date,source,title,link,description
2026-07-06,네이버뉴스,"강진군, 석교천·까치내·사초리 파크골프장 추진",https://www.newspim.com/news/view/20260706000318,"총사업비 5억 원이 투입되며 2027년 2월 착공, 10월 준공을 목표로 한다. 인근 캠핑장과 연계한 복합 여가공간으로 조성된다. 군은 이번 사업을 통해 권역 간 체육 인프라 격차를 완화하고 군민 건강 증진과 지역 관광... "
2026-07-06,네이버뉴스,"李 “메가 프로젝트는 속도전, 토지 협의취득·강제수용 동시에”",https://biz.chosun.com/policy/politics/president_office/2026/07/06/CB4NIA6VFNAE5BZQKUEG73E5YA/?utm_source=naver&utm_medium=original&utm_campaign=biz,"또 “용인 일반 산단의 경우, 그나마 빨리 됐다고 하는데도 부지 확정부터 팹(Fab) 착공까지 6년 걸렸다고... 필수 인프라인 전력·용수 확보와 관련해서도 “다른 절차가 끝날 때까지 기다리지 말고, 당연히 되는 것을 전제로... "
2026-07-06,네이버뉴스,"GS, 동해시 AI 데이터센터 8월 착공…2.4GW 규모 3개동",https://news.mtn.co.kr/news-detail/2026070610055385363,"동해에서 착공될 예정이어서 침체된 지역경제에 초대형 훈풍이 기대된다.6일 시에 따르면 8월 착공을... AI 데이터센터 바로 옆 부지에는 수소특화산업단지가 들어설 예정이어서, 전력·에너지 인프라가 집적되는... "
2026-07-06,네이버뉴스,"동부건설, 춘천 원도심 주상복합 공사 1015억에 수주",https://realty.chosun.com/site/data/html_dir/2026/07/06/2026070601158.html,"총 공사비는 약 1015억원이며, 공사 기간은 착공 후 48개월로 예정됐다. 동부건설은 이 단지가 입지상 춘천 원도심 생활권에 있어 기존 교육·의료·행정·상업시설 등 인프라를 편리하게 이용 가능할 것이라고 예상한다.... "
2026-07-06,네이버뉴스,"[메가프로젝트] 이재명 ""부지 확정해야…오직 속도전""",http://www.4th.kr/news/articleView.html?idxno=2114262,"확정부터 착공까지 6년이 걸렸다고 하는데, 나름 빠르다고 할 수 있겠지만 제 기준으로는 그렇게 빠른 것... 전력과 용수 등 핵심 인프라에 대해서도 선제 확보를 주문했다. 이 대통령은 ""전력·용수 문제도 다른 절차가 다... "
2026-07-06,네이버뉴스,"이철우, 반도체 호남행 겨냥…""기업은 준비된 지역에 간다""",https://www.nocutnews.co.kr/news/6543394?utm_source=naver&utm_medium=article&utm_campaign=20260706103244,"이철우 경상북도지사가 반도체 팹 등 TK 투자 소외론이 불거지자, 기업은 결국 인프라가 준비된 지역에... 문재인 정부 때 전국 7개 국가공단 지정했지만 착공된 게 별로 없다. 윤석열 정부에서는 14개 지역을... "
2026-07-06,네이버뉴스,"반도체 투자 '속도전' 나선 李대통령 ""부지부터 오늘 확정""",https://news.einfomax.co.kr/news/articleView.html?idxno=4423486,"이 대통령은 ""용인 일반산단의 경우에 그나마 빨리 됐다고 하는데도, 부지 확정부터 착공까지 6년이 걸렸다... 이 대통령은 ""이번 프로젝트는 워낙 인프라 구축에 많은 비용이 들어가게 된다""며 ""행정 절차에서 인허가에... "
2026-07-06,네이버뉴스,"인제군, 북면 갈원선 도로개설 착공…원통리 교통 여건 개선",https://www.shinailbo.co.kr/news/articleView.html?idxno=5037727,인제군은 '북면 농어촌도로 208호 갈원선 도로개설공사'를 이달 본격 착공한다고 6일 밝혔다. 갈원선 도로... 핵심 인프라 역할을 할 것으로 기대된다. 군은 공사 과정에서 안전 관리와 현장 점검을 강화해 사업을 차질... 
2026-07-06,네이버뉴스,"마이크론, 일본에 AI 반도체공장 착공… ""日 정부가 3분의 1 지원""",http://www.the-biz.co.kr/news/articleView.html?idxno=723848,미국 마이크론 테크놀로지가 일본 정부와 손잡고 14조원 규모의 신공장 착공에 나섰다. 글로벌... 기존 인프라를 활용한 '속도전'이 가능하다는 점도 주효하게 작용했다. 증설이 진행되는 히로시마 공장은 과거 일본... 
2026-07-06,네이버뉴스,[뉴스퀘어10] 청와대 경고에도 공방 계속...이병태 사퇴론 가열,https://www.ytn.co.kr/_ln/0101_202607061027130491,"용인 일반산단의 경우에 그나마 빨리 됐다고 하는데도 부지 확정부터 팹 착공까지 6년이 걸렸더라고요. 나름... 또 주로 문제되는 인프라 중에 전력, 용수가 있는데 전력, 용수 문제도 다른 절차 다 끝날 때까지 기다릴 게... "
2026-07-06,네이버뉴스,삼성 ‘67조’ 투자에 아산 ‘신도시 개발’ 속도 낸다,https://www.khan.co.kr/article/202607061025001,4㎡ 규모로 이달 착공할 예정이다. 두 사업 모두 실시계획 인가 등 주요 행정절차를 마치고 사업이 진행... 시 관계자는 “국가 반도체 생태계의 중심축으로 도약하는 아산의 비전과 아산현충사IC 등 교통 인프라가... 
2026-07-06,네이버뉴스,"[속보] 李대통령 “반도체 메가 프로젝트, 환경영향평가 원용하거나 기...",https://biz.heraldcorp.com/article/10799050?ref=naver,"부지 문제부터 전력 용수, 인프라 지원에 속도전을 주문했다. 이 대통령은 “특히 행정 절차가 문제인데 이... 팹 착공까지 6년이 걸렸더라. 나름 빠르다고 할 수 있겠지만 제가 보는 기준으로는 그렇게 빠른 것 같지 않다”... "
2026-07-06,네이버뉴스,"마이크론, 日 히로시마에 93억달러 HBM 공장 증설 착공…'삼전닉스' 필사...",https://www.digitaltoday.co.kr/news/articleView.html?idxno=681503,"엔비디아를 비롯한 AI 가속기와 대규모언어모델(LLM) 학습용 서버의 핵심 부품으로 꼽히며, AI 인프라... 마이크론은 공장 착공 직전 AI 스타트업 앤트로픽과도 전략적 협력을 체결했다. 양사는 메모리 아키텍처 공동... "
2026-07-06,네이버뉴스,"동부건설, 1015억원 규모 ‘춘천 효자동 주상복합’ 신축공사 단독 수주",https://www.viva100.com/article/20260706500302,"공사 기간은 착공 후 약 48개월이다. 사업지는 춘천 원도심 생활권에 위치해 교육, 의료, 행정, 상업시설 등 기존 생활 인프라 및 주요 도로망과의 접근성을 갖추고 있다. 원도심 내 신규 주거 공급이 제한적인 상황에서... "
2026-07-06,네이버뉴스,"[현장영상+] 이 대통령 ""메가 프로젝트, 이벤트 아닌 대한민국 국토 균...",https://www.ytn.co.kr/_ln/0101_202607061015372759,"용인 일반산단의 경우에 그나마 빨리 됐다고 하는데도 부지 확정부터 팹 착공까지 6년이 걸렸더라고요. 나름... 또 주로 문제되는 인프라 중에 전력, 용수가 있는데 전력, 용수 문제도 다른 절차 다 끝날 때까지 기다릴 게... "
2026-07-06,네이버뉴스,"李대통령 ""반도체 부지 선정부터 논의…협의취득·강제수용 동시에""",https://biz.sbs.co.kr/article_hub/20000320794?division=NAVER,"확정부터 착공까지 6년이 걸렸다""며 ""나름 빠르다고 할 수는 있겠지만, 제가 보는 기준으로는 그렇게 빠른 것... 李 ""인프라 구축에 대규모 비용…지방정부 역량·의지 중요"" 이 대통령은 또 ""이번 프로젝트는 워낙 인프라... "
2026-07-06,네이버뉴스,"동부건설, 춘천 효자동 주상복합 신축 공사 수주…원도심 랜드마크 조성",https://www.pinpointnews.co.kr/news/articleView.html?idxno=465795,"총 공사금액은 약 1015억원이며, 공사기간은 착공 후 약 48개월이다. 사업지는 춘천 원도심 생활권에 위치해 교육·의료·행정·상업시설 등 기존 생활 인프라를 편리하게 이용할 수 있는 입지를 갖췄다. 춘천 주요... "
2026-07-06,네이버뉴스,에코프로비엠 '기술혁신·투자로 성장'…창사 10주년 새 도약,https://www.nocutnews.co.kr/news/6543361?utm_source=naver&utm_medium=article&utm_campaign=20260706100644,"6일 에코프로비엠에 따르면 사내 홍보 채널인 에코톡톡은 △선제적 인프라 투자 △기술 혁신 △자본시장... 공장을 착공했다. 또, 헝가리, 인도네시아 등에도 생산체제를 구축하고 있다. 김장우 에코프로비엠 대표는... "
2026-07-06,네이버뉴스,"에코프로비엠, 창사 10년 주년 성장사 공개…니켈 투자로 미래 준비",https://news.dealsitetv.com/articles/172861,5일 에코프로비엠에 따르면 사내 홍보 채널인 에코톡톡은 ▲선제적 인프라 투자 ▲기술 혁신 ▲자본시장... 공장을 착공했다. 에코프로그룹은 에코프로비엠의 양극재 공장과 함께 포항 산업단지에 전구체... 
2026-07-06,네이버뉴스,마이크론도 '14조 풀베팅'…더 거세지는 HBM 전쟁,https://news.bizwatch.co.kr/article/industry/2026/07/06/0003,"팹 착공에도 들어갔다. 미국과 일본을 양축으로 첨단 메모리 생산능력을 동시에 확대하는 전략이다.... 전력·용수 인프라 구축, 세제 지원, 인허가 절차 단축 등 후속 지원 방안이 논의될 전망이다. 이 대통령은... "
2026-07-06,네이버뉴스,"용인시, 처인구청 복합청사 건립 본궤도…청년·전통시장 지원도 확대",https://www.g-enews.com/view.php?ud=202607060930234199d6b0ab7f1c_1,"용인특례시가 처인구청 복합청사 건립을 위한 핵심 행정절차를 마무리하면서 대규모 행정 인프라 확충에... 시는 기본 및 실시설계 등을 거쳐 2029년 착공, 2032년 준공을 목표로 사업을 추진하되 공정 관리에 속도를 내... "
2026-07-06,네이버뉴스,"동부건설, 1015억원 규모 춘천 주상복합 공사 수주",https://www.news1.kr/realestate/general/6218556,"총공사비는 약 1015억 원이며, 공사 기간은 착공 후 약 48개월이다. 사업지는 춘천 원도심 생활권 내에 위치해 교육·의료·행정·상업시설 등 기존 인프라를 편리하게 이용할 수 있다. 동부건설은 원도심 내 신규 주거... "
2026-07-06,네이버뉴스,"동부건설, 1015억원 규모 춘천 원도심 주상복합 단독 수주",https://biz.heraldcorp.com/article/10798979?ref=naver,"공사기간은 착공 후 약 48개월이다. 사업지는 춘천 원도심 생활권에 위치해 교육, 의료, 행정, 상업시설 등 기존 생활 인프라를 이용할 수 있는 입지로 평가된다. 춘천 주요 도로망과의 접근성도 갖춰 도심 내 주거... "
2026-07-06,네이버뉴스,지방 분양시장도 '3040 시대'…초품아·교육특화 단지로 수요 쏠림,https://theviewers.co.kr/View.aspx?No=4137810,"생활 인프라를 종합적으로 따지는 '실거주 중심' 소비가 뚜렷해지면서 초등학교를 품은 '초품아' 단지의... 한편 '창원 한신더휴 메가센텀'은 지난 5월 19일 착공식을 마쳤으며, 견본주택은 창원특례시 마산회원구... "
2026-07-06,네이버뉴스,지하철 4·9호선에 GTX-B 호재까지… '남양주 진접 서한이다음' 주목,http://www.ikld.kr/news/articleView.html?idxno=337102,"여기에 송도와 마석을 잇는 GTX-B 노선이 착공에 들어가 2031년 개통 계획이며, 완공되면 서울 주요... 남측으로는 왕숙신도시가, 북측으로는 진접1지구가 인접해 기존 생활 인프라와 신도시 개발 효과를 동시에 누릴 수... "
2026-07-06,네이버뉴스,"[제약·바이오 레이더] 롯데바이오로직스, 신동빈 회장 '현장경영'...대...",http://www.thevaluenews.co.kr/news/view.php?idx=199865,"국내 제약·바이오기업이 생산 인프라 확충과 디지털 헬스케어, 연구 생태계 강화에 잇달아 나서며 미래... 이번 방문은 송도 1공장이 착공 약 2년 만에 사용승인을 획득한 직후 이뤄졌다. 신 회장은 생산시설을 둘러본... "
2026-07-06,네이버뉴스,"동부건설, 춘천 원도심 264가구 주상복합아파트 공사 수주",https://www.yna.co.kr/view/AKR20260706039100003?input=1195m,"공사금액은 약 1천15억원이며 공사기간은 착공 후 약 48개월이다. 동부건설은 단지의 경쟁력을 높이기 위해... 동부건설 관계자는 ""춘천 원도심의 생활 인프라와 도심 주거 수요를 기반으로 안정적인 사업성이 기대되는... "
2026-07-06,네이버뉴스,"동부건설, 1015억 규모 춘천 효자동 주상복합 신축 공사 수주",https://biz.chosun.com/real_estate/real_estate_general/2026/07/06/7QCO7H5LW5GV5DP4PCG3GTCDOY/?utm_source=naver&utm_medium=original&utm_campaign=biz,"총 공사금액은 약 1015억원이며, 공사기간은 착공 후 약 48개월이다. 사업지는 춘천 원도심 생활권 내에 위치해 교육·의료·행정·상업시설 등 기존 생활 인프라를 이용할 수 있는 입지다. 춘천 주요 도로망과의... "
2026-07-06,네이버뉴스,"아산시, 모종샛들·풍기역지구 체비지 매각 본격 추진",http://www.chungnamilbo.co.kr/news/articleView.html?idxno=897219,"정주 인프라 확충도 본격화될 전망이다. 이러한 '삼성 효과'의 직접적인 수혜지로 손꼽히는 아산시가 환지 방식으로 추진 중인 모종샛들지구(57만5728㎡, 2027년 4월 준공 예정)와 풍기역지구(68만227.4㎡, 2026년 7월 착공... "
2026-07-06,네이버뉴스,삼성 19조 투자 발표에 구미시 ‘총력 대응’,https://www.kukinews.com/article/view/kuk202607060021,"로봇 분야는 전담 TF를 구성하고 투자 협의, 인프라 확충, 산학연 협력체 구축에 집중한다. 반도체 분야는... 3GW급 데이터센터 착공 계획을 기반으로 구미를 아시아 AI 중심지로 육성한다. 구미시는 AI 비전위원회와... "
2026-07-06,네이버뉴스,"동부건설, 춘천 효자동 주상복합 단독 수주…264가구 조성",https://www.ziksir.com/news/articleView.html?idxno=139132,"총 공사비는 약 1015억원이며, 공사기간은 착공일로부터 약 48개월이다. 사업지는 춘천 원도심 생활권에 위치해 있다. 주변에는 교육시설과 의료시설, 행정기관, 상업시설 등 기존 생활 인프라가 형성돼 있으며, 춘천 주요... "
2026-07-06,네이버뉴스,"동부건설, 춘천 효자동 주상복합 신축공사 단독 수주",http://www.ftoday.co.kr/news/articleView.html?idxno=361655,공사금액은 1015억원이며 착공부터 준공까지 약 4년이 소요될 전망이다. 해당 부지는 교육·의료·행정·상업시설이 밀집한 춘천 원도심에 자리해 생활 인프라 접근성이 뛰어나다는 평가를 받는다. 특히 신규 주택 공급이... 
2026-07-06,네이버뉴스,"李 대통령 3대 메가 프로젝트 속도전...""오늘 부지선정 논의, 확정지어...",https://www.ntoday.co.kr/news/articleView.html?idxno=128011,"이어 ""용인 산단의 경우 그나마 빨리 됐다는데도 부지 확정에서 착공까지 6년이 걸렸다. 제 기준에는 빠르지... 오늘(6일) 점검회의에서는 권역별 사업 추진을 위한 인프라 구축·세제 지원 방안과 원스톱 행정 절차 마련 등... "
2026-07-06,네이버뉴스,"동부건설, 춘천 원도심에 랜드마크 주상복합 짓는다",http://www.ikld.kr/news/articleView.html?idxno=337091,"총 공사금액은 약 1,015억원이며, 공사기간은 착공 후 약 48개월이다. 사업지는 춘천 원도심 생활권 내에 위치해 교육·의료·행정·상업시설 등 기존 생활 인프라를 편리하게 이용할 수 있는 입지로 평가된다. 춘천 주요... "
2026-07-06,네이버뉴스,"용인특례시 처인구청 복합청사 건립사업, '경기도 투자심사 통과'",https://www.incheonilbo.com/news/articleView.html?idxno=1326606,"/인천일보 DB 용인특례시 처인구 권역의 급증하는 대민 행정 수요에 대응하고 공공 보건 의료 인프라를... 애초 설정된 공식 로드맵은 오는 2029년 현장 공사에 착공해 2032년 6월 최종 준공하는 일정이지만, 시는 행정 절차... "
2026-07-06,네이버뉴스,"동부건설, 춘천 효자동 주상복합 수주…1015억원 규모",https://www.ddaily.co.kr/page/view/2026070609213451518,공사금액은 약 1015억원이며 공사기간은 착공 후 48개월이다. 사업지는 춘천 원도심 생활권에 위치해 교육·의료·행정·상업시설 등 기존 생활 인프라를 이용하기 쉽고 주요 도로망 접근성도 갖췄다. 원도심 내 신규... 
2026-07-06,네이버뉴스,"에코프로비엠, ""자본시장과 성장하며 글로벌 양극소재 회사로 도약""... ...",http://www.biztribune.co.kr/news/articleView.html?idxno=355546,"5일 에코프로비엠에 따르면 사내 홍보 채널 '에코톡톡'은 선제적 인프라 투자·기술 혁신·자본시장 신뢰... 공장을 착공했다. 에코프로그룹은 포항 산업단지에 양극재(에코프로비엠), 전구체(에코프로머티리얼즈)... "
2026-07-06,네이버뉴스,"日 5360억엔 쏟아붓는다…마이크론, 히로시마에 차세대 HBM 기지 건설",https://www.ddaily.co.kr/page/view/2026070609122615492,이번에 착공한 신규 제조동에서는 엔비디아의 인공지능(AI) 프로세서에 필수적인 차세대 고대역폭메모리(HBM)인 HBM4E와 미세 공정 기반의 DRAM 제품군을 단계적으로 양산할 방침이다. 일본 경제산업성은 제조 인프라의... 
2026-07-06,네이버뉴스,"오스트리아의 그린테크 이니셔티브, 친환경 기업의 유럽 진출에 기회",http://dream.kotra.or.kr/kotranews/cms/news/actionKotraBoardDetail.do?SITE_NO=3&MENU_ID=100&CONTENTS_NO=1&bbsGbn=322&bbsSn=322&pNttSn=242365,"교통 인프라 구축 병행을 추진하며, 기후테크 산업을 국가 성장 동력으로 육성하는 데 속도를 내고... 약 1억 7000만 유로가 투입되는 이 대규모 실증 설비는 2025년 9월 린츠 부지에서 착공되어 2027년 말 가동을... "
2026-07-06,네이버뉴스,"용인특례시, 처인구청 복합청사 건립 확정 단계...지역 균형발전 기대감",https://www.pointdaily.co.kr/news/articleView.html?idxno=310727,"이후 2029년 공사에 착공해 2032년 6월 준공을 목표로 사업을 진행할 계획이며, 가능한 범위 내에서 공정을... 행정 인프라 구축의 필요성이 꾸준히 제기돼 왔다고 설명했다. 복합청사가 들어서면 보다 체계적이고 효율적인... "
2026-07-06,네이버뉴스,"류삼영 동작구청장, 수방대책 현장점검…'선조치 후보고' 강조",https://www.jeonmae.co.kr/news/articleView.html?idxno=1271655,"류삼영 구청장은 ""구민의 안전보다 중요한 가치는 없으며, 언제나 안전이 제일이다""며 ""앞으로도 이수~과천 복합터널의 조기착공을 적극 추진하고, AI 스마트 재난방지센터를 구축하는 등 수해대비 인프라 확충에 총력을... "
2026-07-06,네이버뉴스,"파라텍, 224억원 규모 청라 소방공사 수주…회사 사상 최대 프로젝트",https://daily.hankooki.com/news/articleView.html?idxno=1382931,"계약기간은 2026년 7월 3일부터 2029년 11월 20일까지이며, 착공 예정일은 2026년 8월 3일이다. 이번 사업은 인천... 이번 청라 프로젝트에서도 자사 프리미엄 제품군을 적극 활용해 소방 인프라를 구축할 계획이다. 회사는... "
2026-07-06,네이버뉴스,"파라텍, 224억 규모 청라 피크원 푸르지오 소방공사 수주…복합개발 시...",https://view.asiae.co.kr/article/2026070608565170379,"계약 기간은 2026년 7월 3일부터 2029년 11월 20일까지이며, 착공 예정일은 2026년 8월 3일이다. 이번 사업에서... 이번 청라 프로젝트에서도 자사 프리미엄 제품군을 활용해 고품질 소방 인프라를 구축할 계획이다. 또... "
2026-07-06,네이버뉴스,"구미시, 삼성 19조 투자 후속 대응 본격화",https://www.m-i.kr/news/articleView.html?idxno=1388256,제도와 인프라 정비에 나설 계획이다. 시는 그동안 '구미시 로봇산업 육성 및 지원 조례' 제정... 이와 별도로 글로벌 기업의 1.3GW 규모 AI 데이터센터도 착공을 앞두고 있다. 시는 올해 AI 비전위원회 구성과 비전 선포식을... 
2026-07-06,네이버뉴스,[대만 반도체 벨트-上] 북부·중부·남부를 관통하는 실리콘 방패,https://news.einfomax.co.kr/news/articleView.html?idxno=4423431,"북부 사이언스파크 착공 이후 40년 이상 여야 정권 교체와 무관하게 사이언스파크 확장과 지방균형발전... 조성을 승인했고, 글로벌 반도체 사이클과 무관하게 선제적으로 산업 인프라를 준비해왔다는 평가가 나왔다."
2026-07-06,네이버뉴스,"현대제철·동국제강, 건설 한파 속 반도체·데이터센터 수요 주목",http://datanews.co.kr/news/article.html?no=145414,실제 착공으로 이어질 경우 건설용 강재 수요도 함께 확대될 수 있다. 현대제철과 동국제강은 데이터센터 시장 수요에도 선제적으로 대응하고 있다. 현대제철은 올해 3월 차세대 전력 인프라 핵심 산업 판매 확대... 
2026-07-06,네이버뉴스,"파라텍, 224억 규모 청라 복합개발 소방공사 수주",https://www.edaily.co.kr/news/newspath.asp?newsid=02246806645511896,"계약기간은 2026년 7월 3일부터 2029년 11월 20일까지이며, 착공 예정일은 2026년 8월 3일이다. 파라텍은 이번... 이번 청라 프로젝트에서도 자사 소방 제품을 활용해 소방 인프라를 구축할 예정이다. 회사 관계자는 “이번... "
2026-07-06,네이버뉴스,"장승국 비츠로셀 대표 ""美빅테크용 데이터센터 배터리 공급 논의…회사...",https://www.hankyung.com/article/202606231600i,"그동안 '안정적인 캐시카우를 가진 강소기업'으로 평가받던 이 회사가 AI 데이터센터라는 첨단 인프라... 공장을 착공한다""고 귀띔했다. 비츠로셀이 글로벌 경쟁사들을 제치고 독주하는 배경에는 '0.09%'라는 불량률 통제... "
2026-07-06,네이버뉴스,"[인터뷰]이근수 대구 북구청장 ""행정은 주민이 체감해야 완성된다""",https://www.newsis.com/view/NISX20260705_0003696015,"동시에 청년 창업과 골목상권 활성화, 복지 인프라 확충에도 행정력을 집중해 성장과 삶의 질이 함께... 임기 안에는 사업이 안정적으로 착공 단계에 들어갈 수 있도록 행정력을 집중하겠다. 강북권 철도망 연장 역시 북구... "
2026-07-06,네이버뉴스,맞춤형 금융 조건 제시… '포항 펜타시티 대방 엘리움' 눈길,https://www.apnews.kr/news/articleView.html?idxno=3049544,"한국건설기술연구원에 따르면 올해 4월 건설공사비지수는 136.88로 나타나 전년 동월 대비 4.44% 상승했다. 재료비와 노무비, 장비비 등 직접공사비가 늘어나면서 분양가 상승 압력이 확대되고 있다. 이에 따라 계약부터... "
2026-07-06,네이버뉴스,"전문건설공제조합, '중동 리스크' 건설사에 2663억원 특별융자",https://www.newsis.com/view/NISX20260706_0003697656,"최근 건설업계는 원자재 가격 상승과 자재 수급 불안, 공사비 정산 지연, 금리 상승 등 복합적인 경영 악재에 직면해 있다. 이에 조합은 지난 5월 출범한 '중동 전쟁 위기 대응 TF'를 중심으로 종합적인 지원책을... "
2026-07-06,네이버뉴스,[기획] 모듈러 주택 활성화 하자더니…운송 규제 어쩌나,https://www.m-i.kr/news/articleView.html?idxno=1388617,"고스란히 공사비에 반영된다""며 ""운송 규제가 사실상 한계를 정해버리는 셈""이라고 말했다. 이어 ""정부가 LH 등을 통해 모듈러 발주를 늘리며 '건설 혁신'이라고 강조하지만, 정작 운송 단계에서는 여전히 일반 과적 화물과... "
2026-07-06,네이버뉴스,"부산 벡스코 3전시장, HJ중공업 컨소가 짓는다",https://news.bizwatch.co.kr/article/real_estate/2026/07/06/0012,HJ중공업 건설부문은 부산광역시 건설본부가 발주한 '부산 벡스코(BEXCO) 제3전시장 건립사업'의 실시설계적격자로 선정됐다고 6일 밝혔다. 벡스코 제3전시장 건립사업은 부산 해운대구 벡스코 제1전시장 앞 주차장... 
2026-07-06,네이버뉴스,[기획] 대통령까지 '콕' 찝은 모듈러 주택…진척 더딘 이유는?,https://www.m-i.kr/news/articleView.html?idxno=1388566,"완성하는 건설 신기술이다. 기존 건설 공법 대비 2~30%가량 공사 기간을 단축할 수 있는 것이 가장 큰... 그러나 현재 법적 체계가 미비한 데다 발주물량이 부족해 높은 공사비 문제가 해결되지 못하고 있고, 관련된 기술... "
2026-07-06,네이버뉴스,"대한건축학회, 법무법인 태평양과 건설산업 발전 협력",https://www.dnews.co.kr/uhtml/view.jsp?idxno=202607010940235900435,"수 있도록 아낌없는 노력을 다해 지원하겠다”고 화답했다. 향후 양측은 부동산 PF, 건설 공사비 계약 관리, 건설 안전 등 주요 현안을 두고 교류하며,국회 입법 대응 등을 통해 산업 여건 개선 노력에 나설 예정이다. leesu@"
