date,source,title,link,description
2026-06-18,네이버뉴스,현대건설 네덜란드서 원전 심포지엄,https://www.newsclaim.co.kr/news/articleView.html?idxno=3066851,"현대건설,이한우 16, 17일(현지시간) 네덜란드에서 개최된 '네덜란드 서플라이어 심포지엄' 행사에서 현대건설(대표 이한우) NewEnergy사업 부 신달원 상무가 환영사를 하고 있다. 현대건설 제공 현대건설(대표 이한우)이... "
2026-06-18,네이버뉴스,"독보적 기술력의 한신기계, 원전 투자 활성화에 핵심 장비 부각",https://www.pinpointnews.co.kr/news/articleView.html?idxno=461056,"현대건설은 국내외 원전 건설 프로젝트 참여 경험을 보유하고 있어 신규 원전 발주 확대의 수혜가 예상된다. 티플랙스와 일진파워, SNT에너지, 삼미금속은 원전용 소재와 설비, 정비 사업을 통해 원전 산업 생태계에... "
2026-06-18,네이버뉴스,"현대건설, 네덜란드 원전시장 정조준…원전 건설 심포지엄 개최",https://www.bizwork.co.kr/news/articleView.html?idxno=416591,"현대건설이 네덜란드 신규 원전사업 참여를 위해 현지 기업과의 협력 기반을 넓히고 있다. 현대건설은 16, 17일(현지시간) 양일간 웨스팅하우스와 공동으로 네덜란드 암스테르담에서 '네덜란드 서플라이어 심포지엄'을... "
2026-06-18,네이버뉴스,"현대건설, ‘힐스테이트 양산더스카이’ 오는 19일 견본주택 오픈…1·2...",https://biz.heraldcorp.com/article/10774397?ref=naver,힐스테이트 양산더스카이 투시도.[현대건설 제공] 현대건설은 경남 양산시 물금읍 가촌리와 범어리 일원에 공급하는 ‘힐스테이트 양산더스카이’의 견본주택을 오는 19일 개관할 예정이라고 18일 밝혔다.... 
2026-06-18,네이버뉴스,3달 연속 집값 뛰었다... 화성 병점역 일대 교통·주거 인프라 확대,https://www.rcast.co.kr/news/articleView.html?idxno=31067,여기에 경기도 오산시 양산동과 용인시 수지구 성복동을 연결하는 총연장 17.2km 규모의 '오산용인고속도로(계획)' 민간투자사업이 최근 국토교통부와 현대건설 컨소시엄 간 막바지 협상을 진행하며 연내 실시협약 체결... 
2026-06-18,네이버뉴스,"발전설비 명가 비에이치아이, '원전 해체' 신시장 공급 가능성 부각",https://www.pinpointnews.co.kr/news/articleView.html?idxno=461046,현대건설은 대형 원전 건설 사업 경험을 보유하고 있으며 원전 해체 과정에서 필요한 플랜트 엔지니어링 역량이 주목받고 있다. 대창솔루션은 원전 관련 특수강 소재와 부품 사업을 진행하고 있으며 원전 산업 투자 확대의... 
2026-06-18,네이버뉴스,"현대건설, 양산 첫 ‘힐스테이트’ 공급…입지·인프라와 브랜드 경쟁력...",https://www.betanews.net/article/view/beta202606180001,"현대건설은 오는 19일 경남 양산시 물금읍 가촌리, 범어리 일원에 공급하는 ‘힐스테이트 양산더스카이’의 견본주택을 개관하고 본격적으로 분양에 나선다. 현대건설이 양산시에 첫 선보이는 이 아파트는 2개 단지, 총... "
2026-06-18,네이버뉴스,"코스피, 16거래일 만에 9000선 돌파···반도체 쏠림에 신고가 행진",https://www.seoulfn.com/news/articleView.html?idxno=631459,"반면 건설(-4.99%), 운송·창고(-4.35%), 운송장비·부품(-3.72%), 화학(-4.70%), 금속(-5.07%) 등은 하락했다.... 반면 현대차(-2.75%), LG에너지솔루션(-3.85%), 삼성물산(-0.92%), HD현대중공업(-3.25%) 등은 하락했다. 최근... "
2026-06-18,네이버뉴스,"[르포]""아파트야 리조트야?""…'김부장' 아파트, 로열파크씨티Ⅱ 가보니",https://www.mt.co.kr/estate/2026/06/18/2026061816200469771,대우건설이 시공하고 삼성물산 리조트부문이 조경을 맡았다. 지난해 종영한 드라마 '서울 자가에 대기업 다니는 김 부장 이야기' 촬영지로도 유명하다. 극 중 전세가 38억원짜리 반포 신축 아파트로 등장한 곳이... 
2026-06-18,네이버뉴스,"""코스피 새 역사 썼다"" 9063.84 마감…코스닥은 3%대 하락",https://www.mediapen.com/news/view/1105253,"반면 현대차(-2.75%), LG에너지솔루션(-3.85%), 삼성물산(-0.92%), HD현대중공업(-3.25%) 등은 하락했다. 서울... 업종별로는 전기전자(4.63%)와 보험(3.37%), 제조(3.02%) 등 일부 업종이 강세를 보였을 뿐 금속(-5.07%), 건설(-4.99... "
2026-06-18,네이버뉴스,"반도체가 쓴 한국 자본시장 새 역사 삼전닉스 급등…""이례적인 강세장""",http://www.smedaily.co.kr/news/articleView.html?idxno=358928,"반면 현대차(-2.75%), LG에너지솔루션(-3.85%), 삼성물산(-0.92%), HD현대중공업(-3.25%), 두산에너빌리티(-3.49... 07%), 건설업(-4.99%), 화학(-4.70%), 운수창고(-4.35%), 운수장비(-3.72%), 기계(-3.51%), IT서비스(-3.36%), 통신업... "
2026-06-18,네이버뉴스,[르포] 도심에서 즐기는 유럽...383가구 풀리는 '로열파크씨티Ⅱ' 가보니,http://www.fnnews.com/news/202606181524299339,"대우건설이 시공하고, 삼성물산 리조트 부문이 조경을 맡았다. 지난해 종영한 '서울 자가에 대기업 다니는 김 부장 이야기'에 등장해 관심을 받기도 했다. ■ 유럽 정원 옮겨놓은 듯…조경 면적만 37... "
2026-06-18,네이버뉴스,합성목재의 진화 '스마트합성데크'…에버랜드가 반할 이유 있었네,https://www.imwood.co.kr/news/articleView.html?idxno=41231,조경·건설 자재 시장의 패러다임을 바꾸고 있다. 이 제품의 핵심 경쟁력은 수지와 석분류를 혼합한 독자적인... 환경표지인증을 보유한 친환경 보호 제품으로 엄격한 품질과 안전 기준을 요구하는 삼성물산(에버랜드)... 
2026-06-18,네이버뉴스,"우미건설, '평택 고덕 우미린 프레스티지' 분양…분상제 적용",http://www.wowtv.co.kr/NewsCenter/News/Read?articleId=A202606180416&t=NN,"우미건설 컨소시엄이 공급하는 '평택 고덕 우미린 프레스티지'가 분양을 시작했다. 경기도 평택시... 다양한 커뮤니티 시설이 들어서며, 삼성물산이 운영하는 홈 플랫폼 ‘홈닉’을 통해 스마트 라이프도 누릴 수 있다."
2026-06-18,네이버뉴스,"코스피, 사상 첫 9000선 돌파…외국인 순매수에 2.25% 상승 마감",https://www.edaily.co.kr/news/newspath.asp?newsid=05008566645483032,"88%), 삼성물산(028260)(-0.92%) 등도 등락이 엇갈렸다. 반면 현대차(005380)(-2.75%), LG에너지솔루션(373220)... 반면 에너지장비및서비스(-8.80%), 건강관리업체및서비스(-7.06%), 해운사(-6.80%), 건설(-4.82%), 조선(-4.67... "
2026-06-18,네이버뉴스,‘2.3조’ 목동13단지 시공사 찾는다…삼성물산 첫 깃발 꽂나,https://news.mtn.co.kr/news-detail/2026061815343149153,"예정 공사비만 2조3000억원을 웃도는 대형 사업지인 데다, 삼성물산 건설부문이 꾸준히 관심이 보여온 현장인 만큼 입찰 구도에 관심이 집중된다.18일 정비업계에 따르면 목동13단지 사업시행자인 대신자산신탁은... "
2026-06-18,네이버뉴스,"올해 수주 목표만 '13조'…삼성물산, 래미안 앞세워 역대 최대 실적 쓴다",https://daily.hankooki.com/news/articleView.html?idxno=1377820,사진=데일리한국 삼성물산 건설부문(이하 삼성물산)이 올해 서울 강남권 핵심 재건축 사업지에서 수주 행진을 이어가고 있다. 현재의 수주 행보라면 창사 이래 역대 연간 정비사업 최고 수주액 기록을 쓸 수 있다는... 
2026-06-18,네이버뉴스,목동13단지 시공사 선정 돌입…삼성물산 ‘눈독’,https://www.dt.co.kr/article/12068326?ref=naver,현재 입찰에 가장 관심을 보이고 있는 건설사는 삼성물산이다. 삼성물산은 이곳을 지난달 수주한 압구정4구역과 신반포19·25차와 비견되는 사업지로 평가하고 있다. 또 목동9단지 입찰에 관심을 두고 있는 것으로... 
2026-06-18,네이버뉴스,우미건설 '평택 고덕 우미린 프레스티지' 분양 진행,https://www.nocutnews.co.kr/news/6535173?utm_source=naver&utm_medium=article&utm_campaign=20260618025927,"우미건설 컨소시엄이 '평택 고덕 우미린 프레스티지' 분양에 본격 돌입했다. 평택 고덕 우미린... 들어서며, 삼성물산이 운영하는 홈 플랫폼 '홈닉'이 적용된다. 대규모 반도체 생산기지인 삼성전자 평택캠퍼스의 핵심... "
2026-06-18,네이버뉴스,[줌인] 집 안팎 경계 허문 삼성 AI…'커넥티드 케어'와 '모듈러 홈'으로...,http://www.dailypop.kr/news/articleView.html?idxno=99793,"AI 모듈러 홈 역시 가전 시장의 격전지를 개별 소비자에서 건축 및 건설 영역으로 대폭 확장하는 계기다. 이미 유창이앤씨, 삼성물산 등과 협력 체계를 다져온 삼성전자는 향후 4층 이상의 중층 건물, 오피스, 숙박시설로... "
2026-06-18,네이버뉴스,15년 만의 ‘신규 원전’ 건설…원전업계 ‘수혜’,http://www.newstomato.com/ReadNews.aspx?no=1304415&inflow=N,"(사진=뉴시스) 삼성물산 등 원전 플랜트·시공 기업들도 수혜 후보로 꼽힙니다. 신규 원전 건설이 본격화되면 토목, 건축, 전기, 기계설비 등 대규모 플랜트 공사가 뒤따르는 만큼 원전 시공 경험을 보유한 기업들의... "
2026-06-18,네이버뉴스,"코스피, 사상 첫 9000선 돌파…SK하이닉스가 견인",http://www.srtimes.kr/news/articleView.html?idxno=205575,"반면 현대차와 LG에너지솔루션, 삼성물산 등은 약세를 나타냈다. 미래에셋증권은 3,000억원 규모 자사주... 상승 종목 수는 200개를 밑돌았고 금속, 건설, 화학, 운송·창고 등 다수 업종은 하락세를 기록했다. 반면... "
2026-06-18,네이버뉴스,"삼성전자, 단독주택 형 모듈러 건축 시장 진출 본격",http://www.4th.kr/news/articleView.html?idxno=2113360,건설 과정에서 발생하는 폐기물을 줄일 수 있어 친환경 건축 방식으로도 주목받고 있다. 양사는 이달... 또 'IFA 2025'에서는 삼성물산과 협업해 글로벌 기업간거래(B2B) 고객을 겨냥한 모듈러 홈 솔루션을 선보인 바 있다.... 
2026-06-18,네이버뉴스,"코스피, 사상 최고치 근접... 반도체 대형주 강세",https://www.tokenpost.kr/news/market/370642,"반면 현대차는 1.29%, LG에너지솔루션은 2.16%, 삼성물산은 2.45% 내렸다. 지수는 오르고 있지만 실제로는... 코스피에서는 금속이 3.65%, 건설이 2.80%, 아이티서비스가 2.49%, 화학이 2.03%, 운송·창고가 1.90% 하락했다.... "
2026-06-18,네이버뉴스,"'먹을 것 없는 소문난 잔치'?…여의도 시범·목화, 삼성물산 단독 가나",http://www.wikileaks-kr.org/news/articleView.html?idxno=188771,"지난달 26일 개최된 시범아파트와 목화아파트 시공사 선정을 위한 현장설명회에는 삼성물산, 대우건설, GS건설 등 7개사가 참석했다. 이 중 공개적으로 수주 의사를 밝혀 온 삼성물산과 대우건설의 경쟁 입찰 구도가 형성될... "
2026-06-18,네이버뉴스,삼성전자가 만든 '단독주택'...공간제작소와 함께 '삼성 AI 모듈러 홈' 출...,https://www.banronbodo.com/news/articleView.html?idxno=32494,삼성전자는 지난해 'IFA 2025'에서 삼성물산과 협력해 글로벌 B2B 시장을 겨냥한 모듈러 홈 솔루션을 선보인 바 있다. 당시 삼성전자는 모듈러 주택이 기존 수도권 단독주택 대비 건설 비용을 3분의 1 수준까지 절감할 수... 
2026-06-18,네이버뉴스,"성수4지구, 위법 소지 롯데·대우 조건 뺀…시공사 선정 '속도'",https://news.tf.co.kr/read/economy/2333932.htm,"삼성물산은 압구정4구역에 이어 영국의 글로벌 건축설계사 '포스터+파트너스'와 다시 한번 손을 잡았다. 1지구는 지난 4월 GS건설이 따냈다. 정비업계 관계자는 ""건설 경기 침체 여파로 서울 주요 정비사업지에서는 선별... "
2026-06-18,네이버뉴스,"삼성전자, 스마트싱스 기반 'AI 모듈러 홈' 출시··· 모듈러 주택 시장...",https://www.ajunews.com/view/20260618095054838,2025'에서는 삼성물산과 협업해 글로벌 기업간거래(B2B) 대상 모듈러 홈 솔루션을 선보인 바 있다. 국내 모듈러 건축 시장은 오는 2030년 최대 4조4000억 원 규모까지 성장할 것으로 전망된다. 전통적인 건설 방식의... 
2026-06-18,네이버뉴스,'연준 매파 발언'에도 코스피 장초반 사상최고치 … 삼전 보합·SK하닉 ...,https://biz.newdaily.co.kr/site/data/html/2026/06/18/2026061800058.html,"반면 현대차, LG에너지솔루션은 1~2%, 삼성물산은 3% 약세다. 업종별로는 대부분 약세다.... 건설, 해운사, 전기제품 등이 3% 내렸고 철강, 석유와가스, 화학 등이 2% 약세다. 같은 시간 코스닥 지수는 전 거래일 대비 1.... "
2026-06-18,네이버뉴스,"삼성전자, 공간제작소와 '삼성 AI 모듈러 홈' 출시… 스마트 주택 시장...",https://www.cnbizm.com/news/articleView.html?idxno=305888,공사 기간을 단축하고 균일한 품질을 확보할 수 있으며 건설 폐기물 발생을 줄일 수 있는 친환경 건축... 2025에서는 삼성물산과 함께 글로벌 B2B 시장을 겨냥한 모듈러 홈 솔루션을 공개한 바 있다. 양혜순 삼성전자... 
2026-06-18,네이버뉴스,"삼성전자, 'AI 모듈러 홈' 출시…단독주택 시장 공략",https://www.sentv.co.kr/article/view/sentv202606180023,"균일화, 건설 폐기물 감소 등의 장점이 있다. 최근 인력난과 친환경 건축 수요 확대에 따라 국내외... 2025'에서는 삼성물산과 함께 글로벌 B2B용 모듈러 홈 솔루션을 선보인 바 있다. 양혜순 삼성전자 DA사업부 부사장은... "
2026-06-18,네이버뉴스,해외수주 66.8% 급감…중동 대신 아시아가 최대 시장으로,http://www.datanews.co.kr/news/article.html?no=145166,"삼성물산이 말레이시아 데이터센터 프로젝트를 수주했고, GS건설은 싱가포르 철도 공사 증액 계약을 확보했다. 현대엔지니어링도 인도 현대차 연구시험동 신축공사를 수주하는 등 아시아 지역에서 성과를 냈다.... "
2026-06-18,네이버뉴스,[도시정비시장 풍향계] 재건축 시계 빨라지는 목동…10ㆍ13단지도 시공...,https://www.dnews.co.kr/uhtml/view.jsp?idxno=202606181429330120905,"목동6단지 재건축 조합은 이달 27일 시공사 선정총회를 개최해, 우선협상대상자로 지정된 DL이앤씨를 시공사로 선정할 전망이다. 목동6단지는 양천구 목동 911번지 일대에 최고 49층 14개동 2173가구를 건립하는... "
2026-06-18,네이버뉴스,노량진·장위·신길…서울 강북 재개발 분양 대전,https://www.asiatime.co.kr/article/20260618500211,최근 DL이앤씨가 인근 8구역에 공급한 '아크로 리버스카이'는 전용 84㎡ 최고 분양가가 27억원에 육박했다. 6구역 '라클라체 자이드파인'의 동일 평형 역시 약 25억원 수준으로 가격이 책정됐다. 대우건설도 오는 26일... 
2026-06-18,네이버뉴스,"“경쟁률 7배 격차”…정비사업 아파트, 청약·집값 상승 주도",http://www.lawissue.co.kr/view.php?ud=20260618131333463067191f6c6e_12,"DL이앤씨는 서울특별시 동작구 대방동 일원 노량진8구역 재개발사업을 통해 ‘아크로 리버스카이’를 분양 중이다. 단지는 지하 4층~지상 29층, 10개동, 전용면적 36~140㎡ 총 987세대 규모로 이 중 285세대가 일반 분양... "
2026-06-18,네이버뉴스,"정비사업 단지, 비정비보다 청약 경쟁률 7배 높다",http://www.fnnews.com/news/202606180906312725,이밖에도 대우건설이 서울 성북구 장위동 일원 장위10재정비촉진구역 주택재개발 정비사업을 통해 '장위 푸르지오 마크원'을 분양하고 DL이앤씨는 동작구 대방동 일원 노량진8재정비촉진구역 주택재개발... 
2026-06-18,네이버뉴스,[땅박사의 AI임장]조망트리플 역세권은 '반쪽'이지만…드파인 아르티아...,https://www.mediapen.com/news/view/1105063,실제 DL이앤씨가 인근 8구역에 공급한 '아크로 리버스카이'는 전용 84㎡ 최고 분양가가 27억 원에 육박합니다. 6구역 '라클라체 자이드파인'의 동일 평형 역시 약 25억 원 수준으로 가격이 책정됐습니다. 평당 분양가는 7000만... 
2026-06-18,네이버뉴스,"희소가치 높은 한강벨트 새 아파트, ‘아크로 리버스카이’ 20일부터 정...",https://www.dt.co.kr/article/12068031?ref=naver,"DL이앤씨가 서울 동작구 노량진8구역에 선보이는 ‘아크로 리버스카이’가 본격적인 정당계약 일정에 돌입한다. “서울 신축 아파트 값은 오늘이 가장 낮다”는 인식이 확산된 데다, 노량진뉴타운의 미래가치가 기대를... "
2026-06-18,네이버뉴스,"""법원 감액보다 적극적인 면책 판단 필요""...율촌 지체상금 세미나 개최",https://www.etoday.co.kr/news/view/2595087,"정영진 대우건설 국내법무담당 변호사는 ""공공계약은 지체상금 상한이 계약 금액의 30%라는 조항이 있지만 민간의 경우 사실상 협의의 영역""이라며 ""시공사는 계약서 작성 시 지체상금 총액, 상한선을 규정하는 조항을 두는... "
2026-06-18,네이버뉴스,"“지체상금, 페널티 아닌 ‘위험배분 수단’으로 접근해야”",https://www.dnews.co.kr/uhtml/view.jsp?idxno=202606181518488410923,"이어진 종합토론에는 오치현 이스트씨에이 기술고문과 서울주택도시개발공사(SH) 주택매입처장인 이승준 서기관, 이성은 국방시설본부 법무실장, 대우건설 국내법무담당인 정영진 변호사, 장영택 율촌 수석전문위원이... "
2026-06-18,네이버뉴스,"토마토시스템, 제조업 DX 시장 공략…‘엑스빌더6’ 앞세워 사업 확대",https://www.hellot.net/news/article.html?no=113285,"최근 토마토시스템은 대우건설의 건설 현장 관리 플랫폼 ‘바로콘 시스템’ 고도화 사업을 수행했다. 이를 통해 10년 이상 운영된 노후 시스템을 HTML5 기반 최신 웹 환경으로 전환하고, 사용자 편의성과 운영 효율성을... "
2026-06-18,네이버뉴스,"[Tech & Now] 엔젤로보틱스, 범부처 '브레인 투 로봇' 프로젝트 착수 등",https://www.ebn.co.kr/news/articleView.html?idxno=1713081,최근에는 대우건설의 건설 현장 관리 플랫폼 '바로콘 시스템' 고도화 사업을 수행하며 10년 이상 운영된 노후 시스템을 HTML5 기반의 최신 웹 환경으로 전환해 사용성과 운영 효율성을 높였다. 회사 측은 이번 프로젝트... 
2026-06-18,네이버뉴스,[서울데이터랩]마감 직후 인기 검색 종목 20選,https://www.seoul.co.kr/news/economy/securities/2026/06/18/20260618500193?wlog_tag3=naver,"대우건설(047040)도 2만 2950원으로 1850원(-7.46%) 떨어졌다. 플랫폼과 가전 대표주도 부진했다. NAVER(035420)는 23만 5000원으로 8500원(-3.49%) 내렸고, LG전자(066570)는 22만 8500원으로 6000원(-2.56%) 하락... "
2026-06-18,네이버뉴스,"[단독] 하안주공3·4단지 재건축, 포스코이앤씨 단독 입찰로 또 유찰",https://www.asiatime.co.kr/article/20260618500098,"1차 입찰은 포스코이앤씨 단독 입찰로 유찰됐고 지난달 열린 현장설명회에는 포스코이앤씨 외에도 대우건설, IS동서 등이 참석해 시공권에 관심을 보인 바 있다. 하안주공3·4단지 재건축은 광명시 하안동 650번지 일대... "
2026-06-18,네이버뉴스,AI·반도체 산업 성장에 들썩이는 청주… 신축 아파트 관심 높아진다,http://www.ikld.kr/news/articleView.html?idxno=336193,사진제공=대우건설. [국토일보 하종숙 기자] 인공지능(AI) 산업이 빠르게 성장하면서 반도체 생산 거점 도시들의 가치가 재조명되고 있다. 첨단산업 투자와 양질의 일자리가 집중되는 지역은 인구 유입과 경제... 
2026-06-18,네이버뉴스,AI·반도체 산업 성장에 청주 주택시장 관심… 신축 아파트 공급 이어져,https://edu.donga.com/news/articleView.html?idxno=108988,"이 같은 시장 분위기 속에서 대우건설이 시공하는 '청주 푸르지오 씨엘리체'가 분양을 진행 중이다. 단지는 충북 청주시 서원구 미평동 일원 분평·미평지구 도시개발사업을 통해 공급되며, 지하 2층~지상 29층, 10개... "
2026-06-18,네이버뉴스,"신길 대장주 바뀌나, 첫 하이엔드 '써밋 클라비온' 25평 17억대 예상",https://realty.chosun.com/site/data/html_dir/2026/06/18/2026061801968.html,"18일 부동산 업계에 따르면, 대우건설은 다음달 영등포구 신길동 남서울아파트 재건축 사업인 ‘써밋 클라비온’ 일반분양에 나설 예정이다. 단지는 지하 4층~지상 29층, 8개동, 총 812가구 규모로 조성된다. 이 가운데... "
2026-06-18,네이버뉴스,"코스피, 사상 최초 9000 돌파...한달만에 1000p 상승",https://www.wolyo.co.kr/news/articleView.html?idxno=313749,"현대차(-2.91%), SKC(-15%), 네이버(-3.7%), 대우건설(-8.06) 등 반도체 외 다른 종목들은 고전을 면치 못하고 있다. 코스닥 역시 마찬가지다. 같은 시간 코스닥지수는 1003.65포인트를 기록하고 있다. 지난달 15일 1129.... "
2026-06-18,네이버뉴스,"강북 집값, 강남보다 더 올라...전세난에 존재감 키우는 강북",http://www.fnnews.com/news/202606180944161869,"대우건설은 6월 서울시 성북구 장위동 일원에 '장위 푸르지오 마크원'을 분양할 예정이다. 장위10재정비촉진구역 주택재개발 정비사업을 통해 공급되는 이 단지는 지하 5층~지상 35층, 23개 동 총 1931가구 규모의... "
2026-06-18,네이버뉴스,"잠재부실 해소 대우건설, 정비사업 5조원 도전",https://www.newsway.co.kr/news/view?ud=2026061811412929283,대우건설이 지난해 대규모 잠재 부실을 선제적으로 반영하는 빅배스를 단행한 이후 재무구조 개선 효과를 바탕으로 도시정비사업 수주 확대에 속도를 내고 있다. 재무건전성 회복을 기반으로 서울 성수·여의도·목동... 
2026-06-18,네이버뉴스,"""전 직원이 개발자다""…건화 AI-FUNtest 현장 가보니",http://www.engdaily.com/news/articleView.html?idxno=22644,"황규영 건화 대표이사와 한명식 엔지니어링협회 회장이 참석한 가운데 심사는 외부위원으로 백기현 대우건설 팀장, 김해진 오토데스크코리아 상무, 박정준 엔지니어링협회 팀장 3명과 내부위원 김영근 R&D센터장... "
2026-06-18,네이버뉴스,"건설·부동산 업계, 미래 가치 선점 총력...부동산 정비사업 신속 추진...",http://www.dailypop.kr/news/articleView.html?idxno=99787,"■ 대우건설, '써밋 목동 라운지' 개관… 목동 재건축 정조준 및 상반기 역대 최대 실적 달성 대우건설은 서울 양천구 목동에 하이엔드 주거 브랜드 '써밋(SUMMIT)'의 철학과 비전을 담은 고객 경험 공간인 '써밋 목동... "
2026-06-18,네이버뉴스,“강남보다 강북이 더 올라”…서울 전세난에 강북 집값 ‘고공행진’,http://www.lawissue.co.kr/view.php?ud=20260618131011934867191f6c6e_12,"대우건설은 6월 서울시 성북구 장위동 일원에 ‘장위 푸르지오 마크원’을 분양할 예정이다. 장위10재정비촉진구역 주택재개발 정비사업을 통해 공급되는 이 단지는 지하 5층~지상 35층, 23개 동 총 1,931가구 규모의... "
2026-06-18,네이버뉴스,"강북 아파트값, 강남 상승률 첫 추월…'갭 메우기' 본격화",http://www.fntimes.com/html/view.php?ud=202606181253417150048b718333_18,대우건설은 성북구 장위동 장위10구역 재개발사업을 통해 '장위 푸르지오 마크원'을 공급할 계획이다. 단지는 총 1931가구 규모로 조성되며 이 가운데 1032가구가 일반분양 물량이다. 서울지하철 6호선 돌곶이역 인근에... 
2026-06-18,네이버뉴스,"성수4지구, 시공사 선정 걸림돌 제거...대우·롯데 경쟁 성사되나",https://www.m-economynews.com/news/article.html?no=67995,앞서 대우건설은 롯데건설이 제안한 일부 안이 입찰지침서 규정에 위배된다고 주장했다. 성동구청은 직접 검토에 나섰고 위배 소지가 있다는 의견을 내놨다. 이에 조합은 양사가 내건 입찰 제안 중 위법 소지가 있는... 
2026-06-18,네이버뉴스,"토마토시스템, ‘엑스빌더6’ 앞세워 제조업 DX 시장 공략",https://www.edaily.co.kr/news/newspath.asp?newsid=04090166645483032,회사는 최근 대우건설 건설 현장 관리 플랫폼 ‘바로콘 시스템’ 고도화 사업을 수행하며 10년 이상 운영된 노후 시스템을 HTML5 기반 웹 환경으로 전환했다. 이를 계기로 제조업과 건설업계에서 레거시 시스템... 
