date,source,title,link,description
2026-04-23,네이버뉴스,서울 소형 아파트 올해 3.55% 상승…규모별 상승률 1위,https://www.sedaily.com/article/20035987?ref=naver,"현대건설(000720), 압구정3구역 ‘ONE City’ 공개…65층·5175가구 청사진 - 핵심 요약: 현대건설이 압구정3구역 재건축 우선협상대상자로서 기존 현대아파트 3934가구를 최고 65층·5175가구로 탈바꿈하는 ‘ONE City’... "
2026-04-23,네이버뉴스,李 대통령 “호찌민 도시철도에 韓 수출 계약 체결”…23일 비즈니스 포...,https://www.sedaily.com/article/20035974?ref=naver,"한국수력원자력을 비롯해 두산에너빌리티(개발·운영), 현대건설·삼성물산(시공), LS·효성(송배전) 등 주요 기업의 베트남 진출 기회는 물론 한국 금융회사들의 프로젝트파이낸싱 참여까지 기대된다. 이날 체결된 전력... "
2026-04-23,네이버뉴스,"대우건설, 원전으로 성장동력 마련…체코 두코바니 원전 본계약 앞둬",https://www.ceoscoredaily.com/page/view/2026042216425737280,국내 건설사 중 원전 시공주 실적을 보유한 곳은 현대건설과 대우건설뿐이다. 대우건설은 과거 대우그룹 시절부터 축적한 베트남 현지 사업 경험과 베트남 스타레이크 신도시 개발 등을 통해 구축한 발주처 네트워크를... 
2026-04-23,네이버뉴스,울산 고급 프리미엄 ... 주거의 새 기준 제시,https://www.hankookilbo.com/news/article/A2026042213330004649?did=NA,울산 부동산 시장이 회복세를 보이는 가운데 현대건설이 울산 남구 야음동에 공급하는 ‘힐스테이트 선암호수공원’이 선착순 동·호 지정 계약을 진행하고 있다. 이 단지는 지하 6층에서 지상 44층 규모로 들어서며... 
2026-04-23,네이버뉴스,"정주영 “이군이 다 해먹었어?” 횡령범 몰린 MB, 반전 한마디",https://www.joongang.co.kr/article/25422631,「 6회 태국으로 가다 」 1965년 7월 현대건설 입사 후 본사에서 3개월을 일한 나는 경남 진해의 제4 비료공장 건설 현장 경리로 발령받았다. 다들 힘들게 살던 시절이라 경리의 주요 업무 중 하나가 가불(假拂)... 
2026-04-23,네이버뉴스,"양천구청, ‘재건축 사업비만 30兆’ 목동·신월동 시공사 선정 과열 ‘...",https://biz.chosun.com/real_estate/real_estate_general/2026/04/23/FLCGV356WVBG3HTMU3HQCEMGEI/?utm_source=naver&utm_medium=original&utm_campaign=biz,"삼성물산과 현대건설, 대우건설, GS건설, DL이앤씨, 포스코이앤씨, 롯데건설 등 대형 건설사들이 관심을 보이고 있다. 특히 양천구는 지난 14일 관내 신탁 방식 정비사업 시행자를 불러 ‘시공사 선정 관련 간담회’를... "
2026-04-23,네이버뉴스,폐업 늘어나는 건설업…대형 건설사도 구조조정,https://www.kukinews.com/article/view/kuk202604220137,"이어 △GS건설(5483명→4996명, 487명↓) △대우건설(5503명→5146명, 357명↓) △현대건설(7147명→6900명, 247명↓) △삼성물산 건설부문(5933명→5828명, 105명↓) 순으로 나타났다. 주요 건설사들도 구조조정에 나서는... "
2026-04-23,네이버뉴스,패키지 전략에 TF팀까지 꾸린 현대제철···美 뉴코어에 '도전장',https://www.newsway.co.kr/news/view?ud=2026042214532373705,"특히 판재류와 봉형강을 모두 생산할 수 있는 제품 포트폴리오를 앞세워 전력 인프라 전반을 커버하고, 현대건설과 현대엔지니어링 등 계열사와 협업해 설계 초기 단계부터 참여하는 원스톱 제안 전략을 추진한다. 이는... "
2026-04-23,네이버뉴스,"'압여목성' 8만가구 입찰 카운트다운… ""서울 정비사업 '빅매치' 분위기...",https://www.ajunews.com/view/20260421093828523,"다만 앞서 압구정2·3구역은 현대건설이, 압구정 4구역은 삼성물산이 단독 입찰했다. 압구정3구역의 경우 현대건설이 우선협상대상자로 지정됐다. 앞서 현대건설은 지난 10일 압구정3구역 재건축 시공사 선정 입찰에... "
2026-04-23,네이버뉴스,[단독]정주영회장 집무실 ‘계동 15층’에 입성한 정의선[자동차팀의 비...,https://www.donga.com/news/Economy/article/all/20260422/133793568/2,"현대차가 경영난을 겪던 현대건설로부터 계동 사옥을 사들였지만 15층은 비워 뒀었습니다. 정몽구 회장이 계동 사옥 15층으로 돌아온 것은 현대건설을 인수한 후였습니다. 2011년 4월 1일, 현대건설 임직원 조례를 위해... "
2026-04-23,네이버뉴스,[선택 2026 강원] 한금석·김동일·고기영 철원군수 진검승부,https://www.kado.net/news/articleView.html?idxno=2046367,"고 후보는 ""35년간 현대건설 임원과 현대계열사 CEO로 근무한 경험과 노하우로 철원 경제를 살리고 생동감 넘치는 철원을 만들겠다""고 선언했다. 이어 △플라즈마 산업단지 기업유치 활성화 △제대군인 지역 정착 유도... "
2026-04-23,네이버뉴스,‘압여목성’ 재건축 잡아라… 선별 수주 속 ‘알짜’는 경쟁 과열,https://www.kmib.co.kr/article/view.asp?arcid=1776847308&code=11151500&cp=nv,"실제로 지난 20일 현대건설은 강남구 압구정3구역 재건축 사업의 우선협상대상자에 선정됐다. 시공사 선정 1, 2차 입찰에 현대건설만 응찰하면서다. 양천구 목동신시가지6단지 재건축 사업도 지난 21일 열린 2차... "
2026-04-23,네이버뉴스,전쟁에 노봉법·중처법까지…공사장 ‘공기’가 심상찮다,https://www.joongang.co.kr/article/25422500,현대건설 관계자는 “모든 건설사가 자재 확보에 비상이 걸린 상황”이라며 “자재 협력업체에선 전쟁이 장기화하면 단가를 10~40% 올릴 수 있다고 통보해온 상태”라고 말했다. 나프타는 시멘트·철근 같은 주요 원자재는... 
2026-04-22,네이버뉴스,"현대건설 ""우선협상자선정 압구정3구역에 'One City' 청사진""",https://www.webeconomy.co.kr/news/articleView.html?idxno=2150489,현대건설은 정비사업 우선협상대상자로 선정된 압구정3구역에 'OWN THE ONE' 비전과 '단 하나의 대도시(ONE City)' 개념의 청사진을 제시했다고 22일 밝혔다. 현대건설 배포 자료에 따르면 ONE City는 △랜드마크 설계(ONE... 
2026-04-22,네이버뉴스,"현대건설, 압구정3구역 ‘ONE City’ 청사진 공개",https://www.segye.com/newsView/20260422519971?OutUrl=naver,최고 65층·5175가구 재건축 사업 랜드마크 설계·미래 모빌리티 결합 현대건설이 서울 강남구 압구정3구역 정비사업 우선협상대상자로 선정된 가운데 미래 주거 청사진 ‘ONE City’를 공개했다. 글로벌 건축 설계 협업과... 
2026-04-22,네이버뉴스,"李 ""韓·베트남 최적 파트너…원전·인프라·공급망 전방위 협력""",https://www.mk.co.kr/article/12024555,"이와 관련해 우리 정부와 공공 부문에선 국토교통부와 코레일이, 민간에선 현대로템(철도 차량·시스템), 현대건설·대우건설(시공사) 등이 참여하는 민관팀이 북남 고속철 사업 수주 활동을 펼치고 있다. 이번... "
2026-04-22,네이버뉴스,"강원 시장군수 대진표, 7곳 추가 확정",https://news.kbs.co.kr/news/pc/view/view.do?ncd=8543294&ref=A,여기에 무소속 고기영 전 현대건설 상무가 선거전에 뛰어들었습니다. 횡성입니다. 민주당에서는 장신상 전 군수가 군정 탈환을 목표로 하고 있습니다. 국민의힘에서는 임광식 전 횡성군 경제산업국장이 군수 자리에... 
2026-04-22,네이버뉴스,압구정5구역 단지명 공개... '압구정 현대 갤러리아' vs '아크로 압구정...,https://www.meconomynews.com/news/articleView.html?idxno=130450,현대건설 '압구정 현대 갤러리아' 제안 DL이앤씨 '아크로 압구정' 내세워 [시장경제=양병철 기자] 현대건설 '압구정 현대 갤러리아' 티저 영상. 사진=현대건설 유튜브 캡처 압구정5구역의 재건축 단지명이 공개됐다. 22일... 
2026-04-22,네이버뉴스,현대로템 베트남 도시철도 수출 성공…李 “양국 인프라서 최고 수준 협...,https://www.sedaily.com/article/20035936?ref=naver,"한국수력원자력을 비롯해 두산에너빌리티(개발·운영), 현대건설·삼성물산(시공), LS·효성(송배전) 등 주요 기업의 베트남 진출 기회는 물론 한국 금융회사들의 프로젝트파이낸싱 참여까지 기대된다. 이날 체결된 전력... "
2026-04-22,네이버뉴스,"[뉴스공감] 박형준 ""이미 국비 확보한 사직 재건축…포기한다면 지역 갈...",https://news.cpbc.co.kr/article/1172382?division=NAVER,"전재수 후보는 지금 가장 공항 개항이 늦어진 이후로, 현대건설과의 계약 파기를 박형준 시장이 했기 때문에 이거 착공도 못하고 그 공사 공법도 무리하게 주장해서 이렇게 됐다고 얘기를 하시고. 지금 박형준 후보께서는... "
2026-04-22,네이버뉴스,하이엔드 아파트 쏠림 심화…청약 경쟁률 일반의 5배,https://www.ebn.co.kr/news/articleView.html?idxno=1706291,"조사 대상은 한국기업평판연구소 기준 상위 10개 브랜드로, 현대건설 '디에이치', DL이앤씨 '아크로', 롯데건설 '르엘', 대우건설 '푸르지오 써밋' 등이 포함됐다. 이처럼 수요가 쏠리는 배경에는 제한적인 공급에 따른... "
2026-04-22,네이버뉴스,"산업부, 원전, 에너지 베트남 진출기업 간담회",https://www.yna.co.kr/view/PYH20260422196500013?input=1196m,"김정관 산업통상부 장관이 22일(현지시간) 베트남 하노이 JW 메리어트호텔에서 현대건설, 삼성물산 등 기업 관계자들과 '원전, 에너지 베트남 진출기업 간담회'를 하고 있다. 2026.4.22 [산업통상부 제공. 재판매 및... "
2026-04-22,네이버뉴스,"[단독] 삼성물산, 압구정4구역에 사업비 대여금리 '회사채(AA+)+0.1%' 제안",https://www.safetynews.co.kr/news/articleView.html?idxno=247893,"업계 관계자는 ""삼성물산이 현대건설과의 경쟁 사업지인 한남4구역에서 사업비 대여금리로 CD+0.78%라는 구체적인 금리를 제안한 이후, 그동안 정비사업에서 사업비 대여에 대한 구체적인 금리를 제안한 바 없었다""고... "
2026-04-22,네이버뉴스,[고유가 3.0] 중장비 '빅2' 시대…HD건설기계 vs 두산밥캣 '글로벌 톱티...,https://www.financialpost.co.kr/news/articleView.html?idxno=256323,올해 1월 1일 HD현대인프라코어와 HD현대건설기계가 통합해 출범한 'HD건설기계'와 북미의 강자 '두산밥캣'의 '빅 2' 체제는 고유가발 자원 전쟁 속에서 나란히 역대급 실적 랠리를 예고하고 있다. ◇ 통합 HD건설기계... 
2026-04-22,네이버뉴스,"[원자력 연차대회] “AI·SMR로 진화…'원전 르네상스’ 열린다""",https://biz.chosun.com/industry/company/2026/04/22/XZBXZRT6YFBXPMQNKLPUFP5SA4/?utm_source=naver&utm_medium=original&utm_campaign=biz,"홀텍 인터내셔널은 현대건설과 SMR-300 개발에서 협력하고 있다. SMR-300 장점으로는 피동형 안전 시스템, 모듈식 구조, 단순화된 냉각 계통을 꼽았다. 판 이사는 “현대건설과의 전략적 파트너십을 통해 미국 내 인허가... "
2026-04-22,네이버뉴스,[브리프] 삼성물산 현대건설 GS건설 쌍용건설 SK에코플랜트 LH HUG 한국부...,http://www.biztribune.co.kr/news/articleView.html?idxno=352875,"■현대건설, 압구정3구역에 미래 주거의 기준 'One City' 청사진 제시 압구정3구역에 제시한 랜드마크 설계 | 현대건설 현대건설이 압구정3구역 정비사업 우선협상대상자에 선정된 가운데 압구정 현대의 가치를... "
2026-04-22,네이버뉴스,"현대건설, 원전·플랜트 수주 확대 기대…인력 기반 경쟁력 부각 - NH투...",http://www.biztribune.co.kr/news/articleView.html?idxno=352864,출처 = NH투자증권 현대건설이 원전과 플랜트 중심의 해외 수주 확대와 함께 중장기 실적 개선 국면에 진입할 것이라는 분석이 나왔다. 특히 대규모 인력 기반과 원전 시공 경험이 향후 수주 경쟁력의 핵심으로 작용할... 
2026-04-22,네이버뉴스,[원자력 연차대회] 페르미 뉴클리어 메수트 우즈만 대표 “AI로 만드는 ...,https://biz.chosun.com/industry/company/2026/04/22/EZWKPHBF7JGCHMLZ3V7PVZOXUM/?utm_source=naver&utm_medium=original&utm_campaign=biz,"페르미 아메리카는 현대건설, 두산에너빌리티, 삼성물산 등과 대형 원전, 소형 모듈 원자로(SMR) 프로젝트를 협업하고 있다. 그는 “AI를 기반으로 미국과 한국이 실시간으로 대응할 수 있는 구조, 디지털 워크... "
2026-04-22,네이버뉴스,"현대건설, 압구정3구역 ‘ONE City’ 제시…도시형 주거 모델 승부수",https://economist.co.kr/article/view/ecn202604220088,현대건설이 서울 강남권 최대 재건축 사업지인 압구정3구역에서 단지 단위를 넘어 ‘도시형 주거 모델’을 내세운 청사진을 공개했다. 한강변 재건축 시장에서 설계 경쟁이 ‘조망’ 중심에서 ‘라이프스타일... 
2026-04-22,네이버뉴스,[6·3 지방선거 나요나-화성 광역·기초의원] ‘종합경쟁력 전국 1위’ ...,https://www.kyeongin.com/article/1762331,(전 현대건설 주택사업본부) 예비후보가 명단에 포함됐다. 신설된 9선거구에선 국민의힘 정흥범 시의회 부의장이 출사표를 던졌다. 기초의원 선거에서는 더욱 치열한 공방전이 펼쳐질 예정이다. 우선 가선거구... 
2026-04-22,네이버뉴스,"[건설과 AI 산업 ㊤] 현대·대우·DL, 데이터센터·반도체로 불황 극복",https://www.insightkorea.co.kr/news/articleView.html?idxno=245204,"실제로 현대건설, 현대엔지니어링, 대우건설 등 대형 건설사 CEO(최고경영자)들은 건축사업본부 핵심 먹거리로 데이터센터를 지목했다. 정원주 대우건설 회장은 최근 실무진에게 데이터센터 사업 역량 강화를... "
2026-04-22,네이버뉴스,서학개미 10개월 만에 美주식 순매도…반도체 다음 주도주 찾기 나선다,https://www.etoday.co.kr/news/view/2578098,"4월 한 달간 개인투자자 순매수 상위 종목은 LS ELECTRIC(5049억원), HD현대중공업(3385억원), NAVER(3182억원), 하이브(3179억원), 삼성E&A(2395억원), 현대건설(2090억원), 한국전력 (2012억원), 기아(1905억원) 순으로 집계됐다. 반도체... "
2026-04-22,네이버뉴스,"[오늘의 ABC 뉴스룸] ""작아서 빠르다더니 준공 0건?"" 서울 소규모 재건축...",https://www.ajunews.com/view/20260422180057200,"▲ DL이앤씨·현대건설 등 美 차세대 원전 모멘텀도 눈길 DL이앤씨가 앞서 투자한 미국 원전기업 '엑스에너지'의 상장이 본격화되며 막대한 지분 가치 상승이 기대되고, 현대건설 역시 미국 대형 원전 사업의 본계약을... "
2026-04-22,네이버뉴스,"""압구정 3구역을 하나의 대도시로""... 현대건설 'ONE City' 청사진 공개",http://www.fnnews.com/news/202604221814198512,현대건설이 22일 압구정3구역 정비사업에 적용할 미래형 주거 모델 'ONE City(단 하나의 대도시)' 청사진을 공개했다. 압구정 현대의 가치를 계승하면서 초고층·대규모 단지를 기반으로 새로운 주거 기준을 제시하겠다는... 
2026-04-22,네이버뉴스,[리포트] 강원 17개 시·군 대진표 완성.. 누가 뛰나,https://chmbc.co.kr/article/oDRfDUyuVp_fzOCDUntjP7,"철원은 더불어민주당 한금석, 국민의힘 김동일 등두 강원도의장 출신 후보와무소속 고기영 전 현대건설 상무의 대진표가완성됐습니다. 동해는 더불어민주당 이정학 전 동해시의원,국민의힘 김기하 강원도의원,개혁신당... "
2026-04-22,네이버뉴스,'지하철 5개' 온 동네가 역세권…젊은 직장인 몰리더니 '깜짝',https://www.hankyung.com/article/2026042294841,"지난달 5일 현장 설명회에 현대건설과 포스코이앤씨 등 5개 건설사가 참여했다. 충정로역 인근에 지하 6층~지상 25층, 6개 동, 791가구 아파트를 조성하는 재개발 사업이다. 바로 옆 마포로5 10·11지구는 업무 시설과... "
2026-04-22,네이버뉴스,"대형 건설사 '차별화 설계' 앞세워 재건축시장 ""앞으로""",https://www.seoultimes.news/news/article.html?no=2000095262,"삼성물산·현대건설, 한강 조망과 도시 개념 앞세워 경쟁 기준 바꿔 GS건설·현대엔지니어링, 공간·브랜드 확장…주거 경험 설계 강화 KR산업 청약 흥행…가격보다 생활 환경 따지는 수요 뚜렷 [서울타임즈뉴스 = 서연옥... "
2026-04-22,네이버뉴스,DRT셔틀·로보틱스까지…압구정3 '원시티' 청사진,https://www.hankyung.com/article/2026042294831,서울 강남구 압구정3구역(투시도) 재건축 우선협상대상자에 선정된 현대건설이 ‘압구정 현대’의 가치 계승을 내세운 도시 청사진 ‘원 시티(ONE City)’를 22일 공개했다. 현대건설은 원 시티에 랜드마크 설계... 
2026-04-22,네이버뉴스,[건설 브리핑] 중동 리스크에 분양가 고공행진…현대엔지니어링 '힐스테...,http://www.dailypop.kr/news/articleView.html?idxno=98247,사진='용인 플랫폼시티 라온프라이빗 아르디에' 투시도 강남권 재건축은 '고급화' 승부수… 삼성물산·현대건설 청사진 공개 불확실한 시장 상황 속에서도 서울 핵심지 재건축 시장은 독보적인 가치 제안으로... 
2026-04-22,네이버뉴스,"현대건설 압구정3구역 재건축 청사진으로 '원 시티' 제시, 랜드마크 설...",https://www.businesspost.co.kr/BP?command=article_view&num=436306,현대건설이 압구정3구역에 제안한 랜드마크 설계의 모습. 현대건설> 현대건설이 우선협상대상자로 선정된 압구정3구역 정비사업과 관련한 청사진을 공개했다. 현대건설은 22일 압구정3구역에 정비사업... 
2026-04-22,네이버뉴스,10대 건설사 R&D 비용은…SK에코플랜트 늘고 현대엔지니어링·DL이앤씨 ...,https://sports.hankooki.com/news/articleView.html?idxno=6931593,GS건설과 현대건설도 전년보다 투자 규모를 줄였다. GS건설의 지난해 연구개발비는 692억8000만원으로 전년(789억3900만원) 대비 12.24% 감소했다. 매출액 대비 비중은 0.57%에서 0.56%로 조정됐다. 현대건설은 2024년... 
2026-04-22,네이버뉴스,"“조망이 곧 프리미엄”...공원 뷰 아파트, 지역 시세 대장주 등극",https://www.news2day.co.kr/article/20260422500229,조망·쾌적성 중심 재편...뷰 경쟁력이 가치 좌우 운정호수공원 조망권으로 희소성 단지 '부각' 스타필드 빌리지 인접해 편의성까지 확보 ‘힐스테이트 더 운정’ 투시도 [사진=현대건설] [뉴스투데이=김성현 기자] 주택... 
2026-04-22,네이버뉴스,"[건설사 재무점검-⑥] 현대엔지니어링 '무차입 경영' 마침표…""자금조달...",http://www.srtimes.kr/news/articleView.html?idxno=201882,"2001년 현대건설에서 분리된 이후 20년 넘게 유지해 온 '무차입 경영' 기조도 사실상 막을 내리게 됐다. 실제 현금 및 현금성자산은 2024년 말 1조7,331억원에서 2025년 말 1조3,889억원으로 3,442억원 감소했다. 줄어든... "
2026-04-22,네이버뉴스,[민주 부동산] 현대건설·삼성물산·금호건설,http://www.iminju.net/news/articleView.html?idxno=162946,"민주신문=이한호 기자｜압구정3구역 정비사업 우선협상대상자에 선정된 현대건설이 '단 하나의 대도시(ONE City)' 청사진을 공개했다. 압구정3구역은 현대 1~7차, 10·13·14차, 대림빌라트 등 3934가구를 최고 65층... "
2026-04-22,네이버뉴스,"현대건설, 압구정3구역에 'ONE City' 청사진 제시",http://www.koreastocknews.com/news/articleView.html?idxno=118091,"현대건설(000720, 대표 이한우)은 시공사 우선협상대상자로 선정된 서울 강남구 압구정3구역에 'ONE City(원 시티)'라는 청사진을 적용한다고 22일 밝혔다. 압구정3구역은 현대 1~7차, 10·13·14차, 대림빌라트 등... "
2026-04-22,네이버뉴스,"광주시회, 광주시와 함께 대형 건설공사 현장 8개소 합동점검",https://www.koscaj.com/news/articleView.html?idxno=323721,"이번 점검은 현대건설이 시공 중인 '더현대광주 복합쇼핑몰 신축공사'를 포함한 주요 대형공사 현장을 직접 방문해 지역 전문건설업체의 하도급 참여 현황과 운영 실태, 안전관리 이행 여부 등을 종합적으로 살폈다. 특히... "
2026-04-22,네이버뉴스,"현대건설·장수티엔시, 국내 최초 D2600 부단수 양단 차단 성공",http://mcnews.co.kr/86077,상수도 공급 중단 없이 특정 구간 격리하는 기술 매일건설신문=윤경찬 기자 | 서울시 내 핵심 상수도 시설 중 하나인 강북정수장의 증설공사를 수행하고 있는 현대건설과 부단수 전문기업 장수티엔시가 국내 최초로 직경... 
2026-04-22,네이버뉴스,군산·장항항 준설토 처리 '숨통'…제2투기장 24일 착공,http://www.newstomato.com/ReadNews.aspx?no=1298788&inflow=N,"공사는 2개 공구로 나눠 추진하며 각각 현대건설과 동부건설 컨소시엄이 맡습니다. 공두표 해수부 항만국장은 ""군산항 제2준설토 투기장을 차질없이 조성해 군산항과 장항항이 안정적으로 운영될 수 있도록 하겠다""며... "
2026-04-22,네이버뉴스,"[건설업계 소식] GS건설 '자이 굿즈' 조명, 레드닷 디자인 어워드 본상 ...",https://www.sisaweek.com/news/articleView.html?idxno=235087,"◇ 현대건설, 압구정3구역 재건축 우선협상대상자 선정 서울 강남권 핵심 재건축 사업지로 꼽히는 압구정3구역이 시공사 선정 절차에서 첫 관문을 넘었다. 단독 입찰 구조 속에서 특정 건설사가 우선협상대상자로 이름을... "
2026-04-22,네이버뉴스,"中, 원전 총량 1위...운영 강국 미국·프랑스와 격차 좁힌다",https://www.esgeconomy.com/news/articleView.html?idxno=15317,"현대건설은 웨스팅하우스와 AP1000 노선을 중심으로 핀란드·슬로베니아·불가리아 등에서 사업개발을 진행 중이며, 두산에너빌리티는 AP1000 주기기 공급 경험을 바탕으로 미국 원전 공급망 내 역할 확대가... "
2026-04-22,네이버뉴스,중동전쟁 장기화에 공사 현장 ‘비상’…노봉법·중처법까지 건설업계...,https://www.joongang.co.kr/article/25422397,현대건설 관계자는 “모든 건설사가 자재 확보에 비상이 걸린 상황”이라며 “자재 협력업체에선 전쟁이 장기화하면 단가를 10~40% 올릴 수 있다고 통보해온 상태”라고 말했다. 나프타는 시멘트·철근 같은 주요 원자재는... 
2026-04-22,네이버뉴스,"[건설·부동산 레이더] 현대건설, 압구정3구역에 ‘ONE City’ 구상 제시...",http://www.thevaluenews.co.kr/news/view.php?idx=198276,현대건설과 쌍용건설이 각각 대형 정비사업 수주와 신용등급 상향이라는 성과를 내며 사업 경쟁력을 끌어올리고 있다. 현대건설은 서울 압구정3구역 재건축 우선협상대상자로 선정되며 한강변 65층 규모의 미래형... 
2026-04-22,네이버뉴스,송강호⋅윤여정 출연 넷플릭스 '성난 사람들 시즌2' 속 현대건설 시공작...,https://www.newspim.com/news/view/20260422001102,이 중 한국 글로벌 기업의 대형 사옥과 최고급 성형외과 빌딩이 모두 현대건설이 시공한 건물이라는 점이 주목된다. 22일 건설업계에 따르면 성난 사람들(BEEF) 시즌2에서 서울 용산구에 위치한 '아모레퍼시픽 신사옥'과... 
2026-04-22,네이버뉴스,'변협 기업 인권실사 평가' 현대건설 1위…쿠팡·하이브 하위권 [인권경...,https://www.etoday.co.kr/news/view/2578148,이투데이=조소현 기자 | 현대건설·LG전자·네이버 ‘상위권’…쿠팡 최하위 공기업선 한수원 1위·수출입은행 꼴찌 대한변호사협회가 국내 주요 기업 50곳을 대상으로 실시한 기업 인권실사 평가에서 현대건설이... 
2026-04-22,네이버뉴스,"하이엔드 아파트 청약 '28대 1'···희소성에 수요 집중, 일반 단지와 ...",https://www.smartbizn.com/news/articleView.html?idxno=142436,"조사 대상 하이엔드 브랜드는 한국기업평판연구소가 매월 발표하는 상위 10개 브랜드로, 현대건설 '디에이치', 롯데건설 '르엘', DL이앤씨 '아크로', 대우건설 '푸르지오 써밋', 두산건설 '위브더제니스', 포스코이앤씨... "
2026-04-22,네이버뉴스,[코스피 지수선물 옵션] 방산·전력 강세 vs 금융·바이오 약세 선물시장...,https://www.pinpointnews.co.kr/news/articleView.html?idxno=447717,"건설 업종에서는 현대건설, 대우건설이 약세를 보이며 전반적인 투자심리 위축이 이어졌다. 소비재 및 식품 업종에서는 삼양식품이 강세를 보였고, 아모레퍼시픽은 소폭 상승하며 제한적인 회복 흐름을 나타냈다.... "
