date,source,title,link,description
2026-04-14,네이버뉴스,"﻿삼성물산, 히타치 에너지와 사업 협력 확대…유럽 전력망 시장 공략 ...",https://news.bbsi.co.kr/news/articleView.html?idxno=4078391,삼성물산 건설부문(삼성물산)은 13일 스위스 취리히에 위치한 히타치 에너지 본사에서 히타치 에너지와 유럽 지역의 전력망 사업 협력에 대한 업무협약(MOU)을 체결했다고 오늘 밝혔습니다. 행사에는 삼성물산 오세철... 
2026-04-14,네이버뉴스,[건설업계 브리핑] 삼성물산·SP삼화·GS건설·포스코이앤씨 등,https://daily.hankooki.com/news/articleView.html?idxno=1358202,사진= 삼성물산 제공 삼성물산 건설부문(이하 삼성물산)은 지난 13일 스위스 취리히에 위치한 히타치 에너지(Hitachi Energy) 본사에서 히타치 에너지와 유럽 지역의 전력망 사업 협력에 대한 업무협약(MOU)을... 
2026-04-14,네이버뉴스,"[미리보는 이데일리 신문]AI 결제, 외국에 다 뺏기나…멈춰선 원화 스테...",http://www.edaily.co.kr/news/newspath.asp?newsid=05257846645416120,"참여 -삼성물산, 히타치 손잡고 유럽 전력망 공략 -“철도통합 9월 완료… 좌석 늘리고 운임 낮출 것” △Book... 사용자인가… 건설현장 대혼란 △피플 -‘실향민 2세’ 한국계 여성 트럼프 정부 모국 대사로 -“힘든 만큼... "
2026-04-14,네이버뉴스,"삼성물산, 신반포 19차·25차 재건축 입찰서 필수 서류 누락 '논란'",https://www.thepowernews.co.kr/view.php?ud=20260414185939305325c5caa7b2_7,서울 서초구 신반포 19차·25차 재건축 사업의 시공사 선정 과정에서 대형 건설사인 삼성물산이 입찰 제안에 필수적인 서류를 누락한 것으로 드러나 논란이 확산하고 있다. 14일 정비업계에 따르면 지난 10일 마감된 신반포... 
2026-04-14,네이버뉴스,"히타치 업은 삼성물산, 유럽 전력망 공략",http://www.fnnews.com/news/202604141820432628,삼성물산 건설부문이 전력화 분야의 글로벌 기술 선도 기업인 히타치 에너지와의 협력을 확대했다. 이를 통해 유럽 전력망 시장 공략에 나선다는 방침이다. 삼성물산은 지난 13일 스위스 취리히에 위치한 히타치 에너지... 
2026-04-14,네이버뉴스,"삼성물산, 히타치에너지와 협력 확대…유럽 전력망 공략",https://www.segye.com/newsView/20260414520834?OutUrl=naver,"삼성물산 건설부문은 지난 13일 스위스 취리히 히타치 에너지 본사에서 유럽 전력망 사업 협력을 위한 업무협약(MOU)을 체결했다고 14일 밝혔다. 오세철 삼성물산 대표(오른쪽 두 번째), 이병수 삼성물산 해외영업실장... "
2026-04-14,네이버뉴스,"삼성물산, 히타치에너지와 유럽 전력망 공략",https://www.hankyung.com/article/2026041406181,삼성물산 건설부문이 스위스에 본사를 둔 글로벌 전력 기술 기업 히타치에너지와 손잡고 유럽 시장 공략을 본격화한다. 삼성물산은 지난 13일 스위스 취리히에서 히타치에너지와 유럽 지역 전력망 사업 협력을 위한... 
2026-04-14,네이버뉴스,"삼성물산, 히타치에너지 맞손",https://www.mk.co.kr/article/12016657,유럽 전력망 시장 공략 MOU 초고압교류송전 분야 등 협업 삼성물산 건설부문(이하 삼성물산)이 글로벌 전력 기술 선도 기업인 히타치에너지와 손잡고 유럽 전력망 시장 공략에 나선다. 삼성물산은 지난 13일 스위스... 
2026-04-14,네이버뉴스,"[단독] ""소송 확산 전에 먼저 지급"" 삼성물산, TAI 퇴직금 정산 착수",https://www.asiaa.co.kr/news/articleView.html?idxno=246409,"14일 업계에 따르면 삼성물산 건설부문은 지난 13일 인사팀 공지를 통해 ""2026년 1월 29일 대법원 판결에 따라 판결일 이전 3년 이내 퇴직자를 대상으로 TAI를 반영한 퇴직금 차액을 정산할 예정""이라고 안내했다. 적용 대상은... "
2026-04-14,네이버뉴스,[위클리오늘] 포스코이앤씨ㆍ대원ㆍDL이앤씨ㆍ삼성물산ㆍ한화 건설부문,http://www.weeklytoday.com/news/articleView.html?idxno=770975,HVAC 분야 확대 - 스위스 취리히서 MOU 체결하며 전력망 통합 솔루션 구축 합의 - 중동·호주 이어 유럽 인프라 시장 선점 위한 전략적 파트너십 구축 삼성물산 건설부문이 글로벌 전력망 기술 기업인 히타치 에너지(Hitachi... 
2026-04-14,네이버뉴스,"삼성물산, 히타치에너지와 유럽 전력망 시장 공략 위해 손잡아",https://www.businesspost.co.kr/BP?command=article_view&num=435696,"오세철 삼성물산 건설부문 대표이사 사장(오른쪽 두 번째), 안드레아스 쉐렌베크 히타치에너지 CEO(왼쪽 두 번째) 등 관계자들이 13일 스위스 취리히 히타치에너지 본사에서 '유럽 지역의 전력망 사업 협력에 대한... "
2026-04-14,네이버뉴스,"삼성물산-히타치 에너지, 업무협약...유럽 전력망 시장 공략 협력",https://hbnpress.com/news/view/1065597538238097,삼성물산 건설부문(이하 삼성물산)은 지난 13일 스위스 취리히에 위치한 히타치 에너지(Hitachi Energy) 본사에서 히타치 에너지와 유럽 지역의 전력망 사업 협력에 대한 업무협약(MOU)을 체결했다고 밝혔다. 이날... 
2026-04-14,네이버뉴스,"[수소 생태계 확장②] 롯데정밀화학·롯데SK에너루트, 그린암모니아·수...",http://www.wsobi.com/news/articleView.html?idxno=310114,"국내에서는 삼성물산과 롯데정밀화학ㆍ롯데SK에너루트, 현대자동차 등 기업들 수소 경제 활성화에 박차를... 수입된 그린 암모니아는 글로벌 청정 에너지 기술 기업 '엔비전' 사가 중국 내몽고 지역에 건설한 세계... "
2026-04-14,네이버뉴스,[ND 건설] 쌍용건설·삼성물산·한화 건설부문 外,http://www.newsdream.kr/news/articleView.html?idxno=111302,"삼성물산, 히타치 에너지와 유럽 전력망사업 협력 MOU 삼성물산 건설부문이 지난 13일 히타치 에너지와 '유럽 지역 전력망 사업 협력을 위한 업무협약'을 체결했다. 이번 협약으로 양 기관은 기존 HVDC(초고압직류송전)... "
2026-04-14,네이버뉴스,"삼성 손잡고 32명 채용 …""청년인재 갈증 풀었죠""",https://www.mk.co.kr/article/12016541,"삼성물산 협력사인 화성엔지니어링은 삼성물산 건설안전아카데미 안내를 통해 프로그램에 참여했고, 6주간 직무교육을 통해 신규 인력이 회사에 빠르게 적응할 수 있도록 돕고 안정적으로 채용까지 이어갈 수 있었다.... "
2026-04-15,네이버뉴스,고시촌에서 하이엔드 타운으로…노량진뉴타운 ‘아크로’ 첫 분양,https://www.sedaily.com/article/20032393?ref=naver,DL이앤씨(375500)는 다음달 동작구 대방동 일대에 ‘아크로 리버스카이’를 공급할 예정이라고 14일 밝혔다. 이 단지는 지하철 1·9호선 노량진역과 인접한 역세권 입지에 ‘아크로(ACRO)’ 브랜드의 차별화된 상품성을... 
2026-04-15,네이버뉴스,"[단독] ""입찰보증금 420억원 돌려달라""⋯DL이앤씨, 부산 우동1구역과 소...",http://www.inews24.com/view/1960174,"DL이앤씨가 부산 우동1구역 재건축정비사업조합을 상대로 420억원 규모의 입찰보증금 반환 소송을 제기했다. 조합이 지난해 11월 DL이앤씨의 시공사 선정을 취소하자, 과거 납부한 보증금을 돌려달라고 나선 것이다.... "
2026-04-15,네이버뉴스,건설업 장기 침체에 희망퇴직 받는 건설사들,https://news.mtn.co.kr/news-detail/2026041415223118360,"국내 10대 건설사 중 DL이앤씨, 현대엔지니어링, 포스코이앤씨, SK에코플랜트 등 4개사는 지난해 신입사원 공개채용을 아예 진행하지 않았다. 건설업계 '고용한파'는 숫자로도 확인할 수 있다.전자공시시스템에... "
2026-04-15,네이버뉴스,"소송에 내홍, 수사까지…상대원2구역 착공 지연 불가피",https://www.newsis.com/view/NISX20260414_0003591019,"조합 집행부가 기존 시공사인 DL이앤씨와의 계약을 해지했지만, 새로운 시공사 선정이 한 차례 무산된 데다 DL이앤씨에서 '법적 대응'을 시사하면서 사업 지연에 대한 우려가 커지고 있다. 15일 정비업계에 따르면... "
2026-04-15,네이버뉴스,"'시공사 공백' 상대원2구역, 앞길 안갯속",https://www.mt.co.kr/estate/2026/04/15/2026041419132967542,경기 성남시 상대원2구역 주택재개발사업이 DL이앤씨와의 시공사 계약해지 이후 일촉즉발의 혼란상황에 내몰렸다. GS건설로의 시공사 교체가 불발되면서 조합원의 금융부담은 커졌고 조합은 내부갈등 속에 둘로... 
2026-04-15,네이버뉴스,노량진 '자이드파인' 1순위 청약 27 대 1...59㎡ 당첨 안정권은?,https://www.straightnews.co.kr/news/articleView.html?idxno=300195,"앞서 DL이앤씨의 '아크로 드 서초' 59㎡ C형에서 2명의 만점자가 나온 데 따른다. '라클라체 자이드파인'의 전용 59㎡와 84㎡ 평균 분양가는 각각 20억9000만원, 24억6000만원으로 '오티에르 반포'의 같은 형보다 각각... "
2026-04-14,네이버뉴스,[4월15일자] 비즈니스포스트 아침의 주요기사,https://www.businesspost.co.kr/BP?command=article_view&num=435723,"가능성 ● DL이앤씨 '성남 상대원2구역 시공사 해지' 실적에 대형 변수, 박상신 버팀목은 재무체력 ● 미래에셋자산운용 한국투자신탁운용 동시 출격, '스페이스X' 돌풍에 '우주 ETF' 경쟁도 후끈 ● '대체투자 전문가... "
2026-04-14,네이버뉴스,"[EBN 오늘(14일) 이슈 종합] 삼성중공업, 에너지에서 방산으로·4대지주...",https://www.ebn.co.kr/news/articleView.html?idxno=1705438,"◆'상대원2구역 시공권 박탈' DL이앤씨, 법적 반격 나서나...판례 살펴보니 DL이앤씨가 성남 상대원2구역 재개발 사업에서 시공권을 박탈당하면서 법적 반격에 나설지 주목된다. 조합이 총회를 통해 시공 계약 해지를... "
2026-04-14,네이버뉴스,[단독] 상대원2구역 '이주비 자납' 논란의 진실…조합 지도부 '공포 마케...,https://www.safetynews.co.kr/news/articleView.html?idxno=247646,"현재 조합 지도부는 기존 시공사인 DL이앤씨로 인해 금융비용 피해가 발생했다고 주장하고 있으나, 실상은 조합 측의 무리한 시공사 교체 강행과 불투명한 행정 처리가 원인이라는 지적이 제기되며 논란이 커지고 있다.... "
2026-04-14,네이버뉴스,"노량진뉴타운 재개발…DL이앤씨, ‘아크로 리버스카이’ 5월 분양",https://www.dailian.co.kr/news/view/1633560/?sc=Naver,"DL이앤씨는 5월 중 서울 동작구 대방동 노량진8재정비촉진구역 재개발로 ‘아크로 리버스카이’를 분양한다고 14일 밝혔다. 아크로 리버스카이는 지하 4층~지상 29층, 10개 동, 전용면적 36~140㎡ 총 987가구로... "
2026-04-14,네이버뉴스,마감재에 1조 사업 뒤집히나…DL 밀리고 GS 뛰어든 속사정,https://www.sentv.co.kr/article/view/sentv202604140079,"기존 시공사인 DL이앤씨가 특정 마감재 업체 선정을 두고 공사비 상승을 우려해 조합 요구를 거절했는데, GS건설은 새 시공사 입찰에 참여해 그 배경에 관심이 쏠리고 있습니다. 김도하 기자입니다. [기자] 성남... "
2026-04-14,네이버뉴스,"DL이앤씨, X-energy·이란 재건 기대에 137% 급등…PBR 0.7배 '저평가'",http://www.biztribune.co.kr/news/articleView.html?idxno=352390,"신한투자증권은 14일 DL이앤씨에 대해 ""X-energy의 SMR 표준화 설계 계약에 따른 수주 기대감과 함께 이란 재건 모멘텀이 강하게 작용하고 있다""며 ""실제 수혜까지는 시간이 필요하지만, 구조적인 성장 스토리는 유효하다... "
2026-04-14,네이버뉴스,"DL이앤씨, '아크로 리버스카이' 5월 공급 돌입…총 987가구",http://www.paxetv.com/news/articleView.html?idxno=269541,"[사진=DL이앤씨] DL이앤씨가 5월 중 서울 동작구 대방동 일원에 '아크로 리버스카이'를 공급한다고 14일 밝혔다. 노량진8재정비촉진구역 재개발사업을 통해 이 단지는 지하 4층~지상 29층, 10개 동, 전용면적 36~140㎡ 총... "
2026-04-14,네이버뉴스,[르포] '재건축 대어' 목동 7단지 놓고 대형건설사들 눈치싸움 '치열',https://www.insightkorea.co.kr/news/articleView.html?idxno=244612,"조합은 지난 10일 시공사 입찰을 마감한 가운데 DL이앤씨 단독 응찰로 유찰됐다. 이에 13일 재입찰 공고를 내고 2차 현장설명회를 진행한다. 사업비는 1조2000억원 규모다. 목동의 한 중개업소 관계자는 ""대형 건설사들이... "
2026-04-14,네이버뉴스,'비규제 막차' 구리시…규제지역 지정 전 '하이니티 리버파크' 무순위 ...,https://theviewers.co.kr/View.aspx?No=4041530,"이러한 상황 속에서 DL이앤씨, GS건설, SK에코플랜트 컨소시엄이 공급하는 ‘구리역 하이니티 리버파크’의 무순위 청약 소식은 가뭄의 단비가 될 전망이다. 경기 구리시 수택동 일원에 들어서는 이 단지는 이미... "
2026-04-14,네이버뉴스,"'비규제 막차' 타는 구리시, 규제지역 지정 전 '하이니티 리버파크' 무순...",http://www.ikld.kr/news/articleView.html?idxno=332846,"이러한 상황 속에서 DL이앤씨, GS건설, SK에코플랜트 컨소시엄이 공급하는 '구리역 하이니티 리버파크'의 무순위 청약 소식은 가뭄의 단비가 될 전망이다. 경기 구리시 수택동 일원에 들어서는 이 단지는 이미... "
2026-04-14,네이버뉴스,"역세권·초품아 단지···DL이앤씨, '아크로 리버스카이' 공급",http://www.enewstoday.co.kr/news/articleView.html?idxno=2418723,"DL이앤씨가 5월 동작구 대방동 23-61번지 일원 노량진8재정비촉진구역 주택재개발 정비사업을 통해 '아크로 리버스카이'를 공급한다고 14일 밝혔다. 아크로 리버스카이는 지하 4층~지상 29층, 10개 동, 전용면적 36~140㎡ 총... "
2026-04-14,네이버뉴스,[분양소식] 한화 건설부문 '한화포레나 제주에듀시티' 재분양,http://www.4th.kr/news/articleView.html?idxno=2110441,"노량진8구역 '아크로 리버스카이' / 이미지=DL이앤씨 DL이앤씨, 노량진8구역 '아크로 리버스카이' 5월 분양 DL이앤씨는 5월 중 노량진8재정비촉진구역 주택재개발 정비사업을 통해 '아크로 리버스카이'를 분양할... "
2026-04-14,네이버뉴스,"DL이앤씨, '아크로 리버스카이' 5월 분양... 노량진 뉴타운 하이엔드",http://www.newslock.co.kr/news/articleView.html?idxno=128597,DL이앤씨가 서울 동작구 대방동 노량진8재정비촉진구역에서 하이엔드 주거 브랜드 '아크로 리버스카이'를 오는 5월 선보이며 노량진 뉴타운의 새로운 랜드마크를 예고한다. DL이앤씨는 노량진8재정비촉진구역 주택재개발... 
2026-04-14,네이버뉴스,"노량진 '아크로리버스카이'…DL이앤씨, 987가구 공급",https://www.hankyung.com/article/2026041404551,"DL이앤씨는 다음달 동작구 대방동 23의 61 일대에서 아크로 리버스카이를 분양한다고 14일 발표했다. 이 단지는 지하 4층~지상 29층, 10개 동, 987가구(전용면적 36~140㎡)로 이뤄진다. 이 중 일반분양은 285가구다.... "
2026-04-14,네이버뉴스,“서울 청약 판 바뀌었다”…국민평형 밀리고 소형 쏠림 심화,http://www.lawissue.co.kr/view.php?ud=20260414165622823667191f6c6e_12,"DL이앤씨는 4월 동작구 대방동 일원 노량진8재정비촉진구역 주택재개발 정비사업을 통해 ‘아크로 리버스카이’를 분양할 예정이다. 이 단지는 지하 4층~지상 29층, 10개동, 전용면적 36~140㎡ 총 987세대 규모로 이중... "
2026-04-14,네이버뉴스,"DL이앤씨, '아크로 리버스카이' 5월 분양...﻿""한강라인의 물결을 잇는 ...",https://news.bbsi.co.kr/news/articleView.html?idxno=4078334,"DL이앤씨는 5월 중에 서울 동작구 대방동 23-61번지 일원 노량진8재정비촉진구역 주택재개발 정비사업을 통해 '아크로 리버스카이'를 분양할 예정이라고 오늘 밝혔습니다. 아크로 리버스카이는 지하 4층~지상 29층, 10개 동... "
2026-04-14,네이버뉴스,내달 서울 동작구 아크로리버스카이·써밋더힐 일반분양,https://www.yna.co.kr/view/AKR20260414132800003?input=1195m,"각각 285가구·432가구…노량진8·흑석11 재개발 단지 DL이앤씨는 다음 달 서울 동작구 대방동 '아크로 리버 스카이'(노량진8구역 재개발)를 분양할 예정이라고 14일 밝혔다. 단지는 지하 4층∼지상 29층, 10개 동... "
2026-04-14,네이버뉴스,"결국 시공사 바뀌나…상대원2구역, 5월 1일 총회소집",https://www.sedaily.com/article/20032378?ref=naver,"성남 상대원2구역 재개발조합이 기존 시공사인 DL이앤씨와의 시공 계약을 해지했다. 조합은 대신 다음달 1일 GS건설을 새 시공사로 선정하는 안건을 추진한다. 14일 조합의 공문에 따르면, 상대원2구역... "
2026-04-14,네이버뉴스,"DL이앤씨, 노량진 '아크로 리버스카이' 5월 분양…""역세권∙뉴타운 수요...",http://www.kdfnews.com/news/articleView.html?idxno=181895,DL이앤씨가 서울 동작구 노량진뉴타운에 신규 아파트를 공급하며 수요 공략에 나선다. DL이앤씨는 노량진8구역 재개발 사업을 통해 '아크로 리버스카이'를 오는 5월 분양할 예정이라고 14일 밝혔다. 총 987가구 규모로 이... 
2026-04-14,네이버뉴스,"[분양 리포트] DL이앤씨, 노량진뉴타운 '핵심 입지' 출격…아크로 리버...",https://www.fetv.co.kr/news/articleView.html?idxno=300265,DL이앤씨가 서울 동작구 노량진뉴타운 핵심 입지에 '아크로' 브랜드 단지를 공급한다. 교통 접근성과 정비사업 기대감이 맞물린 지역으로 분양 성적에 시장의 관심이 쏠린다. DL이앤씨는 5월 중 동작구 대방동... 
2026-04-15,네이버뉴스,"대기업 오너일가 평균 보수 27억원, 직원의 26.9배…박정원·조현준·정...",https://www.businessplus.kr/news/articleView.html?idxno=110632,이어 격차가 작은 기업으로는 △유니드(이우일) 5.1배 △대우건설(김보현) 6.0배 △세아홀딩스(이태성) 6.3배 △세아베스틸지주(이태성) 6.4배 △DB하이텍(김주원) 6.5배 △코오롱모빌리티그룹(이규호) 6.7배... 
2026-04-15,네이버뉴스,[증시키워드] SK하이닉스 ‘110만닉스’ 회복…증권주 강세 속 광통신주...,https://www.etoday.co.kr/news/view/2575792,"15일 금융투자업계에 따르면 장 시작 전 네이버페이증권 검색 상위 종목은 삼성전자, SK하이닉스, 대한광통신, 현대차, 대우건설, 두산에너빌리티, 미래에셋증권, 에코프로, 삼성SDI, 우리로 등이다. 전날 SK하이닉스는... "
2026-04-15,네이버뉴스,대기업 오너일가 평균 보수 27억원… 직원과 27배 격차,https://www.viva100.com/article/20260415500061,"BGF에코머티리얼즈 또한 홍정혁 대표의 보수가 49.0% 늘어난 반면 직원 보수는 16.9% 감소했고, LX세미콘, 대우건설, 원익홀딩스, HDC, GS 등도 오너 보수와 직원 보수가 상반된 흐름을 보였다. 이와 대조적으로... "
2026-04-15,네이버뉴스,지난해 대기업 오너일가 평균 보수는 27억원…전년보다 6.9%↑,http://www.segyebiz.com/newsView/20260415505395?OutUrl=naver,이어 ▲유니드(이우일) 5.1배 ▲대우건설(김보현) 6.0배 ▲세아홀딩스(이태성) 6.3배 ▲세아베스틸지주(이태성) 6.4배 ▲DB하이텍(김주원) 6.5배 ▲코오롱모빌리티그룹(이규호) 6.7배 ▲세아제강(이주성) 6.7배... 
2026-04-15,네이버뉴스,'직원 100배' 보수 받는 대기업 총수…오너 일가 평균 27억,https://www.jnilbo.com/news/articleView.html?idxno=90000030529,이어 ▲ 유니드(이우일) 5.1배 ▲ 대우건설(김보현) 6.0배 ▲ 세아홀딩스(이태성) 6.3배 ▲ 세아베스틸지주(이태성) 6.4배 ▲ DB하이텍(김주원) 6.5배 ▲ 코오롱모빌리티그룹(이규호) 6.7배 ▲ 세아제강(이주성) 6.... 
2026-04-15,네이버뉴스,대기업 오너 평균 보수 27억원…두산·효성·이마트는 직원의 100배,https://www.kado.net/news/articleView.html?idxno=2044754,"이어 유니드 5.1배, 대우건설 6.0배, 세아홀딩스 6.3배, 세아베스틸지주 6.4배, DB하이텍 6.5배, 코오롱모빌리티그룹 6.7배, 세아제강 6.7배, 셀트리온제약 7.3배 등이 뒤를 이었다. 오너 보수가 증가한 반면 직원... "
2026-04-15,네이버뉴스,대기업 오너 평균 보수 27억원… 직원 158배 받은 총수는,https://www.chosun.com/economy/economy_general/2026/04/15/7PTQPA553ZGCRD2DVCSJ4K7LSM/?utm_source=naver&utm_medium=referral&utm_campaign=naver-news,이어 ▲유니드(이우일) 5.1배 ▲대우건설(김보현) 6.0배 ▲세아홀딩스(이태성) 6.3배 ▲세아베스틸지주(이태성) 6.4배 ▲DB하이텍(김주원) 6.5배 ▲코오롱모빌리티그룹(이규호) 6.7배 ▲세아제강(이주성) 6.7배... 
2026-04-15,네이버뉴스,대기업 오너일가 평균 보수 27억원…직원 1인당은 1억120만원,https://www.slist.kr/news/articleView.html?idxno=731802,이어 ▲ 유니드(이우일) 5.1배 ▲ 대우건설(김보현) 6.0배 ▲ 세아홀딩스(이태성) 6.3배 ▲ 세아베스틸지주(이태성) 6.4배 ▲ DB하이텍(김주원) 6.5배 ▲ 코오롱모빌리티그룹(이규호) 6.7배 ▲ 세아제강(이주성) 6.7배... 
2026-04-15,네이버뉴스,"대기업 오너일가, 평균 보수 27억원…박정원·조현준·정용진, 직원의 1...",https://www.ceoscoredaily.com/page/view/2026041316080323310,이어 오너 보수와 직원간 보수 격차가 작은 곳은 △유니드(이우일) 5.1배 △대우건설(김보현) 6.0배 △세아홀딩스(이태성) 6.3배 △세아베스틸지주(이태성) 6.4배 △DB하이텍(김주원) 6.5배 △코오롱모빌리티그룹... 
2026-04-15,네이버뉴스,대기업 오너일가 평균 27억 받는다…직원 100배 이상 받은 총수도 3명,https://news.tvchosun.com/site/data/html_dir/2026/04/15/2026041590004.html,"이어 유니드(이우일) 5.1배, 대우건설(김보현) 6.0배, 세아홀딩스(이태성) 6.3배, 세아베스틸지주(이태성) 6.4배, DB하이텍(김주원) 6.5배, 코오롱모빌리티그룹(이규호) 6.7배, 세아제강(이주성) 6.7배 등 순으로... "
2026-04-15,네이버뉴스,강남 밀고 외곽 ‘키 맞추기’… 서울 아파트 중위가격 2억 오른 12억,https://biz.chosun.com/real_estate/real_estate_general/2026/04/15/PF6UXBZWJVH7XBZSRWWGD42O7I/?utm_source=naver&utm_medium=original&utm_campaign=biz,조영광 대우건설 빅데이터랩 연구원은 “최근 성북·노원 등 외곽 랜드마크 상승 폭(7~8%)이 강남권(1~2%)을 압도하고 있다”며 “공급이 부족할 것이라는 학습 효과와 대출 규제 강화 전 ‘내 집 마련’에... 
2026-04-15,네이버뉴스,대기업 오너일가 평균 보수 27억원…직원 100배 이상 받은 총수 3명,https://www.yna.co.kr/view/AKR20260414151900003?input=1195m,이어 ▲ 유니드(이우일) 5.1배 ▲ 대우건설(김보현) 6.0배 ▲ 세아홀딩스(이태성) 6.3배 ▲ 세아베스틸지주(이태성) 6.4배 ▲ DB하이텍(김주원) 6.5배 ▲ 코오롱모빌리티그룹(이규호) 6.7배 ▲ 세아제강(이주성) 6.... 
2026-04-14,네이버뉴스,분양시장 '리버·오션·레이크' 조망 단지 강세 지속,https://www.hankyung.com/article/202604140664i,"대우건설이 충남 천안시 서북구 업성동 일원에서 ‘업성 푸르지오 레이크시티’를 분양 중이다. 단지는 지하 2층~지상 최고 39층, 11개동, 총 1908가구의 대단지로 조성되며 이번 분양에서는 1블록 전용면적 72~95... "
2026-04-14,네이버뉴스,"""한강 보이니 공시가 7억 높아""...희소성 높은 '물세권' 단지",http://www.fnnews.com/news/202604141705277696,"대우건설은 충남 천안시 서북구 업성동 일원에서 '업성 푸르지오 레이크시티'를 분양 중이다. 단지는 지하 2층~지상 최고 39층, 11개동, 총 1908가구의 대단지로 조성되며 이번 분양에서는 1블록 전용면적 72~95㎡ 1... "
2026-04-14,네이버뉴스,"대우건설, 데이터센터·원전·북미 주택시장서 신규 먹거리 발굴",http://www.wsobi.com/news/articleView.html?idxno=310119,"대우건설이 데이터센터ㆍ원전ㆍ북미 주택시장서 신규 먹거리 발굴에 나서고 있다. 14일 건설업계에 따르면 대우건설은 최근 데이터센터 전담조직을 신설해 개발부터 건설, 운영등을 담당하는 '디벨로퍼'로 도약하고... "
