date,source,title,link,description
2026-04-06,네이버뉴스,"우체국, 우편업무 넘어 '국민 생활 플랫폼' 도약",https://www.insnews.co.kr/news/articleView.html?idxno=89960,"전국적인 오프라인 인프라를 활용해 시중은행 점포 축소로 발생한 금융 사각지대를 해소하고, 도심의 낡은... 총 462가구 규모로 2026~2027년 착공해 2029년 말 입주를 목표로 한다. 청년 특화주택은 역세권 등 우수 입지에... "
2026-04-05,네이버뉴스,너도나도 수조원짜리 초대형 공연장…‘수익성’ 계산 안중에 없는 지자...,https://www.mk.co.kr/article/12008547,"정부가 ‘K팝 공연 인프라 확충’을 위해 5만석 규모의 스포츠·공연 복합 돔구장 조성을 추진하면서 지자체 간 유치 경쟁도 점차 치열해질 전망이다. 문화체육관광부는 2030년 착공, 2034년 준공을 목표로 후보지 공모를... "
2026-04-05,네이버뉴스,"구미시, 체류형 관광도시로 거듭난다",https://www.idaegu.co.kr/news/articleView.html?idxno=543979,"우선 숙박 인프라 확충에 속도를 내고 있다. 제1국가산업단지에는 지하 1층~지상 15층, 211객실 규모의 4성급 글로벌 브랜드 호텔이 오는 5~6월 착공을 앞두고 있으며 공단 일대 추가 호텔 건립도 계획돼 있다. 기존... "
2026-04-05,네이버뉴스,"구미시, 머물고픈 도시로… 평균 숙박 일수 3일",http://www.hidomin.com/news/articleView.html?idxno=615455,구미시 제공 1호집 각산집 내부.구미시 제공 구미시가 체류형 관광 도시로의 전환을 위해 숙박 인프라... 5~6월 착공에 들어갈 예정이며 공단 지역 내 신규 호텔 건립도 예정돼 있다. 또 지난해까지 7억여 원을 들여 52개... 
2026-04-05,네이버뉴스,먹거리통합지원센터·농산물종합가공지원센터 착공,https://sjbnews.com/news/news.php?number=875563,"공동 착공식을 가졌다. ‘미래 농업 클러스터 조성’사업의 본격적인 출발을 알리며, 지역 농산물의 유통... 핵심 인프라가 될 것”이라며 “차질 없이 완공되어 농업 현장의 든든한 지원군으로 자리매김하도록 행정... "
2026-04-05,네이버뉴스,"'일만 하던 도시의 반전' … 구미시, 데이터로 입증한 '머무는 관광'으...",https://www.ajunews.com/view/20260405192515414,호텔 신설·노후 숙박 개선 병행 관광 인프라 확충 속도 아주경제=여종구 기자 yjkhero@ajunews.com 경북 구미시... 5~6월 착공에 들어갈 예정이며 공단 지역 내 신규 호텔 건립도 예정돼 있다. 또 지난해까지 7억원을 들여... 
2026-04-05,네이버뉴스,해남 솔라시도 ‘국가AI컴퓨팅센터’ 건립 본격화,http://www.jndn.com/article.php?aid=1775384729430254001,"해남군은 친환경 에너지 기반을 안정적으로 뒷받침하기 위한 전력 인프라도 선제적으로 구축하고 있다. 솔라시도 내 전력망 확충을 위한 154kV 변전소가 오는 7월 착공, 국가AI컴퓨팅센터가 가동되는 2028년 4월 준공을... "
2026-04-05,네이버뉴스,부산 기초단체 '3구 3色' 해양수산부 신청사 유치전 후끈,http://www.fnnews.com/news/202604051902104560,"■동구 ""북항 부지 준비된 인프라"" 이에 기존 임시청사를 유치한 부산 동구와 부산항 북항 하부를 끼고 있는... 해당 부지는 매립과 핵심 기반시설이 조성돼 있어, 즉시 착공이 가능한 상태로 전해졌다. 또 이미 조성된... "
2026-04-05,네이버뉴스,"2030년 서·남해 재생에너지, 전력망 타고 수도권 간다 [에너지고속도로...",http://www.fnnews.com/news/202604051853551165,"입지 선정 절차 단축, 환경영향평가 협의간주제 도입, 부대공사 인허가 의제 처리 등 착공 전 단계의... 정부가 국산화 개발에 착수한 것은 에너지고속도로를 단순 인프라 공사가 아닌 산업 정책과 연동된 국가... "
2026-04-05,네이버뉴스,변방 탈출 꿈꾸는 베트남 반도체… 4년내 '5만 인재' 키운다,http://www.fnnews.com/news/202604051844102655,핵심은 국가 차원의 연구 인프라다. 하노이국립대학교는 현재 1000㎡ 규모 클린룸을 포함한 국가 반도체... ■베트남 최초 반도체 칩 공장 착공…글로벌 빅테크도 베트남行 베트남은 반도체를 국가 전략 산업으로... 
2026-04-05,네이버뉴스,새 성장축 절실한 충청… 도로·철도·하늘길 '분수령' 앞뒀다,https://www.daejonilbo.com/news/articleView.html?idxno=2267188,지방선거 국면에서 충청의 교통 인프라가 지역 미래를 가를 핵심 의제로 다시 떠오르는 이유다. 충청권에선... 대구와 광주는 외곽순환고속도로를 갖추고 있고 울산도 2017년 국가계획 반영 이후 연내 착공을 앞두고... 
2026-04-05,네이버뉴스,AI 3강 노리는 한국… 데이터센터 특별법부터 막혀,http://www.fnnews.com/news/202604051817399924,"AI인프라 확산에 총력을 기울이고 있다. 지난해 이미 아마존웹서비스(AWS)와 손잡고 울산 AI데이터센터 착공에 나선데 이어, 오픈AI와 손잡고 서남권에 초대형 AI데이터센터를 구축한다는 구상이다. 또 정부의 '국가대표... "
2026-04-05,네이버뉴스,남원시 행안부 특교세 확보 사활,http://www.jjn.co.kr/news/articleView.html?idxno=1037167,"이번에 건의한 사업은 현안수요 6건 40억 원, 재난안전수요 4건 24억 원으로, 문화 인프라 확충과 농촌... 한편 이성호 남원시 부시장은 ""건의 사업 대부분이 공사 중이거나 착공을 앞둔 사업으로, 적기에 재원이 확보돼야... "
2026-04-05,네이버뉴스,전주시 농산물 고소득 핵심 인프라 첫 삽,http://www.jjn.co.kr/news/articleView.html?idxno=1037185,"공동 착공식을 가졌다. 이중 '전주시 먹거리통합지원센터'는 도도동 491-4번지 일원에 오는 2027년까지 국비... 먹거리를 제공하고, 농업인에게는 새로운 소득 창출 기반을 제공하는 핵심 인프라가 될 것""이라고 말했다."
2026-04-05,네이버뉴스,너도나도 공연장 추진 … 수익성 악화 우려,https://www.mk.co.kr/article/12008412,"정부가 'K팝 공연 인프라 확충'을 위해 5만석 규모의 스포츠·공연 복합 돔구장 조성을 추진하면서 지자체 간 유치 경쟁도 점차 치열해질 전망이다. 문화체육관광부는 2030년 착공, 2034년 준공을 목표로 후보지 공모를 계획... "
2026-04-05,네이버뉴스,"구미시, 외지인 평균 숙박 2.99일…체류형 관광도시 전환 속도",https://www.jeonmae.co.kr/news/articleView.html?idxno=1245296,"숙박 인프라 확충에 나섰다. 제1국가산업단지에는 지하 1층~지상 15층, 211객실 규모의 4성급 글로벌 브랜드 호텔이 들어설 예정으로, 오는 5~6월 착공이 계획돼 있다. 공단 지역 내 추가 호텔 건립도 추진되고 있다. 기존... "
2026-04-05,네이버뉴스,부산 기장군 '대변~죽성교차로간 도로개설사업 7차 구간' 막바지 순항,https://www.tournews21.com/news/articleView.html?idxno=133202,"관광 인프라 구축, 기존 도로의 협소한 폭원으로 인한 주민 불편 해소를 위해 단계적으로 추진되고 있다. 이번에 개통할 7차 구간은 전체 노선 중 약 1.05㎞로 2023년 6월 착공해 현재 마무리 단계에 접어들고 있다. 해안... "
2026-04-05,네이버뉴스,[월요논단] CTX(충청권 광역급행철도) 출발역을 서대전역으로,https://www.joongdo.co.kr/web/view.php?key=20260405010001203,"충청권광역급행철도(CTX)는 상대적으로 철도 교통망이 부족한 충청권에 전환점을 마련할 핵심 인프라이다.... CTX 사업이 민자적격성조사를 통과하면서 기본적인 타당성은 인정받았지만, 실제 착공과 안정적 사업 추진을... "
2026-04-05,네이버뉴스,"충북 괴산군, 문광 농기계임대사업소 착공… 영농 지원 인프라 확충",https://www.ccdn.co.kr/news/articleView.html?idxno=1071477,"군은 지난 3일 문광면 송평리 일원에서 '문광 농기계임대사업소' 착공식을 개최했다고 밝혔다. 사업소는 총사업비 20억 원을 투입해 4천235㎡ 부지에 지상 1층 2동, 690㎡ 규모로 조성되며 올해 상반기 준공을 목표로... "
2026-04-05,네이버뉴스,음성화훼유통센터 누적 경매액 2천억 돌파,https://www.ccdn.co.kr/news/articleView.html?idxno=1071559,국내 제1호 거점 산지 유통센터라는 상징성에 걸맞게 온라인 수·발주 시스템을 도입하는 등 유통 인프라를... 공사를 착공한다. 올해 말 준공 예정인 이 시설은 전시·판매·체험을 아우르는 복합 공간으로 조성되어 지역... 
2026-04-05,네이버뉴스,"해남군, 미래농업 대전환… 농업 AX 플랫폼 구축",https://www.jnilbo.com/news/articleView.html?idxno=90000029101,"하반기 착공이 예정돼 있다. 센터가 들어서면 기후 변화에 따른 작물 재배 환경 변화 대응과 품종 개발, 재배... 핵심 축인 농업연구단지는 총 82㏊ 규모로 조성되는 국내 최대 수준의 농업 연구 인프라다. 기후변화 대응... "
2026-04-06,네이버뉴스,"서초는 7800만원 vs 노량진 8500만원…아파트 분양가 역전, 무슨일?",https://www.mk.co.kr/article/12008592,3㎡당 분양가 8천만원 흑석써밋더힐 59㎡ 21억 후반대 규제 피해 급등한 공사비 반영 분상제 강남은 3.3㎡당... 이어 “건설사는 분양가를 낮췄는데 수분양자는 자금 부담이 커지고 이득은 국가가 챙기는 구조”라며... 
2026-04-06,네이버뉴스,"[마켓+]2분기 분양시장 ""공급 쏟아진다""…서울 '로또 청약' vs 지방 '양극...",https://www.businessplus.kr/news/articleView.html?idxno=110087,다만 치솟는 공사비 여파로 인한 분양가 상승과 대출 규제 강화는 여전히 시장의 변수로 꼽힌다. 6일 업계에... 또한 최근 건설사들이 수익성 보전을 위해 발코니 확장비나 유상 옵션 가격을 높게 책정하는 경향이 있어... 
2026-04-06,네이버뉴스,"국가철도공단, 연내 기술형입찰 공사비 산정 방식 바꾼다",https://www.dnews.co.kr/uhtml/view.jsp?idxno=202604051528431960997,최대 건설 발주기관 중 하나인 국가철도공단이 기술형입찰의 공사비 산정 방식을 기존 물가변동 평균 지수에서 비목별 지수조정률로 전환한다. 공무원연금공단 등 18개 기관은 수의계약 가이드라인을 올 연말까지 새로... 
2026-04-06,네이버뉴스,[건설사 수익성 점검] [KCC건설] ROA '쑥'...공사비 관리 효과 '톡톡',https://dealsite.co.kr/articles/159585,건설원가 절감으로 순이익 1.5배↑…올해 미분양發 금융비 관리 관건 지난해 KCC건설이 원가율 개선에 성공하며 수익성을 큰 폭으로 끌어올렸다. 건설 업황 전반의 부진 속에서도 원가관리 역량을 발휘하며 내실... 
2026-04-06,네이버뉴스,"이번엔 욕설까지 섞어가며... 트럼프, 이란에 폭발했나",https://www.wikitree.co.kr/articles/1129788,"높이 136미터, 공사비 4억 달러(약 5700억 원) 규모의 이 현수교는 테헤란과 카라즈를 잇는 구조물로, 이란... 교량 건설에 참여한 한 엔지니어는 이란 국영 방송에 ""우리의 기술과 인력, 자원으로 모든 것을 만들었다.... "
2026-04-06,네이버뉴스,"부실 PF 18조5천억 정리에도…""중동發 공사비 상승, 면밀 모니터링 필요...",http://www.newsroad.co.kr/news/articleView.html?idxno=57330,"금융권과 건설업계는 회의에서 최근 중동 지역 긴장 고조로 인한 공사비 상승과 원자재 수급 불안이 PF 사업의 불확실성을 다시 키우고 있다고 우려를 전했다. 민간 전문가들도 ""부동산 PF 시장이 전반적으로 안정세에... "
2026-04-06,네이버뉴스,"부동산PF 시장, 부실 사업장 정리·재구조화 효과 나타나...변수는 중동...",http://www.joseilbo.com/news/news_read.php?uid=565988&class=18&grp=,"금융권 및 건설업계는 제도개선 방향에 공감하면서도, 최근 중동 상황으로 공사비 상승 등 부동산PF 사업의 불확실성이 확대된 만큼 제도개선방안 시행이 탄력적으로 이루어질 필요가 있다는 의견을 제시했다.... "
2026-04-06,네이버뉴스,“지을수록 손실…적정 예산ㆍ인센티브 확보 절실”,https://www.dnews.co.kr/uhtml/view.jsp?idxno=202604041803130540949,높은 공사비가 여전히 허들로 남아 있다. 모듈러 발주 확대와 함께 이를 뒷받침할 현실적인 예산 확보와... 모듈러 건축을 건설업이 아닌 제조업 관점에서 접근해야 한다는 혁신적인 시각도 제기된다.... 
2026-04-06,네이버뉴스,납품단가연동 배제 우려 현실화…하도급사 '시름',http://www.kmecnews.co.kr/news/articleView.html?idxno=46045,"지난 1일 전문건설업계에 따르면, 원자재 가격이 지속적으로 상승하면서 하도급 공사비도 덩달아 폭등하고 있는 상황에서, 종합건설사와 하도급 계약을 체결할 때 설정한 '물가변동을 인정하지 않는다'는 ESC배제... "
2026-04-06,네이버뉴스,노란봉투법 시행 따른 세부 기준 마련 시급,http://www.kmecnews.co.kr/news/articleView.html?idxno=46380,"◇건설업 가이드라인·공사비 연동제 필요 전문가들은 이 같은 부작용을 막기 위해 정부 차원의 '건설업 가이드라인' 마련이 시급하다고 입을 모은다. 단순히 법리적 해석에 그칠 것이 아니라, 현장에서 원·하청 간 책임... "
2026-04-06,네이버뉴스,유가·나프타 상승에⋯운송비·레미콘·아스팔트 줄줄이 급등 [건설현장...,https://www.etoday.co.kr/news/view/2571756,"5일 한국건설기술연구원 공사비원가관리센터에 따르면 2월 건설공사비지수는 133.69(잠정)를 기록했다. 이는 지수 도입 이래 가장 높은 수치로, 전월(133.52)보다 0.13% 상승했다. 지난해 같은 달과 비교하면 2.04% 올랐다. 2월... "
2026-04-06,네이버뉴스,"공공 지원책 속속, 민간은 어쩌나⋯“금융 기반 해법 필요” [건설현장...",https://www.etoday.co.kr/news/view/2571828,"5일 김윤덕 국토교통부 장관은 8개 관련 협회 등 건설 기업인과 긴급 회동을 갖고 “자재 수급부터 공사비, 금융까지 건설 산업 전반에 영향을 줄 수 있는 모든 요소를 면밀히 관리해 국민들께서 체감하는 불안이 커지지... "
2026-04-06,네이버뉴스,중소 건설현장 퇴직공제 신고 ‘숨통’…최대 3개월 무료 대행 지원,https://biz.heraldcorp.com/article/10710298?ref=naver,공사비 300억 미만 사업장 대상 상생협력 시범사업 도입 가입·신고·전자카드까지 행정업무 일괄 대행…제도 이행 부담 완화 [헤럴드경제=김용훈 기자] 중·소 건설사업장의 퇴직공제 신고 부담을 덜어주기 위한 무료... 
2026-04-06,네이버뉴스,"[시론]공기열 히트펌프, 정책 속도와 현장 속도 균형 잡아야",http://www.kmecnews.co.kr/news/articleView.html?idxno=46371,반면 건축주는 기존에 설치하던 설비가 신재생에너지 시스템으로 인정받기 때문에 공사비 증가에 대한... 따라서 기득권을 확보하기 위한 소모성 싸움보다는 산업의 전환과 기술의 진화에 순응해 건설적인 방안을... 
2026-04-06,네이버뉴스,머니투데이 오프라인 헤드라인-6일,https://www.mt.co.kr/stock/2026/04/06/2026040522331153160,"전성시대"" [건설 부동산] ""공사비 협상 좀…"" PM 모시는 정비사업장 [정책사회·문화] 정년 지나도 현역…다시 명함 파는 시니어 [사회] 힘 세진 헌재, 약해진 대법, 사라질 검찰 [증권] 하나대체운용, 日 호텔투자 펀드... "
2026-04-06,네이버뉴스,"제주 건설 수주, 4년간 1조6000억 급감",https://www.donga.com/news/Society/article/all/20260406/133678182/2,"건설업 위기는 금리와 공사비, 분양가는 치솟았지만, 인구 유출로 수요는 크게 줄면서 촉발됐다. 실제 2024년 12월 완공된 제주시 애월읍의 425채 규모 아파트 단지는 단 1채만 분양되면서 미분양 물량이 통째로 공매에... "
2026-04-06,네이버뉴스,“아스팔트 관리품목화…수출용→내수 전환을”,https://www.dnews.co.kr/uhtml/view.jsp?idxno=202604041129022270940,나프타 수급난에 따른 원재료 가격의 상승과 이로인한 주택건설 공사비 상승 문제가 주로 다뤄졌다는 것이 참석자들의 전언이다. 건설자재 모두 수급안정이 시급하지만 생산중단에 이른 아스콘의 상황은 심각하다. 정부는... 
2026-04-06,네이버뉴스,[건설계약관리 강좌](2) 공기(工期)는 비용이다 - 시간 개념 없는 공사비...,http://www.kmecnews.co.kr/news/articleView.html?idxno=46400,건설공사는 본질적으로 시간 위에서 이뤄지는 생산 활동이다. 따라서 공사비 역시 시간의 함수로 이해돼야 한다. 공기를 고려하지 않은 공사비 산정은 현실을 반영하지 못하는 형식적 계산에 불과하다. 이제는 공사비를... 
2026-04-06,네이버뉴스,"100년 관문 광주역, 멈춰설 것인가 우회할 것인가",http://www.gjdream.com/news/articleView.html?idxno=668415,"임시선로 건설은 대안에 없었다. 전면 운행 중단이 임시선로 가설에 비해 공사비 약 322억 원 절감, 공사 기간이 26개월로 단축된다는 경제적 이점이 크게 작용했다. 만약 신안철교 운행 중단이 현실화되면, 최소 2년간... "
2026-04-05,네이버뉴스,"금융당국 ""부동산 PF 연체율 3.88%로 하락...중동 변수 주시""",https://www.ytn.co.kr/_ln/0102_202604052256055532,"다만 회의에 참석한 민간 전문가들은 부실 PF 규모가 3분기 연속 줄어들며 시장이 안정권에 진입했지만, 중동 상황에 따라 건설 공사비 상승 등 영향은 지켜봐야 한다고 조언했습니다. 정부는 공사비 증액 등 일시적... "
2026-04-05,네이버뉴스,"IB ""한국 물가상승률 전망 2→2.4%""…인플레이션 경고",https://www.imaeil.com/page/view/2026040512330386203,한국건설기술연구원에 따르면 2월 기준 건설공사비지수는 133.69로 통계 작성 이후 최고치를 기록했다. 공사비 오름세가 분양가 추가 인상으로 이어질 경우 실수요자의 내 집 마련 부담도 한층 가중될 전망이다.
2026-04-05,네이버뉴스,GTX-B '청학역' 신설 속도…설계 본격화,https://www.incheonilbo.com/news/articleView.html?idxno=1320253,GTX-B 건설 사업은 지난해 8월부터 송도국제도시 인천대입구역 등 주요 정거장 수직구와 환기구 설치 공사를... 추가 정거장 설치 사업비는 원인자 부담 원칙에 의해 시가 설계비와 공사비 전액을 부담해야 한다.... 
2026-04-05,네이버뉴스,부산 숙원 '하단~녹산선' 본궤도,http://www.fnnews.com/news/202604051902236500,부산시가 서부산 교통 편의를 높일 도시철도 하단~녹산선 건설사업의 설계업체 선정을 위한 최종... 하지만 지난해 업계의 공사비 부담 등으로 인해 두 차례 유찰을 겪으면서 시는 공구를 나누고 설계와 시공을... 
2026-04-05,네이버뉴스,부동산PF 연체율 3%대로 '뚝',http://www.fnnews.com/news/202604051844487226,75%p 하락한 29.68%로 나타났다. 다만 금융권과 건설업계는 최근 중동 상황으로 공사비 상승과 원자재 수급 불안 등 PF 사업 불확실성이 확대되고 있다는 의견을 제시했다.
2026-04-05,네이버뉴스,"[이슈포커스] 미국·이란 전쟁에 K-산업 어쩌나… 정부, 석유·나프타 수...",http://www.sisacast.kr/news/articleView.html?idxno=94687,"건설 장비 가동 연료비가 기계 경비의 약 30%를 차지하는데 유가가 20% 오를 경우 토목 공사비는 약 7%, 건축 공사비는 약 4% 상승하는 것으로 분석된다. 아스팔트, 페인트, 레미콘 혼화제 등 석유계 원료를 사용하는 자재... "
2026-04-05,네이버뉴스,"3高, 아파트 분양가 인상 불지펴",http://www.jjn.co.kr/news/articleView.html?idxno=1037121,중동 전쟁에 따른 공사비 상승은 2월 건설공사비지수에도 잘 나타나 있다. 한국건설기술연구원의 2월 건설공사비지수는 133.69(잠정)로 지난해 8월 130.91 이후 6개월째 최고치를 경신하고 있다. 게다가 지수에는 아직 중동... 
2026-04-05,네이버뉴스,분상제 피하자… 강남3구·용산 새 아파트 절반은 '후분양',http://www.fnnews.com/news/202604051829078839,"다른 대형사 임원은 ""후분양을 택하면 건설사 입장에서는 분양 때까지 공사비 및 금융 비용을 부담해야 한다""며 ""분상제 지역 조합들이 후분양을 원하고 있다 보니 건설사 입장에서도 따라갈 수 밖에 없다""고 말했다.... "
2026-04-05,네이버뉴스,"김윤덕 국토장관, 중동 상황 관련 건설기업인 긴급 회동",https://imnews.imbc.com/news/2026/econo/article/6812782_36932.html,"김윤덕 장관은 ""자재 수급부터 공사비, 금융까지 건설산업 전반에 영향을 줄 수 있는 모든 요소를 면밀히 관리해, 위기 상황에서도 국민의 일상이 흔들리지 않도록 하겠다""고 말했습니다."
2026-04-05,네이버뉴스,'짓기도 전에 무너질라' 전북 건설업 3곳 닫힐 때 1곳 생긴다,http://www.domin.co.kr/news/articleView.html?idxno=1551125,"소재철 대한건설협회 전북도회장은 ""공사비 현실화와 공공 발주 확대 없이는 지역 건설업계의 정상적인 운영이 어려운 상황""이라며 ""지방 건설 생태계 유지를 위해서는 재정 여건과 발주 구조 개선을 통해 안정적인... "
2026-04-05,네이버뉴스,"김윤덕 국토부 장관, 건설 8개 협회와 긴급 회동…“자재 등 전방위 대...",https://www.dnews.co.kr/uhtml/view.jsp?idxno=202604051541275190998,"김윤덕 장관은 “자재 수급부터 공사비, 금융까지 건설산업 전반에 영향을 줄 수 있는 모든 요소를 면밀히 관리하여 국민들께서 체감하는 불안이 커지지 않도록 해야 할 때”라고 강조했다. jh606@"
2026-04-05,네이버뉴스,부동산PF 대출 연체율 3%대로 하락…중동 리스크 변수,https://www.ebn.co.kr/news/articleView.html?idxno=1704476,다만 금융권과 건설업계는 최근 중동 상황에 따른 공사비 상승과 원자재 수급 불안이 PF 사업의 불확실성을 키우고 있다고 진단했다. 금융당국은 부실 사업장 정리와 함께 제도 개선도 병행한다는 방침이다. 올해... 
2026-04-05,네이버뉴스,3기 신도시 뜬다…수도권 공공분양 1년 내내 쏟아져,https://www.hankyung.com/article/2026040597861,"금호건설이 ‘왕숙 아테라’로 시공한다. 지하 2층~지상 29층, 7개 동, 812가구(전용 59·74·84㎡) 규모다.... 그동안 공사비가 오른 것을 고려해 본청약 분양가는 84㎡ 기준 6억원대 후반에서 7억원대 초반까지 오를... "
2026-04-05,네이버뉴스,[사다리의 복원] 서울 비아파트 전세 씨 마른다…월세 비중 79.7% '사상 ...,https://www.ajunews.com/view/20260403145221695,한국건설기술연구원이 발표하는 건설공사비지수는 올해 1월 133.28로 2020년 1월(99.86) 대비 33.5%나 상승했다. 코로나19 이후 원자재 가격 급등과 인건비 인상이 맞물린 결과다. 서울 토지가격 상승까지 더해지면서... 
2026-04-05,네이버뉴스,분상제에 묶인 강남 … 동작이 더 비싸져,https://www.mk.co.kr/article/12008399,"동작 3.3㎡당 분양가 8천만원 분상제에서 빠진 노량진·흑석 급등한 공사비 분양가에 반영 흑석써밋더힐 59... 없다""며 ""건설사는 분양가를 낮췄는데 수분양자는 자금 부담이 커지고 이득은 국가가 챙기는 구조""라고... "
2026-04-05,네이버뉴스,"국토부, 중동 정세 대응 긴급 간담회",https://www.mk.co.kr/article/12008402,"김 장관은 ""자재 수급부터 공사비, 금융까지 건설산업 전반에 영향을 줄 수 있는 모든 요소를 면밀히 관리해 불안이 커지지 않도록 해야 할 때""라면서 ""위기 상황에서도 국민의 일상이 흔들리지 않도록 하겠다""고 전했다."
2026-04-05,네이버뉴스,"김윤덕 국토부 장관, 건설분야 8개 협회와 긴급 회동…중동상황 영향 점...",https://www.sedaily.com/article/20028429?ref=naver,"김 장관은 “자재 수급부터 공사비, 금융까지 건설산업 전반에 영향을 줄 수 있는 모든 요소를 면밀히 관리해 국민이 체감하는 불안이 커지지 않도록 해야 할 때”라며 “위기 상황에서도 국민의 일상은 흔들리지 않도록... "
2026-04-05,네이버뉴스,"건설협회 긴급 소집한 국토 장관, 중동발 자재·공사비 점검",http://www.inews24.com/view/1957119,"김 장관은 ""자재 수급부터 공사비, 금융까지 건설산업 전반에 영향을 주는 모든 요소를 면밀히 관리해 국민이 체감하는 불안이 커지지 않도록 해야 할 때""라며 ""위기 상황에서도 국민의 일상은 흔들리지 않도록 하겠다""고... "
