date,source,title,link,description
2026-06-08,네이버뉴스,에너지·전자소재·로봇… 두산 '제조 DNA'에 'AI 혁신' 입힌다,https://www.asiatoday.co.kr/kn/view.php?key=20260609010002702,"'엔비디아 협력' 미래 청사진 데이터센터 전력·인프라·원전부터 운영체제·지능형 건설물류장비까지 'AI팩토리 고도화' 등 전방위 결합 박정원 ""AI 기반 새 사업기회 모색 엔비디아와 협력, 중요 발판 될 것"" ""AI시대... "
2026-06-08,네이버뉴스,"젠슨 황, 韓 기업 대표들과 연달아 회동…AI 협력 강화",http://www.sisafocus.co.kr/news/articleView.html?idxno=361063,"두산에너빌리티의 가스터빈과 소형모듈원전(SMR), 두산퓨얼셀의 수소연료전지 등 두산의 다양한 에너지... 여기에 두산밥캣의 건설, 조경, 농업, 물류 장비에 엔비디아의 다양한 피지컬 AI 기술을 접목하고, 산업... "
2026-06-08,네이버뉴스,"두산그룹, 엔비디아와 AI 동맹 강화…에너지·로보틱스·첨단소재 전방...",http://www.efnews.co.kr/news/articleView.html?idxno=130199,"두산에너빌리티의 가스터빈과 소형모듈원전(SMR), 두산퓨얼셀의 수소연료전지 등 다양한 에너지 솔루션이... (사진=두산로보틱스) 두산밥캣 역시 건설과 조경, 농업, 물류 장비에 엔비디아의 피지컬 AI 기술을 접목해... "
2026-06-08,네이버뉴스,"""AI 혁명 함께 간다""…젠슨 황, 한국 기업과 전방위 협력 선언",https://www.dizzotv.com/site/data/html_dir/2026/06/08/2026060880177.html,"양사는 두산에너빌리티의 가스터빈과 소형모듈원전(SMR), 두산퓨얼셀의 수소연료전지 등을 AI 팩토리 전력... 두산밥캣은 건설·농업·물류 장비에 엔비디아의 피지컬 AI 기술을 접목해 자율 작업 기능을 강화할... "
2026-06-08,네이버뉴스,"박정원 두산그룹 회장, 엔비디아와 AI 협력…제조 역량 고도화",https://www.g-enews.com/view.php?ud=20260608144628464524debea800_1,"두산에너빌리티의 가스터빈·소형모듈원전(SMR), 두산퓨얼셀의 수소연료전지, 두산로보틱스의 협동로봇... 두산은 피지컬 AI 기술을 두산밥캣의 건설·조경·농업·물류 장비에도 접목해 자율 산업 장비 시장 대응력을... "
2026-06-08,네이버뉴스,"두산, 엔비디아 AI팩토리 전력 인프라 전방위 협력",https://www.kfenews.co.kr/news/articleView.html?idxno=658630,"양사는 두산에너빌리티의 가스터빈과 소형모듈원전(SMR), 두산퓨얼셀의 수소연료전지가 DSX AI팩토리... 두산밥캣은 건설·조경·농업·물류 장비에 엔비디아 피지컬AI 기술을 접목해 장비가 작업 환경을 스스로 인식하고... "
2026-06-08,네이버뉴스,"엔비디아, 방산 참전…네이버·NC '군사 AI' 동맹 [배창학의 방산인사이...",https://www.wowtv.co.kr/NewsCenter/News/Read?articleId=A202606080194&t=NNv,"네이버는 또 지도라는 공간 정보도 있어서 복잡한 도심, 공항이나 원전, 항만 같은 국가 시설을 가상 현실로 구현할 수 있습니다. 엔비디아와 오늘(8일) 데이터를 처리하는 초대형 글로벌 AI 팩토리를 건설하겠다며 손을... "
2026-06-08,네이버뉴스,두산·엔비디아 전방위 동맹... 로봇부터 에너지까지,http://www.newslock.co.kr/news/articleView.html?idxno=131131,"이에 따라 두산에너빌리티의 소형모듈원전(SMR)과 가스터빈, 두산퓨얼셀의 수소연료전지 등 핵심 에너지... 아울러 두산밥캣의 건설 및 물류 장비에도 이러한 기술을 접목해 주변 환경을 자율적으로 인식하고 판단하는... "
2026-06-08,네이버뉴스,고준위 방폐장 용지 선정 속도 … 내년부터 지자체 공모,https://www.mk.co.kr/article/12068671,고준위 방폐장은 원전을 가동한 뒤 나오는 사용후핵연료를 저장 및 최종 처분하는 시설이다. 한국은 원전 내... 핀란드는 현재 고준위 방폐장 건설을 완료하고 운영을 위한 인허가 절차를 밟고 있다. 스웨덴은 용지 선정을... 
2026-06-08,네이버뉴스,이건 10만년 짜리 재난... '흉물스럽다' 말하는 그 건물의 실체,https://www.ohmynews.com/NWS_Web/View/at_pg.aspx?CNTN_CD=A0003236573&CMPT_CD=P0010&utm_source=naver&utm_medium=newsearch&utm_campaign=naver_news,한수원이 기한을 넘겨 갑작스레 수명연장을 한 건 2022년 원전 생태계를 회복하겠다는 당시 새로운 대통령의... 환경단체에서 건설취소 소송을 제기하기도 했다. 그런데다 최근 핵발전소들의 감발운전이 잦아지고 있다.... 
2026-06-08,네이버뉴스,"손잡은 박정원·젠슨 황, '피지컬 AI' 동맹 굳힌다",https://www.ntoday.co.kr/news/articleView.html?idxno=127504,AI 반도체 공급망에서 출발한 협력 관계가 산업용 로봇·건설기계·발전설비를 아우르는 피지컬 AI... 과거 그룹 재무 부담의 핵심이었던 두산에너빌리티는 원전·가스터빈·전력 인프라 수주를 앞세워 다시 성장축으로... 
2026-06-08,네이버뉴스,"한국 AI기업들, 엔비디아 손잡고 피지컬AI·인프라로 영토 확장",https://www.yna.co.kr/view/AKR20260608150200003?input=1195m,"두산밥캣도 건설·물류 등 장비에 엔비디아 피지컬 AI 기술을 적용하도록 개발엔 나서기로 했다. SK·네이버... 두산에너빌리티의 가스터빈과 소형모듈원전(SMR), 두산퓨얼셀의 수소연료전지 등 두산의 다양한 에너지... "
2026-06-08,네이버뉴스,"두산, 엔비디아와 AI 협력 확대…CCL·로보틱스·에너지 총동맹",https://www.thelec.kr/news/articleView.html?idxno=57749,"두산밥캣은 건설·조경·농업·물류 장비에 엔비디아 기술을 적용한다. 산업 현장에 특화된 월드 모델... 에너지 분야에서는 두산에너빌리티의 가스터빈과 소형모듈원전(SMR), 두산퓨얼셀의 수소연료전지 등... "
2026-06-08,네이버뉴스,반도체 밸류체인 핵심 SK실트론 인수 지연…두산 신사업 재편 제동,http://www.newsworker.co.kr/news/articleView.html?idxno=430223,"두산밥캣은 건설·물류 장비에 피지컬 AI 적용을 검토하고, 두산에너빌리티는 AI 데이터센터용 소형모듈원전(SMR) 등 전력 설비 공급을 추진하며, ㈜두산 전자소재BG는 AI 서버용 동박적층판(CCL) 밸류체인 진입을... "
2026-06-08,네이버뉴스,"두산-엔비디아, 동맹 확대…로봇 넘어 반도체 소재·전력 인프라 주목",https://www.sidae.com/article/2026060814555996005,"가스터빈, 소형모듈원전(SMR) 등 두산에너빌리티의 에너지 설루션은 엔비디아 'DSX 플랫폼'에 활용될 것으로 보인다. DSX는 AI 팩토리를 설계·구축·확장하기 위한 엔비디아의 풀스택 청사진이다. 데이터센터 건설, 전력... "
2026-06-08,네이버뉴스,"두산-엔비디아, 피지컬AI·로보틱스·AI팩토리 협력 강화",https://hbnpress.com/news/view/1065598219902806,"양 측에 따르면 두산에너빌리티의 가스터빈과 소형모듈원전(SMR), 두산퓨얼셀의 수소연료전지 등 두산의... 두산은 로보틱스 분야 협력을 확대해 두산밥캣도 건설·조경·농업·물류 장비에 엔비디아의 피지컬 AI 기술을... "
2026-06-08,네이버뉴스,"두산, 엔비디아와 에너지·로봇·소재 협력 확대…AI 동맹 강화",https://news.kbs.co.kr/news/pc/view/view.do?ncd=8580549&ref=A,"두산에너빌리티는 가스터빈과 소형모듈원전(SMR), 두산퓨얼셀은 수소연료전지 등을 기반으로 AI 팩토리... 또 두산밥캣은 건설·농업·물류 장비에 엔비디아의 피지컬 AI 기술을 적용해 자율 작업 기술 고도화를... "
2026-06-08,네이버뉴스,"""AI팩토리 시대 본격 대응""...두산그룹, 엔비디아와 에너지·로봇·소재...",http://www.thefirstmedia.net/news/articleView.html?idxno=200756,"두산에너빌리티의 가스터빈과 소형모듈원전(SMR), 두산퓨얼셀의 수소연료전지 등을 활용해 AI 데이터센터와... 두산밥캣 역시 건설과 농업, 물류 장비에 엔비디아의 피지컬 AI 기술을 접목해 작업 환경을 스스로 인식하고... "
2026-06-08,네이버뉴스,젠슨 황이 잠실 찾은 이유…엔비디아 AI 생태계 중심에 선 두산,https://www.newsway.co.kr/news/view?ud=2026060815495250270,"이후 양사는 건설기계·발전설비·로봇 분야에 엔비디아 기술을 접목하는 방안을 추진해 왔으며, 올해... 두산에너빌리티의 가스터빈과 소형모듈원전(SMR), 두산퓨얼셀의 수소연료전지 등이 엔비디아의 DSX(AI팩토리... "
2026-06-08,네이버뉴스,충남도 배경민 사무관 '토목시공기술사' 합격,https://www.ccdn.co.kr/news/articleView.html?idxno=1081975,배 사무관은 해양생태복원팀장으로 근무하다 지난해 7월부터 행정중심복합도시건설청에서 파견 근무... 규모) △보령신항 해상풍력 지원 항만 민자(2천억 원 규모) 개발 추진 △제4차 항만기본(수정)계획 도 현안 사업... 
2026-06-08,네이버뉴스,지방선거 이후 지역 건설시장 정비사업·SOC·산단 개발 '주목',https://www.koscaj.com/news/articleView.html?idxno=324479,제9회 전국동시지방선거가 마무리되면서 향후 4년간 지역 건설시장의 방향도 윤곽을 드러내고 있다.... 바이오사이언스파크 조성과 해상풍력 산업 육성도 함께 추진될 예정이다. 민형배 전남광주통합특별시장은 AI... 
2026-06-08,네이버뉴스,전남 서남권 재생에너지 숨통 튼다…무안~신안 송전망 준공,https://www.m-i.kr/news/articleView.html?idxno=1379589,"특히 이번 사업은 국내 전력망 건설 역사에서도 손꼽히는 고난도 공사로 평가된다. 송전선로 대부분이 도서 지역을 통과해 섬과 섬 사이를 22차례 연결해야 했으며, 일부 구간은 최대 2㎞에 이르는 해상 횡단이 이뤄졌다.... "
2026-06-08,네이버뉴스,"“반도체공장, 지역에 분산해야 전력·용수 해결 가능”",https://www.hani.co.kr/arti/area/honam/1262467.html,"송·변전설치 확충에만 73조원이 필요하고, 송전선로 평균 건설기간은 13년이 걸린다고 했다. 안 교수는 “전남 태양광 발전량은 전국 1위, 해상풍력 잠재력은 12.4GW(전국 37%)에 달한다”며 “광주를 중심으로 광역 반도체... "
2026-06-08,네이버뉴스,"탐라해상풍력 확장에 ""조류 충돌 방안 제시해야""",https://www.jejusori.net/news/articleView.html?idxno=503751,"건설 기간은 2030년부터 2년 동안 진행하며, 사업비는 6000억원이다. 또한 한경면에 위치한 탐라해상풍력발전(주) 본사사무실도 확장한다. 사업자인 탐라해상풍력발전(주)은 ""합리적인 지역발전기금을 공유하고, 지속... "
2026-06-08,네이버뉴스,고래의 꿈을 묻는 하루,https://www.jemin.com/news/articleView.html?idxno=838584,남방큰돌고래들이 지나가는 경로라 핫핑크돌핀스에서 성명서를 내고 탐라해상풍력발전 대규모 확장사업... 사회 건설은 무의미한 구호가 아닐는지. 이번 6·3선거에 당선된 정치인들은 양심을 걸고 주장하고 약속한 말들이... 
2026-06-09,네이버뉴스,"풀무원, 새만금에 국내 첫 김 육상양식 R&D센터 착공",http://www.beyondpost.co.kr/view.php?ud=20260609082647385546a9e4dd7f_30,"풀무원은 전북 군산 새만금 국가산업단지에 국내 최초 김 육상양식 전용 연구개발(R&D)센터를 착공했다고 9일... 총 9473㎡ 규모 부지에 양식시설과 해수 처리시설, 연구·지원시설 등을 갖춘 통합 연구 인프라로 조성된다.... "
2026-06-09,네이버뉴스,"풀무원, 새만금에 김 육상양식 실증센터 짓는다",https://www.edaily.co.kr/news/newspath.asp?newsid=02778166645480080,"풀무원이 새만금 국가산업단지에 착공한 국내 최초 ‘김 육상양식 R&D센터’ 조감도. (사진=풀무원) 풀무원... 1단계 사업에서는 김 육상양식동, 해수 처리시설, 사무동 등 핵심 인프라를 먼저 구축한다. 이후 실증 결과를... "
2026-06-09,네이버뉴스,롯데免 BTS 협업 브랜드 출시·풀무원 김 육상양식 R&D센터 착공,https://www.slist.kr/news/articleView.html?idxno=744123,"사진=풀무원 풀무원이 새만금 국가산업단지에 국내 최초 '김 육상양식 R&D센터'를 착공했다. 이번 센터는... 센터는 총 9473㎡ 부지에 양식시설, 해수 인·배수 및 전처리시설, 연구·지원시설을 통합한 R&D 인프라로... "
2026-06-09,네이버뉴스,"풀무원, 새만금에 국내 첫 '김 육상양식 R&D센터' 짓는다",https://www.newspim.com/news/view/20260609000045,"풀무원이 새만금 국가산업단지에 착공한 국내 최초 '김 육상양식 R&D센터' 조감도. [사진=풀무원 제공] R&D센터는 총 9473㎡ 부지에 양식시설, 해수 인·배수 및 전처리시설, 연구·지원시설 등을 갖춘 첨단 인프라로 조성된다.... "
2026-06-09,네이버뉴스,"풀무원, 미래 수산업 혁신 나선다..새만금에 김 육상양식 R&D센터 착공",https://kpenews.com/View.aspx?No=4104990,"센터는 총 9473㎡(약 2865평) 부지에 양식시설, 해수 인·배수 및 전처리시설, 연구·지원시설을 통합해 첨단 RD 인프라로 조성된다. 이번 착공은 1단계 사업으로 테스트베드 운영에 필요한 핵심 인프라 구축에 집중한다. 김... "
2026-06-09,네이버뉴스,"[보도 그 후] 여수 월호도 뉴딜300, '방치' 아닌 '기다림'... ""독단 추진...",http://www.netongs.com/news/articleView.html?idxno=333413,"마을 주민들은 ""우리 월호도 뉴딜300 사업은 추진 과정에서 잡음이 없었고, 낙후됐던 섬 인프라가 대폭 개선되어 다른 마을보다 주민들의 만족도가 상당히 높다""라며, ""교량 착공 지연이라는 외부적 요인으로 인해 발생한... "
2026-06-09,네이버뉴스,"'검은 반도체' 김, 육지에서 키운다…풀무원 새만금 프로젝트 본격화",https://www.megaeconomy.co.kr/news/newsview.php?ncode=1065566290349959,"풀무원이 새만금 국가산업단지에 국내 최초 김 육상양식 연구개발(R&D)센터를 착공하고 미래 수산업 혁신을... 양식시설과 해수 인·배수 및 전처리 시설, 연구·지원시설 등을 집약한 첨단 연구 인프라로 구축될 예정이다.... "
2026-06-09,네이버뉴스,"[종목+] 웨이비스, 천안 신공장 베팅…K-방산 수혜 기대",https://www.newspim.com/news/view/20260608000976,"착공일은 오는 22일, 준공 목표는 2027년 4월이다. 투자 규모는 지난해 말 기준 자기자본(609억원)의 50.8%에... 신공장은 칩·트랜지스터·모듈을 아우르는 통합 생산 인프라와 군사 규격 신뢰성 시험설비를 갖출... "
2026-06-09,네이버뉴스,"풀무원, 새만금에 '김 육상양식 R·D센터' 착공…해수온 상승 대항할 미...",https://www.thefairnews.co.kr/news/articleView.html?idxno=78976,이러한 환경 변화 속에서 풀무원은 새만금 국가산업단지에 국내 첫 김 육상양식 연구개발(R·D) 센터를 착공하... 총 부지 9473㎡ 규모로 들어서는 R·D센터는 양식 설비와 해수 전처리 인프라·연구 시설을 유기적으로 결합한... 
2026-06-09,네이버뉴스,"서울 구청장들 정비사업 전담부서 신설 … ""재건축 속도전""",http://www.queen.co.kr/news/articleView.html?idxno=458231,"사업 초기 단계부터 인허가, 착공, 입주에 이르는 전 과정을 보다 체계적으로 관리해 사업 지연을... 실제로 사업 지연 여부에 따라 지역 부동산 시장과 생활 인프라 개선 속도가 달라지는 만큼 주민들의 관심도 매우... "
2026-06-09,네이버뉴스,"풀무원, 새만금에 국내 최초 '김 육상양식 R&D센터' 착공",http://www.popcornnews.net/news/articleView.html?idxno=123317,"센터는 총 9천473㎡(약 2천865평) 부지에 양식시설, 해수 인·배수 및 전처리시설, 연구·지원시설을 통합해 첨단 R&D 인프라로 조성된다. 이번 착공은 1단계 사업으로, 테스트베드 운영에 필요한 핵심 인프라 구축에... "
2026-06-09,네이버뉴스,데이터센터 건설 지연에 GPU 담은 텐트까지 등장… 빅테크의 ‘매드 맥...,https://biz.chosun.com/it-science/ict/2026/06/09/GGESPAH44JCWDM3O774MVYEPVE/?utm_source=naver&utm_medium=original&utm_campaign=biz,"AI 인프라 구축 경쟁이 본격적인 속도전으로 돌입했다는 사실을 보여준다. 투자은행 JP모건에 따르면 2027년 완공 예정을 목표로 발표된 미국 데이터센터 프로젝트의 60% 이상이 아직 착공도 하지 않았고, 7%는 공사가... "
2026-06-09,네이버뉴스,"李대통령 ""세제·금융·공급 함께 손본다""…용산·태릉이 시험대",https://www.news1.kr/realestate/general/6191080,"이재명 대통령이 최근 3년간 재건축·재개발과 인허가, 착공 감소로 주택 공급이 크게 줄었다고 진단하며... 태릉CC는 약 6800가구 규모 공급이 추진되는 사업으로, 세계유산 보존과 교통 인프라 확충 문제가 함께 논의되고... "
2026-06-09,네이버뉴스,“창동기지 개발 속도… 일자리 넘치는 ‘미래경제도시’ 완성할 것” ...,https://www.seoul.co.kr/news/publicnews/seoul_local/today_seoul/2026/06/09/20260609021001?wlog_tag3=naver,"S-DBC 착공 속도 재개발·재건축 차질 없게 GTX-C 공사 신속 정상화 기대 SRT 연장 등 교통혁신 지속 추진 행정... 주거 환경 개선은 일자리·기업 유치, 교통 인프라 개선과 함께 이뤄질 수 있다. 노원은 충분히 가능성이 있다.... "
2026-06-09,네이버뉴스,"농지→관광→잼버리…개발 잔혹史, 현대차그룹이 끊어낼까",https://www.ajunews.com/view/20260608123320224,1991년 11월 본격 착공해 올해 35년 차를 맞았지만 정치·환경·시대적 갈등에 따라 수차례 계획이 변경되며... 잼버리 사태로 국제적인 인프라 미흡 도시로 낙인이 찍히면서 새만금은 수십 년간 농업도시도 관광도시도... 
2026-06-09,네이버뉴스,"“4일 7시16분 서울 운명 바뀌어… 국힘, 거친 중도 바다로 갈건가, 강성...",https://www.chosun.com/politics/politics_general/2026/06/09/GIQSPC5CDZCH5OV3SQAQV5D4ZY/?utm_source=naver&utm_medium=referral&utm_campaign=naver-news,"시장 교체로 그간 쌓아 올린 정책 인프라가 뿌리째 뽑혀 나갔다면, 서울은 쇠퇴의 길로 접어들 수밖에... 2031년까지 31만호 착공을 공약했다. “선거를 겨냥해서 급조한 정치 공약이 아니다. 현재 서울시 정비 사업... "
2026-06-09,네이버뉴스,과천·성남도 야당 지자체장이 당선… 수도권 6만호 공급 대책 ‘변수’...,https://www.chosun.com/economy/real_estate/2026/06/09/USCDSEJTINCMTKUBKJGBGQZ6JI/?utm_source=naver&utm_medium=referral&utm_campaign=naver-news,도시 인프라에 과부하가 걸린다는 게 주된 반대 이유다. 성남 판교신도시 인근의 신규 택지 2곳에 6300가구를... 하지만 이 역시 국민의힘 후보였던 신상진 시장이 재선에 성공하면서 당초 목표로 했던 2029년 착공이... 
2026-06-09,네이버뉴스,"""살고 싶고, 일하고 싶은 홍천 미래 열겠다""",https://www.kado.net/news/articleView.html?idxno=2054558,"정주 여건 개선과 양질의 일자리 창출, 교통 인프라 확충 등을 통해 홍천의 경쟁력을 높이고 지속 가능한 발전 기반을 마련하겠다. 용문~홍천 광역철도 조기 착공을 비롯해 지역경제 활성화, 농업 경쟁력 강화, 청년 정착... "
2026-06-08,네이버뉴스,"경북119특수대응단, 실전 화재 대응 훈련 인프라 구축",https://www.hidomin.com/news/articleView.html?idxno=708520,실화재훈련장은 2025년 5월 착공 이후 11개월에 걸쳐 총 사업비 20억 6200만 원을 투입하여 특수대응단 부지 내... 실화재훈련장 내부와 첨단 집진설비 등 전반적인 시설을 둘러보며 안전성과 훈련 인프라를 최종 점검했다.
2026-06-08,네이버뉴스,"괴산군, 연풍면 도시재생 뉴딜사업 추진",https://www.ccreview.co.kr/news/articleView.html?idxno=349867,본격 착공한다고 8일 밝혔다. 군은 총사업비 15억6200만원을 투입해 올해 12월 준공을 목표로 공사에 들어가... 골목길 경관 개선사업을 통해 마을 안전성을 높이고 자전거 인프라 확충을 통해 연풍을 찾는 자전거 여행객의... 
2026-06-08,네이버뉴스,지방선거 이후 정비사업 탄력 기대… 역세권 가치 더욱 커진다,http://www.biztribune.co.kr/news/articleView.html?idxno=354500,오세훈 서울시장 당선인은 신속통합기획과 모아타운을 중심으로 2031년까지 31만 가구 착공을 목표로... 업계에서는 이 같은 정책들이 정비사업 추진 속도를 높이는 동시에 교통 인프라와 연계된 역세권 가치 상승으로... 
2026-06-08,네이버뉴스,HBM 다음은 기판…삼성전기·LG이노텍 나란히 1조클럽 가시권,https://www.edaily.co.kr/news/newspath.asp?newsid=05067606645479752,인공지능(AI) 인프라 투자 확대에 따른 반도체 업계 병목 현상이 고대역폭메모리(HBM)를 넘어 반도체... 오는 7월 착공해 2027년 5월 준공할 예정이다. 올해 1분기 LG이노텍의 반도체 기판 설비 가동률은 91.8%로 사실상... 
2026-06-08,네이버뉴스,HBM 훈풍 타고 날아오른 충북경제…4.4% 성장 전환,https://www.ccdn.co.kr/news/articleView.html?idxno=1082016,"특히 반도체 수출은 서버와 데이터센터 등 AI 인프라 투자 확대에 따른 HBM 수요 급증으로 75.1% 늘었다. 이... 기계류 수입액은 15.8% 늘어 설비투자 개선을 보여줬고, 건축착공면적도 3.1% 증가했다. 제조업 생산, 수출... "
2026-06-08,네이버뉴스,"괴산군, 연풍 중심상가로 가로환경 조성 공사 착공",https://www.thepublic.kr/news/articleView.html?idxno=306921,"본격 착공한다. 총사업비 15억6200만 원을 투입해 연풍전통시장~연풍보건소 구간 420m를 정비하며, 보차도... 군은 이번 사업을 계기로 골목길 경관 개선, 자전거 인프라 확충 등 도시재생 사업을 단계적으로 추진해 지역... "
2026-06-08,네이버뉴스,강기윤 창원시장 당선자 경제 공약 현실성 의문 여전,https://www.idomin.com/news/articleView.html?idxno=2007505,"발전 인프라 및 관련 연구개발 거점 조성 등을 제시했다. 강 당선사는 임기 1~2년 차에 마산·봉암·창원제2산단별 특화 마스터플랜 수립 및 고시, 임기 3~4년 차에 방위·원전 선도 기업 유치 및 제2산단 터 조성 착공... "
2026-06-08,네이버뉴스,최원용 평택시장 당선자 “산업 다각화로 성장동력 확보… 화양지구 민...,https://www.kyeongin.com/article/1765210,"특히 서부권 최대 현안인 화양지구의 교통·의료·생활 인프라 부족과 관련 “지금 당장 해결해야 할... 이어 “안중~화양지구 간 도로(3-2도로 포함)의 조속한 착공과 완공, 서부권 종합병원 건립을 통한 의료 공백 해소... "
2026-06-08,네이버뉴스,현대차 새만금투자 선제적 물류망 구축 다급,http://www.domin.co.kr/news/articleView.html?idxno=1557846,"전북의 최대 현안인 새만금 공항과 항만 철도 등 물류 인프라 구축이 터덕거리면서 내년부터 본격화할... 국토교통부 기본계획 고시 기준으로 2024년 착공, 2028년 완공, 2029년 개항의 목표 역시 환경분쟁 소송에... "
2026-06-08,네이버뉴스,서부산 개발공약에 미래가치 상승… 반도 아이비플래닛 등 지식산업센터...,http://www.ikld.kr/news/articleView.html?idxno=335663,"6·3 지방선거에서 서부산 개발과 교통 인프라 확충을 공약으로 내세운 후보들이 부산시장과 강서구청장에... 분양 관계자는 ""부산에코델타시티가 가덕도신공항 착공 호재와 첨단 미래 산업의 중심지로 자리매김하는... "
2026-06-08,네이버뉴스,"괴산군, 연풍 중심상가로 가로환경 조성 착공...“걷고 싶고, 머물고 싶...",http://www.breaknews.com/1212750,전격 착공하고 본격적인 작업에 돌입했다고 8일 밝혔다. 괴산군은 이번 거리를... 자전거 인프라를 확충해 연풍을 중부권 최고의 자전거 여행 명소로 키우겠다는... 
2026-06-08,네이버뉴스,"[위클리오늘] 이진환 남양주시의원, ""다산신도시 개발이익 환원 사업 속...",http://www.weeklytoday.com/news/articleView.html?idxno=778701,조기 착공 ▲경의중앙선 복개공원 랜드마크화 추진 ▲경기 유니티 추가 신설 ▲다산신도시와 왕숙1지구를... 교통·문화·예술·생활SOC 인프라의 적극적인 확충이 필요하다고 강조했다. 특히 GH 동부사업단의 다산역 이전과... 
