date,source,title,link,description
2026-06-18,네이버뉴스,평창동 308평에 국제아트레지던시 조성…기금 마련 위한 경매 열린다,https://www.ajunews.com/view/20260618111650137,"문화예술 인프라 조성 모델이라는 점에서도 의미가 크다. 사업은 현재 상당 부분 구체화되었다. 자문밖문화포럼은 종로구 평창동 93-4번지 일원, 308평의 대지에 자문밖 국제아트레지던시를 조성하고 있으며, 2026년 착공... "
2026-06-18,네이버뉴스,이천 대월2일반산업단지 착공…SK하이닉스 연계,https://www.newsis.com/view/NISX20260618_0003674225,시는 대월면 구시리 일원에 조성하는 대월2일반산업단지 부지 조성공사가 착공에 들어갔다고 18일 밝혔다.... 시는 공공 주도의 태양광 발전 인프라를 구축해 입주기업의 RE100 이행과 글로벌 환경규제 대응을 지원할... 
2026-06-18,네이버뉴스,"[서울&] 노원구, 복합문화공간 ‘태릉어울림 도서관’ 착공",http://www.seouland.com/arti/society/society_general/24223.html,노원구(구청장 오승록)가 공릉동 지역의 도서관 인프라 확충과 전 세대 맞춤형 복합문화공간을 위해... 구는 16일 건립 부지에서 주민들과 함께 착공식을 했으며 2029년 3월 개관을 목표로 공사에 들어간다. 서울살이... 
2026-06-18,네이버뉴스,6만 군민 숙원 '태안~안성 민자고속도로' 적격성조사 통과,https://www.ccdailynews.com/news/articleView.html?idxno=2422632,"2031년 착공을 목표로 추진될 예정이다. 태안은 전국에서 손꼽히는 해양관광도시임에도 지역내에 고속도로가 한 곳도 접하지 않는 교통 소외지역으로, 군은 이번 사업으로 열악한 교통 인프라가 크게 개선될 것으로... "
2026-06-18,네이버뉴스,태안군 6만 군민 숙원 '태안~안성 민자고속도로' 적격성조사 통과,https://www.jeonmae.co.kr/news/articleView.html?idxno=1266449,"2031년 착공을 목표로 추진될 예정이다. 태안군은 전국적인 해양관광도시임에도 고속도로가 연결되지 않은 교통 소외지역으로, 이번 사업을 통해 교통 인프라 개선 효과가 클 것으로 기대하고 있다. 사업이 완료되면... "
2026-06-18,네이버뉴스,"""이제 마산이 뜬다"" 마산 부동산 반등 '청신호'… '창원 한신더휴 메가...",http://www.ikld.kr/news/articleView.html?idxno=336182,"지난 5월 19일 착공식을 진행한 회원2구역은 학군·교통·자연·상업 등 생활 인프라가 집중된 마산 주거지 내에서도 주요 입지에 위치해 지역민들의 기대감이 높았던 현장으로, 기다림이 길었던 만큼 우수한... "
2026-06-18,네이버뉴스,'자문밖 국제아트레지던시' 건립에 가나문화재단·서울옥션 힘 보태,https://www.cnbizm.com/news/articleView.html?idxno=305914,"문화예술 인프라 조성 모델이라는 점에서도 의미가 크다""고 부연했다. 현재 자문밖문화포럼은 종로구 평창동 308평의 대지에 자문밖 국제아트레지던시를 조성하고 있으며, 올해 착공, 2028년 상반기 개관을 목표로 사업을... "
2026-06-18,네이버뉴스,제주영어교육도시 교육 인프라 확장…주거 수요 늘어난다,https://www.asiatime.co.kr/article/20260618500126,"5번째 국제학교 FSAA 착공, 정원 1354명 증가 '한화포레나 제주에듀시티' 등 인근 단지 주목 제주도, 미분양... 캠퍼스 착공이 본격화됨에 따라 제주영어교육도시에 대한 관심도 늘고 있다. 특히 영어교육도시 학생... "
2026-06-18,네이버뉴스,"TSMC CEO, ""공장에 물트럭 부를까 고민했다""...대만 반도체의 5대 고민은...",http://www.impacton.net/news/articleView.html?idxno=19273,"고질적인 인프라 한계가 최대 복병으로 떠올랐다. 삼성전자와 SK하이닉스 또한 비슷한 상황에 처할 수... Wei) TSMC 최고경영자는 대만 남부 핑둥에서 열린 신설 과학단지 착공식에서 ""TSMC가 현재 가장 부족한 것은... "
2026-06-18,네이버뉴스,"달성군, 적극 행정으로 그린벨트 풀었다… '다사공영주차장' 18일 본격 ...",https://news.bbsi.co.kr/news/articleView.html?idxno=4089892,"이후 철저한 사전 준비를 거쳐 지난 4월 착공에 들어갔으며, 주민들의 교통 불편을 최소화하기 위해 단 두 달... 밀착형 인프라 확충은 지자체의 기본 책무인 만큼, 앞으로도 주민 불편을 야기하는 행정 사각지대를 과감히... "
2026-06-18,네이버뉴스,"동부건설, 2779억 제천~영월 고속국도 2공구 수주",https://www.ddaily.co.kr/page/view/2026061811114444129,공사기간은 착공일로부터 약 84개월이다. 제천~영월 고속국도는 충청권과 강원 남부·태백권을 연결하는... 교통 인프라 분야 실적을 확대하고 있다. 동부건설 관계자는 “이번 사업은 충청권과 강원 남부권을 연결하는... 
2026-06-18,네이버뉴스,"[당선인에게 듣는다]명현관 해남군수 ""AI·에너지산업 선도, 농어업 대전...",https://www.namdonews.com/news/articleView.html?idxno=914028,"명 군수는""하반기 국가AI컴퓨팅센터와 국립농식품기후변화대응센터가 착공에 들어가 2028년 운영을 시작할... 쌀과 배추, 고구마, 김 등 4대 농수산물의 탑 브랜드화와 산업화, 서남부권 거점 물류기지 구축, 수출 인프라... "
2026-06-18,네이버뉴스,"베트남, 향후 5년 내 '신규공항' 7곳 문 연다…연간 2.2억 명 수용",https://www.insidevina.com/news/articleView.html?idxno=43409,"중이거나 착공을 앞둔 7개 공항이 포함된다. 당국에 따르면 기존 공항의 시설 개보수 및 확장과 함께... 공항 인프라 투자와 관련하여, 건설부는 2021~2030년 기간 총 485조 동(184억2,600만여 달러)이 필요할 것으로... "
2026-06-18,네이버뉴스,"“시운전 기간만 6개월”…세계 최장 대전 트램, 개통 1년 이상 늦어질...",https://www.joongang.co.kr/article/25437833,"8㎞로 노선 길이가 세계에서 가장 길며, 정거장 45개와 차량기지 1곳을 조성하는 대전의 핵심 인프라다.... 대전 트램, 28년 만에 착공 대전 트램은 30년 가까이 우여곡절을 겪었다. 대전시가 대전도시철도 2호선을 처음... "
2026-06-18,네이버뉴스,"아산시, '봉안당 건립공사' 착공",https://www.ggilbo.com/news/articleView.html?idxno=1164394,"아산시 제공 충남 아산시는 '아산시 공설장사시설 확충사업 봉안당 건립공사'를 착공했다고 18일 밝혔다.... 장사 인프라 구축을 통해 시민 복지 수준 향상에도 도움이 될 것으로 기대하고 있다. 또, 설계 단계에서... "
2026-06-18,네이버뉴스,"이천시, 대월2산단 조성 착수…반도체 기업 집적 기반 마련",https://www.discoverynews.kr/news/articleView.html?idxno=1093760,이천시 대월2일반산업단지 본격 착공 [사진제공=이천시] 이천시가 반도체 산업과 연계한 기업 유치 기반... 특히 지역 내 반도체 산업 인프라와의 연계성을 높여 기업 간 협업 환경을 구축하는 데 중점을 두고 있다. 입주... 
2026-06-18,네이버뉴스,제주영어교육도시 5번째 국제학교 착공···‘한화포레나 제주에듀시티...,https://www.siminilbo.co.kr/news/newsview.php?ncode=1160269434939974,시설 인프라로 구성된다. 학교는 순수 민간 자본을 바탕으로 설립을 진행하여 제주국제자유도시개발센터(JDC) 등 유관 기관과의 협력하에 기공식을 개최하고 착공에 들어갔다. 본교의 교육 과정을 도입하여 아시아... 
2026-06-18,네이버뉴스,대전의료원 건립 '순조'…조달청 설계적정성 검토 통과,https://www.newsis.com/view/NISX20260618_0003674065,"대전의료원은 지역 공공의료 기반 확충을 위한 핵심 공공인프라 사업이다. 일반 공공건축물과 달리... 및 착공 절차를 밟을 계획이다. 대전시 관계자는 ""검토 결과는 실제 발주 가능한 공사비 수준을 객관적으로... "
2026-06-18,네이버뉴스,"HJ중공업, 제천~영월 고속국도 3공구 수주…공사비 2126억원",https://www.delighti.co.kr/news/articleView.html?idxno=117867,"총 공사금액은 2126억원이며, 공사 기간은 착공일로부터 84개월이다. HJ중공업은 전체 사업비의 70% 지분으로... 핵심 인프라로 자리매김할 수 있는 고속도로를 성공적으로 건설하는 데 최선을 다하겠다""고 말했다."
2026-06-18,네이버뉴스,"아산시, 공설장사시설 확충사업 봉안당 건립공사 착공...2028년 목표",http://www.newstown.co.kr/news/articleView.html?idxno=706567,"건립공사'를 착공했다. 이번 사업은 아산시 송악면 거산리 산56-21 외 5필지에 연면적 4,944.56㎡ 지상 3층 규모로... 장사 인프라 구축을 통해 시민 복지 수준 향상에도 도움이 될 것으로 예상된다. 아울러 해당 사업은 설계... "
2026-06-18,네이버뉴스,"HJ중공업, 제천∼영월간 고속도로 3공구 건설공사 수주",http://www.smarttimes.co.kr/news/articleView.html?idxno=46494,"공사 금액은 2126억원, 공사 기간은 착공일로부터 84개월이다. HJ중공업 지분은 70%의 지분을 갖고 주간사로... HJ중공업 관계자는 ""협력사들과 긴밀히 공조해 철저한 품질 관리와 안전을 최우선으로 지역 핵심 인프라가... "
2026-06-18,네이버뉴스,대전의료원 건립 총사업비 협의 본궤도,https://www.daejonilbo.com/news/articleView.html?idxno=2282399,"대전의료원은 지역 공공의료 기반을 확충하기 위한 핵심 공공인프라다. 일반 공공건축물과 달리 의료장비와... 협의가 마무리되면 기본설계를 재개하고 발주와 착공 절차를 순차적으로 밟을 계획이다. 시 관계자는 ""검토... "
2026-06-18,네이버뉴스,"""지방에 AI 데이터센터 지으면 '규제' 확 푼다""…정부, AIDC법 하위법령...",https://www.newsis.com/view/NISX20260618_0003673987,'전력 괴물'로 불리는 AI 데이터센터(AIDC)를 지방으로 분산시키고 국내 AI 인프라 경쟁력을 키우기 위한... 한국전력의 까다로운 심사 과정을 건너뛰고 곧바로 착공할 수 있는 길이 열린 셈이다. AIDC 특별법은... 
2026-06-18,네이버뉴스,"동부건설, '제천~영월 고속국도 건설공사 2공구' 수주",http://www.newsdream.kr/news/articleView.html?idxno=113260,"공사기간은 착공일로부터 약 84개월이다. 계약금과 공기는 향후 사업 진행 과정에서 변동될 수 있다. 동부건설 측은 ""장기간 진행되는 대형 인프라 공사인 만큼 품질 확보와 안전 관리, 공정 리스크 최소화에 중점을... "
2026-06-18,네이버뉴스,"동부건설, 공공 토목 수주 확대…2779억원 규모 제천~영월 고속국도 2공...",https://biz.heraldcorp.com/article/10774537?ref=naver,"공사기간은 착공일로부터 약 84개월이다. 제천~영월 고속국도는 충청권과 강원 남부·태백권을 잇는 동서축... 장기간 진행되는 대형 인프라 공사인 만큼 품질 확보와 안전 관리, 공정 리스크 최소화에 중점을 둘... "
2026-06-18,네이버뉴스,"동부건설, 제천~영월 고속국도 2공구 2779억 수주",https://www.cstimes.com/news/articleView.html?idxno=710229,공사기간은 착공일로부터 약 84개월이다. 2공구는 교량 6개소·터널 2개소 등 복합 공종으로 구성되며 전체 1... 도로·교통 인프라 분야에서 입지를 넓혀왔다. 이번 수주는 계양~강화에 이어 대형 고속국도 사업을 추가로... 
2026-06-18,네이버뉴스,대전의료원 건립사업 설계적정성 검토 완료... 적정 공사비 1437억 원,https://www.ohmynews.com/NWS_Web/View/at_pg.aspx?CNTN_CD=A0003244265&CMPT_CD=P0010&utm_source=naver&utm_medium=newsearch&utm_campaign=naver_news,"대전의료원은 지역 공공의료 기반 확충을 위한 핵심 공공인프라 사업이다. 일반 공공건축물과 달리... 발주와 착공 절차를 이어갈 계획이다. 대전시 관계자는 ""이번 검토 결과는 실제 발주 가능한 공사비 수준을 객관적으로... "
2026-06-18,네이버뉴스,대전의료원 적정 공사비 '1천437억원'…예산확보 한발짝,https://www.yna.co.kr/view/AKR20260618057000063?input=1195m,"설계·발주·착공 단계가 연속적으로 이어질 수 있도록 사업관리를 강화할 것""이라고 말했다. 대전의료원은 지역 공공의료 기반 확충을 위한 핵심 공공인프라 사업이다. 일반 공공건축물과 달리 의료 장비와 기계·전기... "
2026-06-18,네이버뉴스,"HJ중공업 건설부문, 2126억 규모 ‘제천~영월간 고속국도’ 3공구 수주",https://biz.chosun.com/real_estate/real_estate_general/2026/06/18/KXJH3APQF5DSFO64BJHJTXNMJY/?utm_source=naver&utm_medium=original&utm_campaign=biz,"공사 금액은 2126억원이며, 공사 기간은 착공일로부터 84개월이다. HJ중공업은 70%의 지분을 갖고 주간사로... 안전을 최우선으로 두고 지역의 핵심 인프라가 될 명품 고속도로를 건설하는 데 최선을 다하겠다”고 말했다."
2026-06-18,네이버뉴스,"포스코그룹, 고순도 희귀가스 공장 준공···국내 반도체 수요 52% 충당",https://www.seoulfn.com/news/articleView.html?idxno=631400,"이번 공장 준공을 시작으로 철강 생산 인프라와 가스 정제 기술력을 결합해 고부가가치 특수가스 시장으로... 포스코가 2024년 2월 착공에 돌입, 총 6000억원 투자한 해당 전기로는 국내외 탈탄소 정책 강화와 탄소저감 제품... "
2026-06-18,네이버뉴스,아산에 '공설봉안당' 들어선다…2028년 상반기 준공 목표,https://www.newsis.com/view/NISX20260618_0003673827,건립공사'를 착공했다고 18일 밝혔다. 시에 따르면 이 사업은 송악면 거산리 5필지에 연면적 4944.45㎡ 지상 3층... 시는 향후 본 인증도 획득할 수 있도록 시공 단계에서도 만전을 기해 탄소중립 건축 인프라 실현에 기여할... 
2026-06-18,네이버뉴스,"[강대웅의 정문일침(頂門一鍼)] 임병택, 시흥시 성장동력 챙기며 민선 ...",https://www.ajunews.com/view/20260618090221672,"이번 협약으로 2029년 개관을 목표로 인허가와 설계, 착공 등 관련 절차를 이어갈 방침이다. 이번 사업에는... 다하겠다""며 ""관광 인프라 확충을 통해 지역경제 활성화와 도시 경쟁력 제고에 더 힘쓰겠다""고 밝혔다. 민선 7... "
2026-06-18,네이버뉴스,대전의료원 적정 공사비 1437억 통보,https://www.nocutnews.co.kr/news/6534814?utm_source=naver&utm_medium=article&utm_campaign=20260618091325,"지역 공공의료 기반을 넓히기 위한 핵심 공공 인프라 사업인 대전의료원은 일반 공공건축물과 달리 의료... 발주와 착공 절차를 차질 없이 이어갈 계획이다. 시 관계자는 ""총사업비 협의를 통해 안정적인 사업비를... "
2026-06-18,네이버뉴스,"아산시, 공설장사시설 확충 '봉안당 건립공사' 착공",http://www.chungnamilbo.co.kr/news/articleView.html?idxno=894220,"건립공사'를 착공했다고 밝혔다. 이번 사업은 아산시 송악면 거산리 산56-21 외 5필지에 연면적 4944.56㎡ 지상... 또한 시설 운영에 따른 일자리 창출과 방문객 유입으로 지역경제 활성화에 기여하고, 체계적인 장사 인프라... "
2026-06-18,네이버뉴스,두 차례 유찰에 착공 제동…송도세브란스 준공 지연 우려,https://www.dailypharm.com/user/news/339549?REFERER=NP,"정 의원은 ""송도 세브란스병원은 단순한 건축물이 아니라 인천과 송도 시민들의 생명권, 건강권과 직결된 절대적인 생존 인프라""라며 “2006년부터 이어진 기약 없는 희망 고문으로 연세대를 향한 송도와 인천시민들의... "
2026-06-18,네이버뉴스,"'1437억 공사비 윤곽' 대전의료원, 총사업비 협의 본격화",https://www.bzeronews.com/news/articleView.html?idxno=818929,사업 추진을 기다려 온 지역 주민들도 공공의료 인프라 확충에 대한 기대를 나타내고 있다. 동구와 대덕구... 대전시는 기획예산처와 총사업비 협의를 마친 뒤 중단됐던 기본설계를 재개하고 발주 및 착공 절차를... 
2026-06-18,네이버뉴스,"전국 지자체 75% 소멸 위험…""철도망으로 지방 살려야""",https://www.electimes.com/news/articleView.html?idxno=369221,"핵심 인프라다. 지방소멸 위기와 수도권 집중 문제를 해결하기 위해서는 철도망을 통한 광역경제권 형성이... 사업이라도 착공까지 최소 13년 이상이 소요되는 만큼, 국가적 합의와 우선순위 선정이 중요하다""고 밝혔다.... "
2026-06-18,네이버뉴스,"대전시, ‘대전의료원’ 건립 가속도",https://biz.heraldcorp.com/article/10774360?ref=naver,"대전의료원은 지역 공공의료 기반 확충을 위한 핵심 공공인프라 사업이다. 일반 공공건축물과 달리... 총사업비 협의를 추진하고, 협의 완료 이후 기본설계를 재개해 발주 및 착공 절차를 차질 없이 추진할 계획이다."
2026-06-18,네이버뉴스,"대전의료원 1437억 검증, 착공 로드맵 탄력",https://www.ccdailynews.com/news/articleView.html?idxno=2422636,"대전의료원은 지역 공공의료 기반을 넓히는 핵심 인프라다. 일반 공공건축물보다 의료장비, 기계·전기·통신... 발주와 착공 절차를 이어갈 계획이다. 시 관계자는 ""이번 검토는 실제 발주 가능한 공사비 수준을... "
2026-06-18,네이버뉴스,"[기획특집]김동욱 도봉구청장 당선자 ""도봉 대전환 시대 열겠다""",https://www.jeonmae.co.kr/news/articleView.html?idxno=1266317,착공을 앞둔 창동 아레나는 카카오 측의 수익성 제고 방안과 연계해 지역 일자리 창출 및 세수 확보 등 구에... 성대야구장·화학부대 부지 활용…교통 인프라 조기 구축 새로운 지역 발전 동력 확보와 교통 인프라 확충에도... 
2026-06-18,네이버뉴스,대전의료원 건립사업 속도 낸다…조달청 설계적정성 검토 통과,https://www.shinailbo.co.kr/news/articleView.html?idxno=5031713,"대전시의 핵심 공공의료 인프라 사업인 대전의료원 건립사업이 조달청 설계적정성 검토를 통과하면서 사업... 뒤 중단됐던 기본설계 절차를 재개하고, 발주와 착공 등 후속 절차를 순차적으로 추진할 계획이다. [신아일보]"
2026-06-18,네이버뉴스,[패트롤] 용인시-안성시-여주시-오산시,https://www.ekn.kr/web/view.php?key=20260618026164251,관광 인프라를 확충하고 있다. 유입된 소비가 골목 상권으로 순환하도록 여주관광상품권의 가맹점 확보를... '개군·대신 다목적 용수개발' 9월 착공…상습 침수 방지 무촌지구 사업 병행 여주=에너지경제신문 송기우... 
2026-06-18,네이버뉴스,"전건협, 전국 시군 기초자치단체 순회",https://www.koscaj.com/news/articleView.html?idxno=324732,"지역 건설경기와 현장 애로사항, 제도 개선 의견 등을 청취할 예정이다. 전건협은 현장 의견을 향후 정책 건의와 제도 개선 과제 발굴에 활용한다는 방침이다. 특히 상호시장 정상화, 하도급 질서 개선, 적정 공사비 확보... "
2026-06-18,네이버뉴스,"대한건설협회·국방시설본부, 국방시설 품질 향상 위한 업무협약 체결",https://www.viva100.com/article/20260618500990,양 기관은 협약을 통해 △건설산업 관련 정책·제도 개선 과제 발굴 및 제안 △부실시공 예방과 시공 품질 향상을 위한 상호 협력 △법령 준수를 전제로 한 적정 공사비 반영 등 건설업계 발전도모 등에 협력하기로 했다.... 
2026-06-18,네이버뉴스,수도권 분양가 13% 상승…상한제 단지 수요 증가,https://www.polinews.co.kr/news/articleView.html?idxno=734450,한국건설기술연구원 공사비원가관리센터 기준 4월 건설공사비지수는 136.88(잠정)으로 최고 수준을 기록했다. 지난해 9월 이후 상승세가 이어지고 있다. 자재 수급 지표도 하락했다. 한국건설산업연구원에 따르면 5월... 
2026-06-18,네이버뉴스,해외건설 중재절차 간소화·신속화···클레임 분쟁 처리 진행 빨라진...,https://www.koscaj.com/news/articleView.html?idxno=324744,"절차 간소화와 신속성 강화가 핵심인 만큼 공기지연(EOT), 추가공사비, 설계변경 등 해외 건설 클레임 분쟁 역시 보다 빠르게 진행될 가능성이 커졌다는 평가다. ICC는 지난 1일부터 개정 중재규칙을 시행했다. 개정... "
2026-06-18,네이버뉴스,"""전문업체 종합공사 진출 사실상 불가능""",https://www.koscaj.com/news/articleView.html?idxno=324738,"/편집자 주 윤학수 회장은 ""전문건설업계는 공사비 상승과 상호시장 개방에 따른 경쟁 심화 등 어려움에 직면해 있다""며 ""현장의 의견을 듣고 업계가 요구하는 제도 개선 과제를 정부와 국회에 적극 전달하겠다""고 말했다.... "
2026-06-18,네이버뉴스,"“전셋값, 집값보다 더 오른다”… 하반기 주택시장 덮치는 공급 부족",https://biz.chosun.com/real_estate/real_estate_general/2026/06/18/Y2WEBTJO2NEKLNA3TPDC35S5XA/?utm_source=naver&utm_medium=original&utm_campaign=biz,"공사비 급등, 프로젝트 파이낸싱(PF) 심사 강화, 지방 미분양 누적 등이 신규 착공을 가로막는 주요 원인으로 지목됐다. 이지혜 건산연 연구위원은 “2026년 건설경기는 공공과 토목 부문이 일정 부분 보완하겠지만 민간... "
2026-06-18,네이버뉴스,"'2조3,762억' 목동13단지, 시공자 선정 나섰다",https://www.arunews.com/news/articleView.html?idxno=63922,"공고문에 따르면 입찰방법은 일반경쟁입찰, 사업방식은 도급제다.입찰 참여를 희망하는 건설사는... 예정공사비는 총 2조3,762억7,003만6,000원으로, 3.3㎡당 980만원(VAT 별도) 수준이다. 이 단지는 양천구 신정동... "
2026-06-18,네이버뉴스,"하반기 매맷값 1.5%, 전셋값 3.6% 오른다",http://www.newstomato.com/ReadNews.aspx?no=1304476&inflow=N,"한편 건설 경기는 공공 부문을 중심으로 제한적인 회복세가 예상됐습니다. 이지혜 건산연 연구위원은 수주 지표 개선에도 높은 공사비와 자금조달 부담, 지방 미분양 누적 등의 영향으로 민간 부문의 본격적인 회복에는... "
2026-06-18,네이버뉴스,미착공·입주 감소에 전세 불안…주택시장 상승 압력 커진다,http://www.opinionnews.co.kr/news/articleView.html?idxno=140261,"18일 열린 '2026년 하반기 건설 건설·부동산 경기 전망 세미나'에서 김성환 한국건설산업연구원... 공사비와 금융비용, PF 여건, 분양 성과 불확실성이 여전히 부담으로 작용하고 있기 때문이다. 같은 지역 안에서도... "
2026-06-18,네이버뉴스,"대한건설협회, 국방시설본부와 상생협력 위한 업무협약",https://www.dnews.co.kr/uhtml/view.jsp?idxno=202606181439023890910,양 기관은 금번 업무협약을 통해 △건설산업 관련 정책?제도개선을 위한 과제발굴 및 제안 △부실시공 예방 및 시공 품질 제고를 위한 상호협력 △법령을 준수한 적정 공사비 반영 등 건설업계 발전 도모에 성실히 협력해... 
2026-06-18,네이버뉴스,건협·국방시설본부 맞손…군시설 품질 향상·제도 개선 협력,http://www.fnnews.com/news/202606181543532614,"최근 건설 현장에서는 공사비 현실화와 품질 확보를 위한 제도 개선 요구가 커지고 있다. 한승구 협회장은 ""국방시설 품질 제고를 위한 합리적인 제도 개선과 적정 공사비 반영이 필요하다""며 ""건설업계도 성실 시공을 위해... "
2026-06-18,네이버뉴스,"'1조 수익?'…아이에스동서, 경산 '펜타힐즈W' 사업 고분양가 논란",http://www.smarttimes.co.kr/news/articleView.html?idxno=46510,18일 건설업계와 금융투자업계 등에 따르면 아이에스동서가 경산시 중산동 일원에서 추진 중인 초고층... 3㎡당 650만원 수준의 건축비를 반영해 총공사비를 1조7994억원으로 산정했다. 예상 분양가는 3.3㎡당 2050만원... 
2026-06-18,네이버뉴스,"[AT 현장] ""하반기 건설경기 제한적 회복…인허가 위축 지속될 것""",https://www.asiatime.co.kr/article/20260618500307,하반기 건설경기가 공공·토목 발주를 중심으로 일부 회복될 것이란 전망이 나왔다. 다만 민간 비주거 부진과 공사비·금융 부담으로 체감 회복은 제한적일 수 있으며 수도권 집값의 경우 우상향 할 것이란 분석이다. 18일... 
2026-06-18,네이버뉴스,건설협회·국방시설본부 맞손…군 시설공사 적정 공사비 논의,https://www.newspim.com/news/view/20260618000915,적정 공사비 확보는 건설사의 수익 보장보다 부실시공을 막고 시설의 완성도를 높이는 기반에 가깝다. Q. 앞으로 양 기관은 어떻게 협력하나? 정책과 제도 개선 과제를 지속적으로 발굴하고 현장 의견을 공유할 계획이다.... 
