date,source,title,link,description
2026-04-14,네이버뉴스,"""문전박대는 괜찮다""… 문성호 서울시의원, 10대 건설사 돌며 서부선 참...",https://www.ilyoseoul.co.kr/news/articleView.html?idxno=515629,문 의원은 건의문에서 서부선 사업의 공사비 부담과 사업성 문제를 언급하며 건설사의 참여가 필요하다는 입장을 밝혔다. 해당 건의문에는 공사비를 현실화하는 방향의 이른바 '서부선 최적화' 방안과 시의회 차원의 지원... 
2026-04-14,네이버뉴스,"서울시의회 문성호 시의원, 10대 건설사 돌며 ‘서부선 정상화’ 간곡히...",https://weekly.cnbnews.com/news/article.html?no=211971,그는 제안서를 통해 ▲건설사의 부담을 덜어주는 ‘서부선 최적화(우수한 대한민국 건설사의 공법으로 현재 거품처럼 오른 공사비를 절감하고 합당한 실익이 보장되는 선으로 공사비를 현실화하는 방안)’ ▲문성호... 
2026-04-14,네이버뉴스,"부산도시공사, 스마트건설 전환 시도 ‘BIM 발주 협의회’ 가입",https://www.busan.com/view/busan/view.php?code=2026041413452715350,"특히 설계부터 시공, 유지관리 단계까지 BIM 기반의 사업관리 체계를 구축해 공사비 절감, 설계오류 사전 검토, 공정관리 효율화 등 스마트건설 기반을 한층 강화할 방침이다. 신창호 부산도시공사 사장은 “스마트건설... "
2026-04-14,네이버뉴스,"한미글로벌 美 자회사, 현지 국립공원 인프라 사업 참여…총 6000억 규모",https://www.mt.co.kr/estate/2026/04/14/2026041410430851697,"평가, 공사비 산정 등 엔지니어링 서비스 전 영역이다. 이번 계약 체결은 한미글로벌이 지난 2011년 오택을... 등의 건설 프로젝트 PM 용역 수주를 이어가고 있다. 한미글로벌의 2025년 연결 매출 4488억원 중 해외 매출은... "
2026-04-14,네이버뉴스,"성남, 2040년까지 정비사업에 2조원 투입…‘통합인가’로 속도낸다",https://www.hani.co.kr/arti/area/capital/1254118.html,이를 통해 각종 인허가 기간을 단축해 공사비 상승에 따른 시민들의 분담금 부담을 실질적으로 낮추겠다는... 신 시장은 “이번 정책은 단순한 건설 지원을 넘어 시민의 삶의 질을 바꾸고 도시의 미래를 결정하는 약속”... 
2026-04-14,네이버뉴스,"LH, 통합 출범 뒤 첫 '순손실'…공사비 급증에 재무부담 가중",https://news.einfomax.co.kr/news/articleView.html?idxno=4409445,"LH 관계자는 ""임대주택 사업의 경우 임대료 인상에 다소 제한이 있다""며 ""토지 사업에서도 공사비 급등으로 민간 건설사에서도 해약하는 경우가 많은데, 토지 매출을 보전하는 부분에서 다소 어려움을 겪고 있다""고... "
2026-04-14,네이버뉴스,[공기업 센터] 부산도시공사·부산진해경자청·부산시설공단,http://www.iminju.net/news/articleView.html?idxno=162518,"또한 향후 시행하는 건설공사에 단계적으로 BIM 적용을 확대할 방침이다. 공사는 설계, 시공, 유지관리 전 단계에 BIM 기반 사업관리 체계를 구축해 공사비 절감, 설계 오류 사전 검토, 공정관리 효율화 등을 추진할... "
2026-04-14,네이버뉴스,"모노리스 9.81파크 인천, PF조달에 담보 총동원",https://dealsite.co.kr/articles/160032,"시공은 두산건설이 맡았고, 일정 기한 내 사용승인을 확보해야 하는 책임준공 의무를 부담하고 있다. 이는... 모노리스인천파크는 현재 매출이 발생하지 않는 상태에서 공사비 지출이 지속되는 구조다. 실제로 최근... "
2026-04-14,네이버뉴스,"""중동발 위기 선제 대응""… 국토부, 전국 순회하며 건설업계 밀착 지원",https://www.youthdaily.co.kr/news/article.html?no=217359,"한 대형 건설사 관계자는 ""중동 사태로 인한 공급망 불안이 공사비 상승과 공기 지연의 주된 원인이었는데, 이를 불가항력으로 명시한 점은 현장의 실질적인 고충을 정확히 짚은 조치""라고 평가했다. 이어 “금융 리스크... "
2026-04-14,네이버뉴스,민자 공사비 늘면 보조금 vs 통행료…보전 원칙 놓고 이견,https://www.dnews.co.kr/uhtml/view.jsp?idxno=202604131433077530025,예비비는 민자사업 시행자가 공사비 증가 등 예기치 못한 상황에 대비해 미리 확보해 둔 재원을 의미한다. 반면 정부는 건설보조금 지급 원칙의 일괄적인 명문화에는 신중한 입장이다. 건설보조금 지급 원칙을... 
2026-04-14,네이버뉴스,오션뷰 내세웠지만 특공 청약 '0건'…지방 미분양 공포,https://www.newsis.com/view/NISX20260414_0003590290,"대내외 변수로 공사비가 급등한 상황에서 미분양 누적은 지방 중소 건설사의 재무 부담을 키우고 있다. 금융권에 따르면 신한·하나·우리은행 등 시중은행 3곳의 중소 건설업 평균 연체율은 지난해 말 기준 0.74%로, 2년... "
2026-04-14,네이버뉴스,중동발 자재 불안에 정부 '현장 대응'…수급·금융 동시 관리 나선다,http://www.hansbiz.co.kr/news/articleView.html?idxno=832693,"대한건설협회 등 업종별 협회 시도회가 참석해 자재 수급 차질과 공사비 상승, 지방 중소 건설사의 경영난 등을 현장에서 전달할 예정이다. 이번 조치는 중동 지역 긴장 고조로 석유화학 기반 자재 공급 불안이 커진 데... "
2026-04-14,네이버뉴스,부산도시공사 ‘BIM 발주 협의회’ 가입,https://www.naeil.com/news/read/585266?ref=naver,"앞으로 공사가 시행하는 건설공사에도 BIM을 단계적으로 확대 적용해 스마트건설 기반을 강화한다는 방침이다. 특히 설계부터 시공, 유지관리까지 BIM 기반의 사업관리 체계를 구축해 공사비 절감, 설계 오류 사전 검토... "
2026-04-14,네이버뉴스,"부산도시공사, BIM 협의회 가입...스마트건설 가치 완성",https://www.joongdo.co.kr/web/view.php?key=20260414010004198,"이를 통해 설계 오류를 사전에 검토해 재시공을 방지하고, 정교한 공정관리를 통해 공사비를 절감하는 등 스마트건설 기반을 한층 강화할 예정이다. 특히 국토교통부가 설계·시공·유지관리 전 단계 디지털화를 목표로... "
2026-04-14,네이버뉴스,중동전쟁·금리상승 이중 충격⋯주택사업 전망지수 63.7로 추락,https://www.etoday.co.kr/news/view/2575457,"주산연은 중동 전쟁 여파에 따른 대외 불확실성과 경기 둔화 우려, 유가 상승에 따른 건설원가 부담, 금리... 공사비 상승 압력이 다시 확대될 수 있다는 점에서 향후 사업성 관리가 더 어려워질 수 있다는 전망이... "
2026-04-14,네이버뉴스,"부산도시공사, ‘BIM 발주 협의회’ 가입… 스마트건설 전환 가속",https://view.asiae.co.kr/article/2026041410323047429,"아울러 향후 추진하는 건설사업 전반에 BIM을 단계적으로 도입해 스마트건설 기반을 강화한다는 방침이다. 특히 설계부터 시공, 유지관리까지 전 과정에 BIM 기반 사업관리 체계를 구축해 공사비 절감과 설계 오류... "
2026-04-14,네이버뉴스,"글로벌 PM 한미글로벌 자회사 오택, 美 연방정부 인프라 사업 수주",https://www.newspim.com/news/view/20260414000392,글로벌 건설사업관리(PM) 전문기업 한미글로벌(회장 김종훈)의 미국 자회사 오택(OTAK)이 미국 내무부 산하... 및 공사비 산출까지 엔지니어링 전 과정을 서비스할 예정이다. 이번 계약 체결은 한미글로벌이 지난 2011년... 
2026-04-14,네이버뉴스,"한미글로벌, 美 공공 인프라 공략 성과…자회사 오택, 국립공원 프로젝...",http://wemakenews.co.kr/news/view.php?no=25074,"평가, 공사비 산정까지 전 분야의 엔지니어링 서비스가 요구된다. 이번 수주는 한미글로벌이 2011년 오택... 프로젝트에서 건설사업관리(PM) 용역을 잇따라 수주하고 있다. 2025년 연결 매출 4488억 원 가운데 해외 매출은... "
2026-04-14,네이버뉴스,"한미글로벌 자회사 오택, 6000억원 美 국립공원 프로젝트 수주",https://www.widedaily.com/news/articleView.html?idxno=292222,"글로벌 건설사업관리(PM) 전문기업 한미글로벌은 미국 자회사 오택(OTAK)이 미 내무부 산하... 평가, 공사비 산정 등 엔지니어링 전 분야의 서비스가 수행된다. 이번 수주는 한미글로벌이 2011년 오택 인수 이후... "
2026-04-14,네이버뉴스,"자재수급 불안에 공사 지연 우려…정부, 건설업계와 긴급 소통",https://www.news1.kr/realestate/general/6135567,"대한건설협회 등 주요 업종별 협회 시도회가 참석해 자재 수급 차질, 공사비 상승, 지방 중소 건설사의 경영난 등을 현장에서 전달할 예정이다. 국토부는 이미 '건설현장 비상경제 TF'를 가동해 자재 수급 상황을 점검하고... "
2026-04-14,네이버뉴스,"문성호 서울시의원, 서부선 정상화 위해 건설사 문 두드려",http://www.enewstoday.co.kr/news/articleView.html?idxno=2418416,"문 의원은 건의문에서 △공사비 거품을 줄이기 위한 '서부선 최적화 방안' △건설사 부담 완화를 위한 20억 원 규모 행정 지원 추경 제안 등을 포함해, 사업 참여 여건 개선 방안을 구체적으로 제시했다. 건설사들이... "
2026-04-14,네이버뉴스,"한미글로벌 자회사 오택, 美 국립공원 프로젝트 수주…약 6000억 규모",http://www.paxetv.com/news/articleView.html?idxno=269488,"PM(건설사업관리) 전문기업 한미글로벌의 미국 자회사 오택(OTAK)이 미국 내무부 산하 국립공원관리청... 평가, 공사비 산정 등 엔지니어링 서비스 전 영역이다. 이번 계약 체결은 한미글로벌이 지난 2011년 오택을... "
2026-04-14,네이버뉴스,"한미글로벌 자회사 오택, 미국 국립공원 프로젝트 수주",https://www.etoday.co.kr/news/view/2575500,"평가, 공사비 산정까지 엔지니어링 전 영역을 수행하게 된다. 이번 수주는 한미글로벌이 2011년 오택 인수... 한미글로벌은 최근 미국 내 반도체, 배터리, 조선, 해저케이블 공장 등 국내 기업의 건설 프로젝트 PM... "
2026-04-14,네이버뉴스,"한미글로벌 美자회사 오택, 6000억원 규모 현지 국립공원 정비사업 참여",https://view.asiae.co.kr/article/2026041409541894115,"건설사업관리(PM) 전문기업 한미글로벌은 미국 자회사 오택(OTAK)이 미국 내무부 산하 국립공원관리청(NPS)... 조사, 공사비 산정까지 엔지니어링 전 분야에 걸쳐있다. 이번 계약은 한미글로벌이 2011년 오택을 인수한... "
2026-04-14,네이버뉴스,1분기 ‘사업주 안전 의무 미이행’ 산재사망 113명…“통계 이후 가장...,https://news.kbs.co.kr/news/pc/view/view.do?ncd=8535079&ref=A,업종별로는 건설업 사망자가 39명으로 지난해 같은 기간 71명에 비해 45.1%가 줄었습니다. 제조업은 52명으로... 규모별로는 50인 미만 또는 총공사비 50억 원 미만 사업장에서 59명이 사망하면서 지난해 같은 기간보다 28.9... 
2026-04-14,네이버뉴스,"문성호 서울시의원, 10대 건설사 돌며 ‘서부선 정상화’ 간곡히 호소....",https://www.seoul.co.kr/news/publicnews/local_govern/smc_movement/2026/04/14/20260414500027?wlog_tag3=naver,그는 제안서를 통해 ▲건설사의 부담을 덜어주는 ‘서부선 최적화(우수한 대한민국 건설사의 공법으로 현재 거품처럼 오른 공사비를 절감하고 합당한 실익이 보장되는 선으로 공사비를 현실화하는 방안)’ ▲문 의원이... 
2026-04-14,네이버뉴스,"한미글로벌 美자회사 오택, 美국립공원 프로젝트 참여",https://www.yna.co.kr/view/AKR20260414041900003?input=1195m,"평가, 공사비 산정 등이다. 한미글로벌은 2011년 오택을 인수한 이후 지속해 현지화 전략을 추진했으며, 트럼프 2기 행정부 출범 이후 국내 대기업의 미국 내 반도체·배터리·조선·해저케이블 공장 건설 프로젝트의 PM... "
2026-04-14,네이버뉴스,"경기도, '원자재 가격 급등' 지역 건설사 지원",https://www.obsnews.co.kr/news/articleView.html?idxno=1520919,경기도가 중동 상황 악화로 인한 원자재 가격 상승으로 어려움을 겪는 지역 건설사 지원에 나섭니다. 도는 도내 31개 시군과 도 소속 발주부서에 공사비 적정 반영을 요청했다고 밝혔습니다. 도는 신규 공사 원가 산정 시... 
2026-04-14,네이버뉴스,"한미글로벌, 美 국립공원 프로젝트 수주…""오택 앞세워 공공 인프라 공...",https://www.asiatime.co.kr/article/20260414500046,"(사진=한미글로벌) 14일 건설업계에 따르면 한미글로벌의 미국 자회사 오택이 국립공원관리청이 발주한... 평가, 공사비 산정 등 엔지니어링 서비스 전 영역이 계약 범위에 들어간다. 이번 계약은 한미글로벌이 2011년... "
2026-04-14,네이버뉴스,[긴급진단] 통계로 보는 공공개발 갈등을 줄이는 방법,https://www.ilyoseoul.co.kr/news/articleView.html?idxno=515494,"전력 인프라 송전소.변전소 건설 지역갈등 지속적 '발생' 2024년 8월 하남시 동서울변전소 옥내화 및 증설관련... 공공개발 사업이 지연될 경우 토지 보상비와 공사비가 증가하고, 정책 추진 지연에 따른 기회비용이 발생한다.... "
2026-04-14,네이버뉴스,"한미글로벌, 미국 공공 인프라 시장 지속 확대한다… 자회사 오택, 美 국...",http://www.ikld.kr/news/articleView.html?idxno=332797,"美 건설시장 공략 '성과'… 시장 확대 지속 노력 한미글로벌, OTAK 로고. [국토일보 하종숙 기자] 글로벌 PM... 평가 ▲공사비 산정 등 엔지니어링 서비스 전 영역이다. 이번 계약 체결은 한미글로벌이 지난 2011년... "
2026-04-14,네이버뉴스,대전 업체 민간 대형 건축현장 하도급 참여율 68.2%…1.1%p 상승,https://www.news1.kr/local/daejeon-chungnam/6135346,"분석 결과, 대형 건축 현장 중 외지업체 비율은 73%, 공사비 비중은 92%에 달했다. 시는 앞으로도 지역 건설경기 활성화를 위한 업무협약 등을 통해 실질적인 수주 기회를 지속적으로 넓혀 나갈 계획이다. 또 공동주택... "
2026-04-14,네이버뉴스,"한미글로벌 美 자회사 오택, 국립공원관리청(NPS)과 4억 달러 규모 계약",https://biz.chosun.com/real_estate/real_estate_general/2026/04/14/KR2LGC2W4JGXRBR6GD6UJLGMDI/?utm_source=naver&utm_medium=original&utm_campaign=biz,"글로벌 건설사업관리(PM) 전문 기업 한미글로벌의 미국 자회사 오택(OTAK)이 미국 내무부 산하... 평가, 공사비 산정 등 엔지니어링 서비스 전 영역이다. 이번 계약 체결은 한미글로벌이 지난 2011년 오택을 인수한... "
2026-04-14,네이버뉴스,"[AI가 바꾸는 건설산업 ⑤] ""법은 과거, 기술은 미래""…AI 건설, '규칙 없...",http://www.newsian.co.kr/news/articleView.html?idxno=88432,공사비를 실시간으로 계산하고 반영하는 일종의 '건설 하이패스'를 도입해 소모적인 분쟁을 원천 차단해야 한다는 것이다. 인력 및 교육 제도의 낙후성도 심각한 리스크다. 현장에서는 이미 로봇과 사람이 섞여 일하기... 
2026-04-14,네이버뉴스,콘크리트 못 굳힌다?…나프타 대란에 건설업 '올스톱' 위기,https://news.jtbc.co.kr/article/NB12294043?influxDiv=NAVER,공급 불안이 장기화할 경우 공사비 상승은 물론 공사 지연 가능성도 배제할 수 없습니다. 국토교통부는 '건설 현장 비상경제 TF'를 만들어 레미콘 혼화제를 비롯한 석유로 만드는 건설자재 수급을 관리하고 매점매석 등을... 
2026-04-14,네이버뉴스,"국토부, 지방정부와 중동 리스크 공동 대응…건설업계 간담회 진행",https://www.dailian.co.kr/news/view/1633401/?sc=Naver,국토교통부가 건설업계와 지역 민생경제에 미치는 중동전쟁의 영향을 최소화하기 위해 지방정부와 함께 지역 건설업계와 소통에 나선다. 14일 국토부는 오는 17일까지 전국의 권역별 지방정부 및 지역 건설업계와 함께... 
2026-04-14,네이버뉴스,'3高' 불청객이 왔다...진짜 관심주는 따로 있다는데 [마켓딥다이브],https://www.wowtv.co.kr/NewsCenter/News/Read?articleId=A202604140340&t=NNv,"특히 이 중에서 방산과 전력, 건설은 러우 전쟁 이후 계속되는 지정학적 리스크와 글로벌 인프라 투자 확대 흐름까지 맞물리며 중장기 성장성까지 확보했다는 평가를 받고요. 또 고유가는 향후 고물가를 낳고, 고물가는... "
2026-04-14,네이버뉴스,[진단_건축자재 ②한일시멘트] 이익 줄어도 배당 늘린 전근식·오해근 ...,http://www.newsworker.co.kr/news/articleView.html?idxno=421858,점에서 리스크 요인으로 지적된다. 한일시멘트는 지난 3월 자율공시를 통해 건설경기 변동에 대비해 수익성을 강화하고 환경규제에 대한 대응과 탄소저감 기술 확대 등으로 지속가능성도 챙기겠다고 밝혔다. 또한... 
2026-04-14,네이버뉴스,"이억원 금융위원장 ""중동 불확실성 지속…금융 대응 총력""",http://www.bizwnews.com/news/articleView.html?idxno=133680,"사진=금융위원회  중동발 지정학적 리스크가 재확산되면서 국내 금융당국이 비상 대응 수위를 한층... 그는 정유·석화, 건설, 의료 등 주요 산업과의 연속 간담회를 통해 업계의 금융 애로를 직접 파악하고, 이를 정책에... "
2026-04-14,네이버뉴스,"제일건설, PFV 누적손실 1245억, 2배 확대에 재무건전성 '잠재 리스크' ...",https://www.upkoreanews.kr/news/articleView.html?idxno=98005,시행·시공 일체형 모델…수익 창출 구조이자 리스크 확대 경로 제일건설은 자체 브랜드 '풍경채'를 중심으로 시행과 시공을 동시에 수행하는 사업 방식을 취하고 있다. 이 과정에서 프로젝트 단위로 PFV를 설립하거나... 
2026-04-14,네이버뉴스,"""지어봐야 손해"" 주택경기 전망 60선 추락…중동 전쟁 유탄",https://www.youthdaily.co.kr/news/article.html?no=217365,이러한 지수 급락은 단순한 심리 위축을 넘어 건설업계 전반의 자금 경색과 공사 중단 리스크로 확산할 조짐을 보이고 있다. 특히 자금조달지수가 60선으로 추락한 것은 금융권의 PF 대출 심사가 더욱 까다로워질... 
2026-04-14,네이버뉴스,"경북, 고유가 충격에 ‘복합 대응’",https://www.naeil.com/news/read/585229?ref=naver,"이에 따라 경북도는 26개 도로건설 현장을 긴급 점검하고 자재 수급 상황에 따라 공정 조정과 납품 일정 관리 등 대응에 들어갔다. 자재 확보 현황과 비상 대응체계를 점검하고, 주 1회 정기 점검을 통해 현장 리스크를... "
2026-04-14,네이버뉴스,4월 주택사업경기 25p 급락 … 미분양 누적에 사업 부담 확대,http://www.queen.co.kr/news/articleView.html?idxno=455011,"큰 리스크로 지목된다. 올해 2월 기준 준공 후 미분양 물량은 3만 가구를 넘어섰으며, 이 중 약 86%가 지방에 집중된 것으로 나타났다. 분양이 완료되지 않은 상태에서 공사가 끝난 '악성 미분양'이 늘어나면 건설사의... "
2026-04-14,네이버뉴스,정유사 세금 납부 9개월 유예…석유공사 여신 한도 최대 30억 달러 확대,https://www.ajunews.com/view/20260414121155418,물가·경기 리스크도 확대됐다. 이에 정부는 수급·가격 불안 우려 품목별로 현장을 점검하고 신속 대응에... 원유 수입 정유기업의 관·부가세 납부를 최대 최대 9개월간 유예할 수 있도록 하고 건설자재 가격조사 주기... 
2026-04-14,네이버뉴스,"주요국도 비었다 … 재외공관장 31곳 공석, 與 '지방선거 낙선자 대기실...",https://www.newdaily.co.kr/site/data/html/2026/04/10/2026041000338.html,에너지·투자·방산·건설에서 전략적 의존도가 높다. 쿠웨이트·바레인도 에너지·금융 측면에서 중요한... 그런 국가의 대사 자리가 오랫동안 공석인 것은 이란·이스라엘 긴장 고조와 호르무즈 해협 리스크가 커진... 
2026-04-14,네이버뉴스,"인텔 파운드리 테슬라와 스페이스X 협력으로 '환골탈태' 기회, 삼성전자...",https://www.businesspost.co.kr/BP?command=article_view&num=435657,인텔이 최근 테슬라 및 스페이스X의 세계 최대 반도체 공장 건설 프로젝트 '테라팹' 참여를 발표한 일이... 트레피스는 미국과 중국의 무역 갈등으로 TSMC의 대만 반도체 공장에 지정학적 리스크가 커지며 인텔의 미국 내... 
2026-04-14,네이버뉴스,"정부, 중동발 공사 지연 ‘불가항력’ 인정...건설사 금융부담 완화 기...",https://www.m-economynews.com/news/article.html?no=66433,"책임준공 기한이 연장되면, 기한 미준수에 따른 금융 리스크가 완화돼 건설사의 자금 부담도 줄어들 전망이다. 특히 PF 사업장에서 공기 지연에 따른 연쇄적인 금융 비용 증가 압박이 일부 해소될 수 있다는 분석이다.... "
2026-04-14,네이버뉴스,3선 도전 이철우vs탈환 나선 오중기…경북도지사 대진표 확정 [6∙3의 선...,https://www.segye.com/newsView/20260414510511?OutUrl=naver,"이 후보는 경선 과정에서 제기된 건강 리스크와 네거티브 공세를 정면 돌파했다는 평가다. 지난 3월31일 오후... 주요 공약으로는 에너지 고속도로 건설과 권역별 전략 산업벨트 조성, 현장 중심의 복지 행정 등을... "
2026-04-14,네이버뉴스,"[로펌이슈] 율촌, '전쟁·인플레이션 시대 국제분쟁 대응 전략' 세미나 ...",https://www.newspim.com/news/view/20260414000725,"최근 전쟁과 공급망 불안, 글로벌 인플레이션이 겹치면서 국제거래 및 해외 건설 현장에서 분쟁 위험이... 절차상 리스크 등을 집중적으로 다룰 예정이다. 특히 싱가포르 변호사회(Law Society of Singapore) 부회장이자... "
2026-04-14,네이버뉴스,"""신도시·원도심 잇는다""…안산선 지하화 통합개발 기본계획 본격화",https://www.incheonilbo.com/news/articleView.html?idxno=1320821,"상부 공간이 개발될 것이라는 기대감과 달리, 구체적인 재무적 리스크 관리 방안이 마련되지 않으면 자칫... 김기선 안산시 철도건설교통국장은 14일 시청 제1회의실에서 열린 4월 정례브리핑을 통해 '안산선 철도 지하화... "
2026-04-14,네이버뉴스,"코스피, 중동전쟁 후 한 달 만에 '6000고지'…증권가 ""올해 7500 간다""",https://www.newsworks.co.kr/news/articleView.html?idxno=837714,"반면 건설과 방산 업종은 '기대 기반' 상승의 대표 사례로 꼽힌다. 중동 재건 수요와 지정학 리스크 확대에 따른 수주 기대가 반영되며 각각 88.9%, 52.3% 상승해 코스피 상승률을 크게 웃돌았다. 그럼에도 수익성 개선은... "
2026-04-14,네이버뉴스,"[천안 24시]수출 리스크 줄이고 판로도 넓히고…천안시, 무역보험 지원...",https://www.sisajournal.com/news/articleView.html?idxno=369346,"글로벌 경기 불확실성과 환율 변동성이 커지는 가운데, 수출 대금 미회수와 금융 부담 등 대외 거래 리스크... 시는 국토교통부에 '아산 배방~천안 목천' 국도대체우회도로 개설 사업을 제6차 국도·국지도 건설계획에... "
2026-04-14,네이버뉴스,"[강원 소식] 삼척시, 민생안정·지역경제 회복 총력 … 중동 분쟁 장기...",https://www.ajunews.com/view/20260414110436363,"이와 함께 농자재 수급 불안에 따른 농업 경영 리스크 대응, 어업·산림용 면세유 가격 급등 지원, 대중교통 운영 대책, 건설 자재 수급 문제 등 분야별 대응책도 함께 논의됐다. 쓰레기 종량제 봉투는 향후 3개월간... "
2026-04-14,네이버뉴스,"정부, 석유공사 여신 30억달러 확대…석유화학 기초유분 ‘매점매석 금...",https://biz.heraldcorp.com/article/10716669?ref=naver,"경기 리스크가 확대되는 상황”이라고 진단했다. 이에 따라 정부는 수급 및 가격 불안 우려 품목에 대해 현장... 아스팔트는 공사 시기 조정과 발주 시기 조정 등을 통해 수요 관리를 강화하고, 레미콘 등 건설 자재는 시장... "
2026-04-14,네이버뉴스,"""건설업계 애로 듣는다""…국토부, 중동발 리스크 대응 '전국 릴레이 간...",https://www.newspim.com/news/view/20260414000396,인한 건설업계와 지역 경제 충격을 최소화하기 위해 지방정부와 함께 현장 소통에 나선다. 국토교통부 로고. [사진=국토교통부] 국토교통부는 17일까지 나흘간 전국 권역별 지방정부 및 지역 건설업계와 함께 '중앙... 
