date,source,title,link,description
2026-04-14,네이버뉴스,"건설업계, 중동전쟁 불가항력 인정에 공기 연장 길 열렸다",http://www.opinionnews.co.kr/news/articleView.html?idxno=136729,"현대건설은 지난달 31일 마천4구역 재개발조합에 도급 공사비를 기존 3834억여원에서 6733억여원으로 2899억여원 올려달라는 공문을 보냈다. 3.3㎡당 공사비는 584만원에서 959만원으로 뛰고, 공사 기간도 34개월에서 44개월로... "
2026-04-14,네이버뉴스,"건설업계, 역대급 복합불황에 구조조정 등 떠밀려",https://www.womentimes.co.kr/news/articleView.html?idxno=102185,"현대건설은 지난 3월 은평구 대조1구역 재개발과 서울 송파구 마천4구역 재개발, 강서구 등촌1구역 재건축 사업과 관련해 각 조합에 공사비 증액을 요구했다. 포스코이앤씨에서는 임원 조직의 20%이나 축소하고 사업부를... "
2026-04-14,네이버뉴스,"광주시 ""자체 발전 태양광 에너지로 수돗물 생산""",https://www.seoulfn.com/news/articleView.html?idxno=626479,"이는 지난해 10월 17일 상수도사업본부가 전력효율을 높이기 위해 빛고을시민햇빛발전 사회적협동조합, 현대건설과 함께 체결한 '용연정수장 유휴부지를 활용한 태양광 직접 PPA 발전 협약'으로 이뤄졌다. 협약에 따라... "
2026-04-14,네이버뉴스,"광주시, 전국 최초 태양광발전 에너지로 수돗물 생산",https://www.newstree.kr/newsView/ntr202604140010,"이 사업은 광주 상수도사업본부가 전력효율을 높이기 위해 지난해 10월 빛고을시민햇빛발전사회적협동조합, 현대건설 등과 체결한 '용연정수장 유휴부지를 활용한 태양광 직접 PPA 발전협약'을 체결한 결과다. 광주... "
2026-04-14,네이버뉴스,"광주시, 태양광 전기로 수돗물 생산…전국 최초 '직접 PPA' 도입",https://www.getnews.co.kr/news/articleView.html?idxno=867704,"이번 사업은 지난해 10월 상수도사업본부와 빛고을시민햇빛발전 사회적협동조합, 현대건설이 체결한 '용연정수장 태양광 직접 PPA 발전 협약'에 따라 추진됐다. 이에 따라 발전사업자인 협동조합은 발전소 설치와 운영... "
2026-04-14,네이버뉴스,4월 재개발·재건축 시공자 선정 동향(2026.3.30.~2026.4.26.),https://www.housingherald.co.kr/news/articleView.html?idxno=61406,"그 결과 현대건설, 대우건설, GS건설, DL이앤씨, 롯데건설, 쌍용건설, 제일건설 등 7개사가 참석했다. 오는 5월 22일 입찰을 마감할 예정이며 예정총공사비는 약 3,233억1,084만원이다. 새시공자 선정에 나선 모아타운... "
2026-04-14,네이버뉴스,"대전 지역업체 1분기 하도급 2조 7,120억원 수주",http://www.ccnnews.co.kr/news/articleView.html?idxno=407369,주요 실적으로는 ▲선화3차 주상복합(코오롱글로벌) 364억 원 ▲KT인재개발원 공동주택(계룡건설) 172억 원 ▲도안2지구 2블럭 공동주택(현대건설) 186억 원 ▲도룡동 주상복합(GS건설) 107억 원 등 주요 현장을 중심으로... 
2026-04-14,네이버뉴스,"광주광역시, 태양광발전소로 수돗물 생산… 전국 최초 탄소중립 모델 구...",https://www.industrynews.co.kr/news/articleView.html?idxno=79972,"이는 지난해 10월 17일 상수도사업본부가 전력효율을 높이기 위해 빛고을시민햇빛발전 사회적협동조합, 현대건설과 함께 체결한 '용연정수장 유휴부지를 활용한 태양광 직접 PPA 발전 협약'으로 이뤄졌다. 협약에 따라... "
2026-04-14,네이버뉴스,"대전시 ""1분기 지역업체 하도급 총 수주액 2조7120억 원""",http://www.chungnamilbo.co.kr/news/articleView.html?idxno=883357,"주요 실적으론 선화3차 주상복합(코오롱글로벌) 364억 원, KT인재개발원 공동주택(계룡건설) 172억 원, 도안2지구 2블럭 공동주택(현대건설) 186억 원, 도룡동 주상복합(GS건설) 107억 원 등 주요 현장을 중심으로 지역업체의... "
2026-04-14,네이버뉴스,"압구정5구역 '문건 촬영' 논란 장기화…업계 ""단순 절차 문제 넘은 전략...",http://www.newstnt.com/news/articleView.html?idxno=606669,이처럼 조합과 인허가청의 판단이 일단락됐음에도 현대건설 측의 문제 제기가 이어지는 양상을 보이자 시장에서는 그 이면에 다른 수주 전략이 깔려있다는 분석이 제기된다. 가장 먼저 거론되는 것은 제안 조건... 
2026-04-14,네이버뉴스,"광주시, 자체 태양광 시설로 수돗물 생산...예산 절감 효과는 미미",http://www.yonhapnewstv.co.kr/AKR20260414135110RAX,"이 사업은 빛고을시민햇빛발전 사회적협동조합·현대건설 등과 체결한 민관 협약을 통해 추진됐으며, 발전 사업자가 생산한 전력을 한전을 거치지 않고 직접 구매하는 방식을 적용했습니다. 이에 따라 송·배전망을... "
2026-04-14,네이버뉴스,"집 짓던 건설사, AI 인프라로 확장…데이터센터 '사업모델 전환' 본격화",http://www.hansbiz.co.kr/news/articleView.html?idxno=832699,"14일 건설업계에 따르면 대우건설, GS건설, 삼성물산, 현대건설 등 주요 건설사들은 최근 데이터센터 사업 확대에 속도를 내며 각사별 전략을 구체화하고 있다. 단순 시공을 넘어 투자와 개발, 운영까지 아우르는... "
2026-04-14,네이버뉴스,"광주시, 태양광 발전 에너지로 수돗물 생산…전국 최초",https://www.kmib.co.kr/article/view.asp?arcid=0029677411&code=61121111&cp=nv,"앞서 지난해 10월 광주시 상수도사업본부는 전력효율을 높이기 위해 빛고을시민햇빛발전 사회적협동조합, 현대건설과 함께 체결한 ‘용연정수장 유휴부지를 활용한 태양광 직접 PPA 발전 협약’을 체결했다. 협약에... "
2026-04-14,네이버뉴스,1년 새 7억 쑥…대치 학원가 옆 38년 된 강남 '이 단지'서 무슨일이,https://realty.chosun.com/site/data/html_dir/2026/04/14/2026041402475.html,"최근 열린 현장설명회에는 대우건설, 현대건설, GS건설, DL이앤씨, 롯데건설, 쌍용건설, 제일건설 등 주요 건설사들이 대거 참석했다. 정비계획에는 단순한 주거시설을 넘어 교육·커뮤니티 기능 강화 방안도 포함됐다.... "
2026-04-14,네이버뉴스,"광주, 전국 최초 '태양광 수돗물' 시대 열었다… 용연정수장 탄소중립 ...",https://www.aitimes.com/news/articleView.html?idxno=209192,"사업은 지난해 10월17일 광주 상수도사업본부와 빛고을시민햇빛발전 사회적협동조합, 현대건설이 체결한 용연정수장 유휴부지를 활용한 태양광 직접 PPA 발전 협약을 바탕으로 추진됐다. 협약에 따라 세 기관은... "
2026-04-14,네이버뉴스,태양광 에너지로 수돗물 생산...전국 최초 탄소중립 모델 갖춰,https://www.ajunews.com/view/20260414114624415,빛고을시민햇빛발전 사회적협동조합과 현대건설이 참여해 민관 협약으로 이 사업을 추진했다. 발전사업자가 생산한 전력을 한국전력공사를 거치지 않고 직접 구매하는 방식을 적용해 계통 안정성과 전력 효율성을... 
2026-04-14,네이버뉴스,"희망퇴직 받고 조직 줄이고 … 건설업계, 유동성 개선 안간힘",https://biz.newdaily.co.kr/site/data/html/2026/04/14/2026041400138.html,시공능력평가 10위권 건설사인 △삼성물산 건설부문 △현대건설 △대우건설 △DL이앤씨 △GS건설 △현대엔지니어링 △포스코이앤씨 △롯데건설 △SK에코플랜트 △IPARK현대산업개발의 지난해 미청구공사비 총액은... 
2026-04-14,네이버뉴스,"“현대건설, 원전 모멘텀 타고 건설업종 주도주 될 것”",https://weekly.donga.com/3/all/11/6183322/1,신한투자증권 “복정역세권 사업으로 국내 매출도 점진적 회복 전망” 현대건설이 해외 원전 모멘텀과 국내 매출 증대 등에 힘입어 건설업종 주도주 자리를 되찾을 것이라는 전망이 나왔다. 김선미 신한투자증권... 
2026-04-14,네이버뉴스,"광주시, 자체 태양광으로 수돗물 생산…전국 첫 사례",https://www.newspim.com/news/view/20260414000584,"이번 사업은 상수도사업본부와 빛고을시민햇빛발전 사회적협동조합, 현대건설이 지난해 10월 체결한 '용연정수장 유휴부지 태양광 직접 PPA 발전 협약'에 따라 추진됐다. 협약에 따라 세 기관은 2035년까지 10년간... "
2026-04-14,네이버뉴스,"광주시, 자체 발전 에너지로 수돗물 생산",http://www.siminsori.com/news/articleView.html?idxno=316797,"이번 사업은 지난해 10월 상수도사업본부와 빛고을시민햇빛발전 사회적협동조합, 현대건설이 체결한 '용연정수장 유휴부지 활용 태양광 직접 PPA 발전 협약'에 따라 추진됐다. 협약에 따라 세 기관은 2035년까지 10년간... "
2026-04-14,네이버뉴스,"광주시, 전국 첫 자체 태양광 활용 수돗물 생산…탄소중립 모델 구축",https://www.newsworks.co.kr/news/articleView.html?idxno=837698,"구체적으로는 지난해 10월 빛고을시민햇빛발전 사회적협동조합, 현대건설과 함께 체결한 협약을 토대로 사업이 추진됐다. 협동조합은 발전사업자로서 태양광발전소의 설치와 유지관리를 맡아 전기를 생산한다. 주목할... "
2026-04-14,네이버뉴스,"건설업종, 코스피 수익률 11%p 상회… 서울 아파트값 63주 연속 '고공행...",http://www.newstnt.com/news/articleView.html?idxno=606613,"현대건설(000720)은 4월 말 미국 페르미 마타도르 FEED 종료 후 EPC 협상을 앞두고 있으며, 미국 홀텍 SMR 수주도 가시권에 들어왔다. 대우건설(047040) 역시 체코 원전 계약 마무리를 앞두고 있고, 베트남 신규 원전... "
2026-04-14,네이버뉴스,"광주 용연정수장, 태양광 전기로 수돗물 만든다",https://www.asiatoday.co.kr/view.php?key=20260414010004134,"이번 사업은 지난해 10월17일 상수도사업본부가 전력효율을 높이기 위해 빛고을시민햇빛발전 사회적협동조합, 현대건설과 함께 체결한 '용연정수장 유휴부지를 활용한 태양광 직접 PPA 발전 협약'으로 이뤄졌다. 협약에... "
2026-04-14,네이버뉴스,"광주시, 전국 첫 자체 발전 에너지로 수돗물 생산",https://biz.heraldcorp.com/article/10716635?ref=naver,"이는 지난해 10월17일 상수도사업본부가 전력효율을 높이기 위해 빛고을시민햇빛발전 사회적협동조합, 현대건설과 함께 체결한 ‘용연정수장 유휴부지를 활용한 태양광 직접 PPA 발전 협약’으로 이뤄졌다. 협약에... "
2026-04-14,네이버뉴스,"광주시, 전국 최초 태양광에너지로 수돗물 생산 '유레카'",https://www.tournews21.com/news/articleView.html?idxno=133649,"시는 빛고을시민햇빛발전 사회적협동조합, 현대건설과 함께 동구 용연정수장에서 오는 2035년까지 10년간 '태양광 발전사업(빛고을시민 용연PPA 햇빛발전소)'을 진행하며 직접전력거래계약(직접 PPA) 방식으로 수돗물을... "
2026-04-14,네이버뉴스,중동 리스크 없는 후분양 오피스텔 '힐스테이트 안양펠루스' 분양,http://www.ikld.kr/news/articleView.html?idxno=332818,◆ 현대건설 시공 완료된 브랜드 후분양 프리미엄 수도권에서 이미 공사가 완료된 후분양 단지가 눈길을 끌고 있다. 현대건설이 시공한 '힐스테이트 안양펠루스'가 바로 그 주인공으로 현재 성황리 분양 중이다.... 
2026-04-14,네이버뉴스,"광주시, 태양광 전력으로 수돗물 생산…전국 첫 '직접 PPA' 모델",https://news.dealsitetv.com/articles/168595,"이번 사업은 지난해 10월 빛고을시민햇빛발전 사회적협동조합, 현대건설과 체결한 ‘용연정수장 유휴부지 활용 태양광 직접 PPA 발전 협약’에 따라 추진됐다. 협약에 따라 빛고을시민햇빛발전 사회적협동조합은... "
2026-04-14,네이버뉴스,"현대건설, '더 써클' 상표권 출원… 신사업 브랜드 선점 나서",https://it.chosun.com/news/articleView.html?idxno=2023092160308,"현대건설이 최근 상표권 출원을 확대하며 브랜드 경쟁력 지위 확보에 공들이고 있다. 건설사들이 건축부터 입주민 서비스까지 신사업을 추가하는 트렌드에 발맞춰 다양한 서비스를 선보이고, 수주 등에서 브랜드... "
2026-04-14,네이버뉴스,"광주광역시, 전국 최초 자체 태양광 발전 에너지로 수돗물 생산",http://www.fnnews.com/news/202604141025392963,"상수도사업본부는 앞서 전력 효율을 높이고자 지난해 10월 17일 빛고을시민햇빛발전 사회적협동조합, 현대건설과 함께 '용연정수장 유휴부지를 활용한 태양광 직접 PPA 발전 협약'을 체결했다. 협약에 따라 세 기관은... "
2026-04-14,네이버뉴스,"""전기는 직접 쓰는 시대""…광주시, 수돗물 생산에 태양광 접목",https://www.thefairnews.co.kr/news/articleView.html?idxno=74292,"이번 사업은 지난해 10월 상수도사업본부와 빛고을시민햇빛발전 사회적협동조합, 현대건설이 체결한 민관 협약을 기반으로 추진됐다. 협약에 따라 발전소 설치와 운영은 시민 참여형 협동조합이 맡고, 광주시는 부지를... "
2026-04-14,네이버뉴스,"광주시, 태양광 전력 활용 '탄소중립 수돗물' 전국 첫 도입",https://www.sidae.com/article/2026041410074170010,"이번 사업은 지난해 10월17일 상수도사업본부가 전력효율을 높이기 위해 빛고을시민햇빛발전 사회적협동조합, 현대건설과 함께 체결한 '용연정수장 유휴부지를 활용한 태양광 직접 PPA 발전 협약'으로 이뤄졌다. 협약에... "
2026-04-14,네이버뉴스,"광주시, 전국 최초 자체 발전 태양광에너지 활용 수돗물 생산 실현",https://www.joongdo.co.kr/web/view.php?key=20260415010004166,"이 결과는 2025년 10월 17일 상수도사업본부가 전력효율을 제고하기 위해 빛고을시민햇빛발전 사회적협동조합, 현대건설과 함께 체결한 '용연정수장 유휴부지를 활용한 태양광 직접 PPA 발전 협약'으로 이뤄졌다. 세... "
2026-04-14,네이버뉴스,"광주시, 전국 최초 자체 발전 에너지로 수돗물 생산",https://www.etnews.com/20260414000109,"이는 지난해 10월17일 상수도사업본부가 전력효율을 높이기 위해 빛고을시민햇빛발전 사회적협동조합, 현대건설과 함께 체결한 '용연정수장 유휴부지를 활용한 태양광 직접 PPA 발전 협약'으로 이뤄졌다. 협약에 따라... "
2026-04-14,네이버뉴스,"광주시, 태양광 전력으로 수돗물 생산…전국 첫 탄소중립 모델 구축",https://news.tvchosun.com/site/data/html_dir/2026/04/14/2026041490076.html,"이번 사업은 빛고을시민햇빛발전 사회적협동조합과 현대건설 등이 참여한 민관 협약을 통해 추진됐다. 발전사업자가 생산한 전력을 한국전력을 거치지 않고 직접 구매하는 방식이 적용됐고, 배전망을 통하지 않아 계통... "
2026-04-14,네이버뉴스,"대전시, 2026년 1분기 지역업체 하도급 2조7000억 수주…건설경기 활성화...",https://www.etnews.com/20260414000096,"주요 실적으로 선화3차 주상복합(코오롱글로벌) 364억원, KT인재개발원 공동주택(계룡건설) 172억원, 도안2지구 2블럭 공동주택(현대건설) 186억원, 도룡동 주상복합(GS건설) 107억원 등 주요 현장을 중심으로 지역업체... "
2026-04-14,네이버뉴스,"'AI·에너지·하이엔드'...건설업계, 미래 인프라 및 고부가가치 시장 공...",http://www.dailypop.kr/news/articleView.html?idxno=98012,"사진=대우건설 장성파인데이터센터 조감도 현대·삼성, 글로벌 '에너지 영토' 확장과 기술 고도화 주력 에너지 인프라 분야에서는 현대건설과 삼성물산 건설부문의 글로벌 행보가 두드러진다. 현대건설은 핀란드와... "
2026-04-14,네이버뉴스,"분양 '파죽지세' 롯데건설, 르엘로 쓰는 하이엔드 '성공 방정식'",https://www.mediapen.com/news/view/1093123,"또 부동산 플랫폼 다방이 전국 10~50대 남녀 1만6048명을 대상으로 실시한 '2026 하이엔드 아파트 브랜드 선호도' 조사에서 DL이앤씨 '아크로', 현대건설 '디에이치'에 이어 3위를 차지했다. 롯데건설은 이러한 브랜드... "
2026-04-14,네이버뉴스,압구정5구역 '문건 촬영 논란'…입찰 무효 사유 판단 엇갈려,https://www.safetynews.co.kr/news/articleView.html?idxno=247616,지난 10일 압구정5구역 시공자 입찰 마감 과정에서 DL이앤씨 직원이 현대건설의 제안서를 촬영했다는 의혹이 제기됐다. 이에 현대건설은 강하게 항의하며 원칙적인 책임 소재를 묻고 나섰으나 입찰 절차 중단을 요구한 것은... 
2026-04-14,네이버뉴스,"광주시, 태양광으로 수돗물 만든다…전국 첫 '직접 PPA' 도입",https://www.namdonews.com/news/articleView.html?idxno=907389,"이번 사업은 지난해 10월 상수도사업본부와 빛고을시민햇빛발전 사회적협동조합, 현대건설이 체결한 '용연정수장 유휴부지를 활용한 태양광 직접 PPA 발전 협약'에서 출발했다. 세 기관은 오는 2035년까지 10년간... "
2026-04-14,네이버뉴스,"광주광역시, 전국 최초 자체 발전 에너지로 수돗물 생산한다",https://www.dailysportshankook.co.kr/news/articleView.html?idxno=427428,"이는 지난해 10월17일 상수도사업본부가 전력효율을 높이기 위해 빛고을시민햇빛발전 사회적협동조합, 현대건설과 함께 체결한 '용연정수장 유휴부지를 활용한 태양광 직접 PPA 발전 협약'으로 이뤄졌다. 협약에 따라... "
2026-04-14,네이버뉴스,"광주시, 태양광 전기로 수돗물 생산…전국 첫 탄소중립 상수도 모델",https://www.viva100.com/article/20260414500169,"이번 사업은 빛고을시민햇빛발전 사회적협동조합, 현대건설과의 협약을 바탕으로 추진됐다. 협동조합은 3억4000만 원을 들여 1442㎡ 부지에 발전소를 설치·운영하고, 상수도사업본부는 부지를 제공하며 생산 전력을... "
2026-04-14,네이버뉴스,"대전시, 지역업체 하도급 참여율 ‘양호’",https://biz.heraldcorp.com/article/10716460?ref=naver,주요 실적으로는 ▷선화3차 주상복합(코오롱글로벌) 364억원 ▷KT인재개발원 공동주택(계룡건설) 172억원 ▷도안2지구 2블럭 공동주택(현대건설) 186억원 ▷도룡동 주상복합(GS건설) 107억원 등 주요 현장을 중심으로... 
2026-04-14,네이버뉴스,태양광 활용해 수돗물 생산…광주상수도본부 직접전력거래 구축,https://www.newsis.com/view/NISX20260414_0003589904,"광주상수도사업본부는 태양광 에너지를 활용해 수돗물을 생산하기 위해 지난해 10월17일 빛고을시민햇빛발전 사회적협동조합, 현대건설 등과 ' ‘용연정수장 유휴부지를 활용한 태양광 직접PPA 발전 협약'을 맺었다.... "
2026-04-14,네이버뉴스,"대전, 건설 침체 속 ‘지역 하도급 확대’…1분기 2.7조 수주",https://cc.newdaily.co.kr/site/data/html/2026/04/14/2026041400036.html,주요 실적으로는 △선화3차 주상복합(코오롱글로벌) 364억 원 △KT인재개발원 공동주택(계룡건설) 172억 원 △도안2지구 2블럭 공동주택(현대건설) 186억 원 △도룡동 주상복합(GS건설) 107억 원 등 대형 현장을 중심으로... 
2026-04-14,네이버뉴스,"[뉴스+]""살아남고 봐야된다""…건설업계, 인력 감축·선별 수주 '위기경영...",https://www.businessplus.kr/news/articleView.html?idxno=110561,"현대건설은 최근 서울 은평구 대조1구역 재개발, 송파구 마천4구역 재개발, 강서구 등촌1구역 재건축 조합 등에 공사비 증액을 요청하는 공문을 보냈다. 공사비를 올려주지 않으면 공사를 중단하거나 지연할 수밖에 없다는... "
2026-04-14,네이버뉴스,"광주시, 자체 발전 태양광 에너지로 수돗물 생산…전국 최초",https://www.news1.kr/local/gwangju-jeonnam/6135347,"이는 지난해 10월 17일 상수도사업본부가 전력효율을 높이기 위해 빛고을시민햇빛발전 사회적협동조합, 현대건설과 함께 체결한 '용연정수장 유휴부지를 활용한 태양광 직접 PPA 발전 협약'으로 이뤄졌다. 협약에 따라... "
2026-04-14,네이버뉴스,"대전시 ""1분기 지역업체 하도급 2조 7120억원 수주""",http://www.fnnews.com/news/202604140838021738,주요 실적별로는 △선화3차 주상복합(코오롱글로벌) 364억 원 △KT인재개발원 공동주택(계룡건설) 172억 원 △도안2지구 2블럭 공동주택(현대건설) 186억 원 △도룡동 주상복합(GS건설) 107억 원 등 주요 현장을 중심으로... 
2026-04-14,네이버뉴스,"중동전쟁 와중에 삼성E&A·현대·GS·대우건설, 쿠웨이트 LNG 프로젝트 입...",https://www.theguru.co.kr/news/article.html?no=100512,"삼성E&A, 현대건설, GS건설, 대우건설 등이 물망에 오른다. 14일 쿠웨이트 현지 매체에 따르면 쿠웨이트 공공입찰중앙청(CAPT)은 국영 석유회사 KIPIC가 신청한 알주르 LNG 터미널 내 LNG 재액화 설비 사업의 시행을 위한... "
2026-04-14,네이버뉴스,대전 지역업체 하도급 1분기 2조 7120억원 수주,https://www.sedaily.com/article/20032062?ref=naver,주요 실적으로는 △선화3차 주상복합(코오롱글로벌) 364억 원 △KT인재개발원 공동주택(계룡건설) 172억 원 △도안2지구 2블럭 공동주택(현대건설) 186억 원 △도룡동 주상복합(GS건설) 107억 원 등 주요 현장을 중심으로... 
2026-04-14,네이버뉴스,"포스코이앤씨, 반포서 ‘잭팟’…삼성물산과 수주전 판세 흔드나",https://www.smarttoday.co.kr/ko-kr/articles/106454,"삼성물산은 시공능력평가 12년 연속 1위에, 지난해 도시정비사업 수주액 9조 원 이상을 기록하며 현대건설과 양강체제를 굳히고 있다. 신반포 19·25차 통합재건축 포스코이앤씨 조감도 반면 포스코이앤씨는 이번... "
2026-04-14,네이버뉴스,"“기본급 30개월치 위로금 줄테니 짐 싸달라”…벼랑 끝 건설사, 줄줄이...",https://www.sedaily.com/article/20032055?ref=naver,"DL이앤씨가 847명으로 감소 폭이 가장 컸고, GS건설 487명, 대우건설 357명, 현대건설 247명 순이었다. 현대엔지니어링과 포스코이앤씨 등 시공능력 상위권 대형사들도 희망퇴직을 검토하거나 임원 수를 줄이는 등 조직... "
2026-04-14,네이버뉴스,13조원 '큰 장'…핵심 정비사업지 시공사 선정 '분수령' [한강벨트 수주...,https://www.sisaon.co.kr/news/articleView.html?idxno=200173,공사비만 5조5610억원에 달하는 압구정3구역 재건축은 현대건설의 '무혈입성' 가능성이 한층 높아진 분위기다. 지난 10일 마감된 1차 입찰에서 현대건설이 단독으로 참여하면서 유찰됐기 때문이다. 이 사업은 압구정동... 
2026-04-14,네이버뉴스,[대전소식]대표음식 전면 개편...빵·칼국수·두부두루치기 외,https://daily.hankooki.com/news/articleView.html?idxno=1357789,주요 실적으로는 △선화3차 주상복합(코오롱글로벌) 364억 원 △KT인재개발원 공동주택(계룡건설) 172억 원 △도안2지구 2블럭 공동주택(현대건설) 186억 원 △도룡동 주상복합(GS건설) 107억 원 등 주요 현장을 중심으로... 
2026-04-14,네이버뉴스,"[리브랜딩 혁신] 'IPARK' 앞세운 이유… 건설사, ""브랜드가 곧 회사""",http://www.seoulwire.com/news/articleView.html?idxno=716562,현대건설은 국민 브랜드인 '힐스테이트'와 함께 하이엔드 브랜드 '디에이치(THE H)'를 통해 강남권과 주요 재건축 시장에서 입지를 강화하고 있다. 특히 디에이치는 세계적인 건축가 협업과 단지별 특화 설계를 앞세워... 
2026-04-14,네이버뉴스,"삼성물산, 강남 대치쌍용1차 재건축 시공권 확보",https://www.megaeconomy.co.kr/news/newsview.php?ncode=1065590970312075,삼성물산 건설부문(이하 삼성물산)은 서울 강남구 대치동 대치쌍용1차 재건축 사업의 시공사로 최종 선정됐다고 밝혔다. 대치쌍용1차 재건축 조합에 따르면 지난 11일 총회를 열고 삼성물산을 시공사로 선정하는... 
2026-04-14,네이버뉴스,"삼성물산, 히타치 에너지와 사업 협력 확대",https://www.arunews.com/news/articleView.html?idxno=61569,삼성물산 건설부문은 지난 13일 스위스 취리히에 위치한 히타치 에너지(Hitachi Energy) 본사에서 히타치 에너지와 유럽 지역의 전력망 사업 협력에 대한 업무협약(MOU)을 체결했다고 14일 밝혔다. 이날 행사에는... 
