date,source,title,link,description
2026-07-14,네이버뉴스,"안양노사민정협의회, 폭염 속 명학역 산업단지서 ‘안전 일터’ 온열질...",https://www.kyeonggi.com/article/20260714580353,"아니라 건설 현장의 붕괴, 침수, 감전 등 풍수해로 인한 2차 산업재해 예방에도 각별히 유의해 줄 것을 현장 관리자들에게 강력히 당부했다. 최대호 안양시장은 “중대재해를 원천 차단하기 위한 사업장별 위험성평가... "
2026-07-15,네이버뉴스,"동국제강, 기대 이상 실적에도 '저평가'…""조선향 후판과 대형건설사향...",http://www.newsprime.co.kr/news/article.html?no=740364,"이어 ""건설 경기 부진에도 불구하고 공격적인 영업전략과 수출 확대에 힘입어 봉형강 판매량이 지난해 동기 대비 9.0% 늘어난 75만1000톤 수준으로 회복된 것으로 추정된다""며 ""중국산 수입 규제 강화로 후판 또한 같은... "
2026-07-15,네이버뉴스,"'30% 빠진 삼성전자'…KB증권 ""지금은 AI가 아닌 공포가 만든 조정""",https://magazine.hankyung.com/money/article/202607155689c,KB증권은 최근 미국 연방에너지규제위원회(FERC)가 AI 데이터센터 건설의 최대 병목 요인으로 지목됐던 전력망 연결 절차를 패스트트랙 방식으로 간소화하면서 기존 5년 이상 소요되던 연결 기간이 1~2년 수준으로... 
2026-07-15,네이버뉴스,"KB證 ""삼성전자 급락은 과도한 우려 때문…오히려 매수 기회""",https://www.newsis.com/view/NISX20260715_0003709559,"김 연구원은 ""최근 미국 연방에너지규제위원회(FERC)는 AI 데이터센터 건설의 최대 병목 요인이었던 전력망 연결 절차를 패스트 트랙으로 간소화해 기존 5년 이상 소요되던 전력망 연결 기간은 향후 1~2년 수준으로... "
2026-07-15,네이버뉴스,"美와 무역분쟁 韓기업, 트럼프 가족 기업에 30억원 제공, '이해충돌' 논...",http://www.fnnews.com/news/202607150735057331,"코리아알루미늄은 건설회사인 까뮤이앤씨의 자회사이며, 베이스그룹은 까뮤이앤씨의 지배지분을 보유한... 역시 규제 연장 및 관세 인상 가능성에 무게를 두고 있는 것으로 전해졌다. 현재까지 트럼프 대통령이나 그의... "
2026-07-15,네이버뉴스,"“30% 빠진 삼성전자, 변한 건 없다…오히려 매수 기회”",https://www.mk.co.kr/article/12098846,KB증권은 최근 미국 연방에너지규제위원회(FERC)가 AI 데이터센터 건설의 병목으로 꼽히던 전력망 연결 절차를 패스트 트랙으로 간소화하면서 데이터센터 구축 속도가 기존보다 두 배 이상 빨라질 것으로 전망했다.... 
2026-07-15,네이버뉴스,"KB證 “삼성전자, 변한 것은 없다⋯AI 인프라 성장 방향성 유효”",https://www.etoday.co.kr/news/view/2603791,최근 미국 연방에너지규제위원회(FERC)는 AI 데이터센터 건설의 최대 병목 요인으로 꼽혔던 전력망 연결 절차를 패스트트랙으로 간소화했다. 이에 따라 기존 5년 이상 걸리던 전력망 연결 기간은 향후 1~2년 수준으로... 
2026-07-15,네이버뉴스,"美 뉴욕주, AI데이터센터 건설 1년간 금지…""공공요금 인상 위협""",https://view.asiae.co.kr/article/2026071507543143720,데이터센터가 건설되는 것에 반대하고 있다. 이미 여러 주에서 데이터센터의 환경영향 규제를 위한 법안을 발의했다. 미국 빅테크 기업들도 주정부들의 규제 압박이 커질 것으로 예상되면서 지역주민들에 대한 혜택... 
2026-07-15,네이버뉴스,"""삼성전자 달라진 것 없다…최근 조정은 매수 기회""-KB",https://www.hankyung.com/article/2026071556256,최근 미국 연방에너지규제위원회 (FERC)가 AI 데이터센터 건설의 최대 병목 요인이었던 전력망 연결 절차를 패스트트랙으로 간소화했기 때문이다. 기존 5년 이상 소요되던 전력망 연결 기간은 향후 1~2년 수준으로 단축될... 
2026-07-15,네이버뉴스,[오늘의 국회일정] 15일(수),https://www.newscj.com/news/articleView.html?idxno=3417101,"경쟁제한적 규제 개선을 위한 정책 세미나(의원회관 제11간담회의실) 14:00 김대식 의원실... K-우주항공·복합도시건설 특별법 제정 토론회(의원회관 제1소회의실) 15:00 박주민 의원실, 5선 오세훈 시장에게 고함... "
2026-07-15,네이버뉴스,"KB證 “SK하이닉스, 최소 2028년까지 메모리 공급 부족… 과도한 우려는...",https://biz.chosun.com/stock/stock_general/2026/07/15/NF5NHS5R2ZBBRAYAJKVRZGNSCE/?utm_source=naver&utm_medium=original&utm_campaign=biz,AI 데이터센터 건설 속도 역시 두 배 이상 빨라질 것으로 예상했다. 이 연구원은 “미국 연방에너지규제위원회(FERC)가 전력망 연결 절차 간소화를 패스트 트랙으로 승인하면서 기존 5년 이상 소요되던 전력망 연결... 
2026-07-15,네이버뉴스,"물 부족·전기료 급등 우려…뉴욕주, AI 데이터센터 건설 1년 유예",https://www.mt.co.kr/world/2026/07/15/2026071507173787617,"갈등은 뉴욕주뿐 아니라 다른 지역에서도 벌어지고 있다. 파이낸셜타임스(FT)에 따르면 조지아, 미시간, 펜실베이니아 등 최소 14개 주에서 데이터센터 건설 규제 또는 일시 중단과 관련한 법안과 제도 도입을 검토하고 있다."
2026-07-15,네이버뉴스,"K-철강 미래 먹거리 된 AI 데이터센터…포스코, '신수요' 선점 나선다",http://www.economytalk.kr/news/articleView.html?idxno=422726,14개월 만의 철강 수출 반등…美 데이터센터 건설 붐 덕분 최근 산업통상자원부 발표에 따르면 지난 6월... 이런 보호무역 기조는 중국산 저가 제품 유입을 억제하는 동시에 한국 철강업계에도 주요 시장의 통상 규제... 
2026-07-15,네이버뉴스,"성장률 3% 전망, 경향신문 ""고용 해결 못하면 '빛 좋은 개살구'""",https://www.mediatoday.co.kr/news/articleView.html?idxno=335783,반도체 산업의 고용 창출 효과가 크지 않은 데다 건설 등 반도체 이외 산업 부진이 이어지고 있는 영향으로... 동아일보 역시 규제 혁파와 구조 개혁을 통해 경제 체질 전반을 개선하는 데 국가 역량을 총동원해야... 
2026-07-15,네이버뉴스,"뉴욕주, 첫 AI데이터센터 1년 중단…전기료 68% 폭등",https://www.wikitree.co.kr/articles/1146473,최소 10여 개 주에서 모라토리엄이 논의됐지만 대부분 큰 진전을 보지 못했다.뉴욕주 의회 역시 독자적인 규제를 추진해왔다. 지난달 20메가와트를 초과하는 데이터센터 건설을 1년간 멈추는 법안이 주 의회를... 
2026-07-15,네이버뉴스,"""고점대비 36% 폭락, 지금 사라""…420만닉스 뚝심 지킨 이유는",https://www.edaily.co.kr/news/newspath.asp?newsid=02469846645514848,그는 “미국 연방에너지규제위원회(FERC)가 AI 데이터센터 건설의 최대 병목이었던 전력망 연결 절차 간소화를 패스트트랙으로 승인하면서 기존 5년 이상 걸리던 전력망 연결 기간이 1~2년 수준으로 단축될 전망”... 
2026-07-15,네이버뉴스,"[오늘의 주요일정·15일] 민주노총, 7·15 총파업대회",https://www.safetimes.co.kr/news/articleView.html?idxno=244227,"경쟁제한적 규제 개선을 위한 정책 세미나(14:00 의원회관 제11간담회의실) 김대식 의원실... 복합도시건설 특별법 제정 토론회(14:00 의원회관 제1소회의실) 박주민 의원실, 5선 오세훈 시장에게 고함: 오세훈 5기... "
2026-07-15,네이버뉴스,서민용 주택 빌라·오피스텔 공급 감소…“제도 불확실성 제거해야”,https://www.sedaily.com/article/20067795?ref=naver,정작 건설 현장에서는 대출 제약으로 이미 착공을 준비하던 사업조차 멈춰선 상태라고 지적했다. 그는 “규제지역으로 묶이며 담보인정비율(LTV)이 축소된 것이 핵심 원인”이라며 “정부가 마련하겠다고 밝힌 비아파트... 
2026-07-15,네이버뉴스,[중국 D램 CXMT 해부] ③주이밍 손에서 탄생한 '설계+제조 양대 축',https://www.newspim.com/news/view/20260714001016,"이를 위해 허페이시의 대규모 투자와 정책 지원을 바탕으로 생산라인을 건설했고, 독일 메모리 제조사... 특히 미국의 대중국 반도체 규제가 강화되는 상황에서 이러한 변화의 의미는 더욱 커지고 있다. 첨단... "
2026-07-15,네이버뉴스,"물·전기 먹는 하마…뉴욕주, 데이터센터 건설 1년간 금지",https://www.edaily.co.kr/news/newspath.asp?newsid=02417366645514848,데이터센터 건설을 1년간 금지할 예정이다. 14일(현지시간) 캐시 호컬 뉴욕주지사는 성명을 통해 이 같은... 이에 정치권과 규제당국은 데이터센터 산업의 급격한 성장세를 어떻게 관리할지를 놓고 고심하고 있다.... 
2026-07-15,네이버뉴스,AI 투자 7000억 달러의 부메랑… 글로벌 물가·전기료 밀어 올린다,https://www.g-enews.com/view.php?ud=202607150638071334fbbec65dfb_1,빅테크 기업의 데이터센터 건설 광풍으로 반도체와 전력 수요가 폭증하면서 전자제품 가격과 전기요금이... 규제 장벽 넘는 전력 수요… 중장기 요금 인상 압박 데이터센터가 집어삼키는 막대한 전력은 인프라 투자... 
2026-07-15,네이버뉴스,[롯데 반등을 위한 질문④] 2554억원 더 넣는 롯데바이오…이제는 수주...,https://www.ngetnews.com/news/articleView.html?idxno=551529,"조달 자금은 인천 송도 바이오캠퍼스 제1공장 건설과 상업 생산 준비에 투입한다. 이번 증자는 송도... 품질관리 기록과 규제기관 대응 경험, 납기 준수 능력, 공급 안정성을 함께 평가한다. 롯데바이오로직스는 시러큐스... "
2026-07-15,네이버뉴스,"이 대통령 ""3·4·5 도약 원년 되게 힘 모아달라""",https://www.labortoday.co.kr/news/articleView.html?idxno=235702,"또 충청권은 광대역폭메모리(HBM) 팹(온양·천안) 건설 등 156조원 투자로 패키징 거점화, 영남권은 기존 산업... 재정·규제 영역에서 혁신도 속도를 내야 한다""고 강조했다. 이어 ""이번 하반기에 우리가 어떤 성과를... "
2026-07-15,네이버뉴스,부동산 공급 첫 국민 토론회… “현실에 맞는 규제 완화·혁신적 정책 필...,https://www.dnews.co.kr/uhtml/view.jsp?idxno=202607141531534470153,"참석한 전문가와 시민들은 공급 확대를 위해 “현실에 맞는 규제 완화와 혁신적인 정책이 필요하다”는... JD종합건설 대표이사, 김용진 대한토지신탁 리츠1본부장, 최하은 민달팽이유니온 활동가 등이 패널로 참석했다.... "
2026-07-15,네이버뉴스,장벽 뒤에 숨은 美 자동차 산업… 정치적 빗장에 막힌 ‘역기술 이전’...,https://www.g-enews.com/view.php?ud=202607142319448620c8c1c064d_1,실제 도널드 트럼프 대통령은 중국 완성차 업체들이 미국 영토 내에 팩토리를 건설하도록 유도하겠다는... 바이든 행정부 말기 확정되어 트럼프 행정부가 가동한 상무부의 ‘커넥티드 차량 규제(Connected Vehicle Rule)... 
2026-07-15,네이버뉴스,"AI로 진단하고 톡신으로 성장…대웅제약, 종합 헬스케어 도약",https://www.ngetnews.com/news/articleView.html?idxno=551501,주요 규제기관의 허가를 확보하며 핵심 수출 품목으로 자리 잡았다. 2019년부터 지난해까지 연평균 57... 현재 2027년 가동을 목표로 톡신 전용 신공장을 건설하고 있다. 공장이 완공되면 연간 생산 능력은 기존... 
2026-07-15,네이버뉴스,"[설계 오독, 시공 오류 해법은]③서울시 ‘One-PMIS’ 재구축 시급… “...",https://www.dnews.co.kr/uhtml/view.jsp?idxno=202607141406414390115,게 건설 IT 업계의 지적이다. 이에 서울시 도시기반시설본부(도기본)은 시스템 고도화의 필요성을 인지하고 지난해 1월부터 준비해 왔다. 도기본은 당시 ‘불필요한 규제 개선 및 철폐’ 과제 10가지 중 핵심 과제로... 
2026-07-15,네이버뉴스,"학생부 매매는 금지, 대면 컨설팅엔 면죄부…대입 혼란 키우는 ‘학생부...",https://www.kmib.co.kr/article/view.asp?arcid=0030110406&code=61121411&cp=nv,세종시에 사는 건설사 간부 A씨는 지난해 고3 자녀를 데리고 서울과 대전 등의 사설 대입 컨설턴트를 찾아... 입시 제도의 불확실성을 줄이는 ‘정공법’ 대신 손쉽게 생색 낼 수 있는 규제를 택했다는 것이다. 교육부는... 
2026-07-15,네이버뉴스,"이 대통령, 오늘부터 국민참여 생중계 업무보고…첫날 재경부·금융위 ...",https://www.newsis.com/view/NISX20260714_0003709299,"하반기 경제 성장 전략과 내년도 예산안, 부동산 대출 규제 등이 중점적으로 논의될 것으로 예상된다. 다음날인 16일에는 과학기술정보통신부(우주항공청)·방송미디어통신위원회, 국토교통부(행정중심복합도시건설청... "
2026-07-15,네이버뉴스,[출근길포인트]HBM 쏠림에 범용 제품까지 가격 폭등… 내년 이후 수급 변...,https://www.pointdaily.co.kr/news/articleView.html?idxno=311879,마이크론 역시 신규 팹(FAB) 건설 기간과 공정 미세화 난이도를 감안할 때 비트 성장률 확보가 제한적이라며... 사진=연합뉴스 ◇법원 제동 걸린 공정위 '쿠팡 동일인' 지정…무리한 총수 규제 논란 확산 공정거래위원회가... 
2026-07-15,네이버뉴스,[오늘의 국회일정] 국회의장·상임위·세미나·기자회견·주요 정당 - 7월...,https://www.newspim.com/news/view/20260714001187,"경쟁제한적 규제 개선을 위한 정책 세미나 / 의원회관 제11간담회의실 14:00 김대식 의원실... 복합도시건설 특별법 제정 토론회 / 의원회관 제1소회의실 15:00 박주민 의원실, 5선 오세훈 시장에게 고함: 오세훈 5기... "
2026-07-15,네이버뉴스,[오늘의 주요일정]국회(7월15일 수요일),https://www.newsis.com/view/NISX20260714_0003709416,"경쟁제한적 규제 개선을 위한 정책 세미나(의원회관 제11간담회의실) 14:00 김대식 의원실... 복합도시건설 특별법 제정 토론회(의원회관 제1소회의실) 15:00 박주민 의원실, 5선 오세훈 시장에게 고함: 오세훈 5기... "
2026-07-15,네이버뉴스,머니투데이 오프라인 헤드라인-15일,https://www.mt.co.kr/politics/2026/07/15/2026071422070462946,"받는다 [건설 부동산] ""매매·전월세 다 올라, 규제완화로 풀 때"" [사회] 폭우에 덜덜, 폭염에 헉헉…""비가 와도, 안와도 무섭다"" [정책사회·문화] ""미약"" 李 지적에…촉법연령 하향 재논의 [정책현장을 가다] 도매시장... "
2026-07-15,네이버뉴스,“공급 확대 위해 재건축 활성화를” 규제완화 요구 쏟아진 토론회,https://www.donga.com/news/Economy/article/all/20260715/134300323/2,“수도권이 규제지역으로 묶이며 LTV가 축소돼 지으려고 했던 주택도 멈춰서 있다”며 “비아파트에 대한 기금과 보증 상품을 정부가 조속히 만들어야 한다”고 했다. 강경훈 진경건설 대표는 “지난해 9·7 공급대책에서... 
2026-07-15,네이버뉴스,“LTV 줄어 건설 사업장 멈췄다… 대출 규제 완화로 공급 촉진을”,https://www.kmib.co.kr/article/view.asp?arcid=1784020355&code=11151100&cp=nv,규제 지역으로 묶여 담보인정비율(LTV)이 축소됐기 때문”이라고 지적했다. 비아파트 건설 업체인 진경건설 강경훈 대표는 “주택 신축 판매업에는 LTV 0%인 것을 완화해 달라”고 요청했다. 이정식 서울시 공동주택과장도... 
2026-07-15,네이버뉴스,[사설] 노조 “3대 메가도 교섭 대상”…노봉법이 광주팹 족쇄 될라,https://www.sedaily.com/article/20067706?ref=naver,더구나 두 회사가 평택과 용인에 건설 중인 반도체 클러스터의 가동 시기도 대거 앞당기기로 한 상황이라... 주요국들이 반도체·데이터센터 등 전략 산업 패권을 위해 대규모 투자와 규제 혁파에 총력을 기울이는 상황에서... 
2026-07-14,네이버뉴스,"103년시간차, 놀라울 만큼 닮은 통찰 … ""공산주의는 자유의 적"" [이진광...",https://www.newdaily.co.kr/site/data/html/2026/07/14/2026071400330.html,"미국에는 막대한 규모의 투자가 이루어지고 있으며, 공장은 그 어느 때보다 많이 건설되고 있습니다. 더... 이것은 세금이나 규제 수준을 둘러싼 단순한 정치적 견해 차이가 아닙니다. 공산주의는 미국의 자유를 위협하는... "
2026-07-14,네이버뉴스,"""규제에 재건축·비아파트 공급 차질""...토론회 겨냥 비판도",https://www.ytn.co.kr/_ln/0102_202607142312103397,공급난 해결을 주제로 열린 첫 부동산 정책 토론회에서 규제 완화를 통한 비아파트 공급 회복과 민간... 특히 사업자들은 주택담보대출을 받을 수 없게 돼 빌라 건설이 힘들어졌다며 대출 문턱을 낮춰달라고 호소했습니다.... 
2026-07-14,네이버뉴스,양극화·청년 취업난...여전한 숙제,https://www.ytn.co.kr/_ln/0102_202607142248267762,"호황인 ICT 분야는 고용 창출력이 낮고, 서민 일자리 저수지인 건설 부진은 이어지는 등 수출과 내수 편차가... 재정, 규제 영역에서 혁신도 속도를 내야 되겠습니다.] 또 지방과 중소기업 성장을 촉진하는 방향으로... "
2026-07-14,네이버뉴스,"울산 북구의회, 원구성 후 첫 임시회… 지역현안 챙기기 본격화",http://www.ujeil.com/news/articleView.html?idxno=388848,"아울러 규제개혁위원회 설치 및 운영 조례 전부개정조례안 등 조례안과 제2차 수시분 공유재산... 중요한 회기""라며 ""현안 사업들이 잘 추진되도록 주민 눈높이에서 건설적이고 발전적인 대안을 제시해달라""고 당부했다."
2026-07-14,네이버뉴스,‘우주항공복합도시 특별법’…올해 안 통과 ‘탄력’,https://news.kbs.co.kr/news/pc/view/view.do?ncd=8610769&ref=A,"지난해 말 국회에 발의된 '우주항공복합도시 건설 특별법'. 사천과 인근 지역을 포함해 규제 특례와 연구기관, 기업 유치 지원 등이 담겼습니다. 경남과 전남 등 여야 국회의원 40여 명이 공동 발의했지만, 7개월이 넘도록... "
2026-07-14,네이버뉴스,"“건설 규제·임대 주택 축소를” “민원의 장이냐, 임대 비율 50%로”",https://www.khan.co.kr/article/202607142143005,강경훈 진경건설 대표는 “2008년 금융위기 후 부동산 장기 침체 때보다 지금이 훨씬 더 힘들다”며 “지난해 9·7 대책 이후 주택 매매업·임대사업자 담보인정비율(LTV)을 0%로 규제하면서 힘들어졌다”고 말했다.... 
2026-07-14,네이버뉴스,울산 북구의회 첫 임시회 현안 챙기기 본격화,https://www.ulsanpress.net/news/articleView.html?idxno=579208,"이와 함께 규제개혁위원회 설치 및 운영 조례 전부개정조례안 등 조례안과 제2차 수시분 공유재산... 눈높이에서 건설적이고 발전적인 대안을 제시해달라""고 말했다. 한편 이날 본회의 첫머리에는 △안현진 의원이... "
2026-07-14,네이버뉴스,모노레일 대신 3칸 굴절버스?.. 공약 무산 위기,http://news.mbccb.co.kr/home/sub.php?menukey=61&mod=view&RECEIVE_DATE=20260714&SEQUENCE=4333,"건설비와 운영비가 저렴하기 때문인데요. 그런데 각종 규제와 한계가 드러나면서, 공약이 무산될 처지에 놓였습니다. 김영일 기자입니다. ◀ 리포트 ▶ 트램처럼 긴 차량이 도로 위를 시원하게 내달립니다. 이장섭... "
2026-07-14,네이버뉴스,"'국토부 부동산 토론회'서 규제 완화 요구…""공급 외치며 자금줄 차단""",https://www.g-enews.com/view.php?ud=20260714203434574112616b072_1,국토교통부가 마련한 부동산 정책 토론회에서 대출 규제로 재건축과 비아파트 공급이 차질을 빚고 있다는... 건설업계는 주택 신축·판매 사업자에게 주택담보인정비율(LTV) 0%가 적용되면서 사업비 조달이 사실상 막혔다며... 
2026-07-14,네이버뉴스,부동산 대토론회 첫날 쏟아진 ‘규제완화’ 요구... “공공주택 확대가...,https://vop.co.kr/A00001695821.html,이어 소형 비아파트를 주택 수에서 제외하는 방안을 언급하며 전향적인 검토가 필요하다고 했다.건설업계에서는 금융 규제 때문에 주택을 지을 토지조차 매입하기 어렵다는 호소가 나왔다. 강경훈 진경건설 대표는... 
2026-07-14,네이버뉴스,"[논설위원의 단도직입]“문 정부 전철 안 밟으려면, 시장 예상보다 강력...",https://www.khan.co.kr/article/202607142005005,"윤석열 정부서 종부세 감세·규제지역 해제하며 2023년부터 이미 ‘급등’ 시작 이 정부, 부자 감세 원위치... “신규 공급으로 가격이 떨어진 사례는 노태우 정부 때 200만호 건설, 이명박 정부 때의 보금자리주택... "
2026-07-14,네이버뉴스,"재건축 속도전·비아파트 규제 손질 한목소리…""공급 막는 장벽부터 걷...",https://www.ebn.co.kr/news/articleView.html?idxno=1716379,"김 연구위원은 ""1990년대 기준에 머물러 있는 규제가 현재 주거 환경과 맞지 않는다""며 ""품질 높은 비아파트 공급을 위해 건축기준 전면 재검토가 필요하다""고 말했다. 건설업계도 공급 위축에 대한 우려를 나타냈다. 강병호... "
2026-07-14,네이버뉴스,“주택공급 늘리려면 재건축 활성화…대출규제 풀어야”,https://www.donga.com/news/Economy/article/all/20260714/134298595/1,“수도권이 규제지역으로 묶이며 LTV가 축소돼 지으려고 했던 주택도 멈춰서 있다”며 “비아파트에 대한 기금과 보증 상품을 정부가 조속히 만들어야 한다”고 했다. 강경훈 진경건설 대표는 “지난해 9·7 공급대책에서... 
2026-07-14,네이버뉴스,충북도의회 초선 의원 '정책 제안' 봇물,https://www.dynews.co.kr/news/articleView.html?idxno=858016,"박형용(옥천1·건설농림위) 의원은 ""옥천·영동·보은은 인구감소와 초고령화, 청년유출, 산업기반 부족... 배치 △대청호 규제 개선·주민지원사업 확대 △남부권 발전기금 조성 △청주·세종·대전 광역교통망 확충... "
2026-07-14,네이버뉴스,"“강남과 용인 기흥이 같은 규제…규제지역·토허구역, 전면 재검토해야...",https://www.dailian.co.kr/news/view/1667167/?sc=Naver,"급격한 규제지역 및 토허구역 해제 시 눌렸던 수요가 폭발하며 수도권 주택가격 상승을 부추길 수 있단 설명이다. 한편, 이날 국토부가 국토부 산하기관장, 주택건설·금융업계 관계자, 청년·신혼부부 등 일반국민... "
2026-07-14,네이버뉴스,"박형용 충북도의원, 남부권 특별지원 정책과 균형발전 대전환 필요성 강...",https://www.newstnt.com/news/articleView.html?idxno=710200,"충북도의회(의장 이상식)는 14일 건설농림위원회 소속의 박형용(옥천1) 의원이 제436회 임시회 제1차... 대청호 규제까지 부담하고 있어, 46년간 깨끗한 물을 공급해 온 주민들에게 이제는 정당한 보상과 발전의 기회를... "
2026-07-14,네이버뉴스,[속 타는 예타] 예타 결과 도대체 언제?…달빛철도 예타 면제 검토도 '오...,https://www.imaeil.com/page/view/2026071418030069473,총사업비 500억원 이상 대규모 건설사업을 대상으로 진행하는 예비타당성조사 절차는 정부가 지방정부를 통제하는 대표적 '규제'로 오랜 기간 거론돼 왔다. 실제 예타 조사 수행 과정에서 지침상 기간을 넘기는 경우가... 
2026-07-14,네이버뉴스,"[인사이트 뉴스]쿠팡 사태, 이제는 출구전략이 필요하다…'호통'보다 법...",https://www.moneystorm.kr/news/articleView.html?idxno=5081,"성장률 저하와 건설업 불황 속에서 내수를 지탱하던 쿠팡의 투자 규모가 축소되거나 고용 동력이 약화될... 한국 정부는 정당한 법 집행이라는 입장이지만, 미국 측은 이를 디지털 무역 환경에서의 차별적 규제로... "
2026-07-14,네이버뉴스,부동산 대토론회 첫날…건설업계·서울시 “임대주택 축소 등 규제 완화...,https://www.khan.co.kr/article/202607141812001,강경훈 진경건설 대표는 “2008년 금융위기 후 부동산 장기침체 때보다 지금이 훨씬 더 힘들다”며 “지난해 9·7대책 이후 주택 매매업·임대사업자 LTV(담보인정비율)를 0%로 규제하면서 힘들어졌다”고 말했다.... 
