date,source,title,link,description
2026-04-30,네이버뉴스,"매출 줄어도 이익 2배…박상신 DL이앤씨 대표, '선별 수주' 효과",https://www.insightkorea.co.kr/news/articleView.html?idxno=245748,"DL이앤씨가 올해 1분기 매출 감소 속에서도 수익성 개선에 성공했다. 박상신 대표가 2024년 취임한 이래 진행한 수익성 중심의 체질 개선이 효과를 보고 있다는 분석이다. 30일 전자공시시스템에 따르면,  DL이앤씨는... "
2026-04-30,네이버뉴스,"DL이앤씨, 1분기 영업익 1574억…전년비 94.3%↑",https://www.dizzotv.com/site/data/html_dir/2026/04/30/2026043080193.html,"DL이앤씨가 올해 1분기에 연결기준으로 매출 1조7252억원, 영업이익 1574억원, 영업이익률 9.1%, 당기순이익 1601억원, 신규수주 2조1265억원을 기록했다고 30일 잠정실적을 발표했다. 전년 말 대비 순현금은 1906억원... "
2026-04-30,네이버뉴스,"DL이앤씨, 1분기 영업이익 1574억…전년 대비 94.3%↑",http://datanews.co.kr/news/article.html?no=144590,DL이앤씨는 2026년 1분기 연결 기준 ▲매출 1조7252억 원 ▲영업이익 1574억 원 ▲영업이익률 9.1% ▲당기순이익 1601억 원 ▲신규수주 2조1265억 원을 기록했다고 30일 밝혔다. 영업이익은 전년 동기(810억 원) 대비... 
2026-04-30,네이버뉴스,"﻿DL이앤씨, 1분기 매출 1.7조, 영업이익 1,574억 달성",https://news.bbsi.co.kr/news/articleView.html?idxno=4081555,"DL이앤씨는 오늘 잠정 실적발표를 통해 연결기준 2026년 1분기 매출 1조 7천 252억원, 영업이익 천 574억원, 영업이익률 9.1%, 당기순이익 천 601억원, 신규수주 2조 천 265억원을 기록했다고 밝혔습니다. 지난해 말 대비... "
2026-04-30,네이버뉴스,"상대원2구역 시공사 교체 제동, 'DL이앤씨 5600억 신용보강' 유지",https://www.bloter.net/news/articleView.html?idxno=661098,DL이앤씨 도급계약 해지 효력이 정지됐고 5월 1일 예정된 GS건설 시공사 선정 총회도 법원 결정으로 중단됐다. 기존 사업비 대출은 DL이앤씨 신용보강과 주택도시보증공사(HUG) 보증을 기반으로 진행됐다. DL이앤씨는... 
2026-04-30,네이버뉴스,"DL이앤씨, 1분기 영업익 94% 급증…'선별 수주'로 수익성 반등",http://www.whitepaper.co.kr/news/articleView.html?idxno=261944,"화이트페이퍼, WHITEPAPERDL이앤씨 사옥 (사진=DL이앤씨)  DL이앤씨가 매출 감소에도 불구하고 수익성 중심 전략을 앞세워 1분기 영업이익을 두 배 가까이 끌어올렸다. 원가율 개선과 선별 수주 전략이 맞물리며 시장... "
2026-04-30,네이버뉴스,"DL이앤씨, 1분기 영업이익률 9.1% '선별수주' 통했다",https://www.bloter.net/news/articleView.html?idxno=661095,DL이앤씨가 건설업계 전반의 원가 부담 속에서 1분기부터 9%대 영업이익률을 달성하며 업계 최상위권 수익률을 달성했다. DL이앤씨는 30일 잠정 실적발표를 통해 연결기준 2026년 1분기 영업이익이 1574억원으로 전년... 
2026-04-30,네이버뉴스,[분양 캘린더] 5월 첫째 주 6672가구 청약접수,https://www.asiatime.co.kr/article/20260430500238,"6일 DL이앤씨는 경기도 부천시 소사3구역 주택재개발사업을 통해 선보이는 'e편한세상 부천 어반스퀘어'의 1순위 청약 접수를 받는다. 지하 3층~지상 38층, 13개 동, 총 1,649가구 규모로 조성되며 구성은 전용면적 59~84... "
2026-04-30,네이버뉴스,"DL이앤씨, 1분기 영업이익 1574억…전년比 94% 급증",https://www.newspim.com/news/view/20260430001286,DL이앤씨가 올해 첫 분기부터 철저한 원가 관리와 선별 수주 전략을 바탕으로 확연하게 개선된 수익 지표를 내놨다. DL이앤씨 2026년 1분기 실적 [AI 그래픽 생성=정영희 기자] 30일 DL이앤씨는 잠정 실적발표를 통해... 
2026-04-30,네이버뉴스,"DL이앤씨, 1분기 영업익 1574억원…전년 比 94.3%↑",http://www.newscape.co.kr/news/articleView.html?idxno=121979,"DL이앤씨가 전년 동기와 대비해 두 배가량 늘어난 영업이익을 달성했다. DL이앤씨는 30일 지난 1분기 연결재무제표 기준 매출 1조7252억원, 영업이익 1574억원, 신규 수주 2조1265억원의 잠정실적을 발표했다. 이는 전년... "
2026-04-30,네이버뉴스,"DL이앤씨, 1분기 영업이익 1574억… 전년비 94.3%↑",http://www.seoulwire.com/news/articleView.html?idxno=719751,DL이앤씨가 수익성 중심 경영 전략을 기반으로 실적 개선 흐름을 강화하고 있다. 부동산 경기 둔화와 원가 상승 등 대외 불확실성에도 원가율 개선과 사업 포트폴리오 다변화를 통해 수익성과 재무 안정성을 동시에... 
2026-04-30,네이버뉴스,"DL이앤씨, 1분기 영업이익 94% 급증···수익성 중심 전략 효과 본격화",https://www.smartbizn.com/news/articleView.html?idxno=143014,"| 스마트비즈 = 최형호 기자 | DL이앤씨는 올해 1분기 연결 기준 매출 1조 7252억원, 영업이익 1574억원을 기록했다고 30일 밝혔다. 영업이익률은 9.1%로 집계됐으며, 당기순이익은 1601억원, 신규 수주는 2조 1265억원을... "
2026-04-30,네이버뉴스,"DL이앤씨, 압구정5구역에 ‘아크로’ 제안…수익·안정성 동시 강화",https://www.segye.com/newsView/20260430516873?OutUrl=naver,DL이앤씨가 서울 강남 압구정5구역 재건축 사업에 하이엔드 브랜드 ‘아크로(ACRO)’를 앞세워 공사비를 낮추고 금융 부담을 줄이는 조건을 제시했다. DL이앤씨는 압구정5구역에 ‘아크로 압구정(ACRO Apgujeong)’을... 
2026-04-30,네이버뉴스,"DL이앤씨, 1분기 영업이익 전년 比 94%↑…수익성 체질 개선 성공",https://view.asiae.co.kr/article/2026043016562975063,"DL이앤씨가 주택과 건축 부문의 원개율 개선에 힘입어 1분기 수익성을 대폭 끌어올렸다. DL이앤씨는 잠정 실적발표를 통해 연결기준 1분기 매출 1조7252억원, 영업이익 1574억원을 기록했다고 30일 공시했다.... "
2026-04-30,네이버뉴스,"DL이앤씨, 1분기 영업이익 1574억원 94.3% 급증…매출 1.7조",https://www.seoultimes.news/news/article.html?no=2000095440,영업이익률 9.1% 회복…원가 구조 개선 효과 반영 순이익 4배 증가·수주 확대…내실 중심 전략 가시화 순현금 1.3조 유지…업황 둔화 속 재무 안정성 부각 [서울타임즈뉴스 = 서연옥 기자] DL이앤씨가 올해 1분기... 
2026-04-30,네이버뉴스,"DL이앤씨, 1분기 영업이익 1574억원…2배 증가",http://www.lawissue.co.kr/view.php?ud=20260430165028156567191f6c6e_12,"DL이앤씨는 잠정 실적발표를 통해 연결기준 2026년 1분기 매출 1조7252억원, 영업이익 1574억원, 영업이익률 9.1%, 당기순이익 1601억원, 신규수주 2조1265억원을 기록했다고 밝혔다. 또 전년 말 대비 순현금은 1906억... "
2026-04-30,네이버뉴스,"""주택사업이 효자네"" DL이앤씨, 1Q 영업익 1574억·전년比 94%↑",https://www.catchnews.kr/news/articleView.html?idxno=123457,DL이앤씨의 2026년 1분기 실적 추이. [그래픽 DL이앤씨] DL이앤씨가 올해 1분기 연결 기준 실적을 잠정 집계한 결과 영업이익 1574억원으로 전년 동기 810억원 대비 94.3% 증가했다고 30일 공시했다. 같은 기간 매출은... 
2026-04-30,네이버뉴스,[식물원·수목원 설계 이야기 ②] 도심 속 수목원 : 국립세종수목원,http://www.lak.co.kr/news/boardview.php?id=23013,"최저가 입찰의 단점인 계획예산 활용성 및 시공 품질 저하 등을 보완하기 위해 기본설계 기술제안입찰로 진행됐으며, DL이앤씨·건원건축·도화엔지니어링 컨소시엄이 우선협상대상자로 선정돼 실시설계를 진행했다.... "
2026-04-30,네이버뉴스,"[건설사리포트]DL이앤씨, 안양 관양동서 404가구 분양ㆍ금호건설, 상반...",https://www.ebn.co.kr/news/articleView.html?idxno=1707378,"DL이앤씨, '안양 에버포레 자연& e편한세상' 5월 분양 DL이앤씨가 경기 안양시 동안구 관양동 일대에 공급하는 '안양 에버포레 자연& e편한세상'을 5월 분양한다. DL이앤씨는 오는 5월 1일 주택전시관을 개관하고 본격적인... "
2026-04-30,네이버뉴스,"DL이앤씨, 1분기 영업이익 94%↑…선별 수주로 내실 다졌다",https://www.cstimes.com/news/articleView.html?idxno=704141,"컨슈머타임스=김동역 기자 | DL이앤씨가 올해 1분기 매출 1조7252억원, 영업이익 1574억원을 기록했으며, 9.1%의 영업이익률과 2조1265억원의 신규 수주를 달성하며 견조한 실적을 거뒀다. 이번 실적은 선별 수주와... "
2026-04-30,네이버뉴스,"DL이앤씨, 1분기 영업익 1,574억원…전년비 94.3%↑",http://www.srtimes.kr/news/articleView.html?idxno=202522,DL이앤씨가 주택 부문의 원가율 개선과 선별 수주 전략에 힘입어 올해 1분기 영업이익이 전년 대비 2배 가까이 급증하는 어닝 서프라이즈를 기록했다. ​30일 DL이앤씨는 연결 기준 올해 1분기 영업이익이 1... 
2026-04-30,네이버뉴스,"“재건축=속도”…DL이앤씨, 압구정5구역 ‘사업기간 단축 플랜’ 제안",http://www.lawissue.co.kr/view.php?ud=2026043016355823167191f6c6e_12,"DL이앤씨가 오직 압구정5구역에만 집중한 전략을 통한 ‘사업기간 단축 플랜’을 제시하며 조합원 공략에 나섰다. 공사기간을 단축시킬 뿐 아니라 책임준공확약서 제출, 지역 첫 이주개시 등 조합원의 실익을 고려한... "
2026-04-30,네이버뉴스,"법원, 상대원2구역 시공사 교체 제동…DL이앤씨 지위 유지",https://economist.co.kr/article/view/ecn202604300074,30일 정비업계에 따르면 수원지방법원 성남지원은 지난 29일 DL이앤씨가 제기한 ‘시공사 해임 총회 결의 효력정지 가처분’에 대해 인용 결정을 내렸다. 이는 지난 4월 11일 조합이 임시총회를 통해 의결한 DL이앤씨... 
2026-04-30,네이버뉴스,"DL이앤씨, 건설 불황 뚫고 수익성 2배 '퀀텀 점프'",http://www.ttlnews.com/news/articleView.html?idxno=3104381,"건설업계 전반이 고금리와 원자재 가격 상승, 부동산 프로젝트파이낸싱(PF) 부실 여파로 신음하고 있는 가운데 DL이앤씨가 수익성 중심의 체질 개선을 통해 반전 드라마를 썼다. 단순한 외형 확장보다는 내실 경영에... "
2026-04-30,네이버뉴스,"속도 붙는 한남뉴타운...5구역, 사시인가로 8부 능선 넘었다",http://www.fnnews.com/news/202604301617362287,"시공은 DL이앤씨가 맡았다. 감정평가를 위한 현장조사는 오는 5월 11일부터 6월 18일까지 진행될 예정이다. 이후 조합은 관리처분인가 과정에 돌입한다. 고준석 연세대 상남경영원 주임교수는 ""한남5구역은 한강과... "
2026-04-30,네이버뉴스,"DL이앤씨, 1분기 영업익 95% 급증…""원가율 낮추고 수익 개선""",https://www.sidae.com/article/2026043016161114557,DL이앤씨가 올해 1분기 지난해 두 배 수준의 영업이익을 기록하며 실적 반등에 성공했다. 주택·건축 부문의 원가율이 크게 낮아지면서 실적 개선에 힘을 보탰다. 30일 DL이앤씨는 연결기준 1분기 영업이익이... 
2026-04-30,네이버뉴스,DL이앤씨·GS건설 1Q 영업익 개선…매출은 감소,https://www.1conomynews.co.kr/news/articleView.html?idxno=48390,"DL이앤씨가 수익성 위주의 경영 기조를 강화한 결과 올해 1분기 영업이익이 급증했다. 30일 DL이앤씨에 따르면 올해 1분기 잠정 경영실적은 매출 1조7252억원, 영업이익 1574억원으로 집계됐다. 매출은 전년 동기... "
2026-04-30,네이버뉴스,"[2026 1분기 실적] DL이앤씨, 1분기 영업이익 1574억…수익성 2배 개선",https://www.inthenews.co.kr/news/article.html?no=86354,"영업이익률 9.1%로 개선 순현금 1.28조 재무 안정성 인더뉴스 제해영 기자ㅣDL이앤씨는 연결 기준 2026년 1분기 매출 1조7252억원, 영업이익 1574억원, 영업이익률 9.1%, 당기순이익 1601억원, 신규수주 2조1265억원을... "
2026-04-30,네이버뉴스,"DL이앤씨, 1분기 영업익 전년比 94.3% 급증...원가 개선·선별 수주로 수...",https://www.joongangenews.com/news/articleView.html?idxno=516214,|중앙이코노미뉴스 송태원 기자|DL이앤씨 CI DL이앤씨가 원가율 개선과 선별 수주 전략에 힘입어 1분기 수익성 개선 흐름을 이어갔다. 매출 감소에도 불구하고 이익 지표가 크게 개선되며 체질 개선 성과가... 
2026-04-30,네이버뉴스,중동 사태 장기화 국면에 분양가 상승 지속 전망,https://www.dt.co.kr/article/12060385?ref=naver,"DL이앤씨는 동작구 대방동 일원 노량진8재정비촉진구역 주택재개발 정비사업을 통해 ‘아크로 리버스카이’를 분양할 예정이다. 이 단지는 지하 4층~지상 29층, 10개 동, 전용면적 36~140㎡ 총 987가구 규모로 이중... "
2026-04-30,네이버뉴스,"DL이앤씨, 노량진 '아크로 리버스카이' 분양",https://news.tf.co.kr/read/economy/2318900.htm,"전용 36~140㎡ 총 987가구, 일반분양 285가구 DL이앤씨는 다음달 서울 동작구 노량진8구역 재개발을 통해 '아크로 리버스카이'를 공급한다고 30일 밝혔다. 아크로 리버스카이는 지하 4층~지상 29층, 10개 동, 전용면적... "
2026-04-30,네이버뉴스,"DL이앤씨, 1분기 영업익 1574억…수익성 구조 완전 전환",https://www.bizwork.co.kr/news/articleView.html?idxno=415200,"DL이앤씨는 1분기 연결기준 매출 1조7252억원, 영업이익 1574억원, 당기순이익 1601억원, 신규수주 2조1265억원을 기록했다고 30일 밝혔다. 매출은 전년 대비 소폭 감소했지만, 영업이익과 이익률이 크게 개선되며 수익성... "
2026-04-30,네이버뉴스,"""어디까지 올라가는 거예요?"" 중동 사태 장기화에 분양가 상승 지속 전...",https://www.woodkorea.co.kr/news/articleView.html?idxno=89284,"DL이앤씨는 동작구 대방동 일원 노량진8재정비촉진구역 주택재개발 정비사업을 통해 '아크로 리버스카이'를 분양할 예정이다. 이 단지는 지하 4층~지상 29층, 10개 동, 전용면적 36~140㎡ 총 987가구 규모로 이중 285가구가... "
2026-04-30,네이버뉴스,국평 16억 찍은 광명… 15분 거리 '부천 소사' 저평가 인식 확산,http://www.ikld.kr/news/articleView.html?idxno=333865,"DL이앤씨가 소사3구역 주택재개발사업을 통해 공급하는 'e편한세상 부천 어반스퀘어'는 지하 3층~지상 38층, 13개 동, 총 1,649가구 규모로 지어지며 이중 전용면적 59~84㎡, 897가구를 일반 분양한다. 단지 바로 앞에 1호선과... "
2026-04-30,네이버뉴스,"DL이앤씨, 1분기 영업익 94% 증가…원가율 낮추며 수익성 대폭 개선",https://biz.chosun.com/real_estate/real_estate_general/2026/04/30/E6NPNDXYHFECZMBT7JLOVILJIE/?utm_source=naver&utm_medium=original&utm_campaign=biz,영업이익 1574억원·영업이익률 9.1% 기록 신규 수주 2조1265억원으로 전년比 39.3% ↑ 순현금 확대·부채비율 87.5%로 재무 안정성 유지 DL이앤씨의 올해 1분기 수익성이 대폭 개선됐다. 주택·건축 부문의 원가율이... 
2026-04-30,네이버뉴스,[건설 Pick] GS건설·우미희망재단·DL이앤씨...실적·상생·분양으로 '내...,https://www.lcnews.co.kr/news/articleView.html?idxno=201566,"DL이앤씨는 브랜드 경쟁력을 앞세워 신규 분양에 돌입하며 시장 공략을 이어갔다. 업계에서는 ""양적 성장보다 질적 성장과 신뢰 확보가 중요한 시기""라는 평가가 나온다. 한 업계 관계자는 '최근 건설사들이 외형... "
2026-05-01,네이버뉴스,"서울숲 넘어 성수·한강까지 ""걷다 보니 정원""…'정원도시 서울' 열린다",https://www.news1.kr/local/moi/6154384,"맞은편 대우건설의 '써밋 사일로(SILO) 정원'은 'O형' 사일로 구조로 외부 동선과 소리를 자연스레 끌어들이면서도 중심으로 갈수록 고요한 변화를 느낄 수 있었고, 바로 옆 호반건설의 '왕관의 수줍음 정원'은 숲의 의자와... "
2026-05-01,네이버뉴스,"헌신, 오감, 침묵… 숲이 들려주는 주거 공간의 정체성",https://www.seoul.co.kr/news/economy/industry/2026/05/01/20260501032003?wlog_tag3=naver,① 호반건설 ‘왕관의 수줍음’ 서로 지탱하는 인간의 관계 표현 ② GS건설 ‘엘리시안 포레스트’ 겹겹이 공존하며 오감 자극 공간 ③ 대우건설 ‘사일런스 오 가든’ 도심 속 고요와 내면의 집중 상징 ④... 
2026-04-30,네이버뉴스,"대우건설, 추락재해 예방 릴레이 캠페인 참여",https://www.kgnews.co.kr/news/article.html?no=893997,대우건설은 지난 29일 서울시 중구 세운 구역 일대에서 ‘건설현장 추락재해 예방 캠페인’에 참여했다고 30일 밝혔다. 이번 캠페인은 서울지방고용노동청이 주관한 추락재해 예방 릴레이 캠페인의 일환으로 실시됐다.... 
2026-04-30,네이버뉴스,"안산그린파워, 대우건설 보유 자사주식 담보 제공 받아",https://www.digitaltoday.co.kr/news/articleView.html?idxno=662041,안산그린파워는 PF대출약정과 관련해 계열회사인 대우건설로부터 담보를 제공받았다고 30일 공시했다. 담보는 대우건설이 보유한 안산그린파워 발행주식에 대한 주식근질권 설정 방식이다. 담보받은 일자는... 
2026-04-30,네이버뉴스,대우건설 '건설현장 추락재해 예방' 캠페인,http://www.fnnews.com/news/202604301840111859,"대우건설이 건설현장 추락사고 예방을 위한 현장 중심 활동에 나섰다. 최근 건설업 사망사고의 상당 부분이 추락에서 발생하는 만큼, 기본 안전수칙 준수 문화 확산이 중요해지고 있다. 대우건설은 지난 29일 서울 중구... "
2026-04-30,네이버뉴스,"IPARK현대산업개발·GS·대우건설, 매출 줄고 이익 상승…'내실경영'으로...",https://www.greened.kr/news/articleView.html?idxno=340137,"▲ GS건설 사옥 IPARK현대산업개발, GS건설, 대우건설 등 3사는 주택·건축 부문 착공 둔화로 외형은 줄어들었지만, 고마진 프로젝트 선별 수주와 원가율 안정화, 사업 포트폴리오 다각화를 통해 수익성을 방어하는 데... "
2026-04-30,네이버뉴스,"대우건설, 고용노동청 캠페인 동참…안전 문화 확산",https://www.thedailypost.kr/news/articleView.html?idxno=114042,"노력하겠습니다"" (대우건설 관계자) 매년 증가하고 있는 건설현장의 추락재해 사고 예과 안전 강화를 위해 대우건설이 고용노동청이 주관하는 캠페인에 참여했다. 대우건설은 지난 29일 서울 중구 세운구역 일대에서... "
2026-04-30,네이버뉴스,"[오늘의 건설 브리핑] 건설·공공·레저업계, 안전·ESG·주거·교통까지...",https://www.smartbizn.com/news/articleView.html?idxno=143016,"■ 대우건설, 도심 현장 추락재해 예방 캠페인 대우건설은 서울 중구 세운지구 일대에서 추락재해 예방 캠페인에 참여했다. 이번 캠페인은 서울지방고용노동청 주관으로 진행됐으며, 참여 기관과 건설사들이 함께... "
2026-04-30,네이버뉴스,"대우건설 ""안전이 최우선"" 중구 일대 건설현장 순회 점검",https://www.newstnt.com/news/articleView.html?idxno=700814,"대우건설이 서울 중구 세운 구역 일대 건설현장을 돌며 추락 사고 방지를 위한 안전 문화 확산에 나섰다. 지난 29일 진행한 이번 행사는 서울지방고용노동청이 주관하는 릴레이 캠페인의 일환으로, 최근 빈번하게... "
2026-04-30,네이버뉴스,"[박수진의 머니워치] 美 연준 기준금리 동결…""코스피 상승세 지속""",http://www.newswatch.kr/news/articleView.html?idxno=79539,"거래량은 SK증권이 가장 많았고 대원전선, 진흥기업, 대우건설, 조일알미늄 순으로 이어졌다. 같은 기간 개인 순매수 상위 종목은 LS ELECTRIC, 삼성전자우, NAVER, HD현대일렉트릭, 삼성바이오로직스다. 순매도 상위... "
2026-04-30,네이버뉴스,"대우건설, 2026년 1분기 경영실적 발표",https://www.arunews.com/news/articleView.html?idxno=62286,"대우건설(대표이사 김보현)은 지난 28일 공시를 통해 2026년 1분기 경영실적(연결기준) 잠정집계 결과 매출 1조9514억원, 영업이익 2,556억원, 당기순이익 1,958억원을 기록했다고 밝혔다. 매출은 전년 동기(2조767억원)... "
2026-04-30,네이버뉴스,"대우건설, 세운구역 일대 추락재해 예방캠페인 참여",https://www.safetynews.co.kr/news/articleView.html?idxno=248103,대우건설 수표구역 도시정비형 재개발사업 현장에서 진행된 추락재해 예방 릴레이 캠페인 단체사진 /사진 = 대우건설 제공 대우건설이 서울 중구 세운구역 일대 건설현장에서 추락재해 예방 캠페인에 참여했다.... 
2026-04-30,네이버뉴스,"대우건설, 서울 세운구역서 건설현장 '추락 예방' 캠페인 실시…안전문...",http://www.paxetv.com/news/articleView.html?idxno=271065,[사진=대우건설] 대우건설이 지난 29일 서울 세운구역 일대 건설현장에서 추락 사고 예방을 위한 안전 캠페인을 실시했다고 30일 밝혔습니다. 서울지방고용노동청이 주관한 이번 행사는 최근 잇따르는 건설현장 추락 사고에... 
2026-04-30,네이버뉴스,[포토] ‘비밀의 숲’ 속 피카츄 보러 오세요…서울국제정원박람회 내일...,https://www.hani.co.kr/arti/society/society_general/1256655.html,"기업 정원은 서울숲 중심공간인 잔디광장 주변에 대우건설, 지에스(GS)건설, 에이치디시(HDC), 호반건설, 계룡건설, 에스에이치(SH)공사 등 다양한 기업과 기관이 참여해 조성됐다."
2026-04-30,네이버뉴스,"대우건설, 세운구역서 '추락재해 예방 캠페인' 참여",https://www.gokorea.kr/news/articleView.html?idxno=865254,대우건설이 건설현장 안전문화 확산을 위한 추락재해 예방 캠페인에 참여했다. 대우건설은 지난 29일 서울 중구 세운구역 일대에서 열린 '건설현장 추락재해 예방 릴레이 캠페인'에 참여했다고 30일 밝혔다. 이번... 
2026-04-30,네이버뉴스,[건설소식] 한화 건설부문·대우건설·대보그룹·현대엔지니어링,https://sports.hankooki.com/news/articleView.html?idxno=6932196,추락재해 예방 릴레이 캠페인 ⓒ대우건설 대우건설이 지난 29일 서울시 중구 세운 구역 일대에서 진행된 '건설현장 추락재해 예방 캠페인'에 참여했다. 이번 캠페인은 서울지방고용노동청이 주관한 추락재해 예방 릴레이... 
2026-04-30,네이버뉴스,"대우건설, 추락재해 예방 캠페인 동참…""안전, 타협할 수 없는 가치""",https://www.mt.co.kr/estate/2026/04/30/2026043015082263116,"대우건설이 건설현장에서의 추락재해 예방에 나서고 있다. 대우건설은 서울지방고용노동청이 주관한 추락재해 예방 릴레이 캠페인에 참여했다고 30일 밝혔다. 이날 행사에는 서울지방고용노동청, 서울지방국토관리청 등... "
2026-05-01,네이버뉴스,"[건설사 체력점검 – GS건설④] 건설의 홀로서기…브랜드는 공유, 리스...",https://theviewers.co.kr/View.aspx?No=4054613,GS건설은 지금 그룹의 그늘보다 시장의 검증대 위에 더 가까이 서 있다. 독립적 지위와 자립 구조 여기에 규제 리스크까지 겹치며 회사의 실질적인 경쟁력이 시험대에 올랐다는 평가다.■ 그룹 안 ‘독립 계열’... 
2026-05-01,네이버뉴스,"GS건설, 주택 공백에 매출 '뚝'…판관비 줄여 이익 방어",https://dealsite.co.kr/articles/161179,"준공 기저효과에 주택 매출 감소…하반기부터 점진적 회복 기대 GS건설이 주택사업 부진 여파로 매출이 감소했지만, 판관비 절감 효과에 힘입어 수익성 방어에는 성공했다. 상반기까지는 주택 매출 감소 흐름이... "
2026-05-01,네이버뉴스,"GS건설, 1분기 영업이익 증가했지만 시장 기대 '충격 하회'",http://www.newsroad.co.kr/news/articleView.html?idxno=58808,GS건설이 올해 1분기 시장 기대에 크게 못 미치는 실적을 내놓았다. 영업이익은 소폭 늘었지만 매출과 순이익이 모두 줄어들며 수익성·성장성 측면에서 부담을 드러냈다는 평가가 나온다. GS건설은 30일 공시를 통해... 
2026-05-01,네이버뉴스,역대 최장 기간 180일 … 정원으로 물드는 서울,https://www.chosun.com/national/national_general/2026/05/01/MG44LQSZQBBJRDLIMVOP64Y2Z4/?utm_source=naver&utm_medium=referral&utm_campaign=naver-news,"프랑스 조경가 앙리 바바와 이남진 조경가가 참여한 초청 정원, 국제 공모에서 선정된 작가 정원 5곳, GS건설·스타벅스·롯데월드 등 기업과 지방자치단체 등이 참여한 기부정원 46곳 등을 구경할 수 있다. 서울숲뿐... "
