date,source,title,link,description
2026-07-06,네이버뉴스,[위클리오늘] 서울 주거비 부담에 '탈서울' 가속화…전출자 10명 중 6명...,http://www.weeklytoday.com/news/articleView.html?idxno=783693,"롯데건설은 경기 부천시 원미구 상동 일원에 상동역 롯데캐슬 시그니처를 분양한다. 지하 8층~지상 49층 7개동, 전용면적 84~192㎡, 총 1,859가구 규모다. 지하철 7호선 상동역 초역세권으로 향후 GTX-B 노선이 예정돼... "
2026-07-06,네이버뉴스,"롯데건설, 성수4지구 재개발 시공권 확보…공사비 1조3492억원",https://www.polinews.co.kr/news/articleView.html?idxno=736130,롯데건설이 서울 성동구 성수전략정비구역 제4지구 재개발사업 시공사로 선정됐다. 롯데건설은 지난 5일 열린 성수4지구 재개발사업 시공사 선정 총회에서 조합원 투표를 거쳐 시공권을 확보했다고 6일 밝혔다. 전체... 
2026-07-06,네이버뉴스,"신동빈 회장, 송도 1공장 찾아 바이오 신사업 점검",https://www.thepowernews.co.kr/view.php?ud=202607061537256466de3f0aa1be_7,"현장에는 박제임스 롯데바이오로직스 각자대표, 신유열 롯데바이오로직스 각자대표 겸 롯데지주 미래성장실장, 오일근 롯데건설 대표이사 등이 함께했다. 신 회장은 생산시설 주요 공정 시설을 둘러보고 글로벌 고객사... "
2026-07-06,네이버뉴스,롯데벤처스 10년째 부산 스타트업 육성…34개사에 투자,https://www.mk.co.kr/article/12091261,"부산창조경제혁신센터가 운영하는 ‘스타트업 오픈이노베이션 챌린지’에 참여해 롯데백화점, 롯데건설, 롯데웰푸드, 롯데월드, 롯데글로벌로지스 등 계열사와 스타트업 간 협업 및 기술검증(PoC)을 추진해 왔으며... "
2026-07-06,네이버뉴스,"[호텔리조트 트렌드] 노보텔 앰배서더 서울 동대문 호텔 & 레지던스, 8주...",https://www.ibabynews.com/news/articleView.html?idxno=152662,ⓒ롯데리조트 롯데건설은 지난 7월 1일 울산 북구 강동관광단지에 조성 중인 '롯데리조트 울산'의 홍보관을 개관하고 콘도미니엄 창립 회원권 분양을 시작했다고 밝혔다. 이는 울산 최초의 리조트이자 롯데리조트... 
2026-07-06,네이버뉴스,"롯데건설, 성수4지구 1조3492억 수주…초고층 기술력으로 도시정비 새 기...",https://www.upkoreanews.kr/news/articleView.html?idxno=99145,롯데건설이 서울 한강변 핵심 도시정비사업으로 꼽히는 성수전략정비구역 제4지구 재개발사업을 수주하며 프리미엄 도시정비 시장에서 다시 한번 경쟁력을 입증했다. 하이엔드 브랜드 '르엘'과 초고층 시공 기술력을... 
2026-07-06,네이버뉴스,"롯데벤처스, 10년간 부산 스타트업 34곳 키웠다",https://www.kmib.co.kr/article/view.asp?arcid=0030070327&code=61141311&cp=nv,"부산창조경제혁신센터와 함께 추진한 오픈이노베이션 프로그램을 통해 롯데백화점과 롯데건설, 롯데웰푸드, 롯데월드, 롯데글로벌로지스 등 계열사와 스타트업 간 협업 39건을 성사시켰다. 또 글로벌 진출 프로그램을... "
2026-07-06,네이버뉴스,"롯데건설, ‘롯데리조트 울산’ 창립 회원권 분양",https://www.sedaily.com/article/20064250?ref=naver,롯데건설이 울산 북구 강동관광단지에 조성 중인 ‘롯데리조트 울산’의 콘도미니엄 창립 회원권 분양에 나섰다. 롯데건설은 이달 1일 울산 남구 문수로 일원에 롯데리조트 울산 홍보관을 열고 회원권 상담과 분양을... 
2026-07-06,네이버뉴스,"롯데건설, 울산 첫 리조트 '롯데리조트 울산' 회원권 분양",https://www.pinpointnews.co.kr/news/articleView.html?idxno=465893,롯데건설 제공 동남권 관광 인프라 확충이 본격화되는 가운데 울산에도 처음으로 대규모 리조트가 들어선다. 숙박을 넘어 워터레저와 체험형 콘텐츠를 결합한 복합 휴양시설이 조성되면서 지역 관광 경쟁력 강화에도... 
2026-07-06,네이버뉴스,"성수4지구 재개발, 시공자로 롯데건설 선정",https://www.housingherald.co.kr/news/articleView.html?idxno=62232,서울 성수전략정비구역 내에서 유일하게 최고 64층 초고층 재개발을 추진하며 한강변 최대어로 꼽혀온 성수4지구의 시공권이 결국 롯데건설의 품으로 돌아갔다. 성수4지구 재개발 조합은 지난 7월 5일 오후 서울... 
2026-07-06,네이버뉴스,"[초점] 롯데, 신동빈표 AI 대전환 '드라이브'",http://www.newswatch.kr/news/articleView.html?idxno=80296,또 롯데이노베이트는 롯데건설과 함께 건설 현장용 AI 실시간 음성번역 에이전트를 개발했다. 지원 언어를 20개국으로 확대하는 한편 건설 전문 용어와 현장 은어를 학습시켜 외국인 근로자와의 의사소통과... 
2026-07-06,네이버뉴스,"롯데건설, ‘롯데리조트 울산’ 콘도미니엄 창립 회원권 분양",https://biz.chosun.com/real_estate/real_estate_general/2026/07/06/VPU2P3RWT5HWNF5LV4CA6QKFIE/?utm_source=naver&utm_medium=original&utm_campaign=biz,롯데건설이 울산 북구 강동관광단지에 조성 중인 ‘롯데리조트 울산’ 홍보관을 지난 1일 개관하고 콘도미니엄 창립 회원권 분양을 시작했다고 6일 밝혔다. 롯데리조트 울산은 울산 최초의 리조트이자 롯데리조트의... 
2026-07-06,네이버뉴스,"삼성전자, 갤워치로 폭염 속 노동자 지킨다···폭염 대응 글로벌 '산업...",https://www.newsfreezone.co.kr/news/articleView.html?idxno=698025,롯데건설은 건설현장 근로자의 온열질환을 막기 위해 체감온도를 실시간 감시하는 사물인터넷(IoT) 플랫폼을 전국 80개 현장에서 가동한다고 지난 2일 밝혔다. 스마트 설루션 기업 엔비즈소프트와 공동 개발한 이... 
2026-07-06,네이버뉴스,"""탈서울? 우린 선택했다"" 서울러 60%가 둥지 튼 이곳",https://www.econovill.com/news/articleView.html?idxno=744397,"롯데건설은 경기도 부천시 원미구 상동 일원에서는 '상동역 롯데캐슬 시그니처'의 분양을 앞두고 있다. 지하 8층~지상 49층, 7개 동, 전용면적 84~192㎡, 총 1859가구의 대단지 규모다. 경기도 의왕시 삼동에서는... "
2026-07-06,네이버뉴스,"롯데건설, 1.3조 규모 성수4지구 재개발사업 수주",https://www.fetv.co.kr/news/articleView.html?idxno=305832,롯데건설이 총 공사비 1조3492억원의 서울 성동구 '성수전략정비구역 제4지구 주택재개발정비사업'을 수주했다. 5일 서울 강남구 예림당 아트홀에서 열린 시공사 선정 총회에서 조합원 620명 중 449표를 얻어 최종... 
2026-07-06,네이버뉴스,"김경기 부장 ""은마 14→49층·잠실주공5단지 15→65층으로 탈바꿈…강남...",http://www.mbn.co.kr/pages/news/newsView.php?news_seq_no=5204070,"그러면서 이번에 롯데건설이 이번 달에 주상복합을 이 자리에 분양한대요. 그래서 지상 49층 그러니까 49층 7개 동, 1859가구나 되고요. 거의 2천 가구 되는 굉장히 큰 가구인데 그중에 1370가구가 국민 평형인 전용 84... "
2026-07-06,네이버뉴스,"롯데건설, '롯데리조트 울산' 회원권 분양…2027년 개장 목표",https://www.widedaily.com/news/articleView.html?idxno=297017,"롯데건설은 울산 북구 강동관광단지에 조성 중인 '롯데리조트 울산' 홍보관을 개관하고, 콘도미니엄 창립 회원권 분양에 나섰다고 6일 밝혔다. 이 리조트는 울산 지역 첫 리조트이자, 롯데리조트의 다섯 번째 직영... "
2026-07-06,네이버뉴스,"신동빈 회장, 3세 신유열과 바이오 송도 공장 방문…""새로운 도약 이끌...",https://www.newspost.kr/news/articleView.html?idxno=224007,"이 자리에는 박제임스 롯데바이오로직스 각자대표와 신유열 롯데바이오로직스 각자대표 겸 롯데지주 미래성장실장, 오일근 롯데건설 대표이사 등이 함께했다. 신 회장은 생산시설 주요 공정 시설을 직접 둘러보고... "
2026-07-06,네이버뉴스,64층 성수4지구 롯데건설이 품었다,https://www.naeil.com/news/read/594269?ref=naver,롯데건설이 서울 성동구 ‘성수전략정비구역 제4지구 주택재개발정비사업’(성수4지구) 시공권을 확보했다. 6일 롯데건설에 따르면 성수4지구 조합은 5일 서울 강남구 예림당 아트홀에서 열린 시공사 선정 총회에서... 
2026-07-06,네이버뉴스,"'서울 떠나 경기로' 3년간 84만명 이주 .... ""주거비 부담이 밀어낸 이동...",http://www.worktoday.co.kr/news/articleView.html?idxno=86428,"롯데건설은 이달 경기 부천시 원미구 상동 일원에 '상동역 롯데캐슬 시그니처'를 분양할 예정이다. 단지는 지하 8층~지상 49층, 7개 동, 전용면적 84~192㎡, 총 1,859가구 규모다. SK에코플랜트는 이달 경기 의왕시... "
2026-07-06,네이버뉴스,"신동빈 회장, 롯데바이오로직스 송도 공장 점검…CDMO 경쟁력 직접 챙겼...",https://www.e-science.co.kr/news/articleView.html?idxno=131501,"현장에는 박제임스 롯데바이오로직스 각자대표와 신유열 롯데바이오로직스 각자대표 겸 롯데지주 미래성장실장, 오일근 롯데건설 대표이사 등이 함께했다. 신 회장은 바이오의약품 생산시설과 핵심 공정 설비를 직접... "
2026-07-06,네이버뉴스,"“바이오, 롯데 도약 핵심”… 신동빈, 송도 공장 방문",https://www.munhwa.com/article/11600567?ref=naver,"신 회장의 현장 점검엔 장남인 신유열 롯데바이오로직스 각자대표 겸 롯데지주 미래성장실장과 박제임스 롯데바이오로직스 각자대표, 오일근 롯데건설 대표가 함께했다. 그는 현장에서 “공장 준공 이후로 예정된... "
2026-07-06,네이버뉴스,"신동빈 롯데 회장, 송도 공장 점검… 바이오 사업 성장동력 확보 본격화",https://www.ezyeconomy.com/news/articleView.html?idxno=237134,"현장에는 박제임스 롯데바이오로직스 각자대표, 신유열 롯데바이오로직스 각자대표 겸 롯데지주 미래성장실장, 오일근 롯데건설 대표이사 등이 함께했다. 신 회장은 ""바이오는 그룹의 새로운 도약을 이끌 핵심 산업군... "
2026-07-06,네이버뉴스,서울 집값 부담에 '탈서울' 행렬…전출자 60% 경기로 향했다,https://www.widedaily.com/news/articleView.html?idxno=297012,"롯데건설도 이달 부천시 원미구 상동 일원에 '상동역 롯데캐슬 시그니처'를 분양한다. 단지는 지하 8층~지상 49층, 7개동, 전용면적 84~192㎡, 총 1859가구 규모다. 지하철 7호선 상동역 초역세권 입지로 인근에는 GTX... "
2026-07-06,네이버뉴스,"롯데건설, 1조3천억원 성수4지구 재개발 수주…'성수르엘 S70' 조성",https://www.webeconomy.co.kr/news/articleView.html?idxno=2222765,롯데건설이 서울 성동구 성수전략정비구역 제4지구 재개발사업 시공권을 따내며 올해 도시정비사업 누적 수주액 2조8천억원을 돌파했다. 롯데건설은 지난 5일 열린 시공사 선정 총회에서 조합원 투표를 거쳐... 
2026-07-06,네이버뉴스,"“아무래도 서울엔 집 못 구하겠어” 집 때문에 경기로 이사, ‘고양’...",https://biz.heraldcorp.com/article/10799233?ref=naver,"롯데건설은 이달 경기 부천시 원미구 상동 일원에 ‘상동역 롯데캐슬 시그니처’를 분양한다. 단지는 지하 8층~지상 49층, 7개 동, 전용면적 84~192㎡으로 구성된 총 1859가구 규모 대단지다. 지하철 7호선 상동역... "
2026-07-06,네이버뉴스,부산 창업 생태계 ‘성장 사다리’ 된 롯데벤처스…14기 출범,https://www.sedaily.com/article/20064167?ref=naver,"롯데백화점과 롯데건설, 롯데웰푸드, 롯데글로벌로지스 등 그룹 계열사와 지역 스타트업을 연결하는 오픈이노베이션 프로그램을 통해 지금까지 39건의 협업을 성사시켰다. 또 부산창조경제혁신센터와 함께 28개... "
2026-07-06,네이버뉴스,"[건설 레이더] SK에코플랜트·두산건설·롯데건설, 차별화 주거 서비스...",http://www.thevaluenews.co.kr/news/view.php?idx=199876,"두산건설은 쌍용건설과 함께 다음달 경기 부천시 일대의 건물을 분양하고 롯데건설은 성수동 한강변에 최고 64층의 초고층 랜드마크 단지를 조성한다. ◆ SK에코플랜트, 교육·카페 전문서비스 브랜드와 주거서비스 모델... "
2026-07-06,네이버뉴스,성수4지구 품은 롯데건설…올해 정비사업 수주 2.8조 넘겼다,http://www.smedaily.co.kr/news/articleView.html?idxno=359817,성수르엘 S70 투시도 롯데건설이 서울 성동구 성수전략정비구역 제4지구 재개발사업 시공권을 확보했다. 한강변 초고층 정비사업지로 꼽히는 성수4지구를 수주하면서 올해 도시정비사업 누적 수주액은... 
2026-07-06,네이버뉴스,"신동빈 롯데 회장, 송도 바이오 공장 점검…CDMO 사업 본격화 준비",http://www.popcornnews.net/news/articleView.html?idxno=125679,"이날 현장에는 박제임스 롯데바이오로직스 각자대표와 신유열 롯데바이오로직스 각자대표 겸 롯데지주 미래성장실장, 오일근 롯데건설 대표이사 등이 함께했다. 신 회장은 생산 공정 시설을 직접 점검하고 글로벌 고객사... "
2026-07-06,네이버뉴스,"신동빈 롯데 회장, 바이오 송도 공장 점검…""그룹 도약 이끌 핵심 산업...",http://www.dailypop.kr/news/articleView.html?idxno=100338,"현장에는 박제임스 롯데바이오로직스 각자대표와 신유열 롯데바이오로직스 각자대표 겸 롯데지주 미래성장실장, 오일근 롯데건설 대표이사 등이 동행했다. 사진=신동빈 롯데 회장이 3일 인천 연수구에 위치한... "
2026-07-06,네이버뉴스,서울 주택가격 부담에 '탈서울' 가속화... 10명 중 6명 발길 쏠린 '이곳...,https://www.getnews.co.kr/news/articleView.html?idxno=874219,"롯데건설은 이달 경기 부천시 원미구 상동 일원에 '상동역 롯데캐슬 시그니처'를 분양할 예정이다. 단지는 지하 8층~지상 49층, 7개 동, 전용면적 84~192㎡, 총 1,859가구 규모다. 지하철 7호선 상동역 초역세권 입지로... "
2026-07-06,네이버뉴스,"롯데건설, 성수4지구 시공자로 선정… '성수 르엘 S/70' 변신",https://www.arunews.com/news/articleView.html?idxno=64574,롯데건설이 서울 성동구 성수전략정비구역 제4지구의 시공권을 따냈다. 성수4지구 재개발조합(조합장 정영보)은 지난 5일 강남구 예림당아트홀에서 시공자 선정 총회를 개최했다. 이날 총회 제1호 안건인 시공자... 
2026-07-06,네이버뉴스,"신동빈 롯데그룹 회장, 미래 준비 속도…신사업·글로벌 직접 챙긴다",https://news.tf.co.kr/read/economy/2339977.htm,"현장 점검에는 박제임스 롯데바이오로직스 각자 대표와 신유열 롯데바이오로직스 각자 대표 겸 롯데지주 미래성장실장, 오일근 롯데건설 대표 등이 함께했다. 바이오는 신 회장이 그룹의 미래 먹거리로 점찍은 핵심... "
2026-07-06,네이버뉴스,롯데가 짓는 울산 첫 리조트 ‘롯데리조트 울산’ 홍보관 개관,https://www.mk.co.kr/article/12091025,롯데건설이 울산 북구 강동관광단지에 짓고 있는 ‘롯데리조트 울산’ 홍보관을 지난 1일 열고 콘도미니엄 창립 회원권 분양을 시작한다고 6일 밝혔다. 울산에서 처음 선보이는 리조트로 롯데리조트가 직접 운영하는... 
2026-07-06,네이버뉴스,"롯데건설, 1.3조 규모 '성수4지구' 재개발 수주",https://www.job-post.co.kr/news/articleView.html?idxno=220049,롯데건설이 총공사비 1조 3492억 원 규모의 서울 성동구 '성수전략정비구역 제4지구(성수4지구) 주택재개발정비사업' 시공권을 획득했다. 이번 사업은 서울시 성동구 성수2가1동 일대에 지하 6층~지상 64층 규모의... 
2026-07-06,네이버뉴스,"롯데건설, 974실 규모 '롯데리조트 울산' 홍보관 개관",http://www.beyondpost.co.kr/view.php?ud=202607061048093087205868f676_30,롯데건설이 울산 북구 강동관광단지에 조성 중인 '롯데리조트 울산' 홍보관을 열고 콘도미니엄 창립 회원권 분양을 시작했다. 롯데건설은 지난 1일 울산 북구 산하동 강동관광단지에 조성하는 '롯데리조트 울산... 
2026-07-06,네이버뉴스,"롯데건설, 울산 첫 리조트 회원권 분양…2027년 개장 목표",https://www.gpkorea.com/news/articleView.html?idxno=144427,롯데건설은 울산 북구 강동관광단지에 조성 중인 '롯데리조트 울산' 홍보관을 열고 콘도미니엄 창립 회원권 분양을 시작했다고 6일 밝혔다. 롯데리조트 울산은 울산 지역 첫 리조트이자 롯데리조트의 다섯 번째 직영... 
2026-07-06,네이버뉴스,"롯데건설, '롯데리조트 울산' 회원권 분양…내년 개장 목표",https://www.mt.co.kr/estate/2026/07/06/2026070610122296793,롯데건설이 울산 지역에 숙박과 레저시설을 갖춘 복합 휴양시설을 조성한다. 울산 지역에 공급되는 첫 리조트이자 롯데리조트의 다섯 번째 직영 사업장이다. 롯데건설은 울산 북구 강동관광단지에 조성 중인... 
2026-07-06,네이버뉴스,"신동빈 롯데 회장, 송도 1공장 방문…""바이오는 새 도약 이끌 핵심 산업...",https://www.econovill.com/news/articleView.html?idxno=744375,"이 자리에는 박제임스 롯데바이오로직스 각자대표와 신유열 롯데바이오로직스 각자대표 겸 롯데지주 미래성장실장, 오일근 롯데건설 대표이사 등이 함께했다. 신 회장은 생산 시설 주요 공정 시설을 직접 둘러보고... "
2026-07-06,네이버뉴스,"울산 첫 리조트 '롯데리조트 울산', 콘도미니엄 창립 회원권 분양",https://www.hankyung.com/article/202607067473i,"롯데건설이 울산 첫 리조트인 '롯데리조트 울산' 콘도미니엄 278실의 창립 회원권 분양에 나선다. 울산 최초의 리조트이자 롯데리조트 브랜드의 다섯 번째 직영 사업장으로, 롯데리조트가 직접 운영하는 프리미엄 복합... "
2026-07-06,네이버뉴스,"신동빈 롯데 회장, 바이오 송도 공장 찾아",http://www.smedaily.co.kr/news/articleView.html?idxno=359804,"이 자리에는 박제임스 롯데바이오로직스 각자대표와 신유열 롯데바이오로직스 각자대표 겸 롯데지주 미래성장실장, 오일근 롯데건설 대표이사 등이 함께했다. 신 회장은 생산시설 주요 공정 시설을 직접 둘러보고... "
2026-07-06,네이버뉴스,[Epic Why] 신동빈 회장은 왜 바이오에 공들이나?,http://www.globalepic.co.kr/view.php?ud=20260706102907896448439a4874_29,박제임스·신유열 각자대표와 오일근 롯데건설 대표 등 주요 임원진과 함께 생산시설 주요 공정을 둘러보고 글로벌 고객사 수주 현황 및 추진 전략을 보고받았다. 송도 1공장은 1.5만 리터급 배양기 8기를 갖춘 12만 리터... 
2026-07-06,네이버뉴스,"﻿신동빈 회장, 롯데바이오로직스 송도 공장 첫 현장 점검",https://www.mhj21.com/news/articleView.html?idxno=252980,"이 자리에는 박제임스 롯데바이오로직스 각자대표와 신유열 롯데바이오로직스 각자대표 겸 롯데지주 미래성장실장, 오일근 롯데건설 대표이사 등이 함께했다. 신 회장은 생산시설 주요 공정 시설을 직접 둘러보고... "
2026-07-06,네이버뉴스,"신동빈, 롯데바이오 송도공장 점검…""준공 후 일정 차질 없이 추진"" 당부",http://www.sisacast.kr/news/articleView.html?idxno=97471,"현장에는 박제임스 롯데바이오로직스 각자대표, 신유열 롯데바이오로직스 각자대표 겸 롯데지주 미래성장실장, 오일근 롯데건설 대표이사 등이 동행했다. 신 회장은 ""바이오는 그룹의 새로운 도약을 이끌 핵심 산업군... "
2026-07-06,네이버뉴스,"롯데벤처스, 부산서 10년간 스타트업 28개사 육성·34개사 투자",http://www.fnnews.com/news/202607061011041604,"대표적으로 부산창경센터가 운영하는 '스타트업 오픈이노베이션 챌린지'에 참여해 롯데백화점, 롯데건설, 롯데웰푸드, 롯데월드 등 계열사와 스타트업 간 협업과 기술검증(PoC)를 추진해 왔다. 또 부산창경센터와 함께... "
2026-07-06,네이버뉴스,"롯데건설, 1조3492억원 규모 성수4지구 재개발 수주",https://www.gokorea.kr/news/articleView.html?idxno=871193,롯데건설이 서울 성동구 성수전략정비구역 제4지구 주택재개발정비사업 시공권을 확보했다. 롯데건설은 지난 5일 서울 강남구 예림당 아트홀에서 열린 성수4지구 시공사 선정 총회에서 조합원 753명 가운데 620명이... 
2026-07-06,네이버뉴스,"롯데건설, 성수4지구 재개발 수주…공사비 1조3492억원",https://www.cstimes.com/news/articleView.html?idxno=712300,컨슈머타임스=정용규 기자 | 롯데건설이 서울 성동구 성수전략정비구역 제4지구 주택재개발정비사업 시공사로 선정됐다. 지난 5일 서울 강남구 예림당 아트홀에서 시공사 선정 총회가 열렸다. 전체 조합원 753명 중... 
2026-07-06,네이버뉴스,"롯데 신동빈 회장, 송도 바이오로직스 1공장 방문…장남 신유열 동행",http://www.queen.co.kr/news/articleView.html?idxno=459781,"이날 현장에는 박제임스 롯데바이오로직스 각자대표, 신유열 각자대표 겸 롯데지주 미래성장실장, 오일근 롯데건설 대표이사 등이 함께했다. 신 회장은 생산시설의 핵심 공정을 직접 둘러보고 글로벌 고객사 수주 대응... "
2026-07-06,네이버뉴스,"롯데건설, 성수4지구 수주… 한강 조망 품은 '성수르엘 S70' 시대 연다",https://www.e-science.co.kr/news/articleView.html?idxno=131466,| 이코노미사이언스 김연옥 기자 | 롯데건설이 서울 성동구 성수전략정비구역 제4지구 재개발사업의 시공사로 선정되며 서울 대표 주거지로 떠오른 성수동에 새로운 하이엔드 주거단지 조성에 나선다. 단순한 주택... 
2026-07-06,네이버뉴스,울산 첫 번째 리조트... '롯데리조트 울산' 창립 회원권 분양 시작,https://www.rcast.co.kr/news/articleView.html?idxno=31201,롯데건설은 지난 7월 1일 울산 북구 강동관광단지에 조성 중인 '롯데리조트 울산' 홍보관을 개관하고 콘도미니엄 창립 회원권 분양을 시작한다고 밝혔다. 울산 최초의 리조트이자 롯데리조트 브랜드의 다섯 번째 직영... 
2026-07-06,네이버뉴스,"신동빈 롯데 회장, 롯데바이오로직스 송도 공장 찾아 주요시설 점검",https://www.ekoreanews.co.kr/news/articleView.html?idxno=86881,"이 자리에는 박제임스 롯데바이오로직스 각자대표와 신유열 롯데바이오로직스 각자대표 겸 롯데지주 미래성장실장, 오일근 롯데건설 대표이사 등이 함께했다. 신 회장은 생산시설 주요 공정 시설을 직접 둘러보고... "
2026-07-06,네이버뉴스,"롯데건설, '울산 첫 리조트' 콘도 278실 회원권 분양",https://view.asiae.co.kr/article/2026070609583799128,롯데건설이 울산 첫 리조트인 '롯데리조트 울산' 콘도미니엄 창립 회원권 분양을 시작했다. 롯데건설은 울산 북구 강동관광단지에 조성 중인 롯데리조트 울산 홍보관을 지난 1일 열고 콘도미니엄 회원권 분양에... 
2026-07-06,네이버뉴스,"롯데건설, 강동관광단지에 '울산 첫 리조트' 띄운다",https://www.bizwork.co.kr/news/articleView.html?idxno=417115,"롯데건설이 울산 북구 강동관광단지에 조성 중인 '롯데리조트 울산' 홍보관을 열고 콘도미니엄 창립 회원권 분양에 나섰다. 울산 최초 리조트이자 롯데리조트 브랜드의 다섯 번째 직영 사업장으로, 동남권 해양관광 거점... "
2026-07-06,네이버뉴스,"'공장 말고 미래 점검'···롯데 신동빈, 바이오 현장 찾은 이유",https://www.smartbizn.com/news/articleView.html?idxno=147775,"박제임스 롯데바이오로직스 각자대표, 오일근 롯데건설 대표, 그리고 후계자인 신유열 롯데지주 미래성장실장 겸 롯데바이오로직스 각자대표까지 현장을 함께했다. 미국 시러큐스에서 송도까지···현장경영의 같은... "
2026-07-06,네이버뉴스,"롯데건설 서울 성수4지구 재개발 사업 수주, 1조3천억 규모",https://www.businesspost.co.kr/BP?command=article_view&num=441588,롯데건설> 롯데건설이 1조3천억 원 규모 성수4지구 재개발 사업을 수주했다. 6일 롯데건설에 따르면 서울 성동구 성수전략정비구역 제4지구 주택재개발정비사업 조합은 전날 총회를 열고 롯데건설을 시공사로... 
