date,source,title,link,description
2026-04-21,네이버뉴스,"""노후 97%·신규 공급 '제로'""…목동, 신축 갈증 속 기대감 커진다",http://www.newslock.co.kr/news/articleView.html?idxno=129032,"GS건설은 목동 핵심 입지인 양천구 목동 924번지 일대에 '목동윤슬자이'를 선보일 예정이다. 해당 사업은 지하 6층~지상 48층, 3개 동 규모의 복합개발 프로젝트로 조성되며, 주거·상업·커뮤니티 기능을 결합한 형태로... "
2026-04-21,네이버뉴스,"네이버, GS 풍력발전소에 지분 투자…""데이터센터용 재생에너지 수급""",https://www.getnews.co.kr/news/articleView.html?idxno=868268,"GS가 건설 중인 경상북도 영양군 소재 풍력발전단지는 연간 약 180기가와트시(GWh)의 전력을 생산할 수 있다. 2028년 상반기 상업운전 개시 후 네이버 데이터센터 각 세종, 각 춘천 등에 전력을 공급할 예정이다. 네이버는... "
2026-04-21,네이버뉴스,"네이버, GS풍력발전에 투자… “데이터센터용 재생에너지 수급”",http://www.segyebiz.com/newsView/20260421509785?OutUrl=naver,"GS가 건설 중인 경북 영양군 소재 풍력발전단지는 2028년 상업운전 개시 및 연간 약 180GWh의 전력 생산을 목표로 지어지고 있다. 이번 계약에 따라 풍력발전단지는 네이버 데이터센터 각 세종, 각 춘천 등에 전력을... "
2026-04-21,네이버뉴스,[건설업계 브리핑]GS건설·SK에코플랜트·한화건설부문·LH,https://daily.hankooki.com/news/articleView.html?idxno=1360131,"사진=챗GPT 생성 이미지 ◇GS건설, 인도 재생에너지 시장 파트너십 확대 20일 인도 델리에서 허윤홍 GS건설 대표(사진 왼쪽)과 비슈와지트 파르마르 아리 에너지 대표가 업무협약을 체결하고 기념사진을 촬영하고 있다.... "
2026-04-21,네이버뉴스,"GS건설, 인도 재생에너지 시장 파트너십 확대",https://www.betanews.net/article/view/beta202604210024,"허윤홍 GS건설 대표가 지난 20일 인도 델리를 찾아 현지 재생에너지 리파워링 기업 아리 에너지(Arie Energy), 인도 풍력발전 선두기업인 수즐론 에너지(Suzlon Energy)와 각각 업무협약(MOU)를 맺었다. 21일 GS건설에 따르면... "
2026-04-21,네이버뉴스,모디 인도 총리 “韓 ‘빨리빨리’ 배우겠다…국빈오찬에 韓기업인들을...,https://www.cnbnews.com/news/article.html?no=790277,"대표, GS건설 허윤홍 대표, SK 이형희 부회장, 크래프톤 김창한 대표 등이 초청됐다. 김용범 정책실장이 20일(현지 시간) 인도 뉴델리 한 호텔의 한국프레스센터에서 이재명 대통령과 나렌드라 모디 총리의 오찬 및 한-인도... "
2026-04-21,네이버뉴스,"GS건설, 인도 재생에너지 시장 공략…사업 다변화",http://www.wowtv.co.kr/NewsCenter/News/Read?articleId=A202604210292&t=NN,"GS건설이 인도 재생에너지 시장 공략에 나선다. GS건설은 지난 20일 인도 재생에너지 리파워링 기업 아리 에너지(Arie Energy), 인도 풍력발전 선두기업인 수즐론 에너지(Suzlon Energy)와 각각 업무협약(MOU)를 체결했다고... "
2026-04-21,네이버뉴스,"GS건설, 인도서 풍력·태양광 결합 재생에너지 사업 진출한 내용은?",http://www.newsworker.co.kr/news/articleView.html?idxno=422782,"GS건설은 지난 20일 인도 재생에너지 리파워링 기업 아리 에너지(Arie Energy), 인도 풍력발전 기업 수즐론 에너지(Suzlon Energy)와 각각 업무협약을 체결하고, 풍력 리파워링과 태양광·풍력·에너지저장장치를 결합한 인도... "
2026-04-21,네이버뉴스,"네이버, 데이터센터용 재생에너지 수급 안정성 강화",https://www.datanet.co.kr/news/articleView.html?idxno=211115,"GS가 건설 중인 경상북도 영양군 소재 풍력발전단지는 연간 약 180GWh의 전력을 생산할 수 있다. 2028년 상반기 상업운전 개시 후 네이버 데이터센터 각 세종, 각 춘천 등에 전력을 공급할 예정이며, 이를 통해 2029년 기준... "
2026-04-21,네이버뉴스,"GS건설, 인도 재생에너지 시장 공략 확대…풍력·태양광 파트너십 구축",https://www.mt.co.kr/estate/2026/04/21/2026042109573220583,"GS건설이 급성장하는 인도 재생에너지 시장 진출을 구체화하며 중장기 성장 동력 확보에 나선다. GS건설은 지난 20일 허윤홍 대표가 참석한 가운데 아리 에너지(Arie Energy), 수즐론 에너지(Suzlon Energy) 등 인도 에너지기업과... "
2026-04-21,네이버뉴스,한·인도 경제협력 강화…기업들도 '맞손',https://www.bigtanews.co.kr/article/view/big202604210008,"GS건설은 인도 재생에너지 기업 아리 에너지, 수즐론 에너지와 협약을 맺고 5년 내 1GW 규모의 풍력 리파워링 프로젝트 추진에 나선다. 네이버는 한국-인도 비즈니스 포럼에서 인도 최대 IT 기업 TCS와 업무협약을... "
2026-04-21,네이버뉴스,"""풍력+태양광 묶는다""⋯GS건설, 인도 에너지 사업 확장",http://www.inews24.com/view/1962012,"GS건설이 인도 재생에너지 시장에서 현지 기업과의 협력을 확대하며 사업 포트폴리오 다변화에 나섰다. GS건설은 인도 재생에너지 기업 아리 에너지(Arie Energy), 수즐론 에너지(Suzlon Energy)와 각각 업무협약(MOU)을... "
2026-04-21,네이버뉴스,‘소년공·짜이왈라’ 유대감… 한·인도 “차원 다른 협력”,https://www.munhwa.com/article/11583863?ref=naver,"뒷줄 오른쪽부터 이형희 SK 부회장, 최수연 네이버 대표, 허윤홍 GS건설 대표, 김창한 크래프톤 대표, 정기선 HD현대 회장. 연합뉴스 뉴델리=나윤석 기자 인도를 국빈 방문한 이재명 대통령이 20일(현지시간) 나렌드라 모디... "
2026-04-21,네이버뉴스,"네이버, GS풍력발전 지분 30% 인수…""데이터센터 재생에너지 확보""",https://biz.sbs.co.kr/article_hub/20000305652?division=NAVER,"네이버에 따르면 GS가 건설 중인 경상북도 영양군 소재 풍력발전단지는 연간 약 180GWh의 전력을 생산할 수 있습니다. 2028년 상반기 상업운전 개시 후 네이버 데이터센터 각 세종, 각 춘천 등에 전력을 공급할 예정이며... "
2026-04-21,네이버뉴스,"GS건설, 인도 재생에너지 협력 확대…현지 기업과 MOU",http://www.edaily.co.kr/news/newspath.asp?newsid=03699846645418416,GS건설이 인도 에너지 기업들과 손잡고 빠르게 성장 중인 인도 재생에너지 시장에서 중장기 성장 동력을 찾는다. 허윤홍 GS건설 대표(왼쪽)와 아리 에너지(Arie Energy) 비슈와지트 파르마르(Vishwajitsinh Parmar) 대표가... 
2026-04-21,네이버뉴스,"목동 ‘금싸라기’ 옛 KT 부지, 48층 복합개발 시작… “서남부 랜드마...",https://www.donga.com/news/Economy/article/all/20260421/133780671/1,"GS건설은 양천구 목동 924번지 일대, 과거 KT 정보전산센터가 자리했던 부지에 지하 6층~지상 48층, 3개 동 규모의 초고층 복합시설인 ‘목동윤슬자이’를 선보일 예정이다. 사업 시행은 부동산 개발업체 아이코닉이... "
2026-04-21,네이버뉴스,"GS건설, 인도 재생에너지 시장 영토 확장...현지 기업들과 맞손",https://www.the-pr.co.kr/news/articleView.html?idxno=61164,더피알=최진 기자｜GS건설이 인도 재생에너지 시장에 본격적으로 뛰어들며 미래 성장 동력 확보에 속도를 낸다. 단순한 건설 사업을 넘어 노후 설비 교체와 하이브리드 발전 등으로 사업 포트폴리오를 구체화하는... 
2026-04-21,네이버뉴스,"GS건설, 인도 신재생에너지 사업 본격 진출…기업 2곳과 MOU",http://www.yonhapnewstv.co.kr/AKR20260421113500or1,GS건설이 풍력 리파워링과 태양광·풍력·에너지저장장치를 결합한 인도 신재생에너지 전력공급 사업에 본격 진출합니다. GS건설은 이를 위해 지난 20일 인도 델리에서 허윤홍 대표가 참석한 가운데 인도 재생에너지... 
2026-04-21,네이버뉴스,"GS건설, 인도 재생에너지 파트너십 확대…풍력·태양광 사업 본격화",http://www.updownnews.co.kr/news/articleView.html?idxno=316969,인도 재생에너지 시장 공략에 나선 GS건설이 현지 기업들과 전략적 협력을 확대하며 풍력 리파워링부터 통합 전력공급 모델까지 사업 포트폴리오를 넓히고 중장기 성장 기반 강화에 속도를 내고 있다. GS건설은 20일... 
2026-04-21,네이버뉴스,"GS건설, 인도 재생에너지 시장 확대...현지 기업 2곳과 협력",https://www.youthdaily.co.kr/news/article.html?no=217775,풍력 리파워링 및 하이브리드 발전 모델 공동 개발 추진 허윤홍 대표 참석...5년 내 1기가와트 프로젝트 확보 목표  GS건설이 인도 재생에너지 기업들과 손잡고 현지 시장 파이프라인 구체화에 나섰다. GS건설은 허윤홍... 
2026-04-21,네이버뉴스,"GS건설, 인도 재생에너지 시장 진출 박차…“전문 기업 2곳과 업무협약...",https://www.mk.co.kr/article/12022709,풍력·리파워링 태양광·풍력·에너지저장장치 등 신재생에너지 시장 포트폴리오 확장 기후변화 대응·중장기 사업 체질 강화 일환 GS건설이 풍력 리파워링(Repowering)과 태양광·풍력·에너지저장장치를 결합한 인도... 
2026-04-21,네이버뉴스,인도 현지화 통해 ‘글로벌 사우스 공략’ 속도,https://biz.heraldcorp.com/article/10722004?ref=naver,"李대통령 印국빈방문 ‘비즈니스포럼’ 이재용 “현지기업되겠다는 자세로 진출” 현대차, 전기차 공동개발…전동화 전환 포스코 10.7조원 일관제철소 합작투자 HD현대·GS건설·네이버 파트너십 재계 2030년 500억弗 교역... "
2026-04-21,네이버뉴스,"GS건설, 인도 재생에너지 공략 본격화⋯풍력 리파워링·하이브리드 사업...",https://www.etoday.co.kr/news/view/2577660,"이투데이=이난희 기자 | 아리 에너지·수즐론과 MOU 5년 내 1GW 확보 목표, 통합 에너지 모델 구축 GS건설이 인도 재생에너지 기업들과 손잡고 현지 시장 공략을 본격화한다. GS건설은 20일 인도 델리에서 허윤홍 대표가... "
2026-04-21,네이버뉴스,"GS건설, 인도 재생에너지 확장…""풍력∙태양광 통합 모델 추진""",http://www.kdfnews.com/news/articleView.html?idxno=182315,GS건설은 인도 재생에너지 기업들과 협력해 풍력 리파워링과 통합 전력 사업에 진출한다고 21일 밝혔다. 현지 사업 파이프라인을 확대해 중장기 성장 기반을 강화하는 전략이다. GS건설은 아리 에너지와 협약을... 
2026-04-21,네이버뉴스,"[한-인도] 전자·車·조선 전방위 협력…李 ""인도 AI, 한국 반도체 결합...",https://www.polinews.co.kr/news/articleView.html?idxno=729052,"GS건설이 아리에너지, 수즐론에너지 등과 협력해 풍력단지 고효율화 사업에 착수했으며 네이버는 인도 최대 IT 기업인 TCS(Tata Consultancy Services)와 AI·클라우드 기술 및 B2C 서비스 중심의 전략적 협력을 추진하기로 했다.... "
2026-04-21,네이버뉴스,"GS건설, 인도 신재생에너지 공급 사업 본격 진출",http://www.datanews.co.kr/news/article.html?no=144426,"GS건설이 인도 재생에너지 시장에서 사업 확대에 나서며 중장기 성장 동력 확보를 추진한다. GS건설은 인도 재생에너지 기업 아리 에너지(Arie Energy), 인도 풍력발전 기업 수즐론 에너지(Suzlon Energy)와 각각 업무협약(MOU)를... "
2026-04-21,네이버뉴스,"네이버, 재생에너지 발전소에 직접 투자…국내 첫 사례",https://www.ekn.kr/web/view.php?key=20260421025438704,"GS가 건설 중인 경상북도 영양군 소재 풍력발전단지는 연간 약 180기가와트시(GWh)의 전력을 생산할 수 있다. 2028년 상반기 상업운전 개시 후 네이버 데이터센터 각 세종, 각 춘천 등에 전력을 공급할 예정이다. 네이버... "
2026-04-21,네이버뉴스,신설동역 도보 2분 역세권 '신설동 자이르네' 분양,https://realty.chosun.com/site/data/html_dir/2026/04/21/2026042101940.html,"GS건설 계열사 자이S&D가 공급하는 서울 동대문구 ‘신설동 자이르네’가 분양 중이다. 서울 동대문구 신설동 일원에 들어설 ‘신설동역자이르네’는 지하 4층 ~ 지상 최고 20층, 전체 3개 동, 전용면적 42~45... "
2026-04-21,네이버뉴스,"네이버, GS풍력발전 PPA 계약…""지분 30% 인수""",https://www.ddaily.co.kr/page/view/2026042111044320077,GS가 건설 중인 경상북도 영양군 소재 풍력발전단지는 연간 약 180GWh의 전력을 생산할 수 있다. 오는 2028년 상반기 상업운전 개시 후 네이버 데이터센터 각 세종·각 춘천 등에 전력을 공급할 예정이다. 이를 통해... 
2026-04-21,네이버뉴스,"GS건설, 인도 재생에너지 시장 공략 본격화…""현지 파트너십 확대""",https://www.financialpost.co.kr/news/articleView.html?idxno=256208,"GS건설이 인도 재생에너지 시장에서 사업 파이프라인을 구체화하며 중장기 성장동력 확보에 나선다. GS건설은 20일 허윤홍 대표가 참석한 가운데, 인도 재생에너지 리파워링 기업인 아리 에너지(Arie Energy), 인도 풍력발전... "
2026-04-21,네이버뉴스,"GS건설, 인도 재생에너지 시장 파트너십 확대…""중장기 사업 강화""",https://www.dailian.co.kr/news/view/1635941/?sc=Naver,"GS건설이 인도 재생에너지 시장에서 중장기 성장 동력 확보에 나선다. GS건설은 지난 20일 허윤홍 대표가 참석한 가운데 인도 재생에너지 리파워링 기업 아리 에너지, 인도 풍력발전 선두기업인 수즐론 에너지와 각각... "
2026-04-21,네이버뉴스,"GS건설 대표 허윤홍 인도 재생에너지 시장 파트너십 확대, ""성장 체계 완...",https://www.businesspost.co.kr/BP?command=article_view&num=436147,허윤홍 GS건설 대표이사 사장(왼쪽)이 지난 20일 인도 뉴델리에서 비슈와지트 파르마르 아리에너지 대표와 협약을 맺고 기념사진을 찍고 있다. GS건설 > 허윤홍 GS건설 대표이사 사장이 인도 시장 진출을 위해 현지... 
2026-04-21,네이버뉴스,이재명 대통령 인도 방문 맞춰 경제계 총출동···공급망 핵심축 인도...,https://www.pointdaily.co.kr/news/articleView.html?idxno=302138,"에너지와 디지털 분야도 속도를 냈다. GS건설은 현지 기업들과 풍력단지 고효율화 사업에 착수했고, 네이버는 인도 IT기업 TCS와 AI·클라우드 기술, 소비자 서비스 협력을 추진하기로 했다."
2026-04-21,네이버뉴스,"GS건설, 인도 재생에너지 시장 파트너십 확대…신성장 동력 확보",https://www.businessplus.kr/news/articleView.html?idxno=110890,20일 인도 델리에서 GS건설 허윤홍 대표(왼쪽)과 아리 에너지(Arie Energy) 비슈와지트 파르마르 대표가 업무협약을 체결하고 기념사진을 촬영하고 있다. /사진=GS건설 GS건설이 급성장하는 인도 재생에너지 시장에서... 
2026-04-21,네이버뉴스,"GS건설, 인도 재생에너지 시장 파트너십 확대한다",https://www.getnews.co.kr/news/articleView.html?idxno=868252,GS건설이 가파르게 성장하는 인도의 재생에너지 시장에서 사업 파이프라인을 명확히하며 중장기 성장 동력 확보에 나선다. 허윤홍 GS건설 대표가 이달 20일 참석한 상황에서 인도 재생에너지 리파워링 기업 아리... 
2026-04-21,네이버뉴스,"GS건설, 인도서 재생에너지 협력…현지 기업과 맞손",http://www.metroseoul.co.kr/article/20260421500118,태양광·풍력·에너지저장장치 결합 지난 20일 인도 델리에서 GS건설 허윤홍 대표(왼쪽)가 아리 에너지(Arie Energy) 비슈와지트 파르마르(Vishwajitsinh Parmar) 대표와 업무협약을 체결하고 기념촬영을 하고 있다./GS건설... 
2026-04-21,네이버뉴스,[건설업계 동향] 한화 건설부문ㆍ두산건설ㆍ부영그룹ㆍGS건설(4.21),http://www.weeklytoday.com/news/articleView.html?idxno=771945,"■ GS건설, 인도 재생에너지 시장 영토 확장...현지 전문 기업 2곳과 MOU - 풍력 리파워링·하이브리드 재생에너지 사업 추진 위해 아리·수즐론 에너지와 협력 - 허윤홍 대표 '선택과 집중' 전략...5년 내 1GW 규모 풍력... "
2026-04-21,네이버뉴스,"[오늘의 건설 브리핑] ""인도·금융·주거까지 판 키운다""···건설·공공...",https://www.smartbizn.com/news/articleView.html?idxno=142312,"■ GS건설, 인도 재생에너지 '정조준'···풍력·태양광 통합 모델 구축 GS건설이 급성장하는 인도 재생에너지 시장에서 사업 포트폴리오를 본격 확장하며 중장기 성장 기반 확보에 나섰다. 회사는 지난 20일 허윤홍... "
2026-04-21,네이버뉴스,"GS건설, 인도 신재생에너지 전력공급 사업 진출…중장기 동력 확보",https://biz.heraldcorp.com/article/10721884?ref=naver,인도 기업 아리 에너지·수즐론 에너지와 MOU 지난 20일(현지시간) 인도 델리에서 허윤홍(사진 왼쪽) GS건설 대표와 비슈와지트 파르마르(Vishwajitsinh Parmar) 아리 에너지(Arie Energy) 대표가 업무협약을 체결하고 기념사진을... 
2026-04-21,네이버뉴스,"GS건설, 인도 재생에너지 시장 진출…중장기 성장 동력 확보",https://www.kgnews.co.kr/news/article.html?no=892571,인도 아리 에너지·수즐론 에너지와 각각 업무협약 양사와 풍력발전소 등 에너지 공급 사업에 협력키로 GS건설이 인도 재생에너지 시장에서의 사업 파이프라인을 구체화하고 중장기 성장 동력 확보에 나선다. GS건설은... 
2026-04-21,네이버뉴스,[서울아파트거래] 이촌 LG한강자이 전용 203.12㎡ 63억으로 신고가,https://www.businesspost.co.kr/BP?command=article_view&num=436137,"GS건설 > 같은 면적 기준 2024년 5월 기록된 종전 최고가 51억 원(22층)을 12억 원 웃돌았다. LG한강자이는 최고 높이 25층, 10개동, 656세대 규모 단지로 2003년 4월 사용승인을 얻었다. LG건설(현 GS건설)이 한강... "
2026-04-21,네이버뉴스,"﻿﻿﻿﻿네이버, GS 풍력발전과 PPA 계약…지분 30% 인수",https://www.mhj21.com/news/articleView.html?idxno=251702,"GS가 건설 중인 경상북도 영양군 소재 풍력발전단지는 연간 약 180GWh의 전력을 생산할 수 있다. 2028년 상반기 상업운전 개시 후 네이버 데이터센터 각 세종, 각 춘천 등에 전력을 공급할 예정이며 이를 통해 2029년 기준... "
2026-04-21,네이버뉴스,"허윤홍 GS건설 대표 ""리파워링으로 인도 재생에너지 공략""",https://www.ezyeconomy.com/news/articleView.html?idxno=234900,GS건설이 인도 재생에너지 시장에서 단일 발전원을 넘어 '통합 전력 공급' 전략으로 사업 확장에 나섰다. 풍력 설비 개선과 태양광·에너지저장장치(ESS)를 결합한 구조를 동시에 추진하며 중장기 성장 기반 확보에 속도를... 
2026-04-21,네이버뉴스,"韓총수 파격 초청한 모디, HD현대·삼성·GS 언급하며 ""잘해보자""",https://www.asiatoday.co.kr/view.php?key=20260421010006481,"우리 측에서는 이재용·정의선·구광모 회장 외에 류진 한국경제인협회장, 장인화 포스코홀딩스 회장, 정기선 HD현대 회장, 조현준 효성 회장, 최수연 네이버 대표, 허윤홍 GS건설 대표, 이형희 SK주식회자 부회장, 김창한... "
2026-04-21,네이버뉴스,"GS건설, 인도 재생에너지 시장 공략 가속…풍력·태양광 파트너십 확대",https://www.fetv.co.kr/news/articleView.html?idxno=300835,GS건설이 급성장 중인 인도 재생에너지 시장에서 사업 확대에 나섰다. 현지 전문기업들과 손잡고 노후 풍력발전소 교체 사업과 태양광·풍력·에너지저장장치(ESS)를 결합한 통합 전력사업을 추진하며 미래 성장동력... 
2026-04-21,네이버뉴스,"﻿공급 막힌 목동...GS건설, 막힌 혈 뚫는다...﻿'목동윤슬자이' 공급 예...",https://www.bizwork.co.kr/news/articleView.html?idxno=414850,"GS건설은 목동 일대에 지하 6층`지상 48층 3개 규모의 복합개발 프로젝트 '목동윤슬자이'를 공급할 예정이다. 특히, GS건설은 '목동윤슬자이'에 새로운 주거 기준으로 하이퍼트라는 개념을 선보일 계획이다. 하이퍼트란... "
2026-04-21,네이버뉴스,"네이버, GS 풍력발전 발전소 지분 인수 및 PPA 계약",http://www.sisafocus.co.kr/news/articleView.html?idxno=359005,"GS가 건설 중인 경상북도 영양군 소재 풍력발전단지는 2028년 상반기 상업운전 개시 후 네이버 데이터센터 각 세종, 각 춘천 등에 전력을 공급할 예정이다. 이를 통해 2029년 기준 회사 전체 전력사용량의 약 46% 수준까지... "
2026-04-21,네이버뉴스,"GS건설, 인도 재생에너지 사업 확대…풍력·태양광 결합 모델 추진",https://www.seoultimes.news/news/article.html?no=2000095219,GS건설은 이러한 변화 속에서 인도 재생에너지 시장을 중심으로 사업 기회를 넓히고 있다. 기존 태양광 사업 경험을 바탕으로 풍력과 결합한 복합 전력 모델을 추진하며 사업 구조를 다각화하려는 시도로 풀이된다. 이번... 
2026-04-21,네이버뉴스,"李대통령, 세계 4위 인도 협력 강화…'교역 3위국' 베트남 국빈방문",https://www.newspim.com/news/view/20260421000245,"허윤홍 GS건설 대표, 이형희 SK 부회장, 김창한 크래프톤 대표가 초청됐다. [사진=KTV] 이 때문에 한국 주요 그룹 총수들이 인도에 이어 베트남 경제사절단에도 자원했다. 이 대통령은 베트남 순방 중에 또 럼 당 서기장과의... "
2026-04-21,네이버뉴스,"GS건설, 인도 재생에너지 기업 2곳과 협력",https://www.dnews.co.kr/uhtml/view.jsp?idxno=202604210953053620986,"GS건설이 인도 재생에너지 기업 2곳과 손잡고, 신재생에너지 시장에서 포트폴리오를 확장한다. GS건설은 지난 20일 허윤홍 대표가 참석한 가운데 인도 재생에너지 리파워링 기업 ‘아리 에너지’, 인도 풍력발전... "
2026-04-21,네이버뉴스,"GS건설, 인도 신재생에너지 시장 본격 공략…현지 기업과 MOU 체결",https://www.ajunews.com/view/20260421103328665,인도 노후 풍력 '리파워링' 및 '하이브리드 에너지 솔루션' 진출 토대 마련 아주경제=우주성 기자 wjs89@ajunews.com 20일 인도 델리에서 GS건설 허윤홍 대표(사진 왼쪽)과 아리 에너지(Arie Energy) 비슈와지트 파르마르... 
2026-04-21,네이버뉴스,"인도 재생에너지 시장 뚫는다...GS건설, 현지 선도기업과 맞손",https://www.ebn.co.kr/news/articleView.html?idxno=1706052,GS건설이 급성장하는 인도 재생에너지 시장에서 사업 파이프라인을 구체화하며 중장기 성장 동력 확보에 나선다. 허윤홍 GS건설 대표는 올해 신년사에서 미래 성장성이 높은 분야에서 새로운 사업 기회를 적극... 
2026-04-21,네이버뉴스,"[건설브리핑] 건설업계, 에너지·부동산·콘텐츠 분야 '전방위 MOU'",https://www.seoulfn.com/news/articleView.html?idxno=627028,"GS건설은 지난 20일 인도 재생에너지 리파워링 기업 아리 에너지(Arie Energy), 인도 풍력발전 수즐론 에너지(Suzlon Energy)와 각각 업무협약(MOU)를 체결하고, 풍력 리파워링(Repowering)과 태양광·풍력·에너지저장장치를... "
2026-04-21,네이버뉴스,"GS건설, 인도 재생에너지 사업 확대… 현지기업과 업무협약",https://biz.chosun.com/real_estate/real_estate_general/2026/04/21/QNCR6NXUPZG2HCTMSULCFHKE4E/?utm_source=naver&utm_medium=original&utm_campaign=biz,"GS건설이 인도 재생에너지 시장 공략에 속도를 낸다. GS건설은 21일 허윤홍 대표가 전날 인도 델리를 찾아 현지 재생에너지 리파워링 기업 아리 에너지(Arie Energy), 인도 풍력발전 선두기업인 수즐론 에너지(Suzlon Energy)와... "
2026-04-21,네이버뉴스,"GS건설·한화 건설부문, 신재생·부동산 개발로 사업 다각화 '박차'",https://www.cstimes.com/news/articleView.html?idxno=702736,지난 20일 인도 델리에서 허윤홍 GS건설 대표(사진 왼쪽)과 비슈와지트 파르마르 아리 에너지 대표가 업무협약을 체결하고 기념사진을 촬영하고 있다. 컨슈머타임스=김동역 기자 | GS건설이 인도 재생에너지 기업들과... 
2026-04-21,네이버뉴스,"GS건설, 인도 재생에너지 포트폴리오 확장… 중장기 성장 동력 확보",https://www.gokorea.kr/news/articleView.html?idxno=864189,"GS건설이 인도 재생에너지 기업들과 협력하며 현지 시장 공략을 본격화한다. GS건설은 지난 20일 인도 재생에너지 리파워링 기업 Arie Energy와 풍력 리파워링 사업 협력을 위한 업무협약(MOU)을 체결하고, 인도 풍력발전... "
