date,source,title,link,description
2026-07-07,네이버뉴스,간척지서 AI데이터센터 허브로…해남 솔라시도의 '변신',https://www.hankyung.com/article/2026070708681,화려한 청사진 뒤에는 부지를 조성하고 전력 인프라를 확보하며 산업 기반을 다져온 중견 건설사... 삼성SDS의 국가AI컴퓨팅센터(총사업비 2조5000억원)도 이달 착공을 앞두고 있다. 2002년 사업이 시작된 이후 2019년... 
2026-07-07,네이버뉴스,"낙도 소통·SOC 점검… 김태성 신안군수, '현장 중심' 첫 행보 속도",https://www.greened.kr/news/articleView.html?idxno=344475,교통 인프라 사업의 추진 상황을 점검했다. 특히 공사가 장기화되면서 주민 불편이 이어지고 있는 압해 신장... 이어 비금~암태 도로개설 공사와 관련해서는 향후 입찰과 착공 일정 등을 확인하고 사업이 차질 없이 추진될... 
2026-07-07,네이버뉴스,"[에너지소식] 한난, 공동주택 탈탄소화 협력…한수원, 새만금 수상태양...",https://www.ekn.kr/web/view.php?key=20260707026290135,공급 인프라의 일환으로 새만금 수상태양광 사업이 주목받고 있다. 이에 한수원은 이날 세미나에서 해양... 음성복합발전소 2호기는 내년 9월 착공해 2030년 준공까지 마칠 계획이다. 권명호 한국동서발전 사장은... 
2026-07-07,네이버뉴스,"동부건설, 춘천 주상복합 단독 수주…원도심 랜드마크 기대",https://news.dealsitetv.com/articles/172951,총 공사금액은 1015억원이며 공사기간은 착공 후 48개월이다. 사업지는 춘천 원도심 생활권 내 위치해 교육·의료·행정 등 기존 인프라를 이용할 수 있다. 춘천 주요 도로망과의 접근성도 갖춰 도심 내 주거 편의성 또한... 
2026-07-07,네이버뉴스,"김태성 신안군수, '도로 SOC 현안'... 첫 공식 일정 점검",http://www.newsworker.co.kr/news/articleView.html?idxno=435134,"입찰과 착공 일정을 확인하며 조속한 추진을 촉구했다. 신안군은 도로 기반시설 확충이 주민 정주 여건... 하루빨리 해소하고, 군민이 체감할 수 있는 교통인프라 확충과 지역 균형발전을 위해 총력을 기울이겠다""고 밝혔다."
2026-07-07,네이버뉴스,"'U자형 반도체 벨트' 남부 거점 도약…해남 솔라시도, 대한민국 AI 허브...",https://www.ajunews.com/view/20260707162146769,"삼성 17조 등 대규모 투자 확정…""즉시 착공 가능한 원스톱 인프라 완비"" 황준호 서남해안기업도시개발 대표 ""재생에너지 특별법 시급…인재 위한 파격적 라이프케어 특례 필요"" 아주경제=백두산 기자 102san@ajunews.com... "
2026-07-07,네이버뉴스,"""위기의 남원, 발로 뛰는 행정으로 살려낼 것""",http://www.jjn.co.kr/news/articleView.html?idxno=1045760,남원시는 이미 부지를 55% 이상 확보해 둬 즉시 착공할 준비가 끝난 상태입니다. 이와 함께 '경찰수련원' 역시... KTX와 고속도로 등 교통 인프라도 훌륭하게 갖춰져 있습니다. 현재 타당성 검토(BC 분석) 등으로 최종후보지... 
2026-07-07,네이버뉴스,"신안군, 도로 SOC 속도 높여 섬 교통 불편 줄인다",https://www.m-i.kr/news/articleView.html?idxno=1389126,"또 섬 주민들의 오랜 염원인 비금~암태 도로개설 공사의 향후 입찰과 착공 일정 등을 확인하고 조속한 사업... 김 군수는 ""군민이 체감할 수 있는 교통 인프라 확충과 지역 균형발전을 위해 총력을 기울이겠다""고 강조했다.... "
2026-07-07,네이버뉴스,"민형배 시장 ""반도체 클러스터 조성 …빠르고 치밀하게 준비""",https://www.cnbnews.com/news/articleView.html?idxno=1007232,"핵심 인프라인 부지·전력·용수 준비 상황을 집중 점검했다. 이번 현장점검은 지난 6일 청와대에서 열린... 바로 활용 가능한 부지가 약 63만 평에 달하는 만큼, 이르면 내년부터 1기 팹(공장) 착공에 들어가는 방안이 유력하다."
2026-07-07,네이버뉴스,[N2 포커스] '평균 10억' 서울 집값 잡힐까…부동산 세제 개편안 7월말 ...,https://www.news2day.co.kr/article/20260707500215,"산업 인프라를 대대적으로 지원하겠다는 구상을 밝혔다. ■ 서울 주택 평균 가격 첫 10억원 돌파 현... 국토교통부의 4월 주택통계를 보면 올해 1~4월 서울 아파트 착공은 전년 동기 대비 24.5%, 준공은 31.2% 감소했다. ■ OECD... "
2026-07-07,네이버뉴스,김태성 신안군수 첫 일정 익산국토청 방문...도로사업 속도전,https://www.newspim.com/news/view/20260707001067,"비금~암태 도로개설 사업은 향후 입찰과 착공 일정 점검과 함께 조속한 추진을 촉구했다. 면담은 장기... 교통 인프라를 확충하고 지역 균형발전을 이루겠다""고 말했다. 신안군은 도로 기반 확충이 정주 여건 개선과... "
2026-07-07,네이버뉴스,"진주시, 맞춤형 투자정책으로 기업 유치 속도",https://www.jeonmae.co.kr/news/articleView.html?idxno=1272341,"시는 연말 착공을 거쳐 2028년 상반기 준공을 목표로 사업을 추진하고 있다. 의료 인프라 확충도 병행된다. 기존 경상국립대병원과 함께 경남서부의료원 유치가 추진되고 있으며, 2029년 개원을 목표로 해 근로자와 시민이... "
2026-07-07,네이버뉴스,은마로 이사 온 대치키즈 가족들...이주 앞두고 전세대란 우려,http://www.popcornnews.net/news/articleView.html?idxno=125854,그중에서도 주목받는 것이 2028년 착공을 목표로 추진 중인 조합원 이주 문제다. 은마아파트는 여타 대단지... 좀 더 나가면 '대치동 학원가'로 불리는 교육 인프라도 있다. 대표 부촌인 강남 지역에 위치함에도... 
2026-07-07,네이버뉴스,직매립 금지 조치 안정적 정착위한 정부 노력 필요,https://www.kihoilbo.co.kr/news/articleView.html?idxno=3028215,현재 수도권에서는 27개 공공소각장 신·증설이 추진 중이나 실제 착공된 곳은 경기 성남시와 인천 옹진군 등... 민간 소각 업계는 공공 인프라가 구축될 때까지만이라도 우수 민간 소각시설을 '공공 협력시설'로 지정... 
2026-07-07,네이버뉴스,"김태성 신안군수, 도로 SOC 사업 해결 위해 익산국토청 방문",https://www.pressian.com/pages/articles/2026070716004346139?utm_source=naver&utm_medium=search,"압해-화원·비금-암태 등 핵심 국도사업 점검…""군민 체감 교통인프라 확충 총력"" 김태성 신안군수가 민선9기... 또한 서남해안 섬 지역 연결망 구축의 핵심 사업인 '비금-암태 도로개설 공사'에 대해서는 입찰과 착공 일정... "
2026-07-08,네이버뉴스,"""주거 안전망 구축·LH 조직혁신""...이성훈號, 숙원과제 산적하고 '출항...",https://www.youthdaily.co.kr/news/article.html?no=222466,"이 중 3기 신도시 조성이 집중된 경기북부본부 예산은 토지보상비 1조5천억원, 건물공사비 1조8천억원 등으로 나뉘어 고양 창릉과 남양주 왕숙 등 주요 지구의 인프라 구축과 주택 건설 전반에 투입된다. 앞서 LH는 올해... "
2026-07-08,네이버뉴스,公共 건설현장 ‘자재값 급등’ 직격탄,https://www.dnews.co.kr/uhtml/view.jsp?idxno=202607071438202430263,"공공건설 현장의 계약금액 조정 신청이 가파르게 증가해 작년 상반기 대비 3배 이상 급증한 것으로 나타났다. 이는 물가 상승분에 대한 공사비 조정 수요가 늘어나고 있다는 의미로, 하반기엔 그 규모가 더... "
2026-07-08,네이버뉴스,100억 미만 공사도 표준시장단가 적용?…“공사비 부족…안전ㆍ품질 우...,https://www.dnews.co.kr/uhtml/view.jsp?idxno=202607061350203570085,100억원 미만 공사에 표준시장단가를 적용할 경우 국내 대부분 현장에서 공사비 부족 문제가 심화될 수 있다는 우려가 뒤따르는 배경이다. 이는 곧 건설현장의 안전 및 품질에도 악영향을 미칠 수밖에 없다.... 
2026-07-08,네이버뉴스,공공주택 공급 속도전 '삐걱'…성남은 6년 밀리고 목표도 미달,https://www.news1.kr/realestate/general/6220420,공공주택건설사업' 계획 변경을 승인·고시했다. 이 사업은 경기 성남 중원구 성남동 2811번지 일원에... 토지 보상과 인허가 협의 지연에 공사비 상승까지 겹친 탓이다. 서진형 광운대 부동산법무학과 교수... 
2026-07-08,네이버뉴스,"[출근길포인트]삼성전자, 분기 영업익 '106조' 시대…미래사업 투자 실...",https://www.pointdaily.co.kr/news/articleView.html?idxno=310994,"현재 용인 국가산업단지에 6개 반도체 생산라인 구축을 추진하고 있으며 평택캠퍼스 P5 공장 건설도 진행... 총사업비 3262억원 가운데 2023년까지 2681억원이 보상비와 공사비 등으로 집행됐으며, 이전 예정지에서는... "
2026-07-08,네이버뉴스,[시론] ‘닥치고 공급’이 성과를 내려면,https://www.dnews.co.kr/uhtml/view.jsp?idxno=202607031847194580901,"더욱이 중동전쟁과 원화 약세로 인한 자재가격과 공사비 상승, 통화량 증가에 따른 인플레 우려의 심화... 촉진과 건설산업 회생이라는 관점에서 적극적인 대책을 강구해야 한다. 급격하게 상승하고 있는 자재비와... "
2026-07-07,네이버뉴스,"양구, 고속철 국비 ‘임기초 행정력 집중’",https://news.kbs.co.kr/news/pc/view/view.do?ncd=8604681&ref=A,"이 마을부터 용하리까지 300여 미터를 잇는 철도 교량을 국비로 건설하라는 겁니다. 주민들은 마을이... 김 군수는 공사비의 70%, 최소 50억 원 이상은 국비로 지원해야 한다는 입장입니다. [김왕규/양구군수 : ""이해관계를... "
2026-07-07,네이버뉴스,'트램 재검토'는 시민을 위한 책임행정이다,https://www.ulsanpress.net/news/articleView.html?idxno=578638,"최근 원자재 가격 상승과 공사비 증가 추세를 고려하면 실제 사업비는 더 커질 가능성이 높다. 문제는 건설 이후다. 국내 여러 경전철 사업은 이용객 부족으로 매년 막대한 운영 적자를 기록하고 있으며, 결국 시민의... "
2026-07-07,네이버뉴스,공사 재개 ‘스타필드 창원’… 연결로·공사 중단설 “사실무근”,http://www.knnews.co.kr/news/articleView.php?idxno=1545878,"일각에서는 공사비 상승으로 인해 공사가 중단됐다는 의혹도 흘러나왔다. 그러나 창원시와 시행사인... 당초 지하 7층~지상 6층, 연면적 24만 8000㎡ 규모로 추진됐으나, 건설 비용 증가 등으로 사업계획을 변경해 지하 4층... "
2026-07-07,네이버뉴스,충북도 건설현장 불법 하도급 차단 100여곳 실태점검,http://www.cctimes.kr/news/articleView.html?idxno=915492,"점검 대상은 토목, 건축, 투자유치, 치수방재, 상하수도, 농촌개발 등 6개 분야의 건설현장 약 100곳이다. 세부 점검 대상은 총공사비 50억원 이상 관급공사(보상비 제외), 연면적 5000㎡ 이상 공동주택 공사, 개발면적 30만... "
2026-07-07,네이버뉴스,"""추가 공사비 돌려달라"" 토지주 소송…법원 ""건설사 책임 없어""",https://www.sidae.com/article/2026070719125649655,"건물 신축을 위해 추가 체결한 보강토 시공 계약이 불필요했다며 토지 소유자가 건설사를 상대로 낸... 이어 ""1차 계약 금액 안에 대규모 보강토 공사비가 포함된다고 보기 어렵고 2차 계약 금액 역시 통상적인 단가 범위... "
2026-07-07,네이버뉴스,"창원시, 재건축·재개발 정비사업 속도 높인다",https://www.gnnews.co.kr/news/articleView.html?idxno=640570,"현재 재개발은 평균 12년, 재건축은 평균 8년이 소요되면서 공사비와 금융비용 증가로 조합원 부담이 커지고... 이와 함께 강 시장은 교통건설 분야와 관련해 ""국도대체우회도로가 국도로 지정·관리되는 과정에서 창원시... "
2026-07-07,네이버뉴스,"충북도, 건설공사 현장 100곳 대상 하도급 실태점검",https://www.ccdn.co.kr/news/articleView.html?idxno=1087165,"토목·건축·투자유치·치수방재·상하수도·농촌개발 6개 분야 건설현장 100곳이 점검 대상이다. 총공사비 50억원 이상 관급공사(보상비 제외), 연면적 5천㎡ 이상 공동주택공사, 개발면적 30만㎡ 이상 택지개발... "
2026-07-07,네이버뉴스,말뿐인 신속 공급… 신축매입임대 '소급'에 발목 잡히나,http://www.fnnews.com/news/202607071805574690,지난 5월 14일 국토교통부 장관이 참석한 가운데 열린 주택·건설업계와 타운홀 미팅에서도 공사비 연동형 매입임대에 대한 업계의 우려가 나왔다. 정부가 공사비 연동형 제도를 폐지하면서 LH가 현재 추진 중인... 
2026-07-07,네이버뉴스,"검단지역 주민단체 ""5호선 연장, 경제성 추락 막으려면 '원당지구' 반영...",https://www.joongboo.com/news/articleView.html?idxno=363730810,"대광위 노선안이 통과될 경우, 붕괴 사고가 발생했던 아파트 지하를 관통하게 돼 공사비 상승과 주민 불안을... 변경하면 건설비를 크게 절감할 수 있다. 최근 공개된 한국개발연구원 공공투자관리센터(PIMAC)의... "
2026-07-07,네이버뉴스,공급 늘리라는데 가격은 묶였다… 신축매입임대 '속도전' 딜레마,http://www.the-biz.co.kr/news/articleView.html?idxno=723998,"한국건설기술연구원에 따르면 건설공사비지수는 올해 5월 기준 137.67(잠정)을 기록했다. 이는 2020년(100 기준)과 비교하면 약 37% 오른 수준으로, 몇 년 사이 주택 공급 과정에서 부담해야 하는 건설 원가가 크게 늘어난... "
2026-07-07,네이버뉴스,건설현장의 외국인 근로자 의존도 이제는 현실을 인정해야 한다,https://www.koscaj.com/news/articleView.html?idxno=325137,"그러나 현재의 외국인 반장들은 공사비를 협상하고 인력을 관리하며 작업 품질까지 책임지는 현장의 중요한 주체로 성장하고 있다. 더욱 주목해야 할 부분은 문화와 언어의 문제다. 최근 건설현장에서는 베트남, 태국, 중국... "
2026-07-07,네이버뉴스,확성기 소음보다 큰 건설현장의 한숨,https://www.koscaj.com/news/articleView.html?idxno=325135,건설현장은 하루 일정이 곧 공사비와 직결되기 때문에 안정적인 인력 공급 체계는 무엇보다 중요하다. 일부 현장에서는 노조 전임자나 간부 운영 방식에 대한 문제 제기도 나온다. 물론 노조 활동을 위한 일정한 역할은... 
2026-07-08,네이버뉴스,"IREN, AI 인프라 전환과 기관 투자 유입 속 변동성 확대",https://www.tokenpost.kr/news/cryptocurrency/375769,"IREN은 호주 전력망 접근권 확보와 대규모 데이터센터 건설을 지속적으로 추진하고 있으며, 이는 아직... 상태로 리스크 요인 52주 최고가 대비 48% 조정 국면은 중장기 관점 매수 기회 가능성 GPU 15만 개 설치... "
2026-07-08,네이버뉴스,[비철금속 시황] 호르무즈 긴장에 알루미늄 반등…뉴욕증시는 반도체주...,https://kidd.co.kr/news/246639,중동 지정학 리스크 재부각…구리는 美 관세 결정 앞두고 관망 뉴욕증시는 반도체주 약세와 중동 지역... 시장에서는 운송·포장·건설용 수요를 고려할 때 올해 글로벌 알루미늄 시장이 공급 부족 상태를 이어갈... 
2026-07-08,네이버뉴스,"[오늘의 증시]美반도체 급락·중동 리스크 겹악재…코스피, 또 파랗게 질...",https://www.newsis.com/view/NISX20260708_0003699951,최근 한국 기업들의 공격적인 투자 발표와 마이크론 일본 공장 건설 등이 장기적 과잉 공급 이슈로... 중동발 지정학적 리스크도 투자심리를 위축시켰다. 영국해사무역기구(UKMTO) 등에 따르면 지난 24시간 동안에만... 
2026-07-08,네이버뉴스,"中, AI 칩 예산 46% '국산화'에 배정 계획… AI 가속기 판도, 추론 시장부...",https://www.g-enews.com/view.php?ud=202607080705596802fbbec65dfb_1,도시를 건설하며 AI 시장 장악을 시도한다. 핵심 전략은 '동수서산(동부 지역 데이터를 서부 지역에서 처리)... 둔화될 리스크가 있다. HBM 수요가 그래픽처리장치(GPU) 아키텍처 구조에 완전히 종속되어 움직이기... 
2026-07-08,네이버뉴스,"美 상무부, 中·멕시코발 철강·매트리스 반덤핑 조사 착수…우회수출 ...",https://www.g-enews.com/view.php?ud=2026070807194731382bd56fbc3c_1,검증 리스크’를 높이는 계기가 될 것으로 우려하고 있다. 특히 중국산 중간재를 수입해 완제품을 미국으로 수출하는 국내 건설기계 및 철강 가공업체는 원산지 증명 요구가 한층 까다로워질 전망이다. 증권가에서는... 
2026-07-08,네이버뉴스,"지루한 박스권 갇힌 리플(XRP), AI가 예측한 이달 말 최종 가격은?",http://coinreaders.com/246605,"전문가들은 올해 남은 기간의 XRP 가격에 대해 신중하면서도 건설적인 시각을 유지하고 있다. 올해 말... 위해서는 200일 이동평균선인 1.12달러 상향 안착이 중요하며, 이탈 시 추가 하락 리스크에 노출될 수 있다."
2026-07-08,네이버뉴스,PF 부실 장기화에 비은행권 '휘청'…실물경제도 부담,https://www.dailian.co.kr/news/view/1664348/?sc=Naver,"있다""며 ""PF 리스크가 큰 상황인 만큼 업계에서도 사업성 평가 시 부실 사업장 분류 기준에 대한 예외 적용 등 추가 완화를 지속적으로 건의하고 있다""고 말했다. 이어 ""현재 가장 큰 우려는 부동산·건설 경기 침체가... "
2026-07-08,네이버뉴스,[더벨][SM그룹 내부거래 진단] 내부거래 의혹 출발점 자녀들 개인회사,https://www.thebell.co.kr/free/content/ArticleView.asp?key=202607061540075000101038,"그럼에도 꾸준히 건설업과 해운업, 제조업 등 사업 다각화를 펼치며 위기를 극복해왔다. 이번엔... ◇계열사간 전방위 자산·자금 거래, 추가 리스크도 재계에선 이번에 공정위가 제재 대상에 올려 놓은 내부거래 이외... "
2026-07-08,네이버뉴스,"[N2 모닝 경제 브리핑-7월 8일] 美 증시, 반도체주 급락 여파·유가 급등...",https://www.news2day.co.kr/article/20260708500014,메모리 공급과잉 우려 부각 SK하이닉스 ADR에 낙폭 축소 중동 리스크에 장 후반 하락 키워 [뉴스투데이... 공장 건설 등이 장기적으로는 공급 과잉 요인으로 해석되기 시작하면서 투자심리가 위축됐다. 이에... 
2026-07-08,네이버뉴스,"""경고만 계속, 법은 제자리""… 사각지대 노린 민간임대주택",https://www.ccreview.co.kr/news/articleView.html?idxno=352204,주택건설사업계획 승인을 받아야 하고 착공 이후 입주자모집공고 승인을 거쳐야 분양이 가능하다. 임차인... 출자금을 납부한 시점부터 계약자는 법적 보호 없이 사업 리스크를 고스란히 떠안는 구조가 된다. 법의 빈자리... 
2026-07-08,네이버뉴스,"[박근종 칼럼] 변동성 키워 '투기판' 된 증시, '레버리지 ETF' 방치 곤란...",https://www.mhns.co.kr/news/articleView.html?idxno=752688,"무엇보다 '단일종목 레버리지 상장지수펀드(ETF)' 상품은 구조적으로 '음의 복리 효과'라는 리스크(Risk)를... 지역에 건설한다는 정책이 나왔으며, 정치권이 지난 6월 23일 국회 토론회에서 ""주식·부동산 미실현이익도... "
2026-07-08,네이버뉴스,방문요양센터·요양원… 유형별 창업·운영 노하우는,https://www.chosun.com/economy/realty/2026/07/08/S42OHYO5ZJDWJCHNL35S3KDTCA/?utm_source=naver&utm_medium=referral&utm_campaign=naver-news,"요양원 편에서는 까다로운 법적 기준과 장기요양급여 환수 리스크를 예방하는 실무 전략을 구체적으로... 시행사·건설회사 실무자, 기존 요양시설 운영·관리자 등이다. 박 대표는 “이번 교육을 통해 현장에서 검증한... "
2026-07-07,네이버뉴스,"한류, 문화를 넘어 경제가 되다…189억 달러 수출 뒤에 숨은 과제",http://www.ikoreanspirit.com/news/articleView.html?idxno=86242,"1970년대 건설 붐 시기 한국인이 쌓은 근면·성실 이미지, 즉 '한국 프리미엄'이라는 신뢰 자산이 자리한... 반한류 리스크 관리와 국가 유형별 맞춤 전략의 제도화를 제언했다. 일본 한류 수용의 양가성과 소비 지속의... "
2026-07-07,네이버뉴스,"BNK경영연구원, '동남권 경제' 중동 직격탄 맞아",https://www.gnnews.co.kr/news/articleView.html?idxno=640539,침체와 건설업 부진 여파로 취업자 수 증가 폭 역시 6천 명 선에 그치며 고용 시장마저 급격히 얼어붙었다. 연구원은 동남권이 전국 평균보다 이번 사태의 충격을 훨씬 크게 받는 원인으로 중동 리스크에 취약할... 
2026-07-07,네이버뉴스,"[DQN] 우리금융저축은행, 리스크 예방으로 연체율 최저…꼴찌 KB저축은행...",https://www.fntimes.com/html/view.php?ud=2026070217184270947c96e79780_18,"이는 건설업 대출 회수로 관련 잔액이 576억원에서 324억원으로 줄어든 데 따른 것으로, 현재 강화된 리스크 관리를 시행 중이라는 설명이 나온다. 신한저축은행도 건전성 지표를 전반적으로 개선했다. 올해 1분기... "
2026-07-07,네이버뉴스,"구윤철 ""실거주 보호, 투기는 차단""… 보유·거래세 동시 손질[부동산세...",http://www.fnnews.com/news/202607071820107630,"구 부총리는 ""물가와 생계비 부담을 안정적으로 관리하고 외환·금융 시장 리스크를 선제적으로 대응하며 경기회복의 온기가 국민의 삶 속으로 확산될 수 있도록 최선을 다하겠다""고 밝혔다. 대체 불가 대한민국의 건설을... "
2026-07-07,네이버뉴스,"'성능' 아닌 '동맹'… 캐나다, 한화오션 아닌 TKMS 택한 이유는?",https://www.econovill.com/news/articleView.html?idxno=744537,"시설 건설, 캐나다 자동차부품제조협회(APMA)와의 협력을 통한 K9 자주포 등 국산 방산 장비의 현지 생산 라인... 이번 잠수함 프로젝트를 두고 북극 항로의 개척으로 새롭게 부각되는 지정학적 리스크에 나토 동맹국 및... "
2026-07-07,네이버뉴스,"사우디, 홍해 원유 수송능력 확대 검토… 호르무즈 우회 수출길 넓힌다",https://www.kbmaeil.com/article/20260707500762,동서 파이프라인은 1980년대 초 건설된 시설로 사우디 동부 유전지대와 홍해 연안의 얀부(Yanbu) 항구를... 시장에서는 이번 검토가 단순한 인프라 확장을 넘어 중동 지정학적 리스크에 대비한 에너지 안보 전략의 일환으로... 
2026-07-07,네이버뉴스,"[4th-Infra] ""해외 스마트시티, 신도시·산단·PPP 잇는 사업구조 필요""",http://www.4th.kr/news/articleView.html?idxno=2114385,"포쓰저널 이현민 기자 박노준 KIND 차장이 2026년 7월 7일 서울 해외건설협회 교육센터에서 열린 '제4차... 특히 박 차장은 공공이 초기 리스크를 낮출 수 있도록 해야 한다고 설명했다. 그는 ""공공이 정부 간 협력(G2G)을... "
2026-07-07,네이버뉴스,"'작년 영업익 4배↑부채비율 73%' DL건설, 한기평 신용등급 6년연속 'A-'",https://www.catchnews.kr/news/articleView.html?idxno=125884,"DL건설 관계자는 7일 ""이번 신용등급 유지는 어려운 건설업황 속에서도 회사의 사업 경쟁력과 재무건전성을 대외적으로 인정받은 결과""라며 ""앞으로도 철저한 리스크 관리와 수익성 중심의 경영을 통해 회사가 추진... "
2026-07-07,네이버뉴스,"호르무즈 리스크에…""사우디, 우회 송유관 확대 추진""",https://www.edaily.co.kr/news/newspath.asp?newsid=04913446645512224,이것이 기존 인프라 증설을 통해 이뤄질지 아니면 별도의 송유관 건설을 포함할지는 불분명하다고... 사우디의 동서 송유관은 1980년대 초 건설됐다. 올해 2월 이란 전쟁 발발과 그에 따른 호르무즈 해협 봉쇄 이후 그... 
2026-07-07,네이버뉴스,호남 반도체 클러스터 속도전…제1전비 이전 해법 찾아라,http://www.jndn.com/article.php?aid=1783412626435621001,공장을 건설하기 위해서는 현재 공군 제1전투비행단이 점유하고 있는 826만㎡(250만평)의 부지가 온전히... 없어 리스크가 크다. 특히 지자체가 먼저 신공항을 지어주고 기존 땅을 받아 개발하는 현행 ‘기부 대 양여’... 
2026-07-07,네이버뉴스,"DL건설 주요 신용평가사의 신용등급 유지, 수익성 개선과 재무안정성 인...",https://www.businesspost.co.kr/BP?command=article_view&num=441772,"DL건설 관계자는 ""앞으로도 철저한 리스크 관리와 수익성 중심 경영을 기반으로 DL건설이 추진하고 있는 한국토지주택공사의 민간참여 공공주택사업, 도심 공공주택복합사업 등에서 수주를 이어 나가겠다""고... "
