date,source,title,link,description
2026-06-09,네이버뉴스,"[코스피·코스닥,현대건설 한미반도체 HD현대중공업 홈플러스 스피어 삼...",https://www.public25.com/news/articleView.html?idxno=47990,"퍼블릭타임스=[코스피·코스닥,현대건설 한미반도체 HD현대중공업 홈플러스 스피어 삼성중공업 화인베스틸 대한전선 태성등 8일 주요공시] ▲ 현대건설(000720) : 송파비즈클러스터피에프브이로부터... "
2026-06-09,네이버뉴스,[재계부] 성남·부산 '입찰 마감' 총력…서울·경기는 '재도전' 기류,https://www.youthdaily.co.kr/news/article.html?no=220442,"두 곳 모두 앞선 현장설명회에 현대건설, KCC건설, 동원개발 등 3개 사가 나란히 이름을 올렸다. 명장5구역은 13만4천589㎡ 부지에 지하 3층~지상 35층, 2천183가구를 짓는 대단지 프로젝트며, 안락1구역은 9만1천470.1... "
2026-06-09,네이버뉴스,'LH 힐스테이트?'…1만가구 민참사업에 건설사 줄섰다,https://news.bizwatch.co.kr/article/real_estate/2026/06/08/0047,시평 2위인 현대건설과 시평 4위 DL이앤씨가 이미 올해 민참사업을 수주했다. 시평 5위의 GS건설도 평택고덕 민참사업을 노리고 있다. 성대야구장에 '힐스테이트'…검단엔 첫 3파전 9일 한국토지주택공사에 따르면... 
2026-06-09,네이버뉴스,[아주증시포커스] 8800피가 순식간에 7000대로…고배율 베팅에 갇힌 투자...,https://www.ajunews.com/view/20260609071936288,"수주 ▷현대건설, 송파비즈클러스터피에프브이로부터 3조394억원 규모 위례신도시 복정역세권 복합개발사업 복합용지 2BL, 3BL 신축공사 수주 ▷태성, 해외 에이전트와 약 61억원 규모 PCB 자동화 장비 공급 계약... "
2026-06-09,네이버뉴스,"김정은 ""중국과 친선은 제1 전략사업""...어제 시진핑과 정상회담",https://www.newspim.com/news/view/20260609000047,"[사진=신화망 캡처] 조용성 특파원 = 2026.06.08 ys1744@newspim.com 그는 이어 ""중국 당과 정부, 중국 인민이 습근평(시진핑) 동지의 현명한 영도 밑에 사회주의 현대화 국가 건설에서 세계를 놀래우는 위대한 성과를 이룩하고... "
2026-06-09,네이버뉴스,"올 여름 역대급 폭염 예고…건설업계, 현장 ‘안전 최우선’ 총력전",https://www.dailian.co.kr/news/view/1653630/?sc=Naver,현대건설 역시 매년 혹서기마다 온열질환 예방 프로그램을 시행 중이다. 특히 올해는 근로자가 휴게시설에서 휴식을 인증하면 인센티브를 부여하는 ‘휴식 인증 인센티브 제도’를 최초로 도입한다. 또 폭염 작업에 신규... 
2026-06-09,네이버뉴스,[오늘의 IR] 기아ㆍ유한양행ㆍ에스앤에스텍 등,https://www.etoday.co.kr/news/view/2591661,"이투데이=김우람 기자 | △NH농우바이오, 2026년 상반기 KB SmallCap Corporate Day 참여 △현대건설, 한화투자증권 2026 Corporate Day 참가 △가비아, 회사에 대한 이해 증진 및 기업가치 제고 △케이엠더블유... "
2026-06-09,네이버뉴스,"[시행사분석] DSD삼호, 봉담 끝나자 매출 95% 급감…후속 파이프라인 공...",https://www.ebn.co.kr/news/articleView.html?idxno=1711646,GS건설과 현대건설이 시공을 맡아 2021년 분양을 시작했고 2024년 8월 준공됐다. 시행사는 공사 진행률에 따라 매출을 인식하는 만큼 준공 이후 해당 사업장의 수익 인식은 대부분 마무리된다. 봉담 종료는 예정된... 
2026-06-09,네이버뉴스,"대형 건설사, R&D조직 ‘새판짜기’",https://www.dnews.co.kr/uhtml/view.jsp?idxno=202606081051183780418,"8일 건설업계에 따르면 현대건설의 기술연구원과 현대엔지니어링의 미래기술추진단을 통합한 ‘HMG(Hyundai Motor Group)건설기술연구원’이 지난 1일부로 출범했다. HMG건설기술연구원 소속 인원은 200명 이상으로, 국내... "
2026-06-09,네이버뉴스,"""브랜드가 집값""…대형 건설사 정비사업 수주 쏠림 심화",https://www.newsis.com/view/NISX20260608_0003660793,현대건설과 삼성물산 등 대형 건설사들이 굵직한 도시정비사업을 잇따라 따내며 수주 잔고를 늘리고 있다. 대형 건설사들은 브랜드 경쟁력과 자금력을 앞세워 서울 강남과 한강벨트 등 알짜 정비사업을 사실상... 
2026-06-09,네이버뉴스,"[N2 모닝 경제 브리핑-6월 9일] 美 증시, 반도체 저가 매수에 나스닥·S&...",https://www.news2day.co.kr/article/20260608500175,"체결 - 현대건설(000720) : 송파비즈클러스터피에프브이로부터 3조394억원 규모 위례신도시 복정역세권 복합개발사업 복합용지 2BL, 3BL 신축공사 수주 - 아이비전웍스(469750) : 약 37억원 규모 2차전지 검사시스템... "
2026-06-09,네이버뉴스,정부는 재생에너지 전환 속도 주문…인력 모자란 공기업은 '제자리걸음...,https://www.edaily.co.kr/news/newspath.asp?newsid=01676086645480080,"한국중부발전이 한화오션·SK이터닉스·현대건설과 함께 전략적 투자자로 참여해 추진 중이다. (사진=중부발전) 국내 재생에너지 보급이 빠르게 늘고 있지만, 이를 이끄는 주체는 사실상 민간으로 나타났다. 최근 1년... "
2026-06-09,네이버뉴스,“당신이 이명박이야? 죽고싶어?” 박정희 경호실과 맞짱뜨다,https://www.joongang.co.kr/article/25435051,앞서 말했듯이 당시 서울 서빙고동에 있었던 현대건설 중기사업소는 국가적 대사였던 경부고속도로 건설 과정에서 핵심 역할을 했다. 경부고속도로 건설은 속도전이었다. 조속한 준공에 대한 박정희... 
2026-06-09,네이버뉴스,"""오늘 타설 안해요"" 수도권 레미콘 멈추자, 건설현장 '올스톱'",https://www.mt.co.kr/estate/2026/06/09/2026060819514264787,"현대건설은 이날 수도권 현장 가운데 레미콘 타설단계에 있는 사업장의 공정을 중단했다. 현대건설 관계자는 ""레미콘을 쏟아붓는 골조단계 현장은 즉시 공정을 멈췄다""며 ""정상운행하는 업체를 파악하고 있지만 수도권... "
2026-06-09,네이버뉴스,[백광엽 칼럼] 功九過一 'K자본'에 걸맞은 응원을,https://www.hankyung.com/article/2026060841671,창업가 정주영의 현대건설은 ‘20세기 최대 역사’로 불린 주베일항만공사를 성공시키며 오일쇼크 극복에 큰 몫을 했다. 창업가 이병철은 74세 때인 1983년 ‘미래의 대들보가 될 것’이라며 반도체에 올인해 5000만... 
2026-06-08,네이버뉴스,‘압여목성’ 80조 시공권…첫 깃발은 누구 [감평사의 부동산 현장진단...,https://www.mk.co.kr/article/12066809,이날 총회는 현대건설 컨소시엄(현대건설·㈜한화 건설부문)과 DL이앤씨 2파전으로 진행됐다. 이한우 현대건설 대표와 박상신 DL이앤씨 대표가 직접 현장을 방문할 정도로 양측 모두 수주에 총력을 기울였다.... 
2026-06-08,네이버뉴스,"정의선 회장 협력 제안에… 젠슨 황 CEO, ‘삼겹살·새만금AI밸리’로 화...",https://www.donga.com/news/Economy/article/all/20260608/134073427/1,"정의선 회장과 장재훈 현대차그룹 부회장, 박민우 사장(포티투닷 대표), 진은숙 사장(현대차·기아 ICT담당), 이한우 부사장(현대건설 대표), 김흥수 부사장(현대차그룹 글로벌전략담당), 신승규 부사장(현대차... "
2026-06-08,네이버뉴스,[이슈+]수도권 레미콘 운송노조 전면 휴업…건설현장 타설 중단·공정 차...,http://www.biztribune.co.kr/news/articleView.html?idxno=354506,이에 현대건설과 대우건설 등 주요 건설사들은 레미콘 사용이 필요한 타설 일정을 조정하거나 일부 공정을 중단하며 대응에 나섰다. 현대건설의 경우 수도권 현장에서 진행 중인 콘크리트 타설 작업 대부분을 멈춘 상태로... 
2026-06-08,네이버뉴스,[헬로스톡] 6/8 주목할 종목 : 서진시스템·한미약품·삼성물산·NAVER,https://www.hellot.net/news/article.html?no=113058,"다른 지주사(SK 1.4배, SK스퀘어 3.3배, 두산 18.7배) 및 시총 10조원 이상 건설사(현대건설 1.7배, 삼성E&A 1.8배, 대우건설 2.4배)와 비교해도 현저히 낮은 수준이다. 3분기 베트남 닌투언 2호기 팀코리아 시공사... "
2026-06-08,네이버뉴스,"시진핑 주석, 평양 ‘노동신문’에 기고…“전통 친선의 새로운 장 아로...",http://kr.people.com.cn/n3/2026/0608/c203278-20465033.html,중국은 ‘15차 5개년(2026~2030년) 계획’의 좋은 출발을 이뤘으며 중국식 현대화 건설의 새로운 국면을 개척하기 위해 분발하여 노력하고 있으며 두 번째 100년 목표를 향해 힘차게 나아가고 있다. 조선노동당은 제9차... 
2026-06-08,네이버뉴스,"정비사업 '슬로우스타터' 건설사, 마수걸이 수주 시동 건다",https://daily.hankooki.com/news/articleView.html?idxno=1374558,"8일 정비업계에 따르면 현대건설과 GS건설은 올해 정비사업에서 각각 8조, 7조원대 수주 실적을 기록하며 5대 건설사 전체 수주액의 70% 이상을 차지하고 있으며, 삼성물산은 약 3조 2440억원으로 3위, 대우건설이 2조... "
2026-06-08,네이버뉴스,"여의도 15개 단지 재건축 속도…삼부 조합 설립, 시범·목화 시공사 선...",https://realty.chosun.com/site/data/html_dir/2026/06/08/2026060803000.html,"당초 삼성물산과 현대건설의 빅매치가 예상됐으나, 현장에서는 현대건설이 시범아파트에서 발을 뺀 것으로 보고 있다. 현대건설은 광장아파트 38-1 재건축사업을 노린다는 이야기가 돌고 있다. 목화아파트도 지난달... "
2026-06-08,네이버뉴스,"코람코·브룩필드 계열 DCI, 40MW '안산 시화 AI 데이터센터' 착공",https://www.edaily.co.kr/news/newspath.asp?newsid=04496886645479752,"지난해 양사가 공동 개발계획을 공개한 데 이어, 시공사 현대건설의 본 착공을 통해 AI와 클라우드 수요 확대에 대응하는 디지털 인프라 투자전략을 실행하는 것이다. 안산 시화 AI 데이터센터(SEL02) 착공식 (사진... "
2026-06-08,네이버뉴스,"현대건설 위례신도시 복정역세권 복합개발사업 수주, 3조394억 규모",https://www.businesspost.co.kr/BP?command=article_view&num=439518,"현대건설이 3조 원이 넘는 역세권 복합개발사업을 따냈다. 현대건설은 5일 송파비즈클러스터피에프브이 주식회사와 위례신도시 복정역세권 복합개발사업 복합용지 2블록, 3블록 신축공사 관련 계약을 체결했다고... "
2026-06-08,네이버뉴스,"코람코·DCI, 안산에 40MW 인공지능 데이터센터 첫 삽",https://news.tvchosun.com/site/data/html_dir/2026/06/08/2026060890294.html,"지난해 두 회사가 공동 개발계획을 공개한 데 이어, 시공사 현대건설의 본 착공을 통해 AI와 클라우드 수요 확대에 대응하는 디지털 인프라 투자전략을 실행하는 것이다. 두 회사는 이날 경기도 안산시 단원구 성곡동... "
2026-06-08,네이버뉴스,수도권 레미콘 공급 차질…대형 건설사들 타설 중단,https://www.newsis.com/view/NISX20260608_0003660971,홍찬선 정유선 기자 = 수도권 레미콘 운송기사들의 전면 휴업이 현실화되면서 현대건설과 대우건설 등 주요 건설사들의 콘크리트 타설 공정이 중단되는 등 건설현장에 직접적인 영향이 나타나고 있다. 8일 건설업계에... 
2026-06-08,네이버뉴스,"현대엔지니어링, 공정거래 협약 참여... ""협력사 상생 강화""",http://www.thefirstmedia.net/news/articleView.html?idxno=200797,"사진=현대엔지니어링 건설 경기 둔화와 원가 부담 확대 등으로 업계 전반의 어려움이 이어지는 가운데, 건설사들이 협력사와의 상생 협력 강화에 나서고 있다. 특히 원·하도급 거래 관행 개선과 협력사 경영 안정 지원이... "
2026-06-08,네이버뉴스,"""입주하고 내세요""…분담금 납부유예 확산",https://www.hankyung.com/article/2026060839511,앞서 강남구 압구정5구역에선 현대건설과 경쟁한 DL이앤씨가 입주 후 7년 유예를 내걸었다. 분담금은 옛날 집을 새집으로 바꿀 때 내는 차액이다. 조합원 분양가가 권리가액(기존 건물의 감정평가액에 사업수익률을 곱한... 
2026-06-08,네이버뉴스,"서울시, GTX-A 철근 누락 현대건설 벌점 절차 본격화",https://www.pointdaily.co.kr/news/articleView.html?idxno=307465,"서울시가 GTX-A 삼성역 구간 철근 누락 사태와 관련해 현대건설 등에 대한 벌점 부과 절차를 본격화하는 모양새다. 다만 벌점 수위는 아직 확정되지 않았고, 1차 벌점위원회 결과를 토대로 당사자(현대건설) 의견을 받은 뒤... "
2026-06-08,네이버뉴스,[오늘의 주요공시] 현대건설ㆍ네이버ㆍ삼성중공업 등,https://www.etoday.co.kr/news/view/2591595,"이투데이=정수천 기자 | △현대건설, 3조394억원 규모 위례 복정역세권 공사 수주 △대한전선, 싱가포르서 1400억원 초고압 전력망 프로젝트 수주 △삼성중공업, LNG운반선 1척 3855억원에 수주 △한미반도체, 442억... "
2026-06-08,네이버뉴스,인천 삼산농산물도매시장 현대화 초읽기,https://www.incheonilbo.com/news/articleView.html?idxno=1324719,/출처=인천시 삼산농산물도매시장 시설현대화사업 건설공사 타당성조사 및 기본계획 수립 보고서 시설 노후화와 공간 부족으로 경쟁력이 약화한 삼산농산물도매시장의 현대화 사업이 정부의 총사업비 감액 결정... 
2026-06-08,네이버뉴스,[코스피 지수선물 옵션] 반도체 쇼크에 패닉 셀링... 삼성전자·SK하이닉...,https://www.pinpointnews.co.kr/news/articleView.html?idxno=458468,"산업재와 건설 업종에서는 현대건설과 대우건설, 삼성E&A가 모두 하락했다. 경기 민감 업종에 대한 투자심리가 위축되면서 매도 압력이 커진 것으로 분석된다. 항공과 운송 업종에서는 대한항공과 HMM, 한진칼 선물이... "
2026-06-08,네이버뉴스,"코람코, 안산 시화에 40㎿ AI 데이터센터",https://www.mk.co.kr/article/12068574,"AI와 클라우드 중심의 고성능 컴퓨팅 수요에 대응할 수 있도록 이중화 전력체계와 고신뢰 냉각 시스템, 높은 수준의 서비스 가용성을 확보하는 맞춤형 설계를 적용할 계획이라고 밝혔다. 시공은 현대건설이 맡았다."
2026-06-08,네이버뉴스,원자력 발전 현장 ‘안전 리스크’ 원천 차단…노사·협력사 전방위 연...,https://www.g-enews.com/view.php?ud=202606081441136022a9fc143920_1,"이날 현장에는 한수원 노동조합 대표와 더불어 한전KPS, 수산인더스트리 등 정비 전문 기업은 물론 현대건설, 삼성물산 등 대형 건설사를 포함한 총 18개 상주 협력회사의 최고경영자들이 참석했다. 이들은 각 기업이 보유한... "
2026-06-08,네이버뉴스,"코람코·DCI, 안산 시화 AI 데이터센터 착공…40MW 규모",https://www.cstimes.com/news/articleView.html?idxno=708857,시공은 현대건설이 맡았다. 코람코는 앞서 서울 가산동에 케이스퀘어 데이터센터 가산을 개발해 운영에 들어갔으며 의정부 리듬시티 내 100MW 규모 AI 및 복합 데이터센터 개발도 추진 중이다. 2032년까지 데이터센터... 
2026-06-08,네이버뉴스,"코람코·DCI, 안산 시화 AI 데이터센터 첫 삽",http://www.fntimes.com/html/view.php?ud=202606081631272761b372994c95_18,"시공은 현대건설이 담당한다. 이번 착공은 코람코의 데이터센터 사업 확대 전략의 연장선이다. 코람코는 앞서 서울 가산동에 '케이스퀘어 데이터센터 가산'을 개발해 운영 중이며, 의정부 리듬시티에서는 100MW 규모... "
2026-06-08,네이버뉴스,"[마켓인]HD건설기계, 신용등급 상향 가능성 높아졌다",https://www.edaily.co.kr/news/newspath.asp?newsid=04191846645479752,HD현대건설기계 40톤급 굴착기(HX400A).(사진=HD현대사이트솔루션) 나신평은 HD건설기계의 주요 등급 평가 요인으로 △HD현대인프라코어 합병에 따른 사업안정성 향상 △건설기계 수요 회복 및 견조한 엔진 매출에 따른... 
2026-06-08,네이버뉴스,기업 공시[6월 8일],https://www.sedaily.com/article/20053141?ref=naver,▲현대건설(000720)=송파주택도시피에프브이와 3조 394억 원 규모 위례신도시 복정역세권 복합개발사업 복합용지 2BL·3BL 신축공사 수주 ▲대한전선(001440)=싱가포르 전력청과 1401억 3184만 원 규모 전력... 
2026-06-08,네이버뉴스,"[젠슨 황의 깜짝선물] 현대차 정의선에게…""모빌리티와 결합, 미래 바꾸...",https://www.shinailbo.co.kr/news/articleView.html?idxno=5028373,"현장에는 장재훈 현대차그룹 부회장, 박민우 사장(포티투닷 대표 겸 현대차·기아 첨단차플랫폼(AVP) 본부장), 진은숙 ICT 담당 사장, 이한우 현대건설 사장, 김흥수 글로벌전략조직(GSO) 담당 부사장 등이 나와 황 CEO를... "
2026-06-08,네이버뉴스,수도권 건설현장 '올스톱'…레미콘 파업 '불똥'에 공정 차질 현실화,https://www.mt.co.kr/estate/2026/06/09/2026060815172111126,"현대건설은 이날 수도권 현장 가운데 레미콘 타설 단계에 있는 사업장의 공정을 중단했다. 현대건설 관계자는 ""레미콘을 쏟아붓는 골조 단계 현장은 즉시 공정을 멈췄다""며 ""정상 운행하는 업체를 파악하고 있지만 수도권... "
2026-06-08,네이버뉴스,"코람코·DCI, 안산 시화 40㎿ AI 데이터센터 착공…수도권 디지털 인프라...",https://weekly.hankooki.com/news/articleView.html?idxno=7168227,"양사는 이날 단원구 성곡동 사업부지에서 착공식을 열고 시공사 현대건설과 함께 사업 전 주기 실행 체계를 공식 가동했다. 안산 시화 AI 데이터센터(SEL02)는 부지 약 1만448㎡, 연면적 약 2만6810㎡(약 8110평) 규모의... "
2026-06-08,네이버뉴스,"코람코·DCI, AI 인프라 투자 확대... 안산 데이터센터 첫 삽",http://www.thefirstmedia.net/news/articleView.html?idxno=200731,"시공은 현대건설이 맡는다. 코람코는 이번 착공을 계기로 데이터센터 사업 확대에도 속도를 낸다는 방침이다. 앞서 서울 가산동 데이터센터 개발을 완료해 운영 중이며, 의정부 리듬시티 일대에서는 100MW 규모의 AI 및... "
2026-06-08,네이버뉴스,[거래소 외국인] 반도체 차익실현·방산 집중매수…투자전략 바뀌었나,https://www.pinpointnews.co.kr/news/articleView.html?idxno=458443,"이어 미래에셋증권과 HD현대중공업, 현대건설, 한화에어로스페이스, 한국항공우주 등이 상위권에 포함되며 방산과 조선, 건설 업종에 대한 관심이 확대됐다. 방산 업종에 대한 외국인 선호가 두드러졌다.... "
2026-06-08,네이버뉴스,주우정 현대엔지니어링 플랜트 앞세워 현대차그룹 내 체급 올리지만 : ...,https://www.huffingtonpost.kr/article/257781,지난 1일 현대건설과 R&D 조직을 통합해 출범한 'HMG건설기술연구원'은 그룹 내에서 현대엔지니어링의 역할이 확대됐음을 의미한다. 이러한 체질 개선과 재무 구조 재편의 중심에는 주우정 현대엔지니어링 대표이사... 
2026-06-09,네이버뉴스,"[투자의 품격]트러스톤, 행동주의는 빙산의 일각...전정한 힘은 '주식형...",https://news.bizwatch.co.kr/article/market/2026/06/08/0017,[편집자] 2013년 만도(현 HL만도)는 자회사 한라마이스터를 통해 부실 계열사 한라건설 유상증자에 우회... KCC에는 올해 2월 보유 중인 삼성물산 지분의 유동화 계획 수립 및 임직원 보상을 제외한 자사주 소각 계획을... 
2026-06-08,네이버뉴스,수도권 레미콘 8000대 멈췄다…파업 장기화땐 삼전닉스 공장도 차질,https://www.mk.co.kr/article/12068886,삼성전자 평택캠퍼스를 짓는 삼성물산도 지난 주말에 타설 작업을 몰아서 진행하는 등 8~9일 물량을 미리 확보했다. 이번주까지는 현장 자체 역량으로 버틸 수 있다는 설명이다. 하지만 사태가 장기화할 경우 건설현장... 
2026-06-08,네이버뉴스,‘최고 우량주’ 대우마리나 3차·경남마리나 재건축 본격 시동,https://www.busan.com/view/busan/view.php?code=2026060818341761254,"현재 삼성물산, GS건설, 롯데건설 등 1군 건설사 대부분이 마리나 시리즈 재건축 시공권에 관심을 보이는 것으로 알려졌다. 대우마리나 1·2·3차에 경남마리나까지 더하면 현재 마리나 타운에는 2538세대가 거주 중이다. 4개... "
2026-06-08,네이버뉴스,레미콘 8천대 '스톱'… 반도체 공사장 '비상',https://www.mk.co.kr/article/12068714,삼성전자 평택캠퍼스를 짓는 삼성물산도 지난 주말에 타설 작업을 몰아서 진행하는 등 8~9일 물량을 미리 확보했다. 이번주까지는 현장 자체 역량으로 버틸 수 있다는 설명이다. 하지만 사태가 장기화할 경우 건설현장... 
2026-06-08,네이버뉴스,"타운보드중앙, 반포래미안트리니원과 ‘타운보드’ 설치 계약",https://www.joongang.co.kr/article/25434893,"업계 관계자에 따르면 “건설사와 설계단계부터 협력할 수 있는 기술력과 노하우를 보유한 회사는 타운보드중앙이 유일하다”며 “현재 삼성물산뿐만 아니라 GS건설, DL건설 등과도 사업협력을 위한 논의를 하고 있는... "
2026-06-08,네이버뉴스,"[아유경제_재건축] 1245가구 조성 용호1구역 재건축, 시공자 현장설명회...",http://www.areyou.co.kr/news/articleView.html?idxno=94023,이날 현설에 참여한 곳은 삼성물산 동원개발 등 건설사로 파악됐다. 현설에서 좋은 결과를 얻은 조합은 예정대로 오는 25일 오후 2시 현설과 같은 장소에서 입찰을 마감한다는 구상이다. 이 사업은 창원 성산구... 
2026-06-08,네이버뉴스,"코스피 8% 빠져도 ""공포에 삽니다""...개미는 또 '줍줍'",https://www.mt.co.kr/stock/2026/06/09/2026060816063989245,"전기·전자, 제조, 금융, 의료정밀·기기, 건설 등은 8%대 내림세를 보였다. 엔비디아와 협력 소식으로 9.2... 두 종목의 지분을 각각 보유하고 있는 삼성물산과 SK스퀘어도 각각 11.29%와 11.13% 하락했다. 국내외... "
2026-06-08,네이버뉴스,"레미콘 휴업에 건설현장 비상…""공정 순서 바꿔 대응""",https://www.sidae.com/article/2026060815075832808,노조성 인정·건설사 협상 거론 삼성전자 평택캠퍼스 건설현장에선 노조가 토요일 4회전 운반 조건으로 하루 150만원 수준의 비용 인상을 요구했다. 삼성물산은 공기 단축을 위해 레미콘을 직접 생산·공급하는... 
2026-06-08,네이버뉴스,"""코스피 -8%·코스닥 -9%"" 비명 터졌는데...네이버 웃었다",https://www.mt.co.kr/stock/2026/06/08/2026060815034150935,"전기·전자, 제조, 금융, 의료정밀·기기, 건설 등은 8%대 내림세를 보였다. 엔비디아와 협력 소식으로 9.2... 두 종목의 지분을 각각 보유하고 있는 삼성물산과 SK스퀘어도 각각 11.29%와 11.13% 하락했다. 이날 원/달러... "
2026-06-09,네이버뉴스,중노위서 뒤집힌 사용자성 판단…건설업계 ‘혼란’,https://www.dnews.co.kr/uhtml/view.jsp?idxno=202606081351381020455,"전남지노위 기각한 타워노조 시정신청, 재심서 ‘인정’ DL이앤씨 사건도 인정…10대사 중 9개사 사용자 판단 중앙노동위원회가 지방노동위원회의하청노조 사용자성 기각 결정을 뒤집는 판정을 내놨다.지난 3월... "
2026-06-08,네이버뉴스,신통기획 탄력…여의도·성수·목동 정비사업 속도전,https://www.sentv.co.kr/article/view/sentv202606080068,"목동6단지는 오는 26일 시공사 선정 총회를 열고, 우선협상대상자인 DL이앤씨와의 수의계약 여부를 최종 결정할 예정입니다. 이 같은 흐름의 배경에는 오세훈 시장의 5선 성공이 있습니다. 오 시장은 이번 선거에서... "
2026-06-08,네이버뉴스,노량진·신길·장위 분양 잇따라···서울 분양시장 '재개발 대전',https://www.sisajournal-e.com/news/articleView.html?idxno=421588,앞서 노량진뉴타운에서는 DL이앤씨가 시공하는 노량진8구역 재개발 단지 '아크로리버스카이'가 지난달 27일 일반분양에 나섰다. 노량진뉴타운 내 첫 분양 단지인 노량진6구역 '라클라체자이드파인'은 지난달 1순위... 
2026-06-09,네이버뉴스,서울 역세권 '뉴타운 분양대전' 개막,http://www.ikld.kr/news/articleView.html?idxno=335668,"대우건설은 서울 성북구 장위뉴타운 10구역 주택재개발정비사업을 통해 '장위 푸르지오 마크원'을 6월 분양에 나선다. 이 단지는 지하 5층~지상 35층 23개동 전용 39~114㎡ 총 1,931세대 중 1,032세대가 일반에 공급된다. 이... "
