date,source,title,link,description
2026-04-22,네이버뉴스,"韓-베트남, 신규 원전 건설 MOU… 현대로템, 1.1억달러 철도 수주",https://www.dt.co.kr/article/12059006?ref=naver,"양국은 향후 신규 원전 건설 방안을 모색하고, 원전건설 리스크 공동 분석과 공기 최적화 방안 수립을 지원하기로 했다. 이번 MOU를 통해 우리 기업은 베트남의 신규 원전 사업권 확보 기반을 구축하게 됐다. 양국은 또... "
2026-04-22,네이버뉴스,"李 ""韓·베트남 최적의 파트너…에너지·인프라·공급망 협력 강화""(종합...",https://www.asiatoday.co.kr/view.php?key=20260422010007215,"양국 정부는 이번 정상회담을 계기로 신규 원전 건설 방안을 모색하고, 원전건설 리스크 공동 분석 및 공기 최적화 방안 수립을 지원한다는 내용을 담은 '원전 개발 협력 가능성 검토에 관한 MOU' 등 총 12건의 MOU를... "
2026-04-22,네이버뉴스,"李 ""韓, 호치민 도시철도 수출 계약""…에너지·인프라 협력",http://www.wowtv.co.kr/NewsCenter/News/Read?articleId=A202604220646&t=NN,무엇보다 양국은 원전 개발 협력 가능성 검토에 관한 양해각서를 통해 신규 원전 건설 방안을 모색하기로 했다. 원전 건설시 리스크 공동 분석과 공기 최적화 방안이 수립된다. 이와 함께 원전 진출을 위한 금융 협력... 
2026-04-22,네이버뉴스,도시철도·원전 전방위 협력…호찌민에 현대로템 열차 달린다 [韓·베트...,http://www.fnnews.com/news/202604221818553233,"이날 체결된 '원전 개발 협력 가능성 검토 MOU'는 신규 원전 건설방안을 모색하고, 원전 건설 리스크 공동 분석 및 공기 최적화 방안 수립 지원 등을 골자로 한다. 이를 계기로 우리 기업 신규 원전 사업권 확보 기반을... "
2026-04-22,네이버뉴스,"韓, 베트남과 철도인프라·원전 협력↑",http://www.edaily.co.kr/news/newspath.asp?newsid=06166406645418744,"이를 통해 신규 원전 건설 방안과 리스크 분석, 공기 최적화 방안 등을 검토하기로 했다. 여기에 한국수출입은행, 한국무역보험공사, 한국전력이 참여하는 ‘원전 프로젝트 금융 협력 가능성 검토’ MOU도 더했다. 베트남... "
2026-04-22,네이버뉴스,"이 대통령, 베트남과 정상회담서 '호찌민 철도' 수출 계약... 원전 수출...",https://www.hankookilbo.com/news/article/A2026042216260005584?did=NA,"한국전력과 베트남 국가산업에너지공사 부사장이 서명한 원전 개발 MOU는 신규 원전 건설 방안 모색, 원전 건설 리스크 공동 분석과 공기 최적화 방안 수립을 지원하는 내용이 담겼다. 청와대는 ""우리 기업의 신규 원전... "
2026-04-22,네이버뉴스,"한-베트남, '원전·전력 인프라' 협력 등 MOU 12건 체결",http://www.inews24.com/view/1962647,"양국은 '원전 개발 협력 가능성 검토에 관한 MOU'에서 베트남 신규 원전 건설 방안을 모색하고, 원전 건설 리스크 공동 분석 및 공사 기간 최적화 방안 수립을 지원하기로 했다. 이를 통해 우리 기업 신규 원전 사업권... "
2026-04-22,네이버뉴스,韓·베트남 정상 “양적 협력 넘어 질적 도약”…원전 등 12건 MOU 체결,https://www.asiatime.co.kr/article/20260422500414,"이를 통해 양국은 신규 원전 건설 방안을 공동 모색하고, 사업 리스크 분석 및 공기 최적화 등 구체적 협력 기반을 마련할 것으로 기대된다. 또 디지털·과학기술·지식재산 협력과 함께 재생에너지, 전력망 현대화, 물... "
2026-04-22,네이버뉴스,삼성·SK·LG·현대차 총수 하노이 집결…반도체·AI 협력 '빅딜' 본격화,https://www.g-enews.com/view.php?ud=202604222118445272bd56fbc3c_1,"공항 건설, 스마트시티 사업 등 대형 국책 프로젝트에 자국 기업이 참여할 수 있도록 정부 차원의 협력 틀을 마련하겠다는 구상이다. 위성락 국가안보실장은 ""인프라, 원전 등 국가 발전의 핵심 분야에서 베트남과... "
2026-04-22,네이버뉴스,"李대통령·또럼, 8개월만 정상회담…도시철도·신도시·원전 협력",http://www.fnnews.com/news/202604221625160052,"이날 체결된 '원전 개발 협력 가능성 검토 MOU'는 신규 원전 건설 방안을 모색하고, 원전 건설 리스크 공동 분석 및 공기 최적화 방안 수립 지원 등을 골자로 한다. 이를 계기로 우리 기업 신규 원전 사업권 확보 기반을... "
2026-04-22,네이버뉴스,"한-베트남, 원전개발·전력인프라 등 협력문건 12건 체결",https://biz.heraldcorp.com/article/10723469?ref=naver,한국전력공사와 베트남 국가산업에너지공사는 ‘원전 개발 협력 가능성 검토에 관한 MOU’를 맺고 신규원전 건설 방안과 원전 건설 리스크 공동 분석에 착수하기로 했다. 이와 함께 한국전력·수출입은행... 
2026-04-22,네이버뉴스,"산업부, 베트남 원전 진출 기반 마련…수익성 분석 추진",https://www.newsis.com/view/NISX20260422_0003602547,이번 합의로 협력 범위가 신규 원전 건설로 확대됐다. 향후 한전과 PVN은 닌투언2 원전 건설을 위해 원전 공급망 협력 및 사업 수익성 분석 등을 본격 추진할 계획이다. 김정관 산업부 장관은 정상회담에 앞서 레마잉 훙... 
2026-04-22,네이버뉴스,"韓-베트남, 원전개발·전력인프라·AI 등 협력 확대·강화",https://www.daejonilbo.com/news/articleView.html?idxno=2270901,"주요 내용은 신규 원전 건설 방안 모색, 공기 최적화 방안 수립 지원 등이다. 수출입은행·무역보험공사 등이 참여하는 '원전 프로젝트 금융 협력 가능성 검토에 관한 MOU'도 함께 추진됐다. 전력 분야에선 '전력 인프라... "
2026-04-22,네이버뉴스,"체코 산업부 토마쉬 에흘레르 실장 ""탈원전 추진했던 유럽, 결국 원전으...",http://www.e-platform.net/news/articleView.html?idxno=101679,토마쉬 에흘레르 실장에 따르면 현재 유럽은 신규 원전건설과 기존 원전의 장기운전을 병행한는 전략을 수립해 운영하고 있으며 탈원전을 선언했던 일부 국가들은 원전을 사용하는 것으로 정책 전환을 시도하고 있다.... 
2026-04-22,네이버뉴스,"한-베트남, 신규 원전 개발 등 MOU 12건 체결",https://www.shinailbo.co.kr/news/articleView.html?idxno=5014138,"이번 MOU 체결로 양국이 함께 신규 원전 건설 방안을 모색하고, 원전 건설 리스크 공동 분석·공기 최적화 방안 수립에 나서며, 우리 기업의 신규 원전 사업권 확보 기반이 구축될 것으로 기대를 모은다. 또 원전 정보 교환... "
2026-04-22,네이버뉴스,"한·베트남, 신규 원전 개발·전력 인프라 등 MOU 12건 체결",https://www.dailian.co.kr/news/view/1636700/?sc=Naver,"신규 원전 건설 방안 및 원전 건설 리스크 공동 분석, 베트남 측 대규모 금융 수요에 부합하는 맞춤형 지원 체계의 선제적 구축 등을 통해 우리 기업의 신규 원전 사업권 확보 기반이 구축될 것이란 전망이다. 양국은... "
2026-04-22,네이버뉴스,"한-베트남, 신규 원전 개발 협력…MOU 12건 체결",http://www.wowtv.co.kr/NewsCenter/News/Read?articleId=A202604220647&t=NN,"원전건설시 리스크 공동 분석과 공기 최적화 방안이 수립되고, 원전 진출을 위한 금융 협력 가능성을 검토하는 내용이 담긴다. 이밖에 과기정통부와 베트남 과기부는 디지털 협력에 관한 양해각서를 체결했다. 양국은... "
2026-04-22,네이버뉴스,"한-베트남 정상회담...""발전 인프라·원전 개발 협력""",https://www.ytn.co.kr/_ln/0101_202604222111062344,"또, 베트남에 신규 원자력 발전소를 건설할 방법을 모색하고, 관련 정보를 교환하며, 우리 기업의 사업권을 확보할 기반을 마련하는 데도 합의했습니다. 이 밖에도 열처리 가금육 등 축산물 교역 촉진 양해각서 등 모두... "
2026-04-22,네이버뉴스,李 “베트남 과학발전에 韓 기여”… AI·원전·반도체 전방위 협력 [李...,https://www.segye.com/newsView/20260422519020?OutUrl=naver,정상회담… MOU 12건 체결 미래기술 R&D 교류·인력 양성 신규 원전 건설 방안 공동 모색 “물 안보 협력” 환경장관회의도 물 관리 기술·수해 예방 등 전수 베트남 새 정권 출범 후 첫 국빈 李 “국제결혼 1위국 ‘사돈의... 
2026-04-22,네이버뉴스,"한-베트남, 원전·인프라·과학기술 협력 확대…신규원전 진출 기반 마...",http://www.fnnews.com/news/202604222054075448,"이 가운데 한국전력공사와 베트남 국가산업에너지공사(PVN)가 체결한 '원전 개발 협력 가능성 검토에 관한 양해각서'에는 신규 원전 건설 방안을 함께 모색하고, 원전 건설 리스크를 공동 분석하며 공기 최적화 방안... "
2026-04-22,네이버뉴스,"한·베트남, 원전·AI·문화까지 12건 MOU…협력 외연 넓혔다",https://www.kyeonggi.com/article/20260422580604,"한국전력공사와 베트남 국가산업에너지공사(PVN)는 ‘원전 개발 협력 가능성 검토 MOU’를 체결하고 베트남 신규 원전 건설 방안과 사업 리스크 분석에 협력하기로 했다. 또 한국수출입은행, 한국무역보험공사 등이 참여한... "
2026-04-22,네이버뉴스,"한·베트남, 원전·전력인프라 등 MOU 12건 체결",https://www.hankyung.com/article/2026042200337,베트남의 신규 원전 건설 방안 및 원전 건설 리스크를 함께 분석하는 등의 내용이 담겼다. 한전·수출입은행·무역보험공사와 베트남 국가산업에너지공사는 ‘원전 프로젝트 금융 협력 가능성 검토 MOU'도 체결했다.... 
2026-04-22,네이버뉴스,韓·베트남 정상회담…원전·공급망 협력 대폭 늘리기로,https://www.m-i.kr/news/articleView.html?idxno=1366766,"한국전력공사와 베트남 국가산업에너지공사는 '원전 개발 협력 가능성 검토에 관한 MOU'를 맺고 신규원전 건설 방안 및 원전 건설 리스크 공동 분석 등에 힘을 모으기로 했다. 한전과 수출입은행, 무역보험공사는 베트남... "
2026-04-22,네이버뉴스,"한-베트남, 원전·인프라 협력 확대…12개 분야 MOU 체결",https://www.etoday.co.kr/news/view/2578187,"먼저 양국은 '원전 개발 협력 가능성 검토' 양해각서를 통해 신규 원전 건설 방안을 공동으로 모색하고, 건설 과정에서의 리스크를 함께 분석하는 한편 공기 최적화 방안을 마련하기로 했다. 한국전력공사와 베트남... "
2026-04-22,네이버뉴스,한·베트남 '경제협력↑' MOU 12건 체결,http://www.edaily.co.kr/news/newspath.asp?newsid=06012246645418744,"양측은 원전 개발 협력 가능성 검토 MOU를 통해 신규 원전 건설 방안과 리스크 분석, 공기 최적화 방안을 함께 검토하기로 했다. 또 원전 프로젝트 금융 협력 가능성 검토 MOU를 통해 금융 지원 타당성을 살펴보고 정보... "
2026-04-22,네이버뉴스,한-베트남 정상회담서 12개 MOU 체결…원전·AI·인프라 전방위 협력 강...,https://www.newspim.com/news/view/20260422000989,먼저 신규 원전 건설 방안을 모색하고 원전 건설 리스크를 공동 분석하는 동시에 공기 최적화 방안 수립을 지원하기로 했다. 또 원전 정보 교환 체계를 구축하면서 금융 지원 타당성도 검토하기로 했다. 원전 관련 2가지... 
2026-04-22,네이버뉴스,"韓-베트남, 정상회담 계기로 '신규 원전' 협력 약속",https://news.tf.co.kr/read/ptoday/2316199.htm,"원전 개발 협력 가능성 검토에 관한 양해각서는 베트남 신규 원전 건설 방안을 모색하고, 원전건설 리스크 공동 분석 및 공기 최적화 방안 수립을 지원하는 내용을 담고 있다. 이를 통해 한국 기업이 신규 원전 사업권을... "
2026-04-22,네이버뉴스,"한·베 정상회담, 원전 앞세워 협력 확대…12건 MOU 성과",https://biz.heraldcorp.com/article/10723461?ref=naver,"이를 통해 신규 원전 건설 가능성 검토와 함께 건설 리스크 공동 분석, 공사기간의 최적화 방안 마련 등에 협력하기로 했다. 원전사업을 미래 성장동력으로 삼고 있는 국내 건설사들에도 베트남 원전 시장은 향후 핵심... "
2026-04-22,네이버뉴스,"한·베트남, 신규 원전 개발 MOU 등 12건 체결…전력 인프라 협력 확대도",https://news.kbs.co.kr/news/pc/view/view.do?ncd=8543129&ref=A,"우리나라와 베트남이 신규 원전 건설 방안을 모색하고, 재생에너지와 에너지 저장장치(ESS) 등 전력 인프라 분야 협력을 확대하는 내용의 양해각서(MOU)를 체결했습니다. 청와대는 양국이 이재명 대통령과 또 럼 베트남... "
2026-04-22,네이버뉴스,"韓-베, 원전 개발·금융 협력 MOU 등 12건 교환…원전 진출 도전장",https://view.asiae.co.kr/article/2026042219203183551,"원전 분야에서 한국전력공사와 베트남 국가산업에너지공사(PVN)는 신규 원전 건설 방안 모색과 원전 건설 리스크 공동 분석, 공기 최적화 방안 수립 지원 등을 골자로 한 '원전 개발 협력 가능성 검토에 관한 MOU'를... "
2026-04-22,네이버뉴스,"김민석 총리 ""중동전쟁으로 원전 안전 운영 중요…철저한 관리 당부""",https://www.mt.co.kr/politics/2026/04/22/2026042220401191543,"기후에너지환경부는 이번 연기 발생의 근본 원인을 면밀히 분석하는 한편, 오는 24일 한국수력원자력과 긴급회의를 개최해 원전 건설 및 운영 현장의 안전관리 전반에 대한 철저한 점검을 수행할 예정이다． 총리실에... "
2026-04-22,네이버뉴스,"韓-베트남, 원전개발·전력인프라 등 협력문건 12건 체결",https://www.yna.co.kr/view/AKR20260422138600001?input=1195m,우선 한국전력공사와 베트남 국가산업에너지공사는 '원전 개발 협력 가능성 검토에 관한 MOU'를 맺고 신규원전 건설 방안 및 원전 건설 리스크 공동 분석 등에 힘을 모으기로 했다. 또 한전과 수출입은행... 
2026-04-22,네이버뉴스,한-베트남 '신규 원전·인프라' 맞손…정상회담 계기 MOU 12건 체결,https://www.news1.kr/politics/president/6145366,양국은 원전 개발 협력 가능성 및 원전 프로젝트 금융 협력 가능성 검토 MOU를 맺고 베트남 신규 원전 건설 방안을 모색하기로 했다. 이를 통해 우리 기업의 신규 원전 확보 기반을 구축한다는 방침이다. 또 베트남 측... 
2026-04-22,네이버뉴스,"한-베트남, '원전 개발 협력 가능성 검토' 등 MOU 12건 체결…원전 진출...",https://www.newsis.com/view/NISX20260422_0003602205,한국과 베트남 정부가 22일(현지시간) 정상회담을 계기로 MOU를 맺고 신규 원전 건설 방안을 함께 모색하기로 했다. 청와대는 22일(현지시간) 보도자료를 통해 이재명 대통령과 또 럼 당 서기장 겸 국가주석의 정상회담을... 
2026-04-22,네이버뉴스,"체코 당국, EC조사에 ‘우려 일축’…2027년 테믈린 3∙4호기 기대",https://www.segye.com/newsView/20260422519079?OutUrl=naver,앞서 EC가 국가보조금에 대한 조사에 들어가면서 원전 2기 건설 사업에 차질이 발생하는 것 아니냐는 우려가 나온 바 있다. 이에 에흘레르 실장은 “내년 초 자금관련 부분이 (원활하게) 이뤄질 것이라고 생각한다”며... 
2026-04-22,네이버뉴스,"삼척시장 '다자 구도' 확정, 군소정당 후보 관심",https://www.mbceg.co.kr/post/135672,"그래서 원전과 방폐장을 함께 추진해서..."" 자유통일당에서는 홍순근 예비후보가 나서 자유 애국 시와 시민 주식회사 건설을 약속하며 얼굴 알리기에 공을 들이고 있습니다. 지역에서는 일부 전직 단체장의 무소속 출마... "
2026-04-22,네이버뉴스,한·베트남 정상 “에너지·인프라 분야 전략적 협력 강화”,https://www.khan.co.kr/article/202604222036005,"이 대통령, 또럼 서기장과 정상회담…원전 등 MOU 12건 체결 베트남 신도시·신공항 건설 참여…양국민 안정적 체류 노력도 이재명 대통령과 또럼 베트남 공산당 서기장 겸 국가주석은 22일 정상회담을 하고 양국 간 에너지... "
2026-04-22,네이버뉴스,'2번째 흑자국' 베트남과 한발 더…4대 기업도 총출동,https://news.jtbc.co.kr/article/NB12295355?influxDiv=NAVER,"베트남은 또 총사업비 220억 달러 규모의 원전 건설 사업도 추진하고 있습니다. 수주전에 뛰어든 한전이 앞서 정부에 지원을 요청하기도 한만큼, 현재 진행 중인 정상회담에서는 관련한 얘기가 오갈 가능성도 있습니다.... "
2026-04-22,네이버뉴스,'집안싸움' 막는다… 원전 수출 한전으로 단일화,https://m.skyedaily.com/news_view.html?ID=302920,바라카 원전 건설 과정에서 추가 공사비 지급 주체를 두고 한전과 한수원은 2024년부터 법적 분쟁을 이어오고 있다. 한수원은 한전의 100% 자회사이지만 법적으로 독립된 법인격을 갖고 있다. 22일 산업통상부에 따르면... 
2026-04-22,네이버뉴스,"[기고] 체르노빌 사고 40년, 아직도 진행 중",https://www.idomin.com/news/articleView.html?idxno=2004185,탈원전 정책을 폐기하고 신규 원전 건설과 소형모듈원전(SMR) 확대를 추진 중이다. SMR 역시 크기만 작을 뿐 치명적 위험과 핵폐기물 처리라는 본질적 문제를 해결하지 못한다. 마산 돝섬에 SMR 설치하자고 주장하면... 
2026-04-22,네이버뉴스,"김 총리, ‘새울 3호기 시운전 중 연기’에 “철저한 원인 규명”",https://news.kbs.co.kr/news/pc/view/view.do?ncd=8543075&ref=A,안전사고도 발생하지 않도록 현장의 높은 경각심이 필요하다”고 강조했습니다. 기후부는 모레(24일) 한국수력원자력과 긴급회의를 개최해 원전 건설과 운영 현장 안전관리 전반을 점검할 예정입니다. [사진 출처 : 연합뉴스]
2026-04-22,네이버뉴스,"金총리 ""원전 가동률 제고 할 시기""…새울 3호기 연기 원인 규명 지시",https://www.dailian.co.kr/news/view/1636688/?sc=Naver,"이와 관련해 기후에너지환경부는 이번 연기 발생의 근본 원인을 면밀히 분석하는 한편, 오는 24일 한국수력원자력과 긴급 회의를 개최해 원전 건설 및 운영 현장 안전 관리 전반에 대한 점검을 수행할 방침이다."
2026-04-22,네이버뉴스,수도권에 원전급 태양광단지 짓는다,https://www.mk.co.kr/article/12024437,"화옹·시화지구 간척지 활용 기가와트급 발전단지 추진 정부가 경기 화옹지구와 시화지구에 대규모 태양광 발전 단지 건설을 추진한다. 간척지를 활용해 태양광을 설치하는 것으로, 총 설비 용량은 기가와트(GW)급에 이를... "
2026-04-22,네이버뉴스,"""테믈린 3,4호기 건설, 한수원이 수행하면 두코바니와 함께 시너지 효과...",http://www.e-platform.net/news/articleView.html?idxno=101675,"기자회견에 따르면 체코는 테믈린 3,4호기 신규 원전 건설을 추진하기 위해 재정적인 측면과 조건 등에 대한 논의가 진행 중에 있다. 또한 두코바니 원전의 진행 상황도 고려해 내년 경 사업추진여부를 최종결정할... "
2026-04-22,네이버뉴스,"金총리. '새울원전 3호기 보조건물 연기'에 ""원인 철저 규명""",https://www.yna.co.kr/view/AKR20260422157500001?input=1195m,"이와 관련, 기후부는 이번 연기 발생의 근본 원인을 면밀히 분석하는 한편 24일 한국수력원자력과 함께 긴급회의를 개최해 원전 건설 및 운영 현장의 안전관리 전반을 점검키로 했다. 이와 별개로 기후부는 6월까지 원전... "
2026-04-22,네이버뉴스,"울산 새울원전 3호기 연기 발생…김 총리, 안전관리 강화 당부",https://www.newspim.com/news/view/20260422001230,"기후에너지환경부는 이번 연기 발생의 근본 원인을 면밀히 분석하고, 오는 24일 한국수력원자력과 긴급 회의를 열어 원전 건설 및 운영 현장의 안전관리 전반에 대한 철저한 점검을 수행할 예정이다."
2026-04-22,네이버뉴스,"두산에너빌리티, 원전 등 발전 관련 수주잔고 23조…2030년 수익 본격화...",https://www.straightnews.co.kr/news/articleView.html?idxno=300820,"원전과 SMR(소형모듈원전) 등은 건설 기간이 길어 매출과 이익 인식에 시차가 발생하기 때문이다. 메리츠증권 문경원 연구원은 ""대형 원전과 SMR, 가스터빈 사업의 진정한 이익 회수기는 2030년대""라며 ""에너빌리티... "
2026-04-22,네이버뉴스,"김 총리 ""중동 전쟁으로 원전 가동률 높여야 하는 시기…안정적 운영 중...",https://www.newsis.com/view/NISX20260422_0003602487,"기후에너지환경부는 이번 연기 발생의 근본 원인을 면밀히 분석하는 한편, 오는 24일 한국수력원자력과 긴급 회의를 개최해 원전 건설 및 운영 현장의 안전관리 전반에 대한 철저한 점검을 수행할 예정이다．"
2026-04-22,네이버뉴스,체코 원전실장 “한수원 두코바니 사업 공정 맞게 진행”…추가 수주 ‘...,https://biz.heraldcorp.com/article/10723435?ref=naver,또 현지 추가 원전 건설에 대해서도 긍정적인 전망을 내놨다. 토마쉬 에홀레르 체코 산업통상부 원자력 실장은 22일 오후 부산 벡스코에서 열린 ‘한국원자력연차대회 및 태평양연안국 원자력컨퍼런스’에서 기자들과... 
2026-04-22,네이버뉴스,"金총리 ""원전 안전 최우선""…새울 3호기 연기 원인 규명 지시",https://www.news1.kr/politics/president/6145772,"이에 따라 기후에너지환경부는 이번 연기 발생 원인을 면밀히 분석하고, 오는 24일 한국수력원자력과 긴급 회의를 열어 원전 건설 및 운영 전반에 대한 안전 점검에 나설 예정이다."
2026-04-22,네이버뉴스,"김회천 한수원 사장 “AI 시대, 현실적 전력 해법은 원자력”",https://www.asiatoday.co.kr/view.php?key=20260422010007213,"미국과 캐나다에서는 소형모듈원전(SMR) 초도호기 건설이 추진되고 있다.김 사장은 ""우리나라는 기존 원전의 계속운전과 신규 원전 건설을 추진하고 있으며, 혁신형 SMR 표준설계 인가 신청 등 원자력 정책을 본격화하고... "
2026-04-22,네이버뉴스,새울원전 3호기 보조건물서 연기…25분 만에 안전 조치,https://www.iusm.co.kr/news/articleView.html?idxno=1062049,"한편 새울 3호기는 2016년 6월 27일 건설허가를 받고 공사를 시작했으며, 2017년 문재인 정부 출범 직후 탈원전 정책으로 건설이 중단됐다가 공론화를 거쳐 같은 해 10월 공사를 재개했다. 이후 지난해 12월 운영 허가를... "
2026-04-22,네이버뉴스,"활용도 높은 SMR, 경제성 확보 가능…12차 전기본 반영돼야",http://www.e-platform.net/news/articleView.html?idxno=101674,i-SMR의 건설비인 3조5000억원과 비교하면 부하추종 서비스만으로도 원전 건설비를 상회하는 수준이다. SMR의 부하추종은 24시간 가능하며 최대 부하 추종량보다 적게 감발할 때 더욱 경제적인 특성을 갖고 있다. 이는... 
2026-04-22,네이버뉴스,"체코 ""한수원 제안 경쟁력 충분""…테믈린까지 이어질까",https://www.kizmom.com/news/articleView.html?idxno=109556,"한국수력원자력을 포함한 '팀코리아'가 수주한 체코 두코바니 원전 사업이 계획대로 진행되는 가운데, 체코 정부가 추가 원전 건설에도 긍정적인 입장을 밝혔다. 토마쉬 에홀레르 체코 산업통상부 원자력 실장은 22일... "
2026-04-22,네이버뉴스,"한전·한수원, 원전 수출 공동 주계약자로 '집안싸움' 차단",http://www.fnnews.com/news/202604221816255275,이는 바라카 원전 건설 과정에서 발생했던 두 공기업 간 법적 분쟁을 되풀이하지 않겠다는 정부의 의지가 반영된 결과로 풀이된다. 한전의 100% 자회사인 한수원은 설계 변경 등으로 늘어난 약 1조4000억원의 추가 공사비를... 
2026-04-22,네이버뉴스,"재계 총수 총출동 '세일즈 외교'…韓·베트남, 공급망·AI 전략동맹 시동",http://www.newsian.co.kr/news/articleView.html?idxno=88843,"대통령은 ""원전과 인프라, 과학기술 혁신 등 전략 분야 협력을 확대하겠다""며 ""공급망 안정과 기후 대응 등... 이는 단순 수출을 넘어 설계·건설·운영까지 포함하는 장기 수익 모델 확보 차원에서도 의미가 크다. 양국은... "
