date,source,title,link,description
2026-07-23,네이버뉴스,"캠코 공공개발 안전 실천, 안전사고 제로 실현",https://www.mt.co.kr/policy/2026/07/23/2026072317194535381,"이날 캠코는 '안전의식 100%, 안전사고 0%'를 새로운 안전 슬로건으로 선포하고 근로자와 이용자의 생명과... 공공개발 안전관리와 선제적 위험 요인 개선을 통한 안전한 일터 조성을 담았다. 건설공사 발주자의 법적 의무... "
2026-07-23,네이버뉴스,[위클리오늘] 광양만권경제자유구역청ㆍ광양시 소식(7.23),http://www.weeklytoday.com/news/articleView.html?idxno=786873,"이번 현장 점검은 장기간 이어지는 폭염 속에서 야외 작업이 많은 건설현장 근로자의 온열질환을 예방하고 안전사고를 막기 위해 마련됐다. 구충곤 광양경자청장은 공사 현장을 둘러보며 무더위 쉼터 운영, 아이스 조끼... "
2026-07-23,네이버뉴스,"부영그룹, 중복 맞아 임직원·현장근로자에 삼계탕 전달",https://www.koreaittimes.com/news/articleView.html?idxno=155436,특히 올해는 장마와 무더위가 동시에 이어지면서 건설현장의 근로환경이 악화될 수 있다는 점을 고려해 건강관리와 함께 안전사고 예방에도 힘을 쏟고 있다. 부영그룹은 전국 건설현장을 대상으로 장마철 재해 예방을... 
2026-07-23,네이버뉴스,캠코 '안전의식 100%·안전사고 0%' 공공개발 안전 실천 다짐,https://www.gukjenews.com/news/articleView.html?idxno=3644418,"과정에서 안전관리 체계를 강화하고, 임직원의 안전 책임 의식을 높이겠다고 밝혔다. 이번 행사는 건설현장... 이날 캠코는 '안전의식 100%, 안전사고 0%'라는 새로운 안전 슬로건을 선포하고, 중대재해 없는 안전한... "
2026-07-23,네이버뉴스,"이상현 남원시의원 ""유탑아파트 체육시설 진입로 개설을""",http://www.jjn.co.kr/news/articleView.html?idxno=1047346,"이상현 의원(더불어민주당)은 지난 7월 22일 열린 남원시의회 경제농정위원회 안전건설국 업무보고에서... 있다""며 ""자칫 안전사고로 이어질 수 있는 만큼 행정이 더 이상 방치해서는 안 된다""고 지적했다. 또한 이 의원은... "
2026-07-23,네이버뉴스,"광양경자청, 건설현장 '폭염 안전 5대 기본 수칙' 점검",https://www.news1.kr/local/gwangju-jeonnam/6237073,"구충곤 청장은 ""안전사고 예방은 선제 대응이 최우선""이라며 ""광양경자청은 주요 건설사업장에 대한 정기적인 점검을 통해 재해 없는 안전한 사업장이 될 수 있도록 안전관리에 최선을 다하겠다""고 말했다."
2026-07-23,네이버뉴스,"남부발전, 30년 사고사례 담은 안전백서 발간···현장 예방체계 강화",http://www.enewstoday.co.kr/news/articleView.html?idxno=2451857,한국남부발전이 발전소 현장에서 발생한 주요 안전사고 사례와 재발 방지 대책을 체계적으로 정리한... 한편 남부발전은 올해 행정안전부와 '찾아가는 안전체험교실' 업무협약을 체결하고 '건설현장 안전관리 혁신 워크숍... 
2026-07-23,네이버뉴스,"남부발전, 30년 현장 경험 담은 '안전사고 백서' 발간…재발 방지 사슬...",https://www.straightnews.co.kr/news/articleView.html?idxno=307543,발전산업 현장 안전사고 백서. [사진=한국남부발전] 한국남부발전(사장 김준동)이 과거 발전 현장에서... 한편 남부발전은 올해 행정안전부와 '찾아가는 안전체험교실' 업무협약을 체결하고 '건설현장 안전관리 혁신... 
2026-07-23,네이버뉴스,[병원계 소식] 7월 23일,http://www.doctorstimes.com/news/articleView.html?idxno=239167,"이번 인증은 최근 각종 보안사고가 발생하는 환경 속에서 관리대상을 선제적으로 확대한 사례로, 향후... ■보라매병원, 중대재해 예방 안전라운딩 실시···건설·설비 현장 안전관리 점검 서울대병원운영... "
2026-07-23,네이버뉴스,"홍순철 충남 아산시의원, ""아산호 내수면 국가어항 지정 등 주요 현안 사...",https://www.ccdn.co.kr/news/articleView.html?idxno=1089909,충남 아산시의회 홍순철 의원이 지난 16일 열린 제266회 임시회 제2차 건설도시위원회 주요업무 추진상황... 충무교 재건축 및 도로 확장 공사와 관련해 공사 기간 중 시민 불편을 최소화하고 안전사고 예방에 만전을 기해줄... 
2026-07-23,네이버뉴스,"남부발전, 발전현장 안전사고 예방 백서 공개",https://www.newscj.com/news/articleView.html?idxno=3419389,한국남부발전이 발전산업 현장의 안전사고 사례와 재발방지 대책을 담은 백서를 제작했다. 남부발전은 지난... 한편 남부발전은 올해 행정안전부와 '찾아가는 안전체험교실' 업무협약을 체결하고 '건설현장 안전관리 혁신... 
2026-07-23,네이버뉴스,[항공투데이] 백령공항 개항 4년 이상 지연 전망··· 배후용지 개발도...,https://www.incheontoday.com/news/articleView.html?idxno=321492,인천투데이=홍지은 PD | 2029년 개항을 목표로 추진되던 인천 옹진군 백령공항 건설사업이 당초 계획보다... 2024년 12월 제주항공 여객기 참사 이후 조류충돌 사고로 항공 안전 위험성에 국민적 경각심이 높아진... 
2026-07-23,네이버뉴스,"캠코, 공공개발 현장 안전관리 강화…AI로 위험요인 미리 찾는다",https://www.mhns.co.kr/news/articleView.html?idxno=754245,"캠코(한국자산관리공사)는 23일 부산국제금융센터(BIFC)에서 공공개발 안전 실천 결의대회를 열고 건설현장부터 준공사업장까지 안전관리 체계를 점검했다고 밝혔다. 캠코는 이날 '안전의식 100%, 안전사고 0%'를 내걸고... "
2026-07-23,네이버뉴스,"광양경자청, '폭염 안전수칙' 현장 점검... 중대재해 차단 총력",http://www.newsworker.co.kr/news/articleView.html?idxno=437974,"이번 현장 점검은 기후변화로 장기화하는 무더위에 대비해 야외 작업 비중이 큰 건설 현장 노동자의 생명과... 구충곤 광양경자청장은 ""안전사고 예방은 선제 대응이 최우선""이라며 ""지속적인 점검과 안전관리 실천으로... "
2026-07-23,네이버뉴스,"경상북도개발공사,'감성 안전퀴즈 대회'로 안전문화 확산 나서",https://www.idaegu.co.kr/news/articleView.html?idxno=554727,"퀴즈는 '중대재해 처벌 등에 관한 법률' 주요 내용과 건설현장 안전·보건 수칙 등을 주제로 진행됐으며, 정답을 맞힌 근로자들에게는 혹서기 개인 보냉장구 등 안전용품을 전달해 연일 이어지는 폭염 속 현장 근로자들의... "
2026-07-23,네이버뉴스,경남 올해 상반기 중대재해 사망 22건,http://www.gnmaeil.com/news/articleView.html?idxno=591304,"업종별로는 제조업 9건, 건설업 6건 순으로 사고가 집중됐다. 특히 김해는 지난 5월 30일부터 6월 18일까지 중대재해 사망사고 5건이 잇따라 발생하면서 고용노동부 양산지청이 김해를 '중대재해 발생 경보 지역'으로... "
2026-07-23,네이버뉴스,[중부일보 독자위원회] 새로운 출범을 알리며,https://www.joongboo.com/news/articleView.html?idxno=363732223,왕성해 독자위원장을 비롯한 16명의 위원은 법조·교육·경제·산업·통상·건설·문화예술·장애인복지... 독자위원으로서 형사·공정거래·중대재해·미디어 지식재산권·디지털포렌식 분야에서 쌓은 경험을 바탕으로 보도의... 
2026-07-23,네이버뉴스,[2026 기계설비의 날] 국토교통부장관 표창- 이관선 한국자산관리공사 ...,https://www.kmecnews.co.kr/news/articleView.html?idxno=50959,"이 과장은 13년여 동안 공공기관과 건설 현장에서 다양한 기계설비 업무를 수행하며, 시공 품질 향상과 기술... 또 스마트 안전관리 시스템 도입과 위험성 평가를 강화하며, 재직 기간 동안 중대재해 Zero를 유지하는 등... "
2026-07-23,네이버뉴스,[2026 기계설비의 날] 중소기업중앙회 회장상 - 유계호 (주)혜성 대표이...,https://www.kmecnews.co.kr/news/articleView.html?idxno=50946,"산업안전보건법과 중대재해처벌법에 기반한 안전보건관리체계를 구축하고 있다. 또 현장별 실시간 관리체계를 운영해 시공 품질과 고객 만족도를 높였고, 안전을 최우선으로 하는 건설문화 정착에도 기여했다. 유계호... "
2026-07-23,네이버뉴스,"현대엔지니어링, 안성 교량 붕괴로 영업정지 3개월…5.5조원 규모 신규...",https://sateconomy.co.kr/news/view/1065604073815023,이번 처분은 산업안전보건법상 중대재해를 발생시킨 건설사업자에 대해 고용노동부 장관이 영업정지를 요청한 데 따른 것이다. 영업정지 대상 금액은 5조5410억원으로 지난해 매출 13조8965억원의 39.9%에 해당한다. 이는... 
2026-07-23,네이버뉴스,"고용부 태백지청, 삼척서 민·관·공 합동 위험성평가 교차점검",https://www.news1.kr/local/kangwon/6237289,"태백지청은 23일 삼척시 트리븐 아파트 건설현장(시공사 두산에너빌리티)에서 삼척시, 한국남부발전... 지역적 특성을 고려한 맞춤형 상생 안전 체계 구축은 중대재해 감소와 지역 안전보건 수준을 한단계 끌어올릴 것으로... "
2026-07-23,네이버뉴스,"한국기술교육대, 폭염 속 건설현장 찾아 '안전동행 간담회' 개최",https://www.etnews.com/20260723000442,한국기술교육대학교는 23일 대학본부 건설현장 근로자 휴게실에서 시공사 관계자와 현장 근로자와 함께... 이번 간담회를 시작으로 도급인-수급인 상생 안전문화 활동을 지속 추진해 중대재해 없는 안전한 캠퍼스를 만들어... 
2026-07-23,네이버뉴스,"한화 건설부문, 자체 제작 안전캐릭터 '한수호' 선보여",https://www.cnbizm.com/news/articleView.html?idxno=309460,최근 건설업계는 중대재해 예방과 안전의식 제고를 위해 캐릭터와 콘텐츠를 활용한 참여형 안전문화 활동을 확대하고 있다. 한화 건설부문도 안전을 일상 속 문화로 정착시키기 위해 여러 프로그램을 지속적으로 추진할... 
2026-07-23,네이버뉴스,"한기대, 폭염 속 건설현장서 ‘안전동행 간담회’",https://dhnews.co.kr/news/view/1065596827867260,"한기대가 23일 대학본부 건설현장 근로자 휴게실에서 ‘안전한 일터를 위한, 현장과 함께하는 안전동행... 한기대는 이번 간담회를 시작으로 도급인-수급인 상생 안전문화 활동을 지속 추진해 중대재해 없는 안전한... "
2026-07-24,네이버뉴스,"남해군, 27일자 정기인사 단행… 53명 규모 조직개편",https://view.asiae.co.kr/article/2026072408051818188,법무규제개혁팀장 ▲도시건축과 시설 6급 김기태 ⇒ 기획조정실 정원도시TF팀장 ▲미조면 행정 6급 신지은... 이은영 ⇒ 건설교통과 건설관리팀장 ▲삼동면 행정 6급 박진석 ⇒ 수산자원과 수산식품팀장 ▲해양발전과... 
2026-07-24,네이버뉴스,[이제홍의 글로벌 세상만사] 글로벌 RE100과 재생에너지 경쟁력,https://theviewers.co.kr/View.aspx?No=4160345,"새로운 규제로 등장하고 있다. 특히, 우리나라 기업들이 RE100에 불참할 경우 2040년까지 국내 반도체... 둘째, 풍력터빈·태양전지판, 조력 등 청정기술 제조 건설에 대한 투자세액을 공제해야 한다. 셋째, 탈탄소화... "
2026-07-24,네이버뉴스,[오늘의 주요일정] 정치·경제·금융·사회·법조 24일(금),https://www.newscj.com/news/articleView.html?idxno=3419518,"10:00 '규제에서 시장으로, 징벌에서 합리로' 부동산정책 정상화 토론회(국회 본관 245호) 13:30 엄마... 민주노총 건설노조·섬유건설노조 타워크레인분과, 노조원 고용 촉구 집회(연신내역 3번 출구 앞) 07:30·11:30·17... "
2026-07-24,네이버뉴스,"[더벨][CIS케미칼 IPO] 2년만에 상장 재도전, '설비 미비' 꼬리표 뗐다",https://www.thebell.co.kr/free/content/ArticleView.asp?key=202607221437346560108463,광양 세풍산단 2단계 공장에 총 450억원을 투자해 리튬 추출 공장을 건설하고 지난해 준공을 완료했다.... 유럽연합(EU) 신배터리법과 미국 인플레이션감축법(IRA) 등 글로벌 공급망 규제가 강화되는 상황에서 비중국산... 
2026-07-24,네이버뉴스,"[주간 기업동향] 정의선 현대차그룹 회장, 아프리카 사업 확대 점검 外",https://www.banronbodo.com/news/articleView.html?idxno=32695,"AI 데이터센터 확산과 관련해서는 전력·소재·건설 분야의 병목 가능성을 지적하며, AI 인프라 구축이 전기화... 또한 정부와 규제 완화를 위한 소통을 이어가고 있으며, 국내 증시에 대해서는 여전히 저평가돼 있어 추가... "
2026-07-24,네이버뉴스,후반기 과방위 진용 완성…AI 예산·허위조작정보 등 이슈로,https://www.digitaltoday.co.kr/news/articleView.html?idxno=686394,방송·통신 규제 정비를 핵심 과제로 다룰 전망이다. 23일 국회에 따르면 국민의힘은 이날 과방위원 배정을... 다만 발전소 건설과 전력망 확충은 산업통상자원중소벤처기업위원회 등 다른 상임위 소관과도 맞물린다.... 
2026-07-24,네이버뉴스,"""쉬운 전세대출 조정해야""…공급은 '속도전' 강조",https://news.sbs.co.kr/news/endPage.do?news_id=N1008672453&plink=ORI&cooper=NAVER,대출 규제나 공급 문제에 대해서도 이야기가 나왔습니다. 이재명 대통령은 쉬운 전세 대출은 집값 폭등의 한 원인이라며 조정 필요성을 언급했습니다. 3기 신도시 건설 기간의 단축 같은 공급의 속도전도 강조했습니다.... 
2026-07-24,네이버뉴스,[스타트 경제] 3시간 넘긴 이 대통령 주재 부동산 국민 대토론회...핵심...,https://www.ytn.co.kr/_ln/0102_202607240725515368,대부분 공급 쪽을 제외하면 규제일변이었죠. 6.27 대출에서 6억 원 한도 제한을 한 부분이 있었고 10.15 대책을... 건설사업자 입장에서 수익성 담보가 안 되다 보니까 수요자들이 이 물건들을 기피하다 보니까 수요가... 
2026-07-24,네이버뉴스,"[더벨][상장폐지 카운트다운] 버넥트, 신원스틸 인수 승부수에도 투심 ...",https://www.thebell.co.kr/free/content/ArticleView.asp?key=202607220041363490106769,"신원스틸은 후판 가공 전문기업으로 조선, 기계, 건설 등 다양한 산업에 제품을 공급하고 있는 기업이다.... 출처:네이버 증권 ◇투심 위축, 하반기 규제권 진입 이처럼 체질 개선에 분주한 버넥트지만 투심은 돌리지... "
2026-07-24,네이버뉴스,‘똘똘한 한 채’가 뭐길래…어제 ‘부동산 토론회’ 핵심은?[점선면],https://www.khan.co.kr/article/202607240700011,정부는 3기 신도시 건설 기간을 대폭 단축하기 위한 내부 검토에 착수했습니다. 현재 착공까지 60개월 정도... 전세대출 확대는 부정적 전세대출 대출 규제는 강화하는 방안이 유력합니다. 온라인 여론조사에서는 전세대출... 
2026-07-24,네이버뉴스,"철도연, '애로기술·기술이전 상담회' 개최…41개 중소기업 맞춤 지원",https://www.electimes.com/news/articleView.html?idxno=370643,"동향과 규제 대응 전략을 공유했다. 이어진 본 상담에는 총 41개 중소기업이 참여한 가운데, 철도연 전문가들이 연구개발(R&D), 생산공정, 인증, 시장진출, 철도건설 및 운영 등 다양한 분야의 기술 애로를 진단하고... "
2026-07-24,네이버뉴스,"에코프로 니켈 제련소, 내년 2분기 본격 가동 목표",https://www.bntnews.co.kr/article/view/bnt202607240007,이동채 에코프로 창업주(오른쪽에서 네 번째)가 23일 인도네시아 술라웨시 BNSI 제련소 건설 현장에서... BNSI에서 생산되는 니켈은 해외우려기관(FEOC) 규제에 대응 가능한 비금지외국기관(Non-PFE) 원료로 분류된다.... 
2026-07-24,네이버뉴스,[외신 헤드라인]  인텔 2분기 '어닝서프라이즈',https://biz.sbs.co.kr/article_hub/20000324341?division=NAVER,"있어서, 규제를 적용할 방법이 마땅히 없는 데다, 저렴한 가격에 활용성까지 갖춰 이미 생태계에 깊숙이... 특히나 중국은 국가차원에서, 향후 5년간 전국 데이터센터 건설에 우리돈 440조원에 육박한 뭉칫돈을 투입하기로... "
2026-07-24,네이버뉴스,[THE CEO] 정기선 HD현대 회장,http://www.the-biz.co.kr/news/articleView.html?idxno=724869,"조선과 건설기계, 전력기기, 에너지, AI를 하나의 산업 생태계로 연결하는 전략을 주도했고 지난해 HD현대... 환경규제가 강화되고 선박의 디지털화가 빨라질수록 MRO, 친환경 개조, 디지털 운항 솔루션의 가치가 높아질... "
2026-07-24,네이버뉴스,"'전지박 올인' 솔루스첨단소재, 순차입금 눈덩이… EV 캐즘에 발목",https://www.sidae.com/article/2026072315353944960,"실적 악화에도 캐나다 공장 건설에 들어가는 투자비가 계속 발생하면서 차입 부담은 커졌다.... ""북미에서 배터리 소재 역내 조달 규제가 강화되고 있는 만큼 캐나다 공장이 현지 공급망 대응 측면에서 경쟁력으로... "
2026-07-24,네이버뉴스,'스마트도시산업' 첫 공식 분류 만든다…산업 통계 기반 구축,https://www.edaily.co.kr/news/newspath.asp?newsid=02102486645517800,"기존 한국표준산업분류(KSIC)에서는 소프트웨어와 건설, 통신 등으로 나뉘어 있어 산업 규모와 성장 현황을... 조사 결과는 국가승인통계 지정도 추진해 공신력을 확보하고, 연구개발(R&D)과 예산 지원, 규제 샌드박스 대상... "
2026-07-24,네이버뉴스,‘3대 메가프로젝트’ 아산서 첫발 뗐다,https://www.segye.com/newsView/20260723524211?OutUrl=naver,생산시설 건설에 착수한다. 2029년 HBM 양산이 목표다. 공장이 완공되면 온양사업장 연면적은 현재 27만... 이 같은 아산시 지원행정은 단순한 규제 완화를 넘어 지방정부가 국가 전략산업 투자 실행 속도를 끌어올린... 
2026-07-24,네이버뉴스,"AI 융·복합 스마트도시산업, 국가 공식 분류 생긴다",https://www.nocutnews.co.kr/news/6552470?utm_source=naver&utm_medium=article&utm_campaign=20260724060105,"스마트도시 산업은 교통·환경·방범 등 도시 건설·운영과 관련된 다양한 영역에 AI, 사물인터넷(IoT) 등 첨단... 고도화하고, 규제 샌드박스 적용 대상 선정과 K-스마트도시 기업의 해외 진출 지원 등에 활용할 예정이다.... "
2026-07-24,네이버뉴스,"""하반기 입주하는 게 죄?"" 총량제로 수원·동탄서 집단대출 거부 날벼락",https://realty.chosun.com/site/data/html_dir/2026/07/23/2026072302763.html,구조라 건설업계가 유동성 위기를 겪을 수 있다는 분석도 나온다. 일각에서는 2024년 말 비슷한 문제를 겪었던 총 1만2032가구 규모 서울 강동구 둔촌주공 재건축(올림픽파크포레온) 사업지를 위해 정부가 대출 규제를... 
2026-07-24,네이버뉴스,"국토부, 스마트도시산업 통계 특수분류 제정…산업육성 토대 마련",https://biz.heraldcorp.com/article/10817966?ref=naver,"스마트도시산업은 도시 건설·운영에 인공지능(AI), 사물인터넷(IoT) 등 첨단기술을 접목한 복합산업이다.... 조사 결과는 향후 ‘국가승인통계’ 지정을 추진하며, 확보된 통계 지표는 R&D 및 예산 지원, 규제 샌드박스... "
2026-07-24,네이버뉴스,국토부 '스마트도시산업 특수분류' 신규 제정…데이터처 심의 확정,https://www.newsis.com/view/NISX20260723_0003720799,"스마트도시산업은 교통·환경·방범 등 도시 건설과 운영 전반에 인공지능(AI), 사물인터넷(IoT) 등... 고도화, 규제샌드박스 적용 대상 선정, K-스마트도시 기업의 해외 진출 지원 등을 위한 핵심 근거로 활용할 예정이다.... "
2026-07-24,네이버뉴스,"스마트도시산업 범위 첫 공식화…국토부, 특수분류 제정",https://www.newspim.com/news/view/20260723000985,"국토교통부가 인공지능(AI)과 사물인터넷(IoT), 건설·교통 기술이 결합된 스마트도시산업의 범위를 처음으로 체계화했다. 흩어져 있던 기업과 일자리, 시장 규모를 하나의 통계로 파악해 연구개발과 예산 지원, 규제 특례... "
2026-07-24,네이버뉴스,스마트도시산업 통계 특수분류 제정…시장 규모·일자리 체계화,https://www.yna.co.kr/view/AKR20260723123900003?input=1195m,"소프트웨어와 건설, 통신 분야 등에 흩어져 있어 스마트도시산업의 전체 규모나 분야별 성장 추이를... 실태조사 결과는 향후 국가승인통계 지정을 추진하고, 기업 맞춤형 지원과 연구개발(R&D), 규제 샌드박스 적용... "
2026-07-24,네이버뉴스,"국토부, 스마트도시산업 특수분류 24일 제정",http://www.fnnews.com/news/202607231515020111,"스마트도시산업은 도시 건설·운영 분야에 AI, 사물인터넷(IoT) 등 기술을 융합한 복합산업이다. 교통·환경... 조사 결과 통계는 국가승인통계 지정을 추진하고, R&D와 예산 지원, 규제 샌드박스 대상 선정, K-스마트도시... "
2026-07-24,네이버뉴스,스마트도시산업 통계 특수분류 신규제정…산업육성 나선다,https://www.news1.kr/realestate/general/6236980,"스마트도시산업은 교통·환경·방범 등 도시 건설·운영 분야에 인공지능(AI), 사물인터넷(IoT) 등 첨단기술을... 지원, 규제 샌드박스 대상 선정, K-스마트도시 기업의 해외 진출 지원 등에 활용할 방침이다. 이기봉 국토부... "
2026-07-24,네이버뉴스,"국민의힘, 오늘 '부동산정책 정상화 토론회'…李 대토론회 맞불",https://www.news1.kr/politics/assembly/6236944,"국민의힘은 24일 '규제에서 시장으로, 징벌에서 합리로'를 주제로 부동산정책 정상화 토론회를 개최한다.... 발제자로는 이종아 서울시 부동산정책개발센터장, 송원배 대구경북부동산분석학회 부회장, 이은형 대한건설정책... "
2026-07-24,네이버뉴스,"韓 ""1500억달러 마스가 이행 준비"" 美 ""미국내 건조 건수로 평가""(종합)",https://www.news1.kr/world/usa-canada/6237433,"러트닉 장관은 이어진 기조연설에서 ""사업을 건설하는 과정에서 장애물에 부딪히거나 환경이 여러분을 완전히 환영하지 않는다고 느낀다면 상무부에 연락하라""며 ""우리는 여러분이 미국에서 건설할 수 있도록 규제... "
2026-07-24,네이버뉴스,[7ㆍ23 부동산 대토론회]② “1주택자 양도세 감면혜택 제한… 전세대출...,https://www.dnews.co.kr/uhtml/view.jsp?idxno=202607231515493880304,"신도시 건설시간 단축도 검토 [대한경제=황은우 기자]이재명 대통령이 23일 부동산정책 국민 대토론회에서... 보유세ㆍ초고가 주택 이슈 외에도 양도세 감면 제한, 전세대출 규제 지속, 3기 신도시 착공 지연 해소 등 부동산... "
2026-07-24,네이버뉴스,"산업장관 ""韓, 1500억달러 마스가 이행 준비…美는 규제 제거해야""",https://www.news1.kr/world/usa-canada/6237430,"러트닉 장관은 이어진 기조연설에서 ""사업을 건설하는 과정에서 장애물에 부딪히거나 환경이 여러분을 완전히 환영하지 않는다고 느낀다면 상무부에 연락하라""며 ""우리는 여러분이 미국에서 건설할 수 있도록 규제... "
2026-07-24,네이버뉴스,"[사설] 국민 목소리 들었다면, 부동산 정책 정교한 손질로 화답을",https://www.seoul.co.kr/news/editOpinion/editorial/2026/07/24/20260724027001?wlog_tag3=naver,“건설 기간을 절반 이하로 줄이는 방안을 검토 중”이라고 했다. 이해관계가 극심하게 엇갈리는 부동산... 정책의 수용 과정을 고려하지 않은 규제 일변도라면 부동산 시장의 왜곡은 더 깊어질 수 있다. 정부의 강력한... 
2026-07-24,네이버뉴스,"[사설] 부동산 대토론회 딴 나라 얘기, 지방 맞춤 대책 절실",https://www.busan.com/view/busan/view.php?code=2026072318081094027,지방 건설사들은 시장 침체로 제 사업은 펼치지도 못하고 공공 공사에만 목을 매고 있다. 그마저도 출혈... 금융과 정책 규제가 자금 가뭄에 시달리는 지방 부동산 시장 물꼬를 막는 일도 걱정이다. 무엇보다 정부가 ‘지방... 
2026-07-24,네이버뉴스,“민간임대 대책 부실” “10억 넘으면 초고가”… 예정시간 넘겨 3시간...,https://www.donga.com/news/Politics/article/all/20260724/134355507/2,"이 대통령이 이에 “건설 임대를 할 부지가 있다면 민간 업자 입장에선 분양 수요, 가격이 높은데 왜 임대를 하겠느냐”고 반론을 제기하며 토론이 벌어지기도 했다. 이날 토론회에선 부동산 세제와 규제 강화를 요구하는... "
