date,source,title,link,description
2026-07-23,네이버뉴스,"롯데건설, AI·로봇 스타트업 8개 과제 현장 실증..공공지원 6.2억 연계",http://www.4th.kr/news/articleView.html?idxno=2115168,포쓰저널 이현민 기자 이미지=롯데건설 롯데건설이 공공기관과 손잡고 AI(인공지능)·로봇·건설자동화 등 현장 중심 스타트업 혁신 기술 고도화에 나선다. 공공기관의 사업화 지원금을 스타트업의 기술실증에 연계하고... 
2026-07-23,네이버뉴스,"롯데건설, 고급 커뮤니티에 트리플 역세권 … '스카이 브리지'에선 잠실...",https://www.mk.co.kr/article/12105536,재건축 최우수상 / '잠실 르엘' 제30회 매경 살기좋은 아파트 선발대회에서 롯데건설이 시공한 '잠실 르엘'이 아파트 재건축 부문 최우수상을 받았다. 잠실 르엘은 한강변 입지와 롯데월드타워로 대표되는 뛰어난 주변... 
2026-07-23,네이버뉴스,격이 다른 공간을 경험하는 초월적 가치 만들어 나갈것,https://www.mk.co.kr/article/12105534,오일근 롯데건설 대표 제30회 매경 살기좋은 아파트 선발대회에서 롯데건설이 시공한 '잠실 르엘'이 재건축 부문 최우수상을 받았다. 오일근 롯데건설 대표는 이번 수상에 대해 롯데건설의 노하우와 기술력이 집약된... 
2026-07-23,네이버뉴스,"광주 중앙공원 주주권 소송 파기환송심, 롯데건설 승소",https://www.yna.co.kr/view/AKR20260723126200054?input=1195m,"법원, '한양파' 케이앤지스틸 청구 각하·기각 광주 중앙공원 1지구 민간공원특례사업의 주주권 소송 2심 파기환송심에서 아파트단지 신축 등 시공권을 가진 롯데건설이 승소했다. 광주고법 민사1부(박현수 고법판사)는... "
2026-07-23,네이버뉴스,"포스코이앤씨, 네이처테라스·팜가든…조경 차별화",https://www.mk.co.kr/article/12105533,아파트 대형사 우수상 / '더샵 신문그리니티' 포스코이앤씨가 시공한 '더샵 신문그리니티'가 제30회 매일경제 살기좋은 아파트 선발대회에서 일반아파트 대형사 부문 우수상을 수상했다. 더샵 신문그리니티는 경남 김해... 
2026-07-24,네이버뉴스,"[Invest]현대엔지니어링, 서울시 영업정지 처분 일주일만에 인지했다",https://www.investchosun.com/site/data/html_dir/2026/07/23/2026072380092.html,일반적으로 대형 건설사들은 약 3년의 일감을 확보하고 있다.작년 사고 이후 현대엔지니어링은 주택·토목 부문 신규 수주를 전면 중단했다. 작년 신규 수주는 전년 대비 40.9% 감소한 7조8950억원을 기록했다. 올해... 
2026-07-24,네이버뉴스,‘기초금액 후려치기’ 조달청 관행 없앴다,https://www.dnews.co.kr/uhtml/view.jsp?idxno=202607231606571990317,그 중에서도 적격심사 대상 공사에 집중하는 중소ㆍ중견사들의 경우 기초금액 삭감에 따라 낙찰하한율 적용 기준이 함께 낮아져 실제 수주 가능 금액이 줄어드는 등 부담이 컸다. 한 건설사 관계자는 “한국토지주택공사... 
2026-07-24,네이버뉴스,“수도권 정비사업 잡아라”…중견사 고군분투,https://www.dnews.co.kr/uhtml/view.jsp?idxno=202607231348292230276,금호ㆍ반도ㆍ남광토건 잇단 수주 제일건설도 서울 재진입 노려 브랜드 파워ㆍ자본력 격차 여전 핵심지는 대형사 독주 고착화 [대한경제=이종무 기자] 수도권재개발ㆍ재건축 시장에서 중견 건설사들의 고군분투가... 
2026-07-23,네이버뉴스,[헬로스톡] 7/23 주목할 종목 : 한미글로벌·클래시스·LG화학·포스코인...,https://www.hellot.net/news/article.html?no=113937,"단순 건설사가 아닌 반도체 팹·데이터센터·원전으로 이어지는 AI 인프라 밸류체인 전반에 걸쳐... 하이테크 부문 수주 호조가 실적 개선을 이끌었으며, 상반기 하이테크 부문 수주 증가율은 YoY 기준 +98%에... "
2026-07-23,네이버뉴스,[2026 기계설비의 날] 산업통상부 장관 표창 - 김세희 (주)세일에프에이...,https://www.kmecnews.co.kr/news/articleView.html?idxno=50973,탄탄한 기술력은 굵직한 수주 실적으로 이어지고 있다. 최근 1군 대형 건설사의 주요 현장에 악취제거시스템(탈취 유니트)을 납품하고 있다. 세일에프에이가 상용화한 촉매 필터(EXPOL)는 일산화탄소는 물론 각종... 
2026-07-23,네이버뉴스,"현대엔지니어링, 영업정지 3개월…‘일감 공백’ 우려",https://www.sentv.co.kr/article/view/sentv202607230109,"사고 이후 자발적으로 신규 수주를 중단한 상황에서 영업정지까지 겹치며, 일감 공백이 더 커질 수 있다는... 산업안전보건법상 중대재해를 낸 건설사에 대해 고용노동부 장관이 영업정지를 요청한 데 따른 겁니다.... "
2026-07-23,네이버뉴스,"‘부동산 불황’에 발목 잡힌 하츠, B2C서 돌파구 찾나",https://www.sentv.co.kr/article/view/sentv202607230100,"건설사들의 재건축 수주 감소 여파가 실적 둔화로 이어진 겁니다. 이런 상황에서 하츠는 건설사 특판 비중을 줄이고, B2C 유통망을 확대하고 있습니다. 하이마트·이마트·전자랜드 등 오프라인 유통망을 넓힌 겁니다.... "
2026-07-23,네이버뉴스,미국ㆍ동유럽 건설시장 공략…지역별 전략ㆍ전문공종이 승부 가른다,https://www.dnews.co.kr/uhtml/view.jsp?idxno=202607231326288710262,종합건설사(GC)에 위임하는 구조로적응하는 한편 경쟁력을 갖춘 현지 협력업체를 확보하는 것이수주의 핵심 요소로 꼽힌다”고 설명했다. 미국 시장은 숙련 기능인력 부족과 공사비 상승 위험도 지속되고 있으며... 
2026-07-23,네이버뉴스,"국토부, 해외건설 5개국 심층정보 공유회 개최…업계 120명 참석",https://www.fetv.co.kr/news/articleView.html?idxno=306976,한국 건설사의 해외 수주는 지난해 기록적 성과를 냈다. 2025년 해외건설 수주액은 472억7000만 달러로 11년 만의 최대 실적을 기록했다. 체코 원전을 앞세운 유럽 시장 급성장과 플랜트·원전 등 고부가가치 공종으로의... 
2026-07-23,네이버뉴스,8년 연속 '중대재해 ZERO' … 두바이 이어 LA서도 K주택 알려,https://www.mk.co.kr/article/12105546,"종합 건설사로 특히 주택 브랜드 'UBORA'를 성공적으로 공급하며 주택 시장의 강자로 떠올랐다. 반도건설은... 도시정비사업 수주, 복합건축물 개발, 해외개발사업을 영위하고 있다. 단조로운 사업 구조가 아닌... "
2026-07-24,네이버뉴스,"[더벨][현장 스토리] 유니슨, 명운산업개발 시너지 힘입어 매출 1조 '정...",https://www.thebell.co.kr/free/content/ArticleView.asp?key=202607231100436920104039,명운산업개발은 발전개발사로 입찰에서 유니슨과 같은 풍력발전 기자재 업체를 선정한다. 건설업과 비교하면 명운산업개발이 시행사이고 유니슨이 시공사인 셈이다. 유니슨은 명운산업개발과 국책사업 등 입찰에... 
2026-07-23,네이버뉴스,서해최북단 백령발전소 증설 언제 되나 ... '환경영향평가 누락'에 또 제...,https://ic.newdaily.co.kr/site/data/html/2026/07/23/2026072300347.html,"이에 따라 한전은 다음 달 환경영향평가 용역업체 선정을 위한 입찰 공고를 낼 계획이다. 환경영향평가에... 이후 시공사의 재무 악화와 계약 위반 등으로 2024년과 지난해 계약이 잇따라 해지됐고, 한전은 올해 새... "
2026-07-23,네이버뉴스,"""2030년 개통 무산""...도시철도 2호선 시간표 '흔들'",https://www.ikbc.co.kr/article/view/kbc202607230060,"정부의 사업비 증액 승인을 받은 뒤 조달청을 통해 다시 입찰을 거쳐야 해서, 시공사 선정과 착공 시점조차 확정하지 못한 상태입니다. ▶ 싱크 : 전남광주통합특별시 관계자(음성변조) - ""만약에 또 유찰이 돼버리면... "
2026-07-23,네이버뉴스,"[2026 대한민국 주거환경대상] 바른공사, 건설 전 과정 연결 디지털 플랫...",https://www.joongang.co.kr/article/25447621,바른공사는 플랫폼을 통해 건축주·시행사·조합·시공사·자재업체 등이 필요한 정보를 효율적으로 공유할... 바른공사는 건설 분야 디지털 플랫폼 기술력과 사업성을 인정받아 ‘2026 대한민국 주거환경대상’에 선정됐... 
2026-07-23,네이버뉴스,"李 ""3기 신도시 입주 5년 → 2년6개월 단축 … 역세권엔 임대주택""",https://www.mk.co.kr/article/12105696,"박합수 건국대 부동산대학원 겸임 교수는 ""입찰과 시공사 선정, 설계에 1년가량이 필요하고 전기·상하수도 등 기반시설 조성에도 1년이 걸린다""면서 ""500가구 이상 아파트는 안전 기준을 지키며 시공할 경우 공사에만 최소... "
2026-07-23,네이버뉴스,"조유진 영등포구청장 ""구민이 구정의 주인이 되는 영등포 만들 것""",http://tbs.seoul.kr/news/newsView.do?typ_800=7&idx_800=3537432&seq_800=20530307,"민회는 구민이 직접 구정의 주요 현안을 선정하고 함께 토론해 정책에 반영하는 '영등포형 직접 민주주의... 그렇게 되면 도시 정비 단계에서 조합원 간의 갈등, 조합원들과 시공사 간의 갈등 등 여러 가지 장애 요소들이... "
2026-07-23,네이버뉴스,"부동산 대토론회, 서울 집값 해법 집중…지방 대책은 '뒷전'",https://www.daejonilbo.com/news/articleView.html?idxno=2290010,대전 동구 가오1구역은 지난 4월 공사비 증액 갈등으로 기존 시공사와 계약을 해지한 뒤 재입찰에 나섰지만 여전히 시공사 선정에 어려움을 겪고 있다. 토지등소유자 방식으로 추진된 중구 선화1구역은 사업이 장기간... 
2026-07-23,네이버뉴스,"""특허공법 절차 무시·안전관리 부실까지""…화성시 시니어플러스센터 부...",https://www.betanews.net/article/view/beta202607230057,감사에서는 약 5억원 규모의 특정업체 특허공법을 관련 선정 절차 없이 설계서에 임의 반영한 사실이 확인됐다. 더욱이 특허공법 기술보유업체와 정식 하도급 계약도 체결하지 않은 상태에서 시공사가 직접 공사를... 
2026-07-23,네이버뉴스,[부동산 국민 대토론회] 재건축·재개발 '브로커·조합·시공사 유착 가...,http://www.newsian.co.kr/news/articleView.html?idxno=92679,"시공사 선정 및 공사비 증액 과정에서 정비업체와 브로커가 개입해 조합 관계자에게 억대의 금품과 뇌물을 제공하거나, 특정 협력 업체와의 불투명한 계약으로 공사비를 의도적으로 부풀린 정황들이 적발돼 수사기관에... "
2026-07-23,네이버뉴스,"""분담금 더 내더라도 속도 내자""⋯오세훈 '1심 상실형'에 정비사업 '비상...",https://www.etoday.co.kr/news/view/2606699,"최근 시공사를 선정한 한 재개발 단지 조합원은 ""시장이 바뀌더라도 사업 자체가 엎어지진 않겠지만, 구역 지정 등 초기 단계에서 행정 절차가 지연될 수 있다는 점이 가장 부담스럽다""고 말했다. 재개발·재건축 관련... "
2026-07-23,네이버뉴스,정비사업 곳곳 '착공 절벽'… 서울 주택 공급 차질 '빨간불',https://www.pinpointnews.co.kr/news/articleView.html?idxno=470925,해당 사업지는 2022년 조합설립인가를 받은 뒤 시공사 선정에 나섰지만 두 차례 입찰이 모두 유찰됐다. 이후 조합원 과반이 사업 해산에 동의하면서 조합설립인가가 취소됐다. 유사한 사례도 이어지고 있다. 지난해에는... 
2026-07-23,네이버뉴스,해양레저시설 '군산 오션팔레트' 부실…시의회 시정질의 '도마위',https://www.news1.kr/local/jeonbuk/6236999,"그는 ""토목과 건축공사는 2023년 8월에 착공하고 전기·소방·통신공사 착공과 감리단 선정은 2024년 6월에 이뤄졌음에도 준공은 2024년 12월에서 2025년 7월로, 또다시 12월까지 미뤄졌다""며 ""지금이라도 시공사와... "
2026-07-23,네이버뉴스,"김현기 강남구청장, 압구정 재건축 현장 점검…조합과 추진 방안 논의",https://www.job-post.co.kr/news/articleView.html?idxno=221982,"지난 5월에는 3·4·5구역의 시공사 선정이 완료됐으며, 이달에는 2구역이 통합심의를 통과했다. 하반기에는 2구역의 사업시행인가 신청과 함께 3·4·5구역의 통합심의 절차도 진행될 예정이다. 강남구는 구역별 추진 일정과... "
2026-07-24,네이버뉴스,[7ㆍ23 부동산 대토론회]③ 이주비 대출 규제 완화 목소리에… “검토하...,https://www.dnews.co.kr/uhtml/view.jsp?idxno=202607231501490680302,"세제ㆍ정비사업 발언 ‘온도차’ 이 대통령, 재개발ㆍ재건축사업 신규 주택공급 효과 의문 제기 민간... 현장에서는 시공사 신용공여로 추가 이주비를 조달하고 있지만, 일반 대출 금리가 4%대인 데 비해 추가 이주비... "
2026-07-24,네이버뉴스,"“보유세 강화 맞지만 세 배 올리면 폭동, 이미 너무 많이 올라버렸다....",https://slownews.kr/163675,및 시공사를 교체하는 일이 빈번하다는 것이다. 정해권은 “우리가 이런 문제에 관해 사법 당국에 수사 첩보나 범죄 정보를 제공해도 수사가 전혀 이뤄지지 않는다”며 “(수사 당국은) 재건축은 민간 분야이기 때문에... 
2026-07-23,네이버뉴스,"박원갑 ""세제 개편되면 '강남 불패' 흔들릴 것""",https://www.ytn.co.kr/_ln/0101_202607232031142571,"교체하거나 시공사를 교체하는 사례가 많이 일어난다, 이렇게 얘기를 했더니 대통령이 일리 있는... 투명하지 않은 이런 재건축 재개발도 상당히 저도 문제가 있다고 봐요. 그래서 정부가 공공 쪽으로 자꾸 하려는 것도... "
2026-07-23,네이버뉴스,공사비 갈등에 속도 못 내는 리모델링...서울 착공률 1% 안돼,http://www.fnnews.com/news/202607231818466636,재개발·재건축과 달리 리모델링은 법적인 공사비 검증 제도가 없다. 시공사와 조합 간 분쟁이 빈발해도 객관적인 타당성을 따져볼 근거가 없는 것이다. 앞서 공사비 검증 도입 골자의 주택법 개정안이 지난 5월 국회... 
2026-07-23,네이버뉴스,"""실수요자 피해 최소화""… 지역·상황 '핀셋형 정책' 주문한 李",https://www.asiatoday.co.kr/kn/view.php?key=20260724010008748,"재개발·재건축 현장에서는 이주비 대출 규제가 사업 속도를 늦추고 있다는 지적이 제기됐다. 김제경... 김 소장은 이어 ""시공사 신용공여 방식의 이주비 금리는 연 6~7% 수준으로 일반 이주비 대출 금리인 3% 안팎보다 높다... "
2026-07-23,네이버뉴스,"전세대출 줄이면 집값 안정될까…전문가 ""실수요자 배려 필요""",https://www.newspim.com/news/view/20260723001220,특히 강남권을 비롯한 서울시내 인기 주거지역 재건축 단지의 경우 시공사인 1군 브랜드 건설사가 자체 조달한 자금으로 기본 이주비 외 추가 이주비를 지급하지만 모아주택·모아타운 같은 서울 강북권 군소 정비사업의... 
2026-07-23,네이버뉴스,"이재명, 보유세 '차등과세' 첫 공개…기준 정한 뒤 가중감면",http://www.4th.kr/news/articleView.html?idxno=2115182,"재개발·재건축과 관련해서는 용적률 완화가 실제 공급 확대에 얼마나 기여하는지 면밀히 따져야 한다고... 원자재와 인건비 상승뿐 아니라 고급 마감재 사용과 브로커 개입, 조합과 시공사 사이의 불투명한 계약이 공사비... "
2026-07-23,네이버뉴스,"이재명 대통령 ""부동산 정책 목표는 시장 정상화…거주용 주택 보호할 ...",https://www.news2day.co.kr/article/20260723500274,"[사진=연합뉴스] 그러면서 재건축 공사비 급등의 원인이 단순 원자재값 인상이 아닌 마감재 고가화 및 브로커·시공사·조합 간 비리 구조에 있다는 지적에 대해, 이 대통령은 ""부정행위나 불투명한 구조로 인한 부당... "
2026-07-23,네이버뉴스,"""이사 못 가면 착공도 없다""···현장에 번진 이주비 조달 비상",https://www.sisajournal-e.com/news/articleView.html?idxno=422625,사업성이 높은 대규모 재건축은 대형 시공사 보증을 바탕으로 추가 이주비를 확보할 여지가 있다. 반면 모아타운과 소규모 재개발·재건축은 보증 자체가 막히거나 낮은 담보가치 탓에 대체 주거비를 충분히 마련하기... 
2026-07-23,네이버뉴스,'시장 정상화' 내건 부동산 대토론회…대출·보유세·정비사업 공방,http://www.opinionnews.co.kr/news/articleView.html?idxno=141964,"정비사업 공급 효과 공방…""가구 수보다 유효 공급 봐야"" 재건축·재개발 규제를 완화해야 한다는 의견에는... 시공사의 신용공여로 추가 이주비를 조달하면 금리가 높아져 조합의 금융비용도 커질 수 있다. 양지영... "
2026-07-23,네이버뉴스,[부동산 대토론] “빌라보다 신축 아파트 부족”…국민 대토론회서 ‘유...,https://www.dailian.co.kr/news/view/1670164/?sc=Naver,"동시에 재개발과 재건축에 대해서는 신중해야 한다는 의견이 나왔다. 이광수 광수네복덕방 대표는 ""재건축... 교체하거나, 시공사를 교체하는 사례가 많다""며 ""사법당국에 제보해도 민간 분야라는 이유로 제대로 수사가... "
2026-07-23,네이버뉴스,"李대통령 ""재건축 공사비 상승률 놀라워…전면 점검해야""",https://www.nocutnews.co.kr/news/6552453?utm_source=naver&utm_medium=article&utm_campaign=20260723041813,"전문가 ""재건축·재개발 물가지수 400% 상승…마감재 탓"" 정해권 ""우리 집 짓는데 마감재가 왜 집값에... 교체하거나, 시공사를 교체하는 사례가 많이 일어난다""고 원인을 지목하기도 했다. 이 대통령은 ""일리 있는 지적... "
2026-07-23,네이버뉴스,3시간 머리 맞댔지만 해법 못 찾은 '부동산 대토론회'…알맹이는 없었다,https://www.mediapen.com/news/view/1111833,"보니 시공사의 신용을 통해 사업비 대출을 지원하는 식으로 가는데, 추가 이주비 금리가 6∼8%로 일반... 이광수 광수네복덕방 대표는 ""지금 서울시장이 추진하는 것처럼 재건축 규제를 완화하면 집값이 폭등하고 30만 채가... "
2026-07-23,네이버뉴스,"천일건축, 부천 소사본 1-1구역 재개발 건축감리 수주 유력",https://www.dnews.co.kr/uhtml/view.jsp?idxno=202607231608011080318,"1-1구역 재개발정비사업 건축감리용역’ 수주에 다가섰다. 23일 관련 기관에 따르면 경기 부천시가 지난 22일 이 용역에 대한 가격개찰을 집행한 결과, 천일건축이 예정가격 대비 72.975%인 82억4845만2000원을 써내... "
2026-07-23,네이버뉴스,"'속도전' 외친 李…3기신도시 착공 60개월? ""절반으로""",https://news.bizwatch.co.kr/article/real_estate/2026/07/23/0034,"주상복합 수준 양질의 비아파트를 공급해야 한다""고 주장했다. 한편으로 정비사업을 통한 공급을 집값 안정화로 이어가려면 총량 규제가 필요하다는 의견도 있었다. 이광수 광수네복덕방 대표는 ""재건축·재개발을 통한... "
2026-07-23,네이버뉴스,"우리자산신탁, 분당 매화마을 재건축 본격화... 1600세대 탈바꿈",http://www.thefirstmedia.net/news/articleView.html?idxno=204528,사진=우리자산신탁 1기 신도시 재건축이 본격화되면서 신탁사들의 정비사업 수주 경쟁도 한층 치열해지고... 등 수도권 주요 정비사업에 참여하며 재건축·재개발과 도심복합개발로 사업 포트폴리오를 확대하고 있다.
2026-07-23,네이버뉴스,"IPARK현대산업개발, 서울숲·한강을 가까이…자연친화 단지",https://www.mk.co.kr/article/12105531,"단지 인근에 재개발이 진행 중인 성수전략정비구역은 용산구의 한남 재개발, 강남구의 압구정 재건축과 함께 현재 서울 내 최대 규모 정비사업으로 꼽히고 있다. 서울숲 아이파크 리버포레 2차는 한강과 중랑천... "
2026-07-24,네이버뉴스,“사우디 核협정 전제는 ‘아브라함 협정’”…“韓에 이중잣대” 비판...,https://www.joongang.co.kr/article/25447775,이를 놓고 미국 언론들은 트럼프 행정부가 한국과의 원자력 협정 체결을 미루는 와중에 원전조차 건립하지... 그런데 사우디는 그간 이스라엘이 수용하기 어려운 ‘팔레스타인 독립국가 건설’을 관계 정상화의 조건으로... 
2026-07-24,네이버뉴스,"""2047년 원전 100GW 확보""… 印, 2033년까지 소형모듈원자로 5기 독자 건...",https://www.g-enews.com/view.php?ud=202607240734231022e7e8286d56_1,"기술로 건설하며 원자력 발전 설비용량 대폭 확대에 나선다. 23일(현지시각) 오일프라이스닷컴 보도에 따르면, 지텐드라 싱 인도 원자력부 장관은 최근 의회에 제출한 서면 답변을 통해 이 같은 대규모 원전 확충... "
2026-07-24,네이버뉴스,"트럼프 ""대규모 공격 곧 결정""…전면전 임박?",http://www.yonhapnewstv.co.kr/news/MYH20260724073609kc8,다만 사우디가 이스라엘이 받아들이기 어려운 '팔레스타인 독립국가 건설'을 양국 관계 정상화 조건으로... 아직 원전조차 건립하지 않은 사우디가 잠재적 농축 권한을 확보했다는 지적입니다. [앵커] 이 소식도... 
2026-07-24,네이버뉴스,"""사우디는 되고 한국은 안 되나""…NYT, 미 원자력 협정 '이중잣대' 지적",https://news.tvchosun.com/site/data/html_dir/2026/07/24/2026072490076.html,"한국이 오랜 기간 미국과 우라늄 농축과 사용후핵연료 재처리 권한을 놓고 협상해온 반면, 아직 원전을 건설하지 않은 사우디가 잠재적인 농축 권한을 확보한 것은 형평성에 어긋난다는 것이다. 또 무함마드 빈 살만... "
2026-07-24,네이버뉴스,"경북도, 2분기 도정 성과 빛낸 우수부서 6곳 시상",https://biz.heraldcorp.com/article/10818533?ref=naver,원자력산업과는 영덕 대형 원전 건설을 유치해 약 12조원 규모의 사업 추진 기반을 마련하고 2조원 이상의 지역경제 파급효과가 기대되는 등 경북 에너지산업 기반 확충에 크게 기여했다. 지역개발과는 ‘도시재생... 
2026-07-24,네이버뉴스,"홍해 봉쇄에 유가 100달러 선 돌파...트럼프 ""대규모 공격 임박""",https://www.ytn.co.kr/_ln/0104_202607240656044239,"하지만 사우디는 이스라엘이 수용하기 어려운 '팔레스타인 독립 국가 건설'을 관계 정상화 조건으로 내세워... 특히 뉴욕 타임스는 ""원전조차 짓지 않은 사우디가 우라늄 농축의 길로 이어질 수 있는 협정을 체결해 오랜... "
2026-07-24,네이버뉴스,"트럼프, 사우디 핵협정 하루만에 “이스라엘과 수교해야 원전 협정”[1...",https://biz.heraldcorp.com/article/10818505?ref=naver,그러나 사우디는 이스라엘 입장에선 수용하기 어려운 ‘팔레스타인 독립국가 건설’을 양국 관계 정상화의 조건으로 내세워왔다는 점에서 이번 123 협정이 체결 하루 만에 중대 변수를 안게 됐다고 미 언론들은 짚었다.... 
2026-07-24,네이버뉴스,사우디에 핵 빗장 풀어준 트럼프…동맹국인 한국은?,https://www.mk.co.kr/article/12106243,"월스트리트저널(WSJ)·뉴욕타임스(NYT)·로이터 등 보도를 종합하면 협정에는 미국이 사우디에 원전을 건설하고, 원전 연료를 위한 우라늄 농축·사용 후 연료 재처리(플루토늄 추출) 기술을 이전한다는 내용이 들어 있다.... "
2026-07-24,네이버뉴스,내년 원전4기 대책없이 ‘정년퇴임’…연장절차 시작도 못했다,https://www.mk.co.kr/article/12106244,서남권 반도체 클러스터 등 정부가 발표한 메가 프로젝트에 전력을 원활히 공급하기 위해서는 신규 원전 건설뿐 아니라 기존 원전에 대한 신속한 계속운전 허가가 필요하다는 제언이 나온다. 이를 위해서는 규제 인력과... 
2026-07-24,네이버뉴스,SMR 올라탄 K조선...HD현대는 생태계·삼성은 플랫폼,https://www.ebn.co.kr/news/articleView.html?idxno=1717491,◆AI 시대 커지는 SMR 시장...조선업 새 성장축 SMR은 기존 대형 원전보다 규모가 작고 주요 설비를 공장에서 모듈 형태로 제작한 뒤 현장에서 조립하는 방식이다. 건설 기간과 초기 투자 부담을 줄일 수 있고 전력 수요지... 
2026-07-24,네이버뉴스,[사설] 사우디 우라늄 농축 길 터준 美… 한미 안보협의도 속도를,https://www.seoul.co.kr/news/editOpinion/editorial/2026/07/24/20260724027002?wlog_tag3=naver,이를 통해 사우디는 앞으로 건설할 원전에 자체적인 연료공급망을 구축할 수 있게 된다. 미국이 이 같은 협정을 체결하는 데는 사우디 원전시장을 선점하고 사우디에 원전을 제공하려던 중국·러시아를 견제하려는 목적이... 
