date,source,title,link,description
2026-07-15,네이버뉴스,"삼성전자·신한금융·우리금융·기아·KB금융, ESG평가 최고 'S'등급",https://www.esgeconomy.com/news/articleView.html?idxno=16044,"차상위 A등급에는 LG유플러스, 미래에셋증권, 삼성전기, 현대글로비스, 기업은행, 카카오, KT&G, SK텔레콤, 삼성화재, 한국금융지주, SK이노베이션, 포스코홀딩스, 현대건설, 아모레퍼시픽, 한화에어로스페이스... "
2026-07-15,네이버뉴스,올 상반기 해외건설 수주액 112억달러… 체코원전 기저효과ㆍ중동리스...,https://www.dnews.co.kr/uhtml/view.jsp?idxno=202607141007102630049,"기업별로는 현대건설이 35억1400만달러(비중 31.1%)로 1위를 차지했으며, 대규모 FLNG 프로젝트를 수주한 삼성중공업이 28억8100만달러(비중 25.5%)로 뒤를 이었다. 해건협 관계자는 “당초 기대했던 중동 지역 대형... "
2026-07-15,네이버뉴스,펄펄 끓는 건설현장...'하이테크'로 맞선다,https://www.dnews.co.kr/uhtml/view.jsp?idxno=202607141614138520166,14일 건설업계에 따르면 현대건설은 올해부터 온열질환 예방용 웨어러블 손목 밴드를 전격 도입했다. 밴드는 탑재된 자체 알고리즘을 통해 착용자의 체내에 축적되는 열을 감지한다. 체감온도 33℃ 이상 등 일정 수준... 
2026-07-15,네이버뉴스,"[배전망 ESS, 첫발](1) 현대건설, 통합발전소 사업 전격 진출",https://www.dnews.co.kr/uhtml/view.jsp?idxno=202607101357064520703,"기자]현대건설이 한전KDN, 한국동서발전, LG에너지솔루션, SK이터닉스, HD현대일렉트릭 등과 함께 배전망 에너지저장장치(ESS) 사업자로 이름을 올렸다. 국내 건설사 중 처음으로 발전소를 짓는 데 그치지 않고... "
2026-07-15,네이버뉴스,30조 목동 재건축 대전 막 올랐다…상반기 강남 이어 하반기 격전지,https://www.news1.kr/realestate/general/6228131,"대우건설은 '써밋 목동 라운지'를, 현대건설은 '디에이치 목동 라운지'를 열었다. 롯데건설과 GS건설, IPARK현대산업개발도 홍보관 개관을 준비하고 있다. 삼성물산은 1·3·5·7단지 수주에 주력한다. 현대건설은 4·5·7... "
2026-07-15,네이버뉴스,DL이앤씨 상반기 공공공사 9032억 원 수주 '톱'…HJ중공업·계룡건설도 ...,http://www.consumernews.co.kr/news/articleView.html?idxno=759312,"1분기 상위 5곳은 현대건설(대표 이한우)과 남광토건(대표 김종수·이동철), KCC건설(대표 정몽열·심광주), 쌍용건설(대표 김인수), DL이앤씨(대표 박상신)였지만 상반기 순위는 DL이앤씨와 HJ중공업, 계룡건설, 동부건설... "
2026-07-15,네이버뉴스,"문 여는 ‘목동 르엘 라운지’…롯데, 1·7·11·14단지 정조준",https://news.mtn.co.kr/news-detail/2026071417235088871,"7단지 시공권은 삼성물산과 현대건설, 롯데건설의 3파전으로 흘러가고 있다. 최근 조합설립인가를 받은 뒤 시공사 선정 절차에 착수했다. 연내 입찰 공고가 나올 것으로 예상된다.11단지는 대우건설과 롯데건설이 관심을... "
2026-07-15,네이버뉴스,"현대건설, 美 차세대 SMR 사업 참여",https://www.segye.com/newsView/20260714518770?OutUrl=naver,현지 개발사와 프로젝트 협약 초기 단계부터 사업 기회 확대 현대건설이 미국 차세대 소형모듈원전(SMR) 개발사와 협력해 미국 SMR사업 참여에 나선다. 현대건설은 지난 13일(현지시간) 미국 차세대 SMR 개발사... 
2026-07-15,네이버뉴스,‘미니 목동’ 광명 하안주공 재건축⋯대형사 수주 ‘촉각’,https://www.etoday.co.kr/news/view/2603540,삼성물산 건설부문은 하안주공 전 단지 참여를 적극적으로 검토하고 있으며 GS건설과 현대건설도 관심을 보이고 있다. 대우건설과 IPARK현대산업개발은 6·7단지 수주 참여를 검토 중이며 포스코이앤씨는 3·4단지를... 
2026-07-15,네이버뉴스,"[설계 오독, 시공 오류 해법은]①“설계 단계부터 데이터 통합 선행해야...",https://www.dnews.co.kr/uhtml/view.jsp?idxno=202607141337311590106,"현대건설도 피하지 못한 휴먼 에러, 원천 방지 대책은? #. 이한우 현대건설 대표이사는 지난 5월, 수도권광역급행철도(GTX)-A 공사 구간 철근 시공오류에 대해서 “모든 책임을 통감하고 고개를 들 수 없다”고 말 했다.... "
2026-07-15,네이버뉴스,[정비톡] 하반기 수주전 ‘스타트’…롯데ㆍIPARK현산 나란히 ‘마수걸...,https://www.dnews.co.kr/uhtml/view.jsp?idxno=202607141010229350050,"상반기에는 현대건설(7조6947억원), GS건설(7조4694억원), 삼성물산(4조7163억원) ‘빅3’가 20조원 가까이를 쓸어 담았는데, 하반기 초반부터 롯데건설과 현대산업개발이 치고 나가는 모양새입니다. 한= 롯데건설 얘기부터... "
2026-07-15,네이버뉴스,"문 열린 배전망 ESS...K-배터리 3사, 대형 수주전 기대감↑",https://www.ajunews.com/view/20260714143652497,"선정 사업자는 VPP랩과 LG에너지솔루션, 한전KDN, SK이터닉스, HD현대일렉트릭, 그리드위즈, 한국동서발전, 한국중부발전, 현대건설이다. 기후에너지환경부는 이번 사업을 통해 접속 대기 중인 태양광 발전설비 182.... "
2026-07-15,네이버뉴스,학교·공원 인접 단지 청약 경쟁률…젊은 도시서 3배 높아,https://www.newsis.com/view/NISX20260714_0003708746,"평균연령 44.0세로 전국 평균보다 젊고 아동 비율(11.0%)도 전국 평균(9.2%)을 웃도는 경남 양산에서는 현대건설이 '힐스테이트 양산 더스카이'를 분양 중이다. 물금읍 일대 2개 단지, 총 598가구 규모로 조성되며... "
2026-07-15,네이버뉴스,"10대 건설사, 올 도시정비사업 수주액 30조 육박",https://www.chosun.com/economy/2026/07/15/Q7IGDUNDCFDARLU44WGB7EKCLU/?utm_source=naver&utm_medium=referral&utm_campaign=naver-news,"현대건설·GS건설, 7조원 클럽에 올 들어 국내 시공능력평가 상위 10대 건설사의 도시정비사업 누적 수주액이 30조원을 넘어선 것으로 나타났다. 현대건설이 지난해에 이어 수주액 1위 자리를 굳건히 지킨 가운데... "
2026-07-14,네이버뉴스,"현대건설, 美 SMR 기업과 협력 확대 … 차세대 원자로 '풀 라인업' 구축",http://www.worktoday.co.kr/news/articleView.html?idxno=86758,13일(현지 시간) 미국 뉴욕에서 열린 협약식에서 현대건설 NewEnergy사업부 최영 전무(오른쪽)와 FANCO 마이크 라인보스 CEO가 협약서에 서명 후 기념사진을 촬영하고 있다.(사진=현대건설) 현대건설이 글로벌 차세대... 
2026-07-14,네이버뉴스,"현대건설, FANCO와 'EAGL-1' 4세대 SMR 협약 체결…120만 가구 전력공급 ...",http://www.ttlnews.com/news/articleView.html?idxno=3125406,현대건설이 미국 차세대 소형모듈원자로 시장의 핵심 고리를 확보하며 글로벌 원전 생태계 점령에 속도를 낸다. 현대건설은 7월 13일 미국 뉴욕에 위치한 인터컨티넨탈 NY 타임스 스퀘어 호텔에서 미국 차세대 SMR... 
2026-07-14,네이버뉴스,"반복되는 누수에 잠긴 '지축역 현대프리미어캠퍼스'…입주민 ""보수 아닌...",http://www.newslock.co.kr/news/articleView.html?idxno=133008,현대건설이 시공한 경기 고양시 '지축역 현대프리미어캠퍼스'에서 장마철마다 누수 문제가 연례행사처럼 반복되고 있다. 이에 입주자들은 입주 초기와 현재 반복된 누수에 해당 건물에 대한 불안감이 커지고 있다.... 
2026-07-14,네이버뉴스,"청주 사모2구역 조합장, ""특정 브로커 세력의 조합 장악 음모 강력 반발...",http://www.newstown.co.kr/news/articleView.html?idxno=709152,"특히, 본래 시공사 소관이던 철거 업무를 조합이 직접 맡게 된 것 역시 시공사(현대건설 컨소시엄)의 공식적인 업무 인계 공문에 따른 정당한 행정 절차였다. 조합장은 ""법과 원칙에 따라 공정하게 진행된 사업을 '비위'로... "
2026-07-14,네이버뉴스,"""삼천포화력 SMR 전환 중단해야""",http://www.gnmaeil.com/news/articleView.html?idxno=590708,이어 한국남동발전이 지난달 19일 현대건설과 삼천포화력발전소 유휴부지를 활용한 SMR 전환 기술 개발 및 사업화를 위한 업무협약(MOU)을 체결한 것을 사실상 원전 도입 절차로 규정하며 우려를 나타냈다. 단체들은... 
2026-07-14,네이버뉴스,"[포토뉴스]현대건설, 미국 FANCO사와 'EAGL-1 프로젝트' 기본 협약 체결",https://news.bbsi.co.kr/news/articleView.html?idxno=4095087,박원식 기자 isis1964@naver.com
2026-07-14,네이버뉴스,대기업·건설사-스타트업 머리 맞댔다…용인오픈이노베이션 ‘스마트시...,https://www.viva100.com/article/20260714501217,"이번 교류회에는 현대건설, 대우건설, HL그룹, 호반그룹, 조광페인트 등 국내 대표 건설·화학 분야 대·중견기업 5개 사가 수요기업으로 참여했다. 이들 기업은 자사가 필요로 하는 구체적인 스마트시티 기술 분야와 협업... "
2026-07-14,네이버뉴스,"화성특례시, 중부권 광역급행철도 속도전 힘 보탠다…국회 토론회서 조...",https://www.siminilbo.co.kr/news/newsview.php?ncode=1160259591324136,2024년 현대건설이 국토교통부에 민간제안사업을 제안한 데 이어 2025년에는 국토교통부가 한국개발연구원(KDI)에 민자적격성조사를 의뢰하면서 사업 절차가 진행 중이다. 민자적격성조사는 2026년 하반기 마무리될... 
2026-07-14,네이버뉴스,"용인시산업진흥원, 2회차 오픈이노베이션 교류회 개최...기술 협업 기반...",https://www.siminilbo.co.kr/news/newsview.php?ncode=1160292618284443,"현대건설과 대우건설, HL그룹, 호반그룹, 조광페인트 등 수요기업들은 자사가 필요로 하는 기술 분야와 협업 과제를 소개하고, 스타트업들이 실제 협업 사례와 사업화 경험을 공유했다. 이어진 1대1 매칭 상담에서는 참여... "
2026-07-14,네이버뉴스,"'국민성장펀드 1호' 신안우이 해상풍력, 착공 앞두고 '삐걱'",https://www.namdonews.com/news/articleView.html?idxno=916981,총사업비 3조4천억원이 투입되며 ▲한화오션(26.3%) ▲중부발전(18.8%) ▲SK이터닉스(10%) ▲현대건설(4.8%) ▲미래에너지펀드(40%)가 시행사로 참여한다. 2019년 5월 발전사업 허가를 받은 뒤 송전설비 이용계약(2021년 11월)... 
2026-07-14,네이버뉴스,"현대건설, 미국 FANCO와 차세대 SMR 'EAGL-1' 협력",https://www.dailysportshankook.co.kr/news/articleView.html?idxno=431154,=현대건설은 13일(현지시간) 미국 뉴욕에서 미국 소형모듈원자로(SMR) 개발사 [퍼스트 아메리칸 뉴클리어(FANCO)](ca://s?q=FANCO_SM R_개발사)와 차세대 SMR 프로젝트 'EAGL-1' 협력을 위한 기본 협약을 체결했다고 14일 밝혔다.... 
2026-07-14,네이버뉴스,"[분양소식] ""불황에도 통하는 곳은 따로 있다""···7월 대형 건설사 '알...",https://www.smartbizn.com/news/articleView.html?idxno=148501,"부산에서는 두산건설의 '두산위브 트리니뷰 구명역', 경남 양산에서는 현대건설의 '힐스테이트 양산더스카이'가 공급된다. 하반기 분양시장 바로미터···""옥석 가리기 더 심해질 것"" 대형 건설사들의 7월 공급은... "
2026-07-14,네이버뉴스,"현대건설·롯데건설·GS건설, 원전 협력부터 안전 강화·분양까지",http://www.kdfnews.com/news/articleView.html?idxno=185175,13일(현지 시간) 미국 뉴욕에서 열린 협약식에서 현대건설 NewEnergy사업부 최영 전무(오른쪽)와 FANCO 마이크 라인보스 CEO가 협약서에 서명 후 기념사진을 촬영하고 있다. 사진=현대건설 제공 현대건설과 롯데건설... 
2026-07-14,네이버뉴스,"대한건설협회, 10대 건설사 임원 간담회 개최ⵈ ""현장 목소리로 위기 돌...",http://www.ikld.kr/news/articleView.html?idxno=337570,"이날 간담회에는 한승구 회장을 비롯해 삼성물산, 현대건설, 대우건설, 디엘이앤씨, 지에스건설, 현대엔지니어링, 포스코이앤씨, 롯데건설, 에스케이에코플랜트, 아이파크현대산업개발 등 10대 대형 건설사임원들이... "
2026-07-14,네이버뉴스,"현대건설, 美 FANCO와 납-비스무트 냉각 SMR 사업 협력",https://www.newspost.kr/news/articleView.html?idxno=224208,현대건설이 글로벌 원전 기업과의 차세대 원자로 협력망 구축에 속도를 낸다. 현대건설은 13일(현지 시간) 미국 뉴욕에 위치한 인터컨티넨탈 NY 타임스 스퀘어 호텔에서 미국 차세대 소형모듈원전(SMR) 개발사... 
2026-07-14,네이버뉴스,[건설소식] 롯데건설·GS건설·현대건설,https://sports.hankooki.com/news/articleView.html?idxno=6936449,13일(현지 시간) 미국 뉴욕에서 열린 협약식에서 최영 현대건설 NewEnergy사업부 전무(오른쪽)와 마이크 라인보스 FANCO CEO가 협약서에 서명 후 기념사진을 촬영하고 있다. ⓒ현대건설 현대건설은 13일(현지 시간)... 
2026-07-14,네이버뉴스,“시공 넘어 주거서비스까지”…현대건설 ‘디에이치’ 진화,https://www.sentv.co.kr/article/view/sentv202607130152,"현대건설이 도시정비사업 수주 시장에서 독주 체제를 굳히고 있습니다. 올해 수주 목표는 12조 원으로, 상반기에만 7조 6000억 원을 확보하며 목표의 60%를 넘어섰는데요. 하반기엔 하이엔드 브랜드 ‘디에이치’를... "
2026-07-14,네이버뉴스,[오늘의 건설 브리핑] 현대건설 SMR '풀라인업' 완성···LH는 광명시흥...,https://www.smartbizn.com/news/articleView.html?idxno=148574,특히 현대건설은 글로벌 원전 기업들과 협력망을 넓히며 차세대 소형모듈원자로(SMR) 시장 선점에 속도를 내고 있다. 한국토지주택공사(LH)는 수도권 핵심 주거 공급 사업인 광명시흥 3기 신도시 보상 절차를... 
2026-07-14,네이버뉴스,"정부, AI활용 'ESS 사업'···배터리 업계 '엇갈린 전략'",http://www.finomy.com/news/articleView.html?idxno=257277,낙찰자 명단에는 △VPP랩 △LG에너지솔루션 △한전KDN △SK이터닉스 △HD현대일렉트릭 △그리드위즈 △한국동서발전 △한국중부발전 △현대건설 등 총 9곳이 이름을 올렸다. 선정된 9개 사업자 중 삼성SDI 배터리셀을... 
2026-07-14,네이버뉴스,"[비즈&] 현대로템 K2 전차, 국내 첫 나토 인증 外",http://www.yonhapnewstv.co.kr/news/MYH20260714172807rck,"▶ 현대건설, 미 개발사와 차세대 SMR 협력 현대건설은 현지시간 13일, 미국 뉴욕에서 미국 소형모듈원자로 개발사와 차세대 SMR 프로젝트를 위한 기본협약을 체결했다고 밝혔습니다. 개발사 퍼스트아메리칸뉴클리어는... "
2026-07-14,네이버뉴스,"현대건설, 美 FANCO와 4세대 원자력 시스템 협약",http://www.wikileaks-kr.org/news/articleView.html?idxno=189760,현대건설이 차세대 원자로 협력망 구축에 속도를 내고 있다. 현대건설은 13일(현지 시간) 미국 차세대 소형모듈원전(SMR) 개발사인 퍼스트 아메리칸 뉴클리어(FANCO)와 함께 'EAGL-1 프로젝트' 협력을 위한 기본... 
2026-07-14,네이버뉴스,"현대건설, 美 FANCO와 차세대 소형모듈원자로 협력 기본협약",http://www.koreastocknews.com/news/articleView.html?idxno=119794,"현대건설(000720, 대표 이한우)은 13일(현지시간) 미국 뉴욕에서 미국 소형모듈원자로(SMR) 개발사 '퍼스트 아메리칸 뉴클리어'(FANCO)와 차세대 SMR 프로젝트 'EAGL-1' 협력을 위한 기본 협약을 체결했다고 14일 밝혔다.... "
2026-07-14,네이버뉴스,"[건설업계 소식] IPARK현대산업개발, 성남 태평3구역 재개발 수주 外",https://www.sisaweek.com/news/articleView.html?idxno=236689,"◇ 현대건설, 美 SMR 기업과 손잡고 4세대 원전 협력 확대 현대건설은 13일(현지시간) 미국 소형모듈원전(SMR) 개발사 퍼스트 아메리칸 뉴클리어(FANCO)와 'EAGL-1 프로젝트' 협력을 위한 기본협약을 체결했다고 밝혔다.... "
2026-07-14,네이버뉴스,경쟁 사라진 여의도 재건축 시장…삼성·현대 등 '수의계약' 전망 왜?,https://www.fntimes.com/html/view.php?ud=202607141659142626048b718333_18,"◇ 광장은 현대건설, 목화는 삼성물산…단독 입찰 잇따라 14일 정비업계에 따르면 서울 영등포구 여의도 광장아파트 38-1구역 재건축 조합이 지난달 29일 개최한 두 번째 시공사 선정 현장설명회에는 현대건설(대표이사... "
2026-07-14,네이버뉴스,"GS·포스코이앤씨, 인천 부평·부산 남구 분양…도심 주거 단지 구축",https://www.news2day.co.kr/article/20260714500241,GS건설·현대건설·코오롱글로벌 컨소시엄은 오는 8월 인천광역시 부평구 산곡동 10번지 일원에 산곡6 주택재개발정비사업을 통해 들어서는 '산곡역자이힐스테이트&하늘채'를 분양할 예정이다. 지하 3층~지상 최고 33층... 
2026-07-14,네이버뉴스,수면부족·불면증 치유 국내 '2026 국제수면치유박람회' 코엑스서 개최,https://www.gosiweek.com/article/1065600827899714,"현장에는 현대건설, 대원제약(꿀잠샷), 바리오웰, 베스트슬립, 슬립사이클, 알고케어 등 힐링과 숙면을 선도하는 국내외 대표 브랜드들이 대거 참여한다. 특히 주요 콘텐츠인 '브랜드 체험존'에서는 혁신적인 스마트... "
2026-07-14,네이버뉴스,"2026 국제수면치유박람회, 코엑스서 개최",https://www.ksilbo.co.kr/news/articleView.html?idxno=1062105,"행사장의 주요 콘텐츠인 '브랜드 체험존'에서는 현대건설, 대원제약, 베스트슬립, 바리오웰 등 수면과 웰니스 산업을 선도하는 국내외 주요 브랜드들이 대거 참여해 신제품 런칭과 특별 할인 이벤트를 진행한다. 특히... "
2026-07-14,네이버뉴스,"현대건설, 미국 원전 개발사와 SMR 프로젝트 공동 검토",https://www.polinews.co.kr/news/articleView.html?idxno=736956,현대건설이 미국 소형모듈원자로(SMR) 개발사와 차세대 원전 사업 협력에 나선다. 미국 원전 프로젝트 초기 단계부터 참여 기반을 확보하기 위한 행보다. 현대건설은 미국 뉴욕에서 퍼스트 아메리칸 뉴클리어(FANCO)와... 
2026-07-14,네이버뉴스,"대한건설협회, 10대 건설사와 간담회 ""위기의 목소리 전달""",https://www.newsis.com/view/NISX20260714_0003709156,"이날 간담회에는 한승구 회장을 비롯해 삼성물산, 현대건설, 대우건설, 디엘이앤씨, 지에스건설, 현대엔지니어링, 포스코이앤씨, 롯데건설, SK에코플랜트, IPARK현대산업개발 등 10대 대형 건설사 임원들이 참석했다.... "
2026-07-14,네이버뉴스,"힐스테이트 회룡역파크뷰, ‘계약금 정액제’ 실수요자 부담 낮췄다",https://www.sentv.co.kr/article/view/sentv202607140177,"현대건설이 의정부 호원동에서 처음 선보이는 힐스테이트 브랜드 아파트로, 층간소음 저감기술 'H 사일런트 홈 시스템 Ⅰ'과 가구당 1.3대 이상의 주차공간이 특징이다. 현재 선착순 계약을 진행 중이며 만 19세... "
2026-07-14,네이버뉴스,"현대건설, 글로벌 SMR 협력망 확대…미국서 협약 맺고 원전시장 공략",http://www.whitepaper.co.kr/news/articleView.html?idxno=264584,"화이트페이퍼, WHITEPAPER현대건설-FANCO, 차세대 SMR 프로젝트 협력 기본협약. (사진=현대건설)  현대건설이 미국 차세대 소형모듈원전(SMR) 개발사와 협력하며 4세대 원전 시장 공략에 나섰다. 현지에서 원전 사업... "
2026-07-14,네이버뉴스,"함양울산道 지선 1·3공구, 대진표 윤곽… 각각 19·21개사 도전",https://news.mtn.co.kr/news-detail/2026071416453283348,1공구 PQ 통과사는 (가나다순) ▲계룡건설산업 ▲남광토건 ▲두산건설 ▲DL이앤씨 ▲삼환기업 ▲IPARK현대산업개발 ▲HJ중공업 ▲KCC건설 ▲태영건설 ▲현대건설 등이다. 3공구 참여사는 ▲경남기업 ▲극동건설... 
2026-07-14,네이버뉴스,불황에도 지방 분양시장 '똘똘한 한 채'로 쏠린다…입지·브랜드가 승부...,http://www.newsroad.co.kr/news/articleView.html?idxno=61576,"현대건설은 경남 양산시에 '힐스테이트 양산더스카이'를 분양 중이다. 1·2단지 각 299가구, 총 598가구 규모로, 약 88%가 전용 84㎡로 구성됐다. 1차 계약금 500만 원 정액제에 중도금 무이자 혜택을 제공한다. 현대건설이... "
2026-07-14,네이버뉴스,"용인시산업진흥원, 스마트시티 오픈이노베이션 교류회 개최",https://www.kmaeil.com/news/articleView.html?idxno=645335,"현대건설과 대우건설, HL그룹, 호반그룹, 조광페인트 등 5개 대·중견기업이 수요기업으로 참여해 기술 수요와 협업 과제를 제시했다. 이어 스타트업인 지오그리드와 세상을 바꾸는 사람들이 연사로 참여해 대기업과의... "
2026-07-14,네이버뉴스,하도급대금 지연 지급 1389억원···이랜드·대방건설 비율 높아,https://www.seoulfn.com/news/articleView.html?idxno=633362,"삼성물산, 현대건설, 포스코이앤씨, 롯데건설, HDC현대산업개발, HDC아이파크, 호반건설 등 7곳은 현금 결제 비율이 100%였다. 하도급 분쟁조정기구도 상위 10개 건설사 모두 설치한 것으로 나타났다. 공정위는... "
2026-07-14,네이버뉴스,"“우리도 하이엔드 달아줘”…정비사업 수주전, 건설사 브랜드 원칙 흔...",https://www.viva100.com/article/20260714501065,"현대건설의 ‘디에이치’, DL이앤씨의 ‘아크로’, 롯데건설의 ‘르엘', 포스코이앤씨의 ‘오티에르’, SK에코플랜트의 ‘드파인’, 대우건설의 ‘써밋’ 등이 대표적이다. 그러나 최근에는 단순히 하이엔드 브랜드를... "
2026-07-14,네이버뉴스,"대한건설협회, 10대 건설사 임원 초청 ‘건설산업 위기 극복’ 간담회 ...",https://www.viva100.com/article/20260714501104,"간담회에는 한승구 회장을 비롯해 삼성물산, 현대건설, 대우건설, 디엘이앤씨, 지에스건설, 현대엔지니어링, 포스코이앤씨, 롯데건설, 에스케이에코플랜트, IPARK현대산업개발 등 10대 대형 건설사 임원들이 참석했다.... "
2026-07-14,네이버뉴스,지난해 하반기 법정기한 넘겨 지급된 하도급대금 1389억원,https://www.sisajournal.com/news/articleView.html?idxno=379841,"삼성물산, 현대건설, 포스코이앤씨, 롯데건설, 아이파크, 현대산업개발, 호반건설 등 7개사는 100% 현금 결제했다. 하도급 분쟁 해결기구는 상위 10개사에 모두 설치됐다. 공정위는 이번 점검으로 하도급대금... "
2026-07-14,네이버뉴스,[코스피 지수선물 옵션] IT·금융·방산 선물 일제히 하락... 하반기 변동...,https://www.pinpointnews.co.kr/news/articleView.html?idxno=468389,"건설 분야의 현대건설 F(202608)와 대우건설 F(202608) 역시 부동산 경기 둔화 우려 등으로 하락세를 보였다. 정보기술 서비스의 삼성SDS F(202608)는 소폭 상승 마감했으며, LG씨엔에스 F(202608)는 하락을... "
2026-07-14,네이버뉴스,"""출혈경쟁은 옛말""…여의도·목동·성수 재건축, 대형사 '안방' 굳어진다",https://www.ajunews.com/view/20260714162244780,"14일 정비업계에 따르면 최근 여의도 광장아파트38-1 재건축(현대건설), 목화아파트 재건축(삼성물산), 목동6단지 재건축(DL이앤씨), 성수3지구 재개발(삼성물산) 등 주요 사업장에서 단독 응찰에 따른 유찰이 잇따랐다.... "
2026-07-14,네이버뉴스,"현대건설, 美 FANCO와 차세대 SMR 협력… 4세대 원전 라인업 확대",https://www.s-journal.co.kr/news/articleView.html?idxno=42395,"현대건설이 미국 차세대 소형모듈원전(SMR) 개발사와 손잡고 4세대 원전 포트폴리오 확대에 나선다. 경수로형 SMR과 소듐냉각고속로, 용융염원자로에 이어 납-비스무트 냉각 고속로까지 협력 범위를 넓히며 글로벌... "
2026-07-14,네이버뉴스,"현대건설, 4세대 SMR '풀라인업'..美 EAGL-1 초기설계 참여",http://www.4th.kr/news/articleView.html?idxno=2114747,"포쓰저널 이현민 기자 현대건설 NewEnergy사업부 최영 전무(오른쪽), FANCO 마이크 라인보스 CEO가 2026년 7월 13일(현지시간) 미국 뉴욕에서 열린 협약식에서 기념사진을 찍고 있다. / 사진=현대건설 현대건설이 미국... "
2026-07-14,네이버뉴스,"대한건설협회, 10대 건설사 임원 간담회 개최",https://www.dnews.co.kr/uhtml/view.jsp?idxno=202607141028412200060,"이날 간담회에는 한승구 회장을 비롯해 삼성물산, 현대건설, 대우건설, 디엘이앤씨, 지에스건설, 현대엔지니어링, 포스코이앤씨, 롯데건설, 에스케이에코플랜트, 아이파크현대산업개발 등 10대 대형 건설사 임원들이... "
