date,source,title,link,description
2026-04-06,네이버뉴스,"대우건설 올해 도시정비 수주 2조 돌파, 기흥1구역 성산모아타운3구역 ...",https://www.businesspost.co.kr/BP?command=article_view&num=435064,대우건설> 대우건설이 국내 건설사 가운데 처음으로 올해 도시정비 수주실적 2조 원을 돌파했다. 대우건설은 지난 4일 경기도 용인 기흥1구역과 서울 마포구 성산 모아타운3구역의 시공사 선정총회를 통해 시공사로... 
2026-04-06,네이버뉴스,[서울데이터랩]마감 직후 인기 검색 종목 20選,https://www.seoul.co.kr/news/economy/securities/2026/04/06/20260406500164?wlog_tag3=naver,"10위 대우건설(047040)은 2.97% 상승했다. 이 밖에도 SK이터닉스(475150) ▼9.09%, 페니트리움바이오(187660) ▲8.78%, 로킷헬스케어(376900) ▼25.99%, 펄어비스(263750) ▼4.75%, LIG넥스원(079550) ▼5.81... "
2026-04-06,네이버뉴스,"종속회사 13곳·5년 사이 '최대' 대우건설…김보현 체제 사업 확장 ""속도...",https://www.asiatoday.co.kr/view.php?key=20260406010001583,지난해 9곳서 13곳으로…1년 새 외연 확대 베트남·에너지·리츠 등 신사업 동시 편입 개발·운영 아우르는 ‘디벨로퍼 전환’ 본격화 대우건설이 매출 및 수주 반등을 겨냥한 사업 구조 재편에 속도를 내고 있다. 지난해... 
2026-04-07,네이버뉴스,'1Q 영업익 57.2조' 삼성전자 프리마켓 4% 급등…SK하닉도 3%↑,https://www.news1.kr/finance/general-stock/6127451,"삼성전자와 마찬가지로 역대급 실적이 예상되는 SK하이닉스도 전일 대비 2만 8000원(3.16%) 오른 91만 4000원에 거래되고 있다. 이외 풍산홀딩스(17.25%), 삼성E&A(8.21%), GS건설(5.71%) 등이 높은 상승률을 기록하고 있다."
2026-04-07,네이버뉴스,수요 몰리는 '원스톱 생활권'...서초·동작 등서 신규 공급 예고,https://www.bizwork.co.kr/news/articleView.html?idxno=414226,"GS건설·SK에코플랜트는 4월 서울시 동작구 노량진동 일원에서 '라클라체자이드파인'을 분양할 예정이다. 단지는 지하 4층~지상 28층, 14개 동, 총 1499가구 규모로 조성된다. 이 중 전용면적 59~106㎡ 369가구를 일반에... "
2026-04-07,네이버뉴스,"'역대급 분양가' 검단호수공원역 파라곤, 특별공급서 5 대 1",https://www.straightnews.co.kr/news/articleView.html?idxno=299531,사진은 GS건설과 하자문제로 소송을 제기 중인 '서초 그랑자이'에서 촬영했다.  [사진 이준혁 기자] 인천 서구청의 승인 분양가는 6년 전보다 53% 상승한 것으로 서울 서초구에서 같은 기간 동안 40% 올린 '아크로 드... 
2026-04-07,네이버뉴스,부산 수영강변지하차도 또 지반침하…이틀째 잇단 도로 침하,https://www.cbci.co.kr/news/articleView.html?idxno=565881,"시와 만덕∼센텀 대심도 공사 시공사인 GS건설 관계자들이 현장에 출동해 규모를 조사 중이다. 부산시 관계자는 ""침하 규모는 경미한 수준으로 현재까지 교통 통제는 하지 않고 있다""고 밝혔다. 앞서 전날에는... "
2026-04-07,네이버뉴스,'또 지반침하'..부산 수영강변지하차도 인근 재발,https://news.sbs.co.kr/news/endPage.do?news_id=N1008507731&plink=ORI&cooper=NAVER,"부산시와 만덕∼센텀 대심도 공사 시공사인 GS건설 관계자들은 현장에 출동해 침하 규모를 조사하고 있습니다. 부산시 관계자는 ""침하 규모가 가벼운 수준이어서 현재까지 교통 통제는 이뤄지지 않고 있다""라고... "
2026-04-07,네이버뉴스,"[Biz & Now] GS건설·LG전자, 미래형 주거로봇 협력",https://www.joongang.co.kr/article/25418006,GS건설은 LG전자 HS로보틱스연구소와 ‘미래형 주거로봇 서비스 모델 구축’을 위한 업무협약을 맺었다고 6일 밝혔다. GS건설의 주거 브랜드 ‘자이’와 LG전자의 인공지능(AI) 홈 로봇을 결합한 미래형 주거 서비스... 
2026-04-06,네이버뉴스,"GS건설 자이, AI 기반 분양 마케팅 강화…""고객 경험 중심 전환""",https://www.gpkorea.com/news/articleView.html?idxno=141560,"GS건설이 인공지능(AI)과 디지털 콘텐츠를 활용한 분양 마케팅을 확대하며 고객 경험 중심 전략을 강화하고 있다. 자이 브랜드를 앞세운 이번 시도는 기존의 단순 정보 전달형 홍보에서 벗어나, 입주 이후의 생활을 간접... "
2026-04-06,네이버뉴스,"GS건설·LG전자, 자이에 AI 홈로봇 도입…미래형 주거 서비스 본격화",http://www.biztribune.co.kr/news/articleView.html?idxno=351882,"GS건설 자이(Xi) BI | GS건설 GS건설은 LG전자 HS로보틱스연구소와 '미래형 주거 로봇 서비스 모델 구축'을 위한 업무협약(MOU)을 체결하고, 자이(Xi) 아파트에 'AI 홈 로봇' 기술이 적용하기 위한 미래형 주거 서비스 구축에... "
2026-04-06,네이버뉴스,"GS건설, LG전자와 손잡고 ‘로봇 친화형’ 주거 서비스 구축",https://www.betanews.net/article/view/beta202604060094,GS건설은 최근 분양을 진행 중인 '창원자이 더 스카이'와 '아산탕정자이 메트로시티'에 인공지능(AI) 기술을 활용한 홍보영상을 선보였다고 6일 밝혔다. 기존 분양 홍보영상은 제3자의 입장에서 세대 내부를 단순히... 
2026-04-06,네이버뉴스,부산 만덕~센텀 고속화도로 또 ‘지반침하’,https://www.khan.co.kr/article/202604062040005,부산시와 만덕~센텀 대심도 공사 시공사인 GS건설 관계자들은 현장에서 침하 규모를 조사하고 있다. 시는 이번 지반 침하가 지하 터널 공사 후 흙을 다시 메우는 과정에서 발생한 부실에 원인이 있는 것으로 추정하고... 
2026-04-06,네이버뉴스,"[사설] 대심도 구간 도로 지반 침하, 안전대책 내놓아야",http://www.kookje.co.kr/news2011/asp/newsbody.asp?code=1700&key=20260407.22019001691,"시는 되메우기 시공사인 GS건설에 구상권 청구를 검토하는 한편 만덕~센텀 대심도의 동래·해운대·만덕 IC 일대에 GPR(지표투과레이다) 탐사를 계속하고 모니터링을 실시, 사고 재발을 방지하겠다고 밝혔다. 하지만 GPR... "
2026-04-06,네이버뉴스,지하차도 입구 또 침하…市 “시공사에 구상권 검토”,http://www.kookje.co.kr/news2011/asp/newsbody.asp?code=0300&key=20260407.22001001646,시와 대심도 시공사인 GS건설 관계자는 현장에 출동해 침하 규모를 조사하고 있다. 침하 규모가 경미한 수준이어서 현재까지 교통 통제는 이뤄지지 않고 있다. 최초 침하 징후는 지난 4일 오후 2시께 이미 포착됐다.... 
2026-04-06,네이버뉴스,"GS건설, LG전자와 맞손···'AI 홈 로봇' 도입",http://www.enewstoday.co.kr/news/articleView.html?idxno=2415611,"GS건설은 LG전자 HS로보틱스연구소와 '미래형 주거 로봇 서비스 모델 구축'을 위한 업무협약(MOU)을 체결하고, 자이(Xi) 아파트에 'AI 홈 로봇' 기술을 적용하기 위한 본격적인 행보에 나선다고 6일 밝혔다. 이번 협약을... "
2026-04-06,네이버뉴스,부산 대심도 공사 구간 '지반침하' … GS건설 되메우기 부실 논란,https://www.safetimes.co.kr/news/articleView.html?idxno=241591,부산시는 사고 원인으로 '만덕~센텀 대심도' 공사 이후의 부실한 되메우기 작업을 지목하고 시공사인 GS건설 관계자들과 정밀 점검에 착수했다. 6일 부산시에 따르면 이날 오후 4시 15분쯤 해운대구 수영강변지하차도... 
2026-04-06,네이버뉴스,[영상] ‘대심도’ 또 지반 침하,https://www.busan.com/view/busan/view.php?code=2026040618413539801,대심도 시공사인 GS건설 측은 침하 범위와 원인을 확인하고 있다. 시는 침하 규모가 크지 않아 오후 6시 30분 현재 차량 통제는 하지 않았다고 밝혔다. 앞서 지난 5일에는 대심도와 인접한 내성지하차도 일대 4곳과... 
2026-04-06,네이버뉴스,"GS건설, LG전자와 맞손...자이 아파트에 AI 로봇 기술 도입",https://weekly.hankooki.com/news/articleView.html?idxno=7158620,사진=GS건설  GS건설은 LG전자 HS로보틱스연구소와 업무협약을 체결하고 자이(Xi) 아파트에 AI 홈 로봇 기술 적용을 본격화한다고 6일 밝혔다. 양사는 아파트 설계 단계부터 로봇 운영을 고려한 설계안을 마련한다는... 
2026-04-06,네이버뉴스,"부산 수영강변지하차도 이틀 연속 지반침하…""규모 경미, 곧 부분 포장...",https://www.news1.kr/local/busan-gyeongnam/6127234,"현장에 출동한 부산시와 만덕~센텀 대심도 공사 시공사인 GS건설 관계자들의 조사 결과, 다행히 침하 상태는 심하지 않은 것으로 파악됐다. 시는 침하 규모가 경미해 현재 별도의 교통 통제는 실시하지 않고 있으며, 이날... "
2026-04-06,네이버뉴스,"GS건설, ‘이니마 찬스’ 올해 끝…모듈러 3사 시험대",https://www.sentv.co.kr/article/view/sentv202604060150,"서울경제티브이 김도하 기자 GS건설이 캐시카우 역할을 해온 GS이니마 매각을 내년 마무리할 예정입니다. 1조7000억원의 현금을 확보해 재무구조는 개선하게 되지만, 내년부터 닥칠 매출 공백을 어떻게 메울지가... "
2026-04-06,네이버뉴스,[속보] ‘또 지반침하'…부산 수영강변지하차도 인근 재발,http://www.kookje.co.kr/news2011/asp/newsbody.asp?code=0300&key=20260406.99099001637,부산시와 만덕~센텀 대심도 공사 시공사인 GS건설 관계자들은 현장에 출동해 침하 규모를 조사하고 있다. 부산시는 “침하 규모가 경미한 수준이어서 현재까지 교통 통제는 이뤄지지 않고 있다”고 밝혔다. 전날... 
2026-04-06,네이버뉴스,반포·용산 넘은 흑석·노량진···비강남 국평 '30억원' 눈앞,https://www.sisajournal-e.com/news/articleView.html?idxno=420303,"6구역은 GS건설·SK에코플랜트 컨소시엄이 시공을 맡아 지상 27층, 24개 동, 1499가구 규모로 조성된다. 노량진뉴타운 내 첫 분양 단지로 향후 후속 구역 분양가의 기준점 역할을 할 것으로 평가된다. 노량진뉴타운은... "
2026-04-06,네이버뉴스,"""입주 이후의 삶 AI로 미리 둘러봐요""",https://www.hankyung.com/article/2026040622851,최근 GS건설이 유튜브에 공개한 충남 아산 ‘아산탕정자이 메트로시티’ 홍보 영상이다. 2029년 입주 예정인 단지에서의 삶이 눈 앞에 펼쳐진다. 영상 한쪽에 이런 문구가 적혀 있다. “본 장면은 생성형 인공지능(AI)을... 
2026-04-06,네이버뉴스,"[건설업계 브리핑] GS건설, 한미글로벌, HUG, 코람코 등",https://daily.hankooki.com/news/articleView.html?idxno=1355379,"사진=챗GPT 생성 이미지 ◇ GS건설, LG전자와 'AI 로봇 주거 서비스' 협력 GS건설 이상의 도시정비사업실장(왼쪽), 이용구 주택설계부문장 (오른쪽), LG전자 이재욱 HS로보틱스연구소장(가운데)이 기념사진을 촬영하고 있다.... "
2026-04-06,네이버뉴스,"GS건설, LG전자와 ‘로봇 아파트’ 공동 개발…자이 단지에 AI 서비스 도...",https://www.fetv.co.kr/news/article.html?no=216444,"로봇 동선·엘리베이터 연동 등 ‘로봇 친화 설계’ 표준화 추진 성수 재개발 시작으로 적용 확대, 단지 내 배송·생활서비스 구현  GS건설이 LG전자와 손잡고 아파트에 인공지능(AI) 기반 로봇 서비스를 도입한다. 설계... "
2026-04-06,네이버뉴스,"GS건설, LG 로보틱스와 미래 주거 실험",http://www.whitepaper.co.kr/news/articleView.html?idxno=260624,"사진은 이상의 GS건설 도시정비사업실장(왼쪽), 이용구 GS건설 주택설계부문장 (오른쪽), 이재욱 LG전자 HS로보틱스연구소장이 기념촬영하는 모습.(사진=GS건설)  GS건설이 LG전자와 손잡고 자이(Xi) 아파트에 AI 홈 로봇... "
2026-04-06,네이버뉴스,"AI가 그린 '자이' 주민의 삶…""실제보다 더 현실감""",https://news.bizwatch.co.kr/article/real_estate/2026/04/06/0011,GS건설이 추진 중인 AI와 디지털 콘텐츠를 결합한 분양 마케팅 전략이다. GS건설은 최근 분양을 진행 중인 '창원자이 더 스카이'와 '아산탕정자이 메트로시티'에 생성형 AI 기술을 활용한 판촉 영상을 선보였다고 6일... 
2026-04-06,네이버뉴스,"[기업] GS건설, LG전자와 미래형 주거 로봇 서비스 협력",https://www.ytn.co.kr/_ln/0102_202604061643202051,"GS건설이 자이 아파트에 AI 홈 로봇 기술을 적용하기 위해 LG 전자와 업무 협약을 맺었습니다. 두 회사는 로봇의 주거 공간 내 동선 확보, 전용 엘리베이터 연동 등 기준을 마련해 아파트 설계 단계부터 반영할... "
2026-04-06,네이버뉴스,"GS건설, LG전자와 'AI 홈 로봇' 주거 서비스 도입",https://www.ziksir.com/news/articleView.html?idxno=129868,"[GS건설]  GS건설이 LG전자와 손잡고 인공지능(AI) 기반 주거 로봇 서비스를 도입한다. GS건설은 LG전자 HS로보틱스연구소와 '미래형 주거 로봇 서비스 모델 구축'을 위한 업무협약(MOU)을 체결하고, 자이(Xi) 아파트에 AI 홈... "
2026-04-06,네이버뉴스,"GS건설, 생성형 AI 기술 활용 홍보영상 선보여",https://biz.heraldcorp.com/article/10711046?ref=naver,[GS건설 제공] [헤럴드경제=신혜원 기자] GS건설이 인공지능(AI)과 디지털 콘텐츠를 결합한 분양 마케팅 전략을 통해 ‘고객 경험’ 중심의 브랜드 혁신을 강화하고 있다. GS건설은 최근 분양을 진행 중인 ‘창원자이 더... 
2026-04-06,네이버뉴스,"GS건설-LG전자, 미래형 주거 로봇 서비스 모델 구축 맞손",http://www.smarttimes.co.kr/news/articleView.html?idxno=44503,GS건설은 LG전자 HS로보틱스연구소와 '미래형 주거 로봇 서비스 모델 구축'을 위한 업무협약(MOU)을 체결했다고 6일 밝혔다. 이번 협약을 통해 양사는 GS건설의 주거 브랜드 자이(Xi)와 LG전자의 AI 홈 로봇을 결합한 미래형... 
2026-04-06,네이버뉴스,"LG전자·GS건설, 클로이드 결합 미래형 주거 서비스 모델 구축 MOU 체결",https://www.econovill.com/news/articleView.html?idxno=736226,GS건설이 LG전자 HS로보틱스연구소와 '미래형 주거 로봇 서비스 모델 구축'을 위한 업무협약(MOU)을 체결했다고 6일 밝혔다. 협약에 따라 양사는 LG전자의 AI 홈 로봇과  GS건설 아파트 브랜드 '자이'를 결합한 미래형 주거... 
2026-04-06,네이버뉴스,"""미리 해보는 입주 경험""⋯GS건설, AI 결합 분양 마케팅",http://www.inews24.com/view/1957431,GS건설이 생성형 AI 기술을 활용해 미리 입주를 경험해보는 분양 마케팅 전략을 선보였다. GS건설은 최근 분양을 진행 중인 ‘창원자이 더 스카이’와 ‘아산탕정자이 메트로시티’에 생성형 AI 기술을 활용한 홍보영상을... 
2026-04-06,네이버뉴스,GS건설-LG전자 'AI 로봇 친화 아파트' 만든다,https://www.newscj.com/news/articleView.html?idxno=3391680,GS건설이 LG전자와 협력해 인공지능(AI) 로봇 기술을 활용한 차세대 주거 서비스 구축에 나선다. GS건설은 LG전자 HS로보틱스연구소와 '미래형 주거 로봇 서비스 모델 구축'을 위한 업무협약(MOU)을 체결했다고 6일 밝혔다.... 
2026-04-07,네이버뉴스,"[단독] 국세청, 롯데건설 이어 시행사도…'북항 사업' 부산오션파크 특...",http://www.fieldnews.kr/news/articleView.html?idxno=27783,"국세청이 롯데건설을 상대로 특별(비정기)세무조사를 진행하고 있는 가운데, 해당 법인 외 부산항 북항 재개발 사업의 시행사인 부산오션파크에 대해서도 강도 높은 조사를 벌이고 있는 것으로 확인됐다. 이는 양사 간... "
2026-04-07,네이버뉴스,"영업익은 ""2천억"", 이자는 ""4천억""…호텔롯데, 6.8조 차입금·계열사 지...",https://www.youthdaily.co.kr/news/article.html?no=216896,"지난해 이자비용 4천억 등 영업외비용에 당기순손실 기록 총차입금 6조8천억에 유동비율 46%…영구채 등으로 차환 롯데바이오로직스·롯데건설 등 계열사에 자금 지원 부담도 시장은 ""토지 등 보유 자산 활용 자금... "
2026-04-07,네이버뉴스,"[CEO워치] 오일근 롯데건설 대표, 그룹사 부지 개발에 적극 참여…일감...",https://www.ceoscoredaily.com/page/view/2026040614413769206,오일근 롯데건설 대표이사가 그룹사와 연계한 개발사업을 통한 일감 확보에 집중하고 있다. 롯데그룹이 계열사 유휴부지를 활용한 부동산 개발 사업을 본격적으로 추진키로 함에 따라 오일근 대표의 역할에 따라... 
2026-04-07,네이버뉴스,롯데건설이 완공한 창동민자역사...서울 동북권 복합 랜드마크로 거듭,https://www.dnews.co.kr/uhtml/view.jsp?idxno=202604061747361350173,롯데건설이 완공한 창동민자역사(조감도)가 쇼핑ㆍ문화 등으로 구성된 서울 동북권 복합 랜드마크로 거듭난다. 6일 관련업계에 따르면 창동민자역사 사업은 2004년 착공했지만 시행사의 경영상 문제 등으로 2010년... 
2026-04-07,네이버뉴스,‘회장님’은 왜 의장직을 내려놓지 않나 [30대 그룹 이사회 대해부②],https://www.kukinews.com/article/view/kuk202604060212,"고정욱 롯데지주 대표는 지난 1992년 롯데건설에 입사, 그룹 경영관리본부를 거쳐 롯데캐피탈 대표를 지낸 ‘재무통’이다. 한화의 이사회 의장은 김우석 한화 대표가, 현대지에프홀딩스의 이사회 의장은 장호진... "
2026-04-07,네이버뉴스,60년 만에 뚫리는 제4경인…서울-인천 25분 단축,https://www.sedaily.com/article/20029086?ref=naver,"지난해 7월 롯데건설이 민간투자사업으로 제안한 뒤 10개월 만에 타당성을 확보했다. 인천시는 향후 전략환경영향평가, 제3자 제안공고, 실시협약 체결 등 후속 절차를 추진한다. 유정복 시장은 “원도심... "
2026-04-07,네이버뉴스,[목멱칼럼]한일 '50억 시니어타운'의 차이점,http://www.edaily.co.kr/news/newspath.asp?newsid=01597366645413824,"HDC현대산업개발의 파크로쉬 서울원, 롯데건설이 서울 마곡에 공급하는 VL르웨스트까지, 대형 건설·금융사가 잇따라 프리미엄 시니어 주거 시장에 뛰어들고 있다. 한국 시니어 주거 시장에 고급화 바람이 다시 불고... "
2026-04-07,네이버뉴스,"""인천항~강남 25분 단축"" 인천시, 제4경인고속화도로 2030년 착공 목표 ...",https://www.cstimes.com/news/articleView.html?idxno=701044,"앞서 이 사업은 2024년 7월 롯데건설이 민간투자사업으로 제안하며 가시화됐다. 인천시는 관계기관 협의를 거쳐 비용 대비 편익(B/C) 분석, 사업타당성(AHP) 검토, 민간투자방식 적합성(VfM) 여부 등을 판단하는... "
2026-04-07,네이버뉴스,"롯데건설 ""창동민자역사 준공""",https://www.webeconomy.co.kr/news/articleView.html?idxno=2131798,"롯데건설이 서울 도봉구 창동역 상부에 위치한 창동민자역사 공사를 지난달 30일 완료했다고 6일 밝혔다. 2004년 착공 후 시행사 경영난으로 2010년 공사가 중단돼 10년 넘게 방치됐던 사업으로, 롯데건설이 2022년... "
2026-04-06,네이버뉴스,"유정복 인천시장 ""제4경인고속화도로 추진 본격화""…민자적격성 통과",https://www.newsfreezone.co.kr/news/articleView.html?idxno=683763,"해당 사업은 2024년 7월 롯데건설이 민간투자 방식으로 제안하면서 시작됐으며, 인천시는 관계기관 협의를 거쳐 같은 해 10월 한국개발연구원(KDI)에 민자적격성조사를 의뢰했다. 민자적격성조사는 비용 대비 편익... "
2026-04-06,네이버뉴스,"롯데건설, 창동민자역사 준공 ....서울 동북권 재도약 신호탄",http://www.worktoday.co.kr/news/articleView.html?idxno=83474,"창동민자역사 외부 전경(사진-롯데건설 제공) 롯데건설이 20년 만에 창동민자역사 공사를 마무리했다. 이에 따라 창동민자역사는 쇼핑, 문화 등으로 구성된 서울 동북권 대형 복합시설로 거듭난다. 롯데건설은 지난달... "
2026-04-06,네이버뉴스,"인천시, '인천 제4경인고속화도로 사업' 순항",https://www.cnbnews.com/news/article.html?no=787846,"해당 사업은 지난 2024년 7월 롯데건설에서 민간투자사업으로 제안하여 시작됐으며, 인천시는 관계기관 협의를 거쳐 같은 해 10월 한국개발연구원에 민자적격성조사를 의뢰했다. 민자적격성조사는 비용 대비 편익(B/C)... "
2026-04-06,네이버뉴스,"롯데건설, 15년 멈췄던 창동민자역사 완공…동북권 복합 랜드마크로 재...",http://www.biztribune.co.kr/news/articleView.html?idxno=351889,"창동민자역사 외부 전경 | 롯데건설 롯데건설이 지난달 30일 공사를 마친 창동민자역사가 쇼핑, 문화 등으로 구성된 서울 동북권 대형 복합시설로 거듭난다. 이 사업은 2004년 착공했지만 시행사의 경영상 문제 등으로... "
2026-04-06,네이버뉴스,"롯데건설, 40만 유동인구 품은 창동민자역사 준공",https://www.betanews.net/article/view/beta202604060093,롯데건설이 지난달 30일 서울 도봉구 창동민자역사 건설 공사를 마치고 본격적인 운영 준비에 돌입한다. 이사업은 2004년 착공한 후 시행사의 경영난으로 지난 2010년 공사가 중단된 후 10년 넘게 방치됐다. 이후 2021년... 
2026-04-06,네이버뉴스,"유정복, 제4경인고속화도로 ‘순항’…동서축 교통혁신 신호탄",https://www.ekn.kr/web/view.php?key=20260406021484721,"이번 사업은 2024년 7월 롯데건설이 민간투자 방식으로 제안하면서 시작됐으며 이후 시는 관계기관 협의를 거쳐 같은 해 10월 민자적격성조사를 의뢰했고 비용 대비 편익(B/C) 분석과 정책적 타당성(AHP), 민간투자방식... "
2026-04-06,네이버뉴스,"롯데건설, 창동민자역사 준공···서울 동북권 복합문화 '랜드마크' 탈...",http://www.enewstoday.co.kr/news/articleView.html?idxno=2415606,"롯데건설은 지난달 30일 서울 도봉구의 숙원사업이었던 창동민자역사 공사를 마무리하며, 해당 시설이 서울 동북권의 대형 복합시설로 탈바꿈한다고 6일 밝혔다. 지자체는 이번 준공을 통해 지역민의 소비 유출을 막고... "
2026-04-06,네이버뉴스,인천~서울 '제4경인고속화도로' 본궤도,https://www.incheonilbo.com/news/articleView.html?idxno=1320330,이후 2024년 롯데건설이 기점을 가좌동에서 용현동으로 변경하고 주안나들목(IC)을 신설하는 등 사업 구조를 보완한 수정안을 제시하면서 사업이 다시 궤도에 올랐다. 도로가 개통되면 기존 경인고속도로 교통량은 약... 
2026-04-06,네이버뉴스,"롯데건설-대자인병원, 협약체결",https://sjbnews.com/news/news.php?number=875643,롯데건설과 고려대학교 의료원 교류협력 대자인병원이 6일 ‘전주 전시컨벤션센터 신축공사’의 효율적인 사업추진과 지원체계 구축을 위해 상호 협력하기로 했다. 이번 협약은 전주컨벤션센터 건립 사업이 본격화된... 
2026-04-06,네이버뉴스,[인천시정] '천원 복비'로 무주택자 지원 / 제4경인고속화도로 민자적격...,https://www.webeconomy.co.kr/news/articleView.html?idxno=2132778,"■ ""제4인경인고속화도로, 사업 순항중"" 시에 따르면 제4경인고속화도로 사업은 2024년 7월 롯데건설에서 민간투자사업으로 제안해 시작됐다. 시는 관계기관 협의를 거쳐 같은 해 10월 한국개발연구원에... "
2026-04-06,네이버뉴스,"인천시, 제4경인고속화도로 사업 진행 중…민자적격성조사 타당성 확보",http://www.inews24.com/view/1957478,"해당 사업은 2024년 7월 롯데건설에서 민간투자사업으로 제안하여 시작됐으며, 인천시는 관계기관 협의를 거쳐 같은 해 10월 한국개발연구원에 민자적격성조사를 의뢰했다. 민자적격성조사는 비용 대비 편익(B/C)... "
2026-04-06,네이버뉴스,[인천 24시] 제4경인고속화도로 민자적격성 통과…2030년 착공 목표,https://www.sisajournal.com/news/articleView.html?idxno=368381,"앞서 롯데건설은 2024년 7월에 제4경인고속화도로룰 민간투자사업으로 제안했다. 시는 같은 해 10월 관계기관 협의를 거쳐 한국개발연구원에 민자적격성조사를 의뢰했다. 유정복 시장은 ""제4경인고속화도로가... "
2026-04-06,네이버뉴스,제4경인고속화도로 2030년 착공 '청신호',https://www.kihoilbo.co.kr/news/articleView.html?idxno=3018746,이후 2024년 롯데건설이 기점을 기존 가좌동에서 용현동으로 변경하고 주안 나들목(IC)을 신설하는 수정안을 제시하면서 사업이 재추진됐다. 시는 이날 KDI의 적격성 심사를 통과함에 따라 조만간 전략환경영향평가와... 
