date,source,title,link,description
2026-05-20,네이버뉴스,"김윤덕 국토부 장관 ""철근누락 철도공단에 통보하지 않은건 위반""",https://www.newsis.com/view/NISX20260520_0003637852,이에 이한우 현대건설 대표이사는 “저희가 잘못했다. 변명의 여지가 없다”고 고개를 숙였다. 서울시의 보고 누락 여부를 둘러싼 공방도 이어졌다. 김성보 권한대행은 “서울시는 지방계약법과 위수탁 협약에 따라 매달... 
2026-05-20,네이버뉴스,"""철판 덧대면 충분할까""…GTX 삼성역 보강안, 안전성 원점 검증대",https://www.ajunews.com/view/20260520150202794,"com 서울 강남구 GTX-A 노선 구간 공사현장 모습 [사진=연합뉴스] 수도권급행철도(GTX)-A 삼성역 공사 현장에서 철근 누락 사실이 드러난 가운데, 현대건설이 제시한 ‘강판 압착 보강공법’이 실제로 구조 안전성을 확보할... "
2026-05-20,네이버뉴스,"GTX 철근 누락 파문…이한우 ""현대건설 불찰""",https://biz.sbs.co.kr/article_hub/20000311626?division=NAVER,현대건설이 시공을 맡은 GTX-A 삼성역 구간 철근 누락 사태에 대한 원인규명 절차가 본격화되고 있습니다. 오늘(20일) 국회 긴급 현안질의에선 누락사실 보고가 늦어진 것을 두고 서울시와 국가철도공단 사이 책임공방이... 
2026-05-20,네이버뉴스,"""세 낀 집 급매물 주목…수도권 분양 1만2000가구 노려라""",https://www.hankyung.com/article/2026052082721,현대건설은 경기 평택시 평택고덕국제화계획지구 A31·34·35블록에 총 2122가구 규모의 ‘힐스테이트 고덕엘리스트’를 공급한다. 지방에서는 1만2000여 가구가 분양 예정이다. 이 중에서 일반분양 물량은 8925가구다.... 
2026-05-20,네이버뉴스,"오세훈, ‘철근 누락’ 공세 두고 “정부의 관권선거, 선거 뒤 수사 받...",https://news.kbs.co.kr/news/pc/view/view.do?ncd=8565931&ref=A,"그러면서 “현대건설 이후에 서울시가 취할 수 있는 모든 해야 할 역할, 사후 조치는 조금도 흐트러짐이 없었다”며 “모든 걸 다 국가철도공단에 보고했다. 당연히 정상적인 조직이라면 국토부 내에도 공유가 되어야 될... "
2026-05-20,네이버뉴스,"이한우 현대건설 대표 ""GTX 철근 누락, 모든 책임 통감""",https://www.newspim.com/news/view/20260520000919,이한우 현대건설 대표이사가 20일 서울 여의도 국회에서 열린 제435회 국회(임시회) 제02차 국토교통위원회 전체회의에서 의원 질의에 답하고 있다. 현대건설은 GTX-A 삼성역 시공을 맡았으며 승강장 구역... 
2026-05-20,네이버뉴스,GTX 철근 누락 관련 질의 듣는 이한우 대표,https://www.newspim.com/news/view/20260520000917,이한우 현대건설 대표이사가 20일 서울 여의도 국회에서 열린 제435회 국회(임시회) 제02차 국토교통위원회 전체회의에서 의원 질의를 경청하고 있다. 현대건설은 GTX-A 삼성역 시공을 맡았으며 승강장... 
2026-05-20,네이버뉴스,"이한우 현대건설 대표 “GTX 삼성역 철근 누락, 모든 책임 통감”",https://www.ddaily.co.kr/page/view/2026052015401797337,이한우 현대건설 대표이사가 GTX-A 삼성역 구간 철근 누락 사태와 관련해 “모든 책임을 통감한다”며 고개를 숙였다. 이 대표는 20일 국회 국토교통위원회 긴급 현안질의에 출석해 “직접적인 원인 제공자로서 마음이... 
2026-05-20,네이버뉴스,"철도공단, GTX-A 삼성역 기둥철근 누락 보강 적정성 용역 착수",https://www.news1.kr/local/daejeon-chungnam/6172883,"해당 공사는 2021년 2월부터 2028년 10월까지 진행되며, 현대건설 컨소시엄이 시공하고 ㈜삼안이 감리를 맡고 있다. 삼성역 지하 5층 승강장 기둥 구조물 80본에서는 종방향 주철근 2열을 1열로 착오 시공한 것으로... "
2026-05-20,네이버뉴스,"철도공단 ""콘크리트학회, 'GTX 삼성역 철근 누락' 보강 적정성 검토 용역...",https://www.news1.kr/realestate/general/6172887,시공은 현대건설(000720)이다. 현대건설은 해당 구간 도면을 오독해 지하 5층 기둥 80곳에서 2개씩 들어가야 할 주철근을 1개씩만 시공했다. 누적 철근은 178톤에 달한다. 이번 검토 용역은 구조물 분야의 전문 공인기관인... 
2026-05-20,네이버뉴스,"GTX 철근 누락 공방…국힘 ""매달 보고"" 與 ""따로 했어야""",https://www.nocutnews.co.kr/news/6520265?utm_source=naver&utm_medium=article&utm_campaign=20260520033447,민주당은 현대건설이 서울시에 철근 누락 사실을 최초 보고한 지난해 11월 10일 후로부터 5개월이 지난 4월 29일에서야 서울시가 국토부에 보고했다는 점을 지적하고 있다. 4월 29일은 오 시장은 서울시장 선거 출마로 직무... 
2026-05-20,네이버뉴스,[포토] 고개 떨군 이한우 현대건설 대표이사 부사장,https://www.newscj.com/news/articleView.html?idxno=3402434,이한우 현대건설 대표이사 부사장이 20일 서울 여의도 국회 국토교통위원회에서 열린 GTX 삼성역 철근 누락 관련 긴급 현안질의에서 의원 질의에 답변을 못한 채 고개를 떨구고 있다.
2026-05-20,네이버뉴스,"대한건설협회, 한양대서 미래 건설인 만났다",http://www.beyondpost.co.kr/view.php?ud=202605201527274329205868f676_30,"행사에는 한승구 대한건설협회 회장, 이한우 현대건설 대표, 최태진 대한건설협회 서울시회장, 정형열 부산시회장, 박한상 경북도회장, 김기춘 제주도회장, 이충재 한국건설산업연구원장, 이기정 한양대 총장, 한양대... "
2026-05-20,네이버뉴스,"철도공단, GTX 철근 누락 보강안 검증 용역 착수",http://www.edaily.co.kr/news/newspath.asp?newsid=04119686645450888,"이안호(왼쪽부터) 국가철도 공단이사장 직무대행, 이한우 현대건설 대표이사, 최동식 삼안 대표이사가 20일 서울 여의도 국회에서 열린 국토교통위원회 전체회의 ‘GTX-A 삼성역 구간 철근 누락에 대한 현안 질의’에 출석... "
2026-05-20,네이버뉴스,"서울시 ""문제 없어"" vs 국토부 ""부실 보고""…GTX 철근 누락 책임 충돌",https://www.asiatime.co.kr/article/20260520500320,이날 회의에는 △김윤덕 국토부 장관 △김성보 서울시장 권한대행 △이한호 국가철도공단 이사장 직무대행 △이한우 현대건설 대표이사 △최동식 삼안 대표이사 등이 출석했다. 이번 사태에서 문제가 된 구간은 GTX-A... 
2026-05-20,네이버뉴스,"[기획] 서울 한복판 철근누락 사태, 해결책보다 정쟁만",https://www.m-i.kr/news/articleView.html?idxno=1374716,"오세훈 국민의힘 서울시장 후보는 ""이번 철근 누락 사태는 정말 순수한 현대건설 쪽 과실""이라며 ""정원오 캠프가 이제 좀 쫓기는 모양""이라고 맞섰다. 설계도면 해석을 잘못한 시공사의 실수이지, 시 차원의 '은폐'나 '축소... "
2026-05-20,네이버뉴스,[건설 인사이드] 10대 건설사 미청구공사 13조… 8곳 늘고 2곳 줄었다,https://www.viva100.com/article/20260520500858,"건설사별로 보면 현대건설(2조8092억원, 현대엔지니어링 제외 기준),  삼성물산(1조9768억원), 포스코이앤씨(1조6655억원), 현대엔지니어링(1조3205억원), SK에코플랜트(1조2331억원), 롯데건설(9673억원), 대우건설(9379억원)... "
2026-05-20,네이버뉴스,"이한우 현대건설 대표 ""변명의 여지 없다""…GTX-A 철근 누락 사과",https://www.news1.kr/realestate/general/6172846,"윤주현 김동규 기자 = 이한우 현대건설(000720) 대표이사가 GTX-A 삼성역 구간 철근 누락 사태와 관련해 국회에서 ""변명의 여지가 없다""고 공식 사과했다. 국회에서는 시공·감리 부실 책임을 둘러싼 질타가 이어졌다. 20일... "
2026-05-20,네이버뉴스,"GTX-A 삼성역 철근 누락, 보고 누락 논란으로 확산",https://www.newsway.co.kr/news/view?ud=2026052014550902031,"현대건설은 지난해 11월 자체 품질점검 과정에서 지하 5층 기둥 80개에서 주철근 일부가 누락된 사실을 발견해 서울시에 자진 보고했다. 누락 물량은 약 2500개, 178톤에 달한다. 권한일 기자"
2026-05-20,네이버뉴스,[기획] 순살 아파트 이은 '순살 GTX'… 누가 책임지나,https://www.m-i.kr/news/articleView.html?idxno=1374737,"사진=연합뉴스 매일일보 = 김승현 기자  |  GTX-A 삼성역 철근누락 사태를 둘러싼 발주처 서울시와 시공사 현대건설, 위탁자 국가철도공단 간 책임공방이 격화하고 있다. 자칫 작업자 개인의 실수로 사태가 마무리될... "
2026-05-20,네이버뉴스,GTX 철근 누락 '불똥'…현대건설 재건축 단지들 뒤숭숭,https://www.newsis.com/view/NISX20260520_0003637145,"대조1구역은 현대건설이 시공하고 있다. 대조1구역은 대조동 일대 11만2000㎡ 부지를 재개발해 지하 4층∼지상 25층, 28개동 2451가구를 짓는 사업이다. 하지만 조합 집행부 직무정지와 공사비 1800억원 미지급 문제로 1년 반... "
2026-05-20,네이버뉴스,[포토] 굳은 표정 짓는 이한우 현대건설 대표이사,https://www.asiatoday.co.kr/kn/view.php?key=20260520010005891,이한우 현대건설 대표이사가 20일 국회 국토교통위원회에서 열린 GTX-A 삼성역 구간 철근 누락에 대한 현안 질의에서 굳은 표정을 짓고 있다. 오른쪽은 김성보 서울특별시장 권한대행. 이병화 photolbh... 
2026-05-20,네이버뉴스,[포토] 국회 국토위 출석한 이한우 현대건설 대표이사,https://www.asiatoday.co.kr/kn/view.php?key=20260520010005893,이한우 현대건설 대표이사가 20일 국회 국토교통위원회에서 열린 GTX-A 삼성역 구간 철근 누락에 대한 현안 질의에 출석해 있다. 이병화 photolbh@asiatoday.co.kr
2026-05-20,네이버뉴스,다시 도마 오른 건설업계 '안전 불감증',https://www.m-i.kr/news/articleView.html?idxno=1374709,작년 10월 시공사인 현대건설은 철근이 누락된 사실을 인지한 이후 서울시에 보고한 것으로 확인됐지만 약 6개월간 외부에 공개되지 않으며 논란을 키우고 있다. 이 같은 철근 누락 사태는 이번이 처음이 아니다. 앞서... 
2026-05-20,네이버뉴스,"""고개 들 수 없다"" GTX-A 삼성역 철근 누락에 현대건설 전면 사과",http://www.finomy.com/news/articleView.html?idxno=254650,"현대경제신문 임이랑 기자 | 수도권광역급행철도(GTX)-A 삼성역 공사 현장에서 기둥 철근이 대거 빠진 사실이 드러나면서, 시공사 현대건설이 국회에 출석해 책임을 인정하고 사과했다. 국토교통부는 삼성역 구간 기둥... "
2026-05-20,네이버뉴스,"고개 숙인 이한우 현대건설 대표 ""명백한 불찰""...GTX-A 전면 감사",https://www.insightkorea.co.kr/news/articleView.html?idxno=246751,이한우 현대건설 대표가 20일 오전 국회 국토교통위원회(국토위) 긴급 현안질의에 출석했다. 이 대표는 수도권광역급행철도(GTX)-A 노선 삼성역 구간 철근 누락 사태와 관련해 사과하고 재발 방지 대책 마련을 약속했다. 이... 
2026-05-20,네이버뉴스,"오세훈, GTX 책임론에 ""李정부 관권선거, 선거 뒤 수사받아야""",https://www.news1.kr/politics/assembly/6172784,"오 후보는 ""평소 김 장관의 일하는 스타일이나 인품에 비춰봤을 때 참으로 무리스러운 말씀을 오늘 하신 셈""이라며 ""현대건설의 자진 신고 이후 서울시가 취할 수 있는 모든 역할과 사후 조치는 조금도 흐트러짐이 없었다... "
2026-05-20,네이버뉴스,"이한우 현대건설 대표, 철근 누락 사과 “모든 책임 통감”",https://www.ichannela.com/news/main/news_detailPage.do?publishId=000000530076,"수도권광역급행철도, GTX-A 공사 철근 누락과 관련해 이한우 현대건설 대표이사가 ""모든 책임을 통감하고 고개를 들 수 없다""고 사과했습니다. 오늘(20일) 국회 국토교통위원회 현안질의에 출석한 이 대표는 ""직접적인... "
2026-05-20,네이버뉴스,"오세훈 캠프, 'GTX 철근 누락' 보도 MBC 기자들 고발… MBC ""알권리 훼손...",https://www.mediatoday.co.kr/news/articleView.html?idxno=334570,"오 후보는 GTX-A 삼성역 구간 철근 누락에 대한 책임이 시공사인 현대건설 과실이라고 주장한 가운데, 오 후보 본인이 시공과 감리의 책임자라는 문건도 발견됐다고 했다. 한동수 MBC 취재센터장은 이날 미디어오늘에 ""이번... "
2026-05-20,네이버뉴스,"오세훈, GTX 삼성역 논란 ""정부·민주당의 '정치공세'""",http://www.fnnews.com/news/202605201506067697,오 후보는 “이미 이날 오전 관훈토론회에서도 상세히 설명했지만 현대건설의 자진 신고 이후 서울시가 해야 할 역할과 사후 조치는 조금도 흐트러짐 없이 진행됐다”고 강조했다. 이어 “모든 내용을 국가철도공단에... 
2026-05-20,네이버뉴스,"권영진 의원 ""삼성역 철근 누락, 철도공단이 국토부에 전달 안해""",https://www.sidae.com/article/2026052011393983188,"이어 ""이번 철근 누락 문제는 시공사인 현대건설의 자진신고로 드러났으며 서울시가 공사현장 CCTV 설치를 통해 사고 은폐가 불가능한 구조를 마련한 결과""라고 평가했다. 또 ""서울시는 위수탁협약에 따른 보고 의무를... "
2026-05-20,네이버뉴스,"전현희 ""재건축 재개발, 민주당이 더 신속하게 지원할 것""",http://tbs.seoul.kr/news/newsView.do?typ_800=7&idx_800=3536553&seq_800=20529434,"서울시도 마찬가지로, 작년 11월에 현대건설이 철근이 누락된 사실을 서울시에 보고를 했다고 하거든요. 그러면 예 그럼 서울시 현장 책임자들은 인지를 했다는 거 아닙니까? 그러면 당연히 안전 관리 책임자인 시장에게... "
2026-05-20,네이버뉴스,"김윤덕 “서울시, 철근 누락 ‘숨은그림 찾기식’ 보고…안전 불감증”",https://www.dailian.co.kr/news/view/1646623/?sc=Naver,"서울시는 지난해 11월 10일 시공사인 현대건설로부터 철근 누락 보고를 받은 이후, 철도공단에 월간 사업관리 보고서를 제출하며 해당 사실을 세 차례에 걸쳐 전달했다는 입장이다. 하지만 철도공단은 서울시로부터 별도... "
2026-05-20,네이버뉴스,"김윤덕 국토부 장관 ""GTX 삼성역 철근 누락⋯모든 기둥 전수조사""",http://www.inews24.com/view/1970157,"시공은 현대건설이 맡았다. 문제가 된 구간은 지하 5층 기둥 80곳이다. 설계상 2개씩 배치돼야 할 주철근이 1개씩만 시공됐다. 누락된 철근은 약 2500개, 총 178톤 규모다. 현대건설은 보강 공법을 최종안으로 제시했다.... "
2026-05-20,네이버뉴스,"현대건설 이한우 GTX 철근 누락 사고에 국회 출석해 사과, ""고개 들 수 없...",https://www.businesspost.co.kr/BP?command=article_view&num=438244,"이한우 현대건설 대표가 수도권광역급행철도(GTX)-A 삼성역 철근 누락을 두고 사과했다. 이 대표는 20일 국회 국토교통위원회 전체회의에 출석해 ""고개를 들 수 없다""며 ""직접적 원인 제공자로서 마음이 무겁고 모든... "
2026-05-20,네이버뉴스,미리보는 양자토론? 정원오·오세훈 관훈클럽 토론서 맞붙어,https://news.cpbc.co.kr/article/1173029?division=NAVER,"GTX-A 삼성역 구간 철근 누락에 대해서는 ""현대건설이 하청업체 부실시공을 발견해 서울시에 보고한 사안""이라며 ""19차례 회의를 거쳐 보강공사하면 개통에 문제 없다고 판단했다""고 밝혔다. 그러면서 ""민주당은 처음엔... "
2026-05-20,네이버뉴스,“GTX 철근 누락 책임 통감”…이한우 현대건설 대표 사과,https://www.kukinews.com/article/view/kuk202605200101,현대건설 대표이사가 GTX 철근 누락 사태와 관련해 공식 사과했다. 20일 열린 국회 국토교통위원회 전체회의 긴급 현안질의에서 이한우 현대건설 대표이사는 “고개를 들 수 없을 정도로 마음이 무겁다”며 “직접적인... 
2026-05-20,네이버뉴스,"건설현장 혼선···IPARK현산, '원스톱 키오스크'로 답 찾나",https://www.newsfreezone.co.kr/news/articleView.html?idxno=690789,현재 국내 건설업계 DX 주도권은 삼성물산과 현대건설이 선점 중이다. 자본 규모와 기술 투자 면에서 시장을 리드하는 두 회사는 글로벌 클라우드 협업이나 중장비 제조사와의 직접 제휴를 통해 대응하고 있다.... 
2026-05-20,네이버뉴스,"현대건설 대표, GTX 철근 누락 공식 사과 ""책임 통감""",http://www.breaknews.com/1208576,브레이크뉴스 문홍철 기자= 이한우 현대건설 대표이사가 수도권광역급행철도(GTX)-A 삼성역 공사 현장에서 발생한 철근 누락 사태와 관련해 공식 사과했다. 이한우... 
2026-05-20,네이버뉴스,[포토] 시간 확인하는 이한우 현대건설 대표,https://www.ilyosisa.co.kr/news/article.html?no=256006,이한우 현대건설 대표가 20일 서울 여의도 국회에서 열린 국토교통위원회 'GTX-A 삼성역 구간 철근 누락에 대한 현안 질의'에 출석해 시간을 확인하고 있다. 이날 이 대표는 GTX-A 삼성역 구간 철근 누락 사건과 관련해... 
2026-05-20,네이버뉴스,[포토] 국회 국토교통위원회 출석한 현대건설 이한우 대표,https://www.ilyosisa.co.kr/news/article.html?no=256008,"이한우 현대건설 대표가 20일 서울 여의도 국회에서 열린 국토교통위원회 'GTX-A 삼성역 구간 철근 누락에 대한 현안 질의'에 출석해 있다. 이날 이 대표는 GTX-A 삼성역 구간 철근 누락 사건과 관련해 ""모든 책임을... "
2026-05-20,네이버뉴스,[포토] 'GTX-A 삼성역 철근 누락' 관련 질의받는 이한우 현대건설 대표,https://www.ilyosisa.co.kr/news/article.html?no=256007,이한우 현대건설 대표가 20일 서울 여의도 국회에서 열린 국토교통위원회 'GTX-A 삼성역 구간 철근 누락에 대한 현안 질의'에 출석해 의원 질의를 받고 있다. 이날 이 대표는 GTX-A 삼성역 구간 철근 누락 사건과 관련해... 
2026-05-20,네이버뉴스,"외인, 올 들어 코스피 91조 '팔자'에도 비중 증가...매수 집중 종목은",http://www.opinionnews.co.kr/news/articleView.html?idxno=138729,"이달 들어선 두산로보틱스, 삼성SDI, 포스코홀딩스, LG디스플레이, 현대건설을 순매수했다. 코스피 전체 시가총액과 외국인 보유 비율. 외인 비율은 올해 초 36.65%에서 전날 39.43%로 증가했다. 단위, 백만원. 사진... "
2026-05-20,네이버뉴스,"서울시 “GTX 삼성역 철근 누락, 6차례·51건 보고”",https://www.kmib.co.kr/article/view.asp?arcid=0029849293&code=61122011&cp=nv,"시공사인 현대건설은 지난해 11월 10일 시에 보고했으나, 시가 이를 정부에 곧바로 알리지 않았다는 의혹이 제기되면서 정치권을 중심으로 ‘은폐 논란’이 일었다. 시는 곧장 철도공단에 수차례 관련 내용을 보고했다고... "
2026-05-20,네이버뉴스,“월간보고서에 있었다” vs “누가 그걸 보나” 서울시·철도공단 ‘보...,https://www.ekn.kr/web/view.php?key=20260520022506440,"국토교통부는 모든 기둥에 대한 전수조사와 특정감사에 착수하겠다고 밝혔고, 시공사인 현대건설은 공식 사과했다. 이번 논란은 서울 강남구 영동대로 지하공간 복합개발사업 내 GTX-A 삼성역 공사 과정에서 불거졌다.... "
2026-05-20,네이버뉴스,"현대건설 ""모든 책임 통감""... 국토부, GTX-A 삼성역 전수조사·감사 착...",https://www.meconomynews.com/news/articleView.html?idxno=131273,"이한우 현대건설 대표, 20일 국토위서 공개 사과 ""고개를 들 수 없다... 안전·품질 최우선으로 공사"" 김윤덕 국토장관 ""전수조사·보강 공법 종합 검토"" [시장경제=노경민 기자] 20일 국회 국토교통위원회에서 열린 전체... "
2026-05-20,네이버뉴스,[포토] 스타트업 벤처 캠퍼스 서울 개소식,https://www.etnews.com/20260520000364,"중소벤처기업부 장관을 비롯한 참석 인사들이 개소식 세레모니를 하고 있다. 왼쪽부터 박종열 네이버클라우드 이사, 산딥 엔틀러 아태 대표, 한성숙 장관, 박상주 홍익대 총장, 박병규 현대건설 상무, 안미선 샤이닝랩 대표."
2026-05-20,네이버뉴스,국회 국토위 현안 질의…GTX-A 삼성역 철근 누락 질타 [포토],https://www.etoday.co.kr/news/view/2586378,"이 자리에는 김윤덕 국토교통부 장관, 이안호 국가철도공단 이사장 직무대행, 김성보 서울시장 권한대행, 이한우 현대건설 대표이사, 최동식 삼안 대표 등이 출석했다. 고이란 기자 photoeran@"
2026-05-20,네이버뉴스,"이한우 현대건설 대표 ""GTX-A 삼성역 철근 누락 책임 통감""",http://www.inews24.com/view/1970124,"이한우 현대건설 대표이사가 수도권광역급행철도(GTX)-A 공사 구간의 철근 누락 사태와 관련해 공개 사과하며 고개를 숙였다. 이 대표는 20일 오전 국회 국토교통위원회 현안질의에 출석해 이사는""모든 책임을 통감하고... "
2026-05-20,네이버뉴스,"서울시 ""GTX-A 삼성역 무정차 통과 차질 없게 역량 총동원""",http://www.inews24.com/view/1970097,시는 시공사인 현대건설이 제안한 보강방안으로 기존 설계 기준을 상회하는 안전조치를 추진할 계획이다. 한편 삼성역 공사 구간이 포함된 영동대로 3공구는 총사업비 1조7000억원 규모의 대형 지하 인프라 사업이다.... 
2026-05-20,네이버뉴스,"국힘, ""정원오 '주폭 논란' 물타기 나선 MBC 단죄해야""",http://www.edaily.co.kr/news/newspath.asp?newsid=03929446645450888,"이어 “보도 대상 사업의 구조를 보면, 해당 공사는 국토부 산하 국가철도공단이 서울시에 위탁하고, 현대건설이 시공을 맡은 사업”이라며 “서울시는 철근 누락 관련 사항을 이미 지난해 11월부터 올해 5월까지... "
2026-05-20,네이버뉴스,"[기획] DL이앤씨, SMR 4축으로 글로벌 디벨로퍼 변신 가속",https://www.startuptoday.co.kr/news/articleView.html?idxno=801496,"국내 건설사들의 SMR 사업을 보면 현대건설이 미국 홀텍과 손잡고 팰리세이즈 SMR-300 인허가 절차에 들어선 상태이며, 삼성물산은 미국 뉴스케일파워와 루마니아 SMR 사업을 추진 중이다. 두산에너빌리티는 한국형 i... "
2026-05-20,네이버뉴스,"""AI·뷰티·콘텐츠 스타트업 모였다""…홍대앞 대규모 창업거점 개소",https://www.mt.co.kr/future/2026/05/20/2026052014185715957,"대기업은 한국IBM, 한국마이크로소프트, 현대자동차, 네이버클라우드, 현대건설 등 8곳이, 투자사는 뮤어우즈벤처스, 큐네스티 등 국내 VC 2곳과 앤틀러(싱가포르), 슈룩파트너스(UAE), 사제파트너스(미국), 졸트캐피탈... "
2026-05-20,네이버뉴스,"GTX 철근 누락 '늑장 보고' 논란…서울시 ""즉시 보고 의무 없어 위법 아...",https://www.newspim.com/news/view/20260520000726,복합환승센터 지하 5층에 위치한 3공구 GTX 승강장 부분으로 시공사는 현대건설이다. 설계상 기둥 80본에 주철근을 2열로 배치해야 했지만 실제로는 1열만 시공된 것으로 확인됐다. 전체 기둥의 62.5%에 달하는 50본이 준공... 
2026-05-20,네이버뉴스,"野, MBC '철근 괴담' 보도 규탄 ''책임은 철도공단·시공사''",https://www.gukjenews.com/news/articleView.html?idxno=3587530,"""MBC가 국민 안전이나 진상 규명에는 관심이 없고, 오로지 오세훈 후보에게 책임을 씌우려는 정치적 음해에 불과하다""고 직격해당 공사가 국토부 산하 국가철도공단이 서울시에 위탁하고 현대건설이 시공한 사업임을... "
2026-05-20,네이버뉴스,"GTX 삼성역 철근 누락 파장 확산…민주 ""서울시, 조직적 은폐 의혹""",https://www.wolyo.co.kr/news/articleView.html?idxno=312448,"더불어민주당 정원오 서울시장 후보 측은 ""서울시가 수개월간 사실상 보고를 누락했다""며 오세훈 국민의힘 서울시장 후보를 정면 겨냥했고, 현대건설 대표는 국회에 출석해 공식 사과했다. 정원오 후보 선거대책위원회... "
2026-05-20,네이버뉴스,"""차라리 우리를 질책해달라""…GTX-A 철근 누락에 현대건설 대표 사과",http://weekly.chosun.com/news/articleView.html?idxno=51728,"수도권광역급행철도(GTX)-A 삼성역 공사 구간 철근 누락 사태와 관련해 이한우 현대건설 대표이사가 국회에 출석해 공식 사과했다. 이 대표는 20일 오전 국회 국토교통위원회 현안질의에 출석해 ""모든 책임을 통감하고... "
