date,source,title,link,description
2026-07-12,네이버뉴스,"김윤덕 장관 ""모듈러 기술로 좋은 집 더 빠르게""…공공주택 확대 추진",http://www.ferrotimes.com/news/articleView.html?idxno=49093,"업계는 모듈러 공법이 기존 건설방식보다 공기를 20~30% 단축할 수 있고 고소작업이 적어 안전사고 예방에도 유리하지만, 초기 인프라 구축 비용 부담으로 공사비가 기존 공법보다 약 30% 높은 데다 관련 제도와 규제가 산업... "
2026-07-12,네이버뉴스,"서한, 건설 상호협력평가 10년 연속 대구경북 1위",https://www.edaily.co.kr/news/newspath.asp?newsid=02673206645513864,서한이 국토교통부의 ‘2026년 건설사업자 간 상호협력평가’에서 최우수 등급을 획득하며 10년 연속 대구... 지난해 추석과 올해 설 명절을 앞두고는 협력업체들의 자금 부담을 덜기 위해 공사비와 자재대금 등 약... 
2026-07-12,네이버뉴스,[기획] 사라진 충주동막마을 경로당 中. 혈세 낭비하고 개인 배만 불려...,https://www.jbnews.com/news/articleView.html?idxno=1507517,"그는 해당 부지 매입 이후 어울림센터 신축을 명분으로 센터로 진입하는 교량을 건설해 줄 것을 앙성면에... 아니다""며 ""누가 공사비를 부담했든 공사를 해준 것은 맞지 않느냐""고 주장했다. 어울림센터 신축을 위해... "
2026-07-12,네이버뉴스,"부동산 PF '개선 흐름' 반전, 유의·부실우려 여신 9.6%",https://www.bloter.net/news/articleView.html?idxno=667883,PF 상황 점검회의에 참석한 건설·개발업계 관계자들은 공사비와 시중금리 상승으로 자금 조달에 어려움을 겪는 사업장이 늘고 있다는 의견을 냈다. 사업성이 있는 사업장도 금융비용 부담이 커지면 공사와 분양... 
2026-07-12,네이버뉴스,막오르는 ‘부동산 릴레이 토론회’… 첫 의제는 공급·규제·전월세,https://www.segye.com/newsView/20260712512470?OutUrl=naver,이에 국회에서 잠자는 관련 법안들의 신속 처리를 비롯해 정비사업 지연 요인으로 손꼽히는 공사비 분쟁 중재안과 이주비 대출 지원책 등이 논의될 수 있다. 재건축 초과이익 환수제를 비롯해 주택 건설 인허가 기간 단축... 
2026-07-12,네이버뉴스,"서한, 상생경영·복지경영 모두 인정…대구·경북 건설사 10년 연속 1위",https://www.kyongbuk.co.kr/news/articleView.html?idxno=4078088,건설산업기본법상 벌점 0.5점 감경 등의 혜택을 받을 수 있다. 서한은 협력업체와의 동반성장을 위한 지원도 꾸준히 이어오고 있다. 지난해 추석과 올해 설 명절을 앞두고 협력업체의 자금 부담을 덜기 위해 공사비와... 
2026-07-12,네이버뉴스,"[부동산 손자병법] ""강남4구로 불러주세요""… 동작의 야심, 사당동 대변...",https://www.mk.co.kr/article/12096441,아파트 높이는 지상이 아니라 고도 기준으로 책정돼 층수가 생각보다 높지 않게 건설될 수 있기 때문이다. 또 언덕으로 단차가 커 공사 난도가 높아져 공사비도 늘어날 가능성이 크다. 남성역 인근 '제일아파트'도... 
2026-07-13,네이버뉴스,"[박수연 칼럼] K-배터리, 전기차 캐즘 넘어 ESS로 반격...관세 방패 열린...",http://www.thevaluenews.co.kr/news/view.php?idx=200020,데이터센터 건물 자체는 2~3년이면 짓지만 이를 받쳐줄 송전망과 발전소 건설은 훨씬 오래 걸린다. 그... 관통하는 리스크는 결국 두 가지로 좁혀진다. 첫째는 중국이다. 미국 ESS에 공급되는 배터리 셀은 여전히... 
2026-07-13,네이버뉴스,"AI 클라우드 전환 본격화한 IREN, 마이크로소프트·엔비디아와 초대형 계...",https://www.tokenpost.kr/news/cryptocurrency/376991,"이들은 AI 클라우드 플랫폼 고도화, 대규모 데이터센터 건설, 전력 인프라 확장 등을 총괄하게 된다.... 다만 전문가들은 고객 집중도 리스크와 자본 집약적 사업 구조, 레버리지 위험 등을 주의 깊게... "
2026-07-13,네이버뉴스,"중앙그룹 부도 사태… 개미들은 몰랐다, 물렸다",https://h21.hani.co.kr/arti/economy/economy_general/59608.html,2011년 3월 엘아이지(LIG)건설은 법원에 기업회생을 신청하기 불과 열흘 전까지 우리투자증권(현... 증권사 내부에는 채권 발행 리스크를 분석하는 전담팀도 있다. 그렇다면 서로의 사정을 계속 알고 있었기에 당연히 부도... 
2026-07-13,네이버뉴스,【오늘의 법조】 2026년 7월 13일,https://www.lawtimes.co.kr/news/articleView.html?idxno=223440,"율촌, '건설사업자를 위한 부실벌점 및 산업안전 형사 리스크 대응 전략' 세미나 -오후 2시, 서울 삼성동 파르나스타워 39층 법무법인 율촌 렉처홀 ▷법무법인 지평·한국환경공단, '탄소중립 이행전략' 제2회... "
2026-07-13,네이버뉴스,"대구상의, 상반기 경제동향 보고회 개최",https://biz.heraldcorp.com/article/10806230?ref=naver,"반면 건설경기는 부진을 면치 못했다. 이 기간 건설수주액은 3천185억원으로 지난해보다 78.1% 감소, 전국... 박윤경 대구상공회의소 회장은 “하반기에도 내수 부진등 복합적인 경영 리스크가 이어질 것으로 예상되는... "
2026-07-13,네이버뉴스,[건축명가 리포트] [도화엔지니어링] 본업으로 회귀…신사업 전략 '수술...,https://dealsite.co.kr/articles/164837,"EPC 사업은 리스크 대비 수익성이 낮은 프로젝트를 줄이고, 설계·건설사업관리(CM)·컨설팅 등 기존 경쟁력이 높은 분야에 역량을 집중키로 했다. 최근 EPC와 O&M 매출 비중이 감소하는 반면 컨설팅 부문이 성장하면서 사업... "
2026-07-13,네이버뉴스,[뉴욕 주간전망] 물가지표 주목...2분기 실적도 주목해야,http://www.opinionnews.co.kr/news/articleView.html?idxno=141404,"물가지표에 대한 주목도가 높아지고 있는 상황에서 중동발 지정학적 리스크가 재부각되고 있는 점은 부담... ▲7월 16일 16일에는 주간 신규실업보험 청구건수 및 6월 소매판매, 7월 미국 주택 건설업협회(NAHB)... "
2026-07-13,네이버뉴스,美 관세 장벽에 ‘공장 이전’ 망설이는 자동차 업계… “관세가 더 싸...,https://www.g-enews.com/view.php?ud=202607130631434682bd56fbc3c_1,"기업들은 수십억 달러가 소요되는 신규 공장 건설 대신, 수익성을 희생하더라도 기존 공급망을 유지하는... 경영상 리스크가 지나치게 크다는 평가다. 실제로 《오토모티브 뉴스》의 분석에 따르면, 2025년 이후 자동차... "
2026-07-13,네이버뉴스,"다스코㈜, 신안 태양광 EPC·O&M 동시 계약…전력 인프라 기업 변모",https://www.dnews.co.kr/uhtml/view.jsp?idxno=202607091253579520566,"98㎿ 규모의 태양광 발전단지 건설공사를 수행한다. 전체 계약금액은 총 760억원이며, 다스코㈜는532억원... 협력으로 리스크를 철저히 관리해 최고 수준의 태양광 발전소를 완공할 것”이라고 말했다. 이어 “개발... "
2026-07-13,네이버뉴스,"10조 PDRN·PN 시장 출사표...엔지켐생명과학, 수직 통합 '속도'",https://www.pharmnews.com/news/articleView.html?idxno=304838,"국내 굴지의 식품회사 연구소에서 팀장 및 부소장으로 재직하며 아스파탐(인공감미료) 생산 공장 건설 등... 모두가 찬성했지만, 저는 식품 기반 회사가 갑자기 대규모 항생제 생산에 뛰어드는 것은 리스크가 크다고... "
2026-07-13,네이버뉴스,"""전쟁 끝났다"" 샴페인 너무 일찍 터뜨린 시장이 받아들 청구서",https://www.fortunekorea.co.kr/news/articleView.html?idxno=53194,"사우디아라비아와 아랍에미리트(UAE)가 새 송유관을 건설하는 데 최소 1년이 걸리기 때문에, 송유관으로... 따라서 향후 수요 급증과 별개로 당분간 배럴당 최소 5달러의 지정학적 리스크 프리미엄이 유가에 상시... "
2026-07-13,네이버뉴스,"中, 신규 탄소 피크 로드맵 전격 공개… 녹색 전환 가속화",https://www.g-enews.com/view.php?ud=2026071216124757820c8c1c064d_1,"합작으로 건설하고, 친환경 유통 수송을 전담할 무탄소 운송 회랑(화물 노선)을 촘촘히 구축해 저탄소... 서방의 가혹한 무역 관세 펜스를 우회하고 자국 내 과잉 생산 캐파 리스크를 친환경 인프라 고도화로 상각하려는... "
2026-07-13,네이버뉴스,"[월드 포커스] 카스피해(海)의 불꽃, 아제르바이잔",https://www.sedaily.com/article/20066634?ref=naver,플랜트 건설에 최적의 파트너가 될 수 있다. 또 우리의 독보적인 정보통신기술(ICT) 역량을 중앙회랑의 스마트 항만과 디지털 물류 통신망 고도화에 접목한다면 우리는 유라시아 공급망 리스크를 분산하는 동시에 미래... 
2026-07-12,네이버뉴스,"에코프로, 전기차 150만대 분량 니켈 자원 확보 나섰다",https://www.hidomin.com/news/articleView.html?idxno=712972,인도네시아 술라웨시에 건설 중인 BNSI 제련소는 인도네시아 국영 광산기업 PTVI(PT Vale Indonesia) 등 글로벌... 전략 광물인 니켈 투자는 에코프로비엠 등 기업 경쟁력 향상을 넘어 글로벌 공급망 리스크 해소와 한국... 
2026-07-12,네이버뉴스,대구 제조업 회복에도 체감경기 '냉랭'…기업 10곳 중 7곳 목표 미달,https://www.edaily.co.kr/news/newspath.asp?newsid=02637126645513864,"반면 건설경기는 극심한 침체를 이어갔다. 1~5월 건설수주액은 3185억원으로 지난해보다 78.1% 급감했다.... 응답 기업의 52.3%는 경영환경이 악화될 것으로 전망했으며, 주요 리스크로는 내수 부진과 소비 위축(62.8... "
2026-07-12,네이버뉴스,빚으로 쌓아올린 'AI 바벨탑'… 빅테크의 위험한 베팅 [글로벌 리포트],http://www.fnnews.com/news/202607121840309198,"5%인 4378개가 운영 중이며, 2700개가 추가로 건설되거나 계획 단계에 있다. 클라우드 서비스와 초거대 AI... ■커지는 투자…금융시장 새 리스크 다만 우려도 적지 않다. 국제결제은행(BIS)은 AI 프로젝트가 충분한 수익을... "
2026-07-12,네이버뉴스,[전규열 칼럼] 금리 인상 시작되나...반도체 호황 속 가려진 민생의 그...,https://www.polinews.co.kr/news/articleView.html?idxno=736763,"여기에 중동 리스크로 국제 유가 변동성이 커지고, 원·달러 환율도 1500원 안팎에서 높은 수준을 유지하고... 수출 대기업은 호황을 누리지만, 건설·내수·자영업 부문은 여전히 부진하다. 고용 시장도 예외가 아니다. 최근... "
2026-07-12,네이버뉴스,"에코프로, 인도네시아 니켈 연 6만5000t 확보…배터리 공급망 강화",https://www.kyongbuk.co.kr/news/articleView.html?idxno=4078119,인도네시아 술라웨시에 건설 중인 BNSI 제련소는 인도네시아 국영 광산기업 PTVI(PT Vale Indonesia) 등 글로벌... 전략 광물인 니켈 투자는 에코프로비엠 등 기업 경쟁력 향상을 넘어 글로벌 공급망 리스크 해소와 한국... 
2026-07-12,네이버뉴스,"이마트, 본업 회복세에도 스타벅스 리스크에 발목 잡히나",https://www.bloter.net/news/articleView.html?idxno=667874,지분법손실이 분기마다 400억~500억원 수준 발생하는 것으로 파악된다. 신세계건설의 미분양 관련 대손충당금 이슈도 예측이 쉽지 않은 변수로 꼽힌다. 본업 실적 개선에도 계열사발 손실이 성과를 갉아먹을 수 있다.
2026-07-12,네이버뉴스,홈플러스 회생 무산에 다시 불거진 MBK '겸직 리스크',http://www.newslock.co.kr/news/articleView.html?idxno=132891,"회사는 지난해 이사회에서 미국 정부 등으로부터의 투자 유치와 미국 제련소 건설 등 사업 추진계획을 승인한 바 있다. 이런 장치산업은 대규모 설비투자와 장기 연구개발, 안정적인 공급망 관리가 필수인 만큼, 단기... "
2026-07-12,네이버뉴스,"에코프로 그룹, 印尼 니켈 투자로 전기차 150만 대분 확보",https://www.munhwa.com/article/11602055?ref=naver,에코프로 그룹이 인도네시아 인터내셔널 그린 산업단지(IGIP) 내 건설 중인 ‘BNSI 제련소.’ 에코프로 제공 에코프로 그룹이 인도네시아 니켈 제련소 투자로 전기차 약 150만 대를 생산할 수 있는 규모의 니켈 공급권을... 
2026-07-12,네이버뉴스,[제민포럼] '민족단결'의 이름으로 국경을 넘다,https://www.jemin.com/news/articleView.html?idxno=840148,이 법은 중국의 '강한 중국' 건설 의지를 보여주지만 동시에 주변국에 보내는 경고이기도 하다. 자유민주주의 국가들은 연대해 초국가적 법 집행의 남용을 견제해야 한다. 한국 사회도 '중국 리스크'를 단순한 경제 변수가... 
2026-07-12,네이버뉴스,SK하이닉스 미 상장 자금 265억달러 유입…환율 안정 변수 부상,https://www.sidae.com/article/2026071216410487250,12일 금융투자업계에 따르면 이번 공모 자금은 용인 반도체 클러스터와 청주 P&T7 첨단 패키징 공장 건설... 특히 최근 중동 지역 지정학적 리스크와 외국인 자금 유출 등으로 달러 수급이 경색됐던 상황에서 SK하이닉스... 
2026-07-12,네이버뉴스,"에코프로, 인도네시아 니켈로 글로벌 공급망 빗장 건다...전기차 150만 대...",https://www.getnews.co.kr/news/articleView.html?idxno=874825,에코프로 그룹은 인도네시아 술라웨시 지역에 건설 중인 BNSI 제련소 지분을 대거 확보하며 대주주 지위를... 규제 리스크를 원천 차단했다. 에코프로 그룹은 지난 4년간 진행된 1단계 IMIP 프로젝트에 약 8000억 원을... 
2026-07-12,네이버뉴스,오늘의 인사-국무조정실 외,https://www.khan.co.kr/article/202607121600001,양종호 △건설안전과장 이창훈 △첨단물류과장 박동주 ■성평등가족부 ◇국장급 승진 △고용평등정책관... 조중현 △리스크관리부장 이주안 △안전운영부장 한종수 △정보시스템부장 박진태 △여수출장소장 서밀희... 
2026-07-13,네이버뉴스,"경기도 도민감리단, 10개 공공건설 현장 방문… 179건 지적",https://www.munhwa.com/article/11602132?ref=naver,"이들은 도로·철도·하천·건축 등 공공 건설 현장을 방문해 안전사고 예방, 부실시공 방지, 품질 향상을 목표로 점검한다. 도 도민감리단은 올해 점검 대상 총 22곳의 공공 건설공사 현장 중 우기 전 점검이 필요한... "
2026-07-13,네이버뉴스,[Hot Pick] 보보 '일체형 비데',https://www.kmecnews.co.kr/news/articleView.html?idxno=50793,"인한 안전사고가 빈번하게 발생하는 곳이다. 보보의 스마트 일체형비데는 이러한 욕실 내 안전사고에... 1군 건설사 현장에서 프리미엄 위생설비로 독보적인 입지를 다지고 있다. 이상헌 (주)VOVO 상무 ""욕실 위생 넘어... "
2026-07-13,네이버뉴스,건설현장 위험작업 중 휴대전화 사용 금지 추진…위반 시 최대 300만원 ...,https://www.geconomy.co.kr/news/article.html?no=321689,이번 개정안은 이러한 제도적 공백을 보완해 현장 내 안전사고를 줄이겠다는 취지다. 건설기술진흥법 개정안에는 건설사업자와 주택건설등록업자가 수립하는 안전관리계획에 휴대전화 사용 제한 등 근로자의 준수사항을... 
2026-07-13,네이버뉴스,서울시는 문제 없다지만…'또 성수대교' 불안한 시민들,https://news.tf.co.kr/read/life/2342412.htm,사고 당일 시민이 균열을 신고했지만 묵살한 사실이 알려져 도마에 올랐다. 이후 건설사와 서울시가 서로 책임을 떠넘겨 시민들의 안전 불안감이 증폭됐다. 마포구 망원동에 있는 성산대교는 성능개선공사를 마친 지... 
2026-07-12,네이버뉴스,지역기업 국제 표준기반 AI 경영시스템 잇따라 인증,https://www.ulsanpress.net/news/articleView.html?idxno=578985,에이치에이치에스는 산업현장 근로자의 심박수와 체온 등 생체신호를 실시간 분석해 안전사고를 예방하는... 팀솔루션은 AI 기반 건설·설비 디지털트윈과 모니터링 솔루션을 개발하는 기업이다. 이 회사는... 
2026-07-12,네이버뉴스,"펄펄 끓는 포항, ‘폭염 중대경보’에 전방위 총력전…시민 안전에 사활",https://www.ksmnews.co.kr/news/view.php?idx=613095,"이날 박용선 포항시장은 취약계층 밀착 보호 대책을 포함해 무더위쉼터 가동 현황, 건설 현장 등 야외... 인명 사고도 없는 안전한 포항을 만들어야 한다.”고 강조했다.포항시는 이번 무더위가 완전히 꺾일 때까지 24시간... "
2026-07-12,네이버뉴스,"남부발전, 산업안전보건공단과 ‘전력산업 산재예방 안전교육’ 맞손",https://www.busan.com/view/busan/view.php?code=2026071209114019599,"이를 위해 산재예방 현장 점검, 사고사례 교육, 안전보건 콘텐츠 배포 등을 통해 건설현장 유해·위험요인을 사전에 발굴하고 개선하는 데 역량을 강화할 계획이다. 김준동 남부발전 사장은 “안전보건공단과의 유기적인... "
2026-07-12,네이버뉴스,"통합특별시, 버스 정류장 도로 정비",http://www.jndn.com/article.php?aid=1783850081435937003,넘어지는 안전사고 위험이 증가한다. 통합특별시는 이번 사업에 고강도 포장재(개질아스콘)를 도입해 소성변형을 억제하고 대중교통 이용 환경을 개선할 방침이다. 신재욱 통합특별시 종합건설본부장은 “버스정류장... 
2026-07-12,네이버뉴스,"무안 일부 레미콘 공장, 골재·비산먼지 관리 허술",http://www.kjdaily.com/article.php?aid=1783849139682174008,"또한 레미콘은 학교, 아파트, 교량, 도로 등 건물 인프라 구축에 사용되는 뼈대로, 원자재 및 환경 관리 부실이 대형 안전사고로 이어질 수 있다는 우려가 커지고 있다. 건설 전문가들은 “레미콘 품질은 원자재 관리에서... "
2026-07-12,네이버뉴스,"전남광주통합특별시, '정류장 정비' 나서고... 청년 400명 선발",http://www.newsworker.co.kr/news/articleView.html?idxno=435926,"시민 안전사고 우려가 꾸준히 제기돼 왔다. 전남광주통합특별시는 개질아스콘 등 고강도 포장재를 적용해... 신재욱 종합건설본부장은 ""버스정류장 주변 도로 파손은 시민 안전과 직결된 문제""라며 ""주요 정류장을... "
2026-07-12,네이버뉴스,광주 버스정류장 주변 도로 정비 나선다,https://www.namdonews.com/news/articleView.html?idxno=916602,"넘어지는 안전사고 위험도 커질 수 있다. 통합특별시는 이번 사업에 고강도 포장재인 개질아스콘을 도입해 소성변형을 억제하고 대중교통 이용 환경을 끌어올릴 방침이다. 신재욱 시 종합건설본부장은 ""버스정류장 주변... "
2026-07-12,네이버뉴스,[내일의 날씨] 최고 37도·체감 35도 안팎 폭염 계속…14일 전국 20~60mm 비...,https://www.topstarnews.net/news/articleView.html?idxno=16132048,"강풍이 예상되는 지역에서는 간판, 비닐하우스, 공사장 가설물, 건설 장비 등 시설물 피해가 발생할 수 있어 미리 고정 상태를 점검해야 하며, 산지나 해안 절벽 인근에서는 강한 돌풍에 의한 안전사고에도 주의할... "
2026-07-13,네이버뉴스,"[인프라, 건설에서 교체로]①빠르게 늙는 대한민국 SOC…안전 위협 ‘경...",https://view.asiae.co.kr/article/2026070817544082956,"특히 기후 위기와 자연재해가 빈번해지면서 노후 인프라의 취약성은 더욱 두드러지고 있다. 지속적으로... 시설물은 준공 이후 유지관리를 받지만 예상치 못한 파손, 균열, 손상 등 중대 결함 건수 역시 해마다... "
2026-07-13,네이버뉴스,"[전문가 視覺] 폭염 안전, 그늘 한 뼘이 사람을 살린다",https://www.koscaj.com/news/articleView.html?idxno=325184,"2022년 대전 유성구의 한 건설현장에서 59세 하청 근로자가 폭염 속 콘크리트 타설 작업을 하다 열사병으로 사망했다. 2025년 6월, 대전지방법원은 이 사건에서 원청 대표이사에게 중대재해처벌법을 적용해 징역 1년에... "
2026-07-13,네이버뉴스,탁상행정·편법·꼼수로 얼룩진 '건설현장 안전관리',https://www.kmecnews.co.kr/news/articleView.html?idxno=50794,"중대재해처벌법 시행 이후 건설현장의 안전이 지속적으로 강조되고 있지만, 정작 건설현장에서는 법의 허점을 악용한 꼼수 탓에 제대로 된 현장 안전관리가 이뤄지지 않는 모순적 상황이 발생하고 있다. 지난 8일... "
2026-07-13,네이버뉴스,"""폭우와의 사투"" … 충남 지자체 '전방위 재난대응' 총력전",https://www.tournews21.com/news/articleView.html?idxno=138443,"활용해 건설현장과 산사태 위험지역, 하상주차장 등의 실시간 안전점검도 지시했다. 홍성군은 이번... 인명피해나 중대 사고 없이 위기를 넘겼다. 박정주 홍성군수는 ""자연재해보다 더 위험한 것은 대비하지 못한 인재... "
2026-07-12,네이버뉴스,"한보총 백은미 회장 “안전보건관리자, 명목상 선임 벗어나 실질적 역할...",http://www.beyondpost.co.kr/view.php?ud=202607122223304474be44c0aacd_30,"고용노동부 박윤경 산업안전기준과장은 “중대재해의 약 60%가 50인 미만 소규모 사업장에서 발생하는 만큼... 이어진 세션에서는 제조업, 건설업, 보건관리, 소규모 사업장 등 총 4개 영역의 주제 발표가 이뤄졌다. 첫... "
2026-07-12,네이버뉴스,인천 중처법 위반사건 4년여간 ‘100% 집행유예 선고’,https://www.kyeongin.com/article/1767179,"논의 중대재해처벌법(이하 중처법) 시행 이후 4년여간 인천에서 중처법을 위반해 기소된 사업주... 인천 중처법 1호 사건의 원청인 (주)시너지건설은 2014년, 2017년에 산업안전보건법 위반으로 유죄를 선고받았지만... "
2026-07-12,네이버뉴스,"계룡건설, 협력사와 중대재해 예방 맞손…안전경영 강화",https://www.ccdn.co.kr/news/articleView.html?idxno=1087914,한편 계룡건설은 올해 초 '중대재해 ZERO 선포식'을 개최한 데 이어 여름철 '2026 온열질환 ZERO 캠페인'을 추진하는 등 중대재해 예방과 안전한 근로환경 조성을 위한 활동을 이어가고 있다.
2026-07-12,네이버뉴스,‘중소기업 현장목소리를 정책으로’ 손종효 산단공 인천본부장,https://www.kyeongin.com/article/1767148,"최근 제조업계 전반에 중대재해처벌법에 대한 경각심과 인식은 크게 높아졌으나, 인천 산단에 밀집한 영세... 그는 “건설기술연구원과 협력해 산단 내 노후 공장의 샌드위치 패널 화재 예방을 위한 무료 시범 보강 사업도... "
2026-07-12,네이버뉴스,"[사설] 올해 첫 폭염중대경보, 철저한 대비태세 갖춰야",https://www.kyongbuk.co.kr/news/articleView.html?idxno=4078060,"폭염이 국민의 생명과 국가 경제를 위협하는 사회적 재난이자 중대재해가 되고 있다. 올해 폭염은... 폭염은 노약자와 어린이뿐 아니라 야외 노동자, 농어업 종사자, 건설현장 근로자의 생명을 직접 위협한다. 열사병과... "
2026-07-13,네이버뉴스,"정부, 이번 주 세제개편 초안 조율 마무리… 부동산 4대 변수 다가온다",https://www.betanews.net/article/view/beta202607110010,"기준을 어떻게 설계하느냐에 따라 실수요자까지 규제 대상에 포함될 수 있다는 우려도 함께 제기된다. ◆ PF 부실, 지표는 오히려 나빠졌다 건설업계의 뇌관인 프로젝트파이낸싱(PF) 부실도 다시 주목받고 있다.... "
2026-07-13,네이버뉴스,[전국 주요 신문 톱뉴스](13일 조간),https://www.yna.co.kr/view/AKR20260713010200011?input=1195m,"팹 건설 1기 완공 2년 앞당긴다 ▲ 매일일보 = 폭염發 '냉방경제' 재난 넘어 시장됐다 ▲ 서울신문 = 영유아... 주거 규제 완화 기대감 ▲ 경남일보 = ""회사 노력·지역 발전 덕에 낯선 곳이 제2의 고향으로"" ▲ 경북매일 = 6일... "
2026-07-13,네이버뉴스,"FDA, 해외 원료 제조망 등록 확대…미국 의약품 공급망 추적 강화",https://www.medicopharma.co.kr/news/articleView.html?idxno=68678,"PreCheck는 신규 제조시설이 가동되기 전부터 FDA와 시설 설계, 건설, 생산 준비 상태를 협의하도록 지원하는 프로그램이다. 시설 완공 후 문제를 확인하는 방식에서 설계와 준비 단계부터 규제기관이 관여하는 구조로... "
2026-07-13,네이버뉴스,"에코프로비엠, 인도네시아 니켈 투자로 전기차 150만대분 확보",https://news.bbsi.co.kr/news/articleView.html?idxno=4094588,"헝가리에 건설한 양극재 공장과 인도네시아 니켈을 연계해 유럽연합의 규제에 선제적으로 대응할 계획이며, 최근 기관투자자 설명회에서 유상증자 계획을 공개했습니다. 최문호 대표는 ""미국과 유럽 규제를... "
