date,source,title,link,description
2026-04-22,네이버뉴스,"SK하이닉스, 청주에 'AI 메모리' 핵심 기지 구축한다… P&T7 본격 착공",https://www.financialpost.co.kr/news/articleView.html?idxno=256396,회사는 22일 청주 테크노폴리스 산업단지에서 어드밴스드 패키징 전용 공장인 'P&T7' 착공식을 개최하고... 대규모 인프라 확충에 따른 지역 경제 파급 효과도 예상된다. 공사 기간 하루 평균 320명에서 최대 9000명의... 
2026-04-22,네이버뉴스,"경북도, '12조 규모' 핵심 도로·철도망 구축 나선다… 국비 확보 '총력...",https://www.eroun.net/news/articleView.html?idxno=78879,보상과 착공이 동시에 이뤄질 수 있도록 800억 원의 예산 반영을 촉구했다. 신공항 시대 대비… '하늘길' 여는 접근성 강화 나서 대구·경북 신공항의 성공적인 개항을 뒷받침할 연계 교통 인프라 확충안도 테이블에... 
2026-04-23,네이버뉴스,"롯데그룹, 창업주 고향 울산 개발도 접었다",https://dealsite.co.kr/articles/160589,"상권 규모와 수익성에 대한 우려가 이어졌고, 부동산 경기 변화와 공사비 상승 등 대외 환경도 악화했다.... 대암호 건설로 인해 실제 생가는 수몰됐지만 인근에 복원된 가옥과 롯데그룹 오너일가의 별장이 자리하고... "
2026-04-23,네이버뉴스,"""층간소음 전수검사·재시공"" …공사비 최대 1.87% 증가 전망",http://www.queen.co.kr/news/articleView.html?idxno=455609,공사비와 공사 기간 역시 건설사 입장에서는 중요한 변수다. 한국토지주택공사(LH) 토지주택연구원은 고성능 바닥충격음 저감 방안을 적용할 경우 분양주택 기준 아파트 공사비가 0.20%에서 최대 1.87%까지 증가할 수 있다고... 
2026-04-23,네이버뉴스,대내외 리스크 선제분석…성능 경쟁보다 활용 역량에 방점,https://www.dnews.co.kr/uhtml/view.jsp?idxno=202604220920577120147,"이승훈 건원엔지니어링 디지털혁신연구소장 건설현장‘정보 단절’ 문제 해소 사례 기반한 검증방식 정착... 최근 중동전쟁과 관련해 공사비 증가와 공기 연장 우려를 과거 사례와 판례, 계약 조건 등을 바탕으로 검토해... "
2026-04-23,네이버뉴스,[비즈 인사이트] AI 입은 건설 플랫폼…CM시장 진화 첨병,https://www.dnews.co.kr/uhtml/view.jsp?idxno=202604220917488440146,"건설 공사비 시뮬레이션 시스템 ‘KCOST’가 대표적이다. 설계 초기 단계에서 유사 프로젝트를 선별해 개략 공사비를 산정ㆍ비교하는 서비스다. 프로젝트마다 다른 공종 분류 기준을 자체 표준체계로 정리, 전체... "
2026-04-23,네이버뉴스,"전문건설협-건정연, 지역 건설산업 활성화를 위한 아이디어 공모전 시상...",https://www.dnews.co.kr/uhtml/view.jsp?idxno=202604221544053100276,지자체가 매년 실시하는 유지보수 공사 중 공사비 10억원 이하ㆍ단일 공종 공사에 대해 전문건설 전용 발주 트랙을 신설하는 대안을 제시했다. 대상에는 각각 300만원의 상금이 주어졌다. soo@
2026-04-23,네이버뉴스,"""층간소음 기준 미달 땐 재시공""…신축 아파트 입주 지연 우려",https://www.news1.kr/realestate/general/6144265,바닥충격음 강화에 공사비 최대 1.87%↑…분양가 압박 커져 공사비와 공기도 건설사 입장에서는 적지 않은 변수다. 한국토지주택공사(LH) 토지주택연구원은 고성능 바닥충격음 저감 방안을 적용할 경우 분양주택 기준... 
2026-04-23,네이버뉴스,공사비·미분양·일감난 삼중고…건설업계 '현실 공약' 절실,https://www.cctoday.co.kr/news/articleView.html?idxno=2229010,"한국건설기술연구원 공사비원가관리센터에 따르면 지난 2월 기준 건설공사비지수는 133.69로 역대 최고치를 기록했다. 같은 달 대전 미분양 주택은 1751세대로 전월보다 203세대, 13.1% 늘었다.고용지표도 좋지 않다.... "
2026-04-23,네이버뉴스,"공공주택, 느림보 꼬리표 뗀다… '부천대장' 공급 27개월 단축",https://www.mt.co.kr/estate/2026/04/23/2026042220082920042,"사업기간 연장이 고질적 문제로 지적되는 수도권 공공주택 건설사업에서 이례적으로 사업기간... 아울러 공사비 상승 등을 반영해 사업비도 증액됐다. 국토부와 LH는 최근 3기 신도시를 포함, 공공주택 공급속도... "
2026-04-23,네이버뉴스,"울산건설협회, 제29회 정기총회",https://www.ksilbo.co.kr/news/articleView.html?idxno=1054876,총회에서는 공사비 안전·혁신·상생으로 건설산업의 지속가능한 미래 실현을 골자로 한 2026회계연도 사업계획 및 예산(안) 결정의 건과 2025회계연도 수입·지출 결산 승인의 건을 의결했다.
2026-04-22,네이버뉴스,"건설업 폐업 12년만 최고....""전쟁 끝나도 고유가 영향""",http://www.yonhapnewstv.co.kr/MYH20260422225256Piy,"공사 계약에서 실제 집행까지 시차가 길어, 급등한 유가가 반영된 공사비 등으로 인해 건설업계 수익성은 계속 악화할 것으로 전망됩니다. 건설정책연구원 경제금융연구실장> ""유가 상승으로 인해 아스콘과... "
2026-04-22,네이버뉴스,"대한건설협회 울산시회, 건설산업 위기극복 앞장",http://www.ujeil.com/news/articleView.html?idxno=384685,"장홍수 회장은 개회사를 통해 ""현재 건설업계는 가파른 인건비 상승과 강화된 안전 규제로 인해 공사비 지수가 고점 상태를 유지하고 있으며 이는 지역 건설사들의 수익성 악화로 직결되고 있다""고 진단했다. 이어 ""중동... "
2026-04-22,네이버뉴스,'이러다 독박쓰면 어쩌나'…전쟁 탓에 신규 계약도 '올스톱',https://www.hankyung.com/article/2026042295181,중동 전쟁이 장기화하면서 건설·인테리어 시장에 ‘마감재 쇼크’가 덮쳤다. 나프타를 주원료로 하는 단열재·접착제 등 건자재 가격이 폭등하며 공사비 전반을 끌어올리고 있다. 원료 가격 상승분이 인테리어... 
2026-04-22,네이버뉴스,"""중동발 나프타 쇼크""… 건설현장 멈춤 '초읽기'",http://www.jeonmin.co.kr/news/articleView.html?idxno=438469,"건설공사비지수는 6개월 연속 상승세를 이어가고 있으며, 유가 상승까지 반영될 경우 추가 상승이 예상된다. 정부는 건설업계와 긴급 간담회를 열고 자재 수급 상황을 점검하는 등 대응책 마련에 착수했다. ""지금은 버티고... "
2026-04-22,네이버뉴스,불붙은 3기 신도시 분양…국평 7억 ‘내 집 마련 기회’,https://www.mk.co.kr/article/12019908,"왕숙아테라는 일패동 일원 지하 2층~지상 29층 7개동, 전용 59·74·84㎡ 총 812가구 규모로 금호건설이 시공한다. 2021년 762가구 사전청약 당시 평균 29.3 대 1의 경쟁률을 기록했다. 그동안 공사비가 오른 점을 반영하면... "
2026-04-22,네이버뉴스,"""적정공사비 확보·회원 권익보호""",https://www.ulsanpress.net/news/articleView.html?idxno=573876,"또한 울산의 건설산업이 인건비 상승과 강화된 안전 규제 등으로 수익성이 어려운 현실에 대해 회원들의 다양한 의견이 수렴됐다. 장홍수 회장은 ""울산협회는 적정 공사비 확보와 더불어 회원사의 권익 보호를... "
2026-04-22,네이버뉴스,"대구시의회, 공공심야약국 확대 건의안 채택…제324회 임시회 돌입",https://www.polinews.co.kr/news/articleView.html?idxno=729255,조경구 의원은 「대구광역시 건설신기술 연구·개발 및 활용 촉진 조례 일부개정조례안」을 통해 공공 건설공사에서 신기술 적용 가능성 사전 검토와 연간 공사비의 3% 이상을 신기술 활용에 투입할 수 있는 근거를... 
2026-04-22,네이버뉴스,"아이에스티이, 폐플라스틱 열분해 플랜트 EPC 수주… 에너지 밸류체인 ...",https://www.venturesquare.net/1077651/,"플랜트 건설 사업을 수주하며 친환경 에너지 분야에서의 사업 확장에 나섰다. 회사는 금강이엔티와... 이번 프로젝트는 하루 120톤 규모의 연속식 열분해 설비를 적용하는 상업용 플랜트로, 총 공사비는 약 235억 원이다.... "
2026-04-22,네이버뉴스,"‘용인 플랫폼시티 라온프라이빗 아르디에’, 무순위·임의 공급 청약",https://www.mk.co.kr/article/12024465,"아스팔트 등 석유화학 자재 비중이 높아 유가 상승이 공사비로 이어진다. 한국건설산업연구원에 따르면 유가가 10% 상승할 경우, 건설 생산비용은 약 0.21% 증가하는 것으로 알려졌다. 이에 따라 향후 분양가 상승은... "
2026-04-22,네이버뉴스,[데스크시각] 중동사태 나비효과의 위력,http://www.kookje.co.kr/news2011/asp/newsbody.asp?code=1700&key=20260423.22018006537,"건설현장도 위기에 직면해 있다. 아스콘이 필요한 도로 조성 및 보수 공사는 벌써부터 중단된 곳이 속출한다. 일부 아파트 건립 현장에는 이미 ‘원자재 수급 차질이 우려된다’는 공문이 도착하는 등 공기 지연, 공사비... "
2026-04-22,네이버뉴스,"비용 반영 더딘 건설 현장…""유가 내려도 공사비는 뛴다""",https://www.ccdn.co.kr/news/articleView.html?idxno=1075014,공급계약 갱신 주기와 현장 집행구조를 비롯한 요인으로 유가가 떨어져도 공사비가 곧바로 낮아지지 않는다. 건설공사는 계약에서 실제 집행까지 시차가 길어 유가가 올랐을 때 비용 반영은 늦게 나타난다. 반대로 유가... 
2026-04-22,네이버뉴스,전쟁끝나도 건설업계는 후유증 앓아,http://www.jjn.co.kr/news/articleView.html?idxno=1039023,"공사비 상승은 곧바로 건설업체의 수익성 악화로 이어질 가능성이 농후한데다, 이미 고금리와 PF 부담, 누적된 공사비 상승, 지방 부동산시장 부진 등으로 채산성이 악화된 것도 사실이다. 이 같은 상황에서 전쟁 이후... "
2026-04-22,네이버뉴스,"[위클리오늘] 대구시의회, 복지·환경·산업 전방위 정책 드라이브",http://www.weeklytoday.com/news/articleView.html?idxno=772379,"개정안에는 공공공사 설계 단계에서 신기술 적용 여부를 사전 검토하고, 공사비 일부를 신기술 활용에 의무적으로 반영하는 내용이 포함돼 지역 건설산업 경쟁력 강화가 기대된다. 환경 정책도 함께 추진된다. 허시영... "
2026-04-22,네이버뉴스,"[사설] 신현송 한은 총재, 정부와 '위기 방파제' 쌓으라",http://www.fnnews.com/news/202604221823353833,"석유화학업체들은 공장 가동을 줄이고 있고, 건설사들은 주택사업과 관련된 공사비 원가 상승과 공기 지연 가능성을 알리는 공문을 발송하고 있다. 정유 과정의 부산물로 나오는 아스팔트 가격이 크게 오르면서... "
2026-04-22,네이버뉴스,"전건협 서울·인천·경기·강원 4개 시·도회, 중동상황 대응 합동 간담...",https://www.koscaj.com/news/articleView.html?idxno=323735,국토교통부 주관으로 열린 이번 간담회는 중동전쟁 장기화에 따른 건설자재 수급 불안과 공사비 상승 등 지역 건설업계의 애로사항을 점검하고 경영위기 극복 지원 방안을 논의하기 위해 마련됐다. 간담회에는 김윤덕... 
2026-04-22,네이버뉴스,“학교 화장실 공사 맡기겠다”… 선입금 유도 피싱 주의보,https://www.joongdo.co.kr/web/view.php?key=20260422010006950,상대는 자재비 명목으로 1000여 만 원을 먼저 입금하면 전체 4000만 원 가량의 공사비를 받을 수 있다고... 대전에서 이처럼 학교나 공공기관을 사칭해 인테리어업자나 소규모 건설업자를 노리는 피싱 범죄가 이어지고 있다.... 
2026-04-22,네이버뉴스,[아유경제_헤드라인][200회 특집] 재초환ㆍ분상제ㆍ장특공 '3대 리스크'...,http://www.areyou.co.kr/news/articleView.html?idxno=93489,분양가가 제한된 상황에서 공사비와 자재비는 상승세를 이어가고 있어 조합과 건설사 모두 수익성 확보에 어려움을 겪는 구조가 형성되고 있다. 이에 따라 일부 사업에서는 일정 조정이나 전략 변경 가능성도 제기된다.... 
2026-04-22,네이버뉴스,중동 리스크에 분양가 상승 압력…가격 경쟁력 단지로 수요 이동,http://www.lkp.news/news/articleView.html?idxno=79474,"또한 아스팔트 등 석유화학 자재 비중이 높아 유가 상승이 공사비로 이어진다. 한국건설산업연구원에 따르면 유가가 10% 상승할 경우, 건설 생산비용은 약 0.21% 증가하는 것으로 알려졌다. 이에 따라 향후 분양가... "
2026-04-22,네이버뉴스,"벼랑 끝 서희건설, '가족 경영' 고수···상장심사 막판 변수로",https://www.sisajournal-e.com/news/articleView.html?idxno=420650,경기 용인 보평역 서희스타힐스 리버파크 사업과 관련해 서희건설 전 부사장이 공사비 증액 대가로 13억7500만원을 수수한 혐의로 구속됐다. 횡령액은 2024년 별도 기준 자기자본(1조164억원)의 0.14% 수준으로 전액 회수된... 
2026-04-22,네이버뉴스,성남 수광선 도촌야탑역 제외 논란…성남시 “배제사실 없어”,https://www.kyeonggi.com/article/20260422580467,복선전철 건설사업(이하 수광선) 2·3공구 우선 착공 구간에 대해 실시계획 인가 고시를 냈다. 수광선은 서울 수서역을 출발해 성남 모란을 거쳐 경기 광주역을 잇는 19.4㎞ 노선이다. 예상 공사비는 1조1천여억원... 
2026-04-22,네이버뉴스,강화군 주문~아차 연도교 건설 탄력 받나,https://www.siminilbo.co.kr/news/newsview.php?ncode=1160294375667882,해상교량 사업의 총사업비는 657억 원으로 연도교는 550m 길이의 2차선으로 건설되며 2031년 완공이 목표다. 해당 사업은 2022년 총사업비 300억 원 규모로 조건부 승인을 받은 바 있다. 이번 사업비 증액은 공사비 상승과... 
2026-04-22,네이버뉴스,"대한건설협회 대전시회, 제35회 정기총회 개최",http://www.ccnnews.co.kr/news/articleView.html?idxno=408235,"올해 중점 추진 사업으로 ◇지역 건설투자를 통한 물량 확보 ◇적정공기 및 적정공사비 확보 ◇ 공정한 시장질서 확립 및 지역경쟁력 강화 ◇회원사 경영역량 제고 등 4대 중점과제를 설정하였다. 최문규 회장은 ""최근... "
2026-04-22,네이버뉴스,인천 주문도~아차도 해상교량 건설…657억 투입 2031년 완공,https://www.newspim.com/news/view/20260422001054,교량을 건설하는 것으로 2031년까지 모두 657억원이 투입된다. 앞서 강화군은 지난 2022년 중앙투자심사에서 총사업비 300억원 규모로 조건부 승인을 받았으나 실시설계 과정에서 공사비가 늘어나 이번에 재심사를 받았다.... 
2026-04-22,네이버뉴스,"파라다이스, 인바운드 타고 캐파 투자 가속...재무 안정성 '뚜렷'",https://www.bloter.net/news/articleView.html?idxno=660276,지난해 말 기준 건설중인자산에는 장충동 관련 공사비 325억원이 집행됐다. 총 공사비는 5000억원대 중반 규모로 알려졌다. 투자 사이클 속 유동성 방정식 대규모 투자가 이어지고 있지만 당장의 유동성에는 큰... 
2026-04-22,네이버뉴스,강화 주문도~아차도 연도교 건설 본격화,https://www.kyeonggi.com/article/20260422580327,"사업비 증액은 건설공사비 상승과 도서지역 특수성, 해상공사 여건 등이 반영된 결과다. 군은 이 과정에서 관광 활성화와 민원 최소화, 국비 확보 노력 등 기존 조건부 사항도 단계적으로 이행해 왔다. 연도교를 다... "
2026-04-22,네이버뉴스,"아이에스티이, 폐플라스틱 열분해 플랜트 계약 체결",https://www.gasnews.com/news/articleView.html?idxno=124828,"플랜트' 건설사업에 대한 턴키(EPC) 계약을 체결했다고 밝혔다. 이번 사업은 폐플라스틱을 원료로 활용해 재생유를 생산하는 상업용 플랜트 구축 프로젝트로, 하루 120톤 규모의 연속식 열분해 설비를 적용한다. 총 공사비는... "
2026-04-22,네이버뉴스,강화 ‘주문도∼아차도 연도교’ 행안부 투자심사 통과…2031년 완공,https://news.kbs.co.kr/news/pc/view/view.do?ncd=8542786&ref=A,"2031년까지 건설하는 것입니다. 강화군은 2022년 중앙투자심사에서 전체 사업비 300억 원 규모로 조건부 승인을 받았으며, 실시설계 과정에서 공사비를 다시 산정해 재심사를 받았습니다. 주문도와 아차도를 잇는 연도교가... "
2026-04-23,네이버뉴스,"트럼프, 이란 휴전 연장 선언…2차 협상은 끝내 불발",https://www.sedaily.com/article/20035989?ref=naver,■ 미-이란 전쟁 장기화와 유가 지정학 리스크: 트럼프 대통령의 전격 휴전 연장 선언에도 이란 내 강경파... 추가 건설하는 쌍둥이 팹 전략을 가동하며 단일 팹 건설비만 80조 원인 점을 감안해 총 160조 원 이상을... 
2026-04-23,네이버뉴스,코스피 6400 돌파…이틀 연속 사상 최고,https://www.sedaily.com/article/20035981?ref=naver,팹 건설에 총 160조 원 이상을 투입한다. 글로벌 메모리 공급이 내년까지도 수요의 60% 수준에 그칠... 증권가는 지정학적 리스크 해소가 불투명하지만 실적 개선 기대 업종을 중심으로 순환매 장세가 지속될... 
2026-04-23,네이버뉴스,[경영분석] 2025년도 가스연소기기 관련 기업 - 가정용보일러사 경동나...,https://www.gasnews.com/news/articleView.html?idxno=124810,"국내 가정용보일러 제조사들의 지난해 경영실적은 어려운 건설 경기에도 불구하고 선방한 것으로... 대성쎌틱에너시스 관계자는 ""지난해 재무실적 악화는 글로벌 사업에서 발생한 리스크를 선제적으로 반영하는... "
2026-04-23,네이버뉴스,중동 리스크에 내수·수출·투자 '트리플 부진',https://www.newspim.com/news/view/20260423000042,"비제조업 역시 여가·숙박 및 외식(123.1), 도·소매(107.8)를 제외한 전기·가스·수도(58.8), 건설(72.5), 운수·창고(75.0), 정보통신(86.7), 전문서비스(92.3) 등 다수 업종에서 부정 전망이 우세했다. 한경협은 중동 분쟁... "
2026-04-23,네이버뉴스,비트코인 강세 지수 '중립'...고래들은 '매집' 지속,http://coinreaders.com/232312,지수가 50에 도달했다는 것은 시장을 구성하는 주요 조건 중 절반가량이 다시 건설적인 방향으로... 다만 과거의 실패 사례가 있는 만큼 돌발적인 변동성에 대비한 리스크 관리도 병행되어야 한다는 조언이 우세하다.... 
2026-04-23,네이버뉴스,"부품을 만드는 나라, 돈의 길을 설계하는 나라",https://www.ohmynews.com/NWS_Web/View/at_pg.aspx?CNTN_CD=A0003227310&CMPT_CD=P0010&utm_source=naver&utm_medium=newsearch&utm_campaign=naver_news,"세계 각국에서 시작된 탈달러화는 이제 중앙은행들의 리스크 관리 전략으로 명시화되는 추세입니다.... 에디 유 총재는 ""스테이블코인이 실물 경제의 페인 포인트(Pain Point)를 해결하는 건설적 역할을 하는... "
2026-04-23,네이버뉴스,"KRWQ ""당국 규제권 밖 NDF시장, 원화 스테이블코인 온체인화가 대안""",http://www.edaily.co.kr/news/newspath.asp?newsid=02542006645419072,시스템 리스크에 대해 규제당국이 어떤 시각을 갖는지 직접 이해하고 있다. 민병덕 더불어민주당 의원이... 저희는 성과와 규제와의 건설적 협력을 통해 그 역할을 스스로 증명해 나가고자 한다. -디지털자산 시장에서... 
2026-04-23,네이버뉴스,2219조 원 '꿈의 군대' 쏜다… 트럼프발 국방 예산 쇼크와 방산주의 운명,https://www.g-enews.com/view.php?ud=202604230655592143fbbec65dfb_1,"셋째, 지정학적 리스크 강도다. 중동과 우크라이나 전선에서 소모되는 유도 무기 재고 현황을... 그러나 의회라는 정치적 벽과 방산 업체의 생산 한계라는 두 가지 난관이 '꿈의 군대' 건설 프로젝트의 최종 성패를... "
2026-04-23,네이버뉴스,[데스크 칼럼] 공인중개사를 위한 변명,https://www.pinpointnews.co.kr/news/articleView.html?idxno=447708,"조철현 부국장(건설부동산부장) 아침마다 동네 골목에서 주민들과 인사를 나누고, 생활 밀착형 정보를 전하던... 공인중개사는 시장을 교란하거나 가격을 조작하는 세력이 아니라, 복잡한 이해관계와 법적 리스크를... "
2026-04-23,네이버뉴스,[핀셋+] [한림건설] 건설사 아닌 자산운용사?…이자수익으로 메꾼 분양...,https://dealsite.co.kr/articles/160201,"② 블루원·계열사 대여금만 4400억원, 미국 골프장 인수까지…영업손실에도 순익 흑자 한림건설이 본업인... 구조는 리스크 요인으로 지목된다. 골프장 자산은 경기 변동에 민감하고 유동성이 낮은 만큼, 향후 회수... "
2026-04-23,네이버뉴스,"[반도체 强대强] ③HBM 1위 SK하이닉스, 삼성전자 추격 속 선두 지킬까",https://www.fetv.co.kr/news/articleView.html?idxno=300936,또 이번달 22일 청주에 19조원을 들여 건설하는 어드밴스드 패키징 공정인 'P&T 7' 팹 착공식을 진행하며 D램... 여기에 HBM 중심 전략에 따른 리스크 관리도 중요 과제로 꼽힌다. 특정 제품 혹은 고객사에 대한 의존도가... 
2026-04-23,네이버뉴스,"[N2 모닝 경제 브리핑-4월 23일] 美증시, 중동 긴장 완화에 ‘사상 최고...",https://www.news2day.co.kr/article/20260423500011,지정학적 리스크를 충분히 소화한 시장은 위험자산 선호 경향을 더욱 뚜렷하게 보였다. 이러한 협상... 팹 건설계획 - 핑거(163730) : 300억원 규모 신주인사권부사채(BW) 발행 결정 - 달바글로벌(483650) : 200억원... 
2026-04-23,네이버뉴스,李 대통령 베트남 순방…고속철도ㆍ신도시 사업 수주 기대,https://www.dnews.co.kr/uhtml/view.jsp?idxno=202604221328082410219,"지정학적 리스크 확대로 제2의 중동 붐을 노리던 건설업계의 시름이 깊어지는 상황에서, 빠른 경제 성장을 바탕으로 인프라 투자를 늘리고 있는 베트남에서의 초대형 프로젝트 수주는 업계에 가뭄 속 단비가 될... "
2026-04-23,네이버뉴스,"부동산 PF사업, 중동전쟁發 공기연장 논의 본격화",https://www.dnews.co.kr/uhtml/view.jsp?idxno=202604221541487190274,가능한 리스크로 남아있기 때문이다. 일각에서는 현재 최장 90일을 벗어날 수 없도록 설정된 PF사업 모범규준의 책임준공 연장기간을 ‘90일+α’로 확대해야 한다는 목소리도 나온다. 서울지역 소재 C건설사 관계자는... 
2026-04-23,네이버뉴스,"인구 떠난 자리, 미분양만 남았다…광주ㆍ울산 ‘이중 악순환’ 고착",https://www.dnews.co.kr/uhtml/view.jsp?idxno=202604221400371470228,"미반환 리스크로 이어지는 양상도 나타난다. 청년의 수도권 집중이 비수도권 주택 수요의 질적 기반을 허물어, 현재뿐 아니라 10~15년 후의 구조적 수요 전망치 자체를 하향시킨다는 분석이다. 대형 건설사 부동산... "
2026-04-23,네이버뉴스,중동 악재에 기업 경기심리 악화 지속…두 달 연속 하락,https://biz.heraldcorp.com/article/10723301?ref=naver,중동 사태에 따른 글로벌 지정학적 리스크 여파로 상당수 업종이 부진할 것으로 예상되는 가운데 유가... 대안으로는 ▷건설 소재 등 해외 대체재 발굴 ▷신속한 대체재 인증 승인 ▷나프타 등 산업 기초원료 수입... 
2026-04-23,네이버뉴스,중동 리스크에 얼어붙은 기업 경기전망…제조업·비제조업 동반 부진,https://www.etoday.co.kr/news/view/2578111,비제조업의 경우 △여가·숙박 및 외식(123.1) △도·소매(107.8)는 호조 전망을 보였으나 △전기·가스·수도(58.8) △건설(72.5) △운수 및 창고(75.0) △정보통신(86.7) △전문·과학·기술 및 사업지원서비스(92.3)는... 
2026-04-23,네이버뉴스,1분기 '깜짝 반등'에도 웃지 못하는 'K-철강',https://www.newsway.co.kr/news/view?ud=2026042216383927374,"지난 1분기에는 중동 전쟁 리스크로 철광석 등 원재료 가격과 환율 상승, 운임료 인상으로 원가 부담이... 국내 철강업의 경우 건설·자동차·조선업에 대한 의존도가 높은데, 이중 수요의 약 40% 비중을 차지하는 건설... "
2026-04-23,네이버뉴스,중동쇼크 휘청이는 기업…금융위 앞장서 유동성 혈 뚫는다[성장엔진 금...,https://www.news1.kr/finance/general-finance/6145577,"금융당국은 중동 리스크로 직격탄을 맞은 석유화학을 시작으로 건설, 철강업계로 이어지는 '릴레이 간담회'를 이어갔다. 지난 8일에는 건설산업 관련 범정부 협력 강화를 위해 김민석 총리 주재로 금융위와 국토부... "
