date,source,title,link,description
2026-04-14,네이버뉴스,"""유럽 전력망 공략 본격화""…삼성물산, 히타치 에너지와 협력 확대",https://www.hankyung.com/article/2026041487166,삼성물산 건설부문은 14일 스위스 취리히에서 히타치 에너지와 유럽 지역 전력망 사업 협력에 대한 업무협약(MOU)을 맺었다. 양사는 공동 전략과 로드맵을 수립한다. 프로젝트 파이프라인 구축도 추진한다. 협력 범위가... 
2026-04-14,네이버뉴스,"삼성물산 건설부문, 유럽 전력망 시장 공략..히타치 에너지와 협약",https://kpenews.com/View.aspx?No=4040635,한국정경신문 이진성 기­자 jinlee@g.skku.edu [한국정경신문=이진성 기자] 삼성물산 건설부문이 본격적인 유럽 전력망 시장 공략에 나선다.삼성물산은 지난 13일 스위스 취리히에 위치한 히타치 에너지(Hitachi Energy)... 
2026-04-14,네이버뉴스,삼성가·현대가 '아시아 20대 부호 패밀리' 등극...자산 얼마이길래?,https://economist.co.kr/article/view/ecn202604140002,"이재용 회장은 3월 말 기준으로 삼성전자, 삼성물산 등의 보유 주식 가치가 30조9414억원으로 집계되고... 이어 현대차그룹이 한국 새만금에 9조원을 투자해 AI 데이터센터, 로봇 공장, 수소 플랜트를 건설할... "
2026-04-14,네이버뉴스,"전력거래소, 한국형 전력계통 글로벌 상용화 추진",http://www.ikld.kr/news/articleView.html?idxno=332786,전력거래소(이사장 직무대행 김홍근)는 지난 13일 삼성물산 건설부문(이하 삼성물산)과 전력계통운영시스템(EMS) 기술의 신규 응용기술 개발·실증 및 해외시장 공동 진출을 위한 업무협약(MOU)을 체결했다.... 
2026-04-14,네이버뉴스,"DL이앤씨, '아크로 리버스카이' 5월 분양…노량진뉴타운 핵심 입지 주목",http://www.biztribune.co.kr/news/articleView.html?idxno=352358,'아크로 리버스카이' 단지 투시도 | DL이앤씨 DL이앤씨는 5월 중 서울 동작구 대방동 23-61번지 일원 노량진8재정비촉진구역 주택재개발 정비사업을 통해 '아크로 리버스카이'를 분양할 예정이라고 14일 밝혔다. 아크로... 
2026-04-14,네이버뉴스,"DL이앤씨, 아크로 리버스카이 내달 분양 예정",https://www.arunews.com/news/articleView.html?idxno=61558,DL이앤씨가 5월 중 서울 동작구 대방동 23-61번지 일원 노량진8재정비촉진구역 주택재개발 정비사업을 통해 '아크로 리버스카이'를 분양할 예정이라고 14일 밝혔다. 아크로 리버스카이는 지하4~지상29층 10개동... 
2026-04-14,네이버뉴스,"GS건설, 신소재 복합 기술로 교량용 PC 바닥판 실증 완료…모듈러 인프...",https://www.newsinside.kr/news/articleView.html?idxno=4593173,"현재 현대엔지니어링이 조립식 교각 시스템을 선보이고 DL이앤씨가 조립식 하중 전달 기술을 도입하는 등 모듈러 교량 기술 경쟁이 치열해진 상황에서, 기존 공법의 고질적 한계를 극복한 GS건설의 차별화된 승부수가... "
2026-04-14,네이버뉴스,재개발 조합이 요구한 브랜드 거절로 1조 시공권 해지당한 건설사,https://realty.chosun.com/site/data/html_dir/2026/04/14/2026041402594.html,상대원2구역 재개발 조합 측이 요구한 하이엔드 브랜드 ’아크로’ 적용을 거절했다가 갈등에 빠졌던 DL이앤씨가 결국 9800억원대 시공권을 잃게 됐다. 조합이 총회를 열고 투표로 DL이앤씨와의 계약을 해지하는... 
2026-04-14,네이버뉴스,'불법 촬영' 논란 휩싸인 DL이앤씨…압구정5·성수2 수주전 변수되나,https://www.socialvalue.kr/news/view/1065587093591519,"▲서울시 강남구 압구정5구역 조감도/사진=서울시 제공  DL이앤씨가 최근 경기 성남시 상대원2구역 시공사 지위 해지 문제로 논란의 중심에 선 가운데, 압구정5구역 재건축 입찰 과정에서의 불법 촬영 의혹까지 불거지며... "
2026-04-14,네이버뉴스,"DL이앤씨, 노량진8재정비촉진구역 '아크로 리버스카이' 5월 분양 예정",http://www.techholic.co.kr/news/articleView.html?idxno=220790,"DL이앤씨는 5월 중 서울 동작구 대방동 23-61번지 일원 노량진8재정비촉진구역 주택재개발 정비사업을 통해 지하 4층~지상 29층, 10개 동, 전용면적 36~140㎡ 총 987가구로 조성되는 '아크로 리버스카이'를 분양할... "
2026-04-14,네이버뉴스,"DL이앤씨, 노량진8구역 '아크로 리버스카이' 5월 분양한다",https://www.public25.com/news/articleView.html?idxno=44107,"퍼블릭타임스=DL이앤씨는 5월 중 서울 동작구 대방동 23-61번지 일원 노량진8재정비촉진구역 주택재개발 정비사업을 통해 '아크로 리버스카이' 285가구를 일반분양한다고 14일 밝혔다. 지하 4층~지상 29층, 10개 동... "
2026-04-14,네이버뉴스,"서울 노량진 8구역 '아크로 리버스카이' 5월 일반 분양, 285세대규모",https://www.businesspost.co.kr/BP?command=article_view&num=435648,DL이앤씨 > 노량진 8구역의 '아크로 리버스카이'가 5월 분양에 돌입한다. DL이앤씨는 오는 5월 서울 동작구 대방동 23-61번지 일원 노량진 8 재정비촉진구역 주택재개발 정비사업을 통해 '아크로 리버스카이'를... 
2026-04-14,네이버뉴스,흔들리는 건설업…대형사도 '감원 칼바람',https://www.bigtanews.co.kr/article/view/big202604140006,"DL이앤씨는 착공 현장이 크게 줄면서 지난 한 해 동안 전체 인력의 14% 가량이 감소했고, 현대엔지니어링도 지난해 말 합병 이후 처음으로 희망퇴직을 실시했다. 시공능력 기준 상위 10대 건설사 가운데 올해 1분기에... "
2026-04-14,네이버뉴스,"법정으로 간 상대원2구역 재개발 사업...조합, DL이앤씨에 계약 해지 통...",https://www.livebiz.today/news/articleView.html?idxno=201582,경기도 성남시 상대원2구역 재개발 사업을 놓고 시공사인 DL이앤씨와 재개발이 벌이는 다툼이 결국 법정에서 시비를 가리게 됐다. 조합이 DL이앤씨에 계약 해지를 통보하자 DL이앤씨가 법적 소송을 예고하고 나선 것.... 
2026-04-14,네이버뉴스,"건설업계 구조조정 칼바람 시작되나...롯데건설, 희망퇴직 첫 테이프",https://www.livebiz.today/news/articleView.html?idxno=201583,지난해 태영건설·포스코이앤씨·DL이앤씨·현대엔지니어링이 인력이나 조직을 축소한 데 이어 올들어 처음으로 롯데건설이 희망퇴직에 나선 것. 업계 안팎에서는 올해 롯데건설을 시작으로 건설업계의 고용 축소 바람이... 
2026-04-14,네이버뉴스,"DL이앤씨, '아크로 리버스카이' 5월 분양 예정",https://www.upkoreanews.kr/news/articleView.html?idxno=98001,"사진=DL이앤씨 DL이앤씨는 5월 중 서울 동작구 대방동 일원 노량진8재정비촉진구역 주택재개발 정비사업을 통해 '아크로 리버스카이'를 분양할 예정이라고 14일 밝혔다. 아크로 리버스카이는 지하 4층~지상 29층, 10개 동... "
2026-04-14,네이버뉴스,여의도 두 정거장 노량진뉴타운…‘아크로 리버스카이’ 5월 분양,https://www.sedaily.com/article/20032235?ref=naver,DL이앤씨(375500)가 서울 동작구 노량진뉴타운에 하이엔드 브랜드 ‘아크로 리버스카이’를 5월 중 분양한다. DL이앤씨는 14일 서울 동작구 대방동 노량진8재정비촉진구역에 ‘아크로 리버스카이’를 공급한다고... 
2026-04-14,네이버뉴스,"상대원2구역 재개발, 전 조합장 수사에 시공사 공백까지 겹쳐",https://www.g-enews.com/view.php?ud=202604141135545829514e0091f6_1,14일 도시정비업계에 따르면 상대원2구역 재개발사업조합은 지난 11일 조합원 총회를 열고 기존 시공사인 DL이앤씨와의 공사도급계약 해지 안건을 가결했다. 이에 따라 DL이앤씨는 지난 2015년 10월 상대원2구역을 수주한... 
2026-04-14,네이버뉴스,"성남 상대원2구역, DL이앤씨와 결별에도 GS건설 선정 불발...시공사 공백...",http://www.newsworker.co.kr/news/articleView.html?idxno=421836,"지난 11일 총회에서는 DL이앤씨 계약 해지안이 가결됐다. 조합원 2269명 가운데 1205명이 참석했고, 계약 해지안에 1101명이 찬성했다. GS건설 시공사 선정 안건은 현장 직접 참석자 과반 요건에 미달해 표결이 성립하지... "
2026-04-14,네이버뉴스,"[분양 뉴스브리핑] DL이앤씨, 아크로 리버스카이 5월 분양",https://www.asiatime.co.kr/article/20260414500215,"'아크로 리버스카이' 단지 투시도.(사진=DL이앤씨) DL이앤씨, 아크로 리버스카이 5월 분양 DL이앤씨는 5월 중 서울 동작구 대방동 23-61번지 일원 노량진8재정비촉진구역 주택재개발 정비사업을 통해 아크로... "
2026-04-14,네이버뉴스,"DL이앤씨, 노량진 '아크로 리버스카이' 5월 분양 예정",https://news.tf.co.kr/read/economy/2312886.htm,총 987가구 중 285가구 일반분양 DL이앤씨는 다음달 서울 동작구 대방동 23-61번지 일원 노량진8재정비촉진구역 주택재개발 정비사업을 통해 '아크로 리버스카이'를 분양할 예정이라고 14일 밝혔다. 아크로... 
2026-04-14,네이버뉴스,"DL이앤씨, '아크로 리버스카이' 5월 분양",https://www.pinpointnews.co.kr/news/articleView.html?idxno=445335,"DL이앤씨 제공. DL이앤씨가 서울 동작구 대방동 노량진8재정비촉진구역에서 '아크로 리버스카이'를 오는 5월 선보일 예정이다. 단지는 지하 4층~지상 29층, 10개 동, 총 987가구 규모로 조성되며 이 중 285가구가 일반분양된다.... "
2026-04-14,네이버뉴스,"노량진6구역 다음은 8구역, '아크로 리버스카이' 내달 분양",https://news.bizwatch.co.kr/article/real_estate/2026/04/14/0011,"DL이앤씨는 내달 중 서울 동작구 대방동 23-61 일원 노량진8재정비촉진구역 주택재개발 정비사업을 통해 '아크로 리버스카이'를 분양할 예정이라고 14일 밝혔다. 아크로 리버스카이는 지하 4층~지상 29층, 10개동... "
2026-04-14,네이버뉴스,"DL이앤씨, 상대원2구역 계약 해지 통보 받아…법적 대응 나선다",https://mdtoday.co.kr/news/view/1065572278458822,▲ (사진=DL이앤씨) 경기 성남시 상대원2구역 주택재개발 정비사업조합이 기존 시공사인 DL이앤씨와의 공사도급계약을 공식 해지했다. 이번 결정으로 대규모 정비사업을 둘러싼 조합과 시공사 간의 갈등이 법적... 
2026-04-14,네이버뉴스,"DL이앤씨, 노량진8구역 재개발 ‘아크로 리버스카이’ 5월 분양",http://www.lawissue.co.kr/view.php?ud=20260414102929681567191f6c6e_12,"DL이앤씨는 오는 5월 중 서울 동작구 대방동 23-61번지 일원 노량진8재정비촉진구역 재개발사업을 통해 ‘아크로 리버스카이’를 분양할 예정이라고 14일 밝혔다. 단지는 지하 4층~지상 29층, 10개동, 전용면적 36~140... "
2026-04-14,네이버뉴스,"DL이앤씨, 노량진뉴타운 ‘아크로 리버스카이’ 5월 분양",https://www.viva100.com/article/20260414500433,"DL이앤씨는 서울 동작구 대방동 23-61번지 일원에 ‘아크로 리버스카이’를 5월 중 분양할 예정이라고 14일 밝혔다. 해당 단지는 노량진8재정비촉진구역 주택재개발 정비사업을 통해 공급되며, 지하 4층~지상 29층... "
2026-04-14,네이버뉴스,[건설사리포트]상품성 높인 '한화포레나 제주에듀시티' 재분양ㆍDL이앤...,https://www.ebn.co.kr/news/articleView.html?idxno=1705346,"◆DL이앤씨, '아크로 리버스카이' 5월 분양 DL이앤씨가 서울 동작구 노량진뉴타운에 하이엔드 브랜드 아파트 '아크로 리버스카이'를 5월 분양할 예정이다. 교통과 교육, 생활 인프라를 갖춘 입지를 바탕으로 서남권 핵심... "
2026-04-14,네이버뉴스,노량진 뉴타운에 들어서는 아크로…'아크로 리버스카이' 5월 분양,https://www.mt.co.kr/estate/2026/04/14/2026041409334956786,"DL이앤씨는 다음달 서울 동작구 대방동 23-61번지 일원 노량진8재정비촉진구역 주택재개발 정비사업을 통해 '아크로 리버스카이'를 분양한다. 14일 DL이앤씨에 따르면 아크로 리버스카이는 지하 4층~지상 29층, 10개 동... "
2026-04-14,네이버뉴스,"청약 흥행한 ‘아크로 드 서초’, ‘아크로 서초’로 단지명 변경",http://www.edaily.co.kr/news/newspath.asp?newsid=03076646645416120,아크로 드 서초 단지 투시도 (사진=DL이앤씨) 14일 정비업계에 따르면 서초 신동아아파트 재건축 조합은 지난 4일 조합 정기총회를 열고 단지명을 ‘아크로 드 서초’에서 ‘아크로 서초’로 아파트 명칭을 변경했다.... 
2026-04-14,네이버뉴스,"DL이앤씨, 아크로 리버스카이 987가구 5월 분양",https://www.inthenews.co.kr/news/article.html?no=85547,노량진뉴타운 9200가구 조성 하이엔드 커뮤니티 특화 설계 인더뉴스 제해영 기자ㅣDL이앤씨는 오는 5월 중 서울 동작구 대방동 노량진8재정비촉진구역에서 ‘아크로 리버스카이’를 분양할 예정이라고 14일 밝혔습니다.... 
2026-04-14,네이버뉴스,속도 내는 '노량진 뉴타운'…8구역 '아크로 리버스카이' 5월 분양,https://www.hankyung.com/article/2026041488066,DL이앤씨가 노량진8재정비촉진구역 주택재개발 정비사업을 통해 공급하는 '아크로 리버스카이'다. DL이앤씨는 5월 중 서울 동작구 대방동 23-61번지 일원에 '아크로 리버스카이'를 분양할 예정이라고 14일 밝혔다. 이... 
2026-04-14,네이버뉴스,롯데건설 희망퇴직 시행..조직 체질개선 차원,https://theviewers.co.kr/View.aspx?No=4040601,현대엔지니어링과 DL이앤씨 역시 각각 희망퇴직과 인력 감축을 통해 조직 재편에 나선 바 있다. 이는 프로젝트 감소와 수익성 악화 속에서 고정비 절감이 중요한 과제로 떠오른 결과다. 특히 공사비 상승은 업계 전반의... 
2026-04-14,네이버뉴스,"""한강 따라 프리미엄 주거""…아크로 리버스카이 5월 출격",https://www.ajunews.com/view/20260414084312152,노량진뉴타운 9200가구 대단지 축 속 '하이엔드 브랜드 타운' 기대 아주경제=이은별 기자 star@ajunews.com '아크로 리버스카이' 단지 투시도 [사진=DL이앤씨 제공] DL이앤씨가 서울 동작구 노량진뉴타운에서 하이엔드 아파트... 
2026-04-14,네이버뉴스,인프라 갖춘 도시에 ‘신축 프리미엄’… 청약흥행 이끄는 ‘원도심’,https://www.munhwa.com/article/11582027?ref=naver,DL이앤씨는 이달 동작구 노량진8구역 재개발을 통해 ‘아크로 리버스카이(총 987가구·일반분양 285가구)’를 분양할 예정이다. 대우건설은 이달 동작구 흑석 11구역 재개발을 통해 ‘써밋 더힐(총 1515가구·일반분양... 
2026-04-14,네이버뉴스,노량진뉴타운 '아크로 리버스카이' 5월 공급,http://www.fnnews.com/news/202604140842335809,"14일 DL이앤씨는 5월 중 서울 동작구 대방동 23-61번지 일원 노량진8재정비촉진구역 주택재개발 정비사업을 통해 '아크로 리버스카이'를 공급할 예정이라고 밝혔다. 아크로 리버스카이는 지하 4층~지상 29층, 10개 동... "
2026-04-14,네이버뉴스,"'노량진역 직선거리 600m' DL이앤씨, 동작구 '아크로 리버스카이' 5월분...",https://www.catchnews.kr/news/articleView.html?idxno=122713,DL이앤씨의 서울 동작구 '아크로 리버스카이' 단지 투시도. [사진 DL이앤씨] DL이앤씨가 내달 서울 동작구 일원 노량진8재정비촉진구역 주택재개발 정비사업을 통해 '아크로 리버스카이' 분양에 나선다. 단지 중앙에서... 
2026-04-14,네이버뉴스,"[단독]상대원2구역 운명의 날, '5월 1일 총회 소집'…시공사 재선정·조...",https://www.mediapen.com/news/view/1093097,조합은 지난 11일 열린 1차 총회에서 기존 시공사였던 DL이앤씨와의 계약을 해지하고 GS건설을 새 시공사로 선정하려 했다. 총회 결과 DL이앤씨와의 계약은 해지됐으나 GS건설 시공사 선정은 정족수 부족으로 무산된 바... 
2026-04-14,네이버뉴스,공사 앞두고 ‘9900억’ 상대원2구역 계약 해지… 시공사 공백으로 조합...,https://www.donga.com/news/Economy/article/all/20260414/133733096/1,DL이앤씨는 13일 공시를 통해 경기 성남시 상대원2구역 주택재개발정비사업 공사도급계약이 해지됐다고 밝혔다. 해지 금액은 약 9849억 원으로 회사 연간 매출의 13%에 달하는 규모다. 이틀 전 11일 조합 정기총회에서 계약... 
2026-04-14,네이버뉴스,"DL이앤씨, 5월 중 '아크로 리버스카이' …노량진8구역 재개발 단지 주목",https://view.asiae.co.kr/article/2026041408570073353,DL이앤씨는 내달 중 서울 동작구 대방동 일대에 '아크로 리버스카이'를 분양할 예정이라고 14일 밝혔다. 아크로 리버스카이는 노량진8재정비촉진구역 주택재개발 정비사업을 통해 조성된 단지다. 지하 4층~지상 29층... 
2026-04-14,네이버뉴스,"DL이앤씨, 상대원2구역 주택재개발정비사업 계약 해지",https://www.digitaltoday.co.kr/news/articleView.html?idxno=656573,"토목 건설 기업 DL이앤씨(375500)가 4월 13일 공시를 통해 상대원2구역 주택재개발정비사업 조합과의 공사수주 계약을 해지했다고 밝혔다. 해지금액은 9848억8097만4835원으로, 이는 최근 매출액... "
2026-04-14,네이버뉴스,"DL이앤씨, 동작구 '아크로 리버스카이' 987가구 5월 분양",https://www.betanews.net/article/view/beta202604140005,"DL이앤씨가 오는 5월 서울 동작구 대방동 23-61번지 일원 노량진8재정비촉진구역을 재개발하는 ‘아크로 리버스카이’를 분양한다고 14일 밝혔다. 이 단지는 지하 4층~지상 29층, 10개 동, 총 987가구 규모로 조성된다. 이... "
2026-04-14,네이버뉴스,4월 13일 주식시장 주요공시,https://www.catchnews.kr/news/articleView.html?idxno=122708,"보통주 709,790주 소각 결정(소각예정일:2026-04-20) ▶DL이앤씨, 상대원2구역 주택재개발정비사업 조합과 체결한 9,848.80억원(최근 매출액대비 13.30%) 규모 공급계약(상대원2구역 주택재개발정비사업) 해지... "
2026-04-14,네이버뉴스,"DL이앤씨, 노량진8구역 '아크로 리버스카이' 공급",http://www.econonews.co.kr/news/articleView.html?idxno=435489,DL이앤씨 '아크로 리버스카이' 단지 투시도 (사진=DL이앤씨) DL이앤씨는 서울 동작구 대방동 노량진8재정비촉진구역 주택재개발 사업을 통해 '아크로 리버스카이'를 5월 분양할 예정이라고 14일 밝혔다. 단지는 지하... 
2026-04-14,네이버뉴스,"'상대원2구역 시공권 박탈' DL이앤씨, 법적 반격 나서나...판례 살펴보니",https://www.ebn.co.kr/news/articleView.html?idxno=1705297,"DL이앤씨가 성남 상대원2구역 재개발 사업에서 시공권을 박탈당하면서 법적 반격에 나설지 주목된다. 조합이 총회를 통해 시공 계약 해지를 의결했지만, 해당 결의의 유효성과 해지 사유의 정당성을 둘러싼 쟁점은 여전히... "
2026-04-14,네이버뉴스,"[아주증시포커스] 삼전·SK하닉 레버리지 중소형사들도 '일단 출시'...""대...",https://www.ajunews.com/view/20260414081718111,"주요공시 ▷DL이앤씨, 9849억원 규모 상대원2구역 주택재개발정비사업 계약해지 ▷SM라이프디자인, 11억원 규모 자사주 소각 결정 ▷수성웹툰, 제23회차 전환사채 만기 전 4억7023만9320원 취득 ▷LS일렉트릭... "
2026-04-14,네이버뉴스,"[코스피·코스닥, 대한항공 LS일렉트릭 에이프로젠 HD현대마린엔진 한솔...",https://www.public25.com/news/articleView.html?idxno=44063,"조합, DL이앤씨에 계약 해지 통보 ▲ 구영테크(053270) : 종속회사 CAR TECH, LLC가 약 296억원 규모 주주배정 방식 유상증자 결정 ▲ 구다이글로벌, 작년 매출 1조4천700억원·영업이익 2천734억원 ▲ 세라젬 지난해... "
2026-04-14,네이버뉴스,"대우건설, 데이터센터 TFT 신설로 디벨로퍼 전환 추진",https://www.joongangenews.com/news/articleView.html?idxno=511456,|중앙이코노미뉴스 김영진 기자|  대우건설이 데이터센터를 미래 성장동력으로 삼고 전담 조직을 신설하며 시장 공략에 나섰다. 대우건설 CI 대우건설은 지난 13일 데이터센터 설계·시공·전기·기계(MEP) 등 전문성... 
2026-04-14,네이버뉴스,대우건설 '업성 푸르지오 레이크시티' 14일(화) 1순위 청약 돌입… 입지...,http://www.ikld.kr/news/articleView.html?idxno=332829,"대우건설이 충청남도 천안시 서북구 업성동 일원에 공급하는 '업성 푸르지오 레이크시티'가 14일 1순위 청약 접수를 진행한다. 단지는 지난 10일 개관한 견본주택에 주말 3일간 약 1만1,000명의 방문객이 다녀가며 높은... "
2026-04-14,네이버뉴스,"견본주택 오픈 3일간 1만 1000여명 방문, ‘업성 푸르지오 레이크시티’...",https://biz.heraldcorp.com/article/10716917?ref=naver,대우건설이 충남 천안시 업성동 일원에 선보이는 ‘업성 푸르지오 레이크시티’ 견본주택이 오픈 3일간 1만 1000여명의 방문객들이 방문했다. 지난 10일 문을 연 견본주택에는 개관 첫날부터 방문객이 몰리며 대기 줄이... 
2026-04-14,네이버뉴스,“역 신설이 곧 프리미엄” ‘업성 푸르지오 레이크시티’ 금일 1순위 ...,https://view.asiae.co.kr/article/2026041413383538697,"대우건설이 충남 천안시 서북구 업성동 478번지 일대에 공급하는 '업성 푸르지오 레이크시티'가 14일 1순위 청약을 받고 있다. 단지 인근에 수도권 지하철 1호선 부성역이 신설될 예정이며, 부성역에서 두 정거장 거리의... "
2026-04-14,네이버뉴스,‘똘똘한 한 채’ 선호현상…‘귀한 몸’ 중대형 아파트 강세,https://www.mk.co.kr/article/12016385,대전광역시 서구 관저동에서 ‘더샵 관저 아르테’ 전용 59~119㎡ 총 951가구를 분양할 예정이다. 충청북도 청주시 서원구 분평동에서는 대우건설이 ‘청주 푸르지오 씨엘리체’ 전용 84~114㎡ 총 1351가구를 분양 중이다.
2026-04-14,네이버뉴스,침체기에도 하이엔드는 통한다… 'ALTIERO 광안' 부산 흥행 바통 이어간...,http://www.ikld.kr/news/articleView.html?idxno=332826,대우건설이 전국 최초로 선보이는 '써밋' 브랜드를 바탕으로 부산에서 상대적으로 보기 힘든 중대형 평형 위주 세대구성에 희소가치를 높인 고급 주거 단지로 조성한 것이 많은 분들의 관심을 받았다. 또한 옛 NC백화점... 
2026-04-14,네이버뉴스,'업성 푸르지오 레이크시티' 금일 1순위 청약 진행… 청약 본격 돌입,https://www.rcast.co.kr/news/articleView.html?idxno=30520,"대우건설이 충청남도 천안시 서북구 업성동 478번지 일원에 공급하는 '업성 푸르지오 레이크시티'가 14일 1순위 청약 접수를 진행한다. 업성 푸르지오 레이크시티는 지하 2층~지상 최고 39층, 11개 동, 총 1,908세대 규모로... "
2026-04-14,네이버뉴스,"[서울데이터랩]금일 코스피 거래량 1위 남선알미늄 거래대금 4,068억원 돌...",https://www.seoul.co.kr/news/economy/securities/2026/04/14/20260414500139?wlog_tag3=naver,"대우건설(047040)은 2만 3500원으로 1.05% 하락, 거래량은 2500만주를 넘어섰다. 부국철강(026940)은 3180원으로 21.84% 폭등하며 거래량 1600만주를 기록하고 있다. 남해화학(025860)은 9510원에 거래되며 1.28% 상승... "
2026-04-14,네이버뉴스,﻿ 천안 '업성 푸르지오 레이크시티' 본격 청약일정 돌입,http://www.dtnews24.com/news/articleView.html?idxno=810382,﻿대우건설이 천안시 업성동 일원에 선보이는 '업성 푸르지오 레이크시티'가 청약접수 일정에 돌입한 가운데 지난 주말까지 1만1000여 명의 방문객이 견본주택을 찾았다. 대우건설 제공 대우건설이 천안시 업성동... 
2026-04-14,네이버뉴스,남부내륙철도 마지막 퍼즐 1ㆍ7ㆍ9공구 본궤도,https://www.dnews.co.kr/uhtml/view.jsp?idxno=202604131117203850981,"계룡건설산업은 40％의 지분으로 대우건설(20％), 동부건설(15％), HS화성ㆍ영진종합건설ㆍ특수건설ㆍ국기건설ㆍ삼도(각 5％)와 손을 잡았다. 설계는 동명기술공단과 태조엔지니어링, 동해종합기술공사 등이 맡는다.... "
2026-04-14,네이버뉴스,'업성 푸르지오 레이크시티' 특공 654가구 모집에 60명 신청,https://www.newsis.com/view/NISX20260414_0003590127,건설부동산부 기자 = 대우건설이 충남 천안시 업성동 업성3도시개발구역 일대에 조성하는 '업성 푸르지오 레이크시티' 특별공급 평균 경쟁률이 0.09대 1로 집계됐다. 14일 한국부동산원 청약홈에 따르면 전날... 
