date,source,title,link,description
2026-04-21,네이버뉴스,"롯데건설, 서울 CBD '정동 롯데캐슬 136' 견본주택 개관",https://www.job-post.co.kr/news/articleView.html?idxno=214011,"롯데건설이 서울 중구 순화동 일대에 들어서는 '정동 롯데캐슬 136'의 견본주택을 17일 개관하고 분양 일정에 돌입한다. 이 단지는 '지윰 21'이 분양하고, 서울 도심 업무지구(CBD)와 근접하고 교통망을 누릴 수 있다.... "
2026-04-21,네이버뉴스,1분기 분양 1.7만가구 '뚝'…15년 만에 최저 수준,https://www.newsis.com/view/NISX20260421_0003599502,롯데건설은 경기 광주시에서 경기광주역 롯데캐슬 시그니처 1단지를 분양하며 공급 일정에 돌입했다. 총 1077가구 규모의 대단지다. 태영건설은 경남 창원시 마산합포구에서 메트로시티 자산 데시앙을 내달 분양할... 
2026-04-21,네이버뉴스,신도시에서도 통하는 '대형건설사 브랜드' 프리미엄 주목,https://edu.donga.com/news/articleView.html?idxno=106550,"단지는 인천1호선 아라역 초역세권 입지에 들어서는 아파트로, 대형건설사 롯데건설이 검단신도시에서 최초로 선보이는 '롯데캐슬' 브랜드 단지라는 상징성을 갖췄다. 이에 따라 향후 지역 내 랜드마크 단지로... "
2026-04-21,네이버뉴스,"'20억 로또' 오티에르반포, 당첨자 확정...4.6만명 청약자 희비 교차",https://www.straightnews.co.kr/news/articleView.html?idxno=300655,롯데건설이 용산 이촌현대아파트를 리모델링 중인 '이촌 르엘' 건설 현장. 2026.04. 12. [사진 스트레이트뉴스 박정은 기자] 청약홈은 이 단지의 중대형 1순위 당첨자의 최저 가점은 69점으로 '이촌 르엘'과 같으나... 
2026-04-21,네이버뉴스,"[단독] 신동빈 롯데 회장, 계열사 소유 집서 '호화 셋방살이' 하나",https://www.insightkorea.co.kr/news/articleView.html?idxno=244981,이름에서 드러나듯 시공사는 롯데건설이다. 이 곳 역시 초호화 고급빌라다. 신 회장은 2012년 4월부터 시그니엘로 이사가지 전까지 이곳에다 주소지를 뒀다. 문제는 이 고급빌라 역시 소유 구조가 평범하지 않다는 점이다.... 
2026-04-21,네이버뉴스,SPC·쿠팡 시민들이 뽑은 ‘최악의 살인기업’,https://www.busan.com/view/busan/view.php?code=2026042114105257584,"1월에도 경기 수원 신분당선 공사 현장에서 추가 사망사고가 발생했다. 2위에는 현대엔지니어링과 삼정기업(각 6명), 4위는 포스코이앤씨(5명)가 이름을 올렸다. 상위 4개사 사망자 25명 가운데 23명이 하청 노동자였다."
2026-04-21,네이버뉴스,전용 44㎡도 5인가구 만점 돼야…‘오티에르 반포’ 당첨 최저 69점,http://www.metroseoul.co.kr/article/20260421500229,"당첨자 최저·최고 가점,4인 가구·6인 가구 최고 점수 시세차익 20억~30억 기대 '오티에르 반포' 석경투시도./포스코이앤씨 서울 서초구 잠원동 '오티에르 반포'(신반포 21차 재건축) 청약 당첨자의 최저·최고... "
2026-04-21,네이버뉴스,"신도시 주거 선택 기준, 쾌적성·여가 환경 중심으로 변화",https://magazine.hankyung.com/business/article/202604215778b,"이러한 가운데 인천 검단신도시에서 포스코이앤씨가 5월 분양 예정인 호수공원 인근 '더샵 검단레이크파크'가 공급된다. 해당 단지는 인천 검단신도시 22·23블록에 들어서며, 지하 3층~지상 29층, 26개 동, 전용면적 59·84... "
2026-04-21,네이버뉴스,입주하자마자 인프라 누린다… 완성형 생활권 단지 청약자 '눈길',https://www.arunews.com/news/articleView.html?idxno=61869,"포스코이앤씨는 인천 송도국제도시에 '더샵 송도그란테르'를 공급할 예정이다. 아파트 1,544세대·오피스텔 96실 규모다. 주거시설이 밀집한 3공구 인근에 공급되는 물량으로, 기존 송도 생활 인프라 접근성이 높다.... "
2026-04-21,네이버뉴스,"‘6명이 10평대 살 수 있나?’ 오티에르반포, 44㎡ 당첨 최고 79점 [부동...",https://biz.heraldcorp.com/article/10721914?ref=naver,"오티에르반포는 오는 7월 입주하는 후분양 단지로, 포스코이앤씨의 초고급 주거 브랜드 오티에르(HAUTERRE)가 적용되는 첫 분양 단지다. 7호선 반포역과 인접했으며 원촌초, 원촌중, 경원중, 신동중 등과 가깝다.... "
2026-04-21,네이버뉴스,사교육 양극화 심화 속 ‘교육 생활권’ 아파트 몸값 상승,https://www.smarttoday.co.kr/ko-kr/articles/106735,"포스코이앤씨는 대전 서구 관저동에서 ‘더샵 관저아르테’를 공급할 예정이다. 단지 주변으로 초·중·고가 밀집해 있으며, 대전 유명 학원가로 평가받는 관저동 학원가도 인접하다. 또 바로 옆에 ‘대전... "
2026-04-21,네이버뉴스,교육 생활권 효과 눈길… 전국 학세권 아파트 가격 ‘강세’,https://www.viva100.com/article/20260421500421,"포스코이앤씨는 대전 서구 관저동에서 이달 중 ‘더샵 관저아르테’ 전용 59~119㎡ 총 951가구를 분양할 예정이다. 단지 주변으로 초·중·고가 밀집해 있으며, 대전 관저동 학원가도 인접해 있다. 또 바로 옆에... "
2026-04-21,네이버뉴스,신도시 청약 '완성형 입지' 쏠림...인프라 따라 경쟁률 갈린다,https://www.asiaa.co.kr/news/articleView.html?idxno=247054,"인천 송도국제도시에서는 포스코이앤씨가 '더샵 송도그란테르'를 분양할 예정이다. 아파트 1544가구와 오피스텔 96실 규모로, 기존 주거 밀집 지역인 3공구 인근에 공급돼 생활 인프라 접근성이 높은 입지로 평가된다.... "
2026-04-21,네이버뉴스,“신도시도 입지 싸움”…완성형 입지에 청약자 쏠린다,http://www.lawissue.co.kr/view.php?ud=20260421102937747267191f6c6e_12,"포스코이앤씨는 인천 송도국제도시에 '더샵 송도그란테르’를 공급할 예정이다. 아파트 1544가구·오피스텔 96실 규모다. 주거시설이 밀집한 3공구 인근에 공급되는 물량으로, 기존 송도 생활 인프라 접근성이 높다.... "
2026-04-21,네이버뉴스,완성형 입지에 청약자 몰려… 신도시 경쟁률 극과 극,http://www.ikld.kr/news/articleView.html?idxno=333257,"포스코이앤씨는 인천 송도국제도시에 '더샵 송도그란테르'를 공급할 예정이다. 아파트 1544가구·오피스텔 96실 규모다. 주거시설이 밀집한 3공구 인근에 공급되는 물량으로, 기존 송도 생활 인프라 접근성이 높다."
2026-04-21,네이버뉴스,"[#IT라운지] 펀진, AKJCCS에 'KWM' 공급·데이원드림 '투자유치'·'무아' ...",https://www.newsworks.co.kr/news/articleView.html?idxno=838413,"◆""상반기 공채 마감임박"" SGC이앤씨, 포스코DX, 한화투자증권, 한화솔루션 인사이트부문, 한국투자부동산신탁 등 주요 기업들의 상반기 공채 서류 마감이 임박했다. 자소설닷컴에 따르면 SGC이앤씨는 오는 26일까지... "
2026-04-21,네이버뉴스,"‘오티에르 반포’ 전용 44㎡, 최저 당첨 점수 74점... 5인 가구 기준 만...",https://www.chosun.com/economy/real_estate/2026/04/21/TOB7G5KPENHLJBSVJDOVXTC5YQ/?utm_source=naver&utm_medium=referral&utm_campaign=naver-news,"오티에르반포는 지하 4층∼지상 20층, 2동(棟) 총 251가구 규모로, 포스코이앤씨의 초고급 주거 브랜드 오티에르(HAUTERRE)가 적용되는 첫 분양 단지다. 오는 7월 입주하는 후분양 단지다. 서초구에 있는 이 단지는... "
2026-04-21,네이버뉴스,"다 같은 신도시라는 생각은 금물...신도시, 인프라 따라 경쟁률 '극과 극...",https://www.bizwork.co.kr/news/articleView.html?idxno=414841,"포스코이앤씨는 인천 송도국제도시에 '더샵 송도그란테르'를 공급할 예정이다. 아파트 1544가구·오피스텔 96실 규모다. 주거시설이 밀집한 3공구 인근에 공급되는 물량이다. 업계 한 관계자는 ""젊은 신도시일수록... "
2026-04-21,네이버뉴스,"""같은 동네 신축 아파트인데""…청약 경쟁률 천차만별, 왜?",https://www.hankyung.com/article/202604214839i,상한제가 적용되는 ‘고덕신도시 아테라’(총 630가구)를 이달 분양한다. 포스코이앤씨는 이달 인천 연수구 송도동에 인천지하철 1호선 센트럴파크역 역세권 입지를 갖춘 ‘더샵 송도그란테르'(총 1640가구)를 분양한다.
2026-04-21,네이버뉴스,서울 서초구 '오티에르반포' 청약 당첨 최저 69점·최고 79점,https://www.tfmedia.co.kr/news/article.html?no=203909,"오티에르반포는 지하 4층∼지상 20층, 2개 동, 총 251가구 규모로 오는 7월 입주하는 후분양 단지이자, 포스코이앤씨의 초고급 주거 브랜드 오티에르(HAUTERRE)가 적용되는 첫 분양 단지다. 7호선 반포역과... "
2026-04-21,네이버뉴스,"'시세차익 20억' 오티에르반포, 청약가점 최저 69점·최고 79점",https://view.asiae.co.kr/article/2026042109385787497,포스코이앤씨의 강남권 최초 하이엔드 브랜드라는 상징성과 서울 노른자 입지 덕에 고가점자가 대거 몰린 것으로 풀이된다. 21일 한국부동산원 청약홈에 발표된 오티에르반포 당첨 결과를 보면 1순위 청약을... 
2026-04-21,네이버뉴스,서울 잠원동 오티에르반포 청약 당첨 최저 69점·최고 79점,https://biz.sbs.co.kr/article_hub/20000305590?division=NAVER,"오티에르반포는 지하 4층∼지상 20층, 2개 동, 총 251가구 규모로 오는 7월 입주하는 후분양 단지이자, 포스코이앤씨의 초고급 주거 브랜드 오티에르(HAUTERRE)가 적용되는 첫 분양 단지입니다. 7호선 반포역과... "
2026-04-21,네이버뉴스,'오티에르 반포' 청약 당첨 최저 69점·최고 79점 기록,https://www.ajunews.com/view/20260421092422488,아주경제=우주성 기자 wjs89@ajunews.com 오티에르 반포 전경 [사진=포스코이앤씨] 서울 서초구 잠원동 '오티에르 반포'(신반포 21차 재건축) 청약 당첨자의 최저·최고 가점이 각각 4인 가구와 6인 가구가 받을 수... 
2026-04-21,네이버뉴스,"인천 대표, '포레나더샵 인천시청역' 초품아 인기리 분양",https://www.g-enews.com/view.php?ud=2026042021580023849ae5042aca_1,"㈜한화 건설부문과 ㈜포스코이앤씨는 오는 4월 4일부터 상인천초등학교 주변 간석동 311-1번지 일대 재개발 사업인 ‘포레나더샵 인천시청역’의 선착순 분양에 돌입한다. 2026년 올해 처음으로 공급되는 2,000세대... "
2026-04-21,네이버뉴스,신도시도 '완성형 입지'에 청약자 쏠려… '고덕국제신도시 수자인풍경채...,https://www.rcast.co.kr/news/articleView.html?idxno=30572,"포스코이앤씨는 인천 송도국제도시에 '더샵 송도그란테르'를 공급할 예정이다. 아파트 1544가구·오피스텔 96실 규모다. 주거시설이 밀집한 3공구 인근에 공급되는 물량으로, 기존 송도 생활 인프라 접근성이 높다."
2026-04-21,네이버뉴스,"""서두르세요 공채 막바지"" 주요 기업 '공채 마감' 카운트다운",https://www.wolyo.co.kr/news/articleView.html?idxno=311182,"신입 채용 플랫폼 '자소설닷컴'을 운영하는 리멤버앤컴퍼니(각자대표 최재호, 송기홍)는 SGC이앤씨, 포스코DX, 한화투자증권, 한화솔루션 인사이트부문, 한국투자부동산신탁 등 주요 기업들이 상반기 공채 서류 마감... "
2026-04-21,네이버뉴스,SGC·포스코DX·한화투자증권...주요기업 공채 마감 카운트다운,https://www.slist.kr/news/articleView.html?idxno=733402,SGC이앤씨는 오는 26일까지 상반기 신입사원 공개채용 서류 접수를 진행한다. 모집 직무는 ▲플랜트... 포스코DX는 4월 27일까지 상반기 신입사원 채용 서류를 접수한다. 모집 분야는 ▲엔지니어링(IT/전기/통신/IT인프라)... 
2026-04-21,네이버뉴스,"교육 따라 움직이는 집값…‘교육 생활권’ 아파트, 수도권 넘어 지방까...",https://www.mediapen.com/news/view/1094596,대전 서구 관저동에서는 포스코이앤씨가 ‘더샵 관저아르테’를 분양할 예정이다. 단지 주변으로 초·중·고가 모여 있고 관저동 학원가와 인접해 교육 환경을 갖춘 점이 특징이다. 여기에 대전 제3시립도서관 조성... 
2026-04-21,네이버뉴스,고물가 속 사교육 양극화 확대...'교육 생활권' 아파트 찾아보니,https://www.bizwork.co.kr/news/articleView.html?idxno=414819,"포스코이앤씨는 대전광역시 서구 관저동에서 4월 중 '더샵 관저아르테' 전용 59~119㎡ 총 951가구를 분양할 예정이다. 단지 주변으로 초·중·고가 밀집해 있으며, 대전 유명 학원가로 평가받는 관저동 학원가도... "
2026-04-21,네이버뉴스,사교육 양극화… 지역 대표 '교육 생활권' 노려라,http://www.ikld.kr/news/articleView.html?idxno=333211,"포스코이앤씨는 대전광역시 서구 관저동에서 4월 중 '더샵 관저아르테' 전용 59~119㎡ 총 951세대를 분양할 예정이다. 단지 주변으로 초·중·고가 밀집해 있으며, 대전 유명 학원가로 평가받는 관저동 학원가도... "
2026-04-21,네이버뉴스,"한화 건설부문, 마스턴투자운용과 맞손..""개발형 부동산 사업 확대""",http://www.4th.kr/news/articleView.html?idxno=2110729,기존 도급 수주형 사업보다 한 단계 나아가 사업 초기부터 수익성과 리스크를 함께 설계하겠다는 구상이다.... 한국건설산업연구원은 지난해 실질 건설투자가 전년 대비 9.9% 감소해 외환위기 직후인 1998년 이후 27년... 
2026-04-21,네이버뉴스,"한국수출입은행, ‘KEXIM AI·튀르키예 도로·신용평가 개편’…금융·투...",http://www.thevaluenews.co.kr/news/view.php?idx=198214,"도로공사의 실적 축적도 후속 수주에 도움이 될 전망이다. 해외 인프라 발주처는 유사 사업 경험을 주요 입찰 요건으로 보는 만큼, 이번 사업 경험이 쌓이면 국내 건설사와의 컨소시엄을 통한 튀르키예 후속 대형 사업... "
2026-04-21,네이버뉴스,"""일감이 사람 부른다""… 동부건설, 수주 증가에 지원자 2년 연속 40%↑",https://www.mediapen.com/news/view/1094726,구직자들이 중견 건설사인 동부건설에 몰리는 핵심 이유는 날로 증가하는 수주 실적이다. 동부건설의 연간 수주고는 2024년 3조1577억 원에서 2025년 4조3347억 원으로 매년 증가했다. 특히 지난해 수주액은 창사 이후 최고... 
2026-04-21,네이버뉴스,‘명절 앞 돈 봉투’ 공무원…경찰 수사 착수,https://news.kbs.co.kr/news/pc/view/view.do?ncd=8541463&ref=A,"경찰은 뇌물수뢰 등의 혐의로 해당 공무원과 건설사 대표를 입건해 조사하고 있습니다. 경찰은 특히, 이 업체가 인제군으로부터 공사 여러 건을 수주한 사실에 주목하고 있습니다. 이에, 이들의 집과 사무실을 두차례에... "
2026-04-21,네이버뉴스,건설업 폐업 1분기 1000건 넘어서,http://www.smedaily.co.kr/news/articleView.html?idxno=355984,"종합건설사보다 가격 협상력이 낮고, 공사 물량 감소와 원가 상승의 영향을 직접적으로 받기 쉬워 위기에 더 취약한 것으로 평가된다. 자재비가 오르더라도 이를 공사비에 충분히 반영하기 어렵고, 수주 감소가 곧바로... "
2026-04-21,네이버뉴스,"한화 건설, 마스턴과 부동산 개발 '새 길' 연다",http://www.ttlnews.com/news/articleView.html?idxno=3100963,"◈ 단순 시공 넘어 디벨로퍼로 진화…금융 체력 확보에 총력 이번 협력은 건설사의 전통적인 수익 모델인 시공 중심 수주 구조에서 벗어나, 사업 발굴 단계부터 선제적으로 참여하는 선진국형 개발 체계를 구축하기 위해... "
2026-04-21,네이버뉴스,"대한전선, 유럽 심장부서 '해저케이블 턴키' 확장 승부수",http://www.opinionnews.co.kr/news/articleView.html?idxno=137088,"21일(현지시간)부터 사흘 동안 열리는 'WindEurope 2026'에 참가한 대한전선은 전 세계 발전사와 건설사, 정책... 대한전선은 이번 행사를 통해 국내 대형 프로젝트 참여 의지를 다지는 동시에 글로벌 전력 수주 시장에서의... "
2026-04-21,네이버뉴스,"한화 건설부문, 마스턴 손잡고 '금융·시공 결합형' 개발 체계 구축",https://www.asiaa.co.kr/news/articleView.html?idxno=247044,"기존 수주 방식이 발주자가 사업을 기획하면 시공사가 수주하는 순서를 따랐다면, 이번 협약은 건설사가 금융사와 함께 사업을 발굴하고 직접 수익 구조를 설계하는 방식이다. 사업 구조 설계 단계부터 리스크를... "
2026-04-21,네이버뉴스,베트남 고속철 놓고 韓·中 경쟁 분위기…이재명 대통령 지원사격 나설...,https://www.theguru.co.kr/news/article.html?no=100799,한국은 국토교통부 주도로 '팀 코리아'(코레일·국가철도공단·현대로템·건설사 등)를 구성해 수주전에 뛰어들었다. 지난해 12월에는 현대로템이 타코그룹과 철도 분야 협력을 위한 업무협약을 맺으며 수주 가능성을... 
2026-04-21,네이버뉴스,[굿모닝금융] 국민은행·기업은행·수출입은행·SBI저축은행 등,http://www.bizwnews.com/news/articleView.html?idxno=134348,이스탄불 서쪽 외곽 크날르에서 시작해 2018년 국내건설사가 시공한다. 수은이 금융지원 한 '차나칼레... 사업 수주의 길을 열었다는 점이다. 이번 성과는 지난해 11월 한-튀르키예 정상회담 당시 도공과 튀르키예... 
2026-04-21,네이버뉴스,[건설사 수익성 점검] [BS한양] 건설·에너지 투트랙 성장 '본궤도',https://dealsite.co.kr/articles/160025,"가능한 수준이라는 평가다. 16일 업계에 따르면 BS한양의 2025년 매출액은 1조1286억원으로 전년(9010억원)... BS한양 관계자는 ""건설부문의 안정적인 수주 실적을 바탕으로 에너지 사업을 지속 확장하고 있다""며 ""에너지... "
2026-04-21,네이버뉴스,[핀포인트] [SK에코] 적자 부메랑 된 내부거래 90%…감사인도 ‘주의’,https://news.dealsitetv.com/articles/168614,"배터리 공장 등 그룹 계열사 일감에 의존해 성장해온 내부 건설사 특성상 특수관계인 매출 비중이 90%에... 감사의견 자체에 영향을 주는 사안은 아니지만, 내부거래 비중이 통상 수준을 크게 웃돌고 있다는 점을... "
2026-04-21,네이버뉴스,건축문화 거점 조성 첫걸음…제주건축사회 착공식 개최,https://www.jejudomin.co.kr/news/articleView.html?idxno=318534,"행사에는 건축사회 회장단과 역대 회장, 임원, 회관건립 추진위원회, 시공사 관계자 등 약 50여 명이... 이어 2025년에는 건축사 회원들이 참여한 설계 공모를 통해 최인성건축사사무소의 설계안이 선정됐으며 약... "
2026-04-21,네이버뉴스,민주노총 선정 '최악 살인기업' HJ중공업…산재로 8명 사망,https://www.nocutnews.co.kr/news/6505668?utm_source=naver&utm_medium=article&utm_campaign=20260421013229,이날 민주노총은 종로구 세종문화회관 계단에서 '2026 최악의 살인기업 선정식'을 갖고 이 같은 결과를 발표했다. 지난해 HJ중공업에선 8명의 산재 사망사고가 발생했다. 지난해 11월 HJ중공업이 시공사였던... 
2026-04-21,네이버뉴스,"강기정 “광주의 마지막 시정, 통합·개헌·현안 마무리에 집중”",https://www.viva100.com/article/20260421500561,"또 행정 표준코드 순서 문제와 통합특별시 금고 선정, 전산망 통합 등도 차질 없이 준비하겠다고 밝혔다.... 이어 “현재는 주민들과 시공사, 전문가들 사이에서 풍영정천 방향 대안 노선이 더 현실적이라는 공감대가... "
2026-04-21,네이버뉴스,"행복청, 갈등은 관리하는 것...'공공행정 패러다임 전환 앞장'",https://www.ccreview.co.kr/news/articleView.html?idxno=346867,전 세계적인 원자재 가격 상승과 공기 단축 압박이 맞물리면서 발주처인 LH와 시공사 간의 공사비 증액... 부처로 선정되는 핵심 비결이다. 행복청은 2025년 7월 갈등관리심의위원회를 민간 위원 중심으로 전격 재구성... 
2026-04-21,네이버뉴스,"민주노총 ""2026 최악의 살인기업은 8명 숨진 HJ중공업""",http://www.newsfc.co.kr/news/articleView.html?idxno=78209,"HJ중공업을 선정했다. 민주노총은 노동건강연대와 매일노동뉴스, 중대재해전문가넷과 함께 이날 오전... HJ중공업이 시공사였던 한국동서발전 울산화력발전소에서는 지난해 11월 6일 보일러 타워 붕괴 사고로 7명이... "
2026-04-21,네이버뉴스,"행복청, 공공행정 패러다임 전환 '앞장'",http://www.ccnnews.co.kr/news/articleView.html?idxno=408028,전 세계적인 원자재 가격 상승과 공기 단축 압박이 맞물리면서 발주처인 LH와 시공사 간의 공사비 증액... 행정의 전문성과 객관성을 높이기 위한 제도적 장치도 갈등관리 우수 부처로 선정되는 핵심 비결이다. 행복청은... 
2026-04-21,네이버뉴스,"[지자체 포커스] 파주시, 금촌 게이트볼장 실내구장으로 개선공사 21일 ...",http://www.queen.co.kr/news/articleView.html?idxno=455464,"총사업비는 26억 4천만 원(도비 15억 원, 시비 11억 4천만 원)이 투입될 예정으로, 시는 그동안 지방재정 투자심사, 예산 확보, 시공사 선정 등 본격적인 공사 추진에 필요한 관련 행정절차를 모두 완료했다. 이번 사업을 통해... "
2026-04-21,네이버뉴스,"대신자산신탁, 안산 군자주공10단지 재건축 사업시행자 지정",http://www.bizwnews.com/news/articleView.html?idxno=134398,"두 단지는 연내 시공사 선정이 마무리될 것으로 보이며 선부동 일대에 대규모 신축 브랜드 타운이 형성될 전망이다. 김송규 대표는 ""사업시행자로서 보유한 역량을 바탕으로 투명하고 신속하게 정비사업을 추진할 것... "
2026-04-21,네이버뉴스,"대신자산신탁, 안산 군자주공10단지 사업시행자 지정",http://www.thebigdata.co.kr/view.php?ud=202604211010135068df3c2a17b7_23,"두 단지는 연내 시공사 선정이 마무리될 것으로 예상되며, 선부동 일대에 대규모 신축 브랜드 타운이 형성될 전망이다. 김송규 대신자산신탁 대표이사는 “사업시행자로서 보유한 역량을 바탕으로 투명하고 신속하게... "
2026-04-21,네이버뉴스,"파주 금촌게이트볼장, 9월 실내 구장 전환",https://www.newspim.com/news/view/20260421000573,"시는 그동안 지방재정 투자 심사와 예산 확보, 시공사 선정 등 관련 행정 절차를 마쳤다. 이번 사업을 통해 기대되는 가장 큰 변화는 이용 환경의 획기적 개선이다. 기존 실외 시설은 폭염과 한파, 미세먼지, 강우 등 기후... "
2026-04-21,네이버뉴스,"[경제소식] NH농협은행, '초록사다리×우주공간' 프로젝트 4호 조성",http://www.4th.kr/news/articleView.html?idxno=2110713,"두 단지는 연내 시공사 선정이 마무리될 것으로 예상되며, 선부동 일대에 대규모 신축 브랜드 타운이 형성될 전망이다. 김송규 대신자산신탁 대표이사는 ""통합 심의 등 후속 절차의 원만한 진행을 통해 소유주들에게... "
2026-04-21,네이버뉴스,"민주노총, '2026년 최악의 살인기업'에 8명 숨진 'HJ중공업'",https://imnews.imbc.com/news/2026/society/article/6816843_36918.html,"민주노총은 오늘 서울 종로 세종문화회관 앞에서 기자회견을 열고 ""HJ중공업에서 2025년 모두 8명의 산업재해 사망자가 발생했다""며 선정 이유를 설명했습니다. 지난해 11월, HJ중공업이 시공사였던 울산 남구... "
2026-04-21,네이버뉴스,"[위클리오늘] 파주시, 금촌 게이트볼장 개선공사 21일 착공",http://www.weeklytoday.com/news/articleView.html?idxno=771957,"총사업비는 26억 4천만 원(도비 15억 원, 시비 11억 4천만 원)이 투입될 예정으로, 시는 그동안 지방재정 투자심사, 예산 확보, 시공사 선정 등 본격적인 공사 추진에 필요한 관련 행정절차를 모두 완료했다. 이번 사업을 통해... "
2026-04-21,네이버뉴스,"행복청, 2년 연속 갈등관리 최고 등급…공사비 갈등 조율 성과",http://www.fnnews.com/news/202604211034271533,"당시 원자재 가격 상승과 공기 단축 압박이 맞물려 발주처와 시공사 간 공사비 증액 갈등이 발생했으며, 9월... 또 행정 전문성과 객관성 강화를 위한 제도적 장치도 갈등관리 우수 부처 선정의 핵심 요인으로 지목했다.... "
