date,source,title,link,description
2026-06-18,네이버뉴스,"울산시, 지역업체 하도급률 제고 점검회의 열어",https://www.jeonmae.co.kr/news/articleView.html?idxno=1266547,"실제로 현대건설, 삼성물산, 한화 등 주요 건설사 6곳 본사를 방문해 지역업체 참여 확대를 요청했으며 51개 공사현장을 대상으로 합동 방문을 진행해 지역건설산업 활성화 정책을 안내했다. 그 결과 공동주택... "
2026-06-18,네이버뉴스,"현대건설, 웨스팅하우스와 네덜란드서 원전 건설 심포지엄 개최",https://www.businesspost.co.kr/BP?command=article_view&num=440321,네덜란드에서 현지시각 16일에 개최된 '네덜란드 서플라이어 심포지엄' 행사에서 신달원 현대건설 뉴에너지사업부 상무가 환영사를 하고 있다. 현대건설> 현대건설이 유럽 에너지 시장 공략을 위해 현지 파트너십을... 
2026-06-18,네이버뉴스,"[건설·부동산 레이더] GS건설, 현업 중심 AI 경진대회 개최…AI 에이전...",http://www.thevaluenews.co.kr/news/view.php?idx=199476,"현대건설은 네덜란드 현지 파트너십을 강화하며 신규 원전 프로젝트 수주를 위한 유럽 시장 공략에 본격 시동을 걸었다. ◆ GS건설, 전사 AI 내재화 속도…'AX 레시피'로 업무 혁신 확산 GS건설은 전 임직원의 AI 활용... "
2026-06-18,네이버뉴스,"현대차그룹의 극한 도전…남극 기지 전력, 디젤에서 그린수소로",https://www.g-enews.com/view.php?ud=202606181655156818112616b072_1,"현대건설은 1988년 우리나라 최초 남극 기지인 세종과학기지를 건설했고, 2014년에는 두 번째 남극 기지인 장보고과학기지를 건립하며 국내 극지 연구시설 기반을 마련했다. 당시 세종과학기지 건설은 우리나라의 극지 시공... "
2026-06-18,네이버뉴스,"K-방산·K-원전 영토 넓힌다… HD현대중·현대건설, 글로벌 시장 공략 가...",https://www.newstnt.com/news/articleView.html?idxno=706940,한편 현대건설은 미국 웨스팅하우스와 공동으로 네덜란드 암스테르담에서 '서플라이어 심포지엄'을 개최해 유럽 원전 수주 기반 다지기에 나섰다. 네덜란드의 신규 원전 추진 속에서 열린 이번 행사에는 정부와 산업계... 
2026-06-18,네이버뉴스,"[아유경제_재개발] 1535가구 전개 안락1구역 재개발, 시공자 2차 입찰마...",http://www.areyou.co.kr/news/articleView.html?idxno=94186,"이날 현설에 참여한 곳은 현대건설 롯데건설 등 건설사로 파악됐다. 현설에서 좋은 결과를 얻은 조합은 예정대로 오는 7월 7일 오후 3시 현설과 같은 장소에서 입찰을 마감한다는 구상이다. 한편, 이 사업은 부산... "
2026-06-18,네이버뉴스,"[금융zip] 신한은행, 2410억원 규모 태양광 발전사업 PF 금융약정 완료 ...",https://www.getnews.co.kr/news/articleView.html?idxno=872750,"특히 이번 사업은 장기 직접전력구매계약(PPA)을 기반으로 설계됐으며, 생산된 전력은 향후 30년간 재생에너지 공급사업자인 현대건설에 전량 판매될 예정이다. 신한은행은 이번 금융 지원을 통해 재생에너지 인프라... "
2026-06-18,네이버뉴스,"국내서도 첫 SMR 본격화, 박지원 두산에너빌리티 수출 경쟁력 강화 기대...",https://www.businesspost.co.kr/BP?command=article_view&num=440310,"SMR 건설의 시공권을 두고는 SMR 시공 역량 확보에 공을 들이고 있는 삼성물산, 현대건설, DL이앤씨 등이 수주 경쟁을 벌일 것으로 예상된다. 반면 SMR의 '주기기(원자로 및 핵심 설비)' 공급은 두산에너빌리티가 맡게 될... "
2026-06-18,네이버뉴스,[코스피 지수선물 옵션] 삼성전자·SK하이닉스 선물 훨훨…지수 방향성...,https://www.pinpointnews.co.kr/news/articleView.html?idxno=461283,"건설 및 중공업 섹터에서는 두산에너빌리티, 현대건설, 대우건설, 삼성중공업, GS건설, 한화오션 등에서도 등락이 엇갈리며 업황 기대와 단기 부담이 동시에 반영되고 있다. 플랫폼 및 IT 업종에서는 NAVER, 카카오... "
2026-06-18,네이버뉴스,[오늘의 건설 브리핑] 체코 원전부터 AI 혁신·스타트업 육성까지···미...,https://www.smartbizn.com/news/articleView.html?idxno=146519,"유럽 원전 시장을 둘러싼 수주 경쟁이 치열해지는 가운데 한국수력원자력과 현대건설은 현지 협력망 확대에 나섰고, GS건설과 한국수자원공사는 AI 및 기후테크 생태계 구축에 속도를 내고 있다. 여기에 건설... "
2026-06-18,네이버뉴스,"전쟁 멈춰도 회수까지는 멀다···건설업계, 중동 '계산기' 다시 켰다",https://www.greenpostkorea.co.kr/news/articleView.html?idxno=306950,종전 기대감이 무르익기 전인 2026년 1분기 5대 건설사(삼성물산·현대건설·GS건설·DL이앤씨·대우건설)의 해외수주 성적표를 1년 전(2025년 1분기)과 비교하면 시장이 얼마나 얼어붙어 있었는지가 드러난다. 5대... 
2026-06-18,네이버뉴스,"[금융권 풍향계] 메리츠금융, 홈플러스에 DIP 금융 1000억원 집행 결정 ...",https://www.ekn.kr/web/view.php?key=20260618020524472,"특히 이번 사업은 장기 직접전력구매계약(PPA)을 기반으로 설계됐으며, 생산된 전력은 향후 30년간 재생에너지 공급사업자인 현대건설에 전량 판매될 예정이다. 이를 통해 국내 기업들의 재생에너지 사용 확대와 RE100... "
2026-06-18,네이버뉴스,[뉴스락 단독] 물난리 빼고 벌점 깎아준 고양시… 현대건설 지축역 '설...,http://www.newslock.co.kr/news/articleView.html?idxno=131607,"은 시공사인 현대건설의 부실벌점이 쪼개지는 과정에서 터져 나온 지자체의 '탁상행정' 논란을 시작으로, 법인 등기부와 건축물대장 분석을 통해 포착된 설계·감리 업체의 인적 유착 의혹까지 추적했다. 단일 현장을 넘어... "
2026-06-18,네이버뉴스,"오세훈 ""GTX 삼성역 논란은 권언유착·관권선거""…MBC·국토부·민주당 ...",https://www.newdaily.co.kr/site/data/html/2026/06/18/2026061800223.html,"이후 현대건설이 올해 3월 최종 시공계획서를 제출했고 보강을 마치면 기둥 성능이 당초 설계 기준을 넘는다고 밝혔다. 오 시장은 국토부를 향해서도 ""외부 전문가와 긴급안전점검을 벌여 안전에 이상이 없다는 결론을... "
2026-06-18,네이버뉴스,"[금융家 브리핑] AI부터 농촌 지원까지···금융업계, ESG·디지털 행보...",https://www.smartbizn.com/news/articleView.html?idxno=146501,"생산된 전력은 향후 30년 동안 재생에너지 공급사업자인 현대건설에 판매될 예정이다. 장기 직접전력구매계약(PPA)을 기반으로 사업 안정성을 확보했으며, 향후 70MW와 140MW 규모 사업이 추가되면 총 300MW급 태양광... "
2026-06-18,네이버뉴스,"신한금융, 의료·재생에너지·자산승계로 영역 확장…그룹사 간 전략적...",https://www.newstnt.com/news/articleView.html?idxno=706933,"생산 전력은 향후 30년간 현대건설과 장기 PPA로 전량 공급돼 RE100 이행 지원과 사업 안정성을 확보했으며, 최종적으로는 300MW 규모 클러스터로 확대될 계획이다. 한편 신한투자증권은 상속·증여 특화 신탁 서비스... "
2026-06-18,네이버뉴스,"신한은행, 전남 영광 90MW급 태양광 발전사업 2410억원 PF 금융약정 완료",https://www.s-journal.co.kr/news/articleView.html?idxno=41847,"특히 이번 사업은 장기 직접전력구매계약(PPA)을 기반으로 설계됐으며, 생산된 전력은 향후 30년간 재생에너지 공급사업자인 현대건설에 전량 판매될 예정이다. 이를 통해 국내 기업들의 재생에너지 사용 확대와 RE100... "
2026-06-18,네이버뉴스,"""유럽 원전 시장 공략 본격화""... 현대건설, 네덜란드 원전 공급망 구축",http://www.thefirstmedia.net/news/articleView.html?idxno=201654,사진=현대건설 현대건설이 미국 원전 기업 웨스팅하우스와 함께 네덜란드 현지 공급망 확보에 나서며 유럽 원전 시장 공략에 속도를 내고 있다. 탄소중립과 에너지 안보 강화 기조 속에서 유럽 각국이 신규 원전 건설에... 
2026-06-18,네이버뉴스,"""30년 장기 PPA 기반""... 신한은행, 영광 태양광 사업 금융 지원",http://www.thefirstmedia.net/news/articleView.html?idxno=201686,"생산된 전력은 향후 30년간 재생에너지 공급사업자인 현대건설에 전량 판매될 예정으로, 국내 기업들의 RE100 이행을 지원하는 동시에 안정적인 수익 구조를 확보했다는 평가다. 이번 사업은 1단계 90MW를 시작으로... "
2026-06-18,네이버뉴스,"마곡 품은 강서 원도심, 재정비 '속도전'",https://www.goodkyung.com/news/articleView.html?idxno=288303,현대건설·현대엔지니어링 컨소시엄이 시공을 맡아 총 1476세대 규모의 대단지로 탈바꿈하는 방화3구역은 특히 일반분양 물량만 660세대에 달해 서남권 정비사업장 중 사업성이 가장 우수하다는 평가를 받는다.... 
2026-06-18,네이버뉴스,AI·에너지안보에 전력투자 확대… 유럽 노리는 K-건설,http://www.the-biz.co.kr/news/articleView.html?idxno=722840,현대건설은 지난 9일 원전·SMR 투자 재원 확보를 위해 5000억원 규모 전환사채(CB) 발행을 결정했다. 회사는 해당 자금을 원전과 차세대 에너지 사업 투자에 활용할 계획이다. 또 현대건설은 최근 미국 웨스팅하우스와 함께... 
2026-06-18,네이버뉴스,[거래소 기관] 현대차·LG엔솔은 팔고 삼성전자 SK하이닉스 담았다,https://www.pinpointnews.co.kr/news/articleView.html?idxno=461270,"호텔신라, HJ중공업, 케이뱅크, HL만도, 현대건설, 한국항공우주, 한솔테크닉스 등도 순매수 대상에 포함되며 내수·항공·건설 및 방산 관련 종목으로 매수 범위가 확대됐다. 또한 미래에셋생명, CJ, 현대해상, LS... "
2026-06-18,네이버뉴스,"신한은행, 2400억 규모 영광 태양광 발전 금융약정 완료",https://www.newstree.kr/newsView/ntr202606180019,"특히 이번 사업은 장기 직접전력구매계약(PPA)을 기반으로 설계됐으며, 생산된 전력은 향후 30년간 재생에너지 공급사업자인 현대건설에 전량 판매될 예정이다. 이를 통해 국내 기업들의 재생에너지 사용 확대와 RE100... "
2026-06-18,네이버뉴스,"오세훈 ""GTX-A 논란은 관권선거 흑역사...MBC, 선동 도구 전락""",http://www.fnnews.com/news/202606181548098553,현대건설이 올해 3월 17일 제출한 최종 기둥보강 시공계획서에 따르면 보강 공사를 완료할 경우 당초 설계 기준보다 버티는 힘이 높아진다. 해당 내용을 국가철도공단과 국토교통부 역시 인지하고 있었다는 주장이다. 오... 
2026-06-18,네이버뉴스,[거래소 외국인] 삼성전자 삼성전기 HD현대중공업 SK하이닉스 한화에어...,https://www.pinpointnews.co.kr/news/articleView.html?idxno=461269,"또한 대우건설, 현대건설, 대원전선, 한온시스템, 한전산업, 한화솔루션 등도 순매도 대상에 포함되며 건설과 전력, 2차전지 관련 종목에서 차익 실현 압력이 확대됐다. 시장에서는 외국인의 이번 매매 흐름이 단순한... "
2026-06-18,네이버뉴스,"창신9·10구역 재개발, 신탁동의율 75% 돌파…4,500가구 매머드 정비사업...",https://www.housingherald.co.kr/news/articleView.html?idxno=62055,"이미 강북 정비사업 1위 프리미엄 건설사인 △GS건설은 물론, 대한민국 정비사업 1위 건설사인 △현대건설, 용산정비창 수주를 통해 경쟁력을 입증한 △IPARK현대산업개발 등의 대형사들이 현장에 집결해 곳곳에서... "
2026-06-18,네이버뉴스,"신한은행, 산은과 영광 태양광 사업에 2410억원 금융 지원",https://www.ziksir.com/news/articleView.html?idxno=137365,"특히 이번 사업은 장기 직접전력구매계약(PPA)을 기반으로 설계됐으며, 생산된 전력은 향후 30년간 재생에너지 공급사업자인 현대건설에 전량 판매될 계획이다. 이를 통해 국내 기업들의 재생에너지 사용 확대와 RE100... "
2026-06-18,네이버뉴스,"신한은행, 2,410억 규모 전남 영광 태양광 발전사업 PF 금융약정 완료",http://www.newsbrite.net/news/articleView.html?idxno=198716,"이번 사업은 장기 직접전력구매계약(PPA)을 기반으로 설계되었으며, 생산된 전력은 향후 30년간 현대건설에 전량 판매될 예정이다. 프로젝트는 1단계 90MW를 시작으로 2단계 70MW, 3단계 140MW로 확대될 예정이며... "
2026-06-18,네이버뉴스,"신한은행, 산은과 2410억 태양광 PF 금융약정 '맞손'",http://www.finomy.com/news/articleView.html?idxno=255926,특히 장기 직접전력구매계약(PPA)을 기반으로 설계돼 생산된 전력은 향후 30년간 재생에너지 공급사업자인 현대건설에 전량 판매될 예정이다. 장기 수요처를 확보함으로써 사업 안정성을 높이는 동시에 국내... 
2026-06-18,네이버뉴스,"현대건설, 네덜란드서 원전 심포지엄 개최…유럽 시장 공략 박차",https://www.socialvalue.kr/news/view/1065592901186438,"현대건설이 유럽 원전 시장 공략에 속도를 내고 있다. 현대건설은 미국 원자력 기업 웨스팅하우스와 함께 네덜란드에서 '네덜란드 서플라이어 심포지엄'을 개최했다고 18일 밝혔다. ▲지난 16, 17일(현지시간)... "
2026-06-18,네이버뉴스,"""재생에너지 발굴"" 신한은행, 2410억 태양광 발전사업 PF 금융약정",https://www.asiaa.co.kr/news/articleView.html?idxno=252726,"특히 30년 장기 직접전력구매계약(PPA)을 기반으로 한 사업으로, 생산된 전력은 재생에너지 공급자인 현대건설에 전량 판매된다. 향후 2단계 70MW, 3단계 140MW를 추가해 총 300MW 규모의 태양광 클러스터로 확장된다. 이는... "
2026-06-18,네이버뉴스,"해수부 ‘해양수산 창업설명회’ 개최.... “해양수산 창업, 지원보다 ...",https://it.donga.com/109044/,"서울창조경제혁신센터와 함께 주관하며, 올해는 롯데중앙연구소, 아모레퍼시픽, 인천항만공사, 한화오션, 현대건설, CJ제일제당, HD현대삼호 등 7개 대기업이 오픈이노베이션 수요 기업으로 참여한다. 친환경/첨단선박... "
2026-06-18,네이버뉴스,"이한우 현대건설 원전에 해상풍력도 박차, 철근구조물 자회사로 시장 선...",https://www.businesspost.co.kr/BP?command=article_view&num=440295,현대건설이 원전뿐 아니라 해상풍력 분야에서도 국내 최대 규모 단지의 설계·조달·시공(EPC) 조 단위 계약을 수주 후보군에 올려두고 에너지 중심 성장전략에 고삐를 죄고 있다. 이한우 현대건설 대표이사는 해상풍력... 
2026-06-18,네이버뉴스,"신한은행, 전남 영광 태양광 발전사업 PF 금융약정 완료",https://www.cnbnews.com/news/articleView.html?idxno=1005137,특히 이번 사업은 30년간 현대건설에 전력을 전량 판매하는 장기 직접전력구매계약(PPA)을 기반으로 설계돼 사업 안정성을 높였다는 것. 1단계 90MW를 시작으로 향후 총 300MW 규모의 태양광 클러스터로 확대될 계획이다.... 
2026-06-18,네이버뉴스,"오세훈 ""MBC, 관권선거 선전·선동 도구로 활용돼""",http://www.inews24.com/view/1977758,"확정했다""며 ""시공사인 현대건설이 지난 3월 17일 서울시에 제출한 최종 기둥보강 시공계획서에 따르면 기둥 보강 방법을 적용했을 때 버티는 힘이 58,604kN에서 60,915kN으로 향상됐다""고 설명했다. 그러면서 ""이것은 당초... "
2026-06-18,네이버뉴스,"신한은행, 2,410억원 규모 전남 영광 태양광 발전사업 PF 금융약정 완료...",http://www.queen.co.kr/news/articleView.html?idxno=458813,"생산된 전력은 향후 30년간 현대건설에 전량 판매될 예정으로, 기업들의 재생에너지 사용 확대와 RE100 이행을 지원하는 동시에 안정적인 수요처 확보로 사업의 지속성을 높였다. 프로젝트는 1단계 90MW를 시작으로... "
2026-06-18,네이버뉴스,[건설업계 동향] 현대건설ㆍGS건설ㆍ포스코이앤씨ㆍBS한양ㆍSH(6.18),http://www.weeklytoday.com/news/articleView.html?idxno=780702,"■ 현대건설, 유럽 대형원전 수주전 속도...웨스팅하우스와 심포지엄 개최 현지 기업 100여곳 협력 논의…신규 원전 2기 공략 기반 확대 현대건설은 16~17일(현지시간) 네덜란드에서 미국 원자력 기업 웨스팅하우스... "
2026-06-18,네이버뉴스,영덕에 대형 원전·기장에 SMR 확정...12조 건설 수주전 '신호탄',http://www.dailypop.kr/news/articleView.html?idxno=99798,"신한울 3·4호기 주설비 공사 시공사는 현대건설 컨소시엄(현대건설 55%·두산에너빌리티 35%·포스코이앤씨 10%)으로, 총 공사비 11조7000억원 중 주설비 공사 계약인 3조1000억원을 수주했다. 종합설계는... "
2026-06-18,네이버뉴스,"[분양] 포스코이앤씨, '더샵 검단레이크 파크' 외",https://www.seoulfn.com/news/articleView.html?idxno=631422,"현대건설, '힐스테이트 양산더스카이' 견본주택 19일 개관 현대건설은 경남 양산시에 '힐스테이트 양산더스카이' 견본주택을 19일 개관하고 분양에 나선다. 이 단지는 2개 단지, 총 598가구 규모로 경남 양산... "
2026-06-18,네이버뉴스,"오세훈, MBC GTX-A 보도 “관권선거 보여준 흑역사”",https://biz.chosun.com/topics/topics_social/2026/06/18/ZR3Y5O3I7FCQHFR6UAJ4TLU7UM/?utm_source=naver&utm_medium=original&utm_campaign=biz,"확정했다”며 “현대건설이 올해 3월 17일 제출한 최종 기둥보강 시공계획서에 따르면, 기둥 보강 방법을 적용했을 때 버티는 힘이 5만8604kN에서 6만915kN으로 향상됐다. 당초 설계 기준을 웃도는 수준의 성능이 확보된... "
2026-06-18,네이버뉴스,"오세훈 ""GTX 삼성역 논란은 관권선거…MBC·국토부·민주당 삼각편대""",https://www.news1.kr/local/moi/6201527,"또 현대건설이 지난 3월 제출한 최종 기둥 보강 시공계획서에 따르면 보강 이후 구조물이 버티는 힘이 58604kN에서 60915kN으로 높아져 당초 설계 기준을 웃도는 성능이 확보됐다고 강조했다. 오 시장은 ""국토부가 외부... "
2026-06-18,네이버뉴스,"신한은행, 산은과 2410억원 '전남 영광 태양광 발전사업 PF' 금융약정",https://daily.hankooki.com/news/articleView.html?idxno=1377834,"특히 이번 사업은 장기 직접전력구매계약(PPA)을 기반으로 설계됐으며, 생산된 전력은 향후 30년간 재생에너지 공급사업자인 현대건설에 전량 판매될 예정이다. 이를 통해 국내 기업들의 재생에너지 사용 확대와 RE100... "
2026-06-18,네이버뉴스,[기획] '국평 27억' 노량진뉴타운…고시촌에서 '하이엔드 타운'으로 변모,https://www.m-i.kr/news/articleView.html?idxno=1382980,"구역별로 보면 1·3구역은 포스코이앤씨 '오티에르', 2·6·7구역은 SK에코플랜트 '드파인', 4구역은 현대건설 '디에이치', 5구역은 대우건설 '써밋', 8구역은 DL이앤씨 '아크로'가 들어선다. 사실상 강남·한남동·용산 등... "
2026-06-18,네이버뉴스,"신한銀 , 2400억 영광 태양광 발전 PF 약정",https://www.sedaily.com/article/20057390?ref=naver,생산된 전력은 향후 30년간 재생에너지 공급사업자인 현대건설에 전량 판매될 예정이다. 국내 기업들의 재생에너지 사용 확대와 RE100 이행을 지원하는 동시에 장기 수요처 확보를 통해 사업 안정성을 높였다는... 
2026-06-18,네이버뉴스,"신한은행, 전남 영광 '90MW 태양광 PF' 2410억원 약정 완료",https://www.newsmap.co.kr/news/articleView.html?idxno=774,"이번 프로젝트는 장기간의 직접전력구매계약(PPA) 구조를 바탕으로 설계됐으며, 생산된 전력은 향후 30년간 현대건설에 전량 공급될 예정이다. 이를 통해 국내 기업의 재생에너지 사용 확대와 RE100 달성을 뒷받침하고... "
2026-06-18,네이버뉴스,"울산시, 하도급률 37% 목표 박차…지역건설업체 참여 확대",https://www.viva100.com/article/20260618500663,"시는 지난 5월 현대건설과 삼성물산, 한화, 우미건설, IS동서, SM삼환기업 등 대형건설사 본사를 방문해 지역업체 참여 확대를 요청했다. 또한 지난 3월부터 6월까지 공공·민간 건설현장 51곳을 대상으로 민관 합동 현장... "
2026-06-18,네이버뉴스,울산 지역업체 2분기 하도급률 35.95%,https://www.ksilbo.co.kr/news/articleView.html?idxno=1059839,"앞서 울산시는 지난 5월 현대건설, 삼성물산, 한화, 우미건설, 아이에스동서, 에스엠(SM)삼환기업 등 대형건설사 6개 본사를 방문해 지역업체 하도급 참여 확대를 요청했다. 또한 올해 3월부터 6월까지 공공·민간... "
2026-06-18,네이버뉴스,"서울시, MBC 상대 정정보도·손해배상 청구…오세훈 ""권언유착·관권선...",https://www.dailian.co.kr/news/view/1657367/?sc=Naver,"오 시장은 ""현대건설이 올해 3월17일 제출한 최종 기둥보강 시공계획서에 따르면, 기둥 보강 방법을 적용했을 때 버티는 힘이 5만8604kN에서 6만915kN으로 향상됐는데 당초 설계 기준을 웃도는 수준의 성능이 확보된 것... "
2026-06-18,네이버뉴스,"15년 차 연구원, 창업가로 ‘변신’…현대차그룹 스타트업 육성 ‘개방...",https://biz.heraldcorp.com/article/10774535?ref=naver,현대건설에서 원자력 연구시설 공조 설계를 담당했던 이성훈 포지티브플로 대표는 수면 환경 개선에 주목했다. 아이들이 잠을 자며 이불을 걷어차는 모습을 보며 문제의식을 느낀 그는 원자력 시설 공조 기술을 침대에... 
2026-06-18,네이버뉴스,'30조' 목동 재건축 수주전 막올랐다…대형 건설사간 각축전 예고,https://www.mt.co.kr/estate/2026/06/18/2026061714481276461,현대건설은 목동 일대에 '디에이치 목동 라운지'를 운영하며 조합원 접점을 넓히고 있다. 대우건설도 목동중학교 인근에 '써밋 목동 라운지'를 열고 8·11·14단지 등을 겨냥한 홍보전에 나섰다. GS건설과 롯데건설은... 
2026-06-18,네이버뉴스,[오늘의 건설리뷰] HJ중공업·현대건설·GS건설,http://www.financialreview.co.kr/news/articleView.html?idxno=42973,"현대건설은 유럽 에너지 시장 공략을 위한 현지 파트너십 강화에 나서며 유럽 원전 특수 기대감을 높이고 있다. GS건설이 사내 AI활용 경진대회, 전 직원 대상 교육 등을 통해 전사 AI 내재화 속도를 단다. 이미지... "
2026-06-18,네이버뉴스,"현대건설, 네덜란드 원전 '정조준'... 유럽 수주전 참여 노린 '역대급' ...",https://www.insight.co.kr/news/559194,"현대건설이 미국 원자력 기업 웨스팅하우스와 손잡고 네덜란드 신규 원전 시장 공략을 본격화하고 있다. 단순한 기술 소개를 넘어 현지 공급망을 미리 구축하고, 유럽 원전 수주전에서 경쟁력을 확보하기 위한 선제적... "
2026-06-18,네이버뉴스,"오세훈 ""MBC·국토부·민주당 삼각편대 관권선거""",https://www.thereport.co.kr/news/articleView.html?idxno=88888,"시공사 현대건설은 2025년 10월 이를 인지했고, 서울시는 지난해 11월10일 시공사와 감리단으로부터 지하 5층 기둥 시공 오류를 처음 보고받았다. 이후 기둥 보강 방안 검토 보고(2025년 12월19일), 구조물 보강 방안... "
2026-06-18,네이버뉴스,"현대건설, 웨스팅하우스와 유럽 대형원전 시장 공략 가속화",http://www.koreastocknews.com/news/articleView.html?idxno=119188,"현대건설(000720, 대표 이한우)이 유럽 에너지 시장 공략을 위한 현지 파트너십 강화에 나서며 유럽 원전 특수 기대감을 높이고 있다. 현대건설은 지난 16, 17일(현지시간) 양일간 네덜란드 코트야드 바이 메리어트... "
2026-06-18,네이버뉴스,오세훈 “MBC·국토부·민주당 삼각편대가 GTX-A 철근 누락 논란 키워”,https://www.munhwa.com/article/11596555?ref=naver,"이어 “현대건설이 올해 3월 제출한 최종 기둥 보강 시공계획서에 따르면 보강 후 구조 성능은 당초 설계 기준을 웃도는 수준으로 확보됐으며, 이 내용은 국가철도공단과 국토교통부에도 공유됐다”고 밝혔다. 오 시장은... "
2026-06-18,네이버뉴스,"신규 원전 부지 확정에 건설업계 반색…""K-SMR, 해외진출 교두보될 것""",https://www.mt.co.kr/estate/2026/06/18/2026061812022752695,"다만 실제 수주 경쟁이 본격화될 경우 현대건설, 삼성물산, 대우건설 등 기존 원전 시공 경험을 보유한 대형 건설사들이 주도권을 쥘 가능성이 높다는 분석이 우세하다. 한 대형 건설사 관계자는 ""원전은 건설사 입장에서... "
