date,source,title,link,description
2026-07-12,네이버뉴스,"""더는 안 속아! 핵발전소는 지역 소멸의 덫"" 영덕·기장의 경고",https://www.newsclaim.co.kr/news/articleView.html?idxno=3069170,"한국수력원자력이 지난달 17일 경북 영덕군을 신규 대형원전 2기, 부산 기장군을 소형모듈원자로(SMR) 1기 건설 부지로 확정했다. 정부가 '핵발전 르네상스'를 내세우며 공급 확대에 속도를 내는 사이, 현장에서는 정반대의... "
2026-07-13,네이버뉴스,"AI혁명 시대, 결국 '열'을 잡는 나라가 이긴다 [김형자의 세상은 지금]",https://www.sisajournal.com/news/articleView.html?idxno=379157,"이 데이터센터는 해상풍력단지 내 발전기 근처에 수중 침하시켜 전용 광전 케이블로 직접 연결한 구조다.... 그렇다면 강이 아닌 바다 밑에 데이터센터를 건설하는 이유는 뭘까. 거센 파도와 싸워야 하고, 바닷물 특유의... "
2026-07-13,네이버뉴스,"한수원-한화오션, 영광 해상풍력 사업 합의서 체결",https://www.gukjenews.com/news/articleView.html?idxno=3633657,"영광 칠해 해상풍력 발전사업 성공 추진 위한 합의서 체결식 영광 칠해 해상풍력은 영광군 해상에 총 설비용량 1020메가와트 규모로 건설될 예정이며, 2029년 9월 착공해 2032년 10월 상업운전을 목표로 하고 있다. 양사는... "
2026-07-13,네이버뉴스,"울산시의회 상임위 활동, 문화·관광 투트랙 '재미있는 울산' 당부",https://www.ksilbo.co.kr/news/articleView.html?idxno=1061868,◇산업건설위원회(위원장 백현조) 산건위는 경제산업실·울산테크노파크·울산정보산업진흥원 소관 주요... 이주언 위원은 높은 생산 단가와 터빈 수명 리스크 분석 없이 추진되는 부유식 해상풍력 사업의 실익을 따져... 
2026-07-12,네이버뉴스,'최고 복지는 일자리' 염두에 두고 섬기는 행정 실천할 것,http://www.gnmaeil.com/news/articleView.html?idxno=590593,"항만 건설에 그치지 않고 진해구 남양·성내·원포동 일원에 산업·물류·정주 기능이 어우러진 첨단 복합형... RE100 산업단지 태양광, 영농형 태양광, 진해신항 수소에너지 허브, 해상풍력 등을 단계적으로 추진해... "
2026-07-12,네이버뉴스,"한수원, 한화오션과 ʻ영광 칠해 해상풍력ʼ 공동추진 합의서 체결",https://www.cstimes.com/news/articleView.html?idxno=713115,"양사는 총 설비용량 1,020메가와트(MW) 규모로 건설되는 '영광 칠해 해상풍력 발전사업'의 성공적인 추진을 핵심으로 한 주요조건 합의서(이하 합의서)를 지난 10일 서울 한화빌딩에서 체결했다고 밝혔다. 이번 프로젝트는... "
2026-07-12,네이버뉴스,“부산에 AI·재생에너지 물류 거점 조성 땐 첨단산업 유치”,https://www.busan.com/view/busan/view.php?code=2026071218155795282,"서부산스마트밸리(옛 신평·장림산단)는 추진 중이거나 허가 신청 단계인 해상풍력이 실현될 경우... 보고서는 부산시가 RE100 산단 조성에 의지를 갖고 정부의 K해양강국 정책, 가덕신공항 건설과 연계해 AI 기반... "
2026-07-13,네이버뉴스,"미국, 캘리포니아주도 연방정부도 수소 투자엔 '신중 모드'",http://dream.kotra.or.kr/kotranews/cms/news/actionKotraBoardDetail.do?SITE_NO=3&MENU_ID=80&CONTENTS_NO=2&bbsGbn=242&bbsSn=242&pNttSn=242584,"둘째, 45V 세액공제의 착공 시한(2028년 1월 1일)을 고려해 신규 프로젝트의 일정을 검토할 필요가 있다. 셋째, 글로벌 시장별 청정수소 인프라 성숙도와 사업 성격의 차이를 감안한 '투트랙(Two-Track) 전략'이... "
2026-07-13,네이버뉴스,'호남 반도체 클러스터' 속도전 … 올해 착공해 2030년 양산 목표,http://www.queen.co.kr/news/articleView.html?idxno=460129,이르면 올해 말 메모리 반도체 팹(Fab·제조시설) 2기 착공을 시작으로 오는 2030년 첫 제품을 양산한다는... 이는 대규모 반도체 공장이 안정적으로 운영되기 위한 핵심 인프라로 꼽힌다. 이를 위해 시는 신장성변전소와... 
2026-07-13,네이버뉴스,서산 해미국제성지 순례 인프라 확충..세계청년대회 준비,http://www.tjb.co.kr/sub0301/bodo/view/id/100849,서산시가 내년 천주교 세계청년대회를 앞두고 해미국제성지 순례 인프라 확충에 속도를 내고 있습니다.... 순례객 체류형 프로그램을 위한 문화교류센터도 다음 달 착공해 내년 8월 세계청년대회 이전 준공을 목표로... 
2026-07-13,네이버뉴스,"보완 수사권 국물도 남김 없이 폐지, 민주당 교통정리도 안 됐다: 슬로우...",https://slownews.kr/163090,"135만 호, 2030년까지 착공도 어렵다.젠더 투표 격차, 간단한 문제 아니다. 39.9도, 폭염 중대경보. 어제 경북... “하이퍼스케일러의 경쟁적 AI 인프라 투자는 더는 유효하지 않다”는 분석이다. 상장 주간사였던... "
2026-07-13,네이버뉴스,"군포복합문화센터 건립, 행안부 중앙투자심사 ‘조건부 승인’",http://www.mediagunpo.co.kr/21601,군포복합문화센터는 시민의 문화 향유 기회를 확대하고 생활체육 인프라를 확충하기 위해 조성하는... 건립 공사가 조속히 착공될 수 있도록 설계와 인허가 등 후속 행정절차에도 속도를 낼 계획이다. 다만 시 재정 여건과... 
2026-07-13,네이버뉴스,[골재 품질과 건설 안전] 불량 골재 막을 유통이력관리제…법안 계류에...,https://dealsite.co.kr/articles/164756,"하지만 현재 전국적으로 대규모 공공 인프라 사업이 본격화되는 시점이라는 것을 감안할 때 법안의 신속한 통과가 필요하다는 주장이 제기된다. 3기 신도시 조성과 가덕도신공항, GTX 등 국가 주요 사업이 순차적으로 착공... "
2026-07-13,네이버뉴스,"수협중앙회·목포수협, 마른김 가공·유통시설 착공",https://www.aflnews.co.kr/news/articleView.html?idxno=324237,"시설 착공식'을 성황리에 개최했다. 이날 행사에는 전국 회원조합 조합장, 목포시장, 지역 기관장 등... 특히 최첨단 마른김 가공 인프라 구축을 통해 지난해 발생했던 물김 대량 폐기 사태와 같은 문제를 미연에 방지하고... "
2026-07-13,네이버뉴스,[Who Is ?] 전선규 미코 대표이사 회장,https://www.businesspost.co.kr/BP?command=article_view&num=441567,생산 인프라를 늘리고 있다. 이들 3개사의 인수로 미코는 에너지·플랜트 밸류체인의 골격을 갖췄다.... 미코파워는 2024년 11월 경기 평택 브레인시티에 수소연료전지 공장을 착공했다. 이 공장은 2026년 3분기 이후... 
2026-07-13,네이버뉴스,"中 습격에 안방 뺏긴 석화업계, '반도체' 밧줄 잡고 사투",https://news.bizwatch.co.kr/article/industry/2026/07/10/0022,롯데케미칼은 자회사 한덕화학을 앞세워 반도체 인프라 구축에 나섰다. 한덕화학은 지난달 경기도 평택에서 반도체와 디스플레이용 현상액인 수산화테트라메틸암모늄(TMAH) 생산공장 착공식을 열었다. 현상액은... 
2026-07-13,네이버뉴스,베일 벗는 '호남 반도체 클러스터'…올해 착공·2030년 양산 속도전,https://www.news1.kr/local/gwangju-jeonnam/6225225,"이르면 올해 말 메모리 반도체 팹(Fab·제조시설) 2기 착공을 시작으로 2030년 첫 제품을 양산한다는 구상이다.... 이를 위해 시는 신장성변전소, 동복댐, 한국수자원공사, 한국전력공사 등 유관 기관을 직접 방문해 인프라... "
2026-07-13,네이버뉴스,“이번엔 꼭”… 김포 호반써밋 풍무Ⅲ 견본주택에 실수요자 북적,https://www.seoul.co.kr/news/economy/estate/2026/07/13/20260713032001?wlog_tag3=naver,"김포한강로와 김포대로, 풍곡IC와 영사정IC 등 광역 도로 인프라도 더욱 개선될 예정이어서 서울에서 가장 가까운 김포 초입 입지로 평가받는다. 인근에 ‘인하대 김포 메디컬캠퍼스’가 들어선다. 2028년 착공 목표다.... "
2026-07-13,네이버뉴스,SK하이닉스 40조와 유럽 AI 인프라…문화유산은 AI 산업이 될까,https://www.econovill.com/news/articleView.html?idxno=744964,데이터센터를 착공한다고 밝혔다. 투자 규모는 130억캐나다달러 이상이다. 메타의 캐나다 첫 데이터센터이자 글로벌 33번째 데이터센터다. 메타는 전력 사용 비용과 신규 전력·전력망 인프라 비용을 부담하겠다고... 
2026-07-13,네이버뉴스,공약으로 읽는 경기도 ‘특례시’…의회별 공약 들여다보니 [지방의원 ...,https://www.kyeonggi.com/article/20260712580146,대표적으로 ‘국도 17호선(양지-원삼) 확장 추진’과 ‘남동 LH 택지개발지구 적기 착공 추진’ 등 급격한 도시 확장과 생활권 분산에 대응하기 위한 인프라 공약들이 대거 포함됐다. 최다 공약자는 4개 특례시의회... 
2026-07-13,네이버뉴스,삼성전자 “용인 팹 2년 앞당겨 2029년 가동”… 호남 메가프로젝트에 ...,https://www.seoul.co.kr/news/economy/industry/2026/07/13/20260713008003?wlog_tag3=naver,"업계에서는 첫 번째 팹을 2029년 가동하려면 부지 조성 공사가 늦어도 올해 하반기에는 시작되고, 2027년 중에는 팹 착공이 이뤄져야 한다고 보고 있다. 이에 용인 산단의 전력·용수 등 핵심 인프라 공급 일정도 함께... "
2026-07-13,네이버뉴스,삼성전자 용인 팹 건설… 1기 완공 2년 앞당긴다,https://www.donga.com/news/Economy/article/all/20260713/134284469/2,부지 착공에 들어가야 한다. 연내 신속한 토지 수용 및 보상 절차가 마무리되어야 하는 것. 청와대 관계자는... 초미세 공정에 필수적인 초대형 전력망과 대규모 공업용수 확보를 위한 정부 차원의 인프라 구축도... 
2026-07-13,네이버뉴스,"본격 속도내는 용인 팹… 韓-美-中, 메모리 설비 확충 경쟁",https://www.donga.com/news/Economy/article/all/20260713/134284398/2,삼성전자는 이에 더해 경기 평택·용인 및 충남 지역 반도체 인프라에 총 1706조 원을 투자하며... LH는 토지 보상 절차와 착공 준비를 병행해 사업 기간을 단축하겠다는 구상이다. 현재 전체 사유지 중 협의 보상이... 
2026-07-13,네이버뉴스,울주군을 대한민국 산악관광 요람으로 이끌 ‘이천분교 베이스캠프 착공,http://www.kookje.co.kr/news2011/asp/newsbody.asp?code=0700&key=20260712.99099003257,"산악관광 인프라 구축에 속도를 낸다. 영남알프스를 중심으로 다양한 산악관광 콘텐츠를 마련하고, 관광객 편의성을 높여 지역 관광 활성화 및 균형 발전을 도모한다는 구상이다. 내년 착공을 목표로 울주군 상북면... "
2026-07-13,네이버뉴스,[패트롤] 광명시-군포시-시흥시-양평군-하남시,https://www.ekn.kr/web/view.php?key=20260713025041742,군포복합문화센터는 시민의 문화 향유 기회 확대와 생활체육 인프라 확충을 위한 복합문화공간으로... 건립 공사가 조속히 착공될 수 있도록 후속 행정절차에도 속도를 낼 방침이다. 한대희 군포시장은 13일 “이번... 
2026-07-13,네이버뉴스,"광주 군공항, 800조 AI 반도체 메카로 가는 길",http://www.kwangju.co.kr/article.php?aid=1783868700801151131,"반도체 팹 착공을 앞당기려면 신공항 이전 추진과 동시에 군공항 부지 일부를 먼저 활용할 수 있도록 하는... 따라서 무안공항과의 연계는 중앙정부가 재정, 제도, 인프라, 소음대책, 지역발전 패키지를 보증하고... "
2026-07-13,네이버뉴스,"울주군, 이천분교 베이스캠프 첫삽...산악관광 인프라 구축 본격화",https://www.ksilbo.co.kr/news/articleView.html?idxno=1061917,"아울러 군은 이번 이천분교 베이스캠프 건립공사를 시작으로, 영남알프스 일대 산악관광 인프라 구축에 본격 속도를 낸다. 내년 착공을 목표로 상북면 영남알프스 복합웰컴센터에 산악 익스트림센터 건립을 추진 중이며... "
2026-07-12,네이버뉴스,영남알프스 산악관광 육성…이천분교 베이스캠프 첫 삽,https://www.ulsanpress.net/news/articleView.html?idxno=579010,울주군은 이번 이천분교 베이스캠프 건립공사를 시작으로 영남알프스 일대 산악관광 인프라 구축에 본격 속도를 낸다는 계획이다. 이미 내년 착공을 목표로 울주군 상북면 영남알프스 복합웰컴센터에 산악... 
2026-07-12,네이버뉴스,페로타임즈 손바닥뉴스 7월 10일(금),http://www.ferrotimes.com/news/articleView.html?idxno=49079,"녹색 인프라' 추진 광양제철소, 혹서기 'AI 기반 휴게물품 신청시스템' 개발 삼미금속, 선박엔진 증설 수혜... 전기로 착공…포스코·JFE와 '3축 증설' [상반기 韓 철스크랩 무역①] 수출 60만 톤 시대 재진입 2017년래 역대... "
2026-07-12,네이버뉴스,경북 포항 두호주공2·3차 재건축 본격화 '기대감',https://www.news2day.co.kr/article/20260712500050,"안전성 문제와 주차공간 부족, 생활 인프라 노후화 등이 지속적으로 주민 불편사항으로 지적됐으며... 다만 정비구역 지정 이후에도 조합 설립, 사업시행인가, 관리처분계획 인가, 이주와 착공 등 여러 단계의 절차가 남아... "
2026-07-12,네이버뉴스,"""평택 투자자들 벌써 움직였다""..전남광주 반도체 효과에 부동산 '들썩...",https://www.ikbc.co.kr/article/view/kbc202607120028,"송정동, 인프라가 잘 갖춰진 서구 치평동 등입니다. 지역 부동산 업계에 따르면 12일 기준으로 7월 첫째 주... 크게 묶어놓은 것으로 보인다""며 ""착공을 빠르게 앞당기겠다는 정부의 의지로도 해석된다""고 설명했습니다."
2026-07-12,네이버뉴스,인천 제물포·영종 시·구의원 공약 ‘개발·문화’ 초점…459건 공약 분...,https://www.kyeonggi.com/article/20260712580279,"영종둘레길 조성, 인천경제자유구역청 영종분소 설치, 세계평화의 숲 힐링 명소화, 공원·휴식 인프라... 신포동 관광특화거리 조성, 연안부두역 신설 및 트램 조기 착공, 동인천 민자역사 철거·재개발, 개항동... "
2026-07-12,네이버뉴스,"울주군, 이천분교 베이스캠프 건립공사 '첫 삽'",http://www.ujeil.com/news/articleView.html?idxno=388686,"울주군은 이번 이천분교 베이스캠프 건립공사를 시작으로, 영남알프스 일대 산악관광 인프라 구축에 본격 속도를 낸다. 내년 착공을 목표로 울주군 상북면 영남알프스 복합웰컴센터에 산악 익스트림센터 건립을 추진... "
2026-07-12,네이버뉴스,아산시 '삼성전자 46조 투자' 인허가 절차 본격화,https://www.dynews.co.kr/news/articleView.html?idxno=857544,"올 하반기 착공해 2029년 5월 양산이 목표다. 공장 증설이 완료되면 온양사업장 연면적은 기존 27만→42만㎡로... 양측은 기업 애로사항 해소와 산업 인프라 연계, 지역 인재 양성, 사회공헌 확대 등 협력 과제를 지속... "
2026-07-12,네이버뉴스,[취임 인터뷰] ‘미래를 결정할 골든타임’ 이현재 하남시장,https://www.kyeongin.com/article/1767152,이 시장은 “하남시 최초의 종합병원인 연세하남병원이 지난해 9월 착공해 내년 준공 계획인데 11개... 생활밀착형 인프라를 확충해 나갈 계획”도 제시했다. 그는 “2018년 12월 수도권 주택시장 안정을 위한... 
2026-07-12,네이버뉴스,[취임 인터뷰] ‘완성 위한 대도약·새 동력 도전’ 임병택 시흥시장,https://www.kyeongin.com/article/1767151,민선 8기에서는 국가첨단 바이오 특화단지를 유치하고 시흥배곧서울대병원 착공이라는 굵직한 성과를... 이에 더해 AI·바이오 융합 인프라는 더 확장한다. 지난 4월 경기도와 체결한 ‘피지컬 AI 확산센터 구축 협약’을... 
2026-07-12,네이버뉴스,"삼성 ""용인 반도체공장 첫 팹 1~2년 앞당겨 2029년 가동"" [용인 반도체도...",http://www.fnnews.com/news/202607121819129148,"중에는 착공과 함께 본격 골조 공사가 진행돼야 한다. 정부가 호남 반도체 클러스터와 함께 용인 클러스터에도 속도를 내겠다는 입장을 내놓은 만큼, 용인 산단의 전력과 용수 등 핵심 인프라 공급 일정 역시... "
2026-07-12,네이버뉴스,평택 투자 큰손들 광주로… 토허제 지정 전 '폭풍 매수',http://www.fnnews.com/news/202607121758135933,"관심이 쏠린 곳은 넓은 농지가 있는 광산구 우산동과 가격이 상대적으로 저렴한 송정동, 인프라가 갖춰진... 부동산 업계 관계자는 ""알박기 방지를 위해 토허 구역을 최대한 크게 묶어놓았을 것""이라며 ""착공을 빠르게... "
2026-07-12,네이버뉴스,“빌라 등 非아파트는 주택 수에 빼줘야 공급난 풀립니다.”,https://www.chosun.com/opinion/economic_focus/2026/07/12/K5AQZ3CIXVALLKBK4WVY34W2N4/?utm_source=naver&utm_medium=referral&utm_campaign=naver-news,"병원과 인프라를 갖춘 실버 주거 단지를 공급하면 수요는 분산된다.” -오세훈 시장이 재선되면서, 서울시와 중앙정부간 정책 공조가 어려워보인다. “9·7대책의 135만호나 1·29 대책의 6만1000호 건설을 조기에 착공하려... "
2026-07-12,네이버뉴스,희생과 보상…경기도 지자체 '반도체 상생' 과제,https://www.incheonilbo.com/news/articleView.html?idxno=1327123,"광주시는 오는 12일까지 관로가 통과하는 주민 토지수용 등 착공을 위한 절차를 진행한다. 이 같은 현상은... 안성·여주·광주·하남 등이 반도체 산업에 필요한 전력, 용수 인프라와 환경적 부담을 떠안았다는... "
2026-07-12,네이버뉴스,반도체 인재 붙잡을 생활인프라...광주 복쇼 개발 '눈길',http://www.mdilbo.com/detail/DDAuq0/757095,"특히 민선 8기 들어 추진 된 ‘복합쇼핑몰 3종’은 대형 쇼핑시설뿐 아니라 특급호텔과 의료·교육시설, 문화시설 등을 갖춘 복합개발인 만큼 지역 인프라를 끌어올릴 핵심사업으로 평가된다. 앞서 착공에 들어간... "
2026-07-12,네이버뉴스,"BPA, 베트남에 물류 거점 확보",https://www.busan.com/view/busan/view.php?code=2026071217234411301,물류 인프라를 확보하기 위해 추진된다. 부산항만공사와 동방의 자회사 동방비나는 베트남 하이퐁항 배후... 물류센터는 올해 9월 착공해 내년 상반기 개장을 목표로 진행되며 2056년까지 30년간 운영된다. 하이퐁 Deep C... 
2026-07-12,네이버뉴스,[긴급진단] 세계유산 1주년 '반구천의 암각화'…관광 인프라 확충 과제...,https://www.iusm.co.kr/news/articleView.html?idxno=1065274,또 박물관에서 암각화 현장으로 이어지는 도로 혼잡을 해소하기 위해 반구천 우회도로를 올해 말 착공해 내년 말 준공할 계획이라고 설명했다. 울산시도 편의시설 확충 필요성에는 공감하고 있다. 시 관계자는... 
2026-07-12,네이버뉴스,"울산, 수소전기차 안전인증센터 이달말 착공…미래차 거점으로",https://www.iusm.co.kr/news/articleView.html?idxno=1065273,울산 미래 수소 모빌리티 산업 경쟁력을 높일 핵심 인프라 구축이 본격 추진된다. 울산시는 이달 말 북구... 그동안 미래차 산업의 중심도시를 지향해 온 울산은 수소 생산·운송·활용 인프라와 수소차 생산기반을... 
2026-07-12,네이버뉴스,"삼성, 용인 반도체 첫 공장 2029년 '조기 가동'…AI 속도전",https://www.mdtoday.co.kr/news/articleView.html?idxno=604565,"공장 착공에 들어가야 한다. 반도체 생산시설 건설과 장비 반입, 가동 준비에 최소 2년가량이 필요하기 때문이다. 전력과 용수 등 산업 인프라 구축 일정도 함께 앞당겨져야 한다. 정부는 용인 국가산단 전력 공급을... "
2026-07-12,네이버뉴스,"[부동산 손플노트] 최상의 입지 공덕동 재개발, 학군지만 갖추면 딱인데...",https://www.mk.co.kr/article/12096440,"공덕1구역(마포자이힐스테이트라첼스)이 착공을 마치고 입주를 향해 치고 나가면서 주변 노후 구역들에서... 생활 인프라스트럭처로는 이마트 마포점, 롯데마트 서울역점이 차량 10분 거리에 있다. 연세대 세브란스병원... "
2026-07-12,네이버뉴스,영남알프스 산악관광 거점 '이천분교 베이스캠프' 첫 삽,https://www.iusm.co.kr/news/articleView.html?idxno=1065252,"산악관광 인프라 구축에 본격 속도를 낸다다는 방침이다. 울주군 상북면 영남알프스 복합웰컴센터에 산악 익스트림센터 건립을 추진 중으로, 내년 착공이 목표다. 익스트림센터에는 복합로프시설, 인도어카트... "
2026-07-12,네이버뉴스,목포권 기독교 근대역사관 착공… 서남권 종교관광 거점 첫 삽,https://www.segye.com/newsView/20260712511266?OutUrl=naver,"위한 인프라 건립 사업이 첫 삽을 떴다. 12일 목포시에 따르면 시는 최근 북교동 일원에서 강성휘 목포시장과 교계 인사, 지역 주민 등이 참석한 가운데 ‘목포권 기독교 근대역사관’ 신축공사 착공식을 개최했다.... "
2026-07-12,네이버뉴스,김대권 수성구청장 “문화·교육·미래산업 잇는 ‘목적지가 되는 수성...,https://www.kbmaeil.com/article/20260712500133,"여기에 복지와 생태, 교통 등 생활 인프라가 더해질 때 도시의 경쟁력이 완성된다”고 말했다. 민선 9기의... 10월 착공해 2027년 하반기 준공을 목표로 사업을 추진할 계획”이라고 설명했다. 그는 수상공연장이 단순한... "
2026-07-13,네이버뉴스,"[르포] 라인건설 유치권 행사에 조합원 반발… ""총회도 없이 추가 공사...",https://www.ilyoseoul.co.kr/news/articleView.html?idxno=519657,이후 임시사용승인을 거쳐 일반분양자 입주 절차는 시작됐지만 라인건설이 추가 공사비 미납부를 이유로 조합원 세대에 유치권을 행사하면서 일부 조합원들의 입주 제한 사태가 불거졌다. 입주 제한 논란은 법정... 
2026-07-13,네이버뉴스,정보 비대칭이 '불공정' 부른다…하도급계약 전 정보공개 필요,https://www.kmecnews.co.kr/news/articleView.html?idxno=50746,"지난 8일 법무법인 율촌 김순태 전문위원에 따르면, 건설공사 하도급은 원도급사가 발주자로부터 받은... 원도급사는 공기연장이나 설계변경 시 발주자에게 실비와 추가공사비를 청구할 수 있지만, 하도급사는 계약상... "
2026-07-13,네이버뉴스,금탑산업훈장이 높인 기계설비인의 자긍심,https://www.kmecnews.co.kr/news/articleView.html?idxno=50786,"2026년 건설의 날은 기계설비산업의 위상을 새롭게 확인한 뜻깊은 날로 기억될 것이다. 기계설비공사... 정부와 발주기관 역시 기계설비의 가치를 합당하게 평가하고, 적정 공사비와 기술 중심의 발주환경을 조성하는 데... "
2026-07-13,네이버뉴스,"안전 의무 짊어진 전문건설, ""권한 없이 의무만 늘어"" 불만 토로",https://www.kmecnews.co.kr/news/articleView.html?idxno=50796,"전문건설업계가 권한 없이 의무만 부여되는 산업안전 규정으로 인해 극심한 어려움을 겪고 있다. 이른바... 경기 소재 B전문업체 대표는 ""안전 기준 강화에 따른 공사비 증액과 공기 연장이 하도급 계약에 의무적으로... "
2026-07-13,네이버뉴스,싼 게 비지떡… 예산 절감의 진짜 해답은 '직접발주',https://www.kmecnews.co.kr/news/articleView.html?idxno=50784,'싼 게 비지떡'이라는 옛말은 현재의 건설현장에도 적용된다. 적정 공사비를 지급하지 않으면서 최고 품질의 결과물을 바라는 것은 그야말로 도둑 심보나 다름없다. 당장의 예산 절감에 매몰된 정부와 발주처가 진짜... 
2026-07-13,네이버뉴스,[건설분쟁 해결 사례] (15) 돌관공사 지시 않더라도 원사업자 귀책사유...,https://www.kmecnews.co.kr/news/articleView.html?idxno=50790,따른 공사비는 원사업자가 부담한다'고 규정하고 있습니다. 공정표에 반영되지 않은 원사업자의 귀책사유에 의해 공정이 지연된 경우 원사업자가 돌관공사비 등을 부담해야 할 것입니다. 아울러 하도급계약서 일반조건... 
2026-07-13,네이버뉴스,"안성 물류센터 ‘수목 633주’ 횡령 고소, 보완수사 거쳐 검찰 재송치",https://www.cfnews.kr/news/article.html?no=110091,"고삼물류는 “2021년께 해당 수목을 안성시 가사동 케이원건설 관련 부지로 옮겨 보관하면서 공사비와 이식·관리비 등 약 2억2000만 원을 지급했다”고 주장했다. 이어 “공사계약서와 세금계산서, 신탁사 공매 공고문 등... "
