date,source,title,link,description
2026-04-06,네이버뉴스,"문성호 서울시의원, 서울시 투트랙 재추진 결정.. ""사업비 최적화와 리...",https://www.discoverynews.kr/news/articleView.html?idxno=1088432,"하지만 우선협상대상자인 두산건설 컨소시엄이 끝내 출자자 모집에 실패하고 침묵으로 일관하면서 협상은... 높은 공사비 구조를 효율화하여 민간 사업자의 참여 유도 및 경제성(B/C) 확보 그리고, 도시철도망 계획... "
2026-04-06,네이버뉴스,중동 리스크에 노란봉투법까지…겹악재 속 中企 부담 커진다,https://www.etoday.co.kr/news/view/2573151,"제조업은 80.7로 7.4p 떨어졌고, 건설업은 68.8로 1.5p 하락했다. 경영상 애로 요인으로는 매출 부진(49.0%)이 가장... 제조원가나 공사비는 올라갈 수밖에 없다""고 말했다. 기술탈취 피해와 정책자금 제3자 부당개입 문제도... "
2026-04-07,네이버뉴스,"물류센터, '크기' 아닌 '구조' 경쟁",https://www.asiaa.co.kr/news/articleView.html?idxno=245642,물류 효율을 고려한 설계가 오히려 임차 수요와 맞지 않을 경우 공실 리스크로 이어질 수 있음을 보여준다.... 비주거용 건설비 상승이 개발 수익성을 압박하면서 신규 프로젝트가 위축된 영향이다. 이에 따라 시장은 신규... 
2026-04-07,네이버뉴스,"서울 휘발유 1995원 육박, 가격보다 더 무서운 예고된 시나리오",https://www.wikitree.co.kr/articles/1130012,이번 유가 급등의 직접적인 원인은 국제 원유 시장의 수급 불균형과 지정학적 리스크의 재점화에 있다.... 경유는 화물차와 건설 기계의 주 연료로 사용되기 때문에 경유값 상승은 운송비 증가를 초래하고 결국... 
2026-04-07,네이버뉴스,"한국 4대 그룹 총수, 베트남 전격 집결… ‘중동발 공급망 위기’ 돌파...",https://www.g-enews.com/view.php?ud=2026040708213531020c8c1c064d_1,"지정학적 리스크를 분산하고 ‘자립형 공급망’을 완성할 전략적 요충지로 부상했기 때문이다. 6일... 약 3조 3,000억 원(23억 달러) 규모의 이 사업은 발전소뿐만 아니라 LNG 터미널과 항만 건설까지 포함하는 초대형 복합... "
2026-04-07,네이버뉴스,"산하에코종합건설, 다올저축은행과 MOU...""PF 주관부터 책임준공까지 상...",https://www.bizwork.co.kr/news/articleView.html?idxno=414227,LH 민간 신축매입약정 사업은 민간이 주택 건설을 추진하면 LH가 준공 전 매입을 약정하는 방식이다. 분양 리스크를 줄일 수 있지만 초기 자금 확보와 시공사의 책임준공 확약이 핵심 요건이다. 산하에코종합건설은... 
2026-04-07,네이버뉴스,"산하에코종합건설, 다올저축은행과 MOU… LH 매입약정사업 금융지원 확...",http://www.ikld.kr/news/articleView.html?idxno=332337,LH 민간 신축매입약정 사업은 민간이 주택 건설을 추진하면 LH가 준공 전 매입을 약정하는 방식이다. 분양 리스크를 줄일 수 있지만 초기 자금 확보와 시공사의 책임준공 확약이 핵심 요건이다. 최근 금융시장 경색과... 
2026-04-07,네이버뉴스,[기업家] 카카오 ㅣ 'AI·핀테크·모빌리티 전방위 확장…글로벌 협력 가...,https://www.cbci.co.kr/news/articleView.html?idxno=565889,"퀘이사는 공격표면관리, 디지털 리스크 보호, 위협 인텔리전스 등 여러 보안 기능을 하나의 플랫폼에서... 모습 (사진=연합뉴스) 카카오는 제주첨단과학기술단지 내 본사 부지에서 새로운 오피스 건설을 시작했다고 9일"
2026-04-07,네이버뉴스,"K-FINCO, 글로벌 신용평가사 무디스 국제 신용등급 'A2' 상향",https://www.koscaj.com/news/articleView.html?idxno=323409,"무디스는 보도자료를 통해 ""K-FINCO가 정부와 긴밀한 관계를 유지하며 국내 건설보증시장에서 확고한 시장지위를 점하고 있으며, 지속적인 자본 증가로 잠재적 리스크에 대응할 수 있는 자본 완충력을 확보하고... "
2026-04-07,네이버뉴스,"안전보건공단 이사장, 고양파주지사 찾아 현장경영",http://www.mygoyang.com/news/articleView.html?idxno=88209,과정에서 리스크 관리 체계가 철저히 작동될 때 비로소 국민에게 신뢰받는 안전보건 전문 기관으로 거듭날 수 있음을 강조하며 전사적인 내부통제 문화 정착을 독려했다. 오후에는 고양장항지구 내 대형 주상복합건설공사... 
2026-04-07,네이버뉴스,"이호성號 하나은행, 작년 제조·ESG 업종 대출 증대···생산적 금융 '...",http://www.fntimes.com/html/view.php?ud=202604062012245772b4a7c6999c_18,"리스크가 확대되는 부동산·건설 여신 비중을 상대적으로 억제하고, 제조업과 서비스업 대출을 키워 자산건전성과 생산적 금융을 동시에 추구하고 있는 것이다. ESG·포용금융 병행···정책 정합성 확보 하나은행... "
2026-04-07,네이버뉴스,"[외신 헤드라인] 버핏 ""극장서 불나면 문으로 달려가야""…사모신용 경고",https://biz.sbs.co.kr/article_hub/20000302430?division=NAVER,"◇ 오라클 데이터센터 건설 지출·부채 급증에 CFO 직 부활 사모신용 리스크의 중심에는 AI가 있습니다. 전체의 30%까지도 차지할 만큼 비중이 높은데, 이런 와중에 '인공지능 풍향계' 포지션을 맡고 있는 오라클은 돈줄... "
2026-04-07,네이버뉴스,"[N2 뷰] 한국전력, 이재명 정부 에너지 정책에 발맞춘 'ZEB 1등급' 선도 ...",https://www.news2day.co.kr/article/20260406500298,"초기 투자 부담과 기술 리스크로 인해 민간이 쉽게 진입하지 못하는 영역을 공공기관이 먼저 개척하고, 이후... 제로에너지빌딩 건설을 지속 확대하고, 나아가 에너지 신기술 수준을 한 차원 높여 튼튼한 산업 생태계를... "
2026-04-07,네이버뉴스,"전문조합, 무디스 신용등급 'A3' → 'A2' 상향",https://www.dnews.co.kr/uhtml/view.jsp?idxno=202604061749529630174,전문건설공제조합(K-FINCO)은 글로벌 신용평가사인 무디스(Moody’s)의 보험금지급능력평가에서 신용등급... 무디스는 K-FINCO가 지속적인 자본 증가로 잠재적 리스크에 대응할 수 있는 완충력을 확보하고 있다고... 
2026-04-07,네이버뉴스,"민주당, 김부겸·오중기로 TK 승부수…국민의힘은 '분열 리스크'",https://www.dailian.co.kr/news/view/1630259/?sc=Naver,"이에 따라 출마 선언과 함께 행정통합, 신공항 건설 등을 전면에 내세우며 이슈 선점에 나서는 모습이다. 두 후보의 출마로 민주당의 동진 전략이 본격화하면서 여론의 변화도 주목된다. 당내에서는 이재명 대통령의... "
2026-04-07,네이버뉴스,"트럼프 ""합의 없으면 이란 전역 폭격""… 유가 150달러 '복합 공급 충격'...",https://www.g-enews.com/view.php?ud=202604061321022798fbbec65dfb_1,협상이 타결될 경우 정유·석유화학업계는 고가 비축분 재고 손실 리스크에 직면한다. 반면 결렬 시에는... 전문가들은 전쟁 종식 논의가 구체화될 경우 중동 재건 시장이 열릴 가능성이 있어 국내 건설·플랜트 기업들의... 
2026-04-07,네이버뉴스,"美대법원, '트럼프 책사' 배넌 의회 모독죄 사건 하급심 환송",https://www.news1.kr/world/usa-canada/6127334,한편 배넌의 '사법 리스크'는 의회 모독죄뿐만이 아니다. 그는 지난 2019년 미국-멕시코 국경 장벽 건설을 지원하기 위한 비공개 모금 활동에서 기부자들을 기만했다는 혐의로 기소됐고 지난해 2월 뉴욕주 법원에서... 
2026-04-07,네이버뉴스,"[AI의 종목 이야기] 아마존·MS·구글, 물과 전력 문제로 주주 압박 받아",https://www.newspim.com/news/view/20260407000006,"데이터센터 건설 계획을 지역사회 반발로 잇따라 철회한 가운데 이들 기업은 프로젝트의 환경적 영향과... 그는 ""단기적인 인공지능 성과가 장기적인 기후 및 재무 리스크를 희생하지 않도록 보장하기 위한 것""이라며... "
2026-04-06,네이버뉴스,"김현중 안전보건공단 이사장, 경기 평택 삼성전자 건설현장 안전점검",http://www.beyondpost.co.kr/view.php?ud=202604062259286069be44c0aacd_30,"이 자리에서 산재예방 사업의 신뢰성을 높이기 위해 리스크 관리체계 및 내부통제 활동의 중요성을 강조하며, 투명하고 철저한 업무 수행을 당부했다. 이어 최근 공사가 재개된 평택 삼성전자 건설현장을 찾아 현장... "
2026-04-06,네이버뉴스,전문건설공제조합 무디스 신용등급 A3→A2,https://www.idaegu.co.kr/news/articleView.html?idxno=544180,"무디스는 ""K-FINCO가 정부와 긴밀한 관계를 유지하며 국내 건설 보증시장에서 확고한 시장 지위를 점하고 있으며 지속적인 자본 증가로 잠재적 리스크에 대응할 수 있는 자본 완충력을 확보하고 있다""라며 ""규제 기준... "
2026-04-06,네이버뉴스,"과거 수질 위반, 투자 막는다…미국 인허가 '심사 기준' 됐다",http://www.impacton.net/news/articleView.html?idxno=18461,허가 거부 아닌 '지연'…환경 기록이 심사 기준으로 미국에서는 공장 건설이나 설비 확장 과정에서 물과... 최근에는 한 사업장의 위반 기록이 다른 지역 허가 심사에도 반영되면서 기업 전체가 하나의 리스크 단위로... 
2026-04-06,네이버뉴스,"유영하 ""TK신공항, 지방정부 감당 불가능""",https://www.idaegu.co.kr/news/articleView.html?idxno=544142,"유영하 국민의힘 의원(대구 달서구갑·사진)이 대구·경북(TK) 통합신공항 건설 사업의 지지부진한 상황을... 이에 김 총리는 ""수도권 집중 문제에 대한 리스크 지적에 전적으로 공감한다""며 ""새로운 신규 물량은 기업들과... "
2026-04-06,네이버뉴스,"개인도 수주 공시 보고 공급망 분석한다…코어16, '체인스코프' 출시",https://www.mt.co.kr/stock/2026/04/06/2026040618481890082,"코인16은 방산, 조선, 건설, 반도체 등 수주 빈도가 높은 업종에 투자하는 개인 투자자를 주요 고객층으로... 또 AI의 자동 분석을 바탕으로 매출 대비 수주 비중, 계약 규모 추이, 고객 집중도 리스크 등을 살펴볼 수 있다.... "
2026-04-06,네이버뉴스,남해군 신청사 2027년 12월 준공 '순항',https://www.gnnews.co.kr/news/articleView.html?idxno=634270,공정률과 예산 집행 상황을 수시로 점검하는 등 대형 공공사업에서 발생할 수 있는 지연과 리스크를... 집행된 사업비만도 55억 원에 이르며 지역 건설업과 인력시장에 실질적인 소득 효과로 이어지고 있다. 군은... 
2026-04-06,네이버뉴스,여야정 민생경제 회담에 거는 기대 크다,http://www.inews365.com/news/article.html?no=913939,"여기에 이란의 호르무즈 통행료 리스크의 파장은 아주 크다. 정부는 에너지·원자재 공급 실태를 다시 면밀히... 중동의 평화가 원유를, 원유가 나프타를, 나프타가 비닐 봉투와 건설자재, 식탁‧외식물가까지 좌우하고... "
2026-04-06,네이버뉴스,고심 끝 인도·베트남으로 떠나는 총수들,http://www.00news.co.kr/news/articleView.html?idxno=103066,최태원 회장은 베트남 가스복합화력발전소와 LNG 터미널 건설 등 총 23억달러 규모의 프로젝트를... LG는 인공지능(AI) 기반의 제조 효율화 기술을 현지 공장에 적용해 특정 지역 리스크가 그룹 전체 실적에 미치는 영향을... 
2026-04-06,네이버뉴스,"김현중 안전보건공단 이사장, 평택 삼성전자 건설현장 안전점검",http://www.energydaily.co.kr/news/articleView.html?idxno=166067,이 자리에서 산재 예방 사업의 신뢰성을 높이기 위해 리스크 관리체계 및 내부통제 활동의 중요성을 강조하며 투명하고 철저한 업무 수행을 당부했다. 이어 최근 공사가 재개된 평택 삼성전자 건설현장을 찾아 현장... 
2026-04-06,네이버뉴스,중동 사태로 화두 된 '에너지 대전환',https://www.sisaweek.com/news/articleView.html?idxno=234705,"지정학적 리스크에 취약한 에너지 수급 구조를 해결하기 위해선 재생에너지를 기반으로 한 에너지 체계... 김성환 기후에너지부 장관은 이날 회의에서 ""이것뿐 아니라 건설기계나 농기계, 선박, 이륜차 이런 분야도 AI와... "
2026-04-06,네이버뉴스,"강원도, 중동전쟁 장기화에 'TF→비상경제 대책본부'로 격상",https://www.newsis.com/view/NISX20260406_0003580038,"이에 기존 5개 과(팀) 단위 중심의 TF 대응 체계에서 벗어나 경제, 산업, 농업, 건설, 관광 등 8개 분야에 대해... 수급 리스크 선제 관리 등 3대 전략을 중심으로 물가 등 민생 경제 안정 등 6대 분야에 대한 대책을 집중... "
2026-04-06,네이버뉴스,'주민 반대·투자 재원·공급망' 풀어야 2030년 준공 지킨다 [에너지고속...,http://www.fnnews.com/news/202604061821453975,"정부는 전력망 건설 촉진 특별법 하위 법령으로 이 고리를 끊으려 한다. 인허가를 전력망위원회 의제로... 국산화가 그 시점을 맞추지 못하면 결국 수입에 의존해야 하고, 납기 지연과 가격 리스크를 그대로 안게 된다.... "
2026-04-06,네이버뉴스,"김진태 지사 ""중동전쟁 장기화에 부담감 넘어 충격""",https://news.mtn.co.kr/news-detail/2026040616312713458,"도는 기존 5개 과(팀) 단위 중심의 TF 대응체계에서 벗어나 경제, 산업, 농업, 건설, 관광 등 8개 분야에 대해... 수급 리스크 선제 관리 등 3대 전략을 중심으로 물가 등 민생경제 안정 등 6대 분야에 대한 대책을 집중... "
2026-04-06,네이버뉴스,"금융 스타트업 '코어16', 수주 공시 기반 공급망 분석 시스템 출시",http://www.edaily.co.kr/news/newspath.asp?newsid=04844566645413496,"또 단순 공시 나열에 그치지 않고 매출 대비 수주 비중, 계약 규모 추이, 고객 집중도 리스크를 AI가 자동... 코인16 측은 방산, 조선, 건설, 반도체 등 수주 빈도가 높은 업종에 투자하는 개인 투자자가 주요 사용자가 될... "
2026-04-06,네이버뉴스,기름값 2000원·차량 2부제…전기차 시대 오나?,https://www.econovill.com/news/articleView.html?idxno=736237,"기아 관계자는 ""지난달 중동 지역의 지정학적 리스크로 아프리카·중동 판매가 일부 감소했지만 그 외... 경찰차와 렌터카, 법인차, LPG 택시 등 공공·상업용 차량을 중심으로 전기차 전환을 앞당기고 건설기계와 농기계... "
2026-04-06,네이버뉴스,"[이슈+]정몽규 HDC 회장, '계열사 누락'으로 약식기소…'총수 책임론' 지...",https://www.businessplus.kr/news/articleView.html?idxno=110150,"또 다른 업계 관계자는 ""IPARK현대산업개발의 건설 현장 사고 이후 정 회장이 경영 일선에서 물러났다가 복귀하는 과정에서 또다시 법적 리스크가 불거진 점은 뼈아픈 대목""이라며 ""기업 내부적으로 계열사 현황을 전수... "
2026-04-06,네이버뉴스,전쟁이 막은 바닷길,https://www.yonhapmidas.com/news/articleView.html?idxno=10274,가격 경쟁력 높고 해적 활동 힘들어 오랫동안 각광을 받아오던 바닷길의 지정학적 리스크가 이란전쟁으로... 중국은 육상·해상 실크로드 건설 전략인 '일대일로' 정책의 연장선에서 북극 항로를 활용한 '빙상 실크로드'를... 
2026-04-06,네이버뉴스,"“가격 아닌 길이 막혔다”…호르무즈 봉쇄, 韓경제 ‘스태그플레이션...",https://www.etoday.co.kr/news/view/2573154,건설업은 네옴시티 등 중동 프로젝트 발주 축소와 공기 지연 리스크에 직면했다. 이승석 한국경제연구원 책임연구위원은 “이번 중동 전쟁은 단순한 지정학적 충돌을 넘어 한국 경제의 구조적 취약성을 드러낸... 
2026-04-06,네이버뉴스,[2금융 뉴스브리핑] 기보 'AI 신용정보업' 추진,https://www.asiatime.co.kr/article/20260406500375,"기술개발과 사업전략 수입, 신규 아이템 발굴 등 투자사와 금융사의 투자 판단과 리스크 관리에 활용할... 주금공이 운영하는 △안전관리 우수 건설기업을 위한 보증료 우대제도와 △주택연금 가입자 건강검진 할인... "
2026-04-06,네이버뉴스,"고려아연, 4,000억 소송전이 '독자 생존' 가를 듯",http://www.srtimes.kr/news/articleView.html?idxno=200484,"사법 리스크는 장기화 조짐을 보이고 있다. 외형상 '판정승'을 거둔 고려아연은 분쟁으로 흐트러진 조직... 제련소를 건설해 2029년까지 핵심광물 11종을 생산할 계획이며, 아울러 자사주를 활용한 추가적인 우호 지분 확보... "
2026-04-06,네이버뉴스,"전문건설공제조합, 보험금지급능력평가 신용등급 ‘A2’로 상향",http://mcnews.co.kr/86011,"무디스는 보도자료를 통해 “K-FINCO가 정부와 긴밀한 관계를 유지하며 국내 건설보증시장에서 확고한 시장지위를 점하고 있으며, 지속적인 자본 증가로 잠재적 리스크에 대응할 수 있는 자본 완충력을 확보하고... "
2026-04-06,네이버뉴스,"강원도, 중동 상황 장기화 대응 '비상경제 대책본부' 가동",https://chmbc.co.kr/article/SjNFIho-MfRBPNw,"건설, 관광 등8개 분야에 9개 실국이 참여하는전방위 대응 체계를 가동한다고 밝혔습니다. 대책본부는 선제적 대응과 민생 최우선,속도 중심을 기조로 물가·민생 안정과기업·소상공인 피해 최소화,에너지 수급 리스크... "
2026-04-06,네이버뉴스,이범석 시장 중동발 리스크에 민생 총력 대응 주문,https://www.ccdailynews.com/news/articleView.html?idxno=2408385,생활필수품과 건설자재 수급 불안 가능성에 대비한 점검도 함께 지시했다. 쓰레기 종량제 봉투 공급 확대와 수급 상황 관리 강화와 아스콘·레미콘 등 주요 건설 자재 수급을 사전에 파악해 공사 차질을 막을 것을... 
2026-04-06,네이버뉴스,"강원특별자치도, 중동 전쟁 장기화에 도지사 본부장 '비상경제 대책본부...",https://www.m-i.kr/news/articleView.html?idxno=1361999,"기존 5개 과(팀) 단위 중심의 TF 대응체계에서 벗어나 경제, 산업, 농업, 건설, 관광 등 8개 분야에 대해 9개... 수급 리스크 선제 관리 등 3대 전략을 중심으로 물가 등 민생경제 안정 등 6대 분야에 △ 물가 등 민생경제 안정... "
2026-04-06,네이버뉴스,"코어16, DART 수주공시 기반 공급망 분석 서비스 출시",https://www.etoday.co.kr/news/view/2573183,"단순 공시 나열에 그치지 않고 매출 대비 수주 비중, 계약 규모 추이, 고객 집중도에 따른 리스크 등도 AI가... 주요 대상은 방산, 조선, 건설, 반도체 등 수주 공시가 잦은 업종에 투자하는 개인투자자다. 조윤남 코어16... "
2026-04-06,네이버뉴스,"조달금리 위협받는 카드사·캐피탈, '위안화'에 꽂혔다",http://www.newstomato.com/ReadNews.aspx?no=1296857&inflow=N,전액 물량은 중국건설은행이 인수한 것으로 전해졌습니다. (그래픽=뉴스토마토) 김치본드는 국내에서... 원·달러 환율이 요동칠 때 위안화라는 대체 통화를 확보해 두면 전반적인 외화 리스크를 수월하게 관리할 수... 
2026-04-06,네이버뉴스,"강원특별자치도, '비상경제 대책본부' 가동 … 중동 전쟁 장기화 총력 ...",https://gw.newdaily.co.kr/site/data/html/2026/04/06/2026040600359.html,기존 5개 과(팀) 단위 중심의 TF 대응체계에서 벗어나 경제·산업·농업·건설·관광 등 8개 분야에 대해 9개... 수급 리스크 선제 관리 등 3대 전략을 중심으로 6대 분야(△물가 등 민생경제 안정 △긴급 금융지원 확대... 
2026-04-06,네이버뉴스,"[위클리오늘] 강원도, 중동 전쟁 장기화…민생·기업·에너지 3대 전략 ...",http://www.weeklytoday.com/news/articleView.html?idxno=769564,"기존 5개 과(팀) 단위 중심의 TF 대응체계에서 벗어나 경제, 산업, 농업, 건설, 관광 등 8개 분야에 대해 9개... 수급 리스크 선제 관리 등 3대 전략을 중심으로 물가 등 민생경제 안정 등 6대 분야*에 대한 대책을 집중 강구해... "
2026-04-06,네이버뉴스,"대한건설협회, 제4차 여성건설인위원회 간담회 개최",https://www.dnews.co.kr/uhtml/view.jsp?idxno=202604061053477850065,"세무리스크와 자산승계 설계’를 주제로 특강이 진행됐다.이어 참석 위원들은 고유가ㆍ고금리 장기화로 인한 업계 어려움과 극복 방안에 대해 의견을 나누고, 미래 건설산업의 경쟁력 확보를 위해 여성과 청년 인력... "
2026-04-06,네이버뉴스,"TSMC, 美애리조나 공장 규모 확대…삼성전자·SK하닉도 국내외 전방위 투...",https://www.newsis.com/view/NISX20260406_0003579259,글로벌 반도체 기업들이 지정학 리스크와 주요 고객 수요에 대응하기 위해 미국 투자를 확대하는 동시에... 공장을 건설하고 있다. 미국 인디애나주 현지 지역언론에 따르면 지난달 31일 120만 달러(18억) 규모의 임시... 
2026-04-06,네이버뉴스,"삼성중공업, 생산능력 한계 임박…'투자 여력 압박' 속 확장은?",https://www.1conomynews.co.kr/news/articleView.html?idxno=47890,"한 전문가는 ""국내에서는 신규 도크를 건설해 생산능력을 확대하는 사례는 사실상 없고, 유휴 도크를... 신용평가업계에서도 조선업의 운전자본 부담을 주요 리스크로 보고 있다. 실제로 건조 물량 증가에 따라... "
2026-04-06,네이버뉴스,스페이스X IPO 기대에 우주 ETF 확대···투자 테마 부상,https://www.seoulfn.com/news/articleView.html?idxno=625720,구조적 리스크에 대한 경계도 커지는 분위기다. 6일 코스콤 ETF CHECK에 따르면 국내 상장 우주산업 관련... 기지 건설 등 후속 프로젝트로 이어지는 흐름도 주목받고 있다. 민간 기업 참여 확대와 정책 지원이 동시에... 
2026-04-06,네이버뉴스,"강원도, '비상경제 대책본부' 가동…중동발 경제위기 총력 대응",https://www.kado.net/news/articleView.html?idxno=2042938,"기존 5개 과(팀) 중심의 TF 체계에서 벗어나 경제, 산업, 농업, 건설, 관광 등 8개 분야에 걸쳐 9개 실·국이... 수급 리스크 관리 등 3대 전략을 중심으로 대응에 나선다. 이를 바탕으로 물가 안정, 긴급 금융지원 확대, 에너지... "
2026-04-06,네이버뉴스,"""전쟁·AI·탄소, 현금 흐름 바꿨다""… 수은, '3대 신산업'으로 판 다시...",http://www.newsroad.co.kr/news/articleView.html?idxno=57380,"행사에는 건설·에너지·항공 업계와 정부 부처가 함께 참여했다. 실제 수주 전략을 조율하는 자리였다. 정부는 중동 위기를 '실질적 경제 리스크'로 규정하며, 전후 재건까지 염두에 둔 'K-마셜 플랜' 준비를 주문했다.... "
2026-04-06,네이버뉴스,"코스피, 실적 기대·기관 매수에 '5450선 회복'…코스닥 1.54%↓",http://www.newsprime.co.kr/news/article.html?no=729362,"다만 중동 리스크에 대한 경계감이 이어지며 코스닥은 하락 마감하며 시장 내 온도차가 나타났다. 6일... 60%), 건설(2.53%), 반도체와반도체장비(2.49%)가 차지했다. 등락률 하위 5개 업종에는... "
2026-04-06,네이버뉴스,"전문건설공제조합, 무디스 신용등급 A3→A2 상향",https://www.ebn.co.kr/news/articleView.html?idxno=1704571,"무디스는 K-FINCO에 대해 ""정부와 긴밀한 관계를 유지하며 국내 건설보증시장에서 확고한 시장 지위를 점하고 있으며 지속적인 자본 증가로 잠재적 리스크에 대응할 수 있는 자본 완충력을 확보하고 있다""며 ""규제... "
2026-04-06,네이버뉴스,"유영하 ""반도체 팹 분산해야"" 김민석 ""기업 판단…방향은 공감""",https://view.asiae.co.kr/article/2026040616030209755,"유 의원은 ""전력이나 용수가 부족할 경우 전체는 아니더라도 (팹 건설) 일부 계획의 변경은 가능하다고 본다... 전력의 리스크 분산 사례로 적극적으로 검토해주길 바란다""고 요구했다. 김 총리는 이와 관련해 ""그렇게... "
2026-04-06,네이버뉴스,"철강업계, 관세·지역사회 반발 '겹악재'…대미 리스크 커진다",https://www.ziksir.com/news/articleView.html?idxno=129832,"◇현지 거점, 준공 지연 우려…관세 부담 장기화 가능성 여기에 철강업계가 추진 중인 미국 현지 제철소도 지연될 수 있다는 우려가 커지면서 사업 리스크도 확대되고 있다. 현대제철은 현재 루이지애나 제철소 건설을... "
