date,source,title,link,description
2026-05-20,네이버뉴스,"롯데건설, 한국산업안전보건공단 '민간 안전체험교육장 인정서' 취득",https://www.newsquest.co.kr/news/articleView.html?idxno=266516,롯데건설이 경기도 오산시 롯데인재개발원 내에 위치한 안전체험센터 'Safety ON'에서 지난 19일 '민간 안전체험교육장 인정서'를 한국산업안전보건공단으로부터 받았다. 이 자리에는 롯데건설 교육훈련팀장과... 
2026-05-20,네이버뉴스,"롯데건설 안전체험센터, 공단 인정 교육장 됐다",https://www.bizwork.co.kr/news/articleView.html?idxno=415779,롯데건설의 안전체험센터 'Safety ON'이 한국산업안전보건공단의 민간 안전체험교육장으로 인정받았다. 롯데건설은 '세이프티 온(Safety ON)'이 한국산업안전보건공단이 발급하는 '민간 안전체험교육장 인정서'를... 
2026-05-20,네이버뉴스,"롯데건설 안전체험센터, 산안공단 인정 취득…외부 교육 확대 나선다",https://www.wolyo.co.kr/news/articleView.html?idxno=312422,롯데건설이 운영하는 안전체험센터가 한국산업안전보건공단의 공식 인정을 받으며 안전교육 외연 확대에 나선다. 롯데건설은 경기도 오산시 롯데인재개발원 내 안전체험센터 'Safety ON'이... 
2026-05-20,네이버뉴스,"롯데건설, 안전보건공단 '민간 안전체험교육장 인정서' 취득",https://www.yna.co.kr/view/AKR20260520042700003?input=1195m,"롯데건설은 자사 안전체험센터 'Safety ON'(세이프티 온)이 한국산업안전보건공단의 '민간 안전체험교육장 인정서'를 취득했다고 20일 밝혔다. 공단은 교육 프로그램과 강사, 시설, 장비 등 종합적 여건이... "
2026-05-20,네이버뉴스,"“산재 예방 노력 인정”…롯데건설, 산업안전보건공단 ‘민간 안전체험...",https://www.mk.co.kr/article/12052857,다양한 안전 체험·실습 교육 진행 외부 기관 ‘Safety ON’ 안전체험교육 이수 일반인 대상 안전체험교육 확대 롯데건설의 안전문화 확산과 산업재해 예방 노력이 대내외적으로 인정을 받고 있다. 롯데건설은 지난... 
2026-05-20,네이버뉴스,"롯데건설 안전체험센터 ‘Safety ON’, 민간 안전체험교육장 인정 획득",https://www.megaeconomy.co.kr/news/newsview.php?ncode=1065571055559367,롯데건설이 운영하는 안전체험센터 ‘Safety ON’이 한국산업안전보건공단으로부터 민간 안전체험교육장으로 공식 인정받았다. 체험형 안전교육을 통해 산업재해 예방과 현장 안전문화 확산에 나선다는 계획이다.... 
2026-05-20,네이버뉴스,"롯데건설 'Safety ON', 정기안전보건교육 시간 2배 인정 혜택 확보",https://www.newsinside.kr/news/articleView.html?idxno=4687823,롯데건설이운영하는 안전체험센터 'Safety ON'이 한국산업안전보건공단으로부터 '민간 안전체험교육장 인정서'를 취득했다. 인정서 수여식은 지난 19일 경기도 오산시 롯데인재개발원 내 Safety ON에서 롯데건설... 
2026-05-20,네이버뉴스,"롯데건설, 체험형 안전교육 강화…'Safety ON' 공단 인정 취득",https://www.ziksir.com/news/articleView.html?idxno=134403,김규완 한국산업안전보건공단 경기남부지사장(왼쪽)과 박병식 롯데건설 교육훈련팀장(오른쪽)이 지난 19일 경기도 오산시 롯데인재개발원 내 안전체험센터 'Safety ON'에서 '민간 안전체험교육장 인정서' 수여식을... 
2026-05-20,네이버뉴스,롯데건설 안전체험센터 공단 인정서 취득,https://www.newsclaim.co.kr/news/articleView.html?idxno=3064183,"롯데건설,오일근 최근 건설업계는 현장 근로자의 안전의식을 높이기 위해 실무형 체험 교육을 적극적으로 도입하고 있습니다. 롯데건설(대표이사 오일근) 은 자사 안전체험센터 'Safety ON'이... "
2026-05-20,네이버뉴스,"롯데건설 안전체험센터 'Safety ON', 산업안전보건공단 민간 인정 취득",https://www.financialpost.co.kr/news/articleView.html?idxno=259724,"롯데건설의 안전체험센터 'Safety ON'이 한국산업안전보건공단으로부터 '민간 안전체험교육장 인정서'를 받았다. 공단의 엄격한 심사를 통과한 만큼, 이곳에서 안전체험교육을 이수하면 산업안전보건법상 근로자... "
2026-05-20,네이버뉴스,[롯데건설 PF 점검] 우발채무 감소에도 브릿지론 비중 높은 까닭,https://news.dealsitetv.com/articles/170562,①PF 총액서 97% 차지…본PF 위주 포스코‧SK에코 대비 롯데건설이 PF(프로젝트 파이낸싱) 우발채무액을 줄여나가고 있지만 ‘레고랜드 사태’ 악몽에서 벗어나는 데까지 시한이 걸릴 거라는 관측이 나온다. 잠재... 
2026-05-20,네이버뉴스,또 '김부장'의 저주?…창동민자역사 상가에 무슨 일이,https://www.hankyung.com/article/2026051969551,2021년 기업회생절차를 거쳐 2022년 롯데건설이 공사를 인계받아 기존 건물을 보강했다. 창동역사디오트는 2021년 상가 30년 사용권을 분양했다. 계약자는 소유권을 이전받는 게 아니라 30년간 사용하는 조건으로 임차... 
2026-05-20,네이버뉴스,"포스코 선택 조합장들, 신반포19차·25차 포스코이앤씨 지원 사격",https://www.seoul.co.kr/news/economy/2026/05/20/20260520500190?wlog_tag3=naver,"포스코이앤씨가 신반포19차·25차 재건축 수주전에서 파격적인 사업 조건을 제시한 가운데, 실제 사업을 진행 중인 타 정비사업 조합장들이 지원 사격에 나서며 이목을 집중시키고 있다. 이번 수주전에서 포스코이앤씨는... "
2026-05-20,네이버뉴스,경기·인천 인구 증가세… '준서울 입지' 부각,http://www.ikld.kr/news/articleView.html?idxno=334823,"포스코이앤씨는 6월 인천 검단신도시에서 '더샵 검단레이크파크'를 분양할 예정이다. 22·23블록에 전용 59·84㎡ 총 2,857세대 규모의 대단지로 조성된다. 인천2호선 완정역과 인천1호선 검단호수공원역을 도보로 이용할... "
2026-05-20,네이버뉴스,"인천 역대 최고 분양가 더샵 송도 그란테르, 특공 경쟁률 2.55대1…본청...",https://www.kyeonggi.com/article/20260520580234,20일 한국부동산원 청약홈 등에 따르면 포스코이앤씨는 1천640가구 중 특별 공급을 통해 514가구를 19일 우선 공급했다. 특별 공급은 1·3·4·5·6·11블럭에 모두에서 이뤄졌다. 이날 514가구 중 1천313가구가 신청... 
2026-05-20,네이버뉴스,“나왔다 하면 100대 1”…공공택지 ‘로또 분양’ 어디?,http://www.lawissue.co.kr/view.php?ud=20260520151326876067191f6c6e_12,"포스코이앤씨가 인천 검단신도시에서 ‘더샵 검단레이크파크’를 6월 분양할 예정이다. 지하 3층~지상 29층, 26개동, 전용 59·84㎡, 총 2857세대 규모의 대단지로 조성된다. 공공택지에 공급되는 분양가 상한제 적용... "
2026-05-20,네이버뉴스,서울 인구 64만명 줄 때 경기·인천은 약 두배 늘어…수도권 ‘준서울 ...,http://www.lawissue.co.kr/view.php?ud=20260520150548836467191f6c6e_12,"포스코이앤씨는 6월 인천 검단신도시에서 ‘더샵 검단레이크파크’를 분양할 예정이다. 검단신도시에서 처음 공급되는 ‘더샵’ 브랜드 아파트로, 22·23블록에 전용 59·84㎡ 총 2857세대 규모의 대단지로 조성된다.... "
2026-05-20,네이버뉴스,"포스코 단독 참여로 유찰… 하안주공3·4단지, 시공자 재공고",https://www.arunews.com/news/articleView.html?idxno=62842,포스코이앤씨 단독 입찰로 유찰된 경기 광명시 하안주공3·4단지가 시공자 선정에 재도전한다. 하안주공3·4단지 재건축 사업시행자인 대한토지신탁·KB부동산신탁은 20일 2차 입찰공고를 내고 오는 28일 현장설명회를... 
2026-05-20,네이버뉴스,'더샵 송도그란테르' 특공에 1313명 몰려…경쟁률 2.6대 1,https://www.newsis.com/view/NISX20260520_0003637389,"강세훈 기자, 이수안 인턴기자 = 포스코이앤씨가 인천 연수구 송도동 일원에 공급하는 '더샵 송도 그란테르' 특별공급 경쟁률이 2.6대1을 기록했다. 20일 한국부동산원 청약홈에 따르면 전날 진행된 '더샵... "
2026-05-20,네이버뉴스,"[AI 아파트] 포스코이앤씨, 로봇이 더샵 단지 안내…AI로 시공 안전성·...",https://biz.chosun.com/real_estate/real_estate_general/2026/05/20/2WU4SBLXHZGDTOR6SZTVT5GO5U/?utm_source=naver&utm_medium=original&utm_campaign=biz,"포스코이앤씨가 인공지능(AI) 기술을 활용해 차세대 주거 서비스를 구축하고 있다. 대표적인 기술이 로봇 활용 스마트홈 서비스다. 로봇이 집안의 가전 및 홈 플랫폼과 연동돼 입주민의 편의, 안전, 건강을 통합 관리하는... "
2026-05-20,네이버뉴스,중동발 원자재값 급등…분양가 상승 전망 속 '더샵 송도그란테르' 20일 ...,https://www.thegolftimes.co.kr/news/articleView.html?idxno=81160,이러한 흐름 속에 포스코이앤씨가 송도국제도시에서도 핵심 지역으로 꼽히는 국제업무지구(IBD) 내 마지막 주거단지로 선보이는 '더샵 송도그란테르'가 금일 1순위 청약 접수를 진행한다. 단지는 인천광역시 연수구... 
2026-05-20,네이버뉴스,"건설업계, 디지털 경쟁력 강화 '드라이브'…""생산성 혁신·안전 관리 고...",https://www.asiatime.co.kr/article/20260520500060,"IPARK현대산업개발, 호반건설, 포스코이앤씨 등 디지털 경쟁력 강화 나서 건설업계가 생산성 혁신과 안전 관리 고도화를 위해 디지털 경쟁력 강화에 적극 나서고 있다. IPARK현대산업개발은 충남 천안시 서북구 성성동... "
2026-05-20,네이버뉴스,"인천 검단신도시에 2,857가구 대단지 아파트 '더샵 검단레이크파크' 6월...",https://www.ksilbo.co.kr/news/articleView.html?idxno=1057270,"포스코이앤씨는 인천 검단신도시에 들어서는 '더샵 검단레이크파크'를 오는 6월 분양할 계획이다. 단지는 지하 3층~지상 29층, 26개 동 규모로 조성되며, 전용면적 59㎡와 84㎡ 타입으로 구성된다. 최근 분양시장에서는 1천... "
2026-05-20,네이버뉴스,서울 인구 64만명 줄 때 경기·인천은 113만명 늘었다,https://www.rcast.co.kr/news/articleView.html?idxno=30825,"포스코이앤씨는 6월 인천 검단신도시에서 '더샵 검단레이크파크'를 분양할 예정이다. 검단신도시에서 처음 공급되는 '더샵' 브랜드 아파트로, 22·23블록에 전용 59·84㎡ 총 2,857세대 규모의 대단지로 조성된다.... "
2026-05-20,네이버뉴스,대형 건설사 시공 아파트 사업 안정성 대두.. 시공사 신뢰도 기준 강화,http://www.fnnews.com/news/202605191502190586,"부동산 프로젝트파이낸싱(PF) 리스크와 공사비 인상 기조, 자금 조달 여건 악화가 맞물린 가운데 현대엔지니어링과 포스코이앤씨가 공동 시공하는 힐스테이트 더샵 상생공원이 분양 일정을 진행하고 있다. 최근 금융권... "
2026-05-20,네이버뉴스,중동발 원자재값 폭등에 분양가 상승 예측 속 '더샵 송도그란테르' 금일...,http://www.ikld.kr/news/articleView.html?idxno=334802,이러한 흐름 속에 포스코이앤씨가 송도국제도시에서도 핵심 지역으로 꼽히는 국제업무지구(IBD) 내 마지막 주거단지로 선보이는 '더샵 송도그란테르'가 금일 1순위 청약 접수를 진행한다. 단지는 인천광역시 연수구... 
2026-05-20,네이버뉴스,"라인건설·라인그룹, 공정위 ‘공시대상기업집단’ 지정",http://www.segyebiz.com/newsView/20260520512413?OutUrl=naver,"도시개발, 복합개발, 인프라사업으로 영역을 확대 중이며 침체된 건설경기에도 2024년 송산그린시티 기반시설 조성공사, 2025년 경기용인 플랫폼시티 등 대형 프로젝트를 잇달아 수주했다. 동양건설산업은 2025년 토건... "
2026-05-20,네이버뉴스,[금강주택은 지금]① 시공능력평가 '60계단' 뛴 40년 성장사,https://www.bloter.net/news/articleView.html?idxno=662972,주택건설사업자로 등록하며 첫발을 내디뎠다. 창립 이듬해인 1983년 신원주택을 인수해 금강빌라로 상호를... 최근에는 재건축과 재개발 등 도시정비사업 부문을 새롭게 꾸리며 수도권 일대 수주전에도 적극적으로... 
2026-05-20,네이버뉴스,"""공동계약은 도급의 분리와 무관…반드시 분리발주 해야""",https://www.koit.co.kr/news/articleView.html?idxno=207234,"이 같은 입찰 조건과 낙찰자 선정 방식은 설계업무 등에 대한 총괄적인 수행 능력을 갖춘 대형 건설사에... 정보통신공사를 수주할 수 있도록 이번 사업을 반드시 분리 발주해야 한다""고 말했다. 이번 공사의 발주 방식이... "
2026-05-20,네이버뉴스,“송파 아파트 재건축 입찰에 18곳이 달려와”…서울 핵심지 정비사업에...,https://biz.heraldcorp.com/article/10742083?ref=naver,"과거엔 건설사 브랜드, 시공 능력이 수주 경쟁의 핵심으로 꼽혔다면 최근에는 하이엔드 설계 경험이 있는 곳을 선호하는 경향이 짙어졌다. 한 대형 설계사 관계자는 “최근 정비계획 수립 후 설계, 시공사를 선정하는... "
2026-05-20,네이버뉴스,"DL건설, AI 데이터센터 포트폴리오 확대...소비자 관심도 증가",http://www.thebigdata.co.kr/view.php?ud=202605201205495382df3c2a17b7_23,특히 수도권을 중심으로 관련 수요가 이어질 것으로 전망되면서 주요 건설사들의 수주 경쟁도 한층 치열해질 것이란 전망이다. 이와 관련 본지가 데이터앤리서치에 의뢰해 4월 DL건설 AI에 대한 소비자들의 관심도... 
2026-05-20,네이버뉴스,[IPARK 리포지셔닝] ①사명 변경 '자체사업·복합개발' 방점,https://www.bloter.net/news/articleView.html?idxno=662961,"지난해 수주잔액 33조1603억원 중 주택 비중은 88%였다. 최근 5년간 수주잔액 중 주택 비중도 85~88%를... 자체사업은 도급공사보다 토지 확보, 상품기획, 분양, 운영 연계에서 건설사의 역할이 커진다. 복합개발도... "
2026-05-20,네이버뉴스,"회생 조기졸업 신동아건설, '흑자전환의 質'은?",http://www.newsdream.kr/news/articleView.html?idxno=112170,"영업이익률은 21.5%, 순이익률은 25.0%로 국내 건설업계 최상단 수준이다. 회생절차를 거친 중견 건설사라고 믿기 어려울 정도로 수익성 제고를 이룬 것이다. 재무구조도 눈에 띄게 탄탄해졌다. 신동아건설의... "
2026-05-20,네이버뉴스,"[기업탐방] 하이스틸 함안공장, '하이컬럼' 전진기지 부상…해외 공략 ...",http://www.ferrotimes.com/news/articleView.html?idxno=48073,"신규 수주를 통해 시장 다각화에도 속도를 내고 있다. 경남 함안산단에 위치한 함안공장은 2021년 설립된... 일본 내진 시장 공략…""신뢰 확보에만 3년 걸려"" 현재 함안공장은 일본 대형 종합건설사를 중심으로 주요... "
2026-05-20,네이버뉴스,"DL건설, 부천 인공지능 데이터센터 수주…디지털 인프라 경쟁 가속",https://www.tokenpost.kr/news/tech/361491,인프라 수주 경쟁이 한층 본격화하고 있다. DL건설은 20일 ‘부천 삼정 AI 허브센터’ 신축공사를 수주했다고... 이 같은 흐름은 앞으로 건설사들 사이에서 단순 시공 능력뿐 아니라 전력·냉각·구조 설계를 종합적으로... 
2026-05-20,네이버뉴스,"""AI 랙당 열부하 잡는다"" DL건설, 액체냉각 품은 1268억 데이터센터 잭팟",https://www.thefairnews.co.kr/news/articleView.html?idxno=77439,대형 건설사가 차세대 냉각 기술과 모듈화 공법을 앞세워 AI 인프라 건설 시장의 맹주로 우뚝 섰다. DL건설이 총공사비 1268억 원 규모의 '부천 삼정 AI 허브센터 신축공사'를 전격 수주했다고 20일 밝혔다. 이번 프로젝트는... 
2026-05-20,네이버뉴스,"KBI동양철관, 日 철골 규제 벽 넘었다…'대형각관'으로 고부가 시장 개...",https://www.goodkyung.com/news/articleView.html?idxno=287196,"(종합건설사)과 종합상사 등 일본 현지 바이어들이 요구하는 까다로운 '품질 추적성(Traceability)'을 완벽히... 특히 세계 최고 수준으로 평가받는 일본의 내진 인증을 확보했다는 사실 자체가 향후 동남아시아, 미주 등... "
2026-05-20,네이버뉴스,"DL건설, '부천 AI 허브센터' 수주",http://www.econonews.co.kr/news/articleView.html?idxno=438621,특히 수도권은 전력망과 통신 인프라 접근성이 뛰어나고 기업 수요가 집중돼 주요 건설사들의 수주 경쟁이 치열한 지역이다. 건설사들도 AI 데이터센터 전담 조직과 시공 역량 확보에 잇따라 나서는 분위기다.
2026-05-20,네이버뉴스,"[건설 大개조, K-건설 생존 방정식]IPARK현대산업개발, '신뢰 회복'+'내실...",https://www.businessplus.kr/news/articleView.html?idxno=112002,침체와 수주 공백을 메울 신규 먹거리 확보는 여전한 숙제다. 결국 '서울원'으로 대변되는 복합 개발 사업의 성공적인 수행과 운영 수익화 여부가 IPARK현대산업개발이 단순 건설사에서 '토털 라이프 솔루션 기업'으로... 
2026-05-20,네이버뉴스,"목포시, 실내체육관 위험도로 4차로 확장 추진",https://www.jnilbo.com/news/articleView.html?idxno=90000036285,"시는 실시설계 단계부터 한국도로교통공단의 기술 지원을 받아 전문성과 안전성을 높였으며, 지난 1월 시공사 선정을 마쳤다. 이달 중순까지 안전관리계획 수립과 관계기관 협의를 마무리한 뒤 이달 말 공사에 들어가... "
2026-05-20,네이버뉴스,"목포시, 교통사고 위험도로 개선사업 본격 추진",https://www.sportsseoul.com/news/read/1610426?ref=naver,"또한 지난 1월 시공사 선정을 완료했으며, 오는 5월 중순까지 안전관리계획 수립과 관계기관 협의 등 착공 전 절차를 마무리한 뒤, 5월 말 공사에 착수해 2029년 1월 준공을 목표로 사업을 추진할 계획이다. 특히, 시는 공사... "
2026-05-20,네이버뉴스,"목포시, 실내체육관 위험도로 4차로 확장 착수",https://www.newspim.com/news/view/20260520000857,지난 1월 시공사 선정을 완료했으며 5월 중순까지 안전관리계획 수립과 관계기관 협의를 마무리한 뒤 5월 말 착공한다. 준공 목표는 2029년 1월이다. 공사 구간 내 지장 수목은 현장 여건을 고려해 이식을 우선 검토하고... 
2026-05-20,네이버뉴스,"대교아파트, 2년 4개월만에 관리처분인가 획득…“여의도 재건축 단지 ...",https://www.mk.co.kr/article/12053151,"당시 인가를 받은 외관 디자인과 지난해 11월 삼성물산이 시공사로 선정될 당시 제안한 디자인에 차이가 있는데, 조합과 삼성물산은 사업 진행과 함께 새로운 디자인에 대한 변경 심의를 준비하고 있다. 1975년 준공한 뒤... "
2026-05-20,네이버뉴스,"목포, 90억 투입해 상습 정체·위험 구간 도로 구조개선 착공",https://www.aitimes.com/news/articleView.html?idxno=210743,"목포는 지난 1월 시공사 선정을 마쳤으며, 안전관리계획 수립과 관계기관 협의 등 착공 전 절차를 거쳐 5월 말 공사에 들어갈 예정이다. 준공 목표는 2029년 1월이다. 공사 구간 내 수목 처리는 활착률, 시공성, 경제성... "
2026-05-20,네이버뉴스,"콘마켓, 건축주 의사결정 플랫폼 서비스 개시",https://www.joongang.co.kr/article/25429913,"콘마켓 관계자는 ""건축 과정에서는 수익성 분석이나 시공사 선정 등 여러 단계에서 의사결정 부담이 발생한다""며 ""분산돼 있던 건축 의사결정 과정을 하나의 플랫폼 안에서 연결해 보다 효율적으로 프로젝트를 진행할 수... "
2026-05-20,네이버뉴스,"목포시, 실내체육관~푸른주유소 구간 위험도로 개선 추진",https://www.shinailbo.co.kr/news/articleView.html?idxno=5022731,"또 지난 1월 시공사 선정을 마쳤으며, 이달 중 안전관리계획 수립과 관계기관 협의 등 착공 전 절차를 완료한 뒤 5월 말 공사에 들어갈 예정이다. 준공 목표 시점은 2029년 1월이다. 시는 공사 과정에서 발생하는 지장 수목... "
2026-05-20,네이버뉴스,"목포시, '위험도로 개선' 본격화... 실내체육관~푸른주유소 4차로 확장",http://www.newsworker.co.kr/news/articleView.html?idxno=427631,지난 1월에는 시공사 선정도 마쳤다. 시는 오는 5월 중순까지 안전관리계획 수립과 관계기관 협의 등 착공 전 절차를 마무리한 뒤 5월 말 공사에 들어가 2029년 1월 준공을 목표로 사업을 추진할 방침이다. 공사 구간 내 지장... 
2026-05-20,네이버뉴스,목포시 '실내체육관~푸른주유소간 구조개선사업’ 이달 착공,https://www.newsis.com/view/NISX20260520_0003637260,"시는 지난 1월 시공사를 선정한데 이어 안전관리계획 수립과 관계기관 협의 등 착공 전 절차를 마무리했다. 공사는 2029년 1월 준공을 목표로 하고 있다. 시는 공사 구간 내 지장 수목은 활착률과 시공성, 경제성 등 현장... "
2026-05-20,네이버뉴스,"목포시, ‘실내체육관~푸른주유소’ 위험도로 구조개선사업…본격 추진",https://www.seoul.co.kr/news/publicnews/2026/05/20/20260520500080?wlog_tag3=naver,"또한 지난 1월 시공사 선정을 완료했으며, 오는 5월 중순까지 안전관리계획 수립과 관계기관 협의 등 착공 전 절차를 마무리한 뒤, 5월 말 공사에 착수해 2029년 1월 준공을 목표로 사업을 추진할 계획이다. 시 관계자는... "
2026-05-20,네이버뉴스,서울 중구 “소규모 공동주택 노후시설 14곳에 총 1억 원 지원”,https://www.munhwa.com/article/11590152?ref=naver,"조합 설립 이후 1차 안전진단, 시공사 선정, 도시계획 및 건축위원회 심의, 사업계획 승인 등 후속 절차가 진행된다. 구는 전 과정이 신속하고 투명하게 이뤄질 수 있도록 행정적 지원을 이어가며 주민들의 정주여건... "
2026-05-20,네이버뉴스,"강원도, 수소산업 육성 박차… '수소 저장·운송 클러스터' 6월 착공",https://www.todayenergy.kr/news/articleView.html?idxno=298055,"도는 시공사 선정과 감리용역 계약이 마무리되는 대로 올해 6월 중 착공에 들어갈 계획이다. 산업진흥센터와 안전성시험센터, 시스템실증센터는 2024년부터 2028년까지 총사업비 668억 원(국비 245억 원, 지방비 423억 원)을... "
2026-05-20,네이버뉴스,"해송해상풍력, LS마린솔루션과 해저케이블 시공 협력 강화",http://www.ikld.kr/news/articleView.html?idxno=334801,"권지안 해송해상풍력발전 공급망전략담당 상무는 ""본계약 체결 이전 단계부터 시공사와 엔지니어링 세부... 해송 해상풍력 프로젝트 우선협상대상자 선정 체결식에서 (왼쪽 2번째부터) 김병옥 LS마린솔루션 대표... "
2026-05-20,네이버뉴스,"제로투엔, 실무형 사업 안내서 ‘랜드로드 가이드’ 출간",https://www.sentv.co.kr/article/view/sentv202605180124,"공공기관이 선호하는 설계 방향, 평면 구성, 시공사 선정 및 품질 점검 절차는 물론, 민간 프로젝트파이낸싱(PF) 시장이 위축된 상황에서 매입약정 구조가 금융권 협의에 미치는 영향 등 자금 조달 구조까지 깊이 있게... "
2026-05-20,네이버뉴스,"제로투엔, '랜드로드 가이드 Vol.2' 출간... 매입임대주택 사업 구조·절...",https://magazine.hankyung.com/money/article/202605183597c,"LH·SH 설계 기준과 85㎡ 이하 평면 구성, 토지 검토 항목, 시공사 선정 기준, 품질 점검 절차, 자금 조달 구조 등을 25개 질문 형식으로 정리했다. 최근 PF 시장 위축과 관련한 금융 조달 환경 변화도 함께 다뤘다.... "
2026-05-20,네이버뉴스,왜관1일반산업단지 경쟁력강화사업 본격 착공,https://www.hidomin.com/news/articleView.html?idxno=706089,"군은 이후 체계적인 설계와 행정 절차 이행, 시공사 선정 및 계약체결을 완료하고 6월쯤 공사에 착수할 예정이다. 이번 사업은 2028년 말 준공을 목표로 총 180억원(국비 50%, 군비 50%)이 투입된다. 주요 내용은 산업단지 내... "
2026-05-20,네이버뉴스,'분양계약서까지 위조 의심'…입주장 노린 전월세 사기 주의보,https://www.asiatime.co.kr/article/20260520500327,"조합·시공사 확인 절차가 필요하다는 지적이 나온다. 서울 강남구 부동산 중개업소에 붙은 매매·전세·월세... 해당 단지는 반포아파트 제3주구를 재건축하는 래미안 트리니원이다. 지하 3층~지상 최고 35층, 총 17개동... "
