date,source,title,link,description
2026-06-07,네이버뉴스,"반도체가 이끈 '깜짝 성장'…현대硏 ""총량지표에 가려진 K자 양극화 우려...",https://www.getnews.co.kr/news/articleView.html?idxno=871779,중동 리스크에도 불구하고 한국 경제가 반도체 수출에 힘입어 당초 전망치의 두 배에 가까운 깜짝 성장을... 제조업과 건설업의 고용 감소가 이어지는 가운데 서비스업의 고용창출력마저 축소됐다. 청년층(15~29세)... 
2026-06-07,네이버뉴스,전주시 가동사업자 증가하는데 매출은 급락,http://www.jjn.co.kr/news/articleView.html?idxno=1042925,연구원은 또 도매·건설·제조 업태 집중도가 높은 탓에 특정 업종 경기 침체 시 지역 B2B 경제 전체가 동반 위축될 구조적 단일 업태 리스크가 내재돼 있다고 분석했다. 이와 함께 연구원은 전주의 구조적 취약성을... 
2026-06-07,네이버뉴스,고용 호조에 금리 인하 기대감 뚝…워시 의장 시험대,https://www.edaily.co.kr/news/newspath.asp?newsid=02833926645479424,빅테크 기업들의 데이터센터 건설 경쟁은 전력과 원자재 수요를 급증시키고 있으며 관련 산업 전반으로... 정책 리스크의 초점은 인플레이션으로 이동하고 있다”고 평가했다. 그러면서 연준이 오는 6월 FOMC 회의에서... 
2026-06-07,네이버뉴스,"수출입은행, 벤처·중기 지분 15% 초과 취득…정책금융 투자기능 확대",https://www.etnews.com/20260605000197,해외건설촉진법상 해외공사에 투자할 경우 기준수익률 요건을 충족해야 한다. 이와 함께 해당 해외공사 종료... 다만 투자 기능 확대에 따른 리스크 관리와 수출금융 본연의 기능 사이 균형은 과제로 남는다. 수출입은행... 
2026-06-08,네이버뉴스,서소문 고가 참사가 던진 경고,https://www.kmecnews.co.kr/news/articleView.html?idxno=50042,안전진단 과정에서 구조물이 무너지며 작업자들이 목숨을 잃은 이번 사고는 중대재해처벌법 시행 이후에도 건설현장의 위험이 여전히 해소되지 않고 있음을 보여준다. 건설현장은 다단계 하도급 구조와 공기 단축 압박... 
2026-06-07,네이버뉴스,"동서발전, 노후 발전시설 해체 안전관리 강화",https://www.ulsanpress.net/news/articleView.html?idxno=576625,"이에따라 올해 건설기본계획 수립 후, 부대시설물 해체와 현대화 사업완료 후 기존 발전설비 해체공사가... 및 사고예방 안전진단·가이드라인 제공 △동서발전 직원 대상 해체기술 및 안전 교육 운영 △국내외 해체기술... "
2026-06-07,네이버뉴스,"경남 교원단체, 권순기 당선인 축하와 약속 당부",https://www.gnnews.co.kr/news/articleView.html?idxno=638450,"생활지도와 안전사고, 현장체험학습 등 과도한 행정업무에 대한 법적·행정적 책임이 교사 개인에게 집중돼... 김지성 지부장은 ""경남 교육의 공공성과 민주성을 지키기 위한 건설적 비판과 정책 제안을 멈추지 않을 것... "
2026-06-07,네이버뉴스,"한전, 전남 무안-신안 잇는 154kV 송전망 준공",http://www.hansbiz.co.kr/news/articleView.html?idxno=842818,이번 송전망은 도서 지역을 중심으로 건설됐으며 섬과 섬을 22차례 횡단하고 최대 2km에 달하는 해월을... 적용됐으며 안전사고 없이 완공됐다. 재생에너지 확대에 따라 기상 변화로 인한 발전량 조절이 늘고 있는... 
2026-06-07,네이버뉴스,스마트 수변도시 1단계 공사현장 우기 안전점검,http://www.jjn.co.kr/news/articleView.html?idxno=1042923,새만금개발공사(사장 나경균)는 장마철 건설현장 안전사고 예방을 위해 지난 5일 스마트 수변도시 1단계 조성공사 현장을 대상으로 '우기 안전점검'을 진행했다고 밝혔다. 나경균 사장과 관계부서 합동으로 치러진 이번... 
2026-06-07,네이버뉴스,울산 중대재해 제로 만드는 '안전파수꾼'들,http://www.ujeil.com/news/articleView.html?idxno=386814,대한민국 안전사고 예방과 선진 안전문화 확산을 위해 울산지역 중소기업 대표들이 뜻을 모았다.... 방폭안전기금 마련에 앞장선 17개 중소기업은 박동욱 서동건설산업 대표를 비롯해 △구현민 금화 대표 △김상철... 
2026-06-07,네이버뉴스,전남 무안-신안 잇는 송전망 준공... “재생에너지 출력제어 완화 기대...,https://www.viva100.com/article/20260607500533,통해 안전사고 없이 송전망 구축을 완료할 수 있었다. 이재식 기후부 전력망정책관은 “앞으로도 출력제어... “전력설비 건설사업이 전국의 다양한 지역과 지형적 제약 속에서 추진되는 만큼 이를 극복하기 위한... 
2026-06-07,네이버뉴스,"한전, 전남 무안군-신안군 간 154kV 송전망 준공…재생e 출력제어 완화",http://www.e-platform.net/news/articleView.html?idxno=102783,"건의 안전사고 없이 송전망 구축을 완료할 수 있었다. 한전 김동철 사장은 ""재생e 계통연계 가속화와 첨단 전략산업 등 국가경쟁력 확보를 위한 전력망 확충을 차질없이 추진할 것""이라며, ""전력설비 건설사업이 전국의... "
2026-06-07,네이버뉴스,"고용부 대구서부지청, '추락 사망·중상해 재해 근절 결의대회' 개최",https://www.imaeil.com/page/view/2026060717155296421,"김성진 고용노동부 대구서부지청장은 ""건설현장 사망사고는 기본적인 안전수칙을 준수하는 것만으로도 충분히 예방 가능하다""며 ""추락 위험요인에 대한 선제적 현장 점검과 예방 활동을 지속적으로 강화하는 등 산업재해... "
2026-06-07,네이버뉴스,현장 지키는 숨은 영웅들…칠곡 의용소방대 소방기술경연대회·기념식 ...,https://www.kyongbuk.co.kr/news/articleView.html?idxno=4074812,"이날 행사에는 김재욱 칠곡군수와 이상승 칠곡군의회 의장, 박순범 경상북도의회 건설소방위원회 위원장... 의용소방대는 화재와 자연재난, 각종 안전사고 발생 시 소방공무원의 현장 활동을 지원하는 민간 조직이다.... "
2026-06-07,네이버뉴스,신안·무안 154kV 송전망 뚫렸다…호남 재생에너지 숨통,https://www.namdonews.com/news/articleView.html?idxno=912802,"송전망 건설 공사를 지난달 30일 최종 마무리하고 본격적인 가동에 들어갔다고 7일 밝혔다. 이번 송전망... 건의 안전사고 없이 전체 공정을 완료했다. 해당 사업은 지난 2021년 9월 실시계획 사업승인을 받은 뒤, 2022년 5월... "
2026-06-07,네이버뉴스,"기후부·한전, 전남 무안~신안 54㎞ 잇는 154㎸ 송전망 준공",http://www.kookje.co.kr/news2011/asp/newsbody.asp?code=0200&key=20260607.99099001688,건의 안전사고 없이 송전망 구축을 완료할 수 있었다”고 강조했다. 김동철 한전 사장은 “재생에너지... “전력설비 건설사업이 전국의 다양한 지역과 지형적 제약 속에서 추진되는 만큼 이를 극복하기 위한 신기술... 
2026-06-07,네이버뉴스,무안~신안 송전망 준공…재생에너지 ‘출력제어 완화’ 기대,https://www.seoul.co.kr/news/economy/2026/06/07/20260607500076?wlog_tag3=naver,안전사고 없이 송전망 구축을 완료할 수 있었다고 설명했다. 김동철 사장은 “재생에너지 계통연계 가속화와 첨단 전략산업 등 국가경쟁력 확보를 위한 전력망 확충을 차질없이 추진할 것”이라며 “전력설비 건설사업... 
2026-06-08,네이버뉴스,"[노무, 톡!] 발등의 불이 된 ‘위험성평가’ ⋯ 위기의 中企",https://www.etoday.co.kr/news/view/2591173,"이상 건설사업장은 2027년 1월 1일부터, 그 미만 사업장은 2028년 1월 1일부터 적용될 예정이다. 일부 중소기업에서는 아직 시간이 남았다고 생각할 수 있다. 그러나 과태료 부과 시기와 관계없이 중대재해가 발생한 경우... "
2026-06-08,네이버뉴스,"온산산단 중기 17곳, 한국방폭협회에 안전기금 3000만원 전달",https://www.ksilbo.co.kr/news/articleView.html?idxno=1058742,"박종훈·백순흠)에 중대재해 예방과 선진 안전문화 확산, AI 기반 안전도시 구축을 위한 방폭안전기금 3000만원을 전달했다. 참여 기업은 서동건설산업, 금화, 한림정공, 한국안전보건기술진흥, 아티산플러스, 고산알에스... "
2026-06-07,네이버뉴스,"울산 17개 중소기업, 중대재해 예방 한뜻",https://www.ulsanpress.net/news/articleView.html?idxno=576627,"이번 기금은 중대재해 예방과 선진 안전문화 확산, AI 기반 안전도시 울산 구축을 위해 마련됐다. 기금 조성에는 박동욱 서동건설산업 대표를 비롯해 구현민 금화 대표, 김상철 한림정공 대표, 김창선... "
2026-06-07,네이버뉴스,"정읍시, 2026년 폭염 종합대책 본격 가동",http://www.jeonmin.co.kr/news/articleView.html?idxno=441101,오후 2시부터 5시 사이에는 무더위 휴식 시간제를 시행해 건설 현장 작업이나 농사일을 쉬도록 강력히 권고한다. 농축산 분야 피해를 줄이기 위해 현장 기술 지원단을 파견해 가축 재해보험 가입을 돕는다. 아울러 이웃... 
2026-06-07,네이버뉴스,"광주노동청, 폭염 대비 건설현장 불시점검 강화",https://www.namdonews.com/news/articleView.html?idxno=912850,광주지방고용노동청이 여름철 폭염과 건설현장 중대재해 예방을 위한 불시점검을 강화하고 나섰다. 광주지방고용노동청은 최근 전남 장성군 진원면 소재 '산동초등학교 신축공사' 현장을 방문해 전라남도교육청... 
2026-06-08,네이버뉴스,"현대차그룹 9조 원 새만금 투자 뒷받침 나선 국토부, 中 수소 밸류체인...",https://www.autodaily.co.kr/news/articleView.html?idxno=544692,또 세계적 규모의 수소충전소를 건설·운영 중인 기업을 방문해 운영 효율성과 지능형 플랫폼 기반 안전관리... 다싱 국제 수소에너지 시범구는 공용 테스트베드와 규제 완화 기능도 갖추고 있다. 입주 기업이 신기술과... 
2026-06-08,네이버뉴스,규제의 벽은 높아지는데 집값은 오른다…6월 부동산 시장의 '이중 구조...,https://www.betanews.net/article/view/beta202606060012,대출 규제는 이달 말 또 한 번의 전환점을 맞는다. 규제와 상승이 공존하는 6월 부동산 시장의 핵심 이슈를... 지방 주택담보대출에는 지방 경기 침체와 건설 경기 부진을 고려해 2025년 말부터 올해 6월 말까지 3단계... 
2026-06-08,네이버뉴스,"[섬 특별기획] ""우리는 맨날 들러리여"" 소외된 섬들의 외침... 여수 '월호...",http://www.netongs.com/news/articleView.html?idxno=333365,"건설 공사가 한창인 이곳은 육지와의 연결을 눈앞에 두고 큰 기대감에 부풀어 있어야 하지만, 정작 섬에서 만난 주민들의 표정은 어둡기만 했다. 정부 공모사업으로 수십억 원을 들여 지은 최신식 시설들이 행정 규제에... "
2026-06-08,네이버뉴스,[손병관의 뉴스프레소] 투표용지 사태' 계기로 '전국 재선거' 요구한 장...,https://www.ohmynews.com/NWS_Web/View/at_pg.aspx?CNTN_CD=A0003241245&CMPT_CD=P0010&utm_source=naver&utm_medium=newsearch&utm_campaign=naver_news,"교육 규제 문제 등이 논의됐다. 손현보는 21대 대선을 앞두고 예배 중 이재명 대통령을 비방하고 특정 후보... 시위대는 플라밍고 모형을 들고 ""알바니아는 팔 수 없다""는 구호를 외쳤고, 건설 중단 청원에 서명한 사람도... "
2026-06-08,네이버뉴스,"오세훈, 민간주도 정비사업 연속성 확보…중앙정부와 협력이 관건",https://www.ceoscoredaily.com/page/view/2026060514545942072,"고도지구 높이 규제 완화, 사전협상제 확대 등 규제 완화를 현실화하기 위해서는 관련 조례 개정이 필수적이기 때문이다. 이은형 대한건설정책연구원 연구위원은 “도시정비사업 등 그동안 추진되어 온 정책들이... "
2026-06-08,네이버뉴스,[오세훈 5기 부동산 로드맵①] 신통기획 시즌2 시동…서울 재건축 시계...,https://www.dailian.co.kr/news/view/1652740/?sc=Naver,그간 오 시장은 대출 규제 완화와 토지거래허가구역 규제 완화 등을 지속적으로 요구해왔지만 정부의 정책 기조와는 일부 온도차를 보여왔다. 이은형 대한건설정책연구원 연구위원은 “오 시장의 연임으로 기존 5년간... 
2026-06-08,네이버뉴스,"[글로벌 AI시티 경쟁]②북미ㆍ중동, 대규모 투자로 AI시티 모델 확장",https://www.dnews.co.kr/uhtml/view.jsp?idxno=202606051012466460190,"사우디가 추진 중인 ‘네옴시티(NEOM City)’는 도시의 설계부터 건설, 운영에 이르는 전 과정에 AI를 전면... 또한 UAE 정부는 경제자유구역 제도를 기반으로 세제 혜택과 기업 친화적 규제를 제공하며 글로벌 AI 기업과... "
2026-06-08,네이버뉴스,한명식 엔지니어링협회장 “기술이 시장 주도하는 ‘셀러스마켓’ 만들...,https://www.dnews.co.kr/uhtml/view.jsp?idxno=202606051047493770195,"한 회장은협회 수석부회장과 한국건설엔지니어링협회 토목협의회장, 엔지니어링공제조합 운영위원장 등을... 업·면허 규제, 불합리한 PQ 요건, 중복 행정절차 등을 개선하는 것으로도효과를 볼 수 있을 것”이라고 말했다.... "
2026-06-08,네이버뉴스,5극3특 시대 인천의 진로는,http://www.incheonin.com/news/articleView.html?idxno=118488,과도한 규제와 지방소멸을 이유로 불균형적 자기지방 중심의 이기주의에 빠지는 것이고 이를 증폭시키는 정치적 이해관계에 따른 비합리적 분산이다. 향후 광역행정통합이 진행되면서 모두가 공항을 건설하고 삼성전자... 
2026-06-08,네이버뉴스,장비사가 건설기계 70% 운용…문제 생기면 시공사 탓?,https://www.kmecnews.co.kr/news/articleView.html?idxno=50069,현재 국내 건설기계 관리 체계에는 장비의 노후화를 제한할 구체적인 연식 규제(사용 기준)조차 마련되어 있지 않다. 이로 인해 30~40년이 지나 뼈대가 낡고 혈관이 막힌 노후 장비들이 현장을 버젓이 누비고 있다. 여기에... 
2026-06-08,네이버뉴스,[청숫골에서] 폭염 보다 무서운 현장 여건 고려 않는 '탁상행정',https://www.kmecnews.co.kr/news/articleView.html?idxno=50044,정부의 규제 중심 칼날이 거세질 때마다 건설 현장 실무자들은 폭염 그 자체보다 무서운 '현실 모르는 탁상행정'에 먼저 숨이 막힌다고 호소한다. 진정으로 근로자의 목숨을 폭염으로부터 지키고 산업을 고도화하고 싶다면... 
2026-06-08,네이버뉴스,[서평] 인류의 '금빛 욕망'…인간은 왜 황금에 매혹됐나,https://www.ajunews.com/view/20260605152739826,중세의 사치 금지법이 금단추 등 금장식을 규제한 것은 봉건 질서를 지키기 위한 조치였던 것으로도 해석된다. 저자들은 금을 향한 인간의 욕망이 어떻게 문명을 건설했고 또 어떻게 제국을 무너뜨렸는지를 여러 사례를... 
2026-06-08,네이버뉴스,부동산·非조합원 대출 늘렸던 고영철 신협 회장… ‘건전성 위기’ 극...,https://biz.chosun.com/stock/finance/2026/06/05/TRW3MG75AJB7RONJYADJGLXXK4/?utm_source=naver&utm_medium=original&utm_campaign=biz,"부동산·건설 관련 신규 대출을 크게 늘렸다. 당시 전체 개인 사업자 대출 신규 취급액의 3분의 1 이상이... 반면 AMC는 부실 채권 매입 시 자산 한도 규제가 없고, 필요하면 예금자보호기금에서 돈을 빌릴 수 있다.... "
2026-06-08,네이버뉴스,수도권 공급 '6만가구' 절반이 野 단체장 지역…주택공급 시험대,https://www.newsis.com/view/NISX20260607_0003659266,"재건축초과이익환수제, 안전진단 기준 완화 등 핵심 규제 완화는 국회와 중앙정부 협조 없이는 추진이 어렵고, 민간 주도 방식 특성상 사업 지연이나 집값 자극 가능성도 제기된다. 이은형 대한건설정책연구원... "
2026-06-08,네이버뉴스,"[CEO리포트] 박제임스 롯데바이오 대표, '듀얼 사이트' 전략 닻 올린다",https://daily.hankooki.com/news/articleView.html?idxno=1371649,"롯데바이오로직스는 2022년 출범 이후 미국 시러큐스 생산시설 인수와 송도 바이오캠퍼스 건설을 통해 CDMO... 설비 적격성 평가, 공정 밸리데이션, 고객사 실사, 규제 대응 등 후속 절차를 차질 없이 수행하고 품질... "
2026-06-08,네이버뉴스,"日 ""국산 전기차 보호"" 수입차 보조금 싹뚝...한국차 어쩌나 [클로즈업...",https://www.hankookilbo.com/news/article/A2026060509120002553?did=NA,중국 공세 막으려 EU도 해외 업체 규제 자국 업체를 키우려 해외 업체를 차별하는 정책은 이미 세계적인... 캐나다 온타리오주(州)에서 추진해 온 전기차 공장과 배터리 공장 건설도 중단하기로 했다. 닛산자동차도 미... 
2026-06-08,네이버뉴스,머니투데이 오프라인 헤드라인-8일,https://www.mt.co.kr/economy/2026/06/08/2026060721524249311,"AX 시대, 차기 총리 한성숙 국가경제 살릴 시간…'구조개혁'에 초집중 똑똑한 규제·생산적 금융 대전환... 수주"" [건설 부동산] 새만금 '수소 허브' 육성, 中서 해법 찾는다 [산업전환 돌파구, 독일에서 찾다] '쿠카 쇼크... "
2026-06-08,네이버뉴스,[오늘의 경제뉴스] 깐부·삼쏘회동·야구장시구·유퀴즈 출연…젠슨 황...,https://www.newsverse.kr/news/articleView.html?idxno=10650,"전력 수급 정책, 인프라 규제, 인재 육성, 데이터 프라이버시 및 활용 기준 등 AI 산업의 생사여탈권을 쥔... 이미 글로벌 시장에서는 일자리 대체 문제, 무지막지한 데이터센터 건설에 따른 환경 및 전력 논쟁, 군사적 악용... "
2026-06-08,네이버뉴스,"오세훈의 서울시, 정부와 이견… 주택 공급 판도 바뀌나",https://www.chosun.com/economy/real_estate/2026/06/08/246YPSMPGNHQ5BQUTYX3NXSILY/?utm_source=naver&utm_medium=referral&utm_campaign=naver-news,"아파트를 건설하겠다는 것을 두고 ‘이중 잣대’라고 강하게 비판한 바 있다. ‘주택 공급 확대’라는... 吳 공약도 정부 지원 필요 오 시장은 신속 통합 기획, 모아타운 등 기존 추진하던 정비 사업 규제 완화와 신규... "
2026-06-08,네이버뉴스,‘플라밍고 혁명’ 목청 높인 알바니아,https://www.chosun.com/international/international_general/2026/06/08/GAZOUUSN4NHUFGQDC3RJKWJRZ4/?utm_source=naver&utm_medium=referral&utm_campaign=naver-news,"리조트를 건설하는 계획을 세웠고, 라마 총리가 이끄는 알바니아 정부는 외국 투자 유치 차원에서 보호구역 개발 규제를 완화하며 리조트 개발 사업을 승인했다. 그러나 환경운동 단체와 시민들은 리조트가 세워질... "
2026-06-08,네이버뉴스,"[월요칼럼]강원의 미래, 산업에 달렸다",https://www.kwnews.co.kr/page/view/2026060750023000000,이러한 구조 속에서 최근의 내수 부진과 건설경기 침체는 지역경제 전반의 하방 압력으로 작용하고 있다.... 강원특별법에 따른 규제 특례는 산업 실험과 혁신을 가능하게 하는 중요한 수단이다. 이를 전략적으로 활용해... 
2026-06-08,네이버뉴스,北中 밀착·美日 견제·북핵… 시진핑 방북 ‘3대 관전 포인트’,https://www.kmib.co.kr/article/view.asp?arcid=1780824233&code=11142200&cp=nv,"최근에는 섬지역 미사일기지 건설, 필리핀과의 합동 군사훈련, 무기 수출 규제 완화 등을 놓고 일본이 재무장을 통해 군국주의의 부활을 노린다고 비판해 왔다. 북핵 문제는 중국에도 뜨거운 감자다. 미국 백악관은 지난달... "
2026-06-08,네이버뉴스,SK 중간지주사 엇갈린 성적표…‘열등생’ 된 SK디스커버리 [정답은 TSR...,http://www.fntimes.com/html/view.php?ud=202606060004489412dd55077bc2_18,"과거 주요 주주였던 SK건설(현 SK에코플랜트)은 공정거래법 규제를 피하기 위해 지난 2019년 지분을 정리한 바 있다. 올해 3월에는 풍력, 태양광, 연료전지 등 신재생에너지 전문사 SK이터닉스 지분 전량을 사모펀드... "
2026-06-07,네이버뉴스,"KTL, AX 실증센터 구축 사업 주관기관 선정",http://www.gnmaeil.com/news/articleView.html?idxno=588111,"기계, 건설, 에너지 등 국가 주력산업을 뒷받침하는 핵심 기반 산업이다. 동시에 고온 공정과 대규모 에너지 사용이 필수적인 대표적인 탄소 다배출 산업으로, 글로벌 공급과잉과 보호무역, 탄소규제 강화 등으로 산업... "
2026-06-07,네이버뉴스,거대 해양플랜트도 이제 대량생산시대,https://news.knn.co.kr/news/article/188577,"따라서 이 프로젝트를 건설하고, 각종 규제를 통과하고 2028년에 운영을 시작하게 된 것은 매우 큰 성과입니다. 캐나다 전체로 봐도 중요한 시설입니다.""} 거제 삼성중공업에서는 지금 캐나다외에 이탈리아... "
2026-06-07,네이버뉴스,달에서 대포를?…‘뻥’이 아니야,https://www.khan.co.kr/article/202606072046005,"머스크가 매스 드라이버를 월면에 건설하겠다는 복안을 올해 들어 계속 밝혔고, 지난달에는 스페이스X의... 이 때문에 우주조약 규제를 피해갈 가능성이 있다. 매스 드라이버가 유사시에 우주 대포로 사용될 수 있다고... "
2026-06-07,네이버뉴스,"KTL, 철강·금속제조기업 지원 AX 실증센터 구축",https://www.gnnews.co.kr/news/articleView.html?idxno=638444,"건설·에너지 등 국가 주력산업의 기반이 되는 핵심 산업이다. 하지만 고온 공정과 대규모 에너지 사용 특성으로 인해 대표적인 탄소 다배출 산업으로 꼽힌다. 최근에는 글로벌 공급과잉과 보호무역 강화, 탄소규제... "
2026-06-07,네이버뉴스,"美 보이저 테크놀로지스, 재사용 로켓업체 애스트로보틱 인수",https://www.irobotnews.com/news/articleView.html?idxno=46756,"그는 ""사람의 노동력만으로는 그 모든 것을 건설할 수 없다. 어느 정도는 로봇이 주도적으로 이끌게 될 것이다""라고 말했다. 이번 인수 거래는 통상적인 규제 당국의 승인을 거쳐 7월 초 완료될 것으로 예상된다."
2026-06-07,네이버뉴스,호르무즈 사태로 재확인된 세계 급소 '경제적 상호의존',https://news.sbs.co.kr/news/endPage.do?news_id=N1008598566&plink=ORI&cooper=NAVER,미국의 규제로 인해 중국은 엔비디아와 같은 기업이 생산하는 최첨단 인공지능(AI)용 반도체를 확보하는 데... 호르무즈 해협에 대한 세계의 의존도를 낮추려면 새로운 송유관과 수출 경로 건설에 대규모 투자가... 
2026-06-07,네이버뉴스,"'배당' 카드까지 꺼낸 트럼프…""국민 부자로 만들겠다""",https://www.hankyung.com/article/2026060717521,"데이터센터 건설로 인한 전기료 상승과 AI 발달에 따른 일자리 위협 등이 주요 불안으로 꼽힌다. AI 이익... 오픈AI는 AI에 적대적인 여론 관리와 막대한 인프라 투자 재원 마련, AI 관련 정부 규제 완화 등 여러 가지 목표를... "
2026-06-07,네이버뉴스,"금융위, 비거주 1주택 대출규제 '고심'",http://www.fnnews.com/news/202606071817147553,"1주택 규제방안을 내놓기 어려울 것으로 내다보고 있다. 대한건설정책연구원 이은형 연구위원은 ""비거주 1주택은 집이 하나인데 정부가 가질 자격 유무를 판단해 주겠다는 것이 불합리하다""면서 ""예외를 인정해준다 해도... "
2026-06-07,네이버뉴스,보유세 변수 된 '공정시장가액비율',https://www.hankyung.com/article/2026060717201,"심주은 광장 변호사의 호반·대방건설 공공택지 전매 관련 판례 분석에서 “지원 이익의 규모가 크지 않다면... 이밖에 임세영 태평양 변호사의 금융권 망 분리 규제 완화 추진 현황, 양동운 남산 변호사의 금융 시스템... "
2026-06-07,네이버뉴스,日기업 부동산 매각 18년만에 최대,http://www.fnnews.com/news/202606071757198396,도시미래종합연구소에 따르면 비(非)부동산·건설 기업의 국내 부동산 매각액은 지난해 전년 대비 9... 실물자산의 활용 효율을 지속 점검하도록 하는 내용이 포함되며 규제·투자자 압박이 동시에 강화되는 양상이다.
2026-06-07,네이버뉴스,"“민선 9기 대구, AI로봇 수도 도약하려면 반드시 메가특구 잡아야”",https://www.yeongnam.com/web/view.php?key=20260607023568586,"섬유 단일 업종 규제로 가동률 저하, 공실 증가 등을 겪는 염색산단에 △입주업종 다양화 및 전용공업지역... 조성, 건설산업 혁신 펀드 2천500억원 지원, TK신공항 수출벨트 구축 등을 추진할 예정이다.◆대구형 맞춤... "
