date,source,title,link,description
2026-05-20,네이버뉴스,"오세훈, 철근 누락 논란에 ""은폐한적 없어...민주당이 선거 소재화""",http://www.fnnews.com/news/202605201032074280,"오 후보는 20일 서울 중구 한국프레스센터에서 열린 관훈토론회에서 ""현대건설이 문제를 발견한 즉시 발주기관에 보고했고, 전문가 검토를 거쳐 보강공사를 진행한 사안""이라며 ""민주당이 이를 선거 소재로 무리하게... "
2026-05-20,네이버뉴스,"GTX 삼성역 철근 누락 사태, 건설노조 책임 규명 촉구",https://mdtoday.co.kr/news/view/1065576693871324,민주노총 건설노조가 수도권광역급행철도(GTX) 삼성역 복합환승센터 건설 현장에서 발생한 대규모 철근 누락 사태와 관련해 시공사인 현대건설과 인허가 기관인 서울시의 엄중한 책임을 요구하고 나섰다. 건설노조는... 
2026-05-20,네이버뉴스,DL이앤씨가 '현대텃밭' 노리는 이유… 박상신 체면 차리기?,https://it.chosun.com/news/articleView.html?idxno=2023092162432,DL이앤씨가 서울 강남구 압구정5구역 재건축 수주전에서 현대건설과 맞붙으며 조합원 표심 확보에 공을 들이고 있다. 하지만 압구정 재건축 사업은 '압구정 현대'로 대표되는 현대건설의 텃밭으로 여겨지는 만큼... 
2026-05-20,네이버뉴스,압구정3·4구역 시공사 이번 주말 결정...현대건설·삼성물산 유력,https://www.g-enews.com/view.php?ud=202605201036273131ac06cade6e_1,압구정3구역 재건축사업조합은 이날 조합원 총회를 열고 시공사 우선협상대상자로 선정된 현대건설에 대한 찬반 투표를 실시한다. 압구정3구역 재건축은 압구정동 393-1번지 일대 아파트 3934세대를 5175가구의... 
2026-05-20,네이버뉴스,"[단독] '철근 누락' 삼성역, 혈세도 샌다…""400억대 추가 보전금 들 듯""",http://www.yonhapnewstv.co.kr/news/AKR20260520103718tQ9,"이연희 의원실에 따르면 시공사인 현대건설측은 보강공사에 약 4~5개월이 걸릴 것으로 예측했습니다. 그간 월평균 82억원의 보전금을 지급했다는 것을 감안하면, 보강공사 동안 추가 지급해야 하는 보전금은 328억... "
2026-05-20,네이버뉴스,압구정 5구역 수주전 …현대 '정통성' vs DL '실익',http://www.smedaily.co.kr/news/articleView.html?idxno=357331,"시공사 선정을 약 열흘 앞둔 압구정5구역 수주전에서 현대건설과 DL이앤씨는 브랜드 전략과 금융 지원, 설계 등에서 차별화를 꾀하는 모습이다. 서울 강남권 핵심 재건축 사업지로 꼽히는 압구정5구역 수주전이... "
2026-05-20,네이버뉴스,"국가철도공단 ""철근 누락 송구…구조 안전 철저 검증""",https://www.newsis.com/view/NISX20260520_0003637178,삼성역 복합환승센터 지하 5층 승강장 기둥의 주철근이 설계도면상 2열로 시공돼야 했지만 시공사인 현대건설의 설계 도면 해석 오류로 실제로는 1열만 시공돼 철근 178t이 누락된 것이다. 철도공단은 시공 오류를 인지한... 
2026-05-20,네이버뉴스,"[압구정5 재건축]'현대냐 아크로냐', 한양 대신할 간판은",https://news.bizwatch.co.kr/article/real_estate/2026/05/19/0028,현대건설과 DL이앤씨가 응찰해 경쟁이 붙은 사업지다. 현재까지 시공사 선정에 나선 4개의 압구정 재건축 사업지 중 유일하게 수주전이 이뤄진 현장이다. 지난 18일 현대건설과 DL이앤씨의 홍보관이 열린 서울 강남구... 
2026-05-20,네이버뉴스,"""GTX-A 삼성역 공사기간 연장-손실보상금 폭탄 우려 커져""",http://www.hansbiz.co.kr/news/articleView.html?idxno=839843,"현대건설은 지난해 11월 이미 철근 누락 사실을 서울시에 보고했지만, 국토교통부와 국가철도공단은 올해 4월 말에야 상황을 인지한 것으로 알려졌다. 그 사이 서울시는 구조검토와 보강 논의를 진행하면서도 공사를... "
2026-05-20,네이버뉴스,"건설노조 ""GTX 삼성역 부실시공, 단순 실수 아닌 중대 사안""",https://www.widedaily.com/news/articleView.html?idxno=294319,민주노총 건설노조가 GTX(수도권광역급행철도) 삼성역 복합환승센터 건설 현장에서 발생한 철근 누락 사태와 관련해 시공사인 현대건설과 인허가청인 서울시의 엄중한 책임을 촉구했다. 건설노조는 지난 19일 서울시청... 
2026-05-20,네이버뉴스,GTX-A 철근 누락 … 압구정 재건축 조합원의 선택은?,http://www.globalepic.co.kr/view.php?ud=20260520102315798548439a4874_29,현대건설과 DL이앤씨가 한판 승부를 벌이고 있는 와중에 삼성역 공사 구간에서 철근 누락 사태가 터져 해당 공사구간을 책임지고 있는 현대건설이 바짝 긴장하고 있다. 시공사의 시공 오류 논란이 재건축 사업... 
2026-05-20,네이버뉴스,"[기업들] 글로벌 신시장 개척부터 사내 상생 문화까지, 국내 기업 안팎...",http://www.dailypop.kr/news/articleView.html?idxno=98998,"현대차그룹은 5월 18일 홍콩 컨벤션센터에서 열린 '국제 수소 개발 심포지엄 2026'에서 현대차, 현대건설, 제아이엔지 등 한국 기업 3개사와 현지 에너지·물류 기업 등 총 10개사가 참여하는 다자간 업무협약을 체결했다.... "
2026-05-20,네이버뉴스,"건협, 한양대서 '미래 건설인 타운홀 미팅' 개최",https://www.widedaily.com/news/articleView.html?idxno=294316,"이번 행사에는 한승구 건협 회장과 현대건설 이한우 대표, 이기정 한양대 총장, 이충재 한국건설산업연구원장, 건설 관련 학과 학생 200여명이 참석했다. 이날 한국건설산업연구원 김민주 박사는 '지능형 건설 시대... "
2026-05-20,네이버뉴스,"추미애 ""남성보다 두세 배 노력해 여기까지 왔다…도민 불편 꼼꼼히 보...",https://www.nocutnews.co.kr/news/6519928?utm_source=naver&utm_medium=article&utm_campaign=20260520102244,예를 들어서 지금 현대건설이 제안한 더팜 방식 말고 다른 방식이 또 필요하다 그러면 교통의 불편이 GTX 노선이 좀 더 늦어질 수도 있잖아요. 하지만 그렇게 해야 된다고 보십니까? ◆ 추미애> 우선은 안전이 더 중요한... 
2026-05-20,네이버뉴스,"""서울시, 철근 누락 현황 알았지만 한마디도 안 했다""",https://www.nocutnews.co.kr/news/6519920?utm_source=naver&utm_medium=article&utm_campaign=20260520102144,"박 의원은 ""서울시는 현대건설로부터 지하 5층 철근 누락 사실을 최초 보고받은 지난해 11월 10일 이후, 외부 전문가 자문회의(12월 23일)와 약 19회에 걸친 현장 점검(12월~올해 3월)을 통해 철근 누락 현황과 보강방안을... "
2026-05-20,네이버뉴스,"현대건설, 5월 건설사 브랜드평판 1위 '독주'…대우건설 55% 급등",http://www.popcornnews.net/news/articleView.html?idxno=121834,"국내 건설업계의 브랜드 평판 조사 결과, 현대건설이 압도적인 평판지수 성장세를 기록하며 부동의 1위 자리를 수성했다. 건설 시장에 대한 소비자들의 소통량이 전반적인 회복세를 보인 가운데, 대우건설이 전월... "
2026-05-20,네이버뉴스,[시선집중] 김영진 “6.3 골든크로스? 장동혁 지도부의 교체 골든크로스...,https://n.news.naver.com/mnews/article/214/0001500131?sid=100,"현대건설이 물론 시공사업자였지만 현대건설에 통보했는데 서울시가 그걸 숨기고 있다가 6개월 만에 현재 상황이 파악됐기 때문에 오세훈 시장이 정말 서울시민의 안전, 경기도민의 안전을 책임지는 시장인가에 대한 안전... "
2026-05-20,네이버뉴스,"""보고했다""는 서울시, 합동점검 자리선 침묵?",https://www.electimes.com/news/articleView.html?idxno=368242,"서울시는 현대건설로부터 지하 5층 철근 누락 사실을 최초 보고받은 지난해 11월 10일 이후, 외부 전문가 자문회의(12월 23일)와 약 19회에 걸친 현장 점검(12월~올해 3월)을 통해 철근 누락 현황과 보강방안을 이미 파악하고... "
2026-05-20,네이버뉴스,"‘젊은층 없는 건설산업 미래는 없다’…건협, 미래 건설인과 타운홀미...",https://www.dnews.co.kr/uhtml/view.jsp?idxno=202605191420509580298,"한승수 건협 회장을 비롯해 이한우 현대건설 대표, 최태진 건협 서울시회장, 정형열 건협 부산시회장, 박한상 건협 경북도회장, 김기춘 건협 제주도회장, 이충재 한국건설산업연구원장 등은 후배 건설인 110여 명을 일일이... "
2026-05-20,네이버뉴스,한승구 건협 회장 “건설은 사람과 가장 가까운 곳에서 미래를 만드는 ...,https://www.dnews.co.kr/uhtml/view.jsp?idxno=202605191530084490330,"건협, 19일 오후 2시 ‘MEET the CEOs : 한양대 미래 건설인 타운홀미팅’ 개최 이한우 현대건설 대표 “에너지 슈퍼 사이클 진입…데이터센터 등 건설산업 新 먹거리” “건설은 사람의 삶과 가장 가까운 곳에서 미래를... "
2026-05-20,네이버뉴스,[언주로 칼럼] 러ㆍ우 전쟁의 제2라운드,https://www.dnews.co.kr/uhtml/view.jsp?idxno=202605190645019790192,"이미 현대건설, 롯데건설, 포스코이앤씨 등 대형사들은 발주자에 중동전쟁 관련 리스크를 공지한 바 있다. 하지만 각 건설사의 개별적 대응으론 한계가 있다. 이때 필요한 것이 건설현장이 체감할 수 있는 정부의 제도적... "
2026-05-20,네이버뉴스,"서울창조경제혁신센터, 2026년 '민관협력 오픈이노베이션 지원' 사업 '전...",https://www.hankyung.com/article/202605196896O,서울교통공사 △현대건설 △카카오모빌리티 △한국콜마 △경기도청 △가톨릭대학교산학협력단 △㈜타임교육C&P △㈜대경벤드 △㈜현대백화점 △연합뉴스 △SK텔레콤 등이다. 선정된 스타트업은 수요기업과 협업... 
2026-05-20,네이버뉴스,[단독] GTX-A 삼성역 '철근 누락' 외부 검증 착수...무정차 운행 속 기둥...,https://www.asiaa.co.kr/news/articleView.html?idxno=250052,"해당 공구는 현대건설이 포함된 컨소시엄이 시공 중인 구간으로, 공단은 긴급 안전점검과 전문가 자문을 거쳐 별도 전문기관 검증 필요성을 내부적으로 결정한 것으로 보인다. 이번 용역의 범위는 단순 보강 검토에... "
2026-05-20,네이버뉴스,"숨긴 GTX 철근누락…박용갑 ""서울시 은폐 의심 규명해야""",https://www.ccdailynews.com/news/articleView.html?idxno=2417379,서울시는 지난 2025년 11월 현대건설로부터 철근 누락 사실을 보고받은 뒤 외부 전문가 자문회의와 현장 점검을 반복하며 보강 방향까지 검토해 온 것으로 전해졌다. 실제 2025년 12월~2026년 3월까지 약 19차례 현장 점검도... 
2026-05-20,네이버뉴스,현대건설 'GTX 삼성역 철근 누락' 검증 체계 논란 확산,https://www.safetimes.co.kr/news/articleView.html?idxno=242889,현대건설은 설계도면 해석 과정에서 '투 번들(Two bundle)' 표기 등 구조 적용 기준이 현장에 충분히 반영되지 못하면서 오류가 발생했다는 입장을 밝히고 있다. 해당 사항은 자체 점검 과정에서 확인돼 서울시에 보고됐고... 
2026-05-20,네이버뉴스,"건협, 한양대서 '미래 건설인 타운홀 미팅' 개최ⵈ 건설산업 미래 비전...",http://www.ikld.kr/news/articleView.html?idxno=334786,"이번 행사는 한승구 대한건설협회 회장을 비롯해 이한우 현대건설 대표, 최태진 서울시회장, 이기정 한양대학교 총장, 이충재 한국건설산업연구원장과 한양대 건설학과 대학생 200여 명이 참석했다. 이날 행사에서는... "
2026-05-20,네이버뉴스,"""총회 오면 20만원 ""... 압구정3·4구역, 현금 걸고 참석 독려하는 이유...",https://www.meconomynews.com/news/articleView.html?idxno=131244,"압구정3·4구역, 총회 참석 현금 지급키로 시공사 선정 총회, 조합원 과반 이상 출석해야 성립 3구역 일부 조합원들, 현대건설 창호에 일부 반발 4구역도 일부 조합원들, 삼성물산 평형 배치 불만 조합원들 ""시공사 선정 전... "
2026-05-20,네이버뉴스,"현대건설 힐스테이트, 5월 아파트 브랜드평판 1위 탈환",https://www.businesskorea.co.kr/news/articleView.html?idxno=269746,현대건설의 힐스테이트가 소비자들의 압도적인 지지를 받으며 2026년 5월 아파트 브랜드평판 1위 자리를 수성했다. 브랜드에 대한 긍정적 평가와 미디어 관심도가 높아지면서 2위권과의 격차를 더욱 벌리는... 
2026-05-20,네이버뉴스,"""서울시, 국토부와 12번 현장회의에도 '철근 누락' 보고 안했다""",https://news.jtbc.co.kr/article/NB12299036?influxDiv=NAVER,"2025년 11월 10일은 철근 누락 사실을 인지한 현대건설이 서울시에 이를 보고한 때라고 알려진 날짜입니다. 기록을 보면 서울시는 국토부 관계자, 외부 전문가와 함께 지난 1월 29일 '균열점검'을 했습니다. 서울시가 철근... "
2026-05-20,네이버뉴스,"[르포] '압구정 정통' 내세운 현대건설 vs '5구역 실리'의 DL이앤씨, 홍보...",https://www.theguru.co.kr/news/article.html?no=101943,"현대건설, '압구정 현대' 브랜드 타운에 로보틱스·갤러리아 연계로 프리미엄 강조 DL이앤씨, '57개월 공기단축 · 가산금리 0%' 파격 금융 조건으로 실속 표심 공략  오는 30일 시공사 선정을 앞둔 압구정 5구역(한양 1·2차)... "
2026-05-20,네이버뉴스,"현대건설 vs DL이앤씨, 압구정5구역 격돌…삼성역 ‘철근 누락’ 리스크...",https://www.mk.co.kr/article/12052824,"압구정5구역 사업비 규모만 1조5000억 현대건설, 핵심 특화 상품 ‘올인원’ 포함 DL이앤씨, 공사 기간 10개월 단축 포부 “시공사 선정까지 영향 미치기는 어려워” 서울 강남구 압구정5구역 수주전이 한창이 와중에... "
2026-05-20,네이버뉴스,중소도시급 생활권 형성하고 있는 '읍'...공급 줄자 신규 분양에 시선,https://www.bizwork.co.kr/news/articleView.html?idxno=415766,"현대건설은 5월 경남 양산시 물금읍 가촌리, 범어리 일원에 짓는 '힐스테이트 양산더스카이'를 분양할 예정이다. 2개 단지, 총 598가구로 지어진다. 전국 '읍' 중에서 가장 인구가 많은 곳답게 양산부산대학교병원... "
2026-05-20,네이버뉴스,건설회사 브랜드평판 5월…현대건설·대우건설·삼성물산 톱3,https://www.betanews.net/article/view/beta202605200012,"한국기업평판연구소가 20일 발표한 5월 건설회사 브랜드평판 분석 결과 1위 현대건설(대표 이한우), 2위 대우건설, 3위 삼성물산 순으로 집계됐다. 이번 분석은 2026년 4월 20일부터 5월 20일까지 한 달간 수집된... "
2026-05-20,네이버뉴스,"힐스테이트, 5월 아파트 브랜드평판 1위...롯데캐슬·e편한세상·래미안...",http://www.thebigdata.co.kr/view.php?ud=202605200816236432d0a8833aad_23,"현대건설의 아파트 브랜드인 힐스테이트가 최근 한달간 실시된 국내 아파트 브랜드평판 빅데이터 분석에서 1위를 차지했다. 롯데건설의 롯데캐슬과 DL이앤씨의 e편한세상, 삼성물산의 래미안 등이 뒤를 이었다.... "
2026-05-20,네이버뉴스,"현대건설, 건설사 브랜드평판 5월 1위...대우건설·삼성물산·롯데건설...",http://www.thebigdata.co.kr/view.php?ud=202605200809478291d0a8833aad_23,"현대건설이 최근 한달간 실시된 국내 건설회사 브랜드평판 분석에서 1위를 차지했다. 대우건설과 삼성물산, 롯데건설이 뒤를 이었다. 20일 한국기업평판연구소(소장 구창환)는 31개 건설회사 브랜드를 대상으로 4월... "
2026-05-20,네이버뉴스,초고가 주택 가격 꺾였다지만…‘그사세’ 거래는 여전,https://www.sedaily.com/article/20046098?ref=naver,독자 유형별 맞춤 뉴스 6개를 선별해 제공합니다 ■ 압구정5구역 수주 혈투: 현대건설(000720)과 DL이앤씨(375500)가 압구정 5구역 홍보관을 열고 한강 조망권·공사비·금융 조건을 놓고 정면 충돌하고 있다.... 
2026-05-20,네이버뉴스,"힐스테이트, 아파트 브랜드평판 2026년 5월...1위",http://www.beyondpost.co.kr/view.php?ud=20260520080735711846a9e4dd7f_30,현대건설의 아파트 브랜드 힐스테이트가 2026년 5월 아파트 브랜드평판 조사에서 1위를 기록했다. 한국기업평판연구소는 지난 4월20일부터 5월20일까지 국내 아파트 브랜드 26개를 대상으로 빅데이터... 
2026-05-20,네이버뉴스,"현대건설, 건설회사 브랜드평판 2026년 5월...1위",http://www.beyondpost.co.kr/view.php?ud=20260520080007892246a9e4dd7f_30,현대건설이 2026년 5월 국내 건설회사 브랜드평판 조사에서 1위를 기록했다. 한국기업평판연구소는 4월20일부터 5월20일까지 국내 건설회사 브랜드 31개를 대상으로 빅데이터 3111만574개를 분석한 결과... 
2026-05-20,네이버뉴스,"서울시 ""기 통보"" vs 철도공단 ""인지 불가""...""안전불감증""發 GTX-A 철근 ...",https://www.youthdaily.co.kr/news/article.html?no=219400,시는 지난해 11월 10일 시공사인 현대건설로부터 관련 사실을 통보받은 즉시 현장 안전점검을 실시했다. 이후 구조기술사 검토를 통해 현재 하중으로는 구조물 안전에 문제가 없음을 확인하고 공사를 지속했다는... 
2026-05-20,네이버뉴스,"직스테크놀로지-서울매그넷고, AI 설계 인재 육성을 위한 교육 협력 본...",https://www.etnews.com/20260520000388,"또한 'ZYXCAD AX'는 삼성물산, SK AX, 우미건설, GS리테일, LS ITC 등 주요 기업과 한국항공우주연구원(KARI), 국방과학연구원(ADD), 국가유산청 등 국가기관에서도 활용되며 기술력을 인정받고 있다. 직스테크놀로지 최종복... "
2026-05-20,네이버뉴스,"[이슈] 한화 건설부문, '복합개발·환경·신기술'로 불황 파고 넘는다…...",http://www.paxetv.com/news/articleView.html?idxno=272566,LH 아파트 단지 공급을 시작으로 삼성물산 건설부문 등 타 건설사들과의 파트너십을 통해 외부 정비 시장까지 확장한다는 계획이다. 진입장벽이 높은 고부가가치 특수건축 시장에서도 독보적인 지위를 굳히고 있다.... 
2026-05-20,네이버뉴스,[건설업계 브리핑] IPARK현대산업개발·롯데건설·GS건설·삼성물산,https://daily.hankooki.com/news/articleView.html?idxno=1369048,"◇삼성물산 '홈닉', '입주 전 단계'까지 서비스 영역 확대 삼성물산 건설부문의 홈플랫폼 '홈닉' 메인 화면. 사진=삼성물산 삼성물산 건설부문은 자사 홈플랫폼 '홈닉'에 입주예정자를 위한 서비스를 추가한다고 20일... "
2026-05-20,네이버뉴스,"코스피, 외국인 매도세에 7100선 공방⋯삼전 노사 합의 불발로 출렁",https://www.etoday.co.kr/news/view/2586323,"전기·가스(-5.88%), 금속(-5.17%), 유통(-4.10%), 기계·장비(-3.81%), 화학(-3.77%), 건설(-3.64%) 등 약세다.... 41%), 삼성물산(-4.86%), 기아(-4.13%), 삼성SDI(-5.11%) 등은 하락세다. 이날 삼성전자는 장 초반 강세를 보였지만 노사... "
2026-05-20,네이버뉴스,"[부동산 짚어보기] ""산·호수 품은 아파트 대세""…'그린 프리미엄' 관심...",http://www.newsian.co.kr/news/articleView.html?idxno=89888,"백운호수 전경 [사진=리젠시빌건설] 20일 부동산 업계에 따르면, 이 같은 흐름은 청약 시장에서도 나타나고 있다. 청약홈에 따르면 삼성물산이 지난 3월 서울 강서구 방화동에서 분양한 '래미안 엘라비네'는 137가구... "
2026-05-20,네이버뉴스,행정타운 인접 단지… ‘평택 고덕 우미린 프레스티지’ 6월 분양,https://www.dnews.co.kr/uhtml/view.jsp?idxno=202605201255480360443,"이러한 가운데 우미건설 컨소시엄은 6월 경기도 평택시 고덕동 고덕국제화계획지구 내 Abc-36블록에서 '평택... 마련되며, 삼성물산의 홈 플랫폼 '홈닉'이 도입될 예정이다. '평택 고덕 우미린 프레스티지'의 견본주택은... "
2026-05-20,네이버뉴스,"건설경기 '내수 훈풍'…3월 국내 수주 역대 최고, 해외는 급감",https://www.g-enews.com/view.php?ud=202605201057086522514e0091f6_1,"필리핀은 1억5000만 달러, 폴란드는 1억1000만 달러를 기록했다. 업체별 수주 순위는 삼성물산 건설부문, 대우건설, HJ중공업 건설부문 순이었다. 최재민 글로벌이코노믹 기자"
2026-05-20,네이버뉴스,[AI 아파트] 지게차가 스스로 움직이고 계약서도 분석… 건설현장 바뀐...,https://biz.chosun.com/real_estate/real_estate_general/2026/05/20/G6CRW6QACVEMNEJ7XTBRSKPVZA/?utm_source=naver&utm_medium=original&utm_campaign=biz,삼성물산 건설부문은 서울 서초구 반포3주구 재건축 현장에 AI 기술을 활용한 자율주행 지게차와 자재 이동 로봇을 도입했다. 현장에서 작업이 없는 야간에 자재를 자동으로 운반함으로써 주간 작업 공정 간섭을... 
2026-05-20,네이버뉴스,숲·호수 품은 아파트 몸값 '껑충'…'그린 프리미엄' 단지에 수요 몰려,https://www.pinpointnews.co.kr/news/articleView.html?idxno=454028,삼성물산이 지난 3월 서울 강서구 방화동에서 분양한 '래미안 엘라비네'는 일반공급 137가구 모집에 3855명이... 동양건설산업이 인천 서구 검단신도시에서 분양한 '검단호수공원역 파라곤'은 204가구 모집에 6377명을... 
2026-05-20,네이버뉴스,"호카 총판 조이웍스 ""美 본사, 새로운 한국 유통사 선임 불가… 계약 유...",http://www.financialreview.co.kr/news/articleView.html?idxno=42384,"전임 대표 즉시 퇴출… 삼성물산·아디다스 출신 '공동대표 체제' 가동 조이웍스는 전임 대표의 개인 일탈을... 이문기 조이웍스 공동대표는 ""데커스와 한국 러너들을 위한 건설적인 대화를 이어가고 있다""며, ""이번... "
2026-05-20,네이버뉴스,"호카 총판 조이웍스 ""갑질 논란은 사실무근""…계약 유지 총력전",https://www.sisajournal.com/news/articleView.html?idxno=373509,"새롭게 선임된 이문기 공동대표는 과거 삼성물산 패션부문에서 전략기획 및 글로벌사업그룹장을 지낸 전략... 이문기 조이웍스 공동대표는 ""데커스와 한국 러너들을 위한 건설적인 대화를 이어가고 있다""며, ""이번... "
2026-05-20,네이버뉴스,"호카 판권 유지 가능할까...조이웍스 ""美 본사와 계약 협의 중""",https://www.wolyo.co.kr/news/articleView.html?idxno=312424,"이문기 공동대표는 삼성물산 패션부문에서 전략기획과 글로벌사업그룹장을 역임한 전략·재무통으로 2025년... 이문기 공동대표는 ""데커스와 한국 러너들을 위한 건설적인 대화를 이어가고 있다""며 ""새로운 리더십으로... "
2026-05-20,네이버뉴스,"DL건설, 부천 AI 데이터센터 수주⋯'신사업 축' 키운다",http://www.inews24.com/view/1969956,"국내 건설사들도 액침냉각·모듈러 공법·전력 인프라 등을 앞세워 시장 선점 경쟁에 나서고 있다. 삼성물산은 액침냉각·모듈러 공법 기술 확보에 집중하고 있고, SK에코플랜트는 AI 인프라 솔루션 사업 확대에 나서고... "
2026-05-20,네이버뉴스,[100세시대 현장의 불자들] 4. 은퇴출가자,https://www.beopbo.com/news/articleView.html?idxno=335559,"해운업에 종사하며, 삼성물산이 건설에 참여한 두바이 '부르즈 할리파' 자재를 운송하는 등 세계 곳곳을 오갔다. 사회적으로 안정적인 삶이었다. 가정을 꾸리고 경제적으로도 부족함이 없었다. 하지만 마음속 허무함은... "
2026-05-20,네이버뉴스,"이문기 조이웍스 공동대표 ""美 호카 본사, 새로운 한국 유통사 선임 불...",https://www.fashionbiz.co.kr/article/226398,"이문기 조이웍스 공동대표는 ""데커스와 건설적인 대화를 이어가고 있다. 전임 대표 사건과 무관한... 이문기 공동대표는 삼성물산 패션부문에서 전략기획과 글로벌사업그룹장을 역임한 전략·재무통으로 2025년 조이웍스에... "
2026-05-20,네이버뉴스,[현장] 컬러· 향기· 오브제의 향연··· 나만의 'Apartment' 스타일을...,https://www.handmk.com/news/articleView.html?idxno=38209,"《A Part of [Life]》展 /래미안갤러리 삼성물산 건설부문(이하 삼성물산)이 브랜드 체험 공간인 래미안갤러리에서 올해 첫 전시 《A Part of [Life]》를 진행한다. 이번 전시는 오는 7월까지 진행되며, '집'이라는 공간을 개인의... "
