date,source,title,link,description
2026-04-14,네이버뉴스,"한국수자원공사, 합천댐 2단계 수상태양광 본격화",http://www.newstnt.com/news/articleView.html?idxno=606732,"올해 하반기 착공해 연내 상업 발전을 시작할 예정이며, 연간 발전량은 약 1만 가구가 사용할 수 있는 2만 6... 탄소중립 실현과 녹색 수출 확대를 위해 물과 에너지를 연계한 인프라 구축을 지속하겠다""고 밝혔다."
2026-04-14,네이버뉴스, ‘성과로 말하는’ 최은석 대구시장 예비후보,https://www.ilyosisa.co.kr/news/article.html?no=255363,"전국 최고 수준의 온라인 강의를 공공 인프라로 연결해 사교육 부담은 줄이고, 지역 격차는 없애겠다. 이를... 선 착공 추진도 재정적으로든, 행정적으로든 너무 위험하다. 군 공항 이전은 정부 주도로 비용과 재원 조달... "
2026-04-14,네이버뉴스,청주 오창에 계곡형 워터파크 '아마존 아쿠아파크' 조성,https://www.nocutnews.co.kr/news/6502276?utm_source=naver&utm_medium=article&utm_campaign=20260414052705,"충북 청주시에 대규모 체류형 관광 인프라가 확충된다. 청주시는 14일 ㈜조이와 1500억 원 규모의 투자유치... 내년 착공해 2029년 상반기 개장할 예정이다. 시는 이번 사업으로 약 2천억 원의 생산유발효과, 796억 원의... "
2026-04-14,네이버뉴스,"국민성장펀드 150조, 새만금도 찍었다…현대차 9조·국가금융 총동원",http://www.jeollailbo.com/news/articleView.html?idxno=797531,AI 데이터센터와 태양광 발전시설은 2027년 착공해 2029년 완공이 목표다. 이번 2차 프로젝트 6개 분야 중 새만금을 제외한 3개 분야도 전북과 직결된다. 재생에너지 인프라 부문의 핵심인 태양광·수전해 발전은... 
2026-04-14,네이버뉴스,"한국수자원공사, 합천댐 2단계 수상태양광 사업 추진 위한 주주 간 협약...",https://www.upkoreanews.kr/news/articleView.html?idxno=98020,"총사업비 366억 원이 투입되는 이번 사업은 올해 하반기 착공해 연내 상업 발전을 목표로 추진된다. 연간... 공기업으로서 물, 에너지, 인프라를 연계해 국가 탄소중립 실현과 녹색 수출 확대에 기여하겠다""라고 말했다."
2026-04-14,네이버뉴스,"인천시, 2조5000억 투입 서북부, 강화·옹진 도로망 대대적 확충",https://www.siminilbo.co.kr/news/newsview.php?ncode=1160278047569589,"도로 인프라 확충 사업을 본격 추진한다고 밝혔다. 이번 사업은 급증하는 교통 수요에 대응하고, 인천 권역... 강화 지역은 최근 착공한 계양~강화 고속도로와 연계해 광역시도60호선(신정~냉정) 사업이 타당성 조사에... "
2026-04-14,네이버뉴스,충남 신설 학교 3곳 중 1곳이 아산,http://www.cctimes.kr/news/articleView.html?idxno=901902,"오 시장은 아산의 성장세를 보여주는 대표적 지표로 교육 인프라 확충을 제시했다. 그는 ""지난주 천우물초와... 설계와 착공 단계에 들어서 차세대 기술 양산이 아산을 중심으로 이뤄질 것""이라고 했다. 이어 ""AI 데이터센터... "
2026-04-14,네이버뉴스,"한국수자원공사, 합천댐 수상태양광 2단계 사업 본격화",https://www.joongdo.co.kr/web/view.php?key=20260414010004265,"사업은 총 366억 원을 투입해 올해 하반기 착공, 연내 상업운전을 목표로 추진된다. 발전소가 가동되면... 에너지, 인프라를 연계한 사업을 통해 탄소중립과 녹색성장에 기여하겠다""고 말했다. 한편 한국수자원공사는... "
2026-04-14,네이버뉴스,"청주시, 1500억원 관광시설 민간자본 유치 협약",https://www.ccreview.co.kr/news/articleView.html?idxno=346437,"사업은 2029년 상반기 개장을 목표로 추진되며 회사는 내년 착공을 목표로 사전평가와 실시설계 등 관련... 관광 인프라를 확충해 시민과 관광객 모두가 만족할 수 있는 꿀잼 관광도시 청주를 만들어 가겠다""고 말했다.... "
2026-04-14,네이버뉴스,재외동포타운 프리미엄 주거 ‘홈잉루츠’ 선포… 인천 송도서 첫선,https://www.kyeonggi.com/article/20260414580388,"글로벌 인프라와 함께 국내 대표 프리미엄 주거 브랜드로 만들 계획이다. 정근영 인천글로벌시티... 총 14개동, 1천700가구 규모다. 현재 우선협상자인 호반건설과 시공계약을 협상하고 있으며 오는 6월 착공이 목표다."
2026-04-14,네이버뉴스,청주 오창에 워터파크 들어선다,https://www.kmib.co.kr/article/view.asp?arcid=0029678526&code=61121111&cp=nv,"이르면 2027년 착공, 2029년 상반기 개장을 목표로 사전 평가와 실시설계, 주민설명회를 진행한다. 이범석... 청주국제공항 등 우수한 접근성을 바탕으로 경쟁력 있는 관광 인프라를 확충하겠다”고 말했다."
2026-04-14,네이버뉴스,"정하용 경기도의원, 지곡동 버스 승강장 5개소 설치 완료",https://www.jeonmae.co.kr/news/articleView.html?idxno=1248208,"이번 사업은 2026년 1월 특별조정교부금 배정 이후 실시설계용역과 공사 발주를 거쳐, 3월 설치공사 착공 및... 7억 5,000만 원을 확보하며 지역 생활 인프라 개선을 지속적으로 추진하고 있다. [전국매일신문] 한영민기자"
2026-04-14,네이버뉴스,"한국수자원공사, 합천댐에 21MW 수상태양광 사업 추진",http://www.energydaily.co.kr/news/articleView.html?idxno=166287,물-에너지 연계 인프라를 기반으로 한 에너지 전환 사업이 실증 단계에서 상업화로 확대되는 흐름이다.... 공사는 올해 하반기 착공해 연내 상업운전을 목표로 하고 있다. 이번 발전소는 연간 2만6618MWh의 전력을 생산할... 
2026-04-14,네이버뉴스,"나동연 예비후보 ""양산 미래 100년 완성할 것”",https://www.pressian.com/pages/articles/2026041416182770594?utm_source=naver&utm_medium=search,특히 교통·문화·예술·관광·체육 인프라 확대·도시개발·산업기반 확충·일자리·교육·복지 등 전 세대를 아우르는 삶의 질 향상 정책도 펼쳐다고 밝혔다. 또 △부울경 광역철도 조기 착공 △부울경 행정통합청사 양산... 
2026-04-14,네이버뉴스,"육동한 예비후보 “약속을 결과로 증명, 재선 시장으로 춘천의 안정적 ...",https://www.sportsseoul.com/news/read/1602519?ref=naver,"이미 착공했거나, 예산을 확보했고, 기업 투자 약정까지 마친 사업들”이라며, “단순히 건물을 짓고 도로를 놓는 하드웨어 사업에 그치지 않고, 이 인프라 위에 사람이 모이고, 기술이 자라고, 산업이 뿌리를 내리는... "
2026-04-14,네이버뉴스,"한국수자원공사, 합천댐에 '친환경 에너지 플랫폼' 구축… 수상 태양광...",https://www.mediafine.co.kr/news/articleView.html?idxno=77359,"총사업비 366억원이 투입되는 이번 사업은 올해 하반기 착공 후 연내 상업운전을 목표로 한다. 연간 약... 한국수자원공사는 이번 사업을 계기로 물·에너지·인프라를 결합한 통합형 에너지 전략을 확대하고, 탄소중립... "
2026-04-14,네이버뉴스,"하나금융, 9월부터 청라시대 …인천 금융허브에 '천군만마'",https://www.mk.co.kr/article/12016535,"금융 인프라스트럭처를 다핵화하고, '한국판 산탄데르 시티'로서의 시너지 효과에 관심이 쏠리고 있다.... 2022년 2월 착공한 그룹HQ 건물은 연면적 12만8000㎡ 규모로 하나금융지주 등 10개 관계사 임직원이 9월부터... "
2026-04-14,네이버뉴스,"기본소득·출산장려금 통했다…연천, 합계출산율 경기 2위 우뚝",https://www.mk.co.kr/article/12016539,"여기에 수도권 전철 1호선 연장 등 교통 인프라 확충과 정주 여건 개선이 뒷받침됐다. 이에 따라 2024년 혼인... 우선 올해 착공을 앞둔 에듀헬스케어센터는 교육과 돌봄, 문화·복지·체육 기능을 집약한 복합 공간으로... "
2026-04-14,네이버뉴스,'알파탄약고' 이전 완료…평택 고덕국제화지구 개발 숨통 트였다,https://www.mk.co.kr/article/12016531,15년 지연 핵심 장애물 해소 학교 등 기반시설 본격 착공 탄약고 터 문화공간 재탄생 평택... 장기간 사업의 발목을 잡아온 핵심 장애물이 해소되면서 지구 내 미개발 구역 인프라 구축과 정주 여건 개선도 속도를 낼... 
2026-04-14,네이버뉴스,"""고요함이 팔렸다, 만장일치로…"" AI 붐이 바꾸는 미국 사막의 풍경",https://www.fortunekorea.co.kr/news/articleView.html?idxno=52184,""" 캐시 플레처, 토노파 주민 AI 인프라 투자가 미국 경제 성장에서 차지하는 비중이 점점 커지는 시대에, 민주당과 공화당은 모두 프로젝트를 빠르게 착공할 수 있다는 점을 보여주기 위해 경쟁하고 있다. 이는... "
2026-04-15,네이버뉴스,"건설자재난 현실화…""5월부터 수급 차질 가능성""",https://news.einfomax.co.kr/news/articleView.html?idxno=4409566,"업계 관계자는 ""4월 말까지는 재고가 있는데 중동 사태가 지속되면 5월부터 수급에 문제가 있지 않을까 하는 인식이 있다""면서 공사비 인상, 공사 지연 지체상금 면제 등의 조치가 필요하다고 말했다. 한국건설산업연구... "
2026-04-15,네이버뉴스,[단독] 45년 만에 신청사로 이전했지만…서울시교육청 '공사비 미지급'...,http://www.mbn.co.kr/pages/news/newsView.php?news_seq_no=5188181,"서울시교육청 건설에 참여한 한 업체도 전체 공사비 800억 원 가운데 156억 원을 받지 못했습니다. 하도급 업체 30여 곳도 인건비와 자재비를 줄줄이 받지 못하고 있습니다. ▶ 인터뷰 : 신현민 / 원도급사 관계자 - ""110억... "
2026-04-15,네이버뉴스,[부산 브리핑 모음(4월15일)] 부산 봄꽃의 향연 ‘제6회 부산 봄꽃 전시...,https://www.dnews.co.kr/uhtml/view.jsp?idxno=202604141722516330251,"특히 설계부터 시공, 유지관리 단계까지 BIM 기반의 사업관리 체계를 구축해 공사비 절감, 설계오류 사전 검토, 공정관리 효율화 등 스마트건설 기반을 한층 강화할 방침이다. 신창호 부산도시공사 사장은 “스마트건설... "
2026-04-15,네이버뉴스,"GTX 운영, 민간에 맡겼더니…다단계 하청구조에 1km당 관리인력 단 5명",https://www.pressian.com/pages/articles/2026041409475161786?utm_source=naver&utm_medium=search,"사업자들이 공사비 인상분을 정부가 보전해달라고 해 공사 진행에 차질을 빚기도 했다. 재정부담 완화도, 공사기간 단축도 모두 되지 않는다면, 구태여 공공성을 훼손하면서까지 민간 투자 사업으로 철도를 건설하고... "
2026-04-15,네이버뉴스,“하루 12곳 문 닫았다…건설업계 ‘줄폐업’ 경고음,https://www.dailian.co.kr/news/view/1633337/?sc=Naver,한국건설기술연구원에 따르면 건설공사비지수는 지난 2월 133.69로 역대 최고치를 기록했다. 해당 지수에는 중동 전쟁에 따른 원자재 가격 상승분이 충분히 반영되지 않았다는 점을 고려하면 3월부터는 상승폭이 더욱... 
2026-04-15,네이버뉴스,"건협 전북도회-한국농어촌공사 전북본부, 간담회 개최",https://www.dnews.co.kr/uhtml/view.jsp?idxno=202604141720054570249,"전북도회는 간담회에서 건설환경 변화에 따른 적정 공기ㆍ공사비 확보를 건의했다. 또 스마트팜 조성공사 발주방식 개선 및 종합건설업체 참여기회 확대, 건설공사 발주 시 현장여건을 충분히 반영한 설계도서 작성 등을... "
2026-04-15,네이버뉴스,"일상으로 번진 나프타 대란, 주사기까지 수급불안…‘매점매석’ 시작...",https://www.dnews.co.kr/uhtml/view.jsp?idxno=202604141401244280186,"포장필름ㆍ단열재 원료 공급 차질로 건설ㆍ제조 현장의 원가 부담이 커지면서 공사비 추가 상승 압박은 심화하고 있다. 대기업은 재고 여력으로 단기 충격을 흡수하고 있지만, 중소기업들은 ‘원가 급등-주문 취소... "
2026-04-15,네이버뉴스,[단독]호르무즈발 건설 리스크 차단…PF 보증 2.5조→4조 확대,https://view.asiae.co.kr/article/2026041416491990787,건축공사비 플러스 PF 보증은 사업성이 충분하지만 일시적으로 유동성 부족을 겪고 있는 건설 사업장에 자금 공급을 지원하기 위해 마련된 제도다. 총사업비 대비 보증 한도를 최대 90%까지 늘려 자금 공급을 지원하고... 
2026-04-15,네이버뉴스,SP벽체파일 신기술로 CIP 공법 한계 극복,https://www.donga.com/news/Economy/article/all/20260414/133730589/2,아이비이앤씨㈜가 ‘2026 대한민국 산업대상’ 건설 신기술 부문 대상을 수상했다. 이 기업의 수상... 또 기존 CIP 대비 9개 공종을 3개로 축소해 공사 기간을 30% 이상 단축할 수 있고 공사비를 20% 이상 줄일 수 있다.... 
2026-04-14,네이버뉴스,건축허가 마친 동탄2신도시 대규모 부지 시장에 나와,https://www.joongboo.com/news/articleView.html?idxno=363722859,"사진= 준빌딩부동산중개법인주식회사 고금리와 공사비 상승 등으로 부동산 개발 시장이 위축된 가운데... 대형 건설사나 자산운용사, 사옥 마련을 검토 중인 중견기업들의 확보 경쟁이 예상된다""고 부연했다. 강소하... "
2026-04-14,네이버뉴스,"건설협회 전북자치도회·농어촌공사 전북본부, 지역건설산업 활성화 간...",http://www.domin.co.kr/news/articleView.html?idxno=1552239,이번 간담회에서 협회는 △건설환경 변화에 따른 적정 공기 및 공사비 확보로 건설품질 제고 △스마트팜 조성공사 발주방식 개선 및 종합건설업체 참여기회 확대 △건설공사 발주시 현장여건을 충분히 반영한 설계도서... 
2026-04-14,네이버뉴스,"중동 전쟁 불똥, 충북 도로 현장까지 덮쳤다",https://www.ccdn.co.kr/news/articleView.html?idxno=1073517,관급 도로공사뿐 아니라 민간 건설현장까지 공정 지연과 공사비 상승 압박이 커지는 양상이다. 정부도 최근 중동 변수로 아스콘을 포함한 건설자재 전반에 영향이 나타나고 있다고 보고 긴급 점검과 비상 대응에 나섰다.... 
2026-04-14,네이버뉴스,도내 민간건설현장 책임준공 연장,http://www.jjn.co.kr/news/articleView.html?idxno=1038158,"최근 3년간 건설공사비는 25~26% 수준으로 상승해 주택공급ㆍ재개발 사업의 비용 부담과 갈등을 키우고 있다. 이에 따라 정부는 올해까지 공사비 상승률을 연 2% 내외로 관리하겠다는 목표를 세우고 자재, 인건비, 공공조달을... "
2026-04-14,네이버뉴스,"건설협도회-농어촌公, 지역건설경기 활성화 머리맞대",http://www.jjn.co.kr/news/articleView.html?idxno=1038160,이번 간담회에서 협회는 △건설환경 변화에 따른 적정 공기 및 공사비 확보로 건설품질 제고 △스마트팜 조성공사 발주방식 개선 및 종합건설업체 참여기회 확대 △건설공사 발주시 현장여건을 충분히 반영한 설계도서... 
2026-04-14,네이버뉴스,"광주시 ""중동전쟁 여파 지역건설업 위기 극복 온힘""",https://www.jnilbo.com/news/articleView.html?idxno=90000030516,건설업계는 △원자재 가격 급등에 따른 수급 대책 △물가상승에 따른 공사비 현실화 △긴급 금융 지원 및 각종 보증료 지원 등을 건의했다. 광주시는 그동안 주택 미분양 해소를 위해 취득세 특례대상 확대를 비롯한... 
2026-04-14,네이버뉴스,"한미글로벌, 6천억 美국립공원 프로젝트 수주",http://www.fnnews.com/news/202604141821057510,"평가, 공사비 산정 등 엔지니어링 서비스 전 영역이다. 한미글로벌은 트럼프 2기 행정부 출범 이후 국내 대기업의 반도체, 배터리, 조선, 해저케이블 공장 등의 건설 프로젝트 PM 용역 수주를 이어가고 있다.... "
2026-04-14,네이버뉴스,원자재 쇼크 현실화… 출하량 40년 만에 최악 수준 [중동전쟁 여파 레미...,https://www.busan.com/view/busan/view.php?code=2026041418160343900,실제로 부산의 한 정비구역에서는 건설사가 공사 비용 상승 가능성을 조합에 통보하는 등 공사비 상승이 현실화하고 있다. 부산경남레미콘산업발전협의회 전병재 전무는 “과거 러시아-우크라이나 전쟁이 발발한 후... 
2026-04-14,네이버뉴스,"부산도시공사, BIM 도입 확대…건설 전 과정 디지털 전환",http://www.newstown.co.kr/news/articleView.html?idxno=700449,이를 활용하면 설계 오류를 사전에 검토할 수 있고 공정 진행 상황을 정밀하게 관리할 수 있어 공사비 절감 효과도 기대된다. 특히 기존 2차원 설계 방식 대비 정보 활용도가 높아 건설 품질과 생산성을 동시에 개선하는... 
2026-04-14,네이버뉴스,"광주시·국토부, 중동전쟁발 건설위기 공동 대응…지역업계 지원 본격화",https://www.viva100.com/article/20260414501272,"간담회에서는 중동발 원자재 가격 급등에 따른 자재 수급 안정 대책, 물가 상승을 반영한 공사비 현실화, 긴급 금융 및 보증료 지원, 지역 건설업체 참여 확대 방안 등이 집중 논의됐다. 건설업계는 특히 유동성 확보를 위한... "
2026-04-14,네이버뉴스,아파트보다 심각한 '빌라 가뭄'…외곽 내몰린 세입자,https://www.hankyung.com/article/2026041406681,여기에 공사비 상승과 금융 불안이 겹쳐 비아파트를 공급하려는 건설회사가 줄고 있어서다. ◇ 빌라 전·월세 가격도 상승 한국부동산원에 따르면 서울의 비아파트 평균 전셋값은 지난 2월 기준 2억3302만원을... 
2026-04-14,네이버뉴스,"경기도, '원자재 가격 급등' 지역 건설사 지원",https://www.obsnews.co.kr/news/articleView.html?idxno=1520987,경기도가 중동 상황 악화로 인한 원자재 가격 상승으로 어려움을 겪는 지역 건설사 지원에 나섭니다. 도는 도내 31개 시군과 도 소속 발주부서에 공사비 적정 반영을 요청했다고 밝혔습니다. 도는 신규 공사 원가 산정 시... 
2026-04-14,네이버뉴스,"한미글로벌 美 자회사 오택, 국립공원 정비보수 입찰권 확보",https://www.sedaily.com/article/20032437?ref=naver,"평가, 공사비 산정까지 전 영역을 주도하게 된다. 한미글로벌은 최근 미국 내 반도체·배터리·조선·해저케이블 공장 등 국내 기업의 현지 투자 프로젝트에서도 건설사업관리(PM) 용역을 잇따라 수주하며 입지를 넓히고... "
2026-04-14,네이버뉴스,건설비 폭등에 광주 공실 쌓이는데…간담회로 대응 되나,https://www.polinews.co.kr/news/articleView.html?idxno=728448,"광주시는 14일 시청에서 국토교통부, 전남도, 전북도와 함께 건설업계 대응 간담회를 열었다. 자재 수급 문제와 공사비 상승, 경영 위기 등이 주요 안건으로 다뤄졌다. 그러나 회의는 업계 의견을 정리하는 데 그쳤다. 공사비... "
2026-04-14,네이버뉴스,"광주·국토부, 건설업 위기 대응 공조… 중동전쟁 여파 최소화 총력",https://www.factin.co.kr/news/articleView.html?idxno=6134,이날 간담회에서는 중동전쟁에 따른 자재 수급 불안과 공사비 상승 등 업계 부담 완화 방안이 집중 논의됐다. 건설업계는 ▲원자재 가격 급등 대응 ▲물가 상승 반영 공사비 현실화 ▲긴급 금융 및 보증료 지원 등을 정부에... 
2026-04-14,네이버뉴스,"""공실 상가, LH가 사준다니""…사업 설명회에 1700여명 몰려",https://www.newspim.com/news/view/20260414001202,"특히 매입 단가가 최근 급등한 공사비와 금융비용을 충분히 반영하지 못할 경우 민간 사업자의 참여가 제한될 수밖에 없는 상황이다. 현재 건설업계는 자재비 상승과 인건비 부담이 누적된 상황인 만큼, LH의 매입... "
2026-04-14,네이버뉴스,"한미글로벌 자회사 오택, 美국립공원 프로젝트 수주",https://www.munhwa.com/article/11582236?ref=naver,"평가, 공사비 산정 등이다. 한미글로벌은 2011년 오택을 인수한 이후 지속해 현지화 전략을 추진했으며, 트럼프 2기 행정부 출범 이후 국내 대기업의 미국 내 반도체·배터리·조선·해저케이블 공장 건설 프로젝트의 PM... "
2026-04-14,네이버뉴스,"부산도시공사, BIM 발주 협의회 가입…디지털 전환·스마트건설 기술 도...",https://www.kukinews.com/article/view/kuk202604140204,"설계부터 시공, 유지관리 단계까지 BIM 기반의 사업관리 체계를 구축해 공사비 절감, 설계오류 사전 검토, 공정관리 효율화 등 스마트건설 기반을 한층 강화한다는 방침이다. 신창호 공사 사장은 ""스마트건설 기술... "
2026-04-14,네이버뉴스,“우리 건물도 사주나요”⋯PF 막히자 LH 오픈마켓에 주택 사업자 몰렸...,https://www.etoday.co.kr/news/view/2575675,"이투데이=조유정 기자 | LH, 연내 3만8224가구 매입 추진 수도권 81% 집중·매입약정 중심 확대 건설ㆍ시행사... 주택사업자 B씨는 “공사비가 크게 올랐지만 매입 가격에는 제대로 반영되지 않는다”며 “감정평가... "
2026-04-14,네이버뉴스,"광주광역시-국토부, 중동전쟁 여파 지역건설업 위기극복 온힘",https://www.siminilbo.co.kr/news/newsview.php?ncode=1160288647667759,"건설업계는 ‘원자재 가격 급등에 따른 수급 대책’, ‘물가상승에 따른 공사비 현실화’, ‘긴급 금융 지원 및 각종 보증료 지원’ 등을 건의했다. 광주시는 그동안 주택 미분양 해소를 위해 취득세 특례대상 확대를... "
2026-04-14,네이버뉴스,"부산도시공사, ‘BIM 발주협의회’ 가입",https://www.geconomy.co.kr/news/article.html?no=319242,"특히 설계부터 시공, 유지관리 단계까지 BIM 기반의 사업관리 체계를 구축해 공사비 절감, 설계오류 사전 검토, 공정관리 효율화 등 스마트건설 기반을 한층 강화할 방침이다. 신창호 부산도시공사 사장은 “스마트건설... "
2026-04-14,네이버뉴스,"광주시·국토부, 건설업 위기 대응 공조…중동발 리스크 공동 대응",https://www.shinailbo.co.kr/news/articleView.html?idxno=5011252,"간담회에서는 정부 측의 건설업 지원 방안 설명과 함께 업계 건의사항 청취가 이뤄졌다. 특히 원자재 가격 상승에 따른 수급 불안, 공사비 현실화 필요성, 긴급 금융 지원과 보증료 부담 완화 등 주요 현안이 집중 논의됐다.... "
2026-04-14,네이버뉴스,"""원자재 상승 직격탄""…전북 건설협회-전북 농어촌공사, 건설경기 활성...",https://www.pressian.com/pages/articles/2026041415563666116?utm_source=naver&utm_medium=search,"대한건설협회 전북특별자치도회와 한국농어촌공사 전북지역본부는 13일 간담회를 열고 공사물량 감소와 원자재 가격 상승으로 어려움을 겪는 지역 건설업계 현안을 논의했다. 협회는 적정 공기·공사비 확보, 스마트팜... "
2026-04-14,네이버뉴스,"전북 건설업계 ""공공 발주 늘려 경영난 해소해야""…농어촌공사에 건의",http://www.jeonmin.co.kr/news/articleView.html?idxno=437869,이 자리에서 전북 건설협회는 △건설환경 변화에 따른 적정 공기 및 공사비 확보를 통한 건설품질 제고 △스마트팜 조성공사의 발주방식 개선 및 종합건설업체 참여기회 확대 △건설공사 발주 시 현장여건을 충분히 반영한... 
2026-04-14,네이버뉴스,"대건협 전북도회-농어촌공 전북본부, 지역 건설경기 회복 '머리 맞대'",http://www.jeollailbo.com/news/articleView.html?idxno=797518,이날 협회는 △건설환경 변화에 따른 적정 공기 및 공사비 확보로 건설품질 제고 △스마트팜 조성공사 발주방식 개선 및 종합건설업체 참여기회 확대 △건설공사 발주시 현장여건을 충분히 반영한 설계도서 작성 등을... 
2026-04-14,네이버뉴스,"광주시-국토부, 중동전쟁 여파 지역건설업 위기극복 맞손",https://news.bbsi.co.kr/news/articleView.html?idxno=4078304,건설업계는 ▲원자재 가격 급등에 따른 수급 대책 ▲물가상승에 따른 공사비 현실화 ▲긴급 금융 지원 및 각종 보증료 지원 ▲지역 건설업체 참여 확대를 위한 제도 개선 등을 정부에 건의했습니다. 광주시도 지방 건설시장... 
2026-04-14,네이버뉴스,"부산도시공사, BIM 도입 본격화… 스마트건설 전환",https://www.kmib.co.kr/article/view.asp?arcid=0029678350&code=61141111&cp=nv,"부산도시공사가 건설사업 전반에 빌딩 정보 모델링(BIM) 도입을 추진하며 스마트건설 전환에 나섰다.... 빌딩 정보 모델링(BIM)은 설계부터 시공, 유지관리까지 전 과정을 3차원 데이터로 통합 관리하는 기술로, 공사비... "
