date,source,title,link,description
2026-05-01,네이버뉴스,2월 기성·착공 소폭 증가···공사비 상승 압력은 커져,https://www.koscaj.com/news/articleView.html?idxno=323891,공사비: 이란전쟁으로 공사비 상승 우려 건설공사비지수는 이란전쟁에 따라 석유화학류를 중심으로 자재가격 변동성에 대한 우려가 커지고 있다. 관련 영향이 3월 이후 통계부터 본격적으로 반영될 예정으로 향후... 
2026-05-01,네이버뉴스,"""예고된 공사비 쇼크...아파트 몸값 달라집니다"" [우동집 인터뷰]",https://www.wowtv.co.kr/NewsCenter/News/Read?articleId=A202604300379&t=NNv,코로나 이후 건설업계는 공사비 상승과 폐업 증가 등의 어려움을 겪고 있다. 미국과 이란의 전쟁이 장기화되면서 고유가 후폭풍 우려까지 나오며 건설업계의 긴장감이 한층 높아지고 있다. 아스콘과 레미콘 혼화제 등... 
2026-05-01,네이버뉴스,아스콘값 2배·마감재 40%↑…지방 건설현장 '5월 셧다운' 공포,https://www.news1.kr/realestate/general/6154625,"2월 건설공사비지수는 133.69로 통계 작성 이후 최고치를 기록했으며, 지난해 8월 이후 상승세가 이어지고 있다. 업계에 따르면 아스콘 원료인 아스팔트 가격은 전년 동기 대비 20∼30%, 단열재는 최대 40%, 접착제는 30∼50... "
2026-05-01,네이버뉴스,"中, 서아프리카경제공동체 본부도 지어줘…아프리카 53국 무관세",https://www.yna.co.kr/view/AKR20260430083300898?input=1195m,중국 업체가 주도한 ECOWAS 본부 건설에는 총 5천650만달러(약 840억원)가 들었으며 공사비는 중국 정부 지원을 통해 마련됐다. 앞서 중국은 2012년 에티오피아 수도 아디스아바바에 2억달러를 들여 아프리카연합(AU) 본부... 
2026-04-30,네이버뉴스,"부산 남구, 남구체육센터 공사비 떼먹은 업체 사기·횡령 고소",http://www.kookje.co.kr/news2011/asp/newsbody.asp?code=0300&key=20260501.22006008955,그러나 건설기계 대여금 등 A 씨와 개별 거래를 한 업체 8곳은 하청 사실 증명이 어려워 대금 지급이 지연되고 있다. 해당 업체 8곳은 현재 남구를 상대로 지급명령 소송을 제기한 상태다. 앞서 남구는 A 씨 회사를... 
2026-04-30,네이버뉴스,"온라이프건설, '무차입 경영'으로 22개 현장 가동",http://www.srtimes.kr/news/articleView.html?idxno=202529,"인수 당시 300%에 육박했던 부채비율 60% 낮춰…공공 보증 사업 중심  고금리와 공사비 상승, 부동산 PF 부실로 건설업계가 '줄도산' 위기에 놓인 가운데 부산 중견 건설사 온라이프건설이 탄탄한 재무 구조와 보수적인... "
2026-04-30,네이버뉴스,"해외공사 하도급대금 미지급 행위, 중소기업들은 벙어리 냉가슴",http://www.engdaily.com/news/articleView.html?idxno=22209,국내 건설 기업들의 해외 사업 하도급 대금 미지급 행위에 대한 정부 차원의 단속이 필요하다는 주장이... 또한 이 과정에서도 지속적인 설계변경이 이뤄지면서 추가 공사비까지 총 900만 유로의 비용이 들어갔다고... 
2026-04-30,네이버뉴스,서울 주택 인허가 62% 급감…공급부족 더 심해진다,https://www.hankyung.com/article/2026043093991,1% 늘었다. 준공 후 미분양 물량이 2개월 연속 3만 가구를 넘은 것은 2012년 3월 이후 14년 만이다. 준공 후 미분양 물량은 공사비 회수 지연으로 이어져 건설사 유동성에 악영향을 끼친다.
2026-04-30,네이버뉴스,자재난에 지방선거 몸조심···공공공사 이중고,https://www.koscaj.com/news/articleView.html?idxno=323911,"이미 건설공사비지수가 역대 최고치를 기록한 상황에서 자재값 쇼크까지 겹치자 업계에서는 ""원가가 계약금을 추월하는 역마진 현장이 속출할 수 있다""는 우려가 높아지고 있다. ◇꼬리 무는 공정 병목 현재 현장에서... "
2026-04-30,네이버뉴스,"청년층 건설기피, 디지털 전환·숙련기술 전수 이중 타격",https://www.koscaj.com/news/articleView.html?idxno=323924,"적정 공사비 확보와 공정한 계약 구조 마련도 인력 투자의 선결 조건으로 꼽힌다. 전문건설업계는 ""사람이 사라지면 산업도 사라지고, 기술이 끊어지면 미래도 사라진다""며 AI 전환과 인력 양성을 동시에 추진하는... "
2026-04-30,네이버뉴스,"해외공사 하도급대금 미지급 논란…""해외법인 앞세운 책임회피 막아야...",http://www.kmecnews.co.kr/news/articleView.html?idxno=46904,"해외법인 간 계약이라는 형식을 앞세워 국내 하도급법 적용을 피하고, 중소 협력업체에는 공사비와 법적 대응... 먼저 홍성진 대한건설정책연구원 산업정책연구실장은 과거 해외건설 표준하도급계약서 연구를 수행하는... "
2026-04-30,네이버뉴스,"단국대, 탈현장건설 가속화할 '콘크리트 연결 기술' 이전",https://www.newsis.com/view/NISX20260430_0003613643,이번 기술 이전을 통해 건설업계의 고질적인 문제인 공사비 부담을 덜고 생산성을 크게 높일 수 있을 것으로 기대된다. 혁신적인 연결 기술 도입으로 기존 공법 대비 시공비를 약 20% 절감할 수 있다. 또 공장에서... 
2026-04-30,네이버뉴스,'오현고 총동창회관에 무슨 일이' 유치권 행사,https://www.jejusori.net/news/articleView.html?idxno=502337,3만명에 육박하는 오현고등학교 동문들이 새로운 총동창회관 건설에 나섰지만 하도급 업체들이 공사비를 제때 지급 받지 못해 속앓이를 하고 있다. 30일 건설업계에 따르면 제주시 아라동 제주대학교 사거리 인근에... 
2026-05-01,네이버뉴스,"""포용금융 늘리면 인센티브""…금융위, 상호금융 규제 손질",https://www.sentv.co.kr/article/view/sentv202604300110,포용금융 확대에 따른 리스크 관리 장치도 함께 마련한다. 금융당국은 포용금융을 늘린 조합의 건전성이나... 그러나 최근에는 수익성 중심 영업이 강화되면서 부동산·건설업 대출과 비조합원 대출 비중이 크게... 
2026-05-01,네이버뉴스,[핀포인트] [신세계건설] ‘분양률 90%의 역설’… 갈매 휴벨나인서 761...,https://news.dealsitetv.com/articles/169457,"특히 책임준공 구조에서는 분양 실패와 금융 리스크가 시공사로 직결된다는 점에서, 향후 건설사들의 PF 사업 참여 기준이 한층 보수적으로 재편될 가능성이 크다는 분석이다."
2026-05-01,네이버뉴스,"한국·금호·넥센타이어, 'OE·고인치'로 선방…2Q는 변수 커",https://daily.hankooki.com/news/articleView.html?idxno=1363152,사진=금호타이어 제공  한국·금호·넥센타이어가 글로벌 수요 둔화와 지정학적 리스크 속에서도 올해... 이에 금호타이어는 함평 및 유럽공장 건설을 통해 한국-유럽-북미를 잇는 글로벌 생산 체계를 본격적으로... 
2026-05-01,네이버뉴스,K-FINCO '2026년 공제 실무자 교육' 성료,https://www.koscaj.com/news/articleView.html?idxno=323907,"K-FINCO 전문건설공제조합(이하 K-FINCO)이 지난달 24일 서울 동작구 전문건설회관에서 전국 28개 지점 공제... 중대재해처벌법 관련 주요 리스크와 상품의 특장점을 상세히 다룸으로써, 지점 담당자들이 조합원사의 안전... "
2026-05-01,네이버뉴스,"[글로벌 K-브랜드③] CJ제일제당 ‘비비고’, 만두만 연 매출 1조…세계...",https://www.mydaily.co.kr/page/view/2026043017420549619,"2024년 말 헝가리 부다페스트 인근에 유럽 신공장 부지를 확정하고 건설에 착수했으며, 일본 치바현에서는... ◇ 1분기 호실적, 담합 이슈·수익성 회복 과제 회사가 직면한 경영환경 리스크도 넘어야할 산이다.... "
2026-05-01,네이버뉴스,"[아주ABC 대한민국 리더에게 듣는다-신봉길 전 주인도대사] ""인도는 생산...",https://www.ajunews.com/view/20260430124345638,"중국은 여러 지정학적 리스크가 커졌고, 베트남은 중요한 생산기지이지만 규모의 한계가 있다. 인도는... 타밀나두주에는 제2의 울산 조선소를 건설하겠다는 비전도 있다. 한국형 조선업을 인도에 이식하겠다는 것이다.... "
2026-05-01,네이버뉴스,"“중동 전쟁 국제 질서 재편 트리거…韓, 리스크 장기화 대비해야”",https://www.sedaily.com/article/20039150?ref=naver,“중동 리스크의 장기화에 대비한 에너지·식량·산업·물류·안보 등 입체적인 전략이 요구된다”고... 기업들이 설계·건설·운영·유지·인력 양성·기술 이전을 함께 묶어주는 장기 파트너가 돼야 한다”고 힘주어 말했다.
2026-05-01,네이버뉴스,[뉴욕증시] 기업 호실적 '사상 최고'···캐터필러 10%↑·알파벳 10%↑,https://www.seoulfn.com/news/articleView.html?idxno=627850,미국 제조업의 상징인 건설장비 회사 캐터필러는 인공지능(AI) 데이터센터 건설 붐에 힘입어 예상을... 중동의 지정학적 리스크도 증시에 부담이 되지 않았다. 중동의 군사적 긴장이 소강국면에 접어든 가운데... 
2026-05-01,네이버뉴스,[단독] 장인화 회장의 최대 업적 ‘포스코 리튬 패권’...아르헨티나서...,https://sateconomy.co.kr/news/view/1065556621054791,표면적으로는 규제 완화로 보이지만 이는 환경 리스크 해소가 아니라 규제 방식의 전환에 가깝다. 법원은... 포소스)의 건설허가 취소 소송 사건’은 여전히 진행 중이다. 이 사건은 특정 기업을 겨냥한 소송이 아니라... 
2026-05-01,네이버뉴스,상장 리츠 첫 기업회생 ‘쇼크’…유동성 리스크 확산은 “제한적” [한...,https://www.segye.com/newsView/20260430519495?OutUrl=naver,우량 부동산을 보유하고도 현금 흐름이 동결되는 리스크가 현실화하면서 해외 투자의 취약성이 수면 위로... 다만 건설업체의 시공 실적을 보여주는 건설기성(불변)은 전월 대비 7.3% 감소했다. 중동사태의 영향은... 
2026-05-01,네이버뉴스,"""온난화·노동력 절벽에 위기의 농업…대동 AI 필드 로봇으로 돌파""",https://www.news1.kr/industry/sb-founded/6152838,"식량안보 역시 핵심 리스크로 지목했다. 그는 ""러시아-우크라이나 전쟁 등의 지정학적 리스크로 글로벌... 농업과 제조·건설 등 실외 환경에서 자율주행 기능을 갖춘 '필드 로봇'을 핵심 사업으로 삼고 있다. 운반... "
2026-05-01,네이버뉴스,"“비슷한 사례 다른 결론”…산업계, 엇갈린 사용자성 판단에 ‘혼돈’...",https://biz.heraldcorp.com/article/10729619?ref=naver,전남·경남 판정 엇갈려…유사 사안도 결론 달라 건설업도 지역별 판단 차…원청 책임 범위 불명확 판정문... 기업의 리스크 차이로 이어질 수밖에 없다. 특히 위탁 급식업체 사례처럼 원청에 교섭 의무를 부과하는 해석이... 
2026-05-01,네이버뉴스,"[6·3 지방선거-인터뷰] 유정복 “李정부, 균형 발전한다면서 인천 경쟁...",https://biz.chosun.com/policy/politics/election/2026/05/01/4EXPI6HAPVD6TC6X2WC7NQ7TYA/?utm_source=naver&utm_medium=original&utm_campaign=biz,"유정복 인천시장 국민의힘 후보 인터뷰 “李 눈치 보는 민주당 정치인, 인천 발전 최대 리스크” “국민... 그는 “인천국제공항공사와 한국공항공사, 가덕도신공항건설공단을 통합하겠다는 논의는 문제의 소지가 크다”... "
2026-05-01,네이버뉴스,미중 외교·무역대표 연쇄통화…정상회담 전 의제 조율,http://mbn.mk.co.kr/pages/news/newsView.php?category=mbn00008&news_seq_no=5191351,"전략성·건설성·안정성을 갖춘 중미 관계 구축을 모색하고, 상호 존중·평화 공존·협력 윈윈을 실현해야 한다""고 했습니다. 왕 부장은 ""대만 문제는 중국의 핵심 이익이자 중미 관계의 최대 리스크""라며 ""미국은 응당... "
2026-05-01,네이버뉴스,"트럼프·시진핑, 2주 후에 만난다… 미·중, 정상회담 앞두고 의제 조율",https://www.dt.co.kr/article/12060408?ref=naver,왕 부장은 “대만 문제는 중국의 핵심 이익이자 중미 관계의 최대 리스크”라고 규정하며 미국 측의 올바른... 솔직하고 건설적인 교류를 했다”고 전했다. 하지만 중국 측은 최근 미국의 반도체 장비 수출 통제와 이란산... 
2026-05-01,네이버뉴스,美中 외교·무역대표 연쇄통화…정상회담 전 의제 조율(종합2보),https://www.yna.co.kr/view/AKR20260430219152083?input=1195m,"전략성·건설성·안정성을 갖춘 중미 관계 구축을 모색하고, 상호 존중·평화 공존·협력 윈윈을 실현해야 한다""고 했다. 왕 부장은 ""대만 문제는 중국의 핵심 이익이자 중미 관계의 최대 리스크""라며 ""미국은 응당 약속을... "
2026-05-01,네이버뉴스,"美中, 외교·통상 고위급 접점 모색…'5월 정상회담' 탄력받나",https://www.yna.co.kr/view/AKR20260501002100071?input=1195m,"왕 부장은 ""대만 문제는 중국의 핵심 이익이자 중미 관계의 최대 리스크""라며 대만 문제에 대한 미국 측의... 있으며 건설적인 교류를 진행했다""고 CCTV가 전했다. 왕 부장은 ""협력의 면을 넓히고 이견이 있는 점을 관리하면서... "
2026-05-01,네이버뉴스,"미중 외교·무역 대표 연쇄 전화소통…""정상회담 전 의제 조율""",http://www.yonhapnewstv.co.kr/news/AKR20260501005951e3p,"전략성·건설성·안정성을 갖춘 중미 관계 구축을 모색하고, 상호 존중·평화 공존·협력 윈윈을 실현해야 한다""고 했습니다. 왕 부장은 ""대만 문제는 중국의 핵심 이익이자 중미 관계의 최대 리스크""라며 ""미국은 응당... "
2026-05-01,네이버뉴스,미중 외교·무역 대표 잇단 통화…정상회담 전 의제 조율,https://biz.chosun.com/international/international_general/2026/05/01/7BRTYIFTUFFRZI2WM5FICXL6RM/?utm_source=naver&utm_medium=original&utm_campaign=biz,건설성·안정성을 갖춘 중미 관계 구축 방법을 찾아야 한다고 덧붙였다. 상호 존중·평화 공존·협력 윈윈을 실현해야 한다고도 밝혔다. 그러면서 왕 부장은 “대만 문제는 중국의 핵심 이익이자 중미 관계의 최대 리스크”... 
2026-05-01,네이버뉴스,반도체로 53조 번 삼성전자… ‘휴머노이드’로 미래 준비,https://www.chosun.com/economy/tech_it/2026/05/01/LC5JQZSZKJF2NLZHOA3H3W7R6Q/?utm_source=naver&utm_medium=referral&utm_campaign=naver-news,완제품 사업은 ‘우려’ 메모리 가격 상승은 삼성전자 DX 부문엔 실적 리스크로 작용한다. 삼성전자는... R&D와 함께 평택·용인 신규 공장 건설 및 미국 테일러 반도체 공장 시설 투자(CAPEX)까지 올해 110조원을... 
2026-05-01,네이버뉴스,"HMM 노사, 부산 이전 극적 합의… 물류 대란 고비 넘겼다",https://www.kmib.co.kr/article/view.asp?arcid=1777536996&code=11151400&cp=nv,중동 전쟁 리스크가 계속되는 가운데 HMM 총파업까지 현실이 될 경우 국내외 물류 마비와 사회적 혼란이... 정부는 ‘K해양 강국 건설’을 제시하면서 해양수산부 이전과 HMM의 부산시 이전 추진을 앞세웠다. 이를 토대로... 
2026-05-01,네이버뉴스,"구윤철 ""금융·외환 변동성에도 위기 대응력 충분""",https://www.ytn.co.kr/_ln/0102_202605010005422451,등 리스크 요인이 있다고 진단했습니다. 또 정부와 관계기관은 비상대응체계를 빈틈없이 유지하고 거시경제와 금융·외환시장 안정에 만전을 기하겠다고 강조했습니다. 이어 정유·석유화학·건설업 등 이란전쟁에... 
2026-04-30,네이버뉴스,"[금융 이모저모] KB국민은행, KB금융, 하나은행, BNK부산은행, BNK경남은...",http://www.worktoday.co.kr/news/articleView.html?idxno=84241,"가공경비 리스크도 점검한다. 신고 책임은 고객이 선택한 세무사에게 명확히 귀속된다. 또 KB스타기업뱅킹... ( 왼쪽부터) 김도완 HD건설기계 협력사 협의회 회장, 문재영 HD건설기계 대표이사, 이호성 하나은행장... "
2026-04-30,네이버뉴스,"[금융 게시판] 은행권, 'K-생산적 금융' 전방위 확대… 세무·스타트업·...",https://www.lcnews.co.kr/news/articleView.html?idxno=201605,"하나은행과 우리은행은 건설기계 협력사와 중소기업에 각각 금융지원을 하고, NH농협은행은 신종자본증권... 매출 누락이나 가공경비 등 세무 리스크 점검까지 포함되면서 단순 편의 기능을 넘어 '리스크 관리 서비스... "
2026-04-30,네이버뉴스,에스티젠바이오→비티젠 사명 변경…“글로벌 바이오 CMO 도약”,https://www.viva100.com/article/20260430500825,"생산공장 건설 프로젝트를 추진했고, 이를 기반으로 합작법인 DM Bio(현 에스티젠바이오)를 설립한 게... 특히 무균 충전 공정의 오염 리스크를 최소화하고 글로벌 규제 기준을 강화하기 위해 ‘Isolator type DP Filling... "
2026-04-30,네이버뉴스,[종합] 美 1분기 GDP 2% 반등…정부지출 덕에 버텼지만 소비·물가 '이중...,https://www.newspim.com/news/view/20260430001430,미국 건설 노동자 [사진=로이터 뉴스핌] ◆ 연준 내부 균열…금리 동결 속 이견 확대 이 같은 경제 환경... 특히 중동 전쟁 장기화는 2분기 이후 경제 성장의 주요 하방 리스크로 지목된다. 결국 이번 GDP 반등은 정부... 
2026-04-30,네이버뉴스,【문성의 밸류업 인사이트】밸류업과 K-스튜어드십 코드 2.0,http://www.impacton.net/news/articleView.html?idxno=18724,"기업과 건설적 대화를 진행하는 행위다. 코드에 명확한 원칙을 두고, 관련 법령 해석집을 정비해 법적 불확실성을 해소하는 것이 선결 과제다. 그렇지 않으면 단독으로는 영향력이 없고 함께하면 법적 리스크가 생기는... "
2026-04-30,네이버뉴스,북미·유럽서 판 키우는 韓타이어…고인치·현지생산으로 '승부수',https://www.newsway.co.kr/news/view?ud=2026043014151975539,"신공장 건설을 추진하고 있다. 약 8606억원을 투자해 연간 600만본 규모 생산 기지를 구축하고, 2028년 8월... 업계 관계자는 ""지정학적 리스크가 2분기 실적에 본격 반영되는 만큼, 고수익 제품 중심으로 강도 높은... "
2026-04-30,네이버뉴스,[인사] 유진그룹,https://it.chosun.com/news/articleView.html?idxno=2023092161406,▲동양 개발/건설부문 ◇부사장 승진 ▷개발/건설부문 대표이사 유정민 ▲그룹혁신부문 ◇전무 승진 ▷준법지원센터장 (겸) 법무팀장 이상규 ▷인사기획팀장(겸) 경영지원팀장 강성모 ▲동양 ◇상무 승진 ▷리스크관리... 
2026-04-30,네이버뉴스,5월1일 인사,https://www.hani.co.kr/arti/society/internalmove/1256710.html,건설부문 대표이사 유정민 ◇전무 △그룹혁신부문 준법지원센터장 겸 법무팀장 이상규 △〃 인사기획팀장 겸 경영지원팀장 강성모 △유진투자증권 경영전략본부장 이상식 △〃 감사총괄 한재혁 ◇상무 △동양 리스크관... 
2026-04-30,네이버뉴스,"대보그룹, 기획조정실장에 유진상 부사장 영입",https://www.hankyung.com/article/202604309726i,"대보그룹 관계자는 “30년간 건설회사의 전 부문에 걸친 업무 성과와 풍부한 경험, 전문지식을 바탕으로 한 리스크 관리 역량 등이 대보건설을 비롯한 대보그룹의 발전에 기여할 수 있다고 판단해 유 부사장을 영입했다”... "
2026-04-30,네이버뉴스,[인사] 헌법재판소 ; 한국해양진흥공사 ; 유진그룹 등,https://www.hankyung.com/article/2026043097131,개발·건설부문 대표이사 유정민 ◎승진▷준법지원센터장 겸 법무팀장 이상규▷인사기획팀장 겸... 한재혁 ◎승진▷동양 리스크관리담당 정원영▷동양 사업관리팀장 고현구▷동양 전략기획담당 황부익... 
2026-04-30,네이버뉴스,"에스티젠바이오, ‘비티젠’ 사명 변경…글로벌 CMO 도약",https://www.dailypharm.com/user/news/338090?REFERER=NP,생산공장 건설 프로젝트를 기반으로 출발했다. 이후 합작법인 DM Bio를 거쳐 2022년 에스티젠바이오로... 무균 충전 공정의 오염 리스크를 낮추기 위해 아이솔레이터 타입 DP 필링 라인을 도입해 글로벌 규제 기준에... 
2026-04-30,네이버뉴스,"‘리튬 적자 끝, 배당은 팍팍’⋯ 포스코홀딩스, 주주환원율 40% 쏜다",https://www.viva100.com/article/20260430500781,포스코는 지난 20일 인도 1위 철강사 JSW스틸과 오디샤주에 연산 600만톤 규모의 일관제철소 건설을 위한... 반면 주력인 철강 부문은 지정학적 리스크와 원가 상승의 이중고를 겪고 있다. 포스코홀딩스는 이란 사태 등... 
2026-04-30,네이버뉴스,[인사] 헌법재판소 외,https://www.hankookilbo.com/news/article/A2026043016370001232?did=NA,승진 △개발/건설부문 대표 유정민 ◇상무 승진 △리스크관리담당 정원영 △사업관리팀장 고현구 △전략기획담당 황부익 △인사총무담당 안준수 ◇상무보 선임 △개발운영팀장 조승범 △공사관리팀장 이종면... 
2026-04-30,네이버뉴스,"스테이블코인 왕 테더, 비트코인 제국 건설 시작...""채굴부터 결제까지...",http://coinreaders.com/233843,규제 기관의 압박 속에서 테더가 실물 기반의 에너지와 채굴 시설을 확보한 점은 향후 사업 리스크를 상쇄하는 전략적 선택이다. 이번 대규모 기업 결합은 개별 경쟁 구도에 머물던 비트코인 생태계가 테더라는 거대... 
2026-04-30,네이버뉴스,중동 리스크 덮쳤지만... 3월 생산·소비·투자 '트리플 증가',https://www.hankookilbo.com/news/article/A2026043010530002552?did=NA,중동 리스크가 우리 경제를 시차를 두고 잠식하는 형국이다. 국가데이터처가 30일 발표한 '3월 산업활동동향... 건설업체의 국내 시공 실적을 보여주는 건설기성은 7.3% 감소했다. 현재 경기 상황을 나타내는 동행종합지수... 
2026-04-30,네이버뉴스,"가스안전공사 대전본부, 도시철도 공사현장 가스사고 대응훈련 실시",http://www.energydaily.co.kr/news/articleView.html?idxno=166922,"도시철도 건설이 완료될 때까지 굴착공사 가스사고 제로 달성을 위해 지속적으로 노력하겠다""고 밝혔다. 이번 훈련은 도시 인프라 확충 과정에서 증가하는 '굴착공사 리스크'에 대응하기 위한 선제적 조치로 평가된다.... "
2026-04-30,네이버뉴스,"에스티젠바이오, '비티젠'으로 새출발…""글로벌 CMO 도약 의지""",https://www.dailian.co.kr/news/view/1640098/?sc=Naver,"생산공장 건설 프로젝트를 추진했고, 이를 기반으로 합작법인 DM Bio(현 에스티젠바이오)를 설립한 게... 오염 리스크를 최소화하고 글로벌 규제 기준을 강화하기 위해 Isolator type DP Filling Line 1기를 배치하는 등... "
2026-04-30,네이버뉴스,"에스티젠바이오, '비티젠'으로 사명 변경",https://dealsite.co.kr/articles/161168,생산공장 건설 프로젝트를 추진했다. 이를 기반으로 합작법인 DM Bio(현 에스티젠바이오)를 설립한 게... 특히 회사는 무균 충전 공정의 오염 리스크를 최소화하고 글로벌 규제 기준을 강화하기 위해 'Isolator type DP... 
2026-04-30,네이버뉴스,[오늘의 인사 : 4월 30일] 국가보훈부·해양수산부·과학기술정보통신부...,https://www.news2day.co.kr/article/20260430500203,개발/건설부문 대표이사 유정민 ◇ 전무 승진 ▷ 그룹혁신부문 준법지원센터장 겸 법무팀장 이상규... 동양 리스크관리담당 정원영 ▷ 동양 사업관리팀장 고현구 ▷ 동양 전략기획담당 황부익 ▷ 동양 인사총무담당... 
2026-04-30,네이버뉴스,"구윤철 부총리 ""금융·외환 변동성에도 위기 대응력 충분""",https://www.busan.com/view/busan/view.php?code=2026043017361272160,"등 리스크 요인이 있다고 진단하고서 ""정부와 관계기관은 비상대응체계를 빈틈없이 유지한 채 거시경제 및 금융·외환시장 안정에 만전을 기하겠다""고 강조했다. 구 부총리는 정유·석유화학·건설업 등 중동전쟁에... "
2026-04-30,네이버뉴스,"유진그룹, 2026년도 임원인사 실시…오너 3세 승진",https://www.1conomynews.co.kr/news/articleView.html?idxno=48391,유진그룹이 오너 3세 유정민 동양 개발·건설부문 대표이사를 부사장으로 승진시켰다. 1986년생인 유정민... 승진 ▲동양 리스크관리담당 정원영 ▲동양 사업관리팀장 고현구 ▲동양 전략기획담당 황부익 ▲동양... 
