date,source,title,link,description
2026-05-01,네이버뉴스,63년 만에 되찾은 이름 '노동절'…세종대로·여의대로 대규모 집회,https://www.ebn.co.kr/news/articleView.html?idxno=1707407,"건설노조는 현대건설 앞, 금속노조는 서울지방고용노동청 앞, 공무원노조는 동화면세점 앞, 백화점면세점노조는 롯데백화점 본점 앞, 언론노조는 서울시청 동편에서 각각 집회를 연다. 민주노총은 오후 4시부터... "
2026-05-01,네이버뉴스,'가정의 달'은 청약의 달…흑석·장위 대단지 등판,https://news.bizwatch.co.kr/article/real_estate/2026/04/29/0035,"한국토지주택공사(LH)가 시행하고 현대건설 컨소시엄이 짓는 민간참여 공공분양 방식이다. A31블록과 A34블록에서 각각 690가구, 679가구가 조성되며 35블록에는 753가구가 들어선다. 총 2122가구가 모두 청약 시장에... "
2026-05-01,네이버뉴스,첫 법정 공휴일 된 ‘노동절’에 서울 도심서 대규모 집회 열려,https://www.munhwa.com/article/11586365?ref=naver,"건설노조는 현대건설 앞, 금속노조는 서울지방고용노동청 앞, 공무원노조는 동화면세점 앞, 백화점면세점노조는 롯데백화점 본점 앞, 언론노조는 서울시청 동편에서 집회를 이어간다. 민주노총은 이번 집회를... "
2026-05-01,네이버뉴스,오늘 첫 법정공휴일 노동절...노동계 서울  광화문·여의도 등  집회,https://www.womennews.co.kr/news/articleView.html?idxno=276960,"건설노조는 현대건설 앞에서, 금속노조는 서울지방고용노동청 앞에서, 공무원노조는 동화면세점 앞에서, 백화점면세점노조는 롯데백화점 본점 앞에서, 언론노조는 서울시청 동편에서 집회를 연다. 민주노총은 이번... "
2026-05-01,네이버뉴스,GTX-C 노선 착공…덕정~수원 86㎞ 현장 투입,https://www.bntnews.co.kr/article/view/bnt202605010021,GTX-C 노선도 및 사업개요 (사진=현대건설) 장기간 지연됐던 수도권 광역급행철도 C노선(GTX-C) 사업이 본격적인 정상화 궤도에 올랐다. 주간사인 현대건설은 30일 GTX-C 공사 현장에 인력과 장비를 투입하며 사업 재개를... 
2026-05-01,네이버뉴스,첫 법정공휴일 된 노동절…서울 곳곳 5만 명 대규모 집회 열린다,https://www.dt.co.kr/article/12060415?ref=naver,▲건설노조(현대건설 앞) ▲금속노조(서울고용노동청 앞) ▲공무원노조(동화면세점 앞) ▲백화점면세점노조(롯데백화점 본점 앞) ▲언론노조(서울시청 동편) 등이 서울 각지에서 산발적 집회를 가진 뒤 본대회에... 
2026-05-01,네이버뉴스,"현대건설, 압구정3구역 '4.5만평 커뮤니티' 제안…단지 순환형 설계",https://www.fetv.co.kr/news/articleView.html?idxno=301649,"현대건설이 압구정3구역에 대규모 순환형 커뮤니티 설계를 제안했다. 단지 전체를 하나의 동선으로 연결하는 구조로, 커뮤니티를 주거 핵심 요소로 끌어올린다는 구상이다. 이번에 공개된 'ONE Circle'은 단지 전반을... "
2026-05-01,네이버뉴스,'첫 법정공휴일' 노동절…오늘 서울 도심 곳곳 노동계 집회,https://www.slist.kr/news/articleView.html?idxno=736163,"건설노조는 현대건설 앞에서, 금속노조는 서울지방고용노동청 앞에서, 공무원노조는 동화면세점 앞에서, 백화점면세점노조는 롯데백화점 본점 앞에서, 언론노조는 서울시청 동편에서 집회한다. 민주노총은 이번... "
2026-05-01,네이버뉴스,북극권에 '핵 배터리' 심는 캐나다… 러시아 견제·에너지 안보 '승부수...,https://www.g-enews.com/view.php?ud=202605010640137958fbbec65dfb_1,"현재 현대건설과 뉴스케일, DL이앤씨와 테레스트리얼 등 한-캐 기업 간 동맹이 활발한 만큼, 이번 국방부 프로젝트는 한국 기업에 '극한지 운용 실적(Track Record)'을 확보할 절호의 기회다. 다만, 현지 원주민 사회와의... "
2026-05-01,네이버뉴스,"[기획] 현대로템, 호치민 메트로 수주…‘100조' 남북고속철 사업 정조...",https://www.sentv.co.kr/article/view/sentv202604300123,"지난해 3월 한국은 국토교통부를 필두로 현대로템, 국가철도공단, 현대건설, 대우건설 등이 결집한 ‘팀코리아’ 체제로 승부수를 던졌다. ◇ 차량 넘어 시스템까지…‘상생형 패키지’로 승부수 이번 베트남 고속철... "
2026-05-01,네이버뉴스,"현대건설, 압구정3구역에 'ONE Circle' 제안…도시형 순환 커뮤니티 선보...",https://www.pinpointnews.co.kr/news/articleView.html?idxno=449951,현대건설 제공. 현대건설은 압구정3구역 재건축 사업에 차별화된 주거 전략으로 미래형 커뮤니티 'ONE Circle'을 제안했다고 1일 밝혔다. 'ONE Circle'은 단지 전체를 하나의 도시처럼 연결하는 순환형 커뮤니티 개념으로... 
2026-05-01,네이버뉴스,"첫 법정공휴일 된 노동절, 서울 도심 곳곳에서 노동계 집회",https://www.mk.co.kr/article/12033333,"건설노조는 현대건설 앞에서, 금속노조는 서울지방고용노동청 앞에서, 공무원노조는 동화면세점 앞에서, 백화점면세점노조는 롯데백화점 본점 앞에서, 언론노조는 서울시청 동편에서 집회한다. 민주노총은 이번... "
2026-05-01,네이버뉴스,첫 법정공휴일 된 노동절…오늘 서울 도심 곳곳 노동계 집회,https://www.yna.co.kr/view/AKR20260430211900004?input=1195m,"건설노조는 현대건설 앞에서, 금속노조는 서울지방고용노동청 앞에서, 공무원노조는 동화면세점 앞에서, 백화점면세점노조는 롯데백화점 본점 앞에서, 언론노조는 서울시청 동편에서 집회한다. 민주노총은 이번... "
2026-05-01,네이버뉴스,"민주노총·한국노총 63년만에 '노동절' 동시 집회, 광화문·여의도 혼잡...",https://www.insight.co.kr/news/552448,"서비스연맹 백화점면세점노조는 오후 1시 롯데백화점 앞에서, 건설산업연맹은 같은 시각 현대건설 앞에서 집회를 연다. 금속노조 서울지부는 오후 1시 서울고용노동청 앞에서 집회를 개최한다. 언론노조는 오후 12시 30분... "
2026-05-01,네이버뉴스,"'샐러리맨 전설' 조갑주 복귀, '국민연금 갈등' 흔들리는 이지스 구할까",https://realty.chosun.com/site/data/html_dir/2026/04/30/2026043003148.html,"성균관대에서 경영학 석사를 전공한 그는 삼성생명과 현대건설에서 부동산관리 업무를 경험한 뒤 2001년 국내 최초 부동산자산운용사인 코람코자산운용에 합류했다. 2001년 장교동 한화빌딩, 여의도동 대한방직 빌딩... "
2026-05-01,네이버뉴스,[Real:팁] “국평 17억 넘었다”... 동북선·GTX 호재 올라탄 ‘장위뉴타...,https://biz.chosun.com/about-investing/2026/05/01/WU5YWZFF2VEHLIZ66FSVMTATBY/?utm_source=naver&utm_medium=original&utm_campaign=biz,"장위동 A공인중개사무소 관계자는 “서쪽 구역 중 15구역은 지난해 현대건설을 시공사로 선정했으며, 12·13·14구역은 뉴타운 규제 완화, 신속통합기획 등을 적용받아 사업에 속도가 나고 있다”며 “동쪽 구역과... "
2026-05-01,네이버뉴스,"“공사비 2899억 올려달라”···전쟁에 하얗게 질린 재건축 조합, 분담...",https://www.khan.co.kr/article/202605010600051,서울 송파구의 마천4구역 재개발조합은 지난달말 시공사인 현대건설로부터 공사비 증액을 요청받았다. 현대건설은 공사비를 기존의 3.3㎡(평)당 584만원에서 959만원으로 높여 달라고 요청했다. 이에 따라 총 공사비는... 
2026-05-01,네이버뉴스,[오늘의 주요일정]사회(5월1일 금요일),https://www.newsis.com/view/NISX20260430_0003614166,"계동 현대건설 앞 2개차로, 노동절 사전집회 ▲오후 1시 전장연, 충무로3가 한국장애인고용공단→서린로터리, 2026 노동절 장애인 결의대회 ▲오후 1시 노동절거리기도회준비위, 공평동 SC제일은행→동화면세점, 노동절... "
2026-05-01,네이버뉴스,63년 만에 '노동절'…양대노총 대규모 집회 광화문·여의도 혼잡 예상,https://www.news1.kr/society/incident-accident/6154591,"서비스연맹 백화점면세점노조는 오후 1시 롯데백화점 앞, 건설산업연맹은 오후 1시 현대건설 앞, 금속노조 서울지부는 오후 1시 서울고용노동청 앞에서 각각 집회를 연다. 언론노조는 오후 12시 30분 시청 동편, 공무원노조... "
2026-05-01,네이버뉴스,건설업계 1분기 성적표 보니 ‘내실 경영’ 주력..DL이앤씨 '깜짝 실적'...,https://www.theguru.co.kr/news/article.html?no=101269,"대우건설 영업익 68.9%·IPARK현산 48.4%↑ 현대건설 매출 6.2조·수주잔고 92조원  올해 1분기 국내 주요 건설사들이 글로벌 지정학적 리스크와 원자재 가격 변동 등 대외 불확실성이 지속되는 가운데, '외형 성장... "
2026-04-30,네이버뉴스,"현대·대우·GS건설, 1분기 매출 감소…영업익 ‘온도차’",https://www.ekn.kr/web/view.php?key=20260430026161555,현대건설·대우건설·GS건설 올해 1분기 매출이 전년 동기 대비 일제히 감소한 가운데 영업이익은 건설사 별로 온도차를 보였다. 30일 에너지경제신문이 현대건설·대우건설·GS건설의 올해 1분기 경영실적(잠정)을... 
2026-04-30,네이버뉴스,"GTX-C 공사 정상화…주간사 현대건설, 사업 재개 공식화",https://www.newsway.co.kr/news/view?ud=2026043020321810507,주간사인 현대건설은 30일 공사 현장에 인력과 장비를 투입하며 사업 재개를 공식화했다고 밝혔다. 이번 착수는 이달 초 대한상사중재원이 총사업비 일부 증액을 인정하는 중재 결정을 내리면서 사업 추진의 최대... 
2026-04-30,네이버뉴스,‘5월 위기설’에도 美·이란 종전 후 기대되는 현대·대우·삼성E&A,http://www.fntimes.com/html/view.php?ud=202604302013365811048b718333_18,"◇ 현대건설 6조 매출·92조 잔고…단기 충격에도 ‘버티는 체력’ 현대건설은 2026년 1분기 연결 기준 매출 6조2813억원, 영업이익 1809억원, 당기순이익 2068억원을 기록했다. 영업이익은 전년 동기 대비 15.4% 감소했다.... "
2026-04-30,네이버뉴스,현대건설 '수도권 남·북교통망 정상화 시험대' 선행 작업 착수,http://www.newsprime.co.kr/news/article.html?no=732211,"현대건설(000720)이 30일부터 GTX-C 현장에 인력과 장비를 투입해 지장물 이설, 현장 펜스 설치 등 선행 작업을 시작했다. 이번 조치는 지난 1일 대한상사중재원이 GTX-C 총사업비 일부 증액을 결정한 이후 이뤄진 후속... "
2026-04-30,네이버뉴스,"""클린수주 외치더니 여론조작?""…압구정5구역, 공정성 흔드는 '단톡방 ...",https://www.ppss.kr/news/articleView.html?idxno=294768,"서울 핵심 재건축 사업지인 압구정5구역에서 현대건설측으로 추정되는 복수의  인원들의 '조합원 사칭' 논란이 불거지며 정비사업 전반의 공정성 문제가 다시 도마 위에 올랐다. 단순한 해프닝을 넘어, 수주 경쟁... "
2026-04-30,네이버뉴스,"한남3구역, 통합심의 접수… 연내 착공 청신호",https://www.dnews.co.kr/uhtml/view.jsp?idxno=202604301926138690361,"실제 한남3구역은 이미 지난해 7월 7일, 이주를 100% 완료한데다 시공사(현대건설)까지 선정해 서울시의 행정 지원이 뒷받침될 경우 연내 가시적인 공사 진척을 기대할 수 있는 만반의 채비를 갖췄다는 평가다. starleaf@"
2026-04-30,네이버뉴스,[건설 브리프] 삼성물산 현대건설 대우건설 롯데건설 外,https://www.s-journal.co.kr/news/articleView.html?idxno=41022,"삼성물산은 홈플랫폼 '홈닉'에 AI 세무 분석 서비스를 도입해 주거 서비스를 자산관리 영역으로 확대하고, 현대건설은 GTX-C 현장 선행 작업에 착수하며 사업 정상화에 속도를 내고 있다. 대우건설·현대엔지니어링·한화... "
2026-04-30,네이버뉴스,"현대건설, 압구정3구역 테마파크형 커뮤니티 'One Circle' 공개",http://www.enewstoday.co.kr/news/articleView.html?idxno=2425509,현대건설이 압구정3구역에 제안한 테마파크형 커뮤니티 'ONE Circle'을 30일 공개했다. 'ONE Circle'은 입주민의 라이프 스타일을 새롭게 완성하기 위한 미래형 커뮤니티이다. 365일 날씨와 관계없이 단지 전체... 
2026-04-30,네이버뉴스,"현대건설, 압구정3구역 '커뮤니티 도시' 승부수",http://www.4th.kr/news/articleView.html?idxno=2111258,포쓰저널 이현민 기자 압구정3구역 더 써클 ONE / 이미지=현대건설 현대건설이 서울 강남 압구정3구역 재건축 사업에서 초대형 커뮤니티를 앞세운 '도시형 주거 플랫폼' 전략을 구체화하고 있다. 전체 개발 청사진인... 
2026-04-30,네이버뉴스,"현대건설, 글로벌 ESG 평가 '건설업 부문 세계 1위' 달성",http://www.ikld.kr/news/articleView.html?idxno=333909,"현대건설 계동 사옥. 현대건설은 최근 S&P 글로벌이 발표한 세계 최고 권위의 지속가능경영 평가(CSA) '다우존스 최상위 지수(DJ BIC)'에서 건설업 부문 세계 1위를 달성했다. 세계, 아시아, 한국으로 평가 대상이... "
2026-04-30,네이버뉴스,"현대건설 컨소시엄, GTX-C 현장 인력·장비 본격 투입",http://www.lawissue.co.kr/view.php?ud=20260430181726887167191f6c6e_12,현대건설이 수도권 교통 혁명을 이끌 핵심 노선인 ‘수도권 광역급행철도 C노선 민간투자사업(GTX-C)’을 본격 착수한다. 현대건설의 현장 작업 돌입은 지난 1일 대한상사중재원이 GTX-C 총사업비 일부 증액을 결정하면서... 
2026-04-30,네이버뉴스,"DL이앤씨, 원가율·금융손익 기반 어닝서프라이즈",https://dealsite.co.kr/articles/161171,"1분기말 현대건설의 부채비율은 157%, 대우건설은 277.7%, GS건설은 231.3% 수준과 비교하면 2배 이상 차이난다. 올해 2분기 실적에 대해서도 플랜트 부문에서의 수주 기대감을 기반으로 긍정적인 전망이 나온다.... "
2026-04-30,네이버뉴스,'공사비 증액' GTX-C 다시 정상궤도,http://www.fnnews.com/news/202604301813454726,30일 현대건설 컨소시엄은 GTX-C 현장에 인력과 장비를 투입하고 지장물 이설과 펜스 설치 등 선행 작업에 착수했다고 밝혔다. 이는 이달 초 대한상사중재원이 총사업비 일부 증액을 결정하면서 사업 추진 기반이 마련된... 
2026-04-30,네이버뉴스,"""커뮤니티 품은 신축 단지로""... 잠실 대장주들 리모델링 기웃",http://www.fnnews.com/news/202604301813416252,"시공사 중 포스코이앤씨가 리모델링 시장의 강자로 꼽히는 가운데, 삼성물산과 현대건설이 지난해 말 각각 '넥스트 리모델링(철거 없이 주거 성능 개선)'과 '더 뉴 하우스(이주 없는 리모델링)'를 제시하며 리모델링... "
2026-04-30,네이버뉴스,[브리프]삼성물산 현대건설 대우건설 DL이앤씨 현대엔지니어링 IPARK현대...,http://www.biztribune.co.kr/news/articleView.html?idxno=353394,"■현대건설, 압구정3구역 테마파크형 커뮤니티 'One Circle' 공개 압구정3구역_더 써클 ONE | 현대건설 현대건설이 압구정3구역에 테마파크형 커뮤니티 'ONE Circle'을 공개하며, 단지를 하나의 도시처럼 연결하는 미래형 주거... "
2026-04-30,네이버뉴스,"수원-삼성 20분대에...현대건설, GTX-C 본격 착수",https://www.hankyung.com/article/202604309675i,"현대건설은 수도권 광역급행철도(GTX) C노선 민간투자사업에 본격 착수했다고 30일 밝혔다. 현대건설은 대한상사중재원의 총사업비 일부 증액 결정으로 사업 정상화 기반이 마련됨에 따라, 이날부터 GTX-C 현장에... "
2026-04-30,네이버뉴스,"[뉴스인사이드_뉴스톡톡] 삼성전자, 1분기 영업익 57.2조 '역대 최대'",https://www.newsinside.kr/news/articleView.html?idxno=4639661,"현대건설은 지장물 이설과 펜스 설치 등 초기 작업에 착수했으며, 연내 재원 조달을 마치고 본공사를 추진할 계획입니다. 총연장 86.46km 구간이 완공되면 주요 구간 이동 시간이 20분대로 단축돼 출퇴근 환경이 크게... "
2026-04-30,네이버뉴스,[AI 부동산 투데이] 전국 미분양 6만가구 넘었는데…'공급 가뭄' 여전,https://www.newspim.com/news/view/20260430001323,"◆ 현대건설, 수도권 20분대 생활권 열까 현대건설이 수도권 광역급행철도(GTX)-C 노선의 선행 작업에 나서며 수도권 교통 인프라 개선에 속도를 붙이고 있습니다. 최근 대한상사중재원이 총사업비 일부 증액을... "
2026-04-30,네이버뉴스,몸집 줄여 돈 더 번 DL이앤씨…'주택 마진 20%',https://news.bizwatch.co.kr/article/real_estate/2026/04/30/0056,압구정5구역 재건축을 놓고는 현대건설과 경쟁 구도다. DL이앤씨는 안정적 재무구조를 바탕으로 이 같은 선별수주 전략을 뒷받침한다는 계획이다. DL이앤씨의 3월 말 기준 부채비율은 87.5%로 3개월 전과 비교했을... 
2026-04-30,네이버뉴스,울산 부동산 시장 회복세...'힐스테이트 선암호수공원' 선착순 계약,https://www.newspim.com/news/view/20260430001365,이 같은 시장 회복세와 맞물려 현대건설이 울산 남구 야음동 일원에 공급하는 '힐스테이트 선암호수공원'이 수요자 관심을 끌고 있다. 단지는 선착순 동·호 지정 계약을 진행 중이다. 단지는 지하 6층~지상 최고 44층... 
2026-04-30,네이버뉴스,"외국인과 기관, 삼성전자 쌍끌이 매수… 코스피 6750.27 찍고 하락 마감",https://weekly.donga.com/3/all/11/6207544/1,"기관이 가장 많이 매도한 10개 종목은 현대건설, 삼성전자우, 삼성전기, NAVER, 한화시스템, 삼성바이오로직스, 삼성물산, 삼성중공업, 키움증권, 한국전력이었다. 이번 주 개인 순매수 1위 종목은 LS... "
2026-04-30,네이버뉴스,"[그린 인사이드] MSR선박, 2050년 7200조 '블루오션'… 한국 선점 나선다",https://www.greenpostkorea.co.kr/news/articleView.html?idxno=306620,"민관 합동 SMR 추진단 공식 출범 배경훈 부총리 겸 과학기술정보통신부 장관은 지난 29일 대전 한국원자력연구원에서 HD한국조선해양, 한화오션, 삼성중공업, 현대건설 등 조선·건설 업계 관계자들과 긴급 간담회를... "
2026-04-30,네이버뉴스,"DL이앤씨 압구정5구역 '속도전'으로 수주 공략, 공사기간 57개월 제시",https://www.businesspost.co.kr/BP?command=article_view&num=436971,"이는 현대건설이 공사를 따낸 압구정 2구역과 비교해 설명한 것으로 풀이된다. DL이앤씨는 압구정5구역 전담 조직 운영, 인허가 책임 및 비용 부담, 압구정 최초 이주 개시, 책임준공을 하나의 사업추진 계획으로 묶어... "
2026-04-30,네이버뉴스,"[건설브리핑] 현대건설, GTX-C 사업 정상화 본궤도 등",https://www.seoulfn.com/news/articleView.html?idxno=627842,현대건설은 '수도권 광역급행철도 C노선 민간 투자사업(이하 GTX-C)'을 돌입한다고 30일 밝혔다. 현대건설은 GTX-C 현장에 지장물 이설과  펜스 설치를 위한 인력과 장비를 투입하는 등 현장 작업에 착수했다. 연내에 재원... 
2026-04-30,네이버뉴스,"현대건설, 울산 부동산 회복세 호재 속 ‘힐스테이트 선암호수공원’ 공...",https://www.ekn.kr/web/view.php?key=20260430028101532,울산 부동산 시장이 회복세를 보이고 있는 가운데 현대건설이 울산시에 '힐스테이트 선암호수공원' 단지 공급에 나선다. 30일 한국부동산원 조사 결과 지난해 동안 울산 아파트 매매가격은 누적 2.1% 올랐다. 이는... 
2026-04-30,네이버뉴스,"롯데칠성-SK에코, 폭염과 전면전…온열질환 예방 협력",https://www.thedailypost.kr/news/articleView.html?idxno=114041,"SK에코플랜트는 작업 현장에 음료를 상시 비치해 근로자들의 수분 보충을 지원한다. 한편 롯데칠성음료는 향후 롯데건설, 현대건설, 한화 건설부문 등과 협력을 확대해 건설현장 안전 문화 확산에 나설 방침이다."
2026-04-30,네이버뉴스,"현대건설, GTX-C 현장 작업 착수…""광역 교통망 완성 속도""",https://www.dailian.co.kr/news/view/1640071/?sc=Naver,"현대건설은 ‘수도권 광역급행철도 C노선 민간투자사업(이하 GTX-C)’ 현장 작업에 돌입했다고 30일 밝혔다. GTX-C는 경기도 양주시 덕정역을 출발해 청량리, 삼성역을 지나 경기도 수원역을 잇는 총연장 86.46km의... "
2026-04-30,네이버뉴스,"'수원→삼성역' 20분 만에 간다… 현대건설, GTX-C 현장 작업 돌입",https://www.sidae.com/article/2026043016203360751,현대건설이 '수도권 광역급행철도 C노선 민간투자사업'(GTX-C) 현장 작업에 착수했다. 해당 철도가 개통되면 수도권 도심 출퇴근 시간이 감소할 것으로 예측된다. 30일 현대건설은 GTX-C 현장에 지장물 이설과 펜스... 
2026-04-30,네이버뉴스,"현대건설, GTX-C 현장 투입..공사비 갈등 딛고 정상화 시동",http://www.4th.kr/news/articleView.html?idxno=2111254,포쓰저널 이현민 기자 이미지=현대건설 현대건설이 공사비 갈등으로 지연돼 온 수도권광역급행철도 C노선(GTX-C) 사업 현장에 인력과 장비를 투입한다. 지난 1일 대한상사중재원의 총사업비 일부 증액 판정 이후 사업... 
2026-04-30,네이버뉴스,"현대건설, 압구정3구역에 테마파크형 커뮤니티 '원 서클' 제안",http://www.worktoday.co.kr/news/articleView.html?idxno=84226,압구정3구역 더 써클 ONE 현대건설은 압구정3구역에 테마파크형 커뮤니티 '원 서클(ONE Circle)'을 제안했다고 30일 밝혔다. 단지 내 커뮤니티 시설을 하나의 순환형 동선으로 연결해 날씨와 관계없이 이용할 수 있도록 한... 
2026-04-30,네이버뉴스,DL이앤씨 '압구정5구역' 공기 57개월 제안에 '갸우뚱',https://www.goodkyung.com/news/articleView.html?idxno=286545,서울 강남구 압구정5구역 재건축사업을 수주하기 위해 DL이앤씨와 현대건설이 입찰전을 벌이고 있는 가운데 '볼펜형 카메라'로 코너에 몰렸던 DL이앤씨가 공사기간(공기) 단축 카드로 조합원의 비용부담을 낮추는... 
2026-04-30,네이버뉴스,"대형 건설사, 1분기 매출 줄어도 이익 늘었다…'내실 경영' 효과",https://www.news1.kr/realestate/general/6154629,"현대건설(000720)도 매출 6조 2813억 원, 영업이익 1809억 원으로 각각 전년 동기 대비 감소했다. 에너지·원전 등 신규 수주 확대와 고원가 현장 정리 효과로 분기별 이익은 점진적으로 개선될 것으로 전망했다. 한... "
2026-04-30,네이버뉴스,[굿모닝! 30일 건설업계 소식] 대우건설·현대건설·현대엔지니어링·한...,https://www.goodkyung.com/news/articleView.html?idxno=286555,"현대건설은 압구정3구역에 테마파크형 커뮤니티 '원서클(One Circle)'을 제안하며 미래형 주거 커뮤니티 구상을 공개했다. One Circle은 입주민의 라이프스타일을 하나의 흐름으로 연결하는 순환형 커뮤니티로, 단지 전체를... "
2026-04-30,네이버뉴스,"우미희망재단, '푸른등대 기부장학금' 수여식 개최…산업재해·주거취약...",https://www.greened.kr/news/articleView.html?idxno=340125,"호반건설은 호반장학재단을 통해 대규모 우수인재 장학사업을 운영 중이며, 현대건설·태영건설·우원건설 등도 자체 장학재단이나 기부를 통해 지역인재 육성과 사회배려계층 지원을 이어가고 있다. 노동분야 전문가는... "
2026-04-30,네이버뉴스,"""100년 된 건설행정법, 전면 폐기하고 '기술경계경영'으로 재설계해야""",https://www.koscaj.com/news/articleView.html?idxno=323893,"손 위원장은 ""국민을 지배 대상으로 보던 고대 로마법의 공·사법 구분 방식을 명확한 근거 없이 채택한 결함이 현대 건설행정법 전반에 스며들어 있다""고 강도 높게 비판했다. ◇사법(私法) 계약으로 둔갑한 공공사업의... "
2026-04-30,네이버뉴스,"영업익, IPARK현산·GS건설 늘고 현대건설 등 감소",https://www.koscaj.com/news/articleView.html?idxno=323913,"IPARK현대산업개발과 대우건설, GS건설은 매출 감소에도 영업이익이 증가했지만, 현대건설과 삼성물산 건설부문은 매출과 영업이익 모두 전년 동기보다 줄었다. 30일 업계에 따르면 IPARK현대산업개발은 1분기... "
