date,source,title,link,description
2026-06-08,네이버뉴스,출퇴근 지옥에 GTX 지연까지… ‘수도권 30분 시대’ 가로막는 장벽 [민...,https://www.kyeonggi.com/article/20260607580378,"이미 착공된 주요 노선조차 완전 개통과 정상화 시점이 늦어질 수 있다는 우려가 상존하며 특정 역 정차나... 용인 반도체 클러스터 등 대규모 산업단지가 조성되면서 교통 수요가 폭증하는 남부권의 경우, 인프라 확충... "
2026-06-08,네이버뉴스,"차세대 AI기지 짓는 LGU+ ""2030년까지 5조 수주""",https://www.mt.co.kr/tech/2026/06/08/2026060718443153494,"파주 AIDC 1동(50㎿)은 지난해 5월 착공, 내년 6월 준공예정으로 전량 분양이 완료됐다. 국내... LG유플러스는 높은 전력수요에 대응하기 위한 DC(직류) 800V(볼트) 배전시스템과 AI 기반 DCIM(데이터센터 인프라관리시... "
2026-06-08,네이버뉴스,‘K전선’도 뜨겁다… AI전력망 특수 타고 ‘수주 릴레이’,https://www.kmib.co.kr/article/view.asp?arcid=1780824249&code=11151400&cp=nv,공장을 착공하는 등 동남아 수요에도 적극 대응하고 있다. 글로벌 공급 차질과 전력 인프라 확충 등으로 구리 가격이 상승한 점도 전선업체들에는 호재다. 전선업체는 대부분 원자재 가격 변동분을 판매 가격에... 
2026-06-08,네이버뉴스,‘캠프페이지·미술관·호수정원’ 속도전⋯민주당 도지사-춘천시장 체...,https://www.kwnews.co.kr/page/view/2026060750104400000,"이를 비롯해 시는 사업 지구 지정, 도시재생활성화계획 승인 등의 행정 절차를 내년까지 이행해 2028년 착공을 목표하고 있다. 문화예술 핵심 인프라 사업인 시립미술관 건립 사업도 다음 달 중앙투자심사 정부 신청을... "
2026-06-07,네이버뉴스,울산 남구 장생포 체험·체류형 관광시설 잇따라 준공,https://www.ulsanpress.net/news/articleView.html?idxno=576641,"10월 착공해 오는 17일 준공식을 갖는다. 서동욱 남구청장은 ""고래잠과 The Wave가 장생포 관광 콘텐츠를 한층 풍성하게 하고 체험·체류형 관광 인프라를 강화하는 계기가 되길 기대한다""며 ""남은 기간 사업을 차질... "
2026-06-07,네이버뉴스,"급격한 정책 변화, 안전장치 필요하다",https://www.ulsanpress.net/news/articleView.html?idxno=576538,"세계 최초 수소트램으로 착공에 들어간 도시철도 1호선과 태화강 위 세계적 공연장 건립은 브레이크가 걸렸고... 대규모 혈세가 투입되는 인프라사업의 실효성을 따져보고, 시민들이 매일 체감하는 대중교통 불편을... "
2026-06-07,네이버뉴스,울산시정 대전환 예고…교통·산업·행정 재설계 되나,https://www.iusm.co.kr/news/articleView.html?idxno=1063750,이미 착공을 앞둔 1호선 사업을 늦추고 예비타당성조사도 통과하지 못한 2호선을 우선 진행하기 위해서는... 공공인프라 기능을 강화하는 방향도 잡았다. 반면 민선 8기에서 추진해 온 일부 대형 프로젝트는 재검토 대상에... 
2026-06-07,네이버뉴스,"[민선 9기 해결해야 할 숙제는 무엇인가]  호기 맞은 새만금, 26조원...",http://www.domin.co.kr/news/articleView.html?idxno=1557712,"다만, 계획은 새만금 접근성 강화를 위해 남북 3축 도로(2030년 착공 목표)와 지역간 연결도로(2030년 개통)를 포함하고 있지만, 공항 인프라는 별도 과제로 남아 있다. 상황이 이런만큼 민선 9기 도정은 국토부 등과 협의해... "
2026-06-07,네이버뉴스,"[전재수 시대, 부산은] 겉치장 랜드마크 대신 시민 체감형 정책에 중점",https://www.busan.com/view/busan/view.php?code=2026060718324241684,"선거 과정에서 대규모 문화 인프라 사업에 대해 여러 차례 거부감을 드러낸 전 당선인이다. 전 당선인은 문화... 2028년 착공을 앞둔 야구장 재건축 안은 지난해 중앙투자심사를 통과했고, 현재 국비 확보 단계에 있다. 지역... "
2026-06-07,네이버뉴스,"정부, 장성 첨단 데이터센터 신속추진 지원한다",http://www.jndn.com/article.php?aid=1780823531433869001,2월 착공했다. 공정률에 따라 금융기관 PF 대출금 등이 투입되며 내년 12월 준공한다. 이후 석 달간 안정화를... 정부 관계자는 “인공지능(AI) 핵심 인프라의 적기 구축 지원을 통해 지역 산업의 AI 전환 및 첨단기업 유치... 
2026-06-07,네이버뉴스,장생포 고래문화특구 '더 오래 머무르고 빛으로 물들다',http://www.ujeil.com/news/articleView.html?idxno=386828,"장생포의 정체성을 담은 차별화된 미디어 콘텐츠와 해양 경관을 결합한 체류형 관광 인프라 구축에 중점을 뒀다. 고래잠은 지난 1월 착공해 오는 10일 준공식을 가질 예정이며, The Wave는 지난해 10월 착공해 오는 17일... "
2026-06-07,네이버뉴스,“우리의 바다 돌려달라”··· 포항 호미곶항 정비사업 뒤 해녀들의 절...,https://www.asiatime.co.kr/article/20260607500056,"2021년 4월 착공해 오는 6월말, 준공을 앞둔 475억 원 규모의 ‘호미곶항 정비사업’이, 정작 그 바다의 주인인... 호미곶항 정비 사업은 단순한 항만 인프라 개선 사업을 넘어, 우리 어촌이 나아가야 할 미래를 보여주는... "
2026-06-07,네이버뉴스,'백운누리센터' 주민 밀착 서비스 공간으로 각광,http://www.jjn.co.kr/news/articleView.html?idxno=1042812,"5월 착공해 지난해 7월 완공됐다. 특히 도시재생 활성화 계획 수립 당시 구상했던 공유주방·식당, 지역... '코인 빨래방'은 세탁 인프라가 부족한 농촌 주민의 생활 불편을 직접적으로 해소하고 있으며, 경제적인 비용으로... "
2026-06-07,네이버뉴스,"[기자수첩] 실험 대신 증명, 서산시민이 다시 '이완섭'을 불러낸 이유",http://www.cctimes.kr/news/articleView.html?idxno=910160,"수석지구 도시개발사업 착공, 자원회수시설 준공, 서산~영덕 고속도로 건설 착공 등 굵직한 숙원 사업들이... 거창한 거대 담론에만 머물지 않고, 도심 속 공원 조성과 맞춤형 복지 인프라 등 시민들이 삶 속에서 체감할 수... "
2026-06-07,네이버뉴스,지방선거 끝나자 주택공급 시계 재가동…수도권·지방 해법 갈린다,https://www.ajunews.com/view/20260607153526108,"정비사업은 조합 설립, 인허가, 이주, 착공까지 여러 절차를 거쳐야 한다. 공사비 상승과 조합원 분담금... 학교, 도로, 상하수도, 공원 등 생활 인프라 확충도 병행돼야 한다. 단순히 용적률을 높여 주택 수를 늘리는... "
2026-06-08,네이버뉴스,[Invest]서울 부동산에 명운 걸 오세훈 시정…개발사업 기대감에 투자자...,https://www.investchosun.com/site/data/html_dir/2026/06/05/2026060580101.html,"최근 들어 환율과 유가의 급등, 공사비 증가에 따른 개발사업이 주춤한 상황이긴하지만, 관련업계에선 서울... 점은 건설사를 포함한 부동산 투자업계에 훈풍이 미치지 못하는 요인으로 작용하고 있다.과거엔 전국 단위... "
2026-06-08,네이버뉴스,[보라매칼럼] 전·월세 시장 안정 해법은 '민간 공급 활성화',https://www.koscaj.com/news/articleView.html?idxno=324414,치솟은 공사비와 토지비를 반영하지 못하는 공공과 수익성을 따지는 민간의 엇박자 때문이다. '좋은 집은... 임대차 시장의 선진화는 건설업을 넘어 서민 주거와 국가 인프라 안정을 도모할 수 있는 중차대한 과제다.... 
2026-06-08,네이버뉴스,"[전문가 視覺] 도시정비사업, 공사비 분쟁 막으려면···",https://www.koscaj.com/news/articleView.html?idxno=324415,"중동지역 불안은 국내 건설시장에도 직접적인 충격을 주고 있다. 국제유가 급등과 해상 물류 불안, 원자재... 급격한 공사비 상승 부담을 줄이기 위해 VE를 통한 설계변경을 추진하게 된다. 이 과정에서 설계변경의 필요성... "
2026-06-08,네이버뉴스,‘4조+∝’ 잠실 MICE PF 조달 속도…지방선거로 불확실성 제거,https://www.dnews.co.kr/uhtml/view.jsp?idxno=202606051716321760253,"가량인데, 공사비 증가 등을 고려하면 추가 조달이 있어야 할 것”이라고 전했다. 검토 중인 추가 조달액 규모는 수천억원 수준으로 알려졌다. 이번 사업은 주무관청의 건설보조금 없이 사업비 전액을 민간에서... "
2026-06-08,네이버뉴스,[현장르포] [기계설비 직접발주 현장을 가다] 대구 송일초등학교,https://www.kmecnews.co.kr/news/articleView.html?idxno=50051,"행정 절차·서류 간소화로 완벽 소통…적정 공사비·공사기간 확보도 ""지켜지지 않는 '기계설비법', 기계설비... 직접발주를 안 하게 되면 시공사는 종합건설사(건축)와 단가 협의를 거쳐야 하고, 타 공종과의 간섭이 생길... "
2026-06-08,네이버뉴스,국토부 하반기 성과관리 핵심은 '하도급·건설생산체계·그린리모델링',https://www.kmecnews.co.kr/news/articleView.html?idxno=47311,"국토교통부가 올해 하반기 건설정책의 핵심 과제로 하도급 구조 개선과 불법하도급 근절, 건설산업... 그러나 최근 공사비 상승과 현장 여건 변화에도 불구하고 기준이 현실을 충분히 반영하지 못한다는 지적이... "
2026-06-08,네이버뉴스,[박재일 칼럼] 그들은 대구를 버릴까,https://www.yeongnam.com/web/view.php?key=20260607024028217,"국방 핵심전력 K2를 확장 이전하고, 공사비는 대구시 니가 알아서 해라는 그 설계도다. 대구 국회의원 누구... 그쪽 토호 건설업자들이 바다를 메우며 줄기차게 배를 불렸다. 이제는 현대차가 온다나. 그는 나의 칼럼 '대구... "
2026-06-08,네이버뉴스,[6ㆍ3 지선 대한도시정비포럼 전문위원 진단] ③ 재초환ㆍ공사비ㆍ금융...,https://www.dnews.co.kr/uhtml/view.jsp?idxno=202606070606453280292,"김진태 대한건설협회 차장은 재초환 폐지에 더해 임대주택 공사원가 현실화도 필요하다고 했다. 김 차장은 “공사비는 코로나19 팬데믹과 러시아-우크라이나 전쟁을 거치며 급격히 상승했고, 최근 중동 상황과... "
2026-06-08,네이버뉴스,[6ㆍ3 지선 대한도시정비포럼 전문위원 진단] ② “이주대책 가장 시급...,https://www.dnews.co.kr/uhtml/view.jsp?idxno=202606070605431070291,"대한도시정비포럼 전문위원, 오세훈 서울시장에 바란다 정부 정책 영향에 시장 활기 한계 토허제ㆍ공사비... 7일 는 김미현 법무법인 현 변호사, 김제경 투미부동산컨설팅 소장, 김진태 대한건설협회 차장... "
2026-06-08,네이버뉴스,[건설계약관리 강좌] (10) 공기 연장 추가 간접비,https://www.kmecnews.co.kr/news/articleView.html?idxno=50066,"공사비는 단순 물량의 합이 아니라, 시간과 자원이 결합된 결과라는 인식이 전제돼야 한다. 공기 연장에 따른 추가간접비를 합리적으로 이해하고 반영하는 것은 단순한 비용 문제를 넘어, 계약의 공정성과 건설산업의 지속... "
2026-06-08,네이버뉴스,"대출 막고 비아파트 늘린다더니…인허가, 2만→7048건 '뚝'",https://www.edaily.co.kr/news/newspath.asp?newsid=01394006645479752,공급하려는 건설업자가 적을 것이란 관측도 나온다. 서울 남산에서 바라본 시내 주택가 모습.(사진... 적용하던 ‘공사비 연동형’을 폐지하고 감정평가 매입 방식으로 일원화했다. 감정평가법은 LH와... 
2026-06-07,네이버뉴스,"조정호 메리츠금융 회장, 한남동 ‘262억 사저’ 신축… 신세계 이명희...",https://www.dailyt.co.kr/newsView/dlt202606070003,"설계는 정림건축, 시공은 장학건설로 전해졌다. 연면적은 약 2014㎡(약 609평)에 달한다. 특히 계약 기준 공사비만 262억원 수준으로 알려지면서 업계에서도 이례적이라는 반응이 나온다. 평당 건축비로 환산하면 약... "
2026-06-07,네이버뉴스,옵션 폭탄 … `배보다 배꼽이 더 큰' 아파트 분양가,http://www.cctimes.kr/news/articleView.html?idxno=910238,"분양업계 관계자는 ""시멘트, 철근 등 핵심 자잿값이 워낙 올라 건설사 입장에서도 마진을 맞추기 어렵다""며... 전문가들은 당분간 공사비 상승세가 꺾이지 않을 것으로 보이는 만큼 이러한 옵션 쪼개기 현상이 지속될... "
2026-06-07,네이버뉴스,땀이 줄줄··· 폭염과 사투벌이는 건설현장,http://www.jjn.co.kr/news/articleView.html?idxno=1042917,"게다가 작업을 중단하거나 공사 일정을 조정해야 하는 문제가 발생하게 되고, 각종 기상 여건 악화로 공기 지연과 공사비 증가로 이어지게 돼 건설업계의 부담은 늘어날 수 밖에 없다. 이달 들어 낮 기온이 점점... "
2026-06-07,네이버뉴스,5년 새 47% 오른 레미콘 운송비…회당 8만원 넘나,https://www.ajunews.com/view/20260605173629136,운송비가 오르면 레미콘 납품단가 인상 압력으로도 이어질 수 있어 건설업계는 올해 협상 결과를 또 다른 공사비 변수로 보고 있다. 상승세는 가파르다. 수도권 회당 운송비는 2020년 5만1500원에서 2021년 5만6000원... 
2026-06-07,네이버뉴스,중동발 고유가 직격탄…울릉공항 공사비·공기 지연 우려,https://www.kyongbuk.co.kr/news/articleView.html?idxno=4074775,"높아 건설업계의 우려는 더욱 커지고 있다. 현재도 업체들은 계약 당시 예상하지 못한 유류비 부담을 떠안고 있는 상황으로, 유가 상승세가 지속될 경우 공사비 증가에 따른 경영 악화는 물론 공정 지연 가능성까지... "
2026-06-08,네이버뉴스,美 우주 공룡 탄생···한화·KAI 통합 시나리오 빨라질까,https://www.newsfreezone.co.kr/news/articleView.html?idxno=693377,"게이트웨이)을 건설하는 것을 골자로 한다. 나아가 달 표면의 자원을 활용하는 지속 가능한 우주 경제... 점도 리스크로 꼽힌다. 국내 항공우주업계 한 관계자는 ""국가 차원의 대표 기업을 키워 규모의 경제를... "
2026-06-08,네이버뉴스,"LGU+, AI DC 사업 키운다…""2030년 누적 수주 5조원 달성""",https://www.itbiznews.com/news/articleView.html?idxno=215453,LG전자는 이달 5일 경기 파주시 소재 AI데이터센터(AI DC) 건설 현장에서 간담회를 열고 차세대... 핵심 리스크로 부각되고 있다. 전력 용량과 인프라 규모 경쟁력 강화도 추진한다. 파주 AI데이터센터는 200MW 전력... 
2026-06-08,네이버뉴스,“트럼프 말발 안 먹힌다”… 외교 피로감에 독자 노선 구축하는 글로벌...,https://www.g-enews.com/view.php?ud=2026060807550293080c8c1c064d_1,공급망 다각화 사수 나선 美… 최초 부유식 LNG 터미널 ‘델핀’ 최종 승인 지정학적 리스크가 심화되자... 터미널’ 건설을 위한 최종 투자 결정(FID)을 공식 발표했다. 카메론 교구 해안에서 약 45마일 떨어진 해상에... 
2026-06-08,네이버뉴스,"한국 철도 기술, 안데스 고산지대 뚫었다…페루 국책 사업 최종 수주",https://www.g-enews.com/view.php?ud=202606051554497509a9fc143920_1,"국가철도공단이 주도하는 컨소시엄은 향후 5년 간 해당 철도의 건설, 초기 운영 단계 전반에 걸쳐 리스크 관리와 공정 품질을 제어하는 핵심 감리 업무를 총괄 지휘하게 된다. 이번 수주는 세계 철도 시장을 선도해 온... "
2026-06-08,네이버뉴스,"""성수동도 안돼"" 성수 지식산업센터, 선임차·통매각 추진",https://dealsite.co.kr/articles/162893,"요진건설 측은 ""해당 현장은 2025년 준공이 완료됐고 성공적인 준공에 따라 기존 PF 대출을 일반담보대출로 리파이낸싱한 것""이라며 ""책임준공 이슈는 소멸됐다""고 밝혔다. 공사 리스크가 해소된 만큼 기존 개발단계 PF를... "
2026-06-08,네이버뉴스,[노무] 장애인 고용부담금의 산정 방식과 가산율,https://www.koscaj.com/news/articleView.html?idxno=324416,특히 건설업은 상시근로자 산정 방식의 복잡성으로 인해 자칫 방심하면 거액의 부담금 리스크에 노출되기 쉽습니다. 정확한 산정 로직에 기반한 상시적인 인원 관리가 필수적인 이유입니다. /김갑주 노무사... 
2026-06-08,네이버뉴스,2.9조 엔 '돈 폭탄' 일본 라피더스… 지금 삼성전자 들고 있다면 이 지표...,https://www.g-enews.com/view.php?ud=202606080641071287fbbec65dfb_1,"하락 리스크가 고개를 들고 있다. 디지타임스(DIGITIMES)가 7일(현지시각) 보도한 내용에 따르면, 일본... 경제산업성은 이 자금 수혈 외에도 오는 2027~2028회계연도 중 국가 재정으로 직접 건설한 공장 건물과 핵심 생산... "
2026-06-08,네이버뉴스,국토부 사상 첫 ‘고공단 나급’ 3명…거세지는 ‘여풍’,https://www.dnews.co.kr/uhtml/view.jsp?idxno=202606051322212360215,"최정민 주거복지정책과장은 민간임대정책과장, 해외건설지원과장, 물류정책과장 등 1ㆍ2차관실 소관 부서를 두루 섭렵한 인재다. 리스크 관리 능력이 뛰어나 사고가 일어나기 전 선제적으로 대응하는 업무 스타일을... "
2026-06-08,네이버뉴스,"[르포] 5조원 수주 '청사진'…LGU+, 파주에 200MW 데이터센터 구축",https://www.theguru.co.kr/news/article.html?no=102724,핵심 리스크로 부각되고 있다. ◇‘ACE on Trust’로 속도·전력·냉각 잡는다…AIDC 사업 수주 5조원 정조준... 파주 AI 데이터센터도 사전 제작한 주요 구조물을 현장에서 조립하는 방식으로 건설 속도를 높였다.... 
2026-06-08,네이버뉴스,전쟁 끝나도 고유가 여파…농업 생산비 상승 압박,https://www.nongmin.com/article/20260605500535,"농업, 건설업 등의 타격이 클 것”이라고 전망했다. 미국 에너지정보청(EIA)은 지난해 10월 1배럴당 50.3달러로... 만큼 핵심 원자재와 부품의 조달 경로, 생산거점을 지정학 리스크 기준으로 재검토해야 한다”고 제언했다."
2026-06-08,네이버뉴스,"""변호사라고 쓰고 해결사라고 읽는다""… 떠오른 로펌들 [2026 로펌 컨수머...",https://www.lawtimes.co.kr/news/articleView.html?idxno=221622,지평은 이러한 격변의 시기를 겪고 있는 기업 고객들의 곁에서 미래의 리스크를 먼저 내다보고 나아갈 길을... 예헌은 건설·부동산과 중대재해 분야에서 전문성을 바탕으로 다수 사건의 승소를 이끌었다는 평가를... 
2026-06-08,네이버뉴스,"기록적 폭염에 훼손되는 수메르문명 유적, 홍수 위기에 빠진 베네치아",https://www.donga.com/news/Culture/article/all/20260608/134065927/2,"기원전 4000년경, 달의 신 ‘난나’를 위해 건설된 이라크 우르의 지구라트(Ziggurat). 유네스코 세계유산인 이... 때문에 기후변화를 장기적 리스크로 관리하는 체계가 서둘러 마련돼야 한다는 목소리가 높다. 김세현... "
2026-06-07,네이버뉴스,[만물상] 우주를 파는 기업,https://www.chosun.com/opinion/manmulsang/2026/06/07/R6PYJJK2DJB63PPDT3TVFXZ5KQ/?utm_source=naver&utm_medium=referral&utm_campaign=naver-news,"로켓 발사 대행은 물론 화성 이주 계획을 제시하고, 달 기지 건설을 통한 우주 경제권을 선점하고, 우주... 일론 머스크 개인에게 좌우되는 지배 구조 리스크와 밑 빠진 독처럼 돈이 드는 우주 개척의 불확실성은... "
2026-06-07,네이버뉴스,16년 만에…‘캐나다 LNG’ 7만5000t첫 수도권 입항,https://www.khan.co.kr/article/202606072029005,LNG 캐나다 프로젝트는 캐나다 서부 브리티시컬럼비아주 키티맷에 LNG 액화플랜트를 건설해 천연가스... “지정학적 리스크나 운하 통항 리스크에서 자유로운 태평양 항로를 이용할 수 있다는 점도 국가 에너지... 
2026-06-07,네이버뉴스,"다음주 증시, 반도체 독주 이어질까…美 물가·스페이스X IPO 변수 [투자...",https://biz.heraldcorp.com/article/10764933?ref=naver,"여기에 중동 지정학적 리스크와 미국 물가 경계심리까지 겹치며 증시 변동성이 확대됐다. 다만... 화장품·의류, 건설, 호텔·레저, 은행 업종 등을 주목할 필요가 있다”고 말했다. 다만, 순환매가 나타나더라도 시장의... "
2026-06-07,네이버뉴스,[포럼] 스타벅스의 출구 전략,http://www.fnnews.com/news/202606071839543425,이번 스타벅스 논란은 그런 점에서 새로운 형태의 오너리스크다. 1966년 당시 비료는 국가의 핵심 산업이었다. 삼성 계열사인 한국비료공업은 울산에 세계적 규모의 공장을 짓고 있었다. 그런데 건설자재를 수입하면서... 
2026-06-07,네이버뉴스,[加 LNG 첫 입항] ② 15년 투자 결실 지분물량 70만t 도입…하반기 2단계...,https://www.dnews.co.kr/uhtml/view.jsp?idxno=202606060826055550271,"가스공사 관계자는 “혹한 폭설, 그리고 코로나 팬데믹을 동반한 건설 노정은 형언할 수 없는 고난과 역경의 연속이었다”면서도 “수많은 위기를 극복한 결과 지정학적 리스크에서 자유로운 태평양 항로를 통해... "
2026-06-07,네이버뉴스,[加 LNG 첫 입항] ④ 민간서도 가스전 개발·지분 투자 ‘활발’,https://www.dnews.co.kr/uhtml/view.jsp?idxno=202606060831318130273,이번 사업은단순 지분 확보에 그치지 않고 대규모 인프라 건설 참여를 병행한다는 점이 특징이다.... 자원 개발사가 특정 구매국에 수출을 집중하면수요 변동에 따른 리스크가 커지기 때문이다. 따라서 개발 단계부터... 
2026-06-07,네이버뉴스,"[加 LNG 첫 입항] ① 韓 'LNG 주권' 결실...가스 자주율, 3031년 10%대 확...",https://www.dnews.co.kr/uhtml/view.jsp?idxno=202606060817322320270,"개발 규모가 큰 데다, 육상에 액화플랜트를 짓고 파이프라인까지 건설해 도입한 LNG 물량이라서다.... 가스공사 관계자는 “2022년 러시아-우크라이나 전쟁 발발로 지정학적 리스크 회피 측면에서 지분물량의... "
2026-06-07,네이버뉴스,"수도권 레미콘 노조, 8일부터 휴업…반도체 공장 지연 리스크 '우려'",https://www.ajunews.com/view/20260607173608274,"레미콘 운송 노조 ""운반비 인상 및 임단협 체결"" 제조사 ""건설 경기 침체로 고사 직전""...협상 난항 아주경제... 공장 건설 현장에 투입되는 물량으로 알려져 긴장감이 고조되고 있다. 7일 전국레미콘운송노동조합은... "
2026-06-07,네이버뉴스,"""건축자재 원자재값 63% 급등""…초고환율에 K중기 비명",https://www.mk.co.kr/article/12067856,공장 건설용 알루미늄 패널을 공급하는 중소기업 A사는 원화가치 폭락이 수개월째 이어지면서 경영 압박을... 지난 3월 발발한 중동 전쟁 여파가 이어져 원재료 품귀 현상을 겪는 상황에서 환율 리스크까지 더해진... 
2026-06-07,네이버뉴스,"[기자24시] 레미콘 파업, AI트럭 재촉할 수도",https://www.mk.co.kr/article/12067843,여기에 건설 현장 대기수당이나 레미콘 세척수를 회수하라고 지급하는 회수수 수당 등 부대비용 부담이... 고령화에 따른 안전 리스크에도 대비할 수 있다. 한국레미콘공업협동조합연합회의 2022년 조사에 따르면... 
2026-06-07,네이버뉴스,반도체 호황 뒤에 가려진 경고등...고용·내수·가계빚의 삼중 과제,https://www.news2day.co.kr/article/20260607500068,최근 수개월 동안 제조업과 건설업 고용이 부진한 반면 보건·복지 서비스업 중심의 고용 증가가 이어지는... 디지털 리스크 대응 방안을 논의한다. 생성형 AI 확산으로 금융권 업무 혁신이 빨라지고 있는 가운데 해킹과... 
2026-06-07,네이버뉴스,"코스피 8000 시대, 지방선거 변수는?…정책 연속성에 시장 촉각",https://www.namdonews.com/news/articleView.html?idxno=912829,정치·외교·통상 리스크가 한꺼번에 부각되면서 코스피는 급등락을 반복하는 불안정한 흐름을 이어갔다.... 업종별로는 지역 개발 공약과 연계된 건설·인프라 관련 종목들이 단기적인 수혜를 받을 가능성이 있다. 실제... 
2026-06-07,네이버뉴스,"서경란의 중소기업 정책설명서(12) - 창업, 이제는 아이디어를 작게 시...",https://news.ifm.kr/news/articleView.html?idxno=472469,"신용평가, 리스크 관리. 또 의료에서는 진단 보조, 신약 개발 이런 것처럼 이제 활용 범위가 매우 넓어졌고요.... 다시 건설적으로 일으키느냐, 이런 프로그램들도 상당히 많이 지원을 하고 있고... 세 번째는 실제로 이제 그... "
