date,source,title,link,description
2026-04-14,네이버뉴스,"포스코이앤씨, 분당 '더샵 분당하이스트' 4월 공급",http://www.enewstoday.co.kr/news/articleView.html?idxno=2418712,"느티마을 4단지 리모델링주택조합이 시행하고 포스코이앤씨가 경기도 성남시 분당구 정자동 90번지 일원에서 시공중인 '더샵 분당하이스트'가 4월 공급한다고 14일 밝혔다. 단지는 지하 4층~지상 최고 26층, 16개 동... "
2026-04-14,네이버뉴스,"세종사이버대 자산관리건축건설학부, 스마트건설·부동산 정책 전망 아...",https://www.kyosu.net/news/articleView.html?idxno=203646,오후 4시부터 시작된 1부에서는 건축도시계획인테리어학과 주관으로 금대연 마스터(현 포스코이앤씨 BIM·스마트건설 부문 Expert)가 '시공현장에서 이루어지는 스마트건설'을 주제로 강연을 진행했다. 금 마스터는... 
2026-04-14,네이버뉴스,"지방도 '될 곳은 된다'…안동더샵더퍼스트, 선별 수요 몰렸다",https://www.thedailypost.kr/news/articleView.html?idxno=113855,|데일리포스트=이우철 기자| 포스코이앤씨가 공급하는 '더샵 안동더퍼스트'가 견본주택 개관 이후 3일동안 8000명의 내방객들로 북새통을 이뤘다. 부동산 대출 규제로 얼어붙었던 신규 분양시장에서 흥행 신호탄이 오른... 
2026-04-14,네이버뉴스,차는 늘어나는데 주차공간은 30년째 제자리…‘주차전쟁’ 해법은?,http://www.lawissue.co.kr/view.php?ud=20260414163245818667191f6c6e_12,"같은 달 포스코이앤씨는 대전 서구 관저지구에 ‘더샵 관저아르테’를 분양한다. 지하 3층~지상 25층, 전용 59~119㎡, 총 951가구다. 중소형부터 중대형까지 폭넓은 평면을 구성했으며, 가구당 1.67대의 주차공간을... "
2026-04-14,네이버뉴스,안동 '더샵 안동더퍼스트' 견본주택 오픈…20일부터 분양일정 시작,https://www.sentv.co.kr/article/view/sentv202604140136,서울경제티브이 박수열 기자 포스코이앤씨는 경북 안동시에 공급하는 ‘더샵 안동더퍼스트’가 지난 10일 견본주택을 개관하고 본격적인 분양 일정에 돌입했다고 14일 밝혔다. 포스코이앤씨에 따르면 개관 이후... 
2026-04-14,네이버뉴스,"포스코이앤씨 '오티에르 반포', 1순위 경쟁률 710대 1",https://www.bizwork.co.kr/news/articleView.html?idxno=414561,포스코이앤씨가 서울 서초구에 공급한 '오티에르 반포'가 1순위 청약에서 평균 700대 1이 넘는 경쟁률을 기록하며 전 타입 청약을 마감했다고 14일 밝혔다. 한국부동산원 청약홈에 따르면 지난 13일 진행된 1순위... 
2026-04-14,네이버뉴스,“첨단 산업이 집값도 움직인다” 반도체·바이오發 부동산 상승세 확산,https://economist.co.kr/article/view/ecn202604140048,"포스코이앤씨는 인천 송도에서 ‘더샵 송도그란테르’를 선보일 예정으로, 국제업무지구 내 마지막 주거단지라는 점에서 관심을 모은다. 역세권 입지와 대형 상업시설, 교육 환경, 대규모 공원 조성 계획 등이 결합된 복합... "
2026-04-14,네이버뉴스,"‘앉아서 20억 번다’ 반포 첫 오티에르, 경쟁률 최대 1181 대 1 [부동산...",https://biz.heraldcorp.com/article/10717087?ref=naver,"홍승희 기자 [헤럴드경제=홍승희 기자] 포스코이앤씨가 서울 서초구에 공급한 ‘오티에르 반포’가 1순위 해당지역 청약에서 3만건이 넘는 청약이 몰리며, 평균 700대 1이 넘는 경쟁률로 전 타입 청약을 마감했다.... "
2026-04-14,네이버뉴스,"포스코이앤씨, 4월 송도국제도시 '더샵 송도그란테르' 1,640가구 분양",https://www.enetnews.co.kr/news/articleView.html?idxno=48889,포스코이앤씨가 4월 인천광역시 연수구 송도동 일원에 '더샵 송도그란테르(G5-1·3·4·5·6·11블록)'를 분양할 예정이다. 이번 단지는 첨단 산업 집적지로 주목받는 송도국제도시 내에서도 핵심 지역인 국제업무지구(IBD)에... 
2026-04-15,네이버뉴스,미-이란 전쟁에 건설업계 1분기 해외수주 '빨간불',https://daily.hankooki.com/news/articleView.html?idxno=1358168,사진=한국전력 제공 국내 건설사들의 해외수주 기반이 흔들리고 있다. 미국-이란 전쟁 여파로 전통적인 수주 텃밭인 중동지역에서의 일감이 크게 줄었기 때문이다. 15일 해외건설협회에 따르면 올해 1∼3월 국내... 
2026-04-15,네이버뉴스,"동문건설, 워크아웃 이후 ""성장에서 안정으로""… 시공 중심 재편",https://www.ebn.co.kr/news/articleView.html?idxno=1705436,한때 성장의 동력이었던 분양사업을 줄이고 상대적으로 변동성이 낮은 수주 기반 공사 매출 비중을... 금리 상승과 부동산 시장 위축으로 분양 리스크가 확대되면서 다수 건설사들이 자체 시행 비중을 줄이고 시공... 
2026-04-15,네이버뉴스,"삼성E&A, 중동 플랜트 재건 호재 기대...안전·외교 변수는 부담",https://www.newspim.com/news/view/20260414001022,건설사업을 통해 얻은 매출이다. 특히 사우디아라비안 오일 컴퍼니(아람코) 발주 사업으로부터 끌어온 매출은 2조8381억원에 달한다. 그동안 중동 시장 공략에 공을 들여왔다. 2007년 사우디 아람코의 'DHT 프로젝트' 수주... 
2026-04-15,네이버뉴스,[매치업] '보릿고개' 넘는 한샘·현대리바트의 치열한 수 싸움,https://www.shinailbo.co.kr/news/articleView.html?idxno=5011012,"CBSI는 건설사의 체감경기 수준을 반영한 지표다. 100이 기준인데 이를 밑돌면 비관적이라는 의미다. 14일 각 사에 따르면, 한샘과 현대리바트는 지난해 매출과 영업이익 모두 역성장했다. 한샘은 지난해 매출액... "
2026-04-14,네이버뉴스,건물은 못 짓고 ‘한숨만 짓는’ 건설,http://www.knnews.co.kr/news/articleView.php?idxno=1539395,종합건설사부터 전문건설사까지 가릴 것 없이 현장에서는 “절반이 폐업해도 이상하지 않은 수준”이라는 비명이 터져 나오고 있다. 14일 경남지역 건설업계에 따르면 이들이 공통으로 지목하는 위협은 ‘수주 절벽’과... 
2026-04-14,네이버뉴스,"폭스바겐 발 뺀 독일, 어빙과 손잡은 한화…'캐나다 잠수함 사업' 승기...",https://magazine.hankyung.com/business/article/202604140853b,(CPSP)' 수주를 위한 협력 체계를 본격화했다. 김희철 한화오션 대표는 최근 캐나다 핼리팩스를 방문해 팀... 반면 한화오션은 건설사 PCL과의 인프라 협업 및 현대차그룹의 수소 인프라 제안 등 실질적인 경제 협력 카드를... 
2026-04-14,네이버뉴스,건설 한파 속 선방…대전 하도급 2조 7천120억 확보,https://www.ccdn.co.kr/news/articleView.html?idxno=1073503,"시는 향후 경쟁력 있는 지역업체를 발굴해 대형 건설사 협력업체로의 진입을 확대할 방침이다. 업무협약을 통한 수주 기반 확충과 함께 공동주택 품질점검, 감리 실태 점검과 연계한 하도급 관리도 강화한다는... "
2026-04-14,네이버뉴스,"한화오션, 캐나다 잠수함 사업 공략…현지 협력망 확대",https://www.g-enews.com/view.php?ud=20260414145758518724debea800_1,이번 방문은 캐나다 잠수함 사업(CPSP) 수주를 염두에 둔 전략적 행보로 풀이된다. 김 대표는 팀 휴스턴(Tim... 최근에는 캐나다 건설사 PCL과도 전략적 협력을 맺는 등 현지 협력 기반을 넓히고 있다. 김 대표는 “신속한... 
2026-04-14,네이버뉴스,"극동건설, 강동하남남양주선 4공구 수주 ‘유력’",http://mcnews.co.kr/86040,"다른 건설사가 참여하지 않고 있는 공구를 찾고 있다”며 “관계사인 남광, 금광과 합심하고 있는 것이 결과로 나타났다”고 설명했다. 극동건설은 앞서 7호선 연장인 양주 옥정~포천 광역철도 3공구를 수주했다.... "
2026-04-14,네이버뉴스,"3월 건설사 체감경기 소폭 상승···""회복은 제한적""",https://www.koscaj.com/news/articleView.html?idxno=323584,"한국건설산업연구원은 13일 월간 건설시장동향(2026년 3월호)를 발표, 2026년 2월 건설수주는 12.9조 원으로 전년 동월 대비 6.7% 증가했다고 밝혔다. 민간수주는 재개발·재건축 등 정비사업 확대 영향으로 11.1% 증가하며... "
2026-04-14,네이버뉴스,건설경기 식었지만… 대전 하도급은 늘었다,https://www.newsfreezone.co.kr/news/articleView.html?idxno=685129,"시는 향후 경쟁력 있는 지역업체를 발굴해 대형 건설사 협력망에 포함시키고, 업무협약 등을 통해 수주 기회를 넓힌다는 계획이다. 또 품질점검과 감리 실태 점검과 연계해 하도급 관리도 강화할 방침이다. 시 관계자는... "
2026-04-14,네이버뉴스,"3월 건설경기 체감지수 소폭 반등…""회복은 여전히 제한적",https://www.ccdailynews.com/news/articleView.html?idxno=2410274,14일 한국건설산업연구원에 따르면 3월 건설경기실사지수(CBSI)는 67.8로 전월 대비 5.3p 상승했다. 다만 기준선인 100을 크게 밑도는 수준으로 건설업계 전반의 체감경기는 여전히 비관적인 상황이다. CBSI는 100을... 
2026-04-14,네이버뉴스,"광산토건이 공공공사 현장을 책임지는 방식, 안전과 신뢰 - 광산토건 김...",https://www.handmk.com/news/articleView.html?idxno=37177,"대기업뿐 아니라 중소 건설사들도 공공공사에 더 집중할 것으로 보인다. 원자재 가격 상승에 비해 공사 원가가 충분히 반영되지 않는 문제도 있어, 수주를 선별하고 실익을 따지는 판단이 더 중요해질 것이다. 현재의... "
2026-04-14,네이버뉴스,"하도급 수주 2조7천억 돌파…대전시, 지역업체 참여 확대",https://www.joongdo.co.kr/web/view.php?key=20260414010004258,"시는 지역업체 경쟁력 강화를 통해 대형 건설사 협력 구조를 확대하고, 안정적인 수주 기반을 마련한다는 계획이다. 이를 위해 업무협약 체결과 함께 신규 참여 업체 발굴에도 나선다. 아울러 공동주택 품질점검과 감리... "
2026-04-14,네이버뉴스,"대전 지역업체, 불황 속 2조7천 억 수주 저력",https://www.straightnews.co.kr/news/articleView.html?idxno=300153,침체된 건설경기 속에서도 대전 지역업체들이 견조한 수주 실적을 이어가며 존재감을 드러냈다. 외지 대형 건설사가 주도하는 시장 환경에서도 하도급 참여율이 상승하는 등 선전이 이어지고 있다. 대전시는 2026년... 
2026-04-14,네이버뉴스,지난달 건설사 체감경기 석달만 상승…추가 여력은 제한적,http://www.snmnews.com/news/articleView.html?idxno=568028,한국건설산업연구원에 따르면 지난 3월 건설경기실사지수(CBSI)는 67.8로 전월 대비 5.3 포인트(p) 상승했으나 여전히 60선대에 머물면서 낮은 수준을 이어갔다. 앞서 CBSI는 연말 수주 증가에 지난해 12월(77.2)까지... 
2026-04-14,네이버뉴스,3월 건설경기 체감지수 기저효과에 소폭 상승했지만⋯여전히 '부정적',https://www.etoday.co.kr/news/view/2575681,14일 한국건설산업연구원(건산연)에 따르면 지난달 건설경기실사지수(CBSI)는 67.8로 전월보다 5.3포인트 상승했다. 다만 기준선인 100을 크게 밑도는 수준으로 건설 경기를 비관적으로 보는 시각이 여전히 우세한... 
2026-04-14,네이버뉴스,3월 건설사 체감경기 소폭 올랐지만 여전히 기준선 하회,https://www.sisajournal.com/news/articleView.html?idxno=369454,"3월 CBSI 67.8…건산연 ""회복은 제한적"" 지난달 건설사들의 체감경기지수가 소폭 상승했으나 여전히 기준선을 크게 밑돌며 부진한 수준을 이어간 것으로 나타났다. 14일 한국건설산업연구원(건산연)에 따르면, 올... "
2026-04-15,네이버뉴스,"[코스피·코스닥,고려아연 KCC건설 진흥기업 엔씨소프트 동원산업 한국...",https://www.public25.com/news/articleView.html?idxno=44188,"가로주택정비사업 시공사 선정 ▲ 엔씨소프트[036570] ""키프로스 계열사 주식 3190억원에 추가취득"" ▲동원산업(006040)=계열사 동원건설산업에 대한 1980억 원 채무보증 결정 ▲한국주강(025890)=삼성중공업과... "
2026-04-15,네이버뉴스,"[N2 모닝 경제 브리핑-4월 15일] 美증시, 미·이란 협상 재개 기대에 '상...",https://www.news2day.co.kr/article/20260414500074,가로주택정비사업 시공사 선정 - 동원산업(006040) : 계열사 동원건설산업에 대한 1980억원 채무보증 결정 - 고려아연(010130) : 최윤범 회장의 주요 계약 체결 주식 비율이 9.59%에서 7.60%로 감소 - 이노메트리(302430)... 
2026-04-14,네이버뉴스,입장 없는 조달청…킨텍스 의혹 확산,https://www.incheonilbo.com/news/articleView.html?idxno=1320887,12월 시공사와 공사계약이 체결됐는데 도서에 명시된 관급자재는 모두 일반 품목으로 경쟁 입찰을 통해 자재 구매·계약을 해야 한다는 것이다. 이 과정에서 조달청은 맞춤형 서비스에 따라 조달청은 관급 자재 선정을... 
2026-04-14,네이버뉴스,"스타필드 창원, 소상공인들과 상생협약 매듭…사업 '날개'",https://www.newsgn.com/news/articleView.html?idxno=546695,"지역 소상공인들과의 갈등, 시공사 선정 문제 등으로 몇 년 째 진척이 없던 '스타필드 창원'이 최근 활기를 띠고 있다. 사업 추진 과정에서 가장 큰 파열음을 불러온 스타필드 창원 측과 지역 소상공인과의 협의가 모두... "
2026-04-14,네이버뉴스,"서해선 운정역 연장 5월 첫 삽…파주시, 서부권 철도 접근성 개선 기대",https://www.globale.co.kr/news/articleView.html?idxno=37638,파주시와 국가철도공단이 '서해선 운정역 연장 사업'의 주요 공정 시공사 선정을 마치고 5월부터 본격 공사에 들어갈 예정이다. 수도권에 포함돼 있으면서도 교통 불편이 꾸준히 제기된 파주에서 이번 사업을 계기로... 
2026-04-14,네이버뉴스,대치선경도 가세 … 교육1번지 재건축 속도,https://www.mk.co.kr/article/12016654,"추진위는 올해 안에 조합 설립, 내년 상반기 시공사 선정을 목표로 절차를 밟아 나가고 있다. 대치미도는 최고 49층 37개 동 3914가구 규모의 대단지로 거듭날 예정이다. 규모가 상대적으로 빠른 대치쌍용1차는 지난 11일... "
2026-04-14,네이버뉴스,"엠디엠플러스, '포제스한강' 잭팟…당기순익 187% 폭증",http://www.wikileaks-kr.org/news/articleView.html?idxno=186290,올해 1월 시공사 선정 작업에 착수했으며 연내 착공 예정이다. 그렇다고는 해도 두 사업 모두 업무·숙박 시설 중심의 임대·매각 모델이어서 당장 분양 매출이 발생하는 구조가 아니다. 실제로 수익이... 
2026-04-15,네이버뉴스,"'중동발 쇼크' 공사비 대란 분수령…건설사, PF 채무 인수 '숨통'",https://www.ziksir.com/news/articleView.html?idxno=130718,◇재건축 현장 '공사비 줄다리기' 격화…시공사 목소리 커질 듯 업계는 이번 정부의 유권해석이 재건축·재개발 현장의 공사비 협상에 미칠 영향에 주목하고 있다. 시공사가 대외 변수에 따른 일정 변경의 정당성을... 
2026-04-14,네이버뉴스,재개발·재건축 공사비 급등 '사이렌'…건자재 재고 내달 바닥,https://www.housingherald.co.kr/news/articleView.html?idxno=61398,"재개발·재건축 등 정비사업에 중동전쟁發 '공사비 상승' 먹구름이 밀려오고 있다. 미-이란 전쟁으로 인한... 실제로 일부 시공사에서는 벌써부터 아스콘과 방수재, 레미콘 자재난을 경험하고 있다. 아파트 단지 내 도로를... "
2026-04-14,네이버뉴스,"창원시 신월 2구역 수십년 생 가로수 싹둑, 시민 목소리",http://www.breaknews.com/1200126,신월 2구역 재건축은 본질적으로 조합과 시공사의 수익 창출을 위한 영리 사업이다. 그동안 인근을 지나는 시민들과 주민들은 대규모 공사로 인한 소음과 먼지 등의... 
2026-04-15,네이버뉴스,[필드 뒷얘기] 뒤바뀐 마스턴 대주주의 지분 매각 전략...왜?,https://www.kbanker.co.kr/news/articleView.html?idxno=224709,"김 전 대표는 마스턴운용이 부동산 재개발 프로젝트 추진 목적으로 토지 매입에 나설 것이라는 계획을 보고... IB업계 한 관계자는 ""기억 남는 건 무신사의 성수동 오피스 개발 프로젝트 펀딩 정도""라고 말했다. 투자 운용도... "
2026-04-15,네이버뉴스,[Who Is ?] 최진민 귀뚜라미홀딩스 대표이사 회장,https://www.businesspost.co.kr/BP?command=article_view&num=435726,"경영복귀의 배경으론 업황난을 비롯 건설경기가 나빠지며 시장이 위축되는 등 실적불안이 이어진데다... 귀뚜라미그룹은 2006년 귀뚜라미범양냉방, 2008년 신성엔지니어링, 2009년 센추리 등을 인수해 원전용 냉동공조기... "
2026-04-15,네이버뉴스,"[오늘의 주요일정·15일] 행안부, 사이버보안관계장관회의",https://www.safetimes.co.kr/news/articleView.html?idxno=241868,한빛원전 현장점검(13:40 전남 영광 한빛원전) [사회] ▲ 오세훈 '명태균 여론조사 의혹' 사건 1심 속행... 접견-대한기계설비건설협회 부산시회 신임 회장단(의전실) ▲ 이장우 대전시장 11:00 2026년 동구 제46회... 
2026-04-15,네이버뉴스,"두산에너빌리티, 원자력·가스·복합 EPC서 영업익 1조 넘긴다",http://www.fnnews.com/news/202604130808427121,미국은 원전 건설에 총력을 기울이고 있으나 기자재 제조·시공 역량이 사실상 부재한 상태여서 한국과의 협력이 불가피하다. 웨스팅하우스가 추진 중인 북미·유럽 프로젝트(불가리아 코즐로두이 7·8호기... 
2026-04-15,네이버뉴스,트럼프 “달에 원전 세워라”…SMR 기업 ‘우주 개척 엔진’으로 수혜,https://www.g-enews.com/view.php?ud=202604150629105663e250e8e188_1,도널드 트럼프 미국 행정부가 달과 우주 궤도에 원자력 발전소를 건설하기 위한 구체적인 로드맵을... 2030년 ‘달 원전’ 현실화… 민간 혁신 결합한 국책 과제 이번 발표는 트럼프 대통령이 지난 2025년 12월 서명한... 
2026-04-15,네이버뉴스,"李정부 첫 에너지 플랜, 12차 전기본 밑그림은…수요 폭증·통상 문제 변...",https://www.kukinews.com/article/view/kuk202604140202,"아울러 신규 대형 원전 2기, SMR(소형모듈원전) 1기 등 계획이 12차 전기본에서도 반영돼 이어지는 만큼, 약 13년 안팎이 소요되는 건설 기간을 고려하면 목표 발전량 달성을 위한 적기 준공이 필수라는 제언도 나온다.... "
2026-04-15,네이버뉴스,롤스로이스 SMR 470㎿ 3기 착공… 英 에너지 자립 승부수,https://www.g-enews.com/view.php?ud=2026041421204165502bd56fbc3c_1,전체 기기의 90%를 공장에서 미리 제작·시험한 뒤 현장에서 조립하는 모듈 공법 덕분에 건설 비용과 일정의 불확실성을 크게 낮출 수 있다고 회사 측은 설명했다. 기존 대형 원전이 수십 년에 걸친 비용 초과와 공기... 
2026-04-15,네이버뉴스,"온타리오 ""비싼 전기 시대는 가라""",https://www.koreadaily.com/article/20260414121229298,발전소 건설 계획을 공개했다. 2030년부터 가동될 이 시설들이 생산하는 전력 가격은 킬로와트시(kWh)당 8.... 온타리오 전력공사(OPG)는 이미 피커링 원전 개보수 등을 이유로 원자력 단가를 내년까지 kWh당 21.4센트로 두 배... 
2026-04-15,네이버뉴스,‘셰일 신화’의 민낯… 이란발 전쟁 공포에 美 에너지 자립 무너졌다,https://www.g-enews.com/view.php?ud=202604141748472195fbbec65dfb_1,반면 미국은 원전 건설과 파이프라인 확충을 두고 당파적 이해관계에 매몰되어 정책 불확실성만 키웠다. 최근 원자력 분야에서 '기후대응(민주)'과 '국가안보(공화)'라는 접점을 찾으며 초당적 협력이 시작된 것은... 
2026-04-15,네이버뉴스,한국수력원자력 체코 글로벌 봉사단 대학생 15명 내외 모집,https://www.newsclaim.co.kr/news/articleView.html?idxno=3060718,원전건설 예정지인 트레비치 등지에서 노력봉사와 문화교류 활동을 이어왔다. 올해는 테믈린 지역을 처음 방문해 활동 범위를 확대한다. 한국문화 소개와 K-Food 체험 태권도 프로그램이 진행된다. 경주 청소년... 
2026-04-14,네이버뉴스,"""K-pop 들고 체코로""...한수원, 글로벌 봉사단 모집",https://www.newscj.com/news/articleView.html?idxno=3393778,원전건설 예정지 중심의 봉사활동과 문화교류를 병행하며 약 10년간 현지와의 우호 관계를 이어오고 있다. 단순한 사회공헌을 넘어 에너지 협력 기반을 다지는 '소프트 파워' 전략의 일환이라는 평가도 나온다. 이와 함께... 
2026-04-14,네이버뉴스,"한수원, 체코 글로벌봉사단 대학생 봉사단원 모집",https://www.busan.com/view/busan/view.php?code=2026041421580910133,"한수원은 2017년부터 매년 체코에 글로벌 봉사단을 파견해 원전건설 예정지인 트레비치 등지에서 노력봉사, 문화교류를 포함한 다양한 봉사활동을 10년째 꾸준히 펼치며 체코와의 우호적인 관계를 지속 유지하고 있다.... "
2026-04-14,네이버뉴스,"영덕군, 원자력산업 육성 조례 추진",https://www.getnews.co.kr/news/articleView.html?idxno=867762,군의회는 지난 2월 24일 임시회에서 '신규 원자력발전소 건설 유치 동의안'을 재적의원 전원 찬성으로 의결했다. 이어 3월 23일에는 신규 원전 유치 촉구 건의문을 채택하며 지역 차원의 강력한 유치 의지를 공식화한 바... 
2026-04-14,네이버뉴스,[경남도지사 후보 인터뷰] 더불어민주당 김경수 예비후보,http://www.knnews.co.kr/news/articleView.php?idxno=1539387,"남해안 우주항공산업벨트와 사천·진주 우주항공복합도시 건설, 재생에너지와 함께 미래 에너지산업의 주역이 될 소형원전(SMR) 특화단지와 메가특구 조성, 부울경 공동으로 시스템 반도체 산업을 육성하는 등 경남과... "
2026-04-14,네이버뉴스,"영덕군, 원전 넘어 에너지 거점도시 인티그레이션 조례제정 추진… 지역...",https://www.thebk.co.kr/news/articleView.html?idxno=308967,"AI 發 전력수요의 폭주로 인해 원전이 이의 해결책으로 부상하고 있고, 정부의 추가 원전 건설을 두고 그 입지에 귀추가 주목되고 있는 가운데 9년 전 원전 입지로 선정됐다가 문재인 정부의 脫 원전 정책의 전환으로... "
2026-04-14,네이버뉴스,"한수원 새울3호기, 원전 가동 ‘첫 관문’ 넘었다…하반기 상업운전 목...",https://www.wikitree.co.kr/articles/1131543,"최근 중동 정세 불안으로 에너지 수급 안정성이 다시 부각되는 가운데, 대형 신규 원전의 가동 절차가 본궤도에 오르면서 전력 공급 안정성 강화에 대한 기대도 커지고 있다. 한국수력원자력은 12일 울산 울주군에 건설... "
2026-04-14,네이버뉴스,"영덕군, 군의회와 협력해 「원자력산업 육성 및 지원 조례」 제정 본격...",https://www.dkilbo.com/news/articleView.html?idxno=541077,"영덕군은 원전 건설을 시작으로 에너지 공공기관 유치와 연구·산업 기능 집적을 거쳐, 지역을 첨단 에너지산업 클러스터이자 '국가 에너지 수도'로 도약시킨다는 전략이다. 황인수 영덕부군수는 군의회와 긴밀히... "
2026-04-14,네이버뉴스,구역전기·자가발전도 ‘전기본 안으로’…정부 통제 확대,https://www.ekn.kr/web/view.php?key=20260414020536328,"실제로 최근 포스코가 포항에 약 600MW 규모 LNG 자가발전소 건설을 추진하는 과정에서, 인허가 대상이... 업계에서는 신규 대형 원전과 일부 SMR(소형모듈원전)을 제외하면, 사실상 재생에너지 중심으로만 신규 설비가... "
2026-04-14,네이버뉴스,"""K-문화로 세계와 소통""…한수원, 체코 봉사단원 15명 모집",https://www.nocutnews.co.kr/news/6502361?utm_source=naver&utm_medium=article&utm_campaign=20260414064606,"한수원은 2017년부터 매년 체코에 글로벌 봉사단을 파견해 원전 건설 예정지인 트레비치 등을 중심으로 다양한 봉사와 문화교류 활동을 지속해 왔다. 지난해에는 경주 청소년 오케스트라팀을 파견했으며, 올해는 경주시... "
2026-04-14,네이버뉴스,"영덕군, 군의회와 협력 ‘원자력산업 육성 및 지원 조례’ 제정 본격 추...",https://www.nspna.com/news/?mode=view&newsid=809646,"원전 입지 지역은 발전소 건설을 시작으로 에너지 공공기관 유치, 연구·산업 기능 집적을 거쳐 첨단 에너지산업 클러스터로 확장되는 단계적 발전 구조를 보여 왔다. 이러한 흐름 속에서 영덕군은 신규 원전 유치를... "
