date,source,title,link,description
2026-04-21,네이버뉴스,"포스코, 인도 일관제철소 합작투자 건설...해외 제철소 투자로 미래 경...",https://www.kbsm.net/news/view.php?idx=516766,"부지는 철광석 광산과 인접해 있고 효율적인 물류·전력·인프라 활용이 가능한 오디샤주 내 부지를 확보하였고, 착공 후 48개월의 건설 기간을 거쳐 2031년 준공을 목표로 하고 있다.양사는 포스코의 저탄소 조업... "
2026-04-21,네이버뉴스,"중앙대, '미래 AX 공학관' 착공 본격화…2029년 준공 목표",https://www.bizwork.co.kr/news/articleView.html?idxno=414842,간삼건축이 설계한 중앙대학교 '205관(미래 AX 공학관)'이 기공식을 열고 본격적인 착공 절차에 돌입했다. 중앙대는 첨단 공학 인프라 확충을 통해 연구 중심 대학 경쟁력을 강화한다는 전략이다. 중앙대는 최근... 
2026-04-21,네이버뉴스,"포스코 장인화, 22년 숙원 인도 일관제철소 본격화···JSW와 8조원대 합...",https://www.smartbizn.com/news/articleView.html?idxno=142296,"부지는 철광석 광산과 가깝고 물류·전력 인프라 활용이 유리한 오디샤주로 확정됐으며, 착공 후 48개월의 건설 기간을 거쳐 2031년 준공을 목표로 한다. JSW스틸의 조강 생산 목표인 5000만t 체제 구축 계획과도 맞닿아... "
2026-04-21,네이버뉴스,"삼성SDI 'ESS 영토 확장' 동행하는 한중엔시에스, 인디애나 신공장 기대...",https://www.pinpointnews.co.kr/news/articleView.html?idxno=447202,데이터센터 인프라 전환의 직접적인 수혜주로 부각되며 시장의 매수세가 집중되고 있다. 에너지저장장치(ESS) 냉각 시스템 전문기업 한중엔시에스는 미국 인디애나주에 ESS 부품 공장을 착공하며 북미 시장 공략에... 
2026-04-21,네이버뉴스,"KNC, 인도 첸나이에 제3공장 기공···현지 생산 거점 확대 나선다",https://www.smartbizn.com/news/articleView.html?idxno=142297,"생산 인프라 확대에 나섰다고 21일 밝혔다. KNC는 2007년 설립 이후 CNG와 LPG 기반의 저공해차 특장 생산에서... 2026년 4월 착공해 10월 준공, 2027년 1월 양산을 목표로 하고 있다. 연간 20만 병의 천연가스(CNG) 자동차 연료... "
2026-04-21,네이버뉴스,"포스코, 인도에 일관제철소…공급망 재편 속 ‘승부수’",https://www.news2day.co.kr/article/20260421500090,"착공 후 약 48개월의 건설 기간을 거쳐 2031년 준공을 목표로 하고 있다. 철광석 광산과 인접한 입지와 물류·전력 인프라를 활용해 생산 효율을 높인다는 구상이다. 포스코의 저탄소 조업 기술과 스마트팩토리 역량, JSW의... "
2026-04-21,네이버뉴스,안후이성의 성장 엔진: 신에너지차·첨단기술·현대서비스업의 3박자 조...,http://dream.kotra.or.kr/kotranews/cms/news/actionKotraBoardDetail.do?SITE_NO=3&MENU_ID=80&CONTENTS_NO=2&bbsGbn=242&bbsSn=242&pNttSn=240216,"특히 2000개 이상의 10억 위안 이상 대형 프로젝트를 신규 착공하고, 성급 중점 프로젝트에 6000억 위안... 계획과 인프라 리츠(REITs) 발행 지원을 통해 자금 조달을 돕고자 한다. 과학기술 혁신과 민생 개선을... "
2026-04-21,네이버뉴스,"김제시, 문화기반 확충·시민참여 콘텐츠 확대...문화도시 도약",https://www.newspim.com/news/view/20260421000271,전북 김제시가 문화 인프라 확충과 시민 참여형 콘텐츠를 동시에 강화하며 '시민 중심 문화도시'로의... 현재 착공 준비가 진행 중이며 완공 시 시민 문화활동과 예술 창작의 핵심 거점 역할이 기대된다. '굿만경... 
2026-04-21,네이버뉴스,"유영하 ""박근혜, 유세차 유세? 가능성 0%…단일화 절대 없어"" [뉴스캐비...",https://www.imaeil.com/page/view/2026042109323348471,6개 들어왔는데 아직 착공도 안 됐어요. 첫 삽도 안 떴어요. 필요한 전략과 절대적으로 부족해요. 대정부 질의... 대구가 관광 인프라를 만든다는 하지만 사실 볼거리가 없지 않습니까? 부족합니다. 그래서 저희도 공약에... 
2026-04-21,네이버뉴스,"포스코, 600만t 인도 합작제철소 본궤도…JSW스틸 맞손",https://www.sentv.co.kr/article/view/sentv202604210035,"제철소는 철광석 광산과 가깝고 물류·전력 등 인프라 활용이 용이한 인도 오디샤주에 들어설 예정으로, 착공 후 48개월의 공사를 거쳐 2031년 준공 목표다. 포스코는 지난 2004년부터 여러차례에 걸쳐 인도에 상공정... "
2026-04-21,네이버뉴스,"포스코, 인도에 600만t 합작제철소 짓는다…5.3조 투자",https://www.nocutnews.co.kr/news/6505440?utm_source=naver&utm_medium=article&utm_campaign=20260421092325,"부지는 철광석 광산과 인접해 있고 효율적인 물류·전력·인프라 활용이 가능한 오디샤주 내 부지를 확보하였고, 착공 후 48개월의 건설 기간을 거쳐 2031년 준공을 목표로 하고 있다. 두 회사는 포스코의 저탄소 조업... "
2026-04-21,네이버뉴스,"로스앤젤레스 국제공항(LAX), 통합 렌터카 센터 개장",https://www.cnbizm.com/news/articleView.html?idxno=300661,"핵심 인프라로, 공항 내에 분산되어 있던 12개 렌터카 업체를 하나의 공간으로 통합했다. 이를 통해... 해당 프로젝트는 2019년 9월 착공 이후 2020년 3월 첫 콘크리트 타설을 시작으로 2021년 7월 골조 완공... "
2026-04-21,네이버뉴스,"포스코, 인도 일관제철소 합작투자 건설",https://www.cnbnews.com/news/article.html?no=790238,"부지는 철광석 광산과 인접해 있고 효율적인 물류·전력·인프라 활용이 가능한 오디샤주 내 부지를 확보하였고, 착공 후 48개월의 건설 기간을 거쳐 2031년 준공을 목표로 하고 있다. 양사는 포스코의 저탄소 조업 기술... "
2026-04-21,네이버뉴스,"포스코, 인도 일관제철소 합작투자 본격화…미래 경쟁력 '승부수'",http://www.ferrotimes.com/news/articleView.html?idxno=47550,"제선, 제강, 열연, 냉연·도금공정을 갖춘 일관 생산체제를 구축할 예정으로, 착공 후 약 48개월의 공사 기간을 거쳐 2031년 준공이 목표다. 부지는 철광석 광산과 인접해 있고 물류 및 전력 인프라 활용이 용이한... "
2026-04-21,네이버뉴스,"포스코, 인도 일관제철소 합작투자 건설…""미래 경쟁력 확보 승부수""",https://www.epnc.co.kr/news/articleView.html?idxno=400652,부지는 철광석 광산과 인접해 있고 효율적인 물류·전력·인프라 활용이 가능한 오디샤주 내 부지를 확보했으며 착공 후 48개월의 건설 기간을 거쳐 2031년 준공을 목표로 하고 있다. 양사는 포스코의 저탄소 조업... 
2026-04-21,네이버뉴스,"영양군, 국도 31호선 입암~영양 선형개량 착공 임박",https://www.joongdo.co.kr/web/view.php?key=20260421010006327,교통 인프라 부족으로 '사각지대'로 꼽혀온 지역 여건이 개선될지 주목된다. 부산지방국토관리청은 지난 17일 조달청에 의뢰한 '청송 진보~영양 입암 국도건설공사' 입찰 개찰을 마쳤다. 국토교통부의 제5차 국도·국지도... 
2026-04-21,네이버뉴스,"포스코, 인도 1위 철강사 JSW와 '600톤 규모' 제철소 건설",http://www.enewstoday.co.kr/news/articleView.html?idxno=2421146,부지는 철광석 광산과 인접해 물류 및 전력 인프라 활용이 뛰어난 인도 오디샤주로 확정됐다. 착공 후 48개월의 건설 기간을 거쳐 오는 2031년 준공을 목표로 하고 있다. 특히 양사는 포스코의 저탄소 조업 기술 및... 
2026-04-21,네이버뉴스,"포스코, 인도에 600만 톤 규모 제철소 짓는다",https://www.cnbizm.com/news/articleView.html?idxno=300638,부지는 철광석 광산과 인접해 있고 효율적인 물류·전력·인프라 활용이 가능한 오디샤주 내 부지를 확보했다. 착공 후 48개월의 건설 기간을 거쳐 2031년 준공을 목표로 하고 있다. 양사는 포스코의 저탄소 조업 기술 및... 
2026-04-21,네이버뉴스,'여수 밤바다' 소제지구 '마수걸이' 주택공급,https://news.bizwatch.co.kr/article/real_estate/2026/04/20/0044,"지난 2021년 4월 택지개발 공사가 착공됐고 2022년 6월 보상(수용재결)이 완료됐다. 올해 12월 택지지구 조성... 하나로마트와 여수시청, 여수시립쌍봉도서관, CGV 등 인프라도 마련돼 있다. 남해와 맞닿은 이점을 살려... "
2026-04-21,네이버뉴스,"포스코, 인도 일관제철소 착수…고성장 시장 공략 '선봉'",https://www.ezyeconomy.com/news/articleView.html?idxno=234883,"부지는 철광석 자원이 풍부한 오디샤주에 마련되며, 물류와 전력 인프라를 활용해 효율성을 극대화할 계획이다. 착공 후 약 48개월의 공사를 거쳐 2031년 준공을 목표로 한다. 특히 포스코는 저탄소 조업 기술과... "
2026-04-21,네이버뉴스,"포스코, 인도 600만톤 일관제철소 착수...JSW와 합작해 '현지화' 전략 본...",https://www.joongangenews.com/news/articleView.html?idxno=513338,"부지는 철광석 광산과 인접한 인도 오디샤주에 확보됐으며, 착공 후 약 48개월의 공사를 거쳐 2031년 준공이 목표다. 양사는 포스코의 저탄소 조업 기술과 스마트팩토리 역량에 JSW의 재생에너지 인프라를 결합해 일부... "
2026-04-21,네이버뉴스,"포스코, 인도 일관제철소 합작투자 건설...JSW스틸과 JVA 체결",https://www.wikitree.co.kr/articles/1132565,"부지는 철광석 광산과 인접해 있고 효율적인 물류·전력·인프라 활용이 가능한 오디샤주 내 부지를 확보하였고, 착공 후 48개월의 건설 기간을 거쳐 2031년 준공을 목표로 하고 있다. 양사는 포스코의 저탄소 조업... "
2026-04-21,네이버뉴스,"포스코, 20년 숙원 풀었다... 인도 1위 JSW와 600만톤 제철소 건설 본격...",https://www.pointe.co.kr/news/articleView.html?idxno=78593,착공 후 48개월의 건설 기간을 거쳐 2031년 준공을 목표로 한다. 이번 협력은 양사의 강력한 신뢰를 바탕으로... 합작법인은 포스코의 스마트팩토리 역량과 JSW의 재생에너지 인프라를 결합해 인도 정부의 '그린스틸... 
2026-04-21,네이버뉴스,"포스코, 인도 일관제철소 합작투자…글로벌 경쟁력 강화 '승부수'",https://www.ilyoseoul.co.kr/news/articleView.html?idxno=515926,"부지는 철광석 광산과 인접해 물류·전력 인프라 활용이 용이하며, 착공 후 48개월의 건설 기간을 거쳐 2031년 준공을 목표로 한다. 포스코는 저탄소 조업 기술과 스마트팩토리 역량을, JSW는 재생에너지 인프라를... "
2026-04-21,네이버뉴스,"미래 승부수 던진 포스코, 印 오디샤州에 조강 600만 톤 규모 일관제철...",https://www.bizwork.co.kr/news/articleView.html?idxno=414817,부지는 철광석 광산과 인접해 있고 효율적인 물류·전력·인프라 활용이 가능한 오디샤주 내 부지를 확보했다. 착공 후 48개월의 건설 기간을 거쳐 2031년 준공 목표다. 양사는 포스코의 저탄소 조업 기술 및... 
2026-04-21,네이버뉴스,"포스코, 인도 제철소 20년 숙원 풀었다...600만톤 일관제철소 본격화",https://www.pinpointnews.co.kr/news/articleView.html?idxno=447157,"제선, 제강, 압연 등 전 공정을 갖춘 생산체제로 구축되며, 착공 후 약 4년의 공사를 거쳐 2031년 준공을 목표로 한다. 해당 부지는 철광석 광산과 인접해 원료 조달이 용이하고, 물류·전력 인프라도 갖춰진 지역으로... "
2026-04-21,네이버뉴스,"포스코, 인도 JSW와 600만톤 규모 일관제철소 짓는다",http://www.fntimes.com/html/view.php?ud=202604210804363377fd637f543_18,"제철소는 제선·제강·열연·냉연 및 도금 공정을 갖춘 고로 기반 설비로, 착공 후 약 48개월의 건설 기간을 거쳐 2031년 준공을 목표로 하고 있다. 부지는 철광석 광산과 인접해 있고 효율적인 물류·전력·인프라 활용이... "
2026-04-21,네이버뉴스,"현대로템, 14조 규모 '다낭 메트로' 급물살…THACO '착공 공식화'",https://www.kpinews.kr/newsView/1065567665453801,현지 최대 기업인 타코(THACO) 그룹이 대규모 투자를 확정 짓고 구체적인 착공 일정을 공식화하면서 사업... 철도 인프라 수주전에서도 유리한 고지를 점할 것으로 분석된다. 응우옌 마잉 훙 다낭시 주석은 관련... 
2026-04-21,네이버뉴스,[기획] '중동발 위기' 건설업 살려라…국토부·금융위 합심,https://www.m-i.kr/news/articleView.html?idxno=1366334,"전쟁 이후 가장 큰 우려로는 공사비 상승 압력이 다시 커져 높은 수준에 고착되는 상황이 꼽힌다. 박 실장은 ""건설업계는 충격 최소화를 위한 공공·민간공사 전반의 계약 관리가 무엇보다 중요하다""며 ""정부도 물가 변동... "
2026-04-21,네이버뉴스,"한화 건설부문, 마스턴투자운용과 ‘금융·시공 결합’ 부동산 개발사업...",https://www.seoul.co.kr/news/economy/estate/2026/04/21/20260421500139?wlog_tag3=naver,"한화 건설부문은 기획·설계·시공 역량으로 공사비와 공사기간을 사전에 검토하는 프리콘 서비스를 적용해 사업성을 조기에 검증하고, 개발사업의 설계 및 시공 전반을 수행한다. 마스턴투자운용은 투자자 모집을 통해... "
2026-04-21,네이버뉴스,"""비용 계속 오른다"" 치솟은 분양가, 아직 '천장' 아닐 수도",https://www.rcast.co.kr/news/articleView.html?idxno=30574,"공사비지수, 역대 최고 수준 '고착화' 한국건설기술연구원 산하 공사비원가관리센터에 따르면 올해 1월 건설공사비지수는 133.3으로 전년 동월 대비 1.7% 올라 역대 최고 수준을 유지하고 있습니다. 2020년 수치를 100으로... "
2026-04-21,네이버뉴스,"정부, 지역주택조합 제도 손질...서희건설 수혜",https://www.g-enews.com/view.php?ud=202604211350051277ac06cade6e_1,하지만 현재 서희건설은 지역주택조합 사업으로 상장 폐지 심사를 받고 있다. 부사장 A씨가 경기도 용인의 한 지역주택조합의 조합장과 공모해 공사비를 늘려주는 대가로 13억7500만원을 착복한 혐의로 재판을 받고... 
2026-04-21,네이버뉴스,[부동산 소식] 중동전쟁·미분양 적체.. 대구 주택시장 불확실성 여전,https://news.bbsi.co.kr/news/articleView.html?idxno=4079581,▷정시훈 기자: 중동사태 여파로 특히 건설업계에서의 원자재 수급차질과 공사비 상승 우려가 커지면서 건설사의 유동성 위기가 확산되는 것을 막기 위해서 국토교통부와 대구시에서도 중동전쟁 때문에 위기에 처한... 
2026-04-21,네이버뉴스,"강원도, 건설업계 간담회서 ""자재비 반영·공공공사 확대"" 건의",https://www.shinailbo.co.kr/news/articleView.html?idxno=5013399,"간담회에서는 자재 가격 상승 대응과 공사비 반영, 지역 건설기업 경영 안정 대책, 투자 확대 방안 등이 주요 의제로 논의됐다. 강원도는 공공공사 비중이 높은 지역 특성을 강조하며 ▲자재가격 급등 시 공사비 신속 반영... "
2026-04-21,네이버뉴스,"한화 건설부문, 금융기관과 부동산 개발 경쟁력 강화 '맞손'",https://it.chosun.com/news/articleView.html?idxno=2023092160683,한화 건설부문은 기획·설계·시공 역량을 바탕으로 공사비와 공사기간을 사전 검토하는 프리콘(Pre-Construction) 서비스를 적용해 사업성을 조기 검증하는 역할을 맡는다. 또 개발사업의 설계·시공 전반을 수행한다.... 
2026-04-21,네이버뉴스,"""갈등 관리 대상""… 행복청, 예방형 행정으로 신뢰 높인다",https://cc.newdaily.co.kr/site/data/html/2026/04/21/2026042100170.html,건설청(행복청)이 갈등을 단순한 장애물이 아닌 정책 완성도를 높이는 과정으로 보고 체계적으로 관리하는 ‘예방형 행정’을 선도하고 있다. 대표 사례는 2024년 세종공동캠퍼스 공사 중단 사태다. 공사비 증액을 둘러싼... 
2026-04-21,네이버뉴스,"HUG, 내년 5월까지 '보증료 한시 할인·PF보증 특례 연장'...건설업계 금...",https://www.g-enews.com/view.php?ud=20260421131155255a9fc143920_1,"겪는 건설업계와의 상생을 위해 이 같은 내용의 '공공성 강화방안'을 추진하기로 했다. 이번 방안은 정부... 아울러, 재건축·재개발 등 정비사업 추진 시 소요되는 공사비 등 사업비를 원활하게 조달할 수 있도록 돕는... "
2026-04-21,네이버뉴스,지역주택조합 사업계획승인 토지확보 80%로 완화,https://www.naeil.com/news/read/586052?ref=naver,"조합원 피해 방지를 위해 대행업 등록제를 도입하고, 공사비 증액 문제도 전문기관 검증을 거치도록 해... 우선 사업계획승인을 위한 토지 소유권 확보 기준을 종전 95%에서 일반 주택건설사업과 동일한 80%로 완화하기로... "
2026-04-21,네이버뉴스,"태평3구역, 공동사업시행 건설업자 입찰 수의계약 전환",https://www.arunews.com/news/articleView.html?idxno=61867,"도급 공사비 단가는 3.3㎡당 735만원(VAT 별도) 이하로 제한했다. 총 공사기간은 동절기를 포함해 51개월이다. 철거공사가 9개월, 본공사에 42개월이 소요된다. 다만 총 공사 기간은 ±4개월의 범위 내에서 건설업자가... "
2026-04-21,네이버뉴스,"한화 건설부문, 마스턴투자운용과 부동산 개발사업 협력 추진한 내용은...",http://www.newsworker.co.kr/news/articleView.html?idxno=422813,㈜한화 건설부문은 프리콘(Pre-Construction) 서비스를 통해 공사비와 공사기간을 사전에 검토하고 사업성을 조기에 검증하는 역할을 수행한다. 또한 개발사업의 설계와 시공 전반을 담당한다. 마스턴투자운용은 투자자... 
2026-04-21,네이버뉴스,"[아유경제_재건축] '시공자 선정' 앞둔 파장1구역 재건축, 북수원 핵심 ...",http://www.areyou.co.kr/news/articleView.html?idxno=93466,"공사비를 비롯해 기술력, 시공 실적, 하자보수 이력, 계약 조건의 투명성 등을 종합적으로 고려해 시공자를 선정할 계획이다. 조합원들에게 쾌적한 주거환경을 제공함과 동시에 재산 가치 극대화를 실현할 수 있는 건설사... "
2026-04-21,네이버뉴스,유가·환율 쇼크에 수입물가 급등… 먹거리·공사비 비상,https://m.skyedaily.com/news_view.html?ID=302817,"원유와 곡물, 비료 원료, 사료, 건설자재 가격이 함께 뛰면서 향후 생활물가와 공사비 전반의 추가 상승 압력이 커질 것이라는 우려가 나온다. 21일 한국은행과 업계에 따르면 3월 수입물가지수는 169.38로 전월보다... "
2026-04-21,네이버뉴스,"장동혁, 지선 앞두고 한국노총 방문 … ""63년 만 첫 방문, 노동 존중 상...",https://www.newdaily.co.kr/site/data/html/2026/04/21/2026042100164.html,"이어 ""어느 한 회사가 현장을 주 5일로 하고 싶다고 해도 다른 회사가 토요일까지 일하겠다고 하면서 입찰로 들어오면 공기도 짧고 공사비도 싸지기에 어떠한 회사도 그렇게 할 수 없다""며 ""건설 현장은 입찰 때부터 주... "
2026-04-21,네이버뉴스,"""내 집 마련이 희망고문 되지 않게""...지주택 대책, 청년 세대엔 어떤 변...",http://www.dailypop.kr/news/articleView.html?idxno=98190,"사업계획승인을 위한 토지 소유권 확보기준을 기존 95%에서 일반적 주택건설사업과 동일한 80%로 완화해 정상... 시공사가 공사비 증액을 요구할 경우 한국부동산원 등 전문기관의 검증을 의무화하고, 표준도급계약서를... "
2026-04-21,네이버뉴스,전문건설 줄폐업 “일해도 돈이 안 돈다”…공사대금 회수 지연에 흔들,https://www.mediapen.com/news/view/1094706,외형상 일감이 완전히 끊기지 않았더라도 공사비가 실제 현금으로 전환되는 과정에서 차질이 생기면 곧바로 유동성 위기로 이어질 수 있어서다. 업계 안팎에서는 전문건설의 위기가 “일이 없어서”만이 아니라 “일을... 
2026-04-21,네이버뉴스,"HUG, 주택분양보증 보증료 내년 5월까지 30% 할인",https://biz.heraldcorp.com/article/10721945?ref=naver,"PF대출보증 사업장, 최대 60% 주택도시보증공사(HUG)가 중동전쟁 상황으로 어려움을 겪는 건설업계와의... 아울러 재건축·재개발 등 정비사업 추진 시 소요되는 공사비 등 사업비를 원활하게 조달할 수 있도록 돕는... "
2026-04-21,네이버뉴스,"마스턴투자운용, 한화 건설부문과 '부동산 개발' 공동 추진",https://www.econovill.com/news/articleView.html?idxno=738088,"한화 건설부문은 기획·설계·시공 역량을 바탕으로 공사비와 기간을 사전에 검토하는 프리콘(Pre-Construction) 서비스를 적용해 사업성을 조기에 검증한다. 아울러 설계 및 시공 전반을 수행하며, 선제적인 리스크 관리와... "
2026-04-21,네이버뉴스,"한화 건설부문-마스턴투자운용, 부동산 개발 '동맹'… 금융·시공 결합",http://www.financialreview.co.kr/news/articleView.html?idxno=41797,한화 건설부문은 풍부한 설계·시공 경험을 바탕으로 공사비와 기간을 사전에 검토하는 '프리콘(Pre-Construction)' 서비스를 적용해 사업성을 조기에 검증하고 시공 전반을 책임진다. 마스턴투자운용은 최적의 투자 구조를... 
2026-04-21,네이버뉴스,"한화 건설부문, 마스턴투자운용과 MOU… 개발사업 공동 추진",https://www.thepublic.kr/news/articleView.html?idxno=301886,한화 건설부문은 기획·설계·시공 역량을 바탕으로 공사비 및 공사기간을 사전에 검토하는 프리콘(Pre-Construction) 서비스를 적용해 사업성을 조기에 검증하는 역할을 맡는다. 또한 개발사업의 설계 및 시공 전반을... 
2026-04-21,네이버뉴스,"헤그세스 美 국방 ""기후 헛소리"" 일축, 7조 들여 홍수벽 대비",http://www.impacton.net/news/articleView.html?idxno=18615,"재건 공사비 6억400만달러(8800억원)를 포함, 기지 완전 재건에는 49억달러(약 7조원)가 소요될 것으로... 이 재건 사업은 미 국방부 역사상 최대 규모의 군사 건설 프로젝트로, 완공 시 F-35 전투기 70여 대를 운용하는 3개... "
2026-04-21,네이버뉴스,"""예방 행정으로 신뢰 확보""…행복청 갈등관리 주목",https://www.news1.kr/realestate/general/6143550,행정중심복합도시건설청(행복청)이 갈등을 '관리 대상'으로 전환하며 공공행정의 새 방향을 제시했다.... 원자재 가격 상승과 공기 단축 압박이 겹치며 한국토지주택공사(LH)와 시공사 간 공사비 갈등이 격화됐고 공사가... 
2026-04-21,네이버뉴스,"“원수에게 권한다”는 지주택 사업, 좀 나아질까… ‘알박기’ 차단 나...",https://www.mk.co.kr/article/12022633,시공사와 공사비 분쟁도 예방 조합 ‘깜깜이 운영’ 방지책도 마련 정부가 지역주택조합(지주택) 사업 추진... 주택건설사업과 동일한 80%로 완화한다. 시공사나 업무 대행사가 보유한 토지는 보유 기간에 상관없이 매도... 
2026-04-21,네이버뉴스,"한화 건설부문, 마스턴투자운용과 손잡고 '금융 결합형' 부동산 개발 강...",https://www.pointe.co.kr/news/articleView.html?idxno=78602,이번 협약에 따라 한화 건설부문은 기획·설계·시공 역량을 바탕으로 공사비와 기간을 사전에 검토하는 '프리콘(Pre-Construction)' 서비스를 적용해 사업성을 조기에 검증한다. 마스턴투자운용은 투자자 모집과 자금 조달... 
2026-04-21,네이버뉴스,"한화 건설부문, 마스턴투자운용과 손잡았다…개발사업 '금융·시공 결합...",https://www.fetv.co.kr/news/articleView.html?idxno=300833,협약에 따라 한화 건설부문은 기획·설계·시공 역량을 바탕으로 사업 초기 단계에서 공사비와 공사 기간을 사전 검토하는 프리콘(Pre-Construction) 서비스를 제공한다. 이를 통해 사업성을 조기에 점검하고 설계·시공 전반을... 
2026-04-21,네이버뉴스,"한화 건설부문, 마스턴투자운용과 맞손…개발사업 판 키운다",https://www.viva100.com/article/20260421500367,한화 건설부문은 기획·설계·시공 역량을 바탕으로 공사비 및 공사기간을 사전에 검토하는 프리콘(Pre-Construction) 서비스를 적용해 사업성을 조기에 검증하는 역할을 맡는다. 또한 개발사업의 설계 및 시공 전반을... 
2026-04-21,네이버뉴스,"㈜한화 건설부문, 마스턴투자운용과 공동 개발… 통합 사업 모델 구축",https://www.gokorea.kr/news/articleView.html?idxno=864187,㈜한화 건설부문은 기획·설계·시공 역량을 바탕으로 공사비와 공사 기간을 사전에 검토하는 프리콘(Pre-Construction) 서비스를 적용해 사업성을 검증하고 설계·시공을 담당한다. 마스턴투자운용은 투자자 모집과 자금... 
