date,source,title,link,description
2026-05-05,네이버뉴스,전쟁에 정비사업 붐에...건설사 1분기 수주 92%는 '국내',http://www.fnnews.com/news/202605041435492062,"5일 건설업계에 따르면 삼성물산, 현대건설, 대우건설, DL이앤씨, GS건설의 올해 1·4분기 국내 수주 비중 평균은 92.4%에 달했다. 국내 수주 비중이 가장 높은 곳은 95%를 기록한 대우건설이다. DL이앤씨와 삼성물산... "
2026-05-05,네이버뉴스,“일단 들어가면 6억”…정비사업 판 키운 글로벌 설계사 경쟁 [부동산...,https://biz.heraldcorp.com/article/10731064?ref=naver,"현대건설은 압구정5구역 수주를 위해 2007년 프리츠커상 수상자인 리처드 로저스가 설립한 ‘알에스에이치피(RSHP)’와 협업을 추진 중이다. RSHP는 파리의 퐁피두센터, 런던의 원 하이드 파크를 설계한 곳으로... "
2026-05-05,네이버뉴스,"[인물] 기부·입법·현장으로 새긴 4년···배현주, 첫 지역구 도전",https://www.pointe.co.kr/news/articleView.html?idxno=79126,2019년 7월 폭우에 고립된 동료를 구하러 지하 터널로 들어갔다 숨진 뒤 2023년 의사자로 인정받은 현대건설 직원 고(故) 안준호씨(당시 28세)의 아내이기도 하다. 남편을 떠나보내고 열흘 뒤 임신 사실을 알게 된 그는 홀로... 
2026-05-05,네이버뉴스,대형 건설사 1분기 성적표…원가 개선 여부에 '희비' 교차,http://www.edaily.co.kr/news/newspath.asp?newsid=02341926645445968,"반면 현대건설과 삼성물산 건설부문은 외형과 수익성이 동시에 둔화되며 대조적인 모습을 보였다. 현대건설은 1분기 매출 6조2813억원, 영업이익 1809억원으로 각각 전년 동기 대비 15.8%, 15.4% 감소했다. 대형 공사 매출... "
2026-05-05,네이버뉴스,[비바100] ‘어디’ 보다 ‘어떻게’ 사느냐… 커뮤니티가 아파트 경쟁...,https://www.viva100.com/article/20260505500050,"현대건설은 대표적으로 입주민 맞춤형 주거 서비스 ‘H 컬처클럽’을 도입해 커뮤니티 경쟁력 강화에 나서고 있다. 단지 내 영화관과 도서관, 피트니스, 수영장 등 대형 시설을 갖추는 것은 물론, 전문 업체와 협업해... "
2026-05-05,네이버뉴스,"[이슈분석] 전쟁 뒤 '제2 중동의 봄' 올까…건설업계, 17조 재건 기회에...",https://www.thepublic.kr/news/articleView.html?idxno=303135,"세부적으로 보면, 카타르·이란·UAE 등에 위치한 가스 시설에는 현대중공업, 현대건설, DL이앤씨, GS건설, 삼성 E&A 등이 시공에 참여했고, 바레인·쿠웨이트·사우디 등의 정유시설에는 삼성E&A, 대우건설, 현대중공업... "
2026-05-05,네이버뉴스,사막 위 태양광 발전소…韓 건설사 기술 눈길[짤막영상],https://www.newsis.com/view/NISX20260504_0003616436,이런 가운데 삼성물산 건설부문이 태양광 발전소 건설 과정을 소개한 영상이 온라인에서 관심을 끌고 있다. 5일 삼성물산 건설부문은 최근 자사 유튜브 채널에 '건설사가 사막에 해바라기 심는 방법'이라는 제목의 영상을... 
2026-05-05,네이버뉴스,[르포] 버스 타려면 13분 걸어야… 안양 에버포레 자연& e편한세상 ‘입...,https://www.viva100.com/article/20260504500668,"경기주택도시공사(GH)와 DL이앤씨가 공동으로 공급하는 이 단지는 2개 블록, 총 404가구 규모로 조성된다. 민간분양인 A1블록이 지하 2층~지상 최고 4층 규모의 전용면적 95㎡ 60가구, 공공분양으로 공급되는 A2블록이 지하... "
2026-05-05,네이버뉴스,DL이앤씨 '압구정5구역' 물가인상 없는 공사비 확정 제안,http://www.sisacast.kr/news/articleView.html?idxno=95582,"사진=DL이앤씨  DL이앤씨는 압구정5구역에 물가인상 부담 없는 공사비를 확정 제안했다고 4일 밝혔다. 이는 조합이 제시한 예정공사비 대비 일정금액 낮춘 금액이다. DL이앤씨는 적당한 공사비를 제시함은 물론, 사업비가... "
2026-05-05,네이버뉴스,"DL이앤씨, 압구정 5구역 ‘가치’ 승부수…파격 금융 조건 제안",https://sports.donga.com/economy/article/all/20260505/133862010/1,서울 강남 재건축 시장의 상징적인 입지로 평가받는 압구정 5구역 수주전에서 DL이앤씨가 조합원의 실질적인 금융 비용을 획기적으로 경감하는 제안을 내놓으며 업계의 주목을 받고 있다. 최근 건설 시장은 고금리... 
2026-05-05,네이버뉴스,"K-산업, 전동화·ESG·친환경으로 글로벌 시장 '초격차' 경쟁력 입증",http://www.dailypop.kr/news/articleView.html?idxno=98561,기후 위기 대응 및 사회 소통 강화…수자원공사·대우건설 행보 주목 공공 및 건설 부문에서는 환경 보호와 시민 소통을 위한 실무적 행보가 이어졌다. 한국수자원공사(K-water)는 여름철 녹조 발생을 예방하기 위해... 
2026-05-05,네이버뉴스,대우건설 정원주 회장 장녀가 미국서 재택근무하는 이유,https://it.chosun.com/news/articleView.html?idxno=2023092161492,"정원주 대우건설 회장의 장녀 정서윤씨가 미국 법인에 합류하면서 오너 3세의 경영 참여가 본격화되고 있다. 대우건설이 북미 사업 확대를 추진하는 가운데, 정씨의 합류를 계기로 미국 현지 사업 행보에도 관심이... "
2026-05-05,네이버뉴스,"대우건설, 2026 서울국제정원박람회서 ‘SUMMIT Silo’ 정원 선뵈",https://www.dnews.co.kr/uhtml/view.jsp?idxno=202605040858230050446,대우건설(대표 김보현)은 “지난 1일 서울숲에서 개막한 ‘2026 서울국제정원박람회’에 참가해 하이엔드 주거 브랜드 ‘써밋(SUMMIT)’의 철학을 담은 기업동행정원 ‘SUMMIT Silo’를 선보였다”고 4일 밝혔다.... 
2026-05-05,네이버뉴스,대기업도 중소기업도 스마트홈에 푹 빠져…스마트 비서 역할 톡톡,https://www.imaeil.com/page/view/2026050502211462321,LG전자는 GS건설과도 손잡고 '로봇 친화형' 주거 서비스 구축에 나서고 있다. ◆가전 넘어 아파트 전체로…건설사도 스마트홈 경쟁 스마트홈 경쟁은 가전 업계를 넘어 건설 업계로 빠르게 번지고 있다. 국내 주요... 
2026-05-05,네이버뉴스,"[주요공시] SK하이닉스, 우리로, 기아, 유니퀘스트, 하림지주, 아모레퍼...",https://www.kdpress.co.kr/news/articleView.html?idxno=204981,"■ GS건설(KOSPI, 006360)은 서초진흥아파트 재건축정비사업의 시공자로 선정됐다고 공시했다. 공사예정금액은 6793억원으로 2025년 말 연결 기준 매출액의 5.46% 규모다. 사업지는 서울 서초구 서초대로 385... "
2026-05-05,네이버뉴스,"GS건설, 1분기 주택 매출 29% 감소…분양 확대·하반기 회복 기대",https://www.news1.kr/realestate/general/6156537,GS건설(006360)의 건축·주택 부문 1분기 매출이 1년 만에 급감했다. 최근 부동산 경기 악화로 주택 사업 착공 현장이 줄어든 영향이다. 전체 매출의 약 60%를 차지하는 건축·주택 부진이 전사 실적에도 부담으로... 
2026-05-05,네이버뉴스,"롯데건설, 가정의 달 맞아 임직원 감사 이벤트",https://www.hankyung.com/article/202605056578i,롯데건설이 가정의 달을 맞아 임직원들에게 감사의 마음을 전하기 위해 다양한 이벤트를 진행했다. 롯데건설은 지난달 30일 서울 서초구 잠원동 롯데건설 본사에서 전 임직원을 대상으로 대표이사의 감사 메시지 카드가... 
2026-05-05,네이버뉴스,"롯데건설, 가정의 달 맞아 '롯또박스' 이벤트...임직원 체감형 복지 강...",https://www.joongangenews.com/news/articleView.html?idxno=516842,"|중앙이코노미뉴스 송태원 기자|롯데건설, 가정의 달 맞아 '롯또박스' 이벤트...임직원 체감형 복지 강화.[사진=롯데건설] 롯데건설이 가정의 달을 맞아 임직원 대상 복지 이벤트를 진행하며 조직 내 만족도 제고에 나섰다.... "
2026-05-05,네이버뉴스,어린이날 회사로 온 아이들..가족까지 품는 기업 복지,http://www.4th.kr/news/articleView.html?idxno=2111331,롯데건설은 가정의 달을 맞아 임직원 대상 '행복가득 롯또박스' 이벤트를 진행했다. 롯데건설은 지난달 30일 서울 서초구 잠원동 본사에서 전 임직원에게 대표이사의 감사 메시지 카드가 담긴 간식 선물 세트를... 
2026-05-05,네이버뉴스,"롯데건설, '가족의 달' 맞아 임직원 감사 이벤트 진행",https://www.businessplus.kr/news/articleView.html?idxno=111410,롯데건설이 가정의 달을 맞아 진행한 '행복가득 롯또박스' 이벤트 이미지. /사진=롯데건설 롯데건설이 5월 가정의 달과 노동절을 맞아 임직원들의 사기 진작과 일·가정 양립을 지원하기 위한 다양한 복지 이벤트를... 
2026-05-05,네이버뉴스,"'롯또박스' 긁으니 휴가 1일…롯데건설, 가정의 달 이벤트 진행",https://news.tf.co.kr/read/economy/2319644.htm,가정의 달 맞아 각종 상품 지급 롯데건설은 가정의 달을 맞아 임직원들을 위한 다양한 이벤트를 진행했다고 5일 밝혔다. 우선 지난달 30일 서초구 잠원동 본사에서 대표이사의 감사 메시지 카드가 동봉된 '간식 선물 세트... 
2026-05-05,네이버뉴스,"""가족과 함께 즐겨요"" … 롯데건설, 가정의 달 임직원 감사 이벤트 진행",http://www.worktoday.co.kr/news/articleView.html?idxno=84331,롯데건설은 가정의 달을 맞아 임직원들에게 감사의 마음을 전하기 위해 다양한 이벤트를 진행했다고 5일 밝혔다. 우선 지난달 30일에는 전 임직원에게 대표이사의 감사 메시지 카드가 동봉된 '간식 선물 세트'를... 
2026-05-05,네이버뉴스,"롯데건설, 가정의 달 맞이 임직원에게 '감사의 마음' 전한다",http://www.enewstoday.co.kr/news/articleView.html?idxno=2426209,롯데건설은 임직원들에게 가정의 달을 맞아 감사의 마음을 전한다고 5일 밝혔다. 롯데건설은 지난 4월 30일 서초구 잠원동 소재 롯데건설 본사에서 전 임직원을 대상으로 대표이사의 감사 메시지 카드가 동봉된 '간식 선물... 
2026-05-05,네이버뉴스,"""복권 긁고 휴가받는다"" 롯데건설 '가정의 달' 맞아 이색 복지 이벤트",https://www.mt.co.kr/estate/2026/05/05/2026050510150515699,롯데건설은 지난달 30일 서울 서초구 잠원동 본사에서 전 임직원을 대상으로 대표이사 감사 메시지가 담긴 '간식 선물 세트'를 전달했다고 5일 밝혔다. 선물에는 '롯또박스'라는 즉석 복권 형식을 접목해 재미 요소를... 
2026-05-05,네이버뉴스,"롯데건설, 가정의 달 맞아 임직원 이벤트 진행",https://www.asiatime.co.kr/article/20260505500046,간식 세트 및 즉석 복권 '롯또박스' 이벤트 진행 사내 복지몰 포인트 지급 등 복지 혜택 강화 가라 앉은 내부 분위기 반전 시도 평가 [아시아타임즈=이현주 기자] 롯데건설이 5월 가정의 달을 맞아 임직원들을 위한 다양한... 
2026-05-05,네이버뉴스,"롯데건설, ‘가정의 달’ 맞아 임직원에 감사 이벤트 진행",https://www.viva100.com/article/20260505500154,"롯데건설은 가정의 달을 맞아 임직원들에게 감사의 마음을 전하고자 다양한 이벤트를 진행했다고 5일 밝혔다. 롯데건설에 따르면, 지난 4월 30일 서초구 잠원동 소재 롯데건설 본사에서 전 임직원을 대상으로 대표이사의... "
2026-05-05,네이버뉴스,"롯데건설, 가정의 달 맞아 임직원 대상 감사 이벤트",https://www.etoday.co.kr/news/view/2581608,이투데이=김지영 기자 | 롯데건설은 가정의 달을 맞아 임직원들에게 감사의 마음을 전하기 위해 다양한 이벤트를 진행했다고 5일 밝혔다. 지난달 30일에는 서초구 잠원동 소재 롯데건설 본사에서 전 임직원을 대상으로... 
2026-05-05,네이버뉴스,"[게시판] 롯데건설, 가정의 달 맞아 임직원에 간식 세트 '롯또박스' 전달",https://www.yna.co.kr/view/AKR20260505021800003?input=1195m,"▲ 롯데건설은 가정의 달을 맞아 전 임직원을 대상으로 대표이사의 감사 메시지 카드가 동봉된 간식 선물 세트 '롯또박스'를 전달했다고 5일 밝혔다. 즉석 복권 형식의 경품 이벤트를 통해 '유급휴가 1일', 'LG 스탠바이미... "
2026-05-05,네이버뉴스,"“롯또박스부터 복지포인트까지” 롯데건설, 가정의 달 임직원 이벤트",http://www.edaily.co.kr/news/newspath.asp?newsid=02328806645445968,롯데건설이 가정의 달을 맞아 임직원들에게 감사의 마음을 전하기 위한 다양한 이벤트를 진행했다고 5일 밝혔다. 롯데건설이 가정의 달을 맞아 진행한 '행복가득 롯또박스' 이벤트 이미지. (사진=롯데건설) 롯데건설은... 
2026-05-05,네이버뉴스,"롯데건설, 가정의 달 맞아 임직원 감사이벤트 진행...'간식 세트부터 유...",https://www.businesskorea.co.kr/news/articleView.html?idxno=268957,롯데건설이 가정의 달을 맞아 임직원들의 노고에 보답하고 활기찬 조직문화를 조성하기 위해 이색적인 감사 이벤트를 전개한다. 롯데건설은 지난 4월 30일 서울 서초구 잠원동 본사에서 전 임직원을 대상으로 '간식 선물... 
2026-05-05,네이버뉴스,"""버티거나, 뚫거나, 바꾸거나""…철강 4사의 '4인 4색' 1분기 생존학",https://www.newsway.co.kr/news/view?ud=2026043016483686970,"포스코 개별 이익은 환율 상승에 따른 원료비 부담으로 감소했지만, 포스코퓨처엠의 흑자 전환과 리튬 사업 적자 축소, 포스코인터내셔널·포스코이앤씨 등 인프라 부문의 실적 개선이 연결 수익성을 끌어올렸다. 같은... "
2026-05-05,네이버뉴스,지방 분양 1.4만가구 쏟아진다⋯입지·가격 따라 ‘청약 양극화’ 전망,https://www.etoday.co.kr/news/view/2581336,포스코이앤씨는 대전 서구 관저동 ‘더샵 관저아르테’를 분양한다. 전용면적 59~119㎡ 총 951가구 규모다. 평당 분양가는 약 1835만원 수준이다. 대전 도시철도 2호선 트램 진잠네거리역 예정지 인근 입지다. 학세권과... 
2026-05-05,네이버뉴스,5월 지방 1만 가구 일반분양…'선별 청약' 이어질 듯,https://www.newsis.com/view/NISX20260504_0003615737,"포스코이앤씨는 대전 서구 관저동에 선보이는 '더샵 관저아르테'의 견본주택을 지난 1일 개관하고, 분양 중이다. 이 단지는 전용 59~119㎡, 총 951가구 규모로 조성된다. 평당 분양가는 약 1835만원(발코니 확장비 별도)... "
2026-05-05,네이버뉴스,"포스코이앤씨, ‘더샵 관저아르테’ 5월 7일 1순위 청약",http://www.segyebiz.com/newsView/20260430520663?OutUrl=naver,사진=포스코이앤씨 대전 서구 관저지구에 위치한 ‘더샵 관저아르테’가 오는 5월 7일 1순위 청약 접수를 진행한다고 5일 밝혔다. 분양관계자에 따르면 ‘더샵 관저아르테’는 대전광역시 서구 관저동 일원에 지하 3층... 
2026-05-05,네이버뉴스,"IPARK현대산업개발, ‘상생 가치’ 담은 맞춤형 사회공헌 확대",https://www.theguru.co.kr/news/article.html?no=101228,이번 활동에는 도시정비수주팀 등 임직원 15명이 참여해 식사 배식과 식당 정리를 도우며 지역 어르신들과... 건설사의 정체성을 살린 ‘주거 안심 동행’ 민관협력사업도 이어진다. 임직원들이 취약계층 가구를 직접... 
2026-05-05,네이버뉴스,"IPARK현대산업개발, 지속 가능 사회공헌 강화···상생 가치 실현",https://www.socialvalue.kr/news/view/1065615760367458,"이번 봉사활동은 광명시립하안노인복지관 구내식당에서 진행됐으며, IPARK현대산업개발 도시정비수주팀 등... 건설사의 특성과 정체성을 살릴 수 있는 활동으로 IPARK현대산업개발 임직원들이 직접 취약계층이 안심하고... "
2026-05-05,네이버뉴스,중동 분쟁 장기화에 중소건설사 줄도산 위기… 공사 중단 잇따라,https://biz.chosun.com/real_estate/real_estate_general/2026/05/05/FBZJNQ23BNBLRFVAG2Q6M4SFYE/?utm_source=naver&utm_medium=original&utm_campaign=biz,반면 대형건설사는 자금력과 사업 다각화를 바탕으로 충격을 일부 흡수하며 버티는 모습이다. 이로 인해 업계 내 양극화도 뚜렷해지고 있다. 중소업체 수주 실적은 줄어드는 반면 대형사 중심의 수주 확대가... 
2026-05-05,네이버뉴스,“시공사 구합니다” 수의계약도 간절한 지방 정비사업지... 왜?,https://www.smarttoday.co.kr/ko-kr/articles/107216,건설사는 공사비 상승과 금리 리스크에 선별 수주를 강화한다. |스마트투데이=김종현 기자| 서울 핵심 입지 등에서 펼쳐지는 대형 건설사간 출혈경쟁(出血競爭)이 ‘그림의 떡’인 곳이 있다. 부동산 시장이 침체한... 
2026-05-05,네이버뉴스,현대百 목동점 리빙관 새단장…프리미엄 리빙 수요 '정조준',https://www.news1.kr/industry/distribution/6157056,주요 단지들이 정비구역 지정 이후 시공사·설계사 선정 단계에 들어서면서 향후 리빙 관련 소비 여력이 확대될 것으로 예상되는 만큼 관련 수요를 선점하려는 전략으로 풀이된다.
2026-05-05,네이버뉴스,'한전이 원전수출 총괄' 법으로 못박는다…산업부 제정 검토,http://www.kookje.co.kr/news2011/asp/newsbody.asp?code=0200&key=20260505.99099000846,이번 법제화 검토는 아랍에미리트(UAE) 바라카 원전 건설 과정에서 발생한 한전과 한수원 간 법적 분쟁이 계기가 됐다. 바라카 원전은 2009년 한국이 해외에서 처음으로 수주한 원전이다. 2021년 1호기를 시작으로 2024년 9월... 
2026-05-05,네이버뉴스,"[위기가 기회다] ② 용인 일극에서 분산으로""…반도체 팹, 왜 지금 구미...",https://www.idaegu.com/news/articleView.html?idxno=661627,"이는 원전 11기에 해당하는 막대한 전력 수요다. 용수 역시 하루 107만t 이상이 필요하다. 반도체 팹 1기당 하루... 수도권 식수 문제, 송전망 건설에 따른 지역 반발, 환경 부담 등이 복합적으로 얽히면서 사업 추진의... "
2026-05-05,네이버뉴스,"한전을 원전 수출 총괄기관으로... 정부, 법 제정 추진",https://weeklytrade.co.kr/news/view.html?section=1&category=5&item=&no=99658,▲한국이 건설한 UAE 바라카 원전 전경[연합뉴스 자료사진]정부가 한국전력을 원전 수출 총괄기관으로 지정하는 내용을 골자로 관련 법 제정에 나섰다.현재 원전 수출 체계가 한전과 한국수력원자력으로 이원화된 상황에서... 
2026-05-05,네이버뉴스,"한전, 원전 수출 컨트롤타워로…'원전수출진흥법' 추진",https://www.news1.kr/economy/idustry-trade/6157074,"원전 건설과 운영 경험을 보유한 한수원의 역할을 반영하는 동시에, 사업 수행 과정에서 발생할 수 있는 분쟁을 최소화하기 위한 조치로 풀이된다. 이번 제도 정비는 한전과 한수원이 아랍에미리트(UAE) 바라카 원전 추가... "
2026-05-05,네이버뉴스,3500억달러 협상 시동…캐나다 잠수함 수주전 속 한미 투자 줄다리기 재...,https://www.news1.kr/economy/idustry-trade/6156969,"미국은 웨스팅하우스를 중심으로 원전 설계 기술과 지적재산권에서 강점을 갖고 있지만, 실제 건설 역량과 기자재 공급망 측면에서는 한국이 더 경쟁력이 있다는 분석이 많기 때문이다. 이와 함께 원유 및 LNG... "
2026-05-05,네이버뉴스,산업장관 2개월만에 방미…늦어진 대미투자 속도 날까,http://www.edaily.co.kr/news/newspath.asp?newsid=02305846645445968,"2차 계획에는 소형모듈원자로(SMR)와 천연가스 발전 시설 건설 등이 포함됐으며, 최대 730억달러 규모로 추진될 전망이다. 정부는 이번 방미를 계기로 협상에 속도를 낸다는 방침이다. 1호 프로젝트로는 에너지 및 원전... "
2026-05-05,네이버뉴스,"LS전선, OTC서 극한환경 대응 기술력 공개... ""북미시장 수주 확대""",http://www.biztribune.co.kr/news/articleView.html?idxno=353519,"해상풍력단지 해저케이블 시공 물량이 본격 반영된 결과다. LS전선은 글로벌 생산거점 확충에도 속도를 내고 있다. 현재 미국에 해저케이블 공장, 멕시코에 버스덕트 공장을 각각 건설 중으로, 북미 현지 수요에... "
2026-05-05,네이버뉴스,POSCO홀딩스 글로벌 공급망 다변화 통했다…장인화 회장 '우량자원 확보...,https://www.pinpointnews.co.kr/news/articleView.html?idxno=450485,"둘째, 국내에서는 건설 및 인프라 투자 회복 기대가 중소형 철강주 수요 개선 기대를 자극했다. 이는... 세아제강은 소폭 상승에 그쳤지만 해상풍력 및 에너지용 강관 수요 기대가 장기적으로는 긍정 요인으로 평가된다.... "
2026-05-05,네이버뉴스,박용선 포항시장 후보 '호미반도 해양 생태 관광지 조성' 공약,https://www.asiatime.co.kr/article/20260505500129,"등 인프라 구축에는 민간 자본을 적극적으로 유치해 시 재무 부담을 줄이면서도 집객 효과는 극대화하는 투... 즉각적인 착공에 돌입하겠다는 로드맵을 밝혔다. 박 후보는 “포항은 이제 굴뚝 산업의 상징을 넘어, 자연과... "
2026-05-05,네이버뉴스,"김태흠, 박수현 겨냥 ""충남 아동의 삶의 질 비판은 아전인수격""",https://www.newsis.com/view/NISX20260505_0003617332,"김 지사는 이날 오전 입장문을 내고 ""박 후보가 언급한 지표는 수십 년간 쌓아온 농어촌 지역의 인프라... 여기에 365일 24시간 어린이집 확대 운영과 어린이전문병원 착공, 공공기관 주4일 출근제 도입 및 민간 확산 등... "
2026-05-05,네이버뉴스,"김태흠 충남지사, 박수현 후보의 통계 왜곡 비판 ‘결과 중시’ 강조",https://www.viva100.com/article/20260505500252,"농어촌 인프라의 부족을 보여줄 뿐이라며, 국비 12조원 시대를 열고 아동·청소년 예산 증가 폭을 전국 최상위권으로 끌어올렸다고 강조했다. 또한, 24시간 어린이집 확대, 어린이전문병원 착공, 공공기관 주4일제, 권역별... "
2026-05-05,네이버뉴스,"“韓, AI가 돈 버는 나라”…반도체·에너지, 전쟁 위기를 기회로",https://www.ekn.kr/web/view.php?key=20260429024270747,"고대역폭메모리(HBM) 반도체로 AI 수요를 확보한 SK하이닉스와 삼성전자, 데이터센터 전력 인프라를... 두산에너빌리티는 올해 1분기 창원에 세계 최초 SMR 전용 공장을 착공했다. 투자액 8068억원, 2028년 완공 시 연간... "
2026-05-05,네이버뉴스,김태흠 지사 “'아동 삶의 질 꼴찌' 통계 왜곡한 선택적 인용”,https://www.kukinews.com/article/view/kuk202605050012,"농어촌 인프라의 부족을 보여줄 뿐”이라며 “저 김태흠은 이를 깨기 위해 국비 12조 시대를 열었고, 아동·청소년 예산 증가 폭은 전국 최상위권이다. 24시간 어린이집 확대, 어린이전문병원 착공, 공공기관 주4일제, 권역별... "
2026-05-05,네이버뉴스,"김태흠 지사 ""충남 아동 삶의 질 꼴찌 주장은 통계 왜곡""",https://www.newsfreezone.co.kr/news/articleView.html?idxno=688126,"김 지사는 해당 지표가 현재 도정의 결과를 보여주는 게 아니라, 농어촌 지역의 수십 년간 쌓인 인프라 부족... 어린이전문병원 착공, 공공기관 주4일제, 권역별 공공산후조리원 설치 등을 통해 아동 삶의 질을 한층... "
2026-05-05,네이버뉴스,영천 서남부 교통망 개선…서영천 하이패스IC 개통,https://www.shinailbo.co.kr/news/articleView.html?idxno=5017627,"2022년 5월 착공 이후 약 3년 만에 개통에 이르렀다. 서영천 하이패스IC는 하이패스 단말기를 장착한 승용차와... 시 관계자는 ""서영천 하이패스IC 개통은 단순한 교통 인프라 확충을 넘어 지역 경쟁력을 높이는 계기가 될... "
2026-05-05,네이버뉴스,"AI 핵심 '데이터센터', 미국서 기피시설로…한국도 갈등 직면",https://zdnet.co.kr/view/?no=20260505092452,"인공지능(AI) 시대 핵심 인프라인 데이터센터가 필수 시설에서 기피 시설로 인식이 바뀌고 있다. 막대한 전력... 이미 착공된 1호 센터를 둘러싼 시위가 이어지는 가운데, 2·3호 센터 추가 건립까지 추진되면서 반발이... "
2026-05-05,네이버뉴스,"통신 3사, 인공지능 시대 필수 인프라 AIDC 선점 위해 투자·기술 총력",https://www.m-i.kr/news/articleView.html?idxno=1369849,2025년 5월 착공에 들어갔으며 오는 2027년 5월 준공을 목표로 하고 있다. LG유플러스는 대규모 연산이 필요한 기업들을 수용하기 위해 고밀도 전력 공급 능력을 갖춘 인프라 구축에 집중한다. 특히 이사회 산하 '환경... 
