date,source,title,link,description
2026-07-14,네이버뉴스,"울산 중구, 건설사와 손잡고 '지역업체 하도급 확대' 나선다",https://www.newsis.com/view/NISX20260714_0003708933,"이어서 진행된 간담회에는 김영길 중구청장과 관계 공무원, ㈜우성종합건설, 우미건설㈜, 에이치엘디앤아이한라㈜, ㈜포스코이앤씨, ㈜나노종합건설, ㈜한양건설, IPARK현대산업개발, 롯데건설㈜ 등 8개 건설사 관계자... "
2026-07-14,네이버뉴스,"롯데렌탈, 수익성 25% 개선됐는데 매각가 20% 인하…'현금 급한' 롯데그...",http://www.fieldnews.kr/news/articleView.html?idxno=29960,"재계 관계자는 ""롯데렌탈 매각 주체인 호텔롯데는 롯데건설의 프로젝트 파이낸싱(PF) 관련 자금보충 약정과 롯데바이오로직스 유상증자 참여 등 계열사를 돕기 위한 자금 부담이 심한 상황""이라며 ""여기에 그룹... "
2026-07-14,네이버뉴스,"롯데건설, 고용부와 '건설안전 징검다리 프로젝트' 협약",http://www.inews24.com/view/1985355,롯데건설이 고용노동부 안양지청과 손잡고 중소규모 건설현장 근로자를 위한 안전체험교육 확대에 나선다. 최근 민간 안전체험교육장 인증을 획득한 데 이어 산업재해 예방과 안전문화 확산 행보를 이어가는... 
2026-07-14,네이버뉴스,"포스코이앤씨, 부산 문현동 ‘더샵 트리센트’ 이달 분양",https://www.donga.com/news/Economy/article/all/20260714/134299745/1,"포스코이앤씨는 부산 남구 문현동 334번지 일원에 들어서는 ‘더샵 트리센트’를 이달 분양할 예정이라고 14일 밝혔다. 더샵 트리센트는 지하 4층~지상 최고 35층, 6개 동, 총 803가구 규모다. 전용면적은 59~84㎡로 구성되며... "
2026-07-14,네이버뉴스,"포스코이앤씨, 부산 '더샵 트리센트' 156세대 일반분양",https://www.hidomin.com/news/articleView.html?idxno=713313,"포스코이앤씨가 부산시 남구 문현동 일원의 '더샵 트리센트'를 이달 중에 분양한다. 이 아파트 단지는 지하 4층~지상 최고 35층, 6개 동, 전용면적 59~84㎡, 총 803세대 규모로 조성되며, 일반분양 물량은 156세대다. 단지가... "
2026-07-14,네이버뉴스,부산 '더샵 트리센트' 803가구 분양,https://www.hankyung.com/article/2026071449021,포스코이앤씨가 이달 부산 남구 문현동에 ‘더샵 트리센트’(조감도)를 분양한다. 부산 지하철 2호선 지게골역이 가까운 데다 부산항(북항) 재개발 사업 등이 이뤄지고 있어 수요자의 관심을 끈다. 단지는 지하 4층~지상... 
2026-07-14,네이버뉴스,"포스코이앤씨, 안전 중심 체질 개선…실적 반등 이어간다",http://www.lkp.news/news/articleView.html?idxno=81894,"포스코이앤씨가 실적 회복과 안전 중심 경영을 바탕으로 경영 정상화에 나서고 있다. 흑자 전환에 성공한 데 이어 도시정비사업에서도 성과를 이어가며 본업 경쟁력 회복에 힘을 싣는 모습이다. ◆ 흑자전환 성공, 경영... "
2026-07-14,네이버뉴스,더샵 트리센트 7월 분양 예정,https://www.hankyung.com/article/202607145087i,"포스코이앤씨가 부산시 남구 문현동 334번지 일원에 ‘더샵 트리센트’를 7월 분양할 예정이다. 이 단지는 지하 4층~지상 최고 35층, 6개 동, 전용면적 59~84㎡, 총 803가구 규모로 조성되며 이중 일반분양 물량은 156가구다.... "
2026-07-14,네이버뉴스,"포스코이앤씨, 부산 문현동서 '더샵 트리센트' 156가구 분양",https://www.mk.co.kr/article/12098377,"포스코이앤씨가 이달 부산시 남구 문현동에 '더샵 트리센트'(투시도)를 분양할 예정이다. 지하 4층~지상 최고 35층, 6개 동, 전용면적 59~84㎡, 총 803가구 규모로 조성되며 이 중 일반분양 물량은 156가구다. 문현동... "
2026-07-14,네이버뉴스,"[건설사 자금조달 진단] 포스코이앤씨, 재무개선 '4000억' 영구채 발행",https://www.bloter.net/news/articleView.html?idxno=668097,포스코이앤씨가 4000억원 규모 신종자본증권(영구채)을 발행해 채무 상환에 나선다. 표면적으로는 자본 확충을 통한 재무건전성 강화가 기대된다. 하지만 실질적으로는 이자 부담이 가중되는 자금 조달로 유동성... 
2026-07-14,네이버뉴스,"지역 주거문화 진화시키는 ‘하이엔드 주거’, 부동산 시장의 새 기준 ...",https://www.dt.co.kr/article/12072878?ref=naver,"포스코이앤씨가 경기도 고양시 일산동구 풍동 일원에 조성을 완료한 최고층펜트하우스 ‘엘로이 THE PH’가 그 주인공이다. ‘엘로이 THE PH’는 총 1,976실 규모의 대단지 ‘더샵일산엘로이’ 내 최상층부에 단 전용 157... "
2026-07-14,네이버뉴스,"[카드] 대연·문현 더블생활권 품은 더샵 트리센트, 2만여세대 신흥 주...",http://www.newsprime.co.kr/news/article.html?no=740309,포스코이앤씨가 부산 남구 문현동 일대에 '더샵 트리센트'를 제시한다. 단지는 지하 4층~지상 최고 35층 6개동 전용면적 59~84㎡ 803세대 규모로 조성된다. 최근 사업지 일대에서 2만여세대 규모 정비사업이 추진되는... 
2026-07-15,네이버뉴스,"[더벨][Company Watch] 다스코, 신재생에너지 사업 다각화 속도 붙었다",https://www.thebell.co.kr/free/content/ArticleView.asp?key=202607130924405040107253,전문건설사 다스코가 서남권 반도체 투자 호재 속 전남 신안군에 대규모 태양광 발전단지 건설 공사와... 98㎿(메가와트) 그린테크시티 태양광발전사업' 공사를 수주했다. 계약금액은 532억원으로 지난해 연간 매출액... 
2026-07-15,네이버뉴스,"이철수 충남도의원, 충남지역 건설산업 생존권 보장 촉구",https://www.newstnt.com/news/articleView.html?idxno=710283,"그러면서 이철수 의원은 ""더욱 심각한 것은 건설산업의 핵심인 공사 부문의 도내 수주율이 55.6%·용역 부문은 47.2%에 불과하다는 점이라""면서 ""도민의 혈세로 발주한 사업의 성과와 이익이 정작 지역 밖으로 빠져나가는... "
2026-07-14,네이버뉴스,"이철수 충남도의원 ""위기의 지역 건설업체 생존권 보장해야""",http://www.cctimes.kr/news/articleView.html?idxno=916649,"이에 대해 이 의원은 ""더욱 심각한 것은 건설산업의 핵심인 공사 부문의 도내 수주율이 55.6%, 용역 부문은 47.2%에 불과하다는 점""이라며 ""도민의 혈세로 발주한 사업의 성과와 이익이 정작 지역 밖으로 빠져나가는... "
2026-07-14,네이버뉴스,[신간안내]건설업 등록부터 운영까지 한 권으로 해결!,https://www.dnews.co.kr/uhtml/view.jsp?idxno=202607141726089270181,"나아가 건설기업 및 산업의 모태법인 건설산업기본법부터 수주에 필요한 국가ㆍ지방계약법령 및 하위규정, 그리고 건설기술진흥법, 하도급법, 산업안전보건법, 산업재해보상보험법 등 주요 법령과 하위기준들도 최신... "
2026-07-14,네이버뉴스,"서울 소규모 정비사업 수주전, '실거주 특화' 바람…특화 설계로 틈새 ...",https://daily.hankooki.com/news/articleView.html?idxno=1385924,공략하는 건설사들이 늘어나는 추세다. 14일 관련업계에 따르면 국토교통부와 한국토지주택공사(LH)가 추진하는 금천구 시흥동 1003번지 일원 가로주택정비사업 등 공공지원형 현장을 중심으로 이 같은 실속형 수주 전략이... 
2026-07-14,네이버뉴스,"[기획] 건설업계 AI 데이터센터 수주 경쟁, '전력 확보'가 사업 성패 가...",https://www.kfenews.co.kr/news/articleView.html?idxno=660398,과거에는 발주처가 한전으로부터 받아온 전력을 건물 내에 안정적으로 연결해 주는 역할에 그쳤다면 이제는 건설사가 전력 인프라까지 해결해 주지 못하면 수주 자체가 불가능한 시장이 됐기 때문이다. 가장... 
2026-07-14,네이버뉴스,"현대엔지니어링, 도시정비 대신 에너지 밸류체인으로 사업 확장",https://www.insightkorea.co.kr/news/articleView.html?idxno=250201,현대엔지니어링이 도시정비사업의 신규 수주를 멈춘 사이 에너지 분야로 사업 보폭을 넓히고 있다.... 현대엔지니어링은 설계와 구매를 맡고 시공은 이탈리아 건설사 시침(SICIM) 현지 법인이 담당한다. 사업비는... 
2026-07-14,네이버뉴스,탈(脫)호남 내몰린 지역 건설사…생존 해법은 '수도권'[NW리포트],https://www.newsway.co.kr/news/view?ud=2026071416241037889,이후 서울·수도권 정비사업을 잇달아 수주하며 사업 기반을 확대하고 있다. 잇단 법정관리…지역 중견 건설사 생존 위기 현실화 수도권으로 활로를 넓히기 어려운 지역 중견·중소 건설사들의 위기도 현실화되고 있다.... 
2026-07-14,네이버뉴스,"[충남도의회 5분발언] 이병하 의원 “AI수도 충남, 정부·도정·의회 삼...",https://www.kukinews.com/article/view/kuk202607140154,"이에 대해 이 의원은 “더욱 심각한 것은 건설산업의 핵심인 공사 부문의 도내 수주율이 55.6%, 용역 부문은 47.2%에 불과하다는 점”이라며 “도민의 혈세로 발주한 사업의 성과와 이익이 정작 지역 밖으로 빠져나가는... "
2026-07-14,네이버뉴스,"6월 건설사 체감경기 상승에도 여전히 '부진' 국면, 중소건설사 더 어렵...",https://www.businesspost.co.kr/BP?command=article_view&num=442327,건설사가 체감하는 건설경기가 소폭 회복됐지만 여전히 부진한 수준에 머물렀다. 14일 한국건설산업연구원(건산연)에 따르면 2026년 6월 건설경기실사지수(CBSI)가 74.5로 집계됐다. 5월과 비교해 3.0포인트 올랐다.... 
2026-07-14,네이버뉴스,"LH 손잡은 가로주택정비 '대안' 부상…극동건설, '더 케이하우스'로 승...",http://www.srtimes.kr/news/articleView.html?idxno=207532,건설사 입장에서는 미분양 우발채무나 공사비 회수 불능 위험을 선제적으로 완충할 수 있다는 메리트가 크다. ​이에 따라 극동건설은 소규모·공공지원형 정비사업을 미래 먹거리 자산으로 낙점하고 전략적 수주... 
2026-07-15,네이버뉴스,"[전주] 노을대교, ""자연유산 갯벌"" 훼손 방지 대책은?",https://kjmbc.co.kr/NewsArticle/1527593,"이 때문에, 사업을 추진하는 익산지방국토관리청은 먼저 설계를 마치고, 내년 9월에 시공사 선정과 관련 행정 절차를 빠르게 마치겠다는 계획입니다. ◀ SYNC ▶ 익산지방국토관리청 관계자 ""현재 단계는 4,200억... "
2026-07-15,네이버뉴스,서울고법 판례위원회 선정 중요 판결·결정,https://www.lawtimes.co.kr/news/articleView.html?idxno=223544,"신탁회사가 시공사의 책임준공의무를 대신 이행할 경우 입주예정일이 최대 6개월 자동연장된다고 정함(이하 '이 사건 자동연장조항') - 시공사 지급불능 등 사유로 신탁회사가 대신하여 오피스텔을 완공하고, 당초... "
2026-07-14,네이버뉴스,“지자체장 수사 촉구”…민선 9기 초반부터 잡음 곳곳,https://news.kbs.co.kr/news/pc/view/view.do?ncd=8610741&ref=A,"저를 달래주러 온 게 아니라 제 입을 막으려고, 입막음용으로 가지고 오지 않았나….""] 권 군수는 지인에게 소개만 해줬을 뿐, 시공사 선정과 계약 등에 관여하지 않았다는 입장을 줄곧 밝혀왔습니다. 고소인 진술을 받은... "
2026-07-14,네이버뉴스,[사설]시공사 무리수에서 빚어진 동부시립도서관 공사 중단,https://www.gnnews.co.kr/news/articleView.html?idxno=641126,"갈등이 고조되자 진주시는 공사 장기화에 따른 주민 피해를 막기 위해 결국 A사와의 계약을 해지하고, 대체 시공사인 B사를 선정했다. 안갯속이던 사업은 진주시가 새 시공사 B사의 현장 착공을 위해 법원에 추가로 제기한... "
2026-07-14,네이버뉴스,"[뉴스분석] 최대 5년 늦어지는 7호선 청라 연장, 공기·제작 이중고… 숙...",https://www.kyeongin.com/article/1767328,"공법 선정 등으로 21개월이 지연될 것으로 예상되며, 6공구는 지하수 유출과 지반 침하 등으로 22개월 동안... 시공사와 감리단에 안전관리자를 추가 투입해 안전을 토대로 공사 속도를 높이는 방안과 공사 후 시험 운행... "
2026-07-14,네이버뉴스,세금 새는 곳·날림공사 막는다… 화성시 '시민 감리단' 떴다,https://www.g-enews.com/view.php?ud=202607141041387977d6b0ab7f1c_1,안전·토목·건축 민간 전문가 7인 설계도면과 실제 시공 일일이 대조 첫 감리 대상지로 선정된 '독서문화공간... 시는 민간 전문가들의 날카로운 시선이 더해짐으로써 행정기관과 시공사 중심으로만 돌아가던 기존 안전... 
2026-07-14,네이버뉴스,"새절역 에스컬레이터 설치 또 밀려…""시공사 경영악화""",https://www.newsis.com/view/NISX20260714_0003709215,"이어 ""몇 년 전에는 시공사가 선정됐다는 현수막을 본 기억이 있으나 이후 사업이 부결됐다는 이야기도 들었고, 최근에는 다시 공사 착공 예정이라는 현수막이 게시된 것을 확인했다""면서 ""주민 입장에서는 정확히 언제... "
2026-07-14,네이버뉴스,"종합특검, ‘관저 이전 부실 감사’ 유병호 구속영장 청구",https://www.sedaily.com/article/20067664?ref=naver,21그램으로 시공사가 변경된 것으로 조사됐다. 관저 이전 당시 각종 의혹이 제기되자 감사원이 감사에... 다만 21그램이 관저 공사 업체로 선정된 경위나 추천인 등에 대해 일축하며 부실 감사 논란이 일었다. 유 위원은... 
2026-07-14,네이버뉴스,"반복되는 무심천 체육시설 침수, '예산 효율성' 뒤 탁상행정 논란",https://www.inews365.com/news/article.html?no=927662,부지 선정의 적정성을 둘러싼 논란이 확산하고 있다. 지난 9일 호우특보가 발효된 청주 지역에 집중호우가... 복구 비용과 관련해서는 시공사의 무상 하자보수와 기존 위탁관리 업체를 통한 정비로 진행돼 별도의 추가... 
2026-07-14,네이버뉴스,"펩트론 최호일 대표, 1만주 장내 매수…""책임경영 강화""",https://www.asiatoday.co.kr/kn/view.php?key=20260714010005349,"국내 임상시험 진입을 위한 준비도 진행하고 있다.펩트론 관계자는 ""오송 제2공장은 9월 착공을 목표로 건축(변경)허가와 시공사 선정 절차를 진행하고 있다""며 ""글로벌 생산역량 확보를 위한 준비도 차질 없이... "
2026-07-14,네이버뉴스,"펩트론 오송2공장, 착공 초읽기…800억 투자도 '본격화'",https://www.topdaily.kr/articles/110983,"9월 착공 목표로 시공사 선정 막바지…당초 계획 대비 2년 가량 지연 투자 규모도 650억→890억원 증액, 향후 1년 내 800억 집행 예정 펩트론의 오송 제2공장 투자가 본격적인 집행 국면에 들어선다. 회사는 오는 9월... "
2026-07-14,네이버뉴스,"[위클리오늘] 파주도시공사, 2026년도 상반기 경영실적 보고회 개최",http://www.weeklytoday.com/news/articleView.html?idxno=785281,"문산정수장 태양광 발전소(1호기)가 이달 중 준공을 앞두고 있으며, 파주LG로 부지 태양광 발전소(2호기)는 시공사 선정을 마치고 지난 6월 착공에 들어갔다. 공사는 현재 3·4호기 기본설계 용역을 병행 추진하며 공공형... "
2026-07-14,네이버뉴스,집값 못 잡은 규제 강화…주택공급 확대 '사업성 회복'에 달렸다,http://www.opinionnews.co.kr/news/articleView.html?idxno=141523,사진=연합뉴스 정부가 마련한 첫 부동산 정책 토론회에서 재건축·재개발 사업성 회복과 비아파트 공급... 시공사 수주 경쟁 과정에서 등장하는 과도한 대안설계와 부대시설 약속이 공사비 상승과 사업 지연으로 이어지는... 
2026-07-14,네이버뉴스,[사사건건] 부동산 정책 공개 토론회… 공급·대출·세제 해법은?,https://news.kbs.co.kr/news/pc/view/view.do?ncd=8610379&ref=A,"지금 뭐, 재개발, 재건축, 규제 완화하는 것부터, 유휴 부지 활용해서 수도권 수요 분산 등등이 있는데, 먼저... 공공이 시공사가 있습니까? 없잖아요. 민간인 시공사가 있지 않습니까? 그러면 공공이 주도하는 형태의... "
2026-07-14,네이버뉴스,“전기공사 대금 떼이는 업체 수두룩…대책 세워야”,http://www.kookje.co.kr/news2011/asp/newsbody.asp?code=0200&key=20260715.22017004338,부산은 북항 재개발을 제외하면 전기공사업계가 체감할 만한 대형 프로젝트는 많지 않다. 그나마 추진되는 대형 사업도 지역 업체에 기대만큼 도움이 되지 못한다는 것이 그의 설명이다. 수도권 대기업이 사업을 수주한 뒤... 
2026-07-15,네이버뉴스,"이마트·홈플러스·롯데마트·코스트코 휴무일, 7월 17일(금) '제헌절' 대...",https://www.lecturernews.com/news/articleView.html?idxno=206200,"그러나 성수점 재개발에 따라 2023년 5월 서울 중구 오렌지센터로 본사를 이전했다. 현재 본사는 독립 사옥에서 운영되고 있으며, 영업 전략상 사실상의 본점 역할은 은평점이 맡고 있다. 실제 전단 광고와 주요 가격... "
2026-07-14,네이버뉴스,"서울 성동구,‘신속관리추진단’전문가와 본격 가동",https://sports.khan.co.kr/article/202607142349003?pt=nv,"성동구는 성수전략정비구역을 비롯한 관내 주요 재개발·재건축 사업이 본격적인 추진 단계에 들어선 만큼, 유 국장의 풍부한 현장 경험과 서울시 주택정책에 대한 높은 이해도가 정비사업의 속도와 완성도를 높이는 데... "
2026-07-14,네이버뉴스,"민선 9기 1호 결재로 신설...성동구,'재개발·재건축 신속관리추진단' 본...",https://www.cnbizm.com/news/articleView.html?idxno=308597,"성동구는 성수전략정비구역을 비롯한 관내 주요 재개발·재건축 사업이 본격적인 추진 단계에 들어선 만큼, 유 국장의 풍부한 현장 경험과 서울시 주택정책에 대한 높은 이해도가 정비사업의 속도와 완성도를 높이는 데... "
2026-07-15,네이버뉴스,"“보유세 강화 찬성은 1번, 반대는 2번”, 국무회의 생방송 댓글 여론조...",https://slownews.kr/163233,“송전망 건설 기간은 지역마다 다르다. 호남은 공장까지만 선로를 깔면 된다. 송전망 길이도 짧고 지역 주민도 반대하지 않는다. 2~3년이면 끝난다. 공장이 내려가서 영광 한빛원전의 전기를 끌어다 쓰면 수도권으로... 
2026-07-15,네이버뉴스,‘역사적 보상’이냐 ‘관치 개입’이냐··· 호남 반도체 산단의 진짜...,https://www.sisain.co.kr/news/articleView.html?idxno=58152,"여기에 원전이나 적정 규모의 가스발전을 함께 두면 전력망의 안정성을 높일 수 있다. 그러니까 풀 수 있는... 송전망을 건설해 전남광주, 전북, 충북 등에서 전력을 끌어와야 하는데, 송전탑 건설 예정지 주민들의 반발이... "
2026-07-15,네이버뉴스,연료 확보한 인도 원전 2배로 늘린다 한국 기자재 틈새 시장 열리나,https://www.g-enews.com/view.php?ud=202607150557579729fbbec65dfb_1,인도 원전 건설 진척률과 국내 기자재 업체의 공급 계약 공시 여부도 함께 지켜봐야 할 지표다. 당장 한국 투자자는 국내 원전 대형주와 원전 기자재 중소형주들이 인도 시장 진출 관련 공급 계약을 따내는지 점검할... 
2026-07-15,네이버뉴스,외주 없이 내부서 일괄 수행… 원전까지 기술력 넓혀,https://www.donga.com/news/Economy/article/all/20260714/134291170/2,"세종기술은 설계·조달·건설을 아우르는 EPC 수행 역량과 현장 시공 전 결함을 미리 확인하는 RT room... 참가하며 원전 산업 진출을 공식화했다. 고 대표는 “탱크, 배관, 펌프 등 원전 부속 설비 구조가 우리가 해오던... "
2026-07-15,네이버뉴스,"트럼프, 다음 타깃은 AI 업체들?…""지분 취득 논의""",https://biz.sbs.co.kr/article_hub/20000322535?division=NAVER,"원자로 제조사 웨스팅하우스도 포트폴리오에 포함됐는데, 미 정부는 웨스팅하우스 원전 건설에 자금 지원을 맡으며 약 8%의 지분을 취득한 것으로 알려졌습니다. 트럼프 행정부는 또 리게티 컴퓨팅, 인플렉션 등 다수의... "
2026-07-15,네이버뉴스,"[칼럼] '전기 먹는 하마', 수소환원제철의 최대 난관… 포항의 미래는 ...",https://www.polinews.co.kr/news/articleView.html?idxno=737026,"첫째, 초고압 송전망의 적기 건설이 시급하다. 그린 전력이 생산되는 동해안의 원전이나 해상풍력 단지로부터 포항 국가산업단지까지 전력을 손실 없이 수송할 수 있어야 한다. 전력 계통의 동맥경화 현상을 해결하지... "
2026-07-15,네이버뉴스,로드맵 확정 ‘광주 반도체’ 목표 향해 직진만,http://www.kwangju.co.kr/article.php?aid=1784042400801251074,정부가 광주 군공항 부지에 건설하는 호남권 반도체 클러스터 로드맵을 확정했다. 간간이 추진 일정이... 전력과 용수의 안정적 공급을 위해 재생에너지 외에 원전을 추가 조성하고 동복댐 둑을 높이겠다는 것은 정부가... 
2026-07-15,네이버뉴스,"2차 종합특검, 관저 이전 부실 감사 유병호 구속영장 청구",https://www.goodmorningcc.com/news/articleView.html?idxno=448995,"문제의 21그램은 김건희 씨의 코바나콘텐츠를 후원했던 업체로 종합건설업 면허가 없었음에도 증축 공사를... 대표적인 사례가 전현희 전 국민권익위원장에 대한 표적 감사와 월성 원전 감사 논란, 서해 공무원 피격 사건... "
2026-07-15,네이버뉴스,[프리즘] 한국 원자력 기술이 유난히 돋보이는 이유,https://www.joongang.co.kr/article/25445104,경수형원전 기술을 이미 확보하고 다양한 비경수형 옵션을 확보해 가는 중인 우리나라는 세계 원자력 개발의 흐름 속에서 유난히 돋보이는 자리에 있다. 부산 기장에 2035년 준공을 목표로 건설하는 혁신형 SMR의 성공을... 
2026-07-15,네이버뉴스,"김상욱 울산시장, 차등 전기료·배터리 투자 유치 광폭행보",https://www.ksilbo.co.kr/news/articleView.html?idxno=1062174,"김 시장은 국산 전기저상버스 추가 도입 지원과 부유식 해상풍력 사업의 국내 기업 참여 확대도 요청하고, 신규 원전 건설과 울산지역의 향후 전력수요에 대해서도 의견을 나눴다. 이어 김 시장은 경기 성남시 HD현대... "
2026-07-15,네이버뉴스,AI 시대 새 먹거리…'바다 위 데이터센터' 뛰어드는 K-조선,https://news.tf.co.kr/read/economy/2342982.htm,"FDC는 바닷물을 활용한 자연 냉각이 가능하고, 전력망이 부족한 육상 대신 해상 풍력이나 소형모듈원전... DS투자증권에 따르면 기존 육상 데이터센터 건설비는(토지·그래픽처리장치 제외) 100㎿당 8억~12억 달러(약... "
2026-07-14,네이버뉴스,"金시장, '현안 해결·투자 유치' 광폭 행보",http://www.ujeil.com/news/articleView.html?idxno=388858,"김 시장은 또 지난달 30일 기후부가 발표한 '2026년 상반기 해상풍력 경쟁입찰 결과'와 관련해 중앙부처 차원에서 향후 국내기업 참여 방안을 마련할 것을 건의하고, 신규 원전 건설 동향 등에 대해서도 의견을 교환했다.... "
2026-07-14,네이버뉴스,"김상욱 시장, 기후부·HD현대·삼성SDI 잇달아 방문 지역별 전기요금제...",https://www.ulsanpress.net/news/articleView.html?idxno=579177,부유식 해상풍력 사업의 국내기업 참여 방안과 신규 원전 건설 동향에 대해서도 의견도 나눴다. 이어 김 시장은 경기 성남시 HD현대 글로벌R&D센터에서 HD현대중공업 임원진과 조선산업 특화 소형언어모형 개발 등... 
2026-07-14,네이버뉴스,"김상욱 울산시장 ""지역별 전기요금제 도입 서둘러야""…AI 데이터센터 유...",https://www.iusm.co.kr/news/articleView.html?idxno=1065393,정부가 검토 중인 신규 원전 건설 동향과 지역 전력 공급에 미칠 영향에 대해서도 의견을 나눴다. 정부 면담에 이어 김 시장은 경기 성남시 HD현대 글로벌R&D센터를 찾아 금석호 HD현대중공업 사장 등 임원진과... 
2026-07-14,네이버뉴스,"전남광주시의회, ‘20조 재정지원’ 실질 보장 촉구",http://www.kwangju.co.kr/article.php?aid=1784026800801258373,"미래산업위원회에서는 진보당 강광석 의원(강진)이 호남권 반도체 클러스터 조성을 명분으로 원전 추가 건설이 거론되는 데 우려를 표하며, 전남광주시 차원의 명확한 입장 표명을 촉구했다. 또 반도체 클러스터 용수... "
