date,source,title,link,description
2026-04-06,네이버뉴스,후분양·비규제 강점 통했다…'힐스테이트 안양펠루스' 견본 '북새통',https://www.mediapen.com/news/view/1091411,현대건설이 시공한 '힐스테이트 안양펠루스' 홍보관이 개관 첫 주말부터 높은 관심을 끌었다. 지난 3일부터 5일까지 사흘간 약 3000명이 방문하며 현장은 활기를 띠었다. 단지 홍보관 현장 사진./사진=현대건설 지난 3일... 
2026-04-06,네이버뉴스,"건설사 연봉 ‘희비’…GS건설 1억 돌파, 포스코·대우↓",http://datanews.co.kr/news/article.html?no=144097,"이어 현대건설(1억1200만 원), 대우건설(9900만 원), DL이앤씨(9800만 원), 포스코이앤씨(9700만 원), HDC현대산업개발(9000만 원) 순으로 나타났다. 가장 큰 상승폭을 기록한 곳은 GS건설로, 전년 9300만 원 대비 12.9... "
2026-04-06,네이버뉴스,"현대건설, 플랜트 비중 30%까지 확대…에너지 수주 박차",http://datanews.co.kr/news/article.html?no=144130,현대건설이 플랜트 사업 비중을 30% 이상으로 끌어올리며 에너지 중심 성장 전략을 본격화하고 있다. 대형 해외 프로젝트와 신재생·원전 사업 확대를 통해 포트폴리오 전환에 속도를 내는 모습이다. 6일... 
2026-04-06,네이버뉴스,"이번에도 '개미'들만 죽쒔다…이란 전쟁이 가른 성적표, 외국인은 '선방...",https://view.asiae.co.kr/article/2026040315101818326,"했으나 지수 대비 선방하며 시장 수익률을 웃돌았다. 종목별로는삼성생명이 -5.65%, 두산에너빌리티가 -11.95%, 서울보증보험이 -16.12%, LG에너지솔루션이 -5.27%, SK텔레콤이 -2.51%, 현대건설이 -9.65% 등으로 집계됐다."
2026-04-06,네이버뉴스,서울 전세 매물 33% 급감…경기 6곳 집값 상승률 전국 최고,https://www.sedaily.com/article/20028558?ref=naver,"현대건설(000720)이 12건으로 가장 많았고, 두산에너빌리티가 누적 32건으로 업계 최다 보유사다. 금호건설은 생성형 AI가 현장 영상을 분석해 위험 상황을 자동 판단하는 시스템을 개발해 실제 현장에 적용 중이다.... "
2026-04-06,네이버뉴스,해외 취업사기 신고 2년 새 48배…민관 이중감시 체계 가동,https://www.sedaily.com/article/20028554?ref=naver,"현대건설(000720)이 12건으로 최다를 기록했으며, 안전관리 시스템·수중 구조물 모니터링 등 현장 전반에 AI를 적용하고 있다. 두산에너빌리티는 누적 32건으로 업계 최다 특허를 보유했고, 금호건설(002990)도 생성형 AI... "
2026-04-06,네이버뉴스,"추론형 AI, 화이트칼라 일자리도 판도 재편",https://www.sedaily.com/article/20028553?ref=naver,"현대건설(000720)이 12건으로 가장 많은 특허를 기록했고, 안전관리 시스템부터 수중 구조물 모니터링까지 현장 전반에 적용 가능한 기술을 확보했다. 금호건설은 생성형 AI가 건설현장 영상을 분석해 위험 상황을... "
2026-04-06,네이버뉴스,프리미엄은 옛말…개포주공6·7단지 펜트하우스 ‘신청 0’ [코주부],https://www.sedaily.com/article/20028499?ref=naver,재건축을 통해 15층 1960가구에서 최고 35층 2698가구로 탈바꿈하는 개포주공6·7단지는 올해 8월 관리처분계획인가와 내년 10월 착공을 목표로 하고 있다. 시공사는 현대건설이다.
2026-04-06,네이버뉴스,"도봉구, GTX-C 공사비 갈등 해소 환영…4월 말 본격 공사 돌입",https://www.munhwa.com/article/11579942?ref=naver,"GTX-C 노선은 2024년 1월 착공식 이후 국토교통부와 사업시행자(현대건설 컨소시엄) 간 총사업비를 둘러싼 갈등으로 실질적인 시공 계약이 지연돼 왔다. 이번 대한상사중재원의 중재로 갈등이 해소되면서, 이달 말부터... "
2026-04-06,네이버뉴스,“집 안 짓는다” 건설사 구조조정 가속...건설사 인력 최대 30% 감소,https://www.smarttoday.co.kr/ko-kr/articles/106155,"이어 GS건설은 487명, 대우건설은 357명, 현대건설은 308명이 각각 감소했다. 인력 축소는 특히 주택·건축 부문에 집중됐다. 건설사들은 플랜트, 공공, 하이테크 등 비주택 부문 인력은 유지하거나 일부 확대하는... "
2026-04-06,네이버뉴스,1분기 쪼그라든 대형사 도시 정비⋯‘재건축 대어’ 본게임 시작,https://www.etoday.co.kr/news/view/2572683,"현대건설은 경기 '금정2구역 재개발(4258억원)'과 서울 '신길1구역 공공재개발(6607억원)'을 수주해 1조865억원을 기록했다. 이어 GS건설은 6856억원, 포스코이앤씨는 1709억원의 수주액을 올렸다. 반면 삼성물산과... "
2026-04-06,네이버뉴스,"부유식 액화천연가스 설비, 모듈화로 신속한 건조 지향",https://www.abcn.kr/news/articleView.html?idxno=87273,"조선소 설립을 위한 현대건설 조선사업부 공채에 신입사원으로 입사한 이래 필자는 현대중공업 뉴욕지사장, 현대종합상사 선박본부장 등 현대와 함께 조선입국(造船立國)의 외길을 걸어왔으며, 현재... "
2026-04-06,네이버뉴스,"도봉구, GTX-C 노선 공사비 갈등 타결 “적극 환영”",https://biz.heraldcorp.com/article/10710326?ref=naver,수도권광역급행철도(GTX) C 노선은 2024년 1월 착공식 이후 국토교통부와 사업시행자(현대건설 컨소시엄) 간 총사업비 갈등으로 실질적인 시공 계약이 미뤄져 왔다. 하지만 이번 대한상사중재원의 중재로 갈등이 해결됐고... 
2026-04-06,네이버뉴스,‘AI 없인 안 된다’…건설사도 특허 확보 총력전 [코주부],https://www.sedaily.com/article/20028498?ref=naver,"현대건설은 지난해 가장 많은 12건의 AI 특허 등록을 기록했다. 2024년(2건)에 비해 6배 증가했다. 근로자 맞춤형 교육을 제공하는 안전관리 시스템을 비롯해 지하 저류시설 상태 진단, 침수 대응 시스템, 수중 구조물... "
2026-04-06,네이버뉴스,[비즈톡톡] SKT·LGU+ 발 빼는 K-UAM… 장밋빛 청사진 대신 ‘사업성 검...,https://biz.chosun.com/it-science/ict/2026/04/06/2PO37CKXPFGHNGMW66AJIEG7IQ/?utm_source=naver&utm_medium=original&utm_campaign=biz,이번 실증에는 대한항공·인천국제공항공사·현대차·KT·현대건설이 참여한 ‘원팀’과 한국공항공사·한화시스템이 참여한 ‘드림팀’이 나섰습니다. 한 업계 관계자는 “지금 K-UAM은 기체 경쟁보다 운항 체계와... 
2026-04-06,네이버뉴스,대형 건설사 눈길 끈 LH 공공재개발…과도한 공공성은 '딜레마',https://www.newspim.com/news/view/20260403000914,이 중 이 중 ▲송파구 거여새마을(삼성물산·GS건설) ▲성북구 장위9구역(DL이앤씨·현대건설) ▲성북구 장위8구역(삼성물산) ▲성북구 성북1구역(GS건설) ▲중랑구 중화5구역(GS건설) ▲동대문구 전농9구역(현대엔지니어링)... 
2026-04-06,네이버뉴스,"AI발 철강산업 새 기회..""美 빅테크 공급 추진""[R&D인사이드]",https://www.mt.co.kr/industry/2026/04/06/2026032716113867113,"이와 관련해 현대건설, 현대엔지니어링 등 계열사와의 협업도 논의 중이다. 안 상무는 ""향후 데이터센터와 함께 ESS 시스템에 들어가는 소재도 통합적으로 고객에게 제공하는 모델을 구축하려 한다""며 ""기존 철강 산업이... "
2026-04-06,네이버뉴스,[이번주 재개발ㆍ재건축] 압구정ㆍ목동 등 초대형 입찰 마감…수주 ‘빅...,https://www.dnews.co.kr/uhtml/view.jsp?idxno=202604051347220000993,"압구정3구역은 앞서 열린 현장설명회(현설)에 현대건설, 포스코이앤씨, 롯데건설, SK에코플랜트, IPARK현대산업개발 등 대형 건설사 5곳과 DL건설, 제일건설, 대방건설, 금호건설 등 중견사 4곳이 참석했다. 지하 7층... "
2026-04-06,네이버뉴스,"정상혁號 신한은행, 제조업 의존 탈피…서비스업 확장 [은행 기업대출 ...",http://www.fntimes.com/html/view.php?ud=202604040114106653dd55077bc2_18,CIB 분야 경쟁력 강화를 위해 건설업계 맏형인 현대건설과 맞손을 잡은 것도 특기할 부분이다. 올해 2월 체결된 현대건설과의 MOU에 따라 신한은행은 현대건설이 추진하는 ▲데이터센터 ▲신재생에너지 ▲인프라/환경... 
2026-04-06,네이버뉴스,"작년 매출 4분의 1 팔아치운 현대모비스 김도형, 왜? [나는CFO다]",http://www.fntimes.com/html/view.php?ud=20260404015509513dd55077bc2_18,"14년간 현대건설 ‘스페셜리스트’ 1973년생인 김도형 전무는 서울대 경제학과 졸업후 2000년 현대차에 입사했다. 11년간 재무부서에서 경력을 쌓았고, 2011년 현대차가 현대건설을 인수하면서 현대건설 경영분석팀장으로... "
2026-04-06,네이버뉴스,"“난 대통령 될거야, 당신은…” MB 경악한 정주영 폭탄 발언 [이명박 회...",https://www.joongang.co.kr/article/25417733,그때 나는 현대건설 대표이사 회장직을 비롯해 숱한 현대그룹 계열사의 요직을 맡고 있었다. 정 회장은 수시로 나를 불러 중요한 경영 문제를 협의하고 상의했다. 1991년 11월의 그 날도 같은 목적의 무수히 많은 호출... 
2026-04-06,네이버뉴스,[챗집피티] '몸테크' 성지에서 강북 대장주로…10억대 '미미삼'의 변신,https://www.mt.co.kr/estate/2026/04/06/2026040314223986691,"실제로 지난 2023년 삼성물산, 현대건설, GS건설, DL이앤씨, 포스코이앤씨, 롯데건설, SK에코플랜트, HDC현대산업개발 등 8개의 대형 건설사가 동의서 접수를 알리는 현수막을 함께 걸어놓는 등 강북지역에서는 이례적인... "
2026-04-05,네이버뉴스,'사천 스카이시티 AI 데이터센터' 건립 본격화,https://www.gnnews.co.kr/news/articleView.html?idxno=634224,"사업 시행은 ㈜태왕디앤디가 맡고, 현대건설이 PCS(선진국형 발주 방식) 로 시공에 참여할 예정이며, 지역 활성화 펀드, 국민 성장 펀드, LS일렉트릭, MSP(관리형 서비스 공급자) 등이 전략적 투자자로 참여하는 구조로... "
2026-04-05,네이버뉴스,[브리프] LG전자 SKT LGU+ 현대차 HD건설기계 조선호텔 놀유니버스,http://www.biztribune.co.kr/news/articleView.html?idxno=351853,"■ HD현대건설기계, 베트남 국제기능올림픽 국가대표 육성 지원 HD건설기계가 하노이에서 현지 직업교육훈련총국 및 CCT1 대학의 주요 관계자가 참석한 가운데 국제기능올림픽 참가 지원을 위한 3자 업무협약 체결했다.... "
2026-04-05,네이버뉴스,"목동4단지, 재건축 조합 창립총회…임원 선출·정관 승인 마무리",https://www.m-i.kr/news/articleView.html?idxno=1361646,"목동4단지 재건축 조합 창립총회장에 설치된 현대건설, 포스코이앤씨, GS건설 배너 현수막. 사진=윤하늘 기자 제공 목동4단지는 5월 내 조합설립인가를 마치고, 6월 중 시공사 선정 입찰 공고를 낼 계획이다. 이날... "
2026-04-05,네이버뉴스,목동4단지 조합설립 '목전'…'구역 지정' 8개월 만에 창립총회,https://www.hankyung.com/article/202604059779i,"이날 창립총회에는 현대건설, GS건설, DL이앤씨, 포스코이앤씨 4개 시공사가 참석해 홍보전을 벌였다. 목동4단지는 다음 달 초 조합설립 인가를 신청하고 6월 중순 시공사 선정을 위한 입찰공고를 낼 계획이다. 8월... "
2026-04-05,네이버뉴스,건설사도 AI 열풍…특허등록 1년새 4배 증가,https://www.sedaily.com/article/20028470?ref=naver,"현대건설은 지난해 가장 많은 12건의 AI 특허 등록을 기록했다. 2024년(2건)에 비해 6배 증가했다. 근로자 맞춤형 교육을 제공하는 안전관리 시스템을 비롯해 지하 저류시설 상태 진단, 침수 대응 시스템, 수중 구조물... "
2026-04-05,네이버뉴스,84㎡ 조합원 분담금 71억…펜트하우스는 ‘그림의 떡’[부동산 라운지],https://www.sedaily.com/article/20028465?ref=naver,재건축을 통해 15층 1960가구에서 최고 35층 2698가구로 탈바꿈하는 개포주공6·7단지는 올해 8월 관리처분계획인가와 내년 10월 착공을 목표로 하고 있다. 시공사는 현대건설이다.
2026-04-05,네이버뉴스,[박상규의 직설] '4월 공포'의 현실화,https://www.pennmike.com/news/articleView.html?idxno=118144,"현대건설 등 대형 건설사들은 이미 공사 비용 상승과 공사 지연 가능성을 재건축·재개발 조합에 통보하기 시작했다. 나프타 수급 불안 때문에 자재 협력사가 4월부터 페인트, PVC, 플라스틱 단열재, 방수재, 도배지... "
2026-04-05,네이버뉴스,정체되던 GTX-B·C 사업 궤도 안착…5년 내 '수도권 30분 시대' 열리나,https://www.joongboo.com/news/articleView.html?idxno=363721879,"5일 중부일보 취재를 종합하면 GTX-C노선의 시행사인 현대건설 컨소시엄(한화 건설부문, 태영건설, 동부건설, 쌍용건설)의 대표사 현대건설은 이달 중 자사 공사구간을 시작으로 C노선 착공 절차에 착수할 예정이다.... "
2026-04-06,네이버뉴스,"""한강변 역세권""⋯신반포19·25차 '래미안 or 오티에르' [현장]",http://www.inews24.com/view/1957029,"소규모 단지인 신반포 19·25차의 통합 재건축이 추진되자, 시공능력평가 상위권인 삼성물산 건설부문(이하 삼성물산)과 포스코이앤씨가 시공사 입찰 참전 의지를 내보이고 있다. 6일 관련업계에 따르면 신반포 19·25차... "
2026-04-06,네이버뉴스,"[리더가 사는 곳] 시작을 설계한 남자, 자산을 완성하다… 프리콘 부의...",https://m.skyedaily.com/news_view.html?ID=301731,이후 1984년부터 삼성물산 건설부문에서 실무를 이어가며 기획과 관리의 중요성을 체감했다. 당시 국내 건설업계는 일단 짓고 보는 ‘빨리빨리’식 시공이 주류였다. 이런 관행은 결국 1990년대 중반 성수대교(1994년)와... 
2026-04-06,네이버뉴스,[이번주 시공사 현장설명회 스케줄(2026.4.6~4.10)],http://www.sisaon.co.kr/news/articleView.html?idxno=182065,삼성물산이 단독으로 참여할 것으로 보인다. 9일에는 성수4지구 재개발 시공사 현설이 열린다. 한차례 입찰이 무효화되고 다시 현설이 열리는 것으로 시공사 선정이 상당 기간 지체되는 모양새다. 대우건설과... 
2026-04-06,네이버뉴스,"[신탁방식 정비사업 전성시대]②한국토지신탁, 72명 맨파워ㆍ10년 이상...",https://www.dnews.co.kr/uhtml/view.jsp?idxno=202604050819461300960,이밖에도 삼성물산 건설부문 등 주요 건설 대기업 출신 전문가들이 다수 포진해 있어 복잡한 이해관계자 간 의견 조율에도 강점을 발휘한다는 평가도 뒤따른다. 정비업계 관계자는 “정비사업은 결국 사람이 하는... 
2026-04-05,네이버뉴스,은마 재건축 27년 만에 본궤도⋯시공권 ‘유지 vs 재선정’ 변수,https://www.etoday.co.kr/news/view/2572637,"이투데이=조유정 기자 | 2002년, 삼성물산ㆍGS건설 컨소시엄 선정 부칙 적용 여부·신고 절차 해석 따라 시공권 유지 촉각 서울 강남구 대치동 ‘은마아파트’ 재건축 사업이 27년 표류 끝에 다시 본궤도에 오르면서 시공권... "
2026-04-06,네이버뉴스,"DL이앤씨,글로벌 협업으로 압구정5구역 '초고층' 기준 다시 쓴다",https://www.mediapen.com/news/view/1091418,DL이앤씨가 글로벌 선도 기업들과의 협업을 통해 '압구정5구역'에서 초고층 건축의 새로운 기준 마련에 나선다. DL이앤씨가 압구정5구역 수주를 위해 글로벌 기업들과 협업에 나선다./사진=DL이앤씨 DL이앤씨는 초고층... 
2026-04-06,네이버뉴스,"DL이앤씨, '압구정5구역'에 글로벌 기술 협업",http://www.seoulwire.com/news/articleView.html?idxno=715243,"DL이앤씨는 영국의 '에이럽(ARUP)', 오스트리아의 '도카(DOKA)'와 협업하고 있다고 6일 밝혔다. DL이앤씨는 지난달 방한한 에이럽, 도카 관계자들을 만나 초고층 건축물 설계 및 시공 기술에 대한 논의를 마쳤다. 각자의... "
2026-04-06,네이버뉴스,"DL이앤씨, 초고층 설계·시공 글로벌 기업과 압구정5구역 협업",https://news.tf.co.kr/read/economy/2309817.htm,"영국 에이럽, AI 기반 설계 프로그램 적용 오스트리아 도카, 초고층 건축 안전성 극대화 DL이앤씨가 압구정5구역 수주를 위해 초고층 건축물 설계 및 시공 기술을 보유한 글로벌 기업들과의 협업한다. DL이앤씨는 초고층... "
2026-04-06,네이버뉴스,"DL이앤씨, 압구정5구역 설계·시공 위해 글로벌 기업과 협업",https://biz.chosun.com/real_estate/real_estate_general/2026/04/06/3PWDM7UUIRCRZJQ6HJVDSE5LMI/?utm_source=naver&utm_medium=original&utm_campaign=biz,"영국 ‘에이럽(ARUP)’, 오스트리아 ‘도카(DOKA)’와 협업체계 구축 DL이앤씨가 세계 최고 수준의 초고층 건축물 설계 및 시공 기술을 보유한 글로벌 기업들과의 협업을 통해 ‘압구정5구역’에서 초고층 건설의 새로운... "
2026-04-06,네이버뉴스,초중고 이어 유치원 품은 '쿼드러플 학세권' 인기,http://www.enewstoday.co.kr/news/articleView.html?idxno=2415161,"DL이앤씨는 동작구 대방동 일원 노량진8재정비촉진구역 주택재개발 정비사업을 통해 '아크로 리버스카이'를 분양할 예정이다. 지하 4층~지상 29층, 10개 동, 전용면적 36~140㎡ 총 987가구 규모이며, 이 중 285가구를... "
2026-04-06,네이버뉴스,"DL이앤씨, 압구정5구역 글로벌 기술 협업",http://www.econonews.co.kr/news/articleView.html?idxno=434266,"압구정5구역 초고층 글로벌 협업 이미지 (사진=DL이앤씨)  DL이앤씨는 초고층 구조 설계 분야에서 세계적 명성을 가진 영국의 '에이럽(ARUP)', 골조 시공 제어 분야 글로벌 선도기업인 오스트리아의 '도카(DOKA)'와 전략적... "
2026-04-06,네이버뉴스,"[비즈+]DL이앤씨, 압구정5구역에 글로벌 기술 총집결…초고층 건설 새 기...",https://www.businessplus.kr/news/articleView.html?idxno=110092,지난 3월 25일 서울의 한 스튜디오에서 앤드류 르엉 에이럽(ARUP) 한국·타이완 그룹장(왼쪽 두 번째)이 DL이앤씨 직원 등과 압구정5구역 초고층 구조시스템에 대한 회의를 진행하고 있다. /사진=DL이앤씨 DL이앤씨가 글로벌... 
2026-04-06,네이버뉴스,"집값, '쿼드러플 학세권'이 갈랐다...교육 인프라 집적 입지 '희소성'",https://www.bizwork.co.kr/news/articleView.html?idxno=414149,"DL이앤씨는 동작구 대방동 일원 노량진8재정비촉진구역 주택재개발 정비사업을 통해 '아크로 리버스카이'를 분양할 예정이다. 지하 4층~지상 29층, 10개 동, 전용면적 36~140㎡ 총 987가구 규모이며, 이 중 285가구를 일반에... "
2026-04-05,네이버뉴스,건설자재 재고 바닥… 공사현장 한달 버티기도 힘들다 [중동發 고물가 ...,http://www.fnnews.com/news/202604051853579090,"DL이앤씨의 경우 이란 지사 직원 1명은 이미 올해 초 대피를 완료했고, 이라크에 현장이 있는 대우건설은 실시간 상황 체크를 통해 단계적 대응을 하는 상황이다. 경영진이 직접 나서 선제 대응을 주문한 건설사도... "
2026-04-05,네이버뉴스,"킨텍스 3전시장 건설, 우수 기술 빠진 일반 제품 채우나",https://www.incheonilbo.com/news/articleView.html?idxno=1320244,"제3전시장 건립은 1998년 수도권 종합 전시장 건립계획에 따른 것으로 지난해 10월 23일 착공식 이후 DL 이앤씨가 시공을 맡아 공사가 진행 중이다. 하지만 최근, 일부 공정에서 설계 변경을 진행 중이다. 실제 A 업체의... "
2026-04-06,네이버뉴스,4월 3일 주식시장 주요공시,https://www.catchnews.kr/news/articleView.html?idxno=122349,"1%, 취득예정일:2026-04-13) ▶대우건설, 케이티앤지와 4,143억원(최근 매출액대비 5.14%) 규모 공급계약(천안 성정동 511일원 공동주택 신축공사) 체결(계약기간:2026-04-03~2029-09-30) ▶플리토, 글로벌 IT기업과... "
2026-04-06,네이버뉴스,[아주증시포커스] 12거래일 만에 '팔자' 멈춘 외국인…반도체로 복귀하...,https://www.ajunews.com/view/20260406071953447,◆장 마감 후(3일) 주요공시 ▷한국유니온제약 2026년 4월 16일 상장폐지 결정 ▷삼부토건 회생계획안 제출기간 2026년 5월 1일로 연장 ▷대우건설 KT&G 4143억원 규모 공사수주 ▷레이저쎌 제4회 10억원 규모 전환사채... 
2026-04-06,네이버뉴스,"[N2 모닝 경제 브리핑-4월 6일] 美증시, ‘성금요일’ 휴장…주요공시 ...",https://www.news2day.co.kr/article/20260404500030,결정 - 대우건설(047040) : 약 4143억원 규모 천안 성정동 511일원 공동주택 신축공사 수주 - HD한국조선해양(009540) : 자회사 HD현대삼호가 그리스 소재 선주로부터 약 3498억원 규모로 LPGC 2척 공사 수주 - HD현대중공업... 
2026-04-06,네이버뉴스,계룡건설 꼼수에… 남부내륙철도 1공구 ‘유찰 우려’,https://news.mtn.co.kr/news-detail/2026040601505762891,반면 계룡건설은 대우건설을 섭외하는 등 참여를 위한 기반 마련에 속도를 내고 있다.대보건설은 교량공사 실적 보완 등을 위해 GS건설·쌍용건설 등과 손을 맞잡는 방안을 협의하고 있다. 1공구 담당 사업자는 공사담당... 
2026-04-06,네이버뉴스,"[브랜드평판] 삼성, 대기업집단 4월 1위... 한화, SK 뒤이어",https://www.enetnews.co.kr/news/articleView.html?idxno=48525,"한솔, 대우건설, 영풍, 넷마블, 아모레퍼시픽, 셀트리온, KT & G, 부영, HJ중공업, 삼천리, 한국항공우주산업, 태영, 세아, 하림, 애경, 태광, 메리츠금융, 하이트진로, 호반건설, OCI, 교보생명보험... "
2026-04-06,네이버뉴스,[주간수급리포트] 불안한 장세 속 외국인 6조 ‘팔자’⋯개미는 ‘폭락...,https://www.etoday.co.kr/news/view/2572704,"이어 HD현대중공업 2030억원, 대우건설 1360억원, 현대차 1270억원, NAVER 1140억원 순으로 순매수했다. SK스퀘어 880억원, 산일전기 720억원, 한국전력 650억원도 순매수 상위권에 올랐다. 반면 삼성전자는 4070억원... "
2026-04-05,네이버뉴스,[통신 맥락읽기] '30년 KT맨' 전면 세웠지만 '뒷문 인사' 그림자 여전,https://www.pointdaily.co.kr/news/articleView.html?idxno=299646,1967년생으로 대우건설·팬택을 거쳐 2015년 KT에 합류한 뒤 홍보실장을 지냈으며 박 대표 공모 과정에서 언론 홍보를 지원한 인연도 있습니다. KT알파 대표에는 SK스토아 전 사장 출신인 박정민 씨가 내정됐습니다. 커머스... 
2026-04-05,네이버뉴스,"동해해경서, 구명조끼 기증식",https://www.ksmnews.co.kr/news/view.php?idx=598319,"이번 행사는 해양 안전 강화를 위한 민·관 협력의 일환으로 마련됐으며, 김환경 동해해경서장을 비롯해 이기석 대우건설 현장소장, 김도현 해양재난구조대 부대장 등이 참석한 가운데 진행됐다.이날 대우건설은 약 300만... "
2026-04-05,네이버뉴스,가덕도신공항 어업 피해조사·보상 시작,http://www.gnmaeil.com/news/articleView.html?idxno=583871,"박성준 경남도 교통건설국장은 ""경남지역 피해 규모가 큰 만큼 한국농어촌공사와의 협업을 통해 전문성을 강화하겠다""며 ""대우건설 컨소시엄이 우선협상대상자로 선정돼 기본설계 및 우선시공분 실시설계가 추진 중인... "
2026-04-05,네이버뉴스,경남도 가덕도신공항 어업보상 시작,http://www.gndomin.com/news/articleView.html?idxno=471164,"박성준 경남도 교통건설국장은 ""경남지역 피해 규모가 큰 만큼 한국농어촌공사와의 협업을 통해 전문성을 강화하겠다""며, ""대우건설 컨소시엄이 우선협상대상자로 선정돼 기본설계 및 우선시공분 실시설계가 추진 중인... "
2026-04-05,네이버뉴스,씨마르는 전·월세…'10년 거주' 민간임대 노려볼까,https://www.hankyung.com/article/2026040598731,"대우건설이 인천 중구 운서동에 조성한 ‘운서역푸르지오더스카이2차’가 좋은 예다. 이 단지는 지하 2층~지상 최고 25층, 10개 동, 총 847가구로 구성된다. 오는 8월 입주 예정이다. 지난달 임차인 모집에 4096명이 몰려... "
2026-04-06,네이버뉴스,"동작구 분양가, 강남3구 넘어서나?...흑석·노량진 '평당 8500만원 시대'",https://www.smarttoday.co.kr/ko-kr/articles/106161,노량진 뉴타운 라클라체자이드파인 조감도 (사진=GS건설) |스마트투데이=이재수 기자| 서울 동작구 신축 아파트 분양가가 분양가상한제(분상제)가 적용되는 강남3구 아파트 분양가를 넘어서는 현상이 나타나고 있다.... 
