date,source,title,link,description
2026-04-17,네이버뉴스,"교통마저 좋아지는 ‘송도’, GTX-B노선 신설 수혜 기대되는 단지에 이...",https://www.dt.co.kr/article/12058010?ref=naver,이러한 흐름 속에 이달 포스코이앤씨가 GTX-B 노선이 신설될 계획에 있는 인천대입구역 도보권 단지 ‘더샵 송도그란테르’의 분양에 나설 예정이다. 단지는 인천시 연수구 송도동 일원(송도국제도시G5-1·3·4·5·6... 
2026-04-17,네이버뉴스,"포스코이앤씨, 신반포19·25차 재건축 '5단계 조망 설계' 적용",https://www.getnews.co.kr/news/articleView.html?idxno=868041,"포스코이앤씨가 신반포19ㆍ25차 재건축 사업에서 '조합원 전 세대 한강 조망'을 구현하기 위한 설계를 제안하며 주목받고 있다. 이번 설계는 일부 세대에 집중됐던 기존 한강 조망 구조를 넘어, 단지 전체를 한강... "
2026-04-17,네이버뉴스,수도권 오피스텔 수익률 및 거래량 동반 상승세 지속,https://www.geconomy.co.kr/news/article.html?no=319462,"포스코이앤씨는 인천시 연수구 송도국제도시 국제업무지구 일원에 '더샵 송도그란테르'를 공급할 예정입니다. 아파트 1,544가구와 오피스텔 96실 규모로 구성되며 오피스텔은 3면 개방형 구조와 맞통풍 설계를... "
2026-04-17,네이버뉴스,안동에 첫 번째 ‘더샵’ 들어선다…'더샵 안동더퍼스트' 20일 특별공급,https://www.dnews.co.kr/uhtml/view.jsp?idxno=202604171540377560689,"경북 내 더샵 단지, 신규 분양 기대감 경상북도 안동시에 포스코이앤씨의 ‘더샵’ 아파트가 첫 공급에 들어간다. 지방 중소도시에서는 브랜드 아파트 공급 자체가 제한적이다. 원자재 가격 상승과 금융 환경 변화로... "
2026-04-18,네이버뉴스,"서영학 여수 땅 파서 남 좋은 일 그만, '여수형 하도급 70%' 승부수",https://www.ppss.kr/news/articleView.html?idxno=293412,지역건설산업 매출 증대 대책'을 전격 발표했다. 서영학 예비후보는 여수가 산단 확장과 관광단지 개발 등 건설 수요가 풍부함에도 불구하고 지역 업체들이 저가 수주 압박과 하도급 배제라는 이중고를 겪고 있다고... 
2026-04-18,네이버뉴스,국내 건설사 텃밭이었는데....미국·이란 전쟁으로 '중동 수주' 10분의 1...,https://www.theguru.co.kr/news/article.html?no=100605,"중동 건설 시장은 국내 건설사의 텃밭으로 전체 해외 수주의 절반 이상을 차지해 왔다. A 건설사 관계자는 ""중동에서의 발주 여건이 개선되지 않으면 올해 수주 목표 달성이 쉽지 않을 것""이라고 우려했다. 이란... "
2026-04-17,네이버뉴스,[로드픽] IMF '82 달러 시나리오' 붕괴… 韓 산업계 덮친 '중간재 단절',http://www.newsroad.co.kr/news/articleView.html?idxno=58123,실제로 올해 1분기 한국 건설사의 중동 수주는 90% 가까이 줄었다. 역설도 있다. 파괴된 인프라는 결국 복구된다. IMF는 하루 1000만 배럴 이상의 생산능력이 손실됐다고 추산한다. 복구 비용은 최소 수십조 원 규모다. 과거... 
2026-04-17,네이버뉴스,"효성중공업, 5200억 사업 계약 해지… 부산 분양시장 옥석가리기",https://www.donga.com/news/Economy/article/all/20260417/133762982/1,이에 따라 건설사들은 해운대나 수영구 등 입지가 확실한 곳에만 집중하는 ‘선별적 수주’ 기조를 강화하고 있고 그 외 지역과 온도 차는 더욱 벌어지는 양극화 현상이 심화되고 있다. 업계 관계자는 “현재 부동산... 
2026-04-17,네이버뉴스,건설사 법정관리·합병 후 실적 희비…극동건설 '사업 정상화' vs STX건설...,https://www.greened.kr/news/articleView.html?idxno=339461,"공공건설시장에서 과거 실적이 수주 경쟁력의 핵심인 만큼, 지방 중소 건설사인 성호건설은 극동건설 인수를 통해 토목·관급공사 수주 기반을 확보하고 중견사로 도약하려는 전략적 선택을 한 것으로 보인다. 인수... "
2026-04-17,네이버뉴스,[K-철강 생존게임 ①] 철강은 하나가 아니다… '가격도 수익도 갈리는 ...,https://www.pressman.kr/news/articleView.html?idxno=101376,건설사를 주요 수요처로 하며 가격은 수급에 따라 형성된다. 재고 기반 거래가 가능하고 유통 비중이 높아... 현대제철 역시 철근 가격 인상 외에도 열연·냉연강판과 후판 등 유통 가격을 4~5만 원 수준으로 인상한다고... 
2026-04-18,네이버뉴스,"서울 아파트 ""비싸도 완판""...이제는 내릴 수 없는 가격[손바닥부동산]",http://www.edaily.co.kr/news/newspath.asp?newsid=01968006645417432,최근 정비사업장에서 시공사 선정이 유찰되는 사례가 증가하는 것도 이러한 맥락에서 이해할 수 있다. 결국 분양가는 시장에서 형성되는 가격을 넘어 사업 지속 가능성을 반영한 최소 가격으로 기능하고 있다. 수요... 
2026-04-18,네이버뉴스,"포천시, 송우2지구 상반기 본격 착공…‘소흘 역세권’ 거점 조성 가속...",https://view.asiae.co.kr/article/2026041720064872454,"이러한 긴밀한 협력과 다각적인 행정 지원을 토대로, 지난해 7월 사유지 및 지장물 보상을 완료하고 시공사 선정과 착공계획서 제출로 이어지는 등 그간 지연되었던 사업 절차를 정상 궤도에 올려놓았다. 시는 앞으로도... "
2026-04-18,네이버뉴스,"서울 중구, 신당9구역, 정비계획 변경 확정…최고 15층, 504세대 [지금 우...",https://www.segye.com/newsView/20260417508235?OutUrl=naver,"당초 공동주택 등 건물 8개동, 315세대와 부대시설 건립이 계획되면서 낮은 사업성으로 시공사 선정이 네 차례 유찰되는 등 추진에 난항을 겪어 왔다. 그러나 이번 계획 변경으로 최고 높이는 기존 7층(28m)에서 15층(45m)... "
2026-04-18,네이버뉴스,불붙은 송파 ‘비잠실’ 재건축…방이 대림가락 866세대로 탈바꿈 [코주...,https://www.sedaily.com/article/20033977?ref=naver,대림가락아파트와 인근 한양3차는 각각 재건축을 추진하면서도 동일 시공사를 선정해 하나의 브랜드로 통합 개발하는 방식이 추진되는 등 사업 방식도 진화하고 있다. 이 같은 속도전은 송파구 비잠실권 재건축이 빠르게... 
2026-04-17,네이버뉴스,"중구 신당9구역, 정비계획 변경 확정",https://www.siminilbo.co.kr/news/newsview.php?ncode=1160288538768246,"당초 이곳에는 공동주택 등 건물 8개동, 315세대와 부대시설 건립이 계획돼 있었지만, 낮은 사업성으로 시공사 선정이 네 차례 유찰되는 등 추진에 난항을 겪어 왔다. 이번 계획 변경으로 최고 높이는 기존 7층(28m)에서... "
2026-04-17,네이버뉴스,"41년 된 인천 부평 현대1단지 재건축, 조합설립 추진위 구성 취소...신탁...",http://www.incheonnews.com/news/articleView.html?idxno=435649,"이날 부평구가 조합설립추진위원회를 취소, 자동 해산한 만큼 주민들은 신탁사와 소통할 최소한의 주민 대표 기구를 구성해 운영하면서 건축설계, 경관·교통·건축심의, 사업시행계획 수립·인가, 시공사 선정 절차를... "
2026-04-17,네이버뉴스,"신당9구역, 정비계획 변경 확정…최고 15층, 504가구 공급",https://www.newsis.com/view/NISX20260417_0003595975,"당초 공동 주택 등 건물 8개동, 315세대와 부대시설 건립이 계획돼 있었지만 사업성 악화로 시공사 선정이 4번 유찰되는 등 추진에 난항을 겪었다. 이번 계획 변경으로 최고 높이는 기존 7층(28m)에서 15층(45m)으로, 상한... "
2026-04-18,네이버뉴스,"주거문화 설계의 선두주자, 제2의 도약 앞둔 '주식회사 하슬라'",http://woman.chosun.com/news/articleView.html?idxno=125493,"단순 가전 공급을 넘어 '주거문화 설계'로 도약 하슬라는 시공사, 시행사, 재개발 및 재건축 시장에서 시스템에어컨과 빌트인가전을 선도적으로 공급하는 LG전자의 우수 협력업체다. 대단지 신축 아파트 및 오피스텔에... "
2026-04-17,네이버뉴스,"나우동인, 염창 우성1·2차·삼천리 재건축 설계 수주전 출사표",https://www.newspim.com/news/view/20260417000901,"나우동인은 재개발 및 재건축 사업을 수행하며 쌓아온 경험을 토대로, 조합원이 체감할 수 있는 사업성과... 나우동인이 이번 설계 수주전에서 내세우는 주요 강점은 무엇인가요? A. 압구정3구역, 성수 트리마제 등... "
2026-04-17,네이버뉴스,"[이로운인터뷰]유보화 성동구청장 예비후보 ""성과는 이어가고 변화는 멈...",https://www.eroun.net/news/articleView.html?idxno=78492,"핵심 공약으로는 왕십리를 서울 동북권 글로벌 비즈니스 허브로 조성하고, 동북선 연장 등 교통 혁신과 성수 혁신경제 확산을 추진하는 한편, 재개발·재건축 등 정비사업과 교육환경 개선, 통합돌봄 체계 구축, 스마트... "
2026-04-18,네이버뉴스,[법조광장] 국가지식재산위원회의 의결기구 격상 환영,https://www.lawtimes.co.kr/news/articleView.html?idxno=219428,반면에 한국은 체코 등에 엄청난 원전건설 수주를 따놓고도 미국 웨스팅하우스와의 지식재산권 분쟁 때문에 계약이 보류되었다가 결국 영업비밀에 관하여 엄청난 로얄티를 지불하기로 하여 일단락 되었다. 인간의... 
2026-04-17,네이버뉴스,"""기름길 막히자 원전으로""...이란 전쟁이 불러온 '원자력 르네상스'",https://www.ytn.co.kr/_ln/0104_202604172243067465,"원전 건설에 오랜 시간이 걸리는 만큼, 지금의 위기에는 재생 에너지가 더 효율적이라는 겁니다. [렉스 아만시오 / 세계재생에너지연합 아태 책임자 : 우리가 현재 겪고 있는 위기 상황에서 국가와 기업, 국민이 지금 당장... "
2026-04-17,네이버뉴스,[자막뉴스] 중동발 연료 끊기자 '패닉'...원전 부활시키는 국가들,https://www.ytn.co.kr/_ln/0134_202604171921398999,"원전 건설에 오랜 시간이 걸리는 만큼, 지금의 위기에는 재생 에너지가 더 효율적이라는 겁니다. [렉스 아만시오 / 세계재생에너지연합 아태 책임자 : 우리가 현재 겪고 있는 위기 상황에서 국가와 기업, 국민이 지금 당장... "
2026-04-17,네이버뉴스,"獨 정치권서 잇따라 '원전 재가동' 주장 제기돼… 여당 원내대표 ""반드...",https://www.newspim.com/news/view/20260417001080,"기사당 대표인 동시에 바이에른주(州) 총리를 맡고 있는 마르쿠스 죄더는 지난달 탈원전 정책 재검토를 주장하며 ""우리 주에 소형모듈원자로(SMR) 건설 계획을 추진하겠다""고 밝혔다. AfD는 더욱 적극적인 행보에 나서고... "
2026-04-17,네이버뉴스,"환경단체 ""기후에너지환경부, 전기본 대국민 3차 토론회 졸속 추진""",https://www.ngonews.kr/news/articleView.html?idxno=228546,"환경단체는 ""더욱 문제가 되는 것은 12차 전기본 수립 논의가 이미 착수된 지난 1월 26일 이재명 정부는 '신규 원전을 계획대로 건설하겠다고 발표'한 것""이라면서 ""이는 윤석열 정부에서 진행된 11차 전기본을 계승하겠다고... "
2026-04-17,네이버뉴스,"기후부, 22일 12차 전기본 토론회…2040년까지 전력수요 공개",https://www.sedaily.com/article/20033869?ref=naver,앞서 지난해 12월과 올해 1월 열렸던 1·2차 토론회는 11차 전기본상 신규 대형 원전과 소형모듈원전(SMR)을 원안대로 건설할지를 결정하는 자리였다. 이번 대국민 토론회에서는 12차 전기본 계획 기간인 2026년~2040년... 
2026-04-17,네이버뉴스,"中 ""비화석에너지 공급 10년 뒤 2배로…신형에너지 시스템 속도""",https://www.yna.co.kr/view/AKR20260417122000009?input=1195m,"식량·에너지 통제권 강조…중국, 원전 설비용량 세계 1위 러시아·우크라이나 전쟁과 중동 전쟁 등... 왕 부주임은 특히 에너지 분야에 대해 에너지 생산·비축 시스템 건설 및 녹색 전환 움직임을 소개하면서 이를 통해... "
2026-04-17,네이버뉴스,"中, 태양광 대미수출 규제 검토…전력수급 차질에 AI인프라 제동 우려",https://www.ziksir.com/news/articleView.html?idxno=131146,"에너지업계 한 관계자는 ""태양광업계는 수혜를 확대하려면 미국 사업장 만큼은 최대한 중국 공급망을 배재해야 하는 상황""이라며 ""원전도 건설기간이 짧은 SMR 기술 상용화를 빠르게 앞당겨야 한다""고 설명했다."
2026-04-18,네이버뉴스,"“에너지 전환, 일자리 전환 담보 못해”…재생에너지공사 반대하는 노...",https://www.ekn.kr/web/view.php?key=20260417024247787,"김동규 서부발전노동조합 위원장은 “해상풍력 등 재생에너지 사업에 발전공기업이 실질적으로 참여할 수... 석탄발전은 연료 투입과 설비 운영 중심의 상시 인력 구조인 반면, 태양광·풍력은 건설·설치 중심으로 고용... "
2026-04-18,네이버뉴스,"[6·3 지선 주자] 김현기 강남구청장 후보 ""강남 역차별 끊겠다…낸 만...",https://www.newspim.com/news/view/20260417000962,"""강남 구민이 받는 복지와 인프라, 행정 서비스는 세금 규모에 턱없이 못 미친다. 강남이라는 이유로 규제는... 내 착공 단지의 재건축 속도를 2년 이상 단축하겠다""고 했다. 세금 부담 완화 제도 도입도 강조했다. 재산세... "
2026-04-18,네이버뉴스,[공약] 김해시장 선거 레이스 점화… 여야 후보 ‘4인 4색 공약’ 승부...,https://www.viva100.com/article/20260417500664,"조기 착공을 약속했다. 특히 만년 적자인 경전철 문제 해결을 위해 ‘김해시교통공단’을 설립, 대중교통... 돌봄 노동자 직접고용을 통한 통합돌봄센터 설치를 핵심 공약으로 내세우며 공공 인프라 강화를 강조했다. 경남="
2026-04-18,네이버뉴스,수서~광주 복선전철 실시계획 승인… 광주 교통망 전환점,https://www.discoverynews.kr/news/articleView.html?idxno=1089311,이번에 승인된 구간은 성남시 수정구 복정동에서 광주시 역동 경기광주역에 이르는 노선 가운데 우선 착공이... 광주시는 이번 사업이 단순한 교통 인프라 확충을 넘어 지역 균형 발전의 기반이 될 것으로 보고 있다.... 
2026-04-17,네이버뉴스,1조 2000억 '인공태양' 품은 나주… '에너지 테크노폴리스' 조성 속도,https://www.newscj.com/news/articleView.html?idxno=3394553,나주시 왕곡면 일원에 들어설 이 시설은 오는 2028년 착공해 2036년 준공을 목표로 핵융합 핵심 기술을 연구... ◆학계·정치권 협력 통한 연구 인프라 확보 핵융합 산업에 필요한 전문 인력 양성 체계도 정비한다. 시는... 
2026-04-17,네이버뉴스,"서울교육대, 보미건설과 '상생형 실내테니스장' 첫 삽… 지역사회 생활...",https://www.kyosu.net/news/articleView.html?idxno=204103,"건립 착공 기념행사'를 성황리에 개최했다고 밝혔다. 이날 기공식에는 장신호 서울교대 총장, 전성수... 이는 민간을 통해 지자체와 국립대학이 지역 발전을 위해 상생 협력하여 공공 인프라를 확충하는 시도라는 점에서... "
2026-04-17,네이버뉴스,[기고][고병욱의 경제동향] 고유가와 부동산 : 에너지 가격이 재편하는...,https://www.lcnews.co.kr/news/articleView.html?idxno=200962,"사업성이 낮아진 프로젝트는 착공이 지연되거나 취소될 수 있으며, 진행 중인 사업은 분양가 상승 압력을... 대중교통 인프라 확충, 친환경 건축 기준 강화, 전기차 인프라 확대 등이 대표적이다. 이러한 정책 변화는 특정... "
2026-04-17,네이버뉴스,"해남군, 산이변전소 신축 인허가 최종 승인…국가AI컴퓨팅센터 전력공급...",https://sports.donga.com/region/article/all/20260417/133760595/1,"7월 착공에 들어갈 계획이다. 2028년 4월 준공을 목표로, 국가인공지능(AI)컴퓨팅센터 구축 일정에 발맞춰... 군 관계자는 “산이변전소는 국가적 과제인 인공지능 인프라 구축의 선결 조건”이라며, “이번 허가를 통해... "
2026-04-17,네이버뉴스,"與 최민희, 김윤덕 국토부 장관 만나 '남양주 3대 철도 현안 속도 추진...",https://news.tvchosun.com/site/data/html_dir/2026/04/17/2026041790248.html,"최 의원은 “남양주는 수도권 동북부 핵심 거점임에도 철도 인프라는 수요를 따라가지 못하고 있다”며 “이제는 계획을 나열할 단계가 아니라, 실제 착공과 개통으로 이어지는 실행력이 필요한 시점”이라고 지적했다.... "
2026-04-17,네이버뉴스,"충주시의회, ‘충북도립 대표도서관’ 충주 건립 촉구 건의안 채택",http://www.breaknews.com/1201278,충주시의회가 충북의 문화 균형발전과 북부권 인프라 확충을 위해 ‘충북도립... 즉시 착공이 가능하며 대규모 주차장과 보존서고 등 부대시설 조성에도 유리한... 
2026-04-17,네이버뉴스,서울교대 보미건설과 '상생형 실내테니스장' 첫 삽…  지역사회 생활 체...,https://www.veritas-a.com/news/articleView.html?idxno=606427,"서울교대(총장 장신호)는 지난 4월 15일 오전 11시, 대학 내 야외테니스장 부지에서 '실내테니스장 건립 착공... 이는 민간을 통해 지자체와 국립대학이 지역 발전을 위해 상생 협력해 공공 인프라를 확충하는 시도라는... "
2026-04-17,네이버뉴스,"로이터 / 4.13 이 대통령·폴란드 총리, 방산 협력 확대 강조 [외신에 비...",https://www.ktv.go.kr/content/view?content_id=752697,"은 또, 두 정상이 에너지와 인프라, 첨단 산업 분야 등 광범위한 분야로 파트너십을 확대하기로... 로이터 / 4.14 한국, 대통령 세종집무실 건립···내년 8월 착공 마지막 소식입니다. 한국 정부가 세종시에... "
2026-04-17,네이버뉴스,"[인터뷰] 이용운 부산시의원 후보 “사람 떠난 서구, 다시 머무는 도시...",http://www.inews24.com/view/1961227,관광과 지역경제를 잇는 기반으로는 교통 인프라를 제시했다. 이 후보는 “송도선 도시철도(트램) 조기 착공을 통해 접근성을 개선해야 한다”며 “관광 자원과 상권을 연결하는 핵심 축이 될 것”이라고 확신했다. 다만... 
2026-04-17,네이버뉴스,봄 바다 연 기장...축제·관광·복지 잇는 지역 활성화 전략 가동,https://www.ajunews.com/view/20260415221437713,"교통 인프라 확충도 병행된다. 기장군은 부산시와 도시철도 정관선 건설 협약을 체결하고 사업 추진에 속도를 내고 있다. 정관선은 부산·양산·울산을 잇는 광역 철도망 구축의 핵심 축으로, 2028년 착공과 2032년 개통을... "
2026-04-17,네이버뉴스,"경남도 1조원대 투자유치, 대한민국 '경제수도' 도약 발판 다진다",http://www.enewstoday.co.kr/news/articleView.html?idxno=2420233,"이어 ""경남은 풍부한 산업 인프라를 기반으로 글로벌 산업 중심지로 도약할 것""이라며 ""기업 투자가... 경남도는 이번 투자협약이 신속한 착공과 고용 창출로 이어질 수 있도록 투자 전담 지원체계를 공고히 가동하고... "
2026-04-17,네이버뉴스,"1년새 9억 폭등한 송파 '올림픽 3대장', 26층 6787가구로 재건축",https://realty.chosun.com/site/data/html_dir/2026/04/17/2026041702437.html,"생활 인프라도 확충한다. 가락시장역 인근에는 지역 주민이 이용할 수 있는 사회복지시설과 공공체육시설... (2026년 착공 예정) 및 현대차 글로벌비즈니스센터(GBC, 2031년 준공 목표) 등 인근 대형 개발 호재까지 입으면... "
2026-04-17,네이버뉴스,"태백시, 500억 규모 '실내 스포츠타운' 조성",https://www.shinailbo.co.kr/news/articleView.html?idxno=5012001,아울러 175억 원 규모의 '청정고원 스포츠센터'와 125억 원 규모의 '태백 休(휴) 전지훈련센터' 역시 2026년 준공 및 착공을 목표로 순항 중이다. 특히 휴(休) 전지훈련센터는 숙박과 훈련이 결합된 체류형 인프라로... 
2026-04-17,네이버뉴스,"강화군, 해안순환도로 '연결 시동'… 황청~창후 구간 푼다",https://www.newsclaim.co.kr/news/articleView.html?idxno=3061091,"특히 계양~강화 고속도로 착공, 광역시도60호선 승격, 강화 경제자유구역 지정 추진 등 지역 개발 여건... 강화 서북부 해양 관광 인프라 간 연계 효과도 기대된다. 박용철 강화군수는 ""해안순환도로 완성은 관광 경쟁력... "
2026-04-17,네이버뉴스,"한화에어로, 지상방산 수출 '분수령'…美 뚫고 유럽·중동 벽 넘는다",https://daily.hankooki.com/news/articleView.html?idxno=1359367,"시험 인프라, 미사일·드론 개발을 위한 연구개발(R&D) 센터도 구축할 계획이다. 이 같은 전략의 일환으로 지난 2월 루마니아 딤보비차주에서 현지 생산시설 'H-ACE 유럽' 착공식을 개최했다. 이 공장에서는 K9 자주포와 K10... "
2026-04-18,네이버뉴스,"[뉴스AS] 중동전쟁에 아스콘값 2배 폭등…5월 셧다운 위기설, 진짤까?",https://www.hani.co.kr/arti/economy/economy_general/1254794.html,한 1군 건설사 관계자는 “대체로 대형 건설사들은 재고 비축도 되어 있고 자재 수급 루트도 다양해서 상황이 괜찮은 편”이라며 “공사비가 오르거나 공기가 다소 지연될 수는 있어도 ‘5월 셧다운’설은 다소 과장된... 
2026-04-18,네이버뉴스,용인 공사장에 뜬 드론... 사람은 열흘 걸릴 일 순식간에 끝냈다,https://www.hankookilbo.com/news/article/A2026041715250004006?did=NA,드론 조종사인 장영식 SK에코플랜트 스마트건설팀 프로가 마우스를 몇 번 클릭해 드론에 '출격 명령'을... 어떤 구역에서 땅이 얼마나 깎였고 쌓였는지 입방미터(㎥) 단위로 계산돼 공사비가 정확히 계산될 뿐 아니라... 
2026-04-18,네이버뉴스,"전북 건설업계, 수익성 악화·원자재 수급 불안에 '고사 위기' 호소",http://www.jeonmin.co.kr/news/articleView.html?idxno=438189,"전문건설협회는 새만금 개발사업 지역업체 참여 확대와 적정 공사비 현실화를, 기계설비협회는 자재비 상승 대응 및 경영부담 완화를 위한 금융지원을 요청했다. 또한 주택건설협회는 지방 아파트 매입임대 등록 재시행과... "
2026-04-17,네이버뉴스,전쟁 끝나 유가 잡혀도 공사비 안잡힐까 두렵다,https://www.cctoday.co.kr/news/articleView.html?idxno=2228786,"올해 2월 건설공사비지수는 133.69로 전년 동월보다 2.0% 상승하며 역대 최고치를 기록했다.연구원은 ""최근 최고치 기록이 이어지고 있고, 중동 지역 지정학적 리스크 등 대외 불안 요인으로 상승 흐름이 지속될 가능성이... "
2026-04-17,네이버뉴스,대전역세권 전쟁 여파에 착공 일정 조정…긴장감↑,https://www.cctoday.co.kr/news/articleView.html?idxno=2228787,"지방 건설시장을 되살리려면 공사비 지원에 그칠 게 아니라, 분양 여건 자체를 개선할 수 있는 정책이 병행돼야 한다는 목소리가 나오는 배경이다.대전의 한 건설업계 관계자는 ""건설업계가 가장 중요하게 보는 건 결국... "
2026-04-17,네이버뉴스,"샤힌에 9조 베팅한 에쓰오일, 올해 하반기 공장 완공 앞두고 재무구조 ...",https://www.newsquest.co.kr/news/articleView.html?idxno=264924,"창립 50주년을 맞은 에쓰오일이 '샤힌'이라는 이름의 대규모 석유화학 공장 건설에 9조2580억원을... 49%)을 갚는 데 전액 썼고, 6월에 발행한 4000억원 중 3200억원은 샤힌 공사비로 들어갔다. 이번에 새로 빌린 돈의... "
2026-04-17,네이버뉴스,"전북 건단련 ""건설산업 위기··· 정부, 실질적 지원·제도 개선해야""",http://www.jeollailbo.com/news/articleView.html?idxno=797901,"전문건설협회는 새만금 개발사업에 지역업체 참여를 확대하고 공사비를 현실화할 필요성을 강조했으며, 기계설비협회는 자재비 상승에 대응할 수 있는 금융지원과 경영 부담 완화 대책을 요청했다. 주택건설협회는 지방... "
2026-04-17,네이버뉴스,"""원자재 급등에 위기""…전북 건설업계, 김윤덕 장관 만나 정부 지원 요...",https://www.pressian.com/pages/articles/2026041715473120212?utm_source=naver&utm_medium=search,"국제공항 건설 행정절차 재개가 필요하다""고 강조했다. 참석 단체들도 지역 업체 참여 확대와 공사비 현실화, 금융 지원, 미분양 해소를 위한 세제 지원, 건축 규제 완화 등 다양한 개선책을 건의했다. 김윤덕 장관은 ""지역... "
