date,source,title,link,description
2026-06-18,네이버뉴스,"한수원 사장, 체코 두코바니 원전사업 점검…현지 협력 강화",https://www.newsis.com/view/NISX20260618_0003673847,"성공적인 원전 건설 모범 사례로 이행해 나가겠다""고 말했다. 한편 김 사장은 전날 프라하에서 두코바니 지역협의회 비테슬라프 요나쉬 회장을 만나 그동안 두코바니 원전사업에 보내준 현지 주민들의 전폭적인 지지와... "
2026-06-18,네이버뉴스,"환경단체 ""영덕 원전·기장 SMR 철회해야""",https://www.safetimes.co.kr/news/articleView.html?idxno=243582,"앞서 한수원 신규원전 부지선정평가위원회는 이날 경북 영덕군 영덕읍·축산면 일원을 2.8GW 규모 대형 원전 2기 건설 부지로, 부산 기장군 기장읍 일원을 0.7GW 규모 SMR 1기 건설 부지로 각각 확정했다. 신규 원전 부지가... "
2026-06-18,네이버뉴스,"오르비텍, 56억 규모 '방재환경 감시장비 유지관리 용역' 계약 체결",https://www.mt.co.kr/stock/2026/06/18/2026061813335623159,"회사 관계자는 ""오르비텍은 원전 운영 단계의 안전관리 사업뿐만 아니라 사용후핵연료 운반 및 원전 해체 분야까지 사업 영역을 확대하고 있다""며 ""국내 원전 계속운전, 신규 원전 건설 및 향후 해체시장 확대에 대비해... "
2026-06-18,네이버뉴스,"영덕군, 원전 유치로 미래 성장 기반 확보...지역 재도약 이끌 대형 국책...",http://www.metroseoul.co.kr/article/20260618500080,한국수력원자력이 신규 원전 건설 부지로 영덕군을 최종 선정하면서 이 일대가 국가 에너지 산업의 새로운 거점으로 주목받고 있다.=영덕군 제공 한국수력원자력이 1400MW급 원전 2기 건설 예정지를 영덕군으로 최종... 
2026-06-18,네이버뉴스,"국내 첫 SMR 부산에…두산에너빌, 원전 판 흔든다",https://www.wowtv.co.kr/NewsCenter/News/Read?articleId=A202606180343&t=NNv,한국수력원자력이 소형모듈원전을 포함한 신규 원전 건설 후보 부지를 발표하면서 원전업계에 다시 훈풍이 불고 있습니다. 오는 2035년 가동을 목표하는 국내 첫 SMR도 본궤도에 오르며 심장인 원자로를 맡게 될... 
2026-06-18,네이버뉴스,"경주시, SMR 초도호기 결과 수용…하지만 ""원전 중심도시 향한 질주 멈추...",https://www.eroun.net/news/articleView.html?idxno=83409,경주시는 18일 정부의 차세대 소형모듈원전(SMR) 초도호기 건설 부지 공모 결과에 대해 '승복 한다'며 하지만 미래 에너지 산업 육성을 향한 행정 기조에는 변함이 없다고 밝혔다. 경주시는 공모 탈락에 대한 깊은 아쉬움을... 
2026-06-18,네이버뉴스,8년만의 탈원전…수혜주는 어디?,https://www.ajunews.com/view/20260618141340684,이번 부지 선정으로 신규 원전 건설이 구체화되면서 관련 기업들의 수주 확대가 기대된다. 원전 정책 변화의 최대 수혜주로는 두산에너빌리티가 꼽힌다. 두산에너빌리티는 원자로와 증기발생기 등 원전 핵심... 
2026-06-18,네이버뉴스,[당신의 생각은] 대미 투자 公社는 20년 존속 vs 프로젝트 기간은 무제한,https://biz.chosun.com/policy/policy_sub/2026/06/18/5S7Y5VCIW5A2TI7TBVHJOCCKK4/?utm_source=naver&utm_medium=original&utm_campaign=biz,하지만 산업통상부는 원전 등 장기 투자가 불가피한 사업이 있기 때문에 기간을 제한할 수는 없다고 한다.... 화력발전소 건설 ▲조지아주의 인공 다이아몬드 제조 시설 건설 ▲텍사스주의 석유·가스 수출 항만 정비... 
2026-06-18,네이버뉴스,[대구일보 픽 이주의 TK 정치인] '신규 원전 유치 숨은 공신' 박형수 의...,https://www.idaegu.com/news/articleView.html?idxno=663719,영덕군이 총 2.8GW(기가와트) 규모의 신규 대형 원전 건설 부지로 최종 선정되면서 지역사회가 새로운 도약의 전기를 맞고 있다. 문재인 정부 시절 탈원전 정책으로 천지원전 사업이 무산되며 좌절을 겪었던 영덕은 이번... 
2026-06-18,네이버뉴스,"‘원전 잔혹사’ 딛고 일어선 영덕, ‘원전 1세대’에서 차세대 SMR로 이...",https://www.ekn.kr/web/view.php?key=20260618026494390,대형원전 2기 후보지로 선정된 경북 영덕은 과거 천지원전 건설 후보지로 지정됐다가 취소된 바 있어 주민수용성과 부지 적정성에서 높은 점수를 받았다. 소형모듈원전(SMR) 후보지로 선정된 부산 기장은 국내 원전... 
2026-06-18,네이버뉴스,"경북 영덕, 신규 대형원전 최종 낙점…AI 시대 전력 수요 대응 ‘국가 에...",https://www.pressian.com/pages/articles/2026061814295015479?utm_source=naver&utm_medium=search,"한국수력원자력은 지난 17일 외부 전문가로 구성된 신규 원전 부지 선정 평가위원회를 열고, 제11차 전력수급기본계획에 반영된 신규 대형 원전 건설 후보지로 영덕군을 확정했다고 밝혔다. 영덕군은 종합평가에서 91.... "
2026-06-18,네이버뉴스,"""AI 시대, 대형원전 2기 건설론 부족…장기 20기 더 지어야""",https://view.asiae.co.kr/article/2026061814284169535,"신규 원전 후보지가 최종 결정되면서 국내 원전 건설이 다시 본궤도에 올랐다. 정부는 경북 영덕에 대형 원전 2기, 부산 기장에 국내 첫 상용 소형모듈원자로(SMR) 1기를 건설할 계획이다. 하지만 원전업계와... "
2026-06-18,네이버뉴스,15년 만에 다시 도는 원전 시계…전력망·폐기물 처리는 숙제,https://www.sisajournal.com/news/articleView.html?idxno=376964,원전 업계에서는 사실상 중단됐던 신규 원전 건설이 다시 궤도에 오르면서 이재명 정부의 '에너지 믹스' 기조가 본격화됐다는 평가가 나온다. 다만 전력망 확충과 고준위 방사성폐기물 처리시설 확보라는 난제가... 
2026-06-18,네이버뉴스,"울산범시민대책위 ""한수원, 새 원전 부지선정 철회하라""",https://www.newsis.com/view/NISX20260618_0003674445,"이들은 ""신규원전의 건설 허가가 날 때까지 2~3년 정도 걸린다. 이 기간 정부와 한수원의 계획을 백지화 시키기 위해 활동을 펼치겠다""며 ""이재명 정부는 핵 진흥 정책을 중단해야 한다. 한수원은 신규 핵시설 부지 선정을... "
2026-06-18,네이버뉴스,고리1호기 잇는 미래원전… 기장 SMR 품었다,https://www.kmib.co.kr/article/view.asp?arcid=0029987027&code=61141111&cp=nv,부산 기장군이 국내 첫 혁신형 소형모듈원자로(SMR) 건설 후보지로 선정됐다. 대한민국 최초 상업용 원전인 고리1호기가 가동된 '원전 1번지' 기장이 차세대 원전 산업의 중심지로 부상할 가능성이 커졌다.... 
2026-06-18,네이버뉴스,"영덕군, 신규 원전 건설 부지 최종 선정…SMR 후보지는 부산 기장군",https://www.sisajournal.com/news/articleView.html?idxno=376858,"김광열 영덕군수는 입장문을 통해 ""한수원의 신규원전 건설 부지 선정 결과, 영덕군이 새로운 원전 유치 지역으로 최종 확정됐다""며 ""이는 단순히 국책사업 하나를 유치한 것을 넘어 영덕의 100년 미래를 새롭게 설계할 수... "
2026-06-18,네이버뉴스,"영덕 원전 2기 품은 경북…""AI·반도체도 전력 따라 와야""",https://www.idaegu.com/news/articleView.html?idxno=663717,신규 원전 건설부지로 영덕이 선정된 의미가 단순히 원전 2기를 추가 확보했다는 데 그치지 않는 대목이다. 실제로 경북은 이미 미래산업 전환의 기반을 갖추고 있다. 포항에서는 대규모 AI 데이터센터 구축이 추진되고... 
2026-06-18,네이버뉴스,"[오마이포토] ""신규 핵발전소·SMR 어디에도 안 돼""",https://www.ohmynews.com/NWS_Web/View/at_pg.aspx?CNTN_CD=A0003244352&CMPT_CD=P0010&utm_source=naver&utm_medium=newsearch&utm_campaign=naver_news,"7GW 규모 SMR(소형모듈원전) 1기 건설 부지로 각각 확정하자 18일 지역의 여러 단체로 꾸려진 탈핵부산시민연대가 부산시청 광장을 찾아 규탄 기자회견을 열고 있다. 이들은 ""이재명 정부와 한수원이 마치 자발적으로... "
2026-06-18,네이버뉴스,[분석] 탈석탄의 역설… 탄소중립은 가는데 지역은 무너진다,https://www.energydaily.co.kr/news/articleView.html?idxno=200551,"지역 상권, 자영업, 건설업, 물류업까지 영향을 받는다. 실제 해외에서는 이미 '정의로운 전환(Just Transition)... 또 LNG, 수소, 암모니아 혼소, 원전, 양수발전 등 차세대 발전산업으로 사업 영역을 확대할 수 있도록 발전사와... "
2026-06-18,네이버뉴스,"원전·SMR 유치 숙원 푼 영덕·기장 ""지역발전"" 환호…환경단체는 “즉...",http://www.segyebiz.com/newsView/20260618511051?OutUrl=naver,인구 약 3만 명의 영덕은 신규 원전건설을 통해 지속적인 인구 감소와 지역경제 침체라는 구조적 문제를 해결하겠다는 각오다. 기장군이 소형모듈원자로(SMR) 건설 부지로 선택 받았다. 사진은 앞서 기장군 관계자들이... 
2026-06-18,네이버뉴스,신규 대형원전 '영덕'…SMR은 '기장'에 첫발,http://www.newstomato.com/ReadNews.aspx?no=1304432&inflow=N,"평가위원회는 ""우리 위원회는 산업 생태계를 지탱할 기저 전원으로서의 역할과 지역 상생을 최우선으로 고려해 최적의 입지를 찾고자 노력했다""면서 한수원에는 ""여론조사 과정에서 확인된 원전건설 찬성과 반대 이유... "
2026-06-18,네이버뉴스,"한수원, 신규 원전 후보지 선정… “대형원전은 영덕, SMR은 기장”",http://digitalchosun.dizzo.com/site/data/html_dir/2026/06/18/2026061880074.html,"송정현 기자 | 신규 원전 건설 후보지로 경북 영덕군과 부산 기장군이 선정됐다. 신규원전 부지선정평가위원회는 제11차 전력수급기본계획에 반영된 신규 원전 건설 후보지 평가 결과 대형원전은 영덕군, 소형모듈원전... "
2026-06-18,네이버뉴스,"기장군, 혁신형 SMR 최종 부지로 확정",https://www.busan.com/view/busan/view.php?code=2026061813540696599,기장군(군수 정종복)은 한수원(주)이 추진하는 대한민국 최초의 혁신형 소형모듈원자로(i-SMR) 건설사업의... 고리원전 유휴부지의 활용 가능성과 사업 효율성을 지속적으로 설명해 왔다. 기장군에 들어설 혁신형 SMR... 
2026-06-18,네이버뉴스,"경북도, 영덕에 신규 대형원전 2기 유치 최종 확정...12조 규모 사업 본...",https://news.bbsi.co.kr/news/articleView.html?idxno=4089915,아울러 원전 건설의 최대 관건인 주민 수용성 조사에서도 86.18%라는 압도적인 찬성률을 기록하며 경쟁 지역을 크게 따돌렸습니다. 이번에 유치한 원전은 총 2.8GW 규모의 한국형 대형 원전인 APR1400 2기입니다. 건설 부지는... 
2026-06-18,네이버뉴스,"원전 유치 영덕에 2조3000억 지원... 경북, 국가 최대 에너지 공급 기지...",https://www.hankookilbo.com/news/article/A2026061813280002804?did=NA,"원전 건설 비용으로 약 12조 원이 투입된다. 향후 건설 기간 8년과 운전 기간 60년을 합쳐 68년간 법정 지원금 약 2조3,000억 원이 순차적으로 지원된다. 법정 지원금은 특별지원금과 기본·사업자 지원금, 지방세 수입으로... "
2026-06-18,네이버뉴스,"'중동 재건+대미투자특별법'…HD건설기계·두산밥캣, 글로벌 빅마켓 '기...",https://www.newsis.com/view/NISX20260618_0003674131,"있다 건설기계 업황 회복 기대를 키우는 또 다른 변수는 미국 시장이다. 이날부터 본격적으로 효력이 발생하는 한미적략적투자특별법을 계기로 액화천연가스(LNG)와 원전, 전력 인프라 분야를 중심으로 한미 간 대규모... "
2026-06-18,네이버뉴스,'신규원전 2기' 경북 영덕에...SMR 1호는 부산 기장,https://science.ytn.co.kr/program/view.php?mcd=0082&hcd=&key=202606181100057342,"신규 대형원전 2기가 건설될 후보 부지로 경북 영덕군이, 국내 첫 소형모듈원자로 SMR 부지로는 부산 기장군이 선정됐습니다. 대규모 전력을 필요로 하는 인공지능 시대, 우리 기술 발전과 산업 생산의 토대가 마련될... "
2026-06-18,네이버뉴스,"국내 최초 '혁신형 SMR' 최종 부지로 확정…기장군, 경주 제쳤다",https://www.onews.tv/news/articleView.html?idxno=281718,"이번 부지선정평가는 주민 수용성, 사업 추진 여건, 부지 활용성 등 원전 건설 전반에 필요한 다각적인 항목을 바탕으로 진행됐다. 기장군은 다양한 평가 항목에서 고르게 우수한 성적을 거두었으며, 특히 주민... "
2026-06-18,네이버뉴스,부산 신규 원전 계획에 탈핵단체 “시민 생명·안전에 위해…철회해야...,https://www.hani.co.kr/arti/area/yeongnam/1264148.html,"7기가와트급 소형모듈원전 1기 터로 부산 기장군을 각각 선정했다. 부지선정위원회는 부지 적정성과 환경성, 건설 적합성, 주민 수용성(각 25점) 등을 평가해 최종 후보지를 선정했다고 설명했다."
2026-06-18,네이버뉴스,"기장군, 혁신형 SMR 최종 부지 확정…경주시 제치고 한수원 평가 1위",http://www.ikld.kr/news/articleView.html?idxno=336186,최일경 건설사업본부장).(사진_기장군) 기장군이 한국수력원자력이 추진하는 대한민국 첫 혁신형... 기장군은 전담 TF를 꾸려 한수원 소유 고리원전 유휴부지 활용 가능성과 사업 효율성을 설명해왔다. 기장군에 들어설... 
2026-06-18,네이버뉴스,"경북도 '영덕, 대형원전 후보지 선정' 환영",https://www.newspim.com/news/view/20260618000615,"대형원전 2기 건설후보지로 최종 선정된 영덕신규원전 예정지[사진=한수원] 2026.06.18 nulcheon@newspim.com ◆ 영덕군이 최종 후보지로 선정된 배경은 영덕군의 신규 원전 건설 예정지인 영덕읍 석리, 노물리 일원은 지난... "
2026-06-18,네이버뉴스,"기장군, 대한민국 첫 혁신형 SMR 최종 부지 선정… 미래 원자력산업 중...",http://www.enewstoday.co.kr/news/articleView.html?idxno=2440218,기장군(군수 정종복)이 한국수력원자력㈜이 추진하는 대한민국 최초의 혁신형 소형모듈원자로(i-SMR) 건설사... 고리원전 유휴부지의 활용 가능성과 사업 효율성을 적극 설명하는 등 체계적인 유치 전략을 추진해 왔다.... 
2026-06-18,네이버뉴스,"경주시, SMR 초도호기 결과 수용…""원자력산업 육성은 멈추지 않을 것""",https://www.m-i.kr/news/articleView.html?idxno=1382865,앞서 한국수력원자력 신규원전 부지선정평가위원회는 17일 0.7GW(기가와트) 규모 SMR 1기 건설 부지로 부산 기장군을 선정한 바 있다. 기장군과 SMR 유치를 놓고 경쟁했던 경주시는 이번 선정 결과에 아쉬움을 표하면서도... 
2026-06-18,네이버뉴스,영덕 대형원전·기장 SMR 확정…한국 에너지정책의 분...,https://www.naeil.com/news/read/592363?ref=naver,"원전 건설 자체보다 송전망 확충, 전력수요 예측, 재생에너지와의 공존 등 복합적인 과제를 해결해야 하기 때문이다. ◆송전망 효율 높이는 방안도 검토할 만 = 원전 확대 정책의 최대 걸림돌로는 송전망 문제가 꼽힌다.... "
2026-06-18,네이버뉴스,'60년 자원개발 역사' 강조한 SK '새 에너지',https://weekly.hankooki.com/news/articleView.html?idxno=7169034,NRC가 신규 상업용 원전 건설을 허가한 것은 10년 만이며 SMR과 같은 첨단 원전의 건설 승인은 미국 내 최초 사례다. 테라파워는 빌 게이츠가 2008년 설립한 차세대 SMR 기업이다. 특히 테라파워의 SMR 기술은 ESS를... 
2026-06-18,네이버뉴스,수조원대 원전 유치 기대효과…경북 영덕·부산 기장군 들썩,https://www.segye.com/newsView/20260618509697?OutUrl=naver,"영덕군 제공 한국수력원자력 신규 원전 건설 부지선정평가위원회는 17일 오후 1400㎿급 대형 원전 2기는 2038년까지 영덕군에, 700㎿급 SMR 1기는 2035년까지 기장군에 건립한다고 발표했다. 이에따라 영덕군과 기장군은... "
2026-06-18,네이버뉴스,"SMR 부지 선정에 기장군 ""환호"" 탈핵단체 ""규탄""",https://www.newsis.com/view/NISX20260618_0003674273,"반복될 것은 자명하다""며 ""SMR 부지 선정을 전면 철회해야 한다""고 강조했다. 제11차 전력수급기본계획에 따라 군에는 0.7GW(기가와트) 규모의 SMR이 2035년 준공을 목표로 건설될 예정이다. 부지는 고리원전 내 유휴 용지다．"
2026-06-18,네이버뉴스,"오르비텍, 한수원과 56억 규모 원전 감시장비 유지관리 계약 [공시록]",http://www.fnnews.com/news/202606181236568928,"오르비텍 관계자는 ""원전 운영 단계 안전관리 사업과 함께 사용후핵연료 운반, 원전 해체 분야로 사업 영역을 넓히고 있다""며 ""국내 원전 계속운전과 신규 원전 건설, 향후 해체시장 확대에 대응해 원전 전주기 사업... "
2026-06-18,네이버뉴스,[산업 콕!] AI 열풍에 메모리 품귀...금값 된 핸드폰,http://www.00news.co.kr/news/articleView.html?idxno=104530,"SK하이닉스가 들어서는 일반산업단지는 1단계로 신안성 변전소와 동용인 변전소를 잇는 송전선로를 구축해 2.8GW의 전력을 공급하고, 2단계로 동해안의 원전 및 발전 전력을 용인으로 연결하는 초고압 송전선로를 건설해... "
2026-06-18,네이버뉴스,신규 대형 원전은 경북 영덕‥첫 소형은 부산 기장,https://imnews.imbc.com/replay/2026/nw1200/article/6831132_36967.html,"영덕군은 2011년 원전 건설 예정지로 선정됐다가 문재인 정부의 탈핵 기조에 따라 사업이 중단된 바 있습니다. 우리나라 첫 소형모듈원자로, SMR 후보 부지에는 부산 기장군이 선정됐습니다. 기장군은 87.11점으로, 84.... "
2026-06-18,네이버뉴스,신규 대형원전 2기 영덕에… 첫 SMR은 기장에 짓는다,http://www.metroseoul.co.kr/article/20260618500087,"평가위원회는 ""여론조사 과정에서 확인된 원전건설 찬성과 반대이유, 개선점 등의 주민 의견은 향후 지역과의 협력방안 구상시 잘 활용해 주시길 부탁드린다""고 당부했다. /세종="
2026-06-18,네이버뉴스,신규 원전·SMR 부지 확정… “AI 수요 맞추려면 더 지어야”,https://www.munhwa.com/article/11596519?ref=naver,부지 선정 후 실제 원전 건설 기간이 통상 7∼8년 걸리는 점을 감안하면 2년마다 수립되는 12·13차 전기본 등에도 꾸준히 신규 원전 계획이 반영돼야 2040년까지 예상되는 최소 6기의 신규 원전 수요를 맞출 수 있다는... 
2026-06-18,네이버뉴스,"기장군, 혁신형 SMR 최종 부지 확정",https://www.pressian.com/pages/articles/2026061811220084105?utm_source=naver&utm_medium=search,(i-SMR) 건설사업 최종 부지로 선정됐다. 이번 선정으로 기장군은 첨단 원자력 산업의 핵심 거점 조성과 관련... 고리원전 유휴부지의 활용 가능성과 사업 효율성을 지속적으로 설명해 왔다. 기장군은 이번 부지 선정을... 
2026-06-18,네이버뉴스,신규 원전 경북 영덕·첫 SMR 부산 기장…탈원전 마침표,https://biz.sbs.co.kr/article_hub/20000317367?division=NAVER,"한국수력원자력이 신규 대형 원전 건설 후보지로 경북 영덕군을, 국내 첫 소형 모듈원자로, SMR 부지로는 부산 기장군을 선정했습니다. 신규 원전 부지가 선정된 건 2011년 이후 처음인데, 선정의 이유와 남은 절차들... "
2026-06-18,네이버뉴스,"신규 원전 후보 부지에 영덕, 경주는 SMR 부지 선정 탈락",https://www.newsmin.co.kr/news/133943/,"평가위원회는 “우리 위원회는 산업 생태계를 지탱할 기저 전원으로서의 역할과 지역 상생을 최우선으로 고려해 최적의 입지를 찾고자 노력했다”며 ”여론조사 과정에서 확인된 원전 건설 찬성과 반대 이유, 개선점 등... "
2026-06-18,네이버뉴스,"영덕·기장에 신규 원전 확정, 15년 허송세월 뼈아프다[사설]",https://www.munhwa.com/article/11596465?ref=naver,"한국수력원자력 신규 원전 부지선정평가위원회는 17일 영덕군에 1.4GW급 대형 원전 2기, 부산 기장군에 국내 첫 0.7GW급 소형모듈원자로(SMR) 1기를 건설하기로 했다. 새 원전 입지가 정해진 것은 2011년 강원 삼척 대진원전... "
2026-06-18,네이버뉴스,"[초점] 원전 부지 선정, '지역 상생'이 국책사업 새로운 모델",https://www.todayenergy.kr/news/articleView.html?idxno=299220,향후 성공적인 원전 건설과 가동을 위해서는 몇 가지 당면 과제를 해결해야 한다. 여론조사 과정에서 확인된 원전 건설 반대 주민들의 우려와 의견을 적극적으로 수렴해야 한다 한국수력원자력은 일방적인 보상을 넘어... 
2026-06-18,네이버뉴스,새울원전 주변 환경방사능 조사결과 '이상 없음',https://www.cnbnews.com/news/articleView.html?idxno=1005056,이처럼 철저한 환경 안전성 검증을 바탕으로 소통을 강화하고 있는 새울원자력본부는 최근 신규 원전 건설 및 본격적인 가동 준비에도 한층 속도를 내며 지역사회의 주목을 받고 있다. 특히 새울원전 3호기(구 신고리... 
2026-06-18,네이버뉴스,"경상북도 ""영덕 원전 2기 건설비 약 12조 원""",https://dgmbc.com/NewsArticle/846419,"경상북도는 영덕이 신규 대형 원전 2기 건설 후보지로 최종 선정됨에 따라 전담 지원체계를 가동합니다. 경상북도는 영덕군이 유치한 신규 원전은 총 2.8GW 규모의 한국형 대형 원전 2기로, 건설 비용이 12조 원에 이를... "
2026-06-18,네이버뉴스,국내 첫 SMR 시대 연다…‘원전 수출 자격증’ 따는 한국 [신규 원전 부...,https://biz.heraldcorp.com/article/10774810?ref=naver,2031년까지 원안위 건설 허가를 받지 못하면 기후에너지환경부가 예정한 준공 목표 일정이 지연될 수 있다. 대형 원전인 신한울 2호기의 경우 안전성 강화 조치 등이 겹치며 6년 넘게 공기가 길어진 전례가 있었다.... 
2026-06-18,네이버뉴스,"'에너지믹스 시대' 공식화··· 영덕에 새 원전, 기장에 SMR 세운다",https://www.greenpostkorea.co.kr/news/articleView.html?idxno=306945,대선후보 시절부터 재생에너지 중심 에너지 전환을 주장해온 이재명 대통령이 집권 초반 신규 원전 건설에 회의적인 태도를 보이다 결국 원전 확대 쪽으로 방향을 튼 끝에 나온 결과이기 때문이다. 인공지능(AI)... 
2026-06-18,네이버뉴스,"'영덕 2기, 기장 SMR' 선정에 원전주 기지개",https://www.koreareport.co.kr/news/articleView.html?idxno=50979,한국수력원자력은 17일 총 2.8GW 규모의 원전 2기 건설 부지로 영덕군 영덕읍 석리·노물리·매정리와 축산면 경정리 일원을 선정했다. 0.7기가와트 규모 SMR(소형원자로) 1기 건설 부지는 부산 기장군 기장읍 일원을... 
2026-06-18,네이버뉴스,"정부, 신규원전 영덕군에 69년간 2조 쏜다…기장군은 절반 수준",https://www.newspim.com/news/view/20260618000466,또 원전건설 착공 이후 약 9년간 기본지원사업비 458억원과 사업자지원사업비 458억원이 각각 지원된다. 연간 102억원 규모다. 특별지원사업비와 합치면 연간 358억원 규모가 지원될 것으로 예상된다. 이와는 별도로... 
2026-06-18,네이버뉴스,"울주군, 신규 원전 유치 '고배'…대형 원전 2기 영덕으로",https://www.iusm.co.kr/news/articleView.html?idxno=1064243,한국수력원자력 신규 원전 건설 후보지로 대형원전 2기는 경북 영덕이 최종 확정돼 울산 울주군은 고배를 마셨다. 소형모듈원자로(SMR) 1기는 부산 기장군이 최종 확정됐다. 17일 한국수력원자력에 따르면 외부... 
2026-06-18,네이버뉴스,"경주 SMR 유치 무산...""혹시나 했지만 역시나"" 지역사회 정치적 고려론...",https://www.hidomin.com/news/articleView.html?idxno=709854,"한수원 신규원전 부지선정평가위원회는 17일 제11차 전력수급기본계획에 반영된 신규 원전 건설 후보부지를 발표하고, 대형원전 2기는 경북 영덕군, SMR 1기는 부산 기장군을 선정했다. 평가 결과 SMR 분야에서는 기장군이... "
2026-06-18,네이버뉴스,"영덕에 대형 원전 2기 들어선다…12조 원 투입, 동해안 '에너지 경제권...",https://www.eroun.net/news/articleView.html?idxno=83404,"경상북도는 사업의 신속한 추진을 위해 영덕군, 한국수력원자력과 공동으로 '영덕 대형원전 건설 행정지원단'을 즉각 발족하고 인허가 패스트트랙 지원과 주민 소통을 위한 전담 공조 체계에 돌입했다고 18일 밝혔다.... "
