date,source,title,link,description
2026-04-21,네이버뉴스,[기획] 중동지역 수주 급감 현실로…올해 해외수주 목표 달성할 수 있나...,https://www.m-i.kr/news/articleView.html?idxno=1366335,현대건설이 수행한 사우디 리야드 380㎸ 송전선로 건설 프로젝트. 사진=현대건설 제공. 매일일보 = 장원석 기자  |  국내 건설업계가 올해 1분기 해외 수주에서 극심한 부진을 겪었다. 미국과 이란간 전쟁이 장기화하면서... 
2026-04-21,네이버뉴스,"현대건설, 압구정3구역 '단독 입찰'…수의계약 전환 수순",https://www.ezyeconomy.com/news/articleView.html?idxno=234912,현대건설이 단독 입찰을 이어가며 우선협상대상자로 지정되면서 시공권 확보를 위한 절차가 사실상 다음 단계로 넘어간 것이다. 압구정3구역 재건축 사업은 최근 진행된 입찰 과정에서 현대건설만 참여하며 경쟁 구도가... 
2026-04-21,네이버뉴스,"현대건설·GS건설·포스코이앤씨, 현장 안전 관리 강화",http://www.wsobi.com/news/articleView.html?idxno=310726,"현대건설과 GS건설, 포스코이앤씨 등 건설업계가 현장 내 중대재해 발생 근절을 위한 안전경영 강화에 박차를 가한다. 외국인 현장 근로자 안전교육부터 경영진의 현장점검 등을 추진하고 산학협력을 통한 안전성 증진... "
2026-04-21,네이버뉴스,국내 건설업계 업황 부진에 에너지 등 신사업 진출 박차,https://www.imaeil.com/page/view/2026042113591806382,"현대건설은 '에너지 전환'을 핵심 전략으로 내세우고 대형 원전과 SMR, 해상풍력·태양광, 수소·암모니아 등 발전 분야는 물론 초고압직류송전(HVDC)과 데이터센터까지 아우르는 사업 체계를 구축하고 있다. 앞서 현대건설은... "
2026-04-21,네이버뉴스,"건설도 AX 시대…스마트 건설 어디까지 왔나 (1) 로봇, 단순 보조 넘어 ...",https://www.electimes.com/news/articleView.html?idxno=367204,가장 앞서가는 곳은 현대건설이다. 현대건설은 업계 최초로 '로봇 친화형 단지' 모델을 상용화하며 시공 패러다임을 바꿨다. 단지 설계 단계부터 로봇의 이동 동선을 반영해 '스마트 자재 운반 로봇'이 엘리베이터를 호출... 
2026-04-21,네이버뉴스,"아파트 가치 좌우하는 ‘층간소음’...건설사, 슬래브 두께·완충재 기...",https://www.smarttoday.co.kr/ko-kr/articles/106741,"현대건설, 삼성물산, DL이앤씨, 포스코이앤씨, 코오롱글로벌 등은 고성능 완충재와 진동 저감 기술, 바닥 구조 성능개선에 집중하고 있는 것으로 알려졌다. 바닥 슬래브와 완충층을 강화해 충격음 자체를 줄이거나... "
2026-04-21,네이버뉴스,"[건설 Pick] 한화 건설부문·현대건설, 개발 사업 수익성 제고 및 현장 ...",https://www.lcnews.co.kr/news/articleView.html?idxno=201050,"한화 건설부문은 대형 자산운용사와의 전략적 협력을 통해 우량 사업지 확보를 위한 발판을 마련했으며, 현대건설은 가상현실(VR)과 인공지능(AI)을 활용해 외국인 근로자까지 아우르는 촘촘한 안전 생태계를 조성하고... "
2026-04-21,네이버뉴스,공사비 1조 마천5구역 수주전...현대·DL·롯데 ‘삼파전’ 예고,https://www.g-enews.com/view.php?ud=202604211307342057514e0091f6_1,"현대건설과 롯데건설, DL이앤씨가 공사비 1조 원 규모의 서울 송파구 마천5구역 재개발사업을 두고 수주 경쟁에 나선다. 21일 도시정비업계에 따르면 마천5구역 재개발사업조합은 전날 시공사 모집 공고를 냈다.... "
2026-04-21,네이버뉴스,"현대건설, 압구정3구역 재건축 우선협상대상자 선정",https://www.naeil.com/news/read/586049?ref=naver,"현대건설은 20일 서울 강남구 압구정동 압구정3구역(현대1~7차, 10·13·14차, 대림빌라트) 재건축 사업의 우선협상대상자에 선정됐다고 공시했다. 압구정3구역 재건축은 서울 강남구 압구정동 393-1번지 일대에 있는... "
2026-04-21,네이버뉴스,"'공사비 5.5조' 압구정3구역, 현대건설 우선협상대상자 지정",https://www.sidae.com/article/2026042109513929308,현대건설이 압구정3구역 재건축 사업의 우선협상대상자에 선정됐다. 압구정 일대를 '현대타운'으로 만들겠다는 현대건설의 재정비 사업 전략에 청신호가 켜졌다. 현대건설은 지난 20일 공시를 통해 서울... 
2026-04-21,네이버뉴스,분양시장 흔드는 '층간소음' 설계...건설사 기술 경쟁 가열,https://www.youthdaily.co.kr/news/article.html?no=217778,"현대건설, 삼성물산, DL이앤씨 등은 고성능 완충재를 적용하고 벽체 구조를 개선해 소음 전달을 최소화하는 기술을 선보이고 있다. 실제 공급 현장에서도 이러한 설계가 도입되는 흐름이다. 코오롱글로벌은 5월 분양... "
2026-04-21,네이버뉴스,"故 정주영-정의선, 새만금 ""40년전 할아버지가 간척한 곳인데..""",https://radio.ytn.co.kr/program/?f=2&id=108465&s_mcd=0206&s_hcd=15,"■ 방송 : YTN 라디오 FM 94.5 (09:00~10:00) ■ 진행 : 조태현 기자 ■ 방송일 : 2026년 4월 21일 화요일 ■ 대담 : 박주근 리더스인덱스 대표 - 고 정주영 회장, 1947년 현대토건 설립..1950년 현대건설의 시초..범 현대가의 시작 - 1968년... "
2026-04-21,네이버뉴스,3년새 파견ㆍ용역 근로자 8.2% 감소…건설ㆍ석화ㆍ철강↓ 운송↑,https://www.dnews.co.kr/uhtml/view.jsp?idxno=202604210857436960965,"건설업은 HDC현대산업개발(631.5%), KCC건설(427.0%), 현대건설(409.5%) 등 주요 기업에서 여전히 소속 근로자 대비 소속 외 근로자 비중이 400%를 웃돌며 높은 외주 의존 구조를 보였다. 석화는 업황 부진이 겹치며 소속... "
2026-04-21,네이버뉴스,현대엔지니어링 '일감 절벽'…모기업 현대건설 반등에 부담주나,https://www.newspim.com/news/view/20260420001305,"현대건설이 도시정비와 해외 인프라, 원전 등 핵심 사업에서 성과를 확대하는 가운데, 현대엔지니어링 관련 리스크가 잠재 변수로 부상하고 있다. 현대엔지니어링은 주택 및 인프라 부문 신규 수주를 사실상 중단하며... "
2026-04-21,네이버뉴스,[#부동산 나들이] GS '인도 재생에너지 공략'·'미리내집' 441세대 모집·...,https://www.newsworks.co.kr/news/articleView.html?idxno=838441,서울시가 올해 첫 미리내집 입주자 441세대를 모집하고 현대건설이 서울 압구정동 압구정3구역 재건축 사업의 우선협상대상자에 선정됐다. ◆GS '인도 재생에너지 공략' GS건설이 인도 재생에너지 시장 공략을... 
2026-04-21,네이버뉴스,"현대건설, 압구정3구역 우협대상자 선정",https://www.bizwork.co.kr/news/articleView.html?idxno=414855,현대건설은 지난 20일 서울 강남구 압구정3구역 재건축 사업의 우선협상대상자로 지정됐다도 공시했다. 앞서 현대건설은 지난 10일 진행된 시공사 선정 입찰에 단독으로 참여했다. 압구정3구역은 압구정 재건축 권역... 
2026-04-21,네이버뉴스,"현대건설,압구정3구역 5.5조 재건축 우선협상대상자로 선정",http://www.seouleconews.com/news/articleView.html?idxno=90759,"압구정3구역 재건축 투시도  현대건설은 20일 서울 강남구 압구정동 압구정3구역(현대1∼7차, 10·13·14차, 대림빌라트) 재건축 사업의 우선협상대상자에 선정됐다고 공시했다. 압구정3구역 재건축은 서울 강남구... "
2026-04-21,네이버뉴스,"신도시 개발붐 남양주, 왜 ‘래미안’만 안 보일까",https://www.kyeongin.com/article/1762225,"현대건설 ‘힐스테이트’, DL이앤씨 ‘e편한세상’, GS건설 ‘자이’, 대우건설 ‘푸르지오’, 포스코이앤씨 ‘더샵’ 등 내로라하는 대형 건설사들이 시공한 아파트들이 들어서 있는 남양주는 1군 브랜드 각축장이나... "
2026-04-21,네이버뉴스,개포 경·우·현 재건축 속도…'양재천 벨트' 퍼즐 맞춰진다,https://news.tf.co.kr/read/economy/2315418.htm,"시공사는 각각 대우건설, 현대건설이다. 개포우성8차·개포현대3차는 통합 재건축을 추진하고 있다. 현재 통합재건축추진위원회 구성을 논의하고 있다. 개포동 일대는 2019년 래미안블레스티지(개포주공2단지)... "
2026-04-21,네이버뉴스,노란봉투법 앞두고 '소속외 근로자' 줄어…외주인력 8.2% 감소,http://www.newsfc.co.kr/news/articleView.html?idxno=78204,"건설업의 경우 HDC현대산업개발(631.5%), KCC건설(427.0%), 현대건설(409.5%) 등 주요 기업에서 여전히 소속 근로자 대비 소속 외 근로자 비중이 400%를 웃돌며 높은 외주 의존 구조를 보였다. 석유화학 업종은 업황 부진이... "
2026-04-21,네이버뉴스,"'노란봉투법' 앞두고, 소속 외 근로자 8% 뚝",https://www.shinailbo.co.kr/news/articleView.html?idxno=5013351,"한진이 가장 높았고 HDC현대산업개발, KCC건설, 현대건설을 비롯해 두산건설(318.9%), 태영건설(314.7%), GS건설(304.4%) 등 건설사가 다수 포함됐다. 현대건설을 제외하면 이들 기업은 2년 전 대비 소속 외 근로자... "
2026-04-21,네이버뉴스,"2년간 30억 폭등, 반포 아파트의 비밀…2000가구 80%가 한강변",https://realty.chosun.com/site/data/html_dir/2026/04/21/2026042101777.html,"◇ 한강변 48층에 현대건설 하이브랜드 신반포2차는 1978년 준공된 1572가구 단지를 허물고 지하 4층~지상 최고 48층, 12개 동, 2056가구 규모로 재탄생한다. 시공은 현대건설이 맡았으며 하이엔드 브랜드 ‘디에이치(THE H)... "
2026-04-21,네이버뉴스,"서울시장 선거 앞둔 5월말에 압구정 재건축, 잇달아 시공사 선정",https://www.theguru.co.kr/news/article.html?no=100809,"가장 규모가 큰 압구정 3구역(현대 1~7, 10, 13, 14차)은 현대건설의 무혈입성이 가시화됐다. 현대건설은 전날 공시를 통해 ""3구역 재건축 정비사업의 우선협상대상자로 선정됐다""고 밝혔다. 앞서 진행된 두 차례의 입찰에서... "
2026-04-21,네이버뉴스,"5.5조 사업…압구정3구역 재건축, 현대건설 우선협상대상자",https://www.widedaily.com/news/articleView.html?idxno=292699,현대건설이 서울 강남 핵심 재건축 사업인 압구정3구역에 우선협상대상자로 선정됐다. 21일 전자공시에 따르면 현대건설은 서울 강남구 압구정3구역 재건축 사업의 우선협상대상자로 지정됐다. 앞서 현대건설은 지난... 
2026-04-21,네이버뉴스,"건설업계, '안전' 내실 다지고 '인재' 수용폭 넓힌다…주거 복지 강화도...",http://www.dailypop.kr/news/articleView.html?idxno=98193,"GS·현대건설·한전KPS, ""안전은 기업의 생존""…현장 밀착 경영 가속 최근 건설업계의 가장 큰 화두는 '안전 시스템의 질적 성장'이다. GS건설은 지난달 주주총회를 통해 김태진 CSSO(최고안전전략책임자) 사장을 각자... "
2026-04-21,네이버뉴스,한-인도 정상회담…인도에 꽂힌 수혜주는 따로 있다,https://www.ebn.co.kr/news/articleView.html?idxno=1706062,"여기에 현대건설, 삼성엔지니어링 등 건설·플랜트 기업들도 전력망·도시 인프라 구축 과정에서 수혜 기대가 커지고 있다. 이 분야는 초기 투자와 시간이 필요한 대신, 한 번 시장을 선점하면 장기 수익으로 이어진다는... "
2026-04-21,네이버뉴스,"분양시장, 층간소음 저감설계 승부",http://www.ikld.kr/news/articleView.html?idxno=333260,"최근에는 현대건설, 삼성물산, DL이앤씨, 포스코이앤씨, 코오롱글로벌 등 주요 건설사들이 고성능 완충재 적용과 진동 저감 기술 개발, 바닥구조 성능 강화에 힘을 쏟고 있다. 바닥 슬래브와 완충층을 강화해 충격음... "
2026-04-21,네이버뉴스,"현대·GS·반도, 안전경영 총력전…현장·협력사까지 전방위 강화",http://www.fntimes.com/html/view.php?ud=202604211019038030b372994c95_18,"21일 건설업계에 따르면 현대건설, GS건설, 반도건설 등 주요 건설사들은 안전을 비용이 아닌 핵심 경쟁력으로 보고 현장 중심 대응을 강화하고 있다. 중대재해처벌법 시행 이후 안전관리 수준이 기업 지속가능성을... "
2026-04-21,네이버뉴스,'노란봉투법 영향' 외주 인력 3년 새 8.2% 감소,https://www.joongang.co.kr/article/25421919,"HDC현대산업개발(631.5%), KCC건설(427.0%), 현대건설(409.5%) 등 주요 기업에서 소속 외 근로자 비중이 400%를 웃돌았다. 반면 운송 업종은 외주 인력이 11.8% 증가하며 다른 산업과 상반된 흐름을 보였다. 특히 한진은... "
2026-04-21,네이버뉴스,"""층간소음 잡아야 완판""…5월 소음 특화 설계 단지 잇따라",https://www.newsis.com/view/NISX20260421_0003599615,"현대건설, 삼성물산, DL이앤씨, 포스코이앤씨, 코오롱글로벌 등은 고성능 완충재 도입, 슬래브 두께 강화, 진동 저감 구조 개발 등에 열을 올리고 있다. 올해 분양 시장에서는 이러한 층간소음 특화 설계가 적용된... "
2026-04-21,네이버뉴스,"[이슈] 압구정3구역, 현대건설 수의계약 전환… 공사비 5조 5610억",https://www.startuptoday.co.kr/news/articleView.html?idxno=610552,현대건설이 서울 강남구 압구정3구역 재건축 사업의 우선협상대상자로 선정됐다고 지난 20일 공시했다. 조합이 제시한 공사비는 5조 5610억원(부가세 별도)으로 단일 정비사업 기준 올해 시공사 선정 사업지 중... 
2026-04-21,네이버뉴스,집 대신 전기 짓는 건설사…에너지로 판 키운다,https://www.mstoday.co.kr/news/articleView.html?idxno=101275,"현대건설은 원전과 재생에너지, 송변전, 데이터센터를 연결하는 통합 에너지 사업 확대에 속도를 내고 있으며, 전력 생산부터 소비까지 이어지는 구조 구축에 집중하고 있다. 대우건설은 데이터센터 전담 조직을 신설하고... "
2026-04-21,네이버뉴스,올해 1분기 건설업 폐업 1088건...12년 만에 최대,https://www.g-enews.com/view.php?ud=202604210958232314514e0091f6_1,앞서 현대건설도 지난달 서울 은평구 대조1구역 재개발정비조합에 보낸 공문에서 중동 전쟁 영향으로 원자재 가격 상승과 자재 공급 차질이 현실화하고 있다며 추가 공사비 반영을 요청한 바 있다. 정부도... 
2026-04-21,네이버뉴스,노란봉투법 시행 앞두고 '소속 외 근로자' 감소 전환…500대 기업 8.2%↓,http://www.newsian.co.kr/news/articleView.html?idxno=88765,"HDC현대산업개발(631.5%), KCC건설(427.0%), 현대건설(409.5%) 등은 여전히 소속 근로자 대비 소속 외 근로자 비중이 400%를 웃돌며 높은 외주 의존 구조를 유지했다. 석유화학(-34.8%)과 2차전지(-33.5%) 역시 소속 외 근로자... "
2026-04-21,네이버뉴스,‘중동 붐 재현’ 기대감…대우건설 15%대 급등 [이런국장 저런주식],https://www.sedaily.com/article/20035012?ref=naver,"GS건설도 9%대 상승 중이며 DL이앤씨와 삼성E&A는 4%대, 현대건설도 2%대 오름세를 보이는 등 업종 전반에 매수세가 확산되고 있다. 이 같은 강세는 중동 재건 사업과 원전 수주 확대 기대감이 반영된 결과로 풀이된다.... "
2026-04-21,네이버뉴스,‘노란봉투법’ 시행 전 고용구조 변환..‘소속 외 근로자’ 뚜렷 감소,http://www.breaknews.com/1201839,"IPARK현대산업개발(631.5%), KCC건설(427.0%), 현대건설(409.5%) 등은 여전히 소속 근로자 대비 소속 외 근로자 비중이 400%를 웃돌며 높은 외주 의존 구조를 보이고 있다.... "
2026-04-21,네이버뉴스,코스피 사상 최고치 경신...6355.39,https://www.wolyo.co.kr/news/articleView.html?idxno=311192,"대우건설은 19.22%, GS건설은 12.88%, 현대건설은 2.98% 상승했다. 한편, 이날 코스닥지수는 전날 대비 0.97% 오른 1186.23로 거래를 시작했고, 서울 외환시장에서 원·달러 환율은 0.03% 내린 1472.4원으로 출발했다.... "
2026-04-21,네이버뉴스,대출 규제 풍선효과 소형 오피스텔 몸값 ↑…'힐스테이트 안양펠루스' ...,https://www.bizwork.co.kr/news/articleView.html?idxno=414832,"이런 가운데 현대건설이 시공한 힐스테이트 안양펠루스가 경기 안양시 만안구 안양동 일대에서 분양을 진행 중이다. 단지는 지하 6층~지상 20층, 총 198가구 규모로 조성된다. 이 가운데 3층~15층에는 전용 54~82... "
2026-04-21,네이버뉴스,"현대건설, 협력사·외국인 근로자 아우르는 안전 프로그램 본격 가동",https://www.ilyoseoul.co.kr/news/articleView.html?idxno=515930,현대건설이 중소 협력사와 외국인 근로자를 대상으로 한 현장 밀착형 안전 프로그램을 본격 운영하며 '안심 일터' 조성에 나섰다. 이번 프로그램은 건설 현장의 안전 사각지대를 해소하고 근로자들이 직관적으로 위험을... 
2026-04-21,네이버뉴스,'노란봉투법' 앞두고 외주 인력 줄었다…500대 기업 '소속 외 근로자' 8...,https://www.youthdaily.co.kr/news/article.html?no=217741,"HDC현대산업개발(631.5%), KCC건설(427.0%), 현대건설(409.5%) 등은 소속 근로자 대비 소속 외 근로자 비중이 400%를 넘으며 높은 외주 의존 구조를 유지했다. 석유화학(-34.8%)과 2차전지(-33.5%) 역시 감소폭이 컸다.... "
2026-04-21,네이버뉴스,4월 20일 주식시장 주요공시,https://www.catchnews.kr/news/articleView.html?idxno=123001,"미진행 ▶현대건설, 약 5조5,610억원(당사분 100%) 규모 압구정아파트지구 특별계획구역3 재건축정비사업 우선협상대상자 선정 ▶대성미생물, 기업가치 제고 계획(신제품 매출 및 국내외 매출 확대 등) ▶YG... "
2026-04-21,네이버뉴스,"현대건설, 공사비 5조5000억 압구정3구역 재건축 수주 눈앞",https://www.g-enews.com/view.php?ud=202604210842323325ac06cade6e_1,현대건설이 서울 강남구 압구정동 압구정3구역 재건축사업의 우선협상대상자에 선정됐다. 21일 건설업계에 따르면 압구정3구역 재건축사업조합은 전날 우선협상대상자로 현대건설을 낙점했다. 압구정3구역은 서울... 
2026-04-21,네이버뉴스,"전재수 부산시장 후보 ""가덕도 연기, 박형준 시장 무능 남 탓으로 돌리...",http://www.breaknews.com/1201822,가덕도신공항 건설 사업이 표류하게 된 결정적 계기로는 2025년 5월 발생한 현대건설 컨소시엄의 수의계약 최종 파기 사태를 꼽았다. 전 후보는 공사 시작을 불과... 
2026-04-21,네이버뉴스,"박형준 ""전재수 의원, 가덕도 신공항 '거짓 선동' 멈춰라...양치기 소년...",http://www.breaknews.com/1201820,"""현대건설 컨소시엄이 자체 판단으로 철수, 적반하장"" 현대건설 컨소시엄의 수의계약 파기가 부산시정의 성적표라는 지적에는 적반하장이라고 비판했다. 박 시장은... "
2026-04-21,네이버뉴스,노란봉투법 앞두고 '소속외 근로자' 줄였다 … 외주 인력 3년새 8.2% 감소,http://www.worktoday.co.kr/news/articleView.html?idxno=83887,"HDC현대산업개발(631.5%), KCC건설(427.0%), 현대건설(409.5%) 등 주요기업에서 여전히 소속 근로자 대비 소속 외 근로자 비중이 400%를 웃돌며 높은 외주 의존 구조를 보이고 있다. 석유화학 업종은 업황 부진이 겹치며... "
2026-04-21,네이버뉴스,"[아주증시포커스] [위험한 머니게임] '상폐위기' 광명전기, 새 주인은 자...",https://www.ajunews.com/view/20260421075547325,"◆장 마감 후(20일) 주요공시 ▷현대건설, 압구정3구역 재건축 우선협상대상자 선정 ▷포스코홀딩스, 1609억 규모 인도 광산업체 지분 취득 결정 ▷에스씨엠생명과학, 주식병합으로 23일부터 거래정지 ▷퓨릿, 350억... "
2026-04-21,네이버뉴스,"[기고] 노란봉투법, 안전 챙길수록 위험해지는 역설",http://mcnews.co.kr/86065,"한화, GS건설, 삼성물산 등 대형 건설사들이 노동위원회의 ‘사용자성 판정’ 심판대에 오르고 있다. 건설현장에서 벌어지는 갈등은 단순한 노사 분쟁이 아니라 안전과 교섭이 뒤엉킨 기묘한 역설이다. 중대재해처벌법 시행... "
2026-04-21,네이버뉴스,"대기업, 자사주 소각 급물살..올 1분기 43조원",http://www.breaknews.com/1201889,"(4조8343억원), 삼성물산(2조3269억원) 순이었다. 특히, 삼성전자와 SK하이닉스... 기업은 △KCC건설(6.80%) △한솔케미칼(4.11%) △넵튠(3.87%) △KG스틸(3.23%) △오리콤(1.90... "
2026-04-21,네이버뉴스,"소풍커넥트·삼성물산, 미래 건설·주거 혁신 스타트업 모집",https://platum.kr/archives/285643,스타트업 밸류업 전문 액셀러레이터 소풍커넥트가 삼성물산 건설부문의 오픈이노베이션 프로그램 '2026 FutureScape' 참가 스타트업을 모집한다. 법인 설립 10년 이내 스타트업을 대상으로 하며 웰니스 솔루션·시니어 리빙... 
2026-04-21,네이버뉴스,노봉법 한 달 1011건…韓경제 ‘교섭폭주 쇼크’,https://www.munhwa.com/article/11583870?ref=naver,서울지방노동위원회는 오는 24일 한화·GS건설·삼성물산 등 대형 건설사 3곳을 대상으로 교섭단위 분리 신청 사건을 심판할 예정이다. 고용노동부에 따르면 노란봉투법 시행 첫날인 지난달 10일에만 하청 노동조합 407곳... 
2026-04-21,네이버뉴스,'래미안 엘라비네' 20% 계약 포기…무순위 청약 열린다,http://www.fnnews.com/news/202604210819578913,"강서구에서 처음 선보이는 삼성물산 건설부문의 래미안 브랜드 단지로, 방화뉴타운(2·3·5·6구역) 가운데 가장 먼저 공급에 나선 곳이다. 이에 본청약 당시 평균 경쟁률이 25대 1을 기록하는 등 관심을 받았다. 다만... "
2026-04-21,네이버뉴스,서초진흥아파트 재건축 58층 설계안 공개… ‘경부고속도로 자이 벨트’...,https://www.dnews.co.kr/uhtml/view.jsp?idxno=202604210947043500984,"GS건설을 우선협상대상자로 지정하고 오는 5월 1일 총회를 앞두고 있다. 이에 GS건설은 단지명 ‘서초자이... 조경은 디즈니 월드를 설계한 미국의 SWA와 삼성물산 리조트부문 에버랜드가 협력하여 2,980평 규모의 대형... "
2026-04-21,네이버뉴스,대기업 상장사 자사주 소각 작년 13조→ 1분기 43조,http://www.efnews.co.kr/news/articleView.html?idxno=129231,"(4조8천343억원), 삼성물산(2조3천269억원) 순으로 나타났다. 특히 삼성전자와 SK하이닉스 양사의 자사주... KCC건설(6.80%), 한솔케미칼(4.11%), 넵튠(3.87%), KG스틸(3.23%), 오리콤(1.90%), AK홀딩스(1.53%), 하이브(1.49... "
2026-04-21,네이버뉴스,"대기업들, 자사주 소각 러시…3개월 만에 42.5조원 태워",https://zdnet.co.kr/view/?no=20260421091558,"이어 SK하이닉스 12조 2400억원, SK 4조 8343억원, 삼성물산 2조 3269억원 순이었다. 삼성전자와 SK하이닉스의... KCC건설, 한솔케미칼, 넵튠, KG스틸, 하이브, 한화솔루션, 한화시스템 등은 자사주를 임직원 보상 목적으로... "
2026-04-21,네이버뉴스,"[CEO스코프] 송치영 포스코이앤씨 사장, 턴어라운드 승부수는?",http://www.iminju.net/news/articleView.html?idxno=162821,"이후 AI 기반 스마트 안전관리 시스템을 전국 수십 개 현장으로 확대 적용하고, 건설업계의 고질적 문제인... 현재 송 사장이 가장 공을 들이는 격전지는 삼성물산과 치열한 수주 맞대결을 벌이고 있는 공사비 4400억 원... "
2026-04-21,네이버뉴스,"수자원공사, 삼성물산과 '해외 물사업 수주' 맞손...국내 물기업 동반 진...",https://www.g-enews.com/view.php?ud=202604210918385430a9fc143920_1,"한국수자원공사가 삼성물산 건설부문과 ‘공공부문-민간 협력 기반, 해외 물사업 진출 확대를 위한 업무협약(MOU)’을 체결했다. 이번 협약은 해외 물사업 발굴과 추진 과정에서 공공과 민간의 협력을 강화하기 위해... "
2026-04-21,네이버뉴스,'상법 개정 후폭풍' 대기업 자사주 소각 올 1분기만 42.5조원 '작년 한 ...,http://www.worktoday.co.kr/news/articleView.html?idxno=83888,"이어 SK가 4조8343억원, 삼성물산이 2조3269억원 규모로 소각 규모가 컸다. 3월 말 기준 대기업집단 상장사... 기업은 △KCC건설(6.80%) △한솔케미칼(4.11%) △넵튠(3.87%) △KG스틸(3.23%) △오리콤(1.90%) △AK홀딩스(1.53... "
2026-04-21,네이버뉴스,"대기업, 3개월만에 자사주 소각 43조 육박… 상법 개정 여파에 지배력 ...",https://www.viva100.com/article/20260421500088,"SK하이닉스(12조2400억원), SK(4조8343억원), 삼성물산(2조3269억원)이 뒤를 이었다. 특히 삼성전자와... KCC건설(6.80%), 한솔케미칼(4.11%), 넵튠(3.87%), KG스틸(3.23%), 오리콤(1.90%), AK홀딩스(1.53%), 하이브(1.49%), 한화솔루션(1.... "
