date,source,title,link,description
2026-04-06,네이버뉴스,"GS건설, 생성형 AI로 분양 마케팅 진화…‘보는 집’서 ‘사는 집’으로",https://www.mediapen.com/news/view/1091409,"GS건설이 인공지능(AI)을 접목한 분양 마케팅으로 고객 체험형 콘텐츠 확대에 나서고 있다. 단순히 평면과 내부 공간을 보여주는 데 그쳤던 기존 홍보 방식에서 벗어나, 실제 입주 후 생활상을 미리 그려볼 수 있도록... "
2026-04-06,네이버뉴스,"GS건설 자이, AI와 디지털 콘텐츠 결합한 분양 마케팅 강화",https://www.bizwork.co.kr/news/articleView.html?idxno=414150,GS건설이 인공지능(AI)과 디지털 콘텐츠를 결합한 분양 마케팅 전략을 통해 '고객 경험' 중심의 브랜드 혁신을 강화하고 있다. GS건설은 최근 분양을 진행 중인 '창원자이 더 스카이'와 '아산탕정자이 메트로시티'에 생성형... 
2026-04-06,네이버뉴스,GS 사촌 코스모그룹도 외면한 에너지머티리얼즈,https://dealsite.co.kr/articles/159248,허윤홍號 '미래 먹거리'서 애물단지로…사업성 한계에 인수 매력 '뚝' GS건설이 배터리 재활용 자회사 에너지머티리얼즈 매각을 추진하는 과정에서 범(凡) GS가로 분류되는 코스모그룹과의 거래마저 무산된 것으로... 
2026-04-06,네이버뉴스,용계역 걸어서 5분… 1780가구 일반 분양,https://www.chosun.com/economy/real_estate/2026/04/06/RWCIPZG6GBEBHDK3JXYXBLEB3I/?utm_source=naver&utm_medium=referral&utm_campaign=naver-news,"도안자이 센텀리체 GS건설이 대전 유성구 용계동 267-3번지 일원에서 건설하는 ‘도안자이 센텀리체’ 분양에 나선다. 이 단지는 지하 2층~지상 최고 42층, 2293가구 규모로 조성된다. 이 중 1780가구가 일반 분양 물량으로... "
2026-04-06,네이버뉴스,"분양가상한제의 역설…노량진, 강남 아파트 분양가 역전",https://www.joongang.co.kr/article/25417690,라클라체자이드파인은 노량진6구역 재개발 단지로 GS건설(자이)과 SK에코플랜트(드파인)가 컨소시엄을 구성해 짓는다. 총 1499가구 중 일반분양 물량은 369가구다. 노량진 뉴타운 중 첫 분양에 나서 관심을 모았지만... 
2026-04-05,네이버뉴스,다주택 규제 속 '전국적 인기' 구가하는 수지·분당·동탄 아파트,https://www.joongboo.com/news/articleView.html?idxno=363721906,"이 단지의 인기 요인은 GS건설 자이 브랜드의 신뢰성과 함께 GTX-A 연장선(예정) 및 수인분당선 접근성으로 해석되고 있다. 또, 2027년 입주 예정인 성남 분당구 '더샵분당센트로' 역시 10위 안에 첫 진입이다. 총... "
2026-04-05,네이버뉴스,서울은 ‘천 대 일’ 지방은 ‘빈집’…극명하게 갈린 대한민국 분양 성...,http://www.segyebiz.com/newsView/20260405508944?OutUrl=naver,GS건설이 공급한 창원자이 더 스카이는 295가구 모집에 2277명이 접수돼 비교적 양호한 성적표를 거뒀다. 특히 전용 84㎡ A타입은 113가구 모집에 1307명이 몰려 12대1의 경쟁률을 보였다. 반면 한화포레나 부산... 
2026-04-05,네이버뉴스,"서울은 수백대 1, 지방은 미달…분양시장 양극화 뚜렷",https://www.wolyo.co.kr/news/articleView.html?idxno=310631,GS건설이 공급한 창원자이 더 스카이는 295가구 모집에 2277명이 접수했다. 전용 84㎡A 타입은 113가구 모집에 1307명이 몰려 12대 1의 경쟁률을 기록했다. 반면 한화포레나 부산 당리는 입주자를 모두 채우지... 
2026-04-05,네이버뉴스,[분양캘린더] 10개 단지서 4112가구 분양…용산 이촌르엘 10일 청약 주목,https://www.sedaily.com/article/20028469?ref=naver,"10일에는 롯데건설이 서울 용산구 이촌현대아파트를 리모델링한 ‘이촌 르엘’이 전용 100~122㎡ 88가구의 1순위 청약을 받는다. 지상 27층 9개 동, 750가구 규모로 조성되며 2023년 7월 이후 약 3년 만에 공급되는 용산... "
2026-04-05,네이버뉴스,[4월6일자] 비즈니스포스트 아침의 주요기사,https://www.businesspost.co.kr/BP?command=article_view&num=434994,"나선다 ● 롯데건설 1분기 '도시정비 수주' '부동산 개발' 고무적, 오일근 취임 첫해 순풍에 돛 단다 ● 아모레퍼시픽 미용기기 사업 적극적이지만, 서경배 염두에 둔 '록인 전략'에 의구심도 ● KGM '티볼리' 11년 만에... "
2026-04-05,네이버뉴스,"""롯데 개발, 속도보다 책임""… 의왕시, 상생 없는 확장에 '정면 제동'",https://www.joongboo.com/news/articleView.html?idxno=363721885,롯데건설이 시공 중인 의왕 롯데 B부지 백운밸리 복합쇼핑시설 공사 현장. 사진=의왕시청 의왕시 대형 유통시설 개발 사업이 '속도'보다 '책임'이라는 새로운 기준 앞에 섰다. 5일 의왕시에 따르면 시는 최근 롯데건설이... 
2026-04-06,네이버뉴스,"【분양현장 톺아보기】 대전 '더샵 관저아르테', 1,2차 합쳐 대규모 브...",http://www.consumernews.co.kr/news/articleView.html?idxno=753268,포스코이앤씨가 대전광역시 서구에 '더샵 관저아르테'를 분양한다. 이 단지는 관저지구 내에서 10년 만에 공급되는 신규 더샵 아파트로 기존 단지들과 연계된 대형 브랜드 타운 형성이 기대되는 곳이다. 더샵... 
2026-04-05,네이버뉴스,인천 남동구 ‘포레나더샵 인천시청역’ 735가구,https://www.khan.co.kr/article/202604052111005,"한화 건설부문과 (주)포스코이앤씨가 인천 남동구 ‘포레나더샵 인천시청역’을 선착순 분양 중이다. 이 단지는 인천 남동구 간석동 311-1번지 일원에 들어서며 지하 4층~지상 최고 35층, 24개동, 총 2568가구 규모다. 이... "
2026-04-05,네이버뉴스,[‘더샵 송도그란테르’ 이달 분양] 워터프론트 입체적 디자인… 생활 ...,https://www.kyeongin.com/article/1761391,"포스코이앤씨, G5블록 15개동 IBD 마지막 공급 ‘희소성’ 갖춰 더샵 송도그란테르 조감도. /포스코이앤씨 제공 포스코이앤씨는 인천 송도국제도시 G5 블록에 ‘더샵 송도그란테르’를 이달 분양한다고 5일 밝혔다. 더샵... "
2026-04-05,네이버뉴스,인천세계도시축전 부지 17년만에 '시민 품으로',https://www.incheonilbo.com/news/articleView.html?idxno=1320233,최근 포스코이앤씨가 G5 블록 내 아파트 '더샵 송도그란테르'의 분양 일정을 이달로 확정하며 공원 조성 추진도 본격화됐다. 공원은 더샵 송도그란테르보다 먼저 준공하는 것을 목표로 하고 있어 2029년 하반기 이전... 
2026-04-05,네이버뉴스,"'낙월해상풍력 투자사' 태국 비그림파워 ""中자본설은 허위…초과수익 3...",https://view.asiae.co.kr/article/2026040516412372996,"타워(CS윈드), 트랜지션피스(삼일C&S), 모노파일(GS엔텍), 후판(포스코), 내부케이블(대한전선) 등 국산 기자재 비율이 70%에 달하며 이를 통해 국내 공급망 발전에 기여하고 있다는 것이다. 해상공사(삼해이앤씨)... "
2026-04-05,네이버뉴스,"대전 서구, 대형 건축공사장 일자리 창출 협약",https://www.ccdn.co.kr/news/articleView.html?idxno=1071580,"대전 서구는 4월 2일 구청 보라매실에서 포스코이앤씨 등 건설업체와 협회들과 함께 '대형 건축공사장 일자리 창출 업무협약'을 체결했다. 이번 협약은 대형 공사 과정에서 지역업체 참여를 확대하고, 고용과 자재·장비... "
2026-04-06,네이버뉴스,"'부울경 1위' 동원개발, 평택 반도체·울산 집값 반등 올라탄 ‘투트랙...",https://www.fetv.co.kr/news/article.html?no=216327,"여기에 서부산 행정복합타운 건설사업에서도 720억원대 물량을 추가로 확보하며 수주 잔고를 확대했다. 주택 분양과 공공공사, 지역 개발사업이 동시에 진행되면서 사업 포트폴리오의 균형도 한층 강화되는 모습이다.... "
2026-04-06,네이버뉴스,[더벨][thebell desk] 엔지니어링공제조합의 일탈,https://www.thebell.co.kr/free/content/ArticleView.asp?key=202604011243529960101113,"엔지니어링공제조합은 건설사, 엔지니어링사 등 다수의 출자자들의 출자금으로 운영되는 기관이다. 조합원... 사업을 수주했다. 10년 전만 해도 630억원대였던 엔지니어링공제조합의 다원시스 보증 규모는 지난해 말... "
2026-04-06,네이버뉴스,기계설비건설협회 제13대 시도회장에게 듣는다 | 김진명 울산·경남도회...,http://www.kmecnews.co.kr/news/articleView.html?idxno=46378,"기계설비법 시행으로 직발주의 제도적 토대가 마련됐음에도, 여전히 현장에서는 종합건설사 위주의 발주... 이를 위해 김 회장은 기계설비인들을 위해 저가 수주의 유혹에 빠지지 말 것을 당부했다. 그는 ""매출 규모가... "
2026-04-06,네이버뉴스,공공공사 입찰서 육아휴직 등 한시적 기술자 부족 감점 사라진다,http://www.kmecnews.co.kr/news/articleView.html?idxno=46379,"종합건설사들의 부담이 해소될 것으로 기대된다. 지난 1일 조달청과 관련 업계에 따르면, 조달청은 지난달... 없지만 수주를 위해서는 인력을 채용해야 하는 불합리함이 존재했다""고 말했다. 이번 개정안은 이와 같은... "
2026-04-06,네이버뉴스,"[N2 포커스] 유진기업, 레미콘 시장 침체에 직격탄…수요 급감·비용 압...",https://www.news2day.co.kr/article/20260403500246,한국건설산업연구원은 2025년 건설투자가 전년 대비 5.3% 감소할 것으로 전망했다. 건설수주도 크게 줄어 앞으로 진행될 공사 자체가 줄어드는 흐름이다. 특히 2025년 10월 건설수주는 9조8000억원 수준으로 떨어져 최근 몇 년... 
2026-04-06,네이버뉴스,[송호 골프코스 설계의 정석 64] 코스 리노베이션은 당초 설계가에게 맡...,http://www.golfin.co.kr/news/articleView.html?idxno=7654,"평면 결정, 스프링클러 계획, 기반배수, 표면배수 계획, 잔디 이식계획. ④ 리노베이션 시기 및 기간, 방법, 방향 등 공지 ⑤ 사업계획 변경 인허가. ⑥ 리노베이션 설계. ⑦ 시공사 선정 및 공사 착수. 송호골프디자인 대표이사"
2026-04-05,네이버뉴스,"진안군, 연장농공단지 현안사업 본격 추진",https://sjbnews.com/news/news.php?number=875467,"이날 간담회에는 군 관계자를 비롯해 추진단 위원, 시공사·용역사 관계자 등 20여 명이 참석해 사업 추진현황을 점검하고 의견을 나눴다. ‘휴·폐업공장 리모델링 사업’은 2024년 산업통상자원부 공모에 선정된... "
2026-04-05,네이버뉴스,"""농작만큼 중요한 자금 설계""… 청년농 코치로 나선 '농협銀' [르포]",http://www.fnnews.com/news/202604051843562717,"청년농업인 강성규씨는 ""정부가 스마트팜 창업을 지원해 주고 있지만 부지 매입이나 시공사 선정부터 고민해야 할 부분이 많다""며 ""대출을 한 번도 받아보지 않은 청년농업인들에게 반드시 필요한 교육""이라고 말했다.... "
2026-04-05,네이버뉴스,서부권 정주여건 근간 '울산경제자유구역 비즈니스지구' 17년 만에 준공,https://www.iusm.co.kr/news/articleView.html?idxno=1061323,"100억원 상당의 지장물과 영업보상금을 두고 사업 시행자인 울산도시공사와 ㈜KCC간에 공방이 이어졌고... 공모'에 선정되며 불씨를 살리고 있다. 울산시 관계자는 ""비즈니스 지구가 기존에 개발중이었고... "
2026-04-06,네이버뉴스,"[신탁방식 정비사업 전성시대]①한국토지신탁, 뚝심ㆍ내실 경영…신탁...",https://www.dnews.co.kr/uhtml/view.jsp?idxno=202604050825180070961,"전국 35곳 사업시행ㆍ대행 등 관리 목동ㆍ신월ㆍ하안주공 등 잇단 수주 강남권 첫 신탁방식 정비사업 따내... 실제로 대전 동구 용운 e편한세상 에코포레(재건축ㆍ2267가구), 인천 미추홀구 학익 SK뷰(재개발ㆍ1581가구)... "
2026-04-06,네이버뉴스,"안대호 나우동인 대표 ""강남 하이엔드 '비밀무기' 목동2단지에 푼다""",https://www.news1.kr/realestate/general/6125779,"나우동인건축사사무소는 서울의 압구정, 청담, 성수 등 한강 변을 대표하는 하이엔드 주거지 설계에서... 나우동인은 도시정비 분야 재개발, 재건축, 리모델링 설계 실적 1위를 기록 중이다. 트리마제와 청담 르엘과 같은... "
2026-04-05,네이버뉴스,"[오션 뷰] 땅만 만든 북항 재개발, 도시를 다시 만들자",https://www.busan.com/view/busan/view.php?code=2026040518012203401,그러나 북항 재개발은 2007년 기본계획 수립 이후 20년 가까운 시간이 흘렀음에도 여전히 ‘완성된 도시’의... 서울 성수동의 변화는 중요한 시사점을 제공한다. 성수동은 대규모 철거와 신축이 아니라 기존 도시 구조를... 
2026-04-05,네이버뉴스,"정원오 ""한강벨트 경쟁력"" 박주민 ""민주당 가치"" 전현희 ""강남의 벽 넘을...",https://www.dailian.co.kr/news/view/1629797/?sc=Naver,"다리""라며 ""성수동의 성장을 바탕으로 서울 시민이 주인인 서울, 세금이 아깝지 않은 서울을 만들겠다""고... 아울러 ""저는 '민주당이 시장이 되면 재개발·재건축은 끝'이라는 오래된 체념과도 싸우겠다""며 ""인허가 절차를... "
2026-04-05,네이버뉴스,‘30분 통근 도시’ ‘강북에 3조 투자’ ‘강남 반값 아파트’…서울시...,https://www.sedaily.com/article/20028432?ref=naver,"다리”라며 “성수동의 성장을 바탕으로 서울 시민이 주인인 서울, 세금이 아깝지 않은 서울을 만들겠다”... 그는 “신속한 재개발·재건축으로 집값을 안정시키겠다”며 “청년에게는 반값 월세 4만 가구, 용산... "
2026-04-06,네이버뉴스,태양광 겨눈 尹정부 전방위 기소에 궁지 몰린 사업자들,http://www.e2news.com/news/articleView.html?idxno=329224,"태양광 업계는 당시 윤석열 정부가 원전 부흥과 재생에너지 말살을 목표로 '태양광 마피아'라는 프레임을... 발전소 인허가와 건설공사를 주로 수행해 온 장 대표는 ""종사자들을 일률적으로 중범죄자로 만들어 재기조차... "
2026-04-06,네이버뉴스,“전력산업의 역사적 변화… 현장·정부 잇는 창구”,https://www.dnews.co.kr/uhtml/view.jsp?idxno=202604031851507780927,"고도화해 건설현장의 시공 품질 향상과 안전 시공을 뒷받침할 방침이다. 또 설계와 시공의 기준이 되는... 또 미래 전력산업의 핵심인 AI(인공지능) 기술을 활용한 기술기준 서비스 ‘KEPIC Aide’를 시범 운영하고, 원전해... "
2026-04-06,네이버뉴스,"中 원전 공사 결함 최소 200건 넘어…""기술 부족·안전 의식 문제"" [KDF W...",http://www.kdfnews.com/news/articleView.html?idxno=181423,중국 정부는 후쿠시마(福島) 제1 원전 사고 이후 원전 신규 승인 절차를 일시 중단했다가 2012년부터 건설을 재개했다. 현재는 2030년까지 원전 발전 용량 세계 1위를 목표로 빠르게 확대하고 있다. 일본의 원전 전문가는... 
2026-04-06,네이버뉴스,"독일 전기요금, 프랑스의 5배…탈원전 대가 혹독",https://www.g-enews.com/view.php?ud=2026040520495578622bd56fbc3c_1,"국제에너지기구(IEA)가 탄소 중립 목표 달성을 위해 2050년까지 전 세계 원전 설비 용량을 현재의 2배 이상으로 늘려야 한다고 분석했지만, 그 목표와 현재 유럽의 재정 여건·건설 역량 사이의 간극은 크다. 원전... "
2026-04-06,네이버뉴스,"트럼프 “화요일은 발전소의 날… 미친 X들아, 해협 열어라”",https://www.chosun.com/international/mideast-africa-latin/2026/04/06/4E4JP4PZONC5PB6M7A4BJOSPW4/?utm_source=naver&utm_medium=referral&utm_campaign=naver-news,"이란 원전·병원·교량 타격 이어 7일 핵심 인프라 대공습 예고 이란도 주변국 민간시설들 공격 서로 파괴적... 테헤란 인근에 건설 중이던 B1 대형 현수교와 주요 제철소, 정유 시설 등 교통·산업 기반도 잇따라 파괴됐다.... "
2026-04-05,네이버뉴스,"경주시,‘차세대 원전 i-SMR 유치’ 공감대 확산",https://www.ksmnews.co.kr/news/view.php?idx=598716,i-SMR은 기존 원전보다 안전성이 높고 건설 기간과 비용을 줄일 수 있는 차세대 원전 기술로 평가된다.전문가 강연에서는 i-SMR 도입에 따른 지역경제 파급효과와 함께 경주의 산업 거점 성장 가능성이 제시됐다.... 
2026-04-05,네이버뉴스,"한수원, 고리2호기 재가동… ""노후원전 아닌 '고도화 설비'로 재탄생""",http://www.hidomin.com/news/articleView.html?idxno=615457,업계에서는 이번 고리2호기 재가동을 계기로 국내 원전 산업이 '신규 건설'과 '기존 설비 고도화'라는 투 트랙 전략을 본격화할 것으로 보고 있다. 특히 계속운전 확대는 탄소중립 달성과 함께 전력 시장 안정성 확보... 
2026-04-05,네이버뉴스,"미, 이란 석화단지·원전 집중 공습",https://www.khan.co.kr/article/202604052020025,이란과 함께 부셰르 원전을 건설한 러시아는 공습 발생 20분 후 부셰르 원전에서 자국 전문인력 198명이 철수했다고 밝혔다. 아바스 아라그치 이란 외교장관은 이날 엑스에 “부셰르 원전에 대한 공격으로 방사성 물질이... 
2026-04-05,네이버뉴스,"한전, 베트남 원전 부품 시장 선점 나섰다",https://www.g-enews.com/view.php?ud=202604031336507016a9fc143920_1,원전 건설 전 단계를 아우르는 협력 체계를 한 자리에 놓고 논의한 셈이다. 팀코리아는 설계부터 건설·운영·정비까지 전 주기에 걸친 한국의 경험을 공유하고 베트남 맞춤형 공급망 로드맵을 제시했다. 현지... 
2026-04-05,네이버뉴스,[포럼] ADB가 터준 소형원자로 수출,http://www.fnnews.com/news/202604051814057570,"그래서 원자력발전의 르네상스 시대가 열린 것인데, ADB가 특정 지어 SMR과 같은 소형원전을 건설하겠다는 나라에 적극 지원하겠다는 것이다. 소형원자로인 SMR 시대가 열리면서 원자력 선진국인 미국과 일본이... "
2026-04-05,네이버뉴스,"메타, 데이터센터에 발전소 통째로 묶어...4.5조원 조달 나선다",https://www.sedaily.com/article/20028451?ref=naver,원)의 건설 대출을 추진한다. 이는 데이터센터 건물과 자체 발전시설을 한꺼번에 묶어 자금을 조달하는 첫... 1GW는 원전 1기에 맞먹는 발전량으로 약 100만 가구가 동시에 사용할 수 있는 전력에 해당한다. 이 데이터센터는... 
2026-04-05,네이버뉴스,트럼프의 ‘지옥문’ 카운트다운… 이란에 ‘48시간’ 최후통첩,https://www.segye.com/newsView/20260405509142?OutUrl=naver,발전소 건설의 날이자 다리 건설의 날이 될 것”이라며 “빌어먹을 (호르무즈) 해협을 열어라 미친 놈들아... 부셰르 원전을 잇따라 공격한 가운데 나왔다. 지난 1일 대국민 연설에서 “2∼3주에 걸쳐 강력한 타격을 가할... 
2026-04-05,네이버뉴스,"조주홍 영덕군수 예비후보, 선거사무소 개소식 개최",https://www.getnews.co.kr/news/articleView.html?idxno=867022,"조 예비후보는 영덕 경제 활성화를 위한 핵심 과제로 신규 원전 유치를 포함한 에너지 산업 기반 구축을... 지역 발전 전략으로는 영덕~의성 철도 및 신공항 연계, 영덕~삼척 남북 10축 고속도로 건설, 국도 및 어항 정비... "
2026-04-05,네이버뉴스,보수분열에 3파전이 4파전으로… 울산은 오리무중 속으로,http://weekly.chosun.com/news/articleView.html?idxno=50311,"김종훈 후보는 국회의원(20대) 시절이던 2016년 신규 원전 건설 주민투표 의무화 법안을 추진하고, 당시 울산 울주군에 건설 중이었던 새울 3·4호기(구 신고리 5·6호기) 중단을 주장한 바 있다. 박맹우 완주 선언, 보수분열... "
2026-04-06,네이버뉴스,"제천시, 36홀 규모 산악형 파크골프장 본격 착수",https://www.newspim.com/news/view/20260406000058,"조사를 마무리한 뒤 상반기 내 본격적인 공사에 들어갈 계획이다. 시 관계자는 ""파크골프장이 조성되면 지역 내 체육 인프라가 확충되고 시민들의 건강 증진과 삶의 질 향상에 기여할 것으로 기대한다""라고 말했다."
2026-04-06,네이버뉴스,"[단독] 현대제철, 프랑스 피브스와 美 차량 강판 첨단 설비 계약…루이...",https://www.theguru.co.kr/news/article.html?no=100153,현대제철은 오는 2029년 1분기 상업 가동을 위한 대규모 생산 인프라 구축에 속도를 내게 됐다. 6일... 루이지애나 공장은 올해 착공에 들어가 오는 2029년 1분기 상업 가동을 목표로 하고 있다. 완공 시 연간 270만 톤의... 
2026-04-06,네이버뉴스,"라오스·베트남 철도 프로젝트, 양허계약 체결…철도공단·유신·희림 등...",https://www.theguru.co.kr/news/article.html?no=100156,"6일 라오스 현지 언론 등에 따르면, 라오스 재무부는 지난달 31일 비엔티안에서 라오스 최대 민간 인프라... PTL홀딩 회장은 지난해 12월 라오스·베트남 철도 프로젝트의 착공 시점을 공개했다. 시티사이 회장은 “이번... "
2026-04-06,네이버뉴스,2조9000억 투입 국가 AI컴퓨팅센터...해남군 7월 착공,https://www.etoday.co.kr/news/view/2572857,"이달 중 인허가 절차를 마무리한 뒤 설계보완과 구조 검토에 착수하고, 상반기 내 실시설계와 착공계를... 이번 사업은 단순한 데이터센터를 넘어 국가 차원의 AI 연산 인프라 구축이라는 점에서 의미가 크다.... "
2026-04-06,네이버뉴스,"청주시, SK하이닉스 AI 반도체 공장에 하루 11만㎥ 공업용수 공급 나선다",https://www.eroun.net/news/articleView.html?idxno=77402,상수도 인프라 확충에 나선다. 시 상수도사업본부는 청주테크노폴리스 일반산업단지 내에 건설 예정인 P&T7 공장에 공업용수를 공급하기 위한 'SK하이닉스 추가공장(P&T7) 공업용수 공급사업(4단계)'을 본격 착공했다고... 
2026-04-06,네이버뉴스,"“2.99일 머물렀다”…구미, ‘일하는 도시’에서 ‘체류형 관광도시’...",https://www.ekn.kr/web/view.php?key=20260406022014399,"구미시는 이러한 흐름을 기반으로 숙박 인프라 확충에 속도를 내고 있다. 제1국가산업단지에는 지하 1층~지상 15층, 211객실 규모의 4성급 글로벌 브랜드 호텔이 들어설 예정이며, 이르면 5~6월 착공이 목표다. 공단 지역... "
2026-04-06,네이버뉴스,"청주시, SK하이닉스 P&T7 공업용수 공급사업 착공",https://news.bbsi.co.kr/news/articleView.html?idxno=4076388,"공급사업'을 착공한다고 오늘(6일) 밝혔습니다. 총 278억원이 투입되는 이번 사업은 길이 2.4km, 관경 1천100... 청주시는 2024년 기준 하루 44만 6천 705㎥ 규모의 상수도 공급능력을 보유해 전국 7위 수준의 인프라를... "
2026-04-06,네이버뉴스,"위탁개발생산 후발 롯데바이오, 수주·수익화 '쉽지 않네'",https://news.bizwatch.co.kr/article/healthcare/2026/04/03/0029,"공장·설비뿐 아니라 품질관리(QC) 인프라, 인허가 체계까지 초기 투자 부담이 큰 '초고정비 산업'인 탓에... 회사는 2024년 7월 착공식 간담회에서 2028년을 목표로 기업공개(IPO)에 착수하겠다는 계획을 밝힌 바 있다."
2026-04-06,네이버뉴스,"청주시, 첨단산업 기반 강화·임산부 지원 확대",https://www.bzeronews.com/news/articleView.html?idxno=815541,공급 인프라 구축과 함께 임산부 할인업소 사업을 전 지역으로 확대하는 등 산업·생활 분야 정책을 병행 추진하고 있다. ◇ SK하이닉스 P&T7 공업용수 공급사업 착공 청주시 상수도사업본부는 청주테크노폴리스... 
2026-04-06,네이버뉴스,부동산 활황·교통 호재…신복 역세권 뜬다,https://www.ksilbo.co.kr/news/articleView.html?idxno=1053178,울산시는 1호선 착공을 시작으로 추후 2·3·4호선과 혁신도시선까지 촘촘한 도시철도망을 계획 중이다. 또... 한층 더 개선된 교통 인프라를 누릴 수 있다는 기대감과 미래가치가 반영되면서 부동산시장에도 긍정적인... 
2026-04-06,네이버뉴스,"정장선 평택시장 ""후회없는 정치여정, 아름다운 마무리 영광스럽다""",https://www.ajunews.com/view/20260405072200110,"1라인이 착공됐다. 그리고 2017년 6월, 마침내 반도체 생산이 시작됐다. -카이스트 캠퍼스 유치와 국제학교... 주거 환경과 생활 인프라가 빠르게 개선되며, 합계출산율 역시 1.02로 전국 평균과 경기도 평균을 크게 웃도는... "
