date,source,title,link,description
2026-07-13,네이버뉴스,"현대건설, 디에이치 방배 공개…'H 컬처클럽' 첫 적용",https://www.sentv.co.kr/article/view/sentv202607130002,현대건설은 오는 9월 입주를 앞둔 서울 서초구 '디에이치 방배'를 처음 공개하고 입주자 사전점검 행사인 '더 에이치 쇼케이스'를 11일부터 13일까지 진행한다고 밝혔다. 이번 행사는 단순히 단지 상품성을 점검하는 기존... 
2026-07-13,네이버뉴스,"北총리, 中총리에 감사전문…""친선 전면적 확대 발전 노력""",https://www.edaily.co.kr/news/newspath.asp?newsid=01994246645514192,박 총리는 중국공산당 역사전시관 방명록에 “중국 인민이 중국 공산당 영도 밑에 사회주의 현대화 국가 건설에서 끊임없이 새로운 성과를 거두기 바란다”는 글을 남겼다. 대표단은 이에 앞서 톈진시에서... 
2026-07-13,네이버뉴스,"북한 총리, 중국 총리에 감사전문…""조중친선 전면적 확대발전 노력""",https://news.sbs.co.kr/news/endPage.do?news_id=N1008654137&plink=ORI&cooper=NAVER,"박태성 총리는 중국공산당 역사전시관 방명록에 ""중국 인민이 중국 공산당 영도 밑에 사회주의 현대화 국가 건설에서 끊임없이 새로운 성과를 거두기 바란다""는 글을 남겼습니다. 대표단은 이에 앞서 톈진시에서... "
2026-07-13,네이버뉴스,"北총리, 中총리에 감사전문…철도 관제센터 등 참관 후 귀국",https://www.newsis.com/view/NISX20260713_0003705984,"박 총리는 방문록에 ""중국인민이 중국 공산당의 영도 밑에 사회주의 현대화 국가 건설에서 끊임없이 새로운 성과를 거두기 바란다""고 썼다. 아울러 대표단은 베이징시 도시철도 관제센터를 찾아 ""교통운수의 현대화... "
2026-07-13,네이버뉴스,"북 총리, 중국총리에 감사전문…“조중친선 전면적 확대발전 노력”",https://news.kbs.co.kr/news/pc/view/view.do?ncd=8608713&ref=A,박태성 총리는 중국공산당 역사전시관 방명록에 “중국 인민이 중국 공산당 영도 밑에 사회주의 현대화 국가 건설에서 끊임없이 새로운 성과를 거두기 바란다”는 글을 남겼습니다. 앞서 대표단은 톈진시에서... 
2026-07-13,네이버뉴스," 대한민국 산업의 미래, 3대 그룹 선택에 있었다",https://www.ilyosisa.co.kr/news/article.html?no=256773,"삼성은 무역과 전자를 중심으로 사업을 키웠고, 현대는 건설과 중공업을 앞세워 국가 기간산업을 일으켰으며, 선경(SK의 전신)은 섬유와 무역을 기반으로 안정적인 성장을 이어갔다. 출발은 달랐지만 세 기업 모두... "
2026-07-13,네이버뉴스,"양주지역 미분양관리지역 세 달만에 재지정…""미분양 장기화 우려""",https://www.news1.kr/local/gyeonggi/6225399,"단지별로 보면 양주 옥정동 일대 옥정지구 D-1~3BL, 5~8BL, 10BL 및 중상1·복합1BL과 은현면 용암리, 회정동 회천지구 등에 분포돼 있으며 각 지역에 ㈜현대건설, ㈜영무토건, ㈜대광건영 등의 건설사들이 준공하거나... "
2026-07-13,네이버뉴스,"암모니아 운반선, 차세대 고(高)부가가치 선박으로 수요 점증",https://www.abcn.kr/news/articleView.html?idxno=89357,"조선소 설립을 위한 현대건설 조선사업부 공채에 신입사원으로 입사한 이래 필자는 현대중공업 뉴욕지사장, 현대종합상사 선박본부장 등 현대와 함께 조선입국(造船立國)의 외길을 걸어왔으며, 현재... "
2026-07-13,네이버뉴스,"北총리, 中총리에 감사전문…""조중친선 전면적 확대발전 노력""",https://www.yna.co.kr/view/AKR20260713007700504?input=1195m,"박태성 총리는 중국공산당 역사전시관 방명록에 ""중국 인민이 중국 공산당 영도 밑에 사회주의 현대화 국가 건설에서 끊임없이 새로운 성과를 거두기 바란다""는 글을 남겼다. 대표단은 이에 앞서 톈진시에서... "
2026-07-13,네이버뉴스,[30조 목동 패권전-①삼성물산] '래미안' 저력 입증…5·13단지 선점 속...,https://daily.hankooki.com/news/articleView.html?idxno=1385001,데일리한국은 [30조 목동 패권전] 시리즈를 통해 서울 서남권 주거벨트의 핵심인 목동 재건축 시장에 도전장을 내밀고 있는 대형건설사(삼성물산·현대건설·대우건설·DL이앤씨·GS건설·포스코이앤씨·롯데건설... 
2026-07-13,네이버뉴스,하반기에도 뜨거운 재개발·재건축…시공사 선정 ‘봇물’,https://www.dailian.co.kr/news/view/1665731/?sc=Naver,"사업에 관심이 있는 건설사로는 GS건설, 대우건설, 현대건설 등 10대 건설사 대부분이 거론된다. 마포구와 용산구 등 강북권에서는 1000가구 이상 대단지가 시공사 선정을 준비하고 있다. 마포구 성산시영은 3710가구에서... "
2026-07-13,네이버뉴스,10대 건설사 모두 '원청 사용자' 맞다,https://www.labortoday.co.kr/news/articleView.html?idxno=235645,앞서 사용자성이 인정된 △삼성물산 △현대건설 △디엘이앤씨 △지에스건설 △현대엔지니어링 △포스코이앤씨 △롯데건설 △에스케이에코플랜트 △에이치디씨현대산업개발을 포함하면 시공능력평가 상위 10위... 
2026-07-13,네이버뉴스,'여의도 대교' 따낸 삼성⋯목화·시범 재건축도 싹쓸이하나,https://www.etoday.co.kr/news/view/2602625,"이투데이=이세령 기자 | 삼성물산, 목화 수의계약 전망 시범도 단독 응찰 가능성 높아 화랑은 대우·포스코 등서 관심 광장, 현대건설 사업 참여 유력 서울 영등포구 여의도 일대 재건축 사업이 빠르게 전개되고 있다.... "
2026-07-13,네이버뉴스,[이번주 시공사 현장설명회 스케줄(2026.7.13~7.16)],https://www.sisaon.co.kr/news/articleView.html?idxno=202593,앞서 지난달 말 1차 시공사 현설이 열렸으며 현대건설이 단독으로 참석해 자동 유찰됐다. 2차 입찰도 현대건설의 단독 입찰 가능성에 무게가 실린다. 오는 15일에는 목동12단지아파트 조합이 현설을 연다. 서울... 
2026-07-13,네이버뉴스,“래미안 뜨니 줄줄이 철수”…늘어난 재건축 수의계약,https://www.dt.co.kr/article/12072454?ref=naver,올 상반기 압구정과 반포에서 시공권 확보에 도전했던 건설사들은 모두 삼성물산과 현대건설에 밀려 고배를 마셨다. 이 때문에 하반기 재건축 수주전에선 두 회사와의 경쟁을 피하려는 움직임이 더 커질 것이란 분석이... 
2026-07-13,네이버뉴스,여의도 재건축 급물살…시공사 선정 레이스,https://www.dnews.co.kr/uhtml/view.jsp?idxno=202607091558316490615,"역시 그간 시공권 확보에 의지를 보여온 현대건설이 단독으로 참석해 유찰되면서, 현대건설의 무혈입성이 가시화하고 있다. 특히 이곳은 기존 168가구를 최고 52층 414가구로 재건축하는 사업이다. 예정 공사비가 3.3㎡당... "
2026-07-13,네이버뉴스,"[이번주 재개발ㆍ재건축] 대우건설, 1.4조 상도15구역 수주 ‘초읽기’",https://www.dnews.co.kr/uhtml/view.jsp?idxno=202607120803070290794,오랜 기간 수주에 공들여온 현대건설이 1차 현설에 단독 참석하며 시공권 확보가 가까워지고 있다. 지하 4층~지상 최고 52층 3개동 아파트 414가구와 부대복리시설 등을 짓는 사업이다. 서울 양천구 목동12단지아파트... 
2026-07-13,네이버뉴스,‘조 단위 대어’ 목동ㆍ성수ㆍ마포도 시동,https://www.dnews.co.kr/uhtml/view.jsp?idxno=202607101244500590700,"지난달 말 열린 시공사 선정을 위한 현장설명회에는 현대건설, 대우건설, 포스코이앤씨, 제일건설, 금호건설, CA이앤씨 등 6개사가 참석했다. 12단지도 최고 43층 2810가구 규모로 재건축하는 사업으로 총사업비... "
2026-07-13,네이버뉴스,칼날·폭염·충격으로부터 보호… 안전 기능 강화한 요즘 작업복,https://www.chosun.com/economy/industry-company/2026/07/13/H6PXI54YHJF5BHF6ZDXACUUOFM/?utm_source=naver&utm_medium=referral&utm_campaign=naver-news,"볼디스트는 작년 현대차그룹과 함께 충격 방지용 모자를 개발했고, 현대건설에는 야간에도 쉽게 식별 가능한 안전 조끼를 만들어 납품했다. 블랙야크아이앤씨는 안전 솔루션 스타트업 린솔과 손잡고 위험 감지용... "
2026-07-13,네이버뉴스,"성수르엘-압구정 현대, 지명 담고 짧은 아파트 이름 인기",https://www.donga.com/news/Economy/article/all/20260712/134283296/2,서울 강남구 압구정 2·3·5구역 재건축 사업을 잇달아 수주한 현대건설은 새로 짓는 단지에 하이엔드 브랜드인 ‘디에이치(THE H)’ 대신 ‘압구정 현대’를 활용하기로 했다. 압구정 현대아파트가 갖는 상징성을 살린... 
2026-07-13,네이버뉴스,삼성SDI '차세대 AI 배전망 사업' 최대 수혜,https://www.ksilbo.co.kr/news/articleView.html?idxno=1061861,"한국중부발전, 현대건설 등 9곳이 선정됐다. 9곳 중 6곳이 삼성SDI 배터리셀을 채택해 가장 많았고, LG에너지솔루션과 SK온의 배터리셀을 채택한 사업자가 각각 1곳과 2곳으로 집계됐다. 특히 용량 기준으로 보면... "
2026-07-13,네이버뉴스,"건설 빅3, 상반기 수주 27.9조…재건축으로 곳간 채웠다",https://www.fntimes.com/html/view.php?ud=202607110028556520dd55077bc2_18,"한국금융신문이 각 건설사의 공시와 IR 자료를 집계한 결과 삼성물산 건설부문(대표이사 오세철)과 현대건설(대표이사 이한우), 대우건설(대표이사 김보현)은 올해 1~6월 전국에서 총 31건, 27조9138억원 규모의 건축공사를... "
2026-07-13,네이버뉴스,"[Biz Inside] 송영흡 KR파트너스 대표 ""리스크 설계가 산업 경쟁력""",https://www.insnews.co.kr/news/articleView.html?idxno=91730,"송 대표는 서울대학교 토목공학과 출신으로 현대건설·삼성물산에서 싱가포르, 스리랑카 등 국내외 항만·인프라 사업을 수행한 뒤, 2007년 코리안리재보험으로 옮겨 리스크관리 실무를 총괄했다. 그는 ""현장에서 공법과... "
2026-07-12,네이버뉴스,"정부, 배전망 ESS 첫 도입…2030년 재생에너지 1GW 추가 접속",http://www.ferrotimes.com/news/articleView.html?idxno=49096,"이번 공모에는 14개 사업자가 82개 배전선로를 신청했으며, 최종적으로 VPP랩, LG에너지솔루션, 한전KDN, SK이터닉스, HD현대일렉트릭, 그리드위즈, 한국동서발전, 한국중부발전, 현대건설 등 9개 사업자가 선정됐다.... "
2026-07-12,네이버뉴스,"현대건설,계절의정취담아낸디에이치스페셜티(Tea)출시",https://www.job-post.co.kr/news/articleView.html?idxno=220797,현대건설이 하이엔드 주거 브랜드 '디에이치(THE H)'의 고품격 라이프스타일과 정서적 여유를 담아낸 특별한 시그니처 티를 선보인다. 현대건설은 프리미엄 브랜드 '델픽(DELPHIC)'과 협업하여 독창적인 티 세트인 '디에이치... 
2026-07-12,네이버뉴스,현대건설 '5000억' 실탄 확보…원전·SMR 신사업 정조준,https://www.bloter.net/news/articleView.html?idxno=667882,현대건설이 이자 부담 없이 확보한 5000억원의 대규모 자금을 바탕으로 원자력 발전과 소형모듈원전(SMR) 등 환경·에너지 신사업 전환에 속도를 낸다. 침체된 주택 사업의 한계를 극복하기 위한 체질 개선 작업이... 
2026-07-12,네이버뉴스,플랜트노조 위원장 “산재 줄이자는 교섭이 원청에 무리한 요구냐”,https://www.hani.co.kr/arti/society/labor/1267908.html,"노란봉투법 시행 뒤 포스코, 에쓰오일, 고려아연, 에스케이에너지 등 4곳의 발주사와 현대건설, 롯데건설 등 7곳의 종합건설사가 모두 플랜트 하청노동자에 대한 사용자성이 인정됐다. 그러나 교섭에 응한 곳은 1곳도 없다.... "
2026-07-12,네이버뉴스,"삼성SDI, 정부 AI 배전망 ESS 입찰 '최다'",http://www.ujeil.com/news/articleView.html?idxno=388659,"12일 기후에너지환경부가 발표한 '2026년 인공지능(AI) 활용 ESS 구축 지원 사업' 사업자 선정 결과 VPP랩, LG에너지솔루션, 한전KDN, SK이터닉스, HD현대일렉트릭, 그리드위즈, 한국동서발전, 한국동서발전, 현대건설 등... "
2026-07-12,네이버뉴스,호남 전력망 숨통 트일까…ESS로 재생에너지 접속 확대,https://www.namdonews.com/news/articleView.html?idxno=916670,"공모에는 14개 사업자가 참여했으며, VPP랩과 LG에너지솔루션, 한전KDN, SK이터닉스, HD현대일렉트릭, 그리드위즈, 한국동서발전, 한국중부발전, 현대건설 등 9개 사업자가 선정됐다. 이들 기업은 32개 배전선로에 ESS 128MW... "
2026-07-12,네이버뉴스,"현대건설, 디에이치 방배 ‘H 컬처클럽’ 서비스 선봬",https://www.smarttoday.co.kr/ko-kr/articles/109428,"|스마트투데이=김종현 기자| 현대건설이 서울 서초 ‘디에이치 방배’서 입주자 사전점검 행사 ‘디에이치 쇼케이스’를 진행한다고 12일 밝혔다. 디에이치 방배는 지하 4층~지상 33층, 29개 동, 총 3064가구 규모다. 이... "
2026-07-12,네이버뉴스,"삼성SDI 연합, 정부 'AI 활용 ESS' 사업서 우위 확보…전체 물량의 약 66...",https://www.pinpointnews.co.kr/news/articleView.html?idxno=467719,"기후에너지환경부가 지난 10일 발표한 'AI 활용 ESS 구축지원 사업' 낙찰자 명단에 따르면 VPP랩, LG에너지솔루션, 한전KDN, SK이터닉스, HD현대일렉트릭, 그리드위즈, 한국동서발전, 현대건설 등 총 9곳이 이름을... "
2026-07-12,네이버뉴스,‘압여목성’ 중 가장 빠르다…재건축 가속페달 밟는 목동,https://www.sedaily.com/article/20066716?ref=naver,"7단지에는 삼성물산·현대건설·롯데건설 등이 관심을 보이고 있으며, 현대건설은 브랜드 라운지를 열어 수주 활동에 들어갔다. 4단지는 현대건설과 포스코이앤씨, 8단지는 성수4지구에서 맞붙었던 대우건설과... "
2026-07-12,네이버뉴스,‘H컬처클럽’ 첫 적용…왕실 정원 콘셉트 조경도[디에이치 방배 9월 입...,https://www.sedaily.com/article/20066711?ref=naver,"방배5구역을 재건축한 이 단지는 지하 4층~지상 33층, 29개 동, 총 3064가구 규모 대단지로 현대건설이 하이엔드 주거브랜드 디에이치(THE H)를 선보인 7번째 현장이다. 전 세대 남향으로 배치돼 채광과 조망을 확보했으며... "
2026-07-12,네이버뉴스,"메이사, 국토부 ‘AX 스프린트’ 사업 맡아",https://www.dt.co.kr/article/12072477?ref=naver,"컨소시엄에는 산업용 IoT 안전관리 기업 ‘무스마’와 비전 AI 올인원 플랫폼 ‘슈퍼브AI’가 기술 파트너로, 현대건설이 수요기업으로 참여한다. 사업은 토공·지형, 기초·구조물, 실내·지하 등 건설 전 공정 단계에서... "
2026-07-12,네이버뉴스,"韓탄소, 동남아시아 바다에 저장한다",https://www.mk.co.kr/article/12096493,석유공사·현대건설 CCS 속도 한국석유공사가 추진 중인 동남아시아 탄소포집·저장(CCS) 사업이 본궤도에 올랐다. 이번 사업은 국내 기업이 배출한 탄소를 포집해 동남아 고갈 유전에 격리하는 '국가 간 CCS 협력'이... 
2026-07-12,네이버뉴스,"삼성SDI, 기후부 ‘AI 배전망 ESS’ 사업 66% 수주",https://www.munhwa.com/article/11602054?ref=naver,"한국동서발전, 현대건설등 총 9곳이 선정됐다. AI 활용 ESS 구축지원사업은 재생에너지를 통해 만든 전기를 보낼 선로에 ESS를 구축하고 AI를 통해 이를 효율적으로 운영할 수 있도록 지원해주는 정부 사업이다.... "
2026-07-12,네이버뉴스,압구정현대-성수르엘…지역 앞세운 짧고 쉬운 이름 뜬다,https://www.donga.com/news/Economy/article/all/20260712/134282250/1,서울 강남구 압구정 2·3·5구역 재건축 사업을 잇달아 수주한 현대건설은 새로 짓는 단지에 하이엔드 브랜드인 ‘디에이치(THE H)’ 대신 ‘압구정 현대’를 활용하기로 했다. 압구정 현대아파트가 갖는 상징성을 살린... 
2026-07-12,네이버뉴스,하반기 포문 여는 여의도 일대 재건축…별들의 전쟁 예고,https://www.asiatoday.co.kr/kn/view.php?key=20260712010004266,"삼성물산은 대교아파트 시공권을 확보했고, 현대건설은 한양아파트, 대우건설은 공작아파트의 시공사로 각각 선정됐다. 이들 기업은 여의도 핵심 단지 수주 실적을 바탕으로 브랜드 인지도를 높이는 동시에 향후 인근... "
2026-07-12,네이버뉴스,고원가 현장 털어낸 곳부터 반등…주요 건설사 2분기 실적 '온도차' 전망,https://www.etoday.co.kr/news/view/2601161,"대우건설과 IPARK현대산업개발은 원가 부담 완화와 자체사업 효과를 바탕으로 영업이익이 큰 폭으로 늘어날 것으로 예상되는 반면, 현대건설·DL이앤씨·GS건설은 매출 감소와 기저 부담 영향으로 감익이 예상된다. 12일... "
2026-07-12,네이버뉴스,영화관부터 AI 학습까지…'디에이치 방배'가 바꾼 아파트의 하루,https://www.apnews.kr/news/articleView.html?idxno=3049706,©AP신문(AP뉴스)/이미지 제공 = 현대건설 ▲'디에이치 방배' 전경 아파트 단지 안에서 최신 영화를 보고 프라이빗 북콘서트와 미술 작품 해설을 즐긴다. 직접 재배한 채소를 식탁에 올리고 인공지능(AI)의 도움을 받아... 
2026-07-12,네이버뉴스,[ET시론] 인공지능을 비용 절감보다는 수익 창출의 도구로,https://www.etnews.com/20260710000072,"동일한 논리가 1995~1997년 현대건설에서도 재현됐다. 아파트 건설 계약에 입찰하려면 프로젝트 관리 기법인 프로그램 평가 및 검토 기법(PERT)과 임계 경로 방법(CPM)에 기반한 복잡한 일정을 수립해야 하는데, 이를 짜기... "
2026-07-13,네이버뉴스,"건원엔지니어링, 방배신삼호 재건축 CM용역 수주",https://www.dnews.co.kr/uhtml/view.jsp?idxno=202607100928512590672,재건축정비사업’의 건설사업관리(CM) 용역을 수주하며 도시정비시장에서 독보적인 CM 역량을 재입증했다.... 시공사로 선정된 삼성물산은 단지명으로 ‘래미안 르페리움(RAEMIAN REPERIUM)’을 제안했다. 건원엔지니어링... 
2026-07-12,네이버뉴스,주거·교육·의료 '원스톱' 해결… 단지 자체가 미니신도시,https://www.mk.co.kr/article/12096475,DK아시아는 삼성물산 리조트부문과 협업해 단지 내 커뮤니티와 조경 공간을 리조트형으로 조성했다.... 나란히 대상에 선정된 우미건설의 '오산세교 우미린 센트럴시티'는 경기 오산세교2지구에 들어선 1532가구 규모... 
2026-07-12,네이버뉴스,"""집 구했죠?""…한샘, 평형·타입별 인테리어 제시",https://www.newsis.com/view/NISX20260710_0003704383,한샘은 삼성물산 건설부문과 인테리어 분야 단독 제휴를 맺고 다양한 특별 할인 이벤트를 제공한다고 12일 밝혔다. 협업을 통해 한샘은 삼성물산의 홈플랫폼 홈닉(Homeniq)에서 홈닉 도입단지 입주 예정자의 편리하고... 
2026-07-13,네이버뉴스,"[더벨]DL이앤씨, 효제동 오피스 임차인 물색",https://www.thebell.co.kr/free/content/ArticleView.asp?key=202607081432598400104017,DL이앤씨가 서울 종로구 효제동에서 자체 개발 중인 오피스의 임차인 모집에 나섰다. 준공을 약 1년 앞둔 상태로 우선 임차인을 확보한 뒤 매각 여부를 검토할 것으로 보인다. DL이앤씨가 PF 신용보강과 자금 대여를... 
2026-07-13,네이버뉴스,7월 13일 개장 전 주요 공시,https://www.seoulfn.com/news/articleView.html?idxno=633180,DL이앤씨는 서울시 도시기반시설본부가 발주한 '국회대로 지하차도 및 상부공원화(2단계) 건설공사 2공구'를 2578억원에 수주했다고 공시했다. 지난해 매출의 3.48%에 해당한다. 2021년 최초 계약이 변경되면서 공시... 
2026-07-13,네이버뉴스,"건설업계, AI 데이터센터 ‘새 먹거리’ 부상…대우·GS·SK에코 미래 투...",https://www.ceoscoredaily.com/page/view/2026071016004326673,"DL이앤씨 역시 데이터센터 수주 경험이 많은 만큼 향후 AI 데이터센터 수주에서 유리한 위치를 점할 수 있을 것으로 전망된다. DL이앤씨는 상암데이터센터, 가산 데이터센터 등을 준공한 바 있으며 현재는 김포... "
2026-07-13,네이버뉴스,"[N2 모닝 경제 브리핑-7월 13일] 美 증시, 중동 변수 딛고 상승…SK하이...",https://www.news2day.co.kr/article/20260710500198,■ 주요 기업 공시(10일) - 한화엔진 : 약 1158억원 규모 선박용 엔진 판매·공급계약 - DL이앤씨 : 약 2578억원 규모 국회대로 지하차도 및 상부공원화(2단계)건설공사 2공구 수주 - 대웅제약 : 펙수클루정(Fexuclue)의... 
2026-07-12,네이버뉴스,신혼희망타운 ‘e편한세상 분당 퍼스트빌리지’,https://www.khan.co.kr/article/202607122018005,"DL이앤씨가 경기 성남시 분당구에 ‘e편한세상 분당 퍼스트빌리지’를 분양한다. e편한세상 분당 퍼스트빌리지는 신혼희망타운 입주 자격을 갖춘 신혼부부나 결혼 예정자, 한부모 가구가 분양 대상이다. 성남시 2년... "
2026-07-13,네이버뉴스,"건설현장에 AI·로봇 투입…국토부, 스마트건설 실증기술 10개 선정",https://www.newspim.com/news/view/20260712000142,대우건설 현장에서는 시에라베이스가 개발한 회전형 라이다 기반 위치 추정·지도 작성(SLAM) 기술을 실증한다. 지하실 등 실내 시설물의 균열을 디지털 방식으로 측정하고 손상 규모를 정량화하는 기술이다.... 
2026-07-12,네이버뉴스,피지컬 AI로 현장위험 찾는다… 노가다 오명벗는 스마트건설,https://m.skyedaily.com/news_view.html?ID=307683,국토교통부(국토부)는 시에라베이스가 대우건설 공사현장에서 SLAM 기술을 적용해서 상용화 가능성을 검증할 수 있도록 도왔다. 정부가 건설현장에 피지컬 인공지능(AI)을 도입한다. 국토부와 한국건설기술연구원은 12일... 
2026-07-13,네이버뉴스,"""밭·공장 자율주행으로 잇는다""…대동그룹 '농업 피지컬 AI' 속도",https://www.news1.kr/industry/sb-founded/6222865,"50억 시리즈A로 필드로봇 사업 속도 13일 업계에 따르면 대동로보틱스는 GS건설 계열 엑스플로인베스트먼트, 포스코홀딩스 계열 포스코기술투자, 나우IB투자 등 3곳으로부터 총 50억 원 규모 시리즈A 투자를 유치했다.... "
2026-07-12,네이버뉴스,전용면적 75~166㎡까지 ‘오산헤리티지자이’,https://www.khan.co.kr/article/202607122018015,"GS건설이 경기 오산시에 ‘오산헤리티지자이’를 분양한다. 오산헤리티지자이는 지상 27층에 22개동, 1783가구 규모다. 가구 유형은 전용면적 75㎡, 84㎡, 102㎡, 124㎡, 166㎡ 등으로 다양하다. 이 중 166㎡ 가구는... "
2026-07-12,네이버뉴스,매경 살기좋은아파트 종합대상… 검암역 로열파크씨티 푸르지오,https://www.mk.co.kr/article/12096598,부문별 최우수상은 △아파트 대형사 부문 GS건설 '영등포자이디그니티' △중견사 부문 반도건설 '유보라 천안두정역' △재건축 부문 롯데건설 '잠실르엘' △재개발 부문 두산건설 '두산위브더제니스 오션시티' 등이... 
2026-07-13,네이버뉴스,[Who Is ?] 고정욱 롯데지주 대표이사 사장,https://www.businesspost.co.kr/BP?command=article_view&num=435995,"롯데건설에 입사해 롯데그룹과 인연을 맺었다. 롯데호텔를 거쳐 롯데캐피탈에서 경영전략본부장, 영업2본부장을 지냈다. 롯데호텔 대표이사로 역임한 뒤 롯데지주 재무혁신실장으로 자리를 옮겼다. 2025년 12월... "
2026-07-12,네이버뉴스,대단지·역세권·금융조건이 청약 흥행 가른다…주요 단지는,https://www.newsis.com/view/NISX20260712_0003705677,총 1857가구 규모 대단지로 수도권 1호선 의왕역이 가깝다. 롯데건설은 경기 부천시 원미구 상동 일원에서 '상동역 롯데캐슬'을 이달 선보인다. 총 1859가구 규모로 지하철 7호선 상동역을 도보로 이용할 수 있다．
2026-07-13,네이버뉴스,"경북도개발공사, 경북도청 신도시에 37층 공공임대주택 공급",https://biz.heraldcorp.com/article/10806236?ref=naver,13일 경북도개발공사에 따르면 금호건설 컨소시엄(금호건설·포스코이앤씨·플러스종합건설)이 시공을 맡은 이 공공임대주택은 예천군 호명읍 산합리 일원에 들어선다. 이번 신축 공공임대아파트는 내년 초... 
