date,source,title,link,description
2026-07-14,네이버뉴스,"전남광주통합특별시의회, 첫 업무보고서 현안 집중 점검",https://www.kukinews.com/article/view/kuk202607140178,"도로교통위원회에서는 시민 이동권 강화를 위한 교통 인프라 확충 요구가 이어졌다. 허석진 의원은 북부순환도로 총사업비 협의가 장기화되고 있다며 착공과 준공 일정을 제시할 것을 요구했고, 노소영 의원은 효천지구... "
2026-07-14,네이버뉴스,반도체 타고 IMF 이후 최고 경상성장률…3高·고용없는 성장은 과제,https://www.sedaily.com/article/20067692?ref=naver,인프라 측면에서는 총 8.4기가와트(GW) 규모의 AI 데이터센터 글로벌 허브를 2028년 상반기 중 울산·동해·세종 등에 착공하고 2029년부터 단계적으로 운영한다. 나아가 자동차·로봇 등 국내 강점이 있는 7대 핵심 분야에... 
2026-07-14,네이버뉴스,"박승진 서울시의원, 서울시·중랑구와 교통 현안 점검…6호선 연장·GTX-...",https://www.job-post.co.kr/news/articleView.html?idxno=221119,"6호선 연장과 GTX-E 신내역 정차, 면목선 도시철도 조기 착공 등 주민 숙원사업의 추진 속도를 높이기 위한... 박 의원은 ""중랑구는 서울 동북권의 관문이자 성장 잠재력이 큰 지역이지만 교통 인프라 확충이 가장 중요한... "
2026-07-14,네이버뉴스,"[메가Pick] 이 대통령·이재용·최태원 회장, '비친화기업 규제의 민주당...",https://www.megaeconomy.co.kr/news/newsview.php?ncode=1065586979963069,"민간기업의 기술력과 투자 역량에 정부와 지방자치단체의 행정·인프라 지원이 더해져야 글로벌 반도체와 AI... 공장 착공 시점과 인·허가 단축 실적, 지역 일자리 창출 규모로 결정될 전망""이라며 ""총수들과의 만남을... "
2026-07-14,네이버뉴스,"임실군, 특화산업 살리는 일하고 싶은 정착 일터’본격 시동",https://www.thepowernews.co.kr/view.php?ud=2026071417000991673dfcd109a8_7,"이번 특화사업은 관내에 밀집한 지역 기업들과 소상공인들의 노후화된 인프라 및 복지 환경으로 인해... 특히 이번 사업은 단순한 시설 보수 지원에 그치지 않고, 임실군로컬JOB센터의 전담 매니저가 1:1로 매칭되어 착공부... "
2026-07-14,네이버뉴스,"메타, 루이지애나 AI 데이터센터 5GW로 확대…투자 500억달러 돌파",https://biz.chosun.com/it-science/ict/2026/07/14/NH2ZVGJU7VGKTCGITXN2SHMS74/?utm_source=naver&utm_medium=original&utm_campaign=biz,하이페리온은 챗GPT와 같은 대규모언어모델(LLM)을 학습하는 데 필요한 핵심 AI 인프라로 활용될 예정이다.... 2024년 12월 착공 이후 루이지애나 지역 기업들이 메타로부터 수주한 계약 규모는 16억달러를 넘어섰다.... 
2026-07-14,네이버뉴스,"[IT큐레이션] 욕망의 페르소나, AI 데이터센터",https://www.econovill.com/news/articleView.html?idxno=745195,"사업자가 인프라 비용을 전액 부담한다는 원칙, 폐열의 지역난방 연계 의무화, 착공 전 소음 조사와 준공 후 검증 같은 장치들이 미국과 유럽에서는 갈등을 겪은 뒤에야 하나씩 도입됐다는 점에 착안, 지금부터라도... "
2026-07-14,네이버뉴스,용인세브란스병원 암센터 들어선다…2028년 개원 목표,https://view.asiae.co.kr/article/2026071416553971087,"공사는 올해 하반기 착공해 2028년 1월 준공을 목표로 추진된다. 이상일 용인시장은 ""용인세브란스병원은... 이번 암센터 건립으로 용인 남부권을 중심으로 한 지역 의료 인프라가 한 단계 도약할 것으로 전망된다."
2026-07-14,네이버뉴스,"정부 “반도체 호황, 성장동력으로 돌린다”…추가세수 미래산업에 재투...",https://www.ddaily.co.kr/page/view/2026071416451713019,AI 인프라 투자 확대에 따라 메모리 수요와 가격이 동시에 상승하면서 수출과 기업 실적이 개선됐다.... 정부는 GPU 약 5만장을 확보하고 국가 AI컴퓨팅센터를 올해 3분기 착공한다. 데이터센터에 투입되는 IT와... 
2026-07-14,네이버뉴스,"[하반기 경제] 정부, 미래대응기금 신설·국부펀드 확대… 부동산은 투...",https://www.viva100.com/article/20260714500658,"이를 통해 반도체와 인공지능(AI) 데이터센터, 피지컬 AI 등 3대 메가프로젝트를 비롯해 금융·인프라 등 국가... 남양주 왕숙 6800호와 인천 계양 1100호 등을 포함한 3기 신도시 주택 1만2000호를 하반기 착공한다. 태릉·성남... "
2026-07-14,네이버뉴스,"[통신 AIDC 전략]③LG유플러스, 수도권 유일 '하이퍼스케일' 파주 AIDC '승...",http://www.finomy.com/news/articleView.html?idxno=257353,"AI 연산 수요가 공급을 압도하는 현재, LG유플러스가 내놓은 하이퍼스케일 인프라에 고객사들이 앞다퉈 자리를 선점한 것으로 분석된다. 착공 단계에서부터 시장의 신뢰를 확보했다는 점은 파주 AIDC가 단순한... "
2026-07-14,네이버뉴스,"해남군, 미래 성장동력 확보 총력",https://www.namdonews.com/news/articleView.html?idxno=916924,명 군수는 오는 7월 착공을 앞둔 국가 AI 컴퓨팅센터와 정부의 3대 메가 프로젝트를 통해 17조 원 규모의... 이외에도 명 군수는 호남권 반도체 클러스터의 인프라를 구축할 때 해남 솔라시도를 포함해 통합 설계할 것을... 
2026-07-14,네이버뉴스,"UAE, 호르무즈 우회 신규 항만·터미널 건설 추진",https://www.asiatoday.co.kr/kn/view.php?key=20260714010005326,"중공업 인프라를 유지할 것""이라고 설명했다. 또 ""이번 투자는 상황이 악화할 경우를 대비한 방어적... 이번 프로젝트의 초기 투자 규모는 수억 달러 수준으로 예상되며, 신규 항만은 이르면 착공 후 1년 반 이내에... "
2026-07-14,네이버뉴스,수도권 분양가 상승세 속 분상제 단지 부각…‘호반써밋 풍무III’ 공급,https://economist.co.kr/article/view/ecn202607140038,"특히 분양가상한제가 적용되면서 교통과 교육, 생활 인프라를 갖춘 단지에는 청약 수요가 이어지는... 2028년 착공해 2031년 500병상 규모의 종합병원을 개원한 뒤 향후 700병상으로 확대한다는 계획이다. 단지는 전체... "
2026-07-14,네이버뉴스,새만금공항 소송 장기화… 대규모 투자 프로젝트 '발목' 우려,http://www.jeollailbo.com/news/articleView.html?idxno=805383,핵심 인프라인 항공인프라 구축의 불확실성이 악재로 작용할 수 있기 때문이다. 14일 전북특별자치도 등에... 문제는 소송 장기화로 실제 착공이 늦어지고 개항 시기가 불투명해지면서 대기업들의 투자 이행 속도가... 
2026-07-14,네이버뉴스,"대전, 글로벌 '테크아트' 허브 노린다… 국회·지자체·KAIST 머리 맞대",https://www.wikitree.co.kr/articles/1146426,"앞으로의 평가는 연구용역의 선언적인 기능 나열이나 인프라 연계 구상 발표가 아니라, 오는 9월경 공개될 연구용역 최종 결과의 실현 가능성과 실질적인 국비 확보 및 착공으로 이어질지 주목된다."
2026-07-14,네이버뉴스,튀르키예 첫 혈액제제 공장 짓는다…'K바이오 플랜트' 새 역사,https://www.hankyung.com/article/2026071434631,◇ 튀르키예 첫 혈장분획제제 공장 착공 SK플라즈마와 튀르키예 적신월사(이슬람권 적십자사) 합작사... 나수흐베이올루 CEO는 “튀르키예 적신월사에서 혈장 수집 인프라를 확대하면서 기증자 관리와 추적 시스템을... 
2026-07-14,네이버뉴스,"아산시, 삼성 113조 투자 지원 '전담 컨트롤타워' 출범",http://www.cctimes.kr/news/articleView.html?idxno=916618,"추진단은 신속허가팀, 인프라 및 정주여건개선팀, 지역경제활성화 및 상생협력팀, 홍보팀 등 4개 분과로... 안에 착공하기 위한 행정지원 방안이 핵심 의제로 다뤄졌다. 시는 각종 인허가 절차를 획기적으로 단축해 착공... "
2026-07-15,네이버뉴스,분양가상한제 건축비 또 오른다… 철근값 급등에 기본형건축비 0.77% 인...,https://www.kbmaeil.com/article/20260715500031,장우철 국토교통부 주택정책관은 “이번 기본형건축비 조정이 중동전쟁 등 영향으로 공사비가 급등한 상황에서 주택 건설 현장의 부담을 일부 완화하는 데 도움이 되길 기대한다”고 말했다.
2026-07-15,네이버뉴스,"""규제로 거래는 줄었는데""···분양가는 '최고치' 어쩌나",http://www.enewstoday.co.kr/news/articleView.html?idxno=2448663,"시장에서의 거래는 위축됐지만 공사비와 토지비 상승, 핵심 입지 선호가 맞물리면서 분양가 상승세는... 이은형 대한건설정책연구원 연구위원은 공개토론회와 관련해 ""향후 규제와 수요 억제 정책이 더욱 강화된다면... "
2026-07-15,네이버뉴스,"""공급 막는 규제 풀자""…공공성·체감 공급도 과제",https://www.pointdaily.co.kr/news/articleView.html?idxno=311923,"김윤덕 국토교통부 장관을 비롯해 학계와 건설·부동산업계, 시민단체, 청년 등 약 60명이 참석했다. 이번... 토론 전반에서는 공사비와 금리 상승, 대출 규제로 막힌 주택공급 과정을 다시 작동시켜야 한다는 주장이... "
2026-07-15,네이버뉴스,"조달청, PMIS 시범 도입…비용ㆍ작업ㆍ물량 통합데이터 관리",https://www.dnews.co.kr/uhtml/view.jsp?idxno=202607141441166720135,"이는 건설현장의 비용ㆍ작업ㆍ물량 정보를 통합 데이터로 관리할 수 있는 시스템으로, 작업분류체계(WBS)를... 활용돼 공사비와 예산을 책정하는 데 도움을 줄 수 있다”며 “다수 현장의 공정 및 각종 사업비... "
2026-07-15,네이버뉴스,[법률라운지] 건축물분양법 개정에 따른 건물 용도변경,https://www.dnews.co.kr/uhtml/view.jsp?idxno=202607141303396130096,최근 국내 건설 및 부동산 개발 시장은 미분양 물량 증가와 공사비 폭등으로 사업성 악화를 겪고 있다. 이러한 위기 속에서 많은 시행사와 시공사들이 사업 정상화를 위한 출구전략으로 선택하는 것이 바로 분양 건축물의... 
2026-07-15,네이버뉴스,철근값 18.6% 뛰자 기본형건축비 0.77%↑…㎡당 223만7000원,https://www.edaily.co.kr/news/newspath.asp?newsid=02099206645514848,장우철 국토부 주택정책관은 “이번 기본형건축비 조정이 중동전쟁 등 영향으로 공사비가 급등한데 따른 주택건설 현장의 애로 해소에 도움이 되길 바란다”며 “앞으로도 현장의 주택공급 애로 해소를 전방위적으로... 
2026-07-15,네이버뉴스,철근값 뛰자 기본형건축비 5만6000원 인상…3.3㎡ 약 740만원,https://www.etoday.co.kr/news/view/2603735,장우철 국토교통부 주택정책관은 “이번 기본형건축비 조정이 중동전쟁 등의 영향으로 공사비가 급등한 데 따른 주택건설 현장의 애로 해소에 도움이 되길 바란다”며 “앞으로도 현장의 주택공급 애로 해소를... 
2026-07-15,네이버뉴스,"""이제는 집도 배달한다""…공장서 만들어 조립하는 '미래 주택'[영상]",https://www.nocutnews.co.kr/news/6548104?utm_source=naver&utm_medium=article&utm_campaign=20260715063632,한마디로 '건설업계의 조립식 레고'인 셈입니다. 기후위기가 불러낸 '레고 아파트'모듈러주택이 주목받는... 아직 대량 자동화 생산 체계를 구축할 만큼 수요가 충분히 형성되지 않아 공사비가 일반 공법보다 높은 편이고... 
2026-07-15,네이버뉴스,“강남 분양가 더 오르겠네” ‘분상제 적용’ 기본형건축비 ㎡당 1.7만...,https://biz.heraldcorp.com/article/10808571?ref=naver,장우철 국토부 주택정책관은 “이번 기본형건축비 조정이 중동전쟁 등 영향으로 공사비가 급등한데 따른 주택건설 현장의 애로 해소에 도움이 되길 바란다”며 “앞으로도 현장의 주택공급 애로 해소를 전방위적으로... 
2026-07-15,네이버뉴스,철근값 18.6% 뛰자…분양가상한제 기본형건축비 0.77% 인상,http://www.fnnews.com/news/202607141702048386,"공사비 상승분을 제때 반영하면서 주택건설 현장의 부담을 덜겠다는 취지다. 장우철 국토부 주택정책관은 ""이번 조정이 주택건설 현장의 애로 해소에 도움이 되길 바란다""며 ""앞으로도 현장의 주택공급 애로 해소를... "
2026-07-15,네이버뉴스,분양가상한 기본형건축비 0.77% 인상…철근값 상승 영향,https://www.nocutnews.co.kr/news/6548213?utm_source=naver&utm_medium=article&utm_campaign=20260715063632,"국토부 장우철 주택정책관은 ""기본형건축비 조정이 공사비 상승으로 어려움을 겪는 주택건설 현장에 도움이 되길 바란다""며 ""주택공급 애로 해소를 위한 지원을 이어가겠다""고 말했다. ※CBS노컷뉴스는 여러분의... "
2026-07-15,네이버뉴스,"국토부, 기본형건축비 0.77% 인상… 고강도 철근 가격 상승분 반영",https://biz.chosun.com/real_estate/real_estate_general/2026/07/15/EZ67735BYRD3FF2OUNKGDJTT7A/?utm_source=naver&utm_medium=original&utm_campaign=biz,장우철 국토교통부 주택정책관은 “이번 기본형건축비 조정이 중동전쟁 등 영향으로 공사비가 급등한데 따른 주택건설 현장의 애로 해소에 도움이 되길 바란다”며 “앞으로도 현장의 주택공급 애로 해소를... 
2026-07-15,네이버뉴스,"새마을금고 부실채권, '개발'로 푼다…'MG ASSET' 출범",https://www.ngetnews.com/news/articleView.html?idxno=551516,"매입임대주택 건설을 추진하는 방식이다. 부국증권과 리딩투자증권, 엠플러스자산운용 등 금융사와도... LH가 신축 매입약정 가격 산정 방식을 공사비 연동형에서 감정평가로 일원화했다. 고가 매입 논란을... "
2026-07-15,네이버뉴스,"국토부, 분상제 적용 기본형건축비 조정…철근값 상승 영향",https://www.mt.co.kr/estate/2026/07/15/2026071416421097003,"장우철 국토부 주택정책관은 ""이번 기본형건축비 조정이 중동전쟁 등 영향으로 공사비가 급등한 데 따른 주택건설 현장의 애로 해소에 도움이 되길 바란다""며 ""앞으로도 현장의 주택공급 애로 해소를 전방위적으로... "
2026-07-15,네이버뉴스,분양가 더 오른다…기본형건축비 0.77% 상승,https://www.newsis.com/view/NISX20260714_0003709308,"장우철 국토부 주택정책관은 ""이번 기본형건축비 조정이 중동전쟁 등의 영향으로 공사비가 급등한 데 따른 주택건설 현장의 애로 해소에 도움이 되길 바란다""며 ""앞으로도 주택공급 애로 해소를 위해 전방위적으로... "
2026-07-15,네이버뉴스,고강도 철근값 18% 상승…분양가상한제 건축비 0.77% ↑,https://www.news1.kr/realestate/general/6227737,"장우철 국토부 주택정책관은 ""이번 기본형건축비 조정이 중동전쟁 등 영향으로 공사비가 급등한 데 따른 주택건설 현장의 애로 해소에 도움이 되길 바란다""며 ""앞으로도 현장의 주택공급 애로 해소를 전방위적으로... "
2026-07-15,네이버뉴스,분양가상한제 기본형건축비 0.77% 상승…철근 가격 영향,https://www.newspim.com/news/view/20260714001125,"장우철 국토부 주택정책관은 ""이번 기본형건축비 조정이 중동전쟁 등의 영향으로 공사비가 급등한 데 따른 주택건설 현장의 애로 해소에 도움이 되길 바란다""며 ""앞으로도 현장의 주택공급 애로 해소를... "
2026-07-15,네이버뉴스,분양가상한제 기본형건축비 0.77%↑…철근가격 상승분 반영,https://www.yna.co.kr/view/AKR20260714168600003?input=1195m,"장우철 국토부 주택정책관은 ""이번 기본형 건축비 조정이 중동전쟁 등 영향으로 공사비가 급등한 데 따른 주택 건설 현장의 애로 해소에 도움이 되길 바란다""고 말했다."
2026-07-15,네이버뉴스,"부산 북항 복합환승센터, 법적 분쟁에 공사 중단 위기",https://www.chosun.com/national/regional/2026/07/15/V2BLTPB5OFBJZGUBAVLV3UGWKI/?utm_source=naver&utm_medium=referral&utm_campaign=naver-news,"건설사인 협성종합건업 계열사다. 여기에 지상 24층 건물 2동을 짓고 부산역과 부산국제여객터미널 등을 잇는 길이 250m 공중 보행로를 놓기로 했다. 건물에는 오피스텔, 영화관, 환승 시설 등이 들어선다. 총 공사비는 약... "
2026-07-15,네이버뉴스,[엔터家] 프로야구 ⑬ㅣ 후반기 개막 앞둬…순위 싸움·새 외인 변수 '관...,https://www.cbci.co.kr/news/articleView.html?idxno=588882,● 2026-07-12 인천 청라 돔구장 개장 차질 위기…오수관로 공사비 80억원 부담에 중단 스타필드 청라 건설 현장(2026년 1월) (사진=연합뉴스) 인천 청라에 조성 중인 돔구장과 복합쇼핑몰 '스타필드 청라'의 2028년 정상... 
2026-07-14,네이버뉴스,건설수주 22.4조 '50% 급증'… 아직 회복은 제한적,https://www.ppss.kr/news/articleView.html?idxno=302033,"건설공사비는 전월에 이어 높은 상승세를 이어갔다. 2026년 5월 건설공사비지수는 137.67로 전년 동월 대비 5.1% 상승했다. 시멘트와 레미콘은 비교적 안정적인 흐름을 보였지만, 일반철근은 생산자물가지수가 전년... "
2026-07-14,네이버뉴스,[민선 9기 시정 현안 분석] 제2명촌교 건설 산업로 교통량 분산 남북 이...,https://www.ulsanpress.net/news/articleView.html?idxno=579176,"도로를 건설하는 사업이다. 총연장 1.06㎞, 폭 24.4~33.4m의 왕복 4~6차로 규모로 조성되며, 사업기간은 2022년부터 2031년까지다. 총사업비는 2,101억1,800만원으로 공사비 1,892억6,000만원, 보상비 54억8,000만원, 기타... "
2026-07-14,네이버뉴스,"특검, 감사원 유병호 위원 구속영장…“윤석열 정부 관저이전 봐주기 감...",https://www.dt.co.kr/article/12072958?ref=naver,"및 ’공사비‘ 등의 의혹에 대해 2022년 10월 국민감사를 청구했다. 감사원은 약 2년간 감사 끝에 2024년 9월... 종합건설면허가 있는 원담종합건설을 내세워 합법 외관을 만들고, 실제로는 공사 자격이 없는 21그램이 모든... "
2026-07-14,네이버뉴스,"특검, '관저이전 봐주기' 유병호 감사위원 구속영장 청구…20일 심사",https://www.edaily.co.kr/news/newspath.asp?newsid=06064726645514520,"이전을 담당한 공사 업체 선정과 공사비 등을 두고 여러 의혹이 제기됐고, 시민단체가 국민감사를 청구하며 감사가 시작됐다. 특검팀은 일부 공사에 자격이 없는 21그램이 종합건설면허가 있는 업체를 내세워 합법적인... "
2026-07-14,네이버뉴스,"유병호 감사위원 구속영장 청구…특검, '관저 이전 감사 개입' 의혹 정조...",https://www.ngonews.kr/news/articleView.html?idxno=232947,이후 공사 업체 선정과 공사비 집행을 둘러싸고 여러 의혹이 제기됐고 2022년 참여연대 등이 국민감사를... 감사보고서는 대통령비서실이 증축 공사 자격을 갖춘 업체를 요청했고 이에 따라 종합건설면허를 보유한... 
2026-07-14,네이버뉴스,"尹정부 감사원 실세 유병호 구속영장…""관저이전 봐주기 감사""(종합)",https://www.yna.co.kr/view/AKR20260714153351004?input=1195m,"이후 이전 공사 업체 선정 과정과 공사비 등을 둘러싼 각종 의혹이 제기됐고, 2022년 10월 참여연대 등이... 종합건설업 면허가 있는 원담종합건설에 증축 공사 참여를 요청해 공사가 이뤄졌다고 적었다. 그러면서 ""촉박한... "
2026-07-14,네이버뉴스,"특검, 유병호 감사위원 구속영장 청구…20일 심사(종합)",https://www.newsis.com/view/NISX20260714_0003709392,"이후 이전을 담당한 공사 업체 선정과 공사비 등을 두고 여러 의혹이 제기됐고, 시민단체가 국민감사를 청구하며 감사가 시작됐다. 특검팀은 일부 공사에 자격이 없는 21그램이 종합건설면허가 있는 업체를 내세워... "
2026-07-14,네이버뉴스,"“주택공급 막는 건 금융”…국토부 첫 경청토론회, 규제 완화 ‘한 목...",https://www.ekn.kr/web/view.php?key=20260714023062429,"세제, 건설시장 전반이 함께 움직이는 공급 생태계를 회복해야 한다""고 말했다. 이어 “재건축 활성화 역시... 급감했다""며 “공사비 상승과 전세사기 여파, 임대사업자 규제가 복합적으로 작용하면서 시장이 크게... "
2026-07-14,네이버뉴스,"""공급 늘린다며 대출 조이는 정부, 앞뒤 안 맞아""…부동산 첫 토론회 성...",https://view.asiae.co.kr/article/2026071417594580903,"토론자로 참석한 강경훈 진경건설 대표는 ""9·7 대책 이후 주택매매업자와 임대사업자의 LTV가 0%로... 사업 지연 여파로 서울 서초구 신반포22차 평당 공사비는 2017년 569만원에서 2023년 1300만원으로 2배 이상 뛰었다. 수요... "
2026-07-14,네이버뉴스,[이슈체크] 정부 첫 주택공급 토론회…새 정책보다 실행이 관건,https://www.tfmedia.co.kr/news/article.html?no=205777,"이날 토론회에는 학계와 연구기관, 건설업계, 금융권, 시민단체 등이 참석해 공급 확대를 위한 제도 개선과... 공급 확대를 위해서는 공사비 부담보다 금융비용을 낮추는 정책이 우선돼야 한다는 주장도 나왔다. 공공의... "
2026-07-14,네이버뉴스,"""공급 파이프라인 막혀"" 부동산 첫 토론회 규제 완화 요구 봇물",https://www.ohmynews.com/NWS_Web/View/at_pg.aspx?CNTN_CD=A0003251402&CMPT_CD=P0010&utm_source=naver&utm_medium=newsearch&utm_campaign=naver_news,"강경훈 진경건설 대표도 ""비아파트의 대출 LTV를 아파트와 같은 40%로 제한하는 것은 과도하다""라고 지적했다.... 불과하다""라며 ""공사비 폭등과 법적 불확실성이 사업 지연 주원인""이라고 분석했다. 반면 시민단체와 일부... "
2026-07-14,네이버뉴스,체감경기 소폭 개선에도 웃지못하는 건설업계,https://www.ggilbo.com/news/articleView.html?idxno=1169409,건설 원가 부담을 나타내는 건설공사비지수는 일반 철근 가격 급등(시장가격지수 12.1%↑) 등의 여파로 지난해 대비 5.1% 상승했다. 5월 건설업 취업자 수는 192만 명으로 전년 동기 대비 2.2% 감소했다.
2026-07-14,네이버뉴스,‘스타필드 청라’ 오수관로 설치 내달 정상화,https://www.kyeongin.com/article/1767313,14일 인천 건설업계에 따르면 인천경제자유구역청은 스타필드 청라 비상 관로 설계와 공사비 분담 협의를 다음 달 말까지 마무리하기 위해 시행사인 신세계프라퍼티와 협의를 진행하고 있다. 인천경제청은 다음 달까지... 
2026-07-14,네이버뉴스,"'공급!' 한 목소리…""민간 받치고 공공 밀어야""",https://news.bizwatch.co.kr/article/real_estate/2026/07/14/0035,"민간 전문가를 비롯해 서울시 등 지방자치단체 담당 과장, 주택건설업 관계자, 청년·신혼부부 등 각계... 있다""며 ""이는 공사비나 금리 등 고비용 구조에서 나타나는 구조적 문제에서 기인한다""고 분석했다. 이어... "
2026-07-14,네이버뉴스,“비아파트 살리고 LTV 규제 풀어야” [주택공급 경청 토론회],https://www.kukinews.com/article/view/kuk202607140192,건설업계에서도 비슷한 목소리가 나왔다. 강경훈 진경건설 대표는 “다세대주택과 도시형생활주택 공급이... 그는 공사비 급등을 대표적인 원인으로 꼽았다. 신반포22차 재건축 사업의 3.3㎡(평)당 공사비가 2017년... 
2026-07-14,네이버뉴스,[이슈] 다시 커진 호르무즈 리스크…산업계 넘어 장바구니까지 흔들,http://www.sisafocus.co.kr/news/articleView.html?idxno=362523,"한국건설산업연구원의 '월간 건설시장동향'에 따르면 지난 5월 건설공사비지수는 137.67로 전년 동월보다 5.1% 상승하며 역대 최고 수준을 기록했다. 건설업계 관계자는 ""중동 리스크가 장기화하면 자재 운송비와 원자재... "
2026-07-14,네이버뉴스,"부동산 토론회서 쏟아진 현장 요구…""이주비 대출 확대·민간임대 복원...",https://www.newspim.com/news/view/20260714001171,또 김효선 KB부동산수석 전문위원은 최근 공사비가 크게 오르며 분담금 문제가 커지고 있다고 지적하며... 주택공급 확대를 위한 건축규제 완화도 건설사업자를 중심으로 심도 있게 다뤄졌다. 박천규 국토연구원 본부장은... 
2026-07-14,네이버뉴스,공급 목표보다 착공이 문제…전문가들 “규제 현실화 시급”,https://www.dailian.co.kr/news/view/1667154/?sc=Naver,"14일 국토교통부는 민간 전문가와 국토부 산하기관장, 주택건설·금융업계 관계자, 청년·신혼부부 등... 주택 노후화가 진행되면서 정비사업 필요성은 커지고 있으나, 공공기여 규제 및 공사비 상승 등으로 사업 추진... "
