date,source,title,link,description
2026-07-23,네이버뉴스,"“원전에도 AX 도입한다”…한컴, 한수원에 AI 문서작성 솔루션 공급",https://www.mk.co.kr/article/12105624,"한컴어시스턴트는 하이누리와 연동돼 원전 운영과 발전, 건설, 안전 분야의 내부 지식 데이터를 기반으로 문서를 작성한다. 자연어 명령만으로 필요한 정보를 검색하거나 보고서 초안을 작성하고 문장을 교정하거나... "
2026-07-23,네이버뉴스,"한수원, 사내 생성형 AI 활용 스마트 문서 혁신 시동",https://www.todayenergy.kr/news/articleView.html?idxno=300765,"한수원의 '하이누리'는 건설, 발전 운영, 원전 안전 등 사내의 방대한 문서 데이터를 검색증강생성(RAG) 기술로 학습한 지식 기반 인공지능 플랫폼이다. 여기에 결합한 '한컴어시스턴트'는 하이누리의 인공지능 엔진 및... "
2026-07-23,네이버뉴스,韓 원자력 권한확보에 사우디 사례 영향은…핵확산우려 불식해야(종합),https://www.yna.co.kr/view/AKR20260723088751504?input=1195m,"23일 미 언론에 따르면 미국과 사우디의 협정에는 미국이 사우디에 원자력발전소를 건설하고 원전 연료로 쓰기 위한 우라늄 농축 및 사용후 핵연료 재처리 기술을 이전하되, 농축·재처리에는 미국 인력만 접근할 수 있게... "
2026-07-23,네이버뉴스,"한컴, 한수원에 AI 문서 솔루션 공급⋯원전 AX 사업 확대",http://www.finomy.com/news/articleView.html?idxno=257896,"한컴어시스턴트는 원전 운영과 발전, 건설, 안전 분야 내부 지식 데이터를 기반으로 △보고서 초안 작성 △문장 교정 △문서 요약 △정보 검색 등을 지원하며 표준 템플릿을 활용한 문서 작성 기능도 제공한다. 특히... "
2026-07-23,네이버뉴스,"美, 사우디아라비아 원자력 협정 체결",https://www.imaeil.com/page/view/2026072316344665401,사우디아라비아 역시 원전 건설로 화력발전에 사용된 원유를 수출할 수 있게 된다. 현재 사우디아라비아의 전력은 천연가스(68%)와 석유(32%)에 의존하고 있다. 중동 지역에서 유일하게 핵무기를 보유한 이스라엘은... 
2026-07-23,네이버뉴스,"미국, 사우디와 '안전장치' 없는 핵 협정 체결? ""중동 핵확산 부추겨"" 비...",https://www.hankookilbo.com/news/article/A2026072315100003563?did=NA,또 양국은 앞으로 2년간 공동 연구를 진행해 사우디 내 우라늄 농축 시설 건설이 타당한지 여부를 판단한다. 타당성이 입증되면 해외에서 핵연료를 수입하는 한국 등 원전 운영국 대다수와 달리 사우디는 자력으로 매장된... 
2026-07-23,네이버뉴스,[단독] SMR 상용화 시점 앞당긴다…개발·규제 아우르는 TF 가동,https://www.mk.co.kr/article/12105584,전력 수요지 근처에 건설하면 송전망을 별도로 구축하지 않아도 전력을 공급할 수 있기 때문이다. 다만 기존 대형 원전 중심의 규제는 방사선비상계획구역을 약 30km로 잡고 있다. SMR 특성에 맞는 규제를 마련하지... 
2026-07-23,네이버뉴스,"한수원, 생성형 AI 기반 스마트 문서환경 구축…보고서 작성 효율 높인...",http://www.breaknews.com/1223902,"하이누리는 건설과 발전 운영, 원전 안전 분야 등 사내 축적 데이터를 검색증강생성(RAG) 기술로 활용하는 생성형 AI 플랫폼이다. 여기에 한컴어시스턴트를 연동해... "
2026-07-23,네이버뉴스,"한수원, 사내 생성형 AI 활용 스마트 문서 혁신 ‘가속도’",https://www.dt.co.kr/article/12074415?ref=naver,"하이누리는 건설은 물론 발전 운영, 원전 안전 등 사내의 방대한 문서 데이터를 검색증강생성(RAG) 기술로 학습한 지식 기반 AI 플랫폼이다. 여기서 한 발 더 나간 한컴어시스턴트는 하이누리의 AI 엔진 및 사내 폐쇄망 보안... "
2026-07-24,네이버뉴스,"산업은행, 수협과 해상풍력 발전사업 금융지원 MOU 체결",https://biz.heraldcorp.com/article/10818543?ref=naver,발전소 건설 및 운영사업’ 금융약정을 맺기도 했다. 신승우 한국산업은행 부행장은 22일 산업은행 본점에서 열린 업무협약 기념사에서 “이번협약은 양 기관이 국내 해상풍력 발전사업에 대한 공동 금융지원과... 
2026-07-24,네이버뉴스,"‘해상풍력 터빈 1위’ 베스타스, 약속했던 목포 공장 왜 안 짓나 했더...",https://biz.chosun.com/industry/company/2026/07/24/MUQOYFDWWJGCXIADWVI6PSIMNM/?utm_source=naver&utm_medium=original&utm_campaign=biz,24일 풍력 업계에 따르면 베스타스는 지난 2023년 싱가포르에 있던 아시아태평양지역 본사를 한국으로 옮기면서 목포에 해상풍력 터빈 공장을 건설한다는 계획을 발표한 바 있다. 20만제곱미터(㎡) 규모의 목포신항... 
2026-07-24,네이버뉴스,“인천바이오과학기술원 만들고 ‘AI 허브’로 도시 경쟁력 높일 것”,https://www.chosun.com/national/regional/2026/07/24/EUSW6D36XRHXND2JKTHQNHQF5A/?utm_source=naver&utm_medium=referral&utm_campaign=naver-news,"인천 앞바다엔 해상 풍력발전 단지를 세우겠다. 인천은 해상 풍력으로 만든 전기를 수도권에 공급하기... “정부가 인천국제공항공사와 한국공항공사, 가덕도신공항건설공단을 통합한다고 해 이재명 대통령에게... "
2026-07-24,네이버뉴스,"괴산군, 칠성 농기계 임대사업소 신축…11월 준공",https://www.news1.kr/local/sejong-chungbuk/6237473,송인헌 군수가 민선 8기 들어 도내 최대 농기계 임대 인프라 구축을 목표로 공격적으로 확대한 덕분이다. 여기에 현재 건립 공사를 진행 중인 문광사업소와 이번에 착공하는 칠성 사업소를 더하면 괴산군의 농기계... 
2026-07-24,네이버뉴스,"[발행인 칼럼] 제천-영월 고속도로 착공, 협치의 문을 열다",http://kor.theasian.asia/archives/410500,제천-영월 고속도로 착공식이 2026년 7월 21일 오후 2시 영월군 스포츠파크 실내체육관에서 열린 가운데 신용한... 성장 인프라라고 강조했다. 접근성이 높아져야 기업이 들어오고 관광객이 늘며 청년들이 돌아오는 선순환이... 
2026-07-24,네이버뉴스,"“빨리 하겠다, 내가 원래 속도가 빠른 사람이다”: 슬로우레터 7월24일...",https://slownews.kr/163694,주택 착공이 가능하다”고 말했다. 비어 있는 지식산업센터를 주거용으로. 조일진(도시이야기 대표)은... 지방 인프라와 국립대에 투자해야 한다”고 제안했다. 이재명은 “갑자기 박수치고 싶어졌다”면서 “반도체... 
2026-07-24,네이버뉴스,"삼성 19조 투자 발표에도 ""글쎄""…20년 전 악몽 떠올린 도시 [소멸 리포...",https://www.hankyung.com/article/202607228450H,"그는 ""투자한다고 해놓고 실제로 하지 않은 일이 많지 않으냐""며 ""용수나 전력 같은 산업 인프라를 따지면... 삼성SDS의 구미 AI 데이터센터의 경우 이번 발표 전인 지난 1월 경북도·구미시와 투자협약을 맺고 9월 착공을... "
2026-07-24,네이버뉴스,[해체공사 틀 바꿔라] (1) 2044년 노후인프라 75%…“해체설계 분리 의무...,https://www.dnews.co.kr/uhtml/view.jsp?idxno=202607231056333130232,"기자]노후 인프라가 급증하며 구조물 해체 수요가 갈수록 늘어나는 가운데 해체공사를 독립적인 영역으로... 의무화하고, 착공 전 보완진단을 실시해 그 결과를 해체설계와 연계해야 한다”고 덧붙였다. 또한 교량... "
2026-07-24,네이버뉴스,오세훈 1심 유죄에 서울 공급정책 '변수'…정비사업 영향 촉각,https://www.news1.kr/local/seoul/6237066,가구 착공을 목표로 사업을 추진하고 있다. 시장 교체가 현실화할 경우 이 같은 공급 정책의 연속성과 사업... 서울시는 정부안대로 추진하려면 교통 인프라를 비롯한 도시계획을 다시 수립해야 해 사업이 2년가량... 
2026-07-24,네이버뉴스,경남도 ‘1시간 생활권’ 조성 본격화,https://www.segye.com/newsView/20260723519355?OutUrl=naver,동대구∼창원∼가덕도신공항 고속화철도의 연내 국가계획 반영을 추진하며 남부내륙철도 추가 착공 및... 항공 인프라 경쟁력을 극대화할 방침이다. 박성준 도 교통건설국장은 “민선 8기에 다져온 광역교통 인프라를... 
2026-07-24,네이버뉴스,대구 ‘AI 기반 미래차 제조 혁신’ 나선다,https://www.segye.com/newsView/20260723519362?OutUrl=naver,"센터는 올해 실시설계를 마무리한 뒤 2027년 착공, 2028년 준공이 목표다. 총 사업비는 37억여원이다. 내부에는 디지털트윈 기반의 제조공정 설계·시험 환경을 비롯해 전문 교육시설 등이 조성된다. 첨단 장비 인프라와... "
2026-07-24,네이버뉴스,[패트롤] 고양시의회-양평군의회-의정부시의회-포천시의회,https://www.ekn.kr/web/view.php?key=20260724022395571,광역철도 인프라는 전무한 실정이다. 의정부시의회는 결의안을 통해 △8호선 의정부 연장사업의 제5차... 송현천 소하천 정비사업과 축석령 우회도로 개설공사 현장에선 착공 이후 공정 추이를 살폈다. 포천시의원들은... 
2026-07-24,네이버뉴스,인도 코끼리와 서남권 반도체 클러스터 팹,http://www.kwangju.co.kr/article.php?aid=1784820000801535131,"연계 인프라가 유기적으로 결합된 최첨단 팹이라고 한다. 최첨단 팹의 요건은 첫째, 초고압의 대규모... 추진 로드맵을 보면 광주 반도체 클러스터 건설을 위한 공장 착공은 2026년 말에 최소 1기 착공을 시작으로 2027년... "
2026-07-23,네이버뉴스,"안양시, 인덕원 인텐스퀘어 기업용지 공급 본격화…90여 개사 의견 수렴",http://www.newstown.co.kr/news/articleView.html?idxno=710185,"안양시와 경기주택도시공사(GH), 안양도시공사가 공동으로 추진하며, 지난해 9월 착공한 부지조성공사가... 최대호 안양시장은 ""인덕원 인텐스퀘어를 우수한 교통 인프라를 바탕으로 직장과 주거, 문화가 조화를 이루는... "
2026-07-23,네이버뉴스,안양시 '인덕원 인텐스퀘어' 기업용지 사전설명회,https://www.newsclaim.co.kr/news/articleView.html?idxno=3070206,"부지조성공사를 착공해 현재 공사가 진행되고 있습니다. 안양시는 도시지원시설 내 기업용지를 내년 상반기... 최대호 안양시장은 ""인덕원 인텐스퀘어는 우수한 입지와 교통 인프라를 갖춘 광역 거점이자 직장과 주거... "
2026-07-23,네이버뉴스,의왕시 '2026 한국의 최고 경영대상' 수상,https://www.newsclaim.co.kr/news/articleView.html?idxno=3070205,교통 인프라 확충에 힘쓰고 있습니다. 문화와 교육 분야에서도 주요 사업이 순조롭게 진행되고 있습니다. 의왕문화예술회관은 지난 2024년 2월 착공해 올해 하반기 준공을 목표로 공사가 진행되고 있으며... 
2026-07-23,네이버뉴스,"월덱스, 구미에 반도체 소재 공장 증설",https://biz.heraldcorp.com/article/10818451?ref=naver,"올해 하반기 용지 매입을 시작으로 내년 4월 착공해 2028년 1차 공장을 가동하고, 2030년까지 2차 증축을... 상생 인프라를 확대해 지역경제 활성화에 기여하는 모범 기업으로 자리매김하겠다”고 전했다. 김장호... "
2026-07-23,네이버뉴스,"OCI홀딩스, 2분기 영업익 1080억원…말레이시아·베트남 물량 매진",https://www.thelec.kr/news/articleView.html?idxno=59978,미국 인공지능(AI) 인프라 확대에 따른 태양광 수요 증가에 대응하기 위해 3만5000t을 추가 증설해 오는... 올해 말 착공을 목표로 현지 빅테크 기업과 전력구매계약(PPA) 체결을 협의 중이다. 현재 텍사스를... 
2026-07-23,네이버뉴스,[미리보는 이데일리 신문] 보유세 강화…초고가·다주택자는 더 올린다,https://www.edaily.co.kr/news/newspath.asp?newsid=06586246645517472,"시사 -李 “착공까지 60개월, 지연 심각…절반으로 단축” -대출·분양·청약 불이익…‘결혼 페널티’... AI인프라 플랫폼 기업 도약할 것“ △19면 산업 -”AI 데이터센터 투자 활성화…세액공제 검토“ -SKT, AIDC... "
2026-07-23,네이버뉴스,부진경자청 입주기업 후속 투자 이어져,http://www.gnmaeil.com/news/articleView.html?idxno=591315,착공 건수 역시 건설경기 침체에도 전년 동기 21건에서 46건으로 두 배 이상 증가를 기록했다. 특히... 부산진해경제자유구역은 부산항신항을 중심으로 구축된 물류 인프라에 더해 가덕도신공항과 진해신항을 품은... 
2026-07-23,네이버뉴스,정청래 “호남 반도체 속도전…대통령 임기 중 착공·생산”,http://www.jndn.com/article.php?aid=1784803825436596093,"약속을 하고 10년, 20년 뒤 완공되면 의미가 없다”며 “이재명 대통령 임기 중에 착공해 물건을 생산해 내야... 나주 혁신도시는 기존 인프라를 확대해 향후 2차 공공기관 이전 등으로 더 좋은 기관들이 들어오도록 최대한... "
2026-07-23,네이버뉴스,'부동산정책 대토론회' 공급 확대부터 세제 개편까지 국민 제안 '봇물',https://www.incheonilbo.com/news/articleView.html?idxno=1327952,"지방인프라를 늘려야 한다""고 호소했다. 이광수 광수네복덕방 대표는 대출 구조조정과 양도세 비과세 제한... ▲부동산 전문가, 각종 규제 완화 필요성 강조 진미윤 명지대 부동산대학원 교수는 ""인허가·착공 위축 등 공급... "
2026-07-23,네이버뉴스,[민선 9기 단체장 인터뷰]김윤철 합천군수,https://www.gnnews.co.kr/news/articleView.html?idxno=641736,"두무산 양수발전소는 2028년 착공, 2034년 준공을 목표로 순조롭게 진행되고 있다. 총사업비 2조 5000억 원이... -인프라 확대를 통한 '스포츠 명소 합천'을 만들기 위해 구상 중인 체육·교통 연계 전략은 무엇인가. ▲우수한... "
2026-07-23,네이버뉴스,"OCI홀딩스, 2분기 흑자 지속...美 태양광 사업 성과에 '방긋'",https://www.energy-news.co.kr/news/articleView.html?idxno=227022,"OCI홀딩스는 늘어나는 AI 인프라 전력 수요에 대응하기 위해 오는 2029년까지 폴리실리콘 생산능력을 현재... OCI Energy는 최근 500MW 규모의 '라살(La Salle)' 프로젝트 매각을 마쳤으며, 해당 사업은 올해 말 착공을... "
2026-07-23,네이버뉴스,"이상일 용인특례시장, 추미애 지사에 반도체 국가산단 전력·용수 공급...",https://www.thepublic.kr/news/articleView.html?idxno=312358,"그러면서 반도체 프로젝트가 성공적으로 자리 잡으려면 무엇보다 교통 인프라 확충이 시급하며, 이를... 용인 국가산단 부지 조성 착공이 예정보다 늦어진 가운데, 삼성전자는 오히려 1기 팹 가동 목표 시점을 2029년 10월로... "
2026-07-23,네이버뉴스,"OCI홀딩스 2분기 흑자 전환…이우현 회장 “고객 주문, 감당할 방법이 ...",https://www.ekn.kr/web/view.php?key=20260723024485501,"구체적으로 OCI홀딩스는 급증하는 미국 AI 인프라 수요에 대응하기 위해 하반기 말레이시아 폴리실리콘... 이 프로젝트는 올해 말 착공을 앞두고 있고, 추후 현지 빅테크 기업과 전력구매계약(PPA) 체결을 논의... "
2026-07-23,네이버뉴스,"재투자 이끄는 BJFEZ, 동남권 성장의 중심에 서다",http://www.gndomin.com/news/articleView.html?idxno=483228,"▲ 박성호 부산진해경제자유구역청장 건축허가 3배·착공 2배 증가 … 부산·경남 미래 성장축 가속화 박성호... 기업은 투자 이후에도 경영환경과 인프라, 미래 성장 가능성을 평가한다. 그런 점에서 최근... "
2026-07-23,네이버뉴스,"기업 '재투자' 이끈 부산진해경자청, 미래 성장 속도낸다",http://www.fnnews.com/news/202607231826245681,착공 건수 역시 21건에서 46건으로 증가하며 두 배 이상의 성장세를 기록했다. 이 가운데 이재모피자... BJFEZ는 부산신항을 중심으로 구축된 물류 인프라에 더해 가덕도신공항과 진해신항을 품은 트라이포트 시대를... 
2026-07-23,네이버뉴스,"[이슈포커스] 반도체 훈풍 속 전남광주 복합쇼핑몰, '상생 과제'는 안갯...",https://www.namdonews.com/news/articleView.html?idxno=917901,최근 통합특별시 인수위원회가 도시철도 상무광천선 등 대형 교통인프라 사업에 대해 초단기 재검토를... 현재 국토교통부 도시철도망 구축계획 심의를 거쳐 후속 절차를 밟고 있지만 아직 착공 전 단계다. 인수위는 재원... 
2026-07-23,네이버뉴스,"OCI홀딩스, 2분기 영업익 1080억원…3개 분기 연속 흑자",http://www.paxetv.com/news/articleView.html?idxno=277749,"AI 인프라 수요 증가에 대응해 2029년까지 폴리실리콘은 연 7만톤, 웨이퍼는 11.5GW 규모로 증설할... 미국 태양광 개발 자회사 OCI Energy는 500MW 규모 태양광 프로젝트를 매각하며 수익화에 성공했으며, 올해 말 착공을... "
2026-07-23,네이버뉴스,"최정호 익산시장, '교통 관문 익산 굳히기' 향해 뛴다",https://sjbnews.com/news/news.php?number=883642,도로 인프라 부문에서는 수도권과의 접근성을 획기적으로 개선할 핵심 동맥인 서부내륙고속도로 2단계(부여~익산) 구간의 내년 조기 착공을 전격 요구하고 나섰다. 더불어 주민들의 집단 민원을 해결하고 학생들에게... 
2026-07-23,네이버뉴스,[구동에서]반도체가 뭐길래,http://www.kjdaily.com/article.php?aid=1784797556682980244,"이재명 대통령 임기 내 2030년 양산을 목표로 올해 말 착공을 예정하고 있다. 인·허가부터 보상, 부지 조성... 최 회장은 “현재로선 대한민국에서 (호남만큼) 인프라 조건을 완벽하게 충족하는 다른 곳을 찾지 못하고... "
2026-07-23,네이버뉴스,"의왕시, ‘2026 한국의 최고 경영대상’ 지역발전 부문 수상",http://www.breaknews.com/1223987,"지난해 착공해 올해 하반기 준공을 앞두고 있으며, 내손중고통합학교와 백운호수초중통합학교가 잇따라 개교해 교육 인프라도 크게 확충됐다. 시민들의... "
2026-07-23,네이버뉴스,현대차가 새만금에 쏘아올린 공 낙수효과 기대감,http://www.jjn.co.kr/news/articleView.html?idxno=1047369,"먼저 AI 데이터센터는 GPU 5만장급의 대규모 연산 인프라를 구축할 계획이다. 이 데이터센터는 자율주행, 로봇... 오는 2027년 AI 데이터센터 착공을 시작으로 로봇 제조·부품 클러스터, 태양광 발전시설, 수전해 플랜트, AI... "
2026-07-23,네이버뉴스,"美매체 ""인텔, 오하이오 팹 운영 파트너 모색…SK하이닉스와 협력 타진...",https://it.chosun.com/news/articleView.html?idxno=2023092166433,인텔 오하이오 팹은 2022년 280억달러 투자 계획과 함께 착공했지만 2025년 가동 목표 달성에 실패했다. 이후... 이에 인텔과의 오하이오 팹 운영 협력이 전공정 인프라 활용의 새로운 선택지가 될지 관심이 쏠린다.... 
2026-07-23,네이버뉴스,"임만균 의장 ""난곡선·서부선 조속 추진해야""",https://www.megaeconomy.co.kr/news/newsview.php?ncode=1065602559608347,"필수 인프라""라며 ""예비타당성조사가 진행 중인 난곡선은 지역 주민들이 20여 년간 염원해 온 숙원사업인... 이 때문에 주민들이 체감하는 착공과 개통까지는 상당한 시간이 소요될 것으로 예상된다. 서울시는 지난 10일 '내... "
2026-07-23,네이버뉴스,"인천, 환경기술 ‘산업화 엔진’ 재가동",https://www.sedaily.com/article/20071149?ref=naver,"시는 올 3월 착공한 검단2일반산업단지를 생산거점 삼아 ‘자립형 ECT 혁신 클러스터’를 완성할... 정승환 인천시 환경국장은 “인천 강소특구는 대한민국 최고의 환경 인프라와 공공기술, 인적 자원이 결합한... "
2026-07-23,네이버뉴스,"김진열 군위군수 ""TK신공항·스카이시티 조성""[인터뷰]",https://www.newsis.com/view/NISX20260723_0003720707,"앞으로 신공항 보상과 착공 절차가 지연되지 않도록 하고, 공항 예정지 주민들의 이주와 생활대책을 현실적으로 마련하겠다. 동시에 공항 배후도시로서 스카이시티, 첨단산업단지, 농산물 유통 기반, 관광·체류 인프라를... "
2026-07-23,네이버뉴스,김지호 경기도의원 “국가계획 반영 넘어 통합 철도망 설계해야”,https://www.seoul.co.kr/news/publicnews/local_govern/kyungki_do/2026/07/23/20260723500270?wlog_tag3=naver,"경기도의회 건설교통위원회 김지호 의원(더불어민주당, 의정부3)이 개별 철도 사업의 단순 착공이나... 김 의원은 “교통 인프라가 이미 충분한 지역과 오랫동안 투자가 부족했던 지역에 동일한 경제성 잣대만 적용하는... "
2026-07-23,네이버뉴스,"[AJU+MONEY] ""반지하 버티면 신축이 온다""…치솟는 집값에 '몸테크' 뛰어...",https://www.ajunews.com/view/20260722145603386,"입주하는 '착공 및 입주' 단계로 진행된다. 여기서 조합원 지위를 승계할 수 있는 단계를 따져봐야 한다.... 교통과 학군, 생활 인프라, 주변 개발계획뿐 아니라 건물 상태와 점유 현황까지 직접 확인해야 한다. 입찰가는... "
2026-07-23,네이버뉴스,"해남군, 국토부 공모 선정…스마트 재활 거점 구축 국비 30억 확보",https://www.ajunews.com/view/20260723172808661,"완도·진도·강진 아우르는 권역형 재활 인프라 조성…'1535 복지라인' 구축 아주경제=김옥현 기자 okbest70... 올해 9월 본공사 착공을 앞두고 있으며, 주간보호센터와 재활치료실, 프로그램실 등을 갖춘 복지관이 들어서면... "
2026-07-23,네이버뉴스,"OCI홀딩스 2분기 영업이익 1080억 내 흑자전환, 미국 태양광사업 호조",https://www.businesspost.co.kr/BP?command=article_view&num=443017,라사예 태양광 프로젝트는 설비용량 500MW(메가와트) 규모로 올해 말 착공을 앞두고 있다. 현지... OCI홀딩스는 하반기 급증하는 미국 인공지능(AI) 인프라 수요에 대응할 목적에서 연 3만5천 톤 규모 증설을... 
2026-07-23,네이버뉴스,"임만균 서울시의회 의장, 난곡·서부선 경전철 조기 착공 총력전 ... ""20...",http://www.ttlnews.com/news/articleView.html?idxno=3128220,"기본 인프라""라며, ""특히, 20년 넘게 사업 완공만을 기다려온 난곡선 주변 주민들의 염원을 감안해, 진행 중인... 사업 착공을 앞당기기 위한 의회 차원의 적극적인 입법·행정 지원도 공언했다. 시의회 내 '도시철도 관련... "
2026-07-23,네이버뉴스,40년 숙원 논산경찰서 청사 신축 순항…치안 인프라 새 전환점,https://www.cctoday.co.kr/news/articleView.html?idxno=2233716,"경찰청·충남경찰청 행정절차 차질 없이 진행 실시설계부터 착공 로드맵 가시화 충청투데이 지속 보도... 경찰청은 국가 치안 인프라 확충 차원에서 사업 추진을 지속적으로 뒷받침했고, 충남경찰청 역시 현장의 절박한... "
2026-07-23,네이버뉴스,"최정호 익산시장, 국토부 장관 면담…철도망·SOC 등 핵심사업 지원 건...",https://www.kfenews.co.kr/news/articleView.html?idxno=661054,도로 인프라 확충을 위한 지원도 요청했다. 최 시장은 수도권 접근성 향상을 위한 서부내륙고속도로 2단계(부여~익산) 구간의 조기 착공​과 함께 주민 교통 불편 해소와 학생들의 안전한 통학환경 조성을 위한 동익산역... 
2026-07-23,네이버뉴스,"김성제 시장, 20년 묵은 숙원 '착착'…의왕시, 자족도시 기반 굳힌다",https://www.asiatoday.co.kr/kn/view.php?key=20260723010008652,"의왕문화예술회관·종합병원·통합학교 등 핵심 인프라 기틀 완성 대규모 도시개발과 철도망 확충 성과... 의왕문화예술회관은 올해 하반기 준공을 앞두고 있으며, 의왕 종합병원도 지난 4월 착공에 들어갔다. 교육... "
2026-07-23,네이버뉴스,[THE인터뷰] 박상준 부산 강서구청장,https://news.skbroadband.com/news/articleView.html?idxno=232931,도시철도와 대형 교량 사업은 부산시와 중앙 정부가 주도하는 사업이기 때문에 구청의 힘만으로는 그 착공... 정주 인프라를 갖추고 있습니다. 최근에는 이런 입지 경쟁력을 갖춘 우리 강서구가 해양수산부 신청사 유치를... 
2026-07-23,네이버뉴스,"OCI홀딩스, 2분기 영업익 1080억 원…3분기 연속 흑자",http://www.iminju.net/news/articleView.html?idxno=167042,OCI홀딩스는 미국의 인공지능(AI) 인프라 확대에 따른 전력 수요에 대응하기 위해 하반기부터 연산... 해당 프로젝트는 올해 말 착공을 앞두고 있으며 현지 빅테크 기업과 전력구매계약(PPA) 체결을 위한 협상이 진행... 
