date,source,title,link,description
2026-05-01,네이버뉴스,"[이슈분석] “한전 총괄, 한수원 시공?”…원전수출 일원화, ‘UAE 모델...",https://www.ekn.kr/web/view.php?key=20260430023340484,"UAE 바라카 원전 건설사업에서 시공사로 참여한 한수원은 시행사인 한전에 추가 공사비 약 1조4000억 원을 청구했지만, 한전이 이를 미루자 결국 한수원이 이를 런던국제중재법원(LCIA)에 제소해 국제 분쟁으로 비화됐다.... "
2026-05-01,네이버뉴스,[기고] 이제는 ‘하이브리드 민주주의’다,https://www.seoul.co.kr/news/editOpinion/opinion/contribution/2026/05/01/20260501025002?wlog_tag3=naver,신고리 원전 건설 여부를 둘러싼 공론화위원회는 무작위로 선정된 시민들이 충분한 정보를 바탕으로 토론하고 결론을 도출한 사례다. 시민들은 감정이 아니라 논리로 판단했고 그 결과는 사회적으로 높은 수용성을 얻었다.... 
2026-05-01,네이버뉴스,"벨기에, 원전 국유화 선언… 유럽, 에너지 위기에 속속 탈원전 포기",https://www.dt.co.kr/article/12060409?ref=naver,폴란드와 체코 등 동유럽 국가들 역시 러시아산 에너지 독립을 위해 대규모 신규 원전 건설 프로젝트에 박차를 가하고 있다. 유럽 각국이 이처럼 원전으로 선회하는 배경에는 기후 위기 대응을 위한 탄소 중립 달성과... 
2026-04-30,네이버뉴스,[아주칼럼] 인도의 원자력 돌파구: 고속증식로 개발의 전략적 전환점,https://www.ajunews.com/view/20260430174933267,"이 원자로는 인도 원자력부 산하 국영기업인 Bharatiya Nabhikiya Vidyut Nigam Limited(BHAVINI)가 건설한 것이다. 이는... 소형모듈원자로(SMR) 개발 계획과 결합될 경우, 인도는 글로벌 원전 시장에서 새로운 주자로 부상할... "
2026-04-30,네이버뉴스,"[강창호의 친원전팩트체크] 대미투자, 달러가 아니라 원전이다",https://www.ilyoseoul.co.kr/news/articleView.html?idxno=516454,세계 최고 수준의 원전 건설 능력이다. 이제 우리는 그 능력을 들고 미국 시장으로 가야 한다. 미국은 현재 원전 건설 능력을 사실상 상실했다. 수지타산이 안 맞는다는 말이 맞을지도 모르겠다. 조지아주 보글 원전 3... 
2026-04-30,네이버뉴스,전력값 급등에 열린 유럽 시장…中 풍력 진입에 '안보 충돌',http://www.impacton.net/news/articleView.html?idxno=18722,원전·수력·풍력 중심의 포트폴리오가 가격 변동을 흡수했다. 이 같은 가격 상승 흐름은 지정학적... 영국 정부는 3월 밍양의 스코틀랜드 공장 건설 계획을 국가안보 심사를 이유로 불허했다. 베스타스(CPH: VWS)와... 
2026-04-30,네이버뉴스,'AI는 곧 국가경쟁력'…국가생존 위해 원전 비중 50% 이상 늘려야,http://www.e-platform.net/news/articleView.html?idxno=101945,"원전은 초기 원전건설 비용이 타 발전원보다 비싼 경향이 있지만, 저렴한 전력을 활용해 늦어도 2~30년 정도면 건설비용을 만회하고도 남으며, 남은 5~60년은 발전소를 재활용하면서 저렴한 전기를 계속 사용할 수... "
2026-04-30,네이버뉴스,[최태원의 AI 국회강연③] 두번째 AI 보틀넥...전기,https://www.dailybrief.co.kr/news/articleView.html?idxno=5759,"1기가와트라는 게 어느 정도냐, 하면 우리가 생각하는 원전이 우리나라 모형으로 보면 한 1.4기가와트... 송전로를 건설하는 게 되게 어렵고 힘들고 제약이 따르고 또 중간에 변전소를 만들어야 되고 이런 인프라... "
2026-04-30,네이버뉴스,[공감경제] 해양도시 부산에서 해양산업의 미래를 그리다...경영혁신 우...,https://news.bbsi.co.kr/news/articleView.html?idxno=4081505,"제조 역량을 갖춘데 이어 최근에는 해상풍력 플랜트 사업 진출에 도전하고 있습니다. [김명진 매일마린 회장]... "" 우리나라가 2015년부터 참여하고 있는 국제 핵융합 실험로 ITER 건설 프로젝트가 있는데요. 신조로지텍은 이... "
2026-04-30,네이버뉴스,"위성곤 ""위대한 제주의 시작""… 예비후보 등록하고 본선 행보 본격화",http://www.fnnews.com/news/202604301804127645,"해상풍력 등 재생에너지 산업을 키워 ""제주의 바람이 도민의 수익이 되도록 하겠다""고 강조했다.... 1억~3억원 규모의 생활밀착형 소규모 건설 공사를 신속히 발주해 행정이 경기회복의 마중물 역할을 하겠다는 계획도... "
2026-04-30,네이버뉴스,국민성장펀드 훈풍에 … 인프라 대출 2.7배 쑥,https://www.mk.co.kr/article/12032542,"3조4000억원 규모의 신안우이 해상풍력, 2조5000억원 규모의 평택 삼성전자 반도체 공장 건설 등 복수의 굵직한 사업이 '1호 프로젝트'로 선정된 가운데 시중은행들도 앞다퉈 금융주선·대출 등에 나서고 있다.... "
2026-04-30,네이버뉴스,"[대전 24시] 대전TP, 태국한국교육원과 한-태 교육 협력 강화",https://www.sisajournal.com/news/articleView.html?idxno=371436,신안우이 해상풍력'의 안정적인 운영을 이끌어갈 계획이다. 신안우이 프로젝트는 국내 최초로 15MW급 대형 풍력 터빈이 도입되는 만큼 검증된 운영 경험과 전문성이 프로젝트 성공의 핵심 요소로 꼽힌다. ◇ 계룡건설... 
2026-04-30,네이버뉴스,"경남 유권자 절반 이상 ""기후공약 따라 지지 후보 바꿀 수 있다""",https://www.idomin.com/news/articleView.html?idxno=2004740,"2040년까지 석탄발전소를 폐지하는 계획에는 70.4%가 찬성했고, 신규 원자력발전소 건설에는 45.8%가... 규제나 해상풍력 등 지역 현안도 비교적 긍정적 인식이 확인됐다""고 덧붙였다. 토론자로 나선 강보금 경남매일... "
2026-04-30,네이버뉴스,"'예비후보 등록' 위성곤, 선거전 돌입...""제주를 새롭게 바꿀 것""",https://www.headlinejeju.co.kr/news/articleView.html?idxno=591792,"이어 소득 구조와 관련해 ""제주의 자원이 도민의 소득으로 이어지는 구조를 만들겠다""며 ""해상풍력 등... 1억 원에서 3억 원 규모의 생활밀착형 소규모 건설 공사를 신속히 발주해 행정이 경기회복의 마중물이 되겠습니다.... "
2026-04-30,네이버뉴스,"한화의 도전과 헌신, 현장 안전으로 이어지고 있나",https://www.ppss.kr/news/articleView.html?idxno=294666,"또한 한화건설이 이라크 비스마야 신도시 건설을 추진할 당시 내전 등으로 위험이 커지자 다수 건설사가... 수소, 해상풍력, 에너지 저장 장치(ESS) 등으로 사업을 확대하며 에너지 솔루션에서 공격적인 확장을 하고 있다.... "
2026-05-01,네이버뉴스,"경기도, 노후 산업단지 경쟁력 강화 나서…입주기업 의견 수렴",http://www.econonews.co.kr/news/articleView.html?idxno=437243,현재 경기도는 착공 후 20년 이상 경과한 도내 58개 노후 산업단지를 대상으로 실태조사를 진행 중이다. 이를... 특히 제조업 중심 산업단지의 경우 시설 현대화와 교통·편의 인프라 개선 여부가 기업 유지와 신규 투자... 
2026-05-01,네이버뉴스,"이장우 대전시장 ""초일류 경제도시 도약""… ""노잼도시에서 꿀잼도시로""",https://www.newscj.com/news/articleView.html?idxno=3397749,"도시 인프라 구축 성과도 강조했다. 그는 ""도시철도 2호선이 28년만에 착공됐고 유성복합터미널, 호수공원 조성고 오랜 지연 끝에 추진되는 등 주요 기반 시설 사업이 본격화되며 도시 경쟁력이 한층 강화됐다""고... "
2026-05-01,네이버뉴스,"""수도권 역차별의 벽 넘어야"" 김용태의 미래 개혁 비전 [여의도 교차로...",https://news.mtn.co.kr/news-detail/2026043020564660354,"인프라 투자가 많이 부족했었던 곳인데, 2000년대 들어와서 수도권 균형 발전이라는 것에 따라 수도권이라는... 김용태> 7호선과 관련한 지하철은 저희가 착공이 들어갔고요. 준공 시점을 당기기 위해 예산 조기 확보를... "
2026-05-01,네이버뉴스,더 머물고 다 즐기는 경남… 관광객도 소비도 함께 늘었다,https://www.seoul.co.kr/news/publicnews/local_govern/news_local/2026/05/01/20260501022001?wlog_tag3=naver,"1조 투입 인프라·콘텐츠·디지털 확충 남도 기차둘레길 여행 활성화 관광·숙박 1박 2일 패키지로 경남... 짓고 착공했다. 올 상반기에는 고성 상족암 디지털 놀이터 명소화 사업, 창원 K-예술마실섬 네트워크 구축사업... "
2026-05-01,네이버뉴스,"에스원, 1분기 영업익 62% 감소…일회성 비용 반영",https://sateconomy.co.kr/news/view/1065600501583393,부문별로는 시큐리티 사업이 물리보안 고객 증가로 성장세를 유지했고 인프라 사업은 건물관리 서비스 확대와 재계약 인상 영향으로 매출이 늘었다. 반면 보안SI는 프로젝트 수주 및 착공 지연으로 전년 대비... 
2026-04-30,네이버뉴스,"김병욱 성남시장 후보 ""성남 전역을 하나로""… '성남메트로 1·2호선' 구...",https://www.fntoday.co.kr/news/articleView.html?idxno=383531,"교통 인프라 대전환을 공약했다. 원도심과 분당, 신규 개발지를 하나의 생활권으로 묶고 재건축·재개발... 2030년 착공을 목표로 제시했다. 김 후보는 ""재건축 단지 입주 이전에 철도망을 완성해 시민들이 실질적인 교통... "
2026-04-30,네이버뉴스,김병수 국민의힘 김포시장 예비후보 김포시장 출마 선언…‘거침없이!...,https://www.kyeonggi.com/article/20260430580485,"조기 착공과 빠른 개통을 위해서는 굳건한 의지와 단단한 힘이 있는 시장이 김포에 필요하다”고 강조했다.... 다섯째, 문화·체육 인프라 확충 및 수변 지속 확보를 위해 ▲문화시설·문화예술공간·체육시설 확충... "
2026-04-30,네이버뉴스,"﻿다이나믹솔루션, 무기소재 독점 생산·판매권 확보·납품 계약 물량 ...",https://kr.aving.net/news/articleView.html?idxno=1810802,생산 인프라 구축도 병행되고 있다. 다이나믹솔루션은 연내 소재 공장 완공을 목표로 직접 생산·납품 체계... 행정 절차가 마무리되는 대로 5월 착공에 돌입할 예정이다. 중장기적으로는 안정적인 수익 기반도... 
2026-04-30,네이버뉴스,"김동근 ""의정부 대전환 완성""",http://news.lghellovision.net/news/articleView.html?idxno=541879,"출마 각오 의정부 방향을 설정하는 중요한 선거 성과로 보여주기 위해 노력 대웅그룹 유치, GTX-C 착공, 물류,단지 백지화 의정부 자족도시 만들기 위해 노력 지하철 8호선 연장 등 교통 인프라 확충 Q. 자신만의 강점 재임... "
2026-04-30,네이버뉴스,"[르포] GM 창원공장서 만든 트랙스 크로스오버, 가포신항 거쳐 세계로",https://it.donga.com/108833/,"GM은 2019년 창원공장에 약 9000억원 규모 투자를 발표하고 신규 도장공장 착공에 들어갔다. 이후 2021년 신규... 안전 인프라와 작업환경 개선, 운영 효율성 향상을 위해 약 4400억원을 추가로 발표했다. 이는 끊이지 않던... "
2026-04-30,네이버뉴스,가락시장 시설현대화 3단계 본궤도···채소1동·수산동 실시설계 착수,https://www.agrinet.co.kr/news/articleView.html?idxno=403874,"서울시공사는 채소1동과 수산동의 실시설계를 시작했으며, 올해 12월 공사를 발주하고 본격적인 착공에... 수산동은 제빙 시설과 해수 공급 시스템을 갖추고 냉장, 냉동 인프라를 강화해 수산물이 최상의 신선도를... "
2026-04-30,네이버뉴스,"광산경찰서, '글로벌 안심생활권' 조성",https://www.namdonews.com/news/articleView.html?idxno=909289,경찰 분석 결과 범죄위험도 2등급 지역이지만 기존 방범 인프라는 상대적으로 부족한 것으로 나타났다.... 5월부터 본격 착공에 들어가며 경찰·호남대·광산구청·시민이 함께하는 합동 캠페인도 병행된다. 호남대... 
2026-04-30,네이버뉴스,"김병욱 ""성남 전역 잇는 '성남메트로' 구축""",https://www.ohmynews.com/NWS_Web/View/at_pg.aspx?CNTN_CD=A0003230064&CMPT_CD=P0010&utm_source=naver&utm_medium=newsearch&utm_campaign=naver_news,철도 사각지대를 해소하고 재건축·재개발 사업을 뒷받침하는 선제적 교통 인프라 확충 구상이다. 김 후보는... 2030년 착공하여 본격적인 재건축 단지 입주 이전에 완공하는 것을 목표로 삼았다. 재원은 민간투자재원과... 
2026-04-30,네이버뉴스,"김병욱 ""성남메트로 1·2호선 구축…성남 전역 역세권으로""",https://www.sidae.com/article/2026043017582282263,"2030년 착공해 본격적인 재건축 단지 입주 이전 완공을 목표로 제시했다. 재원은 민간투자재원과 재개발... 핵심 인프라를 구축하겠다""며 ""성남메트로 1·2호선을 통해 원도심과 분당의 균형 발전을 이루고 성남 어디에... "
2026-04-30,네이버뉴스,"인천글로벌캠퍼스, 입주대학 공동 의지 다목적 잔디광장 조성",https://www.segye.com/newsView/20260430518625?OutUrl=naver,"이런 목소리에 귀를 기울인 재단은 올해 2월 추진 계획을 수립하고, 실시설계 용역 완료 뒤 3월 24일 착공에... 최대 1500여명을 수용할 수 있는 면적으로 입주대학이 공동으로 활용 가능한 인프라다. 재단은 지난 2일... "
2026-04-30,네이버뉴스,"김병욱의 '성남메트로'⋯""사각지대 없는 10분 역세권 시대 열겠다""",https://www.incheonilbo.com/news/articleView.html?idxno=1322029,그는 2026년 하반기 사전 타당성 조사를 시작으로 2030년에는 반드시 착공에 들어가겠다는 구체적인 로드맵을 확정했다. 이는 향후 본격화될 1기 신도시 재건축 입주 시점에 맞춰 교통 인프라를 선제적으로 완성하겠다는... 
2026-04-30,네이버뉴스,안양천 바람 따라 '나이스 샷'… 광명소하 파크골프장 5월 문 연다,https://www.stnsports.co.kr/news/articleView.html?idxno=316143,"이번 파크골프장 조성은 생활체육 인프라를 확충해 시민들의 건강 증진과 여가 활동 수요에 적극 대응하기... 도비 1억 2천만 원, 시비 3억 7천여만 원 등 총 약 5억 9천만 원의 사업비를 투입해 지난해 11월 착공 후 같은... "
2026-04-30,네이버뉴스,"백성현 후보 ""논산을 세계 중심으로""...개소식서 비전 제시",http://www.dtnews24.com/news/articleView.html?idxno=811208,"백 후보는 ""국방산단은 오는 7월 말 착공식을 앞두고 있으며 재선에 성공하면 즉시 착공과 분양을... 이어 탑정호 일원에 체류형 관광 인프라를 구축해 관광객 유치와 체류 확대를 통한 지역경제 활성화를 이루겠다는... "
2026-04-30,네이버뉴스,"김병욱 성남시장 후보, 재건축·철도망 묶어 성남 도시 구조 전면 재편",http://www.fieldnews.kr/news/articleView.html?idxno=28304,주거 정비와 교통 인프라를 결합해 도시 구조를 전면적으로 바꾸겠다는 구상이다. 김병욱 후보는 지난 29일... 2030년 착공을 목표로 속도감 있게 추진하겠다고 말했다. 이는 재건축 사업과 연계된 교통 수요를 반영해... 
2026-04-30,네이버뉴스,"에스원, 1Q 매출 6737억…평균임금 판결 영향",https://www.1conomynews.co.kr/news/articleView.html?idxno=48398,"인프라 부문은 신규 관리 사업장 증대 및 재계약 인상을 통해 부동산 서비스 매출이 전년 동기 대비 증가했으나, 보안SI는 프로젝트 수주 및 착공 지연 영향으로 매출이 감소했다. 한편, 지난 1월 대법원 2부는 삼성전자... "
2026-04-30,네이버뉴스,"이장우 ""성과로 재선 승부""…도전 본격화",https://www.cctoday.co.kr/news/articleView.html?idxno=2229464,"교통·도시 인프라 분야에선 도시철도 2호선 착공, 유성복합터미널 준공, 베이스볼드림파크 준공 등을 성과로 언급했다.이 시장은 ""도시철도 2호선을 28년 만에 착공했고, 지지부진했던 유성터미널과 호수공원도... "
2026-04-30,네이버뉴스,청약 쏠리고 집값 리딩하는 '대단지' 13년만의 최저 공급… 희소성 높아...,http://www.ikld.kr/news/articleView.html?idxno=333877,"단지 규모가 클수록 대단지는 관리비 절감 효과와 대규모 조경 및 커뮤니티 시설, 주변 생활인프라 시설... 최근 공사비 상승과 사업 조건 재조정 등으로 인해 착공 및 분양 일정이 지연되는 사례가 이어지는 가운데... "
2026-04-30,네이버뉴스,"‘랩노쉬’ 이그니스, 친환경 패키징 사업 키운다",http://www.segyebiz.com/newsView/20260430517327?OutUrl=naver,센터 착공식을 열고 기념 촬영을 하고 있다. 이그니스 제공 이그니스가 개폐형 캔 마개 ‘XO 리드’를... 생산 인프라 확충에 투자를 이어오고 있다. 이 회사가 생산하는 XO 리드는 상대적으로 재활용 효율이 높은 캔... 
2026-04-30,네이버뉴스,[패트롤] 경주시-대구시의회-청도군-영남대-대구대-대구도시개발공사,https://www.ekn.kr/web/view.php?key=20260430029411490,이어 “올해 하반기 착공 예정인 반고개역 출입구 공사를 시작으로 향후 모든 도시철도 사업에서는 충분한... 및 인프라 교류 등이다. 특히 학생들이 이론 중심 학습을 넘어 실제 법·사법 현장을 경험할 수 있도록 실무형... 
2026-04-30,네이버뉴스,김병욱 후보 “성남 어디에 살든 역세권 편리함 누리도록”... 성남메트...,https://www.wikitree.co.kr/articles/1134529,"교통 인프라 확충을 목표로 하는 ‘성남메트로 1·2호선’ 구축 계획을 발표했다.김병욱 후보는 30일... 2026년 하반기 사전 타당성 용역 착수, 2028년 예비타당성조사 또는 민자적격성조사 완료, 2030년 착공을 일정으로... "
2026-04-30,네이버뉴스,"이그니스, 독일서 생산·R&D 통합 센터 착공",https://www.joongang.co.kr/article/25424903,센터를 착공하며 글로벌 친환경 패키징 사업 확대에 속도를 낸다. 이그니스는 독일 자회사 엑솔루션(Xolution)... 생산 인프라 확충에 투자를 이어오고 있다. 최근 글로벌 식음료 제조사들의 'XO 리드' 채택이 가파르게... 
2026-04-30,네이버뉴스,"[선택! 6.3지방선거] '하남 원팀' 강병덕·이광재, 국회 뚫었다…'교통·...",https://www.joongangenews.com/news/articleView.html?idxno=516236,"조기 착공을 강력히 촉구했다. 그는 ""신도시 입주 초기 발생할 교통 혼란을 미연에 방지하기 위해 '선(先)교통... 이광재 후보는 ""하남은 수도권 동부의 관문이지만, 광역교통망 인프라는 여전히 부족한 실정""이라며 ""국가... "
2026-04-30,네이버뉴스,"고성군수 선거, 함명준 '안정론' vs 박효동 '변화론'",http://news.lghellovision.net/news/articleView.html?idxno=541925,"낙후된 산업을 일으키고 관광 인프라를 확충해 고성의 새 길을 만들겠다는 포부입니다. [박효동 국민의힘... "" 반면 박효동 후보는 동해고속도로 조기 착공과 화진포 국제 관광레저항 개발, 신도시 조성 등을 주요 공약으로... "
2026-04-30,네이버뉴스,"[선택! 6.3지방선거] 김병욱 성남시장 후보,'성남메트로 1·2호선' 전격 ...",https://www.joongangenews.com/news/articleView.html?idxno=516230,"완료 ▲2030년 착공을 제시했다. 재원 조달은 민간 투자와 재개발·재건축 광역교통시설 분담금 등을 활용할 계획이다. 김 후보는 ""교통이 최고의 복지라는 신념으로 시민의 삶의 질을 결정짓는 핵심 인프라를 구축하겠다... "
2026-04-30,네이버뉴스,"인천글로벌캠퍼스, 입주대학 공동 의지로 잔디광장 준공",https://www.kmib.co.kr/article/view.asp?arcid=0029758085&code=61122012&cp=nv,24일 착공에 들어가 지난 26일 준공했다. 이를 통해 잔디광장 600㎡가 새롭게 조성됐으며 기존 단절된 주변... 이는 최대 1500명을 수용할 수 있는 규모로 입주대학이 공동 활용 가능한 캠퍼스 공유 인프라다. 또 이식된... 
2026-04-30,네이버뉴스,"이그니스, 독일 내 엑솔루션 생산·R&D 통합 센터 착공...유럽 중심 글로...",http://www.financialreview.co.kr/news/articleView.html?idxno=42060,"이그니스 자회사 엑솔루션, 독일 생산·R&D 센터 착공식 성료./사진=이그니스 브랜드 디벨로퍼 이그니스(대표... 생산 인프라 확충에 투자를 이어오고 있다. 최근 글로벌 식음료 제조사들의 'XO 리드' 채택이 가파르게... "
2026-04-30,네이버뉴스,김병욱“2030년 동서와 남북 가로지르는 성남메트로 1·2호선 착공”,https://www.sportsseoul.com/news/read/1606592?ref=naver,교통 인프라 확충 김병욱 후보가 30일 성남시의회에서 기자회견을 하고 있다. 제공=더불어민주당 김병욱... 임기 내인 2030년까지 사전 타당성조사 및 민자적격성 조사를 통과시켜 신속하게 착공을 추진하겠다”고 피력했다.
2026-04-30,네이버뉴스,"[나는 후보다] ""연속성과 완성"" · · 이기재가 던진 승부수",http://news.lghellovision.net/news/articleView.html?idxno=541842,"[리포트] [질문1: 출마의 변] [이기재 / 국민의힘 양천구청장 후보: ""재건축·재개발, 대장홍대선 착공... 교통 인프라 갖춘 도시"", ""보육부터 평생학습까지 이어지는 교육도시"" [질문6 주민께 당부의 말: ""지난 4년간 양천의... "
2026-04-30,네이버뉴스,"김병욱, '성남메트로 1·2호선' 구축 공약 발표…""성남 전역 역세권 시대...",https://www.shinailbo.co.kr/news/articleView.html?idxno=5016799,"2030년 착공을 목표로 한다. 재원은 민간투자와 재개발·재건축 광역교통시설 분담금을 활용할 방침이다. 김 후보는 ""급증하는 판교와 백현마이스 개발 수요, 재건축·재개발 본격화에 대응하기 위해서는 교통 인프라... "
2026-04-30,네이버뉴스,"이그니스, 독일에 생산·R&D 센터 착공…친환경 ‘XO 리드’로 유럽 공략...",https://www.megaeconomy.co.kr/news/newsview.php?ncode=1065597873137963,브랜드 디벨로퍼 이그니스가 독일 바이에른주 다하우에 생산 및 연구개발(R&D) 통합 센터를 착공하며... 이그니스는 2022년 인수 이후 기술 고도화와 생산 인프라 확충에 지속적으로 투자해 왔다. 최근 글로벌 식음료... 
2026-04-30,네이버뉴스,"인천글로벌캠퍼스, 다목적 잔디광장으로 학생 꿈 실현",https://www.viva100.com/article/20260430500674,"재단은 이러한 요청을 수렴해 올해 2월 사업 추진 계획을 수립하고, 지난달 24일 착공해 이달 26일 준공을... 이는 최대 1500명을 수용할 수 있는 규모로, 4개 입주대학이 공동으로 활용할 수 있는 캠퍼스 공유 인프라다. 또한... "
2026-04-30,네이버뉴스,"김성제 의왕시장 후보 ""공직자 헌신이 의왕 변화 동력""",https://www.kmaeil.com/news/articleView.html?idxno=639173,"종합병원 착공 등도 속도감 있게 추진되길 바란다""고 말했다. 백운밸리 개발은 의왕시 도시 재편의 상징적 사업으로 꼽힌다. 개발 이후 인구 유입과 상업·주거 기능이 확대되면서 생활 인프라 확충 요구도 함께 증가해... "
2026-04-30,네이버뉴스,"“경남형 카이스트를”… 박완수, 국립창원대 과기원 전환 약속",https://www.chosun.com/politics/election2026/2026/04/30/BQILFFVX6NFJZNGLCNUOKAPKYQ/?utm_source=naver&utm_medium=referral&utm_campaign=naver-news,"개통 시 창원·김해·부산을 하나의 생활권으로 연결하는 동남권 핵심 인프라로 평가된다. 2014년 착공 후 공정률 99%까지 진행됐으나, 2020년 낙동1터널 구간 지반침하 사고로 장기간 지연돼 왔다. 한편, 박 후보는 전날... "
2026-04-30,네이버뉴스,"[이슈 IN 인천] 박찬대 ""ABC+E 전략으로 대한민국 이끄는 도시 만들겠다...",https://news.skbroadband.com/news/articleView.html?idxno=225999,교통 인프라를 만들어야 되는 것 아닌가 이렇게 생각됩니다. 지금 GTX- B 노선이 착공이 됐습니다. 그렇지만 아직도 불편한 우리 서부권 남부권에  GTX-D 노선과 GTX-E 노선에 대한 수요가 있습니다. 아직도 미확정되어... 
2026-04-30,네이버뉴스,"근우, IPO 주관사로 NH투자증권 선정…“코스닥 상장 준비 본격화”",https://www.dnews.co.kr/uhtml/view.jsp?idxno=202604301547377310328,"생산 인프라 확충도 속도를 내고 있다. 2025년 충북 음성 제1공장을 준공해 생산능력을 대폭 확대했으며, 올 3월에는 음성 제2공장 착공에 들어갔다. 김재진 근우 대표이사는 “IPO를 통해 확보한 자금을 바탕으로... "
