date,source,title,link,description
2026-07-07,네이버뉴스,"""중동전쟁 여파에 숨 막힌다""…경남·부산 건설사 '가덕신공항' 공사비...",https://www.newsgn.com/news/articleView.html?idxno=561081,"지역 건설업계에 따르면 대우건설을 주간사로 하는 가덕신공항 부지 조성 공사 컨소시엄에 참여 중인 지역 건설사 13곳(경남 5개 사, 부산 8개 사)은 최근 국토교통부 장관, 경남도지사, 부산시장, 가덕도신공항건설공단... "
2026-07-07,네이버뉴스,"[분양소식] ""84㎡만 답 아니다""···신도시·서울 핵심지서 '큰 집' 재평...",https://www.smartbizn.com/news/articleView.html?idxno=148014,"대우건설이 공급한 '써밋 더힐' 역시 무순위 청약에서 전용 84㎡ 3가구 모집에 2179명이 몰리며 평균 726.33대 1의 경쟁률을 기록했다. 한강 접근성과 흑석뉴타운 입지, 브랜드 가치가 복합적으로 작용한 결과라는... "
2026-07-07,네이버뉴스,"대우건설, 협력회사 안전등급제 도입...안전관리 수준 높인다",https://www.asiaa.co.kr/news/articleView.html?idxno=254546,대우건설은 협력회사의 안전관리 수준을 높이고 안전 중심의 건설문화를 확산하기 위해 '협력회사 안전등급제'를 시행한다고 7일 밝혔다. 이번 제도는 협력회사의 안전관리 역량을 객관적으로 평가해 우수 업체에는... 
2026-07-07,네이버뉴스,"대우건설, 협력사 안전등급 따라 '입찰가점 인센티브' 부여",http://www.sisacast.kr/news/articleView.html?idxno=97554,대우건설 사옥  대우건설은 협력회사 '안전등급제'를 통해 입찰가점 인센티브를 부여하는 것으로 안전관리 역량을 강화한다고 7일 밝혔다. 협력회사 안전등급제는 협력회사의 안전관리 수준을 객관적으로 평가해 우수... 
2026-07-07,네이버뉴스,고분양가 논란에도 흑석동 완판,https://www.mk.co.kr/article/12092603,'써밋더힐' 무순위 726대1 대우건설이 서울 동작구 흑석뉴타운에서 선보인 '써밋더힐'(조감도)이 무순위 청약에서 세 자릿수 경쟁률을 기록했다. 7일 한국부동산원 청약홈에 따르면 전날 진행된 써밋더힐 무순위... 
2026-07-07,네이버뉴스,"[비즈&] 우리금융 ""혁신기업에 7조 투자…모험자본 공급"" 外",http://www.yonhapnewstv.co.kr/news/MYH20260707173633u39,"▶ 대우건설, 협력사 안전등급제 시행 대우건설이 협력회사의 안전관리 역량을 평가하는 '안전등급제'를 시행합니다. 협력사의 안전관리 수준을 객관적으로 평가해 우수 협력사에는 입찰금액 가점 등 인센티브를... "
2026-07-07,네이버뉴스,"협력회사 입찰, 안전관리 따라 가점한다...대우건설, '안전등급제' 시행",http://www.popcornnews.net/news/articleView.html?idxno=125863,대우건설이 협력회사 안전관리 역량을 강화하고 안전 중심 건설문화 확산을 위해 '협력회사 안전등급제'를 시행했다고 7일 밝혔다. 이번에 도입된 '협력회사 안전등급제'는 협력회사 안전관리 수준을 객관적이고 정밀하게... 
2026-07-07,네이버뉴스,"대우건설, 협력사 ‘안전등급제’ 시행…등급 따라 입찰가점 추가 부여",http://www.lawissue.co.kr/view.php?ud=20260707172417926267191f6c6e_12,"대우건설은 7일 협력회사 안전관리 역량 강화를 위해 ‘협력회사 안전등급제’를 본격 시행했다. 현장·본사 안전평가와 신용평가사 안전등급(SH/SA 등급)을 종합 반영해 협력회사 안전 수준을 평가하며, 우수 협력사에는... "
2026-07-07,네이버뉴스,"대우건설, 협력회사 안전등급제 도입…안전관리 우수 기업 입찰 우대",https://www.megaeconomy.co.kr/news/newsview.php?ncode=1065600339113959,대우건설은 협력회사의 안전관리 수준을 입찰 평가에 반영하는 '협력회사 안전등급제'를 도입해 안전 중심의 건설문화 확산에 나섰다. 대우건설은 협력회사의 안전관리 역량을 강화하기 위해 '협력회사 안전등급제'를 본격... 
2026-07-07,네이버뉴스,가덕도신공항 덮친 공사비 갈등…연내 착공 변수 되나,https://www.etoday.co.kr/news/view/2600695,대우건설 컨소시엄에 참여한 부산·경남 지역 건설사들이 유류비와 원자잿값 상승을 이유로 공사비 현실화를 요구하고 나서면서다. 탈퇴 가능성까지 거론되면서 컨소시엄 운영과 후속 일정에 차질이 생길 수 있다는... 
2026-07-07,네이버뉴스,"대우건설, 협력사 '안전등급제' 도입…안전관리 우수하면 입찰 혜택",https://biz.sbs.co.kr/article_hub/20000321163?division=NAVER,대우건설이 협력회사의 안전관리 수준을 입찰 평가에 반영하는 '협력회사 안전등급제'를 본격 도입했습니다. 대우건설은 협력회사의 안전관리 역량을 강화하고 건설현장의 안전문화를 정착시키기 위해 '협력회사... 
2026-07-07,네이버뉴스,[뉴스워커_대우건설] 협력사 '안전등급제' 도입…안전도 입찰 경쟁력 된...,http://www.newsworker.co.kr/news/articleView.html?idxno=435088,대우건설이 협력회사의 안전관리 수준을 입찰 평가에 반영하는 '협력회사 안전등급제'를 도입하며 안전 중심의 건설 생태계 구축에 나섰다. 대우건설은 협력사의 안전 역량을 객관적으로 평가해 우수 업체에는 입찰... 
2026-07-07,네이버뉴스,29억원대 흑석동 신축 '줍줍' 흥행…3가구에 2179명 몰렸다,https://www.newspim.com/news/view/20260707001091,'써밋 더힐' 조감도 [자료=대우건설] 7일 한국부동산원 청약홈에 따르면 전날 진행된 써밋 더힐 무순위 청약에서 전용면적 84㎡A 3가구 모집에 총 2179명이 신청했다. 평균 경쟁률은 726.33대 1이다. 이 단지는 앞서 지난 5월... 
2026-07-07,네이버뉴스,"대우건설, 협력회사 안전등급제 도입…입찰 평가에 안전 반영",https://www.fntimes.com/html/view.php?ud=202607071638229118048b718333_18,"대우건설이 협력회사 입찰 평가 과정에 안전관리 수준을 반영하는 '협력회사 안전등급제'를 7월부터 시행한다. 협력회사의 안전관리 역량을 정기적으로 평가하고, 결과에 따라 입찰 인센티브와 제한을 적용하는 방식이다.... "
2026-07-07,네이버뉴스,"대우건설, 우수업체 인센티브 준다…협력사 안전등급제 시행",https://www.kfenews.co.kr/news/articleView.html?idxno=659901,한국금융경제신문=김한나 기자 | 대우건설이 협력회사의 안전관리 역량 강화를 위해 '협력회사 안전등급제'를 본격 시행한다고 7일 밝혔다. 대우건설 을지로 사옥. 사진=대우건설 협력회사 안전등급제는 협력사의 안전관리... 
2026-07-07,네이버뉴스,"대우건설, 협력회사 안전등급제 시행…안전 우수업체 입찰 인센티브",https://www.tfmedia.co.kr/news/article.html?no=205603,협력사 안전관리 역량 평가해 입찰 가점 부여 안전등급 낮은 업체는 입찰 제한 등 패널티 적용  대우건설이 협력회사의 안전관리 역량을 강화하기 위해 이달부터 '협력회사 안전등급제'를 본격 시행한다고 7일 밝혔다.... 
2026-07-07,네이버뉴스,"대우건설, 협력사 안전등급제 시행···안전관리 역량 강화",http://www.koreastocknews.com/news/articleView.html?idxno=119625,"대우건설(047040, 대표 김보현)은 협력회사의 안전관리 역량을 평가하는 '안전등급제'를 시행한다고 7일 밝혔다. 협력회사 안전등급제는 협력사의 안전관리 수준을 객관적으로 평가해 우수 협력사에는 입찰 인센티브를... "
2026-07-07,네이버뉴스,"대우건설 ""협력회사 안전관리 역량 강화하고 안전 중심 건설문화 확산한...",https://www.ngonews.kr/news/articleView.html?idxno=232377,"건설 현장에서 중대재해가 지속적으로 발생하고 있는 가운데 대우건설(대표이사 김보현)이 협력회사의 안전관리 역량을 강화하고, 안전 중심의 건설문화를 확산하기 위해 '협력회사 안전등급제'를 본격 시행한다. 7일... "
2026-07-07,네이버뉴스,"대우건설, '협력회사 안전등급제' 본격 시행…안전 역량을 경쟁력으로",https://www.fntoday.co.kr/news/articleView.html?idxno=387711,대우건설 을지로 사옥 / 대우건설 제공 대우건설(대표이사 김보현)이 협력회사의 안전관리 역량을 강화하고 안전 중심의 건설문화를 확산하기 위해 '협력회사 안전등급제'를 본격 시행했다. 이 제도는 협력회사의 안전관리... 
2026-07-07,네이버뉴스,"""같은 단지인데 나만 구축""…'5동만 빼고 재건축' 명일삼익맨숀, 왜?",https://www.mt.co.kr/estate/2026/07/08/2026070715010553682,"조합 측은 또 서울시와 강동구는 물론 시공사로 선정된 대우건설도 5동 주민 설득에 나섰지만 성과를 내지 못했다고 주장했다. 신성덕 삼익맨숀 재건축조합장은 ""소송 전부터 2년 넘게 5동까지 함께 재건축하기 위해... "
2026-07-07,네이버뉴스,[건설업계 브리핑] 대우건설·롯데건설·DK아시아·HUG,https://daily.hankooki.com/news/articleView.html?idxno=1383595,"사진=챗GPT 생성 이미지 ◇ 대우건설, 협력회사 안전등급제 도입…안전 우수업체 입찰 혜택 사진=대우건설 제공 대우건설이 협력회사 안전관리 수준을 평가하는 안전등급제를 시행한다. 안전 우수 협력회사에는... "
2026-07-07,네이버뉴스,"대우건설, 협력사 안전관리 '안전등급제' 시행",https://www.delighti.co.kr/news/articleView.html?idxno=118705,대우건설 을지로 사옥. (사진=대우건설) 대우건설은 협력회사의 안전관리 역량을 평가하는 '안전등급제'를 시행한다고 7일 밝혔다. 안전등급제는 협력사의 안전관리 수준을 객관적으로 평가해 우수 협력사에는 입찰... 
2026-07-08,네이버뉴스,"GS건설, 데이터센터 모멘텀 주목…하반기 최선호주-IBK",https://www.edaily.co.kr/news/newspath.asp?newsid=02450166645512552,"IBK투자증권은 GS건설(006360)에 대해 단기 실적은 다소 부진하겠지만 주택 수주와 공급 회복, 데이터센터 개발 모멘텀을 감안해 하반기 최선호주(Top-pick)로 제시했다. 8일 조정현 IBK투자증권 연구원은 “실적... "
2026-07-08,네이버뉴스,[AI 경영] 직원들이 각자 수만가지 업무 챗봇 만들어 전사 공유...GS건설...,http://www.consumernews.co.kr/news/articleView.html?idxno=758890,"입찰안내서와 계약서, 설계 기준, 안전·품질 기준을 찾기 위해 여러 파일을 번갈아 열던 GS건설(대표 허윤홍) 직원들의 업무 방식이 완전히 달라지고 있다. 이제는 필요한 문서를 사내 인공지능 플랫폼에 올려 직접... "
2026-07-07,네이버뉴스,호반써밋풍무·목동윤슬자이…7~8월 수도권 2.3만가구 공급,https://www.hankyung.com/article/2026070708701,GS건설은 서울 양천구 목동에 651실 규모의 오피스텔 ‘목동윤슬자이’를 선보인다. 지하철 5호선 오목교역과 목동역이 가까운 편이다. 조선호텔앤리조트가 운영하는 프리미엄 멤버십 피트니스클럽 ‘콩코드... 
2026-07-07,네이버뉴스,"부산 삼익비치, 3060가구 '1 대 1 재건축'",https://www.hankyung.com/article/2026070708651,GS건설이 시공을 맡았으며 단지명은 ‘그랑자이 더 비치’로 정해졌다. 조합은 지난해 11월 임시총회에서 층수와 가구 수를 줄이는 설계 변경안을 참석 조합원 97% 찬성으로 통과시켰다. 연내 관리처분계획 인가를... 
2026-07-07,네이버뉴스,올여름 수도권 분양물량 ‘봇물’…직주근접 ‘반세권’ 단지 눈길,https://www.viva100.com/article/20260707501068,"서울에서는 GS건설이 양천구 목동 옛 KT 부지에 ‘목동윤슬자이’ 651실을 공급하며, 쌍용건설은 8월 서대문구에 ‘쌍용 더 플래티넘 서대문’ 일반분양 62가구를 선보인다. 경기도에서는 두산건설·쌍용건설... "
2026-07-08,네이버뉴스,"지방 부동산 경기 침체…대기업 건설사, '탈부산' 가속화 우려",https://www.yna.co.kr/view/AKR20260707134400051?input=1195m,미분양 증가 등 불황 장기화…롯데건설 영남지사 철수 전환 배치 부산의 부동산 경기 침체가 깊어지는 가운데 대기업 건설사인 롯데건설이 지역 조직을 축소하기로 해 1군 업체의 '탈(脫)부산'이 가속화 되는 것 아니냐는... 
2026-07-08,네이버뉴스,"정비사업, 조합ㆍ公共 ‘콜라보 시대’ 열렸다",https://www.dnews.co.kr/uhtml/view.jsp?idxno=202606291345301050149,"서울 성수4지구 재개발 사업 시공사 입찰 과정에서 성동구가 롯데건설의 이주비 제안을 입찰 지침 위반으로 판정한 반면, 같은 시기 신반포19ㆍ25차, 압구정5구역에서는 사실상 마이너스 금리 조건이 허용됐다. 구청마다... "
2026-07-07,네이버뉴스,"롯데건설, 공사대금채권 기반 3천억원 ABS 추가 발행 성공",http://www.smarttimes.co.kr/news/articleView.html?idxno=47051,롯데건설이 지난 5월에 이어 연이어 자산유동화증권(ABS) 발행에 성공하며 안정적인 자금 조달 체계를 공고히 했다. 롯데건설은 준공이 임박한 주택사업장과 그룹 계열사 건축사업장의 공사대금채권을 활용해 최고... 
2026-07-07,네이버뉴스,"롯데벤처스 10년 결실…부산 창업 28곳, 전국구 기업으로",http://www.kookje.co.kr/news2011/asp/newsbody.asp?code=0200&key=20260708.22011002144,"롯데벤처스는 부산창경센터가 운영하는 ‘스타트업 오픈이노베이션 챌린지’에 참여, 롯데백화점 롯데건설 롯데웰푸드 롯데월드 롯데글로벌로지스 등 계열사와 스타트업 간 협업 및 기술검증을 추진해 총 9건의 협업을... "
2026-07-07,네이버뉴스,"롯데건설, AAA등급 ABS 3000억원 발행 성공…공사비 7700억원 조기 회수...",https://economist.co.kr/article/view/ecn202607070061,롯데건설이 공사대금채권을 활용한 자산유동화증권(ABS) 발행을 통해 3000억원 규모의 자금 조달에 성공했다. 지난 5월 1차 발행에 이어 두 번째 발행도 성공적으로 마무리하면서 안정적인 자금 조달 기반을 확보했다는... 
2026-07-07,네이버뉴스,롯데 에코 스마트 시티 투티엠 프로젝트 '청신호',http://www.fnnews.com/news/202607071807553108,지분 거래 후 롯데 프로퍼티스 호찌민시의 자본금은 4조2090억 동(약 2443억원)으로 조정되며 주주 구성은 △롯데쇼핑 30.59% △호텔롯데 22.94% △롯데건설 11.47% △팟닷 35% 체제로 재편된다. 기존 주주였던... 
2026-07-07,네이버뉴스,"롯데건설, 3천억 규모 ABS 발행 성공",http://www.fnnews.com/news/202607071806027403,롯데건설이 공사대금채권을 기초자산으로 한 3000억원 규모의 자산유동화증권(ABS)을 최고 신용등급(AAA)으로 발행했다. 롯데건설은 준공을 앞둔 주택사업장과 그룹 계열사 건축사업장의 공사대금채권을 활용해... 
2026-07-07,네이버뉴스,"롯데건설, AAA등급 ABS 3천억 발행",https://www.mk.co.kr/article/12092604,부채비율 168.2%로 낮춰 롯데건설이 준공이 임박한 주택사업장과 그룹 계열사 건축사업장의 공사대금채권을 기초자산으로 활용해 AAA 신용등급의 자산유동화증권(ABS) 3000억원 규모 발행에 성공했다고 7일 밝혔다.... 
2026-07-07,네이버뉴스,"롯데건설, AAA 등급 자산유동화증권 추가 발행…3000억 규모",https://news.tvchosun.com/site/data/html_dir/2026/07/07/2026070790248.html,롯데건설은 준공이 임박한 주택사업장과 그룹 계열사 건축사업장의 공사대금채권을 활용해 AAA 신용등급으로 3000억 원 규모의 자산유동화증권 발행에 성공했다고 7일 밝혔다. 3000억 원의 유동화증권 중 1500억 원은... 
2026-07-07,네이버뉴스,"롯데건설, AAA등급 ABS 2차 3천억 발행 성공…재무 구조 개선",http://www.lawissue.co.kr/view.php?ud=20260707172640847367191f6c6e_12,"롯데건설은 7일 준공 임박 주택사업장 및 그룹 계열사 건축사업장의 공사대금채권을 활용해 3000억원 규모의 자산유동화증권(ABS)을 발행했다. 만기는 1년(1500억원)과 1년 3개월(1500억원)로 구성됐으며, KB증권... "
2026-07-07,네이버뉴스,"롯데건설, AAA등급 ABS 발행 잇달아 성공...3000억 원 조달",http://www.popcornnews.net/news/articleView.html?idxno=125877,"롯데건설이 최고 신용등급인 AAA 등급으로 3000억 원 규모 자산유동화증권(ABS)을 발행했다고 7일 밝혔다. 이번에 발행된 ABS는 만기 구조를 다변화해 리스크를 분산했다. 1500억 원은 만기 1년, 나머지 1500억 원은 만기 1년... "
2026-07-07,네이버뉴스,"롯데건설, AAA 등급 ABS 2차 발행 성공… 공사대금채권 유동화로 현금흐...",https://www.s-journal.co.kr/news/articleView.html?idxno=42233,"롯데건설이 공사대금채권을 활용한 자산유동화증권(ABS) 2차 발행에 성공하며 자금 운용 안정화에 속도를 내고 있다. 지난 5월 업계 최초로 자체 개발한 공사대금채권 유동화 구조를 통해 3000억원을 조달한 데 이어, 두... "
2026-07-07,네이버뉴스,"베트남 '롯데 에코 스마트시티' 15조 동 세금 체납..롯데프로퍼티스 ""은...",http://www.fnnews.com/news/202607071544046654,"해당 컨소시엄에는 롯데쇼핑, 호텔롯데, 롯데건설 등 롯데그룹 계열사 3사와 팟닷 부동산개발사가 참여하고 있다. 한편, 롯데 측은 '투티엠 에코스마트시티' 프로젝트가 현지 금융당국의 신용 규제 강화로 금융조달... "
2026-07-07,네이버뉴스,홈플러스 리스크 떠안은 롯데건설···내년 3월 PF 고비,https://www.sisajournal-e.com/news/articleView.html?idxno=422259,홈플러스 회생절차 폐지 결정이 롯데건설의 프로젝트파이낸싱(PF) 우발채무 리스크로 번지고 있다. 홈플러스 점포 부지를 활용한 개발사업에서 제공한 보증이 재무 부담으로 돌아올 수 있어서다. 홈플러스 청산이... 
2026-07-07,네이버뉴스,"목동·여의도 수주 위해 롯데건설, 3천억 조달",https://www.hankyung.com/article/2026070708641,롯데건설이 3000억원 규모 자산유동화증권(ABS)을 추가 발행했다. 목동과 여의도 등 서울 주요 재건축·재개발 수주를 앞두고 재무 안정성을 강화하기 위한 조치다. 롯데건설은 준공을 앞둔 주택사업장과 그룹 계열사... 
2026-07-07,네이버뉴스,"롯데건설, 공사대금채권 활용···3000억원 ABS 추가 발행 성공",http://www.koreastocknews.com/news/articleView.html?idxno=119627,롯데건설(대표 오일근)이 지난 5월에 이어 연이어 자산유동화증권(ABS) 발행에 성공했다. 롯데건설은 준공이 임박한 주택사업장과 그룹 계열사 건축사업장의 공사대금채권을 활용해 AAA 신용등급으로 3000억원 규모의... 
2026-07-07,네이버뉴스,"3~4인 가구 중심 수요, '국민평형' 아파트 인기 이어져",https://www.woodkorea.co.kr/news/articleView.html?idxno=90184,"롯데건설은 7월, 경기도 부천시 원미구 상동 일원에 짓는 '상동역 롯데캐슬 시그니처'를 분양할 예정이다. 지하 8층~지상 49층, 7개 동, 전용면적 84~192㎡, 총 1,859가구 규모다. 지하철 7호선 상동역 역세권 단지다.... "
2026-07-07,네이버뉴스,"롯데·DL건설, 자금조달·신용등급 '청신호'…재무안정성 입증",http://www.biztribune.co.kr/news/articleView.html?idxno=355613,롯데건설 공사대금채권 ABS발행 | 롯데건설 건설 경기 침체가 장기화되는 가운데 롯데건설과 DL건설이 각각 자산유동화증권(ABS) 발행과 신용등급 유지를 통해 안정적인 재무구조를 다시 한번 입증했다. 시장에서는 두... 
2026-07-07,네이버뉴스,[초점] 물산부터 알미늄까지…롯데그룹 계열사 신용등급·전망 줄하향,http://www.newswatch.kr/news/articleView.html?idxno=80358,"또 ""롯데물산은 2023년 롯데케미칼 유상증자에 참여해 2463억원을 투입했고 롯데건설 유동화 SPC(프로젝트 샬롯)에 대한 후순위 대여금 2000억원 및 선순위 및 중순위 대출 잔액 1조2614억원의 이자에 대한 자금보충약정... "
2026-07-07,네이버뉴스,"롯데건설, AAA등급 ABS 3천억 원 추가 발행…자금조달 안정성 강화",https://biz.sbs.co.kr/article_hub/20000321158?division=NAVER,롯데건설이 최고 신용등급인 AAA등급의 자산유동화증권(ABS) 3천억 원을 추가 발행하는 데 성공했습니다. 롯데건설은 준공을 앞둔 주택사업장과 그룹 계열사 건축사업장의 공사대금채권을 기초자산으로 한 3천억 원... 
2026-07-07,네이버뉴스,"롯데건설, AAA등급 자산유동화증권 3천억 발행 성공",http://www.techholic.co.kr/news/articleView.html?idxno=222014,롯데건설은 준공이 임박한 주택사업장 및 그룹 계열사 건축사업장의 공사대금채권을 활용해 AAA 신용등급으로 3천억 원 규모의 자산유동화증권(ABS) 발행에 성공했다고 7일 밝혔다. 3천억 원의 유동화증권 중 1천5백억... 
2026-07-07,네이버뉴스,올 상반기 분양시장 키워드 ‘하이엔드’와 ‘국민평형’…청약 쏠림 뚜...,https://www.viva100.com/article/20260707500970,전용면적 59·84㎡ 총 660가구 규모의 ‘호반써밋 풍무Ⅲ’를 각각 분양할 예정이다. 롯데건설은 경기 부천시 원미구 상동 일원에 전용면적 84~192㎡ 총 1859가구 규모의 ‘상동역 롯데캐슬 시그니처’를 공급한다.
2026-07-07,네이버뉴스,"롯데건설, ‘AAA등급’ 3000억원 규모 ABS 2차 발행… “현금흐름 개선 ...",https://www.viva100.com/article/20260707501036,롯데건설은 준공이 임박한 주택사업장 및 그룹 계열사 건축사업장의 공사대금채권을 활용해 AAA 신용등급으로 3000억원 규모의 자산유동화증권(ABS) 발행에 성공했다고 7일 밝혔다. 이번 발행은 만기 1년물 1500억원과... 
2026-07-08,네이버뉴스,"[주요공시] 삼성전자, LG에너지솔루션, 씨에스윈드, 다원넥스뷰, 윈하이...",https://www.kdpress.co.kr/news/articleView.html?idxno=206726,"■ 삼일씨엔에스(KOSPI, 004440)는 포스코이앤씨와 새만금 지역간 연결도로 건설사업 2공구 강교 제작 및 설치공사 계약을 체결했다. 계약금액은 286억원이며, 최근 매출액 대비 12.8% 규모다. 시가총액... "
2026-07-08,네이버뉴스,"건설업계, 하반기도 '보릿고개'…줄도산 위기감 증폭",https://www.asiatime.co.kr/article/20260707500325,한국건설산업연구원 따르면 올해 건설수주는 전년 대비 8.9% 증가한 240조 8000억원으로 예상됐다. 반면 건설투자는 266조 1000억원으로 전년보다 0.3% 증가하는 데 그칠 것으 보인다. 수주 회복에도 실제 착공과 기성으로... 
2026-07-08,네이버뉴스,[리빙대전]한샘·리바트 정면승부…에넥스·KCC·LX도 '고급주거 전쟁',https://www.sidae.com/article/2026070714055424194,"브랜드 인지도를 높이는 동시에 건설사와 시행사 등 기업 고객이 제품을 직접 체험할 수 있도록 해 특판 수주 경쟁력을 강화하기 위해서다. 한샘 관계자는 ""프리미엄 브랜드 라인업을 지속적으로 확대하고 본사의 디자인... "
2026-07-07,네이버뉴스,"DL건설, 기업신용등급 'A-' 6년 연속 유지",https://www.thepublic.kr/news/articleView.html?idxno=310460,"등에서 수주를 이어 나가겠다""고 말했다. 업계에서는 신용등급 유지가 향후 자금 조달 측면에서도 긍정적인 영향을 미칠 것으로 보고 있다. 우수한 신용도를 확보한 건설사는 회사채 발행이나 금융권 차입 과정에서... "
2026-07-07,네이버뉴스,"DL건설, 'A-' 신용등급 6년 연속 사수",http://www.srtimes.kr/news/articleView.html?idxno=206995,"현금흐름 ▲낮은 수준의 PF 우발채무 부담 등을 꼽았다. DL건설은 지난해 701억원의 영업이익을 기록하며... 이는 현재 국내 대형 건설사 중 최상위권에 해당하는 클린 재무제표다. DL건설 관계자는 ""이번 신용등급 유지는... "
2026-07-07,네이버뉴스,"사상 첫 수주 2조원… 대보건설 ""공공 인프라 톱10 목표"" [POWER COMPANY]",https://www.dt.co.kr/article/12071654?ref=naver,"상반기에는 약 2800억원짜리 강동하남남양주선 광역철도 3공구 건설 사업을 수주했다. 건축부문에서도 도화 B-3블록과 양주회천 A-23·A-4블록 민간참여 공공주택사업, 송담고 신축공사, 여주시 신청사 건립공사... "
