date,source,title,link,description
2026-05-20,네이버뉴스,"대방건설, 수원이목지구에 1,744세대 대단지 ‘디에트르 더 리체Ⅱ’ 공...",https://www.kbsm.net/news/view.php?idx=520134,5월 착공이 계획돼 있다.단지 관계자는 “서울 전세시장 불안과 공급 감소 영향으로 수도권 주요 지역 신규 단지를 찾는 수요가 이어지고 있다”며 “광역 교통망 개발과 생활 인프라 확충 계획 등이 진행되면서 수원... 
2026-05-20,네이버뉴스,광주 미래차 소재·부품·장비 특화단지 사업 '순조',https://www.jnilbo.com/news/articleView.html?idxno=90000036261,㈜에니트는 차량과 도로 인프라 간 정보를 주고받는 통신장치인 '로드사이드 유닛(RSU)'을 개발 중이다.... 지난해 9월 착공한 자율주행 안전·성능평가 인증센터는 올해 12월 준공 예정이다. 인증센터에는 21종의 성능평가... 
2026-05-20,네이버뉴스,"OCI홀딩스, 美 ESS 프로젝트 착공…2027년 상업운전",https://www.insightkorea.co.kr/news/articleView.html?idxno=246727,북미 태양광·ESS 시장을 중심으로 신재생에너지 개발 사업을 확대하며 현지 전력 인프라 시장 내 입지를... 이 프로젝트는 OBBB 법안에 따른 착공 요건을 충족해 투자세액공제 30%와 에너지 커뮤니티 보너스 10%를... 
2026-05-20,네이버뉴스,"[이슈체크] OCI홀딩스, 美 대형 ESS 사업 본격화",http://www.hansbiz.co.kr/news/articleView.html?idxno=839850,OCI홀딩스는 미국 정부의 친환경 인프라 지원 정책 수혜도 기대하고 있다. 이번 프로젝트는 미국 OBBB 법안에 따른 착공 요건을 충족해 최대 40% 수준의 투자비 환급 혜택 적용이 가능한 것으로 알려졌다. 기본... 
2026-05-20,네이버뉴스,"동해시, 3177억 수소 저장·운송 클러스터 6월 착공…'굴뚝도시'의 변신",https://news.mtn.co.kr/news-detail/2026052009575687787,"실증 인프라가 들어선다.이 사업은 2023년 12월 정부 예비타당성 조사를 통과한 뒤 부지 매입, 실시설계 공모를 거쳐 착공까지 단계적으로 추진돼 왔다. 강원특별자치도가 추진하는 수소산업 로드맵에서 동해시는 수소산업... "
2026-05-20,네이버뉴스,"인천시, 대한항공 MRO 클러스터 조성 사업 계획 승인",https://www.ngonews.kr/news/articleView.html?idxno=230042,"정비공장과 인프라를 구축함으로써 고부가가치 MRO 생태계를 집약하는 것이다. 인천경제자유구역청... 이후 세부 설계를 거쳐 2029년 착공, 2031년 준공 및 본격 운영에 돌입한다는 계획이다. 윤백진... "
2026-05-20,네이버뉴스,"DL건설, 1,268억 규모 '부천 삼정 AI 허브센터' 수주",http://www.srtimes.kr/news/articleView.html?idxno=203611,착공 후 26개월이다. 부천 삼정 AI 허브센터는 약 9.8MW 규모의 AI 연산 특화 데이터센터다. 유진그룹 계열인 동양과 디씨플랫폼이 공동으로 사업을 추진하는 민간 주도 프로젝트다. 급증하는 수도권 내 AI 인프라 수요에... 
2026-05-20,네이버뉴스,"DL건설, 1268억 부천 삼정 AI 허브센터 수주",http://www.opinionnews.co.kr/news/articleView.html?idxno=138714,"유진그룹 계열사인 ㈜동양과 디씨플랫폼㈜이 사업을 추진하는 민간 주도 AI 인프라 개발사업이다.... DL건설은 토공·파일 공정을 통합 발주해 착공 초기 리스크를 줄이고, 전체 공정을 2% 이상 단축한다는 목표를... "
2026-05-20,네이버뉴스,영종산업단지 항공 MRO 허브 메카로 도약,https://www.kgnews.co.kr/news/article.html?no=896575,"관련 인프라를 구축할 계획이다. 항공기 정비 분야 중에서도 엔진과 핵심 부품 정비는 가장 높은 수준의... 이후 세부 설계를 거쳐 2029년 착공, 2031년 준공 및 본격 운영에 돌입하기 위한 구체적인 로드맵을 마련할... "
2026-05-20,네이버뉴스,"OCI홀딩스, 美텍사스 120MW·480MWh 규모 ESS 착공",http://www.enewstoday.co.kr/news/articleView.html?idxno=2431159,OCI홀딩스가 미국 텍사스에서 대규모 에너지저장장치(ESS) 프로젝트 착공에 나서며 북미 전력 인프라 시장 공략을 강화한다. OCI홀딩스는 미국 자회사 OCI에너지가 19일(현지시간) 텍사스주 베어카운티에서 현지... 
2026-05-20,네이버뉴스,"이권재 오산시장 후보, ""말이 아닌 결과로 증명…'더 큰 오산' 향해 중단...",http://www.fnnews.com/news/202605181402557028,"현재의 20만~30만 규모로는 백화점이나 대학병원 같은 대형 인프라 유치가 어렵다는 판단에서다. 그 핵심... 오산역과 직접 연결되는 브리지를 만들고 이미 확정이 난 GTX-C 노선 조기 착공, 그리고 오는 2027년 운행 목표인... "
2026-05-20,네이버뉴스,"아시아 최대 항공정비 거점 뜬다...인천시, 대한항공 502대 엔진 정비기...",https://www.hankookilbo.com/news/article/A2026052009560000811?did=NA,"이곳에 약 1,500억 원을 투자해 연면적 10만 1,151㎡ 규모의 첨단 엔진·부품 정비 공장과 인프라를 구축한다.... 세부 설계를 거쳐 2029년 착공, 2031년 준공 및 본격 운영에 돌입할 계획이다. 윤백진 인천경제청장 대행... "
2026-05-20,네이버뉴스,"박우량 신안군수 후보, 신안군 교통혁명 선언",http://www.jndn.com/article.php?aid=1779239263432823109,신속한 착공을 추진한다. 흑산공항은 응급환자 이송 체계를 강화하고 서남해 관광 활성화와 국가안보 기능을 함께 뒷받침할 전략적 인프라로 꼽힌다. 도서 교통의 공공성을 높이기 위한 여객선 공영화도 단계적으로... 
2026-05-20,네이버뉴스,"[경북 24시] 경북도, 'AI·시스템반도체 생태계' 로드맵 가동…구미·포...",https://www.sisajournal.com/news/articleView.html?idxno=373475,주요 인프라 사업의 추진 상황을 종합 점검했다. 대구경북신공항은 정부 기금과 지방채 발행 등 가용 재원을 동원해 조속한 착공에 나선다. 이와 함께 공항신도시 산업단지 및 항공우주산업 육성 연구용역에 착수해... 
2026-05-20,네이버뉴스,"인천시, 대한항공 항공정비 클러스터 사업계획 승인",https://www.shinailbo.co.kr/news/articleView.html?idxno=5022633,"대한항공은 운북동 산업단지 내 약 5만㎡ 부지에 1500억 원을 투입해 엔진·부품 정비 공장과 관련 인프라를... 인천경제자유구역청은 향후 사업 시행자와 토지 매매 절차를 진행한 뒤 2029년 착공, 2031년 준공을 목표로... "
2026-05-20,네이버뉴스,"OCI홀딩스, 美 텍사스 ESS 착공…전력저장 사업 확대 본격화",https://www.pinpointnews.co.kr/news/articleView.html?idxno=453996,OCI Energy 알라모 시티 프로젝트 기공식 현장 사진 OCI홀딩스가 미국 텍사스에서 대규모 에너지저장장치(ESS) 프로젝트를 착공하며 북미 전력 인프라 사업 확대에 나선다. OCI홀딩스는 미국 자회사 OCI Energy... 
2026-05-20,네이버뉴스,"조원휘, 정용래 '행정 책임론' 정조준… 유성구청장 토론서 공약·혈세...",https://www.goodkyung.com/news/articleView.html?idxno=287189,"착공이나 부지 확보 단계 사업까지 완료 처리됐다""고 주장했다. 또 유성온천 관광 활성화 공약과 관련해서는 유성호텔이 2024년 영업을 종료했고, 리베라호텔·아드리아호텔도 2018년 폐업한 점을 언급하며 ""관광 인프라가... "
2026-05-20,네이버뉴스,"광주시, 미래차 소부장 특화단지 조성 '가속도'… 자율주행 핵심부품 국...",https://www.mtnews.net/news/articleView.html?idxno=24835,이와 함께 중소기업의 부품 신뢰성 검증을 뒷받침할 인프라와 전문 인력 양성 사업도 순조롭게 궤도에 올랐다. 기반구축 분야를 전담하는 광주미래차모빌리티진흥원은 지난해 9월 착공한 '자율주행 안전·성능평가... 
2026-05-20,네이버뉴스,'보수 텃밭'서 '스윙보터' 변모한 경기 광주…방세환 vs 박관열 '양강 맞...,http://www.fnnews.com/news/202605200929597154,"주요 공약: 광주시 발전을 가로막아온 수도권 규제 완화를 위한 특별법 추진, GTX 노선 유치 및 지하철 연장 조기 착공 등 '교통 혁명', 교육·문화 인프라 확충을 통한 명품 정주여건 조성을 핵심 공약으로 발표하며 '준비된... "
2026-05-20,네이버뉴스,"DL건설, 삼정 데이터센터 수주…1268억 규모",https://www.g-enews.com/view.php?ud=202605200934096813ac06cade6e_1,"유진그룹 계열 동양과 디씨플랫폼이 발주한 민간 주도 AI 인프라 개발사업이다. DL건설의 데이터센터... 2022년 6월 착공해 지난해 5월 준공했고, 서버 냉각 효율을 높이는 컨테인먼트(Containment) 공사를 마친 후... "
2026-05-20,네이버뉴스,"인천 영종, 아시아 최대 항공 MRO 허브 도약",https://biz.heraldcorp.com/article/10741457?ref=naver,"관련 인프라를 구축할 계획이다. 이번 사업은 단순 정비시설을 넘어 항공엔진과 핵심 부품을 전문적으로... 오는 2026년 8월 토지매매계약 체결 이후 세부 설계를 거쳐 2029년 착공, 2031년 준공 및 본격 운영에... "
2026-05-20,네이버뉴스,"광주시, 미래차 소부장 특화단지 사업 추진 방향 공유",https://www.namdonews.com/news/articleView.html?idxno=911111,"에니트는 차량과 도로 인프라 간 통신을 담당하는 로드사이드 유닛(RSU) 개발 상황을 공개했다. 회사는... 지난해 9월 착공한 인증센터는 올해 12월 준공 예정이며, 21종의 성능평가 장비를 갖춰 자율주행 기업들의 시험... "
2026-05-20,네이버뉴스,"인천시, 영종항공일반산단 대한항공 입주 가결",https://www.businesskorea.co.kr/news/articleView.html?idxno=269752,투자해 인프라를 완성할 방침이다. 사업이 본격화되면 생산 지표는 비약적으로 상승할 것으로 보인다.... 이후 세부 설계를 거쳐 2029년 착공에 들어가며 2031년 준공과 함께 본격적인 운영에 돌입한다는 구상이다.... 
2026-05-20,네이버뉴스,속초 화채 마을 도시재생 순항…내년 4월 화채락센터 준공,https://www.yna.co.kr/view/AKR20260520039900062?input=1195m,"시는 최근 화채락센터 착공 공정회의와 안전보건 협의체 정기 회의를 열고 공사 진행 방향과 안전관리... 것""이라며 ""생활 인프라 확충과 주거환경 개선 사업을 차질 없이 추진해 주민 삶의 질 향상으로 이어질 수 있도록... "
2026-05-20,네이버뉴스,"“공항만 지으면 뭐 하나”… 부산 시민사회, 에어부산 사라질 위기 강...",https://sports.donga.com/region/article/all/20260520/133955682/1,"이들은 이날 발표한 기자회견문에서 “가덕도신공항은 착공 단계에 들어섰지만 정작 지역거점항공사는... 복합물류 인프라라고 평가했다. 아울러 “부산이 수도권 중심 항공체계의 보조 거점에 머물 것인지, 독자적인... "
2026-05-20,네이버뉴스,"경북도, 신공항·영일만항 중심 미래 성장인프라 점검",http://www.metroseoul.co.kr/article/20260519500377,경북도는 19일 도청 화백당에서 황명석 경북도지사 권한대행 행정부지사 주재로 핵심 성장인프라 추진상황... 우선 지역 최대 현안인 대구경북신공항의 조속한 착공 방안이 논의됐다. 경북도는 정부 공공자금관리기금... 
2026-05-20,네이버뉴스,"정원오·우형찬 후보, 목동아파트 찾아 '초고속 재건축' 약속",https://view.asiae.co.kr/article/2026052009014599050,"또 ""재건축 이후 5만 가구로 인구가 배가되는 상황에서 목동선 경전철이 조기에 착공되지 않으면 끔찍한... 우형찬 후보는 교통 인프라와 관련해 ""개정된 국가재정법의 예타 산정 시 항공기 소음 피해, 대중교통 사각지대 등... "
2026-05-20,네이버뉴스,"영종도에 대규모 항공 MRO 클러스터 조성…""연 5조 매출 기대""",https://www.news1.kr/local/incheon/6172129,"이곳에 약 1500억 원을 투자해 연면적 10만 1151㎡ 규모의 첨단 엔진·부품 정비 공장과 인프라를 구축한다는... 세부 설계를 거쳐 2029년 착공, 2031년 준공 및 본격 운영에 돌입할 계획이다. 윤백진 인천경제청장 대행... "
2026-05-20,네이버뉴스,KTX·SRT 천안아산역 인접 '천안아산역 그랑시티 필하우스 1블록' 6월 분...,http://www.ikld.kr/news/articleView.html?idxno=334739,"특히 지난해 착공한 충남국제전시컨벤션센터가 2027년 준공되면 기업 간 교류와 오픈이노베이션, 투자... 인근 불당지구의 생활 인프라도 이용이 가능하다. 우수한 교육여건도 눈여겨볼 부분이다. 단지 바로 앞에... "
2026-05-20,네이버뉴스,"경상북도, 신공항·국가산단 등 핵심 인프라 사업 추진 상황 점검 회의...",http://news.lghellovision.net/news/articleView.html?idxno=543221,경상북도가 '핵심 성장 인프라 추진 상황 점검 회의'를 개최했습니다. 19일 도청에서 열린 이번 회의는 경북의... 구체적으로는 대구경북신공항의 착공 방안과 배후도시 조성을 비롯해 국가산업단지 조성과 광역 교통망... 
2026-05-20,네이버뉴스,쿼드러플 역세권 현실화… 인덕원 집값이 움직인다,https://www.rcast.co.kr/news/articleView.html?idxno=30819,"안정성과 인프라를 함께 갖춘 현실적인 진입 선택지'로 꼽고 있습니다. 교통 호재는 통상 계획 발표, 착공, 개통의 세 단계에 걸쳐 가격에 반영되는 만큼, 착공이 본격화될수록 상승 압력이 높아질 수 있다는 분석이... "
2026-05-20,네이버뉴스,"“수도권 남부 교통 한계 달했다” 경기남부 지자체, 18만 시민 서명 안...",https://www.ekn.kr/web/view.php?key=20260520023386279,"조속한 착공을 공식 건의했다. 이번에 전달된 서명은 중부권 광역급행철도(JTX) 조기 착공 촉구 10만 5,445명... 광역교통 인프라가 시급하다는 입장이다. 성남시는 이외에도 지역 내 산적한 연계 교통 현안의 조속한 처리를... "
2026-05-20,네이버뉴스,"[6·3지선 인터뷰] 이원택 ""전북 경제 대전환…새만금·AI·재생에너지로...",https://www.newspim.com/news/view/20260520000071,공공의료 인프라 확충은 도민의 생명권과 직결된 가장 시급한 민생 과제다. 오랫동안 표류해 온 남원 국립의전원 설립은 더 이상 미룰 수 없는 시대적 과제이며 정부 및 국회와의 긴밀한 공조를 통해 법안 통과와 착공을... 
2026-05-20,네이버뉴스,"'보강된 사다리 vs 혁신적 설계'…오세훈·정원오, 청년 비전공약 '정면...",https://www.youthdaily.co.kr/news/article.html?no=219093,"정 후보는 주택 공급 부족을 시장 불안의 원인으로 보고 조기 착공을 전면에 내세웠다. 18일 공약 발표를... 구체적인 인프라 확충을 바탕으로 기존 시스템의 완성도를 높이는 데 주력했다면, 정 후보는 SH공사를 겨냥해... "
2026-05-20,네이버뉴스,"[아유경제_부동산] DL건설, 1268억 원 규모 '부천삼정AI허브센터' 수주",http://www.areyou.co.kr/news/articleView.html?idxno=93828,"총공사비는 1268억 원, 공사 기간은 26개월이다. '부천삼정AI허브센터'는 약 9.8㎽ 규모의 AI 연산 특화 데이터센터다. 유진그룹 계열 동양과 디씨플랫폼이 사업을 진행하는 민간 주도 AI 인프라 개발사업이다. DL건설은 AI... "
2026-05-20,네이버뉴스,반복되는 대방건설 꼼수 인상 논란…제도 취지 무색해진 '공공지원 민간...,https://www.newsinside.kr/news/articleView.html?idxno=4689965,"대방건설과 은평구청의 장기 소송으로 착공이 지연되는 동안 공사비·물가가 급등했고, 일반분양 대신 공공지원 민간임대 형태로 착공 허가를 받은 구조였다. 입주자협의회 관계자는 ""계약 과정에서 10년 동안 안정적... "
2026-05-20,네이버뉴스,"DL건설, 부천 AI 데이터센터 구축사업 수주",https://www.cnbizm.com/news/articleView.html?idxno=303448,"DL건설이 경기도 부천 지역에 들어서는 인공지능(AI) 데이터센터 구축사업을 수주했다. '부천 삼정 AI... 총공사비는 1268억원, 공사 기간은 26개월이다. 부천 삼정 AI 허브센터는 9.8㎿(메가와트) 규모의 AI 연산 특화... "
2026-05-20,네이버뉴스,"""'시간이 금' AI 인프라, 옥상서 통째로 조립한다""...용접 70% 없앤 DL건설...",https://www.insight.co.kr/news/554935,"이번 프로젝트는 부천시 오정구 삼정동 48-59, 61번지 일원에 건설되는 AI 연산 특화 데이터센터다. 건물 규모는 지하 2층부터 지상 4층까지 총 연면적 약 10,763㎡로 계획됐다. 총 공사비는 1,268억 원이며, 공사 기간은... "
2026-05-20,네이버뉴스,"DL건설, 부천 삼정 AI 허브센터 1268억원 수주",https://www.dt.co.kr/article/12063494?ref=naver,"공사비는 1268억원, 공사 기간은 26개월이다. DL건설은 AI 데이터센터 시장에서 조기 가동이 경쟁력을 좌우한다고 보고, 옥상층 주요 장비와 냉방 배관을 사전 모듈화하는 시공 전략을 적용할 계획이라고 밝혔다. 이를... "
2026-05-20,네이버뉴스,"DL건설, 연이은 데이터센터 성과로 AI 인프라 시장 주도",https://www.mk.co.kr/article/12053134,"DL건설은 ‘부천 삼정 인공지능(AI) 허브센터 신축공사’를 수주했다고 20일 밝혔다. ‘부천 삼정 AI... 총 공사비는 1268억원, 공사 기간은 26개월이다. 부천 삼정 AI 허브센터는 약 9.8MW 규모의 AI 연산 특화... "
2026-05-20,네이버뉴스,"DL건설, 부천 AI 특화 데이터센터 수주…1268억 규모",https://www.hankyung.com/article/202605208059i,"DL건설이 인공지능(AI)과 전력 인프라 산업 급성장에 따라 '미래 먹거리'로 주목받는 데이터센터를 잇달아... 총공사비는 1268억원 규모다, 공사 기간은 26개월이다. 부천 삼정 AI 허브센터는 약 9.8㎽ 규모의 AI 연산 특화... "
2026-05-20,네이버뉴스,평당 공사비 1370만원 등장…치솟는 정비사업 공사비,https://news.tf.co.kr/read/economy/2324582.htm,"한국건설기술연구원에 따르면 올해 3월 건설공사비지수는 134.42포인트(p)로 전월 대비 0.49%, 전년 동월 대비 2.53% 상승했다. 해당 지수는 7개월 연속 최고치를 경신 중이다. 해당 지표는 건설공사에 투입되는 재료비... "
2026-05-20,네이버뉴스,"DL건설, ‘공사비 1268억원’ 부천 삼정 AI 허브센터 수주",https://www.viva100.com/article/20260520500516,"DL건설은 ‘부천 삼정 AI 허브센터 신축공사’를 수주했다고 20일 밝혔다. 이번 사업은 경기도 부천시... 총 공사비는 1268억원이며, 공사 기간은 26개월이다. 부천 삼정 AI 허브센터는 약 9.8MW 규모의 AI 연산 특화... "
2026-05-20,네이버뉴스,"DL건설, 부천 데이터센터 수주로 디지털 사업 강화",https://www.pinpointnews.co.kr/news/articleView.html?idxno=454053,"DL건설은 경기 부천시 오정구 삼정동 일원에서 추진되는 '부천 삼정 AI 허브센터 신축공사'를 수주했다고 20일 밝혔다. 이번 사업은 지하 2층~지상 4층, 연면적 약 1만763㎡ 규모로 조성되며 총 공사비는 1268억원이다. 공사... "
2026-05-20,네이버뉴스,춘천 소양강 인근 ‘더 리치먼드 리버센트 소양’ 공급 예정… HUG 분양...,https://www.megaeconomy.co.kr/news/newsview.php?ncode=1065584159404550,"최근 부동산 시장에서는 공사비 상승과 금융시장 변동성 등의 영향으로 분양가뿐 아니라 사업 안정성과... 시행은 이재도시개발, 시공은 태원건설산업이 맡았으며 KB부동산신탁이 신탁 업무를 담당한다. 입지 측면에서는... "
2026-05-20,네이버뉴스,"DL건설, 데이터센터 4연속 수주…모듈러로 공기 단축",https://www.insightkorea.co.kr/news/articleView.html?idxno=246737,"공사비는 1268억원, 공사 기간은 26개월이다. 이 센터는 약 9.8MW 규모로 건립될 예정이다. 유진그룹 계열 (주)동양과 디씨플랫폼(주)이 사업을 진행한다. DL건설 시공을 맡는다. 회사는 상암 데이터센터, 가산 AI데이터센터... "
2026-05-20,네이버뉴스,"DL건설, 부천 삼정 AI 데이터센터 수주",https://www.fetv.co.kr/news/articleView.html?idxno=302754,총공사비는 1268억원이며 공사 기간은 26개월이다. 센터는 약 9.8MW 규모 AI 연산 특화 데이터센터로 조성된다. 사업은 동양과 디씨플랫폼이 추진하는 민간 개발사업이다. DL건설은 옥상 주요 장비와 냉방 배관을 사전... 
2026-05-20,네이버뉴스,"""데이터센터 시공역량 통했다""…DL건설, '부천 AI 허브센터' 수주",https://www.econovill.com/news/articleView.html?idxno=740478,20일 DL건설에 따르면 총 공사비 1268억원 규모의 경기도 '부천 삼정 AI 허브센터 신축공사'를 수주하는데 성공했다. 이번 결과는 기존 상암 데이터센터 등 3건을 포함한 네 번째 수주인 셈이다. 총 2년 2개월에 걸쳐... 
2026-05-20,네이버뉴스,구포 첫 정비사업 단지… ‘두산위브 트리니뷰 구명역’ 2순위 청약 진...,https://biz.heraldcorp.com/article/10741729?ref=naver,최근 건설 원가와 공사비 상승이 이어지는 가운데 정비사업 초기 공급 단지에 대한 관심도 이어지고 있다. 업계에서는 초기 공급 단지의 경우 후속 사업 대비 상대적으로 낮은 가격에 공급되는 사례가 많다고 보고 있다.... 
2026-05-20,네이버뉴스,"[이슈] 종합특검, 관저이전 의혹 줄구속 영장청구…26일 尹 '계엄 정당화...",https://www.polinews.co.kr/news/articleView.html?idxno=731738,"특검은 김 전 실장 등이 종합건설업 면허가 없는 21그램에 공사비를 지급하기 위해 행안부 예산을 불법 전용했다고 보고 있다. 예비비 14억 4000만 원만으로는 공사가 불가능한 상황에서, 공사를 먼저 시작한 뒤 예산을... "
2026-05-20,네이버뉴스,"DL건설, '부천 삼정 AI 허브센터' 수주...""AI 데이터센터 공략 확대""",http://www.kdfnews.com/news/articleView.html?idxno=183406,"DL건설은 '부천 삼정 AI 허브센터 신축공사'를 수주했다고 20일 밝혔다. 사업은 경기 부천시 오정구 삼정동 일원에 지하 2층~지상 4층, 연면적 약 1만763㎡ 규모로 조성된다. 총 공사비는 1268억원이며 공사 기간은... "
2026-05-20,네이버뉴스,"5대 금융지주 ""반도체 호황에 성장률 뛰었지만 경기 온도차 여전""",http://www.newsian.co.kr/news/articleView.html?idxno=89890,"하나금융 역시 2분기 국내 경제에 대해 반도체 경기 호황과 정부 경기부양책으로 급락 가능성은 제한적이지만, 건설투자는 공사비 인상과 재료 공급 차질 등으로 회복세가 약화될 가능성이 높다고 봤다. 금융시장... "
2026-05-20,네이버뉴스,"DL건설, 공사비 1268억원 규모 부천 삼정 AI 허브센터 수주",https://biz.heraldcorp.com/article/10741714?ref=naver,"20일 DL건설은 공사비는 1268억원 규모의 부천 삼정 AI 허브센터 신축공사를 수주했다고 밝혔다. 해당 사업은 경기도 부천시 오정구 삼정동 48-59, 61번지 일원에 지하 2층~지상 4층, 연면적 약 1만763㎡ 규모로... "
2026-05-20,네이버뉴스,"DL건설, 부천 삼정 AI 허브센터 수주…AI 인프라 시장 4번째 프로젝트",http://www.lawissue.co.kr/view.php?ud=20260520104922200367191f6c6e_12,"DL건설은 경기도 부천시 오정구 삼정동 일원에 지하 2층~지상 4층, 연면적 약 1만763㎡ 규모(총공사비 1268억원, 공기 26개월)의 ‘부천 삼정 AI 허브센터 신축공사’를 수주했다고 20일 밝혔다. 해당 센터는 약 9.8MW... "
2026-05-20,네이버뉴스,[박용준의 어부바] 다주택자 잡으려다 임차인 잡았다…전세 마르고 현장...,https://www.ajunews.com/view/20260520102950528,한국건설기술연구원이 집계하는 건설공사비지수는 2026년 1월 133.28로 2020년 1월(99.86) 대비 33.5% 올랐다. 단순 환산하면 2020년에 10억원 들던 공사가 지금은 13억3000만원이 드는 셈이다. 빌라·다세대·소형 오피스텔처럼... 
2026-05-20,네이버뉴스,"DL건설, 상암·가산 이어 부천 AI 데이터센터 수주…공사비 1268억",https://www.mt.co.kr/estate/2026/05/20/2026052009573891185,"DL건설은 경기 부천시 오정구에 들어서는 '부천 삼정 AI 허브센터 신축공사'를 수주했다고 20일 밝혔다. 이 사업은 지하 2층~지상 4층, 연면적 약 1만763㎡ 규모의 데이터센터를 조성하는 공사다. 총 공사비는 1268억원... "
2026-05-20,네이버뉴스,"DL건설, 부천 'AI 허브센터' 1268억원 수주… 9.8MW 규모",http://www.whitepaper.co.kr/news/articleView.html?idxno=262797,총공사비는 1268억원이며 공사 기간은 26개월이다. DL건설은 AI 데이터센터 시장에서 조기 가동이 핵심 경쟁력이라고 보고 옥상층 주요 장비와 냉방 배관을 사전 모듈화하는 전략을 적용할 예정이다. 이를 통해 용접... 
