date,source,title,link,description
2026-07-13,네이버뉴스,부동산 디벨로퍼로 새판 짜는 김동선… 강남 개발부지에 2367억 베팅,https://biz.chosun.com/stock/market_trend/2026/07/13/PI7Y3EHOEVCZXJW2EAI6NMBRAM/?utm_source=naver&utm_medium=original&utm_campaign=biz,이번에 확보한 부지는 포스코이앤씨가 주택문화관 ‘더샵갤러리’로 사용했던 곳이다. 이후 디벨로퍼 알비디케이(RBDK)가 초고급 주거 프로젝트인 ‘더피크 도산’을 추진했다. 도산공원 영구 조망이 가능한 입지에 지하... 
2026-07-13,네이버뉴스,"경북개발공사, 도청신도시에 726세대 규모 공공임대아파트 공급",https://www.hankyung.com/article/202607120231h,금호건설 컨소시엄(금호건설·포스코이앤씨·플러스종합건설)이 시공을 맡은 이번 사업은 경상북도 예천군 호명읍 산합리 1118 외 1개 필지에 들어선다고 공사가 13일 발표했다. 이번 사업은 경상북도가 추진 중인... 
2026-07-12,네이버뉴스,경북도청신도시 10년 만에 공공임대 공급,https://www.idaegu.co.kr/news/articleView.html?idxno=553626,"사업은 경북도개발공사가 발주하고 금호건설 컨소시엄(금호건설·포스코이앤씨·플러스종합건설)이 시공을 맡는다. 예천군 호명읍 산합리 1118번지 일원 2개 필지에 지하 3층~지상 최고 37층, 7개 동, 총 726세대 규모로... "
2026-07-12,네이버뉴스,경북도청 신도시 예천에 37층 공공임대아파트 726채 건립…67㎡·84㎡ 평...,https://view.asiae.co.kr/article/2026071221204184565,"경북개발공사가 추진하고 금호건설(주) 컨소시엄(금호건설·포스코이앤씨·플러스종합건설)이 시공을 맡은 이번 사업은 경북도 예천군 호명읍 산합리에 들어선다. 단지는 지하 3층~지상 최고 37층, 7개동, 총 726세대... "
2026-07-12,네이버뉴스,경북도청신도시 B-1BL 공공임대 승인…2029년 726가구 준공,https://www.kyongbuk.co.kr/news/articleView.html?idxno=4078123,"시공은 금호건설 컨소시엄(금호건설·포스코이앤씨·플러스종합건설)이 맡으며, 2027년 초 착공해 2029년 준공을 목표로 한다. 공급 주택은 전용면적 67㎡와 84㎡의 중소형 평형으로 구성된다. 67㎡A 163가구, 67㎡B 109가구, 84... "
2026-07-12,네이버뉴스,[지령 10000호 특집] 창간 35주년·지령 10000호 축하해주신 분들,https://www.joongboo.com/news/articleView.html?idxno=363731224,권정록 포스코이앤씨 커뮤니케이션실 상무 엄범식 농협중앙회 경기본부 본부장 김성록 NH농협은행 경기본부 본부장 최원준 NH농협은행 인천본부 본부장 장주익 수원화성오산축산업협동조합 조합장 정상혁 신한은행... 
2026-07-12,네이버뉴스,"경북도청신도시, 주택 공급 가뭄 해소",https://www.kbsm.net/news/view.php?idx=526432,"시공은 금호건설·포스코이앤씨·플러스종합건설 컨소시엄이 맡는다. 전용면적 67㎡·84㎡ 중소형 4개 타입으로 구성되며, 공급 유형은 10년 분양전환형 공공임대아파트다. 1층 세대 사생활 보호를 위한 관통형... "
2026-07-12,네이버뉴스,"‘10년 공급 가뭄’ 끝낸 경북도청신도시, 37층 랜드마크로 주거지도 바...",http://www.breaknews.com/1221078,"시공은 금호건설과 포스코이앤씨, 플러스종합건설이 참여한 컨소시엄이 맡는다. 수요자 선호도가 높은 전용면적 67㎡와 84㎡의 중소형 평형으로만 구성됐으며, 세부적으로는 총 4개 타입으로 나뉜다. 특히 이번 공급은... "
2026-07-12,네이버뉴스,"경북도청신도시에 10년 만에 아파트 공급…최고 37층, 새로운 스카이라...",https://www.munhwa.com/article/11602045?ref=naver,"경북도개발공사가 추진하고 금호건설 컨소시엄(금호건설·포스코이앤씨·플러스종합건설)이 시공을 맡는다. 단지는 예천군 호명읍 산합리 1118 외 1개 필지에 들어서며 지하 3층~지상 최고 37층, 7개 동, 총 726가구 규모다.... "
2026-07-13,네이버뉴스,[의원님은 수주왕][단독]실적도 없었는데 당선 후 ‘싹쓸이’···군수...,https://www.khan.co.kr/article/202607130600131,"사업을 수주했다. C사가 진입한 이후 영양군에서 ‘데크’가 사업명에 들어가는 수의계약을 모두 추려보니, 전체 계약액에서 C사가 52.1%를 차지한 것으로 나타났다. D건설사는 오 군수의 재임 기간에 205건... "
2026-07-13,네이버뉴스,"우미건설, 강원도 분양 1위…제주는 태왕이앤씨 선두 [이 지역 분양왕-...",https://www.fntimes.com/html/view.php?ud=202607110025171416dd55077bc2_18,지역별 사업지수와 분양가구수(컨소시엄의 경우 각 건설사 분양수에 포함)를 중심으로 건설사 실적을 비교한다. 대형사와 중견사의 수주 양상과 사업 포트폴리오도 함께 분석한다. 이를 통해 건설사들이 어느 지역에서... 
2026-07-12,네이버뉴스,공공기관 연료전지 설치 근거 사라져…中企 ‘발주 절벽’ 공포,https://www.sedaily.com/article/20066743?ref=naver,"연료전지 부품기업인 디알퓨얼셀의 박달영 대표는 “건물용 연료전지 시장은 설계 반영 여부가 곧 수주로 이어지는 구조”라며 “설계사무소와 친환경 컨설팅사, 건설사는 제도적 불확실성이 감지되는 순간 설계 반영을... "
2026-07-12,네이버뉴스,금호타이어 왜 상한기 쳤나 했더니...반도체 클러스터 수혜주,https://www.mk.co.kr/article/12096472,특히 금호건설·전기가 플랜트·데이터센터·전력망 관련 공사를 대거 수주한다는 기대는 근거가 부족하다고 지적했다. 오히려 대형 건설사가 사업을 맡을 가능성이 커 금호건설이 직접 수혜를 볼 가능성은 적다고... 
2026-07-12,네이버뉴스,"㈜서한, ‘상생·워라밸’ 두 토끼 잡았다…지역 건설업계 ‘독보적 행...",http://www.breaknews.com/1221077,"이번 최우수 등급 획득으로 서한은 조달청 공공입찰 참가자격 사전심사(PQ) 가점 부여, 시공능력평가액 6% 가산, 건설산업기본법상 벌점 0.5점 감경 등 향후 수주 시장에서 강력한 제도적 인센티브를 확보하게 됐다. 서한의... "
2026-07-13,네이버뉴스,"양천구, 목동 재건축 대비 '100년 하수도 재설계'…설계 용역 32억 투입",https://view.asiae.co.kr/article/2026071308060008846,"6단지는 지난달 시공사를 선정했다. 이기재 양천구청장은 ""목동아파트 재건축은 양천구의 미래를 좌우할 중요한 사업인 만큼 눈에 보이지 않는 기반시설인 하수도 역시 미래 수요를 충분히 반영해 계획적으로... "
2026-07-13,네이버뉴스,"양천구, 목동 재건축 대비 '100년 하수도 체계' 구축한다",https://www.yna.co.kr/view/AKR20260713010600004?input=1195m,"사업시행자 지정을 마쳤고, 조합방식으로 추진 중인 6개 단지(3·4·6·7·8·12단지) 가운데 5개 단지가 조합설립을 완료했다. 6단지는 지난달 시공사를 선정하는 등 본격적인 실행단계에 들어섰다."
2026-07-13,네이버뉴스,"삼성전자, 용인 첫 반도체공장 2029년 조기가동…AI 반도체 '속도전'",https://www.econovill.com/news/articleView.html?idxno=744967,"토지 보상과 지장물 철거, 시공사 선정 등 후속 절차도 일정에 맞춰 속도를 낼 것으로 전망된다. 관건은 전력과 용수 등 핵심 인프라 구축이다. 정부는 3기가와트(GW) 규모 액화천연가스(LNG) 발전소 조기 착공과 전력... "
2026-07-13,네이버뉴스,"삼성전자, 용인 첫 반도체 공장 2029년 가동 추진",https://www.ebn.co.kr/news/articleView.html?idxno=1716038,"최첨단 반도체 공장 건설에 통상 2년가량 소요되는 만큼 토지·지장물 보상, 수용 재결, 시공사 선정 등 후속 절차도 차질 없이 진행돼야 한다. 변수는 전력과 용수다. 반도체 팹은 막대한 전력과 초순수를 필요로 하는... "
2026-07-13,네이버뉴스,"완도-강진 고속도로 건설사업, 연말 설계 발주 ‘청신호’",https://www.dnews.co.kr/uhtml/view.jsp?idxno=202607121055122080806,"환경영향평가 협의가 마무리되면 기본ㆍ실시설계와 시공사 선정 등을 진행할 계획이다. 착공 목표 시점은 2028년이다. 관련 업계는 설명회 이후 환경 부처와의 협의가 원만하게 진행돼 최종 결과가 도출되면, 올해... "
2026-07-13,네이버뉴스,코리아신탁 이어 교보신탁도…수수료 장사하던 신탁계 줄희망퇴직 위기,https://realty.chosun.com/site/data/html_dir/2026/07/10/2026071001163.html,"앞으로 코리아신탁은 경영위원회 심의를 통해 대상자를 최종 선정한 뒤, 확정된 퇴직자는 이달 중... 또 시공사가 책임준공에 실패하거나 토지·인허가·소송 관련 문제가 터지는 경우에도 대금을 제 때 회수하지... "
2026-07-13,네이버뉴스,[파워인터뷰] 장영호 부동산마케팅협회장 “지방 미분양 해소ㆍ오피스...,https://www.dnews.co.kr/uhtml/view.jsp?idxno=202607120444007410793,"국토교통부 산하 사단법인 한국부동산마케팅협회에는 시공사 등으로부터 분양대행 일감을 맡아, 사업 초기... 장 회장은 “지난 2024년부터 서울시 매력일자리사업 운영기관으로 3년 연속 선정돼 누적 87명의 청년... "
2026-07-13,네이버뉴스,[대한도시정비포럼 전문위원 칼럼] 공사비 갈등의 해법은 ‘시공사 선정...,https://www.dnews.co.kr/uhtml/view.jsp?idxno=202606201944431040075,갈등 해소를 위한 시공사 선정 기준이 중요해지는 이유다. 주거환경연구원의 보고서에 따르면 2021년 서울지역 평균 3.3㎡당 공사비는 530만원 수준이었다. 그런데 불과 4년 만인 지난해 890만원으로 약 70%나 급등했다.... 
2026-07-13,네이버뉴스,[출근길 포인트] 삼성전자 용인 반도체 공장 1∼2년 앞당겨 2029년 첫 가...,https://www.pointdaily.co.kr/news/articleView.html?idxno=311534,"통상 최첨단 반도체 공장 건설에 2년가량 소요되는 만큼 이를 위해서는 부지 조성과 토지·지장물 보상, 수용 재결, 시공사 선정 등 후속 절차도 차질 없이 진행돼야 한다는 설명이다. 특히 정부가 용인 국가산단 조성... "
2026-07-12,네이버뉴스,[스트레이트] '벼랑 끝' 지역주택조합,https://imnews.imbc.com/replay/straight/6836865_28993.html,""" 지역주택조합은 조합원 모집부터 토지확보, 인허가, 시공사 선정 등을 시행사가 아닌 조합이 직접 해야 하지만, 현실적으로 직접 하기 어려워 거의 100% 업무대행사를 선정해 대행시킵니다. 사업이 무산된 부산 장림... "
2026-07-12,네이버뉴스,"삼성전자, 용인 반도체 공장 가동 시점 1~2년 앞당긴다",https://www.newspim.com/news/view/20260712000024,"때문에 부지 조성과 토지·지장물 보상, 수용 재결, 시공사 선정 등 후속 절차도 차질 없이 진행될 것으로 전망된다. 정부가 용인 국가산단 조성 기간 단축 의지를 밝힌 만큼 용인 산단의 전력과 용수 등 핵심 인프라... "
2026-07-12,네이버뉴스,"삼성전자 용인 반도체 1기 팹, 2년 앞당겨 2029년 가동한다",https://www.kyeongin.com/article/1767165,"이를 위해선 부지 조성을 비롯해 토지·지장물 보상, 수용 재결, 시공사 선정 등 후속 절차 등 모든 일정이 차질 없이 진행돼야 한다. 일단 이성훈 LH 신임 사장은 용인 국가산단 사업현장을 방문해 사업 추진 현황 및... "
2026-07-12,네이버뉴스,전세 공급 절벽속 영통 8단지 ‘이주 대란’,https://www.kyeongin.com/article/1767157,"보통 사업계획승인을 받은 이후에는 선정된 시공사와 공사비 확정, 조합원 분담금 확정 총회 등의 절차를 거친다. 통상적으로 조율 과정이 15개월 가량 걸리는데, 해당 조합 또한 시공사와 공사비 갈등을 겪으며... "
2026-07-12,네이버뉴스,"[인천시 소식] '서울7호선 청라연장 관련 주민간담회' 개최, 2026년 문화...",http://www.bizwnews.com/news/articleView.html?idxno=140472,"박 시자은 앞서 10일 공사 현장을 방문해 시공사 현장소장 및 건설사업관리단 등 관계자들과 간담회를 갖고... 최종 선정됐다고 12일 밝혔다. ◆인천시, 2026년 문화선도산단 공모 최종 선정…587억 투입 '남동 WINGS' 본격... "
2026-07-12,네이버뉴스,삼성 용인 클러스터 첫 가동 2년 당긴다,https://www.hankyung.com/article/2026071202691,"이에 따라 토지 보상, 지장물 철거, 시공사 선정 등 후속 행정 절차도 빠르게 이뤄질 것으로 전망된다. 관건은 전력과 용수 등 핵심 인프라의 적기 구축이다. 정부는 3기가와트(GW) 규모 액화천연가스(LNG) 발전소 조기... "
2026-07-12,네이버뉴스,삼성 용인 반도체공장 2029년 첫 가동,https://www.mk.co.kr/article/12096543,"최첨단 반도체 공장 건설에 통상 2년가량이 소요되는 만큼 토지 보상과 지장물 이전, 수용 재결, 시공사 선정 등 후속 절차도 일정에 맞춰 진행돼야 한다는 분석이다. 전력과 용수 등 핵심 인프라 구축 일정도 함께... "
2026-07-12,네이버뉴스,용인 반도체 국가산단 팹 1~2년 앞당겨 가동,https://www.incheonilbo.com/news/articleView.html?idxno=1327122,"다만 2027년 착공을 위해서는 수용 재결, 시공사 선정 등 후속 조치가 차질 없이 이뤄져야 한다. 정부가 용인 국가산단 조성 기간 단축 의지를 내비친 만큼 3GW 규모 액화 천연가스(LNG) 발전소 조기 착공, 2·3단계 전력... "
2026-07-12,네이버뉴스,"삼성, 용인 반도체 승부수 앞당긴다…첫 공장 2029년 가동 추진",https://www.socialvalue.kr/news/view/1065599618247775,"통상 최첨단 반도체 공장을 건설하는 데 약 2년이 걸리는 점을 고려하면 토지와 지장물 보상, 수용재결, 시공사 선정 등 후속 절차가 차질 없이 진행돼야 2029년 가동 목표를 달성할 수 있다는 설명이다. 전력과 용수 등... "
2026-07-12,네이버뉴스,"웨이퍼 생산 월 100만장 시대 오나…삼성전자, 용인 팹 가동 앞당긴 배...",https://www.ekn.kr/web/view.php?key=20260712021081619,"통상 최첨단 반도체 공장 건설에 2년가량 소요되는 만큼 부지 조성과 토지·지장물 보상, 수용 재결, 시공사 선정 등 후속 절차도 차질 없이 진행돼야 한다는 설명이다. 특히 전력·용수 등 핵심 인프라 공급 일정 역시... "
2026-07-12,네이버뉴스,"""서울 집값만 중요한가""…대토론회서 지방 해법도 다뤄야",https://www.daejonilbo.com/news/articleView.html?idxno=2287466,시공사 선정에 어려움을 겪거나 조합원 분담금 부담이 커지면서 사업 일정이 늦어지는 정비사업장도 나타나고 있다. 실제 대전 서구 내동2구역은 지난달 시공사 선정을 위한 1차 현장설명회를 열었지만 참여 업체... 
2026-07-12,네이버뉴스,[기획] 김천 '깔따구 잔혹사' 끊는다,https://www.idaegu.com/news/articleView.html?idxno=664269,시는 앞으로 각종 까다로운 인허가 절차와 관계기관 협의를 차질 없이 진행한 뒤 시공사를 선정해 조속히 공사에 착공할 방침이다. 최종 준공 목표는 2032년이다. 80년 된 낡은 허물을 벗고 지좌동에서 새롭게 태어날... 
2026-07-13,네이버뉴스,"IPARK현산, 태평3구역 품었다…올 마수걸이 수주",https://www.dnews.co.kr/uhtml/view.jsp?idxno=202607101423195660711,공공재개발사업의 시공사로 IPARK현대산업개발이 확정됐다. 코오롱글로벌과의 컨소시엄 형태다. 12일... 당장 광명 하안주공 6·7단지 재건축에서는 글로벌 설계사 겐슬러(Gensler)와의 협업을 확정하며 한발 앞서... 
2026-07-12,네이버뉴스,"은마 재건축, 속도 붙었다…진짜 고비는 이제부터",https://www.sisajournal.com/news/articleView.html?idxno=379168,은마아파트 재건축 사업이 오세훈 서울시장의 행정 지원 속에 사업시행 인가 문턱을 넘었지만 후속 절차가... 서울 전역으로 넓히면 사업성이 낮아 시공사조차 구하지 못하는 단지도 적지 않다. 행정 절차를 줄이더라도... 
2026-07-13,네이버뉴스,폭염에 AI까지…'열 받은 지구' 식히는 삼성·LG 전략은,https://www.nocutnews.co.kr/news/6546558?utm_source=naver&utm_medium=article&utm_campaign=20260713050108,실제로 LG전자의 지난해 데이터센터향(向) 칠러 수주 실적은 전년 대비 3배 수준으로 성장했다. 앞서... 또 영국 콘월 '웨스트 카클레이즈 가든 빌리지' 재개발 프로젝트에도 고효율 히트펌프 공조 솔루션을... 
2026-07-13,네이버뉴스,"한강변 재건축, 높이보다 '열린 경관'이 중요한 이유 [더 머니이스트-최...",https://www.hankyung.com/article/202607071271Q,"그 결과 한강변 재개발·재건축 구역에서는 60층 이상 초고층 계획도 속속 나오고 있습니다. 강남구... 성수전략정비구역 4지구는 최고 64층, 1439가구 규모 계획으로 통합심의를 통과했습니다. 압구정2구역도 최고 66층... "
2026-07-13,네이버뉴스,"강훈식 ""300채 가진 사람 세금 면제 놀라워…주택 공급이 최우선""",https://www.news1.kr/politics/president/6225629,"신규 원전 건설 필요성이 제기되는 데 대해선 ""11차 전력수급기본계획을 기준으로 2030년까지 원전으로만 29기가와트(GW)가 확보될 예정이고, 2030년까지 재생에너지 기준으로 100GW를 저희가 준비하고 있다. 그것만 해도... "
2026-07-13,네이버뉴스,[논단] WTO체제의 종말···한국건설엔 새 도전의 기회,https://www.koscaj.com/news/articleView.html?idxno=325182,클레임을 비롯한 각종 법적 분쟁의 일상화와 만성적인 건설기술인력 및 숙련기능인력 부족 문제도 심각하다. 이제 미국은 원천기술과 특허를 갖고 있어도 자국인력만으로는 더 이상 원전이나 첨단 반도체 공장을 짓기... 
2026-07-13,네이버뉴스,"AI 전력난 키운 기회…두산에너빌리티, 수주기반 확대 박차",https://www.ngetnews.com/news/articleView.html?idxno=551465,"경북 울진에 건설되는 APR1400 원전 2기에 원자로와 증기발생기, 터빈발전기 등 핵심 기자재를 공급한다. 국내와 해외 원전 사업이 함께 진행되면서 축적한 주기기 제작 역량이 다시 수주로 이어지는 선순환도 이어지고... "
2026-07-13,네이버뉴스,[유신모의 외교포커스] 난항 겪는 '한·미 원자력 협상'...신뢰 회복이 ...,https://www.newspim.com/news/view/20260713000005,미국 원전 기업 웨스팅하우스와 한국수력원자력은 체코의 두코바니에 건설하기로 한 신규 원전의 원자로 APR-1400의 원천 기술을 놓고 법적 분쟁을 벌였다. 웨스팅하우스는 자신들이 특허권을 갖고 있는 시스템80 기술이 APR... 
2026-07-13,네이버뉴스,"돌고 돌아 다시 원전, 메가프로젝트 마지막 퍼즐",https://weekly.khan.co.kr/article/202607130600031,정부는 기존의 재생에너지 기저전력으로 신규 원전 건설을 공식화했다. 주무 장관인 김성환 기후에너지환경부(기후부) 장관은 “전남광주(통합특별시) 영광 한빛원전 부지와 울산시 울주 (새울)원전 부지에 2기씩 더... 
2026-07-13,네이버뉴스,"[논현논단-홍준형 칼럼] 메가프로젝트, 대승적으로 풀어야 한다",https://www.etoday.co.kr/news/view/2602818,"기저전력 확보를 위한 원전, 액화천연가스(LNG) (LNG) 열병합발전 증설, 용수문제 해결을 위한 댐 활용·증설... 이처럼 혼종성을 띤 국가정책들은 대놓고 반대하기 어렵고 건설적 비판이나 비판적 침묵 이외에 마땅한 대안이... "
2026-07-12,네이버뉴스,[朝鮮칼럼] 전남광주시의 반도체 공장이 성공하려면,https://www.chosun.com/opinion/chosun_column/2026/07/12/IILIGA6IQNBOTM3DVQJWBZGY6A/?utm_source=naver&utm_medium=referral&utm_campaign=naver-news,"영광에 2기, 울주에 2기 원전을 더 지을 수 있는 땅이 있으니 통상 13~15년 걸리는 원전 건설 기간을 7년으로 앞당길 수 있다”는 기후에너지환경부 장관의 발언은 에너지를 기후부 소관으로 한 이후 나라 경제 전체를... "
2026-07-12,네이버뉴스,울산시의회 원구성 후 첫 상임위 활동 돌입,https://www.ulsanpress.net/news/articleView.html?idxno=579005,"산업건설위원회는 경제산업실과 울산테크노파크, 울산정보산업진흥원의 업무보고를 받고 △농수산물도매시장 이전과 울산공업축제 △부유식 해상풍력 △신규 원전 유치 △북극항로 전략 등을 점검했다. 위원들은... "
2026-07-12,네이버뉴스,“반도체 때문에” 탈원전→감축…기후부의 ‘원전 변심’,https://www.khan.co.kr/article/202607122121005,"대통령 회견선 “현실성 없다”더니…정부, 원전 확대 논의 속도 12차 전기본 수정 불가피…환경단체들 “기후부가 기업 지원 부처 전락” 김 장관이 최근 들어 추가 원전 건설 검토 가능성까지 거론하자 그가 강조한... "
2026-07-12,네이버뉴스,"삼성·SK 광주 반도체 용수, 수몰민과 온배수 문제가 관건",http://www.kwangju.co.kr/article.php?aid=1783854630801168277,또 안정적인 전력 공급을 위한 한빛원전 신규 원전 2기 건설에 따른 온배수 문제를 점검하기 위해 기후환경에너지부는 오는 21일께 영광을 찾을 예정이다. 현재 정부 안팎에서는 온배수가 기존보다 30%가량 늘어날 수 있고... 
2026-07-12,네이버뉴스,"‘광주 반도체 전력공급’…한전, 4년 내 안정적 기반 조성",http://www.kwangju.co.kr/article.php?aid=1783852800801162005,적기 건설을 위한 ‘전력공급 방안’이 논의되고 있다. 한전은 이를 위해 4개 분과 15개 단·처·실로 구성된... 이 자료를 보면 현재 이 지역은 한빛원전(6기·5.9GW)과 재생에너지를 통해 풍부한 발전원을 바탕으로 대규모... 
2026-07-12,네이버뉴스,[경남신문을 읽고] ‘SMR 원전 사설’ 균형감 부족 유감- 박종권(경남기...,http://www.knnews.co.kr/news/articleView.php?idxno=1546206,"원전을 찬성하거나 인공지능을 위한 데이터센터의 폭발적인 전력 수요 증가에 따라 원전 건설이 불가피하다는 주장을 할 수 있고, 실제로 지역 국회의원이 원전 예산 확대를 주장하기도 한다. 그러나 원전 주장은 이... "
2026-07-12,네이버뉴스,"울산시의회 ""문화·관광사업, 행정 연속성 고려해야""",http://www.ujeil.com/news/articleView.html?idxno=388700,"지난 10일 시의회산업건설위원회는 경제산업실 울산테크노파크 울산정보산업진흥원 소관 2026년도... 위원들은 부유식 해상풍력 발전단지의 경제성과 시민 편익, 북구 제2농수산물도매시장 이전 문제, 신규 원전 유치... "
2026-07-12,네이버뉴스,AI가 국가생존 결정한다… 에너지·노동시장까지 전방위 영향 [글로벌 리...,http://www.fnnews.com/news/202607121840308761,"노동시장에서도 데이터센터 건설과 발전설비 분야의 기술직 수요는 증가하는 반면, 화이트칼라 직군의... 전력망 병목 현상이 심화되자 소형모듈원전(SMR)을 활용한 독립형 데이터센터 구축도 새로운 대안으로... "
2026-07-12,네이버뉴스,"[기획취재] AI 시대 포항의 미래 잇는 전력망…송전선로 갈등, 어디로 가...",https://www.dkilbo.com/news/articleView.html?idxno=548410,신동선 기자 포항 신영일변전소에서 영덕을 연결하는 국가 송전선로 건설사업이 중대한 갈림길에 섰다.... 영덕 원전과 동해안 풍력단지 등 신재생 발전설비에서 생산되는 전력을 국가 전력망과 유기적으로 연결하기 위한... 
2026-07-12,네이버뉴스,‘탈원전’ 접고 ‘감원전’ 접고 ‘원전 증설’로 향하나···“재생에...,https://www.khan.co.kr/article/202607121714001,"‘정기국회 전 추가 원전 건설계획이 나올 수 있냐’는 진행자의 질문에는 “그렇다”고 답했다. 전남광주통합특별시 영광군에 2기, 울산 울주군에 2기 등 총 4기의 대형 원전을 더 지을 수 있는 땅이 있다며 추가 원전... "
2026-07-12,네이버뉴스,[지평선] '휘발적' 대한민국,https://www.hankookilbo.com/news/article/A2026071119570001283?did=NA,"환율, 부동산(대출 규제·세제 개편), 산업·환경(원전과 댐 건설), 안보(사관학교 통합), 치안(보완수사권) 등 민생 전반의 정책 예측성도 낮아졌다. 신임 총리와 합리적 국무조정실장의 기용을 계기로 안정적 기조로의... "
