date,source,title,link,description
2026-04-18,네이버뉴스,[주간증시전망] 다음 주 코스피 5700~6400⋯SK하닉 실적에 쏠린 시선,https://www.etoday.co.kr/news/view/2576653,"선언으로 리스크가 확대되는 듯했으나, 양측의 접촉이 지속하며 2차 협상 기대감이 빠르게 높아진 점이... 또한 미국과 이란의 휴전 기대감에 '중동 재건' 키워드가 떠오르며 건설 업종의 상승세를 이끌었다. 반면... "
2026-04-18,네이버뉴스,"美 백악관, 달 핵 발전소·핵 추진 우주선 등 '우주 개발 프로젝트' 공식...",https://www.theguru.co.kr/news/article.html?no=100704,"핵 에너지 기반 추진 시스템도 발사  미국 백악관이 달 핵 발전소 건설, 핵 추진 우주선 발사 등의... 또한 백악관 주도로 정부 각 부처와 연구소가 참가해 리스크를 분산하고, 효율성을 높인다는 계획이다.... "
2026-04-18,네이버뉴스,에너지 시장에는 왜 ‘토스’가 없는가 [스페셜리스트뷰],https://economist.co.kr/article/view/ecn202604110016,정보는 감춰져 있고 리스크는 오롯이 구매자의 몫이다. 재생에너지 확대 국면인데도 현장의 체감이 이처럼... 건설이 끝나면 운용 주체가 사실상 고정되고 참여자는 제한되며 구조는 경직된다. 시장 참여자들이 이... 
2026-04-18,네이버뉴스,"""천안 외곽순환도로 '성거~목천' 첫 단추""…총사업비 심의 통과로 9월 착...",https://www.bzeronews.com/news/articleView.html?idxno=816258,◇ 총사업비 심의 통과…착공 지연 리스크 해소 더불어민주당 문진석 의원(천안 갑)은 17일 천안 외곽순환도로의 한 축인 성거~목천 국도 건설사업이 기획예산처 총사업비 심의를 통과한 데 대해 환영의 뜻을 밝혔다. 이번... 
2026-04-18,네이버뉴스,"주택 신규수주 접은 현대엔지니어링, 플랜트·에너지로 인력 재편",https://www.newspim.com/news/view/20260417000822,"한 건설업계 관계자는 ""현대엔지니어링의 이번 인력 재배치는 단순한 인원 감축을 넘어 엔지니어링 기술력 중심의 에너지 기업으로 연착륙하겠다는 명확한 시그널""이라며 ""국내 부동산 리스크를 털어내고 수익성 높은... "
2026-04-18,네이버뉴스,"[주간증시전망] 중동 리스크 완화·실적 시즌 본격화…""랠리 속 되돌림...",https://www.ajunews.com/view/20260418002115336,"[사진=연합뉴스] 다음 주 국내 증시는 중동 지정학적 리스크 완화 기대와 함께 본격적인 실적 시즌 진입이... 중동 재건 기대감이 반영된 건설 업종 역시 상승 모멘텀을 확보했다. 반면 자동차, 미디어 등 일부 업종은... "
2026-04-18,네이버뉴스,전쟁터는 '호르무즈' 전략실은 '서울'… 로펌들 통상자문 영역 커졌다,https://www.lawtimes.co.kr/news/articleView.html?idxno=219550,"기업들이 원유 수급 차질과 제재 리스크 대응에 나서면서, 과거 WTO 분쟁이나 FTA 해석 중심이던 통상 자문이... 한편 건설·플랜트 업계는 향후 중동 재건 사업 발주 가능성을 주시하면서 로펌에 관련 자문을 요청하는... "
2026-04-18,네이버뉴스,"달 핵분열 원자로 2030년 발사…미국, 20㎾급 개발 착수",https://www.g-enews.com/view.php?ud=202604172329263012bd56fbc3c_1,"여기에 비용·일정 리스크가 낮을 경우 1㎾e급 저출력 원자로도 병행 개발하되, 장기적으로는 적어도... 러시아와 중국 역시 2030년대 달 핵기지 건설을 추진 중이다. UAH 추진 로켓 과학자 제이슨 캐시브리(Jason... "
2026-04-18,네이버뉴스,[GAM] 보이저 테크놀로지스 ② 스타랩 상업용 우주정거장 개발 선도,https://www.newspim.com/news/view/20260418000004,1998년 건설을 시작해 30년에 가까운 운영 기간을 보내온 ISS는 이제 노후화의 기로에 서 있다. 러시아 측... 리스크 요인으로는 스타랩의 개발 일정 지연 가능성이 가장 크다. 스타십의 상업적 운용 시점과 정부의... 
2026-04-18,네이버뉴스,"한화투자 ""적자 탈출 임박…자이에스앤디 턴어라운드 신호""",https://www.pinpointnews.co.kr/news/articleView.html?idxno=446428,건설 경기 불확실성이 이어지는 가운데 자이에스앤디가 실적 반등의 초입에 들어섰다는 평가가 나온다.... 주택 부문 리스크도 상당 부분 해소된 것으로 평가된다. 지난해 4분기 대손상각비 반영이 마무리되면서 추가적인... 
2026-04-18,네이버뉴스,"실행 중심 전략, 혁신 역량으로 위기속 도약…제주개발공사·코리아에프...",https://www.joongang.co.kr/article/25421148,"기후 리스크 관리, 인구구조 변화 대응 전략 등이 주요 변수로 작용했다. 이에 따라 선정된 기업들이... 백상산업개발은 울산 지역에서 아파트 내외장 도장, 방수, 석공사, 지반조성·포장공사 등 건설 분야와 시설... "
2026-04-17,네이버뉴스,"[이슈] 李대통령, 홍준표와 비공개 막걸리 오찬…靑 ""통합 행보"" 지선앞...",https://www.polinews.co.kr/news/articleView.html?idxno=728795,"군공항의 건설은 대구시와 국방부가, 민간공항 건설은 국토교통부가 맡고 있다. 홍 전 시장은 이날 대통령과... 홍 전 시장은 기소가 안 됐다. 사법 리스크를 막아달라는 논의도 있을 수 있다""고 덧붙였다. [폴리뉴스 ]"
2026-04-17,네이버뉴스,"'노란봉투법' 시행 한 달…재계, '진퇴양난' 속 리스크 보완 명확한 '가...",https://www.kfenews.co.kr/news/articleView.html?idxno=657024,이 모호한 '실질적 지배력'이라는 문구가 ▲대형 제조사 ▲건설사 ▲IT 플랫폼 기업들을 한꺼번에 교섭... 있는 리스크가 생길까 봐 노심초사하고 있다. 말 그대로 앞뒤가 막힌 진퇴양난의 상황에 놓인 것이다. 기업들이 선뜻... 
2026-04-17,네이버뉴스,"""홍수 나면 자동지급""…보험도 '확률'로 설계",https://www.hankyung.com/article/2026041789351,AI용 데이터센터 하나를 짓는 데 100억~200억달러에 달하는 투자비가 필요하지만 건설 및 운영 관련 리스크는 아직 계량화되지 않았다. 냉각수를 확보하기 위해 해안가에 건설한 데이터센터가 강력한 태풍 피해로 상당한... 
2026-04-17,네이버뉴스,"[단독] AI발 초고압 케이블 호황…LS, 베트남공장 더 짓는다",https://www.mk.co.kr/article/12020208,E1은 베트남 LPG 터미널 건설을 기반으로 현지 진출을 추진하고 있다. 베트남 꽝닌성에 있는 해당 터미널은... 지정학적 리스크가 커지는 상황에서 중국 일변도 공급망에서 벗어나 신성장 동력을 마련하겠다는... 
2026-04-17,네이버뉴스,"서경란의 중소기업 정책설명서(6) ""안전은 아껴야 할 비용 아닌 파산 막...",https://news.ifm.kr/news/articleView.html?idxno=469163,그런데 역설적으로 바로 이런 불황기에 안전을 놓치게 되면 비용 절감이 아니라 회사의 존폐 리스크까지... 실제 사례를 보면 경기도 안성의 공사 현장 붕괴 사고와 관련해서 건설사 대표이사가 징역형이 선고가... 
2026-04-17,네이버뉴스,"코레일, 여름철 이상기후 대응 ‘선제 강화’",http://amenews.kr/news/view.php?idx=66395,"코레일(사장 김태승)이 기후변화로 심화되는 여름철 재난 리스크에 대응해 현장 중심의 선제적 안전관리... 아울러 강풍에 대비해 선로 주변 건설장비 전도 방지 점검을 실시하고, 수목과 승강장 안내표지 등 낙하... "
2026-04-17,네이버뉴스,[캐피탈사 돋보기] [키움캐피탈] 키움증권 자본 수혈 지속...'연쇄 타격...,https://www.topdaily.kr/articles/109729,"국토교통부에 따르면 지난달 건설업 폐업 신고는 345건으로 전월 대비 5.5% 증가했다. 신현송 한국은행 총재 후보자는 ""중동 리스크가 계속돼 근원물가 상승 등 파급효과가 있으면 통화정책을 써야 한다""고 밝혔다.... "
2026-04-17,네이버뉴스,"6·3 재보선, 최대 15곳이면 '미니 총선'…이재명 중간평가 성격도",https://www.ntoday.co.kr/news/articleView.html?idxno=126612,세림조경건설 대표와 박상군 전 금융권 인사가 공천을 신청했다. 충남 아산을은 강훈식 비서실장 사퇴로... 김용 전 부원장의 경우 평택을 안산갑 등지에서 중복 거명되고 있지만 당 일각에서 '사법리스크를 안고 선거를... 
2026-04-17,네이버뉴스,"오토데스크-두산에너빌리티, 글로벌 EPC 현장 ‘종이 도면’ 없앤다",https://www.hellot.net/news/article.html?no=112156,(EPC) 건설 현장의 디지털 전환(DX) 가속화를 위한 파트너십을 맺었다. 이번 협약은 프로젝트 규모가 크고... 여기에 모든 데이터는 클라우드에 실시간 저장돼 리스크 대응력을 높인다. 오찬주 오토데스크코리아 대표는... 
2026-04-17,네이버뉴스,"신고가 앞두고 숨고른 코스피, 6190선 마감⋯주말 미국-이란 2차 협상 눈...",https://www.etoday.co.kr/news/view/2576793,"종이·목재(-2.15%), 비금속(-0.89%), 전기·전자(-0.79%), 운송·창고(-0.65%), 건설(-0.63%) 등은 약세를 보였다.... 지정학적 리스크는 완화 기대가 커지고 있다. 도널드 트럼프 미국 대통령은 주말 2차 협상 개최... "
2026-04-17,네이버뉴스,"세나, 1분기 연결 기준 매출 438억·영업익 38억 달성",https://www.datanet.co.kr/news/articleView.html?idxno=211031,"기상이변, 전쟁 등 대외적인 지정학적 리스크로 인해 주요 국가의 소비 심리가 위축되면서 주력 제품인... 내년 초 양산 예정인 자율주행 골프 트롤리에 선주문이 유입되고, 한국건설기술연구원과의 작업그룹통신에 대한... "
2026-04-18,네이버뉴스,대전 서구 '불법 시설물' 본격 정비... 하천·계곡 안전사고 예방 나서,http://www.newsworker.co.kr/news/articleView.html?idxno=422497,대전 서구는 여름철 안전사고를 예방하고 하천 생태계 회복을 위해 하천과 계곡 주변 불법 시설물 정비에... 주민 안전을 위협하는 시설물을 철저히 관리할 것을 지시했다. 또 구는 오는 20일 안전건설국 등 관련 부서... 
2026-04-17,네이버뉴스,"고창군, 소형특수농기계 면허취득 교육 지원",https://www.newsclaim.co.kr/news/articleView.html?idxno=3061144,수료자는 건설기계조종사면허증을 발급받는다. 면허 취득자는 농업기술센터가 보유한 임대용 굴착기와 로더를 이용할 수 있다. 군 관계자는 무면허 사고 예방과 농업인 안전 확보를 위해 교육을 지속 확대할... 
2026-04-17,네이버뉴스,"LH전북본부, ""중대재해 제로화""…안전문화 행사 가져",http://www.jeonmin.co.kr/news/articleView.html?idxno=438105,사진=한국토지주택공사 전북지역본부 건설현장 안전사고 예방을 위한 경각심을 높이고 초기 대응 역량을 강화하기 위해 한국토지주택공사(LH) 전북지역본부는 15일 전 직원과 건설현장 관계자를 대상으로 안전문화 행사를... 
2026-04-17,네이버뉴스,"용인시, 대형 공장 공사 현장 8곳 ‘여름철 수해 대비’ 긴급 점검",https://www.nspna.com/news/?mode=view&newsid=810083,"1만㎡ 이상 현장 대상 배수 시설 및 흙막이 집중 확인, 7곳 양호 판정 용인특례시가 다가올 여름철 풍수해에 대비해 대규모 건설 현장의 안전 고삐를 죄고 있다. 시는 여름철 집중호우로 인한 안전사고를 예방하기 위해... "
2026-04-17,네이버뉴스,"[인천 소식] '인천형 영아돌봄전문가' 30여명 배출, 청라IHP(도시첨단산...",http://www.bizwnews.com/news/articleView.html?idxno=134133,"및 안전사고 예방, 응급처치 등의 안전돌봄 전반 ▲선배 영아돌봄사와의 사례 나눔을 통한 현장 노하우... 인천시 종합건설본부는 중봉대로와 봉수대로를 연결하는 청라 IHP 진입도로를 오는 4월 20일 오전 9시부터... "
2026-04-17,네이버뉴스,[단독] 양대 공항공사 사장 공석 ‘초유’… 정권 달라도 사퇴 배경 닮...,https://www.segye.com/newsView/20260417513294?OutUrl=naver,"이들은 또 “한국공항공사가 맡아야 할 안전운영, 사고 예방, 신공항 추진, 미래항공모빌리티 준비 등 핵심... 정부가 인천국제공항공사와 한국공항공사, 가덕도신공항건설공단 통합하는 방안이 추진되는 것과 관련, 양대... "
2026-04-17,네이버뉴스,"대전 서구, 하천·계곡 및 주변 지역 불법 점용 시설 집중 단속",http://www.gocj.net/news/articleView.html?idxno=147504,"대전 서구, 불법 점용 시설 실태 점검 대전 서구는 여름철 안전사고 예방과 하천 생태계 회복을 위해 지역 내... 주민 안전을 위협하는 불법 점용 시설을 철저히 관리할 것을 지시했다. 20일에는 안전건설국 등 관련 부서... "
2026-04-17,네이버뉴스,"[오토 뉴스브리핑] 제네시스, 獨 아우토빌트 선정 '최고의 자동차 브랜...",https://www.asiatime.co.kr/article/20260417500213,"건설기계 특별안전 점검은 MAN 서비스 데이 기간 동안 산업현장에서 발생하는 다양한 사고를 예방하고 국민의 불안을 해소하고자 추진된다. 한국타이어, 2026년 상용차 대상 ‘고속도로 안전점검 캠페인’ 진행 2026... "
2026-04-17,네이버뉴스,[경남소식]농어촌공사 경남본부 '중대재해 제로' 워크숍 등,https://www.newsis.com/view/NISX20260417_0003596232,"이번 워크숍은 경남 내 생산기반 정비 및 지역개발사업의 성공적인 완수와 더불어, 건설현장의 안전문화를... 특히 이번 워크숍은 ▲안전 관리 내실화: 중대재해 예방을 위한 ‘공사현장 안전사고 및 점검 사례 교육’... "
2026-04-17,네이버뉴스,"""대형 붕괴사고 막는다"" 노동부, 권역별 붕괴사고 예방 릴레이 세미나",https://www.ajunews.com/view/20260417102502860,"2023.10.13[사진=유대길 기자 dbeorlf123@ajunews.com] 고용노동부는 건설현장 안전관리자 등의 안전관리 역량 강화, 건설기준 등의 이해도 향상을 위해 '붕괴사고 예방 릴레이 세미나'를 개최한다고 17일 밝혔다. 이번... "
2026-04-17,네이버뉴스,"건설 붕괴사고 사망자 2배↑…노동부, 예방 세미나 개최",https://www.news1.kr/economy/employment-labor/6140117,건설현장 붕괴사고 사망자가 1년 새 두 배 이상 늘어나면서 안전관리 강화 필요성이 커지고 있다. 고용노동부는 현장 안전관리자의 대응 역량을 높이기 위해 사고 사례 중심의 '붕괴사고 예방 릴레이 세미나'를... 
2026-04-17,네이버뉴스,반복되는 산업재해 … '생명안전기본법' 제정 논의 재부상,https://www.safetimes.co.kr/news/articleView.html?idxno=241981,"실제로 세월호 참사 이후에도 물류센터 화재, 건설현장 붕괴, 화학물질 사고 등 대형 인명 피해로 이어지는 사고가 반복됐다. 사고 유형은 다르지만 공통적으로는 안전관리 부실과 책임 주체 불명확, 사전 예방 시스템의... "
2026-04-17,네이버뉴스,"동해해수청, 99개 시설 대상 '집중안전점검' 돌입 外",https://www.ajunews.com/view/20260417162800166,‘집중안전점검’을 실시한다고 밝혔다. 이번 점검은 항만·어항시설과 건설현장 등 해양수산 분야 주요... [사진=동해해수청] 동해지방해양수산청이 항만 내 안전사고 예방과 안전의식 강화를 위해 현장 중심의 안전문화... 
2026-04-17,네이버뉴스,"대전 서구, 하천·계곡 '불법 점용' 집중 단속 추진",https://www.newspim.com/news/view/20260417000952,대전 서구는 여름철 안전사고 예방과 하천 생태계 회복을 위해 지역 내 하천과 계곡 주변 불법 시설물... 주민 안전을 위협하는 불법 점용 시설을 철저히 관리할 것을 지시했다. 또 오는 20일에는 안전건설국 등 관련... 
2026-04-17,네이버뉴스,"대전 서구, 하천·계곡 주변 지역 불법 점용 시설 집중 단속",https://www.news1.kr/local/daejeon-chungnam/6140472,대전 서구는 여름철 안전사고 예방과 하천 생태계 회복을 위해 관내 하천과 계곡 주변 불법 시설물 정비에... TF팀은 20일 안전건설국 등 관련 부서 관계자 20여 명이 참여한 가운데 ‘하천·계곡 등 불법 점용 시설 정비 1차... 
2026-04-18,네이버뉴스,용인 경남아너스빌 공사현장서 감전 추정 사고…60대 숨져,https://www.yna.co.kr/view/AKR20260418015900061?input=1195m,"작업중지 명령을 내리고 산업안전보건법 및 중대재해처벌법 위반 사항이 있는지 수사 중이다. 해당 아파트는 지하 3층, 지상 29층 13개 동 총 997세대 규모로 오는 2028년 12월 준공될 예정이다. 시공사는 SM스틸 건설부문이다."
2026-04-17,네이버뉴스,[패트롤] 김천시-구미도시공사-상주시-상주시의회-고령군-문경시-성주군,https://www.ekn.kr/web/view.php?key=20260417029457978,"◇구미도시공사-대한산업안전협회, 안전경영 맞손…“중대재해 예방 강화"" 교육·점검·기술지원 협력 확대... 고속도로' 건설사업의 예비타당성조사 통과를 위한 공조 수위를 높이고 나섰다. 17일 성주군에 따르면 군은... "
2026-04-17,네이버뉴스,"[ZD SW 투데이] 라이너, 발표 자료용 '슬라이드 생성 기능' 출시 外",https://zdnet.co.kr/view/?no=20260417122513,"이날 행사는 제조·건설 분야 고객사 및 관공서 관계자 40여 명이 참석한 가운데 AI 기반 근로자 안전 의식 향상 방안, 비전 AI를 활용한 실시간 사업장 안전관리, 중대재해처벌법 대응 전략 등 현장 실무에 즉시 적용... "
2026-04-17,네이버뉴스,"아시아나IDT, ‘플랜투두’와 함께 하는 산업안전세미나 개최",https://www.ddaily.co.kr/page/view/2026041716075546320,"이번 세미나는 중대재해처벌법 준수에 어려움을 겪는 중소·중견기업의 안전 수준을 높이고, AI 기술을 활용한 실질적인 안전보건 관리 방안을 제시하기 위해 마련됐다. 행사에는 제조·건설 분야 고객사 및 관공서... "
2026-04-18,네이버뉴스,"박찬대 ""인천시장 출사표, 유정복은 성과 없는 용역시장""[한판승부]",https://www.nocutnews.co.kr/news/6504408?utm_source=naver&utm_medium=article&utm_campaign=20260418080049,"그다음에 규제도 풀어야죠. 필요하면 입법도 해야 되지 않겠습니까? 그러면 원내대표 출신인 제가 국회하고... 인천공항공사, 한국공항공사, 가덕도 신공항 건설공단 이 3개를 통합하는 것에 반발도 있는데 의원님은 이거... "
2026-04-18,네이버뉴스,급증하는 인프라 노후화…'성능개선충당금' 실효적 적립 필요,https://www.electimes.com/news/articleView.html?idxno=367120,건설산업연구원은 '노후 인프라 개선을 위한 재원 마련 방안: 성능개선충당금 적립 중심으로' 보고서를... 따른 규제(또는 감사·여론에 의한 간접 규제) 등을 통해 실질적 적립을 유도하고 있다고 지적했다.... 
2026-04-18,네이버뉴스,"[N2 포커스] 서울 아파트값, 혼조세 속 전세 강세…매물 감소에 규제 변...",https://www.news2day.co.kr/article/20260417500296,"국내 건설업계 관계자는 에 ""대출 연장이 막혀 집을 팔아야 하는 집주인과 복잡한 규제에 겁을 먹은 매수자 모두 길을 잃은 상황""이라며 ""현장에선 법이 너무 꼬여 일단 피하고 보자는 분위기가 강하다""고... "
2026-04-18,네이버뉴스,금값 강세 속 금광 개발사 ‘자금 동원력’ 격차…레이크빅토리아골드...,https://www.tokenpost.kr/news/market/350806,그는 광산 개발 전 과정에서 13년 이상 인허가와 환경 규제 준수 업무를 맡아온 인물이다. 같은 흐름에서 자회사 바커빌골드마인스는 JDS 에너지앤마이닝과 카리부 프로젝트 개발을 위한 프로젝트·건설관리 서비스... 
2026-04-18,네이버뉴스,"김형동 의원, 안동댐 자연환경보전지역 일부 해제 조건부 의결 이끌어",https://www.pressian.com/pages/articles/2026041721352544976?utm_source=naver&utm_medium=search,김형동 의원은 “안동은 댐 건설 이후 반세기 동안 과도한 규제로 도시 발전이 억제되고 주민들이 많은 희생을 감내해왔다”며 “이번 결정은 안동의 오랜 숙원을 해소하는 출발점”이라고 밝혔다. 이어 “규제 완화... 
2026-04-17,네이버뉴스,안동댐 일대 자연환경보전지역 규제 일부 완화…반세기 만에 물꼬,https://www.g-enews.com/view.php?ud=20260417210556690078e43e3ead_1,김 의원은 “댐 건설 이후 반세기 동안 과도한 규제로 지역 발전이 억제돼 왔다”며 “이번 결정이 안동의 오랜 숙원을 푸는 출발점이 될 것”이라고 말했다. 육동윤 글로벌이코노믹 기자
2026-04-17,네이버뉴스,"대진표 완성된 정선군수 선거, '안정론 vs 교체론'... 3파전",https://www.mbceg.co.kr/post/135511,"KTX 건설 등 교통망 확충을 약속했습니다. [최승준/더불어민주당 정선군수 후보] ""KTX 정선역과 사북역을... "" 농어촌 기본소득 시범 지역 선정 등 복지 정책 기반을 마련한 최 군수는, 강원랜드 규제완화와 가리왕산 올림픽... "
2026-04-17,네이버뉴스,안동댐 일대 38㎢ 규제 풀린다…도시계획위 조건부 통과,https://www.newsis.com/view/NISX20260417_0003596382,"방지를 위한 기반 시설 확충 계획을 마련한 뒤 재추진될 예정이다. 김 의원은 ""댐 건설 이후 반세기 동안 과도한 규제로 지역 발전이 억제돼 왔다""며 ""이번 결정이 안동의 오랜 숙원을 푸는 출발점이 될 것""이라고 말했다．"
2026-04-17,네이버뉴스,"규제에 묶인 아파트 시장, 대체재 오피스텔로 눈길",https://www.kyeongin.com/article/1762050,우미건설이 시공하는 영통역 우미 린은 이날 견본주택 개관과 동시에 한국부동산원 청약홈을 통해 청약을 접수하고 있다. 영통역 우미 린은 지난 10·15 부동산 대책으로 규제지역과 토지거래허가구역으로 지정된... 
2026-04-17,네이버뉴스,"김부겸, 건설업계 만나 ""TK통합·신공항"" 강조…현안 선점 시도",https://www.kyongbuk.co.kr/news/articleView.html?idxno=4070325,"이 자리에서 건설업계는 일자리 창출과 대구경북신공항 조속 추진, 지방 금융 규제 완화 등을 건의했다. 김 후보는 이에 공감을 표하며 ""대구경북 통합이 이뤄지면 예산 규모가 커지고 신공항 사업도 원활해질 것""이라고... "
2026-04-17,네이버뉴스,[AI 부동산 투데이] 대출 옥죄기에 다주택자 진땀…주담대 만기연장 제...,https://www.newspim.com/news/view/20260417001053,2026년 4월 17일 건설·부동산 시장에서는 가계부채 관리를 위한 다주택자 대출 차단과 분양가 부담에 따른... ◆ 다주택자 주담대 만기 연장 전면 제한…외곽 지역 매물 쏟아지나 이날부터 수도권 및 규제지역에 아파트를... 
2026-04-17,네이버뉴스,[충남도의회 당진시 제2선거구 예비후보 지상토론 2] 국민의힘 이해선 ...,http://www.djtimes.co.kr/news/articleView.html?idxno=111602,"기업에는 합리적인 규제가 필요하고 주민에게는 건강권 보호가 필요하다. 기업과 주민 어느 한쪽에도... 현재 진행 중인 송산지구 경제자유구역, K모빌리티 물류단지, 대한전선 제2공장, 수소도시 건설 등이 제대로... "
2026-04-17,네이버뉴스,"[정인호 객원기자칼럼] 부동산 정책, '금융·세제·규제' 삼박자 맞아야",https://weekly.hankooki.com/news/articleView.html?idxno=7160160,"1980년대 말 경기 호황으로 부동산 광풍이 불자, 노태우 정부는 신도시 건설을 통한 주택 200만호 공급과... 도시의 토지가 부족해지고 기존 주택이 낡으면서 재건축이 불가피해지는데 이에 대한 규제도 사업성에 영향을... "
2026-04-17,네이버뉴스,"박동철 경남도의원, ""국가안보 요충지로 희생한 진해, 규제 개선해야""",http://www.enewstoday.co.kr/news/articleView.html?idxno=2420237,"이번 건의안은 진해구 도심 한복판에 위치한 해군 항공작전기지로 인해 수십년 간 지속된 과도한 규제를... 그러면서 비행안전구역이 진해신항 확장, 가덕도신공항 건설 등 대규모 국책 사업의 성과가 지역 경제로... "
2026-04-17,네이버뉴스,규제 비켜간 주거형 오피스텔···'영통역 우미 린' 분양 개시,http://www.finomy.com/news/articleView.html?idxno=253342,"17일 건설업계에 따르면 단지는 지하 5층~지상 29층, 2개 동, 전용면적 76~119㎡ 총 305실 규모로 조성된다. 청약은 17일과 20일 이틀간 진행되며, 당첨자는 23일 발표된다. 정당 계약은 24일 하루 동안 이뤄진다. 주거형... "
