date,source,title,link,description
2026-06-08,네이버뉴스,"현대건설, 위례 복정역세권 3조 390억 수주→장지동 개발 본격화",https://www.topstarnews.net/news/articleView.html?idxno=16082833,"현대건설(000720)이 송파비즈클러스터피에프브이 주식회사와 '위례신도시 복정역세권 복합개발사업 복합용지 2BL, 3BL 신축공사'에 대한 공사수주 계약을 3,039,406,100,000원에 체결했다고 5일 공시했다. 이번... "
2026-06-08,네이버뉴스,"삼성물산, 삼성전자·삼성생명 지분가치 폭등에도 '실질 PBR 0.7배'…""원전...",http://www.newsprime.co.kr/news/article.html?no=735906,"또한 ""이는 타 지주사인 SK(1.4배), SK스퀘어(3.3배), 두산(18.7배), CJ(1.2배)는 물론 대형 건설사인 현대건설(1.7배), 삼성E&A(1.8배), 대우건설(2.4배)과 비교해도 크게 낮은 수치""라고 짚었다. 올해 3분기와 4분기에 연이어... "
2026-06-08,네이버뉴스,"상생 협약식, 전문·종합건설사 동반성장 계기 되길",https://www.koscaj.com/news/articleView.html?idxno=324434,"이날 행사에는 윤학수 전건협 중앙회장과 주병기 공정거래위원장, 오세철(삼성물산), 이한우(현대건설), 김보현(대우건설), 박상신(DL이앤씨), 김태진(GS건설), 주우정(현대엔지니어링), 송치영(포스코이앤씨), 오일근... "
2026-06-08,네이버뉴스,GTX-A 삼성역 철근 178t ‘발주도 안 했다’··· 커지는 안전 우려,https://www.sisain.co.kr/news/articleView.html?idxno=57975,"지난해 10월23일 시공사인 현대건설은, 영동대로 복합개발 3공구 지하 5층 기둥에 두 개씩 있어야 할 철근이 한 개씩만 들어갔다는 사실을 발견했다. 지하 5층 콘크리트 타설을 이미 완료한 후 지하 4층을 시공하면서 알게... "
2026-06-08,네이버뉴스,차상현호 2연승·A조 선두…강소휘 14점·나현수 12점으로 우즈베크도 완...,https://www.dailysportshankook.co.kr/news/articleView.html?idxno=429418,"팀 내 가장 많은 14점을 기록하며 공격을 이끌었고, 아포짓 스파이커 나현수(현대건설)가 12점으로 뒤를 받쳤다. 전날 서브 에이스 6개를 앞세워 12점으로 맹활약한 박여름(정관장)에 이어 이날은 강소휘와 나현수가... "
2026-06-08,네이버뉴스,"DCI-코람코, 안산에 AI 데이터센터 착공…""40MW급 인프라 구축""",https://zdnet.co.kr/view/?no=20260607162942,DCI가 설계·구축·운영을 총괄하고 현대건설이 시공을 맡는다. 두 기업은 경기도 안산시 단원구 성곡동 사업부지에서 '안산 시화국가산단 AI센터(SEL02) 개발사업 착공식'도 개최했다. 행사에는 유관기관과 사업... 
2026-06-08,네이버뉴스,[이번주 시공사 현장설명회 스케줄(2026.6.8~6.12)],https://www.sisaon.co.kr/news/articleView.html?idxno=201643,"지난 4월 열린 1차 현설에는 대우건설을 비롯해 현대건설, 한화 건설부문 등 6개 건설사가 참석했다. 같은날 천연동 89-16번지 일대 소규모주택정비 관리지역(모아타운) 가로주택 사업 시행사인 한국토지신탁이... "
2026-06-08,네이버뉴스,효율·안전 동시에…건설 현장 '눈과 손' 된 AI,https://www.shinailbo.co.kr/news/articleView.html?idxno=5024778,"현대건설은 AI를 건설장비와 드론, 로봇에 결합한 피지컬 AI 기반 건설 자동화·안전관리 기술로 확장하고 있다. 위험 상황을 먼저 포착하는 역할은 AI CC(폐쇄회로)TV가 맡고 있다. 200만건 이상 현장 데이터를 학습시켜... "
2026-06-08,네이버뉴스,인도 넘어 유럽까지…'1사 2브랜드' 효과 노리는 HD건설기계,https://www.dailian.co.kr/news/view/1652745/?sc=Naver,현대·디벨론 투트랙 전략 올해 1월 HD현대건설기계와 HD현대인프라코어의 합병으로 출범한 HD건설기계는 ‘현대’와 ‘디벨론’ 두 브랜드를 동시에 운영하고 있다. HD건설기계는 인도와 중동·아프리카 등 신흥... 
2026-06-08,네이버뉴스,[이번주 재개발ㆍ재건축] 군포 금정3구역 10일 수의계약 입찰 마감,https://www.dnews.co.kr/uhtml/view.jsp?idxno=202606070602494150290,"현대건설, KCC건설, 동원개발 등 3개사가 각 구역 현설에 나란히 자리한 것으로 알려졌다. 명장5구역은 명장동 104-12번지 일원으로 구역면적이 약 13만4589㎡다. 이곳에 지하 3층~지상 35층 2183가구의 대단지 아파트를... "
2026-06-07,네이버뉴스,[핵심 상권 리포트] 강남역 / 압구정 / 가로수길,http://www.apparelnews.co.kr/news/news_view/?idx=225644,"현대건설이 서울 압구정5구역 재건축 사업 시공권까지 확보하며 압구정 2·3·5구역을 아우르는 9조 8,000억 원 규모의 초대형 정비사업에 착수한다. 현대건설이 압구정 재건축의 주도권을 장악하며, 한강변 최고급... "
2026-06-07,네이버뉴스,"김회천 한수원 사장, 협력사 합동 '안전 최우선' 경영 선포",https://www.cstimes.com/news/articleView.html?idxno=708708,"행사에는 한전KPS, 수산인더스트리, 현대건설, 삼성물산 등 한수원의 주요 협력사 경영진이 대거 참석해 안전 경영 실천 의지를 공유했다. 김회천 한수원 사장은 ""한수원 노사와 협력회사 대표들이 한자리에 모여... "
2026-06-07,네이버뉴스,"목동7단지, 조합 설립 눈앞…삼성·현대·롯데 수주전 본격화",https://news.mtn.co.kr/news-detail/2026060718311738172,"7일 목동7단지 조합 창립총회장 앞에서 삼성물산과 현대건설, GS건설, DL이앤씨, 롯데건설 관계자들이 도열행사를 진행하고 있다./사진=윤하늘 기자조합 설립이 가시화되면서 시공권 경쟁도 본격화하는 분위기다. 이날... "
2026-06-07,네이버뉴스,[부동산 손자병법] 여의도 재건축 잰걸음 … 한강뷰 1.3만가구 미니 신...,https://www.mk.co.kr/article/12067785,시공사인 현대건설과 공사비 규모를 두고 협상을 진행 중인 것으로 알려졌다. 여의도 내 소규모 재건축 사업도 활발하다. 지난해 12월엔 160가구 규모 화랑아파트가 여의도 재건축 단지 중 처음으로 소규모 재건축... 
2026-06-07,네이버뉴스,‘사업비 4조’ 넘긴 완도금일 해상풍력… 국민성장펀드 활용 추진,https://www.asiatoday.co.kr/kn/view.php?key=20260607010002214,EPC 주관사인 현대건설은 한화오션의 대형 풍력터빈 설치선(WTIV) 투입 방안을 추진 중이다. 해당 선박은 2027년 신안우이 해상풍력 사업에 우선 투입된 뒤 완도금일 사업의 주요 설치 공정이 예정된 2028년 순차적으로... 
2026-06-08,네이버뉴스,"산학연관 협력 생태계, 수소 산업 '기술 수장고' 돼야",https://www.kmecnews.co.kr/news/articleView.html?idxno=50045,"대형 시험평가 플랫폼을 통해 다양한 수요 기업(현대제철, 삼성물산, GS건설 등)과 성과를 실시간으로 공유하고 실증 트랙레코드를 확보해 실제 산업 현장에 직접 적용하는 구조다. 수소는 탄소중립과 에너지 안보를... "
2026-06-08,네이버뉴스,초고령화 시대 삼성물산의 실버타운 전략…시공 대신 AI플랫폼으로 승부,https://realty.chosun.com/site/data/html_dir/2026/06/05/2026060503116.html,한 대형 건설사 관계자는 “과거 실버타운은 부동산 개발 사업 성격이 강했지만 앞으로는 호텔·병원·IT 플랫폼이 결합된 운영 산업에 가까워질 것”이라며 “삼성물산도 결국 건설회사로 접근하기보다 플랫폼... 
2026-06-07,네이버뉴스,이번엔 반도체 아니다?…외국인 돈 몰린 곳은 건설·전력주,https://www.news2day.co.kr/article/20260607500085,"LG에너지솔루션(-1643억원), 대우건설(-1454억원), 삼성물산(-1275억원), 삼성SDI(-1145억원) 등에서도 차익실현에 나섰다. 시장에서는 이번 수급 흐름을 단순한 매매 패턴이 아니라 향후 증시 주도주 변화 가능성을... "
2026-06-08,네이버뉴스,"[코스피·코스닥, DL이앤씨 계룡건설산업 태영건설 소프트센 테스 휴니...",https://www.public25.com/news/articleView.html?idxno=47874,"퍼블릭타임스=[코스피·코스닥, DL이앤씨 계룡건설산업 태영건설 소프트센 테스 휴니드  한솔테크닉스  유바이오로직스등  5일 주요공시] ▲DL이앤씨(375500) : 한국동서발전으로부터 약 4999억원 규모... "
2026-06-08,네이버뉴스,[아주증시포커스] 한 달 연속 순매도 외국인…삼성전자·SK하이닉스서 5...,https://www.ajunews.com/view/20260608072318482,"수주 ▷DL이앤씨, 한국동서발전으로부터 약 4999억원 규모 제주청정에너지 복합발전소 파워블럭 및 부대설비 설치조건부 구매 수주 ▷한솔테크닉스, 경영 효율화 및 재무구조 개선 위해 총 640억원 규모 충북... "
2026-06-08,네이버뉴스,"[N2 모닝 경제 브리핑-6월 8일] 美 증시, 반도체주 투매에 급락…필반지...",https://www.news2day.co.kr/article/20260607500065,수주 - DL이앤씨(375500) : 한국동서발전으로부터 약 4999억원 규모 제주청정에너지 복합발전소 파워블럭 및 부대설비 설치조건부 구매 수주 - 휴니드(005870)테크놀러지스 : 미국 The Boeing Company와 약 75억원 규모 H-47... 
2026-06-07,네이버뉴스,[아유경제_오피니언]  주)하농 ...,http://www.areyou.co.kr/news/articleView.html?idxno=94010,있도록 DL이앤씨 출신 정비사업전문관리업자(이하 정비업자) 대표와 주선했을 것이란 의혹을 제기한 증언까지 나와 「성매매알선 등 행위의 처벌에 관한 법률」 및 「성매매방지 및 피해자보호 등에 관한 법률」 등... 
2026-06-08,네이버뉴스,"[SK 도시가스 리밸런싱] 도시가스 알짜 자산 유동화, 매각 시그널",https://dealsite.co.kr/articles/163102,부산도시가스는 2022년 12월 수영구 남천동 일대 본사 사옥(건물면적 5867㎡)과 토지 3만606㎡(약 9258평)을 대우건설 컨소시엄에 매각하기로 결정했다. 당초 해당 유형자산의 자산가치는 1037억원에 불과했지만 실제... 
2026-06-08,네이버뉴스,[주간수급리포트] 외인 ‘17조 매도’에 흔들린 국내 증시⋯금융ㆍ소비...,https://www.etoday.co.kr/news/view/2591070,"한편 개인은 차익 실현을 위해 SK스퀘어(-4713억원), 대우건설(-1298억원), 신한지주(-1078억원) 등을 대거 팔아치웠다. 증권가에서는 외국인의 매도세를 시장 이탈보다는 포트폴리오 재조정으로 해석하고 있다. 이경민... "
2026-06-08,네이버뉴스,"롯데이노베이트, 건설 현장 AI에이전트 도입... 산업계 AX 확산 '시동'",http://www.newsbrite.net/news/articleView.html?idxno=198491,이어 지난달에는 대우건설에도 적용해 기술의 실용성을 인정받았다. 단순한 번역을 넘어 건설 특화 용어까지 정확히 처리해 외국인 근로자와의 소통 효율을 크게 높였다는 게 현장의 평가다. 롯데이노베이트는 외국인... 
2026-06-08,네이버뉴스,1931가구 대단지… 6호선 돌곶이역 역세권,https://www.chosun.com/economy/real_estate/2026/06/08/WMMKTGO37BHFLHB2EGTQ2WEXVQ/?utm_source=naver&utm_medium=referral&utm_campaign=naver-news,서울 성북구 장위 푸르지오 마크원 대우건설이 서울 성북구 장위뉴타운(장위재정비촉진지구) 10구역 재개발을 통해 공급되는 ‘장위 푸르지오 마크원’ 분양에 나선다. 장위동 68-37번지 일원에 들어서는 이 단지는... 
2026-06-07,네이버뉴스,"장성 첨단 데이터센터, 지방투심 면제",https://www.namdonews.com/news/articleView.html?idxno=912873,지난해 펀드 투자 대상으로 선정된 뒤 같은 해 12월 대우건설 정원주 회장과 김영록 전라남도지사 등이 참석한 가운데 착공했다. 대우건설은 이 사업에 출자 및 시공사로 참여하고 있다. 2027년 12월 준공과 안정화 과정을... 
2026-06-07,네이버뉴스,"대우건설, 장위10구역 재개발 ‘장위 푸르지오 마크원’ 6월 분양",http://www.segyebiz.com/newsView/20260607507719?OutUrl=naver,"대우건설은 이달 서울 성북구 장위동 68-37번지 일원에서 ‘장위 푸르지오 마크원’을 분양할 예정이라고 최근 밝혔다. 이 단지는 장위뉴타운 장위10구역 재개발 사업으로 조성된다. 지하 5층~지상 35층, 23개 동... "
2026-06-08,네이버뉴스,월세 5000만원에 권리금 5억…북촌 외국인 몰리자 골목상권 물갈이,https://www.sedaily.com/article/20052759?ref=naver,"GS건설의 충남 천안 ‘백석시그니처자이’는 전용 59~115㎡, 1174가구 규모로 KTX·SRT 천안아산역과 삼성전자(005930)·삼성SDI 등 주요 사업장이 인근에 위치한다. 6. 김윤덕 장관, 中 수소생태계 찾는다…새만금 투자... "
2026-06-08,네이버뉴스,"광주 부동산 침체 속 선별 수요, '입지·대단지·브랜드'로 몰린다",https://realty.chosun.com/site/data/html_dir/2026/06/05/2026060501673.html,"GS건설과 한화건설이 함께 시공한 브랜드 대단지다. 인근에는 경양초, 운암중이 있어 걸어서 단지 내 위치에 따라 5~10분 이내에 통학이 가능하다. 구립운암도서관, 중외공원, 광주시립미술관 등 인프라도 조성돼 있다.... "
2026-06-08,네이버뉴스,건설 불황 한복판에 선 오너家…GS·계룡·대방 ‘시험대’,http://www.fntimes.com/html/view.php?ud=202606060731275587048b718333_18,"GS건설(대표이사 허윤홍)은 오너 4세 대표 체제, 계룡건설산업(대표이사 이승찬)은 오너 2세 회장 체제, 대방건설(대표이사 구찬우)은 오너 2세가 최대주주이자 대표이사로 회사를 이끄는 구조다. 한국금융신문이... "
2026-06-07,네이버뉴스,화성 동탄2 공공분양 등 전국 9개 단지 2000가구 공급 [분양캘린더],https://www.sedaily.com/article/20052710?ref=naver,"GS건설은 충남 천안시 서북구 백석동 일원에 ‘백석시그니처자이’를 분양할 예정이다. 지하 2층~지상 최고 28층, 13개동, 전용면적 59~115㎡, 총 1174가구 규모다. 1블록은 854가구, 2블록은 320가구다. 단지는 차량 10분... "
2026-06-07,네이버뉴스,[부동산 손품노트] GTX-A 지나는 역세권 재개발…은평구 3대장 '불광·대...,https://www.mk.co.kr/article/12067784,"GS건설이 시공을 맡아 '북한산 자이더프레스티지'로 지어진다. 신속통합기획 재개발도 일제히 속도를 내고 있다. 불광동 445, 442, 359-1, 16-111이 신통기획 대상지 선정 단계다. 불광동의 미래 가격을 가늠하려면 세 곳을... "
2026-06-08,네이버뉴스,1분기 745억 영업익 낸 호텔롯데…시장 시선은 '재무구조'로,https://www.newsway.co.kr/news/view?ud=2026060515204813662,호텔롯데는 롯데건설 보증부 단기사채 매입을 위해 설립된 특수목적법인(SPC) 프로젝트샬롯에 1500억원을 대여했으며 해당 SPC 차입금과 사모사채에 대한 자금보충 약정을 제공하고 있다. 롯데건설 전자단기사채 매입 SPC인... 
2026-06-08,네이버뉴스,서울 서북권 최대어 갈현1구역…GTX 뚫리자 은평3대장 재개발도 들썩,https://realty.chosun.com/site/data/html_dir/2026/06/05/2026060502994.html,"시공은 롯데건설이 맡았는데 4000가구가 넘는 매머드급 단지를 단독으로 시공한다. ◇서울 외곽이지만, GTX-A 타면 삼성역까지 10분대 그동안 갈현동 일대는 3·6호선 연신내역이 있음에도 불구하고, 서울 서북부권에서... "
2026-06-08,네이버뉴스,“부산 인재 모여라” 롯데그룹 첫 채용설명회,https://www.donga.com/news/Society/article/all/20260607/134065047/3,"이번 잡카페에는 롯데백화점과 롯데건설, 롯데호텔, 롯데월드, 롯데정밀화학, FRL코리아, 대홍기획 등 10개 계열사가 참여했다. 현장에서는 12개 직무에 대해 각 계열사의 채용 담당자와 현직자가 일대일 맞춤형 직무... "
2026-06-07,네이버뉴스,"롯데그룹, 부산서 인재 채용 행사 개최",https://www.busan.com/view/busan/view.php?code=2026060718164481870,"이번 잡카페에는 롯데백화점, 롯데건설, 롯데호텔, 롯데월드, 롯데정밀화학, 롯데GRS, FRL코리아(유니클로), 롯데글로벌로지스, 롯데이노베이트, 대홍기획 등 총 10개 주요 계열사가 참여했다. 현장에서는 12개 직무에 대해... "
2026-06-08,네이버뉴스,"""선거 끝!""…밀린 아파트 분양 쏟아진다",https://news.bizwatch.co.kr/article/real_estate/2026/06/05/0039,이중 서구 검단신도시에서 포스코이앤씨 '더샵' 브랜드를 단 단지가 공급된다. AB22·23블록에 들어서는 '더샵검단레이크파크'가 주인공이다. 검단신도시 내 중앙호수공원 예정지와 나진포천 사이에 위치했다.... 
2026-06-08,네이버뉴스,‘아파트분양’ 전북이 전남의 2배…포스코이앤씨 압도적 1위 [이 지역 ...,http://www.fntimes.com/html/view.php?ud=202606060240563664dd55077bc2_18,포스코이앤씨와 영무건설이 같은 사업지에 참여했지만 지분 구조에 따라 분양실적 차이가 벌어졌다. 2025년 전라도 분양 시장은 전주와 무안 오룡지구를 중심으로 움직였다. 총 18개 사업지에서 6321가구가 공급되며... 
2026-06-08,네이버뉴스,"[시경 Pick!] BBB+에서 AA로… 동부건설, HUG의 깐깐한 3중 허들 어떻게 ...",https://www.meconomynews.com/news/articleView.html?idxno=131690,"동부건설 AA등급 앞세워 '주택·정비사업' 착착 수주 건설사들이 HUG 신용평가를 잘 받아야 하는 핵심 이유는 '수주'와 '분양' 때문이다. 우리나라 분양 시장은 대부분 '선분양'으로 운영되는데, HUG의 분양보증은... "
2026-06-08,네이버뉴스,"KB證 “삼성E&A, 글로벌 에너지 기업으로 진화 중⋯최선호주 유지”",https://www.etoday.co.kr/news/view/2591206,그에 따르면 삼성E&A는 높은 매출총이익률을 유지하면서도 수익 제한경쟁 형태의 수주와 입찰 참여가... 액화천연가스(LNG) EPC 시장은 전통적으로 라이센서와 일부 대형 건설사가 폐쇄적으로 연결되어 있어 신규... 
2026-06-08,네이버뉴스,‘국산 도로 기술·공적 금융’ 융합…유럽 관문 튀르키예 인프라 영토...,https://www.g-enews.com/view.php?ud=202606051548527312a9fc143920_1,대규모 수주 결실을 맺었다. 도로공사가 해외 도로 운영유지관리(O&M) 시장의 평가 기준을 기술·금융 통합형... 이후 본 노선이 전면 개통되는 오는 2029년부터는 튀르키예 현지의 유력 대형 건설사인 리막(Limak)과 원팀... 
2026-06-08,네이버뉴스,[건설사 체력점검 – SK에코①] 영업익 14배의 비밀…실적 주인공은 하...,https://theviewers.co.kr/View.aspx?No=4097176,■ 주택·토목은 역성장…선별 수주로 버틴다 반면 전통적인 건설사업은 다른 흐름을 보였다. 주택·건축·토목·연료전지 사업을 포함한 솔루션(Solution) 부문 매출은 지난해 1분기 9733억원에서 올해 8642억원으로... 
2026-06-08,네이버뉴스,[오세훈 5기 부동산 로드맵②] 민간 주도 주택 개발…모아타운 추진 탄...,https://www.dailian.co.kr/news/view/1652837/?sc=Naver,모아타운에 관심을 기울이던 건설사들도 이전보다 적극적으로 사업에 나설 여건이 마련됐다. 대형사와 경쟁에 어려움을 겪어왔던 중형사 다수가 오래 전부터 모아타운 수주에 나서온 만큼 앞으로 사업이 속도를 내면... 
2026-06-08,네이버뉴스,[설비인의 소리 '뚝딱뚝딱'] ⑨ 기계설비 직접발주,https://www.kmecnews.co.kr/news/articleView.html?idxno=50047,종합건설사가 일괄 수주한 뒤 전문업체에 하도급을 주는 구조 탓에 저가 수주 경쟁과 품질 저하가 반복되면서 발주처와 기계설비 전문업체가 직접 계약하는 직접발주의 확산과 법적 지위 강화가 시급하다는 목소리가... 
2026-06-08,네이버뉴스,"기계설비 1~4월 해외수주, 전년대비 37% 감소",https://www.kmecnews.co.kr/news/articleView.html?idxno=50088,여기에 국내 건설사가 원도급을 수주하더라도 일부 공종에서는 중국 등 해외 업체가 하도급으로 참여하는 사례가 늘어나 국내 기계설비업체들의 수주 여건이 악화되고 있다는 분석도 나온다. 해외건설 하도급업계... 
2026-06-08,네이버뉴스,3443가구 '대어' 꺼낸 아이에스동서…3.5조 자체사업 출격,https://www.newsway.co.kr/news/view?ud=2026060514114305641,"지방 주택시장 침체가 장기화되면서 건설사들의 수익성 확보가 최대 과제로 떠오른 상황에서 대규모... 1분기 신규 수주는 1383억원, 수주잔고는 2조2664억원으로 집계됐다. 연결 기준 실적도 큰 폭으로 개선됐다. 올해... "
2026-06-07,네이버뉴스,'30조 재건축 수주전'… 목동 대해부,https://www.mk.co.kr/article/12067791,총사업비만 30조원으로 건설사의 '골드러시'가 펼쳐지는 기회의 땅이기도 합니다. 현재 목동 재건축엔 2030년 11월이라는 데드라인이 설정돼 있습니다. 목동 위를 지나는 비행기들의 이착륙지인 김포공항 관련... 
2026-06-08,네이버뉴스,"청라시티타워, 448m 청사진은 그대로…착공 막는 법정 공방",https://www.dailian.co.kr/news/view/1652574/?sc=Naver,"이 때문에 새로운 사업 추진 방식 결정과 시공사 선정, 실시설계 보완, 공사 발주 등 후속 절차가 사실상 중단돼 있다. 사업 추진 주체와 권한 관계가 법적으로 확정되지 않은 상황에서 대규모 투자와 착공 절차를 진행하기... "
2026-06-08,네이버뉴스,"모닥불에너지, 보조금 없는 태양광+히트펌프 에너지제로 주택 실증 개시",https://platum.kr/archives/288331,"히트펌프 설치를 알아보던 문 씨는 라디오 방송으로 알게 된 모닥불에너지를 시공사로 선정했다. 문 씨는 ""히트펌프는 한번 설치하면 최소 10년은 써야 하는 난방설비인 만큼 믿을 수 있는 시공사를 찾는 것이 가장 큰... "
2026-06-08,네이버뉴스,[이슈체크] 검찰로 향한 해저케이블 공방…LS전선 우위 속 11조 HVDC 수주...,https://www.thepublic.kr/news/articleView.html?idxno=306629,"한국전력은 이르면 내년 초 사업자 선정 절차에 착수할 것으로 전망된다. HVDC 케이블은 장거리 송전... 최근에는 HVDC 케이블 전용 테스트센터를 구축했고, 해저케이블 시공 역량 강화를 위해 전문 시공사 대한오션웍스를... "
2026-06-08,네이버뉴스,서울 버스전용차로 정류장 고강성 콘크리트 포장…특허기술경쟁 본격화,https://www.dnews.co.kr/uhtml/view.jsp?idxno=202606041810320980154,"통해 시공사를 가린다. 정류장별 공사비는 2억5000만원으로, 이번 북부도로사업소 소관 공사비는 10억원이다. 북부도로사업소를 시작으로 남부, 서부, 성동, 동부, 강서 등 나머지 5개 도로사업소의 공법선정위원회도... "
2026-06-08,네이버뉴스,군포 산본11구역 재건축 본격화…주민대표회의 구성 승인 완료,http://www.newstown.co.kr/news/articleView.html?idxno=705409,/군포시 군포시가 산본신도시 선도지구로 선정된 산본11구역 재건축사업의 주민대표회의 구성을 승인하면서... 또한 시공사 추천 등 주요 의사결정 과정에 참여하며 사업시행자인 LH와 각종 현안을 협의하는 주민... 
2026-06-07,네이버뉴스,"“재건축·재개발 삽 뜨면 재산이 달라지니까”…서울시장, 부동산 민심...",https://www.mk.co.kr/article/12067946,"박원순 전 시장 시절 장기간 멈췄던 정비계획 수립·구역지정 등이 오세훈 시정 4기 들어 마무리됐고 일부 단지는 시공사 선정과 통합심의, 사업시행인가 등 후속 절차를 준비하고 있다. 재건축 사업 속도가 선거 기간... "
2026-06-07,네이버뉴스,익산 코스트코 건축허가 최종 승인,https://sjbnews.com/news/news.php?number=879976,㈜코스트코코리아는 시공사 선정을 거쳐 코스트코 익산점 착공에 들어갈 예정이다. 코스트코 익산점은 호남권 전체를 아우르는 최초의 매장으로 조성되는 만큼 그동안 인근 타 시·도로 원정 쇼핑을 떠나야 했던 지역... 
2026-06-07,네이버뉴스,신통기획 추진 지역서 吳 강세 … 서울시장 당락 가른 '개발이슈',https://www.mk.co.kr/article/12067786,"박원순 전 시장 시절 장기간 멈췄던 정비계획 수립·구역지정 등이 오세훈 시정 4기 들어 마무리됐고 일부 단지는 시공사 선정과 통합심의, 사업시행인가 등 후속 절차를 준비하고 있다. 재건축 사업 속도가 선거 기간... "
2026-06-07,네이버뉴스,코스트코 익산점 건축허가 최종 승인,http://www.jjn.co.kr/news/articleView.html?idxno=1042821,"㈜코스트코코리아는 시공사 선정을 거쳐 코스트코 익산점 착공에 들어갈 예정이다. 코스트코 익산점은 호남권 전체를 아우르는 최초의 매장으로 조성되는 만큼, 그동안 인근 타 시·도로 원정 쇼핑을 떠나야 했던 지역... "
