date,source,title,link,description
2026-05-05,네이버뉴스,"'말 아닌 결과로 맞붙자'…김태흠, 박수현 향해 정면 반박",https://www.bzeronews.com/news/articleView.html?idxno=817059,"최근 몇 년 사이 아동·청소년 관련 예산 증가율이 전국 상위권 수준으로 확대됐고, 24시간 어린이집 운영 확대와 어린이 전문병원 착공 등 인프라가 동시에 진행 중이라는 설명이다. 국비 확보 규모 역시 과거 대비 크게... "
2026-05-05,네이버뉴스,"김명호 진보당 후보 ""어린이 전담 '아이튼튼보건소' 신설할 것""",https://www.headlinejeju.co.kr/news/articleView.html?idxno=592007,"예방 인프라는 없다""며 ""이제는 방향을 바꿔야 한다""고 말했다. 김 후보는 ""권역별로 분산하는 것만으로는... 확보가 동시에 가능한 최적 입지""라며 ""임기 1년 내 착공, 2년 내 개소를 목표로 하겠다""고 설명했다. "
2026-05-05,네이버뉴스,"""공공의대는 우리 지역에""…전북·인천·전남·경북 유치전 가열",https://www.news1.kr/bio/welfare-medical/6156798,"각 지자체는 '즉시 착공', '인프라 확충', '통합 모델', '의료 공백' 등 서로 다른 전략으로 접근하고 있지만 실제 선정 여부는 복지부가 마련할 기준에 따라 갈릴 전망이다. 실습병원 확보 가능성과 기존 의료 인프라, 의료... "
2026-05-05,네이버뉴스,가락시장 현대화 ‘3단계 사업’ 본격화…채소1동 올해말 발주 목표,https://www.nongmin.com/article/20260429500440,공사는 실시설계 착수를 기점으로 올 12월 공사 발주를 거쳐 본격적인 착공에 돌입한다는 계획이다. 공사... 전반적인 인프라 개선을 포함한다. 전체 5단계에 걸친 순환 재건축 방식으로 사업이 진행 중이고 1단계... 
2026-05-05,네이버뉴스,"자연과 예술, 건축이 하나로…건축디자이너 Max Lee, 아트센터 건립 본격...",https://www.livesnews.com/news/article.html?no=61294,"건축·문화 업계가 주목하는 이유는 단순한 착공 소식 때문이 아니다. 자연과 건축, 그리고 인간의 관계를... 지역 경제와 문화 생태계, 관광 산업까지 아우르는 문화 인프라로의 가능성을 열어두고 있다. 민간 주도... "
2026-05-05,네이버뉴스,[패트롤] 구리시-남양주시-안양시-양평군-하남시,https://www.ekn.kr/web/view.php?key=20260505020312148,"구리=에너지경제신문 강근주기자 구리시는 '인창천 생태하천 복원사업' 2구간 착공에 따라 수택동 528번지... 양평군 관광과장은 “시설지원 대상지 선정은 양평의 자연환경과 관광 인프라 경쟁력을 인정받은 결과""라며... "
2026-05-05,네이버뉴스,[6‧3 지방선거] 제주도지사 후보,https://www.jejumaeil.net/news/articleView.html?idxno=400533,"놀이 인프라 구축 △누구나 부담 없이 이용할 수 있는 공공 책임 운영체계 확립을 약속했다. 문 후보는... ""취임 후 임기 1년 내 착공하고 2개소 이상을 건설하겠다""고 밝힌 김 후보는 이를 통해 보건소의 과밀 해소... "
2026-05-05,네이버뉴스,침체 빠진 패밀리랜드·지산유원지…광주 휴양시설 확충 시급,https://www.newsis.com/view/NISX20260504_0003615729,"신규 놀이기구 조성·착공 등 대규모 리모델링에도 최소 2~3년이 소요될 것으로 예상되지만, 그 사이 발생할 콘텐츠 공백과 적자를 메울 방안은 불투명하다. 일부 업체들이 사업 참여 의사를 타진했지만 근본적인 문제가... "
2026-05-05,네이버뉴스,"""집값 향방, 결국 정책에 달렸다""…KB ""올해 상승폭 제한적""",https://www.news1.kr/finance/general-finance/6156253,"입지 인프라 차이에 따른 주택 수요, 우량 주택 선호 현상 등이 복합적으로 작용한 결과다. 특히 다주택자... 우선 정부는 지난 1월 도심에 신도시 2개 합친 것과 유사한 규모인 487만㎡(6만 가구)를 내년부터 착공해... "
2026-05-05,네이버뉴스,[휘발유 2천원 시대] 생산·물류 비용 '쑥'…한국산업 시험대,https://www.yonhapmidas.com/news/articleView.html?idxno=10289,"건설업계에서는 공사비 상승 압박이 가시화하고 있다. 건설기계의 연료비뿐만 아니라 석유화학제품을 원료로 쓰는 창호, 배관, 단열재, 아스팔트, 페인트 등의 가격이 올라서다. 최근 아파트 시공사가 건축조합에... "
2026-05-05,네이버뉴스,"'천정부지' 건설공사비, 중동전쟁발 유가 영향 본격화 우려",https://www.mt.co.kr/estate/2026/05/05/2026050416173523077,건설공사비지수가 기록 행진을 이어가는 가운데 건설업체 폐업 신고 수도 전년 대비 증가세를 기록했다. 특히 중동전쟁 영향이 본격 반영되기 시작하면서 원자잿값 상승세가 한층 가팔라질 수 있다는 전망마저... 
2026-05-05,네이버뉴스,“공급은 줄고 금리는 오르고”…수요 몰리는데 집은 없다 [2026 KB 부동...,https://www.etoday.co.kr/news/view/2581486,"실제 건설공사비지수는 2021년부터 2022년까지 2년간 22.8% 상승했다. 이 같은 환경 속에서 건설사들은 사업 추진에 보수적으로 접근하고 있으며, 재건축 등 정비사업도 공사비 부담으로 지연되는 사례가 늘고 있다. 최근... "
2026-05-05,네이버뉴스,"애플, 삼성·인텔과 파운드리 손잡나… 공급망 다변화 추진",https://it.chosun.com/news/articleView.html?idxno=2023092161529,"5일 블룸버그통신에 따르면 최근 애플은 삼성전자가 미국 텍사스에 건설 중인 반도체 공장을 직접... 공급업체를 확보하고자 하는데, 이는 가격 협상에서 유리한 위치를 점하고 공급 차질 리스크를 줄이기 위한 조치다."
2026-05-05,네이버뉴스,"애플, TSMC 의존 줄이나…인텔·삼성과 칩 생산 협력 검토",https://www.mk.co.kr/article/12035943,지정학적 리스크를 키운다는 판단이다. 대만은 중국과의 긴장이 상존하는 지역으로 공급 차질 가능성이 꾸준히 제기돼 왔다. 애플은 이미 미국 애리조나주 피닉스에 건설 중인 TSMC 공장을 통해 일부 칩을 현지 생산하는... 
2026-05-05,네이버뉴스,"일관 생산체계 구축한 삼미금속, 품질과 납기 두 마리 토끼 잡다",https://www.pinpointnews.co.kr/news/articleView.html?idxno=450539,"자동차 산업에 국한되지 않고 건설기계, 산업기계 등으로 매출을 다변화하여 특정 산업의 경기 변동 리스크를 최소화하고 있다. 최근에는 친환경 상용차 및 방산용 부품 등으로 사업 영역을 넓히며 외형 성장을 꾀하고... "
2026-05-05,네이버뉴스,"""최악 시 노사 공멸"" 삼성전자 의장도 등판…쏟아지는 '파업 자제' 촉구",https://www.newsis.com/view/NISX20260505_0003617245,송헌재 서울시립대 교수는 한 번 이탈한 고객은 돌아오기 어렵다는 점을 들어 영구적인 시장 상실 리스크를... 신 의장은 이번 갈등이 건설적인 노사관계를 구축하는 밑거름이 되도록 경영진과 함께 문제 해결에 최선을... 
2026-05-05,네이버뉴스,"삼성전자 이사회 의장, 노조 파업에 “국가 경제 악영향”...커져가는 파...",https://www.chosun.com/economy/tech_it/2026/05/05/WKPIZVCADFCLJKUH2AF5YJFDBA/?utm_source=naver&utm_medium=referral&utm_campaign=naver-news,실제로 국내외 증권가는 파업 리스크로 삼성전자 실적 전망치를 하향하는 움직임이 나타나고 있다. 주주... 더욱 건설적인 노사 관계를 구축하는 밑거름이 될 수 있도록 함께 노력하자. 저도 경영진과 머리를 맞대고... 
2026-05-05,네이버뉴스,"신제윤 삼성전자 의장, 노사 갈등에 공개 메시지…""대화로 풀어야"" 호소",https://www.ajunews.com/view/20260505101421845,"특히 반도체 산업 특성을 언급하며 리스크를 구체화했다. 그는 ""국가 기반 산업인 반도체 사업은 타이밍과... 이어 ""지금의 갈등이 앞으로 더욱 건설적인 노사관계를 구축하는 밑거름이 될 수 있도록 함께 노력하자""며... "
2026-05-05,네이버뉴스,"삼성전자 노조, '45조' 성과급 요구…총파업 시 타격에 각계 우려",https://www.news1.kr/industry/general-industry/6157178,"이어 ""지금의 갈등이 건설적인 노사관계를 구축하는 밑거름이 되도록 함께 노력하자""며 경영진과 함께 문제... 핵심 리스크로 꼽았다. 이어 ""한 번 이탈한 고객은 다시 돌아오기 어렵다""고 경고했다. AMD와 엔비디아 등... "
2026-05-05,네이버뉴스,"""노사 둘 다 설 자리 없다""…삼성 이사회, 파업에 '초강수 경고'",https://www.newsway.co.kr/news/view?ud=2026050512245545825,"핵심은 '파업 리스크'에 대한 강한 경고다. 신 의장은 ""최악의 상황이 발생하면 노사 모두가 설 자리를 잃게... 더욱 건설적인 노사관계를 구축하는 밑거름이 될 수 있도록 함께 노력하자""고 말했다. 이어 ""저도 경영진과... "
2026-05-05,네이버뉴스,"삼성전자 이사회 의장 ""노사 갈등 장기화 땐 고객 신뢰 잃는다""…대화로...",https://news.ifm.kr/news/articleView.html?idxno=470304,반도체 업황 회복과 인공지능(AI) 수요 확대가 맞물린 시점에 파업 리스크가 현실화될 경우 고객 신뢰와 국가... 또 현재의 갈등이 향후 건설적인 노사관계를 구축하는 계기가 되도록 함께 노력하자고 당부했다. 업계에서는... 
2026-05-05,네이버뉴스,"신제윤 삼성전자 의장 ""반도체 경쟁력 약화 우려…국가 경제 악영향""",https://www.etoday.co.kr/news/view/2581618,"노조 리스크와 관련해 강한 우려를 표명하며 임직원들에게 대화를 통한 문제 해결을 촉구하고 나섰다. 5일... 더욱 건설적인 노사관계를 구축하는 밑거름이 될 수 있도록 함께 노력하자""고 당부했다. 이어 ""저도 경영진과... "
2026-05-05,네이버뉴스,"삼성 성과급發 파업 리스크에…신제윤 의장 ""대화로 해결하자"" 호소",https://www.getnews.co.kr/news/articleView.html?idxno=869362,"신제윤 의장은 노사 화합과 건설적인 관계 구축도 당부했다. 신 의장은 ""지금은 회사가 직면한 무한경쟁... 그는 마지막으로 ""지금의 갈등이 앞으로 더욱 건설적인 노사관계를 구축하는 밑거름이 될 수 있도록 함께... "
2026-05-05,네이버뉴스,"""전쟁에도 돈은 움직인다…AI 투자로 자금 쏠림 가속""",http://www.edaily.co.kr/news/newspath.asp?newsid=02679766645445968,중동 리스크가 자본 흐름에 미칠 영향도 주요 변수로 거론됐다. 론 오핸리 스테이트스트리트 최고경영자(CEO)... 이 과정에서 데이터센터 부지 확보와 건설 수요가 증가하며 상업용 부동산 시장에도 변화가 나타나고 있고... 
2026-05-05,네이버뉴스,"국영석 전 완주사랑지킴이 운동본부장, 무소속 출마 결심 배경 밝혀",http://www.domin.co.kr/news/articleView.html?idxno=1554353,"특히 ""완주군 지역은 최근 완주-전주 통합 논란과 특정인의 부동산 투기 의혹, 사법리스크 등으로 지역사회... 넣는 각오로 그 누구도 넘볼 수 없는 자주독립체로서의 완주 건설에 전력을 다할 것이다""고 거듭 강조했다. 완주="
2026-05-05,네이버뉴스,"[리더 열전] 최문홍 한국기술사회 대구·경북지회장 ""기술사 공공성 강...",https://www.imaeil.com/page/view/2026032512150886917,"그간 기술 자문, 설계 검토, 정책 제안, 사회공헌활동 등을 펼쳐왔고 최근에는 기술사 CPD(지속교육), 리스크 관리, AI·스마트 건설 등 미래기술 대응 역량 강화에도 주력하고 있다. 지회장(제14대)은 올 3월부터 2년 임기로... "
2026-05-05,네이버뉴스,"""애플, 미국 내 핵심 칩 생산 위해 '삼성·인텔' 타진""…TSMC 외에 다변화...",https://www.newspim.com/news/view/20260505000084,"텍사스에서 건설 중인 반도체 공장도 직접 방문하며 협력 가능성을 타진해 왔다고 보도했다. 소식통들은... ◆ ""애리조나 TSMC만으론 부족""…지정학적 리스크 분산 속도 애플이 삼성과 인텔로 눈을 돌리는 이유는 현재... "
2026-05-05,네이버뉴스,"AI發 공급부족에…애플, 삼성·인텔과 파운드리 협력 가능성",https://www.ekn.kr/web/view.php?key=20260505023013490,동시에 애플 경영진들은 현재 미 텍사스주에 건설 중인 삼성전자의 반도체 공장을 방문해 생산 역량을... 대만에 생산이 집중된 구조 역시 잠재적 리스크로 지적된다. 중국이 대만을 자국 영토로 주장하고 있는 만큼... 
2026-05-05,네이버뉴스,"서민 외면해온 상호금융, 제자리 잡나…제도개선 착수",https://www.m-i.kr/news/articleView.html?idxno=1369236,실제 상호금융조합(신협·농협·수협·산림)의 부동산·건설업 대출 비중은 2015년 4.9%에서 2025년 23.7%로... 통합적인 리스크 관리와 내부통제 체계에 한계가 있다는 지적도 이어져 왔다. 이재명 정부는 이와 관련해 대통령... 
2026-05-05,네이버뉴스,[전문가 칼럼] ⑭ 중국 공산당 생존을 위협하는 구조적 부패의 뿌리,https://biz.chosun.com/opinion/expert_column/2026/05/05/ZAE5ZG76FFBJXKZ5NNZPVDLQHA/?utm_source=naver&utm_medium=original&utm_campaign=biz,"최근 중국에서 부패는 단순한 도덕적·사회적 문제를 넘어, ‘공산당의 생존’을 위협하는 체제적 리스크로... 이후 중국에서도 ‘내 집 갖기 운동’이 확산하면서 중국 전역에 부동산 건설 붐이 일었다. 전국이 아파트... "
2026-05-05,네이버뉴스,"[저축銀 자산전환-③] 애큐온저축은행 김희상, 부동산PF 털고 기업금융...",https://www.m-i.kr/news/articleView.html?idxno=1369257,키워드로 '선제적 리스크 관리'와 '자산 포트폴리오 리밸런싱'을 제시하며 안정적인 수익 기반 확보에 집중한다는 방침이다. 핵심 전략은 고위험 자산을 줄이고 기업금융 비중을 확대하는 데 있다. PF와 건설업 익스포저를... 
2026-05-05,네이버뉴스,"전북 제3금융중심지 조성, 공공 금융기관 유치로 '완성'",https://www.ajunews.com/view/20260505091249786,"한국투자공사(KIC), 9대 공제회(군인 경찰 교직원 대한지방행정 과학기술인 대한소방 한국지방재정 건설근로... 현재 전국에 분산된 공적 자산운용 기능이 한 지역에서 공동투자·정보공유·리스크관리 협력체계로 통합될... "
2026-05-05,네이버뉴스,"AI가 끌고 실적이 민다 … 증권가 ""5월도 비중 확대""",https://biz.newdaily.co.kr/site/data/html/2026/05/04/2026050400066.html,"조선, 건설, IT소부장이 관심 업종으로 제시됐다. 여기에 신고가 돌파를 사상 최대 실적이 뒷받침하는 반도체, 기계, 방산, 화장품도 5월 주목 업종으로 거론됐다. ◆인플레이션 리스크에 6월은 주의해야 반면 인플레이션... "
2026-05-05,네이버뉴스,"[아주사설 | 기본·원칙·상식]  SK온·닛산, 배터리 계약 전면 재검토....",https://www.ajunews.com/view/20260505082154757,"재무 리스크로 전환된다. 계약 재검토는 이러한 현실을 반영한 조정으로 볼 수 있다. 문제는 이 사안이 개별 기업의 문제가 아니라는 점이다. 최근 글로벌 배터리 업계에서는 투자 속도 조절, 공장 건설 지연, 계약 조건... "
2026-05-05,네이버뉴스,[핀테크핫이슈] 스테이블코인 주도권 경쟁...코스피 '7000선' 눈앞,https://www.digitaltoday.co.kr/news/articleView.html?idxno=662527,"⦁신한은행, 빅바이트컴퍼니와 공동마케팅...""나라사랑카드 혜택 강화"" ⦁하나은행, HD건설기계·신보와... 한편 AI 기반 금융 콘텐츠 확산과 함께 정보 진위 검증 필요성도 커지며 새로운 리스크 요인으로 부각되고 있다.... "
2026-05-05,네이버뉴스,업황 부진 이어온 철강업계...올 하반기부터는 반등 조짐,http://www.inews24.com/view/1965624,"국내 철강업계는 중국발 저가 공세와 건설 경기 침체 등의 이유로 업황 부진을 이어왔다. 올해 1분기에는... 포스코홀딩스 관계자는 ""향후 중동의 지정학적 리스크가 해소돼 환율 및 유가 상승에 따른 원료비와 운송비... "
2026-05-05,네이버뉴스,"김석필 천안시장 권한대행 ""지방선거 엄정 관리·5월 안전 행정 총력""",https://www.ccdailynews.com/news/articleView.html?idxno=2414146,"달라""며 ""안전사고 제로를 목표로 우천 등 돌발 상황에 대비한 이중·삼중의 안전망을 구축하라""고 강조했다.... 또 도로변 제초작업 등 환경 정비를 상시 추진하고 세종-안성 고속도로 건설공사로 단절된 은석산·작성산 등... "
2026-05-05,네이버뉴스,"[김경은 여행작가의 한중일(韓中日) 문화 엿보기(17)] '닮음과 다름', 주...",https://www.ilyoseoul.co.kr/news/articleView.html?idxno=516456,"아파트 공화국, 노태우 정권 '200만호 건설 사업' 시초 먼저 한국의 아파트 변천사를 훑어보자. '한국은... 혹시 불의의 안전사고를 막기 위해 유리창을 두지 않는다. 또 비상탈출구로 활용하기 위해 쉽게 부서지는... "
2026-05-05,네이버뉴스,"'자격증의 달' 5월…""인생전환 취업 사다리 수두룩""",https://www.newsis.com/view/NISX20260504_0003616390,"중대재해처벌법 강화 기조 속 유망 자격증으로 부상한 '건설안전기사'도 소방설비기사(전기 분야)와 동일한 일정으로 운영된다. 환경·정보통신(IT) 분야 시험인 '에너지관리기사', '대기환경기사' 시험도 이달... "
2026-05-05,네이버뉴스,"젠슨 황 ""앤스로픽-국방부 갈등, 기업이 나설 문제 아냐""",http://www.inews24.com/view/1965694,"황 CEO는 의료·자율주행 등 산업별 AI 규제 방향과 일자리 창출 가능성에 대해서도 견해를 내놨다. 그는 AI... 팩토리를 건설해 재산업화할 수 있는 최고의 기회이며, 향후 4~5년간 수십만 개의 일자리를 창출할 것""이라고... "
2026-05-05,네이버뉴스,젠슨 황 “의료·자동차·국방 등에선 AI 규제해야”,https://www.hankyung.com/article/202605056382i,"적합한 규제를 만들어야 한다고 강조했다. 안전한 AI 기술을 만드는 것이 업계의 책임이라는 이유에서다. 황... 그는 “AI는 미국이 칩 공장, 컴퓨터 공장, AI 팩토리를 건설하여 재산업화할 수 있는 최고의 기회이며, 이는... "
2026-05-05,네이버뉴스,"[Spotlight] 한중 기업간 분쟁 해결은 상사조정으로, 중국 '상사조정조례...",http://www.legaltimes.co.kr/news/articleView.html?idxno=93568,"둘째, 분쟁 유형을 기준으로, 적용 분야는 무역, 투자, 금융, 운송, 부동산, 건설공사, 지식재산권 등 상업... 효과적인 규제 수단이 부족하였다. 는 설립 신청, 영업허가증 발급, 정보 공개에서부터 위반 시... "
2026-05-05,네이버뉴스,"의료폐기물 몰린 경북…시민단체 ""난개발 방지 조례 공약화해야""",https://www.newsis.com/view/NISX20260505_0003617162,포항시 북구 청하면에서는 주민 90% 이상이 반대 서명에 참여했음에도 의료폐기물 소각장 건설이 추진되고... 경북에는 환경영향평가 대상을 강화하는 별도 조례가 없어 규제가 상대적으로 느슨하다는 지적도 나온다. 이로... 
2026-05-05,네이버뉴스,"겨우 적자 탈출인데… 태광그룹 계열 저축은행, 올해 영업 빨간불",https://www.mt.co.kr/finance/2026/05/05/2026042714455244928,양사는 건설업과 부동산 PF 위기에서 가까스로 벗어나 지난해 흑자 전환에 성공한 상황이라 이번 규제가 더 타격이 크다. 5일 금융권에 따르면 고려·예가람저축은행은 금융당국으로부터 올해 가계대출 취급... 
2026-05-05,네이버뉴스,"“폐어망이 명품 원료로”…韓 포어시스, 유럽 순환경제 시장 뚫었다",https://www.etnews.com/20260505000020,특히 유럽의 엄격한 환경 규제와 공급망 기준을 충족했다는 점에서 향후 추가 수출 확대 가능성도 크다는... 공장 건설을 진행 중이다. 글로벌 스포츠웨어 기업 아디다스도 지난해 전체 제품의 약 60%에 재활용 또는... 
2026-05-05,네이버뉴스,"[인터뷰] 김선교 ""율사 출신 추미애·조응천…'반도체 전문가' 양향자 넘...",https://www.sisajournal.com/news/articleView.html?idxno=371757,"실제 반도체 산업이 증시에도 영향을 줄 만큼 파급력이 큰 상황이고, 건설업 침체나 인력 부족 문제 등 경제... 농지 전수조사 역시 투기를 방지한다는 명분은 있지만 대출 규제 등 현실적인 여건을 고려할 때 실효성에... "
2026-05-05,네이버뉴스,[우리 만남은] 노동절 청계광장 재봉틀 소리와 '봉제인 김우중'의 바람,https://www.shinailbo.co.kr/news/articleView.html?idxno=5017618,"전국 공제회' 건설 △패션·봉제인 정부·지자체 지원 제도 개선을 5대 사업 목표로 설정했다. 김 지회장은 ""패션, 봉제가 지금 사양 산업에 들어와 있다. 일하는 분들 연령대가 높고 새롭게 배우려는 이들이 많지 않다. 이런... "
2026-05-05,네이버뉴스,[패트롤] 과천시-광명시-군포시-시흥시-안양시,https://www.ekn.kr/web/view.php?key=20260505022192178,한편 시민안전보험에 대한 보장 내용과 보험금 청구 방법 등은 한국지방재정공제회 콜센터(1577-5939)를 통해... 안양=에너지경제신문 강근주기자 최대호 더불어민주당 안양시장 후보가 4일에도 사회복지사협의회-건설업협... 
