date,source,title,link,description
2026-06-08,네이버뉴스,"신동빈 회장, 글로벌 확장한 롯데호텔 '엄지 척'",https://www.shinailbo.co.kr/news/articleView.html?idxno=5028423,브랜드와 디자인의 전략적 가치를 확대하기 위해 올해 신설된 브랜드·CX 디자인 부문에서는 △'르엘'로 하이엔드 주거 브랜드 자산을 구축한 롯데건설 △공간 리뉴얼을 통해 고객에게 일관된 경험을 제공하고 글로벌... 
2026-06-08,네이버뉴스,[산업 브리핑] 롯데·LG·네이버·삼성전자,http://www.niceeconomy.co.kr/news/articleView.html?idxno=89996,"R&D 부문에서는 롯데기초소재가 명단에 이름을 올렸고, 올해 신설된 브랜드·CX디자인 부문에서는 롯데건설과 롯데GRS가 수상했다. 또 챌린지 부문은 롯데정밀화학이 차지했다. [사진 = LG 제공] ◇ LG, 엔비디아와 AI 분야... "
2026-06-08,네이버뉴스,신동빈 회장 “과감한 도전으로 경쟁력 높여달라”…롯데 어워즈 개최,https://www.mydaily.co.kr/page/view/2026060816411213507,올해 신설된 브랜드·CX 디자인 부문에서는 하이엔드 주거 브랜드 ‘르엘’의 브랜드 자산을 구축한 롯데건설과 공간 리뉴얼을 통해 고객 경험을 개선한 롯데GRS가 수상했다. 도전 문화를 장려하기 위해 마련된 챌린지... 
2026-06-08,네이버뉴스,"신동빈 ""과감한 도전으로 경쟁력 높인다""…롯데호텔에 '대상'",https://biz.sbs.co.kr/article_hub/20000315201?division=NAVER,"브랜드와 디자인의 전략적 가치를 확대하기 위해 올해 신설된 브랜드∙CX 디자인 부문에서는 ‘르엘’로 하이엔드 주거 브랜드 자산을 구축한 롯데건설, 공간 리뉴얼을 통해 고객에게 일관된 경험을 제공하고 글로벌... "
2026-06-08,네이버뉴스,롯데호텔 '2026 롯데 어워즈' 대상,https://www.newsclaim.co.kr/news/articleView.html?idxno=3065812,하이엔드 주거 브랜드를 구축한 롯데건설의 '르엘'과 공간 리뉴얼을 단행한 롯데GRS의 '롯데리아'가 첫 수상의 영예를 안았습니다. 이외에도 R&D 부문은 배터리 분리막용 PP 제품을 개발한 롯데기초소재가 수상했습니다.... 
2026-06-08,네이버뉴스,"롯데그룹, ‘2026 롯데 어워즈’ 개최… 신동빈 “저력믿고 과감하게 전...",https://www.donga.com/news/Economy/article/all/20260608/134071132/1,기업 정체성의 가치를 극대화하기 위해 첫선을 보인 브랜드·CX디자인 부문은 프리미엄 아파트 브랜드 입지를 다진 롯데건설의 ‘르엘’과 매장 환경 정비로 해외 진출 발판을 마련한 롯데GRS에 돌아갔다. 실패를... 
2026-06-08,네이버뉴스,"롯데호텔앤리조트, 2026 롯데어워즈 대상…신동빈 ""과감한 도전 이어가...",https://www.delighti.co.kr/news/articleView.html?idxno=117428,첫 수상자로는 하이엔드 주거 브랜드 '르엘'을 구축한 롯데건설과 롯데리아의 글로벌 확장 기반을 마련한 롯데GRS가 선정됐다. 도전 문화를 장려하기 위해 마련된 챌린지 부문은 롯데정밀화학이 수상했다. 챌린지 부문... 
2026-06-08,네이버뉴스,"한양대, 대·중견기업-스타트업 협업 지원행사 개최",https://www.joongang.co.kr/article/25434858,"이날 행사에는 위정환 매일경제 대표, 김민수 한양대 부총장, 류창완 한양대 창업지원단장을 비롯해 교보생명·롯데건설·CJ ENM·호반그룹·녹십자홀딩스 등이 참여했다. 포스코기술투자·신한벤처투자·퓨처플레이... "
2026-06-08,네이버뉴스,"""APEC정상회의 '의전·케이터링' 엄지척"" 롯데어워즈 대상에 '호텔앤리조...",https://www.catchnews.kr/news/articleView.html?idxno=124739,"신설된 브랜드·CX디자인부문에서는 롯데건설('르엘' 하이엔드 주거브랜드)과 롯데GRS(공간 리뉴얼)가 선정됐다. 챌린지부문은 친환경 고흡수성 수지를 개발한 롯데정밀화학이 차지했다. 회사 관계자는 ""당초 기저귀... "
2026-06-08,네이버뉴스,"롯데호텔, 롯데 어워즈 대상…신동빈 ""위기 속 저력 믿고 도전""",https://www.asiatoday.co.kr/kn/view.php?key=20260608010002589,새롭게 신설된 '브랜드·CX디자인' 부문에서는 하이엔드 주거 브랜드 '르엘'을 앞세운 롯데건설과 공간 리뉴얼을 통해 고객 경험을 강화한 롯데GRS가 수상했다. 정문경
2026-06-08,네이버뉴스,"APEC부터 친환경 소재까지… 롯데, '2026 롯데 어워즈'로 조명한 미래 경...",https://www.e-science.co.kr/news/articleView.html?idxno=130345,첫 수상자는 하이엔드 주거 브랜드 '르엘'을 구축한 롯데건설과 매장 공간 혁신을 통해 브랜드 경험을 강화한 롯데GRS였다. 특히 롯데GRS는 롯데리아 매장 리뉴얼 과정에서 공간 디자인과 고객 동선을 개선해 일관된... 
2026-06-08,네이버뉴스,신동빈 “과감한 도전으로 경쟁력 높여야”…롯데 어워즈 개최,https://www.thepowernews.co.kr/view.php?ud=202606081611361312de3f0aa1be_7,올해 새로 마련된 브랜드·CX디자인 부문에서는 롯데건설과 롯데GRS가 수상했다. 롯데건설은 하이엔드 주거 브랜드 ‘르엘’을 통해 브랜드 자산을 구축한 점을 인정받았다. 롯데GRS는 공간 리뉴얼을 통해 고객 경험을... 
2026-06-08,네이버뉴스,"롯데그룹, '롯데 어워즈' 개최…글로벌 브랜드 경쟁력 제고",https://www.pinpointnews.co.kr/news/articleView.html?idxno=458444,"브랜드와 디자인의 전략적 가치를 확대하기 위해 올해 신설된 브랜드∙CX 디자인 부문에서는 '르엘'로 하이엔드 주거 브랜드 자산을 구축한 롯데건설, 공간 리뉴얼을 통해 고객에게 일관된 경험을 제공하고 글로벌 확장... "
2026-06-08,네이버뉴스,"신동빈 롯데 회장 ""위기 속 과감한 도전으로 경쟁력 높여달라""",https://www.mt.co.kr/living/2026/06/08/2026060816072426981,올해 신설한 브랜드·CX 디자인 부문에선 '르엘'로 하이엔드 주거 브랜드 자산을 구축한 롯데건설과 공간 리뉴얼을 통해 글로벌 확장 기반을 마련한 롯데GRS가 수상했다. 또한 도전 문화를 장려하기 위한 챌린지 부문은... 
2026-06-08,네이버뉴스,"신동빈 회장이 다시 꺼낸 '도전 DNA'...롯데호텔, APEC 성과로 롯데어워...",https://www.insight.co.kr/news/557548,첫 수상사는 롯데건설과 롯데GRS다.롯데건설은 하이엔드 주거 브랜드 '르엘'로 수상했다. 롯데GRS는 매장 공간 리뉴얼을 통해 고객 경험을 정비하고 글로벌 확장 기반을 마련한 점이 반영됐다.챌린지 부문은... 
2026-06-08,네이버뉴스,"APEC 치른 롯데호텔앤리조트, 롯데어워즈 대상 받았다",https://news.tvchosun.com/site/data/html_dir/2026/06/08/2026060890255.html,첫 수상사로는 하이엔드 주거 브랜드 ‘르엘’을 만든 롯데건설과 롯데리아의 글로벌 확장 기반을 마련한 롯데GRS가 선정됐다. 도전 문화를 장려하기 위해 만든 챌린지 부문은 롯데정밀화학이 받았다. 챌린지 부문... 
2026-06-09,네이버뉴스,[Who Is ?] 전우종 SK증권 대표이사 사장,https://www.businesspost.co.kr/BP?command=article_view&num=439170,"사업엔 대표사인 케슬러 컬렉션을 비롯 다올자산운용, 갤럭시코퍼레이션 등이 전략적 출자자로 참여하며 시공은 포스코이앤씨가 맡고 SK증권은 금융 구조 설계와 단계별 자금조달 전략 수립을 담당한다. 앞서... "
2026-06-09,네이버뉴스,"공정위, 하도급ㆍ유통ㆍ가맹 10만곳 동시 실태조사...“건설 안전비용 ...",https://www.dnews.co.kr/uhtml/view.jsp?idxno=202606081438270700473,"공정위는 지난 2월 포스코이앤씨, 케이알산업, 다산건설엔지니어링, 엔씨건설 등 4개 건설사에 하도급법 위반 혐의 심사보고서를 발송하고 제재 절차에 착수한 바 있다. 포스코이앤씨는 건설장비 방호장치 설치비용을... "
2026-06-08,네이버뉴스,"노란봉투법 3개월…원청, 사용자로 대부분 인정",https://www.hankyung.com/article/2026060841511,"예를 들어 제조·건설업 대표 사례인 포스코와 포스코이앤씨 사건에서 산업안전과 작업환경 관리가, 백화점·면세점 입점업체 근로자에 대한 원청의 사용자성을 처음 인정한 제주국제자유도시개발센터 사건에서는... "
2026-06-09,네이버뉴스,"[발로 뛰는 건설사 CEO] 세계로 세계로…삼성E&A 남궁홍, 포트폴리오 확...",https://www.shinailbo.co.kr/news/articleView.html?idxno=5027918,전례 없는 위기 속에서 건설사 CEO(최고경영자)의 시계는 빠르게 흐르고 있다. 주요 건설사 CEO의 행보를... 삼성E&A의 올해 1분기 기준 수주잔고는 20조6237억원으로 지난해 말보다 16.1% 많다. 1분기 수주잔고를 지난해... 
2026-06-08,네이버뉴스,"현대엔지니어링, 카자흐스탄 대형 가스처리시설 수주…상생협력 강화로...",http://www.biztribune.co.kr/news/articleView.html?idxno=354489,현대엔지니어링은 해외 수주 확대와 함께 협력사와의 상생경영 강화에도 힘을 쏟고 있다. 회사는 지난달 28일 서울 동작구 전문건설회관에서 열린 '건설산업 상생협력 및 공정거래 협약식'에 참여해 공정거래위원회... 
2026-06-08,네이버뉴스,"지방 미분양·PF 부담 속 동부건설, 주택 비중 16% 안팎 관리",https://www.wolyo.co.kr/news/articleView.html?idxno=313265,"높은 건설사의 부담이 커지고 있다. 주택사업은 분양 성적과 금융비 부담이 실적에 직접 영향을 주는 만큼, 공공·토목·비주택 수주 기반의 중요성도 함께 커지고 있다. 동부건설은 주택사업을 배제하지는 않지만 사업별... "
2026-06-08,네이버뉴스,이겼지만 '못 웃는' 전남·전북 당선인들…떨리는 경찰 칼끝 '6개월',https://www.sisajournal.com/news/articleView.html?idxno=375757,경찰은 이미 담양군을 상대로 정 후보 측 연루 의혹이 있는 건설사 3곳의 지난 2014년부터 올해 5월까지의 공사... 유희태 완주군수 당선인은 공사 수주를 대가로 한 여론조사 응답 강요 및 차명 부동산 투기 의혹으로... 
2026-06-08,네이버뉴스,수주는 반등했는데 현장은 왜 더 힘드나···건설경기 '통계의 역설',https://www.koscaj.com/news/articleView.html?idxno=324503,수주 반등이라는 통계적 신호가 현장의 실제 회복으로 이어지기까지는 상당한 시간이 필요하다는 것이 업계의 공통된 진단이다. 전문건설업체를 중심으로 한 중소 건설사들이 그 시간을 버텨낼 수 있을지가 올 하반기... 
2026-06-08,네이버뉴스,'가짜 인천본사' 건설사 실태조사 강화 조례 추진,https://www.joongboo.com/news/articleView.html?idxno=363728225,"사진=중부일보DB공사 수주를 위해 인천에 최소 인력만 둔 채 본사를 운영하는 이른바 '가짜 인천본사' 건설사 문제가 지속(중부일보 2월 11일자 1면 보도)되는 가운데, 관련 실태조사를 강화하는 내용의 조례 개정이 추진돼... "
2026-06-08,네이버뉴스,"IPARK현산, 강서습지 생태계 교란식물 퇴치",https://www.polinews.co.kr/news/articleView.html?idxno=733454,"건설업계는 대형 건설사들의 움직임이 향후 수주 경쟁력과 기업 가치 평가에 직간접적인 영향을 미칠 것으로 내다보고 있다. 최근 한국ESG기준원(KCGS) 등 국내외 평가 기관의 기준이 고도화되면서, 실질적인 탄소 배출... "
2026-06-08,네이버뉴스,"삼성E&A 중동 재건·반도체 순풍 분다, 남궁홍 역대 최고 수주 달성 기대...",https://www.businesspost.co.kr/BP?command=article_view&num=439501,"삼성E&A는 최근 10년 동안 중동 지역에서 수주 규모가 238억 달러(약 35조2500억 원)으로 국내 건설사 가운데 가장 많다. 게다가 이들 수주는 모두 화공 플랜트, 에너지 등 산업 인프라 등이다. 산업 인프라는 높은 수준의... "
2026-06-08,네이버뉴스,"“지방선거 끝났는데, 다음 수혜주는 뭐지?”…당선자 공약 보면 답 보...",https://www.mk.co.kr/article/12068559,"지방자치단체들이 도로와 철도, 도시재생 사업, 공공시설 확충 등을 추진할 경우 관련 수주 물량이 늘어날 수 있기 때문이다. 특히 지방 정부가 추진하는 신도시 개발과 생활 인프라 구축 사업이 확대될 경우 중견 건설사와... "
2026-06-08,네이버뉴스,페루 대선 결선서 '우파' 후지모리 앞서... 19세에 '페루 영부인' 역할,https://www.hankookilbo.com/news/article/A2026060809420005037?did=NA,이후 부패 혐의와 건설사로부터 부당하게 대선 자금을 받은 혐의 등으로 13년간 수감 생활을 했다.... 4월 1차 투표에서도 운영상의 문제로 개표 작업이 수주간 걸리는 등 난항을 겪었다. 페루에서는 최근 10년간 9명의... 
2026-06-09,네이버뉴스,"우미건설, 종속기업 '14→7개'로 줄였다…전문화 체계 구축",https://www.fetv.co.kr/news/articleView.html?idxno=303855,최근 우미건설은 사업 주주사가 직접 참여하는 구조 아래 1차 사업 시공사로 선정됐다. 이는 단순 시공을 넘어 사업 전반에 관여하는 디벨로퍼 역할을 강화한다는 점에서 의미가 크다. 챔피언스시티는 약 29만8000... 
2026-06-09,네이버뉴스,[어떻게 생각하십니까] 정비사업 CM 43%만 ‘풀 CM’...득일까 실일까,https://www.dnews.co.kr/uhtml/view.jsp?idxno=202606070222031210288,"이외 정비사업 조합은 설계 검증부터 시공사 선정까지 프리콘(시공 전) 단계 업무를 맡기는 '프리콘 CM'이나, 혹은시공사 선정만을 지원하는 CM 용역을 발주했다. 조합의 프리콘 CM발주는 점차 늘어나는 추세다.... "
2026-06-08,네이버뉴스,한자신·하나자산 등 목동 집결…8개 단지 신탁방식 추진 [신탁 부흥기...,http://www.fntimes.com/html/view.php?ud=202606081805394894048b718333_18,"신탁 방식은 신탁사가 사업시행자가 돼 사업비 집행과 자금 관리, 인허가 지원, 시공사 선정 등 사업 전반을 담당하는 구조다. 건설사가 실제 시공을 맡는다면 신탁사는 사업을 관리하는 역할을 수행한다. 업계에서는... "
2026-06-08,네이버뉴스,"선학원, 선우공제회 정신 이은 '노후수행관' 첫 삽",http://www.bulkyo21.com/news/articleView.html?idxno=64334,"2025년 8월 건축허가를 완료하고, 올해 5월 시공사 업체선정 및 계약을 완료하고 이날 기공식을 가졌다. 식전 행사, 기접.ⓒ2026불교닷컴 기공식에서는 홍룡사 합창단과 btn 남성중창단이 음성공양으로 노후복지시설 건립의... "
2026-06-08,네이버뉴스,"일신건영, 이천 최중심 갈산동에 ‘이천 휴먼빌 클래스원’ 7월 분양",https://www.hankyung.com/article/202606083922i,"일신건영은 앞서 공급한 ‘이천 휴먼빌 에듀파크시티’에서 입주민들에게 높은 평가를 받았을 뿐 아니라 이 단지를 통해 ‘2025년 경기도 공동주택 우수시공사’로 선정된 바 있으며 최근 평택, 일산, 여주, 천안 등에서도... "
2026-06-08,네이버뉴스,(단독)시공사·대행사도 없는데 해외서 '청약' 돌입…인천글로벌시티 '...,http://www.newstomato.com/ReadNews.aspx?no=1303290&inflow=N,"인천글로벌시티는 지난 3월23일 호반건설을 우선협상대상자로 선정한 뒤 도급계약을 추진했으나 협상이 결렬됐고, 지난 2일 시공사 선정 재입찰 공고를 다시 냈습니다. 청약 안내문 자체에서도 ""예상 공급 금액""이 ""미정... "
2026-06-08,네이버뉴스,"[도시정비시장 풍향계] 의정부 가능6구역 1차 유찰…조합, 9일 재공고",https://www.dnews.co.kr/uhtml/view.jsp?idxno=202606081529321050494,경기 의정부 가능6구역 재개발 조합이 시공사 선정에 재도전한다. 가능6구역 재개발 정비사업 조합은 8일 시공사 선정을 위한 1차 입찰을 마감했다. 그 결과 참석한 건설사가 없어 무응찰로 유찰됐다. 앞서 지난... 
2026-06-08,네이버뉴스,건설현장 안전책임 강화 추진… 발주자·설계자 책임 확대 법안 발의,https://www.energydaily.co.kr/news/articleView.html?idxno=200209,현행 제도에서는 건설공사 발주자가 설계자와 시공사를 선정하고 공사기간과 비용을 결정하는 등 건설현장의 안전 수준에 큰 영향을 미치고 있음에도 산업재해 예방과 관련한 책임은 상대적으로 제한적이라는 지적이... 
2026-06-08,네이버뉴스,"'용인반도체클러스터 천연가스공급시설 건설 공사' 주민설명회, 결론 없...",https://www.incheonilbo.com/news/articleView.html?idxno=1324704,인천일보 취재를 종합하면 시공사인 SK엔지니어링은 현재 반도체 팹(Fab)동 부근인 원삼면 독성리에서... 첫째는 노선 선정의 불합리성이다. 대구경 고압 가스관의 경우 통상 주거지와 격리된 국도 노선을 따라 직선... 
2026-06-08,네이버뉴스,"'가스공사 참여' LNG 캐나다 2단계 최종투자결정 임박…""제한적 착수 통...",https://www.theguru.co.kr/news/article.html?no=102680,현지 시공사에서 공사 시작을 알리는 전 단계인 '제한착수지시서(Limited Notice To Proceed·LNTP)'를... 파트너로 선정돼 1·2단계 사업의 EPC(설계·조달·시공)를 수행하고 있다. 피에르 베셸라니(Pierre Bechelany) 플루어... 
2026-06-09,네이버뉴스,재건축·재개발만 외친 여야…‘서울시장 선거=부동산’ 공식만 재확인,https://www.khan.co.kr/article/202606090600071,"여야 모두 재개발·재건축 지역 표심에만 호소하며 차별화된 정책을 내놓지 않았고 서울시장 선거가... 성동구에서는 성수전략정비구역이 있는 성수1·2가 제1동과 옥수동, 마포구에서도 집값이 높은 마포갑(공덕·아현... "
2026-06-08,네이버뉴스,"“팝업 성지에서 도시로”…성수, 유행 넘어 ‘머무는 상권’ 됐다",https://www.segye.com/newsView/20260608519541?OutUrl=naver,"크래프톤 사옥을 비롯해 삼표레미콘 부지 개발, 부영호텔 부지 개발, 성수전략정비구역 재개발 등이 예정돼 있다. 쿠시먼앤드웨이크필드 코리아 관계자는 “성수는 소비를 위해 잠시 방문하는 곳을 넘어 사람들이... "
2026-06-08,네이버뉴스,"[박용준의 어부바] 부동산벨트에 막힌 정부, 잡을 토끼가 둘로 늘었다",https://www.ajunews.com/view/20260608165840897,"압구정·여의도·목동·성수처럼 재건축에 미래를 건 동네가 한 방향으로 쏠렸다. 오세훈 시장은 한강을 낀... 공급 대책을 속도 내 곧 발표하겠다며 재건축·재개발을 서두르겠다고 했고, 동시에 “부동산 투기 공화국에서... "
2026-06-09,네이버뉴스,‘찬성’ 요구한 기장군…여론조사 개입 논란,https://news.kbs.co.kr/news/pc/view/view.do?ncd=8581266&ref=A,"한국수력원자력 부지선정 평가위원회는 부지 적정성과 환경성, 건설 적합성, 주민 수용성 등 4개 분야를... 기장군 원전 정책과가 주민들에게 나눠준 안내문입니다. 여론조사 발신 번호와 함께, ""반드시 유치 찬성으로... "
2026-06-09,네이버뉴스,"中, ‘인공태양’ 독자 생태계 구축…한국 배제형 공급망 우려 고조",https://www.g-enews.com/view.php?ud=202606090601173570fbbec65dfb_1,"허페이에서 건설 중이며, 2027년 말 완공을 목표로 한다. BEST는 외부 가열 없이 플라즈마가 스스로 연소를... 나아가 2030년 전후를 목표로 융합과 분열을 연계 활용하는 상용 하이브리드 원전 ‘싱훠’(Xinghuo)... "
2026-06-09,네이버뉴스,AI 패권 2막 열렸다…엔비디아와 뛰는 K기업들,https://www.ebn.co.kr/news/articleView.html?idxno=1711697,"두산밥캣 역시 건설·물류 장비에 피지컬 AI 기술을 적용하는 방안을 추진한다. AI 인프라 분야에서는 SK와... 두산에너빌리티의 가스터빈과 소형모듈원전(SMR), 두산퓨얼셀의 수소연료전지 역시 엔비디아 AI... "
2026-06-09,네이버뉴스,데이터센터 옆 발전소...전력 직거래로 '피지컬 AI 요람' 구현,https://www.ajunews.com/view/20260608133431285,코로케이션 개발은 AI 데이터센터 바로 옆에 발전소를 건설하는 방식으로 송전 거리가 '0'에 수렴해 전력 직거래를 위한 전초 작업으로 불린다. 아마존 등 미국 기업은 AI 데이터센터에 소형 원전을 붙여 짓는 원전... 
2026-06-09,네이버뉴스,"두산, 엔비디아發 AI 확장 속 전력·로봇·소재 삼각축 맡는다",https://www.newsis.com/view/NISX20260608_0003660791,"두산에너빌리티는 가스터빈과 소형모듈원전(SMR) 기술을 보유하고 있으며, 두산퓨얼셀은 수소연료전지를... 두산과 엔비디아 양사는 향후 건설·조경·농업·물류 장비에 AI 기술을 접목하고 산업 현장에 특화된 월드... "
2026-06-09,네이버뉴스,군수 바뀌어도 변함 없다…영덕 주민 86% 원전 유치 찬성,https://www.joongang.co.kr/article/25434967,"앞서 영덕군은 지난 1월 30일 한국수력원자력이 ‘신규 원전 건설부지 유치’에 관한 공모를 발표한 직후부터 주민 의견 수렴을 시작하는 등 원전 유치에 뛰어들었다. 원전 부지 공모에는 4개 지자체가 참여했는데, 1.... "
2026-06-08,네이버뉴스,“반드시 찬성해 달라”…기장군 여론 유도,https://news.kbs.co.kr/news/pc/view/view.do?ncd=8580911&ref=A,"한국수력원자력 부지선정 평가위원회는 부지 적정성과 환경성, 건설 적합성, 주민 수용성 등 4개 분야를... 기장군 원전 정책과가 주민들에게 나눠준 안내문입니다. 여론조사 발신 번호와 함께, ""반드시 유치 찬성으로... "
2026-06-08,네이버뉴스,"""지금은 한국의 시간""…젠슨 황, AI 팩토리·피지컬 AI 동맹 띄웠다",http://www.4th.kr/news/articleView.html?idxno=2112891,"막대한 자본과 에너지, 제조 역량이 필요한 만큼 원전과 제조 기반을 갖춘 한국이 이를 뒷받침할 수... 두산밥캣은 건설·조경·농업·물류 장비에 피지컬 AI 기술을 적용하는 방안을 추진한다. ㈜두산 전자BG는 AI... "
2026-06-08,네이버뉴스,"김정관 산업통상부 장관, 카자흐·중동·체코 방문…에너지·자원 수급...",http://www.econonews.co.kr/news/articleView.html?idxno=439385,"두코바니 신규 원전 사업은 한국수력원자력이 주도하는 약 26조원 규모 프로젝트로, 체코 두코바니 지역에 한국형 원전 APR1000 2기를 건설하는 사업이다. 또  '제3차 장관급 한·체코 공급망·에너지 대화'를 통해 첨단로봇... "
2026-06-08,네이버뉴스,"두산그룹, 엔비디아와 피지컬 AI 협력…에너지·로봇으로 확장",https://www.mediapen.com/news/view/1103282,"두산에너빌리티의 가스터빈과 소형모듈원전(SMR), 두산퓨얼셀의 수소연료전지가 AI 팩토리의 전력 안정성과... 건설, 조경, 농업, 물류 장비에 피지컬 AI 기술을 접목해 다양한 작업 환경을 스스로 인식하고, 상황을 판단해... "
2026-06-08,네이버뉴스,"佛 EDF '보조금 딴지' 끝났다…EU, 한수원 역외보조금 무혐의 결론",https://www.greened.kr/news/articleView.html?idxno=342098,"체코 두코바니 원전. 한수원 제공 한국수력원자력(한수원)을 비롯한 '팀코리아'가 수주한 체코 두코바니 원자력 발전 건설 사업이 유럽연합(EU)의 역외보조금 규제라는 큰 고비를 넘겼다. 8일 한수원에 따르면, 지난 5일... "
2026-06-08,네이버뉴스,"두산그룹, 엔비디아와 AI 팩토리·피지컬AI 고도화 추진",https://www.munhwa.com/article/11594071?ref=naver,"젠슨 황 엔비디아 CEO는 “한국은 세계적인 제조업 중심 국가로, 세상을 건설하고 이동시키며 에너지를... 두산에너빌리티의 가스터빈과 소형모듈원전(SMR), 두산퓨얼셀의 수소연료전지 등 두산의 다양한 에너지... "
2026-06-08,네이버뉴스,"""꼭 부셔야 하나?""···韓 과기 출발점 공중분해 '기로' ""우수 인재 키...",http://www.hellodd.com/news/articleView.html?idxno=112023,"원자력공학 전공 대학생 1719명과 원전 운영 인력 1339명이 이곳에서 실습 교육을 받았다. 미국에 연구용... 설계와 건설로 이어졌다. 나아가 한국이 원자로 설계와 제작, 운영 역량을 확보하고 연구로 수출국으로 성장하는... "
2026-06-08,네이버뉴스,"네이버·두산, 엔비디아와 ‘동맹’…AI 팩토리·로봇 '협력'",https://www.sentv.co.kr/article/view/sentv202606080079,두산밥캣의 건설 장비는 자율주행 장비로 진화시킵니다. 여기에 차세대 AI 서버용 소재를 만드는 ㈜두산 전자BG까지 동맹에 합류했습니다. 두산은 소형모듈원전(SMR)과 가스터빈 기술을 앞세워 엔비디아 측에 전력... 
