date,source,title,link,description
2026-06-08,네이버뉴스,"반도체 넘어 AI 인프라로…젠슨 황, 한국과 'AI 생태계' 구축",https://news.mtn.co.kr/news-detail/2026060816393826698,"내년 상반기 중 55메가와트 규모의 AI팩토리를 착공하고, 같은 해 100메가와트, 그 이듬해인 2028년에... 고성능 인프라 플랫폼인 'DSX'에 적용키로 했습니다. AI 팩토리가 확대되는 만큼, 네이버의 글로벌 영향력도 커지는... "
2026-06-08,네이버뉴스,"전주교대, 본부동 리모델링 125억 예산 확보…2027년 착공 청신호",https://www.gukjenews.com/news/articleView.html?idxno=3602917,"최근 2년간 캠퍼스 인프라 개선을 위해 총 300억 원의 국고 지원을 이끌어낸 것으로 평가된다. 장지성... 공간으로 탈바꿈할 수 있게 되어 기쁘다""며, 앞으로도 최고 수준의 교육·행정 인프라 구축에 힘쓰겠다고 말했다."
2026-06-08,네이버뉴스,"젠슨 황 ""새만금은 AI 밸리""… 9조 로봇거점, 부품 협력사에 열린다",http://www.smedaily.co.kr/news/articleView.html?idxno=358365,"양사 협력이 '30억 달러 인프라 동맹'이라는 추상적 구상을 넘어 구체적 산업 입지로 좁혀지면서, 그동안... AI 데이터센터와 태양광은 2027년 착공해 2029년 완공, 로봇 클러스터와 수전해 플랜트는 2028~2029년 단계적으로... "
2026-06-08,네이버뉴스,"박승원 광명시장, 당선 후 첫 행보는 '안양천 안전 현장 점검'",https://www.fntoday.co.kr/news/articleView.html?idxno=385880,"공사 착공 전 사전 안전 점검을 실시했다. 광장 곳곳을 살피던 박 시장은 ""햇살광장 내 기존 데크 시설이... 박 시장은 현장의 물리적 안전 확보 외에도 시민들의 건강한 여가 생활을 위한 체육 인프라 구축의 속도전도... "
2026-06-09,네이버뉴스,삼전닉스 평택·용인 클러스터 공사 '비상'…무슨 일?,https://biz.sbs.co.kr/article_hub/20000315297?division=NAVER,"공사 일정 지연으로 준공과 입주 시점이 늦어질 수 있고, 공사비 부담 확대에 따라 건설사들의 신규 사업 참여도 위축될 가능성이 있다는 분석입니다. 다만 과거 사례를 보면 레미콘 기사들의 수입 감소 부담이 큰 만큼... "
2026-06-09,네이버뉴스,"공정위 전수조사에 건설업계 ‘초비상’...전방위 책임 추궁, 사면초가",https://www.dnews.co.kr/uhtml/view.jsp?idxno=202606081454293470483,발주처가 공사비 산정 단계부터 이들 비용을 제대로 반영하지 않는 관행이 근본 원인이라는 주장이다. 공정위가 중간 고리인 원청만 제재하면 정작 구조적 문제는 그대로인 채 건설사만 타격을 받는 역설이 생긴다는... 
2026-06-09,네이버뉴스,"건설안전특별법, 적정 공사비ㆍ공기 책정 ‘교두보’ 되나",https://www.dnews.co.kr/uhtml/view.jsp?idxno=202606081404520110459,높은 연관성을 인식하고 안전사고 저감을 위한 노력을 경주하고 있다는 사실에 주목할 만 하다”며 “건설안전특별법 제정이 향후 적정 공사비ㆍ공기 책정을 위한 교두보가 마련되길 바란다”고 밝혔다. 정석한 기자 jobize@
2026-06-09,네이버뉴스,"""보유세 낮다""는 이 대통령…부동산 세제·대출·공급 종합대책 예고",https://www.mt.co.kr/politics/2026/06/09/2026060819405658870,"이은형 대한건설정책연구원 연구위원은 ""지금 전세대출이 많이 풀렸는데 이를 관리해야 한다는 데는... 수도권 규제지역에서 PF(프로젝트파이낸싱) 자금조달 애로와 공사비 상승 등으로 1년 이상 착공이 지연된 약... "
2026-06-09,네이버뉴스,[사설]공사 발주단계에서 적정 안전비용 확보가 최선의 사고 예방책,https://www.dnews.co.kr/uhtml/view.jsp?idxno=202606081720176540523,국회에는 건설공사 발주자 책임 강화와 적정 공사비ㆍ공기 확보를 골자로 하는 ‘건설안전특별법 제정안’이 발의돼 있어 귀추가 주목된다. 건설현장 안전관리를 강화하려는 입법 취지를 살리면서도 현장 현실을 외면하지... 
2026-06-09,네이버뉴스,6월 아파트 4만채 분양… 평균 21억,https://www.donga.com/news/Economy/article/all/20260608/134072790/2,올해 들어 가장 많은 물량으로 건설사들이 6·3 지방선거로 미뤄왔던 분양 일정을 이달 본격화하는 것으로... 고준석 연세대 상남경영원 교수는 “원자재값 상승 등 공사비 인상 요인이 많은 데다 서울 아파트값... 
2026-06-09,네이버뉴스,"건설공제조합, 중동 상황 대응 3000억원 규모 특별융자 실시",https://www.kado.net/news/articleView.html?idxno=2054640,이번 특별융자는 중동 사태와 호르무즈 해협 봉쇄 우려 등에 대외적인 요인에 따른 원자재 수급 어려움과 가파른 공사비 상승 등으로 건설업계의 경제적 부담이 커진 건설업계를 지원하기 위한 취지로 마련됐다.... 
2026-06-08,네이버뉴스,충청경제 뼈아픈 손가락 '건설·석유화학',https://www.ggilbo.com/news/articleView.html?idxno=1162472,"최근 건설업계는 고금리 장기화와 원자재 가격 상승, 부동산 경기 침체로 미분양 적체와 프로젝트파이낸싱(PF) 경색, 공사비 상승이라는 삼중고에 직면했다. 지난 5월 31일 기준 올해 건설업 폐업 신고 누적건수는... "
2026-06-08,네이버뉴스,"[투자의 창] AI가 바꾸는 부동산 개발, ‘감’에서 데이터로",https://www.sedaily.com/article/20053220?ref=naver,프랑스 건설사 부이그(Bouygues)는 생성형 AI 설계 기술을 활용해 수천 개의 설계안을 동시에 시뮬레이션하고 최적 구조를 도출했다. 이를 통해 자재 사용량을 줄이고 설계 기간과 공사비를 절감하는 효과를 거뒀다. 운영... 
2026-06-08,네이버뉴스,잇단 교통시설 사고 배경엔 시간 압박·민간투자사업 있다 [왜냐면],https://www.hani.co.kr/arti/opinion/because/1262499.html,사이 공사비 문제로 유찰이 반복되다 겨우겨우 2024년부터 본격적인 공사가 시작되었다. 이번 사고의 원인과... 워낙 대형 공사를 수반하기 때문에 다른 건설 작업보다 사고 가능성이 크다는 점을 고려하더라도 반복되는... 
2026-06-08,네이버뉴스,레미콘노조 휴업에 공사 밀리나…건설업계 노심초사,https://www.ebn.co.kr/news/articleView.html?idxno=1711688,보통 레미콘은 생산 당일 현장에 투입해야 하는 만큼 공급이 끊기면 건설 공정 운영에 차질이 생길 수밖에 없다. 이번 레미콘 운송 휴업이 장기화할 경우 공사비 증가와 공기 지연으로 이어질 수 있단 우려가 나온다.... 
2026-06-08,네이버뉴스,더 빨라지는 신통기획…31만 가구 로드맵 수혜지는,https://news.mtn.co.kr/news-detail/2026060816394836964,"[이은형 / 대한건설정책연구원 연구위원 : 신통기획의 핵심인 각 정비사업 예정지가 도시계획 심의를... 있죠.]다만 공사비 상승과 조합원 분담금 부담, 주민 간 갈등 등 넘어야할 산이 많은 상황. 인허가 절차... "
2026-06-08,네이버뉴스,李대통령이 짚은 주택 공급 공백 3년…빌라는 72% 실종[부동산AtoZ],https://view.asiae.co.kr/article/2026060816104283023,"국토교통부 주택건설 인허가 실적 통계를 보면, 전국 주택 인허가는 2022년 52만8901가구에서 2024년... 금리 인상과 공사비 상승까지 겹치자 민간 사업자들은 신규 인허가와 착공을 미루거나 포기했다. 이처럼 민간... "
2026-06-08,네이버뉴스,"건설공제조합, '3천억원 규모' 특별융자 실시… ""조합원 자금난 지원""",http://www.ikld.kr/news/articleView.html?idxno=335658,"조합 관계자는 ""지난달 실시한 보증수수료 인하가 건설현장의 고정비 부담을 줄이기 위한 조치였다면, 이번 특별융자는 고금리와 공사비 적체로 인한 조합원들의 자금 가뭄에 실질적인 단비가 될 것""이라고 말했다. 이어... "
2026-06-08,네이버뉴스,수도권 레미콘 1만1000대 멈췄다…건설업계 공정 차질 우려,https://www.dt.co.kr/article/12066478?ref=naver,"한 대형건설사 관계자는 “예고됐던 휴업이었던 만큼 일부 대비는 해놨지만, 장기화할 경우 공정 차질이 불가피하다”며 “휴업이 길어지면 공사비 증가와 공기 지연으로 이어질 가능성도 크다”고 말했다. 또 다른 건설... "
2026-06-08,네이버뉴스,"수도권 지역 레미콘 운송거부 현실화···건설업계 ""정부 지원 시급""",https://www.koscaj.com/news/articleView.html?idxno=324484,건설업계는 레미콘 공급 중단이 장기화될 경우 공사 지연과 공사비 증가가 불가피하다며 정부의 지속적인 지원을 촉구하고 나섰다. 전국레미콘운송노동조합은 8일 서울·경기·인천 등 수도권 지역에서 운송 단가 인상과... 
2026-06-08,네이버뉴스,5월 서울 아파트 ‘국평’ 분양가 21억 넘어…전월 대비 11.5% 상승,https://www.donga.com/news/Economy/article/all/20260608/134070889/1,올해 들어 가장 많은 물량으로 건설사들이 6·3 지방선거로 미뤄왔던 분양 일정을 이달 본격화하는 것으로... 고준석 연세대 상남경영원 교수는 “원자재값 상승 등 공사비 인상 요인이 많은데다 서울 아파트값... 
2026-06-08,네이버뉴스,"[이슈] 수도권 레미콘 1만1000대 멈췄다 …""반도체 공장 신증설 지연 불...",http://www.paxetv.com/news/articleView.html?idxno=274121,"실제로 한국건설기술연구원에 따르면 올해 4월 건설공사비지수는 136.88로 전년 동월 대비 4.44% 오르며 1월 이후 매달 최고치를 경신 중이다. 이번 휴업에 대해 레미콘 업계 관계자는 ""협상 테이블이 마련되지 못하는 이유는... "
2026-06-08,네이버뉴스,때이른 폭염과 사투 벌이는 건설현장,http://www.jjn.co.kr/news/articleView.html?idxno=1043029,"폭염으로 작업을 중단하거나 공사 일정을 조정하게 되면, 공기 지연과 공사비 증가라는 고스란히 건설업계의 경영 부담으로 되돌아오기 때문이다. 따라서 지금 필요한 것은 규제 위주의 옥죄기가 아니라 현장이 자발적으로... "
2026-06-08,네이버뉴스,수도권 레미콘 운송차 1.1만대 멈춰서 … 전면 휴업에 하루 수백억 손실...,http://www.queen.co.kr/news/articleView.html?idxno=458213,건설업계에서는 현재와 같은 방식으로 버틸 수 있는 기간이 길어야 1~2주 정도에 불과할 것으로 보고 있다. 이후에도 운송 중단이 이어질 경우 공정 지연은 물론 공사비 증가와 준공 일정 차질로 이어질 가능성이 크다는... 
2026-06-08,네이버뉴스,"레미콘 노조 휴업 첫날…업계 ""반도체 공장 건설 차질 우려""",https://news.sbs.co.kr/news/endPage.do?news_id=N1008600171&plink=ORI&cooper=NAVER,"장기화하면 공사비 증가와 공기 지연으로 이어질 수 있다""고 말했습니다. 또 다른 건설사 관계자는 ""골조 공사가 마무리돼야 후속 공정을 진행할 수 있어 타설 일정 조정에도 한계가 있다""며 ""현장 인력은 투입된 상태에서... "
2026-06-08,네이버뉴스,"[아유경제_부동산] 건설공제조합, 3000억 원 규모 특별융자… 중동발 유...",http://www.areyou.co.kr/news/articleView.html?idxno=94033,이번 특별융자는 최근 중동 지역 불안으로 원자재 수급 차질 우려가 커지고 공사비 상승 부담이 확대되면서 자금 조달의 어려움을 겪는 건설업계를 지원하기 위해 마련됐다. 융자 금리는 연 2% 후반에서 3% 초반 수준으로... 
2026-06-08,네이버뉴스,미분양 리스크에 움츠린 분양시장···선거 후 공급은 '숨 고르기',http://www.enewstoday.co.kr/news/articleView.html?idxno=2436820,"과거에는 선거 종료 이후 규제 완화 기대감과 개발 공약 효과에 힘입어 공급이 빠르게 확대됐지만, 최근에는 고금리와 공사비 상승, 미분양 증가 등의 영향으로 건설사들이 신규 공급에 신중한 태도를 보이고 있다는... "
2026-06-08,네이버뉴스,"종합특검, '尹관저예산 전용' 기획예산처 등 압수수색",https://www.shinailbo.co.kr/news/articleView.html?idxno=5028319,김 전 실장 등은 당시 종합건설업 면허가 없는 21그램에 공사비를 지급하기 위해 관저 업무와 무관한 행정안전부 예산 28억원 상당을 불법 전용한 혐의를 받는다. 앞서 특검팀은 지난 달 19일 직권남용 혐의로 이들에 대한... 
2026-06-08,네이버뉴스,"덕신EPC, 건축용 구조물 챔피언 ""이젠 해외로""",https://www.mk.co.kr/article/12068484,"공사 기간은 약 40%, 공사비는 약 10% 절감되며, 공정이 간단해져 안전사고 위험도 줄어드는 것이 장점으로... 덕신EPC는 미국 건설 현장 진출에 필수적인 UL인증 획득, 현지 법인 설립, 공장용지 확보 등을 차근차근... "
2026-06-08,네이버뉴스,레미콘 파업에 공사 중단 우려…도심 건설공급망 '경고등',https://www.newspim.com/news/view/20260608000748,초기 비용 부담은 있지만 품질 확보와 폐기 자재 감축이 가능해 결과적으로 공사비를 줄일 수 있다는 장점도 있다. 정부 또한 지난해 BP 활용을 넓히기 위해 관련 제도 완화에 나섰다. 기존에는 시공자가 해당 건설공사에... 
2026-06-08,네이버뉴스,'디벨로퍼 전환' 성과 냈지만…HL디앤아이한라 수주 감소 '숙제',https://www.newsway.co.kr/news/view?ud=2026060815492192359,건설업계에서는 원가율 상승과 공사비 부담이 지속되는 상황에서 자체사업 확대가 수익성 방어의 핵심 전략으로 자리 잡고 있다고 평가한다. 일반 도급사업보다 개발이익을 직접 확보할 수 있어 수익성이 상대적으로... 
2026-06-08,네이버뉴스,"건설공제조합, 3000억원 규모 특별 융자 단행…조합원 자금난 지원",https://www.shinailbo.co.kr/news/articleView.html?idxno=5028375,한국건설기술연구원(KICT) 공사비원가관리센터에 따르면 지난 4월 건설공사비지수는 136.88로 잠정 집계됐다. 전월 134.53보다 1.75% 올랐고 전년 동월 131.06과 비교하면 4.44% 상승했다. 중동 정세 불안에 따른 유가 상승과 자재... 
2026-06-09,네이버뉴스,"현대엘리베이터, 밑 빠진 ‘튀르키예 법인’ 돈 붓기 끝…회복세 뚜렷",https://www.topdaily.kr/articles/110438,"튀르키예 법인은 2016년 8월 현지 건설·에너지 기업인 STFA그룹과의 합작법인(JV) 형태로 출발했다. 당시... 가치 평가 과정에서는 현지 리스크와 미래 성장성을 반영한 할인율, 매출성장률, 영구성장률 등이 핵심... "
2026-06-09,네이버뉴스,"AI 인프라 기업 IREN, 마이크로소프트와 70억 달러 규모 GPU 파이낸싱 계...",https://www.tokenpost.kr/news/cryptocurrency/367243,수요 리스크를 최소화하고 있다. 호주 800MW 데이터센터 캠퍼스 건설로 글로벌 AI 인프라 확장 IREN은 마이크로소프트와의 파트너십을 기반으로 호주에 800메가와트 규모의 대형 데이터센터 캠퍼스를 건설 중이다.... 
2026-06-09,네이버뉴스,"공정위, ""중동 전쟁은 불가항력…하도급 공기 연장·대금 조정 가능""",https://www.kmecnews.co.kr/news/articleView.html?idxno=50123,이번 공정위의 유권해석 역시 이러한 리스크 완화 조치를 하도급 거래 전반으로 확대한 것으로 풀이된다. 그동안 중동 정세 불안이 장기화되면서 건설현장에서는 원재료 가격 급등과 수급 불균형에 따른 자재 조달 지연... 
2026-06-09,네이버뉴스,"한국투자證 “네이버, 엔비디아와 손잡고 AI 데이터센터 구축⋯공격적 ...",https://www.etoday.co.kr/news/view/2591667,"팩토리를 건설하고 최종적으로 5~6년 내에 기가와트(GW)급의 기반시설을 갖출 예정이다""라고 밝혔다. 이어... 고객의 확보만 안정적으로 이루어진다면 사업의 규모 확장 위험(리스크)은 제한적일 것이다""라고 진단했다."
2026-06-09,네이버뉴스,'HBM 폭발' 유리가 먼저 움직였다… 아마존·코닝 동맹에 삼성·SK 긴장하...,https://www.g-enews.com/view.php?ud=202606090710132815fbbec65dfb_1,"빅테크 기업들이 미국산 부품 비중을 강제로 늘릴 경우, 국내 장비사들은 합작법인 설립이나 현지 공장 건설이라는 비용 부담을 떠안아야 할 수도 있다. 국내 투자자가 향후 리스크와 기회를 판단하기 위해 당장... "
2026-06-09,네이버뉴스,"[더벨][엔비디아-K산업계 동맹] LG, 데이터센터 아킬레스건 '열관리·전...",https://www.thebell.co.kr/free/content/ArticleView.asp?key=202606081613353600104677,생성형 AI 서비스가 폭발적으로 성장하면서 전 세계는 초거대 'AI 팩토리(데이터센터)' 건설 붐이 한창이다.... 있다는 리스크가 상존한다. 냉각 설루션이 데이터센터 운영 과정에서 '핵'으로 떠오른 배경이다. LG전자는... 
2026-06-09,네이버뉴스,노조천국 한국과 노조지옥 중국의 산업 대결 [최홍섭의 샬롬 살람],https://www.dailian.co.kr/news/view/1653360/?sc=Naver,"유출이라는 리스크를 미리 떠 안게 되었다. 이동근 경총 상근부회장은 ""노동조합이 기업 이익의 선제적... 사회주의 건설을 목표로 투쟁했다. 학생운동권은 소련의 국가사회주의 정치경제 시스템을 지향하는 PD(민중민주)... "
2026-06-09,네이버뉴스,"김인 새마을금고 회장, 2기 역점은 1.8조 지역금융…5년 큰그림 윤곽",https://www.bloter.net/news/articleView.html?idxno=664705,"신규 부동산 PF 대출이 제한되고 건설·부동산업 대출 한도 안에 PF 한도가 별도로 설정되면서 기업여신을... ""연체율 관리"" 특명…해법은 관계금융 관건은 실행력과 리스크 관리다. 사회연대금융은 금융취약계층과... "
2026-06-09,네이버뉴스,[Who Is ?] 강정석 동아쏘시오홀딩스 회장,https://www.businesspost.co.kr/BP?command=article_view&num=439182,"아벤종합건설, 동아오츠카, 동아참메드, 얼수, 용인기흥PFV, 앱티스, 피노라인, 에코윈 등이 있다.... ISO37301은 국제표준화기구(ISO)가 준법경영 정책과 리스크 관리 체계가 글로벌 수준에 부합하는지 평가하기 위해... "
2026-06-09,네이버뉴스,[Who Is ?] 강해철 기가비스 대표이사,https://www.businesspost.co.kr/BP?command=article_view&num=439327,생산능력 확대 역시 성장과 리스크가 공존한다. 기가비스는 약 500억 원을 투입해 화성 제2공장을 건설 중이며 생산능력을 기존 대비 약 2.5배로 확대한다는 계획을 세웠다. In-Line FA 및 대형 자동화 설비 수요... 
2026-06-09,네이버뉴스,[특별기고] 전쟁 리스크가 바꾼 공공계약...이제 '고정가격' 시대는 끝났...,https://www.koit.co.kr/news/articleView.html?idxno=207456,또한 주요 건설자재의 물가 상승분을 가격에 즉시 반영하는 내용도 이번 조치에 담았다. 이번 조치는 단순한... 과거처럼 모든 책임을 업체에 집중시키던 구조에서 벗어나 외부 리스크를 제도적으로 반영하기 시작한... 
2026-06-09,네이버뉴스,PF 대출 문턱 높인다…자기자본 비율 3%→20%까지 상향,https://www.news1.kr/finance/general-finance/6191133,"이번 개정으로 금융권의 리스크 관리 체계가 강화되는 동시에 상대적으로 자본력이 낮은 시행사와 건설사는 시장에서 자연스럽게 퇴출되고, 재무여력이 충분한 사업자 중심으로 PF 시장이 재편될 것으로 예상된다.... "
2026-06-09,네이버뉴스,"中, 對日 희토류 수출 ‘80% 전격 감축’… 日 첨단 산업계 공장 중단 사...",https://www.g-enews.com/view.php?ud=2026060817330264670c8c1c064d_1,‘차이나 리스크’를 원천 차단하기 위해 글로벌 다각화 노선으로 급선회하고 있다. JX 어드밴스드 메탈스... 본토에 건설하는 방안을 진지하게 검토하기 시작했다. 자원 선순환을 노린 ‘폐기물 재활용’ 카드도... 
2026-06-09,네이버뉴스,"""구글 대신 퀀트"" 유럽의 통첩… 엔비디아 독점 ‘균열 조짐’ HBM 판도...",https://www.g-enews.com/view.php?ud=202606081439151383fbbec65dfb_1,최근 인텔과 TSMC의 유럽 현지 파운드리(반도체 위탁생산) 공장 건설이 보조금 집행 지연과 유럽 내 높은 에너지 비용 리스크로 인해 난항을 겪고 있기 때문이다. 생산 인프라 자립이 늦어질수록 EU는 핵심 부품인 HBM과... 
2026-06-09,네이버뉴스,"[종합] '절치부심' 애플, 제미나이 연동 '시리 AI' 전격 공개…WWDC 2026 총...",https://www.ddaily.co.kr/page/view/2026060903432751124,"셀룰러와 와이파이(Wi-Fi) 네트워크 간의 스마트 전환 인프라를 내재화해 수동 토글 제어 리스크를... 당국이 건설적인 논의를 거부하고 있어 현재로서는 모바일 서비스 가동 타임라인을 수립하지 못했다""라고... "
2026-06-09,네이버뉴스,유럽서 막힌 애플 ‘시리 AI’ 반쪽 출범… 맥·애플워치만 허용하고 아...,https://www.ddaily.co.kr/page/view/2026060903300235349,당국이 건설적인 논의를 거부하고 있어 현재로서는 iOS와 iPadOS 내 서비스 가동 타임라인을 수립하지... EU 규제 당국이 요구하는 법적 의무 사양과 이에 따른 보안 아키텍처 리스크 제원으로 ▲DMA 규정 이행을... 
2026-06-09,네이버뉴스,1분기 기업대출 35.6조 급증…운전자금·대기업 대출이 주도,http://www.gjdream.com/news/articleView.html?idxno=670065,"6조 원 증가로 전환한 반면, 비은행예금취급기관에서는 0.2조 원 감소가 지속됐다. 부동산 프로젝트파이낸싱(PF) 리스크 관리 기조가 이어지는 가운데 비은행권이 건설업 여신을 계속 축소하는 흐름으로 풀이된다."
2026-06-08,네이버뉴스,"삼성重, 해상 LNG 플랜트 시장 독주 체제 구축…상반기 수주 13조 돌파",https://www.goodkyung.com/news/articleView.html?idxno=287906,"육상 플랜트 건설 시 발생하는 지정학적 위험과 까다로운 지역 인프라 규제를 우회할 수 있어, 최근 글로벌... 해양 플랜트 사업의 고질적인 약점으로 꼽히던 공기 지연과 원가 초과 리스크를 선제적으로 제어할 수... "
2026-06-08,네이버뉴스,"코스피, 폭락과 반등의 역사…이젠 팔까? 버틸까? [홍길용의 화식열전]...",https://biz.heraldcorp.com/article/10766633?ref=naver,√ 전력 등 인프라 미비로 AI 데이터센터 건설 차질. AI 반도체 실적 둔화(peak out) 우려 √ 회사채 발행도... (rollover) 리스크 및 반대매매 앞의 세 가지는 우려 또는 의심이다. 현실이 된다면 강도에 따라 위기급 구조... 
2026-06-08,네이버뉴스,"비트코인(BTC) 또 무너지나...JP모건, 스트래티지(MSTR) 배당 리스크 경...",http://coinreaders.com/241078,"JP모건은 현재 약세가 향후 역발상 강세 신호가 될 수 있지만, 하반기 건설적 흐름은 스트래티지의 배당 재원 설명과 미국 암호화폐 시장 구조 법안 승인에 달려 있다고 결론냈다."
2026-06-08,네이버뉴스,중동전쟁 리스크 가시화에도 국내경제 완만한 개선세 유지,https://www.ulsanpress.net/news/articleView.html?idxno=576654,"건설투자는 여전히 부진하지만 소비 개선 흐름이 유지되고, 설비투자가 반도체 관련 투자를 중심으로... 반면 건설업생산은 5.5% 감소해 장기 부진 흐름을 벗어나지 못했다. 소비도 완만한 회복세를 유지했다. 4월... "
2026-06-08,네이버뉴스,"추경호""민생경제 회복에 최우선...사법리스크 이겨내겠다""",https://www.tbc.co.kr/news/view?pno=20260608170940AE00802&id=207122,"최대 현안인 TK신공항 건설과 관련해선 국가주도 사업 전환을 위해 최적의 방안을 찾고, 지역 정치권과... 사법리스크에 대해선 법과 원칙에 따라 당당하게 소명하고 이겨내겠다고 강조했습니다 경쟁 후보와 공약이 겹쳤던... "
2026-06-08,네이버뉴스,[미리보는 이데일리 신문]반도체발 블랙 먼데이 “상승동력은 안 꺾었다...,https://www.edaily.co.kr/news/newspath.asp?newsid=05366086645479752,"레미콘…삼성·하닉 건설현장 ‘비상’ -北 최고 예우 환대받은 시진핑…경제·군사 협력 강화 -기준금리... 세금 리스크, 유증 투자자에만 알렸다는 서진시스템 △문화 -흑인의 쉼을 위해 ‘생체발광’ 눈앞에 -여섯 살... "
2026-06-08,네이버뉴스,[앵커 브리핑] 민선 9기 추경호 대구시장의 과제는?,https://dgmbc.com/NewsArticle/844570,"추경호 당선인은 사법 리스크를 안은 상태에서 TK 신공항 건설과 행정 통합, 취수원 이전 문제 등 쌓여 있는 대구의 숙원 사업들을 성공적으로 풀어갈 수 있을까요? 선거는 끝났고, 이제는 증명과 책임의 시간이... "
