date,source,title,link,description
2026-07-24,네이버뉴스,"삼표산업, '블루콘 스피드' 녹색기술 인증 획득",http://www.econonews.co.kr/news/articleView.html?idxno=441709,(사진 제공=삼표그룹)  삼표그룹의 계열사인 삼표산업은 현대건설과 공동 개발한 조강 콘크리트 '블루콘 스피드(BLUECON SPEED)'가 국토교통부로부터 '녹색기술 인증'을 획득했다고 24일 밝혔다. 녹색기술 인증은 탄소중립... 
2026-07-24,네이버뉴스,"한울본부, 협력사와 한울어울림봉사단 결연 체결",https://www.mhns.co.kr/news/articleView.html?idxno=754298,"한국수력원자력(주) 한울원자력본부는 지난 7월 22일, 한울본부 홍보관에서 한전KPS, 현대건설컨소시움, 두산에너빌리티, 수산인더스트리 등 13개 협력사와 함께 한울어울림봉사단 결연을 체결했다. 이날 결연은 ESG... "
2026-07-24,네이버뉴스,"아시아 대회 찍고 ‘일본으로’ 이다현 “성적 책임져야, 정신적으로 더...",https://www.sportsseoul.com/news/read/1624369?ref=naver,이날 이다현은 현대건설 시절 동료였던 세터 김다인과 뛰어난 호흡을 자랑했다. 이다현은 “소집 후 다인언니가 걱정하더라. 나는 무조건 맞는다고 생각했다. 지난시즌을 치르며 서로 더 성장했기 때문에 자신감은... 
2026-07-24,네이버뉴스,흑석·노량진 넘어 상도까지...동작구에 '하이엔드' 주거 브랜드 몰린다,https://www.g-enews.com/view.php?ud=2026072315421962602aa6f4cdad_1,"정비업계에 따르면 동작구 주요 정비사업장에는 포스코이앤씨 ‘오티에르’, 현대건설 ‘디에이치’, DL이앤씨 ‘아크로’, 대우건설 ‘써밋’, SK에코플랜트 ‘드파인’ 등이 잇따라 적용되고 있다. 동작구는... "
2026-07-24,네이버뉴스,"한울본부, 협력사와 한울어울림봉사단 결연",https://biz.heraldcorp.com/article/10818555?ref=naver,"한전KPS, 현대건설컨소시움, 두산에너빌리티, 수산인더스트리, 씨큐텍, 금화PSC, 퍼스트키퍼스, 수산이앤에스, 옵티멀에너지서비스, 한일원자력, 세안에너텍, 세빛이엔이, 우진엔텍/영진 등이다 이번 결연은 ESG 경영과... "
2026-07-24,네이버뉴스,"‘1조 ESS 본게임’ 앞두고…K배터리, AI 배전망서 ‘총성 없는 전쟁’",https://magazine.hankyung.com/business/article/202607229422b,"삼성SDI는 브이피피랩, SK이터닉스, HD현대일렉트릭, 현대건설, 한국동서발전, 한전KDN 등에 ESS 통합 솔루션 ‘SBB(삼성배터리박스) 1.5’를 공급한다. 배터리셀과 모듈, 랙, 냉각장치, 안전시스템을 하나의 컨테이너에... "
2026-07-24,네이버뉴스,"[더벨][도시정비 언더독 플레이어] IS동서, 경상권 기반 '선별 수주'…계...",https://www.thebell.co.kr/free/content/ArticleView.asp?key=202607211727342000101861,"이후 2008년 현대건설 토목사업부에서 분리된 동서산업을 인수하며 현재의 IS동서로 사명을 변경했고, 건설·환경·소재 사업을 아우르는 종합기업으로 성장했다. 주택 브랜드 역시 지역 기반 경쟁력을 키우는 핵심... "
2026-07-24,네이버뉴스,"【분양현장 톺아보기】 산곡역자이힐스테이트&하늘채, 초역세권에 초·...",http://www.consumernews.co.kr/news/articleView.html?idxno=759902,"GS건설과 현대건설, 코오롱글로벌 컨소시엄이 인천 부평구 산곡동에 '산곡역자이힐스테이트&하늘채'를 공급한다. 산곡역자이힐스테이트&하늘채는 인천 부평구 산곡동 10번지 일원에 지하 3층~지상 최고 33층, 20개 동 총... "
2026-07-24,네이버뉴스,[영상] 재건축 다음은 '재개발'···과천 정비사업 2막 열려,https://www.sisajournal-e.com/news/articleView.html?idxno=422567,"현대건설은 과천 최초로 하이엔드 브랜드를 적용한 '디에이치 르블리스'를 제안했습니다. 최고 35층, 27개 동 규모로 조성됩니다. 사업지는 양재천과 관문초등학교를 끼고 있습니다. 두 단지가 하나로 통합되는 만큼... "
2026-07-24,네이버뉴스,"HD현대사이트솔루션, 저탄소 도료 개발",https://www.segye.com/newsView/20260723520010?OutUrl=naver,건설기계 도장 후 건조과정 탄소 배출량 절반가량 줄여 HD현대의 건설기계부문 중간 지주사인 HD현대사이트솔루션이 굴착기와 휠로더 등 건설기계의 부품과 외장에 색을 입히는 과정에서 발생하는 탄소 배출량을 절반... 
2026-07-24,네이버뉴스,꿈틀대는 용산 일대 재개발…대형 건설사도 수주 경쟁 본격화,https://www.newspim.com/news/view/20260723001022,"현장설명회에는 현대건설과 DL이앤씨, IPARK현대산업개발이 참여했다. 1차 입찰에서 현대건설 단독 참여에 그친 것과 대비된다. 한강로구역 재개발은 지하철 4·6호선 삼각지역 인근인 서울 용산구 한강로1가 158번지... "
2026-07-24,네이버뉴스,MB “이게 대통령님 삶입니까”…뒷거래 제안한 YS 한방 먹이다,https://www.joongang.co.kr/article/25447733,"현대건설에서 내 손으로 구석구석, 하나하나 다시 일으켜 세웠던 곳이기도 하다. 서울이란 도시에서 그 누구보다 치열하게 살았던 나는, 그런 만큼 서울의 문제점을 속속들이 안다고 생각했다. 그리고... "
2026-07-24,네이버뉴스,"건설사 2Q 실적, 원가율에 희비",https://www.mt.co.kr/estate/2026/07/24/2026072319465996419,"23일 금융정보업체 에프앤가이드에 따르면 현대건설, GS건설, DL이앤씨, 대우건설, IPARK현대산업개발 주요 상장 건설사 5곳의 올해 2분기 매출 전망치는 총 14조2847억원으로 집계됐다. 이는 지난해 같은 기간보다 12.7... "
2026-07-24,네이버뉴스,규제가 바꾼 수도권 부동산 시장…'15억 이하'·'비규제' 쏠림,https://www.newsis.com/view/NISX20260723_0003720560,"현대건설은 경기 평택시 고덕국제화지구 A31·34·35블록 일원에서 '힐스테이트 고덕엘리스트'를 분양할 예정이다. 최고 33층, 전용면적 58·84㎡ 총 2122가구 규모로, 수도권 1호선 서정리역과 SRT·1호선 평택지제역을... "
2026-07-24,네이버뉴스,[아파트 미리보기]경남 진주 원도심에 21년 만에 신축 대단지 공급,https://www.donga.com/news/Economy/article/all/20260723/134354024/2,㈜한화 건설부문과 현대건설은 8월 경남 진주시 이현동 일원에서 ‘포레나힐스테이트 진주’를 분양한다고 23일 밝혔다. 이현1-5구역 재건축정비사업을 통해 조성되는 이 단지는 8개 동(지하 2층∼지상 최고 35층)... 
2026-07-23,네이버뉴스,"현대건설, 오픈이노베이션 스타트업 12개사 선발",https://www.webeconomy.co.kr/news/articleView.html?idxno=2242838,현대건설은 23일 서울경제진흥원과 함께 진행한 오픈이노베이션 공모전에서 협업 대상 스타트업 12개사를 선발했다고 밝혔다. 이번 공모전에는 156개 기업이 지원했다. 현대건설은 건설 인공지능 전환과 미래주거... 
2026-07-23,네이버뉴스,"한울본부·협력사, ‘한울어울림봉사단’ 출범",https://www.kbmaeil.com/article/20260723500911,"한울원자력본부는 지난 22일 경북 울진군 한울본부 홍보관에서 한전KPS와 현대건설컨소시엄, 두산에너빌리티 등 13개 협력사와 ‘한울어울림봉사단’ 결연식을 열었다고 23일 밝혔다. 이번 결연은 한울본부와 협력사가... "
2026-07-23,네이버뉴스,"AI 시대의 국제안보, 한국의 전략은 무엇인가?",http://www.ifs.or.kr/bbs/board.php?bo_table=News&wr_id=55934,6) 중국은 14차 5개년 규획(2021~2025년)에서 '전면적 사회주의 현대화 국가 건설' 목표를 위한 핵심 과제 중 하나로 자립·자강을 위한 기술 혁신을 내세웠다. 이에 의하면 중국은 2027년까지 핵심 산업의 70... 
2026-07-23,네이버뉴스,"현대건설, 혁신 스타트업 12곳 발굴 … 오픈이노베이션으로 '미래 건설...",http://www.worktoday.co.kr/news/articleView.html?idxno=87071,현대건설이 오픈이노베이션 프로그램을 통해 건설·주거·헬스케어 등 다양한 분야의 혁신 스타트업을 발굴하며 미래 건설 경쟁력 강화에 속도를 내고 있다. 스타트업과의 기술 협업을 본격화해 신사업과 현장... 
2026-07-23,네이버뉴스,"현대건설, AI·로보틱스 분야 스타트업 12곳 선발",https://daily.hankooki.com/news/articleView.html?idxno=1388839,사진=현대건설 현대건설은 서울시 창업지원기관인 서울경제진흥원과 공동 주관한 '2026 현대건설×서울 스타트업 오픈 이노베이션' 공모전을 통해 유망 스타트업 12개사를 최종 선정했다고 23일 밝혔다. 올해 5회째를... 
2026-07-23,네이버뉴스,[2026 기계설비의 날] 중소벤처기업진흥공단 이사장상 - 노원석 삼우설...,https://www.kmecnews.co.kr/news/articleView.html?idxno=50978,"현대엔지니어링, 현대건설, CJ대한통운 등 국내 유수 업체에게서 '우수 시공 업체'로 인정받아 다양한 표창도 받았다. 노 대표는 ""유해·위험요인을 사전에 파악하고 개선해, 정기적인 안전점검과 안전보건관리체계를... "
2026-07-23,네이버뉴스,가양동 옛 CJ공장 부지에 아파트 960가구 들어선다,https://www.hankyung.com/article/2026072325011,해당 부지는 인창개발(시행)·현대건설(시공) 컨소시엄이 2019년 말 1조501억원에 매입했다. 2022년 지식산업센터 2개 부지와 업무·대형판매시설 1개 부지를 조성하는 개발 계획이 마련됐다. 2023년 건축 허가를 받아 지난해... 
2026-07-23,네이버뉴스,현대건설 힐스테이트 더 운정 오피스텔 수분양자 설계 변경 관련 강남경...,https://www.livesnews.com/news/article.html?no=62879,"대형건설사도, 시행사도, 신탁사도 법 위에 있을 수 없습니다. 기업의 이익보다 국민의 전 재산과 주거의 신뢰가 먼저입니다. 이번 고소가 제대로 수사되어야 합니다. 이번 사건이 바로잡혀야 다음 현장에서 포괄동의서를... "
2026-07-23,네이버뉴스,"현대건설, '오픈이노베이션 공모전'서 12곳 스타트업 발굴",http://www.popcornnews.net/news/articleView.html?idxno=127472,현대건설이 오픈 이노베이션을 통해 미래 건설 산업을 이끌 혁신 스타트업 발굴과 상생 협력을 이어가고 있다. 현대건설은 서울시 창업지원기관인 서울경제진흥원과 공동 주관한 '2026 현대건설×서울 스타트업 오픈... 
2026-07-23,네이버뉴스,[건설소식] 롯데건설·부영그룹·한화 건설부문·현대건설,https://sports.hankooki.com/news/articleView.html?idxno=6936866,2026년 스타트업 공모전 최종 선발업체 현대건설 현대건설이 서울시 창업지원기관인 서울경제진흥원과 공동 주관한 '2026 현대건설×서울 스타트업 오픈 이노베이션(SEOUL STARTUP OPEN INNOVATION)' 공모전을 통해 유망 스타트업... 
2026-07-23,네이버뉴스,"동대문소방서, 건설현장 근로자 대상 폭염 대비 안전교육",http://fpn119.co.kr/254285,= 동대문소방서(서장 김흥곤)는 지난 11일부터 내달 23일까지 현대건설 현장 근로자들을 대상으로 여름철 폭염 대비 안전교육을 실시한다고 23일 밝혔다. 이번 교육은 연일 이어지는 폭염 속에서 건설현장 근로자의 온열질환... 
2026-07-23,네이버뉴스,"비상구 빛나고 위험구역 또렷하게···KCC, CJ제일제당 부산공장 안전환...",https://www.womaneconomy.co.kr/news/articleView.html?idxno=256463,현대건설과 KCC 컬러디자인센터 등이 개발한 지하주차장 길찾기 시스템 '히어&썸웨어'에는 정보 위계에 따른 색채 체계와 유니버설 디자인 요소가 적용됐다. 이 시스템은 2025년 레드닷 디자인 어워드 디자인 콘셉트... 
2026-07-23,네이버뉴스,"삼성물산 건설부문 2분기 실적 반등, 오세철 반도체·에너지로 하반기 ...",https://www.businesspost.co.kr/BP?command=article_view&num=442986,"오 사장은 국내 주택 사업에서는 상반기에만 4조7163억 원의 도시정비 일감을 수주하며 현대건설, GS건설과 3강 경쟁체제를 구축하는 등 순항하고 있다. 오 사장은 특히 하이테크 부문에서 세계적 반도체 산업 호황에... "
2026-07-23,네이버뉴스,아파트 매수 비중 절반이 3040…교육환경 따라 집값 갈렸다,https://www.ziksir.com/news/articleView.html?idxno=141014,"HDC현대산업개발·현대건설·포스코이앤씨는 오는 8월 인천 용현·학익 1블록 도시개발사업 공동3BL에서 '시티오씨엘 9단지 오션파크뷰'를 분양할 예정이다. 지하 2층~지상 49층, 9개 동, 전용면적 59~136㎡, 1949가구... "
2026-07-23,네이버뉴스,대우·현산 웃고 현대·GS·DL 울고…원가율이 가른 건설사 2분기 실적,https://www.mt.co.kr/estate/2026/07/24/2026072316055659827,"23일 금융정보업체 에프앤가이드에 따르면 현대건설, GS건설, DL이앤씨, 대우건설, IPARK현대산업개발 등 주요 상장 건설사 5곳의 올해 2분기 매출 전망치는 총 14조2847억원으로 집계됐다. 이는 지난해 같은 기간보다 12.... "
2026-07-23,네이버뉴스,[코스피 지수선물 옵션] 삼성전자·SK하이닉스 선물 강세…전력 인프라...,https://www.pinpointnews.co.kr/news/articleView.html?idxno=470984,"건설 업종에서는 현대건설과 대우건설, 삼성E&A, GS가 강세를 나타내고 있으며, 국내외 인프라 투자 확대와 해외 수주 증가 기대가 투자심리를 자극하고 있다. 철강과 소재 분야에서는 POSCO홀딩스와 포스코인터내셔널... "
2026-07-23,네이버뉴스,"현대건설, 오픈이노베이션 참여 스타트업 12개사 확정",https://www.ziksir.com/news/articleView.html?idxno=141005,"[현대건설]  현대건설이 건설 AX와 미래주거, 디지털 헬스케어 등 5개 분야에서 스타트업 12개사를 선발하고 현장 적용 가능성을 검증한다. 현대건설은 서울경제진흥원과 공동으로 진행한 '2026 현대건설×서울 스타트업... "
2026-07-23,네이버뉴스,"현대건설, 건설 AX·미래주거 등 '유망 스타트업' 12개사 선정",https://weekly.hankooki.com/news/articleView.html?idxno=7175639,현대건설은 서울시 창업지원기관인 서울경제진흥원과 공동 주관한 '2026 현대건설×서울 스타트업 오픈 이노베이션(SEOUL STARTUP OPEN INNOVATION)' 공모전을 통해 유망 스타트업 12개사를 최종 선정했다.  현대건설은... 
2026-07-23,네이버뉴스,[기획-안성철도 100년] ⑤철도는 길이 아니라 도시의 기억이다…안성선...,https://news.ifm.kr/news/articleView.html?idxno=475648,"이어 2024년 11월 현대건설이 민간투자사업 제안서를 제출했고, 2025년 8월에는 보완 사업제안서가 제출되면서 사업계획이 한층 구체화됐다. 국토교통부는 이를 토대로 한국개발연구원(KDI)에 민자 적격성 조사를 의뢰... "
2026-07-23,네이버뉴스,"현대건설, 오픈 이노베이션 공모전 통해 혁신 스타트업 12곳 선발",https://www.businesspost.co.kr/BP?command=article_view&num=442994,'2026 현대건설×서울 스타트업 오픈 이노베이션(SEOUL STARTUP OPEN INNOVATION)' 공모전 관련 이미지 일부 갈무리. 현대건설> 현대건설이 미래 건설을 함께 이끌 혁신 스타트업을 발굴했다. 현대건설은 서울시... 
2026-07-23,네이버뉴스,전쟁 변수에 공사비 또 오르나⋯재건축·재개발 현장 '긴장',https://www.etoday.co.kr/news/view/2606689,현대건설은 4월 서울 송파구 마천4구역 재개발 조합에 기존 3.3㎡당 584만원이던 공사비를 959만원으로 75.6% 인상해 달라고 요청했다. 2021년 공사비를 산정한 이후 물가 상승과 설계 변경 등으로 사업비 부담이 커졌다는... 
2026-07-23,네이버뉴스,[韓 미래 모빌리티 어디까지 왔나] 도로도 하늘도 ‘실증 中’…자율주...,https://www.smarttoday.co.kr/ko-kr/articles/109760,아울러 국토부를 중심으로 산·학·연·관이 참여하는 UAM 팀 코리아(인천국제공항공사·대한항공·KT·현대건설·현대자동차 5사 컨소시엄)를 운영해 UAM 상용화에 박차를 가한다. 실제 김포공항 인근에서 사업자 간... 
2026-07-23,네이버뉴스,"현대건설, 정원·테라스에 소음 걱정 '0' … 자연 누리는 블록형 단독주...",https://www.mk.co.kr/article/12105573,스마트그린 및 주거혁신 우수상 / '힐스테이트 양주옥정 파티오포레' 현대건설이 경기 양주옥정신도시에 지은 '힐스테이트 양주옥정 파티오포레'가 제30회 살기좋은 아파트 스마트그린 및 주거혁신 부문 우수상을 받았다.... 
2026-07-23,네이버뉴스,"HD현대사이트솔루션, 친환경 도료 개발해 전 사업장 도입",https://www.cnbnews.com/news/articleView.html?idxno=1009003,HD현대의 건설기계 중간지주사 HD현대사이트솔루션이 '저온경화형 도료'를 개발했다 HD현대사이트솔루션에 따르면 이 도료는 건설기계 도장 공정의 탄소 배출량을 약 53% 줄일 수 있다. HD현대사이트솔루션 기술원이... 
2026-07-24,네이버뉴스,"[더벨][Company Watch] 수익성 굳건 KCC, 차입 감축에 쏠리는 눈",https://www.thebell.co.kr/free/content/ArticleView.asp?key=202607221515407880106449,삼성물산·HD한국조선해양 등 약 7조원 규모의 보유 자산 활용 방안도 아직 구체화되지 않은 상태다.... KCC는 건자재·도료 등을 주력 사업으로 영위하고 있어 전방인 건설경기 둔화로 타격을 받고 있는... 
2026-07-24,네이버뉴스,"[건설 DC 조직은] ⑤GS건설, '전문 자회사'로 디벨로퍼 도약",https://www.fetv.co.kr/news/articleView.html?idxno=307022,건설 계열사가 지으면 IT 계열사가 운영을 맡는 구조다. 삼성물산의 춘천 AI 데이터센터를 삼성SDS가 운영하는 것이 대표적인 예시다. 반면 GS그룹은 2018년 GS ITM을 매각한 뒤 대형 IT 계열사가 없는 상태다. GS건설이... 
2026-07-23,네이버뉴스,"[26.7.23 증시 인싸잇] 코스피, 7000선 회복… 외국인 4일째 반도체 집중...",https://www.mediawatch.kr/news/article.html?no=260453,"현대차(+3.35%), 삼성전자우(+3.24%), 삼성생명(+2.97%), 삼성물산(+1.69%), 삼성바이오로직스(+0.51%), KB금융(+0.69%)도 상승 마감했다. 업종별로는 전 업종이 일제히 올랐다. 건설업이 10.47%로 가장 높은 상승률을 기록했고... "
2026-07-23,네이버뉴스,[2026 기계설비의 날] 대통령표창 - 박계석 (주)세방테크 대표이사,https://www.kmecnews.co.kr/news/articleView.html?idxno=50996,앞으로도 첨단산업시설과 기반시설의 완벽한 시공을 통해 기계설비산업이 건설산업의 중심축으로 흔들림... 이러한 철저한 현장 관리 역량은 삼성물산으로부터 3년 연속(2022~2024년) '안전 인정제 3스타'를 획득하는... 
2026-07-23,네이버뉴스,[2026 기계설비의 날] 국토교통부장관 표창- 조진균 국립한밭대학교 건...,https://www.kmecnews.co.kr/news/articleView.html?idxno=50997,"조 교수는 25년 넘게 (주)하이멕, 삼성물산 건설부문, 한국건설생활환경시험연구원 등을 거쳐 현재 국립한밭대학교에서 교육과 연구를 수행하고 있다. 특히 데이터센터와 의료시설, 제로에너지빌딩(ZEB) 등 국가 핵심... "
2026-07-23,네이버뉴스,[2026 기계설비의 날] 국무총리 표창 – 김래형 ㈜귀뚜라미범양냉방 전...,https://www.kmecnews.co.kr/news/articleView.html?idxno=50942,"현장 조립식인 '블록형 냉각탑'을 삼성물산과 공동 개발함으로써, 기존 현장 제작 방식의 한계를 극복하고... 시대적 과제인 친환경 건설과 국민 생활환경 개선에도 앞장섰다. 발전소 등 열 다소비 공정에서 다량으로... "
2026-07-23,네이버뉴스,"[오늘증시]코스피, 외국인 매수세에 4.40% 급등 7000선 회복...코스닥도...",http://www.queen.co.kr/news/articleView.html?idxno=460737,"건설업종이 10.47% 급등했고, IT와 금속은 7% 이상 뛰었다. 화학은 6.35% 올랐으며, 전기·가스, 일반서비스... 삼성전기는 7.66% 강세를 보였고, 삼성생명과 삼성물산도 각각 2.97%, 1.69% 상승했다. 2차전지주 역시 강세를... "
2026-07-23,네이버뉴스,"""고맙다 구글"" 코스피, 7000 재탈환…외국인 나흘째 '사자'",https://www.mt.co.kr/stock/2026/07/24/2026072316143716726,"건설은 10.47% 급등했다. IT(정보기술)와 금속은 7% 이상 뛰었고, 화학은 6.35% 올랐다. 전기·가스... 'S7' 중 삼성전기는 7.66% 강세 마감했고, 삼성생명과 삼성물산은 각각 2.97%와 1.69% 올랐다. SK스퀘어는 약보합... "
2026-07-23,네이버뉴스,[거래소 외국인] SK하이닉스ㆍ삼성전자 또 쓸어 담았다... 추격매수 괜찮...,https://www.pinpointnews.co.kr/news/articleView.html?idxno=470956,"소비재와 내수주 가운데서는 에이피알, 삼양식품, GS건설, 롯데쇼핑이 순매수 상위에 포함됐다. 화장품과... 지주사에서는 SK스퀘어, SK, OCI홀딩스, LS, 삼성물산이 순매도 상위에 포함됐다. 최근 상승폭이 컸던 지주사... "
2026-07-23,네이버뉴스,"DK아시아, 호텔급 서비스에 유럽 궁전의 품격 … 살수록 가치가 높아져",https://www.mk.co.kr/article/12105511,DK아시아는 삼성물산 리조트 부문과 협업해 단지 곳곳에 리조트에 버금가는 커뮤니티 공간을 조성했다.... 디벨로퍼가 기반시설에 직접 투자하는 것은 건설 업계에서 드문 일이다. 입주민들 사이에선 '살아볼수록 진가가... 
2026-07-23,네이버뉴스,e편한세상 부천 어반스퀘어'분양',https://www.ngonews.kr/news/articleView.html?idxno=233674,"DL이앤씨는 경기 부천시 원미구 소사동 48-21번지 일원에서 'e편한세상 부천 어반스퀘어'를 분양 중이다. 소사3구역 주택재개발정비사업을 통해 공급되는 이 단지는 지하 3층~지상 38층, 13개 동, 총 1,649가구로 조성된다.... "
2026-07-23,네이버뉴스,"DL그룹, 원전·SMR 등 에너지 인프라 사업 확대",https://www.ngonews.kr/news/articleView.html?idxno=233673,"DL그룹의 에너지 사업은 DL에너지와 DL이앤씨를 중심으로 구성돼 있다. DL에너지는 발전소 개발과 투자·운영을 담당하고, DL이앤씨는 플랜트와 원전 분야의 설계·조달·시공(EPC) 역량을 갖추고 있다. 대림은 에너지... "
2026-07-23,네이버뉴스,1호선·서해선이 코앞… 부천에 1600가구 풀린다,http://www.fnnews.com/news/202607231818237488,"DL이앤씨가 경기 부천시 원미구 소사역 앞 대단지 'e편한세상 부천 어반스퀘어'를 공급한다. 23일 DL이앤씨에 따르면 이 단지는 소사3구역 주택재개발정비사업을 통해 지하 3층~지상 38층, 13개 동, 1649가구로... "
2026-07-23,네이버뉴스,"DL이앤씨, e편한세상 용인한숲시티 하자소송 일부패소 [법정워치]",http://www.newswatch.kr/news/articleView.html?idxno=80497,사진=카카오맵 로드뷰 캡처 | 뉴스워치= 민서하 기자 | DL이앤씨가 경기도 용인의 e편한세상 아파트 입주민과 벌인 하자소송 1심에서 일부 패소했다. 법원은 DL이앤씨와 시행사가 아파트 입주자대표회의에 약 28억원을... 
2026-07-23,네이버뉴스,"'하이엔드'로 승부...대우건설, 목동 재건축 출격 [뉴스+현장]",https://www.wowtv.co.kr/NewsCenter/News/Read?articleId=A202607230368&t=NNv,"지난 달 6단지가 DL이앤씨를 시공사로 선정한 것을 시작으로 사업 추진에 속도를 내고 있다. 대우건설은 지난해 11월 재편한 하이엔드 주거 브랜드 ‘써밋’도 전면에 내세웠다. 리뉴얼을 통해 ‘성취’, ‘탁월’... "
2026-07-23,네이버뉴스,인력난·공기 단축 해법 '모듈러'…건설산업 판도 바꿀까,https://www.fntimes.com/html/view.php?ud=202607231651336483b372994c95_18,DL이앤씨도 모듈러 기술 경쟁력을 꾸준히 축적하고 있다. 지난 2016년 공동주택 골조 공사에 모듈러 공법을 적용한 이후 엘리베이터 구조물과 경비실 등으로 적용 범위를 넓혔으며 현재까지 40여 건의 관련 특허를... 
2026-07-23,네이버뉴스,"역세권이냐, 가격이냐... 분양 돌입한 'e편한세상 부천 어반스퀘어'",https://www.meconomynews.com/news/articleView.html?idxno=133057,"DL이앤씨, 'e편한세상 부천 어반스퀘어' 분양 59㎡ 8억원대, 74㎡ 9억원대, 84㎡ 10억원대 '소사역' 더블 역세권... GTX-B 도입 시 을지로 20분대, 삼성역 30분대 [시장경제=정규호 기자] DL이앤씨의 e편한세상 부천... "
