date,source,title,link,description
2026-07-07,네이버뉴스,"현대차그룹, 협력사까지 '미래차 체질개선'…AI·로봇·SDV 공급망 키운...",https://www.megaeconomy.co.kr/news/newsview.php?ncode=1065597472506605,"변속기 제작 기업인 현대트랜시스는 ESG 교육과 컨설팅을 제공하고, 현대건설과 현대엔지니어링은 안전 인센티브와 안전관리비 확대 등을 통해 현장 안전 기반을 강화한다. 광고·마게팅 회사인 이노션은 협력사... "
2026-07-07,네이버뉴스,"교통학회, 이달 13일 ‘JTX 추진 촉구 토론회’ 개최",https://news.mtn.co.kr/news-detail/2026070716271894291,"현대건설이 노선을 제안한 상태이며, 현재 한국개발연구원 공공투자관리센터(KDI PIMAC) 주관의 민자적격성 조사를 받고 있다. 이 토론회의 좌장은 이동민 교통학회 회장대행이 담당한다. 이어 토론 패널로 ▲김숙진... "
2026-07-07,네이버뉴스,"현대차그룹, 1·2차 협력사와 대규모 상생협약…대금 '평균 10일 이내' 지...",https://www.delighti.co.kr/news/articleView.html?idxno=118718,"현대트랜시스는 ESG 컨설팅, 이노션은 AI 구독료 지원 및 탈락 협력사 시안 대가 지급 등을 실시하며 현대건설과 현대엔지니어링은 안전 관리 인프라와 포상제를 강화한다. 현대차그룹 관계자는 ""이번 상생협약은 단순한... "
2026-07-07,네이버뉴스,"""협력사는 미래 모빌리티 동반자""…현대차그룹, '상생협약' 체결",https://www.sidae.com/article/2026070714120573865,"행사에는 주병기 공정위원장과 서강현 현대차그룹 기획조정담당 사장을 비롯해 현대차·기아, 현대모비스, 현대제철, 현대건설, 현대로템, 현대엔지니어링, 현대트랜시스, 현대위아, 현대오토에버, 현대케피코, 이노션 등... "
2026-07-07,네이버뉴스,"AI·SDV 시대 공급망 재편…현대차그룹, 협력사와 '미래 모빌리티 상생...",https://www.industrynews.co.kr/news/articleView.html?idxno=83031,"이날 협약식에는 주병기 공정거래위원장을 비롯한 공정거래위원회 관계자와 서강현 현대차그룹 기획조정담당 사장, 현대차·기아, 현대모비스, 현대제철, 현대건설, 현대로템, 현대엔지니어링, 현대트랜시스, 현대위아... "
2026-07-07,네이버뉴스,"""해상풍력에 SMR까지 투자"" 현대건설, 5천억 전환사채로",https://www.catchnews.kr/news/articleView.html?idxno=125881,"현대건설이 7일 5000억원 규모의 전환사채(CB) 발행을 성공적으로 마무리하고, 확보한 자금을 해상풍력부터 소형모듈원전(SMR)까지 뉴에너지 사업 운영자금으로 투입한다고 밝혔다. [사진 현대건설] 현대건설이 5000억원... "
2026-07-07,네이버뉴스,"서강현 사장 ""협력사 경쟁력이 곧 현대차그룹 경쟁력…기술, 자금, 교육...",https://www.asiatime.co.kr/article/20260707500371,"협약식에는 현대차·기아를 비롯해 현대모비스, 현대제철, 현대건설, 현대로템, 현대엔지니어링, 현대트랜시스, 현대위아, 현대오토에버, 현대케피코, 이노션 등 12개 계열사와 150여 개 협력사가 참석했다. 현대차그룹은... "
2026-07-07,네이버뉴스,"현대차그룹, 미래차 전환 위해 협력사 지원 확대…공급망 경쟁력 강화",http://www.press9.kr/news/articleView.html?idxno=79050,"현대제철과 현대트랜시스는 ESG와 납품단가 연동제 교육 등을 지원하며, 현대건설과 현대엔지니어링은 안전관리 역량 강화를 위한 프로그램을 운영할 예정이다. 이노션은 AI 서비스 이용 지원과 기술자료 보호 제도 등을... "
2026-07-07,네이버뉴스,"현대차그룹, 협력사 상생 강화…""공정거래·기술 지원 확대""",https://www.mydaily.co.kr/page/view/2026070716262094388,"현대차·기아와 현대모비스, 현대제철, 현대건설, 현대로템, 현대엔지니어링, 현대트랜시스, 현대위아, 현대오토에버, 현대케피코, 이노션 등 12개 계열사와 150개 협력사 관계자도 함께했다. 현대차그룹은 로봇, SDV... "
2026-07-07,네이버뉴스,"현대차그룹, 미래 산업 전환 위해 공급망 전반 상생협력 강화",http://www.koreastocknews.com/news/articleView.html?idxno=119626,"현대차·기아와 현대모비스, 현대제철, 현대건설, 현대로템, 현대엔지니어링, 현대트랜시스, 현대위아, 현대오토에버, 현대케피코, 이노션 등 12개 계열사 대표와 150여 개 1·2차 협력사 관계자들도 함께 자리했다. 주병기... "
2026-07-07,네이버뉴스,"현대차그룹, 미래 산업 전환 위해 1·2차 협력사와 AI·로봇·SDV 전환 생...",http://www.techholic.co.kr/news/articleView.html?idxno=222017,"협약식에는 주병기 공정거래위원장을 비롯한 공정거래위원회 주요 관계자와 현대차그룹 기획조정담당 서강현 사장을 포함한 현대차그룹 주요 임직원 및 현대차ㆍ기아와 현대모비스, 현대제철, 현대건설, 현대로템... "
2026-07-07,네이버뉴스,"현대건설, 5000억원 5년 만기 전환사채(CB) 성공적 발행",https://www.womentimes.co.kr/news/articleView.html?idxno=104206,"우먼타임스 = 송현섭 기자 현대건설은 자본시장에서 5000억원 규모의 5년 만기 전환사채(CB)를 성공적으로 발행해 자금을 조달했다고 7일 밝혔다. 이번 발행된 CB는 표면금리 0%, 만기금리 0%, 5년 만기 조건이며 이사회... "
2026-07-07,네이버뉴스,"현대차그룹, 협력사와 '미래 모빌리티 동맹' 강화 … 공급망 상생 확대",http://www.worktoday.co.kr/news/articleView.html?idxno=86471,"건설 계열사인 현대건설과 현대엔지니어링은 안전 관리와 현장 운영 역량 강화를 지원하고, 이노션은 AI 구독료 지원과 기술자료임치제 운영을 통해 협력사의 디지털 역량과 지식재산 보호를 강화할 계획이다.... "
2026-07-07,네이버뉴스,"현대차그룹, 협력사 상생 강화해 미래 모빌리티 경쟁력 높인다",https://theviewers.co.kr/View.aspx?No=4140216,"이번 협약에는 현대차·기아와 현대모비스, 현대제철, 현대건설, 현대로템, 현대엔지니어링, 현대트랜시스, 현대위아, 현대오토에버, 현대케피코, 이노션 등 12개 계열사와 150여 개 1·2차 협력사가 참여했다.... "
2026-07-07,네이버뉴스,"현대차그룹, 협력사 납품대금 '60일→10일'로 단축…경영 안정 지원",https://view.asiae.co.kr/article/2026070716280549471,"현대차·기아와 현대모비스, 현대제철, 현대건설, 현대로템, 현대엔지니어링, 현대트랜시스, 현대위아, 현대오토에버, 현대케피코, 이노션 등 12개 계열사 대표와 150여 개 1·2차 협력사 관계자들도 자리했다. 현대차그룹은... "
2026-07-07,네이버뉴스,"현대건설, 5천억 규모 전환사채 발행…""원전·SMR 미래 성장 사업 활용""",https://www.ebn.co.kr/news/articleView.html?idxno=1715445,"현대건설은 7일 5000억원 규모의 전환사채(CB)를 발행했다고 밝혔다. 이번 전환사채는 표면금리 0%, 만기금리 0%, 만기 5년 조건으로 발행됐다. 최근 자본시장에서 보기 드문 수준의 우수한 발행 조건을 확보했다.... "
2026-07-07,네이버뉴스,"""납품대금 열흘 안에 준다""…현대차그룹의 파격적인 상생실험",https://www.financialpost.co.kr/news/articleView.html?idxno=265467,"행사에는 주병기 공정거래위원장과 서강현 현대자동차그룹 기획조정담당 사장을 비롯해 현대자동차·기아, 현대모비스, 현대제철, 현대건설 등 12개 계열사 대표, 150여 개 협력사 관계자가 참석했다. 이번 협약의... "
2026-07-07,네이버뉴스,현대건설 5천억 원 전환사채 발행 완료 원전 SMR 투자 재원 확보,https://www.nextdaily.co.kr/news/articleView.html?idxno=251105,"현대건설이 7일 5,000억 원 규모의 전환사채(CB) 발행을 성공적으로 마쳤다고 발표했다. 이번에 발행된 전환사채는 표면금리와 만기금리가 모두 0%, 만기는 5년으로 정해졌다. 최근 자본시장에서는 찾아보기 힘든 우수한... "
2026-07-07,네이버뉴스,"현대차그룹, 1·2차 협력사와 상생협력 강화···AI·로봇·SDV 전환 생태...",https://www.ziksir.com/news/articleView.html?idxno=139374,현대건설은 우수 현장소장 포상제와 안전 인센티브 제도를 확대한다. 현대엔지니어링은 법정 기준을 웃도는 수준으로 안전관리비를 편성해 현장 안전 기반을 강화한다. 이노션은 협력사 임직원에게 AI 구독료를 지원하고... 
2026-07-07,네이버뉴스,"GS건설 컨소, ‘산곡역자이힐스테이트&하늘채’ 8월 분양",https://biz.heraldcorp.com/article/10801142?ref=naver,"GS건설과 현대건설, 코오롱글로벌 컨소시엄은 오는 8월 인천광역시 부평구 산곡동 10번지 일원에 산곡6 주택재개발정비사업을 통해 들어서는 ‘산곡역자이힐스테이트&하늘채’를 분양할 예정이라고 7일 밝혔다. 이... "
2026-07-07,네이버뉴스,"현대차그룹, 협력사와 미래차 동행…AIㆍ로봇ㆍSDV 전환 돕는다",https://www.dnews.co.kr/uhtml/view.jsp?idxno=202607071128486940223,"협약식에는 주병기 공정거래위원장과 서강현 현대차그룹 기획조정담당 사장, 현대차ㆍ기아ㆍ현대모비스ㆍ현대제철ㆍ현대건설ㆍ현대로템ㆍ현대엔지니어링ㆍ현대트랜시스ㆍ현대위아ㆍ현대오토에버ㆍ현대케피코ㆍ이... "
2026-07-07,네이버뉴스,"[도시정비시장 풍향계] 현대건설, 마천5구역 재개발 2차 현설 단독 참석",https://www.dnews.co.kr/uhtml/view.jsp?idxno=202607071608326610299,현대건설이 서울 송파구 마천5구역 재개발 시공권을 확보하게 될지 관심이 집중된다. 마천5구역(마천5재정비촉진구역) 재개발 정비사업 조합은 7일 시공사 선정을 위한 2차 현장설명회(현설)를 개최했다. 그 결과... 
2026-07-07,네이버뉴스,"현대차그룹, 협력사와 상생협약 체결-미래 모빌리티 공급망 경쟁력 강화",https://www.mediafine.co.kr/news/articleView.html?idxno=82903,"이날 행사에는 주병기 공정거래위원장과 서강현 현대차그룹 기획조정담당 사장을 비롯해 현대차, 기아, 현대모비스, 현대제철, 현대건설, 현대로템 등 12개 계열사 대표와 150여 개 협력사 관계자가 참석했다.... "
2026-07-07,네이버뉴스,"현대건설, '조건 없는' 5000억 CB 발행 성공…제로쿠폰·노리픽싱으로 재...",http://www.financialreview.co.kr/news/articleView.html?idxno=43375,/ 사진=현대건설 현대건설이 고금리 기조 속에서 5000억 원 규모의 전환사채(CB)를 역대 최우량 조건으로 발행하는 데 성공했다. 발행 회사에 절대적으로 유리한 '제로 쿠폰'과 '리픽싱 배제' 조건을 뚫고 기관투자자들의... 
2026-07-07,네이버뉴스,"현대차그룹, AI·로봇 전환 맞춰 공급망 상생협력 강화",https://www.g-enews.com/view.php?ud=202607071552188514112616b072_1,"협약식에는 주병기 공정거래위원장과 서강현 현대차그룹 기획조정담당 사장, 현대차·기아와 현대모비스, 현대제철, 현대건설, 현대로템, 현대엔지니어링, 현대트랜시스, 현대위아, 현대오토에버, 현대케피코, 이노션 등... "
2026-07-07,네이버뉴스,"[비즈+]현대차그룹, 미래 모빌리티 전환 맞춰 공급망 상생 강화…AI·SDV...",https://www.businessplus.kr/news/articleView.html?idxno=113842,"현대차·기아를 비롯해 현대모비스, 현대제철, 현대건설, 현대로템, 현대엔지니어링, 현대트랜시스, 현대위아, 현대오토에버, 현대케피코, 이노션 등 12개 계열사 대표와 150여 개 1·2차 협력사 관계자도 함께했다. 주... "
2026-07-07,네이버뉴스,"현대차그룹, 1·2차 협력사와 AI·로봇·SDV 전환 생태계 구축 나서",https://www.pointdaily.co.kr/news/articleView.html?idxno=310998,"이날 행사에는 주병기 공정거래위원장과 서강현 현대차그룹 기획조정담당 사장을 비롯해 현대차·기아, 현대모비스, 현대제철, 현대건설, 현대로템 등 12개 주요 계열사 대표와 150여 개 협력사 관계자가 참석했다. 이번... "
2026-07-07,네이버뉴스,"""500대 기업 임원 자사주 가치 1년 새 2배↑""",https://www.m-i.kr/news/articleView.html?idxno=1389099,"현대차는 임원 458명 가운데 441명(96.3%)이 자사주를 보유했고, 기아(93.6%), 미래에셋증권(93.2%), KT(92.2%), KT&G(90.9%), 현대건설(90.1%) 등이 뒤를 이었다. 리더스인덱스는 성과보상 차원의 자사주 지급 확대 등이 보유... "
2026-07-07,네이버뉴스,"현대차그룹, 공급망 상생 강화…AI·SDV 시대 협력사 경쟁력 키운다",https://www.ezyeconomy.com/news/articleView.html?idxno=237215,"현대건설과 현대엔지니어링은 안전관리와 현장 운영 지원을 강화하며, 이노션은 AI 구독 지원과 기술자료 임치제 운영, 입찰 탈락 업체에 대한 시안 비용 지급 등을 통해 협력사의 디지털 경쟁력과 지식재산권 보호를... "
2026-07-07,네이버뉴스,"현대차그룹, 미래 모빌리티 상생협약...""협력사 경쟁력이 곧 그룹의 경...",https://www.joongangenews.com/news/articleView.html?idxno=531180,"현대차·기아와 현대모비스, 현대제철, 현대건설, 현대로템, 현대엔지니어링, 현대트랜시스, 현대위아, 현대오토에버, 현대케피코, 이노션 등 12개 계열사 대표와 150여개 1·2차 협력사 관계자들도 함께 자리했다. 주... "
2026-07-07,네이버뉴스,"현대차그룹, 협력사와 상생협력 강화...미래 모빌리티 경쟁력 높인다",http://www.econonews.co.kr/news/articleView.html?idxno=440845,"이날 행사에는 주병기 공정거래위원장과 현대차그룹 기획조정담당 서강현 사장을 비롯해 현대차·기아, 현대모비스, 현대제철, 현대건설 등 12개 계열사 대표와 150여 개 협력사 관계자가 참석했다. 이번 협약은 AI와 SDV... "
2026-07-07,네이버뉴스,"현대건설, 5000억 규모 전환사채 발행…원전·SMR투자에 활용",http://www.whitepaper.co.kr/news/articleView.html?idxno=264315,"화이트페이퍼, WHITEPAPER현대건설 본사 전경. (사진=현대건설)  현대건설이 5000억 원 규모의 전환사채(CB) 발행을 완료했다. 발행된 전환사채는 원전과 소형모듈원자로(SMR) 등 미래 성장 사업에 전략적으로 활용할... "
2026-07-07,네이버뉴스,"현대차그룹, AI·SDV 전환 맞춰 공급망 상생 강화…협력사 지원 확대",https://biz.sbs.co.kr/article_hub/20000321161?division=NAVER,"이번 협약에는 현대차·기아를 비롯해 현대모비스, 현대제철, 현대건설, 현대로템, 현대엔지니어링, 현대트랜시스, 현대위아, 현대오토에버, 현대케피코, 이노션 등 12개 계열사와 150여 개 협력사가 참여했습니다.... "
2026-07-07,네이버뉴스,"현대차그룹 ""협력사가 경쟁력""…AI·로봇 시대 상생협약 체결",https://www.kizmom.com/news/articleView.html?idxno=111417,"행사에는 주병기 공정거래위원장과 서강현 현대차그룹 기획조정담당 사장을 비롯해 현대차, 기아, 현대모비스, 현대제철, 현대건설, 현대로템 등 12개 계열사 대표와 150여 개 협력사 관계자들이 참석했다. 현대차그룹은... "
2026-07-07,네이버뉴스,[1% 초고수의 선택] '한화오션' 사고 '디앤디파마텍' 팔았다,https://www.ebn.co.kr/news/articleView.html?idxno=1715434,"반면 순매도 상위에는 두산, 삼성전자우, SKC, 현대차, 디앤디파마텍, SK스퀘어, 파두, 두산에너빌리티, 현대건설, 테크윙 등이 포함됐다. 이날 한화오션은 8만9800원으로 전 거래일 대비 22.65% 급락했지만 초고수 순매수... "
2026-07-07,네이버뉴스,"현대건설, 5000억 CB 흥행…이자 '제로'로 조달",https://www.financialpost.co.kr/news/articleView.html?idxno=265463,현대건설이 이자를 한 푼도 물지 않는 조건으로 5000억원을 손에 쥐었다. 투자자에게 불리한 조건에도 기관 자금이 몰리며 흥행에 성공했다. 현대건설은 7일 5000억원 규모의 전환사채(CB) 발행을 마무리했다고 밝혔다.... 
2026-07-07,네이버뉴스,"현대건설, 5000억 CB 발행 완료…시장 신뢰 재확인",https://www.g-enews.com/view.php?ud=202607071515571113514e0091f6_1,현대건설이 5000억 원 규모의 전환사채(CB) 발행을 마무리하며 장기 자금 조달 기반을 강화했다. 표면금리와 만기금리를 모두 0%로 설정하고 투자자 보호 장치로 통하는 리픽싱(전환가액 조정)과 조기상환청구권(풋옵션)... 
2026-07-07,네이버뉴스,"현대차그룹, 상생 기반 SDV 공급망 생태계 구축",https://news.dealsitetv.com/articles/172943,"현대차·기아와 현대모비스, 현대제철, 현대건설, 현대로템, 현대엔지니어링, 현대트랜시스, 현대위아, 현대오토에버, 현대케피코, 이노션 등 12개 계열사 대표와 150여개 1·2차 협력사 관계자들도 함께 자리했다. 주병기... "
2026-07-07,네이버뉴스,"현대건설, 5000억원 전환사채 발행…재무안정성·신용도 제고 속도",https://www.cstimes.com/news/articleView.html?idxno=712534,"현대건설 계동사옥. 컨슈머타임스=정용규 기자 | 현대건설이 5000억원 규모의 전환사채(CB) 발행을 완료했다고 7일 밝혔다. 이번 전환사채는 표면금리·만기금리 모두 0%, 만기 5년 조건으로 발행됐다. 전환가액은 이사회... "
2026-07-07,네이버뉴스,"공정위, 현대차와 협력사 간 상생 협약…10일 내 대금지급",https://news.einfomax.co.kr/news/articleView.html?idxno=4423779,"이번 협약식에는 주병기 공정거래위원장을 비롯해 현대자동차, 기아, 현대모비스, 현대제철, 현대건설, 현대로템, 현대엔지니어링, 현대트랜시스, 현대위아, 현대오토에버, 현대케피코, 이노션 등 현대차그룹 12개... "
2026-07-07,네이버뉴스,"현대차그룹, 협력사 대금 기간 단축·지원 확대…상생 협력 강화",https://www.chosun.com/economy/auto/2026/07/07/YOZF6PAHSNF7PICU4QULCTC5WE/?utm_source=naver&utm_medium=referral&utm_campaign=naver-news,"이날 행사에는 주병기 공정거래위원장과 서강현 현대차 사장, 현대차·기아를 비롯해 현대모비스, 현대제철, 현대건설, 현대로템, 현대엔지니어링, 현대트랜시스, 현대위아, 현대오토에버, 현대케피코, 이노션 등 12개... "
2026-07-07,네이버뉴스,"현대차그룹, 협력사 대금 ‘10일 이내’ 지급… 공급망 상생 협력 강화",https://biz.chosun.com/industry/car/2026/07/07/PEWALH2CUZDK3CBKNBEFIOM76Q/?utm_source=naver&utm_medium=original&utm_campaign=biz,"여기에 현대차·기아와 현대모비스, 현대제철, 현대건설, 현대로템, 현대엔지니어링, 현대트랜시스, 현대위아, 현대오토에버, 현대케피코, 이노션 등 12개 계열사 대표와 150여개 1·2차 협력사 관계자들도 자리했다.... "
2026-07-07,네이버뉴스,"“협력을 넘어 상생으로”…현대차그룹, 한국에 ‘AI·로봇·SDV’ 대전...",https://www.mk.co.kr/article/12092469,"현대차·기아와 현대모비스, 현대제철, 현대건설, 현대로템, 현대엔지니어링, 현대트랜시스, 현대위아, 현대오토에버, 현대케피코, 이노션 등 12개 계열사 대표와 150여개 1·2차 협력사 관계자들도 함께 했다. 주병기... "
2026-07-07,네이버뉴스,"현대차그룹, 1·2차 협력사와 상생협력 강화…미래 산업 전환 대응",https://www.etoday.co.kr/news/view/2601098,"현대건설과 현대엔지니어링은 안전 인센티브 확대와 안전관리비 지원을 통해 협력사의 현장 경쟁력을 높일 계획이다. 이노션은 AI 구독료 지원과 기술자료임치제 운영, 입찰 탈락 협력사에 대한 시안 대가 지급 등을 통해... "
2026-07-07,네이버뉴스,"현대건설, '5천억원' 규모 전환사채 발행 성공",http://www.enewstoday.co.kr/news/articleView.html?idxno=2446348,"현대건설은 7일 5000억원 규모의 전환사채(CB) 발행을 성공적으로 완료했다고 7일 밝혔다. 이번 전환사채는 표면금리 0%, 만기금리 0%, 만기 5년 조건으로 발행됐으며, 최근 자본시장에서 보기 드문 수준의 우수한 발행... "
2026-07-07,네이버뉴스,"“협력사도 AI·SDV 전환 함께”⋯ 현대차그룹, 협력사와 상생협약 본격...",https://www.viva100.com/article/20260707501021,"이날 행사에는 주병기 공정거래위원장과 서강현 현대차그룹 기획조정담당 사장을 비롯해 현대차·기아, 현대모비스, 현대제철, 현대건설, 현대로템, 현대엔지니어링, 현대트랜시스, 현대위아, 현대오토에버, 현대케피코... "
2026-07-07,네이버뉴스,"현대차그룹, 1·2·3차 협력사 상생 강화…AI·로봇·SDV 전환 생태계 구...",http://www.metroseoul.co.kr/article/20260707500232,"이 외에도 현대트랜시스는 ESG 교육과 컨설팅을, 현대건설과 현대엔지니어링은 안전관리와 현장 운영 역량 강화를 위한 지원을 확대한다. 이노션은 협력사 임직원을 대상으로 AI 구독료를 지원하고 기술자료임치제 운영... "
2026-07-07,네이버뉴스,"현대차그룹, 협력사 AI·SDV 전환 지원…미래차 공급망 경쟁력 키운다",https://www.asiatime.co.kr/article/20260707500202,협약식에는 현대차·기아를 비롯해 현대모비스·현대제철·현대건설·현대로템·현대엔지니어링·현대트랜시스·현대위아·현대오토에버·현대케피코·이노션 등 12개 계열사와 150여 개 협력사가 함께했다. 이번 협약은... 
2026-07-07,네이버뉴스,"[도시정비시장 풍향계] 부산 명장5구역 2차도 유찰…조합, 후속 절차 논...",https://www.dnews.co.kr/uhtml/view.jsp?idxno=202607071549335710296,"지난 2차 현장설명회에는 현대건설과 롯데건설 등 2개 건설사가 참석했다. 현대건설이 1차에 이어 연속으로 참석했고, 롯데건설은 2차에 처음 자리했다. 조합은 2차 입찰도 유찰된 만큼 향후 절차를 논의할... "
2026-07-07,네이버뉴스,"현대차그룹, 협력사와 AI·로봇·SDV 전환 생태계 구축…협력 강화",https://www.hankyung.com/article/202607070259g,현대건설은 우수 현장소장 포상제와 안전 인센티브 제도를 확대 운용해 협력사의 현장 운영 역량 강화를 지원한다. 현대엔지니어링은 현장 안전 기반을 강화한다. 이노션은 협력사 임직원을 대상으로 AI 구독료를... 
2026-07-07,네이버뉴스,"현대차그룹, 공정위·협력사와 상생협약…미래 모빌리티 공급망 강화",https://www.etnews.com/20260707000270,"현대제철과 현대케피코는 동반성장펀드 등 금융 지원을, 현대건설과 현대엔지니어링은 현장 안전 역량 강화를 지원한다. 이노션은 AI 구독료 지원 등 업종별 상생 기반을 넓힌다. 공정위는 협약을 이행하는 기업들에게... "
2026-07-07,네이버뉴스,"현대차그룹, 협력사 상생협력 확대…미래차 경쟁력 높인다",https://www.edaily.co.kr/news/newspath.asp?newsid=04519846645512224,현대건설은 우수 현장소장 포상제와 안전 인센티브 제도를 확대 운영해 협력사의 현장 운영 역량 강화를 지원한다. 현대엔지니어링은 법정 기준을 웃도는 수준으로 안전관리비를 편성하는 등 현장 안전 기반을 강화한다.... 
2026-07-07,네이버뉴스,"현대차그룹, 1·2차 협력사와 공급망 상생 협약",https://zdnet.co.kr/view/?no=20260707135128,"현대차·기아와 현대모비스, 현대제철, 현대건설, 현대로템, 현대엔지니어링, 현대트랜시스, 현대위아, 현대오토에버, 현대케피코, 이노션 등 12개 계열사와 150여 개 1·2차 협력사도 함께했다. 현대차그룹 서강현... "
2026-07-07,네이버뉴스,"현대차그룹, 협력사 대금 10일 내 지급하기로…공급망 상생 강화",https://www.nocutnews.co.kr/news/6544412?utm_source=naver&utm_medium=article&utm_campaign=20260707091601,"현대차·기아와 현대모비스, 현대제철, 현대건설, 현대로템, 현대엔지니어링, 현대트랜시스, 현대위아, 현대오토에버, 현대케피코, 이노션 등 12개 계열사 대표와 150여 개 1·2차 협력사 관계자들도 함께 자리했다. 주... "
2026-07-07,네이버뉴스,"현대차그룹, AI·SDV 시대 협력사 지원 강화…150개사와 상생협약",https://www.news1.kr/industry/auto-industry/6220140,"이날 협약식에는 주병기 공정거래위원장을 비롯한 공정위 관계자와 서강현 현대차그룹 기획조정담당 사장, 현대차(005380)·기아(000270), 현대모비스(012330), 현대제철(004020), 현대건설(000720), 현대로템(064350)... "
