date,source,title,link,description
2026-04-17,네이버뉴스,"대우건설 김보현, 일본출장 왜 갔을까",http://www.biztribune.co.kr/news/articleView.html?idxno=352605,"대우건설과 토요엔지니어링 간 MOU 체결 후 기념사진을 촬영하고 있다. _ 사진 왼쪽부터 토요엔지니어링 대표이사 에이지 호소이, 대우건설 플랜트사업본부장 박세윤 상무, 토요엔지니어링 사업개발/마케팅... "
2026-04-17,네이버뉴스,"대우건설, 일본 기업과 협력 확대…플랜트·에너지 사업 공동 발굴",https://www.asiaa.co.kr/news/articleView.html?idxno=246842,대우건설은 김보현 대표이사와 주요 경영진이 지난 12일부터 17일까지 일본을 방문해 현지 기업들과 협력 방안을 논의했다고 밝혔다. 이번 방문은 LNG와 플랜트 분야에서 협업해 온 일본 EPC 기업 및 엔지니어링사와의... 
2026-04-17,네이버뉴스,대우건설 대표 김보현 일본 출장 5박6일 : 도쿄-치바현-가나가와현에서...,https://www.huffingtonpost.kr/article/256707,"김보현 대우건설 대표이사 사장이 5박6일의 일본 출장에서 돌아왔다. 도쿄를 필두로 치바현, 가나가와현 등지에 퍼져 있는 5개 기업 본사를 방문해 해외 사업 협력을 약속했다. 일본은 대우건설이 창사 이래 사업을... "
2026-04-17,네이버뉴스,"시공사 선정 재개한 성수4지구, 또 '행정지도' 받나",https://www.m-i.kr/news/articleView.html?idxno=1365505,"대우건설·롯데건설에 요구한 '추가 이행각서'와 입찰 참여 안내서 조건 변경이 문제가 된 것. 일부 조합원들이 서울시와 성동구청에 민원을 제기, 행정지도도 거론되고 있다. 17일 정비업계에 따르면 성동구청은... "
2026-04-17,네이버뉴스,"대우건설, 1.2조 규모 '성남 신흥3구역' 수주",https://www.industrynews.co.kr/news/articleView.html?idxno=80153,인더스트리뉴스 한원석 기자  대우건설이 경기도 성남시의 대규모 재개발 사업을 확보하며 조 단위 수주 실적을 기록했다. 대우건설은 한국토지주택공사(LH)가 발주한 '신흥3구역 공공참여 재개발사업'의... 
2026-04-17,네이버뉴스,"대우건설, 일본 EPC 3사와 협업···플랜트 수주경로 다변화한다",https://www.enetnews.co.kr/news/articleView.html?idxno=49055,"대우건설이 일본 엔지니어링 기업들과 손잡고 플랜트 사업구조 재편에 나선다. 김보현 대표이사는 지난 12일부터 17일까지 일본을 방문해 Toyo Engineering, Chiyoda, JGC 등 주요 EPC 기업들과 협력 범위 확대를 논의했다.... "
2026-04-17,네이버뉴스,"[주요공시] 삼천당제약, 카카오, 하이드로리튬, 이엠텍, 현대로템, 셀루...",https://www.kdpress.co.kr/news/articleView.html?idxno=204390,"수주·공급·영업 ■ 대우건설(KOSPI, 047040)은 한국토지주택공사(LH)와 신흥3구역 공공참여 재개발사업 공사 계약을 체결했다고 공시했다. 계약금액은 1조2686억5670만원으로 최근 매출액 대비 15.75% 수준이다.... "
2026-04-17,네이버뉴스,방산은 '지능형'으로 건설은 '복합형'으로…'첨단 기술'로 미래 성장판...,http://www.dailypop.kr/news/articleView.html?idxno=98136,"사진=첨단3지구 A7블록 '호반써밋 첨단3지구' 투시도 대우건설은 글로벌 에너지 시장 공략을 위해 일본을 방문, LNG EPC(설계·조달·시공) 분야의 세계적 기업들과 전방위적 협력 강화에 나섰다. 정원주 회장을 포함한... "
2026-04-17,네이버뉴스,종전 기대감에 삼성전자 전고점 탈환 목전… 코스피 6000선 안착한 한 주,https://weekly.donga.com/3/all/11/6188731/1,"외국인의 순매도 상위 10개 종목은 삼성전자, LS ELECTRIC, 한화에어로스페이스, HD현대중공업, 대우건설, SK하이닉스, LIG디펜스앤에어로스페이스, 삼성E&A, 삼천당제약, 키움증권였다. 이번 주 기관의 순매수 1위... "
2026-04-17,네이버뉴스,[도시정비시장 풍향계] 하안주공3ㆍ4단지 재건축 1차 현설에 7개사 ‘북...,https://www.dnews.co.kr/uhtml/view.jsp?idxno=202604171734076600710,"17일 도시정비업계에 따르면 하안주공3ㆍ4단지 재건축 사업시행자 대한토지신탁ㆍKB부동산신탁 컨소시엄이 이날 개최한 1차 현설에 대우건설, GS건설, 포스코이앤씨, 롯데건설, SK에코플랜트, IPARK현대산업개발... "
2026-04-17,네이버뉴스,[현장] '4004가구 도시 재편' 하안주공3·4단지...7곳 현설 참석,http://www.popcornnews.net/news/articleView.html?idxno=118709,"이날 설명회에는 대우건설·GS건설·포스코이앤씨·롯데건설·SK에코플랜트·IPARK현대산업개발·진흥기업 등 총 7개 건설사가 참석, 입찰 가능성을 내비친 것으로 파악됐다. 하안주공3·4단지는 지난해 5단지와 함께 가장... "
2026-04-17,네이버뉴스,"선별 수주 통했다… 대우건설, 정비사업 '최대 실적' 시동",https://www.sisaweek.com/news/articleView.html?idxno=234969,"시사위크=정소현 기자  최근 도시정비사업 시장이 빠르게 달아오르는 가운데, 대우건설이 연초부터 공격적인 수주 흐름을 보이며 업계의 시선을 끌고 있다. 통상 하반기에 실적이 몰리는 건설사들의 특성과 달리... "
2026-04-17,네이버뉴스,"대우건설, 日 주요 기업과 LNG·에너지 협력 확대… 중동 재건은 '기회 ...",https://www.s-journal.co.kr/news/articleView.html?idxno=40608,"대우건설이 일본의 대표적인 LNG·플랜트 EPC 기업들과 협력 강화에 나섰다. 글로벌 에너지 시장 재편에 대응해 LNG와 석유화학, 암모니아 등 플랜트 전반에서 사업 기회를 넓히는 한편, 향후 중동 지역 복구 수요가... "
2026-04-17,네이버뉴스,"[기업] 대우건설, 일본서 주요기업과 LNG 등 협력 강화",https://www.ytn.co.kr/_ln/0102_202604171702266381,"대우건설이 일본 주요 기업들과 액화천연가스(LNG)와 플랜트, 재생에너지 등 전방위 협력을 논의했다고 밝혔습니다. 대우건설은 도요엔지니어링, 치요다, JGC 등과 면담하면서 LNG를 비롯해 암모니아, 비료, 석유화학 등... "
2026-04-17,네이버뉴스,"대우건설, 일본 LNG EPC 강자들과 협력 강화",https://www.kgnews.co.kr/news/article.html?no=892168,대우건설 김보현 대표이사 및 주요 경영진이 지난 12일부터 17일까지 일본을 방문해 현지 주요 기업들과 협력 관계를 강화하고 글로벌 사업 확대에 나섰다. 이번 방문은 단순 교류를 넘어 LNG 및 플랜트 분야에서... 
2026-04-17,네이버뉴스,"대우건설, 일본 EPC 강자들과 협력 강화… 글로벌 에너지 사업 확대",https://www.donga.com/news/Economy/article/all/20260417/133761063/1,대우건설은 김보현 대표이사와 주요 경영진이 지난 12일부터 17일까지 일본을 방문해 현지 EPC 기업들과 협력 관계를 강화하고 글로벌 사업 확대 방안을 논의했다고 17일 밝혔다. 이번 방문은 LNG 및 플랜트 분야에서... 
2026-04-17,네이버뉴스,"국토부 장관 “가덕신공항, 대우건설 기술력 증명해달라”…회장 만나...",https://www.busan.com/view/busan/view.php?code=2026041716470737501,"김윤덕 국토교통부 장관은 4월 16일 오후 서울 중구 정동의 국토발전전시관에서 정원주 대우건설 회장과 면담을 갖고, 가덕도신공항 건설사업의 성공적 추진을 위해 그룹 차원의 적극적인 노력을 당부했다. 대우건설은... "
2026-04-17,네이버뉴스,"대우건설 대표 김보현, 일본 방문해 LNG EPC 포함 현지 기업과 협력 강화",https://www.businesspost.co.kr/BP?command=article_view&num=435982,"대우건설과 토요엔지니어링 사이 업무협약 체결 뒤 참석자들이 기념사진을 촬영하고 있다. 사진 왼쪽부터 에이지 호소이 토요엔지니어링 대표이사, 박세윤 대우건설 플랜트사업본부장 상무, 에이지 사카타... "
2026-04-17,네이버뉴스,"김보현 대우건설 대표, 1분기 도정 1위...성수·목동으로 영토 확장",https://www.insightkorea.co.kr/news/articleView.html?idxno=244855,"김보현 대표가 이끄는 대우건설이 1분기 국내 도시정비사업에서 1위(수주액 기준)를 기록했다.  '양적 성장'에 있어서 분명한 성과다. 연내 서울 성수·목동 등 핵심 정비사업지 수주를 앞두고 있는 가운데, 하이엔드... "
2026-04-17,네이버뉴스,"대우건설, 日 EPC 기업과 협력 강화…글로벌 에너지 시장 공략 가속",http://www.efnews.co.kr/news/articleView.html?idxno=129176,"대우건설과 토요엔지니어링 간 MOU 체결 후 기념사진을 촬영하고 있다. 사진 왼쪽부터 토요엔지니어링 대표이사 에이지 호소이, 대우건설 플랜트사업본부장 박세윤 상무, 토요엔지니어링 사업개발/마케팅 본부장... "
2026-04-17,네이버뉴스,"대우건설, 일본 기업들과 '에너지 동맹'… LNG·플랜트 시장 겨냥",http://www.seoulwire.com/news/articleView.html?idxno=717355,대우건설이 일본 주요 에너지·플랜트 기업들과 협력을 확대하며 글로벌 시장 공략에 속도를 내고 있다. 17일 대우건설은 김보현 대표이사를 비롯한 경영진이 지난 12일부터 일본 도쿄를 방문해 현지 기업들과... 
2026-04-17,네이버뉴스,"대우건설 김보현, 日기업과 사업 협력 강화 논의",https://it.chosun.com/news/articleView.html?idxno=2023092160539,"김보현 대우건설 대표가 임원진과 함께 일본을 방문해 현지 기업들과 만나 액화천연가스(LNG), 플랜트 등 전방위 분야에서 협력 관계를 강화했다. 17일 대우건설에 따르면 김 대표는 주요 경영진들과 함께 4월 12일부터... "
2026-04-17,네이버뉴스,[4월 넷째 주 아파트 분양일정] 천안 '엘리프성성호수공원' 등 9258가구,http://www.dtnews24.com/news/articleView.html?idxno=810639,"대우건설은 충북 청주시 서원구 미평동 54-3번지 일원에 '청주푸르지오씨엘리체'를 분양한다. 지하 2층~지상 최고 29층, 10개동, 전용면적 84·114㎡, 총 1351가구 규모다. 계룡건설은 충남 천안시 서북구 업성2구역 1... "
2026-04-17,네이버뉴스,"대우건설, 1분기만에 작년 수주액 60% 달성…한강변 중심 수주 확대에 최...",http://www.consumernews.co.kr/news/articleView.html?idxno=754265,대우건설이 올해 도시정비사업에서 가파른 수주 속도를 이어가고 있다. 4월 초 기준 수주액이 지난해 연간 실적의 절반을 넘어섰다. 업계에서는 2022년 기록한 역대 최대 수주 실적 경신 가능성도 예의주시하고 있다.... 
2026-04-17,네이버뉴스,"대우건설, 일본 토요엔지니어링 등과 에너지 플랜트 MOU",http://www.edaily.co.kr/news/newspath.asp?newsid=04467366645417104,대우건설이 일본 엔지니어링 기업과 업무협약(MOU)을 체결하며 글로벌 에너지 시장 공략에 속도를 낸다. 대우건설과 JGC 간 면담 후 단체 사진을 촬영하고 있다. 사진 왼쪽에서 다섯 번째 쇼지 야마다 JGC 대표이사... 
2026-04-17,네이버뉴스,"[건설사 재무점검-⑤] GS건설, 순차입금 6개월만에 대폭 축소…재무 정...",http://www.srtimes.kr/news/articleView.html?idxno=201414," 미청구공사 금액 매출 10% 안팎 '안정적 관리'…GS이니마 매각 통해 건전성 확보 총력  GS건설이 장부상 이익을 넘어 실제 현금흐름까지 대폭 개선하며 뚜렷한 재무 정상화 궤도에 올랐다. 5,900억원대의... "
2026-04-17,네이버뉴스,"GS건설, 정비사업 조합에 '영업정지 피해 방지 확약서' 제출",https://news.einfomax.co.kr/news/articleView.html?idxno=4410245,"GS건설[006360]이 정비사업 조합에 영업정지 피해 방지 확약서를 제출했다. 인천 검단신도시 아파트 주차장 붕괴 사고 관련 영업정지 소송이 진행되고 있어, 혹시 모를 피해가 발생할 경우 직접 책임지겠단 의도다. 17일... "
2026-04-17,네이버뉴스,"서초진흥아파트 재건축, 서울시 통합심의 통과…GS건설, 특화 설계 및 사...",https://www.hankyung.com/article/202604178778O,"우선협상대상자로 지정된 GS건설은 단지명으로 ‘서초자이 컬리너스’를 제안했으며, 건축 및 조경 특화 설계와 구체적인 사업 조건을 제시한 것으로 알려졌다. GS건설은 이번 사업에 네덜란드 건축 디자인 그룹 MVRDV와... "
2026-04-17,네이버뉴스,"[오늘의 주요공시·17일] GS건설, 3750억 규모 봉천재개발 공사 수주",https://www.safetimes.co.kr/news/articleView.html?idxno=241758,"▲ GS건설, 3750억 규모 봉천재개발 공사 수주 ▲ HD한국조선해양, 6747억 규모 가스운반선 4척 수주 ▲ 금호건설, 최대주주등 보통주 2만8798주 증가 ▲ 제이에이에스, 계열사 광주투자개발에 15억원 자금 대여... "
2026-04-17,네이버뉴스,"GS건설, 3751억 봉천4-1-3구역 재개발 수주 [공시pick]",http://www.joseilbo.com/news/news_read.php?uid=566775&class=17&grp=,"GS건설이 3751억원 규모 봉천4-1-3구역 주택재개발정비사업을 수주했다고 17일 공시했다. 이번 사업을 통해 서울 관악구 봉천동 일대에 지하 3층~지상 28층, 9개동 규모 공동주택 855세대와 부대복리시설 등이 조성된다.... "
2026-04-18,네이버뉴스,봄 이사철 분양 활기…내주 전국 8400여가구 청약,https://www.slist.kr/news/articleView.html?idxno=732698,"서울 중구 순화동 '정동 롯데캐슬 136' 투시도/ 사진=롯데건설·포애드원 시청, 서울역, 광화문 등 사대문 안의 주요 일자리 밀집 지역과 가깝고 지하철 2호선 시청역과 충정로역, 5호선 서대문역이 도보 10분... "
2026-04-18,네이버뉴스,"롯데건설, PF 리스크 줄이고 재무 체질 개선…실적 반등 기반 마련",https://economist.co.kr/article/view/ecn202604150043,롯데건설이 프로젝트파이낸싱(PF) 리스크를 낮추고 재무 구조를 재편하며 재무 안정성 개선 흐름을 보이고 있다. 부동산 경기 둔화와 PF 부실 우려가 이어지는 가운데 건설사들의 재무 체력이 핵심 경쟁력으로... 
2026-04-18,네이버뉴스,"""건겅한 일터 조성"" 임직원 건강 돌보는 건설사들",https://www.asiatime.co.kr/article/20260417500075,"롯데건설은 스마트폰을 활용한 비접촉식 건강체크 애플리케이션을 개발해 현장에 적용 중이다. 해당 앱은 스마트폰 카메라를 통해 안면 인식 기술로 심박, 혈압, 발열, 산소포화도 등 주요 생체신호를 15초 내외로... "
2026-04-17,네이버뉴스,"롯데건설, '정동 롯데캐슬 136' 분양 돌입",http://www.worktoday.co.kr/news/articleView.html?idxno=83811,"정동 롯데캐슬 136 투시도 롯데건설은 자사가 시공하고, 시행사 '지윰 21'이 분양하는 '정동 롯데캐슬 136'의 견본주택을 개관, 분양에 나선다고 17일 밝혔다. 단지는 서울 중구 순화동 일원에 지하 7층~지상 20층, 1개... "
2026-04-17,네이버뉴스,"롯데건설, 서울 중구 '정동 롯데캐슬 136' 분양",https://www.webeconomy.co.kr/news/articleView.html?idxno=2145656,"롯데건설 시공 '정동 롯데캐슬 136'이 17일 견본주택을 개관하고 분양에 나섰다고 롯데건설 측이 이날 밝혔다. 롯데건설에 따르면, 서울 중구 순화동에 들어서는 이 단지는 지하 7층~지상 20층 1개 동으로, 공동주택... "
2026-04-17,네이버뉴스,"[건설사리포트]롯데건설, '정동 롯데캐슬 136' 견본주택 개관",https://www.ebn.co.kr/news/articleView.html?idxno=1705834,"롯데건설, '정동 롯데캐슬 136' 견본주택 개관 롯데건설이 시공하고 지윰21이 시행하는 '정동 롯데캐슬 136'이 17일 견본주택을 열고 본격 분양에 나선다. '정동 롯데캐슬 136'은 서울 중구 순화동 일원에 지하 7층~지상... "
2026-04-17,네이버뉴스,"롯데건설, '정동 롯데캐슬 136' 분양",https://news.tf.co.kr/read/economy/2314543.htm,"공동주택 62가구, 오피스텔 34실 일반 분양 롯데건설은 '정동 롯데캐슬 136' 견본주택을 개관하고 본격적인 분양에 나선다고 17일 밝혔다. 정동 롯데캐슬 136은 서울 중구 순화동 일원에 조성되며 지하 7층~지상 20층, 1개... "
2026-04-17,네이버뉴스,롯데건설 시공 '정동 롯데캐슬 136' 분양 돌입…아파트 102세대·오피스...,http://www.paxetv.com/news/articleView.html?idxno=269939,"[사진=롯데건설] 롯데건설은 시행사 '지윰 21'이 분양하는 '정동 롯데캐슬 136(롯데건설 시공)'가 분양에 돌입한다고 17일 밝혔다. '정동 롯데캐슬 136'은 서울 중구 순화동 일원에 지하 7층~지상 20층, 1개 동 규모로... "
2026-04-17,네이버뉴스,‘정동 롯데캐슬 136’…도심 실수요 겨냥 [견본주택 여기어때?],http://www.fntimes.com/html/view.php?ud=202604171720333438048b718333_18,"[편집자주] 롯데건설이 17일 ‘정동 롯데캐슬 136’ 견본주택을 열고 본격적인 분양 일정에 들어갔다. 단지는 지하 7층~지상 20층, 1개 동 규모로 공동주택 102가구와 오피스텔 34실, 총 136가구로 구성된다. 이 가운데... "
2026-04-17,네이버뉴스,"롯데건설, 경기광주·서울 정동서 분양",https://www.seoulfn.com/news/articleView.html?idxno=626840,"롯데건설은 경기도 광주시 양벌동 경기도 광주시 양벌동에 들어서는 '경기광주역 롯데캐슬 시그니처 1단지'의 견본주택을 개관하고 분양에 나선다고 17일 밝혔다. 단지는 지하 7층~지상 최고 32층, 7개 동... "
2026-04-17,네이버뉴스,경기광주역 롯데캐슬 시그니처 1단지’ 17일 견본주택 개관,https://www.viva100.com/article/20260417500377,"롯데건설이 경기도 광주시 양벌동에 ‘경기광주역 롯데캐슬 시그니처 1단지’를 건립하며, 17일 견본주택을 개관하고 본격적인 분양에 나선다. 이 단지는 지하 7층에서 지상 32층까지 7개 동으로 구성되며, 총 1077가구... "
2026-04-17,네이버뉴스,수서~광주 복선전철 부분 승인…강남 접근성 더 좋아지는 광주,https://www.hankyung.com/article/2026041788161,롯데건설이 광주 양벌동에 1077가구 규모의 ‘경기광주역 롯데캐슬 시그니처 1단지’ 분양에 나선다. 향후 공급될 2단지 1249가구를 더하면 총 2326가구의 롯데캐슬 브랜드타운을 이룬다.
2026-04-17,네이버뉴스,"‘역세권 아파트’, 청약 양극화 속 더 뚜렷해진 선택지로 강세",http://www.lawissue.co.kr/view.php?ud=20260417170027956667191f6c6e_12,"같은 달 롯데건설은 경기 광주시 경강선 경기광주역 인근에 ‘경기광주역 롯데캐슬 시그니처’를 분양할 예정이다. 2개 블록, 총 2326가구로 조성되며, 이 중 전용 59~260㎡, 총 1077가구 규모의 1단지가 먼저 분양에... "
2026-04-17,네이버뉴스,"롯데건설, '경기광주역 롯데캐슬 시그니처 1단지' 공급 착수…총 1077세...",http://www.paxetv.com/news/articleView.html?idxno=269925,"[사진=롯데건설] 롯데건설이 경기도 광주시 양벌동 일원에 들어서는 '경기광주역 롯데캐슬 시그니처 1단지'의 견본주택을 열고 본격적인 분양에 나선다고 17일 밝혔다. 단지는 지하 7층~지상 최고 32층, 7개 동... "
2026-04-17,네이버뉴스,[민주 부동산] 롯데건설·대방건설,http://www.iminju.net/news/articleView.html?idxno=162746,"민주신문=이한호 기자｜롯데건설이 경기도 광주시 양벌동 일원에 건립되는 경기광주역 롯데캐슬 시그니처 1단지의 견본주택을 개관하고 분양에 나선다. 단지는 지하 7층~지상 최고 32층, 7개 동, 전용면적 59... "
2026-04-17,네이버뉴스,“직주근접·교통·학군 3박자”…롯데건설 ‘정동 롯데캐슬 136’ 분양,http://www.lawissue.co.kr/view.php?ud=20260417163249457267191f6c6e_12,"롯데건설이 17일 서울시 중구 순화동 일원에 조성되는 ‘정동 롯데캐슬 136’의 견본주택을 열고 본격적인 분양에 나섰다. ‘정동 롯데캐슬 136’은 지하 7층~지상 20층, 1개동, 전용면적 59㎡ 공동주택(아파트형 주택)... "
2026-04-17,네이버뉴스,롯데건설 '정동 롯데캐슬 136' 도심 비규제 단지 분양,http://www.finomy.com/news/articleView.html?idxno=253330,현대경제신문 임이랑 기자 | 롯데건설이 시공을 맡고 시행사 '지윰 21'이 분양하는 '정동 롯데캐슬 136'이 17일 견본주택을 열고 분양 일정에 돌입한다. 17일 롯데건설에 따르면 '정동 롯데캐슬 136'은 서울 중구 순화동... 
2026-04-17,네이버뉴스,작년 청약 상위 20개 단지 중 70% 이상 ‘역세권’ 입지,https://www.sentv.co.kr/article/view/sentv202604170139,같은 달 롯데건설은 경기 광주시 경강선 경기광주역 인근에 ‘경기광주역 롯데캐슬 시그니처’를 분양할 예정이다. 인천에서는 현대엔지니어링이 인천 남동구 옛 롯데백화점 부지를 개발해 ‘힐스테이트... 
2026-04-17,네이버뉴스,"정동 '롯데캐슬 136' 분양 본격화...""시청·서울역 도보권""",http://www.kdfnews.com/news/articleView.html?idxno=182173,"롯데건설이 시공하는 '정동 롯데캐슬 136'이 17일 견본주택을 개관하고 분양에 나섰다. 서울 중구 순화동 일원에 들어서는 단지로 도심 직주근접 입지를 내세웠다. 단지는 지하 7층~지상 20층, 1개 동 규모로 조성된다.... "
2026-04-18,네이버뉴스,"‘규제 완화 혜택’ 용적률 300%까지 올리는 노량진1구역, 3100가구 대단...",https://biz.chosun.com/real_estate/real_estate_general/2026/04/18/GII5THUGBRBLRD5VW47I7CBD2I/?utm_source=naver&utm_medium=original&utm_campaign=biz,"시공은 포스코이앤씨가 맡았다. 하이엔드 브랜드인 오티에르로 조성할 계획이다. 고준석 연세대 상남경영원 주임교수는 “단지 바로 앞에 9호선 급행이 멈추는 노량진역이 있어 여의도, 강남 등 업무지구와의... "
2026-04-18,네이버뉴스,서울 분양은 '로또' 지방 분양은 '미달'..양극화된 분양 시장,https://www.theguru.co.kr/news/article.html?no=100653,포스코이앤씨가 서울 서초구 잠원동에서 공급한 ‘오티에르 반포’ 일반청약도 43가구 모집에 3만 540개의 청약통장이 접수돼 평균 710.2대 1의 경쟁률을 기록했다. 앞서 진행된 특별공급에서도 43가구 모집에 1만... 
2026-04-17,네이버뉴스,포스코이앤씨 신반포19·25차 재건축 '전 세대 한강뷰' 완성… 5단계 조...,https://www.tournews21.com/news/articleView.html?idxno=133896,"포스코이앤씨가 신반포19·25차 재건축 사업에서 '조합원 전 세대 한강 조망'을 구현하기 위한 설계를 제안하며 주목받고 있다. 이번 설계는 일부 세대에 집중됐던 기존 한강 조망 구조를 넘어, 단지 전체를 한강... "
2026-04-17,네이버뉴스,"수도권 ‘오피스텔’, 수익률에 이어 거래량도 동반 상승",http://www.lawissue.co.kr/view.php?ud=20260417165124559867191f6c6e_12,"포스코이앤씨는 이달, 인천시 연수구 송도국제도시 국제업무지구 G5블록 일원에 짓는 ‘더샵 송도그란테르’를 분양할 예정이다. 아파트 1,544가구와 오피스텔 96실로 구성된다. 오피스텔은 3면 개방형 구조와 맞통풍... "
2026-04-17,네이버뉴스,"수도권 오피스텔, 수익률·거래량 동반 상승세 뚜렷",https://www.woodkorea.co.kr/news/articleView.html?idxno=89091,"포스코이앤씨는 이달, 인천시 연수구 송도국제도시 국제업무지구 G5블록 일원에 짓는 '더샵 송도그란테르'를 분양할 예정이다. 아파트 1,544가구와 오피스텔 96실로 구성된다. 오피스텔은 3면 개방형 구조와 맞통풍... "
2026-04-17,네이버뉴스,"수도권 오피스텔, 수익률·거래량 동반 상승…""실거주·투자 수요 확대...",https://www.thebilliards.kr/news/articleView.html?idxno=30516,"포스코이앤씨는 인천 송도국제도시에 '더샵 송도그란테르'를 분양할 예정이다. 아파트와 오피스텔이 함께 조성되며, 일부 호실에는 팬트리와 맞통풍 구조를 적용해 주거 편의성을 높일 계획이다. 단지 앞 송도... "
2026-04-17,네이버뉴스,"'현금부자만의 리그' 청약통장, 5개월새 26만명 탈퇴했다",https://www.sidae.com/article/2026041715083159257,"지난 13일 포스코이앤씨가 서울 서초구 잠원동에서 공급한 '오티에르 반포'는 일반청약 43가구 모집에 3만540개의 청약통장이 접수돼 평균 710.2대 1의 경쟁률을 기록했다. 해당 단지 분양가는 전용 59㎡가 20억원대, 84... "
2026-04-17,네이버뉴스,송도국제도시 집값 상승세 지속…GTX-B 기대감에 분양 시장도 ‘들썩’,https://theviewers.co.kr/View.aspx?No=4046112,"이러한 분위기 속에서 포스코이앤씨는 이달 송도국제도시 내 ‘더샵 송도그란테르’ 분양에 나설 예정이다. 단지는 인천 연수구 송도동 일원에 지하 2층~지상 최고 46층, 15개 동, 총 1544가구 규모의 아파트와 주거형... "
