date,source,title,link,description
2026-04-22,네이버뉴스,"코스피 최고치 경신에 또 빚투경고등 … 증권사들, 신용거래 제한·증거...",https://biz.newdaily.co.kr/site/data/html/2026/04/22/2026042200185.html,"삼성전기 우, 대우건설, 인텍플러스, 한화엔진, 상신이디피, 후성, 제이오 등 일부 종목은 신용·대주거래를 중단했고, 한솔테크닉스, 모헨즈, 이수페타시스, 와이지-원, 제이에스티나, 엠케이전자 등 일부 종목은 거래를... "
2026-04-22,네이버뉴스,"초록색 입은 오세훈, 역대 최대 서울국제정원박람회 열린다",https://news.cpbc.co.kr/article/1172378?division=NAVER,"대우건설, GS건설, IPARK현대산업개발, 호반건설, 계룡건설, 서울주택도시개발공사 등 주요 건설사가 참여한 기부정원이 서울숲 잔디광장 주변에 조성됐다. 서울숲 연못을 중심으로 삼표, 영풍문고... "
2026-04-22,네이버뉴스,"“사람은 죽고, 돈은 멈췄다”… 대우건설 시흥 현장 ‘총체적 난항’",https://www.wemakenews.co.kr/news/view.php?no=25127,이미지 출처=대우건설 누리집 한 현장에서 생명과 돈의 문제가 겹치면서 관리 체계 전반에 대한 의문이 커지고 있다. 경찰은 최근 시흥 아파트 공사장에서 발생한 사망사고와 관련해 현장 관계자 3명을 업무상 과실치사... 
2026-04-22,네이버뉴스,"과천시, 아주대학교병원 건립 본격화로 의료거점 도약",https://www.viva100.com/article/20260422501100,"아주대학교병원 컨소시엄에 아이비케이 투자증권, 학교법인 대우학원, 코웨이, 한화, 대우건설 등 18개 기업이 참여, 총사업비는 약 4조 2천879억원 규모에 이른다. 향후 막계동 특별계획구역은 종합병원을 넘어 헬스... "
2026-04-22,네이버뉴스,"역대 최장·최대규모 서울국제정원박람회, 5월1일 개막",https://www.dailian.co.kr/news/view/1636607/?sc=Naver,"먼저, 대우건설, GS건설, IPARK현대산업개발, 호반건설, 계룡건설, 서울주택도시개발공사 등 주요 건설사가 참여한 기부정원이 서울숲 중심공간인 잔디광장 주변으로 조성되었다. 이와 함께 서울숲의 또 다른 명소인... "
2026-04-22,네이버뉴스,"李 대통령 ""한-베트남 원전·인프라 등 전략 분야 협력 확대""",https://www.namdonews.com/news/articleView.html?idxno=908270,"특히 여의도 면적의 3분의 2 규모, 총사업비 약 38억 달러가 투입되는 하노이 스타레이크시티 신도시 사업을 진행 중인 대우건설 등이 돋보인다. 이 대통령은 중동전쟁 등 급변하는 국제 정세 속에서 에너지 안보 강화 및... "
2026-04-22,네이버뉴스,'서울숲에서 건대입구까지 10km 꽃길' 역대급 정원박람회 열린다,https://www.hankookilbo.com/news/article/A2026042213100001808?did=NA,"대우건설과 GS건설 등 주요 건설사가 사회공헌의 일환으로 조성한 기부정원은 서울숲 잔디광장을 채운다. 이렇게 조성된 정원은 연간 약 5,630톤의 탄소를 흡수할 것으로 시는 기대한다. 시는 관람객 편의를 위해 전시장... "
2026-04-22,네이버뉴스,과천지구 막계동에 종합병원·융복합클러스터 조성 ‘빅 프로젝트’ 본...,https://www.kyeongin.com/article/1762324,"아주대병원 컨소시엄에는 (주)아이비케이투자증권, 학교법인 대우학원, (주)코웨이, (주)한화, (주)대우건설 등 18개 기업이 참여하고 있다. 한편, 지난해 9월 과천시와 과천도시공사는 막계동에 조성하는 융복합... "
2026-04-22,네이버뉴스,역대 최대·최장 서울국제정원박람회…방문객 1천500만명 목표(종합),https://www.yna.co.kr/view/AKR20260422083551004?input=1195m,"대우건설, GS건설, HDC, 호반건설, 계룡건설, SH의 기부정원이 서울숲 잔디광장 주변에 조성된다. 이 가운데 호반건설의 기부정원은 황지해 작가의 '왕관의 수줍음'(Crown Shyness)이다. 서울숲의 연못을 중심으로는 삼표... "
2026-04-22,네이버뉴스,"한국부동산마케팅협회, 주요 건설사 마케팅 담당 실무진과 정책 간담회",https://www.dnews.co.kr/uhtml/view.jsp?idxno=202604221555097430281,포럼 회장을 맡은 한동준 대우건설 팀장을 비롯한 포럼 구성원들이 함께 했다. 이 자리에서는 오창국 법무법인 동인 변호사가 ‘근로자추정제 등 노동관련 입법동향’을 시작으로 △비주거 상품 용도변경 규제완화... 
2026-04-23,네이버뉴스,"'검단 아파트 붕괴' LH, GS건설 책임져야...24일 손배소송 첫 변론",https://www.newspim.com/news/view/20260422001008,한국토지주택공사(LH)가 GS건설을 상대로 인천 검단 아파트 지하주차장 붕괴사고와 관련해 제기한 손해배상 소송의 첫 변론기일이 이달 24일 열린다. LH는 GS건설의 부실 시공으로 공사가 입주예정자 지체보상금 지출... 
2026-04-23,네이버뉴스,대전지역 완성형 인프라 기대…입지여건ㆍ교육환경ㆍ상품성 우수,https://www.hankookilbo.com/news/article/A2026042211130002534?did=NA,"GS건설이 대전광역시 유성구 용계동에 들어서는 ‘도안 자이 센텀리체’ 견본주택을 10일 열고 분양에 들어갔다. 단지는 지하 2층에서 지상 42층 규모로 총 2,293가구 가운데 1,780가구가 일반분양이다. 전용 84㎡ 비중이... "
2026-04-23,네이버뉴스,부산 광안5구역 재개발… GS건설 광안리 랜드마크 수주 눈앞,https://www.dnews.co.kr/uhtml/view.jsp?idxno=202604221445555500248,두 차례 입찰에서 유일하게 도전장을 내민 GS건설이 우선협상대상자 지위를 등에 업고 총회 의결을 기다리고 있다. 광안5구역 재개발조합은 오는 26일 부산 해운대구 벡스코에서 시공사 선정 총회를 개최한다. 사업... 
2026-04-22,네이버뉴스,[EBN 오늘(22일) 이슈 종합] 하림 등판에 판 뒤집혔다…익스프레스 매각...,https://www.ebn.co.kr/news/articleView.html?idxno=1706284,"■ GS건설, 커지는 책임준공 약정...리스크 관리 '주목' GS건설이 지난해 영업이익 반등에 성공한 가운데 대규모 책임준공 약정이 향후 재무 건전성을 위협할 주요 리스크 요으로 지목되고 있다. 건설업계 전반에 걸쳐... "
2026-04-22,네이버뉴스,"GS건설, '2026 레드닷 디자인 어워드' 본상 수상",https://www.kgnews.co.kr/news/article.html?no=892926,GS건설은 자이 브랜드 굿즈로 기획한 조명 제품 ‘매그닷(magDot)’과 ‘이그니스(IGNIS)’가 ‘Red Dot Award: Product Design 2026’에서 프로덕트 디자인 부문 위너에 선정됐다고 22일 밝혔다. 이번 수상작은 리브랜딩 이후... 
2026-04-22,네이버뉴스,"GS건설 자이 브랜드 굿즈, 2026 레드닷 디자인 어워드 본상 수상",https://www.gokorea.kr/news/articleView.html?idxno=864372,GS건설은 자이 브랜드 굿즈로 기획한 조명 제품 '매그닷(magDot)'과 '이그니스(IGNIS)'가 Red Dot Award: Product Design 2026 프로덕트 디자인 부문 본상(위너)을 수상했다고 21일 밝혔다. 이번 수상작은 리브랜딩 이후 고객 경험... 
2026-04-22,네이버뉴스,경동나비엔·GS건설·금호타이어…글로벌 디자인 어워드 수상 잇따라,http://www.kdfnews.com/news/articleView.html?idxno=182440,GS건설 자이(Xi) BI 국내 기업들이 글로벌 디자인 어워드에서 잇따라 수상하며 제품 경쟁력을 입증했다. 경동나비엔은 독일 '레드닷 디자인 어워드 2026' 제품 부문에서 본상을 수상했다. 수상 제품은 '숙면매트 사계절... 
2026-04-22,네이버뉴스,"GS건설, '자이 브랜드 굿즈' 레드닷 디자인 어워드 본상",http://www.koreastocknews.com/news/articleView.html?idxno=118093,"GS건설(006360, 각자대표 허윤홍·김태진)은 자이 브랜드 굿즈로 기획한 조명 '매그닷(magDot)'과 '이그니스(IGNIS)'가 레드닷 디자인 2026에서 디자인 부문 위너에 선정됐다고 22일 밝혔다. 이번 수상작은 자이가 공간 안에서... "
2026-04-22,네이버뉴스,'AX 시대' 가속페달 밟는 기업들...인프라·인재·디자인 '초격차' 경쟁,http://www.dailypop.kr/news/articleView.html?idxno=98246,"GS건설 역시 자이(Xi) 브랜드 철학을 담은 조명 굿즈 '매그닷'과 '이그니스'로 레드닷 본상을 수상하며, 건설사의 브랜드 경험을 일상형 오브제로 성공적으로 확장했다는 평가를 받았다. 경동나비엔은 숙면매트... "
2026-04-22,네이버뉴스,"[건설브리핑] 건설업계, 디자인·신용·안전까지 확장",https://www.seoulfn.com/news/articleView.html?idxno=627171,GS건설은 자이 브랜드 굿즈로 기획한 조명 제품 2종이 '레드닷 디자인 어워드 2026'에서 프로덕트 디자인 부문 위너에 선정됐다고 21일 밝혔다. 수상 제품인 '매그닷(magDot)'은 아파트 세대 내 천장 조명인 히든... 
2026-04-22,네이버뉴스,"GS건설, '자이 브랜드 굿즈'로 2026 레드닷 디자인 어워드 수상",https://www.womentimes.co.kr/news/articleView.html?idxno=102467,우먼타임스 = 송현섭 기자 GS건설은 자이 브랜드 굿즈로 기획한 조명 제품 '매그닷(magDot)'과 '이그니스(IGNIS)'가 2026 레드닷 디자인 어워드 프로덕트 디자인 부문 위너에 선정됐다고 22일 밝혔다. '매그닷(magDot)'은... 
2026-04-22,네이버뉴스,"배성건설, 이천에 203억 신규 투자…시, 관외기업 첫 유치",https://www.news1.kr/local/gyeonggi/6145618,"GS건설, DL E&C, SK에코플랜트 등 주요 건설사를 거래처로 두고 안정적인 성장세를 이어오고 있다. 이번 투자는 공장 증설이 아닌 외부 기업이 이천에 생산시설을 신설하는 첫 사례라고 시는 밝혔다. 배성건설은 이천시... "
2026-04-22,네이버뉴스,"GS건설 '자이 굿즈', 레드닷 디자인 어워드서 본상 수상",http://www.seoulwire.com/news/articleView.html?idxno=718227,GS건설은 자이 브랜드 굿즈로 기획한 조명 제품 '매그닷(magDot)'과 '이그니스(IGNIS)'가 '레드닷 디자인 어워드(Red Dot Award) 2026'에서 프로덕트 디자인 부문 위너에 선정됐다고 22일 밝혔다. 이번 수상작은 리브랜딩 이후... 
2026-04-22,네이버뉴스,창원 성산구 집값 상승세 지속…‘창원자이 더 스카이’ 공급 희소성 주...,https://isplus.com/article/view/isp202604220124,"GS건설이 공급하는 ‘창원자이 더 스카이’는 창원시 성산구 중앙동 99-4번지 일원에 들어서며, 4개 동, 최고 49층, 총 519세대 규모로 조성된다. 전용면적 84㎡와 106㎡ 타입으로 구성돼 실수요자 선호를 반영했다.... "
2026-04-23,네이버뉴스,"신동빈 롯데 회장, 하노이 시장 면담… 새로운 랜드마크 짓는다",https://www.g-enews.com/view.php?ud=2026042307251892910c8c1c064d_1,"랜드마크 건설은 롯데쇼핑, 롯데호텔, 롯데건설 등 그룹 주요 계열사들이 동반 진출하여 막대한 시너지를 낼 수 있는 최적의 모델이다. 이란 전쟁 등으로 글로벌 공급망이 불안정한 상황에서, 안정적인 성장세를 보이는... "
2026-04-23,네이버뉴스,"[더벨][한맥그룹 편입 10년, 다시 뛰는 삼안] 기업회생부터 손바뀜까지...",https://www.thebell.co.kr/free/content/ArticleView.asp?key=202604201447500800108683,그래픽=Gemini 생성 이미지 (출처: 삼안) 매물로 나온 삼안에 가장 먼저 인수 의사를 보인 건 롯데건설이다. 하지만 프라임개발과 롯데건설은 매각차익 세금을 두고 합의를 보지 못하면서 끝내 거래가 불발됐다. 매각에... 
2026-04-23,네이버뉴스,[롯데건설 재구축] ③홀로서기 시험대…그룹 지원 이후 향방은,https://www.fetv.co.kr/news/articleView.html?idxno=300947,"롯데건설이 PF 리스크 축소와 재무구조 개선에 나서며 한때 불거졌던 유동성 우려를 상당 부분 덜어냈다. 다만 위기 국면에서 이어진 그룹 차원의 지원은 자생력 논란과 함께, 롯데건설 리스크가 그룹 전체 부담으로... "
2026-04-23,네이버뉴스,공사비·분양가 인상 후폭풍에…서울 분상제 단지 흥행 돌풍,https://www.ajunews.com/view/20260422081300953,"[사진=롯데건설] 서울에서 분양가상한제(분상제)가 적용된 단지들이 연일 흥행 기록을 갈아치우며 청약 시장의 열기를 뜨겁게 달구고 있다. 시세차익 기대감이 극대화된 강남권은 물론, 강북의 전통 부촌인... "
2026-04-22,네이버뉴스,"[단독] 선택과 집중 나선 롯데건설, 말레이지사 청산…""돈되는 곳만 한...",https://www.asiatoday.co.kr/view.php?key=20260422010006801,"계열 공사 및 위험 적은 정비사업 집중 베트남 에코스마트시티 1조 사업 기대 “안정적인 해외 포트폴리오 구축하겠다” 롯데건설이 선택과 집중에 나선다. 지난해 중국사업을 정리한 데 이어, 연초엔... "
2026-04-22,네이버뉴스,[경기광주역 롯데캐슬 시그니처 1단지] 쌍령공원 품은 역세권 ‘녹색 아...,https://www.kyeongin.com/article/1762333,"/롯데건설 제공 롯데건설이 ‘경기광주역 롯데캐슬 시그니처 1단지’의 견본주택을 개관하고 분양일정에 돌입했다. 단지는 지하 7층~지상 최고 32층, 7개 동, 전용면적 59~260㎡, 총 1천77가구 규모다. 전용면적별... "
2026-04-22,네이버뉴스,4월23일 알림,https://www.hani.co.kr/arti/society/ngo/1255395.html,◇ 대홍기획은 글로벌 광고제인 ‘2026 클리오 어워즈'에서 롯데건설 ‘폭염주의복'(VEST for REST) 캠페인으로 미디어 부문 동상을 수상했다고 22일 밝혔다. 건설노동자의 작업복을 활용해 여름철 폭염 속 건설 현장의... 
2026-04-22,네이버뉴스,"대홍기획, 클리오 어워즈 미디어 부문 동상 수상",https://www.newspim.com/news/view/20260422001132,수상작은 롯데건설과 함께 진행한 '폭염주의복(VEST for REST)' 캠페인이다. 이 캠페인은 건설노동자의 작업복에 특수 변색 잉크를 적용해 일정 온도에 도달하면 뒷면의 문구가 바뀌도록 설계했다. 대홍기획은 세계 3대... 
2026-04-22,네이버뉴스,"“효성 롯데, 함바집 계약 일방 파기해 손해 극심”… 인근 식당 울분",https://www.kgnews.co.kr/news/article.html?no=892861,하루 평균 250명 손님…계약 한 달 새 끊겨 롯데건설 현장서 일방적 식권 반납 식당 “구두 계약 문제로 대응 못해” 주장 “괜히 롯데건설 현장과 계약을 해서 기존 단골손님들까지 모두 잃었습니다.” 22일 오전 11시... 
2026-04-23,네이버뉴스,"[더벨][디벨로퍼 프로젝트 리포트] 랜스퍼트에이엠씨, 'G1 서울' 이후 차...",https://www.thebell.co.kr/free/content/ArticleView.asp?key=202604201751400880102610,캠파트너스는 포스코이앤씨 안전용역 및 경비 등을 기반으로 성장한 곳이다. 관건은 공평15·16PFV 주주로 참여한 개발사들의 시행 이익 회수로 풀이된다. G1 서울은 아직 공실률이 80% 수준으로 전해진다.... 
2026-04-23,네이버뉴스,한강변 ‘랜드마크 공식’ 깨졌다…스카이브릿지 지우는 재건축 조합들...,https://www.sedaily.com/article/20035905?ref=naver,"신반포19·25차 재건축 수주전에서도 포스코이앤씨가 스카이브릿지를 포함한 특화 설계를 내세웠지만, 일부 조합원 사이에서는 “반포 한강변에서 서울시가 스카이브릿지를 허가한 전례가 드물다”는 회의론이 흘러나온다.... "
2026-04-23,네이버뉴스,더샵 브랜드 가치 집약ㆍ'송도 주거 정점' 기대,https://www.hankookilbo.com/news/article/A2026042213500005037?did=NA,"포스코이앤씨가 인천 연수구 송도동에 들어서는 ‘더샵 송도그란테르’를 4월에 분양한다. 이 단지는 송도국제도시 국제업무지구에 공급되는 마지막 주거단지로, 포스코이앤씨는 그동안 송도에서 쌓아온 더샵 브랜드의... "
2026-04-23,네이버뉴스,"포스코이앤씨, 인천 검단신도시에 대단지 '더샵 검단레이크파크' 5월 분...",https://www.ajunews.com/view/20260422075738926,아주경제=백소희 기자 shinebaek@ajunews.com 더샵 BI 이미지 포스코이앤씨는 오는 5월 인천 검단신도시 22·23블록에 ‘더샵 검단레이크파크’를 분양할 예정이다. 해당 단지는 검단신도시에 처음으로 공급되는 ‘더샵’... 
2026-04-22,네이버뉴스,“자존심보다 실리”…스카이브릿지 포기한 신반포2차[부동산 라운지],https://www.sedaily.com/article/20035892?ref=naver,신반포19·25차 재건축 수주전에서도 포스코이앤씨가 스카이브릿지를 포함한 특화 설계를 제안했지만 일부 조합원들 사이에서는 “반포 한강변에서 스카이브릿지를 서울시가 허가해준 전례가 드물다”며 회의론이 나온다.... 
2026-04-22,네이버뉴스,대전 2호선 트램 역세권 신축 아파트 더샵 관저아르테 4월 공급,http://www.fnnews.com/news/202604221731546517,포스코이앤씨가 대전 서구 관저동 일원에 대단지 신축 아파트인 '더샵 관저아르테'를 4월 중 공급한다고 밝혔다. 최근 청약 제도 개편과 원자재 가격 상승에 따른 신축 아파트 공급 축소 상황에서 대전 도시철도 2호선... 
2026-04-22,네이버뉴스,지방 분양 '후끈'…전주·진주·창원 20대 1 넘어,https://www.hankyung.com/article/2026042294811,전셋값 상승률도 작년과 올해 각각 4.9%와 2.7%다. ‘더샵 안동더퍼스트’는 포스코이앤씨가 안동에서 처음 선보인 단지다. ‘청주 푸르지오 씨엘리체’는 분평·미평동 일대에서 19년 만에 공급된 새 아파트다.
2026-04-22,네이버뉴스,[기획] 같은 평형인데 4배차… 고분양가 부추기는 ‘고무줄 건축비’,https://www.dt.co.kr/article/12058954?ref=naver,비슷한 시기 포스코이앤씨가 분양한 강남권 하이엔드 브랜드 단지인 '오티에르 반포'(전용 59㎡ 기준) 건축비가 5억2576만~5억6410만원대다. 노량진 단지와 비교해 5억원 이상 건축비가 낮다. 단지 규모나 커뮤니티 시설... 
2026-04-22,네이버뉴스,"포스코이앤씨 '책임준공' 리스크 고조...약정 2.6조, 손배액 8.4조",https://www.esgeconomy.com/news/articleView.html?idxno=15319,인천 연수구 송도국제도시에 위치한 포스코이앤씨 송도사옥 앞 신호등에 빨간불이 켜져 있다. 사진=뉴스1 잇단 '인재형' 안전사고로 포스코이앤씨가 영업정지 처분을 받을 가능성이 높아지고 있는 가운데 공사 지연에... 
2026-04-22,네이버뉴스,"포스코이앤씨, '더샵 안동더퍼스트' 1순위 청약 평균 '7.6대 1' 기록",http://www.enewstoday.co.kr/news/articleView.html?idxno=2422066,"포스코이앤씨가 경상북도 안동시에서 분양한 '더샵 안동더퍼스트'가 평균 7.61대 1의 경쟁률을 기록하며 1순위 청약을 마쳤다. 22일 한국부동산원 청약홈에 따르면, 전날 진행한 더샵 안동더퍼스트 1순위 청약에서... "
2026-04-22,네이버뉴스,"지방 경쟁률 맞아?…포스코이앤씨, ‘더샵 안동더퍼스트’ 1순위 청약 ...",https://biz.heraldcorp.com/article/10723324?ref=naver,일반공급 317가구 모집에 2412명 접수 더샵 안동더퍼스트 투시도.[포스코이앤씨 제공] 포스코이앤씨가 경상북도 안동시에서 분양한 ‘더샵 안동더퍼스트’가 평균 7.61대 1의 경쟁률을 기록하며 1순위 청약을... 
2026-04-23,네이버뉴스,"""보완수사권 없어"" 충돌‥13억 뇌물 혐의 불기소",https://imnews.imbc.com/replay/2026/nwtoday/article/6817333_37012.html,지인 명의로 회사를 설립한 뒤 감사 대상 기관으로부터 공사를 수주한 건설사들이 이 회사에 일감을 주도록 하는 방식으로 19차례에 걸쳐 15억 8천만 원의 뇌물을 받았다는 의혹이 포착됐기 때문입니다. 공수처는 2023년... 
2026-04-23,네이버뉴스,TBM 전성기…‘판’이 커진다,https://www.dnews.co.kr/uhtml/view.jsp?idxno=202604221424087430236,"현재 1공구(호반TBMㆍLT삼보), 2공구(특수건설), 3공구(AJ지오텍) 등 주요 전문건설사들이 참여해 굴착... 앞으로 단순 장비 보유를 넘어 시공 기술력과 숙련된 운영인력 확보 여부가 TBM 수주 경쟁의 핵심 요인으로... "
2026-04-23,네이버뉴스,"[N2 포커스] '30조 대어' 목동 재건축 시공사 선정, 조용한 이유 들어보...",https://www.news2day.co.kr/article/20260422500224,"또 다른 대형 건설사 관계자는 ""최근 정비사업은 원가 부담이 커져 예전처럼 공격적으로 경쟁에 나서기 쉽지 않다""며 ""입찰 비용까지 고려하면 선별 수주 기조가 강해질 수밖에 없다""고 말했다."
2026-04-23,네이버뉴스,"[노트북 너머] 정비사업 과열, 이대로 괜찮나",https://www.etoday.co.kr/news/view/2577974,특히 ‘압‧여‧목‧성’이라 불리는 압구정‧여의도‧목동‧성수 등 서울 핵심 지역에서 시공사 선정 총회가 잇따르며 건설사들도 수주에 사활을 거는 모습이다. 업계에서는 ‘지금 아니면 기회가 없다’는 인식을 가장... 
2026-04-23,네이버뉴스,공수처·檢 5년 ‘핑퐁’에… 감사원 13억 뇌물 불기소,https://www.seoul.co.kr/news/society/law/2026/04/23/20260423008007?wlog_tag3=naver,자신이 담당하는 피감기관에 감사 관련 편의를 제공하는 대가로 피감기관 공사를 수주한 민간 건설사들에게 자신이 운영하는 전기공사업체에 전기공사를 주도록 했다는 의혹이다. 또 자신이 운영하는 업체의 법인자금... 
2026-04-23,네이버뉴스,보완수사 다툼에… '뇌물' 감사원 간부 재판 못넘겼다,https://www.mt.co.kr/society/2026/04/23/2026042219303634232,이 가운데 검찰은 A씨가 감사 편의를 제공하는 대가로 고속도로 건설공사를 수주한 한 건설사로부터 자신이 운영하는 업체에 2억원대 전기공사를 주게 해 뇌물 총 2억9000만원을 수수한 혐의를 지난해 6월 먼저 재판에... 
2026-04-23,네이버뉴스,대형 건설사 수주 잔치 뒤의 곡소리…'역마진'에 죽어가는 하청 건설사...,https://www.gukjenews.com/news/articleView.html?idxno=3564025,대형 건설사들의 화려한 수주 실적 뒤에는 하청 노동자와 중소 건설사들의 피눈물이 가려져 있다. 이 구조적 왜곡을 방치하는 한 대한민국 건설산업은 결국 모래 위에 세운 성에 지나지 않는다.
2026-04-22,네이버뉴스,검찰·공수처 ‘보완수사’ 기싸움 하더니…‘감사원 뇌물 사건’ 용두...,https://www.khan.co.kr/article/202604222046005,김씨는 2018~2021년 감사원 과장으로 근무할 때 자신이 감사한 공기업의 건설공사를 수주한 건설사로부터 19차례에 걸쳐 총 15억8000만원 상당의 금품을 수수한 혐의를 받았다. 검찰은 지난해 6월 2억원가량 뇌물수수 의혹에... 
2026-04-22,네이버뉴스,100t 1억4천만원 폴리에틸렌 2억5천만원까지 올라…실물경제는 이미 고...,https://www.yeongnam.com/web/view.php?key=20260422027409550,석탄 및 석유제품은 외환위기 당시인 1997년 12월(57.7%) 이후 가장 높은 수준으로 나타났다.공급난을 겪고... 사정이 이렇자 HS화성 등 대구지역 건설사도 공사계약을 맺은 현장을 중심으로 자재 수급의 어려움과... 
2026-04-22,네이버뉴스,"검찰, 13억 뇌물사건 불기소…""공수처와 보완수사 이견""",https://www.obsnews.co.kr/news/articleView.html?idxno=1522009,A씨는 피감기관에서 공사를 수주한 건설사들을 자신이 운영하던 전기업체와 계약하도록 유도하는 식으로 뇌물을 수수한 혐의를 받습니다. 검찰은 공수처가 A씨 구속영장이 기각된 뒤 사건을 넘겼고 보완수사를... 
2026-04-22,네이버뉴스,돈줄 꽉 막힌 부산 건설사 영업정지 속출,http://www.kookje.co.kr/news2011/asp/newsbody.asp?code=0200&key=20260423.22001006088,통상 5개월 내외의 영업정지 기간에는 신규 수주와 입찰 참여가 금지된다. 위기는 지역 중견 건설사로도 확산하고 있다. 최근 몇 년간 적자가 누적되면서 자본 잠식 상태에 빠진 범양건영은 최근 기업회생 절차... 
2026-04-22,네이버뉴스,[공기업] 에스알 서부발전 산단공 조폐공사 동서발전 서울교통공사 교통...,http://www.biztribune.co.kr/news/articleView.html?idxno=352887,"■ 주금공, 건설사 재무부담 완화 위해 연대보증 제도 개선 ㅣ 한국주택금융공사 한국주택금융공사(주금공)는 건설사의 재무 부담을 줄이고 수주 여력을 확대하기 위해 사업자보증 이용 시공사에 대한 연대보증 면제... "
