date,source,title,link,description
2026-07-06,네이버뉴스,"성수4지구, 롯데건설 품안에…남은 성수지구는?",https://www.goodkyung.com/news/articleView.html?idxno=288921,"당초 현대건설과 DL이앤씨의 빅매치가 예상됐으나 현대건설이 압구정 수주전에서 잇달아 승리를 거둔 이후 관심이 식은 상태로, 장기간 공을 들여온 DL이앤씨가 '아크로'를 앞세워 시공권을 거머쥘 가능성이... "
2026-07-06,네이버뉴스,"[현장]폭염 극복 작업복에 칼날 막는 수트까지…볼디스트, 워크웨어 기...",https://www.newsis.com/view/NISX20260706_0003697623,"볼디스트는 현대자동차, 현대건설, 대림건설, BMW KOREA, 볼보건설기계, LG 디스플레이 등 다양한 B2B 회사와의 협업 및 네트워크 확장 또한 본격적으로 강화하고 있다. 볼디스트 관계자는 ""현장 워커들의 필드 피드백을... "
2026-07-06,네이버뉴스,남동발전·현대건설 소형원전 공동 연구에… 지역 주민 거센 반발,https://www.greened.kr/news/articleView.html?idxno=344268,현대건설과 한국남동발전은 지난 달 19일 석탄화력발전소 부지를 소형모듈원전(SMR)로 연계 전환하기 위한 연구 업무 협약을 체결했다. 해당 연구협약에는 폐지 예정인 화력발전 기반시설을 SMR 건설을 위한 인프라로... 
2026-07-06,네이버뉴스,'기술' 입은 수트·안전화…볼디스트 워크웨어의 진화[리얼로그M],https://www.mt.co.kr/living/2026/07/06/2026070614112519820,"국제기능올림픽 대한민국 국가대표 공식 유니폼과 극지연구소 협업으로 개발한 한랭 환경용 워크웨어를 전시했으며 B2B 상품존에서는 현대자동차, 현대건설, BMW코리아 등 주요 산업군과의 협업 사례도 함께 소개했다.... "
2026-07-06,네이버뉴스,"압구정 현대, 통합 심의 통과...'속도전' 닻 올려",https://www.theguru.co.kr/news/article.html?no=104015,압구정 2구역(지난해 9월)과 3구역(올해 5월)은 단독 입찰을 거쳐 현대건설이 시공사로 선정됐다. 마찬가지로 단독 입찰을 진행한 압구정 4구역은 삼성물산이 수의계약으로 수주해 사업을 추진 중이다. DL이앤씨와... 
2026-07-06,네이버뉴스,"액세스나인, KISS 2026서 안전대 부착설비 '수퍼생명줄 시스템' 소개… ...",https://kr.aving.net/news/articleView.html?idxno=1812108,"그간 현대건설 안전보건 우수사례 공모전 최우수상, 현대모터스그룹 안전보건 우수사례 최우수상전 장려상, HL디앤아이한라 기술공모전 우수상 등을 수상하며 현장 적용 가능성을 인정받았다. 또한 현대건설 '금오... "
2026-07-06,네이버뉴스,"한화큐셀, 메타 전력용 태양광 사업 수주…동서발전, 차세대 태양광 기...",https://www.sisaon.co.kr/news/articleView.html?idxno=202439,"이 기술은 지난해 HD현대건설기계 울산공장 외벽에 실증 설치됐고 국제 건축·디자인상 4개를 수상했다. 올해는 '2026 A+Awards Architectural Design' 부문 파이널리스트에도 선정됐다. 동서발전 관계자는 ""실증 중심의 산학연... "
2026-07-06,네이버뉴스,"코오롱FnC 볼디스트 '국제안전보건전시회' 참가, 산업현장 맞춤 워크웨...",https://www.businesspost.co.kr/BP?command=article_view&num=441626,"현재 현대자동차와 현대건설, DL이앤씨, BMW코리아, 볼보건설기계, LG디스플레이 등에 작업복을 공급하고 있다. 볼디스트가 국제안전보건전시회에 참가한 것은 2025년에 이어 두 번째다. 올해 전시회에는 약 376㎡(114평)... "
2026-07-06,네이버뉴스,"""작업복 넘어 전문 장비로""… 볼디스트, 국제안전보건전시회서 B2B 네트...",http://www.economytalk.kr/news/articleView.html?idxno=422489,"가파른 성장세를 발판 삼아 현대자동차, 현대건설, 대림건설, BMW KOREA 등 주요 기업들과의 협업 및 네트워크 구축에 집중했다. 2024년 기점으로 기업 고객을 향한 전략 수정으로 B2B에 집중한다는 방침이다. 코오롱FnC... "
2026-07-06,네이버뉴스,"성수 따낸 롯데건설, 이제는 목동 수주 드라이브",https://www.dt.co.kr/article/12071368?ref=naver,"현재 현대건설과 대우건설, DL이앤씨 등이 목동에 홍보관을 마련해 운영 중인데, 건물 외관까지 리모델링하는 것은 롯데건설이 처음이다. 다른 건설사의 경우 기존 오피스 일부 층을 임차하는 형태로 홍보관을 마련했다.... "
2026-07-06,네이버뉴스,[위클리오늘] 새 아파트 품귀에 원도심 정비사업 부상,http://www.weeklytoday.com/news/articleView.html?idxno=783683,"한화 건설부문·현대건설 컨소시엄은 다음달 경남 진주시 이현동에서 '포레나힐스테이트 진주'를 분양할 예정이다. 지하 2층~지상 최고 35층 8개동, 전용 59~110㎡, 총 1032가구 규모다. 진주시 첫 대형 건설사 컨소시엄... "
2026-07-06,네이버뉴스,"‘작업복도 장비다’…워크웨어, 산업안전 시장의 새 성장축으로",https://www.mk.co.kr/article/12091256,"이를 기반으로 현대자동차, 현대건설, 대림건설, BMW KOREA, 볼보건설기계, LG디스플레이 등 다양한 기업과 B2B 협업도 확대하고 있다. 안전화 존에서는 올해 신제품 라인업을 대거 공개한다. 퍼포먼스 러닝화 기술을... "
2026-07-06,네이버뉴스,내년 서울 아파트 입주 물량 역대 최저…신축 및 원도심 정비사업에 청...,https://www.viva100.com/article/20260706500976,한화 건설부문과 현대건설 컨소시엄은 8월 경남 진주시 이현동 일원에 전용 59~110㎡ 총 1032가구 규모의 ‘포레나힐스테이트 진주’를 공급할 예정이다. 한신공영은 7월 경남 창원시 마산회원구 회원2동 일원에 총... 
2026-07-06,네이버뉴스,"현대차그룹, 영남·새만금서 국내 미래산업 지도 그린다...125조 투자 구...",https://www.joongangenews.com/news/articleView.html?idxno=530746,"현대차그룹은 현대차와 기아의 현금 창출력, 현대모비스·현대로템·현대제철·현대건설·현대엔지니어링 등 주요 계열사의 투자 분담 구조를 바탕으로 대규모 국내 투자에 나서고 있다. 다만 전기차 수요 둔화와... "
2026-07-06,네이버뉴스,"국토부 상호협력평가… 건설사 88% 우수, 하도급 위반 매년 1,000건",https://www.polinews.co.kr/news/articleView.html?idxno=736139,현대건설은 1977년 설립된 자사 기술교육원을 통해 만 18~34세 청년을 대상으로 전액 무료 실무교육을 실시하고 훈련비와 참여 수당까지 지급한다. 양성된 전문인력이 협력사에 취업해 건설업계 고령화와 숙련 인력 부족... 
2026-07-06,네이버뉴스,"볼디스트, 워크웨어 시장의 새로운 패러다임 제시",http://www.apparelnews.co.kr/news/news_view/?idx=226227,"최근에는 현대자동차, 현대건설, 대림건설, BMW KOREA, 볼보건설기계, LG 디스플레이 등 다양한 B2B 회사와의 협업 및 네트워크 확장 또한 본격적으로 강화하고 있다. 올해 1~5월 매출 실적은 전년 대비 134%로 탄력적인... "
2026-07-06,네이버뉴스,새 아파트 공급 지연에 원도심 정비사업 단지 '부각',https://www.fntimes.com/html/view.php?ud=202607061422126393048b718333_18,"한화 건설부문(대표이사 김우석)·현대건설(대표이사 이한우) 컨소시엄은 8월 경남 진주시 이현동 일원에서 ‘포레나힐스테이트 진주’를 분양할 예정이다. 단지는 지하 2층~지상 최고 35층, 8개 동, 전용면적 59~110㎡ 총... "
2026-07-06,네이버뉴스,"방배5재건축 조합, 공무원 축의금 150만원 의혹…구청 감사 착수",https://www.newsis.com/view/NISX20260611_0003665680,"이후 조합 측 입장을 듣기 위해 수차례 연락을 시도했지만 답변을 받지 못했다. 방배5구역 재건축 사업은 현대건설이 서울 서초구 방배동 일대에 지하 4층~지상 33층, 29개동, 공동주택 3064가구를 짓는 사업이다."
2026-07-06,네이버뉴스,"코오롱FnC, 워크웨어 기술력 전면에···볼디스트 앞세워 산업현장 공략...",https://www.smartbizn.com/news/articleView.html?idxno=147836,"현대자동차, 현대건설, LG디스플레이 등 다양한 기업과 협업을 확대하며 전문 워크웨어 브랜드로 입지를 넓혀가고 있다. 볼디스트는 기술력 기반 브랜드 이미지 강화에도 힘쓰고 있다. 지난달 한국산업인력공단과... "
2026-07-06,네이버뉴스,"신동아ES, 곡선 디자인과 실용성 갖춘 ‘오젤(OZEL) 스위치’ 출시",https://www.seoul.co.kr/news/economy/2026/07/06/20260706500121?wlog_tag3=naver,"신동아ES는 40년 가까운 업력을 지닌 배선기구 전문기업으로 LH한국토지주택공사, 삼성물산, 현대건설, GS건설, 포스코이앤씨, 대우건설 등 국내 대형 건설사들과 협업하며 1억 개 이상의 누적 납품 실적을 보유하고 있다.... "
2026-07-06,네이버뉴스,[기획] 급성장하는 모듈러 주택 시장…본격 성장 과제는?,https://www.m-i.kr/news/articleView.html?idxno=1388526,현대건설은 공동주택 현장에 공장에서 제작한 모듈러 엘리베이터를 적용하며 현장 공정을 줄이고 있다. GS건설은 폴란드 목조 모듈러 전문기업 단우드를 인수한 데 이어 자이가이스트를 통해 국내 모듈러 주택 사업을... 
2026-07-06,네이버뉴스,"사우디, DL이앤씨에 추징금 8533억 부과…자기자본의 16%",http://www.intn.co.kr/news/articleView.html?idxno=2051749,"구 대림산업의 건설플랜트 사업부문을 인적분할해 설립된 기업으로, 삼성물산 건설부문 및 현대건설, 대우건설, GS건설과 함께 대한민국 건설업계의 BIG 5 기업으로 손꼽힌다."
2026-07-06,네이버뉴스,20년 만의 새 아파트⋯'포레나힐스테이트 진주' 8월 분양,https://www.etoday.co.kr/news/view/2600629,이투데이=조유정 기자 | ㈜한화 건설부문과 현대건설은 8월 경상남도 진주시 이현동 10-1번지 일원에서 '포레나힐스테이트 진주'를 분양한다고 6일 밝혔다. 이 단지는 이현1-5구역 재건축정비사업을 통해 공급되며... 
2026-07-06,네이버뉴스,AI시티부터 SMR까지…달라진 해외건설 전략,http://www.hansbiz.co.kr/news/articleView.html?idxno=848461,"현대건설은 SMR 등 차세대 원전 사업을, 현대엔지니어링은 LNG와 수소 플랜트를, 삼성E&A는 CCUS 등 친환경 플랜트를 중심으로 해외 사업을 확대하는 등 정책 방향과 맞닿은 분야에서 경쟁력을 키우고 있다. 다만... "
2026-07-06,네이버뉴스,공공 공급 지연 속 인프라 갖춘 원도심 정비사업 아파트 대안 부각,http://www.fnnews.com/news/202607061325240068,"㈜한화 건설부문·현대건설㈜ 컨소시엄은 오는 8월 경상남도 진주시 이현동 일대에 포레나힐스테이트 진주를 공급할 예정이다. 해당 단지는 지하 2층에서 지상 최고 35층, 8개동, 전용면적 59~110㎡ 규모로 총 1032가구가... "
2026-07-06,네이버뉴스,"볼디스트, 국제안전보건전시회 참가…""맞춤형 기술 솔루션 제시""",https://www.widedaily.com/news/articleView.html?idxno=297041,"볼디스트는 현대자동차, 현대건설, 대림건설, BMW KOREA, 볼보건설기계, LG 디스플레이 등 다양한 B2B 회사와의 협업 및 네트워크 확장 또한 본격적으로 강화하고 있다. 볼디스트는 이번 전시에서 약 114평 규모의 독립... "
2026-07-06,네이버뉴스,"""현장 피드백 상품 반영""'…볼디스트, 맞춤형 산업품 개발[르포]",https://www.news1.kr/industry/distribution/6218861,"볼디스트는 이러한 성장세를 발판 삼아 현대자동차, 현대건설, 대림건설, BMW KOREA, 볼보건설기계, LG 디스플레이 등 다양한 B2B 회사와의 협업 및 네트워크 확장 또한 본격적으로 강화하고 있다."
2026-07-06,네이버뉴스,"""수도권 30분 출퇴근 시대 연다""... 인프라 예산 증액에 GTX 테마 '불기둥...",https://www.pinpointnews.co.kr/news/articleView.html?idxno=465857,철도 및 도로 설계 전문 기업인 유신과 국내 최대 건설사인 현대건설이 하락 흐름을 나타내고 있다. 이어 철도 ICT 솔루션 기업인 폴라리스AI와 중견 건설사인 동부건설 역시 조정 흐름을 보이는 중이다. 아울러 주택 공급... 
2026-07-06,네이버뉴스,[7월 둘째 주 입찰동향] 여의도 목화 등 서울 곳곳 시공자 선정 본격화,https://www.arunews.com/news/articleView.html?idxno=64594,"첫 현설은 롯데건설, DL이앤씨, 현대건설, IPARK현대산업개발, 금호건설, 제일건설 등이 참석했다. 하지만 입찰은 참여사 미달로 자동 유찰됐다. 재개발을 통해 아파트 2,041세대 등이 들어선다. 같은 날 노원구... "
2026-07-06,네이버뉴스,삼성·고용부 뭉쳤다… '갤워치'로 폭염 속 노동자 심부 체온 감지,http://www.the-biz.co.kr/news/articleView.html?idxno=723875,"현재 롯데건설의 비접촉식 생체신호 측정 시스템이나 현대건설의 체열 감지 웨어러블 플랫폼 등 대형 건설사들을 중심으로 AI 안전 투자가 급물살을 타는 이유다. 박찬우 삼성전자 B2B통합오퍼링센터 부사장은 ""고용부... "
2026-07-06,네이버뉴스, 재건축 과장이 받은 수상한 조합 축의금,https://www.ilyosisa.co.kr/news/article.html?no=256738,"시공은 현대건설이 맡았다. 방배5구역 조합은 2004년 12월 추진위원회 구성, 2010년 9월 정비구역 지정 후 2012년 5월 설립 인가를 받았다. 사업 시행은 2013년 7월부터, 2016년 7월 관리처분 계획 인가를 받고 2022년 7월 착공했다.... "
2026-07-06,네이버뉴스,삼천포발전소 SMR 추진 가능성…현대건설 신뢰 시험대,https://news.sbs.co.kr/news/endPage.do?news_id=N1008643348&plink=ORI&cooper=NAVER,"현대건설이 문 닫는 석탄화력발전소를 소형모듈원전, SMR로 전환하는 사업에 뛰어들었습니다. 대상지로는 경남의 삼천포화력발전소가 유력한데요. 하지만 그동안 현대건설이 가덕 신공항과 창원 빅트리 등에서 보인... "
2026-07-06,네이버뉴스,중동 넘어 미국으로…K-건설 해외지도 '2극 체제' 재편,https://www.news1.kr/realestate/general/6218822,현대건설(000720)은 지난해 10월 미국 에너지 개발기업 페르미 아메리카와 텍사스주 아마릴로에 조성되는 '복합 에너지 및 AI 캠퍼스' 사업의 대형원전 기본설계(FEED) 계약을 체결했다. 이 캠퍼스는 AP1000 대형원전 4기... 
2026-07-06,네이버뉴스,‘포레나힐스테이트 진주’ 8월 분양,https://biz.heraldcorp.com/article/10799295?ref=naver,"㈜한화 건설부문과 현대건설이 8월 경남 진주시 이현동에서 1000가구 규모의 브랜드 대단지 ‘포레나힐스테이트 진주’를 분양한다. 이 단지는 이현1-5구역 재건축정비사업을 통해 조성된다. 지하 2층~지상 최고 35층, 8개... "
2026-07-06,네이버뉴스,"코오롱FnC 볼디스트, 2026 국제안전보건전시회 참가! 작업 현장 안전 솔...",http://www.fashionn.com/board/read_new.php?table=1006&number=61615,"볼디스트는 이러한 성장세를 발판 삼아 현대자동차, 현대건설, 대림건설, BMW KOREA, 볼보건설기계, LG 디스플레이 등 다양한 B2B 회사와의 협업 및 네트워크 확장 또한 본격적으로 강화하고 있다. 볼디스트는 지난해 KISS... "
2026-07-06,네이버뉴스,강남권 재건축 급물살… 창호시장 ‘프리미엄’ 전쟁,https://biz.heraldcorp.com/article/10799291?ref=naver,LX하우시스 관계자는 “현재 압구정3구역의 현대건설 홍보관 및 성수1구역의 GS건설 홍보관에 ‘페네스트’가 설치돼 호평을 받고 있다”라고 설명했다. 현대L&C는 독일 3대 창호기업인 ‘레하우(REHAU)’와 손잡고... 
2026-07-06,네이버뉴스,"볼디스트, 산업안전 기술 총집결···안전화·베임방지·쿨링 솔루션 공...",http://www.enewstoday.co.kr/news/articleView.html?idxno=2445719,"볼디스트는 올해 1월부터 지난 5월 매출이 전년 동기 대비 134% 증가한 성장세를 바탕으로 현대자동차, 현대건설, LG디스플레이 등 기업 고객과의 협업도 확대하고 있다."
2026-07-06,네이버뉴스,60조 加잠수함 D-1…한국 '50만개 일자리' vs 독일 'NATO·북극' 총력전,https://www.asiatoday.co.kr/kn/view.php?key=20260706010001858,"HD현대오일뱅크는 캐나다산 원유 도입 확대를, HD현대건설기계는 현지 인프라 구축 협력을 추진하고 있다. 또 브리티시컬럼비아대학교(UBC)와는 AI 기반 자율운항 시스템과 차세대 함정 설계 기술 공동 연구를... "
2026-07-06,네이버뉴스,[허프 트렌드] '폭염'이 여름 음료 제형 진화시키는 중 : 분말에서 슬러...,https://www.huffingtonpost.kr/article/258474,"일반 소비자뿐 아니라 롯데건설과 SK에코플랜트, 현대건설, 한화 건설부문 등과 협력해 건설현장 근로자의 온열질환 예방에도 활용하며 기능성 음료 시장을 넓히고 있다. 주류업계도 '더 오래 차갑게' 마실 수 있는 기술... "
2026-07-06,네이버뉴스,"볼디스트, ‘2026 국제안전보건전시회’ 참가",http://okfashion.co.kr/detail.php?number=63792&thread=81r06,"볼디스트는 이러한 성장세를 발판 삼아 현대자동차, 현대건설, 대림건설, BMW KOREA, 볼보건설기계, LG 디스플레이 등 다양한 B2B 회사와의 협업 및 네트워크 확장 또한 본격적으로 강화하고 있다. 볼디스트는 지난해 KISS... "
2026-07-06,네이버뉴스,"여의도 광장 38-1, 현대건설 무혈입성 예고",https://www.arunews.com/news/articleView.html?idxno=64575,서울 영등포구 여의도 광장아파트 38-1 재건축 시공자로 현대건설이 유력해지는 분위기다. 여의도 광장아파트 38-1 재건축조합(조합장 김신혜)는 지난달 29일 현장설명회를 개최했지만 현대건설만 단독으로... 
2026-07-06,네이버뉴스,"롯데건설 ""성수 4지구 승리"" 여의도·목동 수주전도 유리한 고지 선점할...",http://www.newsprime.co.kr/news/article.html?no=739196,"업계 관계자는 ""여의도와 목동 등 주요 정비사업에는 삼성물산, 현대건설, GS건설, DL이앤씨, 포스코이앤씨 등 대형사 참여 가능성도 거론되고 있어 경쟁은 더욱 치열해질 것""이라며 ""그럼에도 성수4지구 수주는 롯데건설이... "
2026-07-06,네이버뉴스,"[건설 Pick] 현대건설·삼성물산·롯데건설, 탄소중립·글로벌 디자인·...",https://www.lcnews.co.kr/news/articleView.html?idxno=204452,"현대건설이 국책과제를 통해 탄소중립의 핵심인 CCS(이산화탄소 포집·저장) 인프라 기술 확보에 나선 가운데, 삼성물산은 차별화된 주거 디자인으로 국제 무대에서 역량을 인정받았고, 롯데건설은 성수전략정비구역... "
2026-07-06,네이버뉴스,"'안전화·베임방지·온열질환' 볼디스트, 국제안전보건전시회 참가",https://www.fashionbiz.co.kr/article/227665,"볼디스트는 이러한 성장세를 발판 삼아 현대자동차, 현대건설, 대림건설, BMW KOREA, 볼보건설기계, LG 디스플레이 등 다양한 B2B 회사와의 협업 및 네트워크 확장 또한 본격적으로 강화하고 있다. 볼디스트는 지난해 KISS... "
2026-07-06,네이버뉴스,"DL이앤씨, 주택 원가율 79.9%의 비밀…'수익성 경영'이 만든 체질 혁신",https://www.upkoreanews.kr/news/articleView.html?idxno=99139,"현대건설은 약 2.9%, 삼성물산 건설부문은 약 3.2%, GS건설은 약 3.1% 수준이었다. 대우건설은 두 자릿수 영업이익률을 기록했지만, 증권가에서는 예정원가 조정과 정산 효과 등을 함께 고려해야 한다는 분석을 내놓고 있다.... "
2026-07-06,네이버뉴스,"아파트 커뮤니티도 AI 시대…건설사, '생활 플랫폼' 경쟁",http://www.4th.kr/news/articleView.html?idxno=2114259,현대건설은 지난해 7월 서울 강남구 대치동 '디에이치 대치 에델루이'에 AI 기반 학습 플랫폼 'H 스마트스터디'를 도입했다. H 스마트스터디는 현대건설이 AI 기반 학습 솔루션 기업 알고리고와 협력해 개발한 플랫폼이다. AI... 
2026-07-06,네이버뉴스,"동서발전, 태양광 차세대 에너지 기술 성과 잇따라",http://www.epj.co.kr/news/articleView.html?idxno=38913,또 동서발전은 울산대학교와 산학협력을 통해 비정형 곡면 구조의 건축물에도 태양광 모듈의 설치가 가능한 '인공지능 기반 3차원 인쇄 에너지 건축 시스템'을 개발해 지난해 8월 HD현대건설기계 울산공장 외벽에... 
2026-07-06,네이버뉴스,"동서발전, 차세대 BIPV·AI 태양광 기술 잇단 성과… 건물형 태양광 시장...",https://www.energydaily.co.kr/news/articleView.html?idxno=201123,"지난해 HD현대건설기계 울산공장 외벽에 실증 설치를 완료했으며, 실제 건축물 적용 가능성을 입증했다. 이 기술은 지난해 BLT Built Design Awards를 비롯한 국제 건축·디자인 분야 4개 상을 수상한 데 이어 올해 세계적인... "
2026-07-06,네이버뉴스,문 닫는 건설사 줄었다…경기 살아나나 메가프로젝트·중동 재건에 회복...,http://www.smedaily.co.kr/news/articleView.html?idxno=359799,"현대건설, 삼성E&A, GS건설, 대우건설, DL이앤씨 등은 중동 지역에서 정유·가스·발전·교통 인프라 시공 경험을 쌓아온 만큼 향후 재건 사업이 구체화될 경우 수혜 후보로 거론된다."
2026-07-06,네이버뉴스,"30대, 서울 아파트 매수 역대 최대…거래 비중 41%",https://www.sedaily.com/article/20064033?ref=naver,"잠실주공5단지가 지난 1일 사업시행계획인가를 받은 데 이어 장미아파트도 이르면 연내 시공사 선정이 이뤄질 수 있다는 관측이 나오며, 삼성물산(028260)·현대건설(000720)·롯데건설 등 대형 건설사들의 시공권... "
2026-07-06,네이버뉴스,현대·GS·동부·CJ 등 전문인력 모집,http://www.ikld.kr/news/articleView.html?idxno=337095,"건설구인구직플랫폼 건설워커에 따르면 현대건설, GS건설, 동부건설, CJ대한통운건설부문 등 주요 건설사들이 경력직 전문인력 채용을 진행 중이다. 현대건설이 플랜트 설계 분야 경력사원을 모집한다. 모집 직무는... "
2026-07-06,네이버뉴스,"코오롱FnC 볼디스트, KISS 2026 참가…산업현장 맞춤형 워크웨어 기술 솔...",https://www.megaeconomy.co.kr/news/newsview.php?ncode=1065572612689328,"회사는 현대자동차, 현대건설, 대림건설, BMW KOREA, 볼보건설기계, LG디스플레이 등 주요 기업과의 B2B 협업도 확대하며 사업 기반을 넓혀가고 있다. 볼디스트는 올해 전시회에서 약 114평 규모의 독립 부스를... "
2026-07-06,네이버뉴스,“21년 만 신축” 포레나힐스테이트 진주 8월 분양,https://biz.heraldcorp.com/article/10798854?ref=naver,"㈜한화 건설부문과 현대건설이 8월 경남 진주시 이현동에서 1000가구 규모의 브랜드 대단지 ‘포레나힐스테이트 진주’를 분양한다. 이 단지는 이현1-5구역 재건축정비사업을 통해 조성된다. 지하 2층~지상 최고 35층, 8개... "
2026-07-06,네이버뉴스,"대우건설, 성수 고배 털고 '더 큰 場' 노린다",https://www.ebn.co.kr/news/articleView.html?idxno=1715138,"14개 단지, 약 2만6000가구를 4만7000여가구 규모로 재편하는 서울 최대 정비사업으로, 현대건설과 삼성물산, GS건설, DL이앤씨, 롯데건설 등 대형 건설사들이 모두 공을 들이고 있다. 대우건설도 이미 움직이기 시작했다.... "
2026-07-06,네이버뉴스,건설사 입맛 다시는 데이터센터…암초는 '주민 반대',https://news.bizwatch.co.kr/article/real_estate/2026/07/01/0041,"삼성전자, 현대차·기아, SK하이닉스 등과 같은 계열인 삼성물산 건설부문, 현대건설, SK에코플랜트 등 대형 건설사는 물론, 중견 건설사들도 적극적으로 참전하며 기회를 노리는 모양새다. 건설사 SGC이앤씨를 계열사로... "
2026-07-06,네이버뉴스,"볼디스트, KISS 2026 참가…현장 맞춤 워크웨어 선보인다",https://www.pinpointnews.co.kr/news/articleView.html?idxno=465704,"볼디스트는 현대자동차, 현대건설, 대림건설, BMW코리아, 볼보건설기계, LG디스플레이 등과의 B2B 협업 및 네트워크 확장도 강화하고 있다. 안전화존에서는 올해 볼디스트가 제안하는 안전화 라인업을 공개한다.... "
2026-07-06,네이버뉴스,"롯데건설, 1.4조 대어 성수4지구 재개발 품었다...""빅데이터상 수주 예견...",http://www.thebigdata.co.kr/view.php?ud=202607060638501979d0a8833aad_23,"우선 지난 4,5월 전체 하이엔드 아파트 브랜드 관심도에서 롯데건설 르엘은 현대건설의 디에이치를 제치고 1위를 차지했다. '르엘'은 전체 포스팅 수에서 1위를 잇따라 차지했을 뿐만 아니라 호감도에서도 선두에... "
