date,source,title,link,description
2026-04-07,네이버뉴스,"한화운용 '한화K방산조선원전펀드', 순자산 1000억 돌파",https://view.asiae.co.kr/article/2026040708393893779,지난 2월 말 기준 주요 구성종목은 ▲현대건설 ▲한국항공우주 ▲두산에너빌리티 ▲한화에어로스페이스 ▲현대로템 ▲한화시스템 ▲HD한국조선해양 ▲LIG넥스원 ▲삼성중공업 ▲한화오션 등이다. 산업별 비중은... 
2026-04-07,네이버뉴스,"한화K방산조선원전펀드, 순자산 1000억 돌파…수익률 64%",http://www.edaily.co.kr/news/newspath.asp?newsid=02650246645413824,2월 말 기준 주요 구성종목은 △현대건설 △한국항공우주 △두산에너빌리티 △한화에어로스페이스 △현대로템 △한화시스템 △HD한국조선해양 △LIG넥스원 △삼성중공업 △한화오션 등이다. 산업별 비중은 방산 42.0... 
2026-04-07,네이버뉴스,[Who Is ?] 김완수 HD현대로보틱스 대표이사 사장,https://www.businesspost.co.kr/BP?command=article_view&num=435093,△현대건설과 손잡고 건설로봇 공동개발 HD현대로보틱스와 현대건설이 손잡고 건설로봇 산업에 힘을 모으기로 했다. 양사는 2020년 7월16일 '건설 로보틱스 기술 공동 연구개발 업무협약(MOU)'을 체결했다. 이번 협력을... 
2026-04-07,네이버뉴스,"[창간12주년 | 정비사업, 서울 전유물됐나] 수도권은 편애… 지방에선 ...",https://www.arunews.com/news/articleView.html?idxno=61332,"'지방은 지을수록 손해?'… 서울 중심지역은 불꽃 경쟁 예고 삼성물산, 현대건설을 비롯한 대형 건설사들은 서울 압·여·목·성 등 중심지에서는 전담팀을 가동하는 등 수주에 사활을 걸고 있다. 반면 부산에서는 지난... "
2026-04-07,네이버뉴스,"[더벨][산업 플랜트 EPC 건설사 분석] 대아이앤씨, '석화·정유' 기반 국...",https://www.thebell.co.kr/free/content/ArticleView.asp?key=202604021711130680104211,"삼성물산이나 현대건설, GS건설, SK에코플랜트 등 대형 건설사들이 주요 원청사다. 삼성물산과는 삼성전자 평택캠퍼스 P3~P4 배관 공사 등을 협업했다. 현대건설로부턴 샤힌 에틸렌시설 보온 공사, 신한울 원전 기계... "
2026-04-07,네이버뉴스,건설사들이 “못 받을 돈” 포기한 금액 2조 원…원가 폭탄·PF 부실·유...,https://www.sedaily.com/article/20028935?ref=naver,"대우건설이 업계 최대 규모인 6051억 원을 손실로 처리했고, 현대건설도 전년 대비 17배 가량 늘어난 2113억 원을 상각했다. IPARK현대산업개발도 48억 원 규모에 그쳤던 대손상각비가 작년 1165억 원으로 급증하는 등... "
2026-04-07,네이버뉴스,"“인프라, 더 이상 SOC 아냐…‘전략자산’으로 접근해야”",https://www.dnews.co.kr/uhtml/view.jsp?idxno=202604061334204220098,또한 김재영 현대건설 기술연구원 원장과 이종욱 서울과학기술대학교 교수 등 외부위원과 직원들이 참여한 패널 토론도 진행됐다. 박선규 원장은 “반도체와 SMR과 같은 국가전략산업은 안정적이고 정밀한 인프라가... 
2026-04-07,네이버뉴스,"""더이상 '반디클'은 없다""⋯반포주공1단지 이름 변경한다 [현장]",http://www.inews24.com/view/1957501,반포주공1단지 1·2·4주구 재곤축조합이 시공사인 현대건설이 애초 제안했던 단지명 '반포 디에이치 클래스트(일명 반디클)' 변경을 추진한다. 오는 6월 총회에서 새로운 단지명이 최종 결정될 전망이다. 현재 조합원... 
2026-04-07,네이버뉴스,현대건설 수주 잔고 95조 '최대'...IPARK현산 8년·포스코이앤씨 7년 일감...,http://www.consumernews.co.kr/news/articleView.html?idxno=753451,10대 건설사 중 현대건설(대표 이한우)이 95조 원 규모 수주잔고로 업계 최대를 기록했다. 반면 SK에코플랜트(대표 김영식)은 21조 원 수준에 머물며 가장 적었다. IPARK현대산업개발(대표 정경구)은 8년치 일감을 확보한... 
2026-04-07,네이버뉴스,단지 내 배달은 로봇이… 더 똑똑해지는 아파트,https://www.segye.com/newsView/20260406515795?OutUrl=naver,"현대건설 제공 6일 건설업계에 따르면, 시공 중심 경쟁에서 벗어나 입주 이후 관리와 생활 편의까지 포함한 ‘스마트 주거’ 구축에 속도를 내고 있다. GS건설은 HS로보틱스연구소와 ‘미래형 주거 로봇 서비스 모델... "
2026-04-07,네이버뉴스,"공사비 폭등에 ‘속도 전쟁’…건설사, 모듈러로 수백억 아낀다",http://www.edaily.co.kr/news/newspath.asp?newsid=01613766645413824,현대건설이 국내 최초로 공동주택 현장에 모듈러 엘리베이터(Modular Elevator)를 적용하며 건설 현장의 시공 혁신을 주도하고 있다. (사진=현대건설) 6일 업계에 따르면 주요 건설사들은 현장 작업을 최소화하고 공장 제작... 
2026-04-07,네이버뉴스,‘내 곁의 케어’… 요즘 부동산 트렌드,https://www.donga.com/news/Economy/article/all/20260406/133685448/2,● 대학병원과 협업해 헬스케어 플랫폼 고도화 지난달 9일 현대건설은 분당서울대병원과 주거 공간을 기반으로 한 AI 헬스케어 플랫폼 업무협약을 체결했다. 현대건설은 주거 공간 내 실증 환경 제공과 서비스 기획... 
2026-04-07,네이버뉴스,"건설연, 전통 SOC 넘어 첨단 인프라로…반도체·AI·SMR 기술 혁신 이끈...",https://www.electimes.com/news/articleView.html?idxno=366802,"행사는 주제발표에 이어 외부 전문가인 김재영 현대건설 기술연구원장과 이종욱 서울과학기술대학교 교수가 참여한 패널토론, 질의응답 순으로 진행됐다. 건설연은 향후 도로와 교량 등 전통적인 사회기반시설(SOC)... "
2026-04-07,네이버뉴스,"""고급 아파트 아니면 안돼""… 광주 정비사업 덮친 '하이엔드 앓이'",https://www.jnilbo.com/news/articleView.html?idxno=90000028689,광천동 주택재개발사업조합 역시 현대건설의 하이엔드 브랜드 '디에이치(THE H)' 사수에 총력을 다하고 있다. 현대건설은 지난 2022년 시공사 선정 당시 광주 최초로 '디에이치 루체도르'라는 단지명을 제안했다. 그러나... 
2026-04-06,네이버뉴스,[4월7일자] 비즈니스포스트 아침의 주요기사,https://www.businesspost.co.kr/BP?command=article_view&num=435090,"● [중동발 3고 쇼크①] 환율·물가·금리 동시 압박, 한국 경제 '복합위기' 터널 진입 우려 커진다 ● 현대건설 압구정 재건축 수주전 분수령, 이한우 3구역은 여유 5구역은 긴장 ● LG전자 1분기 영업이익 1.6조 추정... "
2026-04-06,네이버뉴스,'빵만 사고 가긴 아쉬운데'···대박난 대전 성심당 ‘빵당포’는 대학...,https://www.khan.co.kr/article/202604062043005,"네이버와 현대건설, 경찰청, 한국수자원공사, 성심당 등과의 협업을 통해 실무형 교육을 강화하고 있다. 학생들은 학기 초 기업을 방문해 실무자 인터뷰를 진행하고 중간·최종 발표를 통해 현장의 피드백을 받는다. 일부... "
2026-04-06,네이버뉴스,"'첩첩산중' 대전북연결선, 이번엔 한남大서 반대…""운동장 무너진다""",https://www.redaily.co.kr/news/articleView.html?idxno=16103,공단은 '지난해 9월 사업 승인을 앞두고 한남대와 시공사인 현대건설과 수차례 회의를 진행했지만 대학 측이 보상 범위 밖인 시설물(종합운동장 하부공간)에 대한 500평 규모의 대체 건물 신축을 요구해 입장 차이를... 
2026-04-06,네이버뉴스,美 원전 시장 잡으려면…SMR 등 실제 시공능력 증명해야,http://www.edaily.co.kr/news/newspath.asp?newsid=04874086645413496,"현대건설과 삼성물산은 UAE 바라카 원전 시공 경험을 보유하고 있고, 대우건설도 유럽 원전 사업 참여를 추진 중이다. 공기 준수 능력과 원가 경쟁력 측면에서 이미 경쟁력을 입증했다는 평가가 나온다. 이 외에도 GS건설... "
2026-04-06,네이버뉴스,중동發 공사비 급등과 자재 수급 불안 ... 공사 중단으로 '공급 경고등',http://www.queen.co.kr/news/articleView.html?idxno=454523,"현대건설은 송파구 마천4구역 재개발 조합에 공사비를 3834억 원에서 6733억 원으로 증액하고, 공사 기간도 34개월에서 44개월로 늘려달라는 요구를 전달했다. 증액 규모만 약 2900억 원에 달하며, 3.3㎡당 공사비는 60% 이상... "
2026-04-06,네이버뉴스,"현대건설, 마천4구역 조합에 공사비 75% 증액 요청",http://www.koreastocknews.com/news/articleView.html?idxno=117765,"현대건설(000720, 대표 이한우)이 서울 송파구 거여·마천뉴타운의 마천4구역 재개발 조합에 기존 공사비에서 75.6% 늘어난 공사비 증액을 요청했다. 6일 정비업계에 따르면 현대건설은 지난달 31일 마천4지구... "
2026-04-06,네이버뉴스,건설업계 작년 ‘떼인 돈’ 2조 털었지만…아직 수조원 더 남았다,https://www.sedaily.com/article/20028983?ref=naver,"대우건설이 업계 최대 규모인 6051억 원을 손실로 처리했고, 현대건설도 전년 대비 17배 가량 늘어난 2113억 원을 상각했다. IPARK현대산업개발도 48억 원 규모에 그쳤던 대손상각비가 작년 1165억 원으로 급증하는 등... "
2026-04-06,네이버뉴스,"건설 빅5 사외이사 뜯어보니…현대는 'AI·에너지', 삼성은 '노동·안전...",https://www.insightkorea.co.kr/news/articleView.html?idxno=244158,"현대건설 '미래 기술' vs 삼성물산 '노동·안전'…엇갈린 전략 현대건설은 사외이사 신규 선임을 통해 뚜렷한 방향성을 드러냈다. 현대는 조혜경 한성대 IT융합공학부 교수, 정은혜 서울대 에너지시스템공학부 교수, 글로벌... "
2026-04-06,네이버뉴스,건설연 '미래 비전 공유회'…반도체·AI·SMR 인프라 기술 혁신 본격화,https://www.newspim.com/news/view/20260406001220,패널토론에는 김재영 현대건설 기술연구원 원장과 이종욱 서울과학기술대학교 교수가 외부위원으로 참석해 산업 환경 변화에 따른 건설기술의 역할과 발전 방향에 대해 의견을 나눴다. 건설연은 앞으로 반도체... 
2026-04-06,네이버뉴스,"경부고속철도 선형 개량 공사에 한남대, 국가철도공단 수년째 마찰",https://www.joongdo.co.kr/web/view.php?key=20260406010001689,"공단 관계자는 ""일방적인 공사 추진이 아니라 지난해 9월 사업승인을 앞두고 한남대, 시공사(현대건설) 간 수차례 회의를 진행했으나, 한남대는 보상 범위 밖 시설물(종합운동장 하부공간)에 대한 대체 건물(500평) 신축을... "
2026-04-06,네이버뉴스,달라진 수주전...건설사 '금융력' 핵심 변수로,https://www.wowtv.co.kr/NewsCenter/News/Read?articleId=A202604060190&t=NNv,"과거 부동산 PF발 자금 경색 등으로 재무제표가 악화된 롯데건설은 성수 4지구 입찰에 앞서 7천억 원 규모 자금 조달을 통해 재무구조 개선에 나섰고, 현대건설과 DL이앤씨, 삼성물산까지도 은행, 증권사 등 금융사들과... "
2026-04-06,네이버뉴스,"대우건설, 용인·마포 수주…정비사업 '2조 클럽' 입성",https://www.asiaa.co.kr/news/articleView.html?idxno=245630,"올해 정비사업 수주액 1조원을 넘긴 건설사는 대우건설과 현대건설, 롯데건설 등이다. 대우건설은 이 가운데 유일하게 2조원을 넘어섰다. 대우건설은 올해 부산 사직4구역 재개발, 신이문역세권 도시정비형 재개발... "
2026-04-06,네이버뉴스,대학 운동장 지하로 고속철도 관통…학생들 “학습권 침해” 반발,https://www.joongang.co.kr/article/25417910,"지난해 9월 사업재개를 앞두고 한남대, 시공사(현대건설) 간 회의를 진행했지만, 대학 측이 과도한 보상을 요구했다고 반박했다. 안전성 등의 이유로 사업이 중단됐다는 대학 측의 주장도 사실이 아니라고 반박했다.... "
2026-04-06,네이버뉴스,전쟁이 촉발한 공사비 상승…분양가 인상 촉각,https://www.daejonilbo.com/news/articleView.html?idxno=2267395,최근 현대건설은 정비사업장 조합들에 공사기간 지연·공사비 인상 등에 대한 공문을 보낸 데 이어 서울의 한 재개발 조합에 3.3㎡(평)당 공사비를 기존 584만 원에서 959만 원으로 올려달라고 요구한 것으로 전해졌다.... 
2026-04-06,네이버뉴스,"건설연, 반도체·AI·SMR 인프라 기술 혁신 본격화",http://www.fnnews.com/news/202604061611419619,현대건설 기술연구원 김재영 원장과 서울과학기술대학교 이종욱 교수 등이 참여해 글로벌 기술 패권 경쟁과 산업 구조 변화 대응 방안을 논의했다. 건설연은 반도체·인공지능(AI)·소형모듈원자로(SMR) 등... 
2026-04-06,네이버뉴스,"중동전쟁 장기화에 건설공사비 급등, 조합과 갈등 점증",https://www.ekoreanews.co.kr/news/articleView.html?idxno=85434,현대건설은 지난달 31일 서울 송파구 마천동 마천4구역 재개발 조합에 총공사비를 3834억원에서 6733억원으로 75.6% 증액해달라는 공문을 발송했다. 공사기간도 34개월에서 44개월로 연장 요구했다. 업계에 따르면 현대건설은... 
2026-04-06,네이버뉴스,"현대건설, '힐스테이트 안양펠루스'···3일간 '3000명' 방문",http://www.enewstoday.co.kr/news/articleView.html?idxno=2415524,현대건설은 '힐스테이트 안양펠루스' 홍보관에 주말 3일간 약 3000명의 방문객으로 붐볐다고 6일 밝혔다. 현대건설은 지난 3일 홍보관을 개관했으며 해당 홍보관은 분양 상담을 받기 위한 예비 청약자들로 가득했다.... 
2026-04-06,네이버뉴스,"아스팔트·단열재·페인트... 건설현장, 자재 수급 비상에 곳곳이 중단...",https://www.hankookilbo.com/news/article/A2026040614040002818?did=NA,"실제 현대건설은 서울 은평구 대조1구역 재개발조합, 송파구 마천4구역 재개발조합 등 최근 공사비 협상을 진행하던 조합들에 공사비 인상을 요구했다. 신규 프로젝트파이낸싱(PF) 추진 차질, 도로·철도 등 공공공사... "
2026-04-06,네이버뉴스,“안전 위협” vs “과도한 요구”…한남대 관통 철도사업 재개 논란,https://www.kmib.co.kr/article/view.asp?arcid=0029639455&code=61221111&cp=nv,이에 대해 국가철도공단은 “지난해 9월 사업실시계획 승인을 앞두고 대학 측과 시공사인 현대건설 간 여러 차례 회의를 진행했으나 대학 측은 적법한 절차에 따른 보상 외에 500평 규모의 대체 건물 신축을 요구하는 등... 
2026-04-06,네이버뉴스,"건설硏 ""AI 데이터센터부터 SMR까지…국가전략산업 인프라 주도""",https://www.mt.co.kr/tech/2026/04/06/2026040616451232827,"패널토론 외부위원으로 김재영 현대건설 기술연구원장, 이종욱 서울과학기술대 교수가 참석한 가운데 건설연은 반도체·AI·SMR 등 국가전략산업을 뒷받침할 인프라 기술 혁신 방향을 전사에 공유했다. 건설연은 반도체... "
2026-04-06,네이버뉴스,"한남대 관통 철도사업 갈등… 대학 ""학습권 침해"" vs 철도공단 ""문제 없...",http://www.chungnamilbo.co.kr/news/articleView.html?idxno=881931,"이날 발표한 입장문에서 공단은 ""설계 등 각 사업 단계마다 관계기관 의견 조회를 진행해왔고, 지난해 9월 사업 승인 전에도 한남대 및 시공사인 현대건설과 수차례 회의를 진행했다""며 ""대학 측이 보상 범위를 벗어난... "
2026-04-06,네이버뉴스,"“SMR·데이터센터·반도체팹, 건설 기술없이 경쟁력 확보어려워”",https://www.mk.co.kr/article/12009309,"패널토론 외부위원으로 현대건설 기술연구원 김재영 원장과 서울과학기술대 이종욱 교수가 참석했다. 이들은 향후 반도체 생산시설의 초정밀 운영을 가능하게 하는 건설 환경 제어 기술과 관련 표준 정립, AI 시대 핵심... "
2026-04-06,네이버뉴스,"현대건설 압구정 재건축 수주전 분수령, 이한우 3구역은 여유 5구역은 긴...",https://www.businesspost.co.kr/BP?command=article_view&num=435053,이한우 현대건설 대표이사가 올해 압구정 재건축사업 수주전의 방향을 잡는 한 주를 보낼 것으로 보인다. 이 대표는 무혈입성이 유력한 압구정 3구역에서는 마음을 놓을 수 있겠지만 압구정 5구역에서는 만만치 않은... 
2026-04-06,네이버뉴스,대우건설 ‘벌써 2조’…정비사업 ‘속도전’ 시작,https://theviewers.co.kr/View.aspx?No=4031379,"동시에 롯데건설, 현대건설 등 추격 건설사들 역시 대형 사업지 확보 여부에 따라 단기간 내 2조원을 넘어서는 ‘점프업’이 가능할 것으로 보인다. 업계에서는 “정비사업 시장이 단순 시공 경쟁을 넘어 브랜드... "
2026-04-06,네이버뉴스,"건설연, 국가전략산업 지원 인프라 기술 혁신 본격화… 반도체·AI·SMR 등...",http://www.ikld.kr/news/articleView.html?idxno=332314,"이번 공유회는 주제발표, 패널토론, 질의응답 순으로 이어졌으며, 패널토론 외부위원으로 현대건설 기술연구원 김재영 원장과 서울과학기술대학교 이종욱 교수가 참석했다. 글로벌 기술 패권 경쟁 심화와 산업 구조의... "
2026-04-07,네이버뉴스,서울 뉴타운 '희소성' 재부각···실수요자들 '주목',http://www.enewstoday.co.kr/news/articleView.html?idxno=2415668,"삼성물산은 강서구 방화동 일원에서 '래미안 엘라비네'를 분양 중이다. 지하 3층~지상 최고 16층, 10개 동... GS건설·SK에코플랜트는 동작구 노량진동 노량진6구역에서 '라클라체자이드파인'을 분양 중이다. 총... "
2026-04-07,네이버뉴스,"삼성물산 래미안갤러리, 2026년 첫 시즌 전시 'A Part of(Life)' 공개",http://www.ikld.kr/news/articleView.html?idxno=332340,삼성물산 건설부문(이하 삼성물산)은 브랜드 체험 공간인 래미안갤러리에서 올해 첫 시즌 전시 'A Part of(Life)'를 공개한다고 7일 밝혔다. 서울 송파구 문정동에 위치한 래미안갤러리는 오는 7월 12일까지 '집'이라는... 
2026-04-07,네이버뉴스,저PBR株 반등 신호?… 국민연금 1분기 사들인 종목 보니,https://it.chosun.com/news/articleView.html?idxno=2023092159891,"PBR은 0.34배로 경쟁사인 삼성물산(1.42배), 신세계인터내셔날(0.49배)보다 낮은 편이다. 산업자재... 증가 폭 상위사 중 PBR 1배가 넘는 곳은 영상보안 업체 한화비전(PBR 4.45배), 건설사업관리 기업 한미글로벌(1.45배)... "
2026-04-06,네이버뉴스,"국내 1,000대 기업 매출 2,000조 시대 열렸다",http://www.srtimes.kr/news/articleView.html?idxno=200514,"2002년 삼성물산을 제치고 선두에 오른 이후 24년 연속 1위 자리를 굳건히 지킨 셈이다. 이어... 밟았고, 삼성중공업은 지난 2014년 이후 11년 만에 재진입하며 완연한 부활을 알렸다. 반면 삼성SDI, 대우건설, LG화학... "
2026-04-06,네이버뉴스,[위험 떠넘기는 사회]① 사고 나면 늘 말단 관리자들에게만 '막중한 책...,https://www.newsclaim.co.kr/news/articleView.html?idxno=3059976,"중대재해처벌법이 시행된 뒤에도 건설·발전 현장에서는 여전히 노동자가 죽는다. 사고가 날 때마다 현장... 편집자주 삼성물산이 시공하던 성남 판교 오피스 빌딩 현장. 지난해 10월, 굴착기 버킷이 뒤로 밀리면서 60대 하청... "
2026-04-06,네이버뉴스,"오세철 삼성물산 도시정비사업 '무혈입성' 끝, 2년 전 패배 안겼던 강적...",https://www.huffingtonpost.kr/article/256420,올해 초 도시정비사업 시장에서 무혈입성 행진을 이어왔던 오세철 삼성물산 건설부문 대표이사 사장이 올해 상반기 첫 진검승부를 앞두고 있다. 상대는 2년여 전 한 번 삼성물산을 꺾은 바 있는 포스코이앤씨다. 이번... 
2026-04-06,네이버뉴스,중동 긴장에도 코스피 상승 5450 마감 ···'실적 기대' 삼성전자 4%↑,https://www.seoulfn.com/news/articleView.html?idxno=625747,"81%), 삼성물산(4.75%), 신한지주(1.31%), 삼성SDI(3.19%), HD현대일렉트릭(1.59%), 하나금융지주(2.46... 업종별로는 제약(-3.63%), 운송장비·부품(-3.47%), 의료·정밀기기(-2.80%), 일반서비스(-2.22%), 건설(-1.95%), 제조(-1.59... "
2026-04-06,네이버뉴스,[거래소 기관] 한화시스템·카카오 팔고 삼성전자 SK하이닉스 공격적 매...,https://www.pinpointnews.co.kr/news/articleView.html?idxno=443260,"삼성물산은 건설·상사·바이오 등 복합 사업 구조를 바탕으로 안정성과 성장성을 동시에 확보한 점이 부각됐고, CJ제일제당은 식품 사업의 견조한 실적이 투자 매력으로 작용했다. 금융주인 하나금융지주와 KB금융 역시... "
2026-04-07,네이버뉴스,"엑스에너지, 글로벌 EPC 기업 플루어와 계약…美 텍사스 SMR 순항",https://www.theguru.co.kr/news/article.html?no=100200,"엑스에너지는 2009년 설립된 원전 기업으로, DL이앤씨·두산에너빌리티와 협력하고 있다. DL이앤씨·두산에너빌리티는 지난 2023년 이 회사 전환사채에 각각 2000만 달러(약 300억원)·500만 달러(약 80억원)를 투자했다.... "
2026-04-07,네이버뉴스,"도곡개포한신, 최고 49층 아파트 792세대로 재건축",https://www.arunews.com/news/articleView.html?idxno=61311,"시공은 지난 2024년 8월 시공자로 선정된 DL이앤씨가 맡는다. 추정비례율은 72.47%로 추산됐다. 총수입 추정액은 1조6,365억5,700만원이고 총지출 추정액은 5,616억6,200만원이다. 종전자산 추정총액은 1조4,831억7... "
2026-04-07,네이버뉴스,증시는 벌써 ‘종전 이후’로… 중동 재건·에너지株 뭉칫돈,https://www.kmib.co.kr/article/view.asp?arcid=1775466636&code=11151100&cp=nv,DL이앤씨도 중동 수주 기대감에 같은 기간 15.56% 상승했다. 종전 후 전쟁의 피해를 본 중동 지역 에너지 설비 등은 기존 설계와 시공을 맡았던 기업이 보수작업을 하게 될 것으로 예상된다. 이란이 개전 초기 중동의 미국... 
2026-04-06,네이버뉴스,"DL이앤씨, 글로벌 협업으로 압구정5구역 초고층 새 기준 제시",http://www.biztribune.co.kr/news/articleView.html?idxno=351890,압구정5구역 초고층 글로벌 협업 이미지 | DL이앤씨 DL이앤씨가 세계 최고 수준의 초고층 건축물 설계 및 시공 기술을 보유한 글로벌 기업들과의 협업을 통해 '압구정5구역'에서 초고층 건설의 새로운 기준을 제시한다.... 
2026-04-06,네이버뉴스,"DL이앤씨, 압구정5구역 글로벌 기술 협업..""초고층 건설 새 지평 열 것""",https://www.betanews.net/article/view/beta202604060091,"DL이앤씨가 글로벌 기업들과의 협업을 통해 압구정5구역 재건축 사업에 첨단 초고층 건축 기술을 도입한다. DL이앤씨는 영국의 구조 설계 전문 기업 '에이럽', 오스트리아의 골조 시공 제어 전문 기업 '도카'와 초고층... "
2026-04-06,네이버뉴스,킨텍스 제3전시장 실시설계 반영 기술…'삭제' 요청 드러나,https://www.incheonilbo.com/news/articleView.html?idxno=1320352,6727억원의 사업비가 투입되며 2028년 말 준공 예정이다. 1998년 수도권 종합 전시장 건립계획에 따른 것으로 지난해 10월 23일 착공식 이후 DL 이앤씨가 시공을 맡아 공사가 진행 중이다. /김영래·
2026-04-06,네이버뉴스,'쿼드러플 학세권' 단지 4월 분양 본격화,https://www.newsis.com/view/NISX20260406_0003579896,"DL이앤씨는 서울 동작구 대방동 노량진8구역 재개발을 통해 '아크로 리버스카이'를 선보인다. 총 987가구 중 285가구가 일반 분양되며, 열림유치원과 영화초, 영등포중·고 등이 도보권에 있다. 우미건설 역시 경기 수원시... "
2026-04-06,네이버뉴스,[민주 부동산] DL이앤씨·대우건설·롯데건설,http://www.iminju.net/news/articleView.html?idxno=162170,"민주신문=이한호 기자｜DL이앤씨는 지난달 방한한 에이럽, 도카 관계자들을 만나 초고층 건축물 설계 및 시공 기술 역량을 압구정5구역에 적용하기로 했다. 구조 설계 분야에서 세계적인 명성을 지닌 에이럽은... "
2026-04-06,네이버뉴스,"DL이앤씨, 압구정5구역 ‘글로벌 기술 연합’ 구축…초고층 경쟁 본격화",https://www.fetv.co.kr/news/article.html?no=216454,"에이럽·도카 협업, AI 설계·자동화 시공 결합 한강변 초고층 겨냥 기술 고도화, 품질·안전 동시 확보  DL이앤씨가 서울 압구정5구역 재건축을 겨냥해 글로벌 설계·시공 기업과 협업 체계를 구축했다. 초고층 기술... "
