date,source,title,link,description
2026-06-08,네이버뉴스,전셋집 품귀…재건축 시작하면 어디로 가나요? [더 머니이스트-최원철의...,https://www.hankyung.com/article/202605256993Q,"이 대목에서 재건축·재개발 조합이 반드시 봐야 할 문제가 있습니다. 바로 이주입니다. 압구정, 여의도... 강남권 일부 사업장은 사업성이 좋아 시공사가 금융 조건을 앞세워 이주비 부담을 줄이려고 할 수 있습니다.... "
2026-06-08,네이버뉴스,"[논현광장_임미화의 부동산, 가격 너머] 정비사업, 속도 아닌 비용이 관...",https://www.etoday.co.kr/news/view/2591170,"재건축·재개발, 신속통합, 모아타운 등 이름은 다르지만 목표는 같다. 낡은 주거지를 정비하고 도심 안에 새... 조합원은 토지와 기존 주택을 제공하고, 시공사는 공사를 맡으며, 금융기관은 자금을 공급한다. 일반분양... "
2026-06-08,네이버뉴스,군포 선도지구 11구역 주민대표회의 구성 승인 완료,http://www.mediagunpo.co.kr/21458,"▲ 산본신도시 선도지구 11구역 군포시는 선도지구 산본 11구역 재건축사업의 주민대표회의 구성을 6월... 주민대표회의는 토지 등 소유자의 권익을 대변하는 기구로, 앞으로 시공사 추천 등 주요 현안에 대한... "
2026-06-07,네이버뉴스,“서울시가 좋아하는 그림 그려달라”…한형기 조합장의 ‘재건축 십계...,https://www.mk.co.kr/article/12067937,‘재건축의 신’ 한형기 인터뷰 하편 “서울시가 좋아하는 그림으로 그려달라.” 한형기 HK미래주택연구원... 그러면 시공사가 무슨 말을 해도 못 알아듣는다. 인허가 단계가 무엇인지도 모른다. 그 상태에서 결정권만... 
2026-06-08,네이버뉴스,"“에너지·로봇 총망라”…두산-엔비디아, AI팩토리 전방위 협력",https://www.dt.co.kr/article/12066293?ref=naver,"젠슨 황 엔비디아 최고경영자(CEO)는 “한국은 세계적인 제조업 중심국가로, 세상을 건설하고 이동시키면서... 두산은 두산에너빌리티의 가스터빈과 소형모듈원전(SMR), 두산퓨얼셀의 수소연료전지 등 에너지 솔루션을... "
2026-06-08,네이버뉴스,"두산, 엔비디아와 AI 팩토리·피지컬AI 협력… 전력·로봇·소재로 확대",https://biz.chosun.com/industry/company/2026/06/08/NZFL5BUWZVDSVHMJLJLAE2UE4M/?utm_source=naver&utm_medium=original&utm_campaign=biz,"두산에너빌리티는 가스터빈과 소형모듈원전(SMR), 두산퓨얼셀은 수소연료전지를 보유하고 있다. 두산은... 두산은 로보틱스 협력을 두산밥캣의 건설, 조경, 농업, 물류 장비로도 확대할 계획이다. 두산은 엔비디아의... "
2026-06-08,네이버뉴스,"두산그룹, 엔비디아와 AI팩토리 인프라 고도화 등 전방위 협력 추진",https://www.aitimes.kr/news/articleView.html?idxno=40373,"세상을 건설하고 이동시키며 에너지를 공급하는 기업들에게 피지컬 AI는 새로운 성장 기회가 될 것이다.... 두산에너빌리티의 가스터빈과 소형모듈원전(SMR), 두산퓨얼셀의 수소연료전지 등 두산의 다양한 에너지... "
2026-06-08,네이버뉴스,"두산그룹, 엔비디아와 ‘피지컬 AI 동맹’…전방위 협력 나서",https://www.mydaily.co.kr/page/view/2026060808160312093,"젠슨 황 엔비디아 창립자 겸 최고경영자(CEO)는 “한국은 세계적인 제조업 중심국가로, 세상을 건설하고... 두산에너빌리티의 가스터빈과 소형모듈원전(SMR), 두산퓨얼셀의 수소연료전지 등 에너지 솔루션을... "
2026-06-08,네이버뉴스,"두산, 엔비디아와 AI 전방위 협력…""새로운 성장 동력""",http://www.yonhapnewstv.co.kr/news/AKR20260608082414hsp,"젠슨 황 엔비디아 CEO는 ""한국은 세계적인 제조업 중심 국가로, 세상을 건설하고 이동시키며 에너지를... 두산에너빌리티의 가스터빈과 소형모듈원전(SMR), 두산퓨얼셀의 수소연료전지 등 두산의 다양한 에너지 솔루션을... "
2026-06-08,네이버뉴스,"두산, 엔비디아와 AI팩토리 인프라 고도화 등 전방위 협력",https://www.insightkorea.co.kr/news/articleView.html?idxno=247716,"두산에너빌리티의 가스터빈과 소형모듈원전(SMR), 두산퓨얼셀의 수소연료전지 등이 엔비디아의 AI팩토리... 두산밥캣 역시 엔비디아 기술을 접목해 건설·농업·물류 장비의 자율화 기술 고도화를 추진한다. 다양한... "
2026-06-08,네이버뉴스,"두산, 엔비디아와 'AI 동맹'… 에너지·로봇·소재 전방위 협력",http://www.fnnews.com/news/202606080820523743,"두산에너빌리티의 가스터빈과 소형모듈원전(SMR), 두산퓨얼셀의 수소연료전지 등은 엔비디아의 AI 팩토리... 두산밥캣 역시 건설·농업용 소형 장비에 피지컬 AI를 접목해 콤팩트 자율 장비 시장의 기술 표준을... "
2026-06-08,네이버뉴스,"두산, 엔비디아와 AI 동맹…에너지·로봇·소재 협력 확대",https://view.asiae.co.kr/article/2026060808192700680,"에너지 분야에서는 두산에너빌리티의 가스터빈과 소형모듈원전(SMR), 두산퓨얼셀의 수소연료전지 등이... 두산밥캣 역시 건설·조경·농업·물류 장비에 엔비디아의 피지컬 AI 기술을 적용한다. 산업 현장에 특화된... "
2026-06-08,네이버뉴스,"두산·엔비디아, AI팩토리·피지컬AI 산업 강화 ..에너지·로봇 협력 확...",https://kpenews.com/View.aspx?No=4103608,에너지 분야에서는 두산에너빌리티의 가스터빈·소형모듈원전(SMR)과 두산퓨얼셀의 수소연료전지가... 양사는 건설·조경·농업·물류 장비에 엔비디아 피지컬AI 기술을 접목하고 산업 현장에 특화된 월드 모델 개발을... 
2026-06-08,네이버뉴스,"두산-엔비디아, 야구로 ‘AI팩토리’ 파트너십 강화…두산 홈경기서 젠...",http://sateconomy.co.kr/news/view/1065567160922660,"에너지 분야에서는 두산에너빌리티의 가스터빈과 소형모듈원전(SMR), 두산퓨얼셀의 수소연료전지 등... 두산은 협력 범위를 두산밥캣의 건설, 조경, 농업, 물류 장비로도 확대할 방침이다. 엔비디아의 피지컬 AI 기술을... "
2026-06-08,네이버뉴스,"두산그룹, 엔비디아와 AI팩토리·피지컬AI 전방위 협력 추진",https://www.yna.co.kr/view/AKR20260608020700003?input=1195m,"젠슨 황 엔비디아 최고경영자(CEO)는 ""한국은 세계적인 제조업 중심 국가로, 세상을 건설하고 이동시키며... 두산에너빌리티의 가스터빈과 소형모듈원전(SMR), 두산퓨얼셀의 수소연료전지 등 두산의 다양한 에너지... "
2026-06-08,네이버뉴스,"[깐부회동 시즌2] 두산그룹, 엔비디아와 맞손…로보틱스·에너지 협력 확...",https://www.newspim.com/news/view/20260608000048,"두산에너빌리티의 가스터빈과 소형모듈원전(SMR), 두산퓨얼셀의 수소연료전지 등은 AI팩토리 전력... [사진=이찬우 기자] 두산밥캣은 건설·농업·물류 장비에 피지컬 AI 기술을 접목해 자율 작업 장비 개발을 확대할... "
2026-06-08,네이버뉴스,"""제조업에 AI 날개 단다""…두산-엔비디아, 피지컬 AI 생태계 구축",https://magazine.hankyung.com/business/article/202606082223b,"젠슨 황 엔비디아 창립자 겸 최고경영자(CEO)는 “세계적인 제조 중심국인 한국에서 세상을 건설하고... 이번 협력에 따라 두산에너빌리티의 가스터빈과 소형모듈원전(SMR), 두산퓨얼셀의 수소연료전지 등 다양한 에너지... "
2026-06-08,네이버뉴스,"두산, 엔비디아와 AI 팩토리·로봇·첨단소재 전방위 협력 '맞손'",https://www.ebn.co.kr/news/articleView.html?idxno=1711549,"젠슨 황 엔비디아 최고경영자(CEO) 역시 ""한국은 세계적인 제조업 중심국가로, 세상을 건설하고 이동시키며... 에너지 부문에서는 두산에너빌리티가 개발하는 소형모듈원전(SMR) 및 대형 가스터빈, 두산퓨얼셀의 친환경... "
2026-06-08,네이버뉴스,"[더벨][엔비디아-K산업계 동맹] 두산 찾은 엔비디아, 피지컬 AI 협업 파...",https://www.thebell.co.kr/free/content/ArticleView.asp?key=202606071747117800101078,"두산에너빌리티는 발전소, 가스터빈, 원자력발전소, 소형모듈원전(SMR) 분야에서 수십 년간 운영 데이터를 축적해왔다. 두산밥캣은 건설장비 운용 과정에서 생성되는 방대한 현장 데이터를 확보하고 있다.... "
2026-06-08,네이버뉴스,전기 없는 AI 없다…굴뚝산업의 화려한 귀환[In Depth],https://www.newsway.co.kr/news/view?ud=2026060300154898086,최근 데이터센터 건설 과정에서 가장 큰 난제로 꼽히는 것은 전력 확보다. 분산에너지활성화 특별법에... 충남 대산권에서도 데이터센터와 차세대 전원인 소형모듈원전(SMR)을 연계한 산업 전환 방안이 거론되고 있다.... 
2026-06-08,네이버뉴스,[비바100] AI의 숨은 엔진 ‘전기’⋯ 전력 인프라가 바꾸는 산업 지도,https://www.viva100.com/article/20260606500167,미국 일부 지역에서는 데이터센터 건설 허가를 받고도 송전망과 변전설비 부족으로 전력망 연결이 수년간... 실제로 미국에서는 급증하는 데이터센터 전력 수요에 대응하기 위해 원전 활용 확대와 가스발전 설비 확충... 
2026-06-08,네이버뉴스,빌게이츠 손잡고 한미 원전 협력…“AI 에너지 주도권 선점”,https://news.kbs.co.kr/news/pc/view/view.do?ncd=8579997&ref=A,"미국 최초의 상업용 소형모듈원전, SMR 건설이 한창입니다. 빌 게이츠가 설립한 이 원전 기업엔 SK와 한국수력원자력도 투자했습니다. [크리스 르베크/테라파워 CEO : ""우리는 뛰어난 한국 파트너들과 함께하고 있습니다.... "
2026-06-08,네이버뉴스,"이번주 SK 이천포럼…SK이노베이션, ‘AI 에너지 인프라 전략’ 내놓을...",https://www.ekn.kr/web/view.php?key=20260607025590953,이에 LNG 발전과 소형원전모듈(SMR)이 AI 인프라용 전력 발전 설비 솔루션의 현실적인 대안으로 대두되고... 테라파워는 최근 세계 최초로 상업용 SMR 건설 승인을 미국 정부로부터 받고 플랜트 착공에 들어갔다.... 
2026-06-08,네이버뉴스,[취재후 Talk] 美 첨단원전 SK 테라파워 건설 현장 르포,https://news.tvchosun.com/site/data/html_dir/2026/06/08/2026060890005.html,◆ '테라파워 원전 건설 승인' 빌게이츠-최태원 합작품 마이크로소프트(MS) 창업자인 빌 게이츠가 지난 2008년 설립한 테라파워는 차세대 원자로의 한 유형인 소듐냉각고속로(SFR) 설계 기술을 보유한 SMR의 선두... 
2026-06-08,네이버뉴스,“한국 반도체 문의가 너무 많이와요”...캐나다에서도 ‘삼전닉스’ 붐,https://www.mk.co.kr/article/12068011,"그는 “시장의 관심은 AI 모델과 소프트웨어 기업에 집중돼 있지만 결국 AI 산업의 기반은 반도체와 전력, 원자재”라며 “기술 혁신은 빠르게 진행될 수 있지만 새로운 광산을 개발하고 원전을 건설하는 데는 오랜... "
2026-06-08,네이버뉴스,"""1000톤 이상 기자재 취급 가능 대규모 공장 구축 필요""",https://www.kmecnews.co.kr/news/articleView.html?idxno=50083,공장 건설과 고도화된 양중·가공 설비 구축을 위한 대대적인 자본 투자가 필요하다. 실제로 에너지학계와... 이는 2050년까지 전 세계 원전 발전 용량이 현재 대비 50% 이상 높아질 것임을 시사하는 수치다. 전세계적으로... 
2026-06-08,네이버뉴스,"HD현대·한화오션, 캐나다 잠수함·KDDX 발표 앞두고 ‘합종연횡’ 가속",https://www.kukinews.com/article/view/kuk202606050113,도로 건설 프로젝트 건설장비 자율·자동화 솔루션 테스트베드 목적의 매칭펀드 조성 제안(HD건설기계) 등... 한미 관세 협상에 따른 3500억달러 규모 대미투자 1호 프로젝트로 조선 또는 원전산업이 꼽히는 가운데... 
2026-06-08,네이버뉴스,원전? 석유? 태양광? 특정 에너지원만으로는 안보 못 지켜,http://weekly.chosun.com/news/articleView.html?idxno=52263,원전 이용률 상향 역시 같은 맥락이다. 이미 건설된 설비를 최대한 활용해 기저전력을 확보하겠다는 계산이다. 정비 중이던 원전들이 순차적으로 재가동되면서 이용률은 올라가고 있다. 결국은 안정적 에너지 확보인데... 
2026-06-08,네이버뉴스,"[분석] ""원전이냐 재생에너지냐는 끝났다""… AI 시대, 통합에너지 전략...",https://www.energydaily.co.kr/news/articleView.html?idxno=200177,반면 2039년 이후 매년 대형원전과 SMR을 추가 건설하는 시나리오는 수소 사용량을 절반 가까이 줄이고 누적 발전비용도 약 490조 원 절감할 수 있는 것으로 분석됐다. 특히 원자력과 재생에너지를 결합한 전원구성이 LNG... 
2026-06-08,네이버뉴스,[사설] EU도 “문제없음” 한국 정치의 ‘체코 원전’ 자해 소동,https://www.chosun.com/opinion/editorial/2026/06/08/7OJFGP7XNVGYLOXILQ6T5JXWVQ/?utm_source=naver&utm_medium=referral&utm_campaign=naver-news,인공지능 시대의 개막으로 전력 수요가 폭증하면서 세계 각국이 원전 건설에 나서는 ‘원전 르네상스’를 맞고 있다. 일본은 2040년대까지 노후 원전 최대 5기를 재건축해 원전 비중을 현재의 10% 미만에서 20%대로 늘리기로... 
2026-06-08,네이버뉴스,[이덕환의 화학이야기] 햇빛·바람으로 AI 3대 강국 이루겠다는 꿈은 허...,https://www.joongang.co.kr/article/25434648,심야 전기의 낭비를 부추긴다는 정치적 논란으로 중단했던 양수발전소 건설을 5년 만인 2017년에 재개한... 대통령이 공개적으로 지적했듯이 원전에 대한 이념적 논란의 늪에서 벗어나야 한다. 세계적인 빅테크... 
2026-06-07,네이버뉴스,[박완수 민선 9기 도정 전망] ‘4050 복지’ 최우선… 남해안 특별법 제...,http://www.knnews.co.kr/news/articleView.php?idxno=1543371,"복합도시 건설 특별법’ 제정에 역점을 둔다. 박 지사는 ‘경남의 대도약’을 완성하기 위해 권역별 성장 전략을 체계적으로 추진한다. 창원을 중심으로 한 중부 경남은 제조 AI, SMR(소형모듈원전), 방위산업을 중심으로... "
2026-06-07,네이버뉴스,"신규 원전 울산 반대 대책위 ""울주군 유치 중단"" 목청",https://www.ulsanpress.net/news/articleView.html?idxno=576647,"울산시 여론조사는 지난 5일부터 8일까지 시행되는 가운데 신규원전반대 대책위가 신규원전 건설 반대하는 목소리를 재차 높이고 있다. 대책위는 이번 여론조사에 대해 ""지역 간 경합과 경쟁을 부추기는 등 사회적으로... "
2026-06-07,네이버뉴스,"젤렌스키 ""러시아, 체르노빌 사용후핵연료 시설에 드론 공격""",https://www.hankookilbo.com/news/article/A2026060720240005924?did=NA,이는 방사성 물질을 격리하기 위해 건설된 시설이다. 러시아는 당시 공격을 부인했다. 우크라이나와 러시아는 우크라이나 남동부에 자리한 유럽 최대 자포리자 원전을 겨냥한 공격의 책임도 서로에게 돌리며 비난을 주고... 
2026-06-07,네이버뉴스,걸림돌 뺀 체코 원전 사업 ‘순풍’,https://www.khan.co.kr/article/202606072023015,"한국수력원자력이 수주한 두코바니 원전 건설 사업 진행 현황과 향후 계획을 점검하는 자리다. 김 장관은 또 ‘3차 장관급 한·체코 공급망·에너지 대화’를 열고 로봇과 배터리, 반도체 등 첨단산업 분야 협력 사업과... "
2026-06-07,네이버뉴스,"젤렌스키 ""러, 체르노빌 사용후핵연료 저장시설 의도적 공격""(종합)",https://www.yna.co.kr/view/AKR20260607041351079?input=1195m,위해 건설된 체르노빌의 보호용 격납 구조물이 타격을 입은 바 있다. 러시아는 당시 공격이 자국의 소행임을 부인했다. 우크라이나와 러시아는 우크라이나 남동부에 자리한 유럽 최대 자포리자 원전을 상대로 이뤄지고... 
2026-06-07,네이버뉴스,엔비디아 ‘뇌(칩)’와 두산 ‘신체(로봇)’ 결합…젠슨 황 ‘피지컬 AI...,http://www.kookje.co.kr/news2011/asp/newsbody.asp?code=0200&key=20260608.22012001302,전력 문제 때문에 데이터센터 건설이 어려워질 수 있는데 이를 두산그룹 주력 계열사인 두산에너빌리티가 해결할 수 있다. 경남 창원에 본사를 둔 두산에너빌리티는 소형모듈원전(SMR)을 제조한다. ‘엔비디아... 
2026-06-07,네이버뉴스,"산업부 김정관 장관, 체코 두코바니 원전 현장 방문…협력 증진방안 모...",http://www.e-platform.net/news/articleView.html?idxno=102786,"산업부 김정관 장관이 두코바니 원전을 건설하고 있는 체코를 비롯해 카자흐, 사우디, UAE, 카타르 등을 방문해 고위급 면담을 실시하고 우리나라와의 협력 증진방안을 모색한다. 산업통상부 김정관 장관은 7일부터... "
2026-06-07,네이버뉴스,[이슈&경제] 오너·합의 중심 경영의 승패,https://www.kyeonggi.com/article/20260607580199,현대그룹은 건설 매출액 기준으로 세계 10위권이며 자동차산업에 진출 현대 기아는 세계시장 3위이다.... 두산그룹은 원전기업으로 발돋움해 세계시장에 활발하게 진출하고 있다. 족벌기업으로 지탄받던 국내 대기업들이... 
2026-06-07,네이버뉴스,잠실 마운드에 오른 젠슨 황... 두산과 '피지컬AI 동맹' 과시[엔비디아...,http://www.fnnews.com/news/202606071826450900,"양사는 이미 지난해부터 건설기계, 발전 설비, 로보틱스에 엔비디아의 AI 기술을 이식하기 위한 전방위적 협력을 선언한 바 있다. 두산에너빌리티의 소형모듈원전(SMR)을 비롯한 전력 발전 역량과 두산로보틱스의 협동... "
2026-06-07,네이버뉴스,日원전 공급망 활짝 … 두산에너빌 기회,https://www.mk.co.kr/article/12067897,원자로 등 수주 경쟁력 월등 인공지능(AI)발 전력 수요 폭발로 일본 정부가 2040년대까지 최대 5기의 원자력발전소를 신형으로 교체 건설한다는 목표를 확정하면서 국내 기업의 일본 원전 생태계 진입 가능성이 커지고... 
2026-06-07,네이버뉴스,"""캐나다서도 삼전닉스 붐… ETF 곧 출시""",https://www.mk.co.kr/article/12067840,"그는 ""시장의 관심은 AI 모델과 소프트웨어 기업에 집중돼 있지만 결국 AI 산업의 기반은 반도체와 전력, 원자재""라며 ""기술 혁신은 빠르게 진행될 수 있지만 새로운 광산을 개발하고 원전을 건설하는 데는 오랜 시간이... "
2026-06-07,네이버뉴스,"젠슨 황 환영하는 박정원 회장…""우리 파트너십 시작""",https://www.hankyung.com/article/202606071604i,"두 회사는 지난해 건설기계와 발전설비, 로봇 분야에 AI 기술을 접목하기 위한 협력을 추진하기로 했다.... 두산에너빌리티는 전력 생산에 필요한 발전설비와 형모듈원전(SMR) 사업을 하고 있고, 두산로보틱스는 협동... "
2026-06-07,네이버뉴스,체코 원전 역외 보조금 조사 중단… K원전 수출 안정화 기대,https://www.hankookilbo.com/news/article/A2026060622110003169?did=NA,본격적인 두코바니 원전 건설에 접어든 한수원에 힘이 실릴 전망이다. 7일 한수원과 산업통상부에 따르면 FSR은 유럽연합(EU) 밖 국가가 기업에 제공한 재정적 기여가 EU 역내시장의 경쟁을 왜곡하는지 심사하기 위한... 
2026-06-07,네이버뉴스,"젠슨 황의 3가지 '깜짝선물'…AI 시대, K-반도체·제조업 가치 재확인",https://www.news1.kr/industry/general-industry/6189749,"지난해 건설기계와 발전설비, 로봇 분야에 AI 기술을 접목하기 위한 협력을 추진하기로 했다. 엔비디아의... 두산에너빌리티는 전력 생산에 필요한 발전설비와 소형모듈원전(SMR) 사업을 하고 있고, 두산로보틱스는... "
2026-06-07,네이버뉴스,"[경북 원전 르네상스 시대를 열다]정동욱 총장 ""경북 동해안 원전 르네...",https://www.imaeil.com/page/view/2026060216092688094,"SMR 건설 일정과 관련해서는 첫 번째 SMR을 2035년까지 준공하고, 이에 앞서 관련 기술은 2034년 9월쯤이면 기술적 완성을 볼 수 있을 것으로 내다봤다. 특히, 울진·영덕·경주 일대 원전에서 생산한 전력을 포항 등 인근... "
2026-06-07,네이버뉴스,'얼마나 쓸지' 빼놓고… 3대 학회의 12차 전기본 공동제언이 아쉬운 이...,https://daily.hankooki.com/news/articleView.html?idxno=1373971,이들은 △원전·재생에너지의 상호 보완적 파트너십 구축 △추가 원전 건설 계획 반영 △ESS·양수발전 등 유연성 설비 확충 △에너지고속도로 중심의 계통 인프라 구축 등을 요구했다. 과거 에너지 정치 논리에 갇혀... 
2026-06-08,네이버뉴스,"한전, 무안~신안 송전망 준공…전남 재생에너지 출력제어 완화 기대",https://www.mhns.co.kr/news/articleView.html?idxno=749553,"최근 태양광·풍력 등 재생에너지 발전 설비가 급속히 늘어나면서 기상 여건과 전력 수급 상황에 따라... 특히 해상 횡단 구간 가운데 가장 긴 곳은 2km에 달하며, 설치된 철탑은 높이 263m로 국내 최고 수준이다. 한전은... "
2026-06-07,네이버뉴스,'무안~신안' 송전망 준공...서남권 재생E 계통 숨통 트이나,https://www.energy-news.co.kr/news/articleView.html?idxno=225902,"해상풍력 확대의 선결 과제였다는 점에 주목하고 있다. 정부 역시 재생에너지 확대와 첨단산업 전력 수요 증가에 대응하기 위해 국가 전력망 확충 속도를 높이고 있지만, 주민 수용성과 인허가 문제로 신규 송전망 건설... "
2026-06-08,네이버뉴스,"[산업보고서] 반도체 소부장, 반도체 가격 상승 사이클 이후 주목",https://theviewers.co.kr/View.aspx?No=4103614,"마이크론은 싱가포르에서 신규 NAND 팹 착공을 시작했다. 해당 라인은 2028년부터 본격 양산에 들어갈... 핵심 인프라로 위상이 바뀌고 있다. 기업은 피에스케이홀딩스, 브이엠, 케이씨텍을 주목할 필요가 있다.... "
2026-06-08,네이버뉴스,"단양군, 매화공원 무장애 환경 조성 착수…사업비 10억원 투입",https://www.shinailbo.co.kr/news/articleView.html?idxno=5028013,"군은 매포읍 평동리 매화공원 일원에서 추진하는 도시숲 무장애 환경조성사업을 착공했다고 8일 밝혔다.... 또한 인근 노인복지관과 체육관, 도서관 등 생활 인프라와의 연계성도 한층 강화될 전망이다. 군 관계자는... "
2026-06-08,네이버뉴스,"괴산군, 연풍 중심상가로 15억6천200만원 투입 가로환경 조성 착공",https://news.bbsi.co.kr/news/articleView.html?idxno=4087789,괴산군은 연풍면 도시재생 뉴딜사업의 일환으로 '연풍 중심상가로 가로환경 조성 공사'를 본격 착공한다고... 군은 이번 공사와 함께 골목길 경관 개선·자전거 인프라 확충·연풍 여행자 플랫폼 조성 등 도시재생... 
2026-06-08,네이버뉴스,[창간특집] 지방정부 지원군 얻은 李정부…'5극 3특' 개혁 드라이브,https://www.shinailbo.co.kr/news/articleView.html?idxno=5027991,대규모 인프라 구축 사업이다. 그동안 대기업 유치나 국가산업단지 개발 같은 굵직한 지역 현안들은... 중앙정부가 세제 혜택이나 금융 지원책을 신속히 마련하더라도 지방정부의 현장 인허가가 지연되면 착공 시점이... 
2026-06-08,네이버뉴스,[글로벌 AI시티 경쟁]④“혁신 거점 잡아라”…서울ㆍ경기ㆍ광주 ‘3色...,https://www.dnews.co.kr/uhtml/view.jsp?idxno=202606051359510370220,"서울시는 산ㆍ학ㆍ연 생태계 구축에, 경기도는 산업 전환에, 광주시는 실증 인프라 확충에 방점을 찍고 있다. 우선 서울시는 오는 2028년 착공을 목표로 양재ㆍ우면동 일대에 ‘서울 AI 테크시티’ 조성을 추진 중이다.... "
2026-06-08,네이버뉴스,[언주로 칼럼] 부동산이 갈랐다,https://www.dnews.co.kr/uhtml/view.jsp?idxno=202606071331407920326,2031년까지 총 31만호의 주택 착공을 이뤄내 압도적인 주택 공급 물량을 확보하겠다고 공약했다. 3년 내 착공... 교육ㆍ교통ㆍ생활 인프라 계획 전반을 재검토해야 한다고 보고 있다. 정부가 추진하는 노원구 태릉골프장... 
2026-06-08,네이버뉴스,"유한양행, API 수주 증가에 생산능력 확충 ""공급망 다변화 대응""",http://www.newsmp.com/news/articleView.html?idxno=254307,"이 가운데 유한양행은 GMP 품질 시스템과 대규모 생산 인프라, 글로벌 제약사와의 장기 파트너십, 핵심... 생산능력을 확대할 계획이다. HC동은 지난 3월 착공했으며, 2028년 상반기 상업화 생산을 목표로 한다."
