date,source,title,link,description
2026-07-06,네이버뉴스,"국힘 ""미래대응기금은 차기 당권 겨냥한 李 '권력대응기금'""",https://www.newsis.com/view/NISX20260706_0003697139,"국가 반도체 초격차를 위해 이제 와서 신규 원전 건설과 기간 단축을 논의하겠다고 한다. 원전을 악마화하며 탈원전을 밀어붙이고 태양광만 외치던 사람들이, 전력이 부족해지자 하루아침에 원전을 찾는 모습은 정책... "
2026-07-06,네이버뉴스,"두산에너빌리, 발전기 모니터링 사업 확대..체코 원전 적용",http://www.4th.kr/news/articleView.html?idxno=2114270,포쓰저널 박소연 기자 2026년 7월 3일 크리에이텍 울산공장에서 진행된 'B-EYES 해외 원전 진출 기념 및 협력을... 가스복합발전소 건설공사 계약을 체결했다. 계약 규모는 약 5300억원이다. 이 사업에서 두산에너빌리티는... 
2026-07-06,네이버뉴스,"[전격시사] 민주, 보완수사권 처리 강행? (박성준) 보완수사요구권으로...",https://news.kbs.co.kr/news/pc/view/view.do?ncd=8602963&ref=A,"그러면 가장 빠른 게 원전 건설인데 이 원전은 지금 현재 문재인 정부 때부터 문재인 대통령 시절부터 탈원전 정책을 대못을 박았어요. 이걸 나름 지금 다시 이 대못을 뽑아내고 그러면 호남권, 광주권 여기에도 원전을... "
2026-07-06,네이버뉴스,"원전 안전·효율 다 잡는 '상시 검사제도', 성공적 안착을 위한 과제",http://www.e-platform.net/news/articleView.html?idxno=103592,"우리나라는 세계 최고 수준의 원전 설계·건설 기술을 보유하고 있으며, 수십 년간 가압경수로를 운영하며 축적한 독보적인 기기 고장률 데이터베이스와 우수한 확률론적 안전성 분석력을 갖추고 있어 인프라 측면의... "
2026-07-06,네이버뉴스,"이 대통령, ""공인들, 협조는 못해도 방해는 말아야""",http://www.kookje.co.kr/news2011/asp/newsbody.asp?code=0100&key=20260706.99099001448,"혹시 문제가 되지 않을까 걱정하는데, 그 문제까지 해결을 선제적으로 하면 좋겠다”고 강조했다. 정부는 서남권 반도체 산단에 필요한 전력 공급을 위해 신규 원전 건설을 포함한 전력 확보 방안을 검토하는 것으로 알려졌다."
2026-07-06,네이버뉴스,이재명-삼성 ‘메가 프로젝트’ 훈풍…반도체 당면 과제 평택 전력공급...,https://www.ekn.kr/web/view.php?key=20260706027569178,"원전은 건설 기간이 길고, 재생에너지는 출력 변동성과 계통 제약으로 반도체 공장의 안정적 전력 공급을 단기간에 대체하기 어렵다는 이유에서다. 결국 현재 시점에서는 LNG 열병합이 가장 현실적인 대안이라는 것이... "
2026-07-06,네이버뉴스,반도체 오라면서 원전은 안 된다? … 800兆 투자 가로막는 호남의 딜레...,https://biz.newdaily.co.kr/site/data/html/2026/07/06/2026070600091.html,반도체 공장을 돌리기 위해선 24시간 안정적인 전원을 공급할 수 있는 신규 원자력 발전소 건설이 반드시 필요하다. 그런데 원전이 정치화되면서 여권 지지기반이 강한 호남 지역 주민들은 원전에 부정적인 정서가 깔려... 
2026-07-06,네이버뉴스,"정부, 해외건설 '단순 시공' 벗어난다···기술·금융 중심 산업으로 체...",https://www.koscaj.com/news/articleView.html?idxno=325084,"또 시공 기술을 타 산업과 접목해 부유식 해상플랜트(FLNG), 데이터센터, 소형모듈원전(SMR) 등 새로운 해외건설 모델을 발굴할 계획이다. 아울러 철도와 공항 등 한국형 인프라를 신호·통신·보안·운영시스템까지 포함한... "
2026-07-06,네이버뉴스,호남 반도체 클러스터 전력난 우려에…탈원전 기조 한발 '후퇴',https://www.newsworks.co.kr/news/articleView.html?idxno=846190,"이재명 정부와 민주당이 800조원 규모의 호남권(서남권) 반도체 클러스터 조성을 위한 선행 조건인 전력·용수 문제 해결 과정에서, 그동안 고수해온 재생에너지 중심 에너지 정책 기조에서 한발 물러나 신규 원전 건설을... "
2026-07-06,네이버뉴스,원전 지원책에 美 우라늄 생산량 3배 늘어…10년 만에 최고치,https://www.theguru.co.kr/news/article.html?no=103996,크리스 라이트 에너지부 장관은 이번 대출 지원이 대형 원전 건설에 필요한 공급망 복원에 도움이 될 것이라고 말했다. 원전 연료용 우라늄 정광 (사진=미국 에너지부)
2026-07-06,네이버뉴스,"민주당 ""나경원, 이재명 정부 발목잡기에만 혈안""",https://www.wikitree.co.kr/articles/1144901,"나 의원은 ""그 논의 과정에서 호남 원전 건설 검토와 주 52시간 예외 적용 등 긍정적 어젠다가 마지못해 나오고 있다""며 ""참 뻔뻔한 위선이자 자기모순이다""라고 했다. 그러면서 ""표몰이용으로 급조한 메가 프로젝트가... "
2026-07-06,네이버뉴스,[시선집중] 11차 전기본 총괄 정동욱 “원전 위험하다고 기피하면 인류...,https://n.news.naver.com/mnews/article/214/0001509778?sid=100,그 끝에 나온 이야기가 원전 추가 건설 필요성이었습니다. 관련해서 전문가 진단이 필요한데요. 정동욱 한국전력국제원자력대학원대학교 총장 연결해서 관련 이야기 나눠보겠습니다. 나와 계시죠?   ☏ 정동욱 > 네... 
2026-07-06,네이버뉴스,우리기술 두산에너빌리티 비에이치아이 오르비텍 한전기술 우진 원전해...,https://www.cbci.co.kr/news/articleView.html?idxno=586771,시장에서는 글로벌 원전 정책 변화와 함께 원전 계속운전 및 신규 원전 건설뿐 아니라 해체 시장도 점진적으로 확대될 것으로 전망하고 있다. 이에 따라 관련 기업들의 기술력과 사업 참여 여부가 향후 투자 포인트로... 
2026-07-06,네이버뉴스,"나경원 ""메가프로젝트, 원전 건설·주 52시간 예외 검토...李 정책 실패...",https://www.newspim.com/news/view/20260706000242,"그러면서 원전 건설과 주 52시간 예외를 검토하고 있는 것은 이 대통령이 에너지, 노동 정책의 실패를 자인한 것이라고 꼬집었다. 나 의원은 이날 자신의 페이스북을 통해 이 대통령이 '취임 직후부터 경제계에 협조 요청을... "
2026-07-06,네이버뉴스,"국토부, 해외건설 5년 청사진 수립…한미 수주지원단 파견",https://www.asiatime.co.kr/article/20260706500060,제5차 해외건설진흥기본계획…2030년까지 방향 제시 기술력·글로벌 금융·지원기반 앞세워 수주구조 전환... 또 △소형모듈원전(SMR) △데이터센터 △탄소 포집·활용·저장(CCUS) 등 전략 분야의 해외 진출도 지원할... 
2026-07-06,네이버뉴스,"기후장관이 던진 '에너지 현실주의', AI 시대의 新국부론 보인다 [데스크...",https://www.newdaily.co.kr/site/data/html/2026/07/06/2026070600040.html,뉴데일리 한종수 경제정책부장 = 김성환 기후에너지환경부 장관이 던진 '호남 신규 원전 건설 가능성' 화두는 단순히 한 지역의 전력 부족을 해결하기 위한 임시방편이 아니다. 대한민국 첨단산업의 생사가 걸린... 
2026-07-06,네이버뉴스,"정부, 해외건설 5개년 청사진…AI시티·SMR 등 고부가 시장 공략",https://www.ebn.co.kr/news/articleView.html?idxno=1715161,"정부가 해외건설 산업을 단순 시공 중심에서 기술·금융 기반의 고부가가치 산업으로 전환하기 위한... 소형모듈원전(SMR), 탄소포집·활용·저장(CCUS), 인공지능(AI) 시티 등 신사업 분야도 육성한다. 해외 투자개발사업에... "
2026-07-06,네이버뉴스,"두산에너빌, 발전기 모니터링 시스템 사업 확대···""체코 원전 공급 토...",https://www.seoulfn.com/news/articleView.html?idxno=632713,"원전 서비스 솔루션 시장을 적극적으로 개척해 나가겠다""고 말했다. 한편 두산에너빌리티는 최근 해외 유수의 발전소 수주 실적을 이어가고 있다. 지난 6월에는 중동 오만에서 5000억원이 넘는 가스복합발전소 건설공사를... "
2026-07-06,네이버뉴스,"[마켓인사이트] AI가 전기를 먹는다…두산, 5조 투자로 '차세대 전력 플...",https://www.moneystorm.kr/news/articleView.html?idxno=4891,"데이터센터 건설 경쟁을 벌이고 있지만, 이를 안정적으로 가동할 전력 확보가 최대 과제로 떠올랐다. 재생에너지 확대만으로는 24시간 안정적인 전력 공급에 한계가 있다는 지적이 이어지면서 원전과 가스터빈 등... "
2026-07-06,네이버뉴스,"[오늘의 사설] ""허위조작정보근절법 시행...권력감시 위축 우려""",http://www.nongaek.com/news/articleView.html?idxno=95979,"동아일보 = ""원전 추가 건설""…올가을 12차 전기본서 확정하라/3년 새 회생 신청 2배로… 정리할 곳은 속히 정리하는 게 최선/與 당 대표 선거, 과거 들추기 '이전투구' 론 미래 없다 ▲ 서울신문 = 신규 원전, 과감한 정부... "
2026-07-06,네이버뉴스,"강훈식 ""추가 세수, 반도체 전력·용수에 투입…원전 활용도 검토""",https://www.news1.kr/politics/president/6218319,"또 원전 활용 가능성을 언급하며, 7~9년이 걸리는 신규 원전 건설 기간을 대폭 줄일 방안도 논의해야 한다고 강조했다. 강 실장은 6일 공개된 동아일보와의 인터뷰에서 반도체 추가 세수 활용 방안과 관련 ""반도체... "
2026-07-06,네이버뉴스,제주 미래산업에 3조8223억원 건다… AI·에너지에 76% 집중,http://www.fnnews.com/news/202607061539135878,■ AI·에너지에 2조9004억원… 제주 미래산업 승부수 에너지 분야에서는 재생에너지 확대와 해상풍력 산업... 데이터센터를 건설하고 운영할 기업도 확보해야 한다. 결국 평가 기준은 '글로벌 허브'라는 이름이 아니다.... 
2026-07-06,네이버뉴스,"서부발전, 첫 '풍력인의 날' 개최…""공공이 이끄는 바다 위 에너지 전환...",https://www.pinpointnews.co.kr/news/articleView.html?idxno=465931,세션 이후 진행된 종합토론 체계에서는 해상풍력발전 산업의 활성화와 국가 차원의 경쟁력 확보를 도모하기 위한 건설적인 제언들이 쏟아졌다. 특히 참석자들은 계획 입지 제도의 안정적인 시장 정착을 비롯해 인허가... 
2026-07-06,네이버뉴스,"""지속 가능한 가치 창출""…ESG 띄우는 아이에스동서",https://www.shinailbo.co.kr/news/articleView.html?idxno=5037927,보고서에 따르면 아이에스동서는 지난해 환경 분야에서 탄소 저감 친환경 건설기술을 위해 5억690만원을 투자했다. 통영 욕지도 해상풍력 발전사업 허가 등을 이끌었고 '기업 재생에너지 이니셔티브' 등에도 가입했다.... 
2026-07-06,네이버뉴스,해저케이블 승부처는 '포설선'…인프라 확보전 본격화,https://www.asiatime.co.kr/article/20260706500282,"대한전선, 1000억 지원으로 '스칸디 커넥터' 확보 LS마린솔루션, 튀르키예서 포설선 건조 착수 HVDC·해상풍력... 건설 중인 해저2공장과의 시너지가 더해지면서 생산·시공을 통합한 사업 체계 강화와 서해안 에너지... "
2026-07-06,네이버뉴스,"낙월해상풍력, 서울시향 '2026 행복한 음악회, 함께!' 후원",https://www.electimes.com/news/articleView.html?idxno=369961,전라남도 영광에서 국내 최대 규모의 해상풍력 발전사업을 건설 중인 낙월블루하트가 장애·비장애의 벽을 허무는 따뜻한 문화예술 후원을 올해도 이어갔다. 낙월블루하트는 지난 3일 서울 서초구 예술의전당 IBK... 
2026-07-06,네이버뉴스,"""英BP, 日 해상풍력 철수 검토""",https://biz.sbs.co.kr/article_hub/20000320841?division=NAVER,"이들이 건설하는 해상 풍력 단지는 2030년 6월에 운전을 시작할 계획입니다. 이 중 BP는 개발 주체가 되는 특수목적법인(SPC) 지분의 4분의 1을 보유하고 있었던 것으로 추정되며, 이는 간사이 전력의 출자 규모와 비슷한... "
2026-07-06,네이버뉴스,[특별기획-서남권 반도체] 대한민국 산업지도가 바뀐다 ③ 왜 해남인가...,https://www.ekn.kr/web/view.php?key=20260706023558936,"특히 전남 서남권은 국내 최대 수준의 해상풍력과 태양광 발전 잠재력을 갖춘 지역으로 평가받고 있다.... 장비와 소재, 물류, 유지보수, 건설, 연구개발, 정보통신, 서비스업까지 다양한 산업이 함께 성장하는 거대한... "
2026-07-06,네이버뉴스,"“영국 에너지 기업 BP, 일 야마가타현 해상 풍력 사업에서 철수 검토”",https://news.kbs.co.kr/news/pc/view/view.do?ncd=8603054&ref=A,"이들이 건설하는 해상 풍력 단지는 2030년 6월에 운전을 시작할 계획입니다. 이 가운데 BP는 개발 주체가 되는 특수목적법인(SPC) 지분의 4분의 1을 보유하고 있었던 것으로 추정되며, 이는 간사이 전력의 출자 규모와... "
2026-07-06,네이버뉴스,"검은 황금 석유의 지정학...독점에서 파동, 그리고 탈탄소 패권까지",https://www.hinews.co.kr/view.php?ud=202607061215597328cd8b879b3c_48,"현대 산업 사회의 골격은 석유라는 고밀도 인화성 자원의 안정적인 공급망 위에 건설되었다. 석유는... 그러나 중동의 지정학적 요충지, 특히 전 세계 해상 원유 수송량의 약 20%가 통과하는 호르무즈 해협(Strait of Hormuz)... "
2026-07-06,네이버뉴스,"""英 에너지 기업 BP, 日 야마가타현 해상풍력 사업서 철수 검토""",https://www.yna.co.kr/view/AKR20260706076500073?input=1195m,"이들이 건설하는 해상 풍력 단지는 2030년 6월에 운전을 시작할 계획이다. 이 중 BP는 개발 주체가 되는 특수목적법인(SPC) 지분의 4분의 1을 보유하고 있었던 것으로 추정되며, 이는 간사이 전력의 출자 규모와 비슷한... "
2026-07-06,네이버뉴스,"남부발전, 2.2GW 해상풍력 프로젝트 개발 본격 추진",https://www.todayenergy.kr/news/articleView.html?idxno=299972,"김대종 남부발전 재생에너지개발처장은 ""정부의 선제적인 중장기 로드맵 발표는 해상풍력 업계에 명확하고 예측가능한 이정표를 제시했다""라며 ""남부발전이 보유한 발전단지 건설·운영 노하우를 바탕으로 영광 야월... "
2026-07-06,네이버뉴스,800조 원 반도체 클러스터 계획 발표…광주 개발사업도 속도,https://www.hankyung.com/article/202607067447O,"전남은 해상풍력과 태양광 등 재생에너지 인프라를 바탕으로 반도체 생산시설의 전력 공급과 RE100 대응... 해당 사업은 신영, 우미건설, 휴먼스홀딩스 등이 참여하는 디벨로퍼형 복합개발이다. 약 9만 평 부지에 주거... "
2026-07-06,네이버뉴스,"낙월블루하트, 서울시향 '행복한 음악회 함께' 4년 연속 후원",https://www.sidae.com/article/2026070610182927748,한편 낙월블루하트는 전남 영광 앞바다에서 민간 주도 국내 최대 해상풍력 프로젝트 낙월 해상풍력 발전사업(364.8MW)을 건설하고 있다. 현재 공정률 87%로 연내 상업 준공을 목표로 추진 중이다. 준공 시에는 연간 약 900GWh... 
2026-07-06,네이버뉴스,"낙월블루하트, 서울시향 '행복한 음악회' 4년 연속 후원…'약자와의 동...",https://www.theguru.co.kr/news/article.html?no=104001,"장애인 연주자 20명과 감동의 앙상블 성료…주주사 비그림파워, '유럽 동반 투어' 글로벌 후원도 전남 영광서 364.8MW 규모 국내 최대 해상풍력 건설 중…공정률 87%로 연내 준공 청신호  낙월블루하트가 장애인 음악가들의... "
2026-07-06,네이버뉴스,[기고] 한국탄소산업진흥원 산업정책실 유병민 수석·송현도 책임연구원,http://amenews.kr/news/view.php?idx=67269,"해상풍력 시장의 최종 승자는 외형적인 플랜트 건설에 치중하는 국가가 아니라, 블레이드의 뼈대인 탄소섬유 공급망 구조를 자국 생태계 안에 완벽히 내재화한 국가가 될 것이다. 지금이야말로 생태계의 성패를 가를... "
2026-07-06,네이버뉴스,우성진 대구 동구청장 “공항 후적지를 대한민국 신경제 중심으로…현...,https://www.kbmaeil.com/article/20260706500467,생활 인프라까지 현장에서 직접 확인하고 신속하게 해결하는 행정을 펼치겠다”고 밝혔다. 그는 “행정은... 우 청장은 “도시철도 4호선 조기 착공은 동구 발전을 위해 반드시 추진돼야 할 사업”이라며 “4호선이... 
2026-07-06,네이버뉴스,"동부건설, 춘천 효자동 주상복합 공사 수주",https://www.ebn.co.kr/news/articleView.html?idxno=1715268,"총 공사금액은 약 1015억원이며, 공사기간은 착공 후 약 48개월이다. 사업지는 춘천 원도심 생활권 내에 위치해 교육·의료·행정·상업시설 등 기존 생활 인프라를 편리하게 이용할 수 있는 입지로 평가된다. 춘천 주요... "
2026-07-06,네이버뉴스,청주시 'SK하이닉스 메가 팹 투자' 총력 지원 나선다,https://www.newsis.com/view/NISX20260706_0003697720,"P&T7은 2027년 말 완광하고, 신규 M17 팹은 내년 착공해 2029년 상반기 착공을 목표로 하고 있다. 시의 지원 전략 핵심은 용적률·고도제한·인프라 등을 아우르는 행정 지원이다. 시는 국토의 계획 및 이용에 관한 법률... "
2026-07-06,네이버뉴스,광주 찍은 李대통령…반도체 '속도전' 선언에 삼성·SK 투자 빨라진다,https://www.ebn.co.kr/news/articleView.html?idxno=1715267,"정부가 부지 선정에 그치지 않고 인허가와 전력, 용수, 교통 인프라까지 직접 챙기겠다고 밝히면서 기업들의... 업계에서는 이미 착공 단계에 들어간 용인 클러스터를 조기에 가동해야 AI 반도체 수요 증가에 즉각 대응할 수... "
2026-07-06,네이버뉴스,"청주시, SK하이닉스 '100조 청주 M17 메가 팹' 행정지원 총동원",https://www.asiatoday.co.kr/kn/view.php?key=20260706010002040,"이에 따라 청주시는 기업의 투자 일정(M17 2027년 2월 착공, 2029년 상반기 준공 및 가동 목표)에 맞춰 부서 간 칸막이를 완전히 허물고, 용적률·고도 제한·인프라 등 분야별 현안을 통합 관리하는 TF 중심의 '컨트롤타워... "
2026-07-06,네이버뉴스,'용인시 처인구청 복합청사' 투자심사 통과…2032년 준공,https://www.newsworks.co.kr/news/articleView.html?idxno=846246,2029년 착공해 2032년 준공을 목표로 추진된다. 용인시는 지난달 열린 '2026년 제2차 경기도 지방재정... 높이고 행정 효율성을 강화하는 동시에 도시 균형발전의 핵심 공공인프라 역할을 할 것으로 전망된다. [뉴스웍스=]
2026-07-06,네이버뉴스,호남 클러스터 부지로 선정된 광주 군공항…변수는 '공항 이전',https://view.asiae.co.kr/article/2026070616051907875,나주 한국전력 본사와 재생에너지 인프라 역시 경쟁 요소로 평가된다. 하지만 군 공항과 민간 공항 이전... 공장 착공을 진행하기 어렵다는 전망도 나온다. 이에 따라 주민 설득을 거쳐 군 공항 이전을 얼마나 빠르게... 
2026-07-06,네이버뉴스,"[정책리뷰] 서남권 반도체 클러스터 입지, 광주 군공항 부지 선택",http://www.financialreview.co.kr/news/articleView.html?idxno=43341,"시장 상황이 빠르게 변화하는 만큼 공장 착공이 늦어질 경우 투자 일정 전체가 흔들릴 수 있고, 글로벌... 아울러 생활 인프라도 이미 갖춰져 있다. 반도체 산업은 첨단 기술 인력이 핵심 경쟁력이기 때문에 교통과 교육... "
2026-07-06,네이버뉴스,"BS한양, 삼성SDS 17조 투자 소식에 반색…'묘도 LNG 열병합발전' 탄력 전...",http://www.lkp.news/news/articleView.html?idxno=81568,청정에너지 인프라와의 연계 가능성에 시장의 이목이 쏠리고 있다. 최근 대한민국 AI 인프라의 핵심 축이... 최대 120MW 이상의 대규모 전력을 요구하는 해당 센터가 올 7월 착공해 2028년 하반기 본격 가동을 목표로... 
2026-07-06,네이버뉴스,청주시 '하이닉스 투자 지원 TF' 가동…파격 규제 완화 추진,https://www.news1.kr/local/sejong-chungbuk/6219150,"TF는 낸드플래시 신규 공장 'M17' 투자 일정(2027년 2월 착공, 2029년 상반기 준공·가동)에 맞춰 용적률, 고도 제한, 인프라 등 분야별 현안을 통합 관리한다. 세부적으로 '국토의 계획 및 이용에 관한 법률 시행령'의... "
2026-07-06,네이버뉴스,[기고] 충북도립대표도서관 충주 건립 '효율'과 '균형'이 핵심 열쇠다,https://www.ccdn.co.kr/news/articleView.html?idxno=1086872,현재 충북의 문화·교육 인프라는 청주권에 극심하게 쏠려 있어 투자 대비 효율이 포화 상태에 이르렀다.... 게다가 즉시 착공이 가능한 부지와 향후 확장이 가능한 여유 공간까지 이미 확보하고 있어 토지 매입비 절감과... 
2026-07-06,네이버뉴스,"임규호 서울시의원, 면목패션특구 도시재생활성화계획 본격 추진…""지역...",https://www.job-post.co.kr/news/articleView.html?idxno=220172,"특히 GTX-B 노선 착공 등 대규모 교통 인프라 확충이 예정된 만큼 이를 도시재생과 연계해 지역 발전의 시너지 효과를 극대화해야 한다는 의견도 제시했다. 임규호 의원은 ""GTX-B 착공 등 면목동 일대에 새로운 성장 동력이... "
2026-07-06,네이버뉴스,삼성 투자 훈풍…아산 신도시 개발 탄력,https://www.ccdn.co.kr/news/articleView.html?idxno=1086838,"정주 인프라 확충도 본격화될 전망이다. 이러한 '삼성 효과'의 직접적인 수혜지로 손꼽히는 아산시가 환지 방식으로 추진 중인 모종샛들지구(57만5천728㎡, 2027년 4월 준공 예정)와 풍기역지구(68만227.4㎡, 2026년 7월 착공... "
2026-07-06,네이버뉴스,"李 대통령 “전남광주특별시, 매우 잘했다”…반도체 속도전 주문",https://www.mk.co.kr/article/12091282,"그는 “용인 일반산단도 부지 확정부터 착공까지 6년이 걸렸는데 내 기준에서는 빠르지 않다”며... 이 대통령은 “이번 프로젝트는 인프라 구축뿐 아니라 교육과 문화, 주거 등 정주여건을 제대로 갖추는 것이 중요하다”... "
2026-07-06,네이버뉴스,"명현관 해남군수 ""17조 투자, 반도체 팹 착공 골든타임 도래했다""",https://www.hankookilbo.com/news/article/A2026070614130000652?did=NA,"명현관 전남광주통합특별시 해남군수는 6일 ""기업의 결단 즉시 곧바로 착공(Fab)에 들어갈 수 있는 국내... ‘3대 인프라’를 갖춘 지역이다. 명 군수는 ""이재명 대통령 임기내에 반도체 건설과 함께 가동, 이익을 낼 수... "
2026-07-06,네이버뉴스,"아산, 모종샛들·풍기역지구 체비지 매각 속도",http://www.cctimes.kr/news/articleView.html?idxno=915181,"주거 인프라 확충에 속도를 내고 있다. 환지 방식으로 추진되는 모종샛들지구는 57만5728㎡ 규모로 2027년 4월 준공을 목표로 공사가 진행 중이며, 풍기역지구는 68만227.4㎡ 규모로 2026년 7월 착공을 앞두고 있다. 두 사업... "
2026-07-06,네이버뉴스,시흥거모지구 개발사업 구체화… '호반써밋 시흥거모 B1블록' 주목,https://magazine.hankyung.com/business/article/202607068143b,"교통 인프라 확충, 친환경 스마트서비스 도입 등을 검토해 주변 산업단지와 연계된 주거지로 조성한다는... 2027년 상반기 착공해 2029년 준공하는 것이 목표다. DCI코리아와 코람코자산운용도 시흥거모지구 인근 안산시... "
2026-07-06,네이버뉴스,"[뉴스분석]""광주 군공항 반도체 속도전하려면 무안 아닌 대체 군공항 찾...",https://www.namdonews.com/news/articleView.html?idxno=915979,"이 경우 이재명 대통령 임기 내 착공은 사실상 어렵고, 반도체 클러스터 조성 계획도 차기 정부의 정책... 이미 군공항 기능과 관련 인프라가 있는 지역으로 이전할 경우 행정·기술적 검토 부담을 줄이고, 전체 일정도 일부... "
2026-07-06,네이버뉴스,진해 장천동 장애인 파크골프장 조성 완료,https://www.shinailbo.co.kr/news/articleView.html?idxno=5037898,오는 9월 정식 개장을 앞둔 가운데 시는 파크골프 인프라 확대와 스포츠 관광 활성화에도 속도를 낼... 1월 착공 후 6개월 만에 공사를 마쳤다. 장천동 장애인 파크골프장은 총면적 4878㎡에 9홀 규모로 조성됐다. 설계와... 
2026-07-06,네이버뉴스,"AI 칩 패권에 兆 단위 돈폭탄…韓·美·日·中, 반도체 '쩐의 전쟁'",https://www.pointdaily.co.kr/news/articleView.html?idxno=310827,"정부가 인프라와 인허가, 세제 지원으로 뒷받침하는 구조다. 반도체 투자 경쟁이 올해 들어 더욱 거세진... 정부는 부지, 전력, 용수, 인허가를 지원해 기업 투자가 실제 착공과 양산으로 이어지도록 하겠다는... "
