date,source,title,link,description
2026-04-06,네이버뉴스,서해안이 미래다 (13) 대천해수욕장 관문 '유령 아파트' 30년간 방치 골...,http://www.dynews.co.kr/news/articleView.html?idxno=845588,"여파로 시공사 연쇄 부도가 발생하며 공정률 약 50% 상태에서 공사가 중단됐다. 이후 수차례 소유권이... 철거 비용만 80억~100억원, 재건축까지 고려하면 약 1269억원이 필요할 것으로 추산된다. 민간 소유 건물인 만큼... "
2026-04-06,네이버뉴스,남해군 청사신축 순항…지역경기 활성화 효과 '톡톡',http://www.gndomin.com/news/articleView.html?idxno=471319,"남해군은 매주 화요일 시공사와 감리단, 담당 부서가 참여하는 정기 합동점검을 실시해 공사 품질과... 정밀안전진단 결과 재건축이 필요한 D등급 판정을 받으면서 신청사 건립의 필요성이 더욱 커졌다. 남해군은 2001년... "
2026-04-06,네이버뉴스,"남해군 신청사, 공정 순항·지역경제 활력",https://www.jeonmae.co.kr/news/articleView.html?idxno=1245577,"남해군은 매주 화요일 시공사와 감리단, 담당 부서가 함께하는 정기 합동점검을 통해 공사 품질과... 정밀안전진단에서도 재건축이 필요한 D등급 판정을 받아 신청사 건립 필요성이 더욱 커졌다. 남해군은 2001년 청사... "
2026-04-06,네이버뉴스,광명 하안주공5단지 재건축 노리는 건설사 윤곽,http://www.sisaon.co.kr/news/articleView.html?idxno=182131,"6일 한국자산신탁에 따르면 이날 열린 광명 하안주공5단지 재건축 시공사 현장설명회에 3개사가 참석했다. 현설에 참석한 건설사는 SK에코플랜트, 한화 건설부문, 대방건설이다. 이들 건설사 중 SK에코플랜트가... "
2026-04-07,네이버뉴스,"‘재건축 대어’ 잠실주공5단지, CM 업체에 무영씨엠 선정",https://biz.chosun.com/real_estate/real_estate_general/2026/04/07/SQ26CIHDFZBGFBD7BVF6LBHTBM/?utm_source=naver&utm_medium=original&utm_campaign=biz,최근 무영CM은 정비사업 시장에서 압구정2구역·압구정5구역·신반포2차 재건축을 포함해 성수전략정비지구의 43%를 차지하는 성수1지구 재개발 등 서울 권역별 랜드마크 단지의 건설사업관리 용역을 연달아 수주했... 
2026-04-07,네이버뉴스,"무영CM, 매머드급 대단지 '잠실주공5단지 재건축 CM' 수주… 도시정비사...",http://www.ikld.kr/news/articleView.html?idxno=332338,"최근 무영CM은 압구정2구역∙압구정5구역∙신반포2차 재건축, 성수전략정비지구의 43%를 차지하는 성수1지구 재개발 등 서울 권역별 랜드마크 단지를 연달아 수주하는 등 정비사업 분야 건설사업관리 시장에서... "
2026-04-06,네이버뉴스,"호반그룹, 건설·비건설 '쌍끌이' 전략···""안정적 성장세""",https://www.smartbizn.com/news/articleView.html?idxno=141331,"신월7동2구역 공공재개발, 자양1-4구역 가로주택정비, 미성동 건영아파트 재건축 등 서울 정비사업 5건을 수주하며 수주금액 7902억원을 달성했다. 올해도 안산 고잔연립6구역 재건축사업 수주로 수도권 정비사업 확대를... "
2026-04-06,네이버뉴스,"[인터뷰] ""정원오측, 여론조사 임의로 손 대…'심각 사안'에 당, 조속히...",https://news.sbs.co.kr/news/endPage.do?news_id=N1008506975&plink=ORI&cooper=NAVER,"이런 트랙으로 민간의 경우에는 재건축 재개발을 더 빨리, 더 부담 없이 가겠다라고 말씀을 드렸고요. 공공의... ▷ 주영진 / 앵커 : 성수동 집값 부분도 상당히 또 그때 공격을 많이 하신 것 같아요? ▶ 박주민 / 민주당... "
2026-04-07,네이버뉴스,원전 수출이 과연 이득인가?,https://www.labortoday.co.kr/news/articleView.html?idxno=233646,"이명박 정부 시절 아랍에미리트에 바라카 원전을 건설하는 계약을 체결했다. 한전이 아랍에미리트와 체결하는 계약의 주체가 되고, 한전이 다시 한수원 등과 계약을 하는 형식이었다. 그런데 한수원이 한전으로부터... "
2026-04-07,네이버뉴스,"전쟁이 바꾼 에너지 질서…아시아, 탈중동 전환 가속",http://www.hansbiz.co.kr/news/articleView.html?idxno=830565,"동남아 국가들은 원전과 재생에너지 모두 자체 밸류체인이 충분히 구축돼 있지 않은 경우가 많다. 이에 따라 발전소 건설뿐 아니라 기자재, 운영, 유지보수 등 전반적 공급망에서 외부 파트너에 대한 의존도가 높다. 최근... "
2026-04-07,네이버뉴스,"[Invest]회사채 시장 ‘골칫덩이’ 삼척블루파워, 에너지 대란 수혜에 '...",https://www.investchosun.com/site/data/html_dir/2026/04/06/2026040680204.html,건설 자금 조달을 위해 꾸준히 회사채 발행에 나섰지만 기관 자금 유입은 제한적이었다.주관사단 역시 ESG... 정부는 에너지 수급 불확실성에 대응해 원전 가동률을 기존 70%대에서 80% 이상으로 높이기로 했으며... 
2026-04-07,네이버뉴스,원전 20GW 시대…전력계통 비대칭 심화,https://www.dnews.co.kr/uhtml/view.jsp?idxno=202604061057144550067,앞서 최원호 원자력안전위원회 위원장은 최근 새울 3호기 건설현장을 찾아 안전관리 실태를 점검했다. 현재 새울 3호기는 임계를 앞두고 설비 테스트를 진행 중이다. 원전이 전력을 생산하는 첫 단계인 임계에 도달하면... 
2026-04-07,네이버뉴스,"[트럼프 상호관세 1년①] 日, '5500억 달러 대미 투자'로 미일동맹 공고...",https://www.ajunews.com/view/20260405120741204,지난 2월 발표된 1단계 투자는 오하이오주의 천연가스 발전소 건설과 텍사스주의 원유 수출 인프라 정비 등... 특히 이번 대미 투자 2단계 사업의 핵심인 SMR 기술 협력은 일본의 원전 기술력을 미국의 설계 기술과 결합해... 
2026-04-07,네이버뉴스,"중국, ‘토륨 원자로’ 연료화 실증 성공… 건설비 kW당 2500달러로 원전...",https://www.g-enews.com/view.php?ud=202604061440578931fbbec65dfb_1,최근 통계에 따르면 중국의 원전 건설 비용은 1킬로와트(kW)당 평균 2500달러(약 370만 원) 수준이다. 이는 세계 평균인 8500달러(약 1280만 원)의 30% 수준에 불과하다. 특히 서방 원전의 경우 총비용의 30~50%가 금융비용과... 
2026-04-07,네이버뉴스,[사설] ‘중동 사태 에너지 전환 대책’에 원전이 빠지다니,https://www.chosun.com/opinion/editorial/2026/04/07/YHSUQQOTDVC7HEJGSPE3ET2JFQ/?utm_source=naver&utm_medium=referral&utm_campaign=naver-news,이날 ‘원전 없는 에너지 대책’을 두고 정부가 원전 건설 계획을 유지한 데 대한 탈원전 세력의 반발을 달래려는 고려가 작용한 것 아니냐는 지적도 나온다. 일부에선 현재 원전 발전량이 역대 최고라고 하지만 국가... 
2026-04-07,네이버뉴스,[사설] 에너지 전환 재생에너지에 편중…원전 증설도 시급하다,https://www.sedaily.com/article/20029029?ref=naver,3년 전 멈춰 선 고리 2호기가 최근 재가동됐고 신규 대형 원전 2기 및 소형모듈원전(SMR) 1기 건설을 위한 부지 선정 절차도 진행 중이다. 하지만 그 정도로는 부족하다. 지정학·기상 여건 등 외부 변수에 흔들리지 않는... 
2026-04-06,네이버뉴스,[한삼희의 환경칼럼] 韓·日 ‘해저 전력 고속도로’ 연결은 어떤가,https://www.chosun.com/opinion/specialist_column/2026/04/06/SJMP44GSH5BYNMI5NYRDZ7CNHY/?utm_source=naver&utm_medium=referral&utm_campaign=naver-news,영국과 덴마크는 765㎞의 바이킹 링크(1.4GW) 초고압 직류(HVDC) 해저 전력망을 건설해 2023년부터 가동에... 2011년 후쿠시마 원전 사고 이후 손정의 소프트뱅크 회장이 제안했다. 나중에 러시아까지 포함하는 구상으로... 
2026-04-06,네이버뉴스,[광화문에서/이유종]“탈원전 실수” 독일의 후회… 에너지는 다차원 대...,https://www.donga.com/news/Opinion/article/all/20260406/133687383/2,"지난해 한국 정부는 원전 신규 건설 재검토를 시사하는 등 ‘탈원전 카드’를 매만졌다. 이탈리아, 스웨덴, 벨기에 등 이미 수십 년 전 탈원전을 선언했던 국가들도 2, 3년 전부터 다시 원전을 재가동하던 상황이었다. 이... "
2026-04-06,네이버뉴스,"김광열 영덕군수, 재선 도전…“지역 대전환 완성” [6·3의 선택]",https://www.segye.com/newsView/20260406519237?OutUrl=naver,충혼탑 참배로 선거 일정 본격화 민선8기 성과 기반 재선 도전 선언 원전 유치·체류형 관광 등 전략 제시... 그는 “현장 중심의 행정을 통해 군민과 함께 새로운 영덕 건설에 매진해 왔다”며 “수많은 위기를 기회로... 
2026-04-06,네이버뉴스,"돌고래 서식지의 해상풍력, 생태계에 안전한가?",https://www.danbinews.com/news/articleView.html?idxno=32746,"언론사 자체 문제 제기 ""해상풍력발전단지 건설, 해양 생태계에 긍정적 영향 끼친다?"" 출처자료: 정부, 해상풍력 바람 일으킨다…10년 뒤 원전 25기 규모 '확충' (, 2024.12.10.) [검증 이유] 해상풍력단지가 건설... "
2026-04-06,네이버뉴스,“말보다 결과로” 김광열 영덕군수 재선 도전,https://www.ksmnews.co.kr/news/view.php?idx=598905,그는 “민선8기 재임 기간 동안 현장행정을 실천하며 군민과 함께하는 새로운 영덕 건설에 매진해 왔다”며... 특히 지역 최대 현안인 신규 원전 유치와 관련해 “지역경제 구조를 바꾸는 중요한 분기점이 될 사업인 만큼... 
2026-04-06,네이버뉴스,"[뉴스공감] 울산 판세 뒤집을 '단일화'?…김종훈 ""김상욱과 두 번 만났다...",https://news.cpbc.co.kr/article/1171897?division=NAVER,원전 문제에 대해서 어떻게 보십니까? 왜냐하면 지금 민주당이나 이재명 대통령은 일단 원전도 필요하다.... 국가산단과 산단을 잇는 물동량을 이동하거나 미포·온산 오가는 곳을 민자로 유치해서 이것을 건설하게 된... 
2026-04-06,네이버뉴스,"경주시, i-SMR 유치 공감대 확산… 자원봉사자 설명회 개최",http://www.newstown.co.kr/news/articleView.html?idxno=699495,i-SMR은 기존 원전보다 안전성이 높고 건설 기간과 비용을 줄일 수 있는 차세대 원전 기술로 평가된다. 전문가 강연에서는 i-SMR 도입에 따른 지역경제 파급효과와 함께 경주의 산업 거점 성장 가능성이 제시됐다.... 
2026-04-06,네이버뉴스,"미·이란, 휴전으로 출구 찾나?...중동 확전 갈림길",https://www.ytn.co.kr/_ln/0104_202604062013591715,건설 중인 다리입니다. 완공도 안 됐는데 군이 쓸 수 있나요? 명분이 안 되죠. 100여 명 사상자 다... 주말 동안 가동 중인 부셰르 원전을 네 번째로 폭격했단 말입니다. 물론 아직까지 방사성 물질이 유출되지는 않았지만... 
2026-04-06,네이버뉴스,"반도체·데이터센터·SMR, 첨단산업에 건설기술 심는다",http://www.hellodd.com/news/articleView.html?idxno=111393,"도로·교량 등 전통적인 사회기반시설(SOC) 중심에 머물렀던 건설기술의 역할을, 반도체 팹·데이터센터·원전 구조물 등 고부가가치 첨단 산업 인프라 영역으로 확장하는 등 전략적으로 전환한다는 계획이다.... "
2026-04-06,네이버뉴스,"김광열 영덕군수, 재출마 선언…""성과로 증명한 4년, 더 큰 영덕 완성""",https://www.newsworks.co.kr/news/articleView.html?idxno=836823,"그는 ""민선8기 재임 기간 동안 현장행정을 실천하며 군민과 함께하는 새로운 영덕 건설에 매진해 왔다""며... 특히 지역 최대 현안인 신규 원전 유치와 관련해 ""지역경제 구조를 바꾸는 중요한 분기점이 될 사업인 만큼... "
2026-04-06,네이버뉴스,"경주시장 예비후보자 정책토론회... 국가유산청 등 공공기관 ""경주로 와...",https://www.kbsm.net/news/view.php?idx=514881,"첨단 산업도시 부분은 차세대 원전과 미래형 자동차 부품산업에 중점을 둘 계획이다. 아울러 경주에 유치한... 정병두 후보가 에버랜드를 보문관광단지에 건설하고 싶다고 했는데, 제 공약 중에도 이와 비슷하게 신라 역사... "
2026-04-06,네이버뉴스,"""에너지전환에 국가운명""…2030년 재생e 100GW 조기 달성 추진",https://www.nocutnews.co.kr/news/6497578?utm_source=naver&utm_medium=article&utm_campaign=20260406062931,"김 장관은 ""재생에너지를 주력 전원화하고 원전과 믹스하면 2030년 무탄소발전 비중이 51% 이상 될 것으로... 아울러, 건설기계·농기계, 선박, 이륜차 등도 인공지능(AI)화와 전기화를 통해 산업 경쟁력 확보를 추진한다.... "
2026-04-06,네이버뉴스,"[기자수첩] 김광열 재선 도전…""완성의 시간 인가, 변화의 선택인가""",http://www.inews24.com/view/1957533,"원전 유치는 단순한 공약이 아니다. 부지 선정부터 건설, 운영까지 수십 년이 걸리는 국가 단위 프로젝트다. 정책 방향이 중간에 흔들릴 경우 사업 자체가 좌초될 가능성도 배제할 수 없다. 이 때문에 '지금은 교체가 아니라... "
2026-04-06,네이버뉴스,"준비된 영덕, 국가가 책임 있게 답할 차례",https://www.hidomin.com/news/articleView.html?idxno=700150,"둘째, 한국수력원자력은 원전 건설과 운영 전 과정에서 완전한 정보 공개와 주민 참여 구조를 제도화해야 한다. 실시간 안전 정보 공개, 독립적인 주민 감시기구 운영, 그리고 주요 의사결정 과정에 주민이 참여할 수 있는... "
2026-04-06,네이버뉴스,"환갑넘은 전기협회, '전기산업연합회'로 재탄생",http://www.econotelling.com/news/articleView.html?idxno=19971,"포함시켜 건설과 제조, 발전 분야를 아우르는 소통 체계를 마련했다. 연합회는 앞으로 중대재해처벌법 시행... 한편 원전 해체 표준화, SMR(소형모듈원자로) 국제표준화 기반 구축, 해상풍력산 업지원센터 구축 등 미래... "
2026-04-06,네이버뉴스,"김광열 영덕군수, 예비후보 등록...""성과 잇고 도약 이끌겠다""",http://www.inews24.com/view/1957524,"그는 ""민선8기 동안 현장행정을 통해 군민과 함께하는 새로운 영덕 건설에 힘써 왔다""며 ""위기를 기회로... 지역 최대 현안인 신규 원전 유치와 관련해서는 ""지역경제 구조를 근본적으로 바꿀 수 있는 중대한 사업""이라며... "
2026-04-06,네이버뉴스,“비상시 대응자원으로”…2040년 후에도 석탄발전 일부 남겨둔다,https://www.sedaily.com/article/20028984?ref=naver,재생에너지와 원전 중심으로 전력망을 운영하면서 일종의 비상전원으로 석탄 발전소를 남겨둘 수 있다”... 햇빛·바람 소득 마을은 전국으로 확대하고 고압 송전망 건설 시 인근 주민이 투자하게 함으로써 주민... 
2026-04-06,네이버뉴스,"국민의힘, ‘매표·전쟁 핑계’ 추경 저지 및 민생 생존 예산 관철 총력",http://www.breaknews.com/1198045,"그러면서 “해외 사례도 공항을 분할하는 추세이며, 통합 시 가덕도 신공항 건설에... 이에 국민의힘 농해수위 위원들은 ▲대통령 관심 사업 예산 2,000억 원 전액 삭감... "
2026-04-06,네이버뉴스,제6장 소형모듈원자로(SMR) 소재와 혁신제조기술(1)-송상우/김기동/강용...,http://amenews.kr/news/view.php?idx=66236,"1970~1995년에는 이러한 물을 냉각재로 사용하는 2세대 원전이 상업 목적으로 건설되었고, 1995년 이후에는 출력 및 열효율을 높이고 안전성을 강화한 3세대 원전이 설계 및 건설되었다. 현재 국내에서 운전... "
2026-04-06,네이버뉴스,"정부, 에너지 체계 혁신…2030년 재생에너지 비중 20% 이상",https://www.korea.kr/news/policyNewsView.do?newsId=148962165&call_from=naver_news,"모든 움직이는 동력원의 전기화도 추진하고, 건설기계·농기계, 선박, 이륜차 등도 인공지능화와 전기화로... 수소경제기획과(044-203-3955), 원전산업정책과(044-203-5326), 녹색전환정책과(044-201-6679), 생활폐기물과(044-201-7381)"
2026-04-06,네이버뉴스,"한수원, 고리2호기 재가동...""노후원전 아닌 '고도화 설비'로 재탄생""",https://www.hidomin.com/news/articleView.html?idxno=700117,업계에서는 이번 고리2호기 재가동을 계기로 국내 원전 산업이 '신규 건설'과 '기존 설비 고도화'라는 투 트랙 전략을 본격화할 것으로 보고 있다. 특히 계속운전 확대는 탄소중립 달성과 함께 전력 시장 안정성 확보... 
2026-04-06,네이버뉴스,"트럼프가 무너뜨린 자리, 마크롱·이재명·다카이치가 채운다",https://www.ohmynews.com/NWS_Web/View/at_pg.aspx?CNTN_CD=A0003221662&CMPT_CD=P0010&utm_source=naver&utm_medium=newsearch&utm_campaign=naver_news,"프랑스 남서부에서는 양국 관민 공동 프로젝트로 희토류 정제공장이 건설되고 있으며, 2026년 말 가동... 한수원은 프랑스 국영 원전기업 오라노와 핵연료 주기 포괄 협력 MOU를, 원전 장비업체 프라마톰과는 핵연료 기술... "
2026-04-06,네이버뉴스,"이란 전쟁에 원자력 에너지 장점 돋보여, ""화석연료보다 우라늄 운반이...",https://www.businesspost.co.kr/BP?command=article_view&num=435059,미국을 포함한 전 세계 주요 국가들은 신규 원전 건설과 관련한 규제를 간소화하거나 정부 지원을 확대하는 등 정책으로 이러한 문제를 해결하려 힘쓰고 있다. 한국 정부도 최근 기존 원전의 수명 연장을 추진하고 신규... 
2026-04-06,네이버뉴스,지역난방도 재생열로...모든 에너지 재생에너지 중심으로 재편,https://www.newstree.kr/newsView/ntr202604060012,"잔존하는 원전 21기는 안보 전원으로의 활용 등 전환비용을 최소화하는 폐지 계획을 수립할 예정이다. 가스... 아울러, 건설기계·농기계, 선박, 이륜차 등도 인공지능화와 전기화를 통해 산업 경쟁력 확보를 추진한다.... "
2026-04-06,네이버뉴스,(이란전이 바꾼 산업지도)①‘에너지 안보’ 구원투수로 뜬 K원전,http://www.newstomato.com/ReadNews.aspx?no=1296814&inflow=N,"대형 원전은 통상 건설에 최소 10~15년이 걸리고, 최소 4조원에 달하는 대규모 초기 투자와 부지 확보가 필요한 데다, 체르노빌과 후쿠시마 원전 사고 이후 안전성에 대한 우려도 꾸준히 제기돼 왔습니다. 또한 태양광... "
2026-04-07,네이버뉴스,2026년 케냐 경제·투자 전망,http://dream.kotra.or.kr/kotranews/cms/news/actionKotraBoardDetail.do?SITE_NO=3&MENU_ID=80&CONTENTS_NO=2&bbsGbn=242&bbsSn=242&pNttSn=240370,그동안 케냐는 중국 등으로부터 대규모 차관을 도입하여 대형 인프라를 건설하는 단순 도급(EPC+F) 방식을... 글로벌 해상 운임 폭등과 연쇄적인 공급망 교란이 발생하고 있다. 글로벌 운임 폭등 및 부대비용 가중... 
2026-04-07,네이버뉴스,[Who Is ?] 이상호 LS에코에너지 대표이사,https://www.businesspost.co.kr/BP?command=article_view&num=435092,덴마크는 해상풍력단지 건설과 가공 송전선 지중화로 초고압 케이블 수요가 많은 국가로 LS에코에너지는 덴마크에 1천㎞가 넘는 케이블을 공급했다. 모회사인 LS전선과의 교차판매 전략도 성과를 냈다.... 
2026-04-07,네이버뉴스,천만 명 ‘햇빛·바람’ 소득…신차 40% 전기차로,https://news.kbs.co.kr/news/pc/view/view.do?ncd=8528592&ref=A,"해상풍력 발전기 하부를 설치하는 선박인데, 다음 주 첫 출항을 앞두고 있습니다. [김경수/'누리바람호... ""] 국내 최초로 도입된 이 설비, 전남 신안 일대 세계 최대 풍력단지 건설에 투입됩니다. 단, 주민 반대는 여전한... "
2026-04-07,네이버뉴스,재생에너지 발전비중 2030년까지 20% 이상으로 확대,http://www.e2news.com/news/articleView.html?idxno=329297,"풍력발전의 경우 지난달 26일 시행된 해상풍력 특별법을 바탕으로 발전기 완공까지의 시간을 단축하고... 이어 건설기계·농기계, 선박, 이륜차 등도 인공지능화와 전기화를 통해 산업 경쟁력 확보를 추진한다. 국가... "
2026-04-07,네이버뉴스,"민주당 제주지사 경선 3인, 합동연설회서 비전 경쟁",https://www.cbci.co.kr/news/articleView.html?idxno=565876,"그는 ""국정 과제 설계 경험을 바탕으로 제주의 미래 전략을 추진하겠다""며 산업 정책, 해상풍력, 국가 AI... 경쟁 주자인 위·문 후보를 향해서는 ""지금은 경쟁하지만 경선 이후에는 원팀이 돼야 한다""며 정책 중심의 건설적... "
2026-04-06,네이버뉴스,관록이냐 세대교체냐… ‘전남광주통합’ 길목서 맞붙은 진도의 선택은...,http://www.inews24.com/view/1957474,군의회 의장 시절 쌓은 인적 네트워크를 풀가동해 연륙·연도교 건설과 농수산물 가공시설 확충 등 지역 숙원 사업을 전라남도 차원의 광역 사업으로 격상시켜 추진하겠다는 복안이다. 특히 해상풍력 발전 수익을 지역... 
2026-04-06,네이버뉴스,'특별법까지 만들었건만'…해상풍력 해외기업 이탈 '비상',https://www.namdonews.com/news/articleView.html?idxno=906523,"업계 관계자는 ""전 세계 해상풍력 업황이 인플레이션에 따른 자재·건설비 상승, 고금리에 따른 자본조달 부담 확대, 공급망 불안으로 급속히 나빠졌다""고 전했다. 코리오가 진도나 여수 사업에 진출하던 7~8년 전 당시... "
2026-04-06,네이버뉴스,"위성곤 ""판 바꿔야""·오영훈 ""결과로 증명""·문대림 ""도민주권""",https://www.yna.co.kr/view/AKR20260406129600001?input=1195m,"위 후보는 이어 ""국정 과제의 설계 경험을 토대로 제주의 미래를 바꾸겠다""며 ""산업 정책, 해상풍력, 국가 AI... 치열하게 토론하고, 더 나은 정책으로 경쟁하며 도민의 삶을 더 낫게 만드는 건설적 경선이 되길 바란다""고... "
2026-04-07,네이버뉴스,"[6·3 후보 미니인터뷰③] 김진선 강서구청장 후보 ""양질 일자리 2만 500...",https://www.newsworks.co.kr/news/articleView.html?idxno=836838,교통 인프라 혁신도 거론하지 않을 수 없다. 강서를 서부권 교통의 허브로 만들기 위해선 '대장-홍대선'의 조기 착공이 필수적이다. 이를 통해 서울 도심 및 수도권 서부와의 접근성을 획기적으로 개선할 계획이다. 또한... 
2026-04-07,네이버뉴스,"청주시, SK하이닉스 AI 반도체 공장에 공업용수 공급 착수",https://www.viva100.com/article/20260406501487,"본격 착공한다고 밝혔다. 이번 사업은 기존 2·3단계 사업과 연계된 4단계로, 총 278억 원이 투입된다. 시는... 청주시는 2024년 기준 하루 44만 6705㎥ 규모의 상수도 공급능력을 보유해 전국 7위 수준의 인프라를 갖추고... "
2026-04-07,네이버뉴스,전주 먹거리 인프라 '첫 삽',http://www.fsnews.co.kr/news/articleView.html?idxno=60554,"공동 착공식을 개최했다고 5일 밝혔다. '전주시 먹거리통합지원센터'와 '전주시 농산물종합가공지원센터'의 공동 착공식이 3일 진행됐다. 이번 사업은 '미래 농업 클러스터 조성'의 출발점으로, 총사업비 90억 원이... "
2026-04-07,네이버뉴스,1구역도 하반기 이주…노량진뉴타운 ‘천지개벽’ 눈앞,https://www.dailian.co.kr/news/view/1630161/?sc=Naver,1구역과 3구역이 이주 후 착공을 진행할 경우 노량진뉴타운은 모든 구역이 철거를 마친다. 이미 가장 속도가... 다만 지역 인프라가 개선되는 점과 별개로 전월세난을 우려하는 목소리도 커지고 있다. 1구역과 3구역 이주... 
2026-04-07,네이버뉴스,"[기자수첩] 내포신도시, '살아가는 도시'로 가는 길",https://www.daejonilbo.com/news/articleView.html?idxno=2267392,"인구는 3만 명을 넘기지 못한 채 정체됐고, 교육·의료·문화 인프라 부족은 늘 한계로 지적됐다. 도청을... 충남대 내포캠퍼스는 중앙투자심사를 앞두고 있고, 종합의료시설 1단계인 어린이병원은 착공 절차에 들어서며... "
2026-04-07,네이버뉴스,"[민자 르네상스 시동 ②] 재정 한계ㆍ민자 침체 이중고…이재명 정부, ...",https://www.dnews.co.kr/uhtml/view.jsp?idxno=202604061501273590129,착공식을 하고도 자금조달의 길이 막혀 2년 넘게 본공사를 시작하지 못했기 때문이다. 이번 차입한도 확대는 대형 인프라 사업의 자금조달 구조를 완성하는 마지막 퍼즐이 될 수 있다는 평가가 나온다. 또 현재... 
