date,source,title,link,description
2026-04-14,네이버뉴스,"포스코이앤씨, '더샵 분당하이스트' 4월 분양",https://www.ziksir.com/news/articleView.html?idxno=130689,"[포스코이앤씨]  포스코이앤씨가 시공 중인 '더샵 분당하이스트'가 4월 분양에 나선다. 해당 사업은 느티마을 4단지 리모델링 주택조합이 시행하며, 경기도 성남시 분당구 정자동 일대에서 추진되고 있다. 단지는 지하... "
2026-04-14,네이버뉴스,제주영어교육도시 5분 거리…'한화포레나 제주에듀시티' 재분양 실시,https://www.wolyo.co.kr/news/articleView.html?idxno=310942,한편 한화 건설부문과 포스코이앤씨는 인천 남동구 구월동 일대에 공급하는 '포레나더샵 인천시청역'의 잔여 세대 선착순 계약을 진행 중이다. 이 단지는 간석동 일대를 재개발하는 사업으로 지하 4층~지상 최고 35층... 
2026-04-14,네이버뉴스,"10년 만에 돌아온 포스코이앤씨, '더샵 관저아르테' 4월 분양 예정",https://www.fntoday.co.kr/news/articleView.html?idxno=382184,"포스코이앤씨가 대전 서구 관저동 '더샵 관저아르테'를 4월 분양할 예정이다. 단지는 대전 서구 관저동 일원에 들어서며 지하 3층~지상 25층, 총 951가구 규모로 조성된다. 타입별 구성은 ▲59㎡ 143가구 ▲84㎡ 450가구 ▲104... "
2026-04-14,네이버뉴스,"세종사이버대 자산관리건축건설학부, 스마트건설·부동산 전망 통합 콜...",https://www.ekn.kr/web/view.php?key=20260413028336649,1부에서는 건축도시계획인테리어학과 주관으로 포스코이앤씨 BIM·스마트건설부문 금대연 마스터가 '시공현장에서 이루어지는 스마트건설'을 주제로 발표를 진행했다. 금대연 마스터는 국토교통부 BIM 시행지침서... 
2026-04-14,네이버뉴스,"3월 건설사 체감경기 소폭 상승…""회복은 제한적""",https://www.yna.co.kr/view/AKR20260414112000003?input=1195m,건산연 CBSI 67.8…기준선 여전히 큰폭 하회 지난달 건설사들의 체감경기지수가 소폭 상승했으나 여전히 기준선을 크게 밑돌며 부진한 수준을 이어갔다. 한국건설산업연구원(건산연)은 올 3월 건설경기실사지수... 
2026-04-14,네이버뉴스,건설경기지수 반등은 '착시'…기저효과에 체감경기 개선은 아직,https://www.news1.kr/realestate/general/6135974,"CBSI는 건설사가 체감하는 경기 지표다. 지수가 기준선인 100을 밑돌면 경기를 비관적으로 보는 기업이 더 많다는 의미고, 100을 넘으면 그 반대다. 부문별 세부지수 중 신규수주지수(68.5, +6.9p)가 가장 큰 폭으로... "
2026-04-14,네이버뉴스,대전지역 건설업체 1분기 하도급 2조7120억 수주,https://www.gukjenews.com/news/articleView.html?idxno=3556703,"주요 수주 실적은 선화3차 주상복합 364억 원, KT인재개발원 공동주택 172억 원, 도안2지구 2블록 공동주택 186억 원, 도룡동 주상복합 107억 원 등이다. 대전시는 지역업체의 대형 건설사 협력업체 참여 확대를 위해... "
2026-04-14,네이버뉴스,"대전시, 대형 건축현장 지역업체 참여율 68.2%…전분기 대비 상승",https://www.shinailbo.co.kr/news/articleView.html?idxno=5010972,"시는 향후 경쟁력 있는 지역업체를 지속적으로 발굴해 대형 건설사 협력업체로 참여를 확대하고, 관련 업무협약 등을 통해 수주 기회를 넓힌다는 방침이다. 아울러 공동주택 품질점검과 감리 수행 실태 점검과 연계해... "
2026-04-14,네이버뉴스,"[도시정비시장 풍향계] IPARK현산 등 4곳, 태평3구역 공공재개발 2차 현...",https://www.dnews.co.kr/uhtml/view.jsp?idxno=202604141115555080158,경기 성남 태평3구역 공공재개발 시공사 현장설명회(현설)에 4개 건설사가 참석했다. 14일 도시정비업계에... 다만 IPARK현산이 이곳 수주를 위해 공을 들이는 것으로 전해진다. 태평3구역 공공재개발 주민대표회의는... 
2026-04-14,네이버뉴스,"""건설경기 위축에도 선방""…대전 하도급 2.7조·참여율 상승",https://www.newspim.com/news/view/20260414000617,"대전시는 향후 지역업체의 실질적인 수주 확대를 위해 대형 건설사와의 협력 구조를 강화하고, 하도급 관리와 현장 점검을 병행할 계획이다. 시 관계자는 ""지속적인 현장 관리와 소통을 통해 지역업체 참여율을... "
2026-04-14,네이버뉴스,주택사업지수 25.3p 폭락…공급망 '하강 국면 2단계' 진입,https://www.nocutnews.co.kr/news/6501689?utm_source=naver&utm_medium=article&utm_campaign=20260414110102,수주지수 또한 각각 11.6p와 9.7p 하락하며 신규 공급의 맥이 끊기고 있음을 보여주었다. 유일하게 1.8p 소폭 상승한 택지보유현황지수(90.3)는 신규 확보가 아니라 사업성 저하로 착공하지 못한 유휴 부지가 건설사의... 
2026-04-14,네이버뉴스,잠수함 아니라 산업을 판다···캐나다 수주전 판 바꾸는 한화오션,https://www.smartbizn.com/news/articleView.html?idxno=141820,"| 스마트비즈 = 이장혁 기자 | 잠수함 수주전은 성능과 가격, 납기를 겨루는 기술 경쟁처럼 보이지만 캐나다... 캐나다 최대 건설사 PCL과 협력 기반을 넓힌 것도 산업 참여 범위를 확장하려는 포석이다. 승부는 수면 위에서... "
2026-04-14,네이버뉴스,"[애널픽] ""전쟁 이후 증시, 실적·기대감 기반 주도주 구분 필요""",https://theviewers.co.kr/View.aspx?No=4040747,"이는 이란 전쟁 이후 중동 지역의 인프라·에너지 시설 피해 복구 수요가 부각돼 국내 건설사의 A/S 및 재건 수주 기대에서 비롯됐다는 설명이다. 방산도 유사한 흐름이라고 봤다. 김 애널리스트는 ""방산 업종 ROE는 19.3... "
2026-04-14,네이버뉴스,'건설 불황 속 선방'…대전 하도급 2조7120억·참여율 68.2% 반등,https://www.bzeronews.com/news/articleView.html?idxno=816016,"외지 건설사 참여 현장의 평균 참여율은 67.4%로 상대적으로 낮았지만, 지역 건설사 현장은 80.6%로 높은 수준을 기록했다. 이는 지역 기반 건설사가 참여할 경우 하도급 구조 내 지역업체 활용도가 크게 높아진다는... "
2026-04-14,네이버뉴스,건설 불황 속 선방…대전 하도급 2조7120억 수주,https://www.ccdailynews.com/news/articleView.html?idxno=2410059,세부 지표를 보면 지역 건설사가 참여한 현장의 평균 참여율은 80.6%로 높은 수준을 기록했다. 반면 외지 건설사가 참여한 현장은 67.4%로 상대적으로 낮게 나타나 구조적 격차도 확인됐다. 자치구별로는 중구와... 
2026-04-14,네이버뉴스,[GAM]쟁기로 캐는 AI 수익 디어 ① 데이터센터發 건설 르네상스,https://www.newspim.com/news/view/20260413000670,"최고 수준의 도로 건설 장비 라인업이 디어의 세 번째 사업 부문에 포함돼 있다. 이 밖에 금융 자회사인 존 디어 파이낸셜(John Deere Financial)은 농가와 건설사 고객을 대상으로 리스와 할부 금융을 제공하며, 장비... "
2026-04-14,네이버뉴스,"서해선, 파주 운정역 연장 5월 착공",https://www.sentv.co.kr/article/view/sentv202604140114,서울경제티브이 김수빈 기자 [서울경제TV 경인=김수빈 기자] 파주시와 국가철도공단이 서해선 운정역 연장 사업의 시공사를 선정하고 오는 5월 공사에 착수할 예정이라고 밝혔다. 이번 사업은 현재 일산역까지 운행 중인... 
2026-04-14,네이버뉴스,서해선 파주 운정역 연장 5월 착공 가시화…고양 일산역 연계 영향도 주...,https://www.joongboo.com/news/articleView.html?idxno=363722799,사진=파주시 파주시와 국가철도공단이 '서해선 운정역 연장 사업'의 시공사 선정을 마치고 5월 착공 방침을 공식화하면서 수도권 서북부 광역교통망 확충에 다시 속도가 붙고 있다. 현재 일산역까지 운행 중인 서해선... 
2026-04-14,네이버뉴스,[단독] 포천 송우2지구 4천580세대 공동주택 조성사업 착공,https://www.joongboo.com/news/articleView.html?idxno=363722794,"주관 시공사로 선정, 지난달 조성공사를 착공했다. 다음 달 통합심의위원회가 마무리되면 6월께 첫 삽을 뜨게 된다. 사업비는 총 5천880억 원이 소요될 예정이다. 포천 송우2지구 조감도. 사진=포천시청 공급촉진지구... "
2026-04-14,네이버뉴스,"파주시와 국가철도공단, 서해선 운정역 연장 사업 본격 착수",https://www.kihoilbo.co.kr/news/articleView.html?idxno=3019585,"시 관계자는 ""이번 시공사 선정으로 사업이 본격적인 추진 단계에 들어섰다""며 ""관계기관과 긴밀히 협력해 공사가 차질 없이 진행될 수 있도록 최선을 다하겠다""고 말했다. 파주="
2026-04-14,네이버뉴스,[속보] 靑 “대통령 세종집무실 건립 공사 내년 8월 착공”,https://biz.heraldcorp.com/article/10716914?ref=naver,이 수석은 이어 “이달 말 (시공사) 당선자를 선정할 계획”이라면서 “1년의 설계 과정 거쳐 내년 8월 건축공사에 들어간다”고 전했다. 또 “이 대통령은 퇴임식을 세종에서 하겠다는 의지 거듭 밝히면서 임기 내에... 
2026-04-14,네이버뉴스,"파주시, 서해선 운정역 연장 착수",https://www.jeonmae.co.kr/news/articleView.html?idxno=1248048,"있어 지역 간 접근성과 교통 편의가 크게 개선될 것으로 전망된다. 시 관계자는 ""시공사 선정으로 사업이 본격 단계에 들어섰다""며 ""관계기관과 협력해 공사를 차질 없이 추진하겠다""고 밝혔다. [전국매일신문] 임청일기자"
2026-04-14,네이버뉴스,"서해선 운정역 연장, 5월 첫 삽 뜬다…""환승 없이 경기 서남부까지""",https://www.kyeonggi.com/article/20260414580170,파주시의 숙원 사업 중 하나인 ‘서해선 운정역 연장 사업’이 시공사 선정을 마치고 마침내 다음 달 첫 삽을 뜬다. 파주시는 국가철도공단이 지난달 서해선 연장 사업의 핵심 공정인 노반 및 궤도 분야 시공사 선정을... 
2026-04-14,네이버뉴스,"스타필드 창원, '점포 등록 조건' 소상공인 상생협약 체결 마무리",http://www.kookje.co.kr/news2011/asp/newsbody.asp?code=0300&key=20260414.99099003891,"앞서 스타필드 측은 2022년 5월 의창구 중동 일대에서 기초 공사에 돌입했으나 건설 경기 악화로 시공사 선정에 난항을 겪었고, 한 때 공정률이 3% 수준에서 나아가지 못했다. 이에 지역에선 사업 백지화 우려가... "
2026-04-14,네이버뉴스,서해선 ‘파주 운정역 연장’ 착공 준비 순항,https://gg.newdaily.co.kr/site/data/html/2026/04/14/2026041400179.html,파주시 관계자는 “이번 시공사 선정으로 사업이 본격적인 추진 단계에 들어섰다”라며 “관계기관과 긴밀히 협력하여 공사가 차질 없이 진행될 수 있도록 최선을 다하겠다”고 밝혔다. 뉴데일리 천의현
2026-04-14,네이버뉴스,[주요공시] 4월 14일 오전,https://www.ebn.co.kr/news/articleView.html?idxno=1705376,▲진흥기업 : 정릉동223-1일원 가로주택정비사업 시공사 선정 ='서울특별시 성북구 정릉동 223-1번지 일원'의 '정릉동223-1일원 가로주택정비사업' 시공사 선정. 시행사는 정릉동223-1일원 가로주택정비사업조합.... 
2026-04-14,네이버뉴스,서해선 '파주 운정역 연장' 다음 달 착공한다,https://www.yna.co.kr/view/AKR20260414080800060?input=1195m,"파주시 관계자는 ""이번 시공사 선정으로 사업이 본격적인 추진 단계에 들어섰다""며 ""관계기관과 긴밀히 협력해 공사가 차질 없이 진행될 수 있도록 최선을 다하겠다""고 말했다."
2026-04-14,네이버뉴스,"[위클리오늘] 파주시, 서해선 운정역 연장공사 5월 착공",http://www.weeklytoday.com/news/articleView.html?idxno=770831,"파주시와 국가철도공단은 지난 3월 '서해선 운정역 연장 사업'의 주요 공종인 노반·궤도 분야 시공사를 선정하고, 후속 절차로 4월 중 공사 계약을 체결하면 5월부터 공사에 착수할 예정이다. '서해선 운정역 연장 사업... "
2026-04-14,네이버뉴스,"진흥기업, 625억 규모 정릉동 가로주택정비사업 수주",https://www.ddaily.co.kr/page/view/2026041411054681857,"진흥기업은 이번 시공사 선정 사실을 조합으로부터 통보받았으며, 향후 본계약 체결 시 확정 내용을 다시 공시할 예정이다. 회사 측은 이번 공시 내용이 사업 진행 과정에서 일부 변경될 수 있다고 밝혔다."
2026-04-14,네이버뉴스,"파주시, 서해선 운정역 연장 착수 예고",http://www.newstnt.com/news/articleView.html?idxno=606617,"파주시 관계자는 ""이번 시공사 선정으로 사업이 본격적인 추진 단계에 들어섰다""라며 ""관계기관과 긴밀히 협력하여 공사가 차질 없이 진행될 수 있도록 최선을 다하겠다""고 밝혔다."
2026-04-14,네이버뉴스,[전문가 기고] 조합방식·신탁방식의 장단점,https://www.m-i.kr/news/articleView.html?idxno=1364152,"통상 신탁회사는 시공사 선정 후 시공사로부터 사업비 대여가 가능한 시점에 그 이전까지 투입한 초기 사업자금을 회수하는 사례가 많은데, 이 경우 시공사는 비교적 장기간 소요되는 착공시점까지 재개발, 재건축 사업의... "
2026-04-14,네이버뉴스,"진흥기업, 정릉동223-1일원 가로주택정비사업 시공사 선정",https://www.digitaltoday.co.kr/news/articleView.html?idxno=656649,진흥기업(002780)이 14일 공시를 통해 정릉동223-1일원 가로주택정비사업의 시공사로 선정됐다고 밝혔다. 이 사업은 서울특별시 성북구 정릉동 223-1번지 일원에 아파트 209세대와 근린생활시설을 건설하는... 
2026-04-14,네이버뉴스,서해선 '파주 운정역 연장' 현장 착공 준비 순항,https://www.m-i.kr/news/articleView.html?idxno=1364151,"파주시 관계자는 ""이번 시공사 선정으로 사업이 본격적인 추진 단계에 들어섰다""라며 ""관계기관과 긴밀히 협력하여 공사가 차질 없이 진행될 수 있도록 최선을 다하겠다""고 밝혔다."
2026-04-14,네이버뉴스,GTX-A부터 서해선 까지 사통팔달 파주 순항,https://www.tournews21.com/news/articleView.html?idxno=133645,"함께 3호선 파주 연장까지 진행되고 있어 교통 핵심도시로 급부상하고 있다. 우상환 교통정책과장은 ""이번 시공사 선정으로 사업이 본격적인 추진 단계에 들어섰다.""고 밝힘며 차질 없는 추진에 만전을 기하겠다고 밝혔다."
2026-04-14,네이버뉴스,"[속보] 진흥기업, 정릉동 가로주택정비사업 시공사 선정 공시…625억 규...",https://www.cbci.co.kr/news/articleView.html?idxno=567665,"진흥기업이 서울 성북구 정릉동 일대 가로주택정비사업 시공사로 선정됐다. 진흥기업은 14일 공시를 통해 ""서울특별시 성북구 정릉동 223-1번지 일원 '정릉동223-1일원 가로주택정비사업'의 시공사로 선정됐음을... "
2026-04-14,네이버뉴스,서해선 운정역 연장사업 본격화...수도권 서북부 교통 접근성 개선 기대,https://www.kmaeil.com/news/articleView.html?idxno=636786,"파주시와 국가철도공단이 '서해선 운정역 연장 사업'의 시공사를 선정하며 본격적인 공사 추진에 나선다. 파주시에 따르면 지난 3월 서해선 운정역 연장 사업의 주요 공종인 노반·궤도 분야 시공사가 선정됐으며, 후속... "
2026-04-14,네이버뉴스,파주시 '서해선 운정역 연장' 본격 추진…5월 착공 예정,https://www.newspim.com/news/view/20260414000192,"우상완 교통정책과장은 ""이번 시공사 선정으로 사업이 본격적인 추진 단계에 들어섰다""며 ""관계 기관과 긴밀히 협력하여 공사가 차질 없이 진행될 수 있도록 최선을 다하겠다""고 말했다."
2026-04-14,네이버뉴스,"파주시, 서해선 운정역 연장 5월 착공…시공사 선정 완료",https://www.sidae.com/article/2026041408490029261,"파주시는 지난달 사업의 핵심 공정인 노반과 궤도 분야 시공사 선정을 마쳤으며, 이달 중 계약 체결을 완료하고 다음달부터 본격적인 현장 공사에 착수할 예정이라고 14일 밝혔다. 서해선 운정역 연장 사업은 현재 고양시... "
2026-04-14,네이버뉴스,"파주시, 서해선 운정역 연장공사 5월 착공 예정",https://www.pressian.com/pages/articles/2026041408543584110?utm_source=naver&utm_medium=search,"시 관계자는 ""이번 시공사 선정으로 사업이 본격적인 추진단계에 들어섰다""며 ""관계기관과 긴밀히 협력하여 공사가 차질 없이 진행될 수 있도록 최선을 다하겠다""고 밝혔다."
2026-04-14,네이버뉴스,"인천시회, 자유경제포럼서 지역업체 하도급 확대 방안 제시",https://www.koscaj.com/news/articleView.html?idxno=323572,"토론자로 나선 김대중 시회 부회장은 ""서울·경기 소재 업체에 비해 지역업체는 입찰 단계에서부터 배제되는 경우가 많다""며 시공사와 재개발·재건축 조합의 실질적인 협력 강화를 촉구했다. 이어 ""지역업체와의 계약... "
2026-04-14,네이버뉴스,2월 건설수주 증가에도 체감경기 부진 지속,https://www.bizwork.co.kr/news/articleView.html?idxno=414539,"재개발·재건축 등 민간 정비사업 확대가 수주 증가를 이끌었지만, 공공부문과 비주택 건축 부진이 이어지며 전반적인 회복세는 제한적인 것으로 나타났다. 민간수주는 정비사업 확대 영향으로 전년 동월 대비 11.1... "
2026-04-14,네이버뉴스,"정원오, “‘골목·공연 인프라’로 3000만 관광객 잡겠다”",https://www.ekn.kr/web/view.php?key=20260414027586851,"쇠락한 준공업지역이던 성수동은 대규모 재개발 대신 도시 재생의 길을 택한 결과, 지난 10년 새 사업체 수 78%, 종사자 수 51%, 카드 매출액 274% 증가라는 성적표를 받았다. 연간 외국인 방문객은 6만 명(2018년)에서 300만... "
2026-04-14,네이버뉴스,"""원전 유치가 영덕의 미래""... 에너지 산업 생태계 구축 조례 추진",http://www.enewstoday.co.kr/news/articleView.html?idxno=2418620,과거 천지원전 건설 백지화로 큰 상실감을 맛봤던 주민들은 이제 원전 유치를 지역 경제를 살릴 마지막 '골든타임'으로 인식하고 있다. 인구는 줄고 상권은 침체하는 현실에서 대규모 국책 사업을 통한 일자리 창출과... 
2026-04-14,네이버뉴스,"영덕군, 원자력산업 육성 조례 추진…신규 원전 유치 연계 ‘에너지 수...",http://www.breaknews.com/1200056,해당 지역은 과거 천지원전 예정구역으로 입지 안정성이 검증된 곳이다. 또한 영덕군의회는 지난 2월 ‘신규 원자력발전소 건설 유치 동의안’을 전원 찬성으로... 
2026-04-14,네이버뉴스,"롤스로이스 SMR, 영국 최초의 SMR 납품 계약 체결",https://www.theguru.co.kr/news/article.html?no=100542,북웨일즈 지역에 SMR 3기 건설 원자로 설계·핵심 부품 발주 착수  영국 소형모듈원전(SMR) 기업 롤스로이스 SMR이 영국 최초 SMR 개발 사업에 본격적으로 착수했다. 롤스로이스 SMR과 영국 원전규제기관인 'GBE-N(Great... 
2026-04-14,네이버뉴스,"한수원, 체코 글로벌봉사단 대학생 봉사단원 모집",https://www.pinpointnews.co.kr/news/articleView.html?idxno=445371,한수원은 지난 2017년부터 10년째 매년 체코에 봉사단을 파견하며 원자력발전소(원전) 건설 예정지인 트레비치 등과 우호적인 관계를 유지해 왔다고 전했다. 특히 올해는 추가 원전 수주 후보지인 테믈린을 처음으로... 
2026-04-14,네이버뉴스,"영덕군, 원전 유치 연계 '원자력 산업 육성 조례' 본격 추진",https://www.kbsm.net/news/view.php?idx=515876,"영덕군은 지난달 27일 한국수력원자력에 2.8GW 규모의 신규 원전 건설을 위한 유치 신청서를 제출했다. 해당 사업은 APR1400 노형 2기 도입을 골자로 하며, 부지는 영덕읍과 축산면 일원 약 324만㎡ 규모다. 이 지역은 과거... "
2026-04-14,네이버뉴스,"영덕군 TF, '원자력산업 육성 및 지원에 관한 조례' 제정 본격 추진",https://www.hidomin.com/news/articleView.html?idxno=701277,신규 원전 유치에 나선 영덕군이 단순히 발전소를 건설하는 것을 넘어 원자력을 지역의 핵심 미래 산업으로 육성하기 위한 제도적 기반 마련에 착수했다. 영덕군 원전 유치 TF는 원자력 발전과 연계한 지역 산업 생태계... 
2026-04-14,네이버뉴스,한불 ‘글로벌 전략적 동반자’ 시대의 개막과 남겨진 숙제 ― 일본-프...,http://www.ifs.or.kr/bbs/board.php?bo_table=News&wr_id=55715,"우크라이나 전쟁 이후 러시아산 우라늄 공급망의 불확실성이 커진 상황에서, 이 MOU는 한국의 원전... 공장 건설 지원을 포함한 핵심광물 협력 로드맵도 마련하였다.21) 이처럼 일불 관계가 이미 제도화의... "
2026-04-14,네이버뉴스,"영덕군, 원자력산업 육성 조례 추진…원전 유치 이후 산업 기반 선제 구...",http://www.metroseoul.co.kr/article/20260414500170,영덕군은 지난달 27일 한국수력원자력에 2.8기가와트 규모 신규 원전 건설 의향서를 제출했다. 대상지는 영덕읍과 축산면 일대 약 324만㎡ 부지다. 이 지역은 과거 천지원전 예정지로 지정된 바 있어 입지 안정성이 검증된... 
2026-04-14,네이버뉴스,"영덕군, 원전 유치 대비 ‘원자력 산업 조례’ 추진…미래 성장동력 확...",https://sports.donga.com/region/article/all/20260414/133734372/1,"원전 입지 지역은 발전소 건설을 시작으로 에너지 공공기관 유치, 연구 및 산업 기능 집적을 거쳐 첨단 에너지 산업 클러스터로 발전해온 사례가 많다. 영덕군 역시 이러한 흐름에 맞춰 신규 원전 유치를 계기로 에너지... "
2026-04-14,네이버뉴스,"한국수력원자력, 체코 글로벌봉사단 대학생 봉사단원 모집",https://www.sentv.co.kr/article/view/sentv202604140078,"한수원은 2017년부터 매년 체코에 글로벌 봉사단을 파견해 원전건설 예정지인 트레비치 등지에서 노력봉사, 문화교류를 포함한 다양한 봉사활동을 10년째 꾸준히 펼치며 체코와의 우호적인 관계를 지속 유지하고 있다.... "
2026-04-14,네이버뉴스,"한수원, 체코 원전 수주 후보지에 'K-문화' 심는다...대학생 봉사단 모집",https://www.straightnews.co.kr/news/articleView.html?idxno=300116,이들은 체코 대학생 봉사단과 손을 잡고 원전 건설 예정지인 트레비치와 올해 처음으로 방문하는 추가 수주 후보지 테믈린 등지에서 활발한 활동을 펼친다. 봉사단은 현지 학생과 주민들을 대상으로 교육 및 노력 봉사를... 
2026-04-14,네이버뉴스,"한수원, 체코 대학생 글로벌봉사단원 모집…한-체코 교류 강화",https://www.econovill.com/news/articleView.html?idxno=737187,"한수원은 2017년부터 매년 체코에 글로벌 봉사단을 파견해 원전건설 예정지인 트레비치 등지에서 노력봉사, 문화교류를 포함한 다양한 봉사활동을 10년째 꾸준히 펼치며 체코와의 우호적인 관계를 지속 유지하고 있다.... "
2026-04-14,네이버뉴스,"한수원, 체코 글로벌봉사단원 모집…한국 문화콘텐츠 특기자 우대",http://www.e-platform.net/news/articleView.html?idxno=101440,"한수원은 2017년부터 매년 체코에 글로벌 봉사단을 파견해 원전건설 예정지인 트레비치 등지에서 노력봉사, 문화교류를 포함한 다양한 봉사활동을 10년째 꾸준히 펼치며 체코와의 우호적인 관계를 지속 유지하고 있다.... "
2026-04-14,네이버뉴스,"한수원, 체코 글로벌봉사단 대학생 모집",https://sports.donga.com/region/article/all/20260414/133734179/1,한수원은 지난 2017년부터 체코 원전 건설 예정지인 트레비치를 중심으로 글로벌 봉사단을 꾸준히 파견해 왔다. 이를 통해 노력 봉사와 문화교류를 병행하며 양국 간 우호 관계를 지속적으로 강화해왔다. 특히 올해는... 
2026-04-14,네이버뉴스,[칼럼] 정치검찰의 몰락과 윤석열 사단의 종말,https://newstapa.org/article/h6wq5,"검찰제국을 건설했다. 기간으로 따지면 무려 7년간인데, 문재인 정부 때 추미애 법무부 장관 취임 이후... 주요 수사로는 적폐 청산, 조국 사태, 울산시장 선거 개입 의혹, 이재용 경영권 불법 승계 의혹, 월성 원전 비리... "
