date,source,title,link,description
2026-04-15,네이버뉴스,"건설사, 이란 사태 위기가 기회될까..재건시 삼성E&A, DL이앤씨 수혜 전...",https://kpenews.com/View.aspx?No=4042036,"현대건설과 대우건설, GS건설 등도 중동에서 플랜트 사업을 다수 진행하고 있다는 점에서 수주 수혜가 기대된다. 현대건설과 대우건설, GS건설, DL이앤씨가 담당했던 시설의 피해는 각 2개로 예상됐다. 다만 전쟁이... "
2026-04-15,네이버뉴스,"압구정5구역 입찰 현장 ‘무단 촬영’ 논란에…DL이앤씨, 공식 사과문 제...",https://mdtoday.co.kr/news/view/1065594717775293,이번 입찰에는 현대건설과 DL이앤씨가 참여해 경쟁 구도가 형성된 상태다. 이에 DL이앤씨는 박상신 대표이사 명의의 사과문을 조합에 제출한 것으로 알려졌다. 회사 측은 입찰 마감 이후 서류 확인 과정에서 발생한 일로... 
2026-04-15,네이버뉴스,현대건설 “압구정5구역 클린수주 원칙 지킬 것…경쟁사 ‘무단촬영’...,https://biz.heraldcorp.com/article/10717363?ref=naver,“중대한 위법 행위 해당” 경쟁사에 법적대응 현대건설 사옥 전경. [헤럴드DB] 현대건설은 최근 압구정5구역 재건축 입찰 과정에서 경쟁사 직원이 입찰 서류를 무단촬영한 것을 두고 “공정 경쟁의 원칙을 훼손하는... 
2026-04-15,네이버뉴스,"대전 지역 건설업체, 1분기 하도급 2조 7,120억 수주…",http://www.breaknews.com/1200287,"주요 현장별 수주 실적을 살펴보면 선화3차 주상복합(코오롱글로벌) 364억 원 ,KT인재개발원 공동주택(계룡건설) 172억 원 ,도안2지구 2블록 공동주택(현대건설) 186억... "
2026-04-15,네이버뉴스,"전쟁에 가로막힌 K-건설, 현대건설 해외수주 97%↓...삼성물산 홀로 33%↑",http://www.consumernews.co.kr/news/articleView.html?idxno=754041,"반면 현대건설(대표 이한우)은 감소폭이 97%, 현대엔지니어링(대표 주우정)은 80%에 달한다. 15일 해외건설통합정보서비스에 따르면 10대 건설사의 1분기 해외수주액은 5억8307만 달러로 전년 동기 20억9303만 달러에... "
2026-04-15,네이버뉴스,건설업계 '탈현장·모듈러' 기술 확보 경쟁…교량까지 확대,https://www.greened.kr/news/articleView.html?idxno=339282,"현대건설은 모듈러 건축 기술을 주택과 병원 시설 등에 적용하며 사업 영역을 넓히고 있고, DL이앤씨 역시 프리캐스트 공법과 OSC 기술을 활용해 시공 효율성을 높이는 전략을 추진 중이다. 또한 일부 건설사들은... "
2026-04-15,네이버뉴스,"종전 기대감, 방산서 재건·성장株로 재편 [종전 후 새 주도주 찾는 증...",https://www.etoday.co.kr/news/view/2575654,"최근 한 달간 대우건설은 92.78%, DL이앤씨는 92.66%, 삼성E&A는 51.07%, 현대건설은 7.06% 상승했다. 재건 기대와 글로벌 에너지 인프라 투자 확대 기대가 함께 반영된 결과로 풀이된다. 외국인 수급에서도 복귀 조짐이... "
2026-04-15,네이버뉴스,[정비톡] 압구정ㆍ성수ㆍ반포ㆍ상대원…서울 핵심 정비사업 잇단 입찰ㆍ...,https://www.dnews.co.kr/uhtml/view.jsp?idxno=202604141025295730130,"현대건설과 DL이앤씨의 2파전이 성사됐는데, 입찰 제안서 개봉 자리에서 DL이앤씨 측 직원이 볼펜 형태 초소형 카메라로 제안서를 몰래 촬영하다 적발되면서 절차가 중단됐습니다. 경쟁사 조건을 공개 전에 미리... "
2026-04-15,네이버뉴스,"광주, 전국 첫 자체 발전 전기로 수돗물 생산",https://www.seoul.co.kr/news/publicnews/local_govern/news_local/2026/04/15/20260415018007?wlog_tag3=naver,"이는 상수도사업본부가 전력 효율을 높이고자 지난해 10월 빛고을시민햇빛발전 사회적협동조합, 현대건설과 함께 체결한 협약의 결과물이다. 협약에 따라 세 기관은 오는 2035년까지 10년간 ‘태양광 발전사업... "
2026-04-15,네이버뉴스,친환경 그라우팅 특허 공법으로 건설 탄소 저감 실현,https://www.donga.com/news/Economy/article/all/20260414/133730425/2,지난해 한국농어촌공사 KRC 신기술 지정을 받았으며 현대건설·포스코이앤씨 등과 협력해 전국 주요 재개발·SOC 현장에 이 기술을 확산시키고 있다. 김 회장은 “혁신 기술로 건설 산업의 탄소중립 실현에 기여하겠다”... 
2026-04-15,네이버뉴스,"DL이앤씨, 목동6단지 재건축 무혈 입성하나",https://www.chosun.com/economy/realty/2026/04/15/MPKVXZX5EBCFJE5OJOXNDABMRI/?utm_source=naver&utm_medium=referral&utm_campaign=naver-news,DL이앤씨는 서울 강남구 압구정5구역 시공사 선정 입찰에도 참여해 현대건설과 경쟁을 벌이게 됐다. 14일 정비업계에 따르면 DL이앤씨는 지난 10일 마감한 목동6단지 재건축 시공사 선정 입찰에 단독 응찰했다.... 
2026-04-15,네이버뉴스,10년 만에 나온 분양형 실버타운,https://www.chosun.com/economy/realty/2026/04/15/FC6UCRPFB5GD7EWOXNK3P6NLDM/?utm_source=naver&utm_medium=referral&utm_campaign=naver-news,"시공사는 현대건설이다. 남판교 더 힐은 대지면적 18만여㎡에 지하 8층~지상 15층 총 892가구 규모로 짓는다. 이 중 713가구는 분양형이며, 179가구는 임대형이다. 전용면적 59~99㎡까지 다양하다. 근린생활시설·복리시설... "
2026-04-15,네이버뉴스,‘몰카 볼펜’ 논란에도 DL 안고 가기… 압구정5구역 재건축 조합의 고...,https://www.chosun.com/economy/real_estate/2026/04/15/BYKAGDVSZJH45LROH7CCOL5ME4/?utm_source=naver&utm_medium=referral&utm_campaign=naver-news,지난 10일 시공사 입찰 마감 현장에서 DL이앤씨 직원이 초소형 카메라가 달린 볼펜으로 경쟁사인 현대건설의 입찰 서류를 몰래 촬영하다 현장에서 적발된 사건 때문입니다. 업계에선 “입찰 절차가 중단될 수도 있다”는... 
2026-04-15,네이버뉴스,‘굿바이 블로퀸’ 제2의 삶 준비하는 양효진 “(김)연경 언니가 ‘이제...,https://www.mk.co.kr/article/12016802,"(현대건설) 동생들이 자기들이 책임질 테니 번복하고 더 함께하자고 했다”라고 웃으며, “겉으로 티는 안 냈는데, 몇 년 전부터 그만두고 싶다는 생각이 컸다. 지금 은퇴하는 게 맞다고 생각한다. 홀가분한 기분이다”... "
2026-04-14,네이버뉴스,"이란, 사우디 공습에 현대건설 현지 사무실 일부 피해",https://www.delighti.co.kr/news/articleView.html?idxno=115137,"현대건설 계동사옥. (사진=연합뉴스) 이란의 사우디아라비아 공습 여파로 현대건설과 현대엔지니어링의 현지 사무소 일부가 파손된 사실이 뒤늦게 확인됐다. 14일 건설업계에 따르면, 사우디 동부 산업도시 주바일에... "
2026-04-14,네이버뉴스,"현대건설, 압구정5구역 입찰 '도촬 논란'…경쟁사에 법적 대응",https://www.delighti.co.kr/news/articleView.html?idxno=115136,"(사진=서울시 제공, 연합뉴스) 현대건설은 최근 서울 강남구 압구정5구역 재건축 사업 시공사 입찰 과정에서 경쟁사 관계자가 입찰 서류를 무단 촬영한 사건과 관련해 엄정 대응 방침을 밝혔다. 현대건설은 14일 배포한... "
2026-04-14,네이버뉴스,4월 3주 주요 제조업 전망,https://www.laborplus.co.kr/news/articleView.html?idxno=40647,"HD건설기계-현대건설, 스마트 안전 기술 협력 업무협약 - HD건설기계와 현대건설이 7일 서울 종로구 현대건설 사옥에서 '건설기계 스마트 안전 기술 공동 개발 및 적용을 위한 업무협약'을 체결했다고 밝힘.... "
2026-04-14,네이버뉴스,이란 공습에 현대건설 사우디 현지 사무소 파손,http://www.smarttimes.co.kr/news/articleView.html?idxno=44757,이란의 공습으로 현대건설 사우디아라비아 현지 사무소가  파손된 사실이 뒤늦게 알려졌다. 14일 건설업계에 따르면 사우디 동부 산업도시 주바일 지역에 위치한 '아미랄 프로젝트' 현장 내 현대건설 사무실이 지난 7일... 
2026-04-14,네이버뉴스,칙칙했던 금호동에 훈풍 불어온다,https://www.mk.co.kr/article/12013645,"지하 8층~지상 16층, 10개동, 595가구 규모로 조성되며 시공은 현대건설이 맡았다. 단지 규모는 크지 않지만 3호선 금호역과 5호선 신금호역을 모두 이용할 수 있는 점이 강점이다. 금호16구역은 2024년 4월... "
2026-04-14,네이버뉴스,"현대건설, 이란 공습에 사우디 현지 사무소 일부 파손",https://it.chosun.com/news/articleView.html?idxno=2023092160381,현대건설의 사우디아라비아 현지 사무소가 이란의 공습으로 일부 파손됐다. 14일 관련 업계 소식을 종합하면 사우디 동부 산업도시 주바일 지역 내 현대건설의 '아미랄 프로젝트' 현장 내 현대건설 사무실이 4월 7일... 
2026-04-14,네이버뉴스,"현대·GS건설 등 차량 5부제 동참…'현장은 예외, 관리직만 압박'",http://www.fntimes.com/html/view.php?ud=202604142045042752048b718333_18,"현대건설은 이미 수년 전부터 계동 본사 사무실 전등을 오전 11시 30분에 일괄 소등하는 방식을 운영해왔다. 현대건설 관계자는 ""단순한 에너지 절감 차원을 넘어, 공사현장의 점심 전후 휴식 관행에 맞춰 사무직 업무... "
2026-04-14,네이버뉴스,이란 공습 현대건설 사우디 사무소 파손…귀국의사 직원 파악,https://news.jtbc.co.kr/article/NB12294197?influxDiv=NAVER,이란의 공습으로 현대건설·현대엔지니어링의 사우디아라비아 현지 사무소가 일부 파손된 사실이 뒤늦게 알려졌습니다. 14일 건설업계에 따르면 사우디 동부 산업도시 주바일 지역에 있는 현대건설·현대엔지니어링의... 
2026-04-14,네이버뉴스,이란 공습 여파에 현대건설 사우디 사무소 일부 파손,https://www.m-i.kr/news/articleView.html?idxno=1364407,현대건설 계동 사옥. 사진=현대건설 제공 매일일보 = 김다니엘 기자  |  이란의 사우디아라비아 공습 여파로 사우디 동부 산업도시 주바일에서 진행 중인 현대건설·현대엔지니어링의 대형 플랜트 현장 사무소가 일부... 
2026-04-14,네이버뉴스,"광주시, 전국 최초 자체 발전 에너지로 수돗물 생산",http://www.jndn.com/article.php?aid=1776165008430833003,"이는 지난해 10월 17일 상수도사업본부가 전력효율을 높이기 위해 빛고을시민햇빛발전 사회적협동조합, 현대건설과 함께 체결한 ‘용연정수장 유휴부지를 활용한 태양광 직접 PPA 발전 협약’으로 이뤄졌다. 협약에 따라... "
2026-04-14,네이버뉴스,"압구정5구역 수주전, 정비사업 입찰 관리 체계 실효성 도마",https://www.safetimes.co.kr/news/articleView.html?idxno=241870,14일 건설업계에 따르면 현대건설은 서울 강남구 압구정5구역 재건축 입찰 과정에서 경쟁사 관계자가 입찰 서류를 촬영한 정황과 관련해 경찰에 고소장을 제출하고 법적 대응에 착수했다. 문제가 된 행위는 지난 10일 입찰... 
2026-04-14,네이버뉴스,"[단독] 'DL이앤씨 도촬' 압구정5구역, 입찰제안서 개봉 중단",https://www.m-i.kr/news/articleView.html?idxno=1364404,사진=서울시 제공 매일일보 = 윤하늘 기자  |  서울 강남구 압구정아파트지구 특별계획구역5 재건축정비사업(이하 압구정5구역) 조합이 현대건설과 DL이앤씨의 입찰제안서 개봉을 중단했다. 강남구청이 제동을 걸고 나선... 
2026-04-14,네이버뉴스,이란 공습에 현대건설 사우디 현지 사무소 파손…“임직원 가족 귀국중...,https://www.munhwa.com/article/11582254?ref=naver,현대건설 계동 사옥 전경. 뉴시스 이란의 공습으로 현대건설·현대엔지니어링의 사우디아라비아 현지 사무소가 일부 파손된 사실이 뒤늦게 알려졌다. 14일 건설업계에 따르면 사우디 동부 산업도시 주바일 지역에 있는... 
2026-04-14,네이버뉴스,"[자막뉴스] '사우디 공습' 현대건설 사무소 천장 '파손'…""매일 미사일...",https://news.sbs.co.kr/news/endPage.do?news_id=N1008518060&plink=ORI&cooper=NAVER,이란의 사우디아라비아 공습으로 현대건설·현대엔지니어링의 현지 사무소가 일부 파손된 사실이 뒤늦게 알려졌습니다. 건설업계에 따르면 사우디 동부 산업도시 주바일 지역에 있는 현대건설과 현대엔지니어링의... 
2026-04-14,네이버뉴스,이란 사우디 공습에 현대건설 사무소 일부 파손,https://www.ebn.co.kr/news/articleView.html?idxno=1705432,이란의 사우디아라비아 공습으로 현대건설 현지 사무소가 일부 파손되는 사태가 벌어졌다. 14일 건설업계에 따르면 사우디 동부 산업도시 주바일 지역에 있는 현대건설의 '아미랄 프로젝트' 현장 사무실이 지난 7일... 
2026-04-14,네이버뉴스,현대건설 사우디 현장 파손…'중동 리스크' 현실화,http://www.4th.kr/news/articleView.html?idxno=2110446,14일 현대건설에 따르면 지난 7일(현지시간) 사우디 동부 산업도시 주바일에 위치한 현대건설·현대엔지니어링 '아미랄 프로젝트' 현장 사무실 천장 일부가 파손됐다. 당시 외부 충격으로 건물에 진동이 발생하면서 일부... 
2026-04-14,네이버뉴스,"압구정5구역 입찰 '무단촬영 논란'…현대건설 ""클린수주 원칙 강화""",http://www.hansbiz.co.kr/news/articleView.html?idxno=832883,현대건설 계동사옥./현대건설 | 서울=한스경제 한나연 기자 | 서울 강남권 핵심 재건축 사업지인 압구정5구역에서 시공사 선정 입찰 과정 중 무단 촬영 논란이 불거지며 사업 절차가 중단됐다. 이에 현대건설은 공정 경쟁... 
2026-04-14,네이버뉴스,이란 공습에 현대건설 사우디 사무소 일부 파손,https://news.einfomax.co.kr/news/articleView.html?idxno=4409510,현대건설 계동사옥[출처: 연합뉴스 자료사진] 이란이 단행한 사우디아라비아 공격으로 현대건설의 현지 사무소가 일부 파손된 것으로 알려졌다. 14일 현대건설 등에 따르면 지난 7일 사우디아라비아 주바일 지역에 있는... 
2026-04-14,네이버뉴스,"현대건설 ""압구정5구역 수주전, 클린수주 원칙 지킬 것""",https://www.newspim.com/news/view/20260414001339,"현대건설은 최근 압구정5구역 재건축 정비사업 입찰 과정에서 발생한 입찰서류 무단 촬영 논란과 관련해, 공정 경쟁의 원칙을 훼손하는 행위에 대해 엄정하게 대응하겠다고 14일 밝혔다. 또한 불공정 행위가 있었음에도... "
2026-04-14,네이버뉴스,1.5조 압구정5구역 놓고 소송전…현대건설 DL이앤씨 고소,https://www.hankyung.com/article/202604140768i,공사비 1조5000억원 규모의 서울 강남구 압구정5구역 재건축 사업 수주 경쟁에서 현대건설이 DL이앤씨를 고소하는 사태가 발생했다. 현대건설은 압구정5구역 재건축 입찰 과정에서 DL이앤씨 직원이 입찰 서류를 무단... 
2026-04-14,네이버뉴스,'재개발 대어' 상도15구역 건설사 6곳 눈독,http://www.fnnews.com/news/202604141821036620,"서울 동작구 최대 재개발 지역인 상도15구역 현장설명회에 현대건설, 대우건설, 한화건설 등 대형 건설사들이 참석하며 본격적인 레이스를 시작했다. 신속통합기획 2차 후보지 중 가장 빠르게 속도를 내며 인근... "
2026-04-14,네이버뉴스,"현대건설, 압구정5구역 '도촬 논란' 경쟁사에 법적대응",https://news.sbs.co.kr/news/endPage.do?news_id=N1008518073&plink=ORI&cooper=NAVER,▲ 압구정5구역 정비계획 조감도 현대건설은 최근 서울 강남구 압구정5구역 재건축 입찰 과정에서 경쟁사 직원이 입찰 서류를 무단 촬영했다며 엄정 대응하겠다고 14일 밝혔습니다. 현대건설은 이날 배포한 입장문에서... 
2026-04-14,네이버뉴스,"[AI 부동산 투데이] 현대건설, 압구정5구역 '도촬' 혐의로 DL이앤씨 고소",https://www.newspim.com/news/view/20260414001327,"◆ 현대건설, 압구정5구역 '도촬' 혐의로 DL이앤씨 고소 총공사비만 1조4960억원에 달하는 서울 강남구 압구정5구역 재건축 사업 수주전에서 현대건설이 경쟁사인 DL이앤씨 관계자를 입찰 서류 무단 촬영 혐의로 경찰에... "
2026-04-14,네이버뉴스,지난주 현대건설 사우디 사무실 주변 드론 추락,https://www.ytn.co.kr/_ln/0102_202604141818173239,지난주 이란의 사우디아라비아 공습으로 현대건설과 현대엔지니어링 현지 사무소가 일부 파손됐던 사실이 파악됐습니다. 현대건설은 지난 7일 사우디 주바일 지역에 있는 '아미랄 프로젝트' 현장 사무실 인근에 드론이... 
2026-04-14,네이버뉴스,압구정5구역 입찰 서류 ‘무단 촬영’ 논란...법정싸움 가나,https://www.m-economynews.com/news/article.html?no=66457,"현대건설, 법적 대응 시사...“조합원 이익 위해, 클린수주 원칙 강화” 지난 10일 압구정5구역 입찰 마감에서 현대건설과 DL이앤씨가 서류 제출을 완료한 가운데, 직후 진행된 입찰서류 개봉 및 날인 절차에서 입찰서류를... "
2026-04-14,네이버뉴스,[대구 24시] '2026 대한민국 전기산업엑스포' 엑스코 개최…AI 전력망 조...,https://www.sisajournal.com/news/articleView.html?idxno=369446,"지난해에는 한국전력공사 및 발전 5사(남동·중부·서부·남부·동서발전), KEPCO KPS, 한국전력기술 등 공공 바이어와 포스코이앤씨, 현대건설 등 건설·엔지니어링사가 참여해 비즈니스 상담을 진행했다. 올해도 VVIP... "
2026-04-14,네이버뉴스,이란의 사우디 공습에 현대건설 사무소 일부 파손,https://news.sbs.co.kr/news/endPage.do?news_id=N1008518066&plink=ORI&cooper=NAVER,▲ 현대건설 이란의 사우디아라비아 공습으로 현대건설의 현지 사무소가 일부 파손된 사실이 뒤늦게 알려졌다. 건설업계에 따르면 사우디 동부 산업도시 주바일 지역에 있는 현대건설의 '아미랄 프로젝트' 현장 사무실이... 
2026-04-14,네이버뉴스,[현대건설이 일하는 법] 글로벌 원전 수주 전략은?…'주도형 업무 능력...,https://www.news2day.co.kr/article/20260414500173, 이한우 현대건설 대표이사 [사진=현대건설 / 편집=뉴스투데이] [뉴스투데이=장지우 기자] 현대건설(대표이사 이한우)은 글로벌 에너지 인프라 시장에서 기술력과 실행력을 기반으로 프로젝트를 주도하며... 
2026-04-14,네이버뉴스,"광주시, 태양광으로 수돗물 생산… 전국 첫 탄소중립 모델 구축",https://www.hankookilbo.com/news/article/A2026041414040001391?did=NA,"이 사업은 본부와 빛고을시민햇빛발전 사회적협동조합, 현대건설 등이 체결한 민관 협약을 통해 추진됐으며, 발전사업자가 생산한 전력을 한국전력공사를 거치지 않고 전력 소비자와 직접 계약을 맺고 일정 기간... "
2026-04-14,네이버뉴스,"볼펜 카메라로 입찰 서류 촬영한 DL이앤씨, 현대건설 경찰 고소 추진",http://www.globalepic.co.kr/view.php?ud=20260414180210150848439a4874_29,입찰 과정에서 적발된 '몰래 카메라' 현대건설과 DL이앤씨가 경쟁한 서울 강남구 압구정5구역 재건축 사업의 입찰 과정에서 불거진 '볼펜 카메라' 논란이 정비사업의 공정성 문제를 다시 한 번 수면 위에 끌어올렸다. 지난... 
2026-04-14,네이버뉴스,상도15구역 시공사 선정 돌입...대우·현대 등 6개사 현설 참석,https://www.youthdaily.co.kr/news/article.html?no=217384,"3천204세대, 1조4천367억원 규모 정비사업 가시화 5월 29일 입찰 마감 후 시공 파트너 최종 선정 예정  서울 동작구 상도15구역 주택정비형 재개발사업이 현장설명회를 열고 대우건설과 현대건설 등 주요 건설사들의... "
2026-04-14,네이버뉴스,사우디 현대건설 현지 사무소 천장 파손…이란 공습 여파,https://news.kbs.co.kr/news/pc/view/view.do?ncd=8535508&ref=A,"이란의 공습으로 현대건설 사우디아라비아 현지 사무소가 일부 파손된 사실이 뒤늦게 알려졌습니다. 오늘(14일) 건설업계에 따르면, 사우디 동부 산업도시 주바일 지역에 있는 현대건설의 '아미랄 프로젝트' 현장... "
2026-04-14,네이버뉴스,이란의 사우디 공습 여파…현대건설 현지 사무소 일부 파손,https://www.viva100.com/article/20260414501263,"이란의 사우디아라비아 공습으로 인해 현대건설 현지 사무소 일부가 파손된 사실이 뒤늦게 확인됐다. 14일 건설업계에 따르면, 사우디 동부 산업도시인 주바일 지역에 자리한 현대건설의 ‘아미랄 프로젝트’ 현장... "
2026-04-14,네이버뉴스,현대건설 사우디 현장 인근 공습에 사무소 일부 파손,https://imnews.imbc.com/news/2026/econo/article/6815179_36932.html,이란의 사우디아라비아 공습으로 현대건설·현대엔지니어링의 현지 사무소 일부가 파손됐습니다. 현대건설 등에 따르면 사우디 동부 산업도시 주바일에 있는 현대건설·현대엔지니어링의 '아미랄 프로젝트' 현장 사무실이... 
2026-04-14,네이버뉴스,"""글로벌 대기업까지 뛰어들었다""···UAM 해외는 '확장' 국내는 '이탈'",http://www.enewstoday.co.kr/news/articleView.html?idxno=2418649,"특히 2개 컨소시엄 가운데 현대차·KT·대한항공·인천국제공항공사·현대건설로 구성된 원팀만 그랜드챌린지 1·2단계 실증을 모두 수행했으며, 현재까지 민간 컨소시엄 형태를 유지하며 실증을 이어가고 있다. 반면... "
2026-04-14,네이버뉴스,"현대건설 ""경쟁사 압구정5구역 입찰 서류 무단 촬영 … 공정성 훼손 엄...",http://www.queen.co.kr/news/articleView.html?idxno=455049,"현대건설 계동사옥 현대건설이 서울 압구정5구역 시공사 선정 과정에서 불거진 경쟁사의 입찰 서류 무단 촬영 논란과 관련해 강경 대응 방침을 밝혔다. 현대건설은 14일 공식 입장문을 통해 ""압구정5구역 조합원 이익을... "
2026-04-14,네이버뉴스,이란 미사일 공격에 사우디 현대건설 현장사무소 일부 파손,https://www.livebiz.today/news/articleView.html?idxno=201599,14일 건설업계에 따르면 이란의 사우디아라비아 공습으로 현대건설의 현장 사무소가 일부 파손되는 물리적 피해가 발생했다. 사우디 동부 산업도시 주바일 지역에 있는 현대건설의 '아미랄 프로젝트' 현장 사무실이 지난... 
2026-04-14,네이버뉴스,"현대건설, '입찰서류 도촬' DL이앤씨 법적 대응",http://www.newstomato.com/ReadNews.aspx?no=1297865&inflow=N,뉴스토마토 = 이수정 기자 | 현대건설 사옥 전경. (사진=현대건설)  현대건설이 압구정5구역 경쟁사인 DL이앤씨 관계자가 입찰서류를 무단 촬영한 건에 대해 경찰에 고소장을 제출했습니다. 현대건설은 14일 입장문을 통해... 
2026-04-14,네이버뉴스,대우건설 결국 '데이터센터' 건설 본격화 : 대형 데이터센터 수요 급증...,https://www.huffingtonpost.kr/article/256610,"2023년 데이터센터 사업에 진출한 대우건설은 현대건설, GS건설 등 경쟁사보다 후발주자에 속한다. 그간 대우건설은 데이터센터 사업의 중요도를 다른 사업보다 상대적으로 낮게 평가했다. 하지만 최근 데이터센터가... "
2026-04-14,네이버뉴스,"현대건설, 압구정 5구역 '도촬 논란' 경쟁사 고소",https://www.ytn.co.kr/_ln/0102_202604141753310157,현대건설은 서울 강남구 압구정 5구역 재건축 입찰 과정에서 경쟁사 직원이 입찰 서류를 무단 촬영했다며 경찰에 고소장을 냈습니다. 현대건설은 입장문을 내고 재건축 조합에서 입찰서류 사진 촬영 금지를 거듭... 
2026-04-14,네이버뉴스,‘대안제시형’ 계양강화道 1공구에 금호·HJ·태영 등 7개사 도전,https://news.mtn.co.kr/news-detail/2026041417461517524,"지난달 종합심사낙찰제 방식인 3·4·5·6공구의 개찰을 실시, 동부건설·금호건설·현대건설·DL이앤씨를 각각 4개 공구 낙찰적격자로 선정했다. 턴키(설계·시공 일괄 진행) 방식인 7공구 담당 사업자는 롯데건설... "
2026-04-14,네이버뉴스,"이란의 사우디 공습에 현대건설 사무소 파손…""귀국 조치 중""",http://www.yonhapnewstv.co.kr/AKR20260414174637OPq,이란의 사우디아라비아 공습으로 현대건설의 현지 사무소가 일부 파손됐습니다. 오늘(14일) 건설업계에 따르면 사우디 동부 산업도시 주바일 지역에 있는 현대건설의 '아미랄 프로젝트' 현장 사무실이 현지시간 지난 7일... 
