date,source,title,link,description
2026-04-18,네이버뉴스,[주간 거래소 외국인] 두산에너빌리티 삼성전자우 대한전선 삼성SDI 에이...,https://www.pinpointnews.co.kr/news/articleView.html?idxno=446526,"또 한국전력, NAVER, 신성이엔지, 현대건설 등이 순매도 상위에 포함됐다. 외국인 매수는 '전력 인프라·에너지 전환'에 집중됐다. 데이터센터 확대와 전력 수요 증가 기대, 친환경 에너지 투자 확대가 맞물리며 관련... "
2026-04-18,네이버뉴스,"같은 원자력 ETF인데…내 펀드는 수익률 60%, 친구 펀드는 141%[주末머니...",https://view.asiae.co.kr/article/2026041616131867122,"이같은 압도적 수익률의 배경에 대해 박우열 신한투자증권 연구원은 ""TIGER 코리아원자력은 성과가 흔들리는 한국전력을 유일하게 편출했고, 성과가 급등한 대우건설, 현대건설을 가장 많이 편입했다""며 ""또... "
2026-04-18,네이버뉴스,"이란, 400조 재건비 압박에 '백기' 드나… 기름값·내 주식 운명은",https://www.g-enews.com/view.php?ud=202604171704098475fbbec65dfb_1,"과거 2015년 핵합의(JCPOA) 체결 당시, 한국은 이란에 묶여 있던 약 100억 달러(약 14조 8200억 원)의 원유 대금 회수 길이 열렸고 현대건설, 삼성엔지니어링 등 건설사가 플랜트 수주에 나선 바 있다. 이번에도 제재 완화가... "
2026-04-18,네이버뉴스,"건설업계, 글로벌 에너지 시장 공략 '드라이브'",https://www.asiatime.co.kr/article/20260417500151,"현대건설은 지난 10일 서울 종로구에 위치한 계동 본사에서 빌레 타비오(Ville Tavio) 핀란드 외교통상개발부 장관을 비롯한 핀란드 대표단과 면담을 갖고, 차세대 에너지 분야 협력을 모색했다. 필리핀 대표단은 빌레... "
2026-04-17,네이버뉴스,집 대신 에너지 짓는 건설사…“에너지 밸류체인 확보 사활” [에너지 ...,https://economist.co.kr/article/view/ecn202604140066,에너지로 사업 구조 대전환 현대건설은 ‘에너지 전환 리더’를 선언하며 사업 구조를 전면적으로 바꾸고 있다. 이한우 현대건설 대표는 올해 정기 주주총회에서 대형 원전과 ▲소형모듈원전(SMR) ▲해상풍력·태양광... 
2026-04-17,네이버뉴스,"[금주의 건설 톡톡] 삼성물산, 신반포19·25차에 ‘래미안 일루체라’ 제...",https://www.mediawatch.kr/news/article.html?no=259344,"있는 현대건설이 경쟁사인 DL이앤씨를 상대로 한 법적 대응 이슈가 화제가 됐다. 삼성물산 건설부문은 유럽 전력망 시장 공략에 히타치와 협력하기로 했고, 대우건설은 일본 기업과 에너지 분야에 대한 전방위 협력을... "
2026-04-17,네이버뉴스,[주요공시] 4월 17일 오후,https://www.ebn.co.kr/news/articleView.html?idxno=1705835,"▲ 현대건설 : 기업설명회(IR) 개최(안내공시) = 2026년4월 29일 오전 9시, 실적발표 NDR, 국내외 주요 기관 투자자 등 대상 경영현황 설명. ▲ 현대글로비스 : 기업설명회(IR) 개최(안내공시) = 2026년 4월 27일 오전 9시... "
2026-04-17,네이버뉴스,도시정비사업 ‘삐걱’…시공사 선정 두고 곳곳에서 충돌,https://www.kukinews.com/article/view/kuk202604170162,강남구 압구정5구역 시공사 선정 과정에서는 현대건설과 DL이앤씨 간 갈등이 격화되며 결국 고소전으로 번졌다. 문제는 지난 10일 시공사 입찰 마감 이후 서류 개봉 및 날인 절차를 진행하는 과정에서 불거졌다. 조합이... 
2026-04-17,네이버뉴스,"[스마트 주거 플랫폼 ➁] 현대건설, 로보틱스 라이프 시대 연다",https://www.goodkyung.com/news/articleView.html?idxno=286016,[편집자주] 현대건설이 정의하는 주거 공간은 단순한 집이 아닌 살아 움직이는 미래 도시에 가깝다. 집에서 제공할 수 있는 스마트 플랫폼을 넘어 하나의 도시로서 기능할 수 있도록 현대차그룹의 강력한 로보틱스... 
2026-04-17,네이버뉴스,압구정5구역 ‘도촬 논란’…입찰 중단 속 수주 향방 촉각,https://economist.co.kr/article/view/ecn202604170075,하지만 경쟁사인 현대건설이 법적 대응에 나서면서 상황은 급변했다. 현대건설은 해당 사안을 “공정 경쟁의 근간을 훼손하는 행위”로 규정하고 관계자를 상대로 고소를 진행했다. 현대건설은 입장문을 통해 “입찰서류... 
2026-04-17,네이버뉴스,잠원동 신반포2차 48층 2056가구,https://www.hankyung.com/article/2026041788151,시공을 맡은 현대건설이 단지명으로 ‘디에이치 르블랑’을 제안했다. 용적률 299.98%를 적용하고 한강 조망이 가능한 입지 특성을 최대한 살렸다. 단지를 특별건축구역으로 지정해 입체적 수변 경관을 조성한다. 북쪽... 
2026-04-17,네이버뉴스,[코스피 지수선물 옵션] 삼성전기·삼성SDI 선물 급등… 현물 시장 온기...,https://www.pinpointnews.co.kr/news/articleView.html?idxno=446460,"HMM과 현대건설 선물은 하락세를 기록했다. 포스코퓨처엠 선물은 상승세를 나타냈으며, 알테오젠 선물은 바이오주 조정과 함께 소폭 하락하며 거래를 마쳤다. 케이티앤지와 LIG디펜스 선물은 나란히 하락세를 보였다.... "
2026-04-17,네이버뉴스,글로벌 플랜트 수주전 '동맹 전략' 강화…대우건설 등 단독 경쟁에서 협...,https://www.greened.kr/news/articleView.html?idxno=339458,"현대건설은 LNG 및 수소, 원전 등 에너지 인프라 중심으로 해외 사업 포트폴리오를 확대하고 있으며, 삼성물산 역시 글로벌 플랜트 시장에서 파트너십 기반 프로젝트 수행을 강화하고 있다. 또한 DL이앤씨는... "
2026-04-17,네이버뉴스,"불가리아 정부, 현대건설 수주 코즐로두이원전 두고 ""고정 가격으로 지...",https://www.businesspost.co.kr/BP?command=article_view&num=435970,불가리아 정부가 현대건설에 코즐로두이 원전이 고정된 가격으로 이뤄져야 한다는 뜻을 내놨다. 17일 월드뉴클리어뉴스 등에 따르면 트라이초 트라이코프 불가리아 에너지부 장관은 주불가리아 한국 대사 및... 
2026-04-17,네이버뉴스,"유권해석 앞둔 압구정5구역 ‘펜 카메라’ 논란, 건설관계자 평가 들어...",http://www.fntimes.com/html/view.php?ud=202604171623572217b372994c95_18,현대건설과 DL이앤씨가 참여해 유효경쟁이 성립된 상태였다. 다만 논란은 입찰 직후 불거졌다. DL이앤씨 측 관계자가 볼펜형 카메라로 현대건설의 입찰 제안서를 촬영하다 적발되면서다. ◇ 현대건설 “중대 위법”... 
2026-04-17,네이버뉴스,[거래소 기관] 삼성전자 집중매수 왜?... SK하이닉스는 팔자,https://www.pinpointnews.co.kr/news/articleView.html?idxno=446446,"현대건설과 현대차 역시 기관의 선택을 받았으며, STX엔진과 SK이노베이션도 매수 우위를 기록했다. 한국전력과 후성, HD현대마린엔진과 삼양식품 또한 기관의 매수세 속에 거래를 마쳤다. 반면 기관은 그간 상승폭이... "
2026-04-17,네이버뉴스,[거래소 외국인] 삼성SDI LG디스플레이 포스코퓨처엠 삼성전기 '줍줍'.....,https://www.pinpointnews.co.kr/news/articleView.html?idxno=446443,"OCI홀딩스와 미래에셋증권 역시 매도 우위를 나타냈으며, 현대건설과 한미반도체도 외국인 순매도 목록에 이름을 올렸다. 비에이치와 두산 또한 외국인이 물량을 털어내며 장을 마감했다. 시장 전문가들은 외국인이... "
2026-04-17,네이버뉴스,대형사 인력감축-중소사 줄폐업…생사기로 선 건설업계,http://www.newstomato.com/ReadNews.aspx?no=1298253&inflow=N,"롯데건설과 현대건설도 각각 266명, 247명 줄었으며, 포스코이앤씨(111명), 삼성물산 건설부문(105명), IPARK현대산업개발(67명) 역시 인원을 줄였습니다. 특히 기간제 근로자를 중심으로 한 감축이 두드러지면서 현장 인력... "
2026-04-17,네이버뉴스,"(단독)고배당인데 밸류업 공시 누락…거래소, 한화시스템 등 107곳에 요...",http://www.newstomato.com/ReadNews.aspx?no=1298245&inflow=N,"HD현대건설기계(267270)는 배당총액 263억4000만원, 배당성향 26.50%, 더존비즈온(012510)은 232억6000만원, 25.20%로 모두 동일 요건을 충족한 것으로 나타났습니다. 특히 한국가스공사(036460)는 배당총액 1007억2000만원... "
2026-04-17,네이버뉴스,"[건설업, 주택 넘어 에너지로] ② 현대건설, 글로벌 '원전 독주' 굳히기...",http://www.opinionnews.co.kr/news/articleView.html?idxno=136944,현대건설이 준공한 UAE 바라카 원자력발전소. 사진=현대건설  현대건설은 1970년대 고리 1호기를 시작으로 20개의 국내 대형원전 건설을 주도한 국내 유일 기업이다. 지난 2009년에는 원전 강국 미국과 프랑스를... 
2026-04-17,네이버뉴스,마포농수산물시장·서울 물재생센터 등 5개 민투심 통과…6.2조원 규모,https://www.news1.kr/economy/trend/6140050,"난지물재생센터는 하수처리시설 68만㎥, 총인처리시설 24만㎥, 분뇨처리시설 4500㎘ 규모를 현대화하며 건설 기간은 68개월이다. 탄천물재생센터는 하수처리시설·총인처리시설·하수찌꺼기처리시설 등 하루 80만㎥ 처리... "
2026-04-17,네이버뉴스,"삼성물산, GVH와 스웨덴에서 현지 SMR 공급망 기업과 협력 강화",https://www.businesspost.co.kr/BP?command=article_view&num=435991,스웨덴의 국영 전력회사인 바텐폴은 2030년 가동을 목표로 1.5GW(기가와트) 규모의 SMR 건설을 추진하고 있다. GE버노바히타치는 SMR 사업과 관련해 삼성물산과 지난해 10월 파트너십을 맺었다. 삼성물산은... 
2026-04-17,네이버뉴스,"전력거래소, 삼성물산과 전력계통운영시스템(EMS) 실증·해외 협력 업무...",http://www.econonews.co.kr/news/articleView.html?idxno=435989,전력거래소는 삼성물산 건설부문과 전력계통운영시스템(EMS) 기술의 신규 응용기술 개발·실증 및 해외시장 공동 진출을 위한 업무협약(MOU)을 체결했다고 17일 밝혔다. 양측은 협약에 따라 ▲전력계통운영시스템 신규... 
2026-04-17,네이버뉴스,"'전력망이 곧 미래'…삼성물산, 유럽 인프라 시장 공략",https://www.thedailypost.kr/news/articleView.html?idxno=113904,삼성물산건설부문은 스위스 취리히에서 히타치 에너지와 유럽 전력망 사업 협력을 위한 업무협약(MOU)을 체결했다. 이번 협약은 기존 HVDC(초고압직류송전) 중심 협력에서 HVAC(초고압교류송전) 분야까지 확장한 것이... 
2026-04-17,네이버뉴스,"개포우성4차, 삼성물산 우선협상자 지정…6월 20일 최종 결정",https://www.m-i.kr/news/articleView.html?idxno=1365471,사진=개포우성4차 조합 제공 매일일보 = 윤하늘 기자  | 서울 강남구 도곡동 개포우성4차아파트 재건축 조합이 삼성물산 건설부문을 우선협상대상자로 지정했다. 조합은 6월 20일 총회를 열고 시공사를 확정할... 
2026-04-17,네이버뉴스,고유가 경계감 속 코스피 6190대로 차익매물 출회…SK하이닉스 2%↓,http://www.smedaily.co.kr/news/articleView.html?idxno=355897,"74%), 삼성물산(-1.47%) 등이 하락 마감했다. 반면 현대차(0.75%), LG에너지솔루션(0.48%), 기아(0.82... 업종별로는 종이·목재(-2.15%), 보험(-1.11%), 증권(-1.01%), 비금속광물(-0.89%), 전기·전자(-0.79%), 운수창고(-0.65%), 건설... "
2026-04-18,네이버뉴스,"수도권 아파트값 ‘키 맞추기’ 본격화,중저가 지역으로 수요 이동",https://www.dailian.co.kr/news/view/1634685/?sc=Naver,"DL이앤씨, GS건설, SK에코플랜트 컨소시엄은 구리시 수택동 일원에서 ‘구리역 하이니티 리버파크’를 분양 중이다. 단지는 총 4개 단지, 지하 6층~지상 최고 35층, 26개동(아파트 24개동,주상복합 2개동), 총 3022가구... "
2026-04-18,네이버뉴스,"[분양 캘린더] 4월 넷째 주, 건설사들 봄 이사철 분양 물량 풀었다...전...",https://www.bizwork.co.kr/news/articleView.html?idxno=414744,"◇ 모델하우스 오픈 예정 24일 DL이앤씨는 경기 부천시 원미구 소사동 일원에 잇는 'e편한세상 부천 어반스퀘어'의 모델하우스를 오픈할 예정이다. 단지는 지하 3층~지상 38층, 13개 동, 총 1649가구 규모로... "
2026-04-18,네이버뉴스,DL이앤씨·GS건설 컨소시엄 등 분양·청약 ‘동시 진행’,http://www.fntimes.com/html/view.php?ud=202604180047134790048b718333_18,"DL이앤씨를 비롯해 GS건설·SK에코플랜트와 LH가 서울과 수도권, 지방 주요 지역에서 분양과 청약, 준공, 입주 일정을 진행하고 있다. 노량진뉴타운과 서울 도심, 분당과 경기광주, 동탄과 영통, 천안·안동·인천... "
2026-04-18,네이버뉴스,"[4월 넷째주 분양동향] 전국 8,485가구 분양…봄 이사철 맞아 쏟아지는...",http://www.srtimes.kr/news/articleView.html?idxno=201528,"오는 24일 DL이앤씨는 경기 부천시 원미구 소사동 일원 'e편한세상 부천 어반스퀘어'의 견본주택을 오픈한다. 지하 3층~지상 38층, 13개 동, 총 1,649가구 중 전용면적 59~84㎡ 897가구를 일반 분양하며 1호선·서해선... "
2026-04-18,네이버뉴스,[분양 캘린더] 4월 넷째 주 전국 8485가구 청약 접수,https://www.asiatime.co.kr/article/20260417500108,"'e편한세상 부천 어반스퀘어' 투시도.(사진=DL이앤씨) 18일 부동산 전문 리서치업체 리얼투데이에 따르면 4월 넷째 주에는 전국 13곳에서 총 8485가구(오피스텔·공공지원 민간임대 포함, 행복주택 제외)의 청약 접수가... "
2026-04-17,네이버뉴스,"[주요공시] 삼성전자, 삼천당제약, DL이앤씨, HD현대중공업, 세종메디칼...",https://www.kdpress.co.kr/news/articleView.html?idxno=204397,"■ DL이앤씨(KOSPI, 375500)·GS건설(KOSPI, 006360)·HD현대중공업(KOSPI, 329180)은 이날 장 마감 후 나온 대형 계약 공시로 주목을 받았다. DL이앤씨는 코리안리 수송동 신사옥 건립공사, GS건설은 봉천4-1-3구역... "
2026-04-17,네이버뉴스,"DL이앤씨, 2030년 준공예정 코리안리 신사옥 공사 수주",http://www.biztribune.co.kr/news/articleView.html?idxno=352603,'코리아리재보험 신사옥' 조감도 | DL이앤씨 DL이앤씨가 서울 종로구 수송동에 들어설  '코리안리재보험 신사옥 건립 공사'를 수주했다. 이 공사비는  3982억원 규모에 달하는 것으로 준공예정 시점은 2030년 7월이다. 이... 
2026-04-17,네이버뉴스,[4월18일자] 비즈니스포스트 아침의 주요기사,https://www.businesspost.co.kr/BP?command=article_view&num=435999,"[오늘Who] DL이앤씨 원전 기대감에도 속내 '복잡', 박상신 흔들리는 수주 다잡기 과제로 ● HD현대중공업 스웨덴 쇄빙선 소송서 '판정승', 정기선 특수목적선 사업 확장 성큼 ● 기후변화가 복합 경제위기 불러, '물 부족... "
2026-04-17,네이버뉴스,[산업공시] HD현대중공업 VLGC 4척 수주 등,https://www.econovill.com/news/articleView.html?idxno=737780,▲DL이앤씨는 코리안리 신사옥 건립공사를 수주했다. 계약 규모는 약 4000억원이다. ▲GS건설은 봉천4-1-3구역 재개발사업을 수주했다. 계약 규모는 3751억원이다. ▲효성중공업은 부산 명장공원 공동주택... 
2026-04-17,네이버뉴스,[4월 4주 청약] 봄 이사철 맞아 분양 ‘활기’…전국 8485가구 청약,http://www.fntimes.com/html/view.php?ud=202604171911273963048b718333_18,"◇ 견본주택 개관 DL이앤씨는 24일 경기 부천시 원미구 소사동 일원에 들어서는 ‘e편한세상 부천 어반스퀘어’의 모델하우스를 개관한다. 단지는 지하 3층~지상 38층, 13개 동, 총 1649가구 규모로 이 가운데 897가구가... "
2026-04-17,네이버뉴스,"DL이앤씨, 4000억 규모 '코리안리 신사옥' 공사 수주",https://www.industrynews.co.kr/news/articleView.html?idxno=80151,인더스트리뉴스 한원석 기자  DL이앤씨가 서울의 심장부인 종로구에 새로운 도심 랜드마크를 세운다. DL이앤씨는 총공사비 3982억원 규모의 '코리안리재보험 신사옥 건립 공사'를 수주했다고 17일 밝혔다. 이번... 
2026-04-17,네이버뉴스,[C-워드] DL이앤씨·현대엔지니어링·코오롱글로벌 외,http://www.newsprime.co.kr/news/article.html?no=730680,"DL이앤씨가 공사비 3982억원 규모 '글로벌 재보험사' 코리안리재보험신사옥 건립공사 관리 업체로 선정됐다. 해당 사업은 업무 환경 고도화, 도심 녹지·문화 공간 확충을 통해 지역 활성화를 목표로 추진하는... "
2026-04-17,네이버뉴스,[오늘의 주요공시] HD현대중공업ㆍDL이앤씨ㆍ기가레인 등,https://www.etoday.co.kr/news/view/2576844,"이투데이=정수천 기자 | △DL이앤씨, 4000억원 규모 코리안리 신사옥 건립공사 수주 △GS건설, 3751억 봉천4-1-3구역 재개발 수주 △HD현대중공업, 6747억 규모 VLGC 4척 수주 △효성중공업, 부산 명장공원 공동주택... "
2026-04-17,네이버뉴스,"DL이앤씨, 3982억 규모 '코리안리 신사옥' 수주…종로 랜드마크로",https://www.newspim.com/news/view/20260417001045,DL이앤씨가 서울 종로 중심부에 들어설 대규모 오피스 건축 사업의 시공사로 낙점됐다. 단순한 업무 시설을 넘어 시민을 위한 문화와 휴식 공간이 결합된 도심 속 새로운 상징물을 세운다는 계획이다.... 
2026-04-17,네이버뉴스,"대림빌딩 뒤 코리안리 신사옥, DL이앤씨가 짓는다",https://news.bizwatch.co.kr/article/real_estate/2026/04/17/0032,DL이앤씨가 수송구역 내 코리안리재보험 신사옥을 내달부터 짓기로 하면서다. DL이앤씨는 서울 종로구 수송동 80 일원에 들어서는 '코리안리재보험 신사옥 건립 공사'를 수주했다고 17일 밝혔다. 글로벌 재보험사인... 
2026-04-17,네이버뉴스,"DL이앤씨, '코리안리재보험 신사옥' 건립공사 수주...4000억 규모",http://www.popcornnews.net/news/articleView.html?idxno=118712,"DL이앤씨가 서울 종로구 수송동 80번지에 들어서는 '코리안리재보험 신사옥' 건립 공사를 수주했다고 17일 밝혔다. 총공사비만 3982억 원인 해당 신사옥은 대지면적 7260㎡, 연면적 11만2600㎡ 규모에 지하 8층~지상 21층... "
2026-04-17,네이버뉴스,"DL이앤씨, 3982억원 규모 '코리안리재보험 신사옥 건립공사' 수주",https://www.s-journal.co.kr/news/articleView.html?idxno=40610,DL이앤씨는 서울 종로구 수송동 80번지 일원에 들어서는 '코리안리재보험 신사옥 건립 공사'를 수주했다고 17일 밝혔다. 공사비는 3982억원인 이번 사업은 글로벌 재보험사인 코리안리재보험이 업무 환경을 고도화하고... 
2026-04-17,네이버뉴스,도심 공간의 쓰임이 달라진다…오피스·주거 모두 ‘머무는 방식’,https://www.seoultimes.news/news/article.html?no=2000095183,"DL이앤씨·현대엔지니어링, CBD 핵심지에 복합형 오피스 잇따라 공급 업무·문화·휴식 결합…도심 개발, ‘체류형 공간’으로 빠르게 이동 청년주택도 변화…원룸 넘어 가족형 구조까지 확장 흐름 [서울타임즈뉴스 = 허성미... "
2026-04-17,네이버뉴스,[건설업계 브리핑] 대우건설·DL이앤씨·SK에코플랜트·동부건설·대방건...,https://daily.hankooki.com/news/articleView.html?idxno=1359330,"◇DL이앤씨, 4000억원 규모 코리안리 신사옥 건립공사 수주 '코리안리재보험 신사옥' 조감도. 사진=DL이앤씨 제공 DL이앤씨는 글로벌 재보험사 코리안리재보험의 서울 종로구 수송동 신사옥 건립 공사를 수주했다고 17일... "
2026-04-17,네이버뉴스,기업공시 [4월 17일],https://www.sedaily.com/article/20033907?ref=naver,▲DL이앤씨(375500)=4000억 원 규모 코리안리재보험 신사옥 건립공사 수주 ▲금양(001570)=100억 원 규모 부동산 강제 경매 개시 결정 통보 ▲GS건설(006360)=3751억 원 규모 봉천 재개발 공사 수주... 
2026-04-17,네이버뉴스,"광화문에 심는 '건축의 선율'… DL이앤씨, 코리안리 신사옥 4,000억 수주...",http://www.ttlnews.com/news/articleView.html?idxno=3100144,"DL이앤씨가 종로구 수송동의 스카이라인을 재편할 코리안리재보험 신사옥 건립 프로젝트의 최종 승자가 됐다. 4,000억 원에 육박하는 공사비는 물론, 단순한 오피스를 넘어 문화와 녹지가 어우러진 복합 랜드마크를... "
2026-04-17,네이버뉴스,"DL이앤씨, 4천억 '코리안리 신사옥' 수주…CBD 랜드마크 경쟁 가세",http://www.newslock.co.kr/news/articleView.html?idxno=128839,DL이앤씨가 약 4000억 원 규모의 도심 핵심 오피스 개발 사업을 따내며 서울 중심업무지구(CBD) 프라임 오피스 시장 공략을 본격화했다. DL이앤씨는 코리안리재보험 신사옥 건립 공사를 수주했다고 17일 밝혔다. 총... 
2026-04-17,네이버뉴스,"DL이앤씨, 4000억 규모 '코리안리 신사옥' 수주…CBD 랜드마크 짓는다",https://www.fetv.co.kr/news/articleView.html?idxno=300619,DL이앤씨가 서울 도심권역(CBD) 대형 오피스 개발 사업인 코리안리재보험 신사옥 건립공사를 따냈다. 종로 핵심 입지에 문화·녹지 기능을 결합한 복합 업무시설이 들어설 전망이다. DL이앤씨는 서울 종로구 수송동... 
2026-04-17,네이버뉴스,"DL이앤씨, 코리안리재보험 신사옥 건립 수주...3982억원 규모",https://weekly.hankooki.com/news/articleView.html?idxno=7160401,"사진=DL이앤씨  DL이앤씨는 서울 종로구 수송동 80번지 일원에 들어서는 코리안리재보험 신사옥 건립공사를 수주했다고 17일 밝혔다. 이번 신사옥 공사는 대지면적 7260㎡, 연면적 11만2600㎡에 지하 8층~지상... "
2026-04-17,네이버뉴스,"'비규제 막차' 오르는 구리시, 규제지역 지정 전 '하이니티 리버파크' 무...",https://www.eroun.net/news/articleView.html?idxno=78491,"이러한 상황 속에서 DL이앤씨, GS건설, SK에코플랜트 컨소시엄이 공급하는 '구리역 하이니티 리버파크'의 무순위 청약 소식은 가뭄의 단비가 될 전망이다. 경기 구리시 수택동 일원에 들어서는 이 단지는 이미... "
2026-04-17,네이버뉴스,"DL이앤씨, 4000억원 규모 코리안리 신사옥 건립공사 수주",https://www.getnews.co.kr/news/articleView.html?idxno=868046,"DL이앤씨는 코리안리재보험의 서울 종로구 수송동 신사옥 건립 공사를 따냈다고 17일 밝혔다. 이번 신사옥은 수송동 일대에 지하 8층∼지상 21층 규모로 건립되는 프라임 오피스다. 공사비는 3982억원이며, 다음 달... "
2026-04-17,네이버뉴스,[굿모닝! 17일 건설업계 소식] 대우건설·DL이앤씨·현대엔지니어링·동...,https://www.goodkyung.com/news/articleView.html?idxno=286015,"DL이앤씨는 서울 종로구 수송동 일대 '코리안리재보험 신사옥 건립 공사'를 수주했다. 공사비는 3982억원 규모다. 대지면적 7260㎡, 연면적 11만2600㎡ 규모에 지하 8층에서 지상 21층까지 규모로 내달 착공해 2030년... "
2026-04-18,네이버뉴스,다음주 9258가구 분양 쏟아진다…수도권·지방 동시 공급,https://www.news1.kr/realestate/general/6140595,"대우건설(047040)은 충북 청주시 서원구 '청주푸르지오씨엘리체'를 분양한다. 단지는 지하 2층~지상 최고 29층, 10개 동, 전용면적 84·114㎡, 총 1351가구 규모로 조성된다. 교통 여건도 양호하다. 청주 제1·2·3순환로와... "
2026-04-18,네이버뉴스,[주간 거래소 기관] 삼성전자 8천억 순매수…사고 판 종목 속 투자 힌트...,https://www.pinpointnews.co.kr/news/articleView.html?idxno=446520,"이와 함께 에이피알, 포스코인터내셔널, 대우건설, SK이터닉스 등에서도 매도세가 나타났다. 일부 성장주와 소재·건설 업종에서 차익실현 성격의 매도가 이어졌다. 또한 한솔케미칼, LS ELECTRIC, OCI홀딩스, 엘앤에프... "
2026-04-18,네이버뉴스,[분양캘린더] 양주 옥정중앙역대방디에트르 등 9258가구 분양,https://www.newspim.com/news/view/20260417000860,"대우건설은 충북 청주시 서원구 미평동 일원에 '청주 푸르지오 씨엘리체'를 분양한다. 지하 2층에서 지상 최고 29층, 10개 동, 전용면적 84·114㎡, 총 1351가구 규모다. 청주 제1·2·3순환로와 청남로를 통한 청주 도심 및... "
2026-04-18,네이버뉴스,내주 9200가구 쏟아진다…11개 단지 출격[분양캘린더],https://www.newsis.com/view/NISX20260417_0003595824,"대우건설은 충북 청주시 서원구 미평동 일원에 '청주푸르지오씨엘리체'를 분양한다. 지하 2층~지상 최고 29층, 10개동, 전용면적 84·114㎡, 총 1351가구 규모다. 단지는 청주 제1·2·3순환로와 청남로를 통한 청주 도심 및... "
