date,source,title,link,description
2026-04-05,네이버뉴스,"김윤덕 국토장관, 건설 8개 협회 긴급 간담회…중동발 자재·공사비 영...",https://www.newspim.com/news/view/20260405000135,"김윤덕 장관은 ""자재 수급부터 공사비, 금융까지 건설산업 전반에 영향을 줄 수 있는 모든 요소를 면밀히 관리해 국민이 체감하는 불안이 커지지 않도록 해야 할 때""라며 ""위기 상황에서도 국민의 일상은 흔들리지 않도록... "
2026-04-05,네이버뉴스,"전남도, '소규모 건설공사 설계기준' 개정…공사비 현실화",https://www.namdonews.com/news/articleView.html?idxno=906392,"강성진 대한전문건설협회 전남도회장은 ""지역 전문건설업계의 공사비를 현실화하는 중요한 계기가 될 것으로 본다""며 ""앞으로도 도내 기업들의 경영환경 개선을 위해 전남도와 힘을 모으겠다""고 말했다. 문인기 전남도... "
2026-04-05,네이버뉴스,"""중동 사태 영향 점검""…국토장관, 건설부문 8개 협회 긴급 회동",https://www.nocutnews.co.kr/news/6496755?utm_source=naver&utm_medium=article&utm_campaign=20260405041918,"김 장관은 ""자재 수급부터 공사비, 금융까지 건설산업 전반에 영향을 줄 수 있는 모든 요소를 면밀히 관리해 국민이 체감하는 불안이 커지지 않도록 해야 할 때라며 ""위기 상황에서도 국민의 일상은 흔들리지 않도록... "
2026-04-05,네이버뉴스,금융권 PF 연체율 3%대로 하락…중동 불확실성에 당국 예의주시,http://mbnmoney.mbn.co.kr/news/view?news_no=MM1005806530,"금융권과 건설업계는 최근 중동 상황으로 공사비 상승과 원자재 수급 불안 등 PF 사업 불확실성이 확대되고 있다는 의견을 제시했습니다. 민간 전문가들도 ""부동산 PF 시장이 안정세에 접어들고 있으나 중동 상황에... "
2026-04-05,네이버뉴스,"대전시, 중·소규모 건축공사장 안전점검 실시",https://www.ccdn.co.kr/news/articleView.html?idxno=1071525,"고용노동부 통계에 따르면 2025년 3분기 누계 기준, 공사비 50억 원 미만 건설현장에서 전체 사망자의 52%가 발생했다. 점검 결과 경미한 사항은 현장에서 즉시 시정하고, 위험 요인이 확인된 공사장은 출입 통제와... "
2026-04-05,네이버뉴스,"중동發 건설업계 위기에…정부 ""자재·공사비·금융까지 전방위 대응""",https://www.getnews.co.kr/news/articleView.html?idxno=867016,"김 장관은 ""자재 수급부터 공사비, 금융까지 건설산업 전반에 영향을 줄 수 있는 모든 요소를 면밀히 관리하여 국민들께서 체감하는 불안이 커지지 않도록 해야 할 때""라며 ""위기 상황에서도 국민의 일상은 흔들리지 않도록... "
2026-04-05,네이버뉴스,"레미콘·아스팔트 '비상'…건설업계 위기, 국토부 긴급 간담회",https://www.kizmom.com/news/articleView.html?idxno=108990,"김 장관은 ""자재 수급부터 공사비, 금융까지 건설산업 전반을 면밀히 관리해 국민이 체감하는 불안을 최소화해야 한다""며 ""위기 상황에서도 국민의 일상이 흔들리지 않도록 하겠다""고 밝혔다."
2026-04-05,네이버뉴스,"'의정부역 센트럴 아이파크', 뜨거운 현장 반응 속 청약 초읽기",https://www.joongangenews.com/news/articleView.html?idxno=508850,"공사비와 땅값, 인건비, 고유가 등의 영향으로 갈수록 분양가가 갈수록 치솟고 있는 상황임을 고려하면 합당한 수준이라는 반응이었다. 오히려, 지하철 1호선과 교외선, GTX-C노선(예정) 의정부역 도보권에 대형 건설사의... "
2026-04-06,네이버뉴스,"DL이앤씨, 압구정5구역 '에이럽·도카'와 글로벌 기술 협업",http://www.ikld.kr/news/articleView.html?idxno=332259,공정 리스크를 최소화하고 시공 속도와 품질을 동시에 확보하기로 했다. 이번 협업을 통해 DL이앤씨는 압구정5구역을 글로벌 기술 융합을 통한 초고층 건설의 새로운 기준을 제시하는 상징적인 프로젝트로 만들겠다는... 
2026-04-06,네이버뉴스,"[금통위poll]②이란 전쟁, 물가에 먼저 타격…전원 ""전망치 상향""",https://view.asiae.co.kr/article/2026040607580909339,"허문종 우리금융경영연구소 센터장은 기존 1.8%에서 2.0%로 높여 잡으며 ""중동발 대외 불확실성과 건설투자... 백윤민 연구원은 ""금융안정 리스크 우려가 통화정책 완화 기대를 제한하는 리스크로 반영됐다면, 물가... "
2026-04-06,네이버뉴스,"중동 전쟁發 석유 위기 속… 중국, ‘수소 엔진’ 화물기 첫 비행으로 ...",https://www.g-enews.com/view.php?ud=2026040608452824920c8c1c064d_1,"◇ 한국 수소 업계에 주는 시사점 중동 전쟁과 같은 지정학적 리스크가 항공 산업에 미치는 영향을... 미래의 모든 공항이 액체 수소 충전 시설을 갖추게 될 것에 대비해, 국내 에너지·건설 기업들이 수소 항공 인프라의... "
2026-04-06,네이버뉴스,"인도, PVC 수입 관세 일시 면제…중국 업계에 '단비'?",http://www.choicenews.co.kr/news/articleView.html?idxno=163320,"PVC는 주로 농업 분야의 관개용 파이프, 배수 및 급수용 파이프와 건설 분야의 건축 자재, 필름, 전선 및... 지정학적 리스크를 주의 깊게 살펴야 한다""며 ""재고 관리와 수출 전략을 유연하게 조정해 시장 변동성에... "
2026-04-06,네이버뉴스,"[N2 포커스] 한국 기업 참여 쿠웨이트 담수화 시설, 전쟁 사정권",https://www.news2day.co.kr/article/20260406500028,흔들…유지보수·인력까지 리스크 확산 두산에너빌리티(구 두산중공업) 해수 담수화 플랜트 [뉴스투데이... 이 일대는 한국 기업이 수조 원을 들여 건설한 담수화 시설이 밀집한 지역이다. 두산에너빌리티(구... 
2026-04-06,네이버뉴스,중처법의 실효성을 제고하는 보완책 필요,https://www.koscaj.com/news/articleView.html?idxno=323336,"지난해 업종별 산업재해 사고 사망자 숫자는 건설업 286명(267건), 제조업 158명(150건), 기타 업종 161명(156건)... 이어 ""중처법이 이른바 '겁주기' 효과에 그치면서 기업이 사후 처벌에 대비한 법적 리스크관리에 몰두하고... "
2026-04-06,네이버뉴스,[박정식의 국내 주식시황] 트럼프-이란 최후 통첩에 국내시장 혼조 및 ...,https://www.newsquest.co.kr/news/articleView.html?idxno=264265,"▷호르무즈 통항 프로토콜 초안 마련 소식 속 중동 리스크 완화, 재건 수요 기대감 등에 건설 대표주/ 건설 중소형, 건설기계 테마 상승. ▷아르테미스 2호 발사 성공 및 스페이스X, IPO 비공개 신청서 제출 속... "
2026-04-06,네이버뉴스,"영업이익에선 '선방', 안방에선 '헛방'…롯데쇼핑, 내수 매출 감소세 '뚜...",https://www.youthdaily.co.kr/news/article.html?no=216802,"(CFC)를 건설할 계획을 가지고 있다. 또한 롯데온의 뷰티 전문 세컨드 앱 '트위즈'에 막대한 역량을 투입하고... 이어 ""사업 포트폴리오 다각화 자체는 리스크 분산 측면에서 긍정적일 수 있지만, 현재 롯데쇼핑의 구조는... "
2026-04-06,네이버뉴스,[전국 주요 신문 톱뉴스](6일 조간),https://www.yna.co.kr/view/AKR20260406010800011?input=1195m,"인상""…건설현장 '중동發 청구서' ▲ 한국경제 = ""이자 무서워"" 회사채 발행 속속 포기 ▲ 전국매일신문... 중동 리스크가 밥상까지…고삐 풀린 먹거리 물가 ▲ 대전일보 = 지역 미래 달린 도로·철도·하늘길… 균형발전... "
2026-04-06,네이버뉴스,[6·3 지방선거-인천] '친명 핵심' 박찬대 vs '행정 전문가' 유정복,https://www.shinailbo.co.kr/news/articleView.html?idxno=5008143,"◇ '사법리스크' '공항운영통합' 최대 변수 인천시장 선거의 최대 변수로는 유 시장의 '사법리스크'가 될... 이번 선거의 또 다른 이슈는 인천공항과 한국공항공사, 가덕도신공항건설공단 등 공항 운영기관 통합도 꼽힌다.... "
2026-04-06,네이버뉴스,"이란, 오픈AI 40조 ‘스타게이트’ 정조준… AI 데이터센터 ‘군사 표적...",https://www.g-enews.com/view.php?ud=202604060644421503fbbec65dfb_1,아부다비에 건설 중인 오픈AI의 300억 달러(약 45조 3000억 원) 규모 데이터센터 ‘스타게이트’를 “완전히... 지정학적 리스크의 정점에 서게 되었음을 증명한다. 20세기 지정학이 원유 공급망을 중심으로 재편됐다면... 
2026-04-06,네이버뉴스,"PF 지급보증 수수료 무상 제공, 공정거래법 위반 된다…계열사 보증 관...",https://www.mk.co.kr/article/12008141,"시공사 PF 지급보증, 업계 관행에서 공정거래법 위반으로 그런데 2025년말 대법원은 A건설이 계열사가... 위반 리스크는 크게 줄어들 것이다. [바른 컴플라이언스리포트]에서는 법무법인 바른 기업법무2그룹 변호사들이... "
2026-04-06,네이버뉴스,[전문가 視覺] 노란봉투법이 건설시장에 미칠 영향과 대처법,https://www.koscaj.com/news/articleView.html?idxno=323358,궁극적으로는 이러한 제도 변화가 대립을 확대하기보다 협력적 관리체계를 통해 건설현장에 끼칠 리스크를 최소화해 나가야 할 것이다. /임정주 공정계약연구원 The TEAM(더팀) 대표
2026-04-06,네이버뉴스,[증시전략] 이란 대폭격 데드라인 임박 속 물가지표 촉각…파장은?,https://biz.sbs.co.kr/article_hub/20000302125?division=NAVER,3% - 의료계 파업종료·건설업 호조…고유가에 4월 먹구름 예고 - 3월 중순 자료 기반…이란 전쟁 영향... 하방 리스크에 대한 가장 적절한 대응은 현금 비중 확보 - 현금 비중 10%+지상군 투입 가정 10~15% 추가 (자세한... 
2026-04-06,네이버뉴스,[법률라운지] 도심복합개발사업 중 신탁업자 시행방식의 주요 쟁점,https://www.dnews.co.kr/uhtml/view.jsp?idxno=202604050459194440958,사업추진의 리스크를 최소화하려면 사업의 효율성을 유지하면서도 소유주의 의사를 반영할 수 있는... 업무(건설사업관리)를 수행하도록 하였습니다(제39조). 복합개발사업에서도 시행자에게 정비사업과 유사한 수준의... 
2026-04-06,네이버뉴스,[여명] 자충수로 돌아올 삼성바이오의 파업,https://www.sedaily.com/article/20028389?ref=naver,백업 체계 구축을 통한 안정적인 생산 물량 확보가 담보되지 않으면 또 다른 파업 리스크가 바이오 의약품의 안정적 공급 시스템을 밑동부터 뒤흔들 수 있는 탓이다. 결국 삼성바이오로직스는 국내 대신 해외 공장 건설에... 
2026-04-06,네이버뉴스,“충격은 다르게 온다…전쟁 여파로 초양극화 심화할 것”,https://weekly.khan.co.kr/article/202604060600011,"“그렇게 되면 본격적으로 전쟁의 충격이 도소매, 음식점, 숙박, 건설 등 내수 산업 전반으로 확산할 것이다. 비용 부담이 증가하면서 기업과 자영업자의 도산·폐업 리스크가 상승한다. 물가상승률이 높아지는 가운데... "
2026-04-06,네이버뉴스,"“IMF 때도 문 안 닫아… 가장 힘든 순간, 금융이 힘이 돼야”[월요인터...",https://www.seoul.co.kr/news/plan/monday-interview/2026/04/06/20260406016001?wlog_tag3=naver,"리스크를 감수하는 선택을 반복하면서도 어떻게 흔들리지 않았을까. 서울 소월로 신협중앙회 사무소에서... 두 곳 모두 자기자본의 20%라는 기준은 같지만, 신협중앙회는 부동산·건설업 대출 한도 규제와 고액여신 한도... "
2026-04-06,네이버뉴스,"정진완號 우리은행, 기업대출 줄여도 제조업 여신은 늘린다 [은행 기업...",http://www.fntimes.com/html/view.php?ud=202604040115559310dd55077bc2_18,"올해부터 기업에 대한 투융자가 본격화되는 만큼, RWA 성장률을 최대한 낮춰둬야 추후 리스크 상승에 더욱... 반면 이를 제외한 ▲건설업 ▲도소매업 ▲숙박·음식업 ▲부동산업종에 대한 대출은 최소 1.39%에서 최대 13.4... "
2026-04-06,네이버뉴스,우회 송유관·러에 사절단… 각국 ‘호르무즈 돌파구’ 찾기 안간힘,https://www.kmib.co.kr/article/view.asp?arcid=1775378205&code=11121100&cp=nv,신규 건설 방안을 검토 중이다. 자국 내 유전을 해협 외부인 오만만과 인접한 수출 거점으로 연결해 원유를 우회 수출하려는 구상이다. 이는 막대한 비용이 들지만 산유국 입장에선 지정학적 리스크의 돌파구가 그만큼... 
2026-04-06,네이버뉴스,데이터센터 보험 수요 급증… 2030년 242억 달러 규모 전망,https://www.insnews.co.kr/news/articleView.html?idxno=89994,"글로벌 데이터센터 건설 확대에 따라 보험 수요와 리스크가 동시에 증가하고 있다. 재보험사 스위스리(Swiss Re)는 데이터센터 관련 보험료가 2030년 약 242억 달러 규모로 성장할 것으로 전망하며, 자연재해와 전력·냉각... "
2026-04-05,네이버뉴스,[ASL 통신] '리쌍록' 기대감 고조…이영호-이제동 나란히 16강 안착,https://www.techm.kr/news/articleView.html?idxno=150834,"이영호는 몰래 스타포트를 건설한 후 4벌처 드랍이라는 승부수를 던져 임진묵을 거세게 흔들었습니다. 초반... 조급해진 김명운이 무리한 뮤탈리스크 공격을 감행했지만, 투스타포트 체제와 함께 벙커와 터렛으로... "
2026-04-05,네이버뉴스,"HS화성, 시공·출자자 병행… 울산 리츠 산업 깃발 꽂았다",http://www.hidomin.com/news/articleView.html?idxno=615463,"통한 리스크 분산과 수익 극대화다. HS화성은 자본금 지분을 직접 출자해 사업 성과를 공동 확보하는 방식을 택했다. 주택도시보증공사(HUG)와 민간 금융기관이 참여해 안정성을 뒷받침하고, 건설사는 단순 공사 수입... "
2026-04-05,네이버뉴스,벌크 넘어 컨테이너로… 물량 감소 ‘컨소시엄’ 대응,https://www.kyeongin.com/article/1761371,"민간 자본으로 건설된 인천 북항 2부두는 CJ대한통운의 합작 형태로 지분이 구성돼 있으며, 북항... 통해 리스크를 분산하려는 움직임이 늘고 있다”며 “지분 참여 방식은 직접 운영 부담 없이 수익을 확보할 수 있다는... "
2026-04-05,네이버뉴스,"머스크의 '테라팹', 꿈인가 공허한 선언인가…스페이스X IPO 앞두고 던진...",https://www.pressman.kr/news/articleView.html?idxno=101185,"오스틴 기가텍사스 북쪽 부지에 건설될 이 시설은 칩 설계부터 리소그래피, 웨이퍼 생산, 메모리, 첨단... 지정학적 리스크도 가속 요인이다. 테슬라와 스페이스X 모두 현재 TSMC와 삼성에 핵심 칩 생산을 의존한다.... "
2026-04-05,네이버뉴스,‘뉴삼성’ 투자 버튼 켜졌다…HBMㆍAIㆍM&A 미래 성장동력 본격화 [포스...,https://www.etoday.co.kr/news/view/2572761,5일 재계에서는 삼성의 상속세 부담과 총수 사법 리스크 해소로 그룹 차원의 중장기 투자 의사결정 환경이... 특히 AI 시대 메모리 수요 확대에 대응하기 위해 삼성전자는 평택캠퍼스 2단지 5라인(P5) 건설을 추진... 
2026-04-06,네이버뉴스,부산시 운전자들 주의…제1만덕터널 3일간 심야 폐쇄,http://www.hansbiz.co.kr/news/articleView.html?idxno=830548,"이번 제1만덕터널 내 전선관 보강 공사는 노후 전선관 탈락으로 인한 차량 안전사고 위험을 미연에 방지하고... 진봉상 시 건설안전시험사업소장은 ""시민들의 불편을 최소화하기 위해 안전하고 신속하게 작업을... "
2026-04-06,네이버뉴스,"부산시, 오는 10일부터 사흘간 제1만덕터널 교통통제",https://www.nocutnews.co.kr/news/6496888?utm_source=naver&utm_medium=article&utm_campaign=20260406084026,"특히 야간 작업 시 발생할 수 있는 사고에 대비해 안전 요원을 배치하고 신속하게 공사를 마무리해 통제 기간을 최대한 앞당기기로 했다. 진봉상 시 건설안전시험사업소장은 ""시민 불편을 최소화하기 위해 신속하고... "
2026-04-06,네이버뉴스,[인터뷰] 한국시설안전협회 정석봉 회장,http://www.ikld.kr/news/articleView.html?idxno=332245,"지자체·공기업 등 발주기관, 행정편의 중심 관행 바로잡아야 안전사고만 나면 호들갑… 결국 예산... 국민안전 정책 당국은 정신차려야 합니다."" 그는 심각한 정책 오류 한가지 예를 든다. ""정부는 지난해 건설현장... "
2026-04-06,네이버뉴스,"전문건설 AX, '스몰 데이터' 축적서 시작하자",https://www.koscaj.com/news/articleView.html?idxno=323357,"건설 시장은 공장에서 부재를 제작해 현장에서 조립하는 PC(Precast Concrete) 공법이 대세로 자리 잡아 가고... 하지만 현실은 기본적인 DX(디지털 전환)조차 뿌리내리지 못한 채, 인력 수급과 안전사고 예방에 급급한... "
2026-04-06,네이버뉴스,"부산 제1만덕터널 10~12일 야간 전면 통제…""제2만덕터널 우회 당부""",https://www.news1.kr/local/busan-gyeongnam/6125997,"이번 공사는 터널 내 낡은 전선관이 떨어져 발생할 수 있는 차량 안전사고 위험을 사전에 차단하고, 시민들에게 더욱 안전한 도로 환경을 제공하기 위해서라고 시가 전했다. 진봉상 시 건설안전시험사업소장은 ""작업을... "
2026-04-06,네이버뉴스,[노무] 건설현장 공사 중단과 휴업수당,https://www.koscaj.com/news/articleView.html?idxno=323341,"특히, 원청(종합건설)이 하도급업체(전문건설)의 안전사고를 이유로 모든 현장(공구)에 노동부 작업중지명령이 내려져 공사가 중지되는 경우가 있습니다. 이런 경우 원청과 하도급업체는 작업을 수행하지 못한 현장... "
2026-04-06,네이버뉴스,"LH, 평택 고덕 '알파탄약고' 이전 완료…1만5천호 주택공급 청신호",http://www.biztribune.co.kr/news/articleView.html?idxno=351860,"당초 2008년 반환 예정이었던 부지는 평택 미군기지 이전 계획에 묶여 대체 탄약고 건설 지연으로 반환이... 진행됐으며, 안전사고 없이 완료됐다. 알파탄약고의 탄약이 완전히 비워지면서 탄약고 주변에 계획됐던... "
2026-04-05,네이버뉴스,"[인터뷰]김헌동 ""서울시장 후보들 부동산 해법 안 보여… '반값 아파트...",http://www.newsroad.co.kr/news/articleView.html?idxno=57294,"▲서울시, 각 구청도 포함 인허가 실명제 도입 및 공공 직접 시공으로 '100년 주택' 건설해야 재개발·재건축... 공사와 안전사고를 획기적으로 줄일 수 있다""고 목소리를 높였다. 그러면서 ""이미 이는 SH공사에서 일부... "
2026-04-05,네이버뉴스,농어촌공사 사천지사 건설현장 안전보건협의체 회의,http://www.gndomin.com/news/articleView.html?idxno=471214,"이날 이재성 지사장은 ""현장 근로자들이 안심하고 작업 할 수 있는 환경 조성과 AI 스마트 안전 장비 확대 및 재해예방 기술지도 작동성 강화 등을 통해 건설 현장 사고율 감소에 이바지하겠다""고 밝혔다."
2026-04-06,네이버뉴스,"[기술혁신기업] (주)삼현비앤이, '장경간 교량' 국내 최고 기술력 평가",http://www.ikld.kr/news/articleView.html?idxno=332218,이는 중대재해처벌법 시행에 따른 현장 안전이 최우선시 되는 최근 건설 트렌드에 가장 부합하는 기술로 관심받고 있다. 시공 편의성 또한 획기적으로 개선했다는 평가다. 기존 거더 공법의 복잡한 다단 긴장 공정을... 
2026-04-06,네이버뉴스,"건설업 중대재해 유형 '천태만상' ""안전, 비용 아닌 투자로 인식돼야""",http://www.kmecnews.co.kr/news/articleView.html?idxno=46401,"정부의 강력한 단속에도 불구하고 건설현장의 중대재해가 여전히 '천태만상'의 양상을 띠고 있다. 3대 사고 유형인 추락, 끼임, 부딪힘부터 질식·중독, 화재·폭발, 감전 등 사고의 원인과 종류가 더욱 복잡해지는 추세다.... "
2026-04-06,네이버뉴스,"[인터뷰] 최은수 인텔리빅스 대표 ""일반 CCTV를 AI로…위험 발견부터 대...",https://www.ebn.co.kr/news/articleView.html?idxno=1704426,"스마트시티 중심의 탄탄한 레퍼런스를 바탕으로 최근 전기차·배터리 화재 예방, 건설 현장 중대재해 방지, 국방 경계 체계, 시설 관리 등으로 사업을 전방위 확장하고 있다. 특정 분야의 단품 솔루션을 파는 회사가... "
2026-04-06,네이버뉴스,"[발언대]산업도시 울산, 중대재해 예방의 해법은 '현장'에 있다",https://www.ksilbo.co.kr/news/articleView.html?idxno=1053134,"▲ 백현조 울산시의회 산업건설위원장 ""사고는 예고 없이 발생하지만, 위험은 대부분 예고되어 있다."" 이 말은 산업현장의 현실을 그대로 보여준다. 중대재해 문제는 더 이상 개별 사업장의 문제가 아니다. 특히 조선... "
2026-04-05,네이버뉴스,"경기도, 건설공사장 사고사망자 감축을 위한 관계자 역량강화 교육 실시",https://www.lecturernews.com/news/articleView.html?idxno=200001,2부에서는 (사)한국산업안전보건지도사협회 남선일 이사장이 ▲중대재해 판례 분석 ▲건설공사 단계별 안전관리 핵심 점검 사항 ▲건설공사 관계자 안전관리 취약요인 및 실무 대응 전략 등의 주제로 교육을 진행했다.... 
2026-04-06,네이버뉴스,"[기획] 스탠다드에너지, 고출력 ESS로 AI 전력 병목 해결",http://www.ikld.kr/news/articleView.html?idxno=332252,"스탠다드에너지는 규제샌드박스를 통해 실증을 완료하고 단체표준 제정과 인증 획득, 한국전기설비기준... 대전 구암역에는 바나듐 이온 배터리 ESS가 설치돼 운영되고 있으며 건설사와 협력해 건물 에너지 효율 개선과... "
2026-04-06,네이버뉴스,"[프롭테크 동향] 프롭테크, 'AI·데이터·인프라'로 재편",http://www.ikld.kr/news/articleView.html?idxno=332200,"반면 건설과 개발 영역은 상대적으로 더디다. Procore와 같은 사례가 등장하고 있지만, 현장 중심 산업 특성상... 거래 주기가 길고 규제 영향이 커 단기간 수익을 내기 어렵기 때문이다. 투자 환경이 보수적으로 바뀌면서... "
2026-04-06,네이버뉴스,건설현장이 못 따라가는 '탄소중립 정책',https://www.koscaj.com/news/articleView.html?idxno=323355,국제 규제에 대응하기 위한 불가피한 흐름이라는 점에서 정책의 방향성에는 공감대가 형성되고 있다. 그러나 문제는 정책의 실행 속도와 방식이 현장의 수용 여건을 충분히 반영하지 못하고 있다는 점이다. 현재 건설현장... 
2026-04-06,네이버뉴스,금통위 기준금리 결정과 용산 ‘이촌 르엘’ 청약... 4월 둘째주 부동산...,https://www.betanews.net/article/view/beta202604040016,"특히 4월부터 본격화된 가계부채 관리방안 후속 조치와 대출 규제가 맞물리면서, 무리한 ‘영끌’... 지방선거를 앞두고 건설사들이 물량을 집중 공급하는 ‘밀어내기’ 분양 또한 단기적으로는 선택지를 넓혀 가격... "
2026-04-06,네이버뉴스,[부산ㆍ경남 대학 브리핑 모음(4월6일)] 신라대 수탁기관 사직종합사회...,https://www.dnews.co.kr/uhtml/view.jsp?idxno=202604050958078170969,천 학생은 “배기가스 모니터링 시스템은 환경 규제 대응과 데이터 신뢰성 확보에 핵심적인 역할을 한다”... 특히 우주항공 분야는 국가 전략산업으로 꼽히는 만큼 이번 수주는 단순한 건설 사업을 넘어 장기적 성장... 
2026-04-06,네이버뉴스,"[매아리] 트럼프 ""화요일 오후 8시!"" 협상 기한 또 연장…이란 ""생필품·...",http://mbnmoney.mbn.co.kr/news/view?news_no=MM1005806809,그외에도 건설과 운송/창고 사회지원 부문도 이번 일자리 증가에 큰 기여를 했습니다. 2. 3월 S&P 글로벌... 붐·미 규제 강화에 사상 최고 매출 아르테미스 2호 “지구보다 달이 더 가까워” 매일 오전 7시 매일경제TV... 
2026-04-06,네이버뉴스,[Who Is ?] 박종래 울산과학기술원(UNIST) 총장,https://www.businesspost.co.kr/BP?command=article_view&num=435000,"불합리한 규제를 발굴해 규제 샌드박스를 적용하는 등 관계부처와 협의를 이어간다는 계획을 밝혔다.... 150억 원의 국가 자금은 교수진 급여, 연구 시설 건설, 연구 장비 구입, 교육과정 개발에 투입된다. 즉시 연구... "
2026-04-06,네이버뉴스,"HD건설기계, 전기 굴착기 통했다…북미서 확인된 '저탄소 경쟁력'",http://www.economytalk.kr/news/articleView.html?idxno=419962,"탄소 규제 강화 속 건설기계 '저탄소 전환' 과제 부상 유럽연합(EU)이 제안한 탄소국경조정제도(CBAM)는 2023년 법제화를 거쳐 올해 본격 단계에 진입했다. 여기에 RE100 확산까지 맞물리며, 탄소 대응 역량 자체가 글로벌... "
